MainSource,Source,Publication Date,Pull_date,Pre-Processed Text,Sentiment_Vader,Sentiment_TextBlob,Average_Sentiment
GoogleNews,New Crypto Projects,1 day ago,2024-09-18 00:48:24.547856,19 best crypto telegram group join 2024for crypto investor trader crucial stay uptodate market however main challenge overabundance,0.7717,0.3888888888888889,0.5802944444444444
GoogleNews,New Crypto Projects,2 days ago,2024-09-18 00:48:24.547856,3 crypto altcoins cant miss 2024 endsas approach closing 2024 crypto market continues present new exciting opportunity investor presales particular,0.7539,0.15075757575757576,0.4523287878787879
GoogleNews,New Crypto Projects,2 days ago,2024-09-18 00:48:24.547856,blockdag investor going new crypto presale insane revenue sharinginvestors flocking rollblock new crypto presale offering incredible revenue sharing model currently 6th stage presale trading,0.0972,0.034545454545454546,0.06587272727272728
GoogleNews,New Crypto Projects,2 days ago,2024-09-18 00:48:24.547856,7 new crypto coin market invest project 1000x profit january 2025 turn 100 thousandsare tired missing lifechanging investment opportunity crypto market feel like arrived late party,0.7003,-0.19090909090909092,0.25469545454545456
GoogleNews,New Crypto Projects,3 days ago,2024-09-18 00:48:24.547856,best ico invest september new crypto project ready make mark 100x return 2025 q1crypto investor constantly lookout next big thing cryptocurrency market evolves many icos popping navigating,0.7717,0.2623376623376623,0.5170188311688312
GoogleNews,New Crypto Projects,3 days ago,2024-09-18 00:48:24.547856,7 upcoming new crypto coin crypto investor vying september guaranteed 1000x roisince bitcoins 2009 launch cryptocurrencies transformed global finance decentralizing control today market brimming thousand,0.0,0.06818181818181818,0.03409090909090909
GoogleNews,New Crypto Projects,3 days ago,2024-09-18 00:48:24.547856,top crypto presales watch september 2024 moonshot listlets talk crypto right heading many predicting next big bull run market poised boom,0.4215,0.2571428571428571,0.33932142857142855
GoogleNews,New Crypto Projects,3 days ago,2024-09-18 00:48:24.547856,best ai crypto coin 2024 top 10 project watchartificial intelligence ai booming popularity top cryptocurrency project related industry,0.9186,0.5,0.7093
GoogleNews,New Crypto Projects,3 days ago,2024-09-18 00:48:24.547856,best crypto presales invest 2024 top upcoming tokenscrypto presales offer opportunity buy new crypto reduced price official launch guide list best crypto presales,0.9186,0.6590909090909091,0.7888454545454545
GoogleNews,New Crypto Projects,4 days ago,2024-09-18 00:48:24.547856,new flappy bird crypto connection raising eyebrowssuspicions evidence connects new flappy bird project web3 crypto influencers,0.0,0.13636363636363635,0.06818181818181818
GoogleNews,New Crypto Projects,4 days ago,2024-09-18 00:48:24.547856,institution quietly accumulate bitcoin new crypto trend gain mainstream attentionwith rapid evolution cryptocurrency space focus expanding bitcoin innovative technology project poised disrupt,0.8074,0.21212121212121213,0.509760606060606
GoogleNews,New Crypto Projects,4 hours ago,2024-09-18 00:48:24.547856,10 best new crypto presales x100 potential 2025 updated listif youve crypto space long enough youve heard talk bull run thats around corner new story cycle,0.6369,0.20378787878787877,0.4203439393939394
GoogleNews,New Crypto Projects,6 hours ago,2024-09-18 00:48:24.547856,dragonfly capital eye 500m fourth crypto funddragonflys new crypto fund target earlystage project crypto space 100 digitalasset startup part firm portfolio,0.0,-0.02121212121212122,-0.01060606060606061
GoogleNews,New Crypto Projects,6 hours ago,2024-09-18 00:48:24.547856,thankfully trump still alive unfortunately misguided crypto projectdonald trump officially announced detail cryptocurrency project x space monday night,0.4588,-0.2,0.1294
GoogleNews,New Crypto Projects,7 hours ago,2024-09-18 00:48:24.547856,ethereum layer2 project goodegg announces ai social scoring system bitcoins rally push coin tothe world cryptocurrencies abuzz recent announcement goodegg gegg innovative layer2 project ethereum,0.4404,0.17777777777777778,0.3090888888888889
GoogleNews,New Crypto Projects,7 hours ago,2024-09-18 00:48:24.547856,behind world liberty financial trump new cryptoworld liberty financial new crypto project hosted donald trump fraudsters executive failed crypto project onboard,0.0258,-0.10454545454545455,-0.039372727272727275
GoogleNews,New Crypto Projects,9 hours ago,2024-09-18 00:48:24.547856,expert expect new altcoin dominate like fantom popcatalthough angry pepe fork apork presale live day institutional investor already participated savvy investor know,-0.3182,-0.07575757575757576,-0.19697878787878786
GoogleNews,New Crypto Projects,1 hours ago,2024-09-18 00:48:24.547856,ai playtodate meme goodegg take project new height announcing social scoring systemin fastpaced world cryptocurrencies innovation drive market value standout player race goodegg gegg aipowered social dating,0.6124,0.06767676767676767,0.34003838383838386
GoogleNews,New Crypto Projects,3 hours ago,2024-09-18 00:48:24.547856,best crypto coin buy new cryptos 1000x potential double return january 2025as progress 2024 fresh wave promising cryptocurrency project set capture attention savvy investor new altcoins,0.9001,0.2532467532467532,0.5766733766233766
GoogleNews,New Crypto Projects,4 hours ago,2024-09-18 00:48:24.547856,votetoearn flockerz investor flocking new crypto sensationinvestors empowered determine project road ahead employing voting right,0.0,0.21103896103896103,0.10551948051948051
GoogleNews,New Crypto Projects,5 hours ago,2024-09-18 00:48:24.547856,trump new defi project world liberty financial aim sec reversal cryptowith backing trump family world liberty financial aim challenge financial intermediary traditional banking barrier,0.7717,0.006060606060606058,0.3888803030303031
GoogleNews,New Crypto Projects,4 hours ago,2024-09-18 00:48:24.547856,10 best new crypto presales x100 potential 2025 updated listif youve crypto space long enough youve heard talk bull run thats around corner new story cycle,0.6369,0.20378787878787877,0.4203439393939394
GoogleNews,New Crypto Projects,6 hours ago,2024-09-18 00:48:24.547856,dragonfly capital eye 500m fourth crypto funddragonflys new crypto fund target earlystage project crypto space 100 digitalasset startup part firm portfolio,0.0,-0.02121212121212122,-0.01060606060606061
GoogleNews,New Crypto Projects,6 hours ago,2024-09-18 00:48:24.547856,thankfully trump still alive unfortunately misguided crypto projectdonald trump officially announced detail cryptocurrency project x space monday night,0.4588,-0.2,0.1294
GoogleNews,New Crypto Projects,7 hours ago,2024-09-18 00:48:24.547856,ethereum layer2 project goodegg announces ai social scoring system bitcoins rally push coin tothe world cryptocurrencies abuzz recent announcement goodegg gegg innovative layer2 project ethereum,0.4404,0.17777777777777778,0.3090888888888889
GoogleNews,New Crypto Projects,7 hours ago,2024-09-18 00:48:24.547856,behind world liberty financial trump new cryptoworld liberty financial new crypto project hosted donald trump fraudsters executive failed crypto project onboard,0.0258,-0.10454545454545455,-0.039372727272727275
GoogleNews,New Crypto Projects,9 hours ago,2024-09-18 00:48:24.547856,expert expect new altcoin dominate like fantom popcatalthough angry pepe fork apork presale live day institutional investor already participated savvy investor know,-0.3182,-0.07575757575757576,-0.19697878787878786
GoogleNews,New Crypto Projects,1 hours ago,2024-09-18 00:48:24.547856,ai playtodate meme goodegg take project new height announcing social scoring systemin fastpaced world cryptocurrencies innovation drive market value standout player race goodegg gegg aipowered social dating,0.6124,0.06767676767676767,0.34003838383838386
GoogleNews,New Crypto Projects,3 hours ago,2024-09-18 00:48:24.547856,best crypto coin buy new cryptos 1000x potential double return january 2025as progress 2024 fresh wave promising cryptocurrency project set capture attention savvy investor new altcoins,0.9001,0.2532467532467532,0.5766733766233766
GoogleNews,New Crypto Projects,4 hours ago,2024-09-18 00:48:24.547856,votetoearn flockerz investor flocking new crypto sensationinvestors empowered determine project road ahead employing voting right,0.0,0.21103896103896103,0.10551948051948051
GoogleNews,New Crypto Projects,5 hours ago,2024-09-18 00:48:24.547856,trump new defi project world liberty financial aim sec reversal cryptowith backing trump family world liberty financial aim challenge financial intermediary traditional banking barrier,0.7717,0.006060606060606058,0.3888803030303031
GoogleNews,New Crypto Projects,8 hours ago,2024-09-18 00:48:24.547856,trump launch new crypto platform scant detailthe former president son donald trump jr touted start financial revolution session streamed x formerly twitter,-0.0516,0.03409090909090909,-0.008754545454545456
GoogleNews,New Crypto Projects,2 hours ago,2024-09-18 00:48:24.547856,trump crypto project detail buythe detail new crypto project backed trump brand announced part lengthy live event x purpose crypto initiative,0.0258,0.13636363636363635,0.08108181818181817
GoogleNews,New Crypto Projects,2 hours ago,2024-09-18 00:48:24.547856,trump launch another business full potential risk conflict winsdonald trump child unveiled new cryptocurrency business monday virtual address maralago estate latest venture stand,-0.5267,0.24659090909090908,-0.14005454545454543
GoogleNews,New Crypto Projects,1 day ago,2024-09-18 00:48:24.547856,trump crypto gambit know launch world liberty financialformer president donald trump campaigning republican nominee u election november teased plan official announcement,0.296,0.0,0.148
GoogleNews,New Crypto Projects,1 day ago,2024-09-18 00:48:24.547856,cookpad launch allinone platform crypto project developmentin significant development cryptocurrency industry cookpad unveiled allencompassing platform aimed simplifying process creating,0.4588,0.375,0.4169
GoogleNews,New Crypto Projects,1 day ago,2024-09-18 00:48:24.547856,dogecoins top trade reveals 4 reason new ai coin goodegg could skyrocket portfolioin everexpanding world meme coin innovative blockchain project there one new aipowered token thats creating serious buzz goodegg,0.6808,0.18787878787878784,0.4343393939393939
GoogleNews,New Crypto Projects,1 day ago,2024-09-18 00:48:24.547856,trump unveil world liberty financial today here everything know defi projectdonald trump set formally announce defi project world liberty financial monday like defi project world liberty got lofty goal,0.9136,0.0,0.4568
GoogleNews,New Crypto Projects,1 day ago,2024-09-18 00:48:24.547856,next crypto explode crypto allstars presale success continuesa new crypto project called crypto allstars star taking meme coin sector storm fresh approach staking project offer,0.7184,0.18409090909090908,0.45124545454545456
GoogleNews,New Crypto Projects,1 day ago,2024-09-18 00:48:24.547856,best crypto presales set 1000x debut end december 2024finding next big crypto investment feel like navigating maze without map crypto market volatility many investor dream,0.8271,0.375,0.60105
GoogleNews,New Crypto Projects,1 day ago,2024-09-18 00:48:24.547856,artificial superintelligence alliance fet investor generate extra profit new ai casinoas cryptocurrency market evolves new innovative project continue emerge offering investor chance diversify portfolio,0.7783,0.034545454545454546,0.40642272727272727
GoogleNews,New Crypto Projects,1 day ago,2024-09-18 00:48:24.547856,q4 2024 poised crypto gain altcoins new project shinethe cryptocurrency market gearing potential surge final quarter 2024 approach historically fourth quarter year known,0.6597,0.03409090909090909,0.3468954545454545
GoogleNews,New Crypto Projects,1 day ago,2024-09-18 00:48:24.547856,bybit bag dubai vara vasp approval new project coming inbybit world secondlargest crypto exchange trading volume secured provisional nonoperational approval virtual asset regulatory,0.886,0.13636363636363635,0.5111818181818182
GoogleNews,New Crypto Projects,1 day ago,2024-09-18 00:48:24.547856,toncoin dog lead market loss amid market weakness hope new tokenthe crypto market still disarray influential bitcoin price closer 50000 mark 60000 mark,0.1779,0.13636363636363635,0.15713181818181818
GoogleNews,New Crypto Projects,1 day ago,2024-09-18 00:48:24.547856,18 new cryptocurrency project invest newest crypto coinstop new crypto buy detailed review coin 1 pepe unchained pepu overall best new crypto coin invest september 2024 2 memebet token,0.6369,0.3015151515151515,0.46920757575757577
GoogleNews,New Crypto Projects,1 day ago,2024-09-18 00:48:24.547856,18 best new meme coin buy september 2024we reviewed ranked best new meme coin buy 2024 narrowing list top meme token crypto analyst collectively,0.8807,0.5545454545454545,0.7176227272727272
GoogleNews,New Crypto Projects,1 day ago,2024-09-18 00:48:24.547856,best crypto buy september 2024 top crypto invest inour research show best cryptos buy right bitcoin ethereum xrp solana bnb dogecoin cardano project range,0.8807,0.6964285714285714,0.7885642857142857
GoogleNews,New Crypto Projects,1 day ago,2024-09-18 00:48:24.547856,17 best crypto presales invest upcoming token salesour analysis show best crypto presales 2024 pepe unchained memebet token crypto allstars flockerz shiba shootout project range,0.8555,1.0,0.9277500000000001
GoogleNews,New Crypto Projects,1 day ago,2024-09-18 00:48:24.547856,degods nft creator de lab launch new crypto token degods here detailsde lab digital asset incubation studio parent company popular degods y00ts nft collection launched new crypto coin,0.7003,0.21818181818181817,0.4592409090909091
GoogleNews,New Crypto Projects,1 day ago,2024-09-18 00:48:24.547856,turkexs blockchain project revolutionizing digital finance turkeyturkex fastemerging player digital finance sector announced ambitious plan launch blockchain leadership ceo,0.4767,0.08333333333333333,0.2800166666666667
GoogleNews,New Crypto Projects,1 day ago,2024-09-18 00:48:24.547856,19 best crypto telegram group join 2024for crypto investor trader crucial stay uptodate market however main challenge overabundance,0.7717,0.3888888888888889,0.5802944444444444
GoogleNews,New Crypto Projects,2 days ago,2024-09-18 00:48:24.547856,3 crypto altcoins cant miss 2024 endsas approach closing 2024 crypto market continues present new exciting opportunity investor presales particular,0.7539,0.15075757575757576,0.4523287878787879
GoogleNews,New Crypto Projects,2 days ago,2024-09-18 00:48:24.547856,blockdag investor going new crypto presale insane revenue sharinginvestors flocking rollblock new crypto presale offering incredible revenue sharing model currently 6th stage presale trading,0.0972,0.034545454545454546,0.06587272727272728
GoogleNews,New Crypto Projects,2 days ago,2024-09-18 00:48:24.547856,7 new crypto coin market invest project 1000x profit january 2025 turn 100 thousandsare tired missing lifechanging investment opportunity crypto market feel like arrived late party,0.7003,-0.19090909090909092,0.25469545454545456
GoogleNews,New Crypto Projects,3 days ago,2024-09-18 00:48:24.547856,best ico invest september new crypto project ready make mark 100x return 2025 q1crypto investor constantly lookout next big thing cryptocurrency market evolves many icos popping navigating,0.7717,0.2623376623376623,0.5170188311688312
GoogleNews,New Crypto Projects,3 days ago,2024-09-18 00:48:24.547856,7 upcoming new crypto coin crypto investor vying september guaranteed 1000x roisince bitcoins 2009 launch cryptocurrencies transformed global finance decentralizing control today market brimming thousand,0.0,0.06818181818181818,0.03409090909090909
GoogleNews,New Crypto Projects,3 days ago,2024-09-18 00:48:24.547856,top crypto presales watch september 2024 moonshot listlets talk crypto right heading many predicting next big bull run market poised boom,0.4215,0.2571428571428571,0.33932142857142855
GoogleNews,New Crypto Projects,3 days ago,2024-09-18 00:48:24.547856,best ai crypto coin 2024 top 10 project watchartificial intelligence ai booming popularity top cryptocurrency project related industry,0.9186,0.5,0.7093
GoogleNews,New Crypto Projects,3 days ago,2024-09-18 00:48:24.547856,best crypto presales invest 2024 top upcoming tokenscrypto presales offer opportunity buy new crypto reduced price official launch guide list best crypto presales,0.9186,0.6590909090909091,0.7888454545454545
GoogleNews,New Crypto Projects,4 days ago,2024-09-18 00:48:24.547856,new flappy bird crypto connection raising eyebrowssuspicions evidence connects new flappy bird project web3 crypto influencers,0.0,0.13636363636363635,0.06818181818181818
GoogleNews,New Crypto Projects,4 days ago,2024-09-18 00:48:24.547856,institution quietly accumulate bitcoin new crypto trend gain mainstream attentionwith rapid evolution cryptocurrency space focus expanding bitcoin innovative technology project poised disrupt,0.8074,0.21212121212121213,0.509760606060606
GoogleNews,New Crypto Projects,4 days ago,2024-09-18 00:48:24.547856,scam fee lost password avoid 10 biggest mistake new crypto investorsinvesting crypto exciting many new investor fall common trap come trading investing cryptocurrencies,-0.8271,0.15454545454545454,-0.3362772727272727
GoogleNews,New Crypto Projects,4 days ago,2024-09-18 00:48:24.547856,crypto expert explains new ai dating cryptocurrency attracting solana ada whale 100x presalein fastevolving world cryptocurrency project combine innovation realworld application drawing serious attention,0.6597,-0.09848484848484848,0.2806075757575757
GoogleNews,New Crypto Projects,4 days ago,2024-09-18 00:48:24.547856,new cryptocurrencies invest 2024 today crypto coinsin guide reveal 19 best new cryptocurrencies invest read discover new project could become next 100x success story,0.836,0.2848484848484848,0.5604242424242424
GoogleNews,New Crypto Projects,4 days ago,2024-09-18 00:48:24.547856,behind trump crypto project selfdescribed dirtbag internetif right fing care go zero chase herro said crypto,0.4939,-0.05714285714285716,0.21837857142857142
GoogleNews,New Crypto Projects,4 days ago,2024-09-18 00:48:24.547856,trump announces launch date crypto project vow leave big bank behinddonald trump allin crypto leaving stone unturned courting crypto enthusiast ahead presidential election november,0.3182,0.0,0.1591
GoogleNews,New Crypto Projects,4 days ago,2024-09-18 00:48:24.547856,donald trump reveals launch date new defi projecttrump announced launch world liberty financial wlfi defi project september 16 wlfis website face scrutiny due use anonymous,0.5267,0.0037878787878787845,0.26524393939393937
GoogleNews,New Crypto Projects,4 days ago,2024-09-18 00:48:24.547856,best crypto twitter account follow 2024 updatedhere curated list top crypto twitterx account follow latest cryptocurrency news stay updated top crypto market trend,0.7783,0.625,0.70165
GoogleNews,New Crypto Projects,4 days ago,2024-09-18 00:48:24.547856,11 next crypto explode 2024 next big cryptocurrencyin analysis reveal next cryptocurrency explode read discover 11 project could generate huge return 2024,0.3182,0.07999999999999999,0.1991
GoogleNews,New Crypto Projects,4 days ago,2024-09-18 00:48:24.547856,best new crypto invest 2024 newest crypto launch septemberthe challenge investor identifying project significant return potential guide highlight best new cryptocurrencies invest,0.9169,0.44128787878787873,0.6790939393939394
GoogleNews,New Crypto Projects,4 days ago,2024-09-18 00:48:24.547856,next crypto explode 2024 next big crypto coinswe review range cryptocurrencies regarded next cryptos likely explode including exciting new token,0.4939,0.06233766233766234,0.2781188311688312
GoogleNews,Crypto Bullrun,,2024-09-18 00:48:24.547856,,0.0,0.0,0.0
GoogleNews,Crypto Bullrun,0 hours ago,2024-09-18 00:48:24.547856,solana eth earthmeta lead crypto bullrun 2025heres simple question could 2025 year greatest crypto bull run weve ever seen ask expert many say,0.6369,0.5,0.56845
GoogleNews,Crypto Bullrun,2 hours ago,2024-09-18 00:48:24.547856,september top 7 altcoins crypto bull run unlock 100x gain investment 100 turn september usher new wave opportunity crypto market savvy investor lookout altcoins primed deliver exceptional,0.7906,0.4343434343434343,0.6124717171717171
GoogleNews,Crypto Bullrun,3 hours ago,2024-09-18 00:48:24.547856,analyst forecast ripple bull run soon high xrp price gotldr xrp rose 10 week fueled grayscales new ripple trust potential robinhood relisting see bullish trend others predicted,0.5106,0.2240909090909091,0.3673454545454546
GoogleNews,Crypto Bullrun,5 hours ago,2024-09-18 00:48:24.547856,2024 crypto bull run beam immutable mpeppe eye massive gainsget ready potential endofyear crypto bull run beam beam immutable imx mpeppe mpepe leading charge privacy gaming,0.3612,0.06666666666666667,0.21393333333333334
GoogleNews,Crypto Bullrun,7 hours ago,2024-09-18 00:48:24.547856,buyer take note hot new altcoin ahead bullrun whats next angry pepe forkin bull market 2021 january may dogecoin doge moved 1725 low 004 alltime high 079,-0.6597,0.007727272727272726,-0.32598636363636363
GoogleNews,Crypto Bullrun,1 day ago,2024-09-18 00:48:24.547856,dogecoin millionaire predicts pepe clone lead next crypto bull runthe dogecoin millionaire glauber contessoto confirmed many smart money already guessed next crypto bull run,0.4019,0.22285714285714286,0.3123785714285714
GoogleNews,Crypto Bullrun,1 day ago,2024-09-18 00:48:24.547856,top altcoins turn 10 100 crypto bull runwith crypto bull market around corner top altcoins buy turn 10 100 amid rising demand,0.2732,0.5,0.3866
GoogleNews,Crypto Bullrun,1 day ago,2024-09-18 00:48:24.547856,bitcoin v xrp crypto set skyrocket upcoming bull run expert share insightsthe bull lacing running shoe everyone waiting see cryptos skyrocket raboo new ai meme coin presale,0.296,0.13636363636363635,0.21618181818181817
GoogleNews,Crypto Bullrun,1 day ago,2024-09-18 00:48:24.547856,q4 2024 start new crypto market bull run analyst insightq4 2024 could ignite crypto bull run fueled seasonality liquidity macro trend explore might drive surge,0.0,0.13636363636363635,0.06818181818181818
GoogleNews,Crypto Bullrun,1 day ago,2024-09-18 00:48:24.547856,trending dogecoin doge alternative soar 4500 bullrun currently 010amidst resurgence interest cryptocurrency investment rexas finance emerged potential contender token recent introduction,0.5423,0.0,0.27115
GoogleNews,Crypto Bullrun,,2024-09-18 00:48:24.547856,,0.0,0.0,0.0
GoogleNews,Crypto Bullrun,0 hours ago,2024-09-18 00:48:24.547856,solana eth earthmeta lead crypto bullrun 2025heres simple question could 2025 year greatest crypto bull run weve ever seen ask expert many say,0.6369,0.5,0.56845
GoogleNews,Crypto Bullrun,2 hours ago,2024-09-18 00:48:24.547856,september top 7 altcoins crypto bull run unlock 100x gain investment 100 turn september usher new wave opportunity crypto market savvy investor lookout altcoins primed deliver exceptional,0.7906,0.4343434343434343,0.6124717171717171
GoogleNews,Crypto Bullrun,3 hours ago,2024-09-18 00:48:24.547856,analyst forecast ripple bull run soon high xrp price gotldr xrp rose 10 week fueled grayscales new ripple trust potential robinhood relisting see bullish trend others predicted,0.5106,0.2240909090909091,0.3673454545454546
GoogleNews,Crypto Bullrun,5 hours ago,2024-09-18 00:48:24.547856,2024 crypto bull run beam immutable mpeppe eye massive gainsget ready potential endofyear crypto bull run beam beam immutable imx mpeppe mpepe leading charge privacy gaming,0.3612,0.06666666666666667,0.21393333333333334
GoogleNews,Crypto Bullrun,7 hours ago,2024-09-18 00:48:24.547856,buyer take note hot new altcoin ahead bullrun whats next angry pepe forkin bull market 2021 january may dogecoin doge moved 1725 low 004 alltime high 079,-0.6597,0.007727272727272726,-0.32598636363636363
GoogleNews,Crypto Bullrun,1 day ago,2024-09-18 00:48:24.547856,dogecoin millionaire predicts pepe clone lead next crypto bull runthe dogecoin millionaire glauber contessoto confirmed many smart money already guessed next crypto bull run,0.4019,0.22285714285714286,0.3123785714285714
GoogleNews,Crypto Bullrun,1 day ago,2024-09-18 00:48:24.547856,top altcoins turn 10 100 crypto bull runwith crypto bull market around corner top altcoins buy turn 10 100 amid rising demand,0.2732,0.5,0.3866
GoogleNews,Crypto Bullrun,1 day ago,2024-09-18 00:48:24.547856,bitcoin v xrp crypto set skyrocket upcoming bull run expert share insightsthe bull lacing running shoe everyone waiting see cryptos skyrocket raboo new ai meme coin presale,0.296,0.13636363636363635,0.21618181818181817
GoogleNews,Crypto Bullrun,1 day ago,2024-09-18 00:48:24.547856,q4 2024 start new crypto market bull run analyst insightq4 2024 could ignite crypto bull run fueled seasonality liquidity macro trend explore might drive surge,0.0,0.13636363636363635,0.06818181818181818
GoogleNews,Crypto Bullrun,1 day ago,2024-09-18 00:48:24.547856,trending dogecoin doge alternative soar 4500 bullrun currently 010amidst resurgence interest cryptocurrency investment rexas finance emerged potential contender token recent introduction,0.5423,0.0,0.27115
GoogleNews,Crypto Bullrun,,2024-09-18 00:48:24.547856,,0.0,0.0,0.0
GoogleNews,Crypto Bullrun,0 hours ago,2024-09-18 00:48:24.547856,solana eth earthmeta lead crypto bullrun 2025heres simple question could 2025 year greatest crypto bull run weve ever seen ask expert many say,0.6369,0.5,0.56845
