MainSource,Source,Publication Date,Pull_date,Pre-Processed Text,Sentiment_Vader,Sentiment_TextBlob,Average_Sentiment
RSS,https://cointelegraph.com/rss,2024-12-24 12:06:56+00:00,2024-12-24 12:19:06.881210,solana sol price today solanas rise today come heel declining bitcoin market dominance supportive technical setup,0.4588,0.25,0.3544
RSS,https://cointelegraph.com/rss,2024-12-24 12:04:22+00:00,2024-12-24 12:19:06.881210,bitcoin bull market decembear sent btc price 2 lower bitcoin need dip much harder deliver even standard december downside data show btc price target continue focus mid80000 area,-0.4939,-0.05,-0.27195
RSS,https://cointelegraph.com/rss,2024-12-24 12:00:00+00:00,2024-12-24 12:19:06.881210,strange true 5 outlandish weird crypto story 2024 failed memecoin stunt attempted teenage rug pull pumpfun fake fbi token 2024 didnt disappoint,-0.5916,-0.19999999999999998,-0.3958
RSS,https://cointelegraph.com/rss,2024-12-24 10:37:14+00:00,2024-12-24 12:19:06.881210,37 uae retail investor plan increase crypto 2025 etoro survey survey reveals uae retail investor prioritize crypto stock personal growth among 2025 goal,0.5994,0.0,0.2997
RSS,https://cointelegraph.com/rss,2024-12-24 10:24:31+00:00,2024-12-24 12:19:06.881210,ethereum eth price today ether price today dip toward 2500 coming week due classic bearish continuation setup could spoil relief rally,0.4767,0.02083333333333333,0.24876666666666666
RSS,https://cointelegraph.com/rss,2024-12-24 09:48:10+00:00,2024-12-24 12:19:06.881210,crypto hack wipe 23b 2024 marking 40 yoy surge according cyvers 40 yearly increase driven mostly growing access control vulnerability centralized exchange cryptocurrency custodian,0.2732,0.5,0.3866
RSS,https://cointelegraph.com/rss,2024-12-24 08:49:56+00:00,2024-12-24 12:19:06.881210,crypto ai growth could strain north american energy grid nerc north america face energy challenge cryptocurrency mining ai data center push electricity demand unprecedented level,0.6597,0.16666666666666666,0.4131833333333333
RSS,https://cointelegraph.com/rss,2024-12-24 08:43:11+00:00,2024-12-24 12:19:06.881210,phishing fear trade crypto event attendee detail revealed cointelegraph obtained data set sample packed sensitive information crypto conference attendee could treasure trove scammer,-0.25,0.1,-0.075
RSS,https://cointelegraph.com/rss,2024-12-24 08:20:00+00:00,2024-12-24 12:19:06.881210,set crypto wallet child beginner guide setting crypto wallet child valuable learning experience important monitor activity closely inform risk digital asset,0.6486,0.2,0.4243
RSS,https://cointelegraph.com/rss,2024-12-24 08:17:34+00:00,2024-12-24 12:19:06.881210,russia ban crypto mining 6 year 10 region russia key crypto mining region like irkutsk enforce seasonal mining restriction instead originally proposed complete ban,-0.7783,0.15833333333333333,-0.30998333333333333
RSS,https://cointelegraph.com/rss,2024-12-24 07:56:30+00:00,2024-12-24 12:19:06.881210,fbi japan expose north korea 305m dmm exchange hack detail fbi unveiled detail 305m bitcoin heist north koreaaffiliated hacker using social engineering technique,-0.1531,0.03333333333333333,-0.059883333333333344
RSS,https://cointelegraph.com/rss,2024-12-24 07:00:00+00:00,2024-12-24 12:19:06.881210,apacs web3 ai dream real deal asiapacific region key potential lead web3 artificial intelligence innovation,0.7717,-0.09999999999999999,0.33585000000000004
RSS,https://cointelegraph.com/rss,2024-12-24 05:24:33+00:00,2024-12-24 12:19:06.881210,scammer share crypto key aiming steal wannabe thief kaspersky kaspersky say scammer targeting digital thief baiting key loadedup crypto wallet swiping crypto added pay fee,-0.8481,0.0,-0.42405
RSS,https://cointelegraph.com/rss,2024-12-24 03:56:50+00:00,2024-12-24 12:19:06.881210,bitcoin santa claus rally hope dwindle price hit december low bitcoin fallen 145 peak high month cryptocurrency dipped 92500 week,-0.1779,0.08,-0.04895
RSS,https://cointelegraph.com/rss,2024-12-24 03:42:04+00:00,2024-12-24 12:19:06.881210,terawulf lease 70 mw host ai bitcoin mining cost jump terawulf looking expand redhot ai space bitcoin mining difficulty increase profitability shrink,0.5106,0.0,0.2553
RSS,https://cointelegraph.com/rss,2024-12-24 03:25:55+00:00,2024-12-24 12:19:06.881210,hyperliquid net outflow top 250m amid fear north korea hacker hyperliquid saw 256 million net outflow security expert revealed north korean threat actor trading platform,-0.5267,0.16666666666666666,-0.18001666666666666
RSS,https://cointelegraph.com/rss,2024-12-23 23:58:55+00:00,2024-12-24 12:19:06.881210,crypto payment firm moonpay mull 150m helio acquisition report moonpay reportedly looking acquire helio pay 150 million adding crypto firm merchant service offering,-0.1027,-0.2,-0.15135
RSS,https://cointelegraph.com/rss,2024-12-23 21:33:16+00:00,2024-12-24 12:19:06.881210,aave mull chainlink integration return mev fee user defi protocol aim capture around 40 mev profit adding chainlinks new oracle service,0.4404,0.13636363636363635,0.2883818181818182
RSS,https://cointelegraph.com/rss,2024-12-23 21:23:51+00:00,2024-12-24 12:19:06.881210,here happened crypto today need know happened crypto today latest news daily trend event impacting bitcoin price blockchain defi nfts web3 crypto regulation,0.0,0.25,0.125
RSS,https://cointelegraph.com/rss,2024-12-23 20:59:28+00:00,2024-12-24 12:19:06.881210,irs double crypto staking tax report u tax agency denied argument second lawsuit brought joshua jessica jarrett staking reward,-0.3818,0.0,-0.1909
RSS,https://cointelegraph.com/rss,2024-12-23 20:10:11+00:00,2024-12-24 12:19:06.881210,cryptocom launch u institutional custody service move part exchange broader plan expand u presence following election donald trump,0.3182,0.0,0.1591
RSS,https://cointelegraph.com/rss,2024-12-23 19:30:00+00:00,2024-12-24 12:19:06.881210,malaysia flag atomic wallet unauthorized operation wallet service provider subjected 100 million hack 2023,0.0,0.0,0.0
RSS,https://cointelegraph.com/rss,2024-12-23 19:02:54+00:00,2024-12-24 12:19:06.881210,december market correction drag crypto etps 17b despite price correction digital asset fund closed week positive net flow totaling 308 million,0.6369,0.005454545454545451,0.32117727272727276
RSS,https://cointelegraph.com/rss,2024-12-23 19:00:11+00:00,2024-12-24 12:19:06.881210,binance australia sued interpol issue red notice hex founder law decoded asic sue binance australia misclassification client interpol target hex founder red notice tornado cash update emerge,0.0,0.0,0.0
RSS,https://cointelegraph.com/rss,2024-12-23 18:18:47+00:00,2024-12-24 12:19:06.881210,price analysis 1223 spx dxy btc eth xrp sol bnb doge ada avax bitcoin remains pressure bull expected defend 90000 support,0.128,-0.1,0.013999999999999999
RSS,https://cointelegraph.com/rss,2024-12-23 16:10:00+00:00,2024-12-24 12:19:06.881210,bitcoin christmas give family friend useful crypto advice deck hall sound advice getting cryptocurrency,0.7269,0.35,0.53845
RSS,https://cointelegraph.com/rss,2024-12-23 15:29:33+00:00,2024-12-24 12:19:06.881210,la rosa holding offer bitcoin payment real estate agent real estate platform allow agent receive commission digital asset 2 fee,0.5267,0.13333333333333333,0.3300166666666666
RSS,https://cointelegraph.com/rss,2024-12-23 15:24:54+00:00,2024-12-24 12:19:06.881210,bitcoin extends loss trader see sub90k btc price support test bitcoin trader offering bearish shortterm btc price target return wall street fails offer relief,0.296,-0.5,-0.10200000000000001
RSS,https://cointelegraph.com/rss,2024-12-23 15:23:19+00:00,2024-12-24 12:19:06.881210,xrp price going crash xrp could crash 1520 december due bearish technical condition sign growing distribution whale,-0.5719,-0.0625,-0.3172
RSS,https://cointelegraph.com/rss,2024-12-23 14:20:00+00:00,2024-12-24 12:19:06.881210,got rich bitcoin unchained explains multisig wallet protect investor btc everyones heard key coin unchained head research joe burnett explains investor protect bitcoin,0.8316,0.1875,0.50955
RSS,https://bitcoinmagazine.com/.rss/full/,2024-12-23 18:57:30+00:00,2024-12-24 12:19:06.881210,satoshi paper explores role state postbitcoin world interview natalie smolenskitheoretical anthropologist natalie smolenski discus latest work satoshi paper second booklength academic text bitcoin conceptualized contributed edited,0.0,0.16666666666666666,0.08333333333333333
RSS,https://bitcoinmagazine.com/.rss/full/,2024-12-21 19:38:26+00:00,2024-12-24 12:19:06.881210,blackrock cant change bitcoin worried blackrock might change bitcoins supply let explain thats possible,0.2235,0.0,0.11175
RSS,https://bitcoinmagazine.com/.rss/full/,2024-12-20 23:22:52+00:00,2024-12-24 12:19:06.881210,need inkind redemption spot bitcoin etfshopefully sec commissioner hester peirce isnt playing say shell reconsider inkind redemption spot bitcoin etf,-0.1511,-0.1,-0.12555
RSS,https://bitcoinmagazine.com/.rss/full/,2024-12-20 20:31:05+00:00,2024-12-24 12:19:06.881210,bought bitcoin 108000 dont panicwhile bitcoins volatility may seem intense correction healthy normal,0.4588,0.2833333333333333,0.37106666666666666
RSS,https://bitcoinmagazine.com/.rss/full/,2024-12-20 16:42:53+00:00,2024-12-24 12:19:06.881210,dont support strategic bitcoin reserve neither younic carter lay argument bitcoin strategic reserve,-0.5801,0.0,-0.29005
RSS,https://bitcoinmagazine.com/.rss/full/,2024-12-20 14:47:33+00:00,2024-12-24 12:19:06.881210,time admit 21 quadrillion bitcoinsim favor bip 21q clever way resolve known problem bitcoin denomination,0.7506,0.16666666666666666,0.45863333333333334
RSS,https://bitcoinmagazine.com/.rss/full/,2024-12-20 13:54:47+00:00,2024-12-24 12:19:06.881210,exploring six onchain indicator understand bitcoin market cycleexplore key bitcoin metric like puell multiple mvrv zscore understand cycle progress anticipate price peak prepare bitcoins potential path toward 200k,0.6486,0.0,0.3243
RSS,https://bitcoinmagazine.com/.rss/full/,2024-12-19 21:26:36+00:00,2024-12-24 12:19:06.881210,bitcoin investor 67000 average startbitcoin investor average average american yearly salary,0.0,-0.11249999999999999,-0.056249999999999994
RSS,https://bitcoinmagazine.com/.rss/full/,2024-12-19 20:26:21+00:00,2024-12-24 12:19:06.881210,foundation introduces passport prime bitcoin wallet data security devicefoundations new device allinone tool digital security,0.5859,0.06818181818181818,0.3270409090909091
RSS,https://bitcoinmagazine.com/.rss/full/,2024-12-19 19:42:53+00:00,2024-12-24 12:19:06.881210,bukele president el salvador bitcoina good leader first priority well people whim public gossip banter,0.5106,0.31666666666666665,0.41363333333333335
RSS,https://bitcoinmagazine.com/.rss/full/,2024-12-19 15:00:29+00:00,2024-12-24 12:19:06.881210,vancouver mayor share probitcoin vision mayor ken sim isnt paying lip service bitcoin supporter come probitcoin rhetoric proposal he true believer,0.7964,0.35,0.5731999999999999
RSS,https://bitcoinmagazine.com/.rss/full/,2024-12-19 14:24:33+00:00,2024-12-24 12:19:06.881210,dont fall bitcoin crash breather worried bitcoins pullback let explain dip nothing healthy pause bull run,-0.296,0.5,0.10200000000000001
RSS,https://bitcoinmagazine.com/.rss/full/,2024-12-19 14:18:59+00:00,2024-12-24 12:19:06.881210,imf improved el salvador bitcoin lawin return loan deal imf el salvador give probitcoin policy made bitcoin law better,0.7184,0.5,0.6092
RSS,https://bitcoinmagazine.com/.rss/full/,2024-12-19 13:00:00+00:00,2024-12-24 12:19:06.881210,human right foundation donates 700000000 satoshis fund bitcoin development projectsthe hrf announces latest round bitcoin grant targeting key area latin america asia africa,0.3612,0.11714285714285713,0.2391714285714286
RSS,https://bitcoinmagazine.com/.rss/full/,2024-12-18 19:11:13+00:00,2024-12-24 12:19:06.881210,self custody theea counter argument attitude people never even consider self custody bitcoin,-0.3612,0.0,-0.1806
RSS,https://bitcoinmagazine.com/.rss/full/,2024-12-18 16:53:49+00:00,2024-12-24 12:19:06.881210,bitcoin puell multiple indicator workthe puell multiple powerful tool bitcoin investor analyzing miner revenue identify potential market top bottom here read itand signaling today,0.5574,0.16,0.3587
RSS,https://bitcoinmagazine.com/.rss/full/,2024-12-18 16:43:41+00:00,2024-12-24 12:19:06.881210,blackrocks new bitcoin ad monumental paradigm shiftthe overton window officially shifted bitcoin going mainstream,0.0,0.13636363636363635,0.06818181818181818
RSS,https://bitcoinmagazine.com/.rss/full/,2024-12-18 14:03:52+00:00,2024-12-24 12:19:06.881210,nic carter wrong u strategic bitcoin reserveis adding bitcoin u reserve sign weakness strength let tell nic carter wrong,-0.7003,-0.5,-0.60015
RSS,https://bitcoinmagazine.com/.rss/full/,2024-12-18 13:04:46+00:00,2024-12-24 12:19:06.881210,youngest ever bitcoin core contributor get bitcoin scholarship17yearold ishaana misra awarded chaincode lab inaugural bitcoin scholarship making youngest ever contributor bitcoin core,0.4019,0.0,0.20095
RSS,https://bitcoinmagazine.com/.rss/full/,2024-12-17 22:15:21+00:00,2024-12-24 12:19:06.881210,china may verge ending bitcoin banis china secretly stacking bitcoin gearing unban let break think theyre make huge moveand sooner think,0.3182,-2.7755575615628914e-17,0.15909999999999996
RSS,https://bitcoinmagazine.com/.rss/full/,2024-12-17 20:00:34+00:00,2024-12-24 12:19:06.881210,unit denomination bitcoin need changea recent bip proposed change way unit bitcoin displayed proposal needed,0.0,0.0,0.0
RSS,https://bitcoinmagazine.com/.rss/full/,2024-12-17 17:24:23+00:00,2024-12-24 12:19:06.881210,gridless mining bitcoin fostering human flourishing africagridless cofounder janet maingi explains company bitcoin mining work helping electrify rural africa leading better quality life community gridless touch,0.6249,0.16666666666666666,0.3957833333333333
RSS,https://bitcoinmagazine.com/.rss/full/,2024-12-17 17:12:07+00:00,2024-12-24 12:19:06.881210,mathematically predicting bitcoin price bull cycle peak bitcoin magazine pro lead analyst matt crosby us mathematical analysis predict next bitcoin bull cycle peak forecasting potential peak price 256000 310000 august 24 2025,0.0,0.0,0.0
RSS,https://bitcoinmagazine.com/.rss/full/,2024-12-17 16:49:59+00:00,2024-12-24 12:19:06.881210,buying bitcoin easy hodling hard partwhile bitcoin boom bull market volatility provide intense reality check ask veteran investor american hodl,0.4215,0.06833333333333333,0.24491666666666667
RSS,https://bitcoinmagazine.com/.rss/full/,2024-12-17 16:25:37+00:00,2024-12-24 12:19:06.881210,bitcoin university investment yield greater financial freedoma look whether bitcoin university education wiser long term investment one financial freedom,0.836,0.1125,0.47425
RSS,https://bitcoinmagazine.com/.rss/full/,2024-12-16 18:57:49+00:00,2024-12-24 12:19:06.881210,bitcoin etf surpass 1 million btc 2025accelerating etf inflow dwindling exchange supply potential u strategic reserve setting stage unprecedented bitcoin scarcitymaking even 1 million price target suddenly plausible,0.0,0.3666666666666667,0.18333333333333335
RSS,https://bitcoinmagazine.com/.rss/full/,2024-12-16 18:46:35+00:00,2024-12-24 12:19:06.881210,last resort unfed covenant bitcoinjeremy rubin recently released proposal allow specialized oracle emulate covenant bitcoin softforks necessary secured bitvm based slashable bond,0.5574,0.0,0.2787
RSS,https://bitcoinmagazine.com/.rss/full/,2024-12-13 19:01:18+00:00,2024-12-24 12:19:06.881210,perianne boring predicts trump 2025 economic policy drive bitcoin price 800kin bold prediction fox business perianne boring ceo digital chamber asserted presidentelect donald trump economic policy could position u global leader bitcoin adoption potentially driving asset price unprecedented 800000 2025,0.128,-0.0740740740740741,0.026962962962962952
RSS,https://bitcoinmagazine.com/.rss/full/,2024-12-13 18:05:58+00:00,2024-12-24 12:19:06.881210,tando rage year africa bitcoin conferencethe app let user pay merchant kenya accepts digital payment via mpesa bitcoin lightning,-0.4019,0.0,-0.20095
RSS,https://bitcoinmagazine.com/.rss/full/,2024-12-13 16:08:29+00:00,2024-12-24 12:19:06.881210,early bitcoin investor sentenced prison tax evasion 37 million btc salethis mark first criminal tax evasion prosecution centered solely bitcoin,-0.875,-0.01666666666666668,-0.44583333333333336
RSS,https://bitcoinmagazine.com/.rss/full/,2024-12-13 14:22:54+00:00,2024-12-24 12:19:06.881210,bitcoin fear greed index trading strategy beat buy hold investingdiscover bitcoin fear greed index sentiment analysis tool rooted human psychology outperform traditional buyandhold strategy,-0.8957,0.0,-0.44785
RSS,https://bitcoinmagazine.com/.rss/full/,2024-12-13 10:46:58+00:00,2024-12-24 12:19:06.881210,government large institution buy bitcoin want except yoursgovernments institution buying large amount bitcoin without risk one thing,0.2764,0.21428571428571427,0.24534285714285714
RSS,https://bitcoinmagazine.com/.rss/full/,2024-12-12 17:33:51+00:00,2024-12-24 12:19:06.881210,texas state rep file strategic bitcoin reserverepresentative giovanni capriglione filed live 𝕏 space,0.0,0.13636363636363635,0.06818181818181818
RSS,https://bitcoinmagazine.com/.rss/full/,2024-12-12 15:32:00+00:00,2024-12-24 12:19:06.881210,realized cap hodl wave identify next bitcoin price peakthe realized cap hodl wave chart highlight bitcoins market cycle align shift investor behavior shortterm holder currently 55 total realized value data suggests significant upside potential market overheats near 80,0.7076,0.095,0.4013
RSS,https://bitcoinmagazine.com/.rss/full/,2024-12-11 20:14:04+00:00,2024-12-24 12:19:06.881210,late invest bitcointhink youve missed bitcoin boom think despite impressive past performance bitcoin continues topperforming asset even recent month strategy like dollar cost averaging dca dont need fortune start investing learn bitcoin outshines gold dow jones traditional investment proving never late join bitcoin revolution,-0.1999,0.09999999999999999,-0.04995
RSS,https://bitcoinmagazine.com/.rss/full/,2024-12-11 17:22:57+00:00,2024-12-24 12:19:06.881210,backup bitcoina look bitcoin backup important manage,0.2023,0.4,0.30115000000000003
RSS,https://bitcoinmagazine.com/.rss/full/,2024-12-11 16:43:46+00:00,2024-12-24 12:19:06.881210,ray dalio prefers bitcoin bondsray dalio say prefers bitcoin gold bond amid rising global debt level signaling growing institutional endorsement bitcoin safe asset,0.7096,0.25,0.4798
RSS,https://bitcoinmagazine.com/.rss/full/,2024-12-10 22:05:55+00:00,2024-12-24 12:19:06.881210,eric trump state bitcoin ultimate hedge real estate investorseric trump highlight bitcoin transformative asset real estate investor emphasizing liquidity portability potential democratize wealthbuilding opportunity globally,0.7717,0.08,0.42585
RSS,https://bitcoinmagazine.com/.rss/full/,2024-12-10 22:05:09+00:00,2024-12-24 12:19:06.881210,microstrategy mstr expected added nasdaq 100 bloombergthe official announcement likely come friday say bloomberg,0.0,-0.05,-0.025
RSS,https://bitcoinmagazine.com/.rss/full/,2024-12-10 17:52:32+00:00,2024-12-24 12:19:06.881210,eric trump confident bitcoin price hit 1 millioneric trump confidently predicts bitcoin reach 1 million emphasizing scarcity global potential early adopter stand gain,0.8689,0.22000000000000003,0.54445
RSS,https://bitcoinmagazine.com/.rss/full/,2024-12-10 17:30:19+00:00,2024-12-24 12:19:06.881210,bitcoin islamic moneya look bitcoin complies islamic law regarding finance money,0.0,0.0,0.0
RSS,https://bitcoinmagazine.com/.rss/full/,2024-12-10 16:59:57+00:00,2024-12-24 12:19:06.881210,golden ratio multiplier mathematically reveals next bitcoin price targetthe golden ratio multiplier bitcoinspecific indicator created philip swift highlight 100000 critical resistance level analysis explores fibonacci multiple 350day moving average provide key insight bitcoins price cycle 127000 emerging next major target barrier broken,-0.3054,0.010227272727272722,-0.14758636363636365
RSS,https://bitcoinmagazine.com/.rss/full/,2024-12-09 22:01:13+00:00,2024-12-24 12:19:06.881210,russian state duma deputy proposes strategic bitcoin reservethe document would see russia create bitcoin reserve similar traditional currency reserve,0.2732,0.0,0.1366
RSS,https://bitcoinmagazine.com/.rss/full/,2024-12-09 18:00:14+00:00,2024-12-24 12:19:06.881210,wabisabi deanonymization vulnerability discloseda major vulnerability wabisabi publicly revealed would allow malicious coordinator server deanonymize user,-0.2944,0.03125,-0.131575
RSS,https://bitcoinmagazine.com/.rss/full/,2024-12-09 12:20:00+00:00,2024-12-24 12:19:06.881210,microbt unveils newgen whatsminer m6xs series bitcoin mena 2024microbt unveils newgen whatsminer m6xs series bitcoin mena 2024,0.0,0.0,0.0
RSS,https://bitcoinmagazine.com/.rss/full/,2024-12-07 18:07:35+00:00,2024-12-24 12:19:06.881210,trump must end capital gain tax bitcoinby eliminating capital gain tax bitcoin trump administration spur u innovation strengthen nation economic sovereignty ensure everyday american gain equal footing world rapidly evolving digital economy,0.9493,0.0,0.47465
RSS,https://bitcoinmagazine.com/.rss/full/,2024-12-06 19:12:33+00:00,2024-12-24 12:19:06.881210,joule paradox energy set value bitcoin bitcoin set value energyenergy fundamental base commodity upon everything value produced bitcoin pure embodiment energy monetary form,0.8402,-0.29285714285714287,0.27367142857142857
RSS,https://bitcoinmagazine.com/.rss/full/,2024-12-05 18:49:06+00:00,2024-12-24 12:19:06.881210,money isnt fixed yeta finite supply cap think necessary fix monetary system money seizure surveillance fundamentally much bigger problem solve,-0.2263,0.03333333333333333,-0.09648333333333334
RSS,https://bitcoinmagazine.com/.rss/full/,2024-12-05 17:27:55+00:00,2024-12-24 12:19:06.881210,100000 bitcoin price beginningwhoa think bitcoin hitting 100k peak think whats ahead 2025 getting started folk,0.0,0.0,0.0
RSS,https://bitcoinmagazine.com/.rss/full/,2024-12-05 17:26:47+00:00,2024-12-24 12:19:06.881210,guatemalan government taking closer look bitcoin memea nayib bukele bitcoin meme posted el salvador bitcoin office went viral guatemala last month im told prompted power country begin homework bitcoin craft better policy around asset,0.6597,0.25,0.45485
RSS,https://bitcoinist.com/feed/,2024-12-24 12:13:17+00:00,2024-12-24 12:19:06.881210,market selloff isnt deterring institutional crypto investor inflow upward trendthe small fish may reacting marketwide selling pressure institutional crypto investor adopted different stance pouring hundred million digital asset investment vehicle last week according coinshares report digital asset investment product saw inflow totaling 308m masking december 19 576m outflow single largest day total outflow,0.4215,-0.04591836734693877,0.1877908163265306
RSS,https://bitcoinist.com/feed/,2024-12-24 11:33:43+00:00,2024-12-24 12:19:06.881210,flockerz ico enters final stage 77m raised 29 day left join flockwho would thought gang blue bird could profitable new meme coin flockerz flock presale another 29 day hit 77m token sale proving serious momentum behind enters final stretch want get,0.6249,-0.08528138528138528,0.26980930735930736
RSS,https://bitcoinist.com/feed/,2024-12-24 11:00:32+00:00,2024-12-24 12:19:06.881210,shiba inu whale transaction spike 265 last 24 hour shib drive toward 000004shiba inu shib one talkedabout meme coin cryptocurrency space seen notable surge whale activity past 24 hour particularly data onchain analytics platform intotheblock reveals 265 increase whale transaction within past 24 hour interestingly surge whale activity notable,0.6124,0.16666666666666666,0.38953333333333334
RSS,https://bitcoinist.com/feed/,2024-12-24 03:30:19+00:00,2024-12-24 12:19:06.881210,cardano leader charles hoskinson push crypto unity democratic senatorsa key figure cryptocurrency sector mission push bipartisan crypto policy would redefine regulation governing digital asset cardano founder charles hoskinson talk senator john fetterman democratic senator lobby crafting establishment policy match circumstance surrounding cryptocurrencies,0.3818,0.0,0.1909
RSS,https://bitcoinist.com/feed/,2024-12-24 02:00:22+00:00,2024-12-24 12:19:06.881210,xrp wallet growing parabolic rate recently data showsonchain data show xrp blockchain witnessed sharp wallet growth recently outpaced giant network like bitcoin ethereum xrp gaining rapid adoption recently according data onchain analytics firm santiment top cryptocurrencies witnessed significant growth total amount holder last couple year,0.9153,0.05500000000000001,0.48515
RSS,https://bitcoinist.com/feed/,2024-12-24 00:30:44+00:00,2024-12-24 12:19:06.881210,blackrocks ethereum etf soar past 1 million eth price followwhile ethereum eth failed break stubborn 4000 resistance level blackrocks ishares ethereum trust etf quietly accumulated one million eth milestone reflects strong institutional demand ethereum even price performance 2024 remains lackluster institutional interest ethereum rise yeartodate ytd ethereum,0.4767,-0.07916666666666666,0.19876666666666667
RSS,https://bitcoinist.com/feed/,2024-12-23 23:00:13+00:00,2024-12-24 12:19:06.881210,hyperliquid hype threatened north korean hacker investor need knowhyperliquid hype decentralized perpetual exchange dex operating layer 1 blockchain currently grappling significant security concern observing abnormal trading activity linked north korean hacker group several address marked north korean hacker trading hyperliquid total loss 700000 first highlighted,-0.3384,0.12083333333333333,-0.10878333333333332
