MainSource,Source,Publication Date,Pull_date,Pre-Processed Text,Sentiment_Vader,Sentiment_TextBlob,Average_Sentiment
RSS,https://cointelegraph.com/rss,2024-10-09 13:15:26+01:00,2024-10-09 12:18:05.016333,peter todd man hbo identified satoshi nakamoto peter todd early figure bitcoin core contributor blockchain today,0.0,0.1,0.05
RSS,https://cointelegraph.com/rss,2024-10-09 13:12:44+01:00,2024-10-09 12:18:05.016333,solana 100m active wallet empty although solanas active address count climbed 100 million wallet appear hold little sol,0.5574,-0.13854166666666667,0.20942916666666667
RSS,https://cointelegraph.com/rss,2024-10-09 12:17:24+01:00,2024-10-09 12:18:05.016333,wirex pay launch noncustodial crypto payment wirex pay introduced modular chain payment enhancing security noncustodial wallet private key system,0.1531,0.0,0.07655
RSS,https://cointelegraph.com/rss,2024-10-09 11:13:32+01:00,2024-10-09 12:18:05.016333,taiwan trial crypto custody service local bank 2025 taiwan financial supervisory commission reportedly plan start collecting application institution interested trialing bitcoin custody service first quarter 2025,0.4019,0.125,0.26344999999999996
RSS,https://cointelegraph.com/rss,2024-10-09 09:57:03+01:00,2024-10-09 12:18:05.016333,btc price retests 62k bitcoin prep 039very high impact039 month end btc price action longer getting u bitcoin trader excited coinbase premium index hit lowest level two month,-0.0516,0.21166666666666667,0.08003333333333333
RSS,https://cointelegraph.com/rss,2024-10-09 09:29:46+01:00,2024-10-09 12:18:05.016333,127 crypto wallet report profit polymarket 127 polymarket user made profit prediction market earning le 100 according onchain data,0.7003,0.0,0.35015
RSS,https://cointelegraph.com/rss,2024-10-09 09:09:51+01:00,2024-10-09 12:18:05.016333,cathie wood ark invest dump 36m robinhood stock ark 36 million robinhood sale came stock price surging 100 yeartodate posting multiyear high,-0.3818,0.16,-0.11089999999999998
RSS,https://cointelegraph.com/rss,2024-10-09 08:39:00+01:00,2024-10-09 12:18:05.016333,ida integrates hkda stablecoin chainlink secure crosschain use ida finance use chainlink proof reserve ccip product aim boost crosschain operability asset security,0.8402,0.4,0.6201
RSS,https://cointelegraph.com/rss,2024-10-09 07:22:24+01:00,2024-10-09 12:18:05.016333,86yearold pay 14m admitting running crypto ponzi scheme prosecutor sought five year probation crypto schemer david kagel age ailing health,-0.1027,0.0,-0.05135
RSS,https://cointelegraph.com/rss,2024-10-09 07:12:55+01:00,2024-10-09 12:18:05.016333,ftx say caroline ellison give asset settlement former alameda research ceo caroline ellison agreed settle case ftx may see turn everything left,0.5574,0.0,0.2787
RSS,https://cointelegraph.com/rss,2024-10-09 05:53:03+01:00,2024-10-09 12:18:05.016333,crypto punter favor dollarcost averaging investing kraken survey according crypto exchange kraken almost 60 1000 surveyed crypto investor use dca main investment strategy,0.4019,0.16666666666666666,0.28428333333333333
RSS,https://cointelegraph.com/rss,2024-10-09 02:40:34+01:00,2024-10-09 12:18:05.016333,peter todd named satoshi nakamoto hbo documentary bitcoin core developer todd admitted bitcoin creator satoshi nakamoto hbos documentary confession wasnt seemed,0.1027,0.0,0.05135
RSS,https://cointelegraph.com/rss,2024-10-09 02:24:38+01:00,2024-10-09 12:18:05.016333,canary capital follows bitwise filing spot xrp etf canary capital filed xrp etf hot heel bitwise filed similar product week earlier,0.0,0.08333333333333333,0.041666666666666664
RSS,https://cointelegraph.com/rss,2024-10-09 00:36:35+01:00,2024-10-09 12:18:05.016333,imdb reveals hbos bitcoin documentary secret everyone cast satoshi imdb page hbos documentary claiming reveal satoshi nakamotos identity edited user make everyone cast appear bitcoin creator,0.0,-0.13333333333333333,-0.06666666666666667
RSS,https://cointelegraph.com/rss,2024-10-08 23:58:18+01:00,2024-10-09 12:18:05.016333,building realworld project using memeinspired strategy memecoins fuel viral growth crypto market throughout 2024 also often lead pumpanddumps,0.3818,0.0,0.1909
RSS,https://cointelegraph.com/rss,2024-10-08 22:37:48+01:00,2024-10-09 12:18:05.016333,palau introduces blockchain saving bond soramitsu palau invest saving bond raise money local infrastructure provide new mean saving,0.0,-0.058712121212121215,-0.029356060606060608
RSS,https://cointelegraph.com/rss,2024-10-08 22:13:23+01:00,2024-10-09 12:18:05.016333,ethereum layer 2 scroll tip native token launch token scr distributed oct 22 airdrop listed binance scroll said,0.0,0.0,0.0
RSS,https://cointelegraph.com/rss,2024-10-08 22:05:00+01:00,2024-10-09 12:18:05.016333,bitcoin following perfect script chart 150k alltime high cycle analysis veteran trader say bitcoin following perfect script terminates potential 150000 cycle high,0.8126,0.29000000000000004,0.5513
RSS,https://cointelegraph.com/rss,2024-10-08 22:00:56+01:00,2024-10-09 12:18:05.016333,blockchainbased desci solves science peer review problem hoskinson desci movement continues gain steam among industry insider,0.4215,0.0,0.21075
RSS,https://cointelegraph.com/rss,2024-10-08 21:47:10+01:00,2024-10-09 12:18:05.016333,x restored brazil 24 hour rule justice alexandre de moraes ruling came social medium platform settled 55m fine south american country,0.765,0.15,0.4575
RSS,https://cointelegraph.com/rss,2024-10-08 21:05:00+01:00,2024-10-09 12:18:05.016333,memecoins today memecoins today strongly outperformed entire crypto market last month,0.2732,0.14444444444444446,0.20882222222222224
RSS,https://cointelegraph.com/rss,2024-10-08 20:24:27+01:00,2024-10-09 12:18:05.016333,brazil review elon musk x ban 5m fine payment social medium platform x could soon restored brazil paying fine appointing new legal representative blocking certain user account court request,0.1027,0.2362193362193362,0.1694596681096681
RSS,https://cointelegraph.com/rss,2024-10-08 20:20:48+01:00,2024-10-09 12:18:05.016333,here happened crypto today need know happened crypto today latest news daily trend event impacting bitcoin price blockchain defi nfts web3 crypto regulation,0.0,0.25,0.125
RSS,https://cointelegraph.com/rss,2024-10-08 20:04:34+01:00,2024-10-09 12:18:05.016333,ethereum price lag bitcoin altcoins rally 26k possible drop ethereum network activity investor concern global economy continue weigh eth price,-0.5423,0.0,-0.27115
RSS,https://cointelegraph.com/rss,2024-10-08 19:40:17+01:00,2024-10-09 12:18:05.016333,exftx exec worried reporting prison oct 11 ryan salame pleaded guilty conspiracy make unlawful political contribution defraud federal election commission ftxs collapse,-0.9313,-0.25,-0.59065
RSS,https://cointelegraph.com/rss,2024-10-08 19:11:52+01:00,2024-10-09 12:18:05.016333,tradias secures funding bafin license eye european expansion bankhaus scheich subsidiary got bafin license using parent company several year,0.3182,0.0,0.1591
RSS,https://cointelegraph.com/rss,2024-10-08 19:00:00+01:00,2024-10-09 12:18:05.016333,polychain franklin templeton back bitlayers 9m series extension bitcoin layer2 startup raised capital upcoming bitlayer v2 bringing total funding 25 million date,0.0,0.0,0.0
RSS,https://cointelegraph.com/rss,2024-10-08 18:53:05+01:00,2024-10-09 12:18:05.016333,theoriq launch testnet blockchainbased ai agent network organization claim developed firstofitskind blockchain network,0.0,0.1,0.05
RSS,https://cointelegraph.com/rss,2024-10-08 18:20:34+01:00,2024-10-09 12:18:05.016333,blockchain activity soar 70 q3 driven ai dapps daily active wallet dapp industry soared third quarter 2024 driven primarily 71 growth performance airelated application,0.6486,0.06666666666666668,0.3576333333333333
RSS,https://cointelegraph.com/rss,2024-10-08 17:47:47+01:00,2024-10-09 12:18:05.016333,cryptocoms u exchange list 4 memecoin derivative trader hedge exposure memecoins including pepe floki,0.0,0.0,0.0
RSS,https://bitcoinmagazine.com/.rss/full/,2024-10-09 07:16:35+00:00,2024-10-09 12:18:05.016333,watch bitcoin amsterdam underwaythe world largest bitcoin conference kick today amsterdam featuring speaker like jack mallers adam back watch live stream european bitcoin leader discus future,0.3612,0.03409090909090909,0.19764545454545457
RSS,https://bitcoinmagazine.com/.rss/full/,2024-10-08 19:49:31+00:00,2024-10-09 12:18:05.016333,entered bitcoin mining lottery nikolaushow im looking beat odds claim full 325 btc block worth 200000,-0.25,0.32499999999999996,0.03749999999999998
RSS,https://bitcoinmagazine.com/.rss/full/,2024-10-08 15:17:43+00:00,2024-10-09 12:18:05.016333,bitcoin report parabolic growth predicted q4 2024exclusive analysis expert insight navigating bitcoins promising q4 market dynamic,0.7845,0.1,0.44225
RSS,https://bitcoinmagazine.com/.rss/full/,2024-10-08 14:15:14+00:00,2024-10-09 12:18:05.016333,vexl next generation bitcoin p2p trading appvexl cofounder ceo lea petrášová belief app shes helped create opensource kycfree peertopeer bitcoin marketplace essential helping preserve bitcoins essential quality,0.5106,0.0,0.2553
RSS,https://bitcoinmagazine.com/.rss/full/,2024-10-08 13:00:00+00:00,2024-10-09 12:18:05.016333,shinobi stop demonizing developer nonsensea quick take latest reason people yelling bitcoin core developer,-0.296,0.41666666666666663,0.06033333333333332
RSS,https://bitcoinmagazine.com/.rss/full/,2024-10-08 12:07:44+00:00,2024-10-09 12:18:05.016333,reminder update bitcoin wallet firmwarelive digital device bitcoin hardware wallet infallible require routine upkeep least wellkept seed phrase,0.0,-0.15,-0.075
RSS,https://bitcoinmagazine.com/.rss/full/,2024-10-07 18:42:05+00:00,2024-10-09 12:18:05.016333,trump presidency best outcome bitcoin nikolaustrump would allow friendly regulatory environment bitcoiners thrive,0.8519,0.6875,0.7697
RSS,https://bitcoinmagazine.com/.rss/full/,2024-10-05 12:26:18+00:00,2024-10-09 12:18:05.016333,uncle jack chili good bitcoina selfproclaimed bitcoin pleb actual brain surgeon dr jack kruse sauce want everyone try,0.4939,0.35,0.42195
RSS,https://bitcoinmagazine.com/.rss/full/,2024-10-05 00:18:02+00:00,2024-10-09 12:18:05.016333,corva want greater adoption bitcoin use fix problemsfollow lead bitcoin ekasis hermann vivier motivs rich swisher,0.7506,0.4375,0.59405
RSS,https://bitcoinmagazine.com/.rss/full/,2024-10-04 15:37:05+00:00,2024-10-09 12:18:05.016333,positive end 2024 bitcoinoptimism ahead q4 2024 deliver bitcoins next big rally,0.5574,0.07575757575757576,0.3165787878787879
RSS,https://bitcoinmagazine.com/.rss/full/,2024-10-04 15:20:11+00:00,2024-10-09 12:18:05.016333,bitcoin magazine introduces new short form opinion format takesthe oldest trusted bitcoin publication introducing new shortform content format,0.4767,0.0909090909090909,0.2838045454545455
RSS,https://bitcoinmagazine.com/.rss/full/,2024-10-04 14:46:41+00:00,2024-10-09 12:18:05.016333,wont find satoshi nakamoto next weekas longtime bitcoiner im certain latest satoshi nakamoto unmasking attempt disappoint like rest real proof provided,0.2263,0.2285714285714286,0.2274357142857143
RSS,https://bitcoinmagazine.com/.rss/full/,2024-10-03 18:17:53+00:00,2024-10-09 12:18:05.016333,aaron trump give damn bitcointrump providing lip service bitcoiners mean continue ally bitcoin get elected second term,-0.4019,-0.15625,-0.27907499999999996
RSS,https://bitcoinmagazine.com/.rss/full/,2024-10-03 15:40:52+00:00,2024-10-09 12:18:05.016333,frank bitcoina seemingly contradictory yet profound message jeff booth,-0.34,0.08333333333333333,-0.12833333333333335
RSS,https://bitcoinmagazine.com/.rss/full/,2024-10-03 14:39:59+00:00,2024-10-09 12:18:05.016333,wall street isnt bitcoin crypto etf comingwall street want sell product make u dollar continue thing make dollar,0.0772,0.0,0.0386
RSS,https://bitcoinmagazine.com/.rss/full/,2024-10-03 12:50:17+00:00,2024-10-09 12:18:05.016333,vivek bitcoin lightning payment long way go indiai couldnt resist lightning fast fiat payment network india,0.0,0.07500000000000001,0.037500000000000006
RSS,https://bitcoinmagazine.com/.rss/full/,2024-10-02 18:04:05+00:00,2024-10-09 12:18:05.016333,offchain protocol always balancing actimportant thing consider looking future offchain system,0.0,0.0,0.0
RSS,https://bitcoinmagazine.com/.rss/full/,2024-10-02 14:42:48+00:00,2024-10-09 12:18:05.016333,1000 faraday backpack protect bitcointhe slnt submersible faraday backpack may bit splurge feature bitcoin privacy expert could want,0.4404,0.0,0.2202
RSS,https://bitcoinmagazine.com/.rss/full/,2024-10-02 13:14:50+00:00,2024-10-09 12:18:05.016333,vivek unsurprisingly bitcoin price follows global liquiditybitcoins siren ringing loudly liquiditydriven boom may soon underway,0.0,0.05,0.025
RSS,https://bitcoinmagazine.com/.rss/full/,2024-10-01 21:08:32+00:00,2024-10-09 12:18:05.016333,retail keep selling bitcoin etf dont sell btc whalesspot bitcoin etf bitcoin accumulation rampage,0.0,0.0,0.0
RSS,https://bitcoinmagazine.com/.rss/full/,2024-10-01 16:43:38+00:00,2024-10-09 12:18:05.016333,lesson running bitrefill premier bitcoin ecommerce platform10 year ago sergej kotliar set help people easily spend bitcoin everyday item task still come number challenge taught many lesson,0.6908,0.24444444444444446,0.4676222222222222
RSS,https://bitcoinmagazine.com/.rss/full/,2024-10-01 11:15:56+00:00,2024-10-09 12:18:05.016333,rizzo satoshi nakamotos new mysteryits 2024 there new mystery surfacing around bitcoins creator satoshi nakamoto time relating mining activity 2009,0.0,0.13636363636363635,0.06818181818181818
RSS,https://bitcoinmagazine.com/.rss/full/,2024-09-30 17:28:43+00:00,2024-10-09 12:18:05.016333,ocean datum tackling bitcoins pressing problemoceans datum since weekend putting transaction selection back hand hashers benefiting bitcoins censorship resistance,0.4939,0.0,0.24695
RSS,https://bitcoinmagazine.com/.rss/full/,2024-09-30 16:44:27+00:00,2024-10-09 12:18:05.016333,inside lebanon currency crisis hyperinflation feelsa look lived experience going hyperinflation lebanon,-0.6249,0.0,-0.31245
RSS,https://bitcoinmagazine.com/.rss/full/,2024-09-30 16:19:29+00:00,2024-10-09 12:18:05.016333,nikolaus business insider say trump harris courting bitcoin vote reality say otherwisekamala harris done nothing confirm support protect industry far political opponent going beyond,-0.5334,0.05,-0.2417
RSS,https://bitcoinmagazine.com/.rss/full/,2024-09-27 16:09:58+00:00,2024-10-09 12:18:05.016333,maximizing bitcoin gain etf dataoutperforming bitcoin simple etf data strategy higher return,0.5267,0.125,0.32585
RSS,https://bitcoinmagazine.com/.rss/full/,2024-09-27 13:52:18+00:00,2024-10-09 12:18:05.016333,tornado cash loses motion dismissa short summary recent decision regarding tornado cash case,-0.3182,-0.09999999999999999,-0.20909999999999998
RSS,https://bitcoinmagazine.com/.rss/full/,2024-09-26 16:05:44+00:00,2024-10-09 12:18:05.016333,proof reserve show money didnt happen proof reserve critical piece infrastructure custodial service built top bitcoin,-0.128,0.25,0.061
RSS,https://bitcoinmagazine.com/.rss/full/,2024-09-26 13:11:18+00:00,2024-10-09 12:18:05.016333,bitcoin swap service boltz launch btcpay server plugin lightning paymentsthe boltz btcpay plugin enables merchant using btcpay server accept lightning payment noncustodially transfer fund liquid sidechain,0.3818,0.0,0.1909
RSS,https://bitcoinmagazine.com/.rss/full/,2024-09-26 12:07:57+00:00,2024-10-09 12:18:05.016333,arthur hayes family office fund another bitcoin core developerarthur hayes family office maelstrom awarded bitcoin developer jon atack 1year grant work fulltime bitcoin core bips nostrings funding aim strengthen bitcoins open source ecosystem,0.7579,0.0,0.37895
RSS,https://bitcoinmagazine.com/.rss/full/,2024-09-25 21:39:13+00:00,2024-10-09 12:18:05.016333,alby release alby go mobile app selfcustodial bitcoin lightning paymentsalby go easytouse opensource bitcoin wallet serf interface lightning node nostr wallet connect nwc wallet service,0.0,0.0,0.0
RSS,https://bitcoinmagazine.com/.rss/full/,2024-09-25 19:35:20+00:00,2024-10-09 12:18:05.016333,paypal enables business account buy hold sell bitcoin cryptopaypal announced new feature allowing u business account buy hold sell transfer supported cryptocurrency bitcoin expanding crypto offering merchant,0.3182,0.13636363636363635,0.22728181818181817
RSS,https://bitcoinmagazine.com/.rss/full/,2024-09-25 18:25:41+00:00,2024-10-09 12:18:05.016333,there three door one bitcoin step througha look prolific post infamous mircea popescu positing rare clairvoyance possible path bitcoin could take road future,0.0,-0.05,-0.025
RSS,https://bitcoinmagazine.com/.rss/full/,2024-09-25 15:34:43+00:00,2024-10-09 12:18:05.016333,israel go cashlessisraels promoting new plan abolish 200 shekel banknote forbid possession physical gold silver use ai enforcement gaza state cash deteriorates efrat fenigson,0.0516,0.06818181818181818,0.05989090909090909
RSS,https://bitcoinmagazine.com/.rss/full/,2024-09-25 11:04:01+00:00,2024-10-09 12:18:05.016333,brink donates 1 million bitcoin developer last yearnonprofit organisation brink published annual report detailing 1 million donation open source developer 2023 report highlighted achievement brinksponsored contributor improving bitcoins protocol,0.4215,0.0,0.21075
RSS,https://bitcoinmagazine.com/.rss/full/,2024-09-24 16:46:51+00:00,2024-10-09 12:18:05.016333,building lnbits wordpress bitcoin lightning node ben arcben arc talented team developer behind lnbits helping user lightning,0.6705,0.14999999999999997,0.41025
RSS,https://bitcoinmagazine.com/.rss/full/,2024-09-24 13:22:48+00:00,2024-10-09 12:18:05.016333,bitwise cio say powerful people finance buying bitcoin cryptothe cio bitcoin asset manager bitwise claim powerful people finance buying bitcoin crypto say nearly 70 top financial advisor recent summit owned bitcoin crypto personally,0.836,0.18333333333333335,0.5096666666666667
RSS,https://bitcoinmagazine.com/.rss/full/,2024-09-23 17:53:49+00:00,2024-10-09 12:18:05.016333,bitcoin fork pathway innovation disruptive forcesa look history major bitcoin fork,0.0772,0.0625,0.06985
RSS,https://bitcoinmagazine.com/.rss/full/,2024-09-23 13:31:05+00:00,2024-10-09 12:18:05.016333,donald trump say crypto could help pay 35 trillion u debtdonald trump floated using crypto pay u 35 trillion debt part embrace bitcoin amid 2024 race kamala harris also pledged boost digital asset signaling cryptos growing bipartisan appeal,0.765,0.0,0.3825
RSS,https://bitcoinmagazine.com/.rss/full/,2024-09-20 21:42:07+00:00,2024-10-09 12:18:05.016333,sec approves option trading blackrocks spot bitcoin etf ibitthe sec approved listing trading option blackrocks ishares bitcoin trust marking significant milestone bitcoin integration traditional finance,0.8625,0.04375,0.453125
RSS,https://bitcoinmagazine.com/.rss/full/,2024-09-20 16:30:47+00:00,2024-10-09 12:18:05.016333,bitcoin react u electioncan historical election trend predict bitcoins next move,0.0,0.0,0.0
RSS,https://bitcoinmagazine.com/.rss/full/,2024-09-20 14:52:09+00:00,2024-10-09 12:18:05.016333,microstrategy buy additional 489 billion worth bitcoinmicrostrategy purchased additional 489 million bitcoin swelling corporate bitcoin treasury 252000 btc worth nearly 10 billion company bitcoin strategy aim boost return hedge inflation,0.743,0.175,0.45899999999999996
RSS,https://bitcoinmagazine.com/.rss/full/,2024-09-20 14:10:48+00:00,2024-10-09 12:18:05.016333,santa monica bitcoin office case study presented cmrta annual conferenceproof workforce santa monicas vice mayor present case study city innovative bitcoin office cmrta annual conference office first kind u aim educate bitcoin support economic recovery,0.8402,0.31,0.5751
RSS,https://bitcoinmagazine.com/.rss/full/,2024-09-20 09:20:12+00:00,2024-10-09 12:18:05.016333,satoshi era wallet moved 16 million worth bitcoinaround 250 btc bitcoins early day transferred 15 year inactivity revealing huge reward reaped early miner 16 million worth satoshi era coin highlight conviction pioneering hodlers,0.8807,0.24,0.56035
RSS,https://bitcoinmagazine.com/.rss/full/,2024-09-19 22:44:29+00:00,2024-10-09 12:18:05.016333,bipartisan consensus emerges final day america love crypto tourcoinbase ceo brian armstrong congressman wiley nickel dnc emphasized need united state decisively lead crypto policy bipartisan manner,0.7906,0.25,0.5203
RSS,https://bitcoinmagazine.com/.rss/full/,2024-09-19 20:26:27+00:00,2024-10-09 12:18:05.016333,hut 8 bitmain launch nextgeneration asic bitcoin miner liquidtochip coolingthese mining giant join force release u3s21exph nextgeneration asic miner featuring advanced liquidtochip cooling technology,0.4939,0.2,0.34695
RSS,https://bitcoinmagazine.com/.rss/full/,2024-09-19 16:01:04+00:00,2024-10-09 12:18:05.016333,celebrating 10 year hardware wallet revolutiona look back start hardware wallet bitcoin space,0.5719,0.0,0.28595
RSS,https://bitcoinmagazine.com/.rss/full/,2024-09-19 12:22:17+00:00,2024-10-09 12:18:05.016333,germany commerzbank dz bank offer bitcoin crypto tradinggermanys two large bank commerzbank dz bank launching bitcoin crypto trading service amid growing demand,0.0516,0.21428571428571427,0.13294285714285714
RSS,https://bitcoinmagazine.com/.rss/full/,2024-09-18 22:59:20+00:00,2024-10-09 12:18:05.016333,donald trump make historic bitcoin payment pubkeyformer u president republican presidential nominee donald trump becomes first u president publicly transact bitcoin,0.0,0.08333333333333333,0.041666666666666664
RSS,https://bitcoinmagazine.com/.rss/full/,2024-09-18 22:30:01+00:00,2024-10-09 12:18:05.016333,louisiana state government accepts bitcoin lightning paymentlouisiana become one first u state accept bitcoin government payment offering resident flexible option transaction,0.7003,0.25,0.47515
RSS,https://bitcoinist.com/feed/,2024-10-09 11:30:20+00:00,2024-10-09 12:18:05.016333,bitcoin bullish q4 narrative fueled ftx repayment development reportaccording report crypto research firm k33 research bitcoin btc price could benefit latest development ftx bankruptcy saga ftx creditor payouts could bullish bitcoin analyst k33 suggest recent development ftx estate creditor repayment process could help leading digital asset maintain bullish,0.7906,0.075,0.43279999999999996
RSS,https://bitcoinist.com/feed/,2024-10-09 10:00:00+00:00,2024-10-09 12:18:05.016333,revoluts crypto security measure prevents 135 million potential lossesglobal fintech revolut revealed prevented million potential loss last three month using cryptospecific measure transaction monitoring tackle criminal activity malicious actor continue target industry related reading bitcoin propelling small texas town new economic era rockdale story revolut prevents 13,-0.3818,-0.03920454545454546,-0.2105022727272727
RSS,https://bitcoinist.com/feed/,2024-10-09 08:30:24+00:00,2024-10-09 12:18:05.016333,warning telegram breeding ground crypto fraud un saysthe united nation recently issued surprising report stating telegram emerged major platform criminal network southeast asia encrypted chat software become hotspot money laundering fraud exchange stolen data according un finding show organized crime group using telegram,-0.9475,0.09062499999999998,-0.4284375
RSS,https://bitcoinist.com/feed/,2024-10-09 07:00:13+00:00,2024-10-09 12:18:05.016333,ethereum whale relentlessly selling 6 month data revealsonchain data show ethereum whale participating constant distribution last six month sign thats ideal eth ethereum accumulation trend score red cohort whole analyst james van straten pointed new post x accumulation trend score showing grim,-0.0772,0.033766233766233764,-0.02171688311688312
RSS,https://bitcoinist.com/feed/,2024-10-09 05:30:18+00:00,2024-10-09 12:18:05.016333,dogecoin price prediction doge due parabolic surge 22a new dogecoin price prediction put another bullish path time forecasting meme coin destined new alltime high particular crypto analyst kev_capital_ta x made notable forecast regarding meme coin could see finally cross 1 market entirely based,0.0,0.12179924242424242,0.06089962121212121
RSS,https://bitcoinist.com/feed/,2024-10-09 02:30:51+00:00,2024-10-09 12:18:05.016333,ethereum fundamental hint upside potential staking hit 29 highethereum critical juncture failing break 2500 mark yesterday leaving investor uncertain next move broader crypto market anticipates rally ethereum trader closely monitor sign strength within network despite recent price struggle promising signal blockchain related reading u spot,0.016,0.03333333333333333,0.024666666666666667
RSS,https://bitcoinist.com/feed/,2024-10-09 01:00:18+00:00,2024-10-09 12:18:05.016333,solana trader turn 800 10 million unreal meme coin trade here howa solana sol trader initially invested mere 800 popular solanabased meme coin moo deng realized unreal gain profit soaring approximately 10 million however despite massive return unreal meme coin trade solana trader facing liquidity obstacle leaving stranded moo dengs value rapidly plummet,0.8402,-0.06000000000000001,0.39009999999999995
RSS,https://bitcoinist.com/feed/,2024-10-08 23:30:08+00:00,2024-10-09 12:18:05.016333,344 million nearly 30 circulating eth staked ethereum still strugglingethereum bull might struggle momentum press time onchain data point interesting development eth trading 2400 capped determined seller intotheblock data show nearly 30 circulating eth staked 344 million eth staked 9 month october 8 intotheblock analyst,0.4215,0.2333333333333333,0.32741666666666663
