MainSource,Source,Publication Date,Pull_date,Pre-Processed Text,Sentiment_Vader,Sentiment_TextBlob,Average_Sentiment
RSS,https://cointelegraph.com/rss,2024-09-20 22:55:22+01:00,2024-09-21 00:48:11.134365,bank canada say retail cbdc reshuffling priority regulating speeding payment without cbdc important canadian central bank,-0.1511,0.2,0.02445
RSS,https://cointelegraph.com/rss,2024-09-20 22:53:28+01:00,2024-09-21 00:48:11.134365,bingx confirms resumption withdrawal service following hack monetary loss bingx hack initially reported totaling 26 million figure since swelled 52 million,-0.296,0.0,-0.148
RSS,https://cointelegraph.com/rss,2024-09-20 22:45:00+01:00,2024-09-21 00:48:11.134365,solana prepares possible sizable move defending 120 support sol price bounced 120 support multiple time since april leading trader believe current market recovery lead explosive rally,0.6597,0.0,0.32985
RSS,https://cointelegraph.com/rss,2024-09-20 22:26:24+01:00,2024-09-21 00:48:11.134365,sec approves option blackrock039s spot bitcoin etf sec notice seemed industry first commission approved listing trading spot bitcoin exchangetraded fund u exchange january,0.6705,0.016666666666666663,0.34358333333333335
RSS,https://cointelegraph.com/rss,2024-09-20 22:00:00+01:00,2024-09-21 00:48:11.134365,crypto biz circle prepares debut wall street stablecoin issuer circle moving forward public offering debut plan shift headquarters wall street 2025,0.0,0.0,0.0
RSS,https://cointelegraph.com/rss,2024-09-20 21:58:34+01:00,2024-09-21 00:48:11.134365,securitize add wormhole multichain rwa token easier crosschain transferability rwas crucial institutional adoption executive say,0.4767,0.0,0.23835
RSS,https://cointelegraph.com/rss,2024-09-20 21:45:03+01:00,2024-09-21 00:48:11.134365,bitcoin price going crash bitcoins failure hold 64000 could early sign price reversal beginning,-0.7184,-0.10833333333333332,-0.41336666666666666
RSS,https://cointelegraph.com/rss,2024-09-20 21:40:10+01:00,2024-09-21 00:48:11.134365,sec seek sanction elon musk twitter investigation elon musk various company currently facing regulatory scrutiny brazil european union united state,0.4215,-0.025,0.19824999999999998
RSS,https://cointelegraph.com/rss,2024-09-20 21:32:35+01:00,2024-09-21 00:48:11.134365,here happened crypto today need know happened crypto today latest news daily trend event impacting bitcoin price blockchain defi nfts web3 crypto regulation,0.0,0.25,0.125
RSS,https://cointelegraph.com/rss,2024-09-20 21:00:30+01:00,2024-09-21 00:48:11.134365,kwons extradition case go back montenegrin justice minister according montenegro supreme court u south korea met condition applying kwons extradition face criminal charge,0.5574,-0.2,0.1787
RSS,https://cointelegraph.com/rss,2024-09-20 20:05:54+01:00,2024-09-21 00:48:11.134365,cryptocom gain payment service license bahrain central bank singaporebased cryptocurrency cryptocom reinforcing regional presence bahraini license following approval dubai,0.7579,0.0,0.37895
RSS,https://cointelegraph.com/rss,2024-09-20 20:01:00+01:00,2024-09-21 00:48:11.134365,trump silent crypto platform sec urged clarify airdrop finance redefined former president donald trump remained silent family upcoming crypto platform republican party lawmaker urged sec clarify stance crypto airdrop,0.4019,-0.04,0.18095
RSS,https://cointelegraph.com/rss,2024-09-20 19:48:52+01:00,2024-09-21 00:48:11.134365,ethereum open interest hit 20month high bullish bearish eth ether future open interest jump 20month high leverage demand remains balanced,0.6705,0.064,0.36724999999999997
RSS,https://cointelegraph.com/rss,2024-09-20 19:38:56+01:00,2024-09-21 00:48:11.134365,expect caroline ellison sentencing hearing former alameda research ceo lawyer requested time served prosecutor seemed flattering sentencing memo judge lewis kaplan say sept 24,0.0258,0.0,0.0129
RSS,https://cointelegraph.com/rss,2024-09-20 18:48:54+01:00,2024-09-21 00:48:11.134365,bitcoin outperformed nearly every asset class past year vaneck vaneck expects bitcoins longterm bull market continue miner struggling,-0.0772,-0.075,-0.0761
RSS,https://cointelegraph.com/rss,2024-09-20 18:42:14+01:00,2024-09-21 00:48:11.134365,price analysis 920 btc eth bnb sol xrp doge ton ada avax shib bitcoin faced selling near 64000 buyer managed keep price shortterm holder realized price near 62000 positive sign,0.5574,0.14242424242424243,0.34991212121212123
RSS,https://cointelegraph.com/rss,2024-09-20 18:30:00+01:00,2024-09-21 00:48:11.134365,iggy azalea unveils new online casino motherland australian rapper iggy azalea unveiled motherland casino solana breakpoint singapore new casino set go live november,0.0,0.10227272727272727,0.05113636363636363
RSS,https://cointelegraph.com/rss,2024-09-20 17:56:59+01:00,2024-09-21 00:48:11.134365,bitcoin hit 200k end 2025 regardless election bank exec 2024 election projected tight race granular local level shouldnt matter longterm price btc,-0.0191,-0.08928571428571429,-0.05419285714285714
RSS,https://cointelegraph.com/rss,2024-09-20 17:40:27+01:00,2024-09-21 00:48:11.134365,elon musk start comply brazilian court order suspends account x least 11 account linked spread misinformation brazil banned x past day platform begin complying supreme court order,-0.1779,-0.275,-0.22645
RSS,https://cointelegraph.com/rss,2024-09-20 16:14:40+01:00,2024-09-21 00:48:11.134365,bitcoin trader agree 65k key btc price resistance beat btc price prediction see consolidation bitcoin bull tackle major resistance hurdle,0.3612,0.03125,0.196225
RSS,https://cointelegraph.com/rss,2024-09-20 15:00:00+01:00,2024-09-21 00:48:11.134365,crypto adoption still stunted lack technical literacy confusion around crypto storage regulation factor techsavvy people take granted could keeping average user sideline away technology,-0.3612,-0.075,-0.21810000000000002
RSS,https://cointelegraph.com/rss,2024-09-20 14:30:00+01:00,2024-09-21 00:48:11.134365,bhutan 750m revenue bitcoin mining set model developing nation bhutan experience mining bitcoin could serve powerful example developing nation seek improve economy,0.6908,0.3,0.49539999999999995
RSS,https://cointelegraph.com/rss,2024-09-20 13:43:47+01:00,2024-09-21 00:48:11.134365,hashgraph association explore digital asset use case qatar stakeholder hashgraph association explore digital asset use case equity real estate tokenization stakeholder qatar,0.6124,0.06666666666666667,0.33953333333333335
RSS,https://cointelegraph.com/rss,2024-09-20 13:40:36+01:00,2024-09-21 00:48:11.134365,microstrategy raise 101b bitcoin acquisition microstrategy completed 101 billion convertible note offering allocating proceeds bitcoin purchase debt repayment,-0.3612,0.0,-0.1806
RSS,https://cointelegraph.com/rss,2024-09-20 13:30:52+01:00,2024-09-21 00:48:11.134365,aethir partner filecoin solve gpu shortage boost ai aethir filecoins partnership integrates gpu leasing service decentralized storage advancing ai web3 infrastructure,0.3612,0.0,0.1806
RSS,https://cointelegraph.com/rss,2024-09-20 13:25:51+01:00,2024-09-21 00:48:11.134365,bull cycle spark seemingly rational reason compromise security ledger exec ian rogers ledger stress importance selfcustody warns complacency crypto market boom,0.3818,0.0,0.1909
RSS,https://cointelegraph.com/rss,2024-09-20 12:35:58+01:00,2024-09-21 00:48:11.134365,asi alliance quite far openai hardware singularitynet ceo asi alliance enable mass adoption decentralized network way world jumped chatgpt singularitynet ceo belief,0.0,0.1,0.05
RSS,https://cointelegraph.com/rss,2024-09-20 12:28:27+01:00,2024-09-21 00:48:11.134365,ethereum eth price today ether current weekly rally 11 largest gain q3 year breaking key trendline suggesting bullish trend shift,0.5267,0.0,0.26335
RSS,https://cointelegraph.com/rss,2024-09-20 10:58:57+01:00,2024-09-21 00:48:11.134365,pancakeswap plan v4 update following 836b trading volume milestone pancakeswap announces v4 update improve liquidity provision interoperability scalability aiming resolve amm shortcoming,0.6705,0.0,0.33525
RSS,https://cointelegraph.com/rss,2024-09-20 10:20:57+01:00,2024-09-21 00:48:11.134365,bitcoin miner wallet awaken 15 year satoshi five miner wallet received block reward week bitcoin launched started moving coin,0.3182,0.0,0.1591
RSS,https://bitcoinmagazine.com/.rss/full/,2024-09-20 21:42:07+00:00,2024-09-21 00:48:11.134365,sec approves option trading blackrocks spot bitcoin etf ibitthe sec approved listing trading option blackrocks ishares bitcoin trust marking significant milestone bitcoin integration traditional finance,0.8625,0.04375,0.453125
RSS,https://bitcoinmagazine.com/.rss/full/,2024-09-20 16:30:47+00:00,2024-09-21 00:48:11.134365,bitcoin react u electioncan historical election trend predict bitcoins next move,0.0,0.0,0.0
RSS,https://bitcoinmagazine.com/.rss/full/,2024-09-20 14:52:09+00:00,2024-09-21 00:48:11.134365,microstrategy buy additional 489 billion worth bitcoinmicrostrategy purchased additional 489 million bitcoin swelling corporate bitcoin treasury 252000 btc worth nearly 10 billion company bitcoin strategy aim boost return hedge inflation,0.743,0.175,0.45899999999999996
RSS,https://bitcoinmagazine.com/.rss/full/,2024-09-20 14:10:48+00:00,2024-09-21 00:48:11.134365,santa monica bitcoin office case study presented cmrta annual conferenceproof workforce santa monicas vice mayor present case study city innovative bitcoin office cmrta annual conference office first kind u aim educate bitcoin support economic recovery,0.8402,0.31,0.5751
RSS,https://bitcoinmagazine.com/.rss/full/,2024-09-20 09:20:12+00:00,2024-09-21 00:48:11.134365,satoshi era wallet moved 16 million worth bitcoinaround 250 btc bitcoins early day transferred 15 year inactivity revealing huge reward reaped early miner 16 million worth satoshi era coin highlight conviction pioneering hodlers,0.8807,0.24,0.56035
RSS,https://bitcoinmagazine.com/.rss/full/,2024-09-19 22:44:29+00:00,2024-09-21 00:48:11.134365,bipartisan consensus emerges final day america love crypto tourcoinbase ceo brian armstrong congressman wiley nickel dnc emphasized need united state decisively lead crypto policy bipartisan manner,0.7906,0.25,0.5203
RSS,https://bitcoinmagazine.com/.rss/full/,2024-09-19 20:26:27+00:00,2024-09-21 00:48:11.134365,hut 8 bitmain launch nextgeneration asic bitcoin miner liquidtochip coolingthese mining giant join force release u3s21exph nextgeneration asic miner featuring advanced liquidtochip cooling technology,0.4939,0.2,0.34695
RSS,https://bitcoinmagazine.com/.rss/full/,2024-09-19 16:01:04+00:00,2024-09-21 00:48:11.134365,celebrating 10 year hardware wallet revolutiona look back start hardware wallet bitcoin space,0.5719,0.0,0.28595
RSS,https://bitcoinmagazine.com/.rss/full/,2024-09-19 12:22:17+00:00,2024-09-21 00:48:11.134365,germany commerzbank dz bank offer bitcoin crypto tradinggermanys two large bank commerzbank dz bank launching bitcoin crypto trading service amid growing demand,0.0516,0.21428571428571427,0.13294285714285714
RSS,https://bitcoinmagazine.com/.rss/full/,2024-09-18 22:59:20+00:00,2024-09-21 00:48:11.134365,donald trump make historic bitcoin payment pubkeyformer u president republican presidential nominee donald trump becomes first u president publicly transact bitcoin,0.0,0.08333333333333333,0.041666666666666664
RSS,https://bitcoinmagazine.com/.rss/full/,2024-09-18 22:30:01+00:00,2024-09-21 00:48:11.134365,louisiana state government accepts bitcoin lightning paymentlouisiana become one first u state accept bitcoin government payment offering resident flexible option transaction,0.7003,0.25,0.47515
RSS,https://bitcoinmagazine.com/.rss/full/,2024-09-18 19:58:31+00:00,2024-09-21 00:48:11.134365,fractal bitcoin misleading affinitya quick look socalled sidechain fractal bitcoin,-0.4019,0.3333333333333333,-0.03428333333333333
RSS,https://bitcoinmagazine.com/.rss/full/,2024-09-18 18:29:12+00:00,2024-09-21 00:48:11.134365,federal reserve cut interest rate 50 basis point address economic uncertaintythe federal reserve lowered interest rate 50 basis point today marking first significant cut four year,0.4767,0.27499999999999997,0.37585
RSS,https://bitcoinmagazine.com/.rss/full/,2024-09-18 14:05:22+00:00,2024-09-21 00:48:11.134365,picklebit proof workforce fold pickle pop partner pickleball tournament offer bitcoin prize poolthe tournament held santa monica peer pier bitcoin festival feature semipro amateur division awarding 5000 prize pool paid bitcoin,0.9136,-0.25,0.3318
RSS,https://bitcoinmagazine.com/.rss/full/,2024-09-18 14:05:06+00:00,2024-09-21 00:48:11.134365,river secures 800 million worth bitcoin launch proof reserveriver launched transparency tool proving hold 800 million worth bitcoin full reserve custody u exchange aim rebuild trust failure like ftx new river proof reserve,0.7964,0.15393939393939393,0.47516969696969696
RSS,https://bitcoinmagazine.com/.rss/full/,2024-09-18 10:34:49+00:00,2024-09-21 00:48:11.134365,blackrock release new report bitcoin unique diversifierblackrock released new report explaining bitcoin unique portfolio diversifier detached asset world largest asset manager continues embracing bitcoin adoption gain mainstream acceptance,0.872,0.2556818181818182,0.5638409090909091
RSS,https://bitcoinmagazine.com/.rss/full/,2024-09-17 22:59:22+00:00,2024-09-21 00:48:11.134365,samourai developer appear together court first time status conferencedefense attorney keonne rodriguez william lonergan hill continue argue developer didnt operate money transmitting business samourai rodriguez request modification bail condition,-0.34,0.25,-0.04500000000000001
RSS,https://bitcoinmagazine.com/.rss/full/,2024-09-17 16:34:57+00:00,2024-09-21 00:48:11.134365,key battleground state pennsylvania host day five america love crypto tourresidents pennsylvania key u swing state upcoming u presidential election come support probitcoin procrypto future united state,0.7906,0.125,0.4578
RSS,https://bitcoinmagazine.com/.rss/full/,2024-09-17 16:21:53+00:00,2024-09-21 00:48:11.134365,regulating bitcoin crypto nigeria crossroad capital control financial freedoma call sensible measured bitcoin regulation nigerian government,0.0,0.0,0.0
RSS,https://bitcoinmagazine.com/.rss/full/,2024-09-17 14:00:00+00:00,2024-09-21 00:48:11.134365,human right foundation grant 10 bitcoin 20 project worldwidethe human right foundation announced latest round grant totaling 1 billion satoshis worth 590000,0.7096,0.1673469387755102,0.4384734693877551
RSS,https://bitcoinmagazine.com/.rss/full/,2024-09-17 13:37:36+00:00,2024-09-21 00:48:11.134365,bitcoins future payment overcoming stablecoin dominance fiatless fiat bitcoin stable channel supported lightning network could introduce novel peertopeer payment infrastructure rival stablecoins,0.765,0.0,0.3825
RSS,https://bitcoinmagazine.com/.rss/full/,2024-09-17 11:58:05+00:00,2024-09-21 00:48:11.134365,singapore db bank launch bitcoin crypto option institutionssingapores largest bank db begin offering otc bitcoin crypto option trading institutional client q4 2024 db first major asian bank providing sophisticated bitcoin derivative amid rising allocation demand,0.4767,0.203125,0.3399125
RSS,https://bitcoinmagazine.com/.rss/full/,2024-09-17 11:35:43+00:00,2024-09-21 00:48:11.134365,arthur hayes family office fund bitcoin core developerarthur hayes family office maelstrom awarded first grant bitcoin developer program contributor rkrux funding support rkrux working fulltime contributing bitcoin core open source project,0.7845,0.125,0.45475
RSS,https://bitcoinmagazine.com/.rss/full/,2024-09-16 21:03:54+00:00,2024-09-21 00:48:11.134365,microstrategy announces 700 million raise redeem senior secured note buy bitcoinmicrostrategy use net proceeds offering redeem senior secured note due 2028 acquire additional bitcoin,0.6597,-0.0625,0.2986
RSS,https://bitcoinmagazine.com/.rss/full/,2024-09-16 19:40:50+00:00,2024-09-21 00:48:11.134365,financial anarchist manifestousing technology like nostr chaumian ecash financial anarchist challenge status quo aiming reclaim economic sovereignty disrupt centralized financial power bitcoin,0.4215,0.05,0.23575
RSS,https://bitcoinmagazine.com/.rss/full/,2024-09-16 19:14:18+00:00,2024-09-21 00:48:11.134365,bitcoin crypto voter make voice heard america love crypto stop wisconsinwisconsin ready move past partisanship unifying force bitcoin crypto ahead 2024 election,0.6705,0.15,0.41025
RSS,https://bitcoinmagazine.com/.rss/full/,2024-09-16 16:42:08+00:00,2024-09-21 00:48:11.134365,bhutan bitcoin holding revealed kingdom owns 780m btc miningbhutans growing bitcoin empire revealed 780 million btc acquired extensive mining operation powered nation renewable energy resource,0.4215,0.0,0.21075
RSS,https://bitcoinmagazine.com/.rss/full/,2024-09-16 16:21:17+00:00,2024-09-21 00:48:11.134365,urgent need bitcoin tax reform encourage everyday usean argument tax treatment bitcoin massive disincentive use commerce,0.3818,-0.1,0.14089999999999997
RSS,https://bitcoinmagazine.com/.rss/full/,2024-09-16 14:00:08+00:00,2024-09-21 00:48:11.134365,mi primer bitcoin promotes two staff member leadership rolesthe opensource bitcoin education platform founded el salvador move two member inhouse talent one native salvadoran supervisory position,0.6369,0.0,0.31845
RSS,https://bitcoinmagazine.com/.rss/full/,2024-09-16 13:26:09+00:00,2024-09-21 00:48:11.134365,bitcoin mining shutdown cause 20 surge electricity billsthe shutdown bitcoin mining facility norway caused 20 increase electricity bill town resident loss mining operation revenue forced local power company raise rate offset cost,-0.4588,-0.15000000000000002,-0.3044
RSS,https://bitcoinmagazine.com/.rss/full/,2024-09-13 20:20:40+00:00,2024-09-21 00:48:11.134365,detroit aim drive digital asset innovation day three america love crypto tourthe motor city state michigan see opportunity creating businessfriendly environment bitcoin crypto industry welcoming stand crypto alliance,0.9451,0.25,0.59755
RSS,https://bitcoinmagazine.com/.rss/full/,2024-09-13 20:09:00+00:00,2024-09-21 00:48:11.134365,bitcoin surge 60000 market brace potential fed rate cutbitcoin touch 60000 ahead potential interest rate cut federal reserve signaling market optimism amid falling reported inflation data,0.5859,0.0,0.29295
RSS,https://bitcoinmagazine.com/.rss/full/,2024-09-13 17:30:36+00:00,2024-09-21 00:48:11.134365,bitcoin price action expect next bitcoins path forward insight price target support resistance zone,0.4019,0.05,0.22594999999999998
RSS,https://bitcoinmagazine.com/.rss/full/,2024-09-13 13:02:18+00:00,2024-09-21 00:48:11.134365,microstrategy buy additional 111 billion worth bitcoinmicrostrategy purchased additional 18300 bitcoins 111 billion boosting total bitcoin trove 244800 btc acquired 945 billion company continues bitcoin accumulation strategy capitalizing btc appreciation,0.765,0.15,0.4575
RSS,https://bitcoinmagazine.com/.rss/full/,2024-09-13 10:28:54+00:00,2024-09-21 00:48:11.134365,bitcoin crypto exchange htx integrate lightning networkone leading bitcoin crypto exchange htx announced integration bitcoins lightning network enable faster cheaper payment,0.0,0.0,0.0
RSS,https://bitcoinmagazine.com/.rss/full/,2024-09-12 15:49:09+00:00,2024-09-21 00:48:11.134365,trump election victory could send bitcoin 125000 say standard chartered analysta trump win could fuel bitcoin rally though new alltime high expected regardless 2024 election outcome,0.5859,0.1992727272727273,0.3925863636363636
RSS,https://bitcoinmagazine.com/.rss/full/,2024-09-12 13:00:00+00:00,2024-09-21 00:48:11.134365,revolutionizing bitcoin mining power threephase systemswhy threephase electrical system offer competitive advantage miner asic efficiency gain tapering,0.8225,0.0,0.41125
RSS,https://bitcoinmagazine.com/.rss/full/,2024-09-11 18:40:01+00:00,2024-09-21 00:48:11.134365,bitcoin vault future bitcoin custodyas bitcoin grows value popularity custody solution become critical learn bitcoin vault importance custody space,0.7906,0.0,0.3953
RSS,https://bitcoinmagazine.com/.rss/full/,2024-09-11 17:06:05+00:00,2024-09-21 00:48:11.134365,uk parliament introduces bill recognize bitcoin crypto personal propertythe new legislation aim provide legal clarity protection bitcoin digital asset owner,0.6908,0.08409090909090909,0.38744545454545454
RSS,https://bitcoinmagazine.com/.rss/full/,2024-09-11 15:31:02+00:00,2024-09-21 00:48:11.134365,el salvador bitcoin office celebrates 21 month success set stage renaissance 20the national bitcoin office onbtc office president el salvador led stacy herbert aim help integrate bitcoin el salvador economy foster cultural artistic psychological renaissance,0.8779,0.18333333333333335,0.5306166666666667
RSS,https://bitcoinmagazine.com/.rss/full/,2024-09-11 13:00:00+00:00,2024-09-21 00:48:11.134365,early bitcoin developer back satoshi nakamoto theorya bitcoin developer 2010 gone public support theory project anonymous founder,0.4019,0.03333333333333333,0.21761666666666665
RSS,https://bitcoinmagazine.com/.rss/full/,2024-09-11 12:14:47+00:00,2024-09-21 00:48:11.134365,bitcoin mining difficulty hit record 92 trillionthe bitcoin mining difficulty hit record high 9267 trillion september 11 displaying intensifying competition network rise indicates greater security surging collective computing power dedicated mining bitcoin,0.4767,0.33,0.40335
RSS,https://bitcoinmagazine.com/.rss/full/,2024-09-10 21:23:09+00:00,2024-09-21 00:48:11.134365,standard chartered bank launch bitcoin crypto custody service uaethe international banking group granted licence dubai financial service authority allowing custody client digital asset,0.5859,0.0,0.29295
RSS,https://bitcoinmagazine.com/.rss/full/,2024-09-10 17:59:33+00:00,2024-09-21 00:48:11.134365,un ode de lprovocateur du bitcoina poem written loosely haiku style enza coin,0.0,-0.07692307692307693,-0.038461538461538464
RSS,https://bitcoinmagazine.com/.rss/full/,2024-09-10 09:40:25+00:00,2024-09-21 00:48:11.134365,metaplanet buy additional 300 million worth bitcoinpubliclylisted metaplanet purchased additional 300 million 22m bitcoin bringing total holding 3988 btc bought 375 billion 276m,0.2263,0.15,0.18814999999999998
RSS,https://bitcoinmagazine.com/.rss/full/,2024-09-09 21:47:47+00:00,2024-09-21 00:48:11.134365,give timeon bitcoin saturn synchronicity privacy issue,0.0,0.0,0.0
RSS,https://bitcoinmagazine.com/.rss/full/,2024-09-09 17:00:00+00:00,2024-09-21 00:48:11.134365,introducing bitcoin report new monthly digest bitcoin magazine probitcoin magazine pro launch bitcoin report monthly digest offering key insight bitcoin trend onchain analysis price forecast mustread investor inaugural august edition free download,0.5106,0.1787878787878788,0.34469393939393944
RSS,https://bitcoinmagazine.com/.rss/full/,2024-09-09 16:13:00+00:00,2024-09-21 00:48:11.134365,bitcoin rollups rock hard placea look scalability limit rollups choice making decision regarding maximizing,-0.1027,-0.2916666666666667,-0.19718333333333335
RSS,https://bitcoinmagazine.com/.rss/full/,2024-09-09 13:00:00+00:00,2024-09-21 00:48:11.134365,proof workforce career government partner integrate bitcoin public sector jobsproof workforce foundation career government teamed integrate bitcoin public sector employment practice revolutionizing compensation financial literacy,0.0,0.0,0.0
RSS,https://bitcoinmagazine.com/.rss/full/,2024-09-09 12:00:28+00:00,2024-09-21 00:48:11.134365,australian bitcoin etf implement proof reserve hosekiaustralias monochrome bitcoin etf partnering hoseki implement proofofreserves becoming first australian spot bitcoin etf provide daily verification holding,0.0,0.13999999999999999,0.06999999999999999
RSS,https://bitcoinist.com/feed/,2024-09-20 23:30:47+00:00,2024-09-21 00:48:11.134365,dogecoin bullish breakout 024 analyst reveals key level watchvarious analyst think popular doggythemed meme coin dogecoin doge showing incredibly bullish sign market cycle despite witnessing severe decline past month particular analyst predicted massive bullish breakout 024 providing chart representation illustrating price doge expected rise gradually,0.6103,0.1880952380952381,0.399197619047619
RSS,https://bitcoinist.com/feed/,2024-09-20 22:00:58+00:00,2024-09-21 00:48:11.134365,43 million gone bingx crypto exchange fall victim major hacka serious security breach hit singaporean bitcoin exchange bingx exchange hot wallet lost almost 43 million friday due hacker activity one biggest crypto attack year event raise doubt centralized exchange security policy related reading vitalik buterin drop rhythm singapore token2049 speech delivered song bingx hack,-0.766,-0.03680555555555556,-0.4014027777777778
RSS,https://bitcoinist.com/feed/,2024-09-20 20:30:07+00:00,2024-09-21 00:48:11.134365,bitcoin metric show market equilibrium entry opportunity sign stagnationbitcoin surged 11 since tuesday following federal reserve announcement 50 bps interest rate cut significant price movement pushed btc past 62000 mark psychological level shifted investor sentiment toward optimism however despite recent rally critical data glassnode reveals bitcoin capital inflow outflow remain,0.8739,0.020833333333333332,0.4473666666666667
RSS,https://bitcoinist.com/feed/,2024-09-20 20:04:00+00:00,2024-09-21 00:48:11.134365,bny mellon cleared bitcoin custody institutional crypto servicesin significant development bitcoin btc broader crypto market traditional banking industry bny mellon identified first bank receive exemption security exchange commission sec staff accounting bulletin sab 121 unchained first reported announcement wyoming select committee blockchain financial technology digital,0.5574,0.11071428571428572,0.3340571428571429
