MainSource,Source,Publication Date,Pull_date,Pre-Processed Text,Sentiment_Vader,Sentiment_TextBlob,Average_Sentiment
RSS,https://cointelegraph.com/rss,2025-01-06 20:43:25+00:00,2025-01-07 00:53:29.122107,number kwons victim could exceed one million court filing terraform lab cofounder u custody pleading guilty nine felony charge related fraud platform,-0.8979,-0.19166666666666665,-0.5447833333333334
RSS,https://cointelegraph.com/rss,2025-01-06 20:25:47+00:00,2025-01-07 00:53:29.122107,here happened crypto today need know happened crypto today latest news daily trend event impacting bitcoin price blockchain defi nfts web3 crypto regulation,0.0,0.25,0.125
RSS,https://cointelegraph.com/rss,2025-01-06 19:34:21+00:00,2025-01-07 00:53:29.122107,solana 24hour dex volume beat ethereum base combined layer1 network clocked nearly 38 billion trading volume past 24 hour according defillama,0.0,-0.3166666666666667,-0.15833333333333335
RSS,https://cointelegraph.com/rss,2025-01-06 19:27:35+00:00,2025-01-07 00:53:29.122107,cleansparks bitcoin stash climb 9952 btc hashrate grows nasdaqlisted bitcoin mining company one world largest corporate btc holder,0.0,0.0,0.0
RSS,https://cointelegraph.com/rss,2025-01-06 19:18:21+00:00,2025-01-07 00:53:29.122107,gemini agrees 5m penalty part proposed cftc order proposed consent order approved judge could allow gemini trust avoid jan 21 civil trial cftc alleged false misleading statement,0.4215,-0.25000000000000006,0.08574999999999997
RSS,https://cointelegraph.com/rss,2025-01-06 19:00:20+00:00,2025-01-07 00:53:29.122107,kwon u custody south korean president impeached law decoded kwon terraform lab cofounder extradited u montenegro bypassing south korea petition,0.0,0.0,0.0
RSS,https://cointelegraph.com/rss,2025-01-06 18:30:00+00:00,2025-01-07 00:53:29.122107,bitcoin trader target 138k btc price coinbase premium hit breakeven point return bitcoin coinbase premium could sign btc price path 138000,0.0,0.0,0.0
RSS,https://cointelegraph.com/rss,2025-01-06 17:30:33+00:00,2025-01-07 00:53:29.122107,price analysis 106 spx dxy btc eth xrp bnb sol doge ada avax sustained buying institutional investor pushed bitcoin 100000 opening door retest alltime high,0.0,0.16,0.08
RSS,https://cointelegraph.com/rss,2025-01-06 16:58:43+00:00,2025-01-07 00:53:29.122107,bitcoin debasement trade stay jpmorgan investor boosting bitcoin allocation hedge geopolitical uncertainty bank said,0.0,0.0,0.0
RSS,https://cointelegraph.com/rss,2025-01-06 16:05:59+00:00,2025-01-07 00:53:29.122107,crypto bull market entering final stage cryptoquant digital asset price may still see substantial gain market corrects analyst said,0.7717,0.0,0.38585
RSS,https://cointelegraph.com/rss,2025-01-06 15:39:44+00:00,2025-01-07 00:53:29.122107,polymarket user bet canadian pm resigning official announcement canadian prime minister justin trudeau announced resignation jan 6 press conference,-0.4767,0.0,-0.23835
RSS,https://cointelegraph.com/rss,2025-01-06 15:27:03+00:00,2025-01-07 00:53:29.122107,btc price top 101k microstrategy make first bitcoin buy 2025 bitcoin waste time wall street open daily btc price gain pas 3 reclaiming 100000 mark,0.34,0.11000000000000001,0.22500000000000003
RSS,https://cointelegraph.com/rss,2025-01-06 15:00:00+00:00,2025-01-07 00:53:29.122107,binance shefi frontier feminine growing influence woman web3 leading crypto exchange creating inclusive community reshaping industry,0.4404,0.0,0.2202
RSS,https://cointelegraph.com/rss,2025-01-06 13:49:42+00:00,2025-01-07 00:53:29.122107,gsr secures uk fca approval expands regulated crypto service gsr secured dual regulatory approval uk singapore expanding crypto trading service institutional client,0.891,0.0,0.4455
RSS,https://cointelegraph.com/rss,2025-01-06 13:31:35+00:00,2025-01-07 00:53:29.122107,microstrategy kick 2025 1070 bitcoin purchase announcement microstrategy began 2025 announcing fresh btc purchase made last two day 2024,0.3182,0.15,0.23409999999999997
RSS,https://cointelegraph.com/rss,2025-01-06 13:22:08+00:00,2025-01-07 00:53:29.122107,trader turn 2k 32m 10 hour metaverse token savvy trader made 1500fold return investment despite broader crypto market slump,0.0,0.0,0.0
RSS,https://cointelegraph.com/rss,2025-01-06 12:55:03+00:00,2025-01-07 00:53:29.122107,crypto etps start 2025 585m inflow coinshares u spot bitcoin etf contributed 100 recordbreaking 442 billion crypto etf inflow 2024 according coinshares,0.0,0.0,0.0
RSS,https://cointelegraph.com/rss,2025-01-06 12:13:14+00:00,2025-01-07 00:53:29.122107,mica attract crypto investment despite overregulation concern european retail investor likely feel biggest effect mica regulation stringent data collection potential introduction crypto taxation law,0.3612,0.0,0.1806
RSS,https://cointelegraph.com/rss,2025-01-06 12:10:52+00:00,2025-01-07 00:53:29.122107,xrp price chart 039bull flag039 target 15 amid increasing open interest xrps price action form classic bullish continuation structure profit target around 15,0.7096,0.08888888888888889,0.39924444444444446
RSS,https://cointelegraph.com/rss,2025-01-06 10:17:39+00:00,2025-01-07 00:53:29.122107,tether usdts market cap drop linked seasonal holiday lull usdt trading fallen 100 billion since middecember may premature turn bearish according matrixport,-0.2263,0.0,-0.11315
RSS,https://cointelegraph.com/rss,2025-01-06 09:58:40+00:00,2025-01-07 00:53:29.122107,global crackdown target crypto scam ai deepfake fraud vietnamese police arrest crypto mining scammer springfield warns atm fraud hong kong bust airelated scam,-0.9571,-0.025,-0.49105
RSS,https://cointelegraph.com/rss,2025-01-06 09:30:32+00:00,2025-01-07 00:53:29.122107,back 76k 2025 5 thing know bitcoin week btc price expectation diverge bitcoin bull eye charge 100000 mark end holiday period,0.4019,0.0,0.20095
RSS,https://cointelegraph.com/rss,2025-01-06 09:25:08+00:00,2025-01-07 00:53:29.122107,bitcoin price today bitcoin price today microstrategy metaplanet announced plan raise billion increase btc reserve 2025,0.3182,0.0,0.1591
RSS,https://cointelegraph.com/rss,2025-01-06 08:57:55+00:00,2025-01-07 00:53:29.122107,crypto market today crypto market today amid increasing optimism cryptofriendly regulatory environment ahead u presidentelect donald trump inauguration,0.5423,0.0,0.27115
RSS,https://cointelegraph.com/rss,2025-01-06 05:52:21+00:00,2025-01-07 00:53:29.122107,korea jeju issue nft tourist card boost gen z visitor report south korea jeju island selfgoverning tourist hotspot reportedly trial nft tourist card bid attract country younger generation,0.6369,0.0,0.31845
RSS,https://cointelegraph.com/rss,2025-01-06 05:22:07+00:00,2025-01-07 00:53:29.122107,sam altman expects first ai worker year openai closer agi confident know build agi traditionally understood said openai bos sam altman,0.4939,0.25,0.37195
RSS,https://cointelegraph.com/rss,2025-01-06 03:59:00+00:00,2025-01-07 00:53:29.122107,ai tokenization usher new longtail capital market 2025 bitwise deregulation realworld asset tokenization ai could accelerate crypto 2025 according hunter horsley,0.3612,0.13636363636363635,0.2487818181818182
RSS,https://cointelegraph.com/rss,2025-01-06 03:20:22+00:00,2025-01-07 00:53:29.122107,bitcoin trump rally could wane ahead endjan fomc meeting 10x research 10x research founder markus thielen said federal reserve decision remain bitcoins primary risk slowing another price surge,-0.2732,0.4,0.06340000000000001
RSS,https://cointelegraph.com/rss,2025-01-06 02:57:10+00:00,2025-01-07 00:53:29.122107,vitalik buterin suggests ai hardware pause humanity safety buterin said last resort slow dangerous form superintelligent ai would restrict available global computing power year two,-0.4404,-0.1,-0.2702
RSS,https://cointelegraph.com/rss,2025-01-06 01:30:11+00:00,2025-01-07 00:53:29.122107,pubg creator even thinking nfts upcoming metaverse report brendan greene creator pubg said upcoming metaverse may integrate blockchain technology doesnt plan nfts,0.0,0.0,0.0
RSS,https://bitcoinmagazine.com/.rss/full/,2025-01-06 18:45:12+00:00,2025-01-07 00:53:29.122107,anchor evil bitcoin core destroying bitcoincriticism bitcoin core developer hitting new high absurdity illogical foundation around ridiculousness,-0.8779,-0.22590909090909086,-0.5519045454545455
RSS,https://bitcoinmagazine.com/.rss/full/,2025-01-06 17:11:57+00:00,2025-01-07 00:53:29.122107,canada elect next bitcoin world leadercanadas prime minster resigned paving way conservative party probitcoin leader replace,0.1779,0.4,0.28895000000000004
RSS,https://bitcoinmagazine.com/.rss/full/,2025-01-06 14:44:57+00:00,2025-01-07 00:53:29.122107,new pi cycle top prediction chart identifies bitcoin price market peak precisiondiscover newly launched pi cycle top prediction chart cuttingedge tool designed help professional investor anticipate bitcoins market cycle peak manage risk effectively,0.765,0.3287878787878788,0.5468939393939394
RSS,https://bitcoinmagazine.com/.rss/full/,2025-01-03 19:58:22+00:00,2025-01-07 00:53:29.122107,michael saylors trump meeting turbo bullish bitcointhe u finally active probitcoin administration coming office,0.4019,-0.13333333333333333,0.1342833333333333
RSS,https://bitcoinmagazine.com/.rss/full/,2025-01-03 18:34:50+00:00,2025-01-07 00:53:29.122107,birthday letter bitcoina letter bitcoin lesson impetuous teenager take heed teenage year,0.0,0.0,0.0
RSS,https://bitcoinmagazine.com/.rss/full/,2025-01-03 13:50:00+00:00,2025-01-07 00:53:29.122107,2025 bitcoin outlook insight backed metric market dataexplore bitcoins 2025 potential datadriven perspective analyzing key metric like mvrv zscore pi cycle oscillator macroeconomic trend uncover insight year ahead,0.3818,0.0,0.1909
RSS,https://bitcoinmagazine.com/.rss/full/,2025-01-02 22:17:57+00:00,2025-01-07 00:53:29.122107,1 million seed capital awarded defi hedge fund boreal bitcoin alpha competition winnersamara asset management bitcoin magazine pro selected boreal winner secondever bitcoin alpha competition,0.8126,0.0,0.4063
RSS,https://bitcoinmagazine.com/.rss/full/,2025-01-02 21:39:36+00:00,2025-01-07 00:53:29.122107,owning 1 bitcoin better millionaire think millionaire exclusive let explain owning 1 bitcoin might real wealth symbol future,0.765,0.2333333333333333,0.49916666666666665
RSS,https://bitcoinmagazine.com/.rss/full/,2025-01-02 16:05:44+00:00,2025-01-07 00:53:29.122107,woman bitcoin cointelegraph forgotwomen based europe u excellent work bitcoin space cointelegraph pointed woman africa latin america southeast asia middle east,0.5719,0.5,0.5359499999999999
RSS,https://bitcoinmagazine.com/.rss/full/,2025-01-01 18:33:27+00:00,2025-01-07 00:53:29.122107,bitcoin fiatbitcoin digital commodity decentralized digital fiat currency,0.0,0.0,0.0
RSS,https://bitcoinmagazine.com/.rss/full/,2025-01-01 17:29:37+00:00,2025-01-07 00:53:29.122107,recounting ethiopia bitcoin development 2024reviewing development 2024 ethiopian electric power eep 25 privately owned bitcoin miner ethiopia contribute 600 mw energy bitcoin network,0.2732,0.0,0.1366
RSS,https://bitcoinmagazine.com/.rss/full/,2024-12-31 19:25:04+00:00,2025-01-07 00:53:29.122107,neobank yopaki aim make every mexican bitcoinerfrancisco chavarria yopakis cofounder ceo belief educating yopakis user bitcoin incorporating favorite mexican pastime app team poised make mexico nation bitcoin enthusiast,0.7579,0.16666666666666666,0.4622833333333333
RSS,https://bitcoinmagazine.com/.rss/full/,2024-12-31 16:58:18+00:00,2025-01-07 00:53:29.122107,watch michael saylors bitcoin 100k partyjoin bitcoin magazine news desk live michael saylors 100k nye bitcoin party miami,0.4019,0.13636363636363635,0.2691318181818182
RSS,https://bitcoinmagazine.com/.rss/full/,2024-12-30 19:41:00+00:00,2025-01-07 00:53:29.122107,capitulated started buying mstrbitcoin changing way public company bolster finance mstr leading way,0.0,0.0,0.0
RSS,https://bitcoinmagazine.com/.rss/full/,2024-12-30 19:17:12+00:00,2025-01-07 00:53:29.122107,bitcoin use lose itwhy simply hodling bitcoin watching number go enough succeed,0.2023,0.0,0.10115
RSS,https://bitcoinmagazine.com/.rss/full/,2024-12-30 17:00:12+00:00,2025-01-07 00:53:29.122107,earn bitcoin providing liquidity via boltz proi look forward earning sat noncustodial manner helping boltz manage liquidity,0.296,0.0,0.148
RSS,https://bitcoinmagazine.com/.rss/full/,2024-12-30 16:20:14+00:00,2025-01-07 00:53:29.122107,progressive case strategic bitcoin reserve strengthening america social safety netprimarily endorsed bitcoin proponent gop politician trump here strategic bitcoin reserve could actually appeal progressive,0.7906,0.016666666666666666,0.40363333333333334
RSS,https://bitcoinmagazine.com/.rss/full/,2024-12-27 19:09:40+00:00,2025-01-07 00:53:29.122107,debt bitcoin return stateless money firstsome quick thought book debt first 5000 year david graeber nonaustrian view history money,-0.6124,0.29166666666666663,-0.1603666666666667
RSS,https://bitcoinmagazine.com/.rss/full/,2024-12-27 16:52:20+00:00,2025-01-07 00:53:29.122107,michael saylor doesnt understand bitcoin saylor convinced bitcoin capital currency would like see whole world adopt u dollar money instead,0.7096,0.2,0.4548
RSS,https://bitcoinmagazine.com/.rss/full/,2024-12-27 14:00:00+00:00,2025-01-07 00:53:29.122107,buy bitcoin bull market dipsbuying bitcoin bull market dip requires strategic approach avoid overpaying maximizing return,-0.296,0.0,-0.148
RSS,https://bitcoinmagazine.com/.rss/full/,2024-12-25 16:14:27+00:00,2025-01-07 00:53:29.122107,bitcoin christmascelebrate season festive bitcoin twist sixfigure high institutional fomo bitcoin christmas unwraps magic holiday hodlers thrive adoption soar santa sleigh get bullish upgrade,0.6908,0.33,0.5104
RSS,https://bitcoinmagazine.com/.rss/full/,2024-12-24 17:57:00+00:00,2025-01-07 00:53:29.122107,protect noncustodial bitcoin wallet support open dialogue foundationa new report open dialogue foundation detail whats coming pike regarding regulation around noncustodial bitcoin crypto wallet european union organization use help push back unfavorable proposal,0.7906,0.02727272727272727,0.4089363636363636
RSS,https://bitcoinmagazine.com/.rss/full/,2024-12-23 18:57:30+00:00,2025-01-07 00:53:29.122107,satoshi paper explores role state postbitcoin world interview natalie smolenskitheoretical anthropologist natalie smolenski discus latest work satoshi paper second booklength academic text bitcoin conceptualized contributed edited,0.0,0.16666666666666666,0.08333333333333333
RSS,https://bitcoinmagazine.com/.rss/full/,2024-12-21 19:38:26+00:00,2025-01-07 00:53:29.122107,blackrock cant change bitcoin worried blackrock might change bitcoins supply let explain thats possible,0.2235,0.0,0.11175
RSS,https://bitcoinmagazine.com/.rss/full/,2024-12-20 23:22:52+00:00,2025-01-07 00:53:29.122107,need inkind redemption spot bitcoin etfshopefully sec commissioner hester peirce isnt playing say shell reconsider inkind redemption spot bitcoin etf,-0.1511,-0.1,-0.12555
RSS,https://bitcoinmagazine.com/.rss/full/,2024-12-20 20:31:05+00:00,2025-01-07 00:53:29.122107,bought bitcoin 108000 dont panicwhile bitcoins volatility may seem intense correction healthy normal,0.4588,0.2833333333333333,0.37106666666666666
RSS,https://bitcoinmagazine.com/.rss/full/,2024-12-20 16:42:53+00:00,2025-01-07 00:53:29.122107,dont support strategic bitcoin reserve neither younic carter lay argument bitcoin strategic reserve,-0.5801,0.0,-0.29005
RSS,https://bitcoinmagazine.com/.rss/full/,2024-12-20 14:47:33+00:00,2025-01-07 00:53:29.122107,time admit 21 quadrillion bitcoinsim favor bip 21q clever way resolve known problem bitcoin denomination,0.7506,0.16666666666666666,0.45863333333333334
RSS,https://bitcoinmagazine.com/.rss/full/,2024-12-20 13:54:47+00:00,2025-01-07 00:53:29.122107,exploring six onchain indicator understand bitcoin market cycleexplore key bitcoin metric like puell multiple mvrv zscore understand cycle progress anticipate price peak prepare bitcoins potential path toward 200k,0.6486,0.0,0.3243
RSS,https://bitcoinmagazine.com/.rss/full/,2024-12-19 21:26:36+00:00,2025-01-07 00:53:29.122107,bitcoin investor 67000 average startbitcoin investor average average american yearly salary,0.0,-0.11249999999999999,-0.056249999999999994
RSS,https://bitcoinmagazine.com/.rss/full/,2024-12-19 20:26:21+00:00,2025-01-07 00:53:29.122107,foundation introduces passport prime bitcoin wallet data security devicefoundations new device allinone tool digital security,0.5859,0.06818181818181818,0.3270409090909091
RSS,https://bitcoinmagazine.com/.rss/full/,2024-12-19 19:42:53+00:00,2025-01-07 00:53:29.122107,bukele president el salvador bitcoina good leader first priority well people whim public gossip banter,0.5106,0.31666666666666665,0.41363333333333335
RSS,https://bitcoinmagazine.com/.rss/full/,2024-12-19 15:00:29+00:00,2025-01-07 00:53:29.122107,vancouver mayor share probitcoin vision mayor ken sim isnt paying lip service bitcoin supporter come probitcoin rhetoric proposal he true believer,0.7964,0.35,0.5731999999999999
RSS,https://bitcoinmagazine.com/.rss/full/,2024-12-19 14:24:33+00:00,2025-01-07 00:53:29.122107,dont fall bitcoin crash breather worried bitcoins pullback let explain dip nothing healthy pause bull run,-0.296,0.5,0.10200000000000001
RSS,https://bitcoinmagazine.com/.rss/full/,2024-12-19 14:18:59+00:00,2025-01-07 00:53:29.122107,imf improved el salvador bitcoin lawin return loan deal imf el salvador give probitcoin policy made bitcoin law better,0.7184,0.5,0.6092
RSS,https://bitcoinmagazine.com/.rss/full/,2024-12-19 13:00:00+00:00,2025-01-07 00:53:29.122107,human right foundation donates 700000000 satoshis fund bitcoin development projectsthe hrf announces latest round bitcoin grant targeting key area latin america asia africa,0.3612,0.11714285714285713,0.2391714285714286
RSS,https://bitcoinmagazine.com/.rss/full/,2024-12-18 19:11:13+00:00,2025-01-07 00:53:29.122107,self custody theea counter argument attitude people never even consider self custody bitcoin,-0.3612,0.0,-0.1806
RSS,https://bitcoinmagazine.com/.rss/full/,2024-12-18 16:53:49+00:00,2025-01-07 00:53:29.122107,bitcoin puell multiple indicator workthe puell multiple powerful tool bitcoin investor analyzing miner revenue identify potential market top bottom here read itand signaling today,0.5574,0.16,0.3587
RSS,https://bitcoinmagazine.com/.rss/full/,2024-12-18 16:43:41+00:00,2025-01-07 00:53:29.122107,blackrocks new bitcoin ad monumental paradigm shiftthe overton window officially shifted bitcoin going mainstream,0.0,0.13636363636363635,0.06818181818181818
RSS,https://bitcoinmagazine.com/.rss/full/,2024-12-18 14:03:52+00:00,2025-01-07 00:53:29.122107,nic carter wrong u strategic bitcoin reserveis adding bitcoin u reserve sign weakness strength let tell nic carter wrong,-0.7003,-0.5,-0.60015
RSS,https://bitcoinmagazine.com/.rss/full/,2024-12-18 13:04:46+00:00,2025-01-07 00:53:29.122107,youngest ever bitcoin core contributor get bitcoin scholarship17yearold ishaana misra awarded chaincode lab inaugural bitcoin scholarship making youngest ever contributor bitcoin core,0.4019,0.0,0.20095
RSS,https://bitcoinmagazine.com/.rss/full/,2024-12-17 22:15:21+00:00,2025-01-07 00:53:29.122107,china may verge ending bitcoin banis china secretly stacking bitcoin gearing unban let break think theyre make huge moveand sooner think,0.3182,-2.7755575615628914e-17,0.15909999999999996
RSS,https://bitcoinmagazine.com/.rss/full/,2024-12-17 20:00:34+00:00,2025-01-07 00:53:29.122107,unit denomination bitcoin need changea recent bip proposed change way unit bitcoin displayed proposal needed,0.0,0.0,0.0
RSS,https://bitcoinmagazine.com/.rss/full/,2024-12-17 17:24:23+00:00,2025-01-07 00:53:29.122107,gridless mining bitcoin fostering human flourishing africagridless cofounder janet maingi explains company bitcoin mining work helping electrify rural africa leading better quality life community gridless touch,0.6249,0.16666666666666666,0.3957833333333333
RSS,https://bitcoinmagazine.com/.rss/full/,2024-12-17 17:12:07+00:00,2025-01-07 00:53:29.122107,mathematically predicting bitcoin price bull cycle peak bitcoin magazine pro lead analyst matt crosby us mathematical analysis predict next bitcoin bull cycle peak forecasting potential peak price 256000 310000 august 24 2025,0.0,0.0,0.0
RSS,https://bitcoinmagazine.com/.rss/full/,2024-12-17 16:49:59+00:00,2025-01-07 00:53:29.122107,buying bitcoin easy hodling hard partwhile bitcoin boom bull market volatility provide intense reality check ask veteran investor american hodl,0.4215,0.06833333333333333,0.24491666666666667
RSS,https://bitcoinmagazine.com/.rss/full/,2024-12-17 16:25:37+00:00,2025-01-07 00:53:29.122107,bitcoin university investment yield greater financial freedoma look whether bitcoin university education wiser long term investment one financial freedom,0.836,0.1125,0.47425
RSS,https://bitcoinmagazine.com/.rss/full/,2024-12-16 18:57:49+00:00,2025-01-07 00:53:29.122107,bitcoin etf surpass 1 million btc 2025accelerating etf inflow dwindling exchange supply potential u strategic reserve setting stage unprecedented bitcoin scarcitymaking even 1 million price target suddenly plausible,0.0,0.3666666666666667,0.18333333333333335
RSS,https://bitcoinmagazine.com/.rss/full/,2024-12-16 18:46:35+00:00,2025-01-07 00:53:29.122107,last resort unfed covenant bitcoinjeremy rubin recently released proposal allow specialized oracle emulate covenant bitcoin softforks necessary secured bitvm based slashable bond,0.5574,0.0,0.2787
RSS,https://bitcoinmagazine.com/.rss/full/,2024-12-13 19:01:18+00:00,2025-01-07 00:53:29.122107,perianne boring predicts trump 2025 economic policy drive bitcoin price 800kin bold prediction fox business perianne boring ceo digital chamber asserted presidentelect donald trump economic policy could position u global leader bitcoin adoption potentially driving asset price unprecedented 800000 2025,0.128,-0.0740740740740741,0.026962962962962952
RSS,https://bitcoinist.com/feed/,2025-01-07 00:00:38+00:00,2025-01-07 00:53:29.122107,90 bitcoin supply profit could cycle mirror 2017 bull runbitcoin verge historic breakout consolidating highly anticipated 100k mark surging 8 since start year leading cryptocurrency captured attention investor analyst alike market remains cautiously optimistic eye btc confirmation next,0.6369,0.05333333333333334,0.3451166666666667
RSS,https://bitcoinist.com/feed/,2025-01-06 22:30:23+00:00,2025-01-07 00:53:29.122107,bitcoin adoption go big jan3 secures 5 million mow oversightjan3 join tech publicly listed company fully adopting bitcoin expanding adoption blog company shared raised 5 million fund plan use develop expand aqua wallet related reading crypto survival mode bitcoin mining giant lends 7000 btc amid operational,0.802,0.0,0.401
RSS,https://bitcoinist.com/feed/,2025-01-06 21:00:31+00:00,2025-01-07 00:53:29.122107,retail bitcoin transaction drop lowest level since 2021 mean btcbitcoin shown resilience pushing key demand level psychological technical barrier 100k remains unclaimed resistance left investor analyst state uncertainty clear shortterm direction market leader despite growing consensus among market expert suggests btc likely see,-0.72,-0.03035714285714286,-0.3751785714285714
RSS,https://bitcoinist.com/feed/,2025-01-06 19:30:36+00:00,2025-01-07 00:53:29.122107,expect strong bullish move dogecoin price 46 crashthe dogecoin price could gearing strong bullish move crypto analyst identified recurring pattern meme coin movement optimistic outlook dogecoins future trajectory come meme coin experienced severe price crash 46 pushing new low dogecoin price get ready,0.6124,0.2861471861471862,0.44927359307359316
RSS,https://bitcoinist.com/feed/,2025-01-06 16:30:10+00:00,2025-01-07 00:53:29.122107,bitcoins price action signal 14 increase new alltime high loomingbitcoins price climbed 99000 level sparking renewed hope potential revisit higher resistance level shortly given recent upside strength growing sentiment market btc might heading toward current alltime high beyond upside breakout bitcoin new high incoming crypto expert,0.8442,0.10024793388429752,0.47222396694214874
RSS,https://bitcoinist.com/feed/,2025-01-06 15:00:09+00:00,2025-01-07 00:53:29.122107,bitcoin cme future push 100000 btc price bull zonecrypto analyst tony severino disclosed bitcoin chicago mercantile exchange cme future crossed 100000 mark indicating potential increase market sentiment institutional interest cryptocurrencys relative strength index rsi 70 analyst asserts bitcoin may entered bull zone result predicts significant,0.8519,0.075,0.46345
RSS,https://bitcoinist.com/feed/,2025-01-06 14:44:26+00:00,2025-01-07 00:53:29.122107,bitcoin could surpass 100k record following trump inauguration take altcoins along ridein leadup presidentelect donald trump inauguration january 20 bitcoin investor may excellent news new record highly anticipated according blockchain analytics platform amberdata recent surge whale activity one trader recently spent around 6m secure 100k strike call option set,0.6808,0.22805194805194803,0.454425974025974
RSS,https://bitcoinist.com/feed/,2025-01-06 13:56:53+00:00,2025-01-07 00:53:29.122107,5 top meme coin predicted explode 2025we anticipate 2025 good year meme coin year toiling shadow bigger sibling bitcoin ethereum top meme coin seem finally flexing muscle crypto trader preparing donald trump reascension white house january 20 partly anticipating,0.6705,0.2833333333333333,0.47691666666666666
