MainSource,Source,Publication Date,Pull_date,Pre-Processed Text,Sentiment_Vader,Sentiment_TextBlob,Average_Sentiment
RSS,https://cointelegraph.com/rss,2025-01-28 12:10:00+00:00,2025-01-28 12:18:29.785325,bitcoin bond etf work discover bitcoin bond etf unique investment option combine stability traditional bond potential high return bitcoin,0.0,0.13375,0.066875
RSS,https://cointelegraph.com/rss,2025-01-28 11:52:50+00:00,2025-01-28 12:18:29.785325,here happened crypto today need know happened crypto today latest news daily trend event impacting bitcoin price blockchain defi nfts web3 crypto regulation,0.0,0.25,0.125
RSS,https://cointelegraph.com/rss,2025-01-28 11:23:33+00:00,2025-01-28 12:18:29.785325,metaplanet plan raise 700m buy bitcoin japanese firm metaplanet plan raise roughly 745 million fund bitcoin purchase aiming 21000 btc 2026 part strategy lead japan bitcoin renaissance,0.0,-0.10000000000000002,-0.05000000000000001
RSS,https://cointelegraph.com/rss,2025-01-28 10:25:20+00:00,2025-01-28 12:18:29.785325,arizona senate move forward bitcoin reserve legislation arizona bitcoin reserve bill aim enable public fund pension invest bitcoin marking significant shift cryptocurrency adoption financial strategy,0.2023,0.125,0.16365000000000002
RSS,https://cointelegraph.com/rss,2025-01-28 10:13:15+00:00,2025-01-28 12:18:29.785325,xrp price today xrp price 12 jan 28 responding ripple attainment money transmitter license new york texas,0.0,0.13636363636363635,0.06818181818181818
RSS,https://cointelegraph.com/rss,2025-01-28 10:07:28+00:00,2025-01-28 12:18:29.785325,bitcoin 039extremely bullish039 trader gear next btc price pump btc price woe increasingly thing past bitcoin recovers majority deepseek dip,-0.4215,-0.125,-0.27325
RSS,https://cointelegraph.com/rss,2025-01-28 08:53:49+00:00,2025-01-28 12:18:29.785325,getgems bet telegram boost nft adoption 2025 despite challenging year nfts getgems bet telegram 950 million user ton blockchain drive adoption utilityfocused digital collectible,0.3085,0.0,0.15425
RSS,https://cointelegraph.com/rss,2025-01-28 08:32:38+00:00,2025-01-28 12:18:29.785325,bitfarms sell paraguay site hive 85m refocuses u bitfarms sell largest paraguay mining farm hive digital 85 million focus u expansion bitcoin ai infrastructure,0.0,0.0,0.0
RSS,https://cointelegraph.com/rss,2025-01-28 05:10:29+00:00,2025-01-28 12:18:29.785325,draftkings settle nfl union suit nft pay dispute national football league player association lawsuit came week draftkings closed nft marketplace july,-0.6124,-0.1,-0.3562
RSS,https://cointelegraph.com/rss,2025-01-28 04:44:21+00:00,2025-01-28 12:18:29.785325,tuttle file 10 leveraged crypto etf issuer test limit analyst tuttle capital filed etf betting memecoins including donald melania trump move analyst say test trumpera regulatory limit,0.0,0.0,0.0
RSS,https://cointelegraph.com/rss,2025-01-28 03:12:48+00:00,2025-01-28 12:18:29.785325,senate confirms procrypto scott bessent u treasury secretary u treasury secretary billionaire hedge fund manager scott bessent sway fiscal policy financial regulation international sanction overseas investment,0.3818,0.0,0.1909
RSS,https://cointelegraph.com/rss,2025-01-28 02:56:54+00:00,2025-01-28 12:18:29.785325,apple close amid u tech stock washout china ai startup deepseek u market dipped amid release chinese firm deepseeks latest ai model supposedly perform well chatgpt fraction cost,0.2732,0.09999999999999999,0.1866
RSS,https://cointelegraph.com/rss,2025-01-28 01:18:07+00:00,2025-01-28 12:18:29.785325,kucoin pleads guilty u charge agrees pay 300m kucoin admitted operating unlicensed moneytransmitting business pay nearly 300 million fine forfeiture,-0.1531,0.005555555555555554,-0.07377222222222223
RSS,https://cointelegraph.com/rss,2025-01-28 00:44:25+00:00,2025-01-28 12:18:29.785325,venice ai token give private access deepseek hit 16b total value venice ai startup allows private access deepseeks ai model hit total value 1 billion within hour newly launched token,0.7083,0.02727272727272727,0.36778636363636363
RSS,https://cointelegraph.com/rss,2025-01-27 22:30:00+00:00,2025-01-28 12:18:29.785325,scam token surge deepseek ai go viral malicious deepseek token surged past 24 hour underscoring scammer mobility reacting current event,-0.5719,-0.125,-0.34845
RSS,https://cointelegraph.com/rss,2025-01-27 22:07:47+00:00,2025-01-28 12:18:29.785325,ripple announces money transmitter license texas new york payment firm said addition two u state held 50 license across different jurisdiction,0.0,-0.02121212121212122,-0.01060606060606061
RSS,https://cointelegraph.com/rss,2025-01-27 22:04:53+00:00,2025-01-28 12:18:29.785325,absence bitcoin panic selling suggests btc drop 98k shortterm blip analyst bitcoins selloff 97777 followed healthy response dip buyer snap back btcs range high next logical step,-0.4019,0.14958333333333332,-0.12615833333333332
RSS,https://cointelegraph.com/rss,2025-01-27 20:37:39+00:00,2025-01-28 12:18:29.785325,bitcoin price drop 98k market selloff following deepseek ai launch bitcoin price fell 97754 crypto stock market digested significance chinabased chatgpt ai competitor called deepseek,0.0,0.0,0.0
RSS,https://cointelegraph.com/rss,2025-01-27 20:20:22+00:00,2025-01-28 12:18:29.785325,judge sentence forcount promoter 30 month behind bar antonia perez hernandez one five individual indicted involvement ponzi scheme forcount pleaded guilty conspiracy commit wire fraud 2024,-0.8176,-0.3,-0.5588
RSS,https://cointelegraph.com/rss,2025-01-27 20:00:32+00:00,2025-01-28 12:18:29.785325,blockchain identity platform humanity protocol valued 11b fundraise advent web3 decentralized identity solution dids considered key securing user digital footprint,0.7579,0.0,0.37895
RSS,https://cointelegraph.com/rss,2025-01-27 19:21:15+00:00,2025-01-28 12:18:29.785325,price analysis 127 spx dxy btc eth xrp sol bnb doge ada link bitcoin altcoins saw sharp selling trader reduced risk following popular launch deepseek ai app,0.1779,0.15833333333333333,0.16811666666666666
RSS,https://cointelegraph.com/rss,2025-01-27 19:20:00+00:00,2025-01-28 12:18:29.785325,cftc acting chair announces roundtable crypto market structure acting cftc chair caroline pham said commission planned go back basic also suggesting regulator would explore regulatory safeguard,0.3818,0.0,0.1909
RSS,https://cointelegraph.com/rss,2025-01-27 19:00:50+00:00,2025-01-28 12:18:29.785325,maple finance debut bitcoinlinked yield offering institutional investor maple new offering compete market share number similar derivative product promising btc yield downside protection wealthy investor,0.6908,0.2090909090909091,0.44994545454545454
RSS,https://cointelegraph.com/rss,2025-01-27 19:00:00+00:00,2025-01-28 12:18:29.785325,wazirx approved hack repayment tornado cash sanction overturned law decoded u court overturned sanction privacy protocol tornado cash significant legal development crypto,0.6249,0.2875,0.4562
RSS,https://cointelegraph.com/rss,2025-01-27 17:42:59+00:00,2025-01-28 12:18:29.785325,multicurrency future stablecoins say former binanceus exec u dollar dominates stablecoin industry soon change according former binanceus ceo 1money founder brian shroder,0.0516,0.0,0.0258
RSS,https://cointelegraph.com/rss,2025-01-27 16:42:28+00:00,2025-01-28 12:18:29.785325,microstrategy proposes 25m share offering fund bitcoin purchase company acquired another 11 billion worth bitcoin last week increasing digital asset holding 471107 btc,0.6808,0.09999999999999999,0.39039999999999997
RSS,https://cointelegraph.com/rss,2025-01-27 16:17:39+00:00,2025-01-28 12:18:29.785325,bitcoin price bounce 5 cancel deepseek stock dive 102k return bitcoin waste little time relief bounce taking btc price action back 100000,-0.2449,-0.071875,-0.15838750000000001
RSS,https://cointelegraph.com/rss,2025-01-27 15:00:00+00:00,2025-01-28 12:18:29.785325,crypto could justifiably spend even lobbying uneasy feeling current volume crypto political spending understandable believe mission price survival,-0.1027,0.0,-0.05135
RSS,https://cointelegraph.com/rss,2025-01-27 13:55:49+00:00,2025-01-28 12:18:29.785325,fake deepseek token hit 48m market cap amid chinese ai app hype solanabased token carrying chinese ai app deepseeks name briefly rose 48 million market cap company denies ever launching cryptocurrency,-0.7096,0.024999999999999994,-0.3423
RSS,https://cointelegraph.com/rss,2025-01-27 13:14:35+00:00,2025-01-28 12:18:29.785325,xrp price today xrp price dropped alongside crypto market responding tech stock selloff led china deepseek disruption global ai sector,-0.3612,0.0,-0.1806
RSS,https://bitcoinmagazine.com/.rss/full/,2025-01-27 22:10:39+00:00,2025-01-28 12:18:29.785325,microstrategy expands bitcoin holding 471100 btc worth 46 billionmicrostrategys relentless bitcoin buying spree continues adding 10100 btc 11 billion 471100 btc treasury valued 46 billion firm reinforces commitment bitcoincentric strategy amid market volatility,0.8316,0.04999999999999999,0.44079999999999997
RSS,https://bitcoinmagazine.com/.rss/full/,2025-01-27 18:54:56+00:00,2025-01-28 12:18:29.785325,declining shortterm u treasury yield impact bitcoin pricehow shifting treasury yield signal economic uncertainty bitcoin could benefit riskon safehaven asset,0.6908,0.2,0.4454
RSS,https://bitcoinmagazine.com/.rss/full/,2025-01-27 14:53:53+00:00,2025-01-28 12:18:29.785325,nasdaq proposes inkind redemption blackrocks bitcoin etfnasdaq proposed new system blackrocks ishares bitcoin etf allowing institutional investor redeem share directly bitcoin instead cash innovative model aim streamline operation cut cost reduce market impact marking significant step forward evolution bitcoin etf,0.5859,0.2778409090909091,0.43187045454545453
RSS,https://bitcoinmagazine.com/.rss/full/,2025-01-24 19:28:07+00:00,2025-01-28 12:18:29.785325,cynic idealist bitcoinbitcoiners need stop letting extreme naive idealism jaded cynicism drive public discourse,-0.7165,-0.14166666666666666,-0.42908333333333337
RSS,https://bitcoinmagazine.com/.rss/full/,2025-01-24 18:01:45+00:00,2025-01-28 12:18:29.785325,dear president trump bitcoin reserve shitcoin reservethe u government shouldnt stockpile anything bitcoin,0.3818,0.0,0.1909
RSS,https://bitcoinmagazine.com/.rss/full/,2025-01-24 17:47:27+00:00,2025-01-28 12:18:29.785325,trump digital asset executive order may last senator lummis rightpresident trump digital asset executive order hoped luckily senator lummis taking better approach establishing strategic bitcoin reserve,0.9153,0.16666666666666666,0.5409833333333334
RSS,https://bitcoinmagazine.com/.rss/full/,2025-01-24 12:47:29+00:00,2025-01-28 12:18:29.785325,brc20 bitcoin token could outshine rune efficient token standard bitcoin good thing,0.6908,0.35,0.5204
RSS,https://bitcoinmagazine.com/.rss/full/,2025-01-24 12:08:51+00:00,2025-01-28 12:18:29.785325,sec rescinds sab 121 permitting bank custody bitcointhe sec rescinded sab 121 removing barrier bank custody bitcoin crypto signaling major shift crypto regulation,-0.128,-0.04583333333333334,-0.08691666666666667
RSS,https://bitcoinmagazine.com/.rss/full/,2025-01-23 21:55:20+00:00,2025-01-28 12:18:29.785325,president trump sign executive order ban central bank digital currency cbdcthe president also assigned working group ass creation strategic bitcoin stockpile,-0.7184,0.0,-0.3592
RSS,https://bitcoinmagazine.com/.rss/full/,2025-01-23 21:19:26+00:00,2025-01-28 12:18:29.785325,trump sign executive order explore u strategic bitcoin reservepresident trump new executive order embrace bitcoin open blockchain technology ban central bank digital currency revoke prior restrictive regulationssignaling landmark policy shift toward fostering responsible innovation financial freedom united state,0.872,0.048051948051948054,0.460025974025974
RSS,https://bitcoinmagazine.com/.rss/full/,2025-01-23 17:38:39+00:00,2025-01-28 12:18:29.785325,ross free far overross last person government try make example,0.5106,0.16666666666666666,0.33863333333333334
RSS,https://bitcoinmagazine.com/.rss/full/,2025-01-23 16:29:45+00:00,2025-01-28 12:18:29.785325,donald trump right thing freeing ross ulbrichttrump delivered promise im glad,0.8126,0.39285714285714285,0.6027285714285714
RSS,https://bitcoinmagazine.com/.rss/full/,2025-01-23 15:33:00+00:00,2025-01-28 12:18:29.785325,bitcoin deep dive data analysis onchain roundupbitcoin kick 2025 bullish momentum rally sustain dive miner recovery sentiment market dynamic insight,0.3818,0.0,0.1909
RSS,https://bitcoinmagazine.com/.rss/full/,2025-01-22 19:33:10+00:00,2025-01-28 12:18:29.785325,blackrock ceo larry fink forecast 700k bitcoin price amid inflation worrieslarry fink ceo blackrock suggested bitcoin could reach 700000 per coin citing growing role hedge economic instability projection sparked discussion sovereign wealth fund highlight increasing momentum institutional adoption potential reshape market dynamic,0.8402,0.06666666666666667,0.4534333333333333
RSS,https://bitcoinmagazine.com/.rss/full/,2025-01-22 18:19:06+00:00,2025-01-28 12:18:29.785325,silk road ross ulbricht defend murdererross ulbricht free unproven allegation silk road founder overshadow well deserved pardon corner internet,0.7717,0.4,0.58585
RSS,https://bitcoinmagazine.com/.rss/full/,2025-01-22 18:11:37+00:00,2025-01-28 12:18:29.785325,making wave tampa bay bitcoin bay foundation join gasparilla parade pirateslook bitcoin bay pirate float gasparilla parade year tampa bay,0.296,-0.25,0.022999999999999993
RSS,https://bitcoinmagazine.com/.rss/full/,2025-01-22 17:40:57+00:00,2025-01-28 12:18:29.785325,bitcoin hacking edition 2025 brazilbitcoin hacking edition 2025 month away dont miss chance learn bitcoin development person best developer,0.5999,1.0,0.7999499999999999
RSS,https://bitcoinmagazine.com/.rss/full/,2025-01-22 17:21:26+00:00,2025-01-28 12:18:29.785325,ethereums looming collapse lesson blockchain integrityif founder pivoting bronze age mindset 2025 youre ngmi,-0.5719,0.0,-0.28595
RSS,https://bitcoinmagazine.com/.rss/full/,2025-01-22 12:55:02+00:00,2025-01-28 12:18:29.785325,ross ulbricht free let fight samourai devsby freeing ross bitcoin network state proven political power use make sure like developer samourai wallet dont go jail,0.8225,0.2,0.51125
RSS,https://bitcoinmagazine.com/.rss/full/,2025-01-22 03:21:28+00:00,2025-01-28 12:18:29.785325,ross ulbricht free victory bitcoin freedomross ulbrichts full pardon president trump mark monumental victory bitcoiners symbolizing justice man became beacon freedom innovation longawaited moment prof power persistence reminds u keep advocating bitcoin freedom,0.9638,0.375,0.6694
RSS,https://bitcoinmagazine.com/.rss/full/,2025-01-21 20:50:46+00:00,2025-01-28 12:18:29.785325,david bailey forecast 1m bitcoin price trump presidencydavid bailey ceo btc inc share bold prediction bitcoins future including potential reach 1 million trump presidency article delf political economic technological force shaping bitcoins role global reserve asset highlight key strategy investor align transformative potential,0.8316,0.06666666666666667,0.44913333333333333
RSS,https://bitcoinmagazine.com/.rss/full/,2025-01-21 18:00:40+00:00,2025-01-28 12:18:29.785325,trump free ross day one course didntdonald trump broke campaign promise free ross ulbricht day one presidency let hope follows next couple day,0.8402,0.26666666666666666,0.5534333333333333
RSS,https://bitcoinmagazine.com/.rss/full/,2025-01-21 17:48:19+00:00,2025-01-28 12:18:29.785325,advanced mathematical projection bitcoin bull cycle peakdiscover advanced statistical method historical data including renowned pi cycle top indicator monte carlo simulation used project bitcoins next bull cycle peak insight potential price range timing savvy investor,0.5859,0.18571428571428572,0.38580714285714285
RSS,https://bitcoinmagazine.com/.rss/full/,2025-01-21 16:48:07+00:00,2025-01-28 12:18:29.785325,bitcoin missed 54 billion opportunity neglecting runesbitcoins reluctance embrace emerging economic trend like memecoins token mean ceding market share user growth innovation competing chain like solana,0.8481,-0.056249999999999994,0.39592499999999997
RSS,https://bitcoinmagazine.com/.rss/full/,2025-01-20 15:11:26+00:00,2025-01-28 12:18:29.785325,watch bitcoin president donald trump inaugurationdonald trump inauguration first probitcoin u president herejoin bitcoin magazine live coverage 10 est,0.0,0.19318181818181818,0.09659090909090909
RSS,https://bitcoinmagazine.com/.rss/full/,2025-01-20 15:00:00+00:00,2025-01-28 12:18:29.785325,btcpay server foundation receives 25000 grant bitcoin unbankthe grant help btcpay continue work opensource payment development,0.7717,0.0,0.38585
RSS,https://bitcoinmagazine.com/.rss/full/,2025-01-19 17:27:03+00:00,2025-01-28 12:18:29.785325,trump like crypto long griftingtrump coin nothing way extract money crypto ecosystem,0.3612,-0.05,0.15560000000000002
RSS,https://bitcoinmagazine.com/.rss/full/,2025-01-17 17:55:41+00:00,2025-01-28 12:18:29.785325,president trump got bold vision bitcoin americaas president donald trump second term begin bitcoin community look bold promise bitcoin regulation national strategy economic growth whats storeand soon,0.8779,0.21666666666666667,0.5472833333333333
RSS,https://bitcoinmagazine.com/.rss/full/,2025-01-17 17:25:55+00:00,2025-01-28 12:18:29.785325,wyoming introduces bitcoin strategic reserve billa look bill proposed wyoming state level bitcoin strategic reserve,0.0,0.0,0.0
RSS,https://bitcoinmagazine.com/.rss/full/,2025-01-17 15:22:17+00:00,2025-01-28 12:18:29.785325,treat bitcoin tool cultignore mindless chanting slogan want bitcoin stack,0.0258,-0.2,-0.08710000000000001
RSS,https://bitcoinmagazine.com/.rss/full/,2025-01-17 14:34:04+00:00,2025-01-28 12:18:29.785325,updated mvrv zscore improves bitcoin price predictionsweve enhanced mvrv zscore better reflect bitcoins evolving market dynamic reduced volatility,0.8074,0.25,0.5287
RSS,https://bitcoinmagazine.com/.rss/full/,2025-01-17 14:00:00+00:00,2025-01-28 12:18:29.785325,california working towards embracing bitcoinbitcoin focused nonprofit proof workforce working office california legislation bitcoin initiative,0.3818,0.0,0.1909
RSS,https://bitcoinmagazine.com/.rss/full/,2025-01-16 18:24:39+00:00,2025-01-28 12:18:29.785325,bitcoin price history predicts february 2025discover bitcoins historical february performance posthalving trend provide insight investor expect 2025,0.0,0.0,0.0
RSS,https://bitcoinmagazine.com/.rss/full/,2025-01-16 16:37:32+00:00,2025-01-28 12:18:29.785325,coinbases bitcoin loan seemnot backed real bitcoin bitcoin blockchain better,0.4588,0.35,0.4044
RSS,https://bitcoinmagazine.com/.rss/full/,2025-01-15 22:03:40+00:00,2025-01-28 12:18:29.785325,bitcoin miner economic irrationality fatalbitcoins censorship resistance depends miner decentralization economic rationality therefore sustainability,-0.4019,0.2,-0.10094999999999998
RSS,https://bitcoinmagazine.com/.rss/full/,2025-01-15 21:30:04+00:00,2025-01-28 12:18:29.785325,u government release half bitcoin intended trump strategic reservethis bullish bitcoin,0.0,-0.16666666666666666,-0.08333333333333333
RSS,https://bitcoinmagazine.com/.rss/full/,2025-01-15 17:57:22+00:00,2025-01-28 12:18:29.785325,bitcoiners view quantum computinga breakdown type risk quantum computing pose bitcoin worried user network,-0.5106,0.0,-0.2553
RSS,https://bitcoinmagazine.com/.rss/full/,2025-01-15 17:46:01+00:00,2025-01-28 12:18:29.785325,hundred company buy bitcoin 2025bitwise cio matt hougan predicts treasury revolution forecasting hundred company buy bitcoin reserve asset within 18 month shaping transformative overlooked megatrend,0.4939,0.0,0.24695
RSS,https://bitcoinmagazine.com/.rss/full/,2025-01-15 16:27:46+00:00,2025-01-28 12:18:29.785325,mining bitcoin congo beyond journey bigblock datacenters sébastien gouspillousébastien gouspillou established bitcoin mining facility remote region world given back community process,0.0,-0.05,-0.025
RSS,https://bitcoinmagazine.com/.rss/full/,2025-01-15 16:18:01+00:00,2025-01-28 12:18:29.785325,x fiatyou sometimes hear bitcoiners claim x fiat x mean category food medicine art whatever im fan extrapolation supposed bitcoin value ill make exception actual x,0.2263,-0.2708333333333333,-0.022266666666666657
RSS,https://bitcoinmagazine.com/.rss/full/,2025-01-14 21:05:22+00:00,2025-01-28 12:18:29.785325,wear bitcoin shirt here whyyou putting target back wearing merch like,0.3612,0.0,0.1806
RSS,https://bitcoinmagazine.com/.rss/full/,2025-01-14 19:57:19+00:00,2025-01-28 12:18:29.785325,bitcoin defi finding productmarket fit runesbtcfi track compete ecosystem,0.3612,0.4,0.38060000000000005
RSS,https://bitcoinmagazine.com/.rss/full/,2025-01-14 19:13:56+00:00,2025-01-28 12:18:29.785325,repeating 2017 bitcoin bull cycleexplore potential bitcoin repeat 2017 bull cycle analyze price action investor behavior future prediction bitcoins market trajectory,0.0,0.03333333333333333,0.016666666666666666
RSS,https://bitcoinmagazine.com/.rss/full/,2025-01-14 17:01:08+00:00,2025-01-28 12:18:29.785325,syria exploring embrace bitcoinsyria fall assad considering legalization bitcoin including partially backing syrian pound mining excess energy reserve,0.5423,-0.1,0.22115
RSS,https://bitcoinmagazine.com/.rss/full/,2025-01-14 15:05:58+00:00,2025-01-28 12:18:29.785325,bitcoin explainer video going insanely viral let tell viral 40minute video best noobfriendly resource ive ever seen,0.6369,0.0,0.31845
RSS,https://bitcoinmagazine.com/.rss/full/,2025-01-14 14:53:02+00:00,2025-01-28 12:18:29.785325,nostr world biggest bitcoin circular economy join usstart sending receiving bitcoin exchange content,0.296,0.0,0.148
RSS,https://bitcoinmagazine.com/.rss/full/,2025-01-13 20:00:52+00:00,2025-01-28 12:18:29.785325,one week donald trump decide ross ulbrichts fatechances ross ulbricht soon free man,0.5106,0.4,0.45530000000000004
RSS,https://bitcoinmagazine.com/.rss/full/,2025-01-13 17:20:23+00:00,2025-01-28 12:18:29.785325,arka noego noah ark solidarity bitcoina look history polish solidarity movement overthrew communism similarity movement bitcoin natalie smolenski,0.5267,0.0,0.26335
RSS,https://bitcoinmagazine.com/.rss/full/,2025-01-10 21:05:24+00:00,2025-01-28 12:18:29.785325,may want redeem bitcoin thorchains lending serviceif thorchain creditor id withdraw bitcoin collateral,0.0516,0.0,0.0258
RSS,https://bitcoinmagazine.com/.rss/full/,2025-01-10 20:13:27+00:00,2025-01-28 12:18:29.785325,privacy shouldnt product stop treating like onethe degree scrutiny accountability privacy project bitcoin space almost nonexistent need change,0.5248,0.0,0.2624
RSS,https://bitcoinist.com/feed/,2025-01-28 11:00:46+00:00,2025-01-28 12:18:29.785325,bitcoin arizona become first u state vote strategic reserve billarizona advanced senate bill 1025 also known arizona strategic bitcoin reserve sbr act committee positioning become first u state vote legislation would authorize investing state fund bitcoin dennis porter ceo founder advocacy group satoshi act fund broke,-0.2023,0.3,0.04884999999999999
RSS,https://bitcoinist.com/feed/,2025-01-28 10:29:52+00:00,2025-01-28 12:18:29.785325,solaxy presale reach 15m new etf cause bull runfund manager tuttle capital filed application ten altcoin exchangetraded fund etf u security exchange commission sec among chainlink link cardano ada even meme coin like bonk bonk official trump trump filing come back recent change sec leadership procrypto mark uyeda,0.6124,-0.01060606060606061,0.3008969696969697
RSS,https://bitcoinist.com/feed/,2025-01-28 09:30:59+00:00,2025-01-28 12:18:29.785325,ethereum adoption still strong new address see largest spike 27 monthsonchain data show large amount new address popped ethereum network recently sign eth adoption occurring ethereum network growth registered sharp spike recently new post x onchain analytics firm santiment discussed latest trend network growth ethereum,0.8176,0.13685666185666187,0.47722833092833095
RSS,https://bitcoinist.com/feed/,2025-01-28 06:30:24+00:00,2025-01-28 12:18:29.785325,800 million crypto longs rekt bitcoin ethereum crashdata show cryptocurrency derivative sector seen mass liquidation event past day bitcoin asset crashed crypto market seen long squeeze last 24 hour according data coinglass large amount contract liquidated past day position,0.3612,-0.06714285714285714,0.14702857142857145
RSS,https://bitcoinist.com/feed/,2025-01-28 05:00:16+00:00,2025-01-28 12:18:29.785325,analyst predicts major dogecoin price crash 026 there good newscrypto analyst behdark predicted dogecoin price could suffer major crash sending 030 support level however analyst also provided good news doge expected witness massive rebound drop price level dogecoin price crash 026 rebound,-0.6962,0.23749999999999996,-0.22935000000000005
RSS,https://bitcoinist.com/feed/,2025-01-28 04:00:28+00:00,2025-01-28 12:18:29.785325,elon musk tweet xrp here storyrumors rippling crypto community several user x claimed tesla founder x owner elon musk briefly tweeted xrp deleting post within second alleged tweet one appears captured screenshot generated flurry debate regarding authenticity alleged,0.0,-0.04,-0.02
RSS,https://bitcoinist.com/feed/,2025-01-28 03:00:29+00:00,2025-01-28 12:18:29.785325,ripple gain ground secures money transmitter license ny texasblockchain payment company ripple announced acquisition two additional money transmitter license mtls united state one new york another texas monday brings ripple total 55 money transmitter license across payment custody stablecoin operation underscoring company robust growth regulatory landscape,0.91,0.06818181818181818,0.48909090909090913
