MainSource,Source,Publication Date,Pull_date,Pre-Processed Text,Sentiment_Vader,Sentiment_TextBlob,Average_Sentiment
Reddit,solana,2024-12-19 21:50:26,2024-12-23 12:19:20.445400,syndica deep dive solana depin november 2024source httpsxcomsyndica_iostatus1869505051691245817httpsxcomsyndica_iostatus1869505051691245817 1 milestone set solanahttpsxcomsolana depin sector revenue aths record demand contributor growth fueling top protocol mapping wireless computing energy dive full report summarized thread ogsyndicaiodeepdivesolanadepinnovember20242httpogsyndicaiodeepdivesolanadepinnovember20242 httpspreviewredditwj2zsni2iv7e1pngwidth680formatpngautowebps7ef053b6a0199f0367787e5eda694599bbe9730d 2 hivemapperhttpsxcomhivemapper revenue skyrocketed since june protocol achieved 796 revenue growth helium render also posting impressive growth figure httpspreviewredditbxzvpi2biv7e1pngwidth680formatpngautowebps946c8a08bda95a9194e79ebb8a567d39540dbcdf 3 srcfulhttpsxcomsrcful seen massive contributor growth since june depin protocol cooled active contributor srcful saw impressive 274 increase httpspreviewreddit62yhoo9div7e1pngwidth680formatpngautowebpse2af9cb676665a0d551e66437562b2931f1c6c8b 4 rendernetworkhttpsxcomrendernetwork contributor received hefty payouts render contributor earn 2k average high mark compared protocol httpspreviewredditg1enqtofiv7e1pngwidth680formatpngautowebpse3cc0e48020e6fb65baddbedd6f50a3062c8e8ca 5 hivemapperhttpsxcomhivemapper demand reached ath usd burned honeyhttpsxcomsearchq24honeysrccashtag_click token surged 24x reaching 141k nov 26th map improvement proposal introduced increase price map credit 50 expected result honeyhttpsxcomsearchq24honeysrccashtag_click burned per km map data httpspreviewreddit2x9p0p7iiv7e1pngwidth680formatpngautowebps7993b8aab04704faf1b643eac508e6c8ab20ca0e 6 natixnetworkhttpsxcomnatixnetwork incentive mechanism working network gave 20 usd reward 38 contributor natix recently launched vx360 device allows tesla driver access monetize camera data adding new product line valuable dataset httpspreviewreddit72tb64cliv7e1pngwidth680formatpngautowebpsd93d67f322ccd09024623b822233eed96658ff63 7 wingbitshttpsxcomwingbits flight network database scaling one month network expanded coverage 20 tracking 8 flight per day live station expected double upcoming delivery hardware sold october presales httpspreviewredditgppieasniv7e1pngwidth606formatpngautowebpsf5111ad623a486717c9e88973e32bbc256dd89ef 8 helium_mobilehttpsxcomhelium_mobile demand extended 6month uptrend data credit burned data transferred hit new aths 13 due strong offload carrier demand increased network usage dc burned directly reflects amount data transferred creating mirrored relationship httpspreviewredditxx8m852siv7e1pngwidth680formatpngautowebps40d98ef15f4ee2804ab2712d52bb98232a53785f 9 helium_mobilehttpsxcomhelium_mobiles carrier offload initiative continues scale rapidly average offload subscriber count offload data hit new aths surpassing 250k daily subscriber 5tb data httpspreviewredditmumz0wgviv7e1pngwidth680formatpngautowebps3d7ff4f047025643dccdd46d8444cdf6634c6053 httpspreviewreddit37ycguzviv7e1pngwidth680formatpngautowebps8af9c901fdb74f43dc932616ccb42be6e265d7c8 10 helium_mobilehttpsxcomhelium_mobile offload subscriber outpaced hotspot growth despite increasing number hotspot number subscriber per hotspot increased 14 httpspreviewreddit34rgjcrelv7e1pngwidth510formatpngautowebps378fdf73b9c850621e495ab81d2d58da0d68f85a 11 offload carrier dependency helium mobile stabilized offload carrier dependency average amount data routed helium mobile offload subscriber 4 month steady growth dependency helium mobile dropped 15 november httpspreviewreddit04hqtrz1jv7e1pngwidth680formatpngautowebps1f661627f5f0a7d1e068df1e42c0d9778a45090e 12 weroamxyzhttpsxcomweroamxyz user count surged 46x november cumulative user count top 15m new wifi setup stabilized 100k range roam provides free esim data daily app checkins competitive pricing free data incentive likely attracting new user httpspreviewredditd5gjznu4jv7e1pngwidth680formatpngautowebpsc875938231e1c63fcdbd8f802600b2bd070f0751 13 xnet_mobilehttpsxcomxnet_mobile offload data continued threemonth growth streak rise offload data indicates growing usage onboarded cellular provider httpspreviewredditkfik3bc8jv7e1pngwidth680formatpngautowebpsc003f36d71b6ff9036e6b0748f44e7add9058ba2 14 xnet_mobilehttpsxcomxnet_mobile burned 68m worth token xnet_fdnhttpsxcomxnet_fdn allocates significant portion revenue network operator reduce xnethttpsxcomsearchq24xnetsrccashtag_click supply httpspreviewredditbttl5n7bjv7e1pngwidth680formatpngautowebps6a6c8d4cb6f25caf9469536da29479a9a42ecf61 15 xnet contributor remained consistent however xnethttpsxcomsearchq24xnetsrccashtag_click reward paid dropped 21 httpspreviewreddit01j6p0cdjv7e1pngwidth680formatpngautowebpseca8d7da22556f08bf2594759a6520a94b93e9f9 16 rendernetworkhttpsxcomrendernetworks revenue exceeded 200k two consecutive month despite recent revenue growth number active render node operator remained stable httpspreviewredditwe9kmuz8lv7e1pngwidth560formatpngautowebps73050991576aa3745597098339cb546a410a9aeb 17 nosana_aihttpsxcomnosana_ai inference reversed fivemonth downtrend monthly inference grew 50 despite active gpu operator noshttpsxcomsearchq24nossrccashtag_click reward declining slightly httpspreviewredditig6dskcmjv7e1pngwidth680formatpngautowebps308af343c621ec2a20c5c5a8d4526954fb484465 18 nosana_aihttpsxcomnosana_ai revenue back rise increase inference pushed nosanas revenue 18 httpspreviewreddit5jdx8adwlv7e1pngwidth680formatpngautowebps02865a261cba240c787abb26d95e9c07e639836d 19 kuzco_xyzhttpsxcomkuzco_xyzs gpu supply stabilized kuzcos epoch one concluded november 18 network remained paused remainder month httpspreviewreddit015yi9bylv7e1pngwidth680formatpngautowebps1e353c3bd31052a1ebd0f74e1818cabbee5cce0a 20 getgrass_iohttpsxcomgetgrass_io demonstrated impressive growth data collection grass collecting 131 tb data per day highlighting robust data collection capability network scale continues grow reflected progress november december 21 getgrass_iohttpsxcomgetgrass_io released first videoaudio interleaved dataset called valid dataset designed simultaneously handle multiple modality audio visual textual crucial training machine learning model task multimodal learning 22 srcfulhttpsxcomsrcful gateway continue proliferate installed gateway increased 55 november despite increase device power production continued decline reflecting seasonality 23 subscribe email newsletter get report theyre published httpsblogsyndicaiodeepdivesolanadepinnovember20242httpsblogsyndicaiodeepdivesolanadepinnovember20242,0.9983,0.15139807162534435,0.5748490358126721
Reddit,solana,2024-12-20 01:29:07,2024-12-23 12:19:20.445400,get token address ticker hi trying build bot swap token base provided ticker example would input pnut ticker bot would perform pnutsol swap raydium platform problem find correct token address merket address based ticker,-0.4019,-0.8,-0.60095
Reddit,solana,2024-12-19 21:25:44,2024-12-23 12:19:20.445400,phantom wallet update customize profile find follow friend send receive money easesource httpsxcomphantomstatus1869460331782877548httpsxcomphantomstatus1869460331782877548 crypto social phantom customize profile find follow friend send receive money ease live mobile extension coming soon httpsredditcomlink1hi3jzqvideoang7y3y4hv7e1player simple sends add friend phantom send receive crypto ease tap send token enter username quickly spot account followensuring send crypto right person every time httpspreviewreddita0qv6ct6hv7e1pngwidth680formatpngautowebpsc9248d832b28c0a7bd20571f77d248c927a8c681 easy account management manage update auth factor linked wallet public address avatar bio httpsredditcomlink1hi3jzqvideoav9s7iqbhv7e1player privacy setting put control decide whether want account public private invisible httpspreviewredditwk1qhmcdhv7e1pngwidth680formatpngautowebps7c25eec89db974d31fc7673bbfd808955ffe2798,0.9501,0.1357864357864358,0.5429432178932179
Reddit,solana,2024-12-19 19:14:49,2024-12-23 12:19:20.445400,solanas star atlas launch biggest update yet,0.0,0.0,0.0
Reddit,solana,2024-12-19 22:00:52,2024-12-23 12:19:20.445400,sensai sentient ai streaming realtime major platform solana ai hackathon contenderhi im phil hughes dev team working tirelessly bring vision life sentient ai rendered raytraced 3d live streaming twitch kick x space many follow today officially submitted entry solana ai hackathon couldnt excited get sensai world tonight live streaming twitch kick x space alpha version sensais next step live streaming major platform soon 247 live streaming chinese korean audience native language usolanahttpsxcomsolana hackathon advance trading feature special interaction token holder question let u know find please visit website httpssensailive,0.6077,0.17296340023612747,0.39033170011806373
Reddit,solana,2024-12-19 13:08:05,2024-12-23 12:19:20.445400,state kraken kyc whole,0.0,0.2,0.1
Reddit,solana,2024-12-19 21:19:03,2024-12-23 12:19:20.445400,vortx arrived small mighty community supporting solana ecosystem making crypto cool texassource httpsxcomsolanastatus1869803548474814642httpsxcomsolanastatus1869803548474814642 vortx arrived powerhouse community top talent serious capital unmatched culture allmight_us superteamhttpsxcomallmight_us texas solana territory elite builder make mark httpsredditcomlink1hi3eh5videoq1scjdrofv7e1player vortx bring event grant coworking opportunity heart texas follow allmight_ushttpsxcomallmight_us update apply join sign happy hour kickoff httpsvortxxyzhttpsvortxxyz httpspreviewredditeq4u1nydgv7e1pngwidth680formatpngautowebps8a05fbd9a8a3cb5150373a0cb8febf8974f80671,0.9705,0.24523809523809526,0.6078690476190476
Reddit,solana,2024-12-19 17:10:39,2024-12-23 12:19:20.445400,major cex exchange announce sol meme coin listing day trading opened wherehey im looking social major cex exchange announce meme coin listing well prior actual listing since dont want risk getting dumped others investing meme coin already got listed like hour ago already pumped hard would great see cex exchange binance kraken bybit etc announce listing prior instead launching unannounced random time get pump anyone suggest popular social major cex exchange known announce listing actual listing take place would appreciate,0.8932,0.06634615384615385,0.4797730769230769
Reddit,solana,2024-12-19 20:34:42,2024-12-23 12:19:20.445400,colosseum codex electric capital report anza research 2025 solana eventssource httpsblogcolosseumorgelectriccapitaldeveloperreportanzaresearch2025solanaeventshttpsblogcolosseumorgelectriccapitaldeveloperreportanzaresearch2025solanaevents electric capital developer report anza research solana event 2025 magicblock open source ephemeral validator httpspreviewredditf4nvl2rf8v7e1pngwidth960formatpngautowebps17c617408b6fe6a9e58326c45d85862f3d32c49a gm last newsletter 2024 since im going enjoying time celebrate holiday 2024 sign future hold solana 2025 going even better im glad im ride cant wait kick new year keep bringing everything need know build solana let take look bag good developer electric capital developer report first time solana overtaken ethereum 1 blockchain new developer according electric capital 2024 developer reporthttpswwwdeveloperreportcomdeveloperreportsdeveloperreportrefblogcolosseumorg 39000 developer exploring crypto year 7600 chose build solana mark 83 yearoveryear increase new developer activity solana ecosystem httpspreviewredditgsnnj3jh8v7e1pngwidth1000formatpngautowebps151334b88f805838ce865707aa1a9804e40012e6 solana built momentum past year even price volatility market cycle work starting show report highlight overlooked win solana solana handled 81 dex transaction across blockchains year surpassed ethereum total dex settlement volume hitting 574 billion year adoption scaling quickly 17 million unique wallet transacted solana 2024 7x chain ethereum remains largest ecosystem overall continues dominate total active developer solanas growth signal next generation builder headed report also point larger global trend developer activity spreading across continent asia leading way india particular onboarded new crypto developer year solana top ecosystem developer region solana developer validation ecosystem thriving attracting builder realworld adoption ever solana overthrow ethereums 8year reign top ecosystem new devshttpscointelegraphcomnewssolanaflipsethereumtopecosystemnewdevelopersrefblogcolosseumorg anza research anza launched cuttingedge research team spearheaded renowned distributed system expert professor roger wattenhoferhttpsxcomthewattenhoferrefblogcolosseumorg two phd student kobi sliwinskihttpsxcomdiscokobirefblogcolosseumorg quentin kniephttpsxcomqknieprefblogcolosseumorg eth zurich goal elevate solanas protocol deeply academic approach key area focus designing performant provably correct turbinebased consensus algorithm enhancing latency resilience network economics addressing adversarial behavior distributed system ensure stateoftheart resilience team academic rigor experience distributed system rust programming major blockchain project like dfinity sui ethereum algorand position bring unexplored improvement solana anza research new chapter solanas protocolhttpswwwanzaxyzbloganzaresearchanewchapterforsolanasprotocolrefblogcolosseumorg solana event 2025 solana foundation prioritizing communityled event bring together developer founder validators product manager strategist build iterate connect way drive actual result schedule 2025 includes several key opportunity developer may two flagship event new york city anchor american crypto scene starting highly selective applicationonly conference deeply engaged building solana event followed larger conference welcoming u crypto industry whole introducing new audience whats happening solana ecosystem around world apex event take place major city like mexico city cape town budapest singapore mumbai designed highlight highquality application tailored local community startup village inspired success gathering like mtndao provide extended period developer entrepreneur work together refine product participate workshop form lasting connection communityled hacker house independent conference continue offer space builder meet experiment share knowledge finally breakpoint 2025 abu dhabi remains ultimate moment ecosystem bringing global solana community together celebrate achievement set course future gather build solana foundation event 2025httpssolanacomnewssolanafoundationevents2025refblogcolosseumorg magicblock ephemeral validator magicblock opensourced magicblock ephemeral validatorhttpsgithubcommagicblocklabsephemeralvalidatorrefblogcolosseumorg lightweight nonvoting svm runtime designed replace traditional web2 server ephemeral validators work cloning account justintime within ultrafast svm instance executing task updating mainnet state upon completion validator enables realtime elastic computing directly solana eliminating need centralized server implementing application logic entirely onchain core innovation lie ephemeral rollups extend solana offering serverless elastic compute allows fully onchain realtime application gaming decentralized social network highfrequency finance maintaining smart contract logic state solana opensource release mark beginning multimonth effort fully develop opensource magicblock open sourcing magicblock ephemeral validatorhttpsblogmagicblockggephemeralvalidatorrefblogcolosseumorg quick hit submission solana ai hackathon live 1159 pm est dec 23rdhttpsxcomsendaifunstatus1869129950890193112refblogcolosseumorg usendaifun web3 community need financial incentiveshttpsmediumcomhrknsinstwhyweb3communitiesneedmorethanjustfinancialincentives77d9bc90d5c8refblogcolosseumorg harkness institute turbin3 solana depin quickstart guide foundershttpssolanacomdevelopersguidesdepingettingstartedrefblogcolosseumorg solana solana consensus fork finalityhttpsneodymeioenblogsolana_consensusrefblogcolosseumorg neodyme using zkps solana sp1 solana verifierhttpsblogsuccinctxyzsolanasp1refblogcolosseumorg succinct svm merklization soonhttpsmediumcomsoon_svmsvmmerklizationonsoon7985a72d736erefblogcolosseumorg soon svm rebirth privacy solanahttpswwwarciumcomarticlestherebirthofprivacyonsolanarefblogcolosseumorg arcium introducing fuse offramphttpsfusewalletcomblogfuseofframprefblogcolosseumorg fuse curated shortlist solana zk compression resourceshttpsxcomswen_sjnstatus1867950422754725990refblogcolosseumorg swen_sjnhttpsxcomswen_sjn collecting price everything introducing pyth energy feedshttpswwwpythnetworkblogcollectingthepriceofeverythingintroducingpythenergyfeedsrefblogcolosseumorg pyth tool resource anchorescrow2025httpsgithubcommikemaccanaanchorescrow2025refblogcolosseumorg anchor example solana escrow program supersmartcontractshttpsgithubcomgabrielepiccosupersmartcontractsrefblogcolosseumorg provides simple example super smart contract using openai api respond query interact user learn adapt need solanatestvalidatorhttpsgithubcombeemansolanatestvalidatorrefblogcolosseumorg docker image solana test validator built night linuxamd64 well linuxarm64 platform nightly build latest version agave client idlprogramhttpsgithubcomsolanadevelopersidlprogramrefblogcolosseumorg idl solution native solana program leverage metadata program instead requiring empty anchor program approach support compressed json urlbased storage funding netrunner solanafocused crypto tax tool announced preseed raise led solflare wallethttpsxcomnetrunnertaxstatus1867255653888368785refblogcolosseumorg alongside notable angel syndicate vaneck invested 25 million dawnhttpsblockworksconewstwovaneckfundsbackdepindawnrefblogcolosseumorg solanabased depin project aiming build shift toward fully wireless internet era driven 5g starlink rollouts get hired hylo hiring senior protocol engineerhttpsjobssolanacomcompanieshylo2jobs43867710seniorprotocolengineerrefblogcolosseumorgcontent build hylos protocol rustanchor sevenlabs hiring full stack developerhttpswwwsevenlabsorgcareersjob1gh_srcsolananetworkopportunitiesjobboardrefblogcolosseumorg build maintain solana project crossmint hiring fullstack engineer ushttpsjobssolanacomcompaniescrossmint2jobs43757532fullstackengineerusrefblogcolosseumorgcontent help develop platform pyth network hiring developer relation engineer solanahttpsjobssolanacomcompaniespythnetworkjobs43614706developerrelationsengineersolanarefblogcolosseumorgcontent help solana developer integrate pyth network product listen unchained 2024 developer report electric capital reveals many shifting dynamic starter first time eight year ethereum top chain new developerssolana meanwhile asia emerged leading hub crypto development taking top spot north america dropped third episode general partner maria shen explores ethereums layer 2 solution bolstering position despite fierce competition bitcoin developer ecosystem remains steadfast emerging project like eigenlayer capturing builder attention also dive top crypto technology fascinating devs usage development activity differ across globe solana beat ethereum nab new crypto developer 2024httpsunchainedcryptocomhowsolanabeatoutethereumtonabnewcryptodevelopersin2024refblogcolosseumorg bonus episode team building solanahttpsblockworkscopodcastlightspeedcde0a8f0b91711ef9a6b5b3f0e0ed873refblogcolosseumorg lightspeed lightspeed discus numerous team coming build solana pudgy penguin token launch raising solanas block limit impact sandwich attack web3 monetization drip empowers creator nfts community growthhttpswwwbuzzsproutcom2363240episodes16226484web3monetizationhowdripempowerscreatorswithnftsandcommunitygrowthrefblogcolosseumorg building web3 episode building web3 podcast host jax dwyer sits jom head creator drip uncover unique opportunity drip offer creator navigating challenge web2 web3 content distribution ambient network decentralized environmental sensor solanahttpswwwyoutubecomwatchvki4wkdscwwarefblogcolosseumorg developer dao gilad penn cto luca franchi ceo ambient network discus work building world largest decentralized network environmental sensor ambient data solana vision technology behind ambient network opportunity developer get involved apis memecoins create millionaire history luca netz meowhttpswwwyoutubecomwatchv3ocdjk0gslyrefblogcolosseumorg shift happens two sharpest mind web3 luca pudgy penguin meow jupiter dive deep future crypto community memecoin driven wealth creation highly hyped pengu launch follow umikehalehttpstwittercommikehalerefblogcolosseumorg x warpcasthttpswarpcastcommikehalerefblogcolosseumorg thanks reading hope found something useful suggestion feedback let know think,0.9991,0.1521375066880685,0.5756187533440342
Reddit,solana,2024-12-19 16:21:27,2024-12-23 12:19:20.445400,alert bot show memecoins bought whitelisted walletshey guy know telegram tracking bot send real time alert memecoins bought sold wallet tracked purpose copy trading simply tracking wondering bot send alert soon memecoin bought whitelisted wallet within set time window like get alert memecoin soon two wallet tracked whitelist buy input wallet tracked time window tokenaaddress bought wallet12 alerted soon possible wallet 1 2 bought tokena within let say hour set know really specialized bot like please lem know would really appreciate help,0.9603,0.12000000000000002,0.54015
Reddit,ethereum,2024-12-17 13:01:18,2024-12-23 12:19:20.445400,weekly discussion thread buildinghello rethereum welcome weekly discussion thread building space developer entrepreneur enthusiast showcase project share idea seek feedback greater ethereum community share project whether youre developing decentralized application dapp launching new layer 2 network working ethereum infrastructure encourage share detail project please provide concise overview including purpose current status link information provide xtwitter youtube link post automatically filtered engage collaborate thread excellent opportunity connect likeminded individual application tester feel free ask question offer feedback seek collaboration safety reminder encourage sharing collaboration please cautious potential scam avoid connecting wallet unfamiliar application without thorough research utilizing wallet tool offer transaction simulation eg rabby walletguard help ensure safety fund never give seed phrase private key looking forward hearing pushing ethereum ecosystem forward,0.9908,0.26694214876033057,0.6288710743801653
Reddit,ethereum,2024-12-23 07:01:33,2024-12-23 12:19:20.445400,daily general discussion december 23 2024welcome ethfinance daily general discussion rethereum httpsimgurcom3y7vezphttpsimgurcom3y7vezp please use thread discus ethereum topic news event even price price discussion posted elsewhere subreddit continue removed rethereum mullet tech front page party daily technical big news item go front page rethereum always pricesmemestweetsoff topic go ethfiance daily always always keep friendly follow sub rule ticker eth subreddit ruleshttpswwwredditcomrethereumaboutrules also rethstaker incredible community dedicated staking need advice getting set head assistance ethfinance ethereum community link discord ev maverickshttpsdiscordggevmavericks ethereum twitterhttpsxcomethereum ethfinance twitterhttpsnitternetethfinancer evmavericks youtubehttpswwwyoutubecomevmavericks ethfinance doots podcasthttpsevmaverickslibsyncom daily doots websitehttpsdailydootscom ethereum jobshttpsethereumorgencommunitygetinvolvedethereumjobs get reddit doots extensionhttpsgithubcometheralphaethfinanceextension uhanniabu see fellow dooters everywhere reddit calendar courtesy week ethereumhttpsweekinethereumnewscom jan 20 ethereum protocol attackathon end jan 2426 eth pondy puducherry hackathon jan 3031 ethereumzurichhttpethereumzurich conference feb 79 eth oxford hackathon feb 1016 ethiopia conference hackathon feb 23 mar 2 ethdenver apr 25 eth bucharest hackathon conference apr 46 ethglobal taipei hackathon may 910 ethbratislava conference hackathon may 911 ethdam amsterdam conference hackathon may 911 ethlisbon hackathon may 2729 ethprague conference may 30 jun 1 ethglobal prague hackathon jun 38 eth belgrade conference hackathon jun 1213 protocol berg berlin conference jun 1618 dappcon berlin jun 2628 ethcluj romania conference jun 30 jul 3 ethcc cannes conference jul 46 ethglobal cannes hackathon jul 1619 napuleth napoli conference aug 1517 ethglobal new york hackathon sep 2628 ethglobal new delhi hackathon nov ethglobal devconnect hackathon,0.8828,0.12674825174825172,0.5047741258741258
Reddit,ethereum,2024-12-23 09:26:30,2024-12-23 12:19:20.445400,tim beiko allcoredevs update 017 pectra,0.0,0.0,0.0
Reddit,ethereum,2024-12-23 08:20:10,2024-12-23 12:19:20.445400,cant sell contract anyone shed light thishi someone alpha shilled ca 60k mc bought bit sushiswap httpsdexscreenercomarbitrum0x016ac0bf9f5ddb38130bffe45641a8e3efc0553e never used arb eth got new wallet purchased sat night saw heavily botted tried selling position give following two error swapping token back arb eth transaction swapping original transaction httpsarbiscaniotx0x5960a26686818e6cffbf9d5fa4c54b000184cb903ed11f7a054d5117ec2577d7 error execution reverted stf error execution reverted_granthole anyway get honeypot thanks,-0.4404,0.1301948051948052,-0.1551025974025974
Reddit,ethereum,2024-12-23 10:19:36,2024-12-23 12:19:20.445400,good reason eth sol xrp friend keep saying dead boomer coin,0.2023,0.24999999999999997,0.22615
