MainSource,Source,Publication Date,Pull_date,Pre-Processed Text,Sentiment_Vader,Sentiment_TextBlob,Average_Sentiment
GoogleNews,Ethereum Projects,1 month ago,2024-12-07 00:55:57.643090,vitaliks latest speech transcript future ethereum achieve key goal 100000 tps l2the development goal ethereum always revolved around technological advancement since 2015 despite facing challenge high transaction fee,-0.0572,0.165,0.0539
GoogleNews,Ethereum Projects,1 month ago,2024-12-07 00:55:57.643090,solana v ethereum detailed comparison blockchainsdiscover key difference solana ethereum transaction speed consensus mechanism decentralization fee,0.0,0.2,0.1
GoogleNews,Ethereum Projects,1 month ago,2024-12-07 00:55:57.643090,shiba inu bull ready charge ethereumbased defi project could deliver 20000x gain 2025this emerging ethereumbased token etfswap etf capturing attention crypto enthusiast prediction 20000x gain 2025,0.8957,0.2,0.5478500000000001
GoogleNews,Ethereum Projects,1 month ago,2024-12-07 00:55:57.643090,ethereumbased virtual reality platform decentraland top santiments ranking nft project developmentthe ethereum ethbased virtual reality platform decentraland mana clocked notable development activity nonfungible token nft,0.2023,0.5,0.35115
GoogleNews,Ethereum Projects,1 month ago,2024-12-07 00:55:57.643090,top 7 innovative crypto project october 2024 leading future decentralised financethis article highlight seven standout crypto project special focus qubetics tic introduced gasless transaction reduce cost,0.8316,0.3392857142857143,0.5854428571428572
GoogleNews,Ethereum Projects,1 month ago,2024-12-07 00:55:57.643090,trump crypto project submits proposal ethereum defi giant aavetrump crypto project submits proposal ethereum defi giant aave,0.0,0.0,0.0
GoogleNews,Ethereum Projects,1 month ago,2024-12-07 00:55:57.643090,retire ethereum 2030today want give bull case ethereum dapp platform deepdive eth crypto best hodl 2024 bull market,0.6705,1.0,0.83525
GoogleNews,Ethereum Projects,2 months ago,2024-12-07 00:55:57.643090,top ethereum defi project burn 17 million ethtop ethereum defi project led uniswap 1inch burned 7163 eth worth 174m one week signaling strong activity value creation,0.8591,0.41111111111111115,0.6351055555555556
GoogleNews,Ethereum Projects,2 months ago,2024-12-07 00:55:57.643090,bitcoin ethereum dominate layer1 project social engagementbitcoin btc solana sol ethereum eth lead layer1 blockchain project social activity revealing strong engagement last 24 hour,0.7003,0.125,0.41265
Reddit,solana,2019-07-26 21:25:42,2024-12-07 00:55:57.643090,welcome rsolana read get started welcome rsolana please read get started ℹ background solana fast secure censorshipresistant blockchain providing open infrastructure required global adoption say goodbye high fee slow confirmation solana built speed without tradeoff solana foundation based geneva switzerland maintains opensource project join fastest growing ecosystem crypto telegram httpstmesolana website httpssolanacom newsletter httpssolanacomnewsletter medium httpsmediumcomsolanalabs github httpsgithubcomsolanalabs twitter httpstwittercomsolanahttpstwittercomsolanas21 podcast httpssolanacompodcast technical network stats httpssolanabeachiohttpssolanabeachio doc httpsdocssolanacom discord httpssolanacomdiscord whitepaper httpssolanacomsolanawhitepaperpdf tokenomics httpssolanacomtokens rule spam repeat post personal attack swearing baseless claim misleading distortion fact news targeted harassment slander subreddit used informational purpose applicable law vary jurisdiction may limit prohibit accessing using various platform product discussed subreddit discussion project product endorsement,-0.1531,0.1872727272727273,0.01708636363636365
Reddit,solana,2024-11-30 15:01:12,2024-12-07 00:55:57.643090,solana ecosystem call december thursday december 5 500 pm 600 pm gmt1source httpslumaecosystemcalldecemberhttpslumaecosystemcalldecember httpspreviewreddite9d7icwmz14e1pngwidth400formatpngautowebps5186428c6101228c6eaa5abacd1e01df2ff06ba8 event every month ecosystem come together celebrateevery month win shared project showcased alpha droppedevery month people find value solanawhether youre builder investor curious there better way get speed everything happening solana agenda win month november recap state solana special guest rune cofounder sky definitely financial advice solana beyond token price started bottom solana community edition worktoearn earning opportunity worth 20k early early access giveaway closing poap project announcement apply herehttpecoapplysuperteamfun get news shared call part showcase reach kashdhandahttptwittercomkashdhanda twitter question feeling fomo catch everything missed last month right herehttpswwwyoutubecomwatchv1w5csdrkclo full video httpsxcomsuperteamstatus1864700776729464866httpsxcomsuperteamstatus1864700776729464866 httpswwwyoutubecomwatchvzxn1ztpqvnmhttpswwwyoutubecomwatchvzxn1ztpqvnm,0.9788,0.2910714285714286,0.6349357142857143
Reddit,solana,2024-12-06 22:02:54,2024-12-07 00:55:57.643090,seems like im fxcked one 0 liquidity coin blow went,0.3612,0.0,0.1806
Reddit,solana,2024-12-06 16:16:02,2024-12-07 00:55:57.643090,pumpfun banned uk im happy degenerate site got banned brought lot bullshit game genuinely hated much diluted meme ecosystem im hoping get regulation maybe one day get completely shutdown good pumpfun need die know wont agree sayi dont shit shit fuck pumpfunn,-0.3886,-0.03333333333333334,-0.21096666666666666
Reddit,solana,2024-12-06 18:51:47,2024-12-07 00:55:57.643090,good idea park gain stablecoinsare stablecoins actually safe enough swap gain would much convenient instead selling crypto bank account especially dont need money atm,0.9118,0.27999999999999997,0.5959
Reddit,solana,2024-12-06 10:36:13,2024-12-07 00:55:57.643090,bot driving price right bot buying like 001 every time drive price wouldnt buy larger amount impact price,0.3612,0.14285714285714285,0.25202857142857144
Reddit,solana,2024-12-06 22:10:50,2024-12-07 00:55:57.643090,gecko terminal say solana highest tvl milesthis seems differ coin gecko main website defi llama im curious anyone know theyre aggregating data,0.3182,0.033333333333333326,0.17576666666666665
Reddit,solana,2024-12-06 19:49:55,2024-12-07 00:55:57.643090,trying organically create community antirug shill get direction created coin le 1 want long term project something similar powsche hege even get community like started friend lol,0.8979,0.25,0.57395
Reddit,solana,2024-12-06 16:56:58,2024-12-07 00:55:57.643090,dont bother hyped meme coin launch sniper take second upon releasedwanted save money there new project everyone interested talking honestly dont bother trying buy early sniping bot buy supply within millisecond launched youll end paying shit ton gas fee transaction finally go coin already million dollar right time early sniper start selling honestly wouldnt surprised hawk launch actually done fairly always unfair average person sniping bot buying selling everyone put money,0.7967,0.13480519480519482,0.4657525974025974
Reddit,solana,2024-12-06 05:14:24,2024-12-07 00:55:57.643090,anybody else still cant discus crypto peer family reallysince 2020 telling friend group crypto future got laughed tried hard explain argument scamming b slim amount real stuff built laughed even finance buddy mine stuck gun grinded bear made decent money prepared last summer finally happening hard work knowledge paying tend think friend left behind started journey least think differently make good progress cycle believe true win next 58 year ill put 10000 hour space want hear anyone el experience friend even family said fuck dont know theyre talking shit either learning making change,0.91,0.06166666666666666,0.48583333333333334
Reddit,solana,2024-12-06 23:44:15,2024-12-07 00:55:57.643090,guy look order maximize profitsive recently gotten meme coin ive nothing crazy see people getting 100xs single day earning ten thousand dollar question look find coin early,0.2584,-0.11428571428571428,0.07205714285714288
Reddit,solana,2024-12-06 23:33:45,2024-12-07 00:55:57.643090,issue unstaking solana exodus wallet hi everyone recently tried unstake solana exodus wallet waited next epoch appeared wallet tried send new address unstake transaction suddenly became failed solscan transaction show program error instruction 1 failed unknown instruction error see fund exodus longer send stake sending staking say 002 left solscan see still original staked amount stake exodus show show nothing staked cant unstake recover fund thank,-0.802,-0.06540404040404041,-0.4337020202020202
Reddit,solana,2024-12-06 21:11:46,2024-12-07 00:55:57.643090,pumpfun doesnt enable scammer make scam prevalent illusion caused byokay hate pumpfun keep seeing mentality enables scamming true pumpfun actually eliminated hard rug net positive scam reduction space reason people think pumpfun filled rug see massive graveyard dead token assume shortterm token scam chain theyd right pumpfun token die way many token way filter noise think many token live day hit 100k mc thats many token sol sustain shouldnt 1 chance token hit 100k mc thats insanity least 810x eth thats maybe biggest reason youre losing money buying launch pumpfun removed barrier launching sent endless tsunami space people already drowning flood think im wrong name one thing inherent pumpfuns platform make scamming prevalent,-0.9846,0.04015788133435193,-0.47222105933282404
Reddit,solana,2024-12-06 19:20:57,2024-12-07 00:55:57.643090,every time try cant name popup isnt coming updo need extension something like,0.3612,0.0,0.1806
Reddit,solana,2024-12-06 22:17:18,2024-12-07 00:55:57.643090,bot resistant token possiblewould possible program bot resistant parameter token example purchase certain value would taxed heavily would certain amount time transaction wallet,0.6808,0.057142857142857134,0.36897142857142856
Reddit,solana,2024-12-06 21:37:53,2024-12-07 00:55:57.643090,uk ban pumpfun im happy didnt really expect happen,0.0258,0.5,0.2629
Reddit,solana,2024-12-07 00:51:03,2024-12-07 00:55:57.643090,critique buy strategy here im picking meme coin short term gambling strong social 1k follower many post 1k reach volume least five time market cap ensures active trading 1k holder 0 risk score solana tracker thats social burned lp token plus audting pumfun token graduate thing though token match criterion happen blue moon even there guarantee wont dud im looking way streamline criterion,0.7744,0.07083333333333335,0.42261666666666664
Reddit,solana,2024-12-07 00:34:19,2024-12-07 00:55:57.643090,read buying memecoins 2025 sol memecoin dictionary hi solana done lot question sub thought may well time contribute 2 cent made memecoin dictionary httpsimpartialbonobof93notionsitethe2024memecoindictionary6c022df5f95c4f97ab143c9ebecd79ee memectionary may avoid trivial question sub help everyone who starting understand go meme check herehttpsimpartialbonobof93notionsitethe2024memecoindictionary6c022df5f95c4f97ab143c9ebecd79ee cover 60 term platform influencers concept inside space hope community get value help sub avoid stupid question least 1 bag good play follow x trading_duckyhttpsxcomtrading_ducky like im continue post shit like help yall grow platform im 60 follower youre still early stay profitable peace,0.9565,-0.08333333333333331,0.4365833333333333
Reddit,solana,2024-12-07 00:29:05,2024-12-07 00:55:57.643090,kraken please take responsibility,0.3182,0.0,0.1591
Reddit,solana,2024-12-06 23:51:45,2024-12-07 00:55:57.643090,solana coin unlocks coming uphow affect sol surely wont great,-0.1012,0.65,0.27440000000000003
Reddit,solana,2024-12-06 17:35:50,2024-12-07 00:55:57.643090,mean removedi looking memecoin price absolutely crashed said removed mean exactly,0.0,-0.04375,-0.021875
Reddit,solana,2024-12-06 17:30:41,2024-12-07 00:55:57.643090,memefueled skepticismi rust engineer looking support web 3 space blockchains use rust certain capacity actually kind motion solana polkadot sui near solana looked like great blockchain focus overall odoption recent memecoin pumping solana left bad taste mouth seems become joke blockchain outside perspective question separate solana polkadot sui near investor stand point tokenomics consumer stand point developer stand point,0.91,0.11142857142857147,0.5107142857142858
Reddit,solana,2024-12-06 15:15:43,2024-12-07 00:55:57.643090,insight orcacr worksi tracing sniper bot trying understand work trying think every piece information bot access coin first created make snipe obvious data field currently many coin owner previously made amount transaction owner previously made amount sol dev owner wallet social channel linked coinpossible information social eg past usernames twitter name ticket though dont think advanced trading bot buying based name coin get stuck bot operates pumpfunhttppumpfun instantly buy coin cross lot metric could use whether coin safe know pump fun fact bot instantly buy coin also mean doesnt access historical price data could use usually first second person buying token cant possibly take account market cap etc anyone knowledge else bot tend look deciding coin trade please let know,0.7757,0.07214912280701755,0.42392456140350876
Reddit,solana,2024-12-06 17:47:43,2024-12-07 00:55:57.643090,solana meme coin platform pumpfun block uk user fca warning,-0.6486,0.0,-0.3243
Reddit,solana,2024-12-06 07:18:50,2024-12-07 00:55:57.643090,meme coin scamsid love create meme coin im always thinking way seems legit enough really dont want rug pull people time want make money funny token get attention people seems there way make money token creator besides rugpulling,0.8402,0.2375,0.5388499999999999
Reddit,solana,2024-12-06 20:10:44,2024-12-07 00:55:57.643090,tool used memecoin website creationi talking fun xyz io love website see everyday made tool make,0.8176,0.20000000000000004,0.5088
Reddit,solana,2024-12-06 19:48:46,2024-12-07 00:55:57.643090,colosseum codex poseidon pudgy penguin pengu solana temple mtndao v7source httpsblogcolosseumorgposeidonpudgypenguinspengumtndaov7httpsblogcolosseumorgposeidonpudgypenguinspengumtndaov7 poseidon pudgy penguin pengu web3js 20 solana temple mtndao v7 httpspreviewredditb5hb7qba8a5e1pngwidth960formatpngautowebps34648f02ee16b056682023895509094ad7d7c134 poseidon poseidon new framework developed turbin3httpsturbin3comrefblogcolosseumorg enables developer write deploy onchain solana program using typescript language familiar million worldwide core poseidon bridge gap typescript rust primary language solana development developer write program t leveraging robust type system familiar syntax poseidon transpilation engine convert typescript code equivalent anchor code translation allows developer deploy application solana blockchain without need master rust accelerating development process reducing learning curve associated solanas complex account model poseidon great getting started fast youre aiming build complex onchain protocol might still need get familiar rust solananative tool poseidon could gamechanger developer curious solana intimidated steep learning curve ultimately poseidon bring developer solana community making development accessible mean achieve first big win like deploying first onchain program much quicker introducing poseidon framework turbin3 write solana program typescripthttpsmediumcomhrknsinstwelcometoposeidon8c31dd2a1c73refblogcolosseumorg pudgy penguin launch pengu solana pudgy penguin one top nft collection ethereum set launch native token penguhttpsxcompudgypenguinsstatus1864851993094664602refblogcolosseumorg solana opportunity interview pudgy penguin ceo luca netz prior announcement shared detail solana obvious choice launch decision launch pengu solana stem solanas superior consumer experience technical capability youre looking trying optimize bringing million fan space hard refute solana best consumer experience today luca netz scalability performance solana also align perfectly pudgy penguin vision supporting extensive integration future growth without compromising speed reliability introduction pengu token open opportunity solana developer anything everything consumer really trying position youre leveraging ip using token integrate nft marketplace consumer application wed excited luca netz developer integrate pengu token various dapps including nft marketplace defi platform gaming environment consumerfocused apps wallet payment gateway loyalty program leverage token functionality solanas vibrant active developer community provides platform pudgy penguin expand already dynamic community isnt one chain building bridge enabling everyone participate luca netz addition technical advantage solanas strong ecosystem provides pudgy penguin tool infrastructure bridge gap digital physical major retailer expand physical product line top nft brand pudgy penguin release pengu token solanahttpswwwcoindeskcommarkets20241205topnftbrandpudgypenguinstoreleasepengutokenrefblogcolosseumorg solana web3js 20 solanas web3js 20 gamechanger developer making development process smoother efficient modular architecture web3js 20 significant upgrade instead one massive library functionality broken independent package whether need rpc communication transaction handling account decoding error identification pick choose exact module need web3js 20 introduces leakresistant key ensuring accidentally log store private key metadata exposed actual key byte also tap native webcrypto signing operation reducing reliance thirdparty dependency boosting overall security customization also easier new sdk add custom rpc method transport strategy tailored specific need whether want implement fallback secondary rpc server throttle api call manage rate limit employ roundrobin approach load balancing web3js 20 provides flexibility get familiar change update v20 check indepth guide helius triton one everything need know get started start building solana web3js 20 sdkhttpswwwheliusdevbloghowtostartbuildingwiththesolanaweb3js20sdkrefblogcolosseumorg intro new solanaweb3js 2xhttpsblogtritononeintrotothenewsolanaweb3js2xrefblogcolosseumorg solana temple solana temple wellnessfirst program specifically designed developer team building solana hosted flow solana temple combine wellness practice essential business strategy foster peak performance program dedicated maintaining healthy worklife balance preventing burnout enhancing productivity variety wellness activity tailored unique challenge faced blockchain developer scheduled take place bali january 12th february 9th solana temple held temple stateoftheart facility equipped coworking space pool gym premium amenity addition wellness activity solana temple offer business workshop focused fundraising strategy pitch development essential entrepreneurial skill combination wellness business strategy provides comprehensive foundation sustainable growth allowing solana developer excel area life program also foster community developer connect share experience support one another solana temple aim transformative experience designed elevate development journey clarity balance solana templehttpswwwflowbalixyzrefblogcolosseumorg mtndao v7 mtndao leading startup summit within solana ecosystem set host 7th iteration february 128 2025 downtown salt lake city building four successful year mtndao v7 promise deliver unparalleled actionpacked experience solana developer founder marketer business developer investor since inception mtndao become cornerstone solana community attracting thousand ambitious builder year summit instrumental launching numerous awardwinning startup nurturing nearly 20 global hackathon champion solidifying reputation premier launchpad blockchain innovation mtndao v7 maintains exclusive inviteonly format ensuring curated environment toptier talent collaborate thrive 2025 summit elevates experience providing exclusive private office downtown salt lake city reserved mtndao community throughout year move underscore commitment decentralized governance mtndao launching mtn token designed steer dao towards futarchypowered future attend mtndao v7 networking opportunity connect solanas ambitious builder including founder developer marketer business developer investor collaborative environment engage dynamic setting foster creativity innovation collaboration resourcerich workspace utilize toptier facility designed support continuous development project advancement communitydriven governance participate shaping future mtndao mtn token futarchy governance model solana devs encouraged stay informed follow mtndaohttpsxcommtndaorefblogcolosseumorg twitter update secure invite mtndao v7 applicationhttpstallysorwo04ebrefblogcolosseumorg quick hit announcing firstever solana ai hackathonhttpsxcomyashhsmstatus1862166390804787611refblogcolosseumorg yashhsmhttpsxcomyashhsm workshop web3 game development framework solana videohttpswwwyoutubecomwatchvgumtnarz8ucrefblogcolosseumorg superteam vietnam recap first cohort metaplex startup programhttpsxcommetaplexstatus1862585025788879341tor5ica0pkf0galpuncey_ws09refblogcolosseumorg metaplexhttpsxcommetaplex zk resource solanahttpsxcomrexstjohnstatus1861462888516661294refblogcolosseumorg rexstjohnhttpsxcomrexstjohn trusted setup zk cryptographyhttpsxcomblockiosaurusstatus1861802246872375369tej46m12yhijeczv4jgsdqs09refblogcolosseumorg blockiosaurushttpsxcomblockiosaurus solana block truly finalizedhttpsxcomlakestakeiostatus1863931792954138935refblogcolosseumorg lakestakeiohttpsxcomlakestakeio third cohort usdc grant program includes several solana projectshttpsxcombuildoncirclestatus1861801693433954757tej46m12yhijeczv4jgsdqs09refblogcolosseumorg buildoncirclehttpsxcombuildoncircle rome protocol blockchain interoperability modularized solanahttps0xvivek88mediumcomromeprotocolblockchaininteroperabilitywithmodularizedsolana659ee656aff3refblogcolosseumorg vivek nakrani plenum super app live solanahttpsxcomplenafinancestatus1862481698606522679tmgnirkwb2bxgbfwn6fvg6as09refblogcolosseumorg plenafinancehttpsxcomplenafinance tool resource poseidon exampleshttpsgithubcomturbin3poseidontreemasterexamplesrefblogcolosseumorg vote vault escrow favorite program typescript corresponding rust program transpiled poseidon carbon pipeline examplehttpsgithubcomsevenlabshqcarbontreemainexamplespumpfunalertsrefblogcolosseumorg demonstrates use helius geyserenhanced websocket process solana transaction using pumpfun decoder plasmahttpsgithubcomellipsislabsplasmarefblogcolosseumorg reference implementation sandwichresistant ammhttpswwwumbraresearchxyzwritingssandwichresistantammrefblogcolosseumorg solana pumpfuntradingapphttpsgithubcombifrosttechnologiespumpfuntradingapprefblogcolosseumorg sample solana maui app built c solnet search pumpfun token let buy sell instantly get hired metadao hiring founding engineer frontend engineerhttpsjobsmetadaofijob5gh_srcsolananetworkopportunitiesjobboardrefblogcolosseumorg help build metadaos product trojan hiring backend developerhttpsjobssolanacomcompaniestrojanjobs43257079backenddeveloperrefblogcolosseumorgcontent build scalable efficient backend system using nodejs typescript blackwing hiring senior backend engineerhttpswellfoundcomjobs2767528seniorbackendengineergh_srcsolananetworkopportunitiesjobboardrefblogcolosseumorg develop core product 0 1 environment rome protocol hiring customer integration engineerhttpsjobssolanacomcompaniesromeprotocol2jobs43098144customerintegrationsengineerrefblogcolosseumorgcontent deliver customized technical solution customer abc lab hiring staff rust protocol engineerhttpsjobssolanacomcompaniesabclabs2829ccc6b2e704c3ea61596a5317cf3fejobs43093149staffrustprotocolengineerrefblogcolosseumorgcontent bring new defi reserve protocol solana zotto hiring solana backend engineerhttpsjobssolanacomcompanieszottoltd2jobs42995257solanabackendengineerrefblogcolosseumorgcontent develop scalable backend service dapps listen validated episode austin chat anna yuan founding perena new company designed support liquidity interoperability capital efficiency stablecoins conversation cover comprehensive value chain stablecoins existing inefficiency current stablecoin ecosystem potential transformative impact payfi global finance discussion also touch regulatory landscape evolving role stablecoins traditional versus decentralized finance future payment system financial service interconnected digital economy stablecoins payfi replace traditional banking w anna yuan perenahttpssolanacomvalidatedepisodeswillstablecoinsandpayfireplacetraditionalbankingwannayuanperenarefblogcolosseumorg bonus episode launching sky solana rune christensenhttpsblockworkscopodcastlightspeedcdb51ca0ac4011ef95715b86635648derefblogcolosseumorg lightspeed rune christensen join lightspeed discus launch sky solana rune chose launch solana future defi decentralization crypto growth stablecoins ethereum v solana future music streaming built solana hiohttpsthomasbahamassubstackcompsolanaweekly94thefutureofmusicrefblogcolosseumorg solana weekly ryder havdale ceofounder hio music share theyre transforming music streaming solana platform prioritizes artist compensation community engagement 0xmert_ feared loved reply guy crypto industryhttpswwwyoutubecomwatchvb8aptxkx8refblogcolosseumorg shift happens episode mert share unfiltered insight solana set explosive growth despite market doubt helius helping developer build faster efficiently solana 1 trillion opportunity within ecosystem mert belief solana hit 1000 follow mikehalehttpstwittercommikehalerefblogcolosseumorg x warpcasthttpswarpcastcommikehalerefblogcolosseumorg thanks reading hope found something useful suggestion feedback let know think,0.9997,0.14564206420642065,0.5726710321032104
Reddit,solana,2024-12-06 13:04:19,2024-12-07 00:55:57.643090,guy filter bot coin bullx im using bullx mobile filter bot coin,0.0,0.0,0.0
