MainSource,Source,Publication Date,Pull_date,Pre-Processed Text,Sentiment_Vader,Sentiment_TextBlob,Average_Sentiment
RSS,https://cointelegraph.com/rss,2025-02-18 22:50:39+00:00,2025-02-19 00:53:02.675086,saylors strategy proposes 2b convertible note offering buy bitcoin michael saylors strategy looking raise another 2 billion via 0 convertible note purchase bitcoin potentially adding firm 478740 bitcoin stash,0.0,-0.1,-0.05
RSS,https://cointelegraph.com/rss,2025-02-18 21:50:12+00:00,2025-02-19 00:53:02.675086,3 reason stablecoin growth thrives globally u follow trump stablecoin use emerging market soar despite absence cryptofriendly regulation basic banking infrastructure u catch trend,0.3818,-0.004166666666666667,0.18881666666666666
RSS,https://cointelegraph.com/rss,2025-02-18 21:40:47+00:00,2025-02-19 00:53:02.675086,here happened crypto today need know happened crypto today latest news daily trend event impacting bitcoin price blockchain defi nfts web3 crypto regulation,0.0,0.25,0.125
RSS,https://cointelegraph.com/rss,2025-02-18 21:36:59+00:00,2025-02-19 00:53:02.675086,trader eye soleth reversal amid memecoin fallout ratio sol eth reversing course reaching record high january amid memecoin scandal,-0.2732,0.16,-0.0566
RSS,https://cointelegraph.com/rss,2025-02-18 21:00:00+00:00,2025-02-19 00:53:02.675086,tether cofounder launch rival stablecoin offer yield usp stablecoin allow user earn yield backed bond realworld asset,0.5423,0.0,0.27115
RSS,https://cointelegraph.com/rss,2025-02-18 20:37:06+00:00,2025-02-19 00:53:02.675086,ftx announces next repayment round may bankrupted crypto exchange started repaying creditor feb 18 two year dramatic collapse,-0.5106,-0.2111111111111111,-0.3608555555555556
RSS,https://cointelegraph.com/rss,2025-02-18 19:56:15+00:00,2025-02-19 00:53:02.675086,libra memecoin scandal ding solanas image here real reason sol solana price plummet drop onchain activity declining dapps tvl looming sol token unlocks approach,-0.6705,0.2,-0.23525
RSS,https://cointelegraph.com/rss,2025-02-18 19:40:58+00:00,2025-02-19 00:53:02.675086,grayscale launch pyth investment fund fund claim offer higherbeta exposure growth solana ecosystem grayscale continues expand suite singleasset crypto fund,0.5994,0.0,0.2997
RSS,https://cointelegraph.com/rss,2025-02-18 18:36:04+00:00,2025-02-19 00:53:02.675086,security platform blockaid raise 50m series b funding blockaid plan use fund growth research development demand onchain security tool expected rise,0.7096,-0.1,0.3048
RSS,https://cointelegraph.com/rss,2025-02-18 18:05:31+00:00,2025-02-19 00:53:02.675086,sec acknowledges cboes request list 21shares xrp etf cboe sought permission list four spot xrp etf feb 6 including 21shares core xrp trust,0.5106,-0.1,0.20530000000000004
RSS,https://cointelegraph.com/rss,2025-02-18 17:48:02+00:00,2025-02-19 00:53:02.675086,bitcoin price going crash bitcoins repeat test 95000 support increase chance liquidity grab price range low,0.296,0.0,0.148
RSS,https://cointelegraph.com/rss,2025-02-18 17:37:53+00:00,2025-02-19 00:53:02.675086,creeping doubt u gold reserve make case tokenized commodity america fort knox kentucky gold reserve havent audited 50 year,-0.3612,0.0,-0.1806
RSS,https://cointelegraph.com/rss,2025-02-18 16:49:56+00:00,2025-02-19 00:53:02.675086,sec deadline extension fork case coinbase john reed stark regulator case coinbase binance shaky ground following creation crypto task force,0.0516,-0.15833333333333333,-0.05336666666666666
RSS,https://cointelegraph.com/rss,2025-02-18 16:41:35+00:00,2025-02-19 00:53:02.675086,nigeria tax cryptocurrency transaction revenue boost nigeria planning amend digital asset regulation tax crypto transaction move belief bring substantial revenue,0.7184,0.0,0.3592
RSS,https://cointelegraph.com/rss,2025-02-18 16:16:29+00:00,2025-02-19 00:53:02.675086,ftx creditor speak plan lesson learned repayment start ftx collapse painful many creditor causing mental distress underscoring danger keeping crypto centralized exchange,-0.9201,-0.09999999999999998,-0.51005
RSS,https://cointelegraph.com/rss,2025-02-18 15:42:13+00:00,2025-02-19 00:53:02.675086,milei libragate debacle took month develop day unfold week libra memecoin sparked international scandal involving president argentina understand one must look back june 2024,-0.4404,0.0,-0.2202
RSS,https://cointelegraph.com/rss,2025-02-18 15:27:08+00:00,2025-02-19 00:53:02.675086,ethereum bottoming last analyst weigh eth price mirror 20192020 cycle chart pattern preceded 2550 price rally history repeat 2025,0.0,0.0,0.0
RSS,https://cointelegraph.com/rss,2025-02-18 15:00:00+00:00,2025-02-19 00:53:02.675086,energybacked currency key climbing kardashev scale aligning financial incentive energy production may key future prosperity abundance,0.5574,0.0,0.2787
RSS,https://cointelegraph.com/rss,2025-02-18 14:45:00+00:00,2025-02-19 00:53:02.675086,singularitynet mind network bring encryption ai agent fully homomorphic encryption may become core component privacycentric decentralized ai system according ben goertzel ceo singularitynet asi,0.0,0.0,0.0
RSS,https://cointelegraph.com/rss,2025-02-18 14:00:04+00:00,2025-02-19 00:53:02.675086,ethereum l2 abstract hit wallet drain tie cardex suspected abstract devs said wallet drain global agw issue isolated specific application potential breach abstractbased game cardex,-0.4939,-0.1,-0.29695
RSS,https://cointelegraph.com/rss,2025-02-18 13:24:53+00:00,2025-02-19 00:53:02.675086,ether reserve exchange hit 9year low supply shrink diminishing ether supply exchange may signal incoming price rally driven supply shock occurs strong buyer demand meet decreasing available eth,-0.2263,0.2777777777777778,0.025738888888888894
RSS,https://cointelegraph.com/rss,2025-02-18 13:19:24+00:00,2025-02-19 00:53:02.675086,tether eye 51 stake south american firm adecoagro tether plan acquire majority stake south american agribusiness firm adecoagro expanding investment amid record profit growing financial influence,0.5574,-0.08,0.2387
RSS,https://cointelegraph.com/rss,2025-02-18 12:46:55+00:00,2025-02-19 00:53:02.675086,ftxs 12b repayment mark key moment crypto industry recovery ftx set repay 12 billion creditor feb 18 marking key step exchange bankruptcy proceeding,-0.0258,0.0,-0.0129
RSS,https://cointelegraph.com/rss,2025-02-18 12:14:44+00:00,2025-02-19 00:53:02.675086,chinese ethereum holder spends 68m warn mass mind control chinese programmer sent 68 million eth burn address donation claiming corporation using mindcontrol technology enslave people,-0.6705,0.0,-0.33525
RSS,https://cointelegraph.com/rss,2025-02-18 11:33:15+00:00,2025-02-19 00:53:02.675086,opensea pause airdrop reward system user backlash opensea paused xp reward listing bidding collection new platform following feedback community,0.875,0.06818181818181818,0.47159090909090906
RSS,https://cointelegraph.com/rss,2025-02-18 11:20:04+00:00,2025-02-19 00:53:02.675086,crypto market today crypto market today investor view crypto product fund outflow recent libra memecoin scandal catalyst bearish market momentum,-0.4404,0.0,-0.2202
RSS,https://cointelegraph.com/rss,2025-02-18 10:23:05+00:00,2025-02-19 00:53:02.675086,bitcoin tease august 2023 breakdown analysis eye 85k btc price btc price action lack trend visit 85000 card bitcoin repeat 2023 trick new research say,-0.5859,0.11818181818181818,-0.2338590909090909
RSS,https://cointelegraph.com/rss,2025-02-18 10:08:21+00:00,2025-02-19 00:53:02.675086,dogecoin price today dogecoin price fell failure libra token triggered intensive selloff across memecoin sector,-0.5106,-0.31666666666666665,-0.41363333333333335
RSS,https://cointelegraph.com/rss,2025-02-18 10:02:20+00:00,2025-02-19 00:53:02.675086,polymarket bet fort knox audit reserve debate heat polymarket launched two related prediction market pressure mount u president donald trump conduct audit fort knox gold reserve,-0.1779,0.0,-0.08895
RSS,https://cointelegraph.com/rss,2025-02-18 09:48:37+00:00,2025-02-19 00:53:02.675086,hyperliquid roll hyperevm unveils bug bounty reward hyperliquid launched hyperevm layer1 blockchain unveiled bug bounty program offering 1 million security vulnerability,0.6908,0.0,0.3454
RSS,https://cointelegraph.com/rss,2019-06-18 13:04:00+01:00,2025-02-19 00:53:02.675086,twitter user claim tradingview ignored fibonacci retracement bug 5 year popular chart analysis service tradingview contains bug fibonacci retracement technical analysis tool,0.128,0.3,0.214
RSS,https://bitcoinmagazine.com/.rss/full/,2025-02-18 17:33:50+00:00,2025-02-19 00:53:02.675086,ambo ceo talk growth bitcoin lightning network tether usdt lightningcofounder ceo ambo jesse shrader belief broader adoption lightning network around corner usdt lightning game changer,0.3818,-0.4,-0.009100000000000025
RSS,https://bitcoinmagazine.com/.rss/full/,2025-02-18 15:00:00+00:00,2025-02-19 00:53:02.675086,next decade part 2 road aheada republication series post shinobi january 2020 predicting course bitcoin 2020s,0.0,0.0,0.0
RSS,https://bitcoinmagazine.com/.rss/full/,2025-02-18 13:59:20+00:00,2025-02-19 00:53:02.675086,mastering bitcoin onchain data gain deeper insight market cycle mastering bitcoin onchain data illuminates intricate pattern behind investor behavior price movement,0.6124,-0.4,0.10620000000000002
RSS,https://bitcoinmagazine.com/.rss/full/,2025-02-17 17:13:07+00:00,2025-02-19 00:53:02.675086,next decade part 1 road behinda republication series post shinobi january 2020 predicting course bitcoin 2020s,0.0,0.0,0.0
RSS,https://bitcoinmagazine.com/.rss/full/,2025-02-14 03:00:00+00:00,2025-02-19 00:53:02.675086,bitvm got massive upgradethe bitlayer finality bridge delivering promise bitvm still far fully trustless system progress made past year remarkable,0.6565,0.15,0.40325
RSS,https://bitcoinmagazine.com/.rss/full/,2025-02-12 20:29:27+00:00,2025-02-19 00:53:02.675086,bitcoin bank build ourselvesbitcoiners shouldnt sit around wait fiat bank financial company offer service built bitcoin,0.0,0.0,0.0
RSS,https://bitcoinmagazine.com/.rss/full/,2025-02-12 16:39:01+00:00,2025-02-19 00:53:02.675086,galoy launch bitcoinbacked loan software set groundwork opensource bankinggaloy founder ceo nicolas burtey want help borrower use bitcoin collateral loan introducing opensource software traditional banking stack,0.4588,0.0,0.2294
RSS,https://bitcoinmagazine.com/.rss/full/,2025-02-11 22:37:53+00:00,2025-02-19 00:53:02.675086,future bitcoin scaling institutional adoption strategic reserve rich rinesas bitcoin continues dominate financial landscape rich rines core dao explores evolutiondelving institutional adoption defi expansion potential global reserve asset,0.8481,0.125,0.48655
RSS,https://bitcoinmagazine.com/.rss/full/,2025-02-11 18:21:31+00:00,2025-02-19 00:53:02.675086,szabos micropayments mental transaction cost 25 year latera look reality ux friction widespread micropayments would create potential solution problem,0.1779,-0.05,0.06395
RSS,https://bitcoinmagazine.com/.rss/full/,2025-02-11 17:00:37+00:00,2025-02-19 00:53:02.675086,fold launch bitcoin reward credit cardfolds bitcoin reward credit card latest addition company suite bitcoinfocused financial product,0.9118,0.25,0.5809
RSS,https://bitcoinmagazine.com/.rss/full/,2025-02-10 11:00:03+00:00,2025-02-19 00:53:02.675086,proton wallet available everyone great starter selfcustodial bitcoin walletproton wallet wellsuited anyone looking begin bitcoin self custody journey andor anyone looking make semifrequent payment onchain managing relatively small bitcoin stack,0.6249,0.3166666666666667,0.47078333333333333
RSS,https://bitcoinmagazine.com/.rss/full/,2025-02-07 21:33:45+00:00,2025-02-19 00:53:02.675086,el salvador still bitcoin countrybitcoin may longer legal tender el salvador bitcoiners country havent given mission,0.128,0.2,0.164
RSS,https://bitcoinmagazine.com/.rss/full/,2025-02-07 13:57:13+00:00,2025-02-19 00:53:02.675086,introducing bitcoin everything indicatora single metric rule bitcoin everything indicator combine multiple key metric one comprehensive tool better investment decision,0.5994,0.10714285714285715,0.35327142857142857
RSS,https://bitcoinmagazine.com/.rss/full/,2025-02-06 20:03:42+00:00,2025-02-19 00:53:02.675086,here secret investing bitcoindont use leverage dont overexpose,0.0,-0.4,-0.2
RSS,https://bitcoinmagazine.com/.rss/full/,2025-02-06 18:04:44+00:00,2025-02-19 00:53:02.675086,lightning company raising good bitcoin tether usdt bitcoin made headline last week lightning ecosystem blossoming,0.4404,0.35,0.3952
RSS,https://bitcoinmagazine.com/.rss/full/,2025-02-06 17:50:20+00:00,2025-02-19 00:53:02.675086,nostr importance censorshipresistant communication innovation human progress open communication central part fostering innovation threatened modern digital age,0.7579,0.04,0.39895
RSS,https://bitcoinmagazine.com/.rss/full/,2025-02-06 15:00:00+00:00,2025-02-19 00:53:02.675086,bitcoin payment arent future theyre alreadytake look breez 1a1zs latest report deep diving current state bitcoins use transactional payment mechanism,0.0772,0.125,0.1011
RSS,https://bitcoinmagazine.com/.rss/full/,2025-02-06 14:09:30+00:00,2025-02-19 00:53:02.675086,bitcoins core remains unbreakablewhy surviving hostility doesnt mean court itand proactive engagement secures better future,0.8271,0.0625,0.4448
RSS,https://bitcoinmagazine.com/.rss/full/,2025-02-05 18:40:49+00:00,2025-02-19 00:53:02.675086,didnt take orange pill threw outthe government hasnt orange pilled theyve simply shown new way pull revolving door grifts,0.0,0.06818181818181818,0.03409090909090909
RSS,https://bitcoinmagazine.com/.rss/full/,2025-02-05 17:22:53+00:00,2025-02-19 00:53:02.675086,blackrock launch spot bitcoin etp europethe world largest asset manager set expand bitcoin footprint internationally new exchangetraded product switzerland,0.5859,0.13636363636363635,0.36113181818181816
RSS,https://bitcoinmagazine.com/.rss/full/,2025-02-05 17:11:55+00:00,2025-02-19 00:53:02.675086,bringin make bitcoin easier spend europe bringin founder ceo prashanth chandrashekar created product make easier european live bitcoin standard onboard bitcoin,0.765,0.04545454545454545,0.4052272727272727
RSS,https://bitcoinmagazine.com/.rss/full/,2025-02-04 23:39:46+00:00,2025-02-19 00:53:02.675086,president trump crypto czar host us first press conference bitcoin digital assetsdavid sack several procrypto politician discus future bitcoin crypto industry united state firstever u press conference digital asset,0.6486,0.05,0.3493
RSS,https://bitcoinmagazine.com/.rss/full/,2025-02-04 21:16:01+00:00,2025-02-19 00:53:02.675086,smart investor buy bitcoin real estatebitcoins finite supply unmatched liquidity deflationary model make ultimate asset modern investor learn forwardthinking investor decided buy bitcoin real estate inflationary world,0.5994,0.16285714285714287,0.3811285714285715
RSS,https://bitcoinmagazine.com/.rss/full/,2025-02-03 20:32:42+00:00,2025-02-19 00:53:02.675086,cowboy reservationthe logical soundness argument ossification bitcoin getting point pure absurdity,-0.3612,0.23214285714285715,-0.06452857142857144
RSS,https://bitcoinmagazine.com/.rss/full/,2025-02-03 20:18:03+00:00,2025-02-19 00:53:02.675086,bitcoin price already peakedbitcoin recently faced 10 retracement leading concern whether bull market article explores onchain metric institutional confidence macroeconomic factor determine whether bitcoin still room growth cycle peak reached,0.743,0.0,0.3715
RSS,https://bitcoinmagazine.com/.rss/full/,2025-02-03 19:45:40+00:00,2025-02-19 00:53:02.675086,buying holding bitcoin best strategy navigate trump tariff warbitcoin safest asset today,0.8555,1.0,0.9277500000000001
RSS,https://bitcoinmagazine.com/.rss/full/,2025-02-03 17:28:13+00:00,2025-02-19 00:53:02.675086,power play bitcoins institutionalization reshaping futureare new institutional player influenced bitcoin one influencing,0.34,0.13636363636363635,0.2381818181818182
RSS,https://bitcoinmagazine.com/.rss/full/,2025-01-31 20:07:04+00:00,2025-02-19 00:53:02.675086,bitcoin benjamin franklinsaving new generation riding wave folly,0.0,0.13636363636363635,0.06818181818181818
RSS,https://bitcoinmagazine.com/.rss/full/,2025-01-31 13:45:44+00:00,2025-02-19 00:53:02.675086,bitcoin bridgeas pleb fiat job important role play,0.4939,0.4,0.44695
RSS,https://bitcoinmagazine.com/.rss/full/,2025-01-31 13:26:54+00:00,2025-02-19 00:53:02.675086,take profit bitcoin cycle peaksselling bitcoin doesnt emotional decisionlearn use key market indicator take profit strategically reaccumulate lower price,0.4864,0.0,0.2432
RSS,https://bitcoinmagazine.com/.rss/full/,2025-01-31 10:15:01+00:00,2025-02-19 00:53:02.675086,forget ecb czechia embrace bitcoin termsthe czech national bank considering adding bitcoin reserve regardless european central bank think,0.1027,0.0,0.05135
RSS,https://bitcoinmagazine.com/.rss/full/,2025-01-30 21:42:05+00:00,2025-02-19 00:53:02.675086,tether back bitcoin lightning dominance startingthe stablecoin issuer choice bring usdt back bitcoin massive win lightning network joltzs bet taproot asset,0.7964,0.2,0.4982
RSS,https://bitcoinmagazine.com/.rss/full/,2025-01-30 17:24:24+00:00,2025-02-19 00:53:02.675086,trump executive order break bitcoins fouryear market cycle trump recent executive order may signal end bitcoins historically rigid fouryear market cycle regulatory clarity institutional adoption governmentbacked initiative could policy shift usher new era sustained growtheliminating dreaded crypto winter,-0.3612,0.04545454545454545,-0.15787272727272728
RSS,https://bitcoinmagazine.com/.rss/full/,2025-01-30 17:01:53+00:00,2025-02-19 00:53:02.675086,bitcoin empowers womenbitcoin tool woman around world closed traditional financial system,0.0,-0.03333333333333333,-0.016666666666666666
RSS,https://bitcoinmagazine.com/.rss/full/,2025-01-30 16:18:30+00:00,2025-02-19 00:53:02.675086,czech national bank ass bitcoin part reserve strategythe cnb approves plan explore allocating portion 140 billion reserve bitcoin,-0.2023,0.0,-0.10115
RSS,https://bitcoinmagazine.com/.rss/full/,2025-01-30 15:06:39+00:00,2025-02-19 00:53:02.675086,grayscale investment launch bitcoin miner etfgrayscale investment launched grayscale bitcoin miner etf mnrs offering investor way gain exposure bitcoin mining industry without directly holding btc tracking indxx bitcoin miner index etf includes major player like mara riot core scientific making attractive option looking diversify bitcoinrelated equity,0.7165,0.32083333333333336,0.5186666666666667
RSS,https://bitcoinmagazine.com/.rss/full/,2025-01-30 14:09:36+00:00,2025-02-19 00:53:02.675086,bitcoin cypherpunk spirit alive well africafrom south africa kenya ghana african using bitcoin better life arent asking anyones permission,0.8074,0.19999999999999998,0.5037
RSS,https://bitcoinmagazine.com/.rss/full/,2025-01-29 18:56:28+00:00,2025-02-19 00:53:02.675086,bitcoin ultimate hedge 97t global liquidity bubblediscover bitcoins fixed supply deflationary nature make ultimate asset navigating 97 trillion global liquidity bubble learn rising money supply influence market trend position bitcoin strategic hedge fiat currency debasement,0.3612,0.02,0.19060000000000002
RSS,https://bitcoinmagazine.com/.rss/full/,2025-01-29 18:10:45+00:00,2025-02-19 00:53:02.675086,bitcoin went wrongthe priority bitcoiners starting shift wrong direction represent actual existential threat success censorship resistant resilient system,-0.4215,-0.05,-0.23575
RSS,https://bitcoinmagazine.com/.rss/full/,2025-01-29 17:38:06+00:00,2025-02-19 00:53:02.675086,forget strategic bitcoin reserve moment mining censorship backf2pool mining pool representing 11 hash power bitcoin network censoring ofacsanctioned transaction,-0.2263,0.0,-0.11315
RSS,https://bitcoinmagazine.com/.rss/full/,2025-01-29 17:29:12+00:00,2025-02-19 00:53:02.675086,cme group launch option bitcoin friday future februarycme group looking obtain regulatory approval option successful cryptocurrency product launch,0.7845,0.375,0.57975
RSS,https://bitcoinmagazine.com/.rss/full/,2025-01-29 16:10:50+00:00,2025-02-19 00:53:02.675086,czech central bank head want buy bitcoin 5 reserve allocationthe czech national bank cnb considering 5 bitcoin allocation surpassing gold reserve approved move could reshape future national reserve asset,0.6808,0.0,0.3404
RSS,https://bitcoinmagazine.com/.rss/full/,2025-01-28 19:29:07+00:00,2025-02-19 00:53:02.675086,200000 realistic bitcoin price target cycleexplore potential bitcoin price reach 200000 cycle analyze market dynamic supply demand money multiplier effect ass feasibility,-0.3182,0.05555555555555555,-0.13132222222222223
RSS,https://bitcoinmagazine.com/.rss/full/,2025-01-28 19:24:46+00:00,2025-02-19 00:53:02.675086,go reserve people wont see differencearguing bitcoin reserve fund inclusion cryptocurrencies ultimately futile fight public large doesnt see difference,-0.6705,0.07142857142857142,-0.2995357142857143
RSS,https://bitcoinmagazine.com/.rss/full/,2025-01-28 17:04:20+00:00,2025-02-19 00:53:02.675086,preston pysh explains sab 121 beat strategic bitcoin reservepreston pysh explains rescission sab 121 could permanently entrench bitcoin financial system surpassing importance strategic bitcoin reserve,0.3612,0.0,0.1806
RSS,https://bitcoinmagazine.com/.rss/full/,2025-01-28 15:30:07+00:00,2025-02-19 00:53:02.675086,game theory strategic bitcoin reserve united state throwing weight behind bitcoin would effect massive shift game theory underpinning bitcoin probably way think,0.4215,-0.30000000000000004,0.06074999999999997
RSS,https://bitcoinmagazine.com/.rss/full/,2025-01-28 15:11:28+00:00,2025-02-19 00:53:02.675086,donald trump vow propel bitcoin new heightsdavid bailey ceo bitcoin magazine share insight private conversation president donald trump expressed support bitcoin community ambitious plan outcompete global competitor,0.7906,0.09659090909090909,0.4435954545454545
RSS,https://bitcoinmagazine.com/.rss/full/,2025-01-28 13:46:52+00:00,2025-02-19 00:53:02.675086,protect bitcoin anchorwatchbecca rubenfeld anchorwatch team recently unveiled firstofitskind bitcoin custody plus insurance solution aim keep customer bitcoin safe customer well,0.836,0.25,0.5429999999999999
RSS,https://bitcoinmagazine.com/.rss/full/,2025-01-27 22:10:39+00:00,2025-02-19 00:53:02.675086,microstrategy expands bitcoin holding 471100 btc worth 46 billionmicrostrategys relentless bitcoin buying spree continues adding 10100 btc 11 billion 471100 btc treasury valued 46 billion firm reinforces commitment bitcoincentric strategy amid market volatility,0.8316,0.04999999999999999,0.44079999999999997
RSS,https://bitcoinmagazine.com/.rss/full/,2025-01-27 18:54:56+00:00,2025-02-19 00:53:02.675086,declining shortterm u treasury yield impact bitcoin pricehow shifting treasury yield signal economic uncertainty bitcoin could benefit riskon safehaven asset,0.6908,0.2,0.4454
RSS,https://bitcoinist.com/feed/,2025-02-18 22:30:00+00:00,2025-02-19 00:53:02.675086,solana serious pressure bitcoin solbtc candle close crucialsolana intense selling pressure since reaching alltime high late january price struggled regain momentum facing negative sentiment meme coin market continues decline significantly impacting solanas ecosystem analyst suggest speculative meme coin trading one primary reason altcoins including sol underperformed,-0.8074,0.028809523809523823,-0.3892952380952381
RSS,https://bitcoinist.com/feed/,2025-02-18 21:00:22+00:00,2025-02-19 00:53:02.675086,argentina president milei face impeachment call libra collapse shake countryargentine president javier milei lauded bitcoinfocused policy facing impeachment involvement crypto scandal according multiple report opposition lawmaker argentina called impeachment president actively pushed new crypto quickly collapsed causing million dollar loss related,-0.836,0.06727272727272726,-0.38436363636363635
RSS,https://bitcoinist.com/feed/,2025-02-18 19:30:33+00:00,2025-02-19 00:53:02.675086,ethereum retests symmetrical triangle pattern analyst set next targetcrypto analyst trader tardigrade provided bullish outlook ethereum price predicting could soon witness massive move upside part analysis trader tardigrade also revealed high eth could reach enjoys upward trend ethereum set rally 3180 eth retests symmetrical triangle,0.5267,0.05333333333333334,0.29001666666666664
RSS,https://bitcoinist.com/feed/,2025-02-18 18:00:26+00:00,2025-02-19 00:53:02.675086,dogecoin show striking resemblance 2017s price trend trigger another surge new heightsa potential shift bearish performance dogecoins price seems horizon chart show encouraging trend growing bullish momentum doge upside strength gradually building analyst believe meme coin could entering beginning notable price move higher level dogecoins history,0.8074,0.2772727272727272,0.5423363636363636
RSS,https://bitcoinist.com/feed/,2025-02-18 16:14:52+00:00,2025-02-19 00:53:02.675086,hk asia holding buy one bitcoin stock surge 90 btc bull explodehk asia holding announced purchase one bitcoin february 13 calling investment symbolic scale following public announcement company stock surged 93 february 13 17 increase catapulted stock 550 hkd hong kong dollar equivalent 071 price fluctuated,0.3182,0.0,0.1591
RSS,https://bitcoinist.com/feed/,2025-02-18 15:34:54+00:00,2025-02-19 00:53:02.675086,best crypto buy bitcoin breakout horizon hype rule marketthe crypto king volatility lowest year valued 91k 109k since november 2024 signaling bitcoin breakout measured choppiness index btc experienced tight consolidation since 2015 indicator signal low volatility historically spur tremendous price movement either north,0.5267,0.3257936507936508,0.42624682539682535
