MainSource,Source,Publication Date,Pull_date,Pre-Processed Text,Sentiment_Vader,Sentiment_TextBlob,Average_Sentiment
Reddit,solana,2024-11-12 15:16:54,2024-11-14 00:51:54.491593,colosseum announced winner solana radar hackathonsource httpsxcomcolosseumstatus1856351054595576134httpsxcomcolosseumstatus1856351054595576134 colosseum thrilled announce winner usolana radar hackathon read winner honorable mention httpblogcolosseumorgannouncingthewinnersofthesolanaradarhackathonhttpblogcolosseumorgannouncingthewinnersofthesolanaradarhackathon winner accepted accelerator program announced coming day stay tuned congrats httpsredditcomlink1gpn0lyvideog4ly7uxfkh0e1player blog post httpsblogcolosseumorgannouncingthewinnersofthesolanaradarhackathonhttpsblogcolosseumorgannouncingthewinnersofthesolanaradarhackathon httpspreviewredditcc5yf7aqkh0e1pngwidth1200formatpngautowebpse3e2f901f5efd78b07a2812bb6b0d798bfcfa872 colosseum thrilled announce result solana radar hackathonhttpswwwcolosseumorgradarrefblogcolosseumorg global online competition focused bringing next wave highimpact project solana ecosystem radar 10th solana foundation hackathon 2nd run colosseum competition brought together founder developer 120 country build product spanning infrastructure gaming depin daos defi payment longtail consumer application httpspreviewreddit8hkg7ye3lh0e1pngwidth432formatpngautowebps8589695e55e706347f855e594677f93db404fab8 10000 participant teamed submit 1359 final projectshttpsarenacolosseumorgprojectsexploreseedb6a9f9b245e016a1refblogcolosseumorg judge making radar largest crypto hackathon date sphere solana mobile drift metadao portal dialect magicblock wormhole joined solana foundation sponsor hackathon offering platform crypto founder jumpstart journey httpspreviewreddit9dusvha5lh0e1pngwidth1800formatpngautowebps36fe2758fb812004342746137894ed3b7c373c69 solana hackathons demonstrate rapid growth developer talent innovation within ecosystem said dan albert executive director solana foundation idea founder emerging solana radar hackathon driving real momentum next wave product strengthen ecosystem without ado winner grand champion reflecthttpsarenacolosseumorgprojectsexplorereflectprotocolpreviousl3byb2ply3rzl2v4cgxvcmu_c2vlzd1ingi0ztywyzvinge0nzkwjnnlyxjjad1yzwzszwn0refblogcolosseumorg defi currency exchange based hedgebacked stablecoins received grand prize 50000 usdc along pass attend breakpoint 2025 abu dhabi uae httpswwwloomcomsharef55a4b055b1643fbbbb7cf57358222dbt9httpswwwloomcomsharef55a4b055b1643fbbbb7cf57358222dbt9 httpsredditcomlink1gpn0lyvideov05mzoq6mh0e1player consumer track first prize go pregamehttpsarenacolosseumorgprojectsexplorepregamepreviousl3byb2ply3rzl2v4cgxvcmu_c2vlzd1ingi0ztywyzvinge0nzkwjnnlyxjjad1wcmvnyw1lrefblogcolosseumorg p2p sport betting platform award 30000 usdc additional prize went second trenchestophttpsarenacolosseumorgprojectsexploretrenchestoppreviousl3byb2ply3rzl2v4cgxvcmu_c2vlzd1ingi0ztywyzvinge0nzkwjnnlyxjjad1ucmvuy2hlcy50b3arefblogcolosseumorg platform tokenizing reputation alpha caller third genesishttpsarenacolosseumorgprojectsexploregenesispreviousl3byb2ply3rzl2v4cgxvcmu_c2vlzd1ingi0ztywyzvinge0nzkwjnnlyxjjad1nzw5lc2lzrefblogcolosseumorg platform fractional tokenized ip investing fourth fanplayhttpsarenacolosseumorgprojectsexplorefanplaypreviousl3byb2ply3rzl2v4cgxvcmu_c2vlzd1ingi0ztywyzvinge0nzkwjnnlyxjjad1myw5wbgf5refblogcolosseumorg new betting mini game market live hamster racing fifth winkhttpsarenacolosseumorgprojectsexplorewinkpreviousl3byb2ply3rzl2v4cgxvcmu_c2vlzd1ingi0ztywyzvinge0nzkwjnnlyxjjad13aw5rrefblogcolosseumorg transaction marketplace customizable blink template although win prize would also like recognize particular order work following honorable mention blinkordhttpsarenacolosseumorgprojectsexploreblinkordpreviousl3byb2ply3rzl2v4cgxvcmu_c2vlzd1ingi0ztywyzvinge0nzkwjnnlyxjjad1ibglua29yzarefblogcolosseumorg hype3httpsarenacolosseumorgprojectsexplorehype3previousl3byb2ply3rzl2v4cgxvcmu_c2vlzd1ingi0ztywyzvinge0nzkwjnnlyxjjad1oexblmwrefblogcolosseumorg alorahttpsarenacolosseumorgprojectsexplorealorapreviousl3byb2ply3rzl2v4cgxvcmu_c2vlzd1ingi0ztywyzvinge0nzkwjnnlyxjjad1hbg9yyqrefblogcolosseumorg infrastructure track first prize go txtxhttpsarenacolosseumorgprojectsexploretxtxpreviousl3byb2ply3rzl2v4cgxvcmu_c2vlzd1ingi0ztywyzvinge0nzkwjnnlyxjjad10ehr4refblogcolosseumorg developer platform engineering team leverage runbooks award 30000 usdc additional prize went second tokamaihttpsarenacolosseumorgprojectsexploretokamaipreviousl3byb2ply3rzl2v4cgxvcmu_c2vlzd1ingi0ztywyzvinge0nzkwjnnlyxjjad10b2thbwfprefblogcolosseumorg developer tool catch error realtime monitoring third chakra drivehttpsarenacolosseumorgprojectsexplorechakradrivepreviousl3byb2ply3rzl2v4cgxvcmu_c2vlzd1ingi0ztywyzvinge0nzkwjnnlyxjjad1jagfrcmerefblogcolosseumorg endtoend decentralized file storage network fourth vervehttpsarenacolosseumorgprojectsexplorevervepreviousl3byb2ply3rzl2v4cgxvcmu_c2vlzd1ingi0ztywyzvinge0nzkwjnnlyxjjad12zxj2refblogcolosseumorg opensource embedded smart wallet infrastructure fifth dashyhttpsarenacolosseumorgprojectsexploredashypreviousl3byb2ply3rzl2v4cgxvcmu_c2vlzd1ingi0ztywyzvinge0nzkwjnnlyxjjad1kyxnoeqrefblogcolosseumorg wallet cluster management tool although win prize judge would also like recognize particular order work following honorable mention solpipehttpsarenacolosseumorgprojectsexploresolpipepreviousl3byb2ply3rzl2v4cgxvcmu_c2vlzd1ingi0ztywyzvinge0nzkwjnnlyxjjad1zb2xwrefblogcolosseumorg unruggablehttpsarenacolosseumorgprojectsexploreunruggablepreviousl3byb2ply3rzl2v4cgxvcmu_c2vlzd1ingi0ztywyzvinge0nzkwjnnlyxjjad11bnj1z2dhymxlrefblogcolosseumorg lookhttpsarenacolosseumorgprojectsexplorelookpreviousl3byb2ply3rzl2v4cgxvcmu_c2vlzd1ingi0ztywyzvinge0nzkwjnnlyxjjad1sb29rrefblogcolosseumorg gaming track first prize go supersizehttpsarenacolosseumorgprojectsexploresupersizepreviousl3byb2ply3rzl2v4cgxvcmu_c2vlzd1ingi0ztywyzvinge0nzkwjnnlyxjjad1zdxblcnnpemurefblogcolosseumorg fully onchain high stake multiplayer game award 30000 usdc additional prize went second arenahttpsarenacolosseumorgprojectsexplorethearenapreviousl3byb2ply3rzl2v4cgxvcmu_c2vlzd1ingi0ztywyzvinge0nzkwjnnlyxjjad10aguryxjlbmerefblogcolosseumorg pvp social trading game third windfallhttpsarenacolosseumorgprojectsexplorewindfallpreviousl3byb2ply3rzl2v4cgxvcmu_c2vlzd1ingi0ztywyzvinge0nzkwjnnlyxjjad13aw5kzmfsbarefblogcolosseumorg game based leveraging lsts fourth barnfighthttpsarenacolosseumorgprojectsexplorebarnfightpreviousl3byb2ply3rzl2v4cgxvcmu_c2vlzd1ingi0ztywyzvinge0nzkwjnnlyxjjad1iyxjuzmlnahqrefblogcolosseumorg unique gaming solution allowing community play tokenincentivized game together fifth quantrohttpsarenacolosseumorgprojectsexplorequantropreviousl3byb2ply3rzl2v4cgxvcmu_c2vlzd1ingi0ztywyzvinge0nzkwjnnlyxjjad1xdwfudhjvrefblogcolosseumorg pvp etf trading game although win prize judge would also like recognize particular order work following honorable mention degen marketshttpsarenacolosseumorgprojectsexploredegenmarketspreviousl3byb2ply3rzl2v4cgxvcmu_c2vlzd1ingi0ztywyzvinge0nzkwjnnlyxjjad1kzwdlbittyxjrzxrzrefblogcolosseumorg trenchtownhttpsarenacolosseumorgprojectsexploretrenchtownpreviousl3byb2ply3rzl2v4cgxvcmu_c2vlzd1ingi0ztywyzvinge0nzkwjnnlyxjjad10cmvuy2h0b3durefblogcolosseumorg defi track first prize go squeezehttpsarenacolosseumorgprojectsexploresqueezepreviousl3byb2ply3rzl2v4cgxvcmu_c2vlzd1ingi0ztywyzvinge0nzkwjnnlyxjjad1zcxvlzxplrefblogcolosseumorg platform long shorting token award 30000 usdc additional prize went second blackpoolhttpsarenacolosseumorgprojectsexploreblackpoolpreviousl3byb2ply3rzl2v4cgxvcmu_c2vlzd1ingi0ztywyzvinge0nzkwjnnlyxjjad1ibgfja3bvb2wrefblogcolosseumorg zkpenabled darkpool trading platform third pyehttpsarenacolosseumorgprojectsexplorepyepreviousl3byb2ply3rzl2v4cgxvcmu_c2vlzd1ingi0ztywyzvinge0nzkwjnnlyxjjad1wewurefblogcolosseumorg marketplace enabling stakers forward sell staking yield fourth neutral tradehttpsarenacolosseumorgprojectsexploreneutraltradepreviousl3byb2ply3rzl2v4cgxvcmu_c2vlzd1ingi0ztywyzvinge0nzkwjnnlyxjjad1uzxv0cmfsrefblogcolosseumorg platform investing onchain multistrat hedge fund fifth watthttpsarenacolosseumorgprojectsexplorewattprotocolpreviousl3byb2ply3rzl2v4cgxvcmu_c2vlzd02ndy3mthkyweyzju0nzdijnnlyxjjad13yxr0refblogcolosseumorg volatility farming protocol us natural market arbitrage generate real yield although win prize judge would also like recognize particular order work following honorable mention repotradehttpsarenacolosseumorgprojectsexplorerepotradepreviousl3byb2ply3rzl2v4cgxvcmu_c2vlzd1ingi0ztywyzvinge0nzkwjnnlyxjjad1yzxbvrefblogcolosseumorg bestlendhttpsarenacolosseumorgprojectsexplorebestlendpreviousl3byb2ply3rzl2v4cgxvcmu_c2vlzd1ingi0ztywyzvinge0nzkwjnnlyxjjad1izxn0bgvuzarefblogcolosseumorg solana giveshttpsarenacolosseumorgprojectsexploresolanagivespreviousl3byb2ply3rzl2v4cgxvcmu_c2vlzd1ingi0ztywyzvinge0nzkwjnnlyxjjad1zb2xhbmerz2l2zxmrefblogcolosseumorg orohttpsarenacolosseumorgprojectsexploreoropreviousl3byb2ply3rzl2v4cgxvcmu_c2vlzd1ingi0ztywyzvinge0nzkwjnnlyxjjad1pcm8refblogcolosseumorg kiwihttpsarenacolosseumorgprojectsexplorekiwipreviousl3byb2ply3rzl2v4cgxvcmu_c2vlzd1ingi0ztywyzvinge0nzkwjnnlyxjjad1raxdprefblogcolosseumorg depin track first prize go svachsakthihttpsarenacolosseumorgprojectsexploresvachsakthipreviousl3byb2ply3rzl2v4cgxvcmu_c2vlzd1ingi0ztywyzvinge0nzkwjnnlyxjjad1tdmfjafnha3roaqrefblogcolosseumorg offgrid cooperative network renewable energy award 30000 usdc additional prize went second adxhttpsarenacolosseumorgprojectsexploreadxsonextgenerationdecentralizedadexchangepreviousl3byb2ply3rzl2v4cgxvcmu_c2vlzd1ingi0ztywyzvinge0nzkwjnnlyxjjad1hzhgrefblogcolosseumorg decentralized ad network third curahttpsarenacolosseumorgprojectsexplorecurapreviousl3byb2ply3rzl2v4cgxvcmu_c2vlzd1ingi0ztywyzvinge0nzkwjnnlyxjjad1jdxjhrefblogcolosseumorg depin pet collar dog walking enthusiast fourth netsepiohttpsarenacolosseumorgprojectsexplorenetsepiopreviousl3byb2ply3rzl2v4cgxvcmu_c2vlzd1ingi0ztywyzvinge0nzkwjnnlyxjjad1uzxrzzxarefblogcolosseumorg decentralized vpn wifi hotspot service fifth kiko networkhttpsarenacolosseumorgprojectsexplorekikonetworkpreviousl3byb2ply3rzl2v4cgxvcmu_c2vlzd1ingi0ztywyzvinge0nzkwjnnlyxjjad1rawtvrefblogcolosseumorg depin network userowned weather station although win prize judge would also like recognize work following honorable mention unkomonhttpsarenacolosseumorgprojectsexploreunkomonpooptoearnpreviousl3byb2ply3rzl2v4cgxvcmu_c2vlzd1knjq0y2zjowexnji3zdrmjnnlyxjjad11bmsrefblogcolosseumorg pont networkhttpsarenacolosseumorgprojectsexplorepontnetworkpreviousl3byb2ply3rzl2v4cgxvcmu_c2vlzd1knjq0y2zjowexnji3zdrmjnnlyxjjad1wb250refblogcolosseumorg payment track first prize go fxswaphttpsarenacolosseumorgprojectsexplorefxswappreviousl3byb2ply3rzl2v4cgxvcmu_c2vlzd1knjq0y2zjowexnji3zdrmjnnlyxjjad1mehn3yxarefblogcolosseumorg protocol allows efficient swap forex stablecoins award 30000 usdc additional prize went second hylohttpsarenacolosseumorgprojectsexplorehylopreviousl3byb2ply3rzl2v4cgxvcmu_c2vlzd1ingi0ztywyzvinge0nzkwjnnlyxjjad1oewxvrefblogcolosseumorg dualtoken stablecoin system backed lsts third split financehttpsarenacolosseumorgprojectsexploresplitfinancepreviousl3byb2ply3rzl2v4cgxvcmu_c2vlzd1ingi0ztywyzvinge0nzkwjnnlyxjjad1zcgxpdarefblogcolosseumorg buy pay never payment solution fourth ribh financehttpsarenacolosseumorgprojectsexploreribhfinancepreviousl3byb2ply3rzl2v4cgxvcmu_c2vlzd1ingi0ztywyzvinge0nzkwjnnlyxjjad1yawjorefblogcolosseumorg payment inventory restocking solution smes fifth quartzhttpsarenacolosseumorgprojectsexplorequartzpreviousl3byb2ply3rzl2v4cgxvcmu_c2vlzd1ingi0ztywyzvinge0nzkwjnnlyxjjad1xdwfydhorefblogcolosseumorg taxefficient offramp without selling token although win prize judge would also like recognize particular order work following honorable mention pow cardshttpsarenacolosseumorgprojectsexplorepowcardspreviousl3byb2ply3rzl2v4cgxvcmu_c2vlzd1knjq0y2zjowexnji3zdrmjnnlyxjjad1wb3cry2fyzhmrefblogcolosseumorg bandohttpsarenacolosseumorgprojectsexplorebandopreviousl3byb2ply3rzl2v4cgxvcmu_c2vlzd1knjq0y2zjowexnji3zdrmjnnlyxjjad1iyw5kbwrefblogcolosseumorg zerocuthttpsarenacolosseumorgprojectsexplorezerocutpreviousl3byb2ply3rzl2v4cgxvcmu_c2vlzd1knjq0y2zjowexnji3zdrmjnnlyxjjad16zxjvy3v0refblogcolosseumorg localsolanahttpsarenacolosseumorgprojectsexplorelocalsolanapreviousl3byb2ply3rzl2v4cgxvcmu_c2vlzd1knjq0y2zjowexnji3zdrmjnnlyxjjad1sb2nhbhnvbgfuyqrefblogcolosseumorg daos network state track first prize go alphafchttpsarenacolosseumorgprojectsexplorealphafcpreviousl3byb2ply3rzl2v4cgxvcmu_c2vlzd1knjq0y2zjowexnji3zdrmjnnlyxjjad1hbhboywzjrefblogcolosseumorg community platform fanoperated sport team award 30000 usdc additional prize went second marshmallowhttpsarenacolosseumorgprojectsexploremarshmallowpreviousl3byb2ply3rzl2v4cgxvcmu_c2vlzd1knjq0y2zjowexnji3zdrmjnnlyxjjad1tyxjzaarefblogcolosseumorg app teach kid financial literacy onchain tool third bizzedhttpsarenacolosseumorgprojectsexplorebizzedpreviousl3byb2ply3rzl2v4cgxvcmu_c2vlzd1knjq0y2zjowexnji3zdrmjnnlyxjjad1iaxp6zwqrefblogcolosseumorg community platform evaluation group investing smbs fourth livingiphttpsarenacolosseumorgprojectsexplorelivingippreviousl3byb2ply3rzl2v4cgxvcmu_c2vlzd1knjq0y2zjowexnji3zdrmjnnlyxjjad1saxzpbmcrefblogcolosseumorg community platform information storytelling fifth blonkhttpsarenacolosseumorgprojectsexploreblonkpreviousl3byb2ply3rzl2v4cgxvcmu_c2vlzd1knjq0y2zjowexnji3zdrmjnnlyxjjad1ibg9urefblogcolosseumorg telegrambased solution creating dao multsigs collective action university award university award recognizes excellence project led university student go lexiconhttpsarenacolosseumorgprojectsexplorelexiconpreviousl3byb2ply3rzl2v4cgxvcmu_c2vlzd1knjq0y2zjowexnji3zdrmjnnlyxjjad1szxhpy29urefblogcolosseumorg receiving 10000 usdc prize project public good award public good award recognizes opensource project benefit developer across solana ecosystem go attest protocolhttpsarenacolosseumorgprojectsexploreattestprotocolpreviousl3byb2ply3rzl2v4cgxvcmu_c2vlzd1knjq0y2zjowexnji3zdrmjnnlyxjjad1hdhrlc3qrefblogcolosseumorg receiving 10000 usdc prize climate award climate award recognizing project built climate change sustainability mind go endcoinhttpsarenacolosseumorgprojectsexploreendcoinpreviousl3byb2ply3rzl2v4cgxvcmu_c2vlzd1knjq0y2zjowexnji3zdrmjnnlyxjjad1lbmrjb2lurefblogcolosseumorg receiving usdc prize 5000 thanks participant judge reviewed project sponsor across ecosystem congratulation winner x200b,0.9998,0.1349179175802552,0.5673589587901277
Reddit,solana,2024-11-12 15:12:09,2024-11-14 00:51:54.491593,best way buy pumpfun coinshi ive crypto space month ive got pumpfunhttppumpfun coin wan na try luck looking various review people using photon seems like take many fee get ripped without sol better swap jupiter pumpfunhttppumpfun coin there another tool 1second graph like photon doesnt take many fee thanks advance,0.9135,0.35714285714285715,0.6353214285714286
Reddit,solana,2024-11-12 17:52:17,2024-11-14 00:51:54.491593,cant transfer sol binance tried phantom trust wallet samewhy cant transfer sol httpspreviewreddit1nrhaoevdi0e1pngwidth504formatpngautowebpsabab659d20443a4324c6f0802a48d251aa985af8,0.5106,0.0,0.2553
Reddit,solana,2024-11-12 16:58:57,2024-11-14 00:51:54.491593,got random coin phantom wallet dust attack scam recently got 2 random coin wallet one worth around 10 usd worth around 4 usd dust attack token way token send 1m marketcap dex accidentally swapped one danger didnt used anything ray dexscreener pumpfun jup,-0.9169,-0.07999999999999999,-0.49845
Reddit,solana,2024-11-12 09:45:28,2024-11-14 00:51:54.491593,eurc solana via wanbridge circle fully backed euro stablecoin eurc new crosschain route wanbridge new route wanchain solana eurc stand eurc reliable euro backed stablecoin fully supported fund held regulated european financial institution compliant mica rule euro easily converted eurc using circle mint transferred across different blockchains using wanbridge eurc widely used defi thing trading lending borrowing designed eurc based usdc make easy developer add dapps platform head wanbridgehttpbridgewanchainorg bridge eurc,0.8119,0.12992424242424244,0.4709121212121212
Reddit,solana,2024-11-12 11:31:15,2024-11-14 00:51:54.491593,please stay safe protect crypto correctly target,0.7783,0.5,0.63915
Reddit,solana,2024-11-12 15:11:04,2024-11-14 00:51:54.491593,brief history solana cofounder raj gokal,0.0,0.0,0.0
Reddit,solana,2024-11-12 14:12:13,2024-11-14 00:51:54.491593,bought ledger staxhey guy bought hardwallet want know properly use trade solana using phantom use wallet safe way safe connect ledger phantom good advice welcome appreciated,0.936,0.45,0.6930000000000001
Reddit,solana,2024-11-12 13:20:31,2024-11-14 00:51:54.491593,introducing allmight accelerating usa leadership cryptosource httpsxcomallmight_usstatus1856043026910720096httpsxcomallmight_usstatus1856043026910720096 introducing allmight accelerating usa leadership crypto united build httpsredditcomlink1gpkju0videoduzt4h001h0e1player step 1 unite u crypto professional announcing allmight vip social mixer tour nyc miami chicago denver san francisco vip max 25 participant fun casual setting designed making real lasting connection register httpallmightuseventshttpallmightusevents httpsredditcomlink1gpkju0video451oc2451h0e1player bonus allmight based austin texas hosting event regular basis including vip social mixer week stay tuned even exciting announcement coming soon httpspreviewredditj76eubbb1h0e1pngwidth551formatpngautowebps83ea70bccc1858bc28cec94c0654be31b4344768 dont see city near dont qualify dont worry city event work creator student devs degens academic everything want see collab allmight event city near comment reach x200b,0.9715,0.04242424242424243,0.5069621212121213
Reddit,solana,2024-11-12 13:13:34,2024-11-14 00:51:54.491593,solana portfolio projecthi trying create project building web application show solana portfolio like token value simple portfolio though using solscan api paid way,0.7184,0.0,0.3592
Reddit,solana,2024-11-12 13:01:30,2024-11-14 00:51:54.491593,loop crypto payment infrastructure web3 live solanasource httpsxcomloopcrypto_xyzstatus1856105486875275304httpsxcomloopcrypto_xyzstatus1856105486875275304 officially live solanahttpsxcomsolana excited powering crypto subscription payment heliuslabshttpsxcomheliuslabs shout well launch partner using loop solana integral_xyz_httpsxcomintegral_xyz_ privy_iohttpsxcomprivy_io _kaitoaihttpsxcom_kaitoai chainedge_iohttpsxcomchainedge_io lever_iohttpsxcomlever_io neynarxyzhttpsxcomneynarxyz drakkarsoctobothttpsxcomdrakkarsoctobot lever_iohttpsxcomlever_io check source httpsxcomelenithinksstatus1856035699352564157httpsxcomelenithinksstatus1856035699352564157 thrilled announce loopcrypto_xyzhttpsxcomloopcrypto_xyz live solanahttpsxcomsolana couldnt ask better launch partner heliuslabshttpsxcomheliuslabs shoutout integral_xyz_httpsxcomintegral_xyz_ chainedge_iohttpsxcomchainedge_io privy_iohttpsxcomprivy_io lever_iohttpsxcomlever_io neynarxyzhttpsxcomneynarxyz drakkarsoctobothttpsxcomdrakkarsoctobot joined beta launch solana thought launch httpsredditcomlink1gpk6nnvideoc6xskx8lwg0e1player 1 made move solanahttpsxcomsolana chain already critical piece global payment infra poised continue scaling impact 35b stablecoin circulation chain fundamental fast global interoperable payment x200b 2 solanahttpsxcomsolana community dont know u yet loopcrypto_xyzhttpsxcomloopcrypto_xyz make simple accept onchain payment settle crypto stablecoins fiat use loop ui standalone integrate u existing system like stripehttpsxcomstripe chargebeehttpsxcomchargebee x200b 3 youre curious accepting crypto stats 80 payment merchant receive outside u 20 payment merchant crypto accepting crypto increase revenue grow customer base x200b 4 making move evm solana wasnt bad learn lot along way though posting series article experience moving evm support solana goal demystify others x200b 5 thats wrap excited solanahttpsxcomsolana support community hear launch check announcement released earlier today httpsloopcryptoxyzbloghellosolanahttpsloopcryptoxyzbloghellosolana httpspreviewreddit9bfjvwgzwg0e1pngwidth680formatpngautowebpscc520f9e1477d3a4e4d6ac64b37796bc2baa1675 x200b,0.9782,0.050534759358288765,0.5143673796791444
Reddit,solana,2024-11-12 12:56:33,2024-11-14 00:51:54.491593,lucky draw protocoli wanted make crypto seems fun onboard friend protocol create lucky drawspin wheel input let say prize like wif solana nft allow spin win,0.9741,0.44166666666666665,0.7078833333333333
Reddit,solana,2024-11-12 12:06:11,2024-11-14 00:51:54.491593,best api create solana toolshi im looking build tool solana blockchain want know api library would recommend developmentmostly insider wallet tracker wallet stand term ease use comprehensive documentation community support thanks advance,0.9531,0.6,0.77655
Reddit,solana,2024-11-12 20:24:41,2024-11-14 00:51:54.491593,tired back room solana meme coinsi watching elliotrades last night running big meme coin chain solana said dogwifhat popcat pick hell lol bonk right skipped past hypothesis wif popcat whale coin heavily owned handful people friend whereas bonk widely distributed amongst community im work id check see many individual holder v whale holding bonk glad see bonk running today wif popcat feel like people coin solana someone correct im wrong,-0.0258,0.0489010989010989,0.01155054945054945
Reddit,solana,2024-11-12 05:39:11,2024-11-14 00:51:54.491593,whats happening sending sol phantom wallet going another wallet,0.0,0.0,0.0
Reddit,solana,2024-11-12 11:33:07,2024-11-14 00:51:54.491593,stuck pending trust wallethey guy new crypto sent sol trust wallet another wallet stuck pending history since june 2024 trust wallet support told wait way changing gas fee cancelling order also tried sending wallet 0 sol initial order still pending since moved rest sol phantom wallet seems issue transferring coin figured still coin trust wallet say available question send remaining crypto technically still pending sent first wallet phantom wallet instead succeeds consequence example first pending transaction go sudden given time negative sol sorry clear enough many thanks advance,0.9413,0.12402597402597403,0.532662987012987
Reddit,solana,2024-11-12 11:16:00,2024-11-14 00:51:54.491593,buy soloing decentralized wayhello bought sol via cex worth 6950 im happy current cycle would like know way buy sol decentralized dex,0.7964,0.3666666666666667,0.5815333333333333
Reddit,solana,2024-11-12 03:29:35,2024-11-14 00:51:54.491593,solana price market cap ratio random thought since believe solana coin supply inflation rate higher seemssupposed many coin unlocks still coming every day one community really focused reducing solana inflation think interesting metric price market cap ratio even ifas market cap continues increase inflation price start plateau right price still roughly increasing line market cap ratio steady point market cap keep going price stagnates could important signal,0.8268,0.18915343915343918,0.5079767195767195
Reddit,solana,2024-11-11 12:42:07,2024-11-14 00:51:54.491593,15 million usd worth industrial rug machine revealedtoday key opinion leader kol seemingly exhausted frequent scam revealed finding twoday investigation major rugpull scheme shared discovery live stream pumpfunhttpspumpfuncoin6tab6pmvtqxycgc9wdzhbpcozmsngpr7rucnb8cpump ironically sarcastically said link tweethttpsxcommarcusopelliusstatus1855877450347020627 httpsredditcomlink1gora6ovideozzt5rzo1vj0e1player refers industrial rug pull there good reason scammer generate multiple wallet send sol hundred wallet creating new token without developer purchase snipe token incredible speed first block artificially inflate volume attract unsuspecting buyer certain threshold reached token collapse scammer reportedly making around 1280 sol daily suspected even wallet involved scheme kol shared video detailing operation recommend watching understand significant risk may exposed market update second part came 15 million 3 million httpsxcommarcusopelliusstatus1856463500102516963httpsxcommarcusopelliusstatus1856463500102516963,0.1027,0.13590706168831168,0.11930353084415585
Reddit,solana,2024-11-11 15:50:25,2024-11-14 00:51:54.491593,helped solana overcome vulnerability threatin late 2022 beginning 2023 research cryptos utilize eddsa signature scheme little known vulnerability regarding different implementation validate signature vulnerability exploited fork blockchains created security advisory solanas github resulted opening following issue firedancerhttpsgithubcomfiredanceriofiredancerissues38 didnt get anything reporting issue feeling made solana secured finally publishing little blog ithttpsmediumcomgalrogozinski_34211doblockchainsknowhowtohandledigitalsignatures90a45005a1fd like please share,0.8134,-0.1125,0.35045
Reddit,solana,2024-11-11 21:42:21,2024-11-14 00:51:54.491593,solution problemim trying change old eth50 solana network eth gas fee high want like 300 transaction idea convert solana network,0.6249,0.13,0.37745
Reddit,solana,2024-11-12 08:09:47,2024-11-14 00:51:54.491593,looking dataset solana smart contract vulnerabilitieshi everyone im working project focused vulnerability detection solana smart contract im trying find publicly available datasets catalog vulnerability specific solana contract im especially interested datasets may include example known vulnerability annotated data could help machine learning model training know ethereum wellestablished datasets smart contract security research havent able locate similar resource solana yet anyone know existing datasets resource even past project compiled kind information id appreciate guidance,0.9595,0.23928571428571427,0.5993928571428572
