MainSource,Source,Publication Date,Pull_date,Pre-Processed Text,Sentiment_Vader,Sentiment_TextBlob,Average_Sentiment
RSS,https://cointelegraph.com/rss,2024-11-14 00:41:29+00:00,2024-11-14 00:51:54.491593,tap pay crypto coming coinbase wallet l2 interoperability month jesse pollak creator ethereum layer2 network base expects coinbase wallet feature available user 50 country end 2025,-0.1027,-0.2,-0.15135
RSS,https://cointelegraph.com/rss,2024-11-13 22:11:42+00:00,2024-11-14 00:51:54.491593,fbi raid home polymarket ceo shayne coplan decentralized betting platform ceo targeted morning fbi raid seizing phone electronics,0.0,0.0,0.0
RSS,https://cointelegraph.com/rss,2024-11-13 22:00:00+00:00,2024-11-14 00:51:54.491593,new sec chair boost ether price etf inflow donald trump election cryptofriendly regulator may replace sec chair gensler opening door staking reward spot eth etf,0.7506,-0.02121212121212122,0.3646939393939394
RSS,https://cointelegraph.com/rss,2024-11-13 21:59:35+00:00,2024-11-14 00:51:54.491593,cantor fitzgerald ceo howard lutnick vying treasury secretary post lutnick become increasingly visible crypto community due relationship tether appearance bitcoin 2024,0.2023,-0.125,0.038650000000000004
RSS,https://cointelegraph.com/rss,2024-11-13 21:57:25+00:00,2024-11-14 00:51:54.491593,hitting holding 100k bitcoin price depends 118b endofyear btc option expiry bitcoins ability reach hold 100000 level influenced upcoming 118 billion option expiry,0.34,0.0,0.17
RSS,https://cointelegraph.com/rss,2024-11-13 21:51:12+00:00,2024-11-14 00:51:54.491593,crypto firm push sec change crypto court securing republican senate procrypto white house crypto firm pushing reform sec,0.3182,-0.12,0.0991
RSS,https://cointelegraph.com/rss,2024-11-13 21:45:00+00:00,2024-11-14 00:51:54.491593,arca blocktower merge unified crypto platform blocktowers venture capital arm blocktower venture capital continue operate independantly,0.3818,0.0,0.1909
RSS,https://cointelegraph.com/rss,2024-11-13 21:39:17+00:00,2024-11-14 00:51:54.491593,fireblocks partner south korean bank vat tokenization fireblocks extends service tokenization tax refund nonghyup bank,0.128,0.0,0.064
RSS,https://cointelegraph.com/rss,2024-11-13 20:52:37+00:00,2024-11-14 00:51:54.491593,u govt point gary wangs outstanding cooperation ftx case prosecutor suggested ftx cofounder would better able develop tool detect potential illegal activity crypto market sentenced time served,0.4939,0.2,0.34695
RSS,https://cointelegraph.com/rss,2024-11-13 20:44:10+00:00,2024-11-14 00:51:54.491593,here happened crypto today need know happened crypto today latest news daily trend event impacting bitcoin price blockchain defi nfts web3 crypto regulation,0.0,0.25,0.125
RSS,https://cointelegraph.com/rss,2024-11-13 20:27:15+00:00,2024-11-14 00:51:54.491593,bitcoin strategic reserve unlikely trump mike novogratz galaxy digital ceo argued expect nearly 36 trillion national debt paid without devaluing currency,-0.6124,-0.13333333333333333,-0.3728666666666667
RSS,https://cointelegraph.com/rss,2024-11-13 20:19:02+00:00,2024-11-14 00:51:54.491593,coinbase acquires onchain payment platform utopia utopia lab team join base network accelerate coinbase wallet onchain payment buildout,0.296,-0.8,-0.252
RSS,https://cointelegraph.com/rss,2024-11-13 19:38:52+00:00,2024-11-14 00:51:54.491593,sen warren top democrat committee crucial crypto policy ohio senator sherrod brown lost reelection elizabeth warren said would become ranking member senate banking committee,-0.128,0.25,0.061
RSS,https://cointelegraph.com/rss,2024-11-13 19:15:00+00:00,2024-11-14 00:51:54.491593,blackrocks buidl go multichain tokenized money market fund launch nearly half dozen new blockchain network,0.0,-0.015151515151515152,-0.007575757575757576
RSS,https://cointelegraph.com/rss,2024-11-13 19:00:00+00:00,2024-11-14 00:51:54.491593,opensea user drop security suit whale drive q3 nft comeback nifty newsletter nft whale bnb chain ecosystem drove increase trading volume third quarter 2024,0.6486,0.0,0.3243
RSS,https://cointelegraph.com/rss,2024-11-13 18:58:03+00:00,2024-11-14 00:51:54.491593,bitcoins record high push big bank profit billion report bitcoin price soared following election big bank reportedly accruing 14 billion future contract,0.4404,0.032,0.23620000000000002
RSS,https://cointelegraph.com/rss,2024-11-13 18:46:04+00:00,2024-11-14 00:51:54.491593,bitcoin price metric forecast rally 100k here039s data suggests bitcoins alltime high rally 93400 far,0.0,0.13,0.065
RSS,https://cointelegraph.com/rss,2024-11-13 18:00:00+00:00,2024-11-14 00:51:54.491593,curve finance launch 039savings crvusd039 yieldbearing stablecoin ensuring decentralized finance platform network remain siloed key hurdle defi application overcome,0.2732,0.0,0.1366
RSS,https://cointelegraph.com/rss,2024-11-13 17:50:14+00:00,2024-11-14 00:51:54.491593,price analysis 1113 btc eth sol bnb doge xrp ada shib ton avax bitcoin showing sign stopping advance toward 100000 several altcoins look poised follow,0.1027,0.0,0.05135
RSS,https://cointelegraph.com/rss,2024-11-13 17:40:00+00:00,2024-11-14 00:51:54.491593,silk road founder trust trump honor pledge commutation ross ulbricht sentenced life prison without possibility parole 2015 asked donald trump second chance freedom,0.8519,0.0,0.42595
RSS,https://cointelegraph.com/rss,2024-11-13 17:17:04+00:00,2024-11-14 00:51:54.491593,korean influencer allegedly led 232m crypto scam 215 arrested south korea taking step suppress crypto scam latest one biggest ever though,-0.8885,0.2,-0.34424999999999994
RSS,https://cointelegraph.com/rss,2024-11-13 17:05:18+00:00,2024-11-14 00:51:54.491593,xrp 039god candle imminent039 2 end year target analyst xrp price could imitate pull like dogecoin bullish chart pattern confirmed,0.3612,0.4,0.38060000000000005
RSS,https://cointelegraph.com/rss,2024-11-13 16:04:00+00:00,2024-11-14 00:51:54.491593,dogecoin follows classical charting principle hint 1000 doge rally dogecoin could break 1 threshold memecoin repeat 2021 trend generated 7000 rally,0.0,0.0,0.0
RSS,https://cointelegraph.com/rss,2024-11-13 14:35:03+00:00,2024-11-14 00:51:54.491593,grid success show invisible blockchain winning play gaming firm split whether blockchain main character web3 game,0.8591,0.07333333333333333,0.46621666666666667
RSS,https://cointelegraph.com/rss,2024-11-13 14:32:08+00:00,2024-11-14 00:51:54.491593,100k bitcoin 9 analyst share endofyear btc price prediction bitcoin rallying almost 30 last week analyst setting sight expect btc end year,0.296,0.0,0.148
RSS,https://cointelegraph.com/rss,2024-11-13 14:00:00+00:00,2024-11-14 00:51:54.491593,moonpay boost selfcustodial crypto spending new solution moonpay balance support deposit withdrawal euro british pound future plan expand u,0.8442,0.04545454545454545,0.4448272727272727
RSS,https://cointelegraph.com/rss,2024-11-13 14:00:00+00:00,2024-11-14 00:51:54.491593,zero gravity lab secures 290m financing decentralized ai operating system startup closed 40 million seed round secured another 250 million liquid fund blockchainbased decentralized ai infrastructure,0.6124,-0.15000000000000002,0.23120000000000002
RSS,https://cointelegraph.com/rss,2024-11-13 13:56:25+00:00,2024-11-14 00:51:54.491593,trump win set path 100k bitcoin price copper head research procrypto regulation incoming trump administration could push bitcoin toward 100000 early 2025 institution accelerate adoption,0.5859,0.45,0.51795
RSS,https://cointelegraph.com/rss,2024-11-13 13:20:00+00:00,2024-11-14 00:51:54.491593,creator ip right must protected age ai tracverse founder traverse founder amos thomas belief story foundation everything humanity must everything power protect,0.6705,0.2857142857142857,0.47810714285714284
RSS,https://cointelegraph.com/rss,2024-11-13 12:17:35+00:00,2024-11-14 00:51:54.491593,sec approves coincheck first japanese crypto exchange nasdaq coincheck set make history first japanese crypto exchange list nasdaq following sec approval,0.7003,0.042857142857142864,0.3715785714285714
RSS,https://bitcoinmagazine.com/.rss/full/,2024-11-13 18:06:59+00:00,2024-11-14 00:51:54.491593,trump pump road capture failurebitcoin ossification ultimately result incentive size network making improving impossible coordinate happening soon good thing,0.802,0.011111111111111108,0.40655555555555556
RSS,https://bitcoinmagazine.com/.rss/full/,2024-11-13 18:00:00+00:00,2024-11-14 00:51:54.491593,truth bitcoin price model stocktoflow power law beyonddiscover strength limitation practical application popular bitcoin price model like stocktoflow bitcoin power law learn leverage realtime metric smarter investment strategy,0.891,0.6,0.7455
RSS,https://bitcoinmagazine.com/.rss/full/,2024-11-13 17:46:25+00:00,2024-11-14 00:51:54.491593,bitcoin may hit 100000 faster expectedat rate hitting 100k week seems likely,0.0,0.0,0.0
RSS,https://bitcoinmagazine.com/.rss/full/,2024-11-13 17:31:05+00:00,2024-11-14 00:51:54.491593,second crypto president like firsta look history cryptography regulation bill clinton might imply cryptocurrencies donald trump,0.3612,0.0,0.1806
RSS,https://bitcoinmagazine.com/.rss/full/,2024-11-13 16:44:38+00:00,2024-11-14 00:51:54.491593,bought bitcoin today felt nothingusually buying bitcoin joyful process id satisfaction picking least bitcent,0.7783,-0.3,0.23915
RSS,https://bitcoinmagazine.com/.rss/full/,2024-11-13 14:50:12+00:00,2024-11-14 00:51:54.491593,scaling bitcoin practically ark labswith ark lab marco argentieri fulfilling latest stage mission help people easily transact bitcoin,0.6249,0.4666666666666667,0.5457833333333333
RSS,https://bitcoinmagazine.com/.rss/full/,2024-11-13 13:18:51+00:00,2024-11-14 00:51:54.491593,bitcoin price psychological leap journey 100k 1mas bitcoin hit new alltime high psychological shift underway,0.0,0.0740909090909091,0.03704545454545455
RSS,https://bitcoinmagazine.com/.rss/full/,2024-11-12 20:38:21+00:00,2024-11-14 00:51:54.491593,bitcoin hash ribbon indicator miner show unwavering optimism hash rate hit new highsbitcoins hash rate surging new alltime high signaling strong miner confidence network future discover hash ribbon indicator help decode miner sentiment bullish crossover could hint upcoming price momentum,0.9153,0.1732121212121212,0.5442560606060606
RSS,https://bitcoinmagazine.com/.rss/full/,2024-11-12 19:02:39+00:00,2024-11-14 00:51:54.491593,digit addiction pandemica look compulsive addictive behavior encouraged structure fiat world,0.3612,0.0,0.1806
RSS,https://bitcoinmagazine.com/.rss/full/,2024-11-12 07:42:01+00:00,2024-11-14 00:51:54.491593,great scott could go back 2009 buy bitcoinas barrel 2024 dream hopping delorean rewinding 2009 buy bitcoin penny per coin tempts u,0.7269,0.4,0.56345
RSS,https://bitcoinmagazine.com/.rss/full/,2024-11-11 21:17:16+00:00,2024-11-14 00:51:54.491593,bitcoin business feel safe u wake trump victorythe bitcoin industry breathes collective exhale trump bitcoinrelated rhetoric policy proposal boon industry,0.4404,0.5,0.4702
RSS,https://bitcoinmagazine.com/.rss/full/,2024-11-11 19:53:29+00:00,2024-11-14 00:51:54.491593,race frontrun u governmentthe u want buy bitcoin country first,0.0772,0.25,0.1636
RSS,https://bitcoinmagazine.com/.rss/full/,2024-11-11 18:43:09+00:00,2024-11-14 00:51:54.491593,thank donald trump bitcoins alltime highits race bitcoin sign slowing,0.3612,0.0,0.1806
RSS,https://bitcoinmagazine.com/.rss/full/,2024-11-08 19:02:07+00:00,2024-11-14 00:51:54.491593,half way 4 year bitcoin cyclebitcoins fouryear rhythm midcycle insight investor expect,0.0,-0.16666666666666666,-0.08333333333333333
RSS,https://bitcoinmagazine.com/.rss/full/,2024-11-08 17:32:26+00:00,2024-11-14 00:51:54.491593,dont lose sight bitcoin missionfighting transaction privacy need remain core,0.3089,0.0,0.15445
RSS,https://bitcoinmagazine.com/.rss/full/,2024-11-08 15:00:00+00:00,2024-11-14 00:51:54.491593,democrat must embrace bitcoin surviveif democratic party future u politics must embrace bitcoin going forward,0.743,0.0,0.3715
RSS,https://bitcoinmagazine.com/.rss/full/,2024-11-08 14:00:00+00:00,2024-11-14 00:51:54.491593,trump bitcoins saviortrump going good thing bitcoin continue malicious path regulation followed biden,0.4404,0.7,0.5702
RSS,https://bitcoinmagazine.com/.rss/full/,2024-11-08 11:32:46+00:00,2024-11-14 00:51:54.491593,bitcoins time come u election result trump win put world notice embrace bitcoin get left behind,0.7269,0.13333333333333333,0.43011666666666665
RSS,https://bitcoinmagazine.com/.rss/full/,2024-11-07 15:03:06+00:00,2024-11-14 00:51:54.491593,bitcoin report key trend insight bitcoin price forecastdiscover key insight expert analysis bullish bitcoin price forecast featured october 2024 edition bitcoin report,0.0,0.0,0.0
RSS,https://bitcoinmagazine.com/.rss/full/,2024-11-07 11:56:06+00:00,2024-11-14 00:51:54.491593,satoshi nakamoto robin hood digital age stole himselfin modernday robin hood tale satoshi nakamoto didnt rob richhe stole discover bitcoins mysterious creator rewrote rule wealth redistribution without tights crossbow gave power back people,0.7289,0.0,0.36445
RSS,https://bitcoinmagazine.com/.rss/full/,2024-11-06 07:55:14+00:00,2024-11-14 00:51:54.491593,probitcoin donald trump becomes 47th president united state bitcoin magazine report la vega realtime election result powered stand crypto,0.4215,0.0,0.21075
RSS,https://bitcoinmagazine.com/.rss/full/,2024-11-05 12:41:43+00:00,2024-11-14 00:51:54.491593,trump coin revolutionary onecoini dont think donald trump actually changed mind cryptocurrency much since three year ago think want scam,-0.5267,0.1,-0.21334999999999998
RSS,https://bitcoinmagazine.com/.rss/full/,2024-11-04 20:08:05+00:00,2024-11-14 00:51:54.491593,u establish strategic bitcoin reservewe send message world,0.0,0.0,0.0
RSS,https://bitcoinmagazine.com/.rss/full/,2024-11-04 19:19:05+00:00,2024-11-14 00:51:54.491593,paid bitcoin btcpay documentary showcase bitcoin medium exchange bitcoin 2024 conference nashvillewatch new documentary paid bitcoin bitcoin use bitcoin 2024 nashville,0.0,0.04545454545454545,0.022727272727272724
RSS,https://bitcoinmagazine.com/.rss/full/,2024-11-04 15:30:29+00:00,2024-11-14 00:51:54.491593,im grateful trump embrace bitcoinas u face consequential election lifetime trump administration offer unprecedented opportunity bitcoin community,0.7964,0.6,0.6981999999999999
RSS,https://bitcoinmagazine.com/.rss/full/,2024-11-01 22:25:58+00:00,2024-11-14 00:51:54.491593,coinbase embarrassing buying bitcoincoinbase fumbling obvious stop buying back share start stacking sat already,-0.3818,0.0,-0.1909
RSS,https://bitcoinmagazine.com/.rss/full/,2024-11-01 17:59:39+00:00,2024-11-14 00:51:54.491593,bitcoin time high postponed please hodlwho win election dictate see new time high,0.6486,0.3140909090909091,0.4813454545454545
RSS,https://bitcoinmagazine.com/.rss/full/,2024-11-01 16:50:43+00:00,2024-11-14 00:51:54.491593,bitcoins price matter lotits okay excited bitcoin hitting new alltime high fact pumped,0.5267,0.29284090909090904,0.40977045454545447
RSS,https://bitcoinmagazine.com/.rss/full/,2024-11-01 15:47:09+00:00,2024-11-14 00:51:54.491593,mathematically forecasting peak bitcoin price next bull cycle bitcoins bull cycle price prediction historical pattern tell u next peak,0.0,0.0,0.0
RSS,https://bitcoinmagazine.com/.rss/full/,2024-11-01 14:47:51+00:00,2024-11-14 00:51:54.491593,basically nothing got 500 bitcoinproducts like lolli fold like hack make stacking sat easy,0.7845,0.43333333333333335,0.6089166666666667
RSS,https://bitcoinmagazine.com/.rss/full/,2024-10-31 17:14:57+00:00,2024-11-14 00:51:54.491593,whitepaper simplest idea profoundthe bitcoin whitepaper barely describes tiny portion bitcoin protocol vaguely bit cover important,0.2023,-0.012499999999999997,0.09490000000000001
RSS,https://bitcoinmagazine.com/.rss/full/,2024-10-31 15:50:26+00:00,2024-11-14 00:51:54.491593,latest fake satoshi fake bitcoin creator needthe newest fake satoshi nakamoto refreshing reminder medium need stop looking bitcoins creator,-0.8885,-0.1,-0.49424999999999997
RSS,https://bitcoinmagazine.com/.rss/full/,2024-10-31 10:26:18+00:00,2024-11-14 00:51:54.491593,today bitcoins birthdayyes bitcoin first proposed via satoshis white paper october 31 2008 doesnt mean today bitcoins birthday,0.0,-0.020833333333333332,-0.010416666666666666
RSS,https://bitcoinmagazine.com/.rss/full/,2024-10-31 05:00:00+00:00,2024-11-14 00:51:54.491593,forget vampire werewolvesthe scariest costume halloween money printerforget dracula werewolvesthis halloween real terror come fiat currency money printer costume inflation haunt wallet bitcoin step hero save u horror currency debasement,-0.5994,0.2,-0.19970000000000002
RSS,https://bitcoinmagazine.com/.rss/full/,2024-10-30 16:03:50+00:00,2024-11-14 00:51:54.491593,bitcoin popularity index bpi measure bitcoin interest around worldthe bitcoin popularity index unique tool measuring global bitcoin interest google search data highlighting key adoption trend,0.9042,0.125,0.5146
RSS,https://bitcoinmagazine.com/.rss/full/,2024-10-30 15:31:04+00:00,2024-11-14 00:51:54.491593,david marcus paypal president bitcoin believerleading team lightspark david marcus poised make lightning network biggest payment network world,0.25,0.0,0.125
RSS,https://bitcoinmagazine.com/.rss/full/,2024-10-30 10:18:46+00:00,2024-11-14 00:51:54.491593,bitcoin best year ever 2024 breakthrough year wed long waited,0.6369,0.475,0.5559499999999999
RSS,https://bitcoinmagazine.com/.rss/full/,2024-10-29 16:55:39+00:00,2024-11-14 00:51:54.491593,bhutan another country using bitcoin escape povertya first hand look effect bhutan bitcoin policy,0.5994,0.25,0.4247
RSS,https://bitcoinmagazine.com/.rss/full/,2024-10-29 14:07:04+00:00,2024-11-14 00:51:54.491593,21 million fashion make bitcoin clothes worth sats21 million fashion bitcoin clothing brand combine fashion crypto get best,0.7269,0.65,0.68845
RSS,https://bitcoinmagazine.com/.rss/full/,2024-10-28 18:14:48+00:00,2024-11-14 00:51:54.491593,trump momentum big rig bitcoin candidate wini think game democrat,-0.128,-0.2,-0.164
RSS,https://bitcoinmagazine.com/.rss/full/,2024-10-28 18:07:42+00:00,2024-11-14 00:51:54.491593,money electric distracted nonsenseas someone wrote book origin story bitcoin felt still watch money electric perhaps comment take even watching purpose waste time,-0.6369,-0.2,-0.41845
RSS,https://bitcoinmagazine.com/.rss/full/,2024-10-28 16:55:34+00:00,2024-11-14 00:51:54.491593,ark could potentially learn lightninga rough idea ark service provider could manage liquidity efficiently create cheaper smoother experience user,0.5859,-0.05,0.26794999999999997
RSS,https://bitcoinmagazine.com/.rss/full/,2024-10-28 13:37:29+00:00,2024-11-14 00:51:54.491593,bitcoin wont let transcend politicsbitcoin escape hatch stop caring political process,0.4019,0.0,0.20095
RSS,https://bitcoinmagazine.com/.rss/full/,2024-10-25 18:46:16+00:00,2024-11-14 00:51:54.491593,microsoft invests bitcoin likely via spot etfsmicrosofts management may choose invest bitcoin etf holding coin,0.0,0.0,0.0
RSS,https://bitcoinmagazine.com/.rss/full/,2024-10-25 18:26:24+00:00,2024-11-14 00:51:54.491593,satoshi nakamoto statue lugano inspiring luganos new disappearing satoshi nakamoto statue beautiful tribute bitcoins anonymous founder,0.7717,0.4954545454545454,0.6335772727272727
RSS,https://bitcoinmagazine.com/.rss/full/,2024-10-25 15:18:08+00:00,2024-11-14 00:51:54.491593,lightspark announces new bitcoin l2 upgraded uma capabilitieslightspark unveils new bitcoin l2 broadens functionality universal money address uma standard release uma extend uma auth uma request,0.1779,0.06818181818181818,0.12304090909090909
RSS,https://bitcoinmagazine.com/.rss/full/,2024-10-25 14:08:20+00:00,2024-11-14 00:51:54.491593,bitcoin repeating previous bull cyclesare repeating pattern accustomed time something different,0.0,-0.08333333333333333,-0.041666666666666664
RSS,https://bitcoinmagazine.com/.rss/full/,2024-10-24 17:20:48+00:00,2024-11-14 00:51:54.491593,blackrocks ibit bitcoin etf successful new etf 4 yearsinstitutional investment bitcoin getting started,0.5859,0.4431818181818182,0.5145409090909091
RSS,https://bitcoinmagazine.com/.rss/full/,2024-10-24 13:10:15+00:00,2024-11-14 00:51:54.491593,ecb economist arent exactly wrong bitcoin theyre uselessa recent paper ecb author claim existence bitcoin could impoverish nonholders latecomer drew ire many bitcoiners isnt essentially hyperbitcoinization,0.3724,0.0,0.1862
RSS,https://bitcoinmagazine.com/.rss/full/,2024-10-24 13:01:06+00:00,2024-11-14 00:51:54.491593,jack dorsey influence bitcoin learned jack dorsey provides 60 bitcoin core funding think need decentralize support,0.4019,0.0,0.20095
RSS,https://bitcoinist.com/feed/,2024-11-14 00:30:53+00:00,2024-11-14 00:51:54.491593,italy crypto tax uturn new 28 rate signal fresh startcrypto watcher investor italy received encouraging news prime minister giorgia melonis government considering watereddown tax hike initial proposal 46 announced last second week october italian government currently reevaluating plan limit increase 28 related reading judge reject,0.6486,0.05454545454545454,0.35157272727272726
RSS,https://bitcoinist.com/feed/,2024-11-13 23:00:19+00:00,2024-11-14 00:51:54.491593,dogecoin price chart pattern show similarity bitcoin 2016 goodveteran trader peter brandt brought fresh attention doge identifying striking similarity current dogecoin price action bitcoin price movement 20152016 brandt highlighted pattern recent post social medium platform x suggesting dogecoin could following bitcoins early footstep peter brandt observation dogecoin,0.3182,0.12916666666666668,0.22368333333333335
RSS,https://bitcoinist.com/feed/,2024-11-13 22:00:20+00:00,2024-11-14 00:51:54.491593,expert say dogecoin price long overdue rally 15 etf reach 5 xrp touch 10a top market expert belief dogecoin price long overdue rally 15 amid brewing bullish momentum crypto market investor also target xrp price run towards 10 new presale token etfswap etf reach 5 bullish expert prediction cryptocurrencies present opportunity,0.5859,0.10727272727272727,0.34658636363636364
RSS,https://bitcoinist.com/feed/,2024-11-13 21:30:07+00:00,2024-11-14 00:51:54.491593,bitcoin lth show sign extreme greed nupl signal bullish continuationbitcoin reached new alltime high yesterday 90243 fueled week intense buying pressure latest surge sparked excitement across crypto market many speculating next target could even higher however btc approach milestone may see brief consolidation phase next upward,-0.0754,0.16213636363636363,0.04336818181818182
RSS,https://bitcoinist.com/feed/,2024-11-13 20:00:38+00:00,2024-11-14 00:51:54.491593,next target bitcoin price 102000 say top analystthe bitcoin price soared new alltime high 89940 binance tuesday fueled market excitement donald trump victory u presidential election surge come trump promised establish national bitcoin reserve even considered using bitcoin pay u national debt bitcoin,0.5574,0.1990909090909091,0.37824545454545455
RSS,https://bitcoinist.com/feed/,2024-11-13 18:30:21+00:00,2024-11-14 00:51:54.491593,crypto founder sell dogecoin buy pepe here whymax founder chief executive officer ceo btc cryptofocused company disclosed sold dogecoin doge holding buy pepe token surprising news come amid significant decline dogecoin price fallen 98 previous high crypto founder dump doge,-0.296,0.26708333333333334,-0.014458333333333323
RSS,https://bitcoinist.com/feed/,2024-11-13 17:33:39+00:00,2024-11-14 00:51:54.491593,trump victory etf hype booming onchain activity solana sol price go parabolicdonald trump emerged historic comeback winning 2024 u presidential contest rocked financial market given fresh life cryptocurrency area major swing state pointing trump favor triumph seen investor sign market optimism stability concurrent crypto market,0.9325,0.17250000000000001,0.5525
RSS,https://bitcoinist.com/feed/,2024-11-13 17:00:27+00:00,2024-11-14 00:51:54.491593,dogecoin explodes 113 trump announced key admin role elon muskdogecoin initially inside joke among crypto enthusiast soon became one top 10 biggest digital asset market cap today worth 5531 billion based current price slowly increasing value recently based technical market chart popular meme coin broken,0.875,0.06363636363636364,0.4693181818181818
