MainSource,Source,Publication Date,Pull_date,Pre-Processed Text,Sentiment_Vader,Sentiment_TextBlob,Average_Sentiment
RSS,https://cointelegraph.com/rss,2024-12-13 12:01:26+00:00,2024-12-13 12:20:19.654237,bitcoin could hit 160k 2025 fueled improving macro condition interest rate cut federal reserve could help bitcoin finish year recordbreaking level according bitfinexs head derivative,0.7506,0.0,0.3753
RSS,https://cointelegraph.com/rss,2024-12-13 10:47:42+00:00,2024-12-13 12:20:19.654237,zksync target 10k tps subzero fee 2025 roadmap goal zksync aim accelerate personal freedom mass crypto adoption developerfriendly blockchain stack,0.6369,0.0,0.31845
RSS,https://cointelegraph.com/rss,2024-12-13 10:09:39+00:00,2024-12-13 12:20:19.654237,bitcoin analysis start selling btc key metric hit 4 bitcoin supply profitability form focus seeking avoid return btc bear market cryptoquant said,-0.0258,0.0,-0.0129
RSS,https://cointelegraph.com/rss,2024-12-13 09:11:01+00:00,2024-12-13 12:20:19.654237,early bitcoin investor jailed unreported crypto gain 4m btc sale texas bitcoin investor face two year prison failing report 4 million cryptocurrency gain setting legal precedent,-0.3612,0.15000000000000002,-0.1056
RSS,https://cointelegraph.com/rss,2024-12-13 07:15:00+00:00,2024-12-13 12:20:19.654237,decentralized identity blockchain decentralized identity system leverage blockchain technology establish secure usercentric framework managing identity,0.34,0.4,0.37
RSS,https://cointelegraph.com/rss,2024-12-13 05:55:12+00:00,2024-12-13 12:20:19.654237,exparadigm investor raise 75m new frontiertech venture firm former paradigm investment partner casey caruso topology backed andreessen horowitz executive openai founder paris hilton,0.0258,-0.02121212121212122,0.00229393939393939
RSS,https://cointelegraph.com/rss,2024-12-13 05:46:52+00:00,2024-12-13 12:20:19.654237,bank england watchdog asks firm disclose crypto exposure uk central bank want monitor stability crypto set future policy asked local firm disclose current future crypto plan,0.0772,-0.05714285714285715,0.010028571428571428
RSS,https://cointelegraph.com/rss,2024-12-13 05:15:40+00:00,2024-12-13 12:20:19.654237,binance inflow hit 24 billion 250m user base 2024 institutional investor played big role binances 242 billion net inflow far 2024,0.34,-0.17500000000000002,0.0825
RSS,https://cointelegraph.com/rss,2024-12-13 05:04:43+00:00,2024-12-13 12:20:19.654237,trump team seek way slim abolish banking regulator wsj trump team asking whether eliminate financial industry regulator combine according wall street journal report,0.0,0.0,0.0
RSS,https://cointelegraph.com/rss,2024-12-13 04:21:24+00:00,2024-12-13 12:20:19.654237,judge slam fdic lack goodfaith censoring crypto letter bank u federal judge ordered fdic redo resubmit redaction made crypto pause letter sent financial institution,-0.5994,0.0,-0.2997
RSS,https://cointelegraph.com/rss,2024-12-13 03:37:32+00:00,2024-12-13 12:20:19.654237,solana overthrow ethereums 8year reign top ecosystem new devs ethereum still crown total developer activity topping chart globally,0.2023,0.1590909090909091,0.18069545454545455
RSS,https://cointelegraph.com/rss,2024-12-13 02:51:11+00:00,2024-12-13 12:20:19.654237,patient zero bitcoin gaslighting digiconomist 2018 esg analyst bitcoin environmentalist daniel batton criticized method used digiconomist founder alex de vries ass bitcoins environmental impact,-0.7184,0.0,-0.3592
RSS,https://cointelegraph.com/rss,2024-12-12 23:12:34+00:00,2024-12-13 12:20:19.654237,new sec bos paul atkins transform crypto right away trump new pick chair security exchange commission win crypto industry desired change may slow come play,0.8658,0.15974025974025974,0.5127701298701299
RSS,https://cointelegraph.com/rss,2024-12-12 22:44:19+00:00,2024-12-13 12:20:19.654237,tech giant like amazon may hesitate adopt bitcoin big tech cash hand currency devaluation make lose purchasing power bitcoin treasury solution fight inflation amazon next decide,0.6705,0.0,0.33525
RSS,https://cointelegraph.com/rss,2024-12-12 21:53:22+00:00,2024-12-13 12:20:19.654237,french hill chair house financial service committee 2025 procrypto arkansas representative french hill taken leadership u house committee crucial molding crypto policy donald trump administration,0.0,0.0,0.0
RSS,https://cointelegraph.com/rss,2024-12-12 21:42:44+00:00,2024-12-13 12:20:19.654237,eigen foundation commits 1 eigen supply eth protocol guild according data coinmarketcap 210 million eigen token circulation total supply 168 billion,0.0258,0.0,0.0129
RSS,https://cointelegraph.com/rss,2024-12-12 21:37:13+00:00,2024-12-13 12:20:19.654237,mystery crypto sleuth death japanese exchange list nasdaq asia express indian public firm microstrategys bitcoin blueprint japanese exchange spac merger nasdaq listing asia express,-0.5994,-0.05,-0.32470000000000004
RSS,https://cointelegraph.com/rss,2024-12-12 21:26:01+00:00,2024-12-13 12:20:19.654237,interest group call u senate confirm caroline crenshaw sec letter sent senate signed 40 organization suggested donald trump might abide tradition nominate democrat sec,0.4588,-0.1,0.1794
RSS,https://cointelegraph.com/rss,2024-12-12 21:07:56+00:00,2024-12-13 12:20:19.654237,starboard value take stake riot platform eye ai shift activist investor said pushing riot optimize use facility like many peer,-0.0258,0.5,0.2371
RSS,https://cointelegraph.com/rss,2024-12-12 20:46:09+00:00,2024-12-13 12:20:19.654237,blackrock say 12 reasonable bitcoin portfolio allocation recommendation applies investor wish hold bitcoin asset manager said,0.6369,0.2,0.41845
RSS,https://cointelegraph.com/rss,2024-12-12 20:07:28+00:00,2024-12-13 12:20:19.654237,here happened crypto today need know happened crypto today latest news daily trend event impacting bitcoin price blockchain defi nfts web3 crypto regulation,0.0,0.25,0.125
RSS,https://cointelegraph.com/rss,2024-12-12 19:48:25+00:00,2024-12-13 12:20:19.654237,emerging market lead crypto adoption according consenys survey according survey blockchain firm consensys half respondent nigeria south africa vietnam philippine india already crypto wallet,0.0,-0.18333333333333335,-0.09166666666666667
RSS,https://cointelegraph.com/rss,2024-12-12 19:41:36+00:00,2024-12-13 12:20:19.654237,texas lawmaker proposes bill establish strategic bitcoin reserve draft legislation suggested texas resident could fund bitcoin reserve voluntary donation,0.0,0.0,0.0
RSS,https://cointelegraph.com/rss,2024-12-12 19:21:55+00:00,2024-12-13 12:20:19.654237,45k next stop ethereum eth price today eth price quickly rebounded 3500 low role dapps activity investor price estimate playing recovery,-0.3612,0.1111111111111111,-0.12504444444444446
RSS,https://cointelegraph.com/rss,2024-12-12 19:16:13+00:00,2024-12-13 12:20:19.654237,australia amp fund invests 27m bitcoin report australia superannuation system requiring employer allocate portion employee earnings retirement account,0.0,0.0,0.0
RSS,https://cointelegraph.com/rss,2024-12-12 19:00:00+00:00,2024-12-13 12:20:19.654237,building dex dont bother starting without security plan developer must prioritize user protection defi landscape,0.0,0.0,0.0
RSS,https://cointelegraph.com/rss,2024-12-12 18:56:15+00:00,2024-12-13 12:20:19.654237,ethenas usde beat dai become 3rdlargest stablecoin cedefi stablecoin attracted billion inflow due doubledigit staking yield,0.4215,-0.125,0.14825
RSS,https://cointelegraph.com/rss,2024-12-12 18:31:51+00:00,2024-12-13 12:20:19.654237,sweden spotlight stock market add 20 crypto etps valour spotlight stock market offer traditional investor total 45 exchangetraded product choose,0.0,0.0,0.0
RSS,https://cointelegraph.com/rss,2024-12-12 17:31:30+00:00,2024-12-13 12:20:19.654237,avalanche raise 250m ahead avalanche9000 launch lockedtoken sale saw participation 40 company,0.0,0.0,0.0
RSS,https://cointelegraph.com/rss,2024-12-12 17:27:07+00:00,2024-12-13 12:20:19.654237,bitcoin bull ignore ppi shock whale fuel btc price run 102k bitcoin whale back buy mode btc price strength continues despite new stagflation jolt u federal reserve,-0.2263,0.06818181818181818,-0.07905909090909091
RSS,https://bitcoinmagazine.com/.rss/full/,2024-12-13 10:46:58+00:00,2024-12-13 12:20:19.654237,government large institution buy bitcoin want except yoursgovernments institution buying large amount bitcoin without risk one thing,0.2764,0.21428571428571427,0.24534285714285714
RSS,https://bitcoinmagazine.com/.rss/full/,2024-12-12 17:33:51+00:00,2024-12-13 12:20:19.654237,texas state rep file strategic bitcoin reserverepresentative giovanni capriglione filed live 𝕏 space,0.0,0.13636363636363635,0.06818181818181818
RSS,https://bitcoinmagazine.com/.rss/full/,2024-12-12 15:32:00+00:00,2024-12-13 12:20:19.654237,realized cap hodl wave identify next bitcoin price peakthe realized cap hodl wave chart highlight bitcoins market cycle align shift investor behavior shortterm holder currently 55 total realized value data suggests significant upside potential market overheats near 80,0.7076,0.095,0.4013
RSS,https://bitcoinmagazine.com/.rss/full/,2024-12-11 20:14:04+00:00,2024-12-13 12:20:19.654237,late invest bitcointhink youve missed bitcoin boom think despite impressive past performance bitcoin continues topperforming asset even recent month strategy like dollar cost averaging dca dont need fortune start investing learn bitcoin outshines gold dow jones traditional investment proving never late join bitcoin revolution,-0.1999,0.09999999999999999,-0.04995
RSS,https://bitcoinmagazine.com/.rss/full/,2024-12-11 17:22:57+00:00,2024-12-13 12:20:19.654237,backup bitcoina look bitcoin backup important manage,0.2023,0.4,0.30115000000000003
RSS,https://bitcoinmagazine.com/.rss/full/,2024-12-11 16:43:46+00:00,2024-12-13 12:20:19.654237,ray dalio prefers bitcoin bondsray dalio say prefers bitcoin gold bond amid rising global debt level signaling growing institutional endorsement bitcoin safe asset,0.7096,0.25,0.4798
RSS,https://bitcoinmagazine.com/.rss/full/,2024-12-10 22:05:55+00:00,2024-12-13 12:20:19.654237,eric trump state bitcoin ultimate hedge real estate investorseric trump highlight bitcoin transformative asset real estate investor emphasizing liquidity portability potential democratize wealthbuilding opportunity globally,0.7717,0.08,0.42585
RSS,https://bitcoinmagazine.com/.rss/full/,2024-12-10 22:05:09+00:00,2024-12-13 12:20:19.654237,microstrategy mstr expected added nasdaq 100 bloombergthe official announcement likely come friday say bloomberg,0.0,-0.05,-0.025
RSS,https://bitcoinmagazine.com/.rss/full/,2024-12-10 17:52:32+00:00,2024-12-13 12:20:19.654237,eric trump confident bitcoin price hit 1 millioneric trump confidently predicts bitcoin reach 1 million emphasizing scarcity global potential early adopter stand gain,0.8689,0.22000000000000003,0.54445
RSS,https://bitcoinmagazine.com/.rss/full/,2024-12-10 17:30:19+00:00,2024-12-13 12:20:19.654237,bitcoin islamic moneya look bitcoin complies islamic law regarding finance money,0.0,0.0,0.0
RSS,https://bitcoinmagazine.com/.rss/full/,2024-12-10 16:59:57+00:00,2024-12-13 12:20:19.654237,golden ratio multiplier mathematically reveals next bitcoin price targetthe golden ratio multiplier bitcoinspecific indicator created philip swift highlight 100000 critical resistance level analysis explores fibonacci multiple 350day moving average provide key insight bitcoins price cycle 127000 emerging next major target barrier broken,-0.3054,0.010227272727272722,-0.14758636363636365
RSS,https://bitcoinmagazine.com/.rss/full/,2024-12-09 22:01:13+00:00,2024-12-13 12:20:19.654237,russian state duma deputy proposes strategic bitcoin reservethe document would see russia create bitcoin reserve similar traditional currency reserve,0.2732,0.0,0.1366
RSS,https://bitcoinmagazine.com/.rss/full/,2024-12-09 18:00:14+00:00,2024-12-13 12:20:19.654237,wabisabi deanonymization vulnerability discloseda major vulnerability wabisabi publicly revealed would allow malicious coordinator server deanonymize user,-0.2944,0.03125,-0.131575
RSS,https://bitcoinmagazine.com/.rss/full/,2024-12-09 12:20:00+00:00,2024-12-13 12:20:19.654237,microbt unveils newgen whatsminer m6xs series bitcoin mena 2024microbt unveils newgen whatsminer m6xs series bitcoin mena 2024,0.0,0.0,0.0
RSS,https://bitcoinmagazine.com/.rss/full/,2024-12-07 18:07:35+00:00,2024-12-13 12:20:19.654237,trump must end capital gain tax bitcoinby eliminating capital gain tax bitcoin trump administration spur u innovation strengthen nation economic sovereignty ensure everyday american gain equal footing world rapidly evolving digital economy,0.9493,0.0,0.47465
RSS,https://bitcoinmagazine.com/.rss/full/,2024-12-06 19:12:33+00:00,2024-12-13 12:20:19.654237,joule paradox energy set value bitcoin bitcoin set value energyenergy fundamental base commodity upon everything value produced bitcoin pure embodiment energy monetary form,0.8402,-0.29285714285714287,0.27367142857142857
RSS,https://bitcoinmagazine.com/.rss/full/,2024-12-05 18:49:06+00:00,2024-12-13 12:20:19.654237,money isnt fixed yeta finite supply cap think necessary fix monetary system money seizure surveillance fundamentally much bigger problem solve,-0.2263,0.03333333333333333,-0.09648333333333334
RSS,https://bitcoinmagazine.com/.rss/full/,2024-12-05 17:27:55+00:00,2024-12-13 12:20:19.654237,100000 bitcoin price beginningwhoa think bitcoin hitting 100k peak think whats ahead 2025 getting started folk,0.0,0.0,0.0
RSS,https://bitcoinmagazine.com/.rss/full/,2024-12-05 17:26:47+00:00,2024-12-13 12:20:19.654237,guatemalan government taking closer look bitcoin memea nayib bukele bitcoin meme posted el salvador bitcoin office went viral guatemala last month im told prompted power country begin homework bitcoin craft better policy around asset,0.6597,0.25,0.45485
RSS,https://bitcoinmagazine.com/.rss/full/,2024-12-05 15:42:57+00:00,2024-12-13 12:20:19.654237,month bitcoin shattered record dive bitcoin reportdiscover key insight trend historic month bitcoin free bitcoin report dont miss outread,0.164,0.13333333333333333,0.14866666666666667
RSS,https://bitcoinmagazine.com/.rss/full/,2024-12-05 02:34:57+00:00,2024-12-13 12:20:19.654237,bitcoin officially hit 100000 first time everthis historic day cemented history,0.0,0.125,0.0625
RSS,https://bitcoinmagazine.com/.rss/full/,2024-12-04 21:37:40+00:00,2024-12-13 12:20:19.654237,fed chair jerome powell correct bitcoin competition gold dollarpowell said bitcoin digital gold,0.0,0.0,0.0
RSS,https://bitcoinmagazine.com/.rss/full/,2024-12-04 20:01:42+00:00,2024-12-13 12:20:19.654237,bitcoin developer move gauge consensus covenant soft forksbitcoin taken notable step often contentious software upgrade process,-0.296,0.3,0.0020000000000000018
RSS,https://bitcoinmagazine.com/.rss/full/,2024-12-04 14:09:46+00:00,2024-12-13 12:20:19.654237,heat home earning bitcoin heatbitheatbits founder alex busarov created device let people increase bitcoin stack keeping home warm also contributes decentralization bitcoin hashrate,0.6369,0.6,0.6184499999999999
RSS,https://bitcoinmagazine.com/.rss/full/,2024-12-03 18:49:37+00:00,2024-12-13 12:20:19.654237,want another bitcoin country something itfor first time history opportunity support presidential candidate want put country bitcoin standard,0.7269,0.125,0.42595
RSS,https://bitcoinmagazine.com/.rss/full/,2024-12-03 18:03:55+00:00,2024-12-13 12:20:19.654237,bother trying scale bitcoinbitcoiners need find balance pessimism optimism looking bitcoins future rather embracing one extreme,-0.1027,-0.0625,-0.0826
RSS,https://bitcoinmagazine.com/.rss/full/,2024-12-03 17:16:33+00:00,2024-12-13 12:20:19.654237,bitcoin selfcustody threat europea look current regulation change taking shape europe could threaten bitcoiners ability right self custody,-0.5719,0.14285714285714285,-0.21452142857142856
RSS,https://bitcoinmagazine.com/.rss/full/,2024-12-03 12:33:14+00:00,2024-12-13 12:20:19.654237,lack soft fork due lack interest lack processbitcoin core developer dedicate time energy whatever part codebase find interesting important work far hasnt really soft fork proposal,0.4019,0.17916666666666667,0.2905333333333333
RSS,https://bitcoinmagazine.com/.rss/full/,2024-12-02 17:57:13+00:00,2024-12-13 12:20:19.654237,dont sell microstrategy bitcoinwhen sell bitcoin mstr others buying,0.0,0.0,0.0
RSS,https://bitcoinmagazine.com/.rss/full/,2024-12-02 16:26:12+00:00,2024-12-13 12:20:19.654237,debanked financial suppression bitcoin business must endwhy regulator must held accountable consequence operation chokepoint 20,0.0,0.0,0.0
RSS,https://bitcoinmagazine.com/.rss/full/,2024-11-29 14:00:00+00:00,2024-12-13 12:20:19.654237,december surpass november recordbreaking bitcoin price increasefrom historic gain future growth november bitcoin price breakthrough mean investor december,0.7184,-0.10416666666666667,0.3071166666666667
RSS,https://bitcoinmagazine.com/.rss/full/,2024-11-27 21:45:37+00:00,2024-12-13 12:20:19.654237,fight bitcoin united state fiscal crossroadsin chapter satoshi paper avik roy explores looming fiscal crisis present three potential response united state restriction paralysis assimilation could bitcoin emerge solutionor spark conflict,-0.6249,0.0,-0.31245
RSS,https://bitcoinmagazine.com/.rss/full/,2024-11-27 20:26:13+00:00,2024-12-13 12:20:19.654237,bitcoin price repeat november 28 ath pattern 2013 2017 2024historically bitcoin achieved alltime high ath november 28 2013 2017 november 28 2024 imminent investor speculating whether bitcoin could reach 100000 mark significant date,0.2263,0.2675,0.2469
RSS,https://bitcoinmagazine.com/.rss/full/,2024-11-27 18:37:31+00:00,2024-12-13 12:20:19.654237,bitcoiners need grow focus shitstop worrying bitcoiners bitcoin worry accomplish want,-0.296,0.0,-0.148
RSS,https://bitcoinmagazine.com/.rss/full/,2024-11-27 16:18:57+00:00,2024-12-13 12:20:19.654237,bitcoin neither racist xenophobic misogynistic response ideological stereotypingkamala harris rejection bitcoin deprives vital resource need globally trump number go approach may jeopardize america core humanitarian value like refugee resettlement program ignore bitcoins potential aid vulnerable population globally,0.0052,-0.08,-0.0374
RSS,https://bitcoinmagazine.com/.rss/full/,2024-11-27 14:23:40+00:00,2024-12-13 12:20:19.654237,here talk bitcoin thanksgiving tableshare resource dont give advice,0.0,0.0,0.0
RSS,https://bitcoinmagazine.com/.rss/full/,2024-11-27 10:22:41+00:00,2024-12-13 12:20:19.654237,michael saylor doesnt control bitcoin notion michael saylor singlehandedly decide bitcoins fate microstrategys stack simply ridiculous,-0.3612,-0.3333333333333333,-0.34726666666666667
RSS,https://bitcoinmagazine.com/.rss/full/,2024-11-26 21:52:20+00:00,2024-12-13 12:20:19.654237,maximizing bitcoin accumulation beyond benchmark bitcoin redefined digital asset landscape outperforming traditional market year year investor institution maximize bitcoin holding beyond simple buyandhold strategy,0.3612,0.0,0.1806
RSS,https://bitcoinmagazine.com/.rss/full/,2024-11-26 17:26:10+00:00,2024-12-13 12:20:19.654237,bitcoin script focus building block wild geeseconversations around script upgrade bitcoin become unfocused irrational lost serious context public square,-0.8625,-0.15833333333333333,-0.5104166666666667
RSS,https://bitcoinmagazine.com/.rss/full/,2024-11-26 17:03:29+00:00,2024-12-13 12:20:19.654237,use bitcoin easily privately cake walletcake wallet founder vik sharma team created one usable noncustodial bitcoin crypto wallet market perhaps one offer transactional privacy,0.5267,0.0,0.26335
RSS,https://bitcoinmagazine.com/.rss/full/,2024-11-26 16:53:42+00:00,2024-12-13 12:20:19.654237,remembering john mcafees bullish bitcoin price bet near 100k milestoneas bitcoin teeter brink 100000 revisit john mcafees audacious 1 million prediction exploring whether maverick wild foresight sheer madness stroke geniusand timing thing got wrong,-0.6249,-0.075,-0.34995
RSS,https://bitcoinmagazine.com/.rss/full/,2024-11-26 14:00:00+00:00,2024-12-13 12:20:19.654237,fidelity investment director share bitcoins adoption valuation modelsjurrien timmer director global macro fidelity investment recently shared bitcoin valuation model based adoption curve monetary policy scenario offering perspective asset maturing role network monetary innovation,0.8271,0.0,0.41355
RSS,https://bitcoinmagazine.com/.rss/full/,2024-11-25 17:11:37+00:00,2024-12-13 12:20:19.654237,safegcds implementation formally verifiedverifying implementation novel modular inversion algorithm using proof assistant guaranteeing bitcoin cryptography handled correctly done,0.3182,0.0,0.1591
RSS,https://bitcoinmagazine.com/.rss/full/,2024-11-25 14:15:42+00:00,2024-12-13 12:20:19.654237,newmarket capital launch battery finance bitcoincollateralized loan strategy battery finance enables borrower use bitcoin collateral loan without marking market mean bring forward bitcoins value,0.34,-0.3125,0.013750000000000012
RSS,https://bitcoinmagazine.com/.rss/full/,2024-11-25 14:00:00+00:00,2024-12-13 12:20:19.654237,invest bitcoin opensource companiesthe launch timestamp really piqued interest,0.5678,0.2,0.3839
RSS,https://bitcoinmagazine.com/.rss/full/,2024-11-22 18:38:34+00:00,2024-12-13 12:20:19.654237,jason spaceboi lowerys bitcoin thesis incoherent gibberishthis space full incoherent nonsense paraded around deep insightful analysis nothing absurd jason lowerys softwar thesis,-0.4019,-0.11000000000000001,-0.25595
RSS,https://bitcoinmagazine.com/.rss/full/,2024-11-22 17:50:03+00:00,2024-12-13 12:20:19.654237,legacy medias transformation evolution beat extinctionlegacy medium evolving audience demand transparency independence bitcoin paving way new era decentralized trustworthy journalism,0.4767,0.13636363636363635,0.3065318181818182
RSS,https://bitcoinmagazine.com/.rss/full/,2024-11-22 16:23:29+00:00,2024-12-13 12:20:19.654237,gary genslers departure triumph bitcoinas upcoming trump administration gearing establish regulatory landscape facilitating fullon anythinggoes multicoinery gary gensler gone could well see atrocious scam coin proliferate soar inevitably implode,0.128,-0.35,-0.11099999999999999
RSS,https://bitcoinmagazine.com/.rss/full/,2024-11-22 14:29:00+00:00,2024-12-13 12:20:19.654237,onchain data show bitcoin price bull run far overdespite bitcoins recent rally onchain data reveals bull market still plenty room grow metric like mvrv zscore nupl puell multiple suggest bitcoin far overheated pointing potential significant upside month ahead,0.5106,0.09583333333333333,0.3032166666666667
RSS,https://bitcoinmagazine.com/.rss/full/,2024-11-21 23:02:16+00:00,2024-12-13 12:20:19.654237,bitcoin nears 100000 trump council expected implement btc reservethis bullish bitcoin ive ever,0.0,-0.1,-0.05
RSS,https://bitcoinist.com/feed/,2024-12-13 11:54:19+00:00,2024-12-13 12:20:19.654237,december crypto bull run 5 coin set explodein month crypto economy added 12t overall market cap december crypto bull run poised another great one growth headlined bitcoin course host altcoins even memecoins benefited btcs alltimehighs big winner past,0.91,0.1375,0.52375
RSS,https://bitcoinist.com/feed/,2024-12-13 11:00:34+00:00,2024-12-13 12:20:19.654237,procrypto rep french hill head house financial service committee detailsin important victory crypto industry rep french hill republican arkansas expected become next chair house financial service committee endorsed gop steering committee move implies favorable trend cryptocurrency regulation presidentelect donald trump administration already made key,0.7096,0.037500000000000006,0.37355
RSS,https://bitcoinist.com/feed/,2024-12-13 10:32:15+00:00,2024-12-13 12:20:19.654237,pepu meme coin skyrocket 550 postpresale wepe footstepscryptos hottest new meme coin pepe unchained pepu shooting 500 phenomenal presale period took 74m investment mean pepe unchained could easily profitable meme coin pepe family going 2025 considering pepu hit uniswap tuesday already netted,0.6486,0.18929924242424243,0.4189496212121212
RSS,https://bitcoinist.com/feed/,2024-12-13 09:00:29+00:00,2024-12-13 12:20:19.654237,xrp ecosystem get 100 million ai upgrade kaj labskaj lab developer behind onchain enterprise platform atua ai tua committed 100 million advance artificial intelligence ai application within xrp ledger ecosystem announcement made december 12 2024 dubai uae aim develop aidriven solution tailored specifically xrps infrastructure xrp meet ai according official press,0.7579,-0.5,0.12895
RSS,https://bitcoinist.com/feed/,2024-12-13 07:30:13+00:00,2024-12-13 12:20:19.654237,cumulative bitcoin volume hit 131 trillionbut much real transfersthe onchain analytics firm glassnode revealed much total cumulative bitcoin volume reflects real transaction entityadjusted approach bitcoin volume reveals shocking fact latest weekly report glassnode discussed metric core bitcoin network like cryptocurrencys price claimed 100000,-0.0516,-0.05000000000000001,-0.050800000000000005
RSS,https://bitcoinist.com/feed/,2024-12-13 05:30:38+00:00,2024-12-13 12:20:19.654237,texas house unveils bill create strategic bitcoin reserveon thursday texas house representative took significant step toward integrating cryptocurrency state financial strategy introducing bill aimed establishing strategic bitcoin reserve sponsored republican state representative giovanni capriglione proposed legislation seek allow state accept tax fee donation bitcoin intention,0.7506,0.1875,0.46905
RSS,https://bitcoinist.com/feed/,2024-12-13 04:30:25+00:00,2024-12-13 12:20:19.654237,bitcoin hashrate inch back alltime high btc reclaims 100000onchain data show bitcoin hashrate rise recently indication miner expanding mining farm bitcoin mining hashrate returned close alltime high hashrate refers indicator keep track total amount computing power miner whole,0.0,0.08666666666666667,0.043333333333333335
