MainSource,Source,Publication Date,Pull_date,Pre-Processed Text,Sentiment_Vader,Sentiment_TextBlob,Average_Sentiment
Reddit,solana,2025-01-19 23:47:33,2025-01-22 00:52:36.797171,melania trump made crypto bad,-0.5423,-0.6999999999999998,-0.6211499999999999
Reddit,solana,2025-01-19 22:26:33,2025-01-22 00:52:36.797171,solana completely unusableignoring go occasionally demand completely break functionality anyone confidence revolutionary crypto,0.4754,0.06666666666666667,0.27103333333333335
Reddit,solana,2025-01-20 21:48:43,2025-01-22 00:52:36.797171,coinbase say lower amount sol solscan correctmy coinbase wallet say x amount sol look wallet solscan true amount congestion wondering,0.1531,0.35,0.25155
Reddit,solana,2025-01-21 04:40:28,2025-01-22 00:52:36.797171,unlimit gatefi shop changelly scamhello friend understand network heavy load right seems like scam tried buy solana fiat money debited bank almost three day still dont coin used unlimit gatefi changelly exchange,0.25,0.042857142857142844,0.1464285714285714
Reddit,solana,2025-01-21 14:19:46,2025-01-22 00:52:36.797171,there lot youtube video identifying scam coin legit coin dont get itwhat legit coin talking meme coin like picture donald trump face throwing pen something legit project rugpull well fuck would legit project project picture donald trump throwing pen like dev marketing marketing lmao develop called dev like dont get something isnt connecting mind would anyone buy someone buy would dev immediately rugpull like wouldnt rugpull isnt point every single meme coin would rugpull going hold coin trump throwing pen forever utility meme coin literally looking bigger idiot intent every single meme coin bar none rugpull mean say sure legit project rugpull would legit project even,0.7003,-0.06941964285714286,0.3154401785714286
Reddit,solana,2025-01-21 10:29:13,2025-01-22 00:52:36.797171,e money card product e money network integrated solana allowing user deposit stablecoins solana blockchainsource httpsxcomemoney_networkstatus1881406810000887818httpsxcomemoney_networkstatus1881406810000887818 excited share e money card integrated solanahttpsxcomsolana deposit stablecoins solana seamlessly card earn 2 reward everyday spends ease tap pay google pay apple pay 150m merchant worldwide httpsredditcomlink1i6fou1video7mkfzerzpbee1player special offer first 1111 solana community member use coupon emnonsolana grab exclusive 30 discount e money card even exclusive deal dont forget join community,0.9017,0.17642857142857143,0.5390642857142857
Reddit,solana,2025-01-21 05:50:51,2025-01-22 00:52:36.797171,transaction showing solscan krakeni sent sol coinbase kraken 18 hour finally got marked successful coinbase showing kraken however checked solscan normal fix wait,0.5859,0.25,0.41795
Reddit,solana,2025-01-21 09:05:17,2025-01-22 00:52:36.797171,get solana price excelthe stock rich data type work fine type solusd select stock data type give investment corp ticker pull sol data excel recognizing sol httpspreviewreddit46mpkm0hbbee1pngwidth177formatpngautowebps422d6094c569ac58f59d31344cc1c6b4a919869d pulling data stock exchange tickerhttpspreviewredditoo7p0jqlbbee1pngwidth275formatpngautowebps17a87c4622a3bead1b7e7226dfe083562213d621,0.8126,0.39583333333333337,0.6042166666666666
Reddit,solana,2025-01-20 13:41:54,2025-01-22 00:52:36.797171,ive started using backpack trade memecoins,0.0,0.0,0.0
Reddit,solana,2025-01-20 19:49:35,2025-01-22 00:52:36.797171,anyone holding sol currentlyso sol solflare wanted swap different wallet move bitcoin friend last night said still hasnt gone congestion issue etc wondering hold stake sol solflare guy opinion,0.4939,0.0,0.24695
Reddit,solana,2025-01-21 01:17:44,2025-01-22 00:52:36.797171,looking trade skill dev anyone interested websiteappdocs packagehello everyone im full stack developer think knack design ive made couple site paired respective apps sol project wanted offer anyone interested couple example feel free ask question compromise also anyone need tip well feel free ask trying connect space,0.9423,0.27499999999999997,0.60865
Reddit,solana,2025-01-20 22:47:26,2025-01-22 00:52:36.797171,nova click working help,0.4019,0.0,0.20095
Reddit,solana,2025-01-21 00:18:29,2025-01-22 00:52:36.797171,experience solana,0.0,0.0,0.0
Reddit,solana,2025-01-21 14:51:31,2025-01-22 00:52:36.797171,solana developer ruggershello everyone hope find well start 20 solanas new crypto prize growing made couple swap wasted money ethereum bitcoin solana got stolen cryptocurrency wallet never ever recoved said know setting 2fa happened nothing started watching video invested assests totally safe expose know far solana guy meme coin give people mil everyday take dream crush everyday true computer engineer tracked seens guy developer wallet expert say invest something dev percentage coin coin reach million even 5 mil minute dy instaltly upon checking telegram channel see pump address coin true telegram gave full rug history coin along address coin dev created rugged everyone hand coin go 5 mil people coming like mad 6001000 bulliofunhttpbulliofun people many outsider insider holding 40 put money rugged dev sold coin dead people made thousand profit solana dev rug history rug big people coin small little people little dream crushed every single second got image prove devs rugger seen inside wallet address guy give money people guy rug people well company got package like vacays extra medical stuff solana offer rug tell develop coin even rug people whenever want lost 36k usd still standing guy go history bad stop rugging people take money account also devs rug people send extra coin like 200 coin new ai coin feel little better bad done kill u guy continue making rich richer poor poorer create new jeet coin saying indian china inside guy doer,0.7665,-0.025827922077922068,0.37033603896103895
Reddit,solana,2025-01-20 17:09:05,2025-01-22 00:52:36.797171,sol transfer still pending yesterday anyone know whats going cb said theyre trying fix,0.0,0.0,0.0
Reddit,solana,2025-01-21 12:58:17,2025-01-22 00:52:36.797171,made allot money im pretty new crypto future reference wanted know hypothetically made 1 million example transferring money proper way taking money bank paying fee tax type investment etc wanted know step ready sell decent understanding wanted insight others experience knowledge im usa fyi,0.7579,0.1255050505050505,0.4417025252525253
Reddit,solana,2025-01-20 00:47:17,2025-01-22 00:52:36.797171,guy stil sure solana overtake ethereums businesssolana break every time load heavy ethereum work total speed ecosystem raise 1000 tps 2 month thanks pectra upgrade versus solanas limit 700 real tps sol holder getting dumped million newly created sol venture capitalist,0.5423,0.13939393939393938,0.3408469696969697
Reddit,solana,2025-01-20 21:36:01,2025-01-22 00:52:36.797171,dex trading platformsanyone know dex trading platform similar trading functionality binance anything adjacent im mainly looking defi platform allows shorting stop loss feature ideally low fee ive trading using crypto chart using defi exchange feel like something one place beneficial would appreciate advice knowledge,0.6486,0.05555555555555555,0.35207777777777777
Reddit,solana,2025-01-20 14:55:24,2025-01-22 00:52:36.797171,solana transaction still pending sent 3 transaction coinbase phantom wallet first one still say pending third one still pending second transaction completed received first second still pending 16 hour worried,-0.296,0.1,-0.09799999999999999
Reddit,solana,2025-01-20 11:29:38,2025-01-22 00:52:36.797171,much solana tip priority auto snipe using crypto bot 01 sol enough first auto snipe 5 sol meme coin put tippriority fee 01 sol saw someone else put 1 sol idk mistake would put using maestro sniper bot huge thanks advance,0.34,0.21000000000000002,0.275
Reddit,solana,2025-01-20 00:27:39,2025-01-22 00:52:36.797171,fuck bullshit scam coin someone serious shenanigansit seems like every single channel get jammed trying send significant amount money tried send 1000 usdc trust wallet solflare rejected simply trying buy little melainia meme coin guess channel jammed intentionally blocked coordinated effort kraken also allowing send significant amount usdc sol wallet edit ahthe reddit community people come project character defect worst personality trait people people incredibly juvenile naïve mentally deficient,-0.9413,-0.17435515873015872,-0.5578275793650793
Reddit,solana,2025-01-19 22:51:45,2025-01-22 00:52:36.797171,people buying melania coin people buying melania coin matter phantom wallet cant buy slow probably much traffic ive tried using jupiter dex scanner one still luck people actuallly managing buy,0.4767,-0.05000000000000002,0.21334999999999998
Reddit,solana,2025-01-21 00:24:42,2025-01-22 00:52:36.797171,asking sendis still congestion site track approx transfer time anyone sent sol last 2 hour go successfully,0.4939,0.375,0.43445
Reddit,solana,2025-01-21 00:06:04,2025-01-22 00:52:36.797171,find solana wallet address jupiter perp entry mark pricethe question title kol shared screenshot date entry mark price jupiter perpetuals trade find wallet address traded using input,0.34,0.0,0.17
Reddit,solana,2025-01-21 00:06:00,2025-01-22 00:52:36.797171,think screwed sending coinbaseive feeling really sick lately sure screwed big time maybe coinbase slow due congestion wasnt thinking straight tried using jupiter mobile app first time ever usdc tried send coinbase forgot put usdc address put sol gone feel awful thought chain cross compatible,-0.8909,-0.13214285714285715,-0.5115214285714286
Reddit,solana,2025-01-20 23:55:31,2025-01-22 00:52:36.797171,want copy trade howwhere findevaluate walletshello complete noob worth thankfully made money nfts 2122 held little solana back however stopped following space guessed fuhrer coin intrigued want give little energy possible enough liquid dont mind losing throw phantom wallet let whatever im probably going use odin trade copying im interested little research picking wallet thanks,0.8955,0.026136363636363638,0.4608181818181818
Reddit,solana,2025-01-20 23:50:46,2025-01-22 00:52:36.797171,transaction failure solition thata lot post noticed facing transaction failure bypass issue one solid solution run dedicated rpc node serious trade defi rpc play important role submission transaction dedicated rpc url face issue faced general public product ecosystem rpc url alot people start use product like phantom jup solflare congested transaction likely fail huge amount trade price sensitive dedicated rpc url help alot might favorable solana congested still option successful transaction pay little bit amount priority fee plenty company give dedicated rpcurl monthly charge expensive might rate limited setup dedicated rpcurl u knowledge setting server setup node complete freedom without rate limitation resource regarding setting node publicly available data need assistance always dm thank,0.9824,-0.0015056022408963597,0.49044719887955185
Reddit,solana,2025-01-20 23:30:32,2025-01-22 00:52:36.797171,depin podcast building startup solana ep 32,0.0,0.0,0.0
Reddit,solana,2025-01-20 09:07:22,2025-01-22 00:52:36.797171,nearly 14 hour waiting transfer coinbase phantom damn almost glad didnt didnt get trump crash,0.3105,0.3,0.30525
Reddit,solana,2025-01-19 16:32:22,2025-01-22 00:52:36.797171,happy profit,0.765,0.8,0.7825
Reddit,solana,2025-01-20 16:32:32,2025-01-22 00:52:36.797171,coinbase say transaction workedstill showing phantom wallet,0.0,0.0,0.0
Reddit,solana,2025-01-20 00:08:03,2025-01-22 00:52:36.797171,solana havent able complete transaction last hourjust wondering,0.0,0.19999999999999998,0.09999999999999999
Reddit,solana,2025-01-20 21:35:52,2025-01-22 00:52:36.797171,sol needed change eth solso new crypto im starting read book watch youtube video crypto saw yesterday trump thought solana would go value proceeded buy like 30 phantom charged 3 wanted buy eth meme coin yeah well sol turn eth back sol plus fee outrageous ive seen fluctuate swap damn go high sometimes tf would need sol change eth sol,0.1779,-0.14072727272727273,0.018586363636363637
Reddit,solana,2025-01-20 21:18:42,2025-01-22 00:52:36.797171,swap error swapping alli mean lucky learn swap like max_sol transactionfee leftover_sol keep difference save,0.7003,0.010416666666666657,0.35535833333333333
Reddit,solana,2025-01-20 19:56:36,2025-01-22 00:52:36.797171,guy spend cryptoi want see anyone actually tried solcard get bybit cardredotpay,0.0772,0.0,0.0386
Reddit,solana,2025-01-20 06:14:07,2025-01-22 00:52:36.797171,real info happened today solana real info fud bullish happened understand httpsxcom0xrwustatus1881110034412867893tfbopwyyi7e1bv91cj1kgdas19 httpsxcom0xmert_status1881141654435799378t2z2sivqsjwx2ozlyry6d6as19 httpsxcom0xmert_status1881174078637199607tycegmgjj0wj8exdwrfuskgs19 httpsxcomsmyyguystatus1881191082475843746tlgoewamracba7vhqh7pp1ws19,-0.2732,0.2,-0.036599999999999994
Reddit,solana,2025-01-20 19:18:26,2025-01-22 00:52:36.797171,missing delete account option solflarewhen dont want see coin solflare chrome extension usually use delete account option get rid however option available coin case delete coin delete account option available,-0.3447,0.08750000000000001,-0.1286
Reddit,solana,2025-01-20 07:45:12,2025-01-22 00:52:36.797171,joke aside trump family working bogdanoff,0.296,0.0,0.148
Reddit,solana,2025-01-20 02:12:35,2025-01-22 00:52:36.797171,probably last time ever use solana waiting 6 hour coinbase withdrawal go first estimated 3 hour double already,0.0258,0.08333333333333333,0.054566666666666666
Reddit,solana,2025-01-20 14:55:22,2025-01-22 00:52:36.797171,noob question buyingfirst time sol buyer yesterday yes im also one tards came trump coin wave luckily purchase sol still hasnt come didnt lose bunch money getting transaction locked trying convert trump back sol anyhow used coinbase buy sol attempted transfer phantom wallet stuck since yesterday know historic volume yesterday network tested like etc etc im wondering future shitcoin trade may attempt fastest way obtain sol time high volume like im sure purchasing large exchange like coinbase isnt optimal strategy sol hand ready trade meme coin immediately guidereferencesomething read plz help,0.9535,0.17595238095238094,0.5647261904761904
Reddit,ethereum,2025-01-19 06:01:32,2025-01-22 00:52:36.797171,weekly discussion thread buildinghello rethereumhttpswwwredditcomrethereum welcome weekly discussion thread building space developer entrepreneur enthusiast showcase project share idea seek feedback greater ethereum community share project whether youre developing decentralized application dapp launching new layer 2 network working ethereum infrastructure encourage share detail project please provide concise overview including purpose current status link information provide xtwitter youtube link post automatically filtered engage collaborate thread excellent opportunity connect likeminded individual application tester feel free ask question offer feedback seek collaboration safety reminder encourage sharing collaboration please cautious potential scam avoid connecting wallet unfamiliar application without thorough research utilizing wallet tool offer transaction simulation eg rabby walletguard help ensure safety fund never give seed phrase private key looking forward hearing pushing ethereum ecosystem forward,0.9908,0.26694214876033057,0.6288710743801653
Reddit,ethereum,2025-01-21 07:01:36,2025-01-22 00:52:36.797171,daily general discussion january 21 2025welcome ethereum daily general discussion rethereum httpsimgurcom3y7vezphttpsimgurcom3y7vezp bookmarking link always bring current daily httpsoldredditcomrethereumaboutstickynum2httpsoldredditcomrethereumaboutstickynum2 please use thread discus ethereum topic news event even price price discussion posted elsewhere subreddit continue removed always constructive subreddit ruleshttpswwwredditcomrethereumaboutrules want stake learn rethstaker ethfinance ethereum community link ethereum jobshttpsethereumorgencommunitygetinvolvedethereumjobs twitterhttpsxcomethereum evmavericks youtubehttpswwwyoutubecomevmavericks discordhttpsdiscordggevmavericks doots podcasthttpsevmaverickslibsyncom doots websitehttpsdailydootscom old reddit doots extensionhttpsgithubcometheralphaethfinanceextension uhanniabu calendar jan 20 ethereum protocol attackathonhttpsblogethereumorg20241125ethereumprotocolattackathon end jan 3031 ethereumzurichhttpsethereumzurich conference feb 79 eth oxfordhttpsethoxfordio hackathon feb 1016 ethiopiahttpsethiopiaxyz conference hackathon feb 23 mar 2 ethdenverhttpswwwethdenvercom mar 2830 eth pondyhttpswwwethpondyxyz puducherry hackathon apr 13 ey global blockchain summit person virtual,0.3818,0.025000000000000005,0.2034
Reddit,ethereum,2025-01-21 18:30:44,2025-01-22 00:52:36.797171,ethereums top ten dont forget,0.354,0.25,0.302
Reddit,ethereum,2025-01-21 13:04:43,2025-01-22 00:52:36.797171,game work vitalik buterin,0.0,-0.4,-0.2
Reddit,ethereum,2025-01-21 21:42:57,2025-01-22 00:52:36.797171,secure software walletmost secure software wallet max 100 buy soon trezor ledger kraken safe 100,0.7717,0.43333333333333335,0.6025166666666667
Reddit,ethereum,2025-01-21 09:09:15,2025-01-22 00:52:36.797171,point current ef leadership change debateas probably know there debate changing ef leadership link weve curated kiwihttpsnewskiwistandcom josh stark ef team httpsxcancelcom0xstarkstatus1868751281071828999httpsxcancelcom0xstarkstatus1868751281071828999 vitaliks post leadership change httpsxcancelcomvitalikbuterinstatus1880635379771904423tqjafajpnxcu_ojklb0lg3gs19httpsxcancelcomvitalikbuterinstatus1880635379771904423tqjafajpnxcu_ojklb0lg3gs19 cobie making ef redundant httpsxcancelcomcobiestatus1879776906633150676httpsxcancelcomcobiestatus1879776906633150676 stani optimizing ef budget httpsxcancelcomstanikulechovstatus1881312457504727108httpsxcancelcomstanikulechovstatus1881312457504727108 ef mythbusting httpsxcancelcomnot_qzstatus1881300604313842106httpsxcancelcomnot_qzstatus1881300604313842106 found interesting point debate feel free share,0.8807,0.1,0.49035
Reddit,ethereum,2025-01-21 10:52:02,2025-01-22 00:52:36.797171,best way dca ethereum hi guy wondering whats bestcheapest way auyomatically dca ethereum send cold storage objective cheap hassle free possible,0.8176,0.20000000000000004,0.5088
Reddit,ethereum,2025-01-21 21:28:43,2025-01-22 00:52:36.797171,error message keep getting try swap anything eth network havent touched wallet standard coin idea,-0.4019,0.0,-0.20095
Reddit,ethereum,2025-01-21 21:14:16,2025-01-22 00:52:36.797171,gas fee helphi guy around 8k eth stored infinity wallet tried earlier send 20 worth 00075 enough eth pay fee could issue wallet say owe 3 gas definitely thanks,0.7269,0.125,0.42595
Reddit,ethereum,2025-01-20 20:35:55,2025-01-22 00:52:36.797171,native rollupssuperpowers l1 execution layer 2,0.0,0.0,0.0
Reddit,ethereum,2025-01-21 03:05:50,2025-01-22 00:52:36.797171,understanding eth stolen phantom walletbefore get called idiot hear 1800 eth straight vanished 3 hour received sent unknown wallet 1800 eth came friend coinbase sent directly ive never bought anything phantom wallet ive ever sent received im trying hardest figure hell happened somehow wallet compromised im struggling figure happened password stronggenerated password manager ive shared private key seed phrase wallet week old nothing else accessed eg bank email account phantom wallet chrome extension mobile downloaded last night wallet went seen transaction whatever latest explanation please httpsetherscanioaddress0xd924cc0a843a023ba07a436d779ec1480dc4c359 anyone able advise went wrong never interested nfts airdrop dont clue clicking trying receive free shit ive trying go absolutely everything yesterday thing think went wrong researching melania meme coin dont know synced logged phantom wallet 0 time site looking way buy sol logged apepro via phantom wallet believe connected wallet uniswap something stood jupuaryjupag link history recall visiting nothing prior website showing indicate purposely went way visit idea anyone able look etherscan find clue wallet person stole money tldr im new fuck crypto idea 1800 stolen,-0.9664,0.0005681818181818121,-0.4829159090909091
Reddit,ethereum,2025-01-21 12:23:58,2025-01-22 00:52:36.797171,0x000000aaf888da0ded40bd9b0146613158e00000how contact address sent eth mistake id like ask owner return know fraudulent address,-0.4767,0.0,-0.23835
Reddit,ethereum,2025-01-20 07:01:47,2025-01-22 00:52:36.797171,daily general discussion january 20 2025welcome ethereum daily general discussion rethereum httpsimgurcom3y7vezphttpsimgurcom3y7vezp bookmarking link always bring current daily httpsoldredditcomrethereumaboutstickynum2httpsoldredditcomrethereumaboutstickynum2 please use thread discus ethereum topic news event even price price discussion posted elsewhere subreddit continue removed always constructive subreddit ruleshttpswwwredditcomrethereumaboutrules want stake learn rethstaker ethfinance ethereum community link ethereum jobshttpsethereumorgencommunitygetinvolvedethereumjobs twitterhttpsxcomethereum evmavericks youtubehttpswwwyoutubecomevmavericks discordhttpsdiscordggevmavericks doots podcasthttpsevmaverickslibsyncom doots websitehttpsdailydootscom old reddit doots extensionhttpsgithubcometheralphaethfinanceextension uhanniabu calendar jan 20 ethereum protocol attackathonhttpsblogethereumorg20241125ethereumprotocolattackathon end jan 3031 ethereumzurichhttpsethereumzurich conference feb 79 eth oxfordhttpsethoxfordio hackathon feb 1016 ethiopiahttpsethiopiaxyz conference hackathon feb 23 mar 2 ethdenverhttpswwwethdenvercom mar 2830 eth pondyhttpswwwethpondyxyz puducherry hackathon apr 13 ey global blockchain summit person virtual,0.3818,0.025000000000000005,0.2034
Reddit,ethereum,2025-01-20 23:53:39,2025-01-22 00:52:36.797171,anyone willing send sepoliaeth need testinghello everyone im working project using ethereum college need sepoliaeth test functionality could anyone help sending faucet usually require minimum balance account release sepoliaeth address 0x7606c1166e5e3d64c1fa5b645b0fea4b441c821e thank much help,0.7845,0.06666666666666667,0.4255833333333333
Reddit,ethereum,2025-01-21 19:50:47,2025-01-22 00:52:36.797171,ethereum need steve jobsdoes ethereum need marketer storyteller get people excited whats coming world need ethereum ever,0.34,0.375,0.35750000000000004
Reddit,ethereum,2025-01-20 21:34:24,2025-01-22 00:52:36.797171,client testing call 21 protocol call,0.0,0.0,0.0
Reddit,ethereum,2025-01-20 15:40:02,2025-01-22 00:52:36.797171,ethereumrelated content ive found interesting last week stuff found interesting curtis yarvin describes independent truth servicehttpsgraymirrorsubstackcomptheindependenttruthservicer3ptcv github cofounder building company developer communitieshttpswwwyoutubecomwatchvasbr_5ti1io homomorphic encryption io 18httpsboehsorgnodehomomorphicencryption bypassing soneium sequencerhttpsxcomdonnoh_ethstatus1879210463952818472s19tlvgsqummwvedvbvlnpj1sg product anonworld launchpad anon communitieshttpsxcomslokhstatus1877829321139564695 link many handpicked kiwi communityhttpskiwistandgithubiokiwidocsdocsintro shared weekly newsletterhttpsparagraphxyzkiwiweeklykiwinewsrecap79,0.8442,0.3,0.5720999999999999
Reddit,ethereum,2025-01-21 15:39:19,2025-01-22 00:52:36.797171,unstaking ethereum remove risk stakingdoes unstaking ethereum remove risk staking,-0.4939,0.0,-0.24695
Reddit,ethereum,2025-01-20 21:11:07,2025-01-22 00:52:36.797171,quasm world first oneclick deploy zk rollup servicewere thrilled announce launch quasm delivering fastest way spin appchain contact form waiting firstclass deployment pipeline live whats deploy faster 300 quicker industry competitor multiple option starknet zksync arbitrum sandbox aztec rollup developerfriendly prefunded wallet faucet block explorer data indexer advanced logging youre looking merge web2 user experience web3 security start building quasm among group early adopter explore staging environment shape future web3 quasm platform sign quasm httpsquasmioand let merge web2 web3,0.5267,0.21233766233766233,0.3695188311688311
Reddit,ethereum,2025-01-20 15:51:29,2025-01-22 00:52:36.797171,eth staking coinbase safe eth staking coinbase please share experience coinbase eth crypto bitcoin,0.7506,0.5,0.6253
Reddit,ethereum,2025-01-21 01:22:01,2025-01-22 00:52:36.797171,help need private client server communication web3i wont go fine detail basic problem need way client pas message server receive response without server learning ip client message small fit tx payload ease want spam message chain server know ethereum address client solution web3 native solution must run browser env ie handle raw tcp comms low level considered ohttp via cloudflare sure actually work browser though considered passing message using txns chain hate idea since slow wasteful term user resource server resource considered xmtp system still early stage highly centralized meaning could go offline time considered ipfs huge pain say least would prefer use considered whisper wagmu think new name whisper terrible support back day fear still might considered tor done browser considered i2p done browser honestly point would happy paying reverse proxy strip client ip address info blackholes log find well established service like try routing cloudflare reason system always includes xforwardedfor variant header matter worker stripping rule stripping set come degens looking something thought idea one,0.8445,0.0316130536130536,0.4380565268065268
