MainSource,Source,Publication Date,Pull_date,Pre-Processed Text,Sentiment_Vader,Sentiment_TextBlob,Average_Sentiment
RSS,https://cointelegraph.com/rss,2024-12-06 22:15:00+00:00,2024-12-07 00:55:57.643090,ethereum impulse breakout lead 15k eth price 2025 analyst ethereum price finally took 4000 resistance level one analyst say eth could hit 15000 may 2025,0.0,0.0,0.0
RSS,https://cointelegraph.com/rss,2024-12-06 21:59:29+00:00,2024-12-07 00:55:57.643090,czech govt move exempt crypto held 3 year taxed prime minister said czech resident would report crypto transaction 4200 per year pay tax selling digital asset held three year,0.3612,0.0,0.1806
RSS,https://cointelegraph.com/rss,2024-12-06 21:58:04+00:00,2024-12-07 00:55:57.643090,400 million crypto wallet nonzero balance chainalysis according chainalysis realworld tokenized asset investment vehicle continue major driver crypto adoption,0.3612,0.0625,0.21185
RSS,https://cointelegraph.com/rss,2024-12-06 21:54:12+00:00,2024-12-07 00:55:57.643090,nansen provide analysis galxes gravity blockchain nansen expands yet another blockchain gravity launched galxe alpha mainnet june,0.2263,0.0,0.11315
RSS,https://cointelegraph.com/rss,2024-12-06 21:30:00+00:00,2024-12-07 00:55:57.643090,crypto biz wall street get taste altseason week crypto biz explores ether etf growing inflow political move behind metas stablecoin sunset bitgos plan india,0.1779,-0.2,-0.011050000000000004
RSS,https://cointelegraph.com/rss,2024-12-06 21:15:00+00:00,2024-12-07 00:55:57.643090,future bitcoin price dip 90k routine profit taking btc trader keep buying trader bought bitcoins dip 90000 sign investor confident btc price 100000,0.7269,0.25,0.48845
RSS,https://cointelegraph.com/rss,2024-12-06 20:45:36+00:00,2024-12-07 00:55:57.643090,eigenlayer upgrade restaking reward upgrade designed bring greater flexibility eigenlayers restaking ecosystem,0.8225,0.5,0.66125
RSS,https://cointelegraph.com/rss,2024-12-06 20:43:10+00:00,2024-12-07 00:55:57.643090,here happened crypto today need know happened crypto today latest news daily trend event impacting bitcoin price blockchain defi nfts web3 crypto regulation,0.0,0.25,0.125
RSS,https://cointelegraph.com/rss,2024-12-06 20:12:50+00:00,2024-12-07 00:55:57.643090,bitcoin spinning top candle target 115k recent 15 btc flash crash bitcoins rebound week flash crash reset key price metric paved path btc chase 115000 level,-0.5574,0.16666666666666666,-0.1953666666666667
RSS,https://cointelegraph.com/rss,2024-12-06 19:43:44+00:00,2024-12-07 00:55:57.643090,trump btc reserve plan would bad deal exny fed president bill dudley joined others suggesting purpose u government bitcoin reserve would reward trump crypto supporter,0.3182,-0.6999999999999998,-0.19089999999999993
RSS,https://cointelegraph.com/rss,2024-12-06 19:15:50+00:00,2024-12-07 00:55:57.643090,u job data point likely rate cut december grayscale interest rate cut increase m2 money supply structural deficit geopolitical tension typically drive bitcoins price higher,-0.4404,0.02777777777777778,-0.2063111111111111
RSS,https://cointelegraph.com/rss,2024-12-06 19:11:11+00:00,2024-12-07 00:55:57.643090,trump new crypto czar called openai piranha forprofit company david sack professed view openais business restructuring seemingly align elon musk,0.0,0.13636363636363635,0.06818181818181818
RSS,https://cointelegraph.com/rss,2024-12-06 19:05:52+00:00,2024-12-07 00:55:57.643090,nuvei visa partner stablecoin payment latam merchant latin america continues center blockchain integration nuvei partner new ecommerce solution merchant,0.3182,0.018181818181818174,0.16819090909090909
RSS,https://cointelegraph.com/rss,2024-12-06 19:00:00+00:00,2024-12-07 00:55:57.643090,bitcoin top 110k jan 20b trx hint altseason finance redefined based correlation liquidity index bitcoin may reach local peak 110000 january,0.2263,0.25,0.23815
RSS,https://cointelegraph.com/rss,2024-12-06 18:32:11+00:00,2024-12-07 00:55:57.643090,price analysis 126 btc eth xrp sol bnb doge ada avax ton shib bitcoin price trade 100000 proving every minor dip purchased,0.0,-0.05,-0.025
RSS,https://cointelegraph.com/rss,2024-12-06 18:08:16+00:00,2024-12-07 00:55:57.643090,fca issue warning ban pumpfun uk united kingdom financial watchdog blocked pumpfun following warning firm authorized country,-0.7717,-0.06666666666666667,-0.41918333333333335
RSS,https://cointelegraph.com/rss,2024-12-06 17:47:35+00:00,2024-12-07 00:55:57.643090,ether poised outperform bitcoin bybit bybits november market report point toward ethereum gaining traction bitcoin dominance fade,0.6808,0.0,0.3404
RSS,https://cointelegraph.com/rss,2024-12-06 16:40:43+00:00,2024-12-07 00:55:57.643090,fdic asked bank pause crypto activity court doc coinbase chief legal officer paul grewal claimed letter provided evidence alleged u government attempt debank firm wasnt crypto conspiracy theory,0.5067,-0.03333333333333333,0.23668333333333336
RSS,https://cointelegraph.com/rss,2024-12-06 16:30:22+00:00,2024-12-07 00:55:57.643090,bitcoin aim 100k analyst see record btc price daily close btc price strength quickly return bitcoin liquidation event like others history,0.6908,0.16666666666666666,0.4287333333333333
RSS,https://cointelegraph.com/rss,2024-12-06 15:44:46+00:00,2024-12-07 00:55:57.643090,ether price return 4k first time since march ether trading 4000 following month disappointing price action negative sentiment,-0.7845,-0.10999999999999999,-0.44725
RSS,https://cointelegraph.com/rss,2024-12-06 15:40:55+00:00,2024-12-07 00:55:57.643090,sec reject bid spot solana etf report u financial regulator reportedly notified least two five issuer seeking approval spot sol exchangetraded fund,0.1027,-0.13333333333333333,-0.015316666666666666
RSS,https://cointelegraph.com/rss,2024-12-06 14:42:24+00:00,2024-12-07 00:55:57.643090,crypto market today crypto market volatility rise bitcoin flash crash 93000 technical setup suggesting upside,-0.4019,0.0,-0.20095
RSS,https://cointelegraph.com/rss,2024-12-06 14:20:11+00:00,2024-12-07 00:55:57.643090,u bitcoin etf hold btc satoshi nakamoto u spot bitcoin etf collectively hold bitcoin estimated held anonymous bitcoin creator satoshi nakamoto,0.0,0.0,0.0
RSS,https://cointelegraph.com/rss,2024-12-06 14:00:05+00:00,2024-12-07 00:55:57.643090,potential charge haliey welch could face sec probe hawk launch crypto lawyer said haliey welch team could face charge following launch memecoin relevant authority take interest,0.5106,0.07500000000000001,0.29280000000000006
RSS,https://cointelegraph.com/rss,2024-12-06 12:39:13+00:00,2024-12-07 00:55:57.643090,sky face scrutiny potential 756m exploit flaw sky formerly makerdao use externally owned account eoas manage 756 million usdc reserve raise question security transparency,0.25,0.0,0.125
RSS,https://cointelegraph.com/rss,2024-12-06 12:01:31+00:00,2024-12-07 00:55:57.643090,bitcoin shape future economy transformative influence bitcoin global economy,0.0,0.0,0.0
RSS,https://cointelegraph.com/rss,2024-12-06 12:00:34+00:00,2024-12-07 00:55:57.643090,hybrid crypto exchange grvt secures bermuda license cefi defi ecosystem dont need divided regulation wellpositioned help dexs improve universal standard grvt ceo said,0.7845,0.0,0.39225
RSS,https://cointelegraph.com/rss,2024-12-06 11:00:00+00:00,2024-12-07 00:55:57.643090,crypto firm zama launch tool build private apps evm chain cryptography firm launching ethereum virtual machine coprocessor enabling full endtoend encryption private smart contract,0.4019,0.02738095238095237,0.2146404761904762
RSS,https://cointelegraph.com/rss,2024-12-06 10:59:12+00:00,2024-12-07 00:55:57.643090,trump crypto czar solana bull multicoin capital investor u crypto czar selection david sack bullish solana among investor solrelated investment firm multicoin capital,0.0,-0.2,-0.1
RSS,https://cointelegraph.com/rss,2024-12-06 10:45:00+00:00,2024-12-07 00:55:57.643090,swap token base solana stepbystep guide discover swap token base solana using crosschain bridge centralized exchange secure efficient transfer,0.6369,-0.4000000000000001,0.11844999999999997
RSS,https://bitcoinmagazine.com/.rss/full/,2024-12-06 19:12:33+00:00,2024-12-07 00:55:57.643090,joule paradox energy set value bitcoin bitcoin set value energyenergy fundamental base commodity upon everything value produced bitcoin pure embodiment energy monetary form,0.8402,-0.29285714285714287,0.27367142857142857
RSS,https://bitcoinmagazine.com/.rss/full/,2024-12-05 18:49:06+00:00,2024-12-07 00:55:57.643090,money isnt fixed yeta finite supply cap think necessary fix monetary system money seizure surveillance fundamentally much bigger problem solve,-0.2263,0.03333333333333333,-0.09648333333333334
RSS,https://bitcoinmagazine.com/.rss/full/,2024-12-05 17:27:55+00:00,2024-12-07 00:55:57.643090,100000 bitcoin price beginningwhoa think bitcoin hitting 100k peak think whats ahead 2025 getting started folk,0.0,0.0,0.0
RSS,https://bitcoinmagazine.com/.rss/full/,2024-12-05 17:26:47+00:00,2024-12-07 00:55:57.643090,guatemalan government taking closer look bitcoin memea nayib bukele bitcoin meme posted el salvador bitcoin office went viral guatemala last month im told prompted power country begin homework bitcoin craft better policy around asset,0.6597,0.25,0.45485
RSS,https://bitcoinmagazine.com/.rss/full/,2024-12-05 15:42:57+00:00,2024-12-07 00:55:57.643090,month bitcoin shattered record dive bitcoin reportdiscover key insight trend historic month bitcoin free bitcoin report dont miss outread,0.164,0.13333333333333333,0.14866666666666667
RSS,https://bitcoinmagazine.com/.rss/full/,2024-12-05 02:34:57+00:00,2024-12-07 00:55:57.643090,bitcoin officially hit 100000 first time everthis historic day cemented history,0.0,0.125,0.0625
RSS,https://bitcoinmagazine.com/.rss/full/,2024-12-04 21:37:40+00:00,2024-12-07 00:55:57.643090,fed chair jerome powell correct bitcoin competition gold dollarpowell said bitcoin digital gold,0.0,0.0,0.0
RSS,https://bitcoinmagazine.com/.rss/full/,2024-12-04 20:01:42+00:00,2024-12-07 00:55:57.643090,bitcoin developer move gauge consensus covenant soft forksbitcoin taken notable step often contentious software upgrade process,-0.296,0.3,0.0020000000000000018
RSS,https://bitcoinmagazine.com/.rss/full/,2024-12-04 14:09:46+00:00,2024-12-07 00:55:57.643090,heat home earning bitcoin heatbitheatbits founder alex busarov created device let people increase bitcoin stack keeping home warm also contributes decentralization bitcoin hashrate,0.6369,0.6,0.6184499999999999
RSS,https://bitcoinmagazine.com/.rss/full/,2024-12-03 18:49:37+00:00,2024-12-07 00:55:57.643090,want another bitcoin country something itfor first time history opportunity support presidential candidate want put country bitcoin standard,0.7269,0.125,0.42595
RSS,https://bitcoinmagazine.com/.rss/full/,2024-12-03 18:03:55+00:00,2024-12-07 00:55:57.643090,bother trying scale bitcoinbitcoiners need find balance pessimism optimism looking bitcoins future rather embracing one extreme,-0.1027,-0.0625,-0.0826
RSS,https://bitcoinmagazine.com/.rss/full/,2024-12-03 17:16:33+00:00,2024-12-07 00:55:57.643090,bitcoin selfcustody threat europea look current regulation change taking shape europe could threaten bitcoiners ability right self custody,-0.5719,0.14285714285714285,-0.21452142857142856
RSS,https://bitcoinmagazine.com/.rss/full/,2024-12-03 12:33:14+00:00,2024-12-07 00:55:57.643090,lack soft fork due lack interest lack processbitcoin core developer dedicate time energy whatever part codebase find interesting important work far hasnt really soft fork proposal,0.4019,0.17916666666666667,0.2905333333333333
RSS,https://bitcoinmagazine.com/.rss/full/,2024-12-02 17:57:13+00:00,2024-12-07 00:55:57.643090,dont sell microstrategy bitcoinwhen sell bitcoin mstr others buying,0.0,0.0,0.0
RSS,https://bitcoinmagazine.com/.rss/full/,2024-12-02 16:26:12+00:00,2024-12-07 00:55:57.643090,debanked financial suppression bitcoin business must endwhy regulator must held accountable consequence operation chokepoint 20,0.0,0.0,0.0
RSS,https://bitcoinmagazine.com/.rss/full/,2024-11-29 14:00:00+00:00,2024-12-07 00:55:57.643090,december surpass november recordbreaking bitcoin price increasefrom historic gain future growth november bitcoin price breakthrough mean investor december,0.7184,-0.10416666666666667,0.3071166666666667
RSS,https://bitcoinmagazine.com/.rss/full/,2024-11-27 21:45:37+00:00,2024-12-07 00:55:57.643090,fight bitcoin united state fiscal crossroadsin chapter satoshi paper avik roy explores looming fiscal crisis present three potential response united state restriction paralysis assimilation could bitcoin emerge solutionor spark conflict,-0.6249,0.0,-0.31245
RSS,https://bitcoinmagazine.com/.rss/full/,2024-11-27 20:26:13+00:00,2024-12-07 00:55:57.643090,bitcoin price repeat november 28 ath pattern 2013 2017 2024historically bitcoin achieved alltime high ath november 28 2013 2017 november 28 2024 imminent investor speculating whether bitcoin could reach 100000 mark significant date,0.2263,0.2675,0.2469
RSS,https://bitcoinmagazine.com/.rss/full/,2024-11-27 18:37:31+00:00,2024-12-07 00:55:57.643090,bitcoiners need grow focus shitstop worrying bitcoiners bitcoin worry accomplish want,-0.296,0.0,-0.148
RSS,https://bitcoinmagazine.com/.rss/full/,2024-11-27 16:18:57+00:00,2024-12-07 00:55:57.643090,bitcoin neither racist xenophobic misogynistic response ideological stereotypingkamala harris rejection bitcoin deprives vital resource need globally trump number go approach may jeopardize america core humanitarian value like refugee resettlement program ignore bitcoins potential aid vulnerable population globally,0.0052,-0.08,-0.0374
RSS,https://bitcoinmagazine.com/.rss/full/,2024-11-27 14:23:40+00:00,2024-12-07 00:55:57.643090,here talk bitcoin thanksgiving tableshare resource dont give advice,0.0,0.0,0.0
RSS,https://bitcoinmagazine.com/.rss/full/,2024-11-27 10:22:41+00:00,2024-12-07 00:55:57.643090,michael saylor doesnt control bitcoin notion michael saylor singlehandedly decide bitcoins fate microstrategys stack simply ridiculous,-0.3612,-0.3333333333333333,-0.34726666666666667
RSS,https://bitcoinmagazine.com/.rss/full/,2024-11-26 21:52:20+00:00,2024-12-07 00:55:57.643090,maximizing bitcoin accumulation beyond benchmark bitcoin redefined digital asset landscape outperforming traditional market year year investor institution maximize bitcoin holding beyond simple buyandhold strategy,0.3612,0.0,0.1806
RSS,https://bitcoinmagazine.com/.rss/full/,2024-11-26 17:26:10+00:00,2024-12-07 00:55:57.643090,bitcoin script focus building block wild geeseconversations around script upgrade bitcoin become unfocused irrational lost serious context public square,-0.8625,-0.15833333333333333,-0.5104166666666667
RSS,https://bitcoinmagazine.com/.rss/full/,2024-11-26 17:03:29+00:00,2024-12-07 00:55:57.643090,use bitcoin easily privately cake walletcake wallet founder vik sharma team created one usable noncustodial bitcoin crypto wallet market perhaps one offer transactional privacy,0.5267,0.0,0.26335
RSS,https://bitcoinmagazine.com/.rss/full/,2024-11-26 16:53:42+00:00,2024-12-07 00:55:57.643090,remembering john mcafees bullish bitcoin price bet near 100k milestoneas bitcoin teeter brink 100000 revisit john mcafees audacious 1 million prediction exploring whether maverick wild foresight sheer madness stroke geniusand timing thing got wrong,-0.6249,-0.075,-0.34995
RSS,https://bitcoinmagazine.com/.rss/full/,2024-11-26 14:00:00+00:00,2024-12-07 00:55:57.643090,fidelity investment director share bitcoins adoption valuation modelsjurrien timmer director global macro fidelity investment recently shared bitcoin valuation model based adoption curve monetary policy scenario offering perspective asset maturing role network monetary innovation,0.8271,0.0,0.41355
RSS,https://bitcoinmagazine.com/.rss/full/,2024-11-25 17:11:37+00:00,2024-12-07 00:55:57.643090,safegcds implementation formally verifiedverifying implementation novel modular inversion algorithm using proof assistant guaranteeing bitcoin cryptography handled correctly done,0.3182,0.0,0.1591
RSS,https://bitcoinmagazine.com/.rss/full/,2024-11-25 14:15:42+00:00,2024-12-07 00:55:57.643090,newmarket capital launch battery finance bitcoincollateralized loan strategy battery finance enables borrower use bitcoin collateral loan without marking market mean bring forward bitcoins value,0.34,-0.3125,0.013750000000000012
RSS,https://bitcoinmagazine.com/.rss/full/,2024-11-25 14:00:00+00:00,2024-12-07 00:55:57.643090,invest bitcoin opensource companiesthe launch timestamp really piqued interest,0.5678,0.2,0.3839
RSS,https://bitcoinmagazine.com/.rss/full/,2024-11-22 18:38:34+00:00,2024-12-07 00:55:57.643090,jason spaceboi lowerys bitcoin thesis incoherent gibberishthis space full incoherent nonsense paraded around deep insightful analysis nothing absurd jason lowerys softwar thesis,-0.4019,-0.11000000000000001,-0.25595
RSS,https://bitcoinmagazine.com/.rss/full/,2024-11-22 17:50:03+00:00,2024-12-07 00:55:57.643090,legacy medias transformation evolution beat extinctionlegacy medium evolving audience demand transparency independence bitcoin paving way new era decentralized trustworthy journalism,0.4767,0.13636363636363635,0.3065318181818182
RSS,https://bitcoinmagazine.com/.rss/full/,2024-11-22 16:23:29+00:00,2024-12-07 00:55:57.643090,gary genslers departure triumph bitcoinas upcoming trump administration gearing establish regulatory landscape facilitating fullon anythinggoes multicoinery gary gensler gone could well see atrocious scam coin proliferate soar inevitably implode,0.128,-0.35,-0.11099999999999999
RSS,https://bitcoinmagazine.com/.rss/full/,2024-11-22 14:29:00+00:00,2024-12-07 00:55:57.643090,onchain data show bitcoin price bull run far overdespite bitcoins recent rally onchain data reveals bull market still plenty room grow metric like mvrv zscore nupl puell multiple suggest bitcoin far overheated pointing potential significant upside month ahead,0.5106,0.09583333333333333,0.3032166666666667
RSS,https://bitcoinmagazine.com/.rss/full/,2024-11-21 23:02:16+00:00,2024-12-07 00:55:57.643090,bitcoin nears 100000 trump council expected implement btc reservethis bullish bitcoin ive ever,0.0,-0.1,-0.05
RSS,https://bitcoinmagazine.com/.rss/full/,2024-11-21 22:23:20+00:00,2024-12-07 00:55:57.643090,microsoft buy 78 billion worth bitcoinmicrosoft clinging cash rejecting bitcoins proven value boost make zero sense quit wasting reserve buy btc,0.0772,0.3,0.1886
RSS,https://bitcoinmagazine.com/.rss/full/,2024-11-21 18:18:18+00:00,2024-12-07 00:55:57.643090,want greater bitcoin adoption engage governmenti tip hat digioats ceo heritage falodun stepping educate nigeria deposit insurance corporation ndic importance bitcoin,0.7717,0.5,0.63585
RSS,https://bitcoinmagazine.com/.rss/full/,2024-11-21 18:01:32+00:00,2024-12-07 00:55:57.643090,bitcoin pi cycle top indicator accurately time market cycle peaksthe bitcoin pi cycle top indicator flawlessly identified every market cycle peak bitcoins history unique mathematical foundation historical accuracy could predict next top bitcoin evolves mature market,0.7906,0.3375,0.5640499999999999
RSS,https://bitcoinmagazine.com/.rss/full/,2024-11-21 17:43:35+00:00,2024-12-07 00:55:57.643090,viable bitvm based pegsa look recent report galaxy looking economic viability two way peg secured bitvm,0.4019,0.1,0.25095
RSS,https://bitcoinmagazine.com/.rss/full/,2024-11-21 15:26:49+00:00,2024-12-07 00:55:57.643090,chart show bitcoins bull run wont stop 100000 sure might selloff far peak bitcoin,-0.0191,0.3,0.14045
RSS,https://bitcoinmagazine.com/.rss/full/,2024-11-20 18:49:28+00:00,2024-12-07 00:55:57.643090,bitcoin boost microstrategy mstr higher trading volume tesla nvidiathe bitcoin treasury effect real,0.5423,0.225,0.38365
RSS,https://bitcoinmagazine.com/.rss/full/,2024-11-20 18:12:38+00:00,2024-12-07 00:55:57.643090,jippi pokémon go bitcoin gamified bitcoin education serve catalyst hyperbitcoinization coming year jippi hope spearhead next wave bitcoin adoption offering newcomer fun friendly entry point industry,0.8555,0.225,0.54025
RSS,https://bitcoinmagazine.com/.rss/full/,2024-11-19 19:33:21+00:00,2024-12-07 00:55:57.643090,u strategic bitcoin reserve fomo horribly oversoldwould great u started buying bitcoin surely industry political capital cash let use wisely,0.7506,0.2,0.47530000000000006
RSS,https://bitcoinmagazine.com/.rss/full/,2024-11-19 18:31:11+00:00,2024-12-07 00:55:57.643090,good riddance martin gruenbergthe fdic chairman one main orchestrator operation chokepoint 20 cant leave fast enough,0.4675,0.26666666666666666,0.3670833333333333
RSS,https://bitcoinmagazine.com/.rss/full/,2024-11-19 18:01:12+00:00,2024-12-07 00:55:57.643090,stablecoins friendsstablecoins one biggest mistake ever made bitcoin space ostracized discouraged embraced,-0.6249,0.0,-0.31245
RSS,https://bitcoinmagazine.com/.rss/full/,2024-11-19 17:15:53+00:00,2024-12-07 00:55:57.643090,bitcoin treasury adoption surge meet new microstrategysinstitutional bitcoin adoption,0.2023,0.13636363636363635,0.1693318181818182
RSS,https://bitcoinmagazine.com/.rss/full/,2024-11-19 14:20:08+00:00,2024-12-07 00:55:57.643090,bitcoin multisig company casa make selfsovereignty easycasa cofounder ceo nick neuman belief taking customercentric approach help get people use multikey bitcoin vault,0.4019,0.0,0.20095
RSS,https://bitcoinmagazine.com/.rss/full/,2024-11-18 23:21:33+00:00,2024-12-07 00:55:57.643090,100000 bitcoin right around corner today tidal wave bullish bitcoin development convinced btc hit 100000 week,0.4019,0.2857142857142857,0.34380714285714287
RSS,https://bitcoinmagazine.com/.rss/full/,2024-11-18 16:41:56+00:00,2024-12-07 00:55:57.643090,buy drug get bitcoini learned nihowdy company let earn bitcoin purchasing prescription drug im intrigued,0.0,0.0,0.0
RSS,https://bitcoinmagazine.com/.rss/full/,2024-11-18 15:00:27+00:00,2024-12-07 00:55:57.643090,paint sandwich solo presentation meme digital culture nardo bitcoin mena5 footlongs meme mushroom bitcoin,0.0,0.0,0.0
RSS,https://bitcoinist.com/feed/,2024-12-06 23:00:19+00:00,2024-12-07 00:55:57.643090,forget xrp price pump analyst say dont sell xrp 7 thing happenmarket participant look securing profit seeing xrp price corrected since recent parabolic rally analyst thexrpguy outlined seven reason yet secure profit hold selling coin suggesting parabolic rally lie ahead xrp price rally lie ahead analyst list reason,0.8225,0.2,0.51125
RSS,https://bitcoinist.com/feed/,2024-12-06 21:30:36+00:00,2024-12-07 00:55:57.643090,solana make critical pattern breakout next key levelswith massive gain past day solana shown true potential ongoing bull cycle making sol one bestperforming crypto asset market result upswing growing confidence within community likelihood sol surging higher resistance level new,0.886,0.054040404040404035,0.470020202020202
RSS,https://bitcoinist.com/feed/,2024-12-06 20:00:15+00:00,2024-12-07 00:55:57.643090,bitcoin shakeout sent price 102k 92k here whybitcoin finally shattered 100000 barrier reaching alltime high 103600 milestone marked historic moment cryptocurrency investor enthusiast celebrated journey six figure however euphoria shortlived within hour btc experienced sharp reversal plunging 92000 dramatic selloff left market reeling related,0.7506,0.08516666666666668,0.4178833333333334
RSS,https://bitcoinist.com/feed/,2024-12-06 18:30:35+00:00,2024-12-07 00:55:57.643090,dogecoin price follows bitcoin trajectory doge hit 0569 happensas bitcoin continues attract major inflow institutional investor dogecoin price move increasingly becoming goto cryptocurrency retail investor interestingly dogecoins price performance also largely correlated bitcoin price bitcoins recent break 100000 price level seen dogecoin price also,0.6369,0.24535714285714283,0.4411285714285714
RSS,https://bitcoinist.com/feed/,2024-12-06 17:00:41+00:00,2024-12-07 00:55:57.643090,exgoldman sachs ceo belief bitcoin could rival u dollar reserve currencyin post shared thursday via x lloyd blankfein former chief executive officer goldman sachs acknowledged potential competitive dynamic bitcoin u dollar context global reserve currency blankfein previously held skeptical view digital asset acknowledged btcs growth may place direct competition,0.8176,-0.07083333333333333,0.37338333333333334
RSS,https://bitcoinist.com/feed/,2024-12-06 16:27:30+00:00,2024-12-07 00:55:57.643090,flockerz fly high hawk fall 95fraud another influencerled meme coin gone bad thats painful question investor facing aftermath hawk meme coin two day ago haliey welch team pull classic rug pull simply impact fud hitting volatile meme coin either way,-0.8176,-0.045555555555555516,-0.4315777777777777
RSS,https://bitcoinist.com/feed/,2024-12-06 16:01:25+00:00,2024-12-07 00:55:57.643090,gme spike 59 roaring kitty return x altcoin season star capitalize rallyfinancial analyst keith gill known roaring kitty youtube made comeback social medium three month silence response gme amc roar token inspired 2021 gamestops short squeeze spiked 50 24 hour degens celebrate kitty return short rally gamestops short squeeze one,0.7845,0.008333333333333333,0.39641666666666664
RSS,https://bitcoinist.com/feed/,2024-12-06 15:30:43+00:00,2024-12-07 00:55:57.643090,bitcoin market see strong confidence among shortterm holder amid growing pricesinvestors trader engaging bitcoin following remarkable price growth past week cementing position leading digital asset crypto market however report show robust optimism spotted mainly among btcs shortterm investor bullish sentiment shift toward bitcoins shortterm holder sudden turn,0.9729,0.18750000000000003,0.5802
