MainSource,Source,Publication Date,Pull_date,Pre-Processed Text,Sentiment_Vader,Sentiment_TextBlob,Average_Sentiment
Reddit,solana,2024-10-21 09:02:31,2024-10-23 00:51:38.638577,guide discover trade fresh memecoinswhats degens im back strategy used month ago research pick new pair hope 35x investment managed get hundred dollar something around 10k strategy people made much others lost youve trading memecoins grandma born experience builder pyramid guide newcomer trader month already know developer shitcoin dev lol currently focused understanding transaction psychology behind solana network people use getting guide let emphasize volatile market know aware dozen conversation user around subreddits came realization many understand volatile market make lifechanging money prepared lose everything invest never ever indulge trading memecoinsshitcoins money prepared lose plan trading first salary saving stop circumstance put money coin using strategy probably lose get depressed want believe way let get guide lot platform use finding checking new coin dexscreener birdeye use supplement well start research process dexscreener left side select solana since well trading memecoins network greeted table trending coin past 24 hour good overview coin could make money already pumped dumped repeat cycle one time already lived life goal strategy catch new coin launched havent gained traction plan adding 5 50 hope 20x usually happens least one coin per day two keep mind cant accurately predict coin succeed end day youre relying luck matter much research much technical knowledge however guide least minimize risk bit find newest coin first go rank option top right corner table order ascending scroll bottom select rank pair age httpsimgurcom5h8jbz8 show newly launched token open token scroll bit right side see token information includes pair age httpsimgurcomy31w8fn token example 2 minute old go back coin overview page let filter go filter option next sort option top right corner table select following parameter min liquidity 2000 max pair age 3 hour looking token past 3 hour minimum acceptable liquidity token le 2000 liquidity good trading since impact price trade pretty noticeable start observing thing volume number transaction holder dont want coin dont coin movement usually dont trade one le 100 holder ive seen sniper enter immediately coin appears blockchain one final thing check dexscreener whether token advertised token advertised see banner side httpsimgurcomatsd5ilp includes info token well social link website cost 299 usually add another layer trust token personal experience token advertised dexscreener around 3 time likely succeed nonadvertised token however keep mind advertisement doesnt mean token good 90 advertised token still turn unprofitable straight rugpulls go birdeye check coin first check security coin found left side website httpsimgurcomfv7z079 important token mintable ownership renounced picture doesnt mean coin scam lower chance since owner cant make additional change token cant mint new token go first mint tx address check solscan open account token minted check address distributed coin here example token 1000000000 total supply httpsimgurcomf6gfaur see account received total supply upon mint distributed across different wallet last wallet received 80 total supply liquiditypool wallet wallet creator plan dumping token lp price token increase bit different traditional rugpool still put creator token invisible advantage trader write guide difference rugpools type coin future case token decide whether 20 advantage creator gave something want back legitimate project token usually frozen extended period used salary team member marketing purpose etc case memecoins purpose give free money coin creator last step process check coin social especially discord one telegram x also search token name reddit see people commenting make sure make critical observation communication platform discord telegram see real engagement people talking vital sign token increase chance success usually analysis end repeat dozen dozen coin pick one satisfy provided criterion put money lose 550 hope one 10x 20x 100x use tool autosell milestone want reach usually conservative trader example sell 20 token 2x 50 3x rest 6x also stop loss set place case token start tanking sell automatically hope guy found guide helpful around guide engagement community help u understand live like educated degens,0.996,0.07522357028935979,0.5356117851446799
Reddit,solana,2024-10-22 04:49:03,2024-10-23 00:51:38.638577,find payment contract address dexscreeneris possible know payment contract address dexscreener like token advertising trending bar advertising would really helpful track,0.6801,0.1,0.39005
Reddit,solana,2024-10-22 16:27:49,2024-10-23 00:51:38.638577,solana trade update told,0.0,0.0,0.0
Reddit,solana,2024-10-22 10:19:07,2024-10-23 00:51:38.638577,solana developer anything askfriends tool need solana,0.0,0.0,0.0
Reddit,solana,2024-10-22 10:13:13,2024-10-23 00:51:38.638577,custom domain name mapping solscanhow domain mapped account address solscan sn currently support sol domain platform see domain also supported like flipgghttpflipgg,0.7579,0.0,0.37895
Reddit,solana,2024-10-22 03:53:02,2024-10-23 00:51:38.638577,product ama arzine discus jupiter limit order tool today 1030 pm sgt,0.0,0.0,0.0
Reddit,solana,2024-10-22 05:56:07,2024-10-23 00:51:38.638577,verify token solana verify token mine made cto want 99 vote dextools know te way verify token right,0.0772,0.2857142857142857,0.18145714285714284
Reddit,solana,2024-10-21 17:50:37,2024-10-23 00:51:38.638577,asset viewonly walletthis second thread create problem solved yet see asset enter adress viewonly wallet key 12 phrase open existing wallet would nothing anyone know whats wrong,0.34,-0.125,0.10750000000000001
Reddit,solana,2024-10-22 05:41:01,2024-10-23 00:51:38.638577,question solana liquidity poolshttpspreviewredditqt9c8jf9v8wd1pngwidth1651formatpngautowebps46e5acd017566abf907a7e7d076c0f7e51347fb9 created position solanausdc liquidity pool 30 stopped giving yield twothree day say range top mean position produce yield range created position httpspreviewreddit9ou65ll0w8wd1pngwidth806formatpngautowebpsca7f74bf86649a94a8b969a015dd1919c5c65ffc dont get work liquidity provider still facilitate usdc anyone wanting sell solana barred trade fee also suggestion thought providing liquidity fundamental token blockchain usdc would mean stable return seem case,0.7579,-0.041666666666666664,0.3581166666666667
Reddit,solana,2024-10-22 18:33:26,2024-10-23 00:51:38.638577,need 1 cent worth solcan anyone send 1 cent preferaby like 5 cent since need probably make multiple transaction usdt solana thing im begging address hbrvhkoynqfbtuujzhccaffdpdytgweybrbi1vgsjfjz,0.5267,0.15,0.33835
Reddit,solana,2024-10-21 20:01:53,2024-10-23 00:51:38.638577,cash solive using phantom bit id like know cash solana since really clear exchange thingy there lot crypto currency thing like paypal usd basically im confused would like know,0.796,-0.15000000000000002,0.323
Reddit,solana,2024-10-22 03:10:29,2024-10-23 00:51:38.638577,question developing pumpfun monitorshello apology post would better suited another section reddit quite monitor believe would help trading wondering would possible code look im overwhelmed cloud server etc expensive run monitor cloud server even able create monitor zero previous coding knowledge hoping use chatgpt help example monitor similar id looking develop x amount volume past x minute coin 30000 market cap know bullxphoton give bunch filter im looking develop alert,0.93,0.01190476190476191,0.47095238095238096
Reddit,solana,2024-10-22 00:51:49,2024-10-23 00:51:38.638577,vaneck eu launch staking solana etphttpsxcomkyle_chassestatus1848333000616104084tqkkcjadbkga1oyjdztxepas19,0.0,0.0,0.0
Reddit,solana,2024-10-22 13:18:27,2024-10-23 00:51:38.638577,copy regret later,-0.4215,0.0,-0.21075
Reddit,solana,2024-10-21 23:35:15,2024-10-23 00:51:38.638577,happened stake stepfinanceabout 3 year ago moved 300 solana network using mathwallet attempted try defi stepfinancehttpstepfinance staked thats right word following pool based note back srmsol 1255 apy ethsrm 474 apy usdcsol 2420 apy today three year logged stepfinancehttpstepfinance see virtually nothing dashboard two nfts pop never bought happened stake pool,0.0,0.09523809523809523,0.047619047619047616
Reddit,solana,2024-10-22 09:34:12,2024-10-23 00:51:38.638577,snoofi reddit dogwhat expect snoofi ive 2 month im waiting breakout many day consolidation floor really strong community active really like gme even become official meme coin reddit httpspreviewreddite2vseh412awd1jpgwidth586formatpjpgautowebpse7e15bf28b8e6d58d6bd08c827c76512da6ef8f9,0.8537,0.25,0.55185
Reddit,solana,2024-10-22 01:54:44,2024-10-23 00:51:38.638577,failed sign transaction using ledgerim trying stake ledger using staking site try complete transaction get error failed sign transaction using ledger unstaked everything withdrew everything using sol account ledger know signing transaction feature working reason try turn around restake get error ive tried different validators getting result sure immediately error doesnt flash anything ledger screen sign quickly error click button web page finish transaction able stake sure whats wrong idea also question im pretty sure need unstake everything order add bought stake correct ended unstaking closing account need start another staking account assume,-0.886,0.10757575757575757,-0.38921212121212123
Reddit,solana,2024-10-21 13:53:40,2024-10-23 00:51:38.638577,need help start journeyi need help dont know start everything confusing know people making money gatekeeping process youtube vids conflicting anyone guide go even mentor process buysell appreciate god bless,0.8126,-0.3,0.2563
Reddit,solana,2024-10-21 21:13:03,2024-10-23 00:51:38.638577,happens memecoin pumpfun bond get transferred raydiumim sorry dumb question couldnt find answer anywhere saw memecoins completing bonding pumpfun price 00000008 bonding repriced somewhere around 000006 mean sell well price catch,-0.3612,-0.3958333333333333,-0.37851666666666667
Reddit,solana,2024-10-21 14:53:00,2024-10-23 00:51:38.638577,look solana activity data tvl wallet transaction fee inflation supply,0.0,0.0,0.0
Reddit,solana,2024-10-21 19:48:36,2024-10-23 00:51:38.638577,memecoin trading tip questionhi guy im total beginner come memecoin trading follow telegram geoup someone post tipps since follow saw 8 recommandations group every single time recommandation coin worth 200600 within 23 minute rhen stayed pretty high foe least 2060 minute question possible thats easy could always invest amount convert back sol minute later cash whats thing dont see cant believe true thanks,0.0931,0.11015873015873014,0.10162936507936507
Reddit,solana,2024-10-21 09:51:48,2024-10-23 00:51:38.638577,sol usdc gonehello guy recently updaterestart phone installed fresh new apps like exodus trust wallet used keeptransfer asset via exodus key 12 word portfolio zero exudos trust wallet sol usdc balance 0 check previous adress solscan sol usdc balance wallet nothing,0.9169,0.05393939393939393,0.485419696969697
Reddit,solana,2024-10-21 18:16:04,2024-10-23 00:51:38.638577,solana developer questionive trying make buy function solana trading bot using python week sometimes work time doesnt time doesnt tried using different rpc even custom one quicknode nothing work something github working buy function use reference,0.0,0.0,0.0
Reddit,solana,2024-10-21 11:09:55,2024-10-23 00:51:38.638577,checking top 10 holder crypto coin hi guy website check top 10 holder coin check see coin worth checking like give stats know solana meme coin bullx birdeye im looking particularly bnb coin chance guy would know,0.8055,0.3666666666666667,0.5860833333333333
Reddit,solana,2024-10-21 01:33:36,2024-10-23 00:51:38.638577,programming language best learn onchainim looking find career type field working crypto seems best way get involved gaining programming experience question would good course path follow want end goal programming language best learn goal read python rust c would beneficial skill focus learning,0.9702,0.925,0.9476
Reddit,solana,2024-10-20 18:15:40,2024-10-23 00:51:38.638577,crypto influencers carefuledit edited remove name big crypto influencers really irrelevant applicable big guy seeing lot talk crypto influencers yes big guy like t mr f many others pumping dumping follower realize large following sooo 1 know drop clue figure wallet sometimes openly share wallet 2 test see many people going copy trade influence test see much leverage way figure exactly 1k investment make much money get thrown give idea much move price therefore figure exitdump price 3 find 20k market cap coin buy 1k worth 4 wait price pump dump price take minute dump making quick 10x 5 repeat conversation come good bad moral v immoral thing buy exit basically dumping people bought answer setting trap intent dump follower influence key similar rug pull coin released intent pull liquidity buyer trap whomever come try belittle pretend dont understand setting trap simply admitting wish could scam people way advice blindly copy trade anybody allow time pas dont fomo buy give time let price settle wait good amount time know sure theyre pump dumping scam tactic know another thing theyre 1 finding dead coin 2 create 10 fresh new wallet 3 buy dead coin slowly random wallet time preventing price moving much radar 4 buy public main wallet triggering others buy coin 5 pump shit twitter pointing target never attained 6 hold coin main wallet never actually sell show conviction dumping 7 sell 10 wallet manipulate market 8 add liquidity 9 shill twitter price pump 10 remove liquidity 11 dump price 10 wallet price drop faster liquidity removed 12 buy 10 wallet 13 repeat scam moral immoral would say intent malicious scam immoral wrong every level equivalent coin launch dev holding huge amount coin multiple wallet already know thats bad justify crypto influencers might gotten lucky trade two following theyre pumping coin let call bull shit bull shit period also sad see religious people wrong reason youre seeing lot big influencers randomly shilling dead coin back life running new scam accumulating lot coin multiple wallet triggering others buy buying public wallet essentially buying coin influencer taken role developer hold huge portion coin spread amongst many wallet funny thing without taking responsibility actual dev influencers tend hate coin came market pumping hard actually best fud prevent liquidity going missed dont stake might turn pro coin got somehow good dip got free coin love dead coin take love pump dump follower there shit theyre well im putting hopefully noobs run least understand whats happening,-0.9955,0.04051226551226549,-0.4774938672438673
Reddit,solana,2024-10-21 06:01:16,2024-10-23 00:51:38.638577,lost dont know starthey help starting memecoins already set trojan bot thing phantom account linked together already got dex screener app access bullxio however idea use bot plus possible copy trader solscan wallet make trojan bot follow exact order without anything,-0.5511,0.08333333333333333,-0.23388333333333336
Reddit,solana,2024-10-21 05:16:24,2024-10-23 00:51:38.638577,want snipe first block set setting make buy first block 0 know buy bot like mintech peppermint buy dedicated nodeprivate server proxy paid bloxroutes improve super fast transaction right need something else better suggestion idea appreciated,0.9186,0.28843537414965986,0.6035176870748299
Reddit,solana,2024-10-20 22:35:57,2024-10-23 00:51:38.638577,job get paid solana hey guy wondering guy know job crypto could get paid solana want crypto side hustle wondering anyone could hire lead right direction x account telegram thats people advised past cant seem find anyone hire anything help thanks,0.7096,0.07857142857142857,0.39408571428571426
Reddit,solana,2024-10-21 08:00:19,2024-10-23 00:51:38.638577,pow combined poh possibleso im intelligent way blockchains work know shit question proof work combined proof history like possible,0.2263,0.20000000000000004,0.21315
Reddit,solana,2024-10-21 02:53:58,2024-10-23 00:51:38.638577,best copy trade setting trojan bot question making profit say sold 77 bought 13 bought 21 worth sold 28 wondering seeing much profit receiving playing around buy gas slippage dont know thats issue wondering could help want know setting good amount trade httpspreviewredditb6l4ywemx0wd1pngwidth431formatpngautowebps28e7d0166d4b95641899cafdcbc037a807ca4d0c httpspreviewreddit2fmhnxemx0wd1pngwidth436formatpngautowebps0b761cd25f8d2f4bf8596f7ec0badf2d83f0427f httpspreviewreddit3cz9r0fmx0wd1pngwidth436formatpngautowebpsd7036f51dd2112f4ad0988f77182119994fe7212 httpspreviewredditvkfezxemx0wd1pngwidth435formatpngautowebps34223b5cb921248e11cf5c0c743b47b37a579b49,0.9559,0.55,0.75295
Reddit,solana,2024-10-21 20:21:15,2024-10-23 00:51:38.638577,raising fund twitter meme coin solhello everyone working meme project certain appeal sol degens fund liquidity share wallet address twitter raise fund liquidity using project account,0.5106,0.21428571428571427,0.3624428571428572
Reddit,solana,2024-10-21 07:21:40,2024-10-23 00:51:38.638577,app watch specific walletis app way watch specific wallet notified wallet change certain dollar amount percentage,0.2732,0.07142857142857142,0.1723142857142857
Reddit,solana,2024-10-20 19:40:30,2024-10-23 00:51:38.638577,best place learn educate myselflooking get trading specifically sol memecoins im unsure learn beginner without someone trying sell course lol help appreciated thank,0.926,0.6666666666666666,0.7963333333333333
Reddit,solana,2024-10-20 16:51:08,2024-10-23 00:51:38.638577,bought field trader empty someone please explain,0.128,-0.1,0.013999999999999999
Reddit,solana,2024-10-21 09:27:07,2024-10-23 00:51:38.638577,memecoins trading adviceshey guy im interested tool wallet tracking volume spotter something like thank nice day,0.8591,0.425,0.64205
Reddit,solana,2024-10-21 07:13:18,2024-10-23 00:51:38.638577,jupiter perps adjusting liquidation levelcan someone please explain possible open 5x long sol liquidation level 140 price get close say 142 would adjusted increase position lower x value,0.5859,-0.016666666666666666,0.28461666666666663
Reddit,solana,2024-10-21 13:00:46,2024-10-23 00:51:38.638577,top solana meme coin 2024 2025 make million bull season,0.2023,0.5,0.35115
Reddit,solana,2024-10-21 06:41:39,2024-10-23 00:51:38.638577,0003 sol le actual balancehi never paid attention byt noticed phanton helium wallet see balance sol example 01 try make transaction le 0003 case 0097 reasonexplanation thanks,0.4404,0.1,0.2702
Reddit,solana,2024-10-20 22:03:58,2024-10-23 00:51:38.638577,convert sol jitosol invest kaminos liquidity pool long termhey everyone ive saved around 55 sol plan hold long term 35 year course im looking best safest way generate gain holding recently found jitosol kamino im wondering safe convert sol jitosol invest kamino liquidity pool say 5 year insight advice would greatly appreciated,0.9617,0.26666666666666666,0.6141833333333333
Reddit,solana,2024-10-20 21:32:25,2024-10-23 00:51:38.638577,sol perpwhere bestcheapest place whats risk anyone explain sol prep please done appreciate sort leverage believe couldnt find much information,0.4404,0.2,0.32020000000000004
Reddit,solana,2024-10-19 21:57:09,2024-10-23 00:51:38.638577,please help say 24k usd worth qwack cant sell,0.7096,0.3,0.5048
Reddit,solana,2024-10-20 15:20:22,2024-10-23 00:51:38.638577,havent received reward staking coinbase staked sol 8 day ago oct 12th unstaking earning frequency est time say 5 day currently coinbase 8 day havent received reward yet first time staking sol sure good coinbase staking curious timing maybe taking longer wait maybe problem unstake,-0.2951,0.26999999999999996,-0.012550000000000006
Reddit,solana,2024-10-20 23:51:44,2024-10-23 00:51:38.638577,need help good solana setting trojan boti question making profit say sold 77 bought 13 bought 21 worth sold 28 wondering seeing much profit receiving playing around buy gas slippage dont know thats issue wondering could help,0.9413,0.39999999999999997,0.67065
Reddit,solana,2024-10-20 13:05:16,2024-10-23 00:51:38.638577,photon sol rediculous platform fee 3hey ive experimenting using photon sol bit cant get crazy fee example using 03 slippage fee 00001 bribery priority fee buying coin 1 sol left 0965 sol worth token bought seems like transaction fee roughly 3 even though people online seem claiming 1 missing something,0.5,-0.12000000000000002,0.19
Reddit,solana,2024-10-20 15:11:56,2024-10-23 00:51:38.638577,mad jupiter coinbase validator betterwhich validator best safe,0.5994,0.2916666666666667,0.44553333333333334
Reddit,solana,2024-10-20 22:23:07,2024-10-23 00:51:38.638577,low transaction fee solana solana phantom wallet im planning selling whenever reach 200 best place sell,0.4939,0.5,0.49695
Reddit,solana,2024-10-20 16:19:21,2024-10-23 00:51:38.638577,phantom wallet say im overall usd worth le put inso bought roughly 230usd worth coin went updown couple day an showing around 170usd worth wallet say im roughly 23usd work shouldnt 60usd,0.5719,0.11666666666666668,0.34428333333333333
Reddit,solana,2024-10-20 13:01:52,2024-10-23 00:51:38.638577,trying build web3 blockchain module deltabased state synchi im building web3 blockchain module sync state node using delta update aiming reduce data transfer especially sidechains shard chain bandwidth critical basic grasp delta calculation sending change full state want explore something innovative guidance implementing potential challenge would greatly appreciated,0.6997,0.15,0.42485
Reddit,solana,2024-10-20 17:50:12,2024-10-23 00:51:38.638577,phantom wallet wont authenticate reason phantom wallet failing read thumbprint using iphone suggestion unable authenticate message,-0.5106,-0.5,-0.5053000000000001
Reddit,solana,2024-10-20 10:34:43,2024-10-23 00:51:38.638577,inpermanent loss hey guy idk happened got 6 worth coin even tho paid 95 800k mcap bought 370k someone help legit telegram raydiumswap group full scammer go defi idk someone guide,0.128,0.32499999999999996,0.22649999999999998
Reddit,solana,2024-10-20 21:06:36,2024-10-23 00:51:38.638577,service send sol memecoin alert webhooki currently use tradingview alert triggered custom indicator setting send webhook alert instruct trading bot execute trade solana blockchain however tradingview doesnt support latest meme coin looking alternative service offer following feature 1 support latest meme coin 2 ability create alert based indicator setting simple price alert 3 webhook support send alert 4 option include json alert detailed instruction bot service feature exist,0.958,0.2333333333333333,0.5956666666666667
Reddit,solana,2024-10-20 20:46:12,2024-10-23 00:51:38.638577,batch processing blockshi want process solana transaction two option 1 use getblock rpc 2 use websocket connection second approach seems ok requires running computer time also retries probably data loss itd perfect batch load new block every hour even though jsonrpc support batching think free node wont happy serve request hundred subrequests service providing history data transaction,0.6126,0.47272727272727266,0.5426636363636363
Reddit,solana,2024-10-20 20:35:07,2024-10-23 00:51:38.638577,anybody know good trojan bot setting pumpfun copy trading wondering setting copy trading pumpfunhttppumpfun token ensure making maximum profit trading 05 solana per trade want know put slippage buy sell gas,0.8271,0.7,0.76355
Reddit,solana,2024-10-20 20:32:33,2024-10-23 00:51:38.638577,drift dex subaccounts securityhi ive using drifttradehttpdrifttrade perpetuals platform great however uncertain safety requirement deposit fund subaccounts actively trade borrow lend platform fund transferred trading subaccount effectively leave original wallet address solflare key dex essentially key balance ttrading subaccount architecture solana chain contract enables still belong original wallet im clued intricacy blockchain smart contract attempted fund clarity reviewing relevant transaction wasnt able glean much,0.9565,0.3028138528138528,0.6296569264069264
Reddit,solana,2024-10-20 17:45:20,2024-10-23 00:51:38.638577,help getting solana keplr walleti cant seem find bridge thats cosmos friendly need send fund phantomsolflare,0.7096,0.375,0.5423
Reddit,solana,2024-10-19 19:25:47,2024-10-23 00:51:38.638577,one buy sell crypto le second tool useits called sniping apparently huge advantage others anyone able execute tx speed know done,0.7003,0.3,0.50015
Reddit,solana,2024-10-19 14:01:43,2024-10-23 00:51:38.638577,who actual millionaire multimillionaire solana wondering watching alot wallet scare shit see 100m wallet basically creating degen memecoins rugpulling whove made profit especially whore millionaire care explain coin pumping approximate time make money big challenge feel becoming millonaires would like new found wealth write comment looking forward reading,0.2893,-0.0019480519480519606,0.143675974025974
Reddit,ethereum,2024-10-22 20:26:21,2024-10-23 00:51:38.638577,future rethereum,0.0,0.0,0.0
