MainSource,Source,Publication Date,Pull_date,Pre-Processed Text,Sentiment_Vader,Sentiment_TextBlob,Average_Sentiment
GoogleNews,ethereum,6 hours ago,2024-11-02 12:16:52.022401,arthur hayes solana could outperform ethereum highbeta bitcoinbitmex founder arthur hayes prefers solana ethereum considering highly responsive nature strong liquidity,0.7474,0.2966666666666667,0.5220333333333333
GoogleNews,ethereum,6 hours ago,2024-11-02 12:16:52.022401,bitcoin price analysis bear drive price 70k weakening ethereum bullsthe twoday bitcoin chart revealed bullish price structure characterized breaking key resistance level forming higher low higher,-0.5267,0.125,-0.20084999999999997
GoogleNews,ethereum,7 hours ago,2024-11-02 12:16:52.022401,top 10 layer1 protocol challenging ethereumethereum may leader layer1 protocol new blockchain challenger rising fast discover top 10 layer1 protocol competing,0.5719,0.36727272727272725,0.46958636363636364
GoogleNews,ethereum,7 hours ago,2024-11-02 12:16:52.022401,data total net outflow ethereum spot etf yesterday 109256 million etf net asset ratio 229chaincatcher message according sosovalue data yesterday eastern time november 1 total net outflow ethereum spot etf 109256 million,0.3612,0.0,0.1806
GoogleNews,ethereum,7 hours ago,2024-11-02 12:16:52.022401,ethereums breakout odds trader watch forethereum showing sign potential breakout whale activity increasing strong bid volume trader keep eye key price level,0.5106,0.14444444444444446,0.32752222222222227
GoogleNews,ethereum,9 hours ago,2024-11-02 12:16:52.022401,ethereums staking yield lag behind competing layer1 protocol mean investorsethereum secondlargest cryptocurrency market capitalization currently facing challenge staking yield significantly lower,-0.5106,-0.084375,-0.2974875
GoogleNews,ethereum,0 hours ago,2024-11-02 12:16:52.022401,ethereum contrarian bet understanding eths decline bitcoin solanaethereums eth lackluster performance 2024 left investor questioning future pioneer crypto space eth find lagging,-0.3612,0.0,-0.1806
GoogleNews,ethereum,0 hours ago,2024-11-02 12:16:52.022401,ethereum price prediction eth breakout btc imminent 50 rally expected 18x gain erc20 tokenthe crypto landscape set see hefty swing analyst predict major rally bitcoin lunex network bitcoin long held prominence,0.5267,-0.02916666666666667,0.24876666666666664
GoogleNews,ethereum,0 hours ago,2024-11-02 12:16:52.022401,ubs launch tokenized fund put eth heart tradfithe union bank switzerland ubs launched ubs usd money market investment fund token money market fund built ethereum network,0.6908,0.0,0.3454
GoogleNews,ethereum,0 hours ago,2024-11-02 12:16:52.022401,ethereum 3000 despite 5 fall eth climb iflike cryptos market ethereum eth also fell victim price correction last 24 hour fact eths latest dip,-0.2732,0.14166666666666666,-0.06576666666666667
GoogleNews,ethereum,1 hours ago,2024-11-02 12:16:52.022401,could sam altmans world chain ethereum l2 upgrade push wld price 10world chain announced november 1 integration across ethereum layer 2 enhancing secure crosschain transaction adding erc7683 support,0.6249,0.4,0.5124500000000001
GoogleNews,ethereum,1 hours ago,2024-11-02 12:16:52.022401,shiba inus kusama proposes vitalik buterin meeting boost shibethereum synergyin strategic move elevate shiba inus status lead developer shytoshi kusama requested meeting ethereums vitalik buterin discus shibs,0.4019,0.0,0.20095
GoogleNews,ethereum,2 hours ago,2024-11-02 12:16:52.022401,xrp crucial candlestick pattern reversal incoming bitcoin btc regain 70000 momentum ethereum eth better thinkmarket seeing substantial recovery shortterm trend might cause dangerous tendency,0.1531,-0.033333333333333326,0.059883333333333344
GoogleNews,ethereum,2 hours ago,2024-11-02 12:16:52.022401,igaming titan set hit 880 gain winter dominates solana sol ethereum eththe gambling market mindblowing 500 billion behemoth show sign slowing right middle goldmine rollblock rblk,0.5574,0.14285714285714285,0.35012857142857146
GoogleNews,ethereum,2 hours ago,2024-11-02 12:16:52.022401,data u ethereum spot etf accumulated net inflow 45 million usd octoberchaincatcher news according trader data u ethereum spot etf cumulative net inflow 45 million october among themetha inflow,0.0,0.0,0.0
GoogleNews,ethereum,2 hours ago,2024-11-02 12:16:52.022401,ethereum future market signal growing eth optimism2024 seen crypto market largely continue resurgence began 2023 asset like bitcoin btc solana sol continued,0.6908,0.10714285714285714,0.39897142857142853
GoogleNews,ethereum,2 hours ago,2024-11-02 12:16:52.022401,xrp price prediction pundit move away ripple amid turbulence calling ethereumbased token musthave jolly christmasas ripple xrp face market uncertainty expert shift focus etfswap etf predicting top pick festive season,0.6908,0.5,0.5953999999999999
GoogleNews,ethereum,3 hours ago,2024-11-02 12:16:52.022401,ethereums bullish outlook could price soar 4000ethereum eth gaining momentum analyst predicting potential rise 4000 positive onchain metric growing investor sentiment fueling,0.7964,0.11363636363636363,0.4550181818181818
GoogleNews,ethereum,3 hours ago,2024-11-02 12:16:52.022401,ethereum claim address dominance 43 leadwill keep risingethereum missed week crazy price movement last couple day bitcoin dominated bigger crypto market making gigantic,-0.4215,-0.19999999999999998,-0.31074999999999997
GoogleNews,ethereum,3 hours ago,2024-11-02 12:16:52.022401,ethereum face grim 62 plunge according veteran analyst brandtethereum eth secondlargest cryptocurrency continues downward spiral whats relentless market correction veteran trader peter brandt,-0.5423,-0.3333333333333333,-0.43781666666666663
GoogleNews,ethereum,4 hours ago,2024-11-02 12:16:52.022401,altcoin poised outpace ethereum solana expert say major gain aheaddiscover altcoin expert predict could outperform ethereum solana major gain anticipated ahead,0.855,0.0625,0.45875
GoogleNews,ethereum,4 hours ago,2024-11-02 12:16:52.022401,ubs launch tokenized treasury fund ethereumubs launch tokenized treasury fund ethereum expanding access money market showcasing blockchain finance leadership,0.3818,0.0,0.1909
GoogleNews,ethereum,4 hours ago,2024-11-02 12:16:52.022401,blockdags bdag100 code double coinsinsights ethereum near market movementsthe cryptocurrency market typically cycle phase optimism hesitancy affecting investment decision ethereums upcoming price forecast,0.3818,-0.022222222222222216,0.1797888888888889
GoogleNews,ethereum,4 hours ago,2024-11-02 12:16:52.022401,blockdag shatters milestonex1 app hit 200k miner ethereum eye breakout cardano get ai boostdiscover blockdags latest milestonethe x1 app reached 200k user get insight ethereums breakout target cardanos new ai,0.1027,0.3181818181818182,0.2104409090909091
GoogleNews,ethereum,5 hours ago,2024-11-02 12:16:52.022401,analyst expose ethereum ascending support 2400 best chance accumulate ethethereum test critical support 2400 recent surge analyst predicts bullish breakout 6000 eth seek regain momentum,0.8271,0.3333333333333333,0.5802166666666666
GoogleNews,ethereum,5 hours ago,2024-11-02 12:16:52.022401,increased use ethereum blob point growing demand l2 transactionsblob usage recently hit alltime high helping ethereums tokenomics adding credence notion l2 network parasitic parent,0.5423,0.08,0.31115
GoogleNews,ethereum,5 hours ago,2024-11-02 12:16:52.022401,ethereum future signal bullish shift despite price drop whats next ethethereum seen significant price volatility recently leading mixed reaction among investor rally 2700 day,0.3847,0.075,0.22985
GoogleNews,ethereum,5 hours ago,2024-11-02 12:16:52.022401,former ethereum developer list sui dtx exchange best infrastructure altcoins 2024while ethereums current performance indicates potential bullish rally near term sui blockchain facing challenge recovering open,0.6705,0.18333333333333335,0.42691666666666667
GoogleNews,ethereum,5 hours ago,2024-11-02 12:16:52.022401,ubs build investment fund ethereumubs asset management introduced first tokenized investment vehicle based ethereum fund called ubs usd money market investment fund token,0.3612,0.25,0.3056
GoogleNews,ethereum,7 hours ago,2024-11-02 12:16:52.022401,ethereum future see bullish sentiment funding rate rallyalthough rate yet reach level seen previous strong rally increasing confidence ethereum,0.7717,0.0888888888888889,0.4302944444444445
GoogleNews,ethereum,7 hours ago,2024-11-02 12:16:52.022401,vcs found solana presale buying aipowered ethereum coin drove whats going onvcs recognized solana price potential rise presale buying wallitiq wltq aipowered ethereum eth coin stirring excitement,0.4939,0.0,0.24695
GoogleNews,ethereum,7 hours ago,2024-11-02 12:16:52.022401,tether ceo mica concern buterin purge ethereum inefficiency finance redefinedtethers ceo shared concern upcoming mica framework vitalik buterin continues trimming outdated feature ethereum,0.34,-0.4000000000000001,-0.030000000000000027
GoogleNews,ethereum,7 hours ago,2024-11-02 12:16:52.022401,ethereum nears 28k resistance bull push 3350ethereum eth find challenging crucial 2800 resistance zone level hasnt breached since august digital asset,0.4767,0.16666666666666666,0.3216833333333333
GoogleNews,ethereum,7 hours ago,2024-11-02 12:16:52.022401,ethereum solana cardano price prediction decoding value wallitiq wltq ethereum hit 12000ethereum eth solana sol cardano price prediction discover value wallitiq wltq could change ethereum surge 12000,0.5859,0.0,0.29295
GoogleNews,blockchain,6 minutes ago,2024-11-02 12:16:52.022401,blockchain based game let fight trump kamalaplay grid popular blockchainbased game offered character skin donald trump kamala harris amid election frenzy,-0.2732,-0.0666666666666667,-0.16993333333333335
GoogleNews,blockchain,7 minutes ago,2024-11-02 12:16:52.022401,tether brings dirhampegged stablecoin ton blockchaintether launching dirhampegged stablecoin ton blockchain enhancing uaes digital finance ecosystem uaes regulatory framework support,0.4019,0.0,0.20095
GoogleNews,blockchain,1 hour ago,2024-11-02 12:16:52.022401,moody rating care blockchain sharding scalabilitywhy would tradfi organization like moody rating closely follow world blockchain sharding techopedia pose question,0.1779,0.0,0.08895
GoogleNews,blockchain,2 hours ago,2024-11-02 12:16:52.022401,post new blockchain update toncoin price advance higherthe v202410 update ton blockchain enhances data management strengthens network security could pave way improved system efficiency,0.875,0.13636363636363635,0.5056818181818181
GoogleNews,blockchain,2 hours ago,2024-11-02 12:16:52.022401,blockchain voting system fix election integrityis blockchain technology key fairer transparent election society worldwide grapple concern election tampering misinformation,-0.3182,0.0,-0.1591
GoogleNews,blockchain,2 hours ago,2024-11-02 12:16:52.022401,blockchain africa conference 2024 set showcase latest development african blockchain crypto innovationsouth africa blockchain africa conference 2024 set unite blockchain developer influencers investor entrepreneur business leader,0.0,0.25,0.125
GoogleNews,blockchain,3 hours ago,2024-11-02 12:16:52.022401,ethaccra 2024 unites west africa top innovator blockchain development university ghanathe university ghana became center innovation collaboration hosted ethaccra 2024 west africa premier ethereum hackathon,0.5267,0.2,0.36334999999999995
GoogleNews,blockchain,4 hours ago,2024-11-02 12:16:52.022401,grid brings avalanche blockchain pc xbox ps5off grid otg highly anticipated battle royale officially debuted playstation 5 xbox series x epic game store,-0.4364,-0.04666666666666667,-0.24153333333333335
GoogleNews,blockchain,4 hours ago,2024-11-02 12:16:52.022401,blockchain interoperability crosschain data analytics multichain ecosystemsblockchain technology rapidly evolving beyond individual network increasing number blockchain network feature,0.0772,0.0,0.0386
GoogleNews,blockchain,5 hours ago,2024-11-02 12:16:52.022401,kirthiga reddy saurabh doshi present verix transforming verification process blockchain ai technologyverix empowers global organization big tech prestigious award event nonprofit including amdocs netflix stevie award gliderai,0.7906,0.0,0.3953
GoogleNews,blockchain,6 minutes ago,2024-11-02 12:16:52.022401,blockchain based game let fight trump kamalaplay grid popular blockchainbased game offered character skin donald trump kamala harris amid election frenzy,-0.2732,-0.0666666666666667,-0.16993333333333335
GoogleNews,blockchain,7 minutes ago,2024-11-02 12:16:52.022401,tether brings dirhampegged stablecoin ton blockchaintether launching dirhampegged stablecoin ton blockchain enhancing uaes digital finance ecosystem uaes regulatory framework support,0.4019,0.0,0.20095
GoogleNews,blockchain,1 hour ago,2024-11-02 12:16:52.022401,moody rating care blockchain sharding scalabilitywhy would tradfi organization like moody rating closely follow world blockchain sharding techopedia pose question,0.1779,0.0,0.08895
GoogleNews,blockchain,2 hours ago,2024-11-02 12:16:52.022401,post new blockchain update toncoin price advance higherthe v202410 update ton blockchain enhances data management strengthens network security could pave way improved system efficiency,0.875,0.13636363636363635,0.5056818181818181
GoogleNews,blockchain,2 hours ago,2024-11-02 12:16:52.022401,blockchain voting system fix election integrityis blockchain technology key fairer transparent election society worldwide grapple concern election tampering misinformation,-0.3182,0.0,-0.1591
GoogleNews,blockchain,2 hours ago,2024-11-02 12:16:52.022401,blockchain africa conference 2024 set showcase latest development african blockchain crypto innovationsouth africa blockchain africa conference 2024 set unite blockchain developer influencers investor entrepreneur business leader,0.0,0.25,0.125
GoogleNews,blockchain,3 hours ago,2024-11-02 12:16:52.022401,ethaccra 2024 unites west africa top innovator blockchain development university ghanathe university ghana became center innovation collaboration hosted ethaccra 2024 west africa premier ethereum hackathon,0.5267,0.2,0.36334999999999995
GoogleNews,blockchain,4 hours ago,2024-11-02 12:16:52.022401,grid brings avalanche blockchain pc xbox ps5off grid otg highly anticipated battle royale officially debuted playstation 5 xbox series x epic game store,-0.4364,-0.04666666666666667,-0.24153333333333335
GoogleNews,blockchain,4 hours ago,2024-11-02 12:16:52.022401,blockchain interoperability crosschain data analytics multichain ecosystemsblockchain technology rapidly evolving beyond individual network increasing number blockchain network feature,0.0772,0.0,0.0386
GoogleNews,blockchain,5 hours ago,2024-11-02 12:16:52.022401,kirthiga reddy saurabh doshi present verix transforming verification process blockchain ai technologyverix empowers global organization big tech prestigious award event nonprofit including amdocs netflix stevie award gliderai,0.7906,0.0,0.3953
GoogleNews,blockchain,6 minutes ago,2024-11-02 12:16:52.022401,blockchain based game let fight trump kamalaplay grid popular blockchainbased game offered character skin donald trump kamala harris amid election frenzy,-0.2732,-0.0666666666666667,-0.16993333333333335
GoogleNews,blockchain,7 minutes ago,2024-11-02 12:16:52.022401,tether brings dirhampegged stablecoin ton blockchaintether launching dirhampegged stablecoin ton blockchain enhancing uaes digital finance ecosystem uaes regulatory framework support,0.4019,0.0,0.20095
GoogleNews,blockchain,1 hour ago,2024-11-02 12:16:52.022401,moody rating care blockchain sharding scalabilitywhy would tradfi organization like moody rating closely follow world blockchain sharding techopedia pose question,0.1779,0.0,0.08895
GoogleNews,blockchain,2 hours ago,2024-11-02 12:16:52.022401,post new blockchain update toncoin price advance higherthe v202410 update ton blockchain enhances data management strengthens network security could pave way improved system efficiency,0.875,0.13636363636363635,0.5056818181818181
GoogleNews,blockchain,2 hours ago,2024-11-02 12:16:52.022401,blockchain voting system fix election integrityis blockchain technology key fairer transparent election society worldwide grapple concern election tampering misinformation,-0.3182,0.0,-0.1591
GoogleNews,blockchain,2 hours ago,2024-11-02 12:16:52.022401,blockchain africa conference 2024 set showcase latest development african blockchain crypto innovationsouth africa blockchain africa conference 2024 set unite blockchain developer influencers investor entrepreneur business leader,0.0,0.25,0.125
GoogleNews,blockchain,3 hours ago,2024-11-02 12:16:52.022401,ethaccra 2024 unites west africa top innovator blockchain development university ghanathe university ghana became center innovation collaboration hosted ethaccra 2024 west africa premier ethereum hackathon,0.5267,0.2,0.36334999999999995
GoogleNews,blockchain,4 hours ago,2024-11-02 12:16:52.022401,grid brings avalanche blockchain pc xbox ps5off grid otg highly anticipated battle royale officially debuted playstation 5 xbox series x epic game store,-0.4364,-0.04666666666666667,-0.24153333333333335
GoogleNews,blockchain,4 hours ago,2024-11-02 12:16:52.022401,blockchain interoperability crosschain data analytics multichain ecosystemsblockchain technology rapidly evolving beyond individual network increasing number blockchain network feature,0.0772,0.0,0.0386
GoogleNews,blockchain,5 hours ago,2024-11-02 12:16:52.022401,kirthiga reddy saurabh doshi present verix transforming verification process blockchain ai technologyverix empowers global organization big tech prestigious award event nonprofit including amdocs netflix stevie award gliderai,0.7906,0.0,0.3953
GoogleNews,blockchain,6 minutes ago,2024-11-02 12:16:52.022401,blockchain based game let fight trump kamalaplay grid popular blockchainbased game offered character skin donald trump kamala harris amid election frenzy,-0.2732,-0.0666666666666667,-0.16993333333333335
GoogleNews,blockchain,7 minutes ago,2024-11-02 12:16:52.022401,tether brings dirhampegged stablecoin ton blockchaintether launching dirhampegged stablecoin ton blockchain enhancing uaes digital finance ecosystem uaes regulatory framework support,0.4019,0.0,0.20095
GoogleNews,blockchain,1 hour ago,2024-11-02 12:16:52.022401,moody rating care blockchain sharding scalabilitywhy would tradfi organization like moody rating closely follow world blockchain sharding techopedia pose question,0.1779,0.0,0.08895
GoogleNews,blockchain,2 hours ago,2024-11-02 12:16:52.022401,post new blockchain update toncoin price advance higherthe v202410 update ton blockchain enhances data management strengthens network security could pave way improved system efficiency,0.875,0.13636363636363635,0.5056818181818181
GoogleNews,blockchain,2 hours ago,2024-11-02 12:16:52.022401,blockchain voting system fix election integrityis blockchain technology key fairer transparent election society worldwide grapple concern election tampering misinformation,-0.3182,0.0,-0.1591
GoogleNews,blockchain,2 hours ago,2024-11-02 12:16:52.022401,blockchain africa conference 2024 set showcase latest development african blockchain crypto innovationsouth africa blockchain africa conference 2024 set unite blockchain developer influencers investor entrepreneur business leader,0.0,0.25,0.125
GoogleNews,blockchain,3 hours ago,2024-11-02 12:16:52.022401,ethaccra 2024 unites west africa top innovator blockchain development university ghanathe university ghana became center innovation collaboration hosted ethaccra 2024 west africa premier ethereum hackathon,0.5267,0.2,0.36334999999999995
GoogleNews,blockchain,4 hours ago,2024-11-02 12:16:52.022401,grid brings avalanche blockchain pc xbox ps5off grid otg highly anticipated battle royale officially debuted playstation 5 xbox series x epic game store,-0.4364,-0.04666666666666667,-0.24153333333333335
GoogleNews,blockchain,4 hours ago,2024-11-02 12:16:52.022401,blockchain interoperability crosschain data analytics multichain ecosystemsblockchain technology rapidly evolving beyond individual network increasing number blockchain network feature,0.0772,0.0,0.0386
GoogleNews,blockchain,5 hours ago,2024-11-02 12:16:52.022401,kirthiga reddy saurabh doshi present verix transforming verification process blockchain ai technologyverix empowers global organization big tech prestigious award event nonprofit including amdocs netflix stevie award gliderai,0.7906,0.0,0.3953
GoogleNews,blockchain,6 hours ago,2024-11-02 12:16:52.022401,reviewing china merchant bank otcmktscihky argo blockchain nasdaqarbkread reviewing china merchant bank otcmktscihky argo blockchain nasdaqarbk defense world,0.128,0.0,0.064
GoogleNews,blockchain,7 hours ago,2024-11-02 12:16:52.022401,decentralising dns future internet security blockchainbased solutionsimagine time browsing internet would easy knowing unblockable safe look almost perfect possible,0.8911,0.38666666666666666,0.6388833333333334
GoogleNews,blockchain,9 hours ago,2024-11-02 12:16:52.022401,algorand world chess transform chess rating blockchain technologyalgorands recent collaboration world chess mark significant milestone chess industry introducing blockchain technology enhance,0.2023,0.1875,0.19490000000000002
GoogleNews,blockchain,9 hours ago,2024-11-02 12:16:52.022401,fame king sheeraz hasan take center stage binance blockchain week dubaidubais iconic cocacola arena became epicenter innovation excitement binance blockchain week unfolded drawing 4000 key player,0.8271,0.13333333333333333,0.4802166666666666
GoogleNews,blockchain,0 hours ago,2024-11-02 12:16:52.022401,blockchain based intrusion detection algorithm iotin internet thing network device vulnerable various intrusion attack existing algorithm trained,-0.6124,-0.25,-0.4312
GoogleNews,blockchain,1 hours ago,2024-11-02 12:16:52.022401,defiisland brings blockchain life real xrpl testnet transactionsblockchainbased digital payment network ripplex unveiled new 3d gaming platform labeled defiisland new gaming platform aim explore xrp,0.0,0.11818181818181818,0.05909090909090909
GoogleNews,blockchain,1 hours ago,2024-11-02 12:16:52.022401,algorands bold move world chess partnership propels blockchain 200000 daily transactionsalgorand recently signed revolutionary deal world chess revolutionize chess industry incorporating blockchain solution,0.5994,0.1111111111111111,0.35525555555555555
GoogleNews,blockchain,2 hours ago,2024-11-02 12:16:52.022401,toncoin rally post new blockchain updateston blockchains latest update v202410 boost network efficiency security setting stage potential toncoin price rally,0.765,0.21212121212121213,0.4885606060606061
GoogleNews,blockchain,2 hours ago,2024-11-02 12:16:52.022401,enhancing blockchain privacy role zeroknowledge proof secure transactionslearn zkps zksnarks privacy coin homomorphic encryption enhance privacy blockchain balancing transparency security,0.5859,0.4,0.49295
GoogleNews,blockchain,5 hours ago,2024-11-02 12:16:52.022401,blockchain coinvestors spac dissolve biz combospecial purpose acquisition company blockchain coinvestors acquisition corp dissolve return investor money two failed merger,-0.5106,-0.5,-0.5053000000000001
GoogleNews,blockchain,6 minutes ago,2024-11-02 12:16:52.022401,blockchain based game let fight trump kamalaplay grid popular blockchainbased game offered character skin donald trump kamala harris amid election frenzy,-0.2732,-0.0666666666666667,-0.16993333333333335
GoogleNews,blockchain,7 minutes ago,2024-11-02 12:16:52.022401,tether brings dirhampegged stablecoin ton blockchaintether launching dirhampegged stablecoin ton blockchain enhancing uaes digital finance ecosystem uaes regulatory framework support,0.4019,0.0,0.20095
GoogleNews,blockchain,1 hour ago,2024-11-02 12:16:52.022401,moody rating care blockchain sharding scalabilitywhy would tradfi organization like moody rating closely follow world blockchain sharding techopedia pose question,0.1779,0.0,0.08895
GoogleNews,blockchain,2 hours ago,2024-11-02 12:16:52.022401,post new blockchain update toncoin price advance higherthe v202410 update ton blockchain enhances data management strengthens network security could pave way improved system efficiency,0.875,0.13636363636363635,0.5056818181818181
GoogleNews,blockchain,2 hours ago,2024-11-02 12:16:52.022401,blockchain voting system fix election integrityis blockchain technology key fairer transparent election society worldwide grapple concern election tampering misinformation,-0.3182,0.0,-0.1591
GoogleNews,blockchain,2 hours ago,2024-11-02 12:16:52.022401,blockchain africa conference 2024 set showcase latest development african blockchain crypto innovationsouth africa blockchain africa conference 2024 set unite blockchain developer influencers investor entrepreneur business leader,0.0,0.25,0.125
GoogleNews,blockchain,3 hours ago,2024-11-02 12:16:52.022401,ethaccra 2024 unites west africa top innovator blockchain development university ghanathe university ghana became center innovation collaboration hosted ethaccra 2024 west africa premier ethereum hackathon,0.5267,0.2,0.36334999999999995
GoogleNews,blockchain,4 hours ago,2024-11-02 12:16:52.022401,grid brings avalanche blockchain pc xbox ps5off grid otg highly anticipated battle royale officially debuted playstation 5 xbox series x epic game store,-0.4364,-0.04666666666666667,-0.24153333333333335
GoogleNews,blockchain,4 hours ago,2024-11-02 12:16:52.022401,blockchain interoperability crosschain data analytics multichain ecosystemsblockchain technology rapidly evolving beyond individual network increasing number blockchain network feature,0.0772,0.0,0.0386
