MainSource,Source,Publication Date,Pull_date,Pre-Processed Text,Sentiment_Vader,Sentiment_TextBlob,Average_Sentiment
RSS,https://cointelegraph.com/rss,2025-02-03 12:08:59+00:00,2025-02-03 12:18:49.582551,crypto etp weekly inflow fall 527m amid deepseek panic trump tariff grayscale investment saw crypto etf outflow increase 140 last week blackrocks inflow slowed significantly,-0.25,0.1875,-0.03125
RSS,https://cointelegraph.com/rss,2025-02-03 11:25:00+00:00,2025-02-03 12:18:49.582551,xrp potential u crypto reserve asset possibility challenge explore risk reward xrp u federal reserve asset strategic hedge volatile holding,0.7845,0.0,0.39225
RSS,https://cointelegraph.com/rss,2025-02-03 10:27:00+00:00,2025-02-03 12:18:49.582551,crypto market today crypto market dropped bitcoin price lost 100000 level following u president donald trump new tariff china mexico canada,-0.3182,0.06818181818181818,-0.1250090909090909
RSS,https://cointelegraph.com/rss,2025-02-03 09:52:02+00:00,2025-02-03 12:18:49.582551,asian crypto stock plunge bitcoin drop threeweek low metaplanet osl group boyaa led crypto stock downturn bitcoin fell 91163 amid broader market fear tariff trade war,-0.8834,0.0,-0.4417
RSS,https://cointelegraph.com/rss,2025-02-03 09:23:44+00:00,2025-02-03 12:18:49.582551,bitcoin bottom 915k global trade war fear highlighting economic concern canada mexico china promised retaliatory measure trump tariff heightened investor anxiety leading crypto market downturn analyst told cointelegraph,-0.743,0.1,-0.3215
RSS,https://cointelegraph.com/rss,2025-02-03 08:36:37+00:00,2025-02-03 12:18:49.582551,crypto ready next phase adoption winning financial adviser crypto struggle reach beyond base etf live financial adviser key wider adoption,0.5719,0.004545454545454533,0.28822272727272724
RSS,https://cointelegraph.com/rss,2025-02-03 08:16:22+00:00,2025-02-03 12:18:49.582551,ethereum lead cryptos 224b liquidation amid tariff war 730000 trader faced liquidation ether led market plunge analyst compared impact ftx collapse covid19 crash,-0.8689,0.0,-0.43445
RSS,https://cointelegraph.com/rss,2025-02-03 08:13:35+00:00,2025-02-03 12:18:49.582551,btc dominance nears 4year high 5 thing know bitcoin week bitcoin crypto market cap dominance spike trump trade war fear take altcoins see capitulation wick,-0.6705,0.16,-0.25525
RSS,https://cointelegraph.com/rss,2025-02-03 07:29:50+00:00,2025-02-03 12:18:49.582551,xrp price today xrp crash 20 trump tariff spark crypto market bloodbath however key price support area hint potential comeback,0.2263,0.0,0.11315
RSS,https://cointelegraph.com/rss,2025-02-03 07:00:00+00:00,2025-02-03 12:18:49.582551,crypto broker uphold relaunches staking uk uphold resume crypto staking uk staking service remain unavailable u europe,0.0,0.0,0.0
RSS,https://cointelegraph.com/rss,2025-02-03 06:35:05+00:00,2025-02-03 12:18:49.582551,weekend wrap ether strategy wrong address el salvador satoshi statue project describes onchain microstrategy ethereum blamed ui fault caused user send 165 eth wrong address el salvador new disappearing satoshi nakomoto statue,-0.9001,-0.2878787878787879,-0.593989393939394
RSS,https://cointelegraph.com/rss,2025-02-03 06:18:14+00:00,2025-02-03 12:18:49.582551,openais newest chatgpt agent deep research online openai launched deep research agent chatgpt search information put report source work,0.128,0.0,0.064
RSS,https://cointelegraph.com/rss,2025-02-03 05:21:34+00:00,2025-02-03 12:18:49.582551,thailand sec plan launch tokenized security trading system platform allow security company trade digital token capitalize large investor base according security exchange commission thailand,0.7964,-0.17142857142857143,0.31248571428571426
RSS,https://cointelegraph.com/rss,2025-02-03 05:14:49+00:00,2025-02-03 12:18:49.582551,ether altcoins dive double digit trump tariff take toll ether cardano avalanche xrp chainlink dogecoin dropped 20 past 23 hour u president donald trump imposed first round tariff,-0.0772,-0.05,-0.0636
RSS,https://cointelegraph.com/rss,2025-02-03 03:24:01+00:00,2025-02-03 12:18:49.582551,law firm sued pumpfun linked 23m dogshit2 coin peak dogshit2 market cap 23 million although since fallen around 24 million,-0.3612,-0.2,-0.2806
RSS,https://cointelegraph.com/rss,2025-02-03 03:12:26+00:00,2025-02-03 12:18:49.582551,nasdaq future plunge 27 trump trade war rattle market future tied three major u stock index red trader prepare volatile week ahead,-0.5994,0.015625,-0.2918875
RSS,https://cointelegraph.com/rss,2025-02-03 01:41:58+00:00,2025-02-03 12:18:49.582551,u bitcoin etf could pull 50b 2025 bitwise say bitwises matt hougan say u spot bitcoin etf recorded nearly 5 billion net inflow january tipping inflow reach 50 billion year end,0.0258,0.05,0.0379
RSS,https://cointelegraph.com/rss,2025-02-03 01:30:53+00:00,2025-02-03 12:18:49.582551,utah could first u state pas bitcoin reserve bill satoshi action fund utah bitcoin reserve bill could first kind pas state level u shorter legislative window decide bill say bitcoin advocate,0.5267,0.3,0.41335
RSS,https://cointelegraph.com/rss,2025-02-02 22:03:54+00:00,2025-02-03 12:18:49.582551,trump trade war send btc price violently higher analyst undoubtedly highest conviction macro trade year bitwise executive analyst jeff park wrote social medium,-0.8271,0.14166666666666666,-0.34271666666666667
RSS,https://cointelegraph.com/rss,2025-02-02 19:59:54+00:00,2025-02-03 12:18:49.582551,here happened crypto today need know happened crypto today latest news daily trend event impacting bitcoin price blockchain defi nfts web3 crypto regulation,0.0,0.25,0.125
RSS,https://cointelegraph.com/rss,2025-02-02 19:16:27+00:00,2025-02-03 12:18:49.582551,bitcoin fall 968k trump tariff spook market om xmr mnt gt show promise bitcoin price lost 100000 level altcoins continued sink lower om xmr mnt gt lead recovery,0.25,0.0,0.125
RSS,https://cointelegraph.com/rss,2025-02-02 19:04:14+00:00,2025-02-03 12:18:49.582551,bitcoin dominance back 60 altcoins slowbleed according coinmarketcap bitcoins price fell estimated 73 last seven day faring better altcoins,0.5719,0.16666666666666666,0.3692833333333333
RSS,https://cointelegraph.com/rss,2025-02-02 16:18:04+00:00,2025-02-03 12:18:49.582551,india may change crypto policy due international adoption report indian government reputation harsh crypto regulatory sea change united state may cause pivot,-0.0258,-0.10833333333333334,-0.06706666666666666
RSS,https://cointelegraph.com/rss,2025-02-02 15:00:00+00:00,2025-02-03 12:18:49.582551,social security number privacy liability hundred million ssns leaked online already privacyfocused identity solution could help fix problem,0.2263,0.03333333333333333,0.12981666666666666
RSS,https://cointelegraph.com/rss,2025-02-02 13:10:17+00:00,2025-02-03 12:18:49.582551,indian crypto holder face 70 tax penalty undisclosed gain india impose tax penalty 70 undisclosed crypto gain part new regulation section 158b income tax act,-0.1027,0.13636363636363635,0.016831818181818177
RSS,https://cointelegraph.com/rss,2025-02-02 11:11:34+00:00,2025-02-03 12:18:49.582551,bitcoin analyst warn 95k bear trap despite record 102k monthly close bear trap form coordinated controlled selling creates temporary dip asset price comprising significant correction longterm uptrend,0.1027,0.375,0.23885
RSS,https://cointelegraph.com/rss,2025-02-02 10:27:31+00:00,2025-02-03 12:18:49.582551,ethereum trader earns 16m eth price fall 3k cryptocurrency trader profiting million ether sixweek downtrend despite heightened risk leveraged trading,0.529,0.0,0.2645
RSS,https://cointelegraph.com/rss,2025-02-02 05:11:12+00:00,2025-02-03 12:18:49.582551,bitcoin fall 100k following donald trump imposing import tariff bitcoin dropped 100000 first time since jan 27 following donald trump imposing import tariff good china canada mexico triggered immediate response three country,0.2732,0.2375,0.25534999999999997
RSS,https://cointelegraph.com/rss,2025-02-02 02:25:57+00:00,2025-02-03 12:18:49.582551,coinbase acquires ad platform spindl tackle onchain discovery problem crypto exchange coinbase acquired onchain advertising platform spindl effort help base builder go viral,0.0,-0.8,-0.4
RSS,https://cointelegraph.com/rss,2025-02-01 23:05:52+00:00,2025-02-03 12:18:49.582551,xrp 4 next sbfs parent seek trump pardon hodlers digest jan 26 feb 1 sbfs parent reportedly exploring possibility trump pardon binance claim special relationship hamas hodlers digest,0.743,0.17857142857142858,0.4607857142857143
RSS,https://bitcoinmagazine.com/.rss/full/,2025-01-31 20:07:04+00:00,2025-02-03 12:18:49.582551,bitcoin benjamin franklinsaving new generation riding wave folly,0.0,0.13636363636363635,0.06818181818181818
RSS,https://bitcoinmagazine.com/.rss/full/,2025-01-31 13:45:44+00:00,2025-02-03 12:18:49.582551,bitcoin bridgeas pleb fiat job important role play,0.4939,0.4,0.44695
RSS,https://bitcoinmagazine.com/.rss/full/,2025-01-31 13:26:54+00:00,2025-02-03 12:18:49.582551,take profit bitcoin cycle peaksselling bitcoin doesnt emotional decisionlearn use key market indicator take profit strategically reaccumulate lower price,0.4864,0.0,0.2432
RSS,https://bitcoinmagazine.com/.rss/full/,2025-01-31 10:15:01+00:00,2025-02-03 12:18:49.582551,forget ecb czechia embrace bitcoin termsthe czech national bank considering adding bitcoin reserve regardless european central bank think,0.1027,0.0,0.05135
RSS,https://bitcoinmagazine.com/.rss/full/,2025-01-30 21:42:05+00:00,2025-02-03 12:18:49.582551,tether back bitcoin lightning dominance startingthe stablecoin issuer choice bring usdt back bitcoin massive win lightning network joltzs bet taproot asset,0.7964,0.2,0.4982
RSS,https://bitcoinmagazine.com/.rss/full/,2025-01-30 17:24:24+00:00,2025-02-03 12:18:49.582551,trump executive order break bitcoins fouryear market cycle trump recent executive order may signal end bitcoins historically rigid fouryear market cycle regulatory clarity institutional adoption governmentbacked initiative could policy shift usher new era sustained growtheliminating dreaded crypto winter,-0.3612,0.04545454545454545,-0.15787272727272728
RSS,https://bitcoinmagazine.com/.rss/full/,2025-01-30 17:01:53+00:00,2025-02-03 12:18:49.582551,bitcoin empowers womenbitcoin tool woman around world closed traditional financial system,0.0,-0.03333333333333333,-0.016666666666666666
RSS,https://bitcoinmagazine.com/.rss/full/,2025-01-30 16:18:30+00:00,2025-02-03 12:18:49.582551,czech national bank ass bitcoin part reserve strategythe cnb approves plan explore allocating portion 140 billion reserve bitcoin,-0.2023,0.0,-0.10115
RSS,https://bitcoinmagazine.com/.rss/full/,2025-01-30 15:06:39+00:00,2025-02-03 12:18:49.582551,grayscale investment launch bitcoin miner etfgrayscale investment launched grayscale bitcoin miner etf mnrs offering investor way gain exposure bitcoin mining industry without directly holding btc tracking indxx bitcoin miner index etf includes major player like mara riot core scientific making attractive option looking diversify bitcoinrelated equity,0.7165,0.32083333333333336,0.5186666666666667
RSS,https://bitcoinmagazine.com/.rss/full/,2025-01-30 14:09:36+00:00,2025-02-03 12:18:49.582551,bitcoin cypherpunk spirit alive well africafrom south africa kenya ghana african using bitcoin better life arent asking anyones permission,0.8074,0.19999999999999998,0.5037
RSS,https://bitcoinmagazine.com/.rss/full/,2025-01-29 18:56:28+00:00,2025-02-03 12:18:49.582551,bitcoin ultimate hedge 97t global liquidity bubblediscover bitcoins fixed supply deflationary nature make ultimate asset navigating 97 trillion global liquidity bubble learn rising money supply influence market trend position bitcoin strategic hedge fiat currency debasement,0.3612,0.02,0.19060000000000002
RSS,https://bitcoinmagazine.com/.rss/full/,2025-01-29 18:10:45+00:00,2025-02-03 12:18:49.582551,bitcoin went wrongthe priority bitcoiners starting shift wrong direction represent actual existential threat success censorship resistant resilient system,-0.4215,-0.05,-0.23575
RSS,https://bitcoinmagazine.com/.rss/full/,2025-01-29 17:38:06+00:00,2025-02-03 12:18:49.582551,forget strategic bitcoin reserve moment mining censorship backf2pool mining pool representing 11 hash power bitcoin network censoring ofacsanctioned transaction,-0.2263,0.0,-0.11315
RSS,https://bitcoinmagazine.com/.rss/full/,2025-01-29 17:29:12+00:00,2025-02-03 12:18:49.582551,cme group launch option bitcoin friday future februarycme group looking obtain regulatory approval option successful cryptocurrency product launch,0.7845,0.375,0.57975
RSS,https://bitcoinmagazine.com/.rss/full/,2025-01-29 16:10:50+00:00,2025-02-03 12:18:49.582551,czech central bank head want buy bitcoin 5 reserve allocationthe czech national bank cnb considering 5 bitcoin allocation surpassing gold reserve approved move could reshape future national reserve asset,0.6808,0.0,0.3404
RSS,https://bitcoinmagazine.com/.rss/full/,2025-01-28 19:29:07+00:00,2025-02-03 12:18:49.582551,200000 realistic bitcoin price target cycleexplore potential bitcoin price reach 200000 cycle analyze market dynamic supply demand money multiplier effect ass feasibility,-0.3182,0.05555555555555555,-0.13132222222222223
RSS,https://bitcoinmagazine.com/.rss/full/,2025-01-28 19:24:46+00:00,2025-02-03 12:18:49.582551,go reserve people wont see differencearguing bitcoin reserve fund inclusion cryptocurrencies ultimately futile fight public large doesnt see difference,-0.6705,0.07142857142857142,-0.2995357142857143
RSS,https://bitcoinmagazine.com/.rss/full/,2025-01-28 17:04:20+00:00,2025-02-03 12:18:49.582551,preston pysh explains sab 121 beat strategic bitcoin reservepreston pysh explains rescission sab 121 could permanently entrench bitcoin financial system surpassing importance strategic bitcoin reserve,0.3612,0.0,0.1806
RSS,https://bitcoinmagazine.com/.rss/full/,2025-01-28 15:30:07+00:00,2025-02-03 12:18:49.582551,game theory strategic bitcoin reserve united state throwing weight behind bitcoin would effect massive shift game theory underpinning bitcoin probably way think,0.4215,-0.30000000000000004,0.06074999999999997
RSS,https://bitcoinmagazine.com/.rss/full/,2025-01-28 15:11:28+00:00,2025-02-03 12:18:49.582551,donald trump vow propel bitcoin new heightsdavid bailey ceo bitcoin magazine share insight private conversation president donald trump expressed support bitcoin community ambitious plan outcompete global competitor,0.7906,0.09659090909090909,0.4435954545454545
RSS,https://bitcoinmagazine.com/.rss/full/,2025-01-28 13:46:52+00:00,2025-02-03 12:18:49.582551,protect bitcoin anchorwatchbecca rubenfeld anchorwatch team recently unveiled firstofitskind bitcoin custody plus insurance solution aim keep customer bitcoin safe customer well,0.836,0.25,0.5429999999999999
RSS,https://bitcoinmagazine.com/.rss/full/,2025-01-27 22:10:39+00:00,2025-02-03 12:18:49.582551,microstrategy expands bitcoin holding 471100 btc worth 46 billionmicrostrategys relentless bitcoin buying spree continues adding 10100 btc 11 billion 471100 btc treasury valued 46 billion firm reinforces commitment bitcoincentric strategy amid market volatility,0.8316,0.04999999999999999,0.44079999999999997
RSS,https://bitcoinmagazine.com/.rss/full/,2025-01-27 18:54:56+00:00,2025-02-03 12:18:49.582551,declining shortterm u treasury yield impact bitcoin pricehow shifting treasury yield signal economic uncertainty bitcoin could benefit riskon safehaven asset,0.6908,0.2,0.4454
RSS,https://bitcoinmagazine.com/.rss/full/,2025-01-27 14:53:53+00:00,2025-02-03 12:18:49.582551,nasdaq proposes inkind redemption blackrocks bitcoin etfnasdaq proposed new system blackrocks ishares bitcoin etf allowing institutional investor redeem share directly bitcoin instead cash innovative model aim streamline operation cut cost reduce market impact marking significant step forward evolution bitcoin etf,0.5859,0.2778409090909091,0.43187045454545453
RSS,https://bitcoinmagazine.com/.rss/full/,2025-01-24 19:28:07+00:00,2025-02-03 12:18:49.582551,cynic idealist bitcoinbitcoiners need stop letting extreme naive idealism jaded cynicism drive public discourse,-0.7165,-0.14166666666666666,-0.42908333333333337
RSS,https://bitcoinmagazine.com/.rss/full/,2025-01-24 18:01:45+00:00,2025-02-03 12:18:49.582551,dear president trump bitcoin reserve shitcoin reservethe u government shouldnt stockpile anything bitcoin,0.3818,0.0,0.1909
RSS,https://bitcoinmagazine.com/.rss/full/,2025-01-24 17:47:27+00:00,2025-02-03 12:18:49.582551,trump digital asset executive order may last senator lummis rightpresident trump digital asset executive order hoped luckily senator lummis taking better approach establishing strategic bitcoin reserve,0.9153,0.16666666666666666,0.5409833333333334
RSS,https://bitcoinmagazine.com/.rss/full/,2025-01-24 12:47:29+00:00,2025-02-03 12:18:49.582551,brc20 bitcoin token could outshine rune efficient token standard bitcoin good thing,0.6908,0.35,0.5204
RSS,https://bitcoinmagazine.com/.rss/full/,2025-01-24 12:08:51+00:00,2025-02-03 12:18:49.582551,sec rescinds sab 121 permitting bank custody bitcointhe sec rescinded sab 121 removing barrier bank custody bitcoin crypto signaling major shift crypto regulation,-0.128,-0.04583333333333334,-0.08691666666666667
RSS,https://bitcoinmagazine.com/.rss/full/,2025-01-23 21:55:20+00:00,2025-02-03 12:18:49.582551,president trump sign executive order ban central bank digital currency cbdcthe president also assigned working group ass creation strategic bitcoin stockpile,-0.7184,0.0,-0.3592
RSS,https://bitcoinmagazine.com/.rss/full/,2025-01-23 21:19:26+00:00,2025-02-03 12:18:49.582551,trump sign executive order explore u strategic bitcoin reservepresident trump new executive order embrace bitcoin open blockchain technology ban central bank digital currency revoke prior restrictive regulationssignaling landmark policy shift toward fostering responsible innovation financial freedom united state,0.872,0.048051948051948054,0.460025974025974
RSS,https://bitcoinmagazine.com/.rss/full/,2025-01-23 17:38:39+00:00,2025-02-03 12:18:49.582551,ross free far overross last person government try make example,0.5106,0.16666666666666666,0.33863333333333334
RSS,https://bitcoinmagazine.com/.rss/full/,2025-01-23 16:29:45+00:00,2025-02-03 12:18:49.582551,donald trump right thing freeing ross ulbrichttrump delivered promise im glad,0.8126,0.39285714285714285,0.6027285714285714
RSS,https://bitcoinmagazine.com/.rss/full/,2025-01-23 15:33:00+00:00,2025-02-03 12:18:49.582551,bitcoin deep dive data analysis onchain roundupbitcoin kick 2025 bullish momentum rally sustain dive miner recovery sentiment market dynamic insight,0.3818,0.0,0.1909
RSS,https://bitcoinmagazine.com/.rss/full/,2025-01-22 19:33:10+00:00,2025-02-03 12:18:49.582551,blackrock ceo larry fink forecast 700k bitcoin price amid inflation worrieslarry fink ceo blackrock suggested bitcoin could reach 700000 per coin citing growing role hedge economic instability projection sparked discussion sovereign wealth fund highlight increasing momentum institutional adoption potential reshape market dynamic,0.8402,0.06666666666666667,0.4534333333333333
RSS,https://bitcoinmagazine.com/.rss/full/,2025-01-22 18:19:06+00:00,2025-02-03 12:18:49.582551,silk road ross ulbricht defend murdererross ulbricht free unproven allegation silk road founder overshadow well deserved pardon corner internet,0.7717,0.4,0.58585
RSS,https://bitcoinmagazine.com/.rss/full/,2025-01-22 18:11:37+00:00,2025-02-03 12:18:49.582551,making wave tampa bay bitcoin bay foundation join gasparilla parade pirateslook bitcoin bay pirate float gasparilla parade year tampa bay,0.296,-0.25,0.022999999999999993
RSS,https://bitcoinmagazine.com/.rss/full/,2025-01-22 17:40:57+00:00,2025-02-03 12:18:49.582551,bitcoin hacking edition 2025 brazilbitcoin hacking edition 2025 month away dont miss chance learn bitcoin development person best developer,0.5999,1.0,0.7999499999999999
RSS,https://bitcoinmagazine.com/.rss/full/,2025-01-22 17:21:26+00:00,2025-02-03 12:18:49.582551,ethereums looming collapse lesson blockchain integrityif founder pivoting bronze age mindset 2025 youre ngmi,-0.5719,0.0,-0.28595
RSS,https://bitcoinmagazine.com/.rss/full/,2025-01-22 12:55:02+00:00,2025-02-03 12:18:49.582551,ross ulbricht free let fight samourai devsby freeing ross bitcoin network state proven political power use make sure like developer samourai wallet dont go jail,0.8225,0.2,0.51125
RSS,https://bitcoinmagazine.com/.rss/full/,2025-01-22 03:21:28+00:00,2025-02-03 12:18:49.582551,ross ulbricht free victory bitcoin freedomross ulbrichts full pardon president trump mark monumental victory bitcoiners symbolizing justice man became beacon freedom innovation longawaited moment prof power persistence reminds u keep advocating bitcoin freedom,0.9638,0.375,0.6694
RSS,https://bitcoinmagazine.com/.rss/full/,2025-01-21 20:50:46+00:00,2025-02-03 12:18:49.582551,david bailey forecast 1m bitcoin price trump presidencydavid bailey ceo btc inc share bold prediction bitcoins future including potential reach 1 million trump presidency article delf political economic technological force shaping bitcoins role global reserve asset highlight key strategy investor align transformative potential,0.8316,0.06666666666666667,0.44913333333333333
RSS,https://bitcoinmagazine.com/.rss/full/,2025-01-21 18:00:40+00:00,2025-02-03 12:18:49.582551,trump free ross day one course didntdonald trump broke campaign promise free ross ulbricht day one presidency let hope follows next couple day,0.8402,0.26666666666666666,0.5534333333333333
RSS,https://bitcoinmagazine.com/.rss/full/,2025-01-21 17:48:19+00:00,2025-02-03 12:18:49.582551,advanced mathematical projection bitcoin bull cycle peakdiscover advanced statistical method historical data including renowned pi cycle top indicator monte carlo simulation used project bitcoins next bull cycle peak insight potential price range timing savvy investor,0.5859,0.18571428571428572,0.38580714285714285
RSS,https://bitcoinmagazine.com/.rss/full/,2025-01-21 16:48:07+00:00,2025-02-03 12:18:49.582551,bitcoin missed 54 billion opportunity neglecting runesbitcoins reluctance embrace emerging economic trend like memecoins token mean ceding market share user growth innovation competing chain like solana,0.8481,-0.056249999999999994,0.39592499999999997
RSS,https://bitcoinmagazine.com/.rss/full/,2025-01-20 15:11:26+00:00,2025-02-03 12:18:49.582551,watch bitcoin president donald trump inaugurationdonald trump inauguration first probitcoin u president herejoin bitcoin magazine live coverage 10 est,0.0,0.19318181818181818,0.09659090909090909
RSS,https://bitcoinmagazine.com/.rss/full/,2025-01-20 15:00:00+00:00,2025-02-03 12:18:49.582551,btcpay server foundation receives 25000 grant bitcoin unbankthe grant help btcpay continue work opensource payment development,0.7717,0.0,0.38585
RSS,https://bitcoinmagazine.com/.rss/full/,2025-01-19 17:27:03+00:00,2025-02-03 12:18:49.582551,trump like crypto long griftingtrump coin nothing way extract money crypto ecosystem,0.3612,-0.05,0.15560000000000002
RSS,https://bitcoinmagazine.com/.rss/full/,2025-01-17 17:55:41+00:00,2025-02-03 12:18:49.582551,president trump got bold vision bitcoin americaas president donald trump second term begin bitcoin community look bold promise bitcoin regulation national strategy economic growth whats storeand soon,0.8779,0.21666666666666667,0.5472833333333333
RSS,https://bitcoinmagazine.com/.rss/full/,2025-01-17 17:25:55+00:00,2025-02-03 12:18:49.582551,wyoming introduces bitcoin strategic reserve billa look bill proposed wyoming state level bitcoin strategic reserve,0.0,0.0,0.0
RSS,https://bitcoinist.com/feed/,2025-02-03 12:00:33+00:00,2025-02-03 12:18:49.582551,ethereum uptrend weakens eth face pullback risk selling pressure intensifiesthe general crypto market experienced strong downward movement ethereum exception bearish development since digital asset experienced pullback key support level waning market performance hindering investor sentiment toward eth altcoin likely undergo extended pullback upcoming day bearish force weigh,0.4404,0.2976190476190476,0.3690095238095238
RSS,https://bitcoinist.com/feed/,2025-02-03 10:30:38+00:00,2025-02-03 12:18:49.582551,could trump back u xrp reserve lawyer reveals unexpected pathin post x attorney jeremy hogan hogan hogan pawellknown within xrp community legal insight ongoing ripple v sec lawsuitfloated idea stirred significant debate hogan suggested u government could establish xrp part strategic reserve one reason,0.3182,0.11500000000000002,0.21660000000000001
RSS,https://bitcoinist.com/feed/,2025-02-03 09:56:08+00:00,2025-02-03 12:18:49.582551,trump tariff crash bitcoin stock presales like meme index survive thrivebitcoin btc trade 95k briefly touching 92k first time three week 100 top token four recorded minor 24hour gain including fartcoin 8 increase huh reason investor panicsell back trump tariff war canada mexico stock market suffered,-0.2023,0.24,0.018849999999999992
RSS,https://bitcoinist.com/feed/,2025-02-03 09:38:00+00:00,2025-02-03 12:18:49.582551,amid trump tariff solaxy presale beat odds save solanasolana solana solana even market number5 crypto came roaring back 2024 blockchain remains plagued network failure congestion crypto degens spamming pumpfun meme coin biggest bigname promoter jumping space issue getting worse savvy crypto user already looking,-0.743,-0.2388888888888889,-0.49094444444444446
RSS,https://bitcoinist.com/feed/,2025-02-03 09:00:06+00:00,2025-02-03 12:18:49.582551,india reconsiders crypto rule u moveswhats changingindia reviewing rule crypto security looking country especially united state major country like u updating plan digital asset india also adjusting strategy stay line global standard related reading trump tariff hit crypto hard bitcoin crash,0.7698,-0.03273809523809524,0.3685309523809524
