MainSource,Source,Publication Date,Pull_date,Pre-Processed Text,Sentiment_Vader,Sentiment_TextBlob,Average_Sentiment
RSS,https://cointelegraph.com/rss,2024-09-25 00:09:05+01:00,2024-09-25 00:52:06.727898,3 reason near protocol near gained 50 month near extends 50 gain user activity network tvl critical network upgrade boost interest blockchain,0.872,0.07500000000000001,0.47350000000000003
RSS,https://cointelegraph.com/rss,2024-09-24 22:31:27+01:00,2024-09-25 00:52:06.727898,bny nears crypto custody etf sec softens sab 121 stance bank new york mellon held sec accounting practice client crypto custody review,0.0,-0.02121212121212122,-0.01060606060606061
RSS,https://cointelegraph.com/rss,2024-09-24 21:56:20+01:00,2024-09-25 00:52:06.727898,doj sue visa alleged payment monopoly suit alleges visa purposely made difficult competitor participate payment market,-0.3612,-0.3,-0.3306
RSS,https://cointelegraph.com/rss,2024-09-24 21:44:32+01:00,2024-09-25 00:52:06.727898,here happened crypto today need know happened crypto today latest news daily trend event impacting bitcoin price blockchain defi nfts web3 crypto regulation,0.0,0.25,0.125
RSS,https://cointelegraph.com/rss,2024-09-24 21:41:56+01:00,2024-09-25 00:52:06.727898,microstrategy lend bitcoin boost yield analyst proliferation institutional bitcoin custodian creates opportunity microstrategy according benchmark analyst,0.765,0.0,0.3825
RSS,https://cointelegraph.com/rss,2024-09-24 21:17:57+01:00,2024-09-25 00:52:06.727898,breaking caroline ellison sentenced 2 year prison former head alameda research serve sentence minimumsecurity prison,-0.7506,0.0,-0.3753
RSS,https://cointelegraph.com/rss,2024-09-24 21:03:48+01:00,2024-09-25 00:52:06.727898,bitcoin bull laying path 66k make bullish bitcoin trader making progress attempting retake 200day moving average close 66000 could kickstart rally btcs alltime high,0.4215,0.0050000000000000044,0.21325
RSS,https://cointelegraph.com/rss,2024-09-24 20:38:02+01:00,2024-09-25 00:52:06.727898,dogwifhat make comeback wif rally 25 week next wif staged doubledigit rally past week memecoin trader piled fresh position,0.3182,0.016666666666666663,0.16743333333333332
RSS,https://cointelegraph.com/rss,2024-09-24 20:20:33+01:00,2024-09-25 00:52:06.727898,sec settle charge truecoin trusttoken trueusd security regulator claim token undercollateralized backing fund risky overseas investment,0.1779,-0.1,0.03895
RSS,https://cointelegraph.com/rss,2024-09-24 20:03:32+01:00,2024-09-25 00:52:06.727898,finance trader first spot superintelligent ai wharton prof ethan mollicks commentary sparked speculation cryptocurrency community,0.0,0.25,0.125
RSS,https://cointelegraph.com/rss,2024-09-24 19:14:00+01:00,2024-09-25 00:52:06.727898,81b bitcoin option expire month bull bear upper hand week 81 billion bitcoin option expiry fuel rally 70000 trader anticipate correction,0.4939,0.0,0.24695
RSS,https://cointelegraph.com/rss,2024-09-24 18:54:32+01:00,2024-09-25 00:52:06.727898,usdc issuer circle launch onchain compliance platform important step toward winning tokenized rwa market circle continues vye stablecoin leader tether,0.6369,0.45,0.54345
RSS,https://cointelegraph.com/rss,2024-09-24 17:36:16+01:00,2024-09-25 00:52:06.727898,cardano ada price week cardano founder upcoming meeting argentine president javier milei one main bullish factor ada week,0.0,0.16666666666666666,0.08333333333333333
RSS,https://cointelegraph.com/rss,2024-09-24 17:07:06+01:00,2024-09-25 00:52:06.727898,solana lab partner google cloud launch web3 api new gameshift service serve web2toweb3 bridge developer,0.0,0.13636363636363635,0.06818181818181818
RSS,https://cointelegraph.com/rss,2024-09-24 16:30:00+01:00,2024-09-25 00:52:06.727898,lady crypto crypto september 2025 x hall flame crypto influencer lady crypto intention hodling plan cash entire crypto portfolio next year x hall flame,0.0,0.0,0.0
RSS,https://cointelegraph.com/rss,2024-09-24 16:00:00+01:00,2024-09-25 00:52:06.727898,trump pardon sbf 6 weird polymarket betting pool u politics u election approach crypto policy betting surge polymarket traditional political prediction quirky unexpected wager user placing bet whats come,0.1531,-0.08,0.036550000000000006
RSS,https://cointelegraph.com/rss,2024-09-24 15:41:00+01:00,2024-09-25 00:52:06.727898,70k next bitcoin china join fed huge macro event bitcoin trader getting divisive btc price action bides time central bank policy easing announced,0.6705,0.125,0.39775
RSS,https://cointelegraph.com/rss,2024-09-24 15:15:00+01:00,2024-09-25 00:52:06.727898,htx reveals future bitcoin defi babylon staking fractal scaling explore babylon unlocks yield bitcoin holder fractal bitcoin address scalability project pave way new era defi,0.0,0.06818181818181818,0.03409090909090909
RSS,https://cointelegraph.com/rss,2024-09-24 12:53:07+01:00,2024-09-25 00:52:06.727898,bybit eye muslim investor shariahcompliant crypto account bybit launch shariahcompliant crypto account targeting muslim investor seeking investment option line islamic finance principle,0.0,0.0,0.0
RSS,https://cointelegraph.com/rss,2024-09-24 11:55:44+01:00,2024-09-25 00:52:06.727898,telegram policy shift raise privacy concern top messaging apps like whatsapp metas messenger also share user data authority receive valid legal request,0.743,0.35,0.5465
RSS,https://cointelegraph.com/rss,2024-09-24 11:35:08+01:00,2024-09-25 00:52:06.727898,philippine agency empowers youth blockchain nft education philippine dostasti introduced blockchain nfts crypto youth focusing realworld application fostering innovation future,0.3818,0.0,0.1909
RSS,https://cointelegraph.com/rss,2024-09-24 11:05:58+01:00,2024-09-25 00:52:06.727898,bitcoin price target rise 78k chinese stimulus package bitcoin rallied strongly previous two stimulus package announcement people bank china,0.2732,-0.08333333333333333,0.09493333333333334
RSS,https://cointelegraph.com/rss,2024-09-24 10:24:21+01:00,2024-09-25 00:52:06.727898,upbit store user data aws user know upbits privacy policy update involves transferring user data aws server u improved service reliability compliance local regulation,0.4767,0.0,0.23835
RSS,https://cointelegraph.com/rss,2024-09-24 10:14:03+01:00,2024-09-25 00:52:06.727898,bitget predicts ton detelegramization next 2 year ton toncoin cryptocurrency likely outperform spot return bitcoin bullish scenario coming year bitget predicted,0.0,0.0,0.0
RSS,https://cointelegraph.com/rss,2024-09-24 09:55:16+01:00,2024-09-25 00:52:06.727898,celsius token surge 300 month 25b payment creditor celsius token skyrocketed 300 month firm paid 25 billion creditor marking strong rebound aftermath bankruptcy settlement,0.4767,0.11666666666666667,0.29668333333333335
RSS,https://cointelegraph.com/rss,2024-09-24 09:50:53+01:00,2024-09-25 00:52:06.727898,kraken acquires dutch broker bcm part european expansion acquisition dutch broker firm key part exchange european expansion strategy ahead mica regulation,0.0,-0.05,-0.025
RSS,https://cointelegraph.com/rss,2024-09-24 09:19:36+01:00,2024-09-25 00:52:06.727898,btc price support 62k must hold bitcoin bear step trader bitcoin bull bear lining epic tug war based order book liquidity gain control btc price trend,0.296,0.1,0.198
RSS,https://cointelegraph.com/rss,2024-09-24 08:47:53+01:00,2024-09-25 00:52:06.727898,ireland eye mica guardrail democratize finance crypto central bank ireland leading call democratize finance boost financial inclusivity implementing eu mica regulation highlighting country priority,0.4019,0.0,0.20095
RSS,https://cointelegraph.com/rss,2024-09-24 08:39:45+01:00,2024-09-25 00:52:06.727898,sweden see crypto exchange professional money launderers swedish authority label certain cryptocurrency exchange key enablers organized crime highlighting four distinct moneylaundering profile,-0.2732,0.15357142857142858,-0.05981428571428571
RSS,https://cointelegraph.com/rss,2024-09-24 06:50:34+01:00,2024-09-25 00:52:06.727898,court question sec vacuous denial coinbase rulemaking petition 2022 coinbase asked sec propose adopt rule govern crypto including clarification crypto asset security,0.6808,-0.1,0.2904
RSS,https://bitcoinmagazine.com/.rss/full/,2024-09-24 16:46:51+00:00,2024-09-25 00:52:06.727898,building lnbits wordpress bitcoin lightning node ben arcben arc talented team developer behind lnbits helping user lightning,0.6705,0.14999999999999997,0.41025
RSS,https://bitcoinmagazine.com/.rss/full/,2024-09-24 13:22:48+00:00,2024-09-25 00:52:06.727898,bitwise cio say powerful people finance buying bitcoin cryptothe cio bitcoin asset manager bitwise claim powerful people finance buying bitcoin crypto say nearly 70 top financial advisor recent summit owned bitcoin crypto personally,0.836,0.18333333333333335,0.5096666666666667
RSS,https://bitcoinmagazine.com/.rss/full/,2024-09-23 17:53:49+00:00,2024-09-25 00:52:06.727898,bitcoin fork pathway innovation disruptive forcesa look history major bitcoin fork,0.0772,0.0625,0.06985
RSS,https://bitcoinmagazine.com/.rss/full/,2024-09-23 13:31:05+00:00,2024-09-25 00:52:06.727898,donald trump say crypto could help pay 35 trillion u debtdonald trump floated using crypto pay u 35 trillion debt part embrace bitcoin amid 2024 race kamala harris also pledged boost digital asset signaling cryptos growing bipartisan appeal,0.765,0.0,0.3825
RSS,https://bitcoinmagazine.com/.rss/full/,2024-09-20 21:42:07+00:00,2024-09-25 00:52:06.727898,sec approves option trading blackrocks spot bitcoin etf ibitthe sec approved listing trading option blackrocks ishares bitcoin trust marking significant milestone bitcoin integration traditional finance,0.8625,0.04375,0.453125
RSS,https://bitcoinmagazine.com/.rss/full/,2024-09-20 16:30:47+00:00,2024-09-25 00:52:06.727898,bitcoin react u electioncan historical election trend predict bitcoins next move,0.0,0.0,0.0
RSS,https://bitcoinmagazine.com/.rss/full/,2024-09-20 14:52:09+00:00,2024-09-25 00:52:06.727898,microstrategy buy additional 489 billion worth bitcoinmicrostrategy purchased additional 489 million bitcoin swelling corporate bitcoin treasury 252000 btc worth nearly 10 billion company bitcoin strategy aim boost return hedge inflation,0.743,0.175,0.45899999999999996
RSS,https://bitcoinmagazine.com/.rss/full/,2024-09-20 14:10:48+00:00,2024-09-25 00:52:06.727898,santa monica bitcoin office case study presented cmrta annual conferenceproof workforce santa monicas vice mayor present case study city innovative bitcoin office cmrta annual conference office first kind u aim educate bitcoin support economic recovery,0.8402,0.31,0.5751
RSS,https://bitcoinmagazine.com/.rss/full/,2024-09-20 09:20:12+00:00,2024-09-25 00:52:06.727898,satoshi era wallet moved 16 million worth bitcoinaround 250 btc bitcoins early day transferred 15 year inactivity revealing huge reward reaped early miner 16 million worth satoshi era coin highlight conviction pioneering hodlers,0.8807,0.24,0.56035
RSS,https://bitcoinmagazine.com/.rss/full/,2024-09-19 22:44:29+00:00,2024-09-25 00:52:06.727898,bipartisan consensus emerges final day america love crypto tourcoinbase ceo brian armstrong congressman wiley nickel dnc emphasized need united state decisively lead crypto policy bipartisan manner,0.7906,0.25,0.5203
RSS,https://bitcoinmagazine.com/.rss/full/,2024-09-19 20:26:27+00:00,2024-09-25 00:52:06.727898,hut 8 bitmain launch nextgeneration asic bitcoin miner liquidtochip coolingthese mining giant join force release u3s21exph nextgeneration asic miner featuring advanced liquidtochip cooling technology,0.4939,0.2,0.34695
RSS,https://bitcoinmagazine.com/.rss/full/,2024-09-19 16:01:04+00:00,2024-09-25 00:52:06.727898,celebrating 10 year hardware wallet revolutiona look back start hardware wallet bitcoin space,0.5719,0.0,0.28595
RSS,https://bitcoinmagazine.com/.rss/full/,2024-09-19 12:22:17+00:00,2024-09-25 00:52:06.727898,germany commerzbank dz bank offer bitcoin crypto tradinggermanys two large bank commerzbank dz bank launching bitcoin crypto trading service amid growing demand,0.0516,0.21428571428571427,0.13294285714285714
RSS,https://bitcoinmagazine.com/.rss/full/,2024-09-18 22:59:20+00:00,2024-09-25 00:52:06.727898,donald trump make historic bitcoin payment pubkeyformer u president republican presidential nominee donald trump becomes first u president publicly transact bitcoin,0.0,0.08333333333333333,0.041666666666666664
RSS,https://bitcoinmagazine.com/.rss/full/,2024-09-18 22:30:01+00:00,2024-09-25 00:52:06.727898,louisiana state government accepts bitcoin lightning paymentlouisiana become one first u state accept bitcoin government payment offering resident flexible option transaction,0.7003,0.25,0.47515
RSS,https://bitcoinmagazine.com/.rss/full/,2024-09-18 19:58:31+00:00,2024-09-25 00:52:06.727898,fractal bitcoin misleading affinitya quick look socalled sidechain fractal bitcoin,-0.4019,0.3333333333333333,-0.03428333333333333
RSS,https://bitcoinmagazine.com/.rss/full/,2024-09-18 18:29:12+00:00,2024-09-25 00:52:06.727898,federal reserve cut interest rate 50 basis point address economic uncertaintythe federal reserve lowered interest rate 50 basis point today marking first significant cut four year,0.4767,0.27499999999999997,0.37585
RSS,https://bitcoinmagazine.com/.rss/full/,2024-09-18 14:05:22+00:00,2024-09-25 00:52:06.727898,picklebit proof workforce fold pickle pop partner pickleball tournament offer bitcoin prize poolthe tournament held santa monica peer pier bitcoin festival feature semipro amateur division awarding 5000 prize pool paid bitcoin,0.9136,-0.25,0.3318
RSS,https://bitcoinmagazine.com/.rss/full/,2024-09-18 14:05:06+00:00,2024-09-25 00:52:06.727898,river secures 800 million worth bitcoin launch proof reserveriver launched transparency tool proving hold 800 million worth bitcoin full reserve custody u exchange aim rebuild trust failure like ftx new river proof reserve,0.7964,0.15393939393939393,0.47516969696969696
RSS,https://bitcoinmagazine.com/.rss/full/,2024-09-18 10:34:49+00:00,2024-09-25 00:52:06.727898,blackrock release new report bitcoin unique diversifierblackrock released new report explaining bitcoin unique portfolio diversifier detached asset world largest asset manager continues embracing bitcoin adoption gain mainstream acceptance,0.872,0.2556818181818182,0.5638409090909091
RSS,https://bitcoinmagazine.com/.rss/full/,2024-09-17 22:59:22+00:00,2024-09-25 00:52:06.727898,samourai developer appear together court first time status conferencedefense attorney keonne rodriguez william lonergan hill continue argue developer didnt operate money transmitting business samourai rodriguez request modification bail condition,-0.34,0.25,-0.04500000000000001
RSS,https://bitcoinmagazine.com/.rss/full/,2024-09-17 16:34:57+00:00,2024-09-25 00:52:06.727898,key battleground state pennsylvania host day five america love crypto tourresidents pennsylvania key u swing state upcoming u presidential election come support probitcoin procrypto future united state,0.7906,0.125,0.4578
RSS,https://bitcoinmagazine.com/.rss/full/,2024-09-17 16:21:53+00:00,2024-09-25 00:52:06.727898,regulating bitcoin crypto nigeria crossroad capital control financial freedoma call sensible measured bitcoin regulation nigerian government,0.0,0.0,0.0
RSS,https://bitcoinmagazine.com/.rss/full/,2024-09-17 14:00:00+00:00,2024-09-25 00:52:06.727898,human right foundation grant 10 bitcoin 20 project worldwidethe human right foundation announced latest round grant totaling 1 billion satoshis worth 590000,0.7096,0.1673469387755102,0.4384734693877551
RSS,https://bitcoinmagazine.com/.rss/full/,2024-09-17 13:37:36+00:00,2024-09-25 00:52:06.727898,bitcoins future payment overcoming stablecoin dominance fiatless fiat bitcoin stable channel supported lightning network could introduce novel peertopeer payment infrastructure rival stablecoins,0.765,0.0,0.3825
RSS,https://bitcoinmagazine.com/.rss/full/,2024-09-17 11:58:05+00:00,2024-09-25 00:52:06.727898,singapore db bank launch bitcoin crypto option institutionssingapores largest bank db begin offering otc bitcoin crypto option trading institutional client q4 2024 db first major asian bank providing sophisticated bitcoin derivative amid rising allocation demand,0.4767,0.203125,0.3399125
RSS,https://bitcoinmagazine.com/.rss/full/,2024-09-17 11:35:43+00:00,2024-09-25 00:52:06.727898,arthur hayes family office fund bitcoin core developerarthur hayes family office maelstrom awarded first grant bitcoin developer program contributor rkrux funding support rkrux working fulltime contributing bitcoin core open source project,0.7845,0.125,0.45475
RSS,https://bitcoinmagazine.com/.rss/full/,2024-09-16 21:03:54+00:00,2024-09-25 00:52:06.727898,microstrategy announces 700 million raise redeem senior secured note buy bitcoinmicrostrategy use net proceeds offering redeem senior secured note due 2028 acquire additional bitcoin,0.6597,-0.0625,0.2986
RSS,https://bitcoinmagazine.com/.rss/full/,2024-09-16 19:40:50+00:00,2024-09-25 00:52:06.727898,financial anarchist manifestousing technology like nostr chaumian ecash financial anarchist challenge status quo aiming reclaim economic sovereignty disrupt centralized financial power bitcoin,0.4215,0.05,0.23575
RSS,https://bitcoinmagazine.com/.rss/full/,2024-09-16 19:14:18+00:00,2024-09-25 00:52:06.727898,bitcoin crypto voter make voice heard america love crypto stop wisconsinwisconsin ready move past partisanship unifying force bitcoin crypto ahead 2024 election,0.6705,0.15,0.41025
RSS,https://bitcoinmagazine.com/.rss/full/,2024-09-16 16:42:08+00:00,2024-09-25 00:52:06.727898,bhutan bitcoin holding revealed kingdom owns 780m btc miningbhutans growing bitcoin empire revealed 780 million btc acquired extensive mining operation powered nation renewable energy resource,0.4215,0.0,0.21075
RSS,https://bitcoinmagazine.com/.rss/full/,2024-09-16 16:21:17+00:00,2024-09-25 00:52:06.727898,urgent need bitcoin tax reform encourage everyday usean argument tax treatment bitcoin massive disincentive use commerce,0.3818,-0.1,0.14089999999999997
RSS,https://bitcoinmagazine.com/.rss/full/,2024-09-16 14:00:08+00:00,2024-09-25 00:52:06.727898,mi primer bitcoin promotes two staff member leadership rolesthe opensource bitcoin education platform founded el salvador move two member inhouse talent one native salvadoran supervisory position,0.6369,0.0,0.31845
RSS,https://bitcoinmagazine.com/.rss/full/,2024-09-16 13:26:09+00:00,2024-09-25 00:52:06.727898,bitcoin mining shutdown cause 20 surge electricity billsthe shutdown bitcoin mining facility norway caused 20 increase electricity bill town resident loss mining operation revenue forced local power company raise rate offset cost,-0.4588,-0.15000000000000002,-0.3044
RSS,https://bitcoinmagazine.com/.rss/full/,2024-09-13 20:20:40+00:00,2024-09-25 00:52:06.727898,detroit aim drive digital asset innovation day three america love crypto tourthe motor city state michigan see opportunity creating businessfriendly environment bitcoin crypto industry welcoming stand crypto alliance,0.9451,0.25,0.59755
RSS,https://bitcoinmagazine.com/.rss/full/,2024-09-13 20:09:00+00:00,2024-09-25 00:52:06.727898,bitcoin surge 60000 market brace potential fed rate cutbitcoin touch 60000 ahead potential interest rate cut federal reserve signaling market optimism amid falling reported inflation data,0.5859,0.0,0.29295
RSS,https://bitcoinmagazine.com/.rss/full/,2024-09-13 17:30:36+00:00,2024-09-25 00:52:06.727898,bitcoin price action expect next bitcoins path forward insight price target support resistance zone,0.4019,0.05,0.22594999999999998
RSS,https://bitcoinmagazine.com/.rss/full/,2024-09-13 13:02:18+00:00,2024-09-25 00:52:06.727898,microstrategy buy additional 111 billion worth bitcoinmicrostrategy purchased additional 18300 bitcoins 111 billion boosting total bitcoin trove 244800 btc acquired 945 billion company continues bitcoin accumulation strategy capitalizing btc appreciation,0.765,0.15,0.4575
RSS,https://bitcoinmagazine.com/.rss/full/,2024-09-13 10:28:54+00:00,2024-09-25 00:52:06.727898,bitcoin crypto exchange htx integrate lightning networkone leading bitcoin crypto exchange htx announced integration bitcoins lightning network enable faster cheaper payment,0.0,0.0,0.0
RSS,https://bitcoinmagazine.com/.rss/full/,2024-09-12 15:49:09+00:00,2024-09-25 00:52:06.727898,trump election victory could send bitcoin 125000 say standard chartered analysta trump win could fuel bitcoin rally though new alltime high expected regardless 2024 election outcome,0.5859,0.1992727272727273,0.3925863636363636
RSS,https://bitcoinmagazine.com/.rss/full/,2024-09-12 13:00:00+00:00,2024-09-25 00:52:06.727898,revolutionizing bitcoin mining power threephase systemswhy threephase electrical system offer competitive advantage miner asic efficiency gain tapering,0.8225,0.0,0.41125
RSS,https://bitcoinmagazine.com/.rss/full/,2024-09-11 18:40:01+00:00,2024-09-25 00:52:06.727898,bitcoin vault future bitcoin custodyas bitcoin grows value popularity custody solution become critical learn bitcoin vault importance custody space,0.7906,0.0,0.3953
RSS,https://bitcoinmagazine.com/.rss/full/,2024-09-11 17:06:05+00:00,2024-09-25 00:52:06.727898,uk parliament introduces bill recognize bitcoin crypto personal propertythe new legislation aim provide legal clarity protection bitcoin digital asset owner,0.6908,0.08409090909090909,0.38744545454545454
RSS,https://bitcoinmagazine.com/.rss/full/,2024-09-11 15:31:02+00:00,2024-09-25 00:52:06.727898,el salvador bitcoin office celebrates 21 month success set stage renaissance 20the national bitcoin office onbtc office president el salvador led stacy herbert aim help integrate bitcoin el salvador economy foster cultural artistic psychological renaissance,0.8779,0.18333333333333335,0.5306166666666667
RSS,https://bitcoinmagazine.com/.rss/full/,2024-09-11 13:00:00+00:00,2024-09-25 00:52:06.727898,early bitcoin developer back satoshi nakamoto theorya bitcoin developer 2010 gone public support theory project anonymous founder,0.4019,0.03333333333333333,0.21761666666666665
RSS,https://bitcoinmagazine.com/.rss/full/,2024-09-11 12:14:47+00:00,2024-09-25 00:52:06.727898,bitcoin mining difficulty hit record 92 trillionthe bitcoin mining difficulty hit record high 9267 trillion september 11 displaying intensifying competition network rise indicates greater security surging collective computing power dedicated mining bitcoin,0.4767,0.33,0.40335
RSS,https://bitcoinmagazine.com/.rss/full/,2024-09-10 21:23:09+00:00,2024-09-25 00:52:06.727898,standard chartered bank launch bitcoin crypto custody service uaethe international banking group granted licence dubai financial service authority allowing custody client digital asset,0.5859,0.0,0.29295
RSS,https://bitcoinmagazine.com/.rss/full/,2024-09-10 17:59:33+00:00,2024-09-25 00:52:06.727898,un ode de lprovocateur du bitcoina poem written loosely haiku style enza coin,0.0,-0.07692307692307693,-0.038461538461538464
RSS,https://bitcoinmagazine.com/.rss/full/,2024-09-10 09:40:25+00:00,2024-09-25 00:52:06.727898,metaplanet buy additional 300 million worth bitcoinpubliclylisted metaplanet purchased additional 300 million 22m bitcoin bringing total holding 3988 btc bought 375 billion 276m,0.2263,0.15,0.18814999999999998
RSS,https://bitcoinmagazine.com/.rss/full/,2024-09-09 21:47:47+00:00,2024-09-25 00:52:06.727898,give timeon bitcoin saturn synchronicity privacy issue,0.0,0.0,0.0
RSS,https://bitcoinist.com/feed/,2024-09-25 00:30:31+00:00,2024-09-25 00:52:06.727898,sean diddy comb join former ftx ceo shared dormitory notorious brooklyn jailaccording report fortune sean diddy comb former ceo collapsed ftx crypto exchange sam bankmanfried two prominent figure respective field share dormitory metropolitan detention center mdc brooklyn harsh condition metropolitan detention center sean comb rapper music producer,-0.25,0.014285714285714287,-0.11785714285714285
RSS,https://bitcoinist.com/feed/,2024-09-24 23:30:45+00:00,2024-09-25 00:52:06.727898,crypto attracting powerful people finance say bitwise cioheres whybitwise chief investment officer matt hougan recently highlighted growing trend top financial advisor allocating cryptocurrency portfolio speaking barrons advisor 100 summit palm beach florida hougan shared insight powerful people financial industry beginning embrace digital asset like,0.9578,0.15714285714285717,0.5574714285714286
RSS,https://bitcoinist.com/feed/,2024-09-24 22:00:01+00:00,2024-09-25 00:52:06.727898,dogecoin whale rouse slumber almost 1000 surge activity price followdogecoin holder working tirelessly change cryptos trajectory previous week stagnation disinteresting price action notably onchain data suggests large holder dogecoin working extending promising price rally last week data insight intotheblock itb reveal large holder netflow exchange netflow showing significant,0.5423,0.17961309523809524,0.3609565476190476
RSS,https://bitcoinist.com/feed/,2024-09-24 20:30:03+00:00,2024-09-25 00:52:06.727898,australia set new rule crypto firm must obtain financial licensesaustralia taking considerable measure regulate cryptocurrency business goal improving consumer safety reducing fraudulent activity related reading digital asset table kamala harris promise invest america future australian security investment commission asic revealed intention compel cryptocurrency enterprise including exchange seek financial,0.8225,0.004040404040404039,0.41327020202020204
RSS,https://bitcoinist.com/feed/,2024-09-24 19:00:21+00:00,2024-09-25 00:52:06.727898,bitcoin stall 65000 despite seller losing momentum whats going onbitcoin firm adding nearly 30 sinking low 49000 early august bull strengthen fundamental factor swing favor world valuable coin price remain 65000 looking daily chart reaction level coincides august high technically buyer find required momentum breaking,0.7494,0.022857142857142857,0.38612857142857143
