MainSource,Source,Publication Date,Pull_date,Pre-Processed Text,Sentiment_Vader,Sentiment_TextBlob,Average_Sentiment
RSS,https://cointelegraph.com/rss,2025-01-06 12:13:14+00:00,2025-01-06 12:19:54.972980,mica attract crypto investment despite overregulation concern european retail investor likely feel biggest effect mica regulation stringent data collection potential introduction crypto taxation law,0.3612,0.0,0.1806
RSS,https://cointelegraph.com/rss,2025-01-06 12:10:52+00:00,2025-01-06 12:19:54.972980,xrp price chart 039bull flag039 target 15 amid increasing open interest xrps price action form classic bullish continuation structure profit target around 15,0.7096,0.08888888888888889,0.39924444444444446
RSS,https://cointelegraph.com/rss,2025-01-06 10:17:39+00:00,2025-01-06 12:19:54.972980,tether usdts market cap drop linked seasonal holiday lull tether usdts trading fallen 100 billion since middecember may premature turn bearish according matrixport,-0.2263,0.0,-0.11315
RSS,https://cointelegraph.com/rss,2025-01-06 09:58:40+00:00,2025-01-06 12:19:54.972980,global crackdown target crypto scam ai deepfake fraud vietnamese police arrest crypto mining scammer springfield warns atm fraud hong kong bust airelated scam,-0.9571,-0.025,-0.49105
RSS,https://cointelegraph.com/rss,2025-01-06 09:30:32+00:00,2025-01-06 12:19:54.972980,back 76k 2025 5 thing know bitcoin week btc price expectation diverge bitcoin bull eye charge 100000 mark end holiday period,0.4019,0.0,0.20095
RSS,https://cointelegraph.com/rss,2025-01-06 09:25:08+00:00,2025-01-06 12:19:54.972980,bitcoin price today bitcoin price today microstrategy metaplanet announced plan raise billion increase btc reserve 2025,0.3182,0.0,0.1591
RSS,https://cointelegraph.com/rss,2025-01-06 08:57:55+00:00,2025-01-06 12:19:54.972980,crypto market today crypto market today amid increasing optimism cryptofriendly regulatory environment ahead u presidentelect donald trump inauguration,0.5423,0.0,0.27115
RSS,https://cointelegraph.com/rss,2025-01-06 05:52:21+00:00,2025-01-06 12:19:54.972980,korea jeju issue nft tourist card boost gen z visitor report south korea jeju island selfgoverning tourist hotspot reportedly trial nft tourist card bid attract country younger generation,0.6369,0.0,0.31845
RSS,https://cointelegraph.com/rss,2025-01-06 05:22:07+00:00,2025-01-06 12:19:54.972980,sam altman expects first ai worker year openai closer agi confident know build agi traditionally understood said openai bos sam altman,0.4939,0.25,0.37195
RSS,https://cointelegraph.com/rss,2025-01-06 03:59:00+00:00,2025-01-06 12:19:54.972980,ai tokenization usher new longtail capital market 2025 bitwise deregulation realworld asset tokenization ai could accelerate crypto 2025 according hunter horsley,0.3612,0.13636363636363635,0.2487818181818182
RSS,https://cointelegraph.com/rss,2025-01-06 03:20:22+00:00,2025-01-06 12:19:54.972980,bitcoin trump rally could wane ahead endjan fomc meeting 10x research 10x research founder markus thielen said federal reserve decision remain bitcoins primary risk slowing another price surge,-0.2732,0.4,0.06340000000000001
RSS,https://cointelegraph.com/rss,2025-01-06 02:57:10+00:00,2025-01-06 12:19:54.972980,vitalik buterin suggests ai hardware pause humanity safety buterin said last resort slow dangerous form superintelligent ai would restrict available global computing power year two,-0.4404,-0.1,-0.2702
RSS,https://cointelegraph.com/rss,2025-01-06 01:30:11+00:00,2025-01-06 12:19:54.972980,pubg creator even thinking nfts upcoming metaverse report brendan greene creator pubg said upcoming metaverse may integrate blockchain technology doesnt plan nfts,0.0,0.0,0.0
RSS,https://cointelegraph.com/rss,2025-01-05 23:08:45+00:00,2025-01-06 12:19:54.972980,metaplanet eye upping bitcoin holding 10k btc 2025 metaplanet hold 1762 bitcoin want increase stash 467 10000,0.3818,0.0,0.1909
RSS,https://cointelegraph.com/rss,2025-01-05 21:00:39+00:00,2025-01-06 12:19:54.972980,bitcoin price move 100k could pull sol sui icp ena higher bitcoin bull keep pushing 100000 make sui ena sol icp could also break,0.0,0.25,0.125
RSS,https://cointelegraph.com/rss,2025-01-05 20:58:53+00:00,2025-01-06 12:19:54.972980,here happened crypto today need know happened crypto today latest news daily trend event impacting bitcoin price blockchain defi nfts web3 crypto regulation,0.0,0.25,0.125
RSS,https://cointelegraph.com/rss,2025-01-05 20:39:27+00:00,2025-01-06 12:19:54.972980,mining company mara lent 7377 btc third party 2024 mara executive said purpose lending program generate income offset operating expense incurred mining,0.4019,0.0,0.20095
RSS,https://cointelegraph.com/rss,2025-01-05 18:39:12+00:00,2025-01-06 12:19:54.972980,03975 ripple open role usbased039 ceo brad garlinghouse even personal genslers sec effectively froze business opportunity home year ceo wrote,0.6908,0.125,0.4079
RSS,https://cointelegraph.com/rss,2025-01-05 17:02:07+00:00,2025-01-06 12:19:54.972980,microstrategy039s saylor post btc tracker hint monday purchase according data saylortracker website microstrategy currently hold 446400 bitcoin valued approximately 437 billion,0.4404,-0.2,0.1202
RSS,https://cointelegraph.com/rss,2025-01-05 15:00:00+00:00,2025-01-06 12:19:54.972980,ai model predict ultimate crypto portfolio 2025 ai model envisioned eyewatering crypto price 2025,0.0,0.0,0.0
RSS,https://cointelegraph.com/rss,2025-01-05 13:10:26+00:00,2025-01-06 12:19:54.972980,dogecoin jump 21 whale accumulate galaxy predicts 1 doge dogecoin jump 21 whale accumulate 1 billion doge analyst predicting could hit 1 2025,0.0,0.0,0.0
RSS,https://cointelegraph.com/rss,2025-01-05 10:50:00+00:00,2025-01-06 12:19:54.972980,pudgy penguin pengu token rally 13 despite declining nft sale pudgy penguin nft sale plummeted 52 past week,0.0,-0.25,-0.125
RSS,https://cointelegraph.com/rss,2025-01-05 03:58:20+00:00,2025-01-06 12:19:54.972980,crypto wallet phantom confirms wont launch token amid airdrop rumor rumor came phantom announced new social discovery feature speculated user would earn token gaining follower,0.4215,0.08484848484848484,0.2531742424242424
RSS,https://cointelegraph.com/rss,2025-01-05 01:08:38+00:00,2025-01-06 12:19:54.972980,ether may struggle 2025 sol etf odds rise hodlers digest dec 29 jan 4 vaneck researcher optimistic spot sol etf listing 2025 terraform lab cofounder kwon pleads guilty hodlers digest,-0.4215,-0.5,-0.46075
RSS,https://cointelegraph.com/rss,2025-01-05 01:01:58+00:00,2025-01-06 12:19:54.972980,procrypto lawyer john deaton offer probe operation chokepoint 20 investigating operation chokepoint 20 would create dangerous precedent regulatory body suppress whoever disfavor deaton stressed,-0.5267,-0.6,-0.56335
RSS,https://cointelegraph.com/rss,2025-01-04 22:12:14+00:00,2025-01-06 12:19:54.972980,elon musk announces change x algorithm face backlash response planned change independent journalist james li asked musk algorithm determine negativity,-0.5106,0.0,-0.2553
RSS,https://cointelegraph.com/rss,2025-01-04 20:33:01+00:00,2025-01-06 12:19:54.972980,btc exchange inflow miner outflow drop btc reclaim 100k price bitcoin hit alltime high 108000 december 17 2024 declined 10 since time,-0.2732,0.16,-0.0566
RSS,https://cointelegraph.com/rss,2025-01-04 17:12:18+00:00,2025-01-06 12:19:54.972980,19 trillion transaction settled bitcoin network 2024 bitcoin current market capitalization roughly 19 trillion surpassed silver 16 trillion market cap 2024,0.0,-0.05,-0.025
RSS,https://cointelegraph.com/rss,2025-01-04 13:45:07+00:00,2025-01-06 12:19:54.972980,cryptos recordbreaking year see spike kidnapping ransom scheme rise ransomware kidnapping extortion show growing risk faced crypto trader investor sector expands,-0.0,0.0,0.0
RSS,https://cointelegraph.com/rss,2025-01-04 13:35:10+00:00,2025-01-06 12:19:54.972980,bitcoin etf inflow rebound 6week high btc price reclaims 97k bitcoin firmly different mood first wall street trading week end btc price action still need convince wary trader,0.25,0.0020000000000000018,0.126
RSS,https://bitcoinmagazine.com/.rss/full/,2025-01-03 19:58:22+00:00,2025-01-06 12:19:54.972980,michael saylors trump meeting turbo bullish bitcointhe u finally active probitcoin administration coming office,0.4019,-0.13333333333333333,0.1342833333333333
RSS,https://bitcoinmagazine.com/.rss/full/,2025-01-03 18:34:50+00:00,2025-01-06 12:19:54.972980,birthday letter bitcoina letter bitcoin lesson impetuous teenager take heed teenage year,0.0,0.0,0.0
RSS,https://bitcoinmagazine.com/.rss/full/,2025-01-03 13:50:00+00:00,2025-01-06 12:19:54.972980,2025 bitcoin outlook insight backed metric market dataexplore bitcoins 2025 potential datadriven perspective analyzing key metric like mvrv zscore pi cycle oscillator macroeconomic trend uncover insight year ahead,0.3818,0.0,0.1909
RSS,https://bitcoinmagazine.com/.rss/full/,2025-01-02 22:17:57+00:00,2025-01-06 12:19:54.972980,1 million seed capital awarded defi hedge fund boreal bitcoin alpha competition winnersamara asset management bitcoin magazine pro selected boreal winner secondever bitcoin alpha competition,0.8126,0.0,0.4063
RSS,https://bitcoinmagazine.com/.rss/full/,2025-01-02 21:39:36+00:00,2025-01-06 12:19:54.972980,owning 1 bitcoin better millionaire think millionaire exclusive let explain owning 1 bitcoin might real wealth symbol future,0.765,0.2333333333333333,0.49916666666666665
RSS,https://bitcoinmagazine.com/.rss/full/,2025-01-02 16:05:44+00:00,2025-01-06 12:19:54.972980,woman bitcoin cointelegraph forgotwomen based europe u excellent work bitcoin space cointelegraph pointed woman africa latin america southeast asia middle east,0.5719,0.5,0.5359499999999999
RSS,https://bitcoinmagazine.com/.rss/full/,2025-01-01 18:33:27+00:00,2025-01-06 12:19:54.972980,bitcoin fiatbitcoin digital commodity decentralized digital fiat currency,0.0,0.0,0.0
RSS,https://bitcoinmagazine.com/.rss/full/,2025-01-01 17:29:37+00:00,2025-01-06 12:19:54.972980,recounting ethiopia bitcoin development 2024reviewing development 2024 ethiopian electric power eep 25 privately owned bitcoin miner ethiopia contribute 600 mw energy bitcoin network,0.2732,0.0,0.1366
RSS,https://bitcoinmagazine.com/.rss/full/,2024-12-31 19:25:04+00:00,2025-01-06 12:19:54.972980,neobank yopaki aim make every mexican bitcoinerfrancisco chavarria yopakis cofounder ceo belief educating yopakis user bitcoin incorporating favorite mexican pastime app team poised make mexico nation bitcoin enthusiast,0.7579,0.16666666666666666,0.4622833333333333
RSS,https://bitcoinmagazine.com/.rss/full/,2024-12-31 16:58:18+00:00,2025-01-06 12:19:54.972980,watch michael saylors bitcoin 100k partyjoin bitcoin magazine news desk live michael saylors 100k nye bitcoin party miami,0.4019,0.13636363636363635,0.2691318181818182
RSS,https://bitcoinmagazine.com/.rss/full/,2024-12-30 19:41:00+00:00,2025-01-06 12:19:54.972980,capitulated started buying mstrbitcoin changing way public company bolster finance mstr leading way,0.0,0.0,0.0
RSS,https://bitcoinmagazine.com/.rss/full/,2024-12-30 19:17:12+00:00,2025-01-06 12:19:54.972980,bitcoin use lose itwhy simply hodling bitcoin watching number go enough succeed,0.2023,0.0,0.10115
RSS,https://bitcoinmagazine.com/.rss/full/,2024-12-30 17:00:12+00:00,2025-01-06 12:19:54.972980,earn bitcoin providing liquidity via boltz proi look forward earning sat noncustodial manner helping boltz manage liquidity,0.296,0.0,0.148
RSS,https://bitcoinmagazine.com/.rss/full/,2024-12-30 16:20:14+00:00,2025-01-06 12:19:54.972980,progressive case strategic bitcoin reserve strengthening america social safety netprimarily endorsed bitcoin proponent gop politician trump here strategic bitcoin reserve could actually appeal progressive,0.7906,0.016666666666666666,0.40363333333333334
RSS,https://bitcoinmagazine.com/.rss/full/,2024-12-27 19:09:40+00:00,2025-01-06 12:19:54.972980,debt bitcoin return stateless money firstsome quick thought book debt first 5000 year david graeber nonaustrian view history money,-0.6124,0.29166666666666663,-0.1603666666666667
RSS,https://bitcoinmagazine.com/.rss/full/,2024-12-27 16:52:20+00:00,2025-01-06 12:19:54.972980,michael saylor doesnt understand bitcoin saylor convinced bitcoin capital currency would like see whole world adopt u dollar money instead,0.7096,0.2,0.4548
RSS,https://bitcoinmagazine.com/.rss/full/,2024-12-27 14:00:00+00:00,2025-01-06 12:19:54.972980,buy bitcoin bull market dipsbuying bitcoin bull market dip requires strategic approach avoid overpaying maximizing return,-0.296,0.0,-0.148
RSS,https://bitcoinmagazine.com/.rss/full/,2024-12-25 16:14:27+00:00,2025-01-06 12:19:54.972980,bitcoin christmascelebrate season festive bitcoin twist sixfigure high institutional fomo bitcoin christmas unwraps magic holiday hodlers thrive adoption soar santa sleigh get bullish upgrade,0.6908,0.33,0.5104
RSS,https://bitcoinmagazine.com/.rss/full/,2024-12-24 17:57:00+00:00,2025-01-06 12:19:54.972980,protect noncustodial bitcoin wallet support open dialogue foundationa new report open dialogue foundation detail whats coming pike regarding regulation around noncustodial bitcoin crypto wallet european union organization use help push back unfavorable proposal,0.7906,0.02727272727272727,0.4089363636363636
RSS,https://bitcoinmagazine.com/.rss/full/,2024-12-23 18:57:30+00:00,2025-01-06 12:19:54.972980,satoshi paper explores role state postbitcoin world interview natalie smolenskitheoretical anthropologist natalie smolenski discus latest work satoshi paper second booklength academic text bitcoin conceptualized contributed edited,0.0,0.16666666666666666,0.08333333333333333
RSS,https://bitcoinmagazine.com/.rss/full/,2024-12-21 19:38:26+00:00,2025-01-06 12:19:54.972980,blackrock cant change bitcoin worried blackrock might change bitcoins supply let explain thats possible,0.2235,0.0,0.11175
RSS,https://bitcoinmagazine.com/.rss/full/,2024-12-20 23:22:52+00:00,2025-01-06 12:19:54.972980,need inkind redemption spot bitcoin etfshopefully sec commissioner hester peirce isnt playing say shell reconsider inkind redemption spot bitcoin etf,-0.1511,-0.1,-0.12555
RSS,https://bitcoinmagazine.com/.rss/full/,2024-12-20 20:31:05+00:00,2025-01-06 12:19:54.972980,bought bitcoin 108000 dont panicwhile bitcoins volatility may seem intense correction healthy normal,0.4588,0.2833333333333333,0.37106666666666666
RSS,https://bitcoinmagazine.com/.rss/full/,2024-12-20 16:42:53+00:00,2025-01-06 12:19:54.972980,dont support strategic bitcoin reserve neither younic carter lay argument bitcoin strategic reserve,-0.5801,0.0,-0.29005
RSS,https://bitcoinmagazine.com/.rss/full/,2024-12-20 14:47:33+00:00,2025-01-06 12:19:54.972980,time admit 21 quadrillion bitcoinsim favor bip 21q clever way resolve known problem bitcoin denomination,0.7506,0.16666666666666666,0.45863333333333334
RSS,https://bitcoinmagazine.com/.rss/full/,2024-12-20 13:54:47+00:00,2025-01-06 12:19:54.972980,exploring six onchain indicator understand bitcoin market cycleexplore key bitcoin metric like puell multiple mvrv zscore understand cycle progress anticipate price peak prepare bitcoins potential path toward 200k,0.6486,0.0,0.3243
RSS,https://bitcoinmagazine.com/.rss/full/,2024-12-19 21:26:36+00:00,2025-01-06 12:19:54.972980,bitcoin investor 67000 average startbitcoin investor average average american yearly salary,0.0,-0.11249999999999999,-0.056249999999999994
RSS,https://bitcoinmagazine.com/.rss/full/,2024-12-19 20:26:21+00:00,2025-01-06 12:19:54.972980,foundation introduces passport prime bitcoin wallet data security devicefoundations new device allinone tool digital security,0.5859,0.06818181818181818,0.3270409090909091
RSS,https://bitcoinmagazine.com/.rss/full/,2024-12-19 19:42:53+00:00,2025-01-06 12:19:54.972980,bukele president el salvador bitcoina good leader first priority well people whim public gossip banter,0.5106,0.31666666666666665,0.41363333333333335
RSS,https://bitcoinmagazine.com/.rss/full/,2024-12-19 15:00:29+00:00,2025-01-06 12:19:54.972980,vancouver mayor share probitcoin vision mayor ken sim isnt paying lip service bitcoin supporter come probitcoin rhetoric proposal he true believer,0.7964,0.35,0.5731999999999999
RSS,https://bitcoinmagazine.com/.rss/full/,2024-12-19 14:24:33+00:00,2025-01-06 12:19:54.972980,dont fall bitcoin crash breather worried bitcoins pullback let explain dip nothing healthy pause bull run,-0.296,0.5,0.10200000000000001
RSS,https://bitcoinmagazine.com/.rss/full/,2024-12-19 14:18:59+00:00,2025-01-06 12:19:54.972980,imf improved el salvador bitcoin lawin return loan deal imf el salvador give probitcoin policy made bitcoin law better,0.7184,0.5,0.6092
RSS,https://bitcoinmagazine.com/.rss/full/,2024-12-19 13:00:00+00:00,2025-01-06 12:19:54.972980,human right foundation donates 700000000 satoshis fund bitcoin development projectsthe hrf announces latest round bitcoin grant targeting key area latin america asia africa,0.3612,0.11714285714285713,0.2391714285714286
RSS,https://bitcoinmagazine.com/.rss/full/,2024-12-18 19:11:13+00:00,2025-01-06 12:19:54.972980,self custody theea counter argument attitude people never even consider self custody bitcoin,-0.3612,0.0,-0.1806
RSS,https://bitcoinmagazine.com/.rss/full/,2024-12-18 16:53:49+00:00,2025-01-06 12:19:54.972980,bitcoin puell multiple indicator workthe puell multiple powerful tool bitcoin investor analyzing miner revenue identify potential market top bottom here read itand signaling today,0.5574,0.16,0.3587
RSS,https://bitcoinmagazine.com/.rss/full/,2024-12-18 16:43:41+00:00,2025-01-06 12:19:54.972980,blackrocks new bitcoin ad monumental paradigm shiftthe overton window officially shifted bitcoin going mainstream,0.0,0.13636363636363635,0.06818181818181818
RSS,https://bitcoinmagazine.com/.rss/full/,2024-12-18 14:03:52+00:00,2025-01-06 12:19:54.972980,nic carter wrong u strategic bitcoin reserveis adding bitcoin u reserve sign weakness strength let tell nic carter wrong,-0.7003,-0.5,-0.60015
RSS,https://bitcoinmagazine.com/.rss/full/,2024-12-18 13:04:46+00:00,2025-01-06 12:19:54.972980,youngest ever bitcoin core contributor get bitcoin scholarship17yearold ishaana misra awarded chaincode lab inaugural bitcoin scholarship making youngest ever contributor bitcoin core,0.4019,0.0,0.20095
RSS,https://bitcoinmagazine.com/.rss/full/,2024-12-17 22:15:21+00:00,2025-01-06 12:19:54.972980,china may verge ending bitcoin banis china secretly stacking bitcoin gearing unban let break think theyre make huge moveand sooner think,0.3182,-2.7755575615628914e-17,0.15909999999999996
RSS,https://bitcoinmagazine.com/.rss/full/,2024-12-17 20:00:34+00:00,2025-01-06 12:19:54.972980,unit denomination bitcoin need changea recent bip proposed change way unit bitcoin displayed proposal needed,0.0,0.0,0.0
RSS,https://bitcoinmagazine.com/.rss/full/,2024-12-17 17:24:23+00:00,2025-01-06 12:19:54.972980,gridless mining bitcoin fostering human flourishing africagridless cofounder janet maingi explains company bitcoin mining work helping electrify rural africa leading better quality life community gridless touch,0.6249,0.16666666666666666,0.3957833333333333
RSS,https://bitcoinmagazine.com/.rss/full/,2024-12-17 17:12:07+00:00,2025-01-06 12:19:54.972980,mathematically predicting bitcoin price bull cycle peak bitcoin magazine pro lead analyst matt crosby us mathematical analysis predict next bitcoin bull cycle peak forecasting potential peak price 256000 310000 august 24 2025,0.0,0.0,0.0
RSS,https://bitcoinmagazine.com/.rss/full/,2024-12-17 16:49:59+00:00,2025-01-06 12:19:54.972980,buying bitcoin easy hodling hard partwhile bitcoin boom bull market volatility provide intense reality check ask veteran investor american hodl,0.4215,0.06833333333333333,0.24491666666666667
RSS,https://bitcoinmagazine.com/.rss/full/,2024-12-17 16:25:37+00:00,2025-01-06 12:19:54.972980,bitcoin university investment yield greater financial freedoma look whether bitcoin university education wiser long term investment one financial freedom,0.836,0.1125,0.47425
RSS,https://bitcoinmagazine.com/.rss/full/,2024-12-16 18:57:49+00:00,2025-01-06 12:19:54.972980,bitcoin etf surpass 1 million btc 2025accelerating etf inflow dwindling exchange supply potential u strategic reserve setting stage unprecedented bitcoin scarcitymaking even 1 million price target suddenly plausible,0.0,0.3666666666666667,0.18333333333333335
RSS,https://bitcoinmagazine.com/.rss/full/,2024-12-16 18:46:35+00:00,2025-01-06 12:19:54.972980,last resort unfed covenant bitcoinjeremy rubin recently released proposal allow specialized oracle emulate covenant bitcoin softforks necessary secured bitvm based slashable bond,0.5574,0.0,0.2787
RSS,https://bitcoinmagazine.com/.rss/full/,2024-12-13 19:01:18+00:00,2025-01-06 12:19:54.972980,perianne boring predicts trump 2025 economic policy drive bitcoin price 800kin bold prediction fox business perianne boring ceo digital chamber asserted presidentelect donald trump economic policy could position u global leader bitcoin adoption potentially driving asset price unprecedented 800000 2025,0.128,-0.0740740740740741,0.026962962962962952
RSS,https://bitcoinmagazine.com/.rss/full/,2024-12-13 18:05:58+00:00,2025-01-06 12:19:54.972980,tando rage year africa bitcoin conferencethe app let user pay merchant kenya accepts digital payment via mpesa bitcoin lightning,-0.4019,0.0,-0.20095
RSS,https://bitcoinmagazine.com/.rss/full/,2024-12-13 16:08:29+00:00,2025-01-06 12:19:54.972980,early bitcoin investor sentenced prison tax evasion 37 million btc salethis mark first criminal tax evasion prosecution centered solely bitcoin,-0.875,-0.01666666666666668,-0.44583333333333336
RSS,https://bitcoinmagazine.com/.rss/full/,2024-12-13 14:22:54+00:00,2025-01-06 12:19:54.972980,bitcoin fear greed index trading strategy beat buy hold investingdiscover bitcoin fear greed index sentiment analysis tool rooted human psychology outperform traditional buyandhold strategy,-0.8957,0.0,-0.44785
RSS,https://bitcoinist.com/feed/,2025-01-06 12:00:30+00:00,2025-01-06 12:19:54.972980,crypto survival mode bitcoin mining giant lends 7000 btc amid operational pressuresmarathon digital mara one largest player bitcoin mining space unveiled new approach managing cost operation bid ease financial pressure generate return company lending 7377 btc 16 deposit strategic play demonstrates,0.4019,0.03409090909090909,0.21799545454545455
RSS,https://bitcoinist.com/feed/,2025-01-06 11:15:26+00:00,2025-01-06 12:19:54.972980,ethereum green korea jeju island issue nft tourist card flockerz benefityou know fine day ethereum turn green 69 gain last week eth consolidating looking test 37k resistance point break 38k could see move 4k soon another procrypto move korea jeju island initiative create nft tourist card,0.743,0.004166666666666666,0.3735833333333333
RSS,https://bitcoinist.com/feed/,2025-01-06 10:30:07+00:00,2025-01-06 12:19:54.972980,dogecoin price mirror bullish pattern last cycle rally 6 possiblethe dogecoin price might gearing look like another notable rally recent performance since beginning january dogecoin spent majority last two week december decline regained momentum month break 040 mark according,0.3612,0.08,0.22060000000000002
RSS,https://bitcoinist.com/feed/,2025-01-06 09:00:29+00:00,2025-01-06 12:19:54.972980,ethereums january performance could significant historic price trend showswith momentum rising across general market several major crypto asset like ethereum transitioned toward upside direction result optimism eth witnessing rally short term risen significantly among crypto enthusiast attributing muchanticipated move past cycle trend major rally ethereum expected january,0.907,0.05750000000000001,0.48225
RSS,https://bitcoinist.com/feed/,2025-01-06 07:30:28+00:00,2025-01-06 12:19:54.972980,strategic bitcoin reserve proposed multiple chilean lawmakersmultiple chilean lawmaker currently pushing legislation would establish strategic bitcoin reserve sbr according detail shared nationstate mining lobbyist andrés villagrán revealing progress via x villagrán explained meeting numerous official advocate btcs potential economic benefit chile path bitcoin adoption 2023,0.802,0.04,0.42100000000000004
RSS,https://bitcoinist.com/feed/,2025-01-05 17:12:21+00:00,2025-01-06 12:19:54.972980,6 promising new cryptocurrency project january 2025as new year kick crypto world buzzing fresh project promising big return meme coin ecofriendly token six cryptocurrencies turning head here keep eye 1 wall street pepe wepe making splash meme coin space blending finance humor,0.8316,0.1621212121212121,0.49686060606060606
RSS,https://bitcoinist.com/feed/,2025-01-05 15:30:21+00:00,2025-01-06 12:19:54.972980,profittaking 90k100k cool bitcoin block pl count ratio drop sharply detailsbitcoin faced significant selling pressure 100k mark leaving market leader struggling regain momentum stellar rally btc testing ability push past critical resistance trader investor remain cautious shortterm trajectory related reading btc dominance breakdown confirmed metric support 2025 altseason,-0.4215,0.125,-0.14825
RSS,https://bitcoinist.com/feed/,2025-01-05 15:17:10+00:00,2025-01-06 12:19:54.972980,5 presale crypto terbaik untuk investasi hari ini presale dalam dunia crypto bisa diibaratkan seperti tiket early bird untuk konser yang sangat dinanti masuk lebih awal dan peluang untuk mendapatkan keuntungan besar semakin terbuka lebar meskipun sulit membedakan antara emas dan kilauannya kami telah menyaring beberapa presale terbaik yang patut anda perhatikan saat ini,0.0,0.1,0.05
