MainSource,Source,Publication Date,Pull_date,Pre-Processed Text,Sentiment_Vader,Sentiment_TextBlob,Average_Sentiment
RSS,https://cointelegraph.com/rss,2024-10-22 13:11:55+01:00,2024-10-22 12:19:07.094288,xrp price today xrp price declined ripple cofounder 10 million donation kamala harris u presidential campaign,0.0,0.0,0.0
RSS,https://cointelegraph.com/rss,2024-10-22 13:00:21+01:00,2024-10-22 12:19:07.094288,solana price unfazed pumpfun 66m sale 47m sol remaining pumpfuns fee account still hold 47 million worth solana token could add selling pressure,-0.0772,0.3,0.1114
RSS,https://cointelegraph.com/rss,2024-10-22 11:52:06+01:00,2024-10-22 12:19:07.094288,uk finance watchdog defends tough crypto stance fca defended rigorous crypto regulation countering claim high standard stifle innovation hinder uk global financial leadership,0.0,-0.04577777777777778,-0.02288888888888889
RSS,https://cointelegraph.com/rss,2024-10-22 11:20:00+01:00,2024-10-22 12:19:07.094288,long take mine 1 bitcoin mining bitcoin block take 10 minute timeframe translate mining 1 bitcoin,-0.4404,-0.05,-0.2452
RSS,https://cointelegraph.com/rss,2024-10-22 11:00:00+01:00,2024-10-22 12:19:07.094288,memecoin trading simplified tesa join cointelegraph accelerator tesa smart trading agent designed optimize memecoin trading enhancing speed cost efficiency accessibility join cointelegraph accelerator program,0.8957,0.21428571428571427,0.5549928571428572
RSS,https://cointelegraph.com/rss,2024-10-22 10:45:19+01:00,2024-10-22 12:19:07.094288,binance cryptocom lose ground rival dexs rise report binances falling market share could present significant opportunity smaller rival like bybit okx,0.6124,0.125,0.3687
RSS,https://cointelegraph.com/rss,2024-10-22 10:18:32+01:00,2024-10-22 12:19:07.094288,crypto market today crypto market today following bearish performance u equity market increasing strength u dollar,0.4939,0.0,0.24695
RSS,https://cointelegraph.com/rss,2024-10-22 09:44:16+01:00,2024-10-22 12:19:07.094288,bitcoin analysis see 039lower risk aversion039 retail demand add 13 bitcoin transaction volume analysis hint retail interest slowly returning line btc price upside,0.1027,-0.30000000000000004,-0.09865000000000002
RSS,https://cointelegraph.com/rss,2024-10-22 09:27:20+01:00,2024-10-22 12:19:07.094288,chainlink launch private blockchain transaction institution anz bank among first client debut chainlinks privacypreserving tech tokenized rwa settlement singapore project guardian,0.0,0.125,0.0625
RSS,https://cointelegraph.com/rss,2024-10-22 06:55:38+01:00,2024-10-22 12:19:07.094288,misspelling soneium google could drain crypto wallet scam sniffer web3 security firm scam sniffer said malicious cryptodraining link may appear google user search sonys new blockchain,-0.7184,-0.03181818181818183,-0.37510909090909095
RSS,https://cointelegraph.com/rss,2024-10-22 06:34:10+01:00,2024-10-22 12:19:07.094288,sky community consider another rebrand back maker maker rebranded sky two month ago part overhaul resistance,0.0,0.0,0.0
RSS,https://cointelegraph.com/rss,2024-10-22 06:11:16+01:00,2024-10-22 12:19:07.094288,blackrock039s ibit investor throw 329m etf bitcoin dip 3 blackrocks bitcoin fund carried rest united state spot bitcoin etf recorded net inflow 294 million oct 21,0.4215,0.0,0.21075
RSS,https://cointelegraph.com/rss,2024-10-22 05:53:23+01:00,2024-10-22 12:19:07.094288,wrong illegal crypto pundit slam fed kashkari minneapolis federal reserve president neel kashkari said crypto almost never used outside drug criminal activity evidence point contrary,-0.9136,-0.35,-0.6317999999999999
RSS,https://cointelegraph.com/rss,2024-10-22 05:06:00+01:00,2024-10-22 12:19:07.094288,cftc chair say agency handcuffed crypto regulation stall report still cftc chair rostin behnam said new congress president may accelerate crypto regulation,-0.2023,0.13636363636363635,-0.03296818181818183
RSS,https://cointelegraph.com/rss,2024-10-22 04:44:46+01:00,2024-10-22 12:19:07.094288,exceo mine digital stole 15m bitcoiner regulator alleges transaction happened two month firm went bust september 2022 australian financial regulator said,0.0,-0.05,-0.025
RSS,https://cointelegraph.com/rss,2024-10-22 04:05:18+01:00,2024-10-22 12:19:07.094288,blade runner 2049 producer sue elon musk ai art robotaxi event tesla ceo elon musk sued producer 2017 film blade runner 2049 allegedly using ai spoof image film robot event,0.0,-0.1,-0.05
RSS,https://cointelegraph.com/rss,2024-10-22 02:25:54+01:00,2024-10-22 12:19:07.094288,bitcoiners slam saylor throwing weight behind big fail bank bitcoin bull michael saylor previously said without bitcoin selfcustody custodian would accumulate much power could abuse,-0.8834,-0.17333333333333334,-0.5283666666666667
RSS,https://cointelegraph.com/rss,2024-10-22 02:00:52+01:00,2024-10-22 12:19:07.094288,ledger live enables thorchains decentralized native crosschain swap ledger allow user swap asset across chain app using decentralized liquidity protocol thorchain,0.5267,0.13636363636363635,0.33153181818181815
RSS,https://cointelegraph.com/rss,2024-10-21 22:26:35+01:00,2024-10-22 12:19:07.094288,mining pac launch ad ted cruz early voting begin texas 18 million registered voter lone star state decide whether replace senator ted cruz representative colin allred,-0.2732,0.1,-0.0866
RSS,https://cointelegraph.com/rss,2024-10-21 22:02:34+01:00,2024-10-22 12:19:07.094288,here happened crypto today need know happened crypto today latest news daily trend event impacting bitcoin price blockchain defi nfts web3 crypto regulation,0.0,0.25,0.125
RSS,https://cointelegraph.com/rss,2024-10-21 22:00:17+01:00,2024-10-22 12:19:07.094288,bitcoin fall 67k stock sell btc derivative stable bitcoin price saw sharp selloff oct 21 btc future market showing zero sign fear,-0.25,-0.0625,-0.15625
RSS,https://cointelegraph.com/rss,2024-10-21 21:34:27+01:00,2024-10-22 12:19:07.094288,chainlink using ai oracle bring marketmoving corporate data onchain oracle protocol partnering financial infrastructure provider including franklin templeton ubs,0.0,0.0,0.0
RSS,https://cointelegraph.com/rss,2024-10-21 20:38:40+01:00,2024-10-22 12:19:07.094288,coinbase file foias u regulator probing bank crypto crackdown exchange asked regulator disclose document relating ongoing crackdown crypto company among u bank,0.0,0.0,0.0
RSS,https://cointelegraph.com/rss,2024-10-21 20:24:56+01:00,2024-10-22 12:19:07.094288,ripple cofounder pledge 10m xrp kamala harris campaign pac chris larsen suggested democratic lawmaker could new approach tech innovation kamala harris presidency starting 2025,0.3818,0.06818181818181818,0.22499090909090907
RSS,https://cointelegraph.com/rss,2024-10-21 20:23:50+01:00,2024-10-22 12:19:07.094288,quantile model analyst predicts 135k285k bitcoin price 2025 unique bitcoin price model chart potential 285000 top btc 2025,0.2023,0.2916666666666667,0.24698333333333333
RSS,https://cointelegraph.com/rss,2024-10-21 20:00:00+01:00,2024-10-22 12:19:07.094288,chainalysis hit 650m lawsuit italy hike bitcoin tax law decoded chainalysis face 650 million defamation lawsuit eu esma push mica amendment cyprus ireland scramble align regulation italy plan hike tax bitcoin,-0.4215,0.0,-0.21075
RSS,https://cointelegraph.com/rss,2024-10-21 19:48:08+01:00,2024-10-22 12:19:07.094288,northern data want sell peak mining invest ai expansion tetherbacked company talking interested party said may also see ipo nasdaq next year,0.6908,0.125,0.4079
RSS,https://cointelegraph.com/rss,2024-10-21 18:44:40+01:00,2024-10-22 12:19:07.094288,transak hit data breach 92k user exposed transak disclosed data breach affecting 92000 user phishing attack compromised employee laptop,-0.5267,0.0,-0.26335
RSS,https://cointelegraph.com/rss,2024-10-21 17:52:58+01:00,2024-10-22 12:19:07.094288,better know crypto candidate john avlon part coverage 2024 u election cointelegraph asked several congressional candidate position cryptocurrency blockchain,0.4404,0.25,0.3452
RSS,https://cointelegraph.com/rss,2024-10-21 16:43:06+01:00,2024-10-22 12:19:07.094288,bitcoin drop 3 u seller spark sub65k btc price target bitcoin offer buyer flash sale dip 67000 trader warn btc price retracement may done yet,-0.1531,0.0,-0.07655
RSS,https://bitcoinmagazine.com/.rss/full/,2024-10-22 11:00:26+00:00,2024-10-22 12:19:07.094288,microstrategy ceo michael saylor reveals bitcoin mstr plansome argue selfcustody nothing else core bitcoin fact trust one hold safeguard wealth,0.7717,0.0,0.38585
RSS,https://bitcoinmagazine.com/.rss/full/,2024-10-21 21:14:47+00:00,2024-10-22 12:19:07.094288,6 step move old 401k bitcoin irathe latest guide unchained offer stepbystep instruction transferring 401k ira ahead next bull run,0.0,0.19999999999999998,0.09999999999999999
RSS,https://bitcoinmagazine.com/.rss/full/,2024-10-21 16:45:52+00:00,2024-10-22 12:19:07.094288,upside world spook hero hero spooksdistorted perception reality completely inverted perception acting best interest bitcoin versus acting interest way put bitcoin risk,0.946,0.275,0.6105
RSS,https://bitcoinmagazine.com/.rss/full/,2024-10-21 16:37:09+00:00,2024-10-22 12:19:07.094288,ecb get wrong bitcoin recent paper researcher european central bank make handful claim bitcoin lack context nuance andor evidence im shed light got wrong,-0.8176,-0.09999999999999999,-0.4588
RSS,https://bitcoinmagazine.com/.rss/full/,2024-10-21 11:00:00+00:00,2024-10-22 12:19:07.094288,kamala presidency could bullish bitcoina trump victory almost certainly ensures one outcome crypto security continue flourish unchecked,0.5434,0.21428571428571427,0.37884285714285715
RSS,https://bitcoinmagazine.com/.rss/full/,2024-10-18 21:06:20+00:00,2024-10-22 12:19:07.094288,bitcoin make new alltime highkey psychological barrier bitcoins fight 70000,-0.4767,0.06818181818181818,-0.20425909090909092
RSS,https://bitcoinmagazine.com/.rss/full/,2024-10-18 18:50:32+00:00,2024-10-22 12:19:07.094288,el salvador survey show bitcoins lindy effect actionslowly surely el salvador way mass bitcoin adoption,0.4404,0.5,0.4702
RSS,https://bitcoinmagazine.com/.rss/full/,2024-10-18 16:25:23+00:00,2024-10-22 12:19:07.094288,bitcoin model perfection doesnt need improvementthe idea bitcoin need improve perfect state decentralized money delusional thinking model perfect state automobile,0.9325,1.0,0.96625
RSS,https://bitcoinmagazine.com/.rss/full/,2024-10-18 11:28:15+00:00,2024-10-22 12:19:07.094288,bitcoin mempool drama predictablethe mempool drama predictable given brewing culture war monetary maximalist purist season 2 pragmatist,-0.5994,-0.2,-0.39970000000000006
RSS,https://bitcoinmagazine.com/.rss/full/,2024-10-17 17:35:36+00:00,2024-10-22 12:19:07.094288,live election day coverage bitcoinersthe firstever election day livestream event tailored specifically bitcoiners going live 3pm est november 5th,0.0,0.13636363636363635,0.06818181818181818
RSS,https://bitcoinmagazine.com/.rss/full/,2024-10-17 16:34:21+00:00,2024-10-22 12:19:07.094288,succeed bitcoin need something new samereplicating type service application legacy world bitcoin necessitates interacting legacy world giving leverage bitcoin,0.6808,0.13636363636363635,0.40858181818181816
RSS,https://bitcoinmagazine.com/.rss/full/,2024-10-16 19:24:11+00:00,2024-10-22 12:19:07.094288,elizabeth warren prof democrat still bitcointhe bitcoin industry could yet another four year harassment attack kamala harris elected president,-0.765,0.0,-0.3825
RSS,https://bitcoinmagazine.com/.rss/full/,2024-10-16 16:48:11+00:00,2024-10-22 12:19:07.094288,shinobi gaza powerful demonstration bitcoin since wikileakswhat happening gaza fact bitcoin way deliver aid gazans point one powerful demonstration bitcoin decade,0.7506,0.3,0.5253
RSS,https://bitcoinmagazine.com/.rss/full/,2024-10-16 13:00:00+00:00,2024-10-22 12:19:07.094288,bitcoins false dichotomy sov moebitcoins use store value mean exchange mutually exclusive,0.4404,-0.35625000000000007,0.042074999999999974
RSS,https://bitcoinmagazine.com/.rss/full/,2024-10-15 20:25:38+00:00,2024-10-22 12:19:07.094288,art surveillance ripcaches radical take bitcoin amsterdama qa privacy ownership unstoppable rise decentralized art world watchful eye,-0.2023,0.0,-0.10115
RSS,https://bitcoinmagazine.com/.rss/full/,2024-10-15 16:00:24+00:00,2024-10-22 12:19:07.094288,corva bitcoin reduce racismharvard professor robert putnams research extrapolated show identifying bitcoiner actually reduce racism,-0.6249,0.0,-0.31245
RSS,https://bitcoinmagazine.com/.rss/full/,2024-10-15 14:07:43+00:00,2024-10-22 12:19:07.094288,president harris buy bitcoin pay black american reparationsa bitcoin stockpile could onceinacentury chance pay back reparation without taxation seriously,0.1823,-0.125,0.028649999999999995
RSS,https://bitcoinmagazine.com/.rss/full/,2024-10-15 12:42:40+00:00,2024-10-22 12:19:07.094288,blackrock ceo right trump kamala cant stop bitcoinim pleasantly surprised accurately blackrocks ceo larry fink understands politics cant stop bitcoins growth,-0.016,0.2619047619047619,0.12295238095238095
RSS,https://bitcoinmagazine.com/.rss/full/,2024-10-14 19:20:22+00:00,2024-10-22 12:19:07.094288,kamala harris prof shes worst candidate bitcoin ownership adoptionour expectation low holy fck,-0.7351,-0.5,-0.61755
RSS,https://bitcoinmagazine.com/.rss/full/,2024-10-14 18:20:59+00:00,2024-10-22 12:19:07.094288,corva welcome empowerment epoch bitcoin people moneyin fifth bitcoin epoch bitcoin looked le speculative bet financial life raft many around world living failing oppressive system,-0.3818,0.43333333333333335,0.025766666666666688
RSS,https://bitcoinmagazine.com/.rss/full/,2024-10-14 14:15:38+00:00,2024-10-22 12:19:07.094288,bought microstrategy mstr stock real reasonso buy mstr short story really im tired watching mstr bull right whatever talking,-0.4902,0.021428571428571422,-0.2343857142857143
RSS,https://bitcoinmagazine.com/.rss/full/,2024-10-11 15:54:50+00:00,2024-10-22 12:19:07.094288,bitcoin miner expect nextwhat miner actually planning going near term future,0.0,0.03333333333333333,0.016666666666666666
RSS,https://bitcoinmagazine.com/.rss/full/,2024-10-10 17:38:41+00:00,2024-10-22 12:19:07.094288,trump winning closer ever freeing ross nikolauswe still fight like 13,0.7506,0.5,0.6253
RSS,https://bitcoinmagazine.com/.rss/full/,2024-10-10 14:44:21+00:00,2024-10-22 12:19:07.094288,memecoin supercycle thesis bitcoin alignedyes hyperbitcoinization happening yes messy period complete crypto degeneracy,0.0516,-0.05,0.0007999999999999986
RSS,https://bitcoinmagazine.com/.rss/full/,2024-10-09 15:16:08+00:00,2024-10-22 12:19:07.094288,hbos satoshi documentary money electric insult bitcoin hard know say documentary except marvel creativity cynicism,-0.25,-0.09722222222222222,-0.1736111111111111
RSS,https://bitcoinmagazine.com/.rss/full/,2024-10-09 12:55:53+00:00,2024-10-22 12:19:07.094288,asian bitcoiners profit maximalistsas someone who lived asia west ive noticed clear difference view bitcoin asia profit maximalists west philosophically driven,0.8126,0.03333333333333333,0.42296666666666666
RSS,https://bitcoinmagazine.com/.rss/full/,2024-10-09 07:16:35+00:00,2024-10-22 12:19:07.094288,watch bitcoin amsterdam underwaythe world largest bitcoin conference kick today amsterdam featuring speaker like jack mallers adam back watch live stream european bitcoin leader discus future,0.3612,0.03409090909090909,0.19764545454545457
RSS,https://bitcoinmagazine.com/.rss/full/,2024-10-08 19:49:31+00:00,2024-10-22 12:19:07.094288,entered bitcoin mining lottery nikolaushow im looking beat odds claim full 325 btc block worth 200000,-0.25,0.32499999999999996,0.03749999999999998
RSS,https://bitcoinmagazine.com/.rss/full/,2024-10-08 15:17:43+00:00,2024-10-22 12:19:07.094288,bitcoin report parabolic growth predicted q4 2024exclusive analysis expert insight navigating bitcoins promising q4 market dynamic,0.7845,0.1,0.44225
RSS,https://bitcoinmagazine.com/.rss/full/,2024-10-08 14:15:14+00:00,2024-10-22 12:19:07.094288,vexl next generation bitcoin p2p trading appvexl cofounder ceo lea petrášová belief app shes helped create opensource kycfree peertopeer bitcoin marketplace essential helping preserve bitcoins essential quality,0.5106,0.0,0.2553
RSS,https://bitcoinmagazine.com/.rss/full/,2024-10-08 13:00:00+00:00,2024-10-22 12:19:07.094288,shinobi stop demonizing developer nonsensea quick take latest reason people yelling bitcoin core developer,-0.296,0.41666666666666663,0.06033333333333332
RSS,https://bitcoinmagazine.com/.rss/full/,2024-10-08 12:07:44+00:00,2024-10-22 12:19:07.094288,reminder update bitcoin wallet firmwarelive digital device bitcoin hardware wallet infallible require routine upkeep least wellkept seed phrase,0.0,-0.15,-0.075
RSS,https://bitcoinmagazine.com/.rss/full/,2024-10-07 18:42:05+00:00,2024-10-22 12:19:07.094288,trump presidency best outcome bitcoin nikolaustrump would allow friendly regulatory environment bitcoiners thrive,0.8519,0.6875,0.7697
RSS,https://bitcoinmagazine.com/.rss/full/,2024-10-05 12:26:18+00:00,2024-10-22 12:19:07.094288,uncle jack chili good bitcoina selfproclaimed bitcoin pleb actual brain surgeon dr jack kruse sauce want everyone try,0.4939,0.35,0.42195
RSS,https://bitcoinmagazine.com/.rss/full/,2024-10-05 00:18:02+00:00,2024-10-22 12:19:07.094288,corva want greater adoption bitcoin use fix problemsfollow lead bitcoin ekasis hermann vivier motivs rich swisher,0.7506,0.4375,0.59405
RSS,https://bitcoinmagazine.com/.rss/full/,2024-10-04 15:37:05+00:00,2024-10-22 12:19:07.094288,positive end 2024 bitcoinoptimism ahead q4 2024 deliver bitcoins next big rally,0.5574,0.07575757575757576,0.3165787878787879
RSS,https://bitcoinmagazine.com/.rss/full/,2024-10-04 15:20:11+00:00,2024-10-22 12:19:07.094288,bitcoin magazine introduces new short form opinion format takesthe oldest trusted bitcoin publication introducing new shortform content format,0.4767,0.0909090909090909,0.2838045454545455
RSS,https://bitcoinmagazine.com/.rss/full/,2024-10-04 14:46:41+00:00,2024-10-22 12:19:07.094288,wont find satoshi nakamoto next weekas longtime bitcoiner im certain latest satoshi nakamoto unmasking attempt disappoint like rest real proof provided,0.2263,0.2285714285714286,0.2274357142857143
RSS,https://bitcoinmagazine.com/.rss/full/,2024-10-03 18:17:53+00:00,2024-10-22 12:19:07.094288,aaron trump give damn bitcointrump providing lip service bitcoiners mean continue ally bitcoin get elected second term,-0.4019,-0.15625,-0.27907499999999996
RSS,https://bitcoinmagazine.com/.rss/full/,2024-10-03 15:40:52+00:00,2024-10-22 12:19:07.094288,frank bitcoina seemingly contradictory yet profound message jeff booth,-0.34,0.08333333333333333,-0.12833333333333335
RSS,https://bitcoinmagazine.com/.rss/full/,2024-10-03 14:39:59+00:00,2024-10-22 12:19:07.094288,wall street isnt bitcoin crypto etf comingwall street want sell product make u dollar continue thing make dollar,0.0772,0.0,0.0386
RSS,https://bitcoinmagazine.com/.rss/full/,2024-10-03 12:50:17+00:00,2024-10-22 12:19:07.094288,vivek bitcoin lightning payment long way go indiai couldnt resist lightning fast fiat payment network india,0.0,0.07500000000000001,0.037500000000000006
RSS,https://bitcoinmagazine.com/.rss/full/,2024-10-02 18:04:05+00:00,2024-10-22 12:19:07.094288,offchain protocol always balancing actimportant thing consider looking future offchain system,0.0,0.0,0.0
RSS,https://bitcoinmagazine.com/.rss/full/,2024-10-02 14:42:48+00:00,2024-10-22 12:19:07.094288,1000 faraday backpack protect bitcointhe slnt submersible faraday backpack may bit splurge feature bitcoin privacy expert could want,0.4404,0.0,0.2202
RSS,https://bitcoinmagazine.com/.rss/full/,2024-10-02 13:14:50+00:00,2024-10-22 12:19:07.094288,vivek unsurprisingly bitcoin price follows global liquiditybitcoins siren ringing loudly liquiditydriven boom may soon underway,0.0,0.05,0.025
RSS,https://bitcoinmagazine.com/.rss/full/,2024-10-01 21:08:32+00:00,2024-10-22 12:19:07.094288,retail keep selling bitcoin etf dont sell btc whalesspot bitcoin etf bitcoin accumulation rampage,0.0,0.0,0.0
RSS,https://bitcoinmagazine.com/.rss/full/,2024-10-01 16:43:38+00:00,2024-10-22 12:19:07.094288,lesson running bitrefill premier bitcoin ecommerce platform10 year ago sergej kotliar set help people easily spend bitcoin everyday item task still come number challenge taught many lesson,0.6908,0.24444444444444446,0.4676222222222222
RSS,https://bitcoinmagazine.com/.rss/full/,2024-10-01 11:15:56+00:00,2024-10-22 12:19:07.094288,rizzo satoshi nakamotos new mysteryits 2024 there new mystery surfacing around bitcoins creator satoshi nakamoto time relating mining activity 2009,0.0,0.13636363636363635,0.06818181818181818
RSS,https://bitcoinmagazine.com/.rss/full/,2024-09-30 17:28:43+00:00,2024-10-22 12:19:07.094288,ocean datum tackling bitcoins pressing problemoceans datum since weekend putting transaction selection back hand hashers benefiting bitcoins censorship resistance,0.4939,0.0,0.24695
RSS,https://bitcoinmagazine.com/.rss/full/,2024-09-30 16:44:27+00:00,2024-10-22 12:19:07.094288,inside lebanon currency crisis hyperinflation feelsa look lived experience going hyperinflation lebanon,-0.6249,0.0,-0.31245
RSS,https://bitcoinist.com/feed/,2024-10-22 11:00:26+00:00,2024-10-22 12:19:07.094288,bitcoin key indicator turn bullish spot etf record 21 billion weekly inflow new ath imminenta crucial momentum indicator bitcoin btc turned positive premier cryptocurrency attracted 21 billion spot exchangetraded fund etf weekly net inflow new bitcoin alltimehigh sight bitcoin could heading new alltime high ath price moving average convergence divergence macd histogram turned positive,0.875,0.08736363636363637,0.48118181818181816
RSS,https://bitcoinist.com/feed/,2024-10-22 09:30:24+00:00,2024-10-22 12:19:07.094288,crypto investor beware binance founder warns x user fake cz accountsbinance cofounder changpeng zhao recently warned crypto community wave fake social medium account targeting investor former ceo also known cz called x team urging efficient fake account related reading u attorney general ask biden act binance exec detention nigeria binance,-0.8885,-0.17708333333333334,-0.5327916666666667
RSS,https://bitcoinist.com/feed/,2024-10-22 08:00:32+00:00,2024-10-22 12:19:07.094288,elon musk back proxrp lawyer john deaton senate race elizabeth warrenwith u general election 15 day away elon musk ceo tesla prominent supporter dogecoin throwing weight political fray recent endorsement proxrp lawyer john deaton running senate seat massachusetts senator elizabeth warren known anticrypto stance musk,0.6908,0.11000000000000001,0.4004
RSS,https://bitcoinist.com/feed/,2024-10-22 05:00:20+00:00,2024-10-22 12:19:07.094288,solana post volume ethereum layer2s 200 incomingsolana emerging one active network looking engagement level past month despite concern around ftx whether asset distribution lead dump bull optimistic lie ahead holder expect sol price climb higher coming day multiple reason,0.7845,-0.033333333333333326,0.3755833333333333
RSS,https://bitcoinist.com/feed/,2024-10-22 03:30:21+00:00,2024-10-22 12:19:07.094288,bitcoin accumulation hit 29 million btc preparation massive rally beguncryptoquant analyst burak kesmecis recent report revealed significant notable rise bitcoin accumulation address surpasses 29 million btc address steadily increased holding without selling despite market uncertainty doubling bitcoin reserve 10 month trend highlight broader market sentiment longterm investor individual,0.7458,0.17361111111111113,0.4597055555555556
RSS,https://bitcoinist.com/feed/,2024-10-22 02:00:09+00:00,2024-10-22 12:19:07.094288,critical bitcoin indicator flip bullish onchain data confirms btc uptrendbitcoin surged 69000 marking significant milestone two week impressive gain since october 10 price increased 17 positioning test previous alltime high around 73000 set march resurgence come pivotal moment key data glassnode indicates shift,0.8074,0.26690476190476187,0.5371523809523809
RSS,https://bitcoinist.com/feed/,2024-10-22 00:30:16+00:00,2024-10-22 12:19:07.094288,analyst predicts dogecoin price double 037 timeline shock youanalyst crypto universe predicted dogecoin price enjoy gain 100 rise 037 prediction undoubtedly look feasible timeline said would happen caught crypto community attention dogecoin price reach 037 crypto universe stated,0.6249,0.2,0.41245
RSS,https://bitcoinist.com/feed/,2024-10-21 23:00:37+00:00,2024-10-22 12:19:07.094288,uk regulator justifies tough crypto crackdown amid industry pushbackthe uk financial regulatory agency stick decision continue implementing stringent rule registration process business involved cryptocurrencies financial conduct authority fca asserted uk tough regulation crypto firm serve deterrence prevent company becoming conduit money laundering activity related reading crypto,-0.1531,-0.07539682539682542,-0.11424841269841271
