MainSource,Source,Publication Date,Pull_date,Pre-Processed Text,Sentiment_Vader,Sentiment_TextBlob,Average_Sentiment
Reddit,solana,2025-02-17 23:26:31,2025-02-19 00:53:02.675086,introducing sonic mobius hackthon first svm hackathon solanasource httpsxcomsonicsvmstatus1891502924183769090httpsxcomsonicsvmstatus1891502924183769090 introducing sonic mobius hackthon first svm hackathon solana 1000000 cash prize pool global online 4 main track feb17th mar17th detail track unleash multisvm universe solanahttpsxcomsolana httpsredditcomlink1iry8nwvideoyytj5g4s9sje1player get started httpshackathonsonicgamehttpstcox4djcxgyb4 sonic mobius hackathon supported solanafndnhttpsxcomsolanafndn solana_zhhttpsxcomsolana_zh sendaifunhttpsxcomsendaifun send_arcadehttpsxcomsend_arcade digimon_techhttpsxcomdigimon_tech mira_networkhttpsxcommira_network sky9capitalhttpsxcomsky9capital bigbrainvchttpsxcombigbrainvc okx_ventureshttpsxcomokx_ventures beosin_comhttpsxcombeosin_com upcoming sponsor special thanks support superteams superteamvnhttpsxcomsuperteamvn superteamfrancehttpsxcomsuperteamfrance superteamukhttpsxcomsuperteamuk superteamkoreahttpsxcomsuperteamkorea superteamphlhttpsxcomsuperteamphl superteamjapanhttpsxcomsuperteamjapan superteamnghttpsxcomsuperteamng superteammyhttpsxcomsuperteammy superteampolhttpsxcomsuperteampol superteamblknhttpsxcomsuperteamblkn etc sonic mobius hackathon first svm hackathon designed multisvm universe builder participate launch sonic svm mainnet first svm launch solana game application hackathon 4 key track sonic svm ecosystem attention capital market defi ai gaming prize pool totaling 1 million comprises 500000 sonichttpsxcomsearchq24sonicsrccashtag_click token 500000 stablecoins potential sonic ecofund investment opportunity also grab detail httpshackathonsonicgamehttpstcox4djcxgyb4,0.9584,0.12034632034632033,0.5393731601731602
Reddit,solana,2025-02-16 15:12:51,2025-02-19 00:53:02.675086,guy find buy coin early 6 month newbie read post somebody found bought elon coin hit dexscreener looking next use kraken right hold btc kaspa recs second exchange dont want swapping yet dont skill ball motivated,-0.4023,0.09642857142857142,-0.15293571428571429
Reddit,solana,2025-02-17 15:14:23,2025-02-19 00:53:02.675086,auto buy unlisted tokenive got ca unlisted token see solscan cant buy yet auto buy launch bot recommend token private mode type dexscreener phantom saying adress,0.3612,0.0,0.1806
Reddit,solana,2025-02-17 21:49:52,2025-02-19 00:53:02.675086,solana snapshot ethdenver 2025 thursday february 27 1030 630 pm mstsource httpsxcomallmight_usstatus1891522050461704390httpsxcomallmight_usstatus1891522050461704390 reminder 10 day away biggest solana event ethdenver 2025 day solanahttpsxcomsolana entirely powered community featuring temporal_xyzhttpsxcomtemporal_xyz arciumhqhttpsxcomarciumhq wormholehttpsxcomwormhole jito_solhttpsxcomjito_sol pipenetworkhttpsxcompipenetwork sonicsvmhttpsxcomsonicsvm dflowprotocolhttpsxcomdflowprotocol anza_xyzhttpsxcomanza_xyz httpspreviewredditv4pcte6esrje1pngwidth680formatpngautowebps01235802d7fddd9bc835eecfc63a9b9351af7cc2 allmight_ushttpsxcomallmight_us solayer_labshttpsxcomsolayer_labs eclipsefndhttpsxcomeclipsefnd boundless_xyzhttpsxcomboundless_xyz certorainchttpsxcomcertorainc cosmoshttpsxcomcosmos crypticbrokerhttpsxcomcrypticbroker multichaininchttpsxcommultichaininc multicoincaphttpsxcommulticoincap pyefinancehttpsxcompyefinance pythnetworkhttpsxcompythnetwork solblaze_orghttpsxcomsolblaze_org tarsprotocolhttpsxcomtarsprotocol graphprotocolhttpsxcomgraphprotocol register httpslumasolanasnapshotethdenverhttpslumasolanasnapshotethdenver httpspreviewreddit7ay98x9qsrje1pngwidth680formatpngautowebps690ff8e896be868f9cb7ace0b15b999761340b95 event join u ethdenver 2025 solana snapshot explore solanas latest blockchain technology infrastructure crosschain capability full day keynote panel coworking networking happy hour title partner temporalhttpsxcomtemporal_xyz presenting partner arciumhttpsxcomarciumhq solayerhttpsxcomsolayer_labs wormholehttpsxcomwormhole jitohttpsxcomjito_sol pipe networkhttpsxcompipenetwork sonic svmhttpsxcomsonicsvm supporting partner dflowhttpsxcomdflowprotocol anzahttpsxcomanza_xyz eclipsehttpsxcomeclipsefnd solanahttpsxcomsolana soonhttpsxcomsoon_svm partner aztechttpsxcomaztecnetwork boundlesshttpsxcomboundless_xyz certorahttpsxcomcertorainc cosmoshttpsxcomcosmos cracked labshttpsxcomcracked_labs cryptic brokerhttpsxcomcrypticbroker multichain advisorshttpsxcommultichaininc multicoin capitalhttpsxcommulticoincap orbithttpsxcomorbitcryptoai pyehttpsxcompyefinance pyth networkhttpsxcompythnetwork risc zerohttpsxcomrisczero romehttpsxcomromeprotocol solblaze httpsxcomsolblaze_org tarshttpsxcomtarsprotocol graphhttpsxcomgraphprotocol partner speaker agenda coming soon interested becoming partner reach tg umrmarcrose solana snapshot consensus 2024 httpswwwyoutubecomwatchviz1dtf5fjkghttpswwwyoutubecomwatchviz1dtf5fjkg httpspreviewredditbzdc1htssrje1pngwidth556formatpngautowebps0e907a417a5df63a011f73342460bd951450de7a,0.891,0.37142857142857144,0.6312142857142857
Reddit,solana,2025-02-17 21:19:05,2025-02-19 00:53:02.675086,introducing gill new javascripttypescript client library interact solana blockchainsource httpsxcomnickfrostystatus1891588509128888432httpsxcomnickfrostystatus1891588509128888432 introducing gill new javascripttypescript client library interact solanahttpsxcomsolana blockchain fully compatible web3js v2 tree shakable lightweight numerous quality life improvement devs let dive httpspreviewredditulw4igb9lrje1pngwidth680formatpngautowebps3e1f1ea44eaa5d3eb03a9233d28a8bb5ec450374 1 checkout readme detailed httpsgithubcomsolanafoundationgilltabreadmeovfilehttpsgithubcomsolanafoundationgilltabreadmeovfile overview quick start code snippet load example come plus cute fish httpspreviewreddit8d82swwblrje1pngwidth680formatpngautowebpsf4d06c84eb9528e72d3029903ef6fef2e6ff81d8 2 web3js v2 great verbose everything unopinionated design long function name hyper modular subpackages fully tree shakable piece everything together know get gill 3 gill built top amazing modular library anza_xyzhttpsxcomanza_xyz lightly opinionated abstraction top web3js v2 order improve devex v2 fully compatible easier adoption curve escape hatch get low level wantneed p huge engineer anza built beast new modern primitive ecosystem httpspreviewredditubvinhfglrje1pngwidth680formatpngautowebpsc433040b1f652444e4be77c974b2ca7c020acaf0 4 gill provides single entry point web3js v2 popular spl program system compute budget memo token token22 popular ecosystem program metaplexhttpsxcommetaplexs token metadata others follow easy use abstraction top escape hatch get lower level wantneed enough talk show code httpspreviewredditpzlewycjlrje1pngwidth680formatpngautowebps9bcc49c7fc060795e700947e68490aa35a8454fd 5 creating connection createsolanaclient immediate access rpc rpcsubscriptions websockets connection ready use sendandconfirmtransaction use public endpoint moniker mainnet testnet devnet even localnet use private url course recommended production 6 making rpc call web3js v2 follow new pattern sending request rpc provider getslot getaccountinfo getlatestblockhash getminimumbalanceforrentexemption gill something special network call httpspreviewreddit9m5evtmtlrje1pngwidth679formatpngautowebps2dd73f6afb7ffc362d7b77e53e3ef36187272fe1 7 easily create transaction createtransaction web3js v2 verbose create transaction gill provides single function accepts standard transaction params feepayer address signer easily include compute unit limit instruction easily include compute unit price instruction fully typed version set latest blockhash httpspreviewredditm42s2xtxlrje1pngwidth680formatpngautowebps89566b9bf08e6502d1aa9367a99e94480ef1f8fe 8 signing sending transaction signable transaction includes latest blockhash signer sign signtransactionmessagewithsigners get signature getsignaturefromtransaction even sending network use sendandconfirmtransaction send default commitmentconfirmed httpspreviewredditawm0v1g0mrje1pngwidth680formatpngautowebps56e25db924de483f71f880350c007c2cca923446 9 think gill simpler use worse feature missing let talk httpsgithubcomsolanafoundationgillissueshttpsgithubcomsolanafoundationgillissues let know tagging nickfrostyhttpsxcomnickfrosty twitter opening issue directly repo common transaction gill help httpspreviewredditfbl0yyx5mrje1pngwidth680formatpngautowebps9396bb6f9e685d5b0c8393fe43a27ee8054bd8cd 10 gill ship transaction builder help easily assemble readytosign transaction common task creating token metadata using either token token22 mint token user including auto creating ata many come p want see specific one tag open issue gill repo discus httpsgithubcomsolanafoundationgilltabreadmeovfiletransactionbuildershttpsgithubcomsolanafoundationgilltabreadmeovfiletransactionbuilders 11 transaction create new token metadata buildcreatetokentransaction people like token creates full transaction creates token mint initializes onchain metadata either via token22 extension umetaplexhttpsxcommetaplexs token metadata setsrecommends reasonable default compute unit limit easily override cu limit andor price instruction support token program httpspreviewredditdnk3d0bcmrje1pngwidth680formatpngautowebpsbe4da6f83c698ea1bcf7f14b1c66355884944f38 12 transaction mint token wallet buildminttokenstransaction people want token creates full transaction mint token directly destination wallet auto creates associated token account setsrecommends reasonable default compute unit limit easily override cu limit andor price instruction support token program httpspreviewredditqseh7nmgmrje1pngwidth680formatpngautowebpsb811e7bb783ff3883c73100346400898c61b0a48 13 since transaction builder scoped single task set recommended default compute unit limit easily overridable course optimize transaction improve landing rate builder may everyone though gill also ship instruction builder still manually craft escape hatch accept relevant input return array instruction task hand getcreatetokeninstructions getminttokensinstructions etc 14 remember mentioned getminimumbalanceforrentexemption earlier since solanahttpsxcomsolana runtime calculates min rent value based static value need make network call get value calculate thats exactly importable function calculates min rent without network call check useful tid bit gill ship especially love debug mode httpspreviewredditiij8y4qlmrje1pngwidth680formatpngautowebpsedbdd71c0a5743eaa47d2101ab8003318b0b967d 15 need keypair signer load one local filesystem loadkeypairsignerfromfile default function load wallet keypair stored file used solana cli configsolanaidjson yes function also resolve relative path use character user home dir httpspreviewreddithnavlkqomrje1pngwidth679formatpngautowebps54579c9f4fc78a9f2fc613adecd16111c60d013f 16 favorite debug mode troubleshooting solana transaction hard annoying gill debug mode first thing included make easier enabled log level debug sendandconfirmtransaction auto log following explorer link view transaction serialized base64 transaction inspect solana explorer inspector httpsexplorersolanacomtxinspectorhttpstcozwrzosedqk greatly assist troubleshooting effort especially since anyone enable frontend apps directly browser console else would help debug codetransactions would debug log helpful httpspreviewreddit7e2gj2grmrje1pngwidth680formatpngautowebps9f78662fcf32a0a7626aecb4cb46a102600a94b9 17 interested using gill right give shot take spin stay tuned complete 25min video detailed overview using gill new javascript client work happy coding frens httpspreviewredditif7h6m82nrje1pngwidth680formatpngautowebps12b9002d8c0dc4129ace71ed218297648b2e381c,0.999,0.2314011544011544,0.6152005772005772
Reddit,solana,2025-02-17 21:15:38,2025-02-19 00:53:02.675086,easycoinlaunch coinfastthose new raydium token creation platform become increasingly popular recently im seeing dozen new one every day guy even make,0.5994,0.21818181818181817,0.4087909090909091
Reddit,solana,2025-02-17 02:54:37,2025-02-19 00:53:02.675086,cant pumpfun lock dev coin launchquite literally help solve rug pulling lot dev wallettransferred coin dev wallet sniper etc sell certain percentage coin rest locked adjusted amount amount time based volatilityother metric coin could set detected insider maybe could pull put rest need stay regulation vcs one company ipo didnt exist stock market would difference volatility ipopenny stock easy yet pumpfun doesnt obvious reason isnt even decentralized argument dev selling coin 10min launch entire industry imploding institution like pumpfun problem deeper cabal,0.8559,0.1619047619047619,0.5089023809523809
Reddit,solana,2025-02-17 20:07:30,2025-02-19 00:53:02.675086,anyone find apr staking sol ledger went 112 10 something couple day laterthat would really cool stayed high next year least ledger say mistake really going g give much,0.0498,0.10166666666666668,0.07573333333333335
Reddit,solana,2025-02-17 11:14:12,2025-02-19 00:53:02.675086,guy really understand whole influencercopytrading schemei see sentiment spread lot dont think many new trader actually understand lose money think random memecoin nerd focused farming engagement theyre roping people create liquidity see shit like personal telegram group speak post thing like 100 reacts drop next play theyre literally waiting 100 people paying attention drop ca nuke face theyre focused building community even cheating win rate main wallet really simple reason go look cupseys trade history buy copytraders time react he selling actually blatant cented streamer say copytrade save face damn well know people still going theyre going nuke regardless stop cant recreate success home precisely dont thousand people following trade reason dont fool thinking anything,0.6134,0.09393939393939396,0.35366969696969697
Reddit,solana,2025-02-17 23:10:53,2025-02-19 00:53:02.675086,introducing forma sri lanka march 21 april 4 2week popup village valuesaligned internet talent solana community beyondsource httpsxcomformacitystatus1891516488395190405httpsxcomformacitystatus1891516488395190405 next dubai south asia easy visa ppl 190 country new special economic zone w 0 income tax high quality life tier beach surf spot meet sri lanka new home digital nomad httpsredditcomlink1irxvwavideorm3fip5s6sje1player curious join u 2 week popup 150 spot open httpsformacitypopupssrilankahttpsformacitypopupssrilanka httpspreviewredditp1azu1ml6sje1pngwidth680formatpngautowebps7952f3f8a36c3576812a67bdda10d0415ed2de63,0.8979,0.1323203463203463,0.5151101731601732
Reddit,solana,2025-02-17 15:26:09,2025-02-19 00:53:02.675086,libra token scam help wake upswith dex meme pump dump trend showing one fail another clear wont see trend last reign notorious crypto history book anything recent libra situation help add shift away useless coin major way actually im proponent apponent situation whatever help btcaltcoin market end sol great potential hopefully trend doesnt push back altcoin realness investment come theyre future,0.25,-0.003409090909090907,0.12329545454545454
Reddit,solana,2025-02-17 19:08:31,2025-02-19 00:53:02.675086,bullx deprecated feb 23 need advicewill respond dm bullx wallet see msg letting know deprecated favor bullx neo feb 23 private key private key import phatomneo bullx fund safe original bullx deprecated also bullx neo seem support base chain migrate base chain coin original bullx recommendation wallet ignoring dm,0.8481,-0.038888888888888896,0.40460555555555555
Reddit,solana,2025-02-17 18:04:20,2025-02-19 00:53:02.675086,adding metadata coinim using solana cli develop coin portfolio project ive created token minted supply im lot trouble adding metadatajson file token ive used multiple ai help nothing working also cant find anything online work help would highly appreciated,0.807,0.0,0.4035
Reddit,solana,2025-02-17 17:51:40,2025-02-19 00:53:02.675086,there cry casin,-0.4767,0.0,-0.23835
Reddit,solana,2025-02-17 14:04:18,2025-02-19 00:53:02.675086,im trying buy new token second created unable soim kind new crypto basically trying swap memecoins im 100 sure get rugpulled im trying first one get finding right token address seems like cant buy im guessing token creator sort preventative measure stop tried jupiter raydium etc give error,0.6486,0.17605519480519477,0.4123275974025974
Reddit,solana,2025-02-16 12:31:41,2025-02-19 00:53:02.675086,struggling small gain neo bullx tip trade size fee settingshey fellow trader ive using neo bullx im happy say ive winning trade issue im facing im trading size 02 factoring fee slippage etc im really seeing kind profit id expect im curious know 1 whats good recommended trade size aim 02 small decent return especially fee 2 tip gas fee setting help optimize trade want make sure im losing transaction cost 3 im currently using autosell 20 50 strategy good strategy would recommend different setting better result 4 general tip insight improve learning curve would greatly appreciated looking forward thought thanks advance,0.9918,0.25092592592592594,0.621362962962963
Reddit,solana,2025-02-17 17:12:14,2025-02-19 00:53:02.675086,phantom wallet badwhy data phantom always lagged market cap number holder never correct often even close accurate,-0.2263,0.4000000000000001,0.08685000000000004
Reddit,solana,2025-02-17 17:04:03,2025-02-19 00:53:02.675086,yeah im new research impossible nowadays bot made moneywith influx newcomer way much noise need tried true bot made money still help catch get moving ive spinning wheel last week thanks,0.8625,0.03661616161616162,0.44955808080808085
Reddit,solana,2025-02-16 23:14:49,2025-02-19 00:53:02.675086,launch pump devbuy another bot manages buy mei minted token pump today set devbuy amount 1sol soon minted bot buy 05 sol worth devbuy amount prevent going forward let say dev buy amount 10 sol,0.25,0.3,0.275
Reddit,solana,2025-02-17 16:21:15,2025-02-19 00:53:02.675086,libra token scam get publikly disclosed insider founder expose dirty job executed behind scenespremise hayden davis kelsier one big four creator libra along julian peh kip protocol mauricio novelli tech forum argentina manuel godoy tech forum argentina endorsed javier milei february 14th 2025 guy think recent development disclosing harsh true influencers participation high government official samming thousand retailer staggering amount 100 million user fund stolen short video clip cover essential full interview httpsxcomcoinbureaustatus1891363688705036689s46tvmukulbwixcjimpfnazc5whttpsxcomcoinbureaustatus1891363688705036689s46tvmukulbwixcjimpfnazc5w full interview httpswwwyoutubecomwatchfeaturesharedveqizjtbxaemhttpswwwyoutubecomwatchfeaturesharedveqizjtbxaem onchain bubblemaps analysis httpsxcombubblemapsstatus1891289507338580028httpsxcombubblemapsstatus1891289507338580028 genuinely interested hear opinion regarding current situation bit alarming solana chain especially considering thing seems occur often recently international level targeting also high government profile like president argentina could potentially affect presidency well consequence could derive,-0.5719,0.017777777777777778,-0.2770611111111111
Reddit,solana,2025-02-17 15:26:59,2025-02-19 00:53:02.675086,jupiter exchange denies involvement libra token crash solana meme coin plummet 90,-0.6705,0.0,-0.33525
Reddit,solana,2025-02-17 08:13:55,2025-02-19 00:53:02.675086,cant unstake solso basically staked amount like 2 week ago still cant withdraw problem wallet id gxqnazk7vdkyyf8e3hotklkh6wgukwk9zchugcbzytp3,0.5801,0.0,0.29005
Reddit,solana,2025-02-17 19:40:07,2025-02-19 00:53:02.675086,get ahead meme make moneyi using app called vector let see new pumpfun coin launched also let see coin migrated app inapp trading quick buying people making huge money app invite every big kol know using feature allows see kol bought sold coin like social app trading see whats trending people buying good ahead curve dont want trade use see people buying download via app store called vector trading meme invite code yotsdcl ucpkjge asavdcn oztidio hiikhbv bwskvaa rfkbspd cfkzyxx nzwjtto fupdjim,0.8473,0.26717171717171717,0.5572358585858586
Reddit,ethereum,2025-02-16 06:01:17,2025-02-19 00:53:02.675086,weekly discussion thread buildinghello rethereumhttpswwwredditcomrethereum welcome weekly discussion thread building space developer entrepreneur enthusiast showcase project share idea seek feedback greater ethereum community share project whether youre developing decentralized application dapp launching new layer 2 network working ethereum infrastructure encourage share detail project please provide concise overview including purpose current status link information provide xtwitter youtube link post automatically filtered engage collaborate thread excellent opportunity connect likeminded individual application tester feel free ask question offer feedback seek collaboration safety reminder encourage sharing collaboration please cautious potential scam avoid connecting wallet unfamiliar application without thorough research utilizing wallet tool offer transaction simulation eg rabby walletguard help ensure safety fund never give seed phrase private key looking forward hearing pushing ethereum ecosystem forward,0.9908,0.26694214876033057,0.6288710743801653
Reddit,ethereum,2025-02-18 07:01:26,2025-02-19 00:53:02.675086,daily general discussion february 18 2025welcome ethereum daily general discussion rethereum httpsimgurcom3y7vezphttpsimgurcom3y7vezp bookmarking link always bring current daily httpsoldredditcomrethereumaboutstickynum2httpsoldredditcomrethereumaboutstickynum2 please use thread discus ethereum topic news event even price price discussion posted elsewhere subreddit continue removed always constructive subreddit ruleshttpswwwredditcomrethereumaboutrules want stake learn rethstaker ethfinance ethereum community link ethereum jobshttpsethereumorgencommunitygetinvolvedethereumjobs twitterhttpsxcomethereum evmavericks youtubehttpswwwyoutubecomevmavericks discordhttpsdiscordggevmavericks doots podcasthttpsevmaverickslibsyncom doots websitehttpsdailydootscom old reddit doots extensionhttpsgithubcometheralphaethfinanceextension uhanniabu calendar feb 23 mar 2 ethdenverhttpswwwethdenvercom mar 2830 eth pondyhttpswwwethpondyxyz puducherry hackathon apr 13 ey global blockchain summit person virtual,0.3818,0.025000000000000005,0.2034
Reddit,ethereum,2025-02-18 02:58:18,2025-02-19 00:53:02.675086,tried open bank account foreign country realized good ethereumim new country trying open bank account buy asset live let tell ya quite challenge asked official local document take month thousand dollar get asked proof source income extensive receipt sure im financial terrorist im put strict limit use 1000 dollar month get comfortable know raise limit time make significant transfer 5k give call question dont know im money treating like grown baby compare ethereum got ta get wallet ether inside use without anyone questioning treating dangerous individual night day never go back traditional financial system experience crypto constantly watching reporting 3 letter agency bit suspicious activity bank account plus extremely easy get bank account banned ask million revolut user didnt get money back let appreciate good continue make accessible people convert crypto fiat local use viceversa,0.8652,0.13178524374176548,0.4984926218708827
Reddit,ethereum,2025-02-18 14:23:31,2025-02-19 00:53:02.675086,pectra network upgrade ethereum testnets preparation listthe pectra network upgrade scheduled activate ethereum testnets holesky epoch 115968 feb 24 2155 utc sepolia epoch 222464 mar 5 729 utc ensure youre fully prepared pectra upgrade here handy cheat list essential information need know info pertains ethereum testnets full announcement httpsblogethereumorg20250214pectratestnetannouncementhttpsblogethereumorg20250214pectratestnetannouncement httpspreviewredditzigxqj7rpwje1pngwidth1943formatpngautowebpsd7d48facdfe779f9c137db719d6f30c730709bc9,0.2006,0.31666666666666665,0.2586333333333333
Reddit,ethereum,2025-02-18 18:47:17,2025-02-19 00:53:02.675086,ethereum validators need update geth avoid financial risk,-0.5106,0.0,-0.2553
Reddit,ethereum,2025-02-18 19:03:31,2025-02-19 00:53:02.675086,acde 205 let fusaka scoping discussion begin summaryacde 205 let fusaka scoping discussion begin youtube linkhttpswwwyoutubecomwatchvhgkvtaazyf4 petra testnet timeline confirmed feb 24 first testnet upgrade march 5 final testnet mainnet fusaka scoping debate begin petra nearly done developer debating fusaka include key topic pieras eof many suggest keeping fusaka focused improvement governance challenge differing view upgrade scope spark lively discussion better testing standard devs want improve upgrade reliability balancing workload,0.9413,0.20959595959595959,0.5754479797979798
Reddit,ethereum,2025-02-18 06:40:04,2025-02-19 00:53:02.675086,ethereums beam initiative rebranded,0.0,0.0,0.0
