MainSource,Source,Publication Date,Pull_date,Pre-Processed Text,Sentiment_Vader,Sentiment_TextBlob,Average_Sentiment
RSS,https://cointelegraph.com/rss,2025-01-20 12:14:14+00:00,2025-01-20 12:18:29.171073,crypto etps see 22b inflow amid trump inauguration euphoria euphoria around inauguration u presidentelect donald trump drove massive 22 billion inflow crypto etps last week,0.8625,0.0,0.43125
RSS,https://cointelegraph.com/rss,2025-01-20 11:36:00+00:00,2025-01-20 12:18:29.171073,trump ushering new era memecoins analyst call altseason trump family token may set precedent memecoin investing attract retail interest cryptocurrencies bitcoin ether,0.6705,0.13636363636363635,0.40343181818181817
RSS,https://cointelegraph.com/rss,2025-01-20 11:00:00+00:00,2025-01-20 12:18:29.171073,winklevoss twin gemini exchange selects malta europe mica hub biggest challenge mica compliance allocating resource build required infrastructure gemini head europe said,0.0772,0.0,0.0386
RSS,https://cointelegraph.com/rss,2025-01-20 10:45:00+00:00,2025-01-20 12:18:29.171073,buy bitcoin south africa buying bitcoin south africa involves choosing reputable exchange verifying identity depositing fund placing order securing bitcoin personal wallet,0.3182,0.25,0.2841
RSS,https://cointelegraph.com/rss,2025-01-20 10:10:11+00:00,2025-01-20 12:18:29.171073,world liberty financial secures trumprelated en domain name one crypto community member speculated trump family may planning ahead another said move solves trump family memecoin puzzle,0.7783,0.0,0.38915
RSS,https://cointelegraph.com/rss,2025-01-20 10:00:00+00:00,2025-01-20 12:18:29.171073,hashgraph association partner taurus global hbar custody push hashgraph association partnered taurus advance secure custody staking tokenizing hedera hbar cryptocurrency globally,0.34,0.13333333333333333,0.2366666666666667
RSS,https://cointelegraph.com/rss,2025-01-20 09:39:07+00:00,2025-01-20 12:18:29.171073,solana user hit delay trump memecoins debut despite mainstream appeal distribution trump memecoins flashing red flag investor looking longterm opportunity,0.128,0.0,0.064
RSS,https://cointelegraph.com/rss,2025-01-20 09:38:29+00:00,2025-01-20 12:18:29.171073,99k trump 039plunge protection039 5 thing know bitcoin week bitcoin take cue u presidentelect donald trump inauguration new btc price alltime high joining crypto volatility frenzy,-0.3182,0.1481818181818182,-0.0850090909090909
RSS,https://cointelegraph.com/rss,2025-01-20 08:37:06+00:00,2025-01-20 12:18:29.171073,bitcoin039s 10 039god candle039 hint 130k next analyst bitcoin printed god candle alltime high trader said good start interesting week,0.7717,0.33999999999999997,0.55585
RSS,https://cointelegraph.com/rss,2025-01-20 08:10:29+00:00,2025-01-20 12:18:29.171073,bitcoin defi take center stage wave new project innovation bringing increasing utility bitcoin ecosystem,0.3818,0.018181818181818174,0.19999090909090908
RSS,https://cointelegraph.com/rss,2025-01-20 07:52:48+00:00,2025-01-20 12:18:29.171073,bitcoin price today bitcoin price surged historical high hour ahead donald trump inauguration ceremony btc price chart suggest may climb 128000,0.0,0.08,0.04
RSS,https://cointelegraph.com/rss,2025-01-20 07:39:59+00:00,2025-01-20 12:18:29.171073,btc price nears 110k trump bitcoin reserve odds spike 60 btc price hit new alltime high latecomer party face real danger immediate unrealized loss bitcoin market analysis say,-0.4588,0.16545454545454547,-0.14667272727272726
RSS,https://cointelegraph.com/rss,2025-01-20 07:28:47+00:00,2025-01-20 12:18:29.171073,bitcoin hit new alltime high 109k ahead trump inauguration bitcoin briefly surged 109000 jan 20 breaking previous high 108000 recorded middecember 2024,0.0,0.05793939393939394,0.02896969696969697
RSS,https://cointelegraph.com/rss,2025-01-20 06:05:13+00:00,2025-01-20 12:18:29.171073,fdic accused omitting crypto pause letter coinbasebacked suit coinbase chief legal officer paul grewal accused fdic playing word game agency said searched pause letter specific time period,-0.2732,-0.06666666666666667,-0.16993333333333333
RSS,https://cointelegraph.com/rss,2025-01-20 05:22:14+00:00,2025-01-20 12:18:29.171073,trump world liberty financial sell markedup token soldout presale world liberty financial completed initial sale token 15 cent released hiking price 5 cent,0.7783,0.0,0.38915
RSS,https://cointelegraph.com/rss,2025-01-20 04:22:06+00:00,2025-01-20 12:18:29.171073,trump accused greed grifting backtoback memecoin launch donald melania trumpbacked memecoins launched weekend amassed combined value 15 billion,-0.25,0.0,-0.125
RSS,https://cointelegraph.com/rss,2025-01-20 03:20:11+00:00,2025-01-20 12:18:29.171073,crypto liquidation hit 1b 24 hour bitcoin plummet 400000 trader liquidated past 24 hour bitcoin plunged back 100000,0.0,-0.125,-0.0625
RSS,https://cointelegraph.com/rss,2025-01-20 03:06:23+00:00,2025-01-20 12:18:29.171073,trump crypto project buy 48m eth token strengthens v bitcoin trump crypto business world liberty financial bought million worth ether past day token slightly strengthened bitcoin,0.8692,-0.029166666666666667,0.42001666666666665
RSS,https://cointelegraph.com/rss,2025-01-19 21:52:25+00:00,2025-01-20 12:18:29.171073,donald trump memecoin drop 38 wife melania launch token melania trump launched memecoin husband trump token hit 15 billion peak valuation falling nearly 40,-0.296,0.1,-0.09799999999999999
RSS,https://cointelegraph.com/rss,2025-01-19 21:42:55+00:00,2025-01-20 12:18:29.171073,here happened crypto today need know happened crypto today latest news daily trend event impacting bitcoin price blockchain defi nfts web3 crypto regulation,0.0,0.25,0.125
RSS,https://cointelegraph.com/rss,2025-01-19 21:11:58+00:00,2025-01-20 12:18:29.171073,buy crypto solana search volume surge amid trump meme frenzy many crypto influencers financial analyst characterized trump memecoin launch new era capital formation,-0.3182,0.21212121212121213,-0.05303939393939393
RSS,https://cointelegraph.com/rss,2025-01-19 20:44:59+00:00,2025-01-20 12:18:29.171073,official trump memecoin capture crypto market trading volume bitcoin prepares new high official trump memecoin aim price tripledigit range sol btc xrp algo xdc prepare breakout new alltime high,0.0,0.1481818181818182,0.0740909090909091
RSS,https://cointelegraph.com/rss,2025-01-19 18:59:28+00:00,2025-01-20 12:18:29.171073,ross ulbrichts odds pardoned trump rise 79 kalshi immense gratitude everyone voted president trump behalf silk road founder wrote november x post,0.6369,0.0,0.31845
RSS,https://cointelegraph.com/rss,2025-01-19 18:06:45+00:00,2025-01-20 12:18:29.171073,trump target 100b market cap arthur hayes call degens celebrate trump memecoin price could headed toward 100 inauguration presidentelect donald trump jan 20 bitmex cofounder suggests,0.5719,0.0,0.28595
RSS,https://cointelegraph.com/rss,2025-01-19 16:12:55+00:00,2025-01-20 12:18:29.171073,microstrategy039s saylor hint bitcoin buy 11th consecutive week microstrategys bitcoin holding currently valued approximately 473 billion company nearly 69 investment,0.4404,-0.10000000000000002,0.1702
RSS,https://cointelegraph.com/rss,2025-01-19 14:00:00+00:00,2025-01-20 12:18:29.171073,trump procrypto policy survive beyond administration presidentelect serve fouryear term oval office contested two new presidential candidate 2028,0.0,0.13636363636363635,0.06818181818181818
RSS,https://cointelegraph.com/rss,2025-01-19 13:58:00+00:00,2025-01-20 12:18:29.171073,trump memecoin hit top 15 worldwide 48 hour sparking tax cut rumor rumor surfaced potential crypto tax reform donald trump official memecoin trump hit 71 billion fully diluted value rise 15thlargest crypto world,0.3353,0.25,0.29264999999999997
RSS,https://cointelegraph.com/rss,2025-01-19 11:59:48+00:00,2025-01-20 12:18:29.171073,mad lad solana nfts jump 6th place amid trump memecoin buzz mad lad climb sixth place among top nfts market cap 1867 million solana hit 287 driven buzz around trump memecoin,-0.6808,-0.25,-0.4654
RSS,https://cointelegraph.com/rss,2025-01-19 09:45:17+00:00,2025-01-20 12:18:29.171073,bitcoin trader see 122k week btc price breakout loom bitcoin bull back btc price action lingers le 5000 alltime high,-0.2263,0.08666666666666667,-0.06981666666666667
RSS,https://cointelegraph.com/rss,2025-01-19 09:12:47+00:00,2025-01-20 12:18:29.171073,insider trading allegation surface trump memecoin flood solana dexs suspicious trading activity emerges around trump memecoin market cap soar 42 billion,-0.3612,0.0,-0.1806
RSS,https://bitcoinmagazine.com/.rss/full/,2025-01-19 17:27:03+00:00,2025-01-20 12:18:29.171073,trump like crypto long griftingtrump coin nothing way extract money crypto ecosystem,0.3612,-0.05,0.15560000000000002
RSS,https://bitcoinmagazine.com/.rss/full/,2025-01-17 17:55:41+00:00,2025-01-20 12:18:29.171073,president trump got bold vision bitcoin americaas president donald trump second term begin bitcoin community look bold promise bitcoin regulation national strategy economic growth whats storeand soon,0.8779,0.21666666666666667,0.5472833333333333
RSS,https://bitcoinmagazine.com/.rss/full/,2025-01-17 17:25:55+00:00,2025-01-20 12:18:29.171073,wyoming introduces bitcoin strategic reserve billa look bill proposed wyoming state level bitcoin strategic reserve,0.0,0.0,0.0
RSS,https://bitcoinmagazine.com/.rss/full/,2025-01-17 15:22:17+00:00,2025-01-20 12:18:29.171073,treat bitcoin tool cultignore mindless chanting slogan want bitcoin stack,0.0258,-0.2,-0.08710000000000001
RSS,https://bitcoinmagazine.com/.rss/full/,2025-01-17 14:34:04+00:00,2025-01-20 12:18:29.171073,updated mvrv zscore improves bitcoin price predictionsweve enhanced mvrv zscore better reflect bitcoins evolving market dynamic reduced volatility,0.8074,0.25,0.5287
RSS,https://bitcoinmagazine.com/.rss/full/,2025-01-17 14:00:00+00:00,2025-01-20 12:18:29.171073,california working towards embracing bitcoinbitcoin focused nonprofit proof workforce working office california legislation bitcoin initiative,0.3818,0.0,0.1909
RSS,https://bitcoinmagazine.com/.rss/full/,2025-01-16 18:24:39+00:00,2025-01-20 12:18:29.171073,bitcoin price history predicts february 2025discover bitcoins historical february performance posthalving trend provide insight investor expect 2025,0.0,0.0,0.0
RSS,https://bitcoinmagazine.com/.rss/full/,2025-01-16 16:37:32+00:00,2025-01-20 12:18:29.171073,coinbases bitcoin loan seemnot backed real bitcoin bitcoin blockchain better,0.4588,0.35,0.4044
RSS,https://bitcoinmagazine.com/.rss/full/,2025-01-15 22:03:40+00:00,2025-01-20 12:18:29.171073,bitcoin miner economic irrationality fatalbitcoins censorship resistance depends miner decentralization economic rationality therefore sustainability,-0.4019,0.2,-0.10094999999999998
RSS,https://bitcoinmagazine.com/.rss/full/,2025-01-15 21:30:04+00:00,2025-01-20 12:18:29.171073,u government release half bitcoin intended trump strategic reservethis bullish bitcoin,0.0,-0.16666666666666666,-0.08333333333333333
RSS,https://bitcoinmagazine.com/.rss/full/,2025-01-15 17:57:22+00:00,2025-01-20 12:18:29.171073,bitcoiners view quantum computinga breakdown type risk quantum computing pose bitcoin worried user network,-0.5106,0.0,-0.2553
RSS,https://bitcoinmagazine.com/.rss/full/,2025-01-15 17:46:01+00:00,2025-01-20 12:18:29.171073,hundred company buy bitcoin 2025bitwise cio matt hougan predicts treasury revolution forecasting hundred company buy bitcoin reserve asset within 18 month shaping transformative overlooked megatrend,0.4939,0.0,0.24695
RSS,https://bitcoinmagazine.com/.rss/full/,2025-01-15 16:27:46+00:00,2025-01-20 12:18:29.171073,mining bitcoin congo beyond journey bigblock datacenters sébastien gouspillousébastien gouspillou established bitcoin mining facility remote region world given back community process,0.0,-0.05,-0.025
RSS,https://bitcoinmagazine.com/.rss/full/,2025-01-15 16:18:01+00:00,2025-01-20 12:18:29.171073,x fiatyou sometimes hear bitcoiners claim x fiat x mean category food medicine art whatever im fan extrapolation supposed bitcoin value ill make exception actual x,0.2263,-0.2708333333333333,-0.022266666666666657
RSS,https://bitcoinmagazine.com/.rss/full/,2025-01-14 21:05:22+00:00,2025-01-20 12:18:29.171073,wear bitcoin shirt here whyyou putting target back wearing merch like,0.3612,0.0,0.1806
RSS,https://bitcoinmagazine.com/.rss/full/,2025-01-14 19:57:19+00:00,2025-01-20 12:18:29.171073,bitcoin defi finding productmarket fit runesbtcfi track compete ecosystem,0.3612,0.4,0.38060000000000005
RSS,https://bitcoinmagazine.com/.rss/full/,2025-01-14 19:13:56+00:00,2025-01-20 12:18:29.171073,repeating 2017 bitcoin bull cycleexplore potential bitcoin repeat 2017 bull cycle analyze price action investor behavior future prediction bitcoins market trajectory,0.0,0.03333333333333333,0.016666666666666666
RSS,https://bitcoinmagazine.com/.rss/full/,2025-01-14 17:01:08+00:00,2025-01-20 12:18:29.171073,syria exploring embrace bitcoinsyria fall assad considering legalization bitcoin including partially backing syrian pound mining excess energy reserve,0.5423,-0.1,0.22115
RSS,https://bitcoinmagazine.com/.rss/full/,2025-01-14 15:05:58+00:00,2025-01-20 12:18:29.171073,bitcoin explainer video going insanely viral let tell viral 40minute video best noobfriendly resource ive ever seen,0.6369,0.0,0.31845
RSS,https://bitcoinmagazine.com/.rss/full/,2025-01-14 14:53:02+00:00,2025-01-20 12:18:29.171073,nostr world biggest bitcoin circular economy join usstart sending receiving bitcoin exchange content,0.296,0.0,0.148
RSS,https://bitcoinmagazine.com/.rss/full/,2025-01-13 20:00:52+00:00,2025-01-20 12:18:29.171073,one week donald trump decide ross ulbrichts fatechances ross ulbricht soon free man,0.5106,0.4,0.45530000000000004
RSS,https://bitcoinmagazine.com/.rss/full/,2025-01-13 17:20:23+00:00,2025-01-20 12:18:29.171073,arka noego noah ark solidarity bitcoina look history polish solidarity movement overthrew communism similarity movement bitcoin natalie smolenski,0.5267,0.0,0.26335
RSS,https://bitcoinmagazine.com/.rss/full/,2025-01-10 21:05:24+00:00,2025-01-20 12:18:29.171073,may want redeem bitcoin thorchains lending serviceif thorchain creditor id withdraw bitcoin collateral,0.0516,0.0,0.0258
RSS,https://bitcoinmagazine.com/.rss/full/,2025-01-10 20:13:27+00:00,2025-01-20 12:18:29.171073,privacy shouldnt product stop treating like onethe degree scrutiny accountability privacy project bitcoin space almost nonexistent need change,0.5248,0.0,0.2624
RSS,https://bitcoinmagazine.com/.rss/full/,2025-01-10 19:03:04+00:00,2025-01-20 12:18:29.171073,spot bitcoin etf approval important moment 2024these etf set stage bullish 2024 become,0.5994,0.4,0.49970000000000003
RSS,https://bitcoinmagazine.com/.rss/full/,2025-01-10 15:30:39+00:00,2025-01-20 12:18:29.171073,pieter wuille gregory maxwell receive finney freedom prize pieter wuille gregory maxwell honoured finney freedom prize transformative contribution bitcoins scalability privacy usability,0.9595,0.0,0.47975
RSS,https://bitcoinmagazine.com/.rss/full/,2025-01-10 13:30:00+00:00,2025-01-20 12:18:29.171073,bitcoin etf lived hypebitcoin etf launched high expectation 2024 one year later analyze performance market influence whether theyve lived hype,0.128,0.08,0.10400000000000001
RSS,https://bitcoinmagazine.com/.rss/full/,2025-01-09 15:48:40+00:00,2025-01-20 12:18:29.171073,future home bitcoin mining bright new bitaxe device come market heatbit device helping everyday user mine bitcoin keeping home warm 5500 opensource mining developer continue work together push home bitcoin mining industry forward,0.7184,0.24727272727272726,0.4828363636363636
RSS,https://bitcoinmagazine.com/.rss/full/,2025-01-08 22:03:10+00:00,2025-01-20 12:18:29.171073,steve hanke wrong strategic bitcoin reserve let break outdated argument dont add,-0.6808,-0.45000000000000007,-0.5654
RSS,https://bitcoinmagazine.com/.rss/full/,2025-01-08 19:34:20+00:00,2025-01-20 12:18:29.171073,dont buy bitcoin dipnow time make sizable bitcoin purchase,0.0,0.0,0.0
RSS,https://bitcoinmagazine.com/.rss/full/,2025-01-08 19:02:07+00:00,2025-01-20 12:18:29.171073,lightning network privacy big picture dont forget nsawhile lightning might provide good privacy direct participant network case powerful adversary,0.6774,0.27499999999999997,0.47619999999999996
RSS,https://bitcoinmagazine.com/.rss/full/,2025-01-08 18:16:42+00:00,2025-01-20 12:18:29.171073,buying greenland would huge boost u bitcoin mininggreenlands abundance renewable energy cold climate make ideal place trump encourage american bitcoin mining,0.9153,0.175,0.54515
RSS,https://bitcoinmagazine.com/.rss/full/,2025-01-08 17:09:03+00:00,2025-01-20 12:18:29.171073,using mining create fully validating bitcoin usershow stratum v2 help improve bitcoin decentralization mining ecosystem overall,0.8553,0.0,0.42765
RSS,https://bitcoinmagazine.com/.rss/full/,2025-01-08 14:00:11+00:00,2025-01-20 12:18:29.171073,ledn remains bitcoins premier borrowing lending platformledns chief strategy officer cso mauricio di bartolomeo reflects choice cofounder made led six year success,0.5719,0.3,0.43594999999999995
RSS,https://bitcoinmagazine.com/.rss/full/,2025-01-07 19:10:31+00:00,2025-01-20 12:18:29.171073,bitcoin layer 2 foundation buy bitcoin treasury bitcoin layer 2 foundation building bitcoin arent storing treasury,0.0536,0.0,0.0268
RSS,https://bitcoinmagazine.com/.rss/full/,2025-01-07 16:55:11+00:00,2025-01-20 12:18:29.171073,meet jason marquez truck driver made 750000 microstrategyafter getting crypto ftx one man went michael saylor made fortune,0.0,0.0,0.0
RSS,https://bitcoinmagazine.com/.rss/full/,2025-01-07 15:13:33+00:00,2025-01-20 12:18:29.171073,laser eye upsidedown pic new bitcoin campaign flip goldbitcoin hit 100k next mission clear flip gold market cap join picfliptillgoldflip campaign help push bitcoin 1 million laser eye upsidedown pic time turn financial world headliterally,0.7579,0.05909090909090908,0.40849545454545455
RSS,https://bitcoinmagazine.com/.rss/full/,2025-01-07 14:55:00+00:00,2025-01-20 12:18:29.171073,democrat reverse stance bitcoinvan jones admits democrat paid attention crypto voter last election cycle want party moving forward offering voting bloc lip service wont enough win,0.2796,0.26666666666666666,0.27313333333333334
RSS,https://bitcoinmagazine.com/.rss/full/,2025-01-06 18:45:12+00:00,2025-01-20 12:18:29.171073,anchor evil bitcoin core destroying bitcoincriticism bitcoin core developer hitting new high absurdity illogical foundation around ridiculousness,-0.8779,-0.22590909090909086,-0.5519045454545455
RSS,https://bitcoinmagazine.com/.rss/full/,2025-01-06 17:11:57+00:00,2025-01-20 12:18:29.171073,canada elect next bitcoin world leadercanadas prime minster resigned paving way conservative party probitcoin leader replace,0.1779,0.4,0.28895000000000004
RSS,https://bitcoinmagazine.com/.rss/full/,2025-01-06 14:44:57+00:00,2025-01-20 12:18:29.171073,new pi cycle top prediction chart identifies bitcoin price market peak precisiondiscover newly launched pi cycle top prediction chart cuttingedge tool designed help professional investor anticipate bitcoins market cycle peak manage risk effectively,0.765,0.3287878787878788,0.5468939393939394
RSS,https://bitcoinmagazine.com/.rss/full/,2025-01-03 19:58:22+00:00,2025-01-20 12:18:29.171073,michael saylors trump meeting turbo bullish bitcointhe u finally active probitcoin administration coming office,0.4019,-0.13333333333333333,0.1342833333333333
RSS,https://bitcoinmagazine.com/.rss/full/,2025-01-03 18:34:50+00:00,2025-01-20 12:18:29.171073,birthday letter bitcoina letter bitcoin lesson impetuous teenager take heed teenage year,0.0,0.0,0.0
RSS,https://bitcoinmagazine.com/.rss/full/,2025-01-03 13:50:00+00:00,2025-01-20 12:18:29.171073,2025 bitcoin outlook insight backed metric market dataexplore bitcoins 2025 potential datadriven perspective analyzing key metric like mvrv zscore pi cycle oscillator macroeconomic trend uncover insight year ahead,0.3818,0.0,0.1909
RSS,https://bitcoinmagazine.com/.rss/full/,2025-01-02 22:17:57+00:00,2025-01-20 12:18:29.171073,1 million seed capital awarded defi hedge fund boreal bitcoin alpha competition winnersamara asset management bitcoin magazine pro selected boreal winner secondever bitcoin alpha competition,0.8126,0.0,0.4063
RSS,https://bitcoinmagazine.com/.rss/full/,2025-01-02 21:39:36+00:00,2025-01-20 12:18:29.171073,owning 1 bitcoin better millionaire think millionaire exclusive let explain owning 1 bitcoin might real wealth symbol future,0.765,0.2333333333333333,0.49916666666666665
RSS,https://bitcoinmagazine.com/.rss/full/,2025-01-02 16:05:44+00:00,2025-01-20 12:18:29.171073,woman bitcoin cointelegraph forgotwomen based europe u excellent work bitcoin space cointelegraph pointed woman africa latin america southeast asia middle east,0.5719,0.5,0.5359499999999999
RSS,https://bitcoinmagazine.com/.rss/full/,2025-01-01 18:33:27+00:00,2025-01-20 12:18:29.171073,bitcoin fiatbitcoin digital commodity decentralized digital fiat currency,0.0,0.0,0.0
RSS,https://bitcoinmagazine.com/.rss/full/,2025-01-01 17:29:37+00:00,2025-01-20 12:18:29.171073,recounting ethiopia bitcoin development 2024reviewing development 2024 ethiopian electric power eep 25 privately owned bitcoin miner ethiopia contribute 600 mw energy bitcoin network,0.2732,0.0,0.1366
RSS,https://bitcoinmagazine.com/.rss/full/,2024-12-31 19:25:04+00:00,2025-01-20 12:18:29.171073,neobank yopaki aim make every mexican bitcoinerfrancisco chavarria yopakis cofounder ceo belief educating yopakis user bitcoin incorporating favorite mexican pastime app team poised make mexico nation bitcoin enthusiast,0.7579,0.16666666666666666,0.4622833333333333
RSS,https://bitcoinist.com/feed/,2025-01-20 11:51:57+00:00,2025-01-20 12:18:29.171073,solana tvl skyrocket back past 10b solaxy next presale boom 2025after trump melania coin launched solana blockchain weekend sol 4557 surpassing 10b tvl total value locked first time since ftx collapse two year ago however success come without challenge solana struggle deal congestion caused,0.6633,0.049999999999999996,0.35665
RSS,https://bitcoinist.com/feed/,2025-01-20 11:39:56+00:00,2025-01-20 12:18:29.171073,trump coin good buy 5 meme coin might better choicesdonald trump like dip toe many business venture steak casino fake university latest business project trump coin trump hit ground running 500k transaction 20 second sooner 5m 38 wiped value launch melania,0.765,0.2833333333333333,0.5241666666666667
RSS,https://bitcoinist.com/feed/,2025-01-20 11:00:19+00:00,2025-01-20 12:18:29.171073,dogecoin reach 20 here proof say crypto analystcan dogecoin realistically surge 20 region higher elliott wave theory breakdown crypto analyst xforceglobal presented case popular memecoin could continue upward trajectory referred dogecoin king meme coin emphasized historical price action provides vital clue future,0.6249,0.17500000000000002,0.39995
RSS,https://bitcoinist.com/feed/,2025-01-20 09:30:10+00:00,2025-01-20 12:18:29.171073,ethereum form bullish continuation pattern upsurge new height aheadamidst strong resurgence general crypto market ethereum gained traction evidenced rebound 2900 threshold recording 10 upswing last day eth continues maintain position leading crypto asset capable witnessing significant growth ongoing bull cycle strong momentum,0.9493,0.2325757575757576,0.5909378787878788
RSS,https://bitcoinist.com/feed/,2025-01-20 06:30:51+00:00,2025-01-20 12:18:29.171073,donald trump hold 90 net worth crypto meansdonald trump reportedly hold 90 net worth cryptocurrency revelation sparked intense debate across social medium prominent tech entrepreneur former coinbase cto balaji srinivasan weighing potential global implication writing january 19 via x srinivasan called development first crypto president,0.6597,0.14393939393939395,0.40181969696969694
RSS,https://bitcoinist.com/feed/,2025-01-19 20:30:40+00:00,2025-01-20 12:18:29.171073,donald trump memecoin launch break crypto record whats next herethe majority crypto community pinning hope donald trump incoming administration gamechanger industry much optimism due promise made campaign many believe could herald new era policy favorable cryptocurrency adoption innovation although administration yet,0.9246,0.16856060606060605,0.546580303030303
RSS,https://bitcoinist.com/feed/,2025-01-19 19:00:19+00:00,2025-01-20 12:18:29.171073,bitcoin successfully retests yearly high alltime high sight next weekbitcoin flirting alltime high rollercoaster week showcased cryptocurrencys trademark volatility price briefly crashed 89100 move shook market confidence staging impressive comeback le six day bitcoin surged 18 reaching local high 105900 reigniting bullish,0.9001,0.26555555555555554,0.5828277777777777
RSS,https://bitcoinist.com/feed/,2025-01-19 17:30:08+00:00,2025-01-20 12:18:29.171073,trump meme coin rollout spark outrage ahead presidencya day officially becoming 47th president united state donald trump making wave cryptocurrency landscape upcoming inauguration january 20 launching controversial meme coin named related reading irs crypto rule spark pushback texas senator ted cruz launched,0.25,0.3333333333333333,0.29166666666666663
