MainSource,Source,Publication Date,Pull_date,Pre-Processed Text,Sentiment_Vader,Sentiment_TextBlob,Average_Sentiment
Reddit,solana,2025-02-12 16:24:39,2025-02-14 12:18:55.158135,need help cli trasnfer spl tokensim looking help cli transfer spl token one wallet another old wallet likely compromised want open web app find right account value issue command transfer old new chatgpt claude running circle see token balance try transfer get error spltoken transfer 3rpbwc 0089878 3zw9suu fundrecipient allowunfundedrecipient transfer 0089878 token sender 36upyu recipient 3zw9suu recipient associated token account gutpht error clienterror request somesendtransaction kind rpcerrorrpcresponseerror code 32002 message transaction simulation failed attempt debit account found record prior credit data sendtransactionpreflightfailurerpcsimulatetransactionresult err someaccountnotfound log account none units_consumed some0 return_data none inner_instructions none replacement_blockhash none,0.6597,0.08023088023088024,0.3699654401154401
Reddit,solana,2025-02-12 19:42:51,2025-02-14 12:18:55.158135,solana live meow send receive usdc solana existing cash balancesource httpsxcombrandonstatus1889721266094882849httpsxcombrandonstatus1889721266094882849 announcement solana live meowhttpsxcommeow send receive usdc solana existing cash balance meowhttpsxcommeow send receive usdc solana free existing cash balance thats right day needing prefund maintain log crypto exchange send receive usdc solana permanently balance use business finance payroll corporate card one use send receive usdc solana usdc transaction integrate natively accounting software like quickbooks netsuite puzzle thats enough set custom spend control per dollar amount multiuser permission 2fa enforced every transaction crypto company building solana crypto vc fund investing solana ecosystem time meow heard apply today meow financial technology company bank payment service described message provided bridge venture llc affiliate registered licensed applicable httpsredditcomlink1inzr2avideo85ls3nxjhrie1player httpsxcombrandonstatus1889735391336362192httpsxcombrandonstatus1889735391336362192 apply right meow httpswwwmeowcomhttpswwwmeowcom httpspreviewreddit63mb0ls1irie1pngwidth680formatpngautowebps62a08fe848e885ee3151a60ae0cb9d6973ca8c1b,0.7003,0.1555194805194805,0.42790974025974027
Reddit,solana,2025-02-12 18:08:58,2025-02-14 12:18:55.158135,twitter trading bot auto executeshey guy brother starting get involved memecoins asked bot suggestion couldnt suggest one feature needed know twitter solana trading bot buy button right tweet see something execute fast looking something instantly auto buy coin specific twitter user tweet solana ca want able link new wallet instantly buy someone tweet ca exist hopefully something slippage bribe mev protection etc thanks,0.6249,0.1468975468975469,0.38589877344877344
Reddit,solana,2025-02-11 06:02:28,2025-02-14 12:18:55.158135,memecoins gamblingwhat think strategic edge,0.0,0.0,0.0
Reddit,solana,2025-02-12 07:20:30,2025-02-14 12:18:55.158135,institution download backpack wallet get started using solana backpackapp,0.0,0.0,0.0
Reddit,solana,2025-02-11 13:23:32,2025-02-14 12:18:55.158135,solana trading 5 path youre probably ignoringmost people see solana place trade memecoins chase pump trade youre missing bigger picture real player solana arent flipping chartsthey creating future let break 5 major path httpspreviewredditzs9rm9tkfiie1jpgwidth310formatpjpgautowebps96cfd35e4caf65ae0253474223308739e02d9a91 solana trading think way make solana trading youre playing small game least 5 different way people carve spot ecosystem 1 trading learning market move sniping play tracking trend 2 marketing growth helping project gain visibility directing attention 3 developing building smart contract bot infrastructure 4 building innovating creating entire ecosystem oneoff project 5 influencing content creation shaping narrative leading community let break httpspreviewreddit9mj3vqwrfiie1jpgwidth474formatpjpgautowebps865bfd8e23f873714e37f21ef0577ad4218f4a47 trading playing onchain game trading isnt buying low selling highits understanding market best trader frontrun narrative track liquidity read onchain signal instead chasing hype study market cycle exit herd youre trading based twitter call youre already late httpspreviewreddit25p6wd8yfiie1jpgwidth750formatpjpgautowebpseef593da944b35a02e3aa4280a8089572ed08818 marketing growth attention game every successful project solana need attention without even great idea die good marketing isnt shillingits crafting narrative directing right eyeball right place best solana marketer create viral campaign manage kol relationship sustain hype know build hype direct attention make anything move httpspreviewredditynuf9fv1giie1jpgwidth675formatpjpgautowebps3fbee0f6510c39c7cd9938de20e0ba6e42714246 developing building tool matter everything crypto run code best trader builder market maker depend devs smart contract engineer bot developer tool creator control infrastructure build dictate ecosystem evolves biggest project solanapumpfun tensor jupitercame devs saw missing built httpspreviewredditbyanj0ibgiie1jpgwidth758formatpjpgautowebps99b5d74cd01ba01fab9d165788ed84eb36d839de building innovating founder change game biggest winner solana arent traderstheyre builder pumpfunhttppumpfun wasnt toolit shaped entire market meta best builder dont launch tokensthey build ecosystem keep growing launch something people need create economy httpspreviewreddithyxtjkhigiie1jpgwidth550formatpjpgautowebps993f3eff861553c16b56ee6c3a60d7532ee1f2dd influencing content creation controlling narrative crypto narrative move market biggest influencers dont report trendsthey start many top voice solana began sharing insight breaking pattern consistently posting value control people talk control liquidity flow httpspreviewreddit9i5jf78ngiie1jpgwidth640formatpjpgautowebps8e1ea196f56934250dd9d73fab75fd3cf2cfb126 matter trade youre playing small game biggest winner create consume trader reactbuilders marketer devs shape space interest path interest go deeper drop comment let break solana way bigger tradinglets discus,0.9961,0.1532142857142857,0.5746571428571429
Reddit,solana,2025-02-12 01:57:02,2025-02-14 12:18:55.158135,franklin templeton signal potential spot solana etf launch delaware trust filing,0.5106,0.0,0.2553
Reddit,solana,2025-02-12 03:48:18,2025-02-14 12:18:55.158135,platform shorting memecoins guy best platform website shorting memecoins im specifically interested shorting newly launched meme coin likely die day like coin launched celebrity influencers yet avalible shorted centralized exchange possible short ie hawk baby coin btw im well aware potential risk experienced trading,0.7579,0.27070707070707073,0.5143035353535353
Reddit,solana,2025-02-11 11:54:01,2025-02-14 12:18:55.158135,swapping phantom tg bot website scami learnt swap using raydium api compare swapping phantom fee 085 set 05 slippage executed time dont see benefit swapping phantom even using tg bot someone tell benefit using tool thinking transaction failure think make multiple request later api raydium conclusion tool milking people dev experience,-0.4176,-0.10555555555555556,-0.2615777777777778
Reddit,solana,2025-02-11 21:32:39,2025-02-14 12:18:55.158135,phantom wallet fund problemi recently bought 100 meme coin span hour went 5000 say ive made like 50 buck wouldnt 5000 increase mean like 50x money dont get,0.4657,-0.15625,0.154725
Reddit,solana,2025-02-11 07:57:51,2025-02-14 12:18:55.158135,bullx scam insane feesi bought 50 worth solana put bullx neo couple profitable trade made 22 total revenue find 46 solana left possible fee huge,-0.0772,-0.049999999999999996,-0.0636
Reddit,solana,2025-02-12 04:33:13,2025-02-14 12:18:55.158135,trackerbot thisim looking something track main wallet trasanction send sol fresh wallet create token want something give ca fresh wallet create token tried cielo show main wallet send sol im looking get ca automatically token created,0.8442,0.2333333333333333,0.5387666666666666
Reddit,solana,2025-02-10 22:44:49,2025-02-14 12:18:55.158135,nova bot alternativei got text telegram bullx account temporarily restricted 5 minute warning 110 weve detected youre using unverified extension tampermonkeynova violates bullxs term service account temporarily restricted 5 minute continuous use extension may lead permanent suspension account choose continue using unverified extension kindly ask use another platform problem one unverified extension overrode critical function bullx app leading unusual request pattern coming account impact service performance user safety avoid installing unnecessary browser extension trading environment extension request permission trading website may compromise security bullx already provides functionality extension claim offerfaster securely whats new bullx 1 even faster market order 2 updated migration snipernow dominates 95 migrating token 3 new monitor square interface better wallet tracking 4 hypervision offer customizable ux thanks helping u keep bullx safe,0.5859,0.22727272727272724,0.4065863636363636
Reddit,solana,2025-02-12 00:02:27,2025-02-14 12:18:55.158135,error editing metadatahello trying figure change metadata token ive tried going solana cli tried using meta bos able anything due error action failed error failed get account data im sure im wrong read sol metadata doc looked online people issue solution also used chatgpt explanation still issue someone help even give simpler solution ill greatly appreciate thank,-0.7374,-0.024999999999999984,-0.38120000000000004
Reddit,solana,2025-02-12 14:42:33,2025-02-14 12:18:55.158135,people missing staking opporunities like must crazy lol,0.1779,0.0,0.08895
Reddit,solana,2025-02-11 21:18:46,2025-02-14 12:18:55.158135,hi im kinda new dex coinsso searching way filter new coin get coin good potential dexscreener solana chain guy recommendation filter tool use best result thanks advance,0.875,0.3621212121212121,0.618560606060606
Reddit,solana,2025-02-12 08:29:38,2025-02-14 12:18:55.158135,help tried trading bullx bought sol 1 solana took 10 worth please helpplesae help tried trading bullx bought sold 1 dollar worth solana ended taking 10 dollar worth wallet please help fix help figure wrong please,0.946,0.09999999999999998,0.5229999999999999
Reddit,solana,2025-02-11 16:20:33,2025-02-14 12:18:55.158135,sol strategy named staking provider 3iqs proposed solana staking etf canada koinbytes,0.0,0.0,0.0
Reddit,solana,2025-02-11 15:02:40,2025-02-14 12:18:55.158135,track asset solanahey since sonar watch acquired jupiter use track asset across ecosystem using pulsar would interested see anything better,0.8625,0.375,0.61875
Reddit,solana,2025-02-11 19:12:11,2025-02-14 12:18:55.158135,zkp rollups way implement zkp blockchainhi im exploring possibility zkp solana blockchain far ive understood native support groth16 etc,0.4019,0.1,0.25095
Reddit,solana,2025-02-11 18:36:12,2025-02-14 12:18:55.158135,let say making trading tool solana would must featureslets keep simple plain simple research hope break rule please write whats important dont like use tool specify please thanks advance,0.8438,0.07714285714285715,0.4604714285714286
Reddit,solana,2025-02-11 20:52:05,2025-02-14 12:18:55.158135,memecoins gambleis gambling anyone good strategy would love share advice recommendation reliable place learn thanks,0.9042,0.4666666666666666,0.6854333333333333
Reddit,ethereum,2025-02-09 06:01:43,2025-02-14 12:18:55.158135,weekly discussion thread buildinghello rethereumhttpswwwredditcomrethereum welcome weekly discussion thread building space developer entrepreneur enthusiast showcase project share idea seek feedback greater ethereum community share project whether youre developing decentralized application dapp launching new layer 2 network working ethereum infrastructure encourage share detail project please provide concise overview including purpose current status link information provide xtwitter youtube link post automatically filtered engage collaborate thread excellent opportunity connect likeminded individual application tester feel free ask question offer feedback seek collaboration safety reminder encourage sharing collaboration please cautious potential scam avoid connecting wallet unfamiliar application without thorough research utilizing wallet tool offer transaction simulation eg rabby walletguard help ensure safety fund never give seed phrase private key looking forward hearing pushing ethereum ecosystem forward,0.9908,0.26694214876033057,0.6288710743801653
Reddit,ethereum,2025-02-14 07:01:22,2025-02-14 12:18:55.158135,daily general discussion february 14 2025welcome ethereum daily general discussion rethereum httpsimgurcom3y7vezphttpsimgurcom3y7vezp bookmarking link always bring current daily httpsoldredditcomrethereumaboutstickynum2httpsoldredditcomrethereumaboutstickynum2 please use thread discus ethereum topic news event even price price discussion posted elsewhere subreddit continue removed always constructive subreddit ruleshttpswwwredditcomrethereumaboutrules want stake learn rethstaker ethfinance ethereum community link ethereum jobshttpsethereumorgencommunitygetinvolvedethereumjobs twitterhttpsxcomethereum evmavericks youtubehttpswwwyoutubecomevmavericks discordhttpsdiscordggevmavericks doots podcasthttpsevmaverickslibsyncom doots websitehttpsdailydootscom old reddit doots extensionhttpsgithubcometheralphaethfinanceextension uhanniabu calendar feb 23 mar 2 ethdenverhttpswwwethdenvercom mar 2830 eth pondyhttpswwwethpondyxyz puducherry hackathon apr 13 ey global blockchain summit person virtual,0.3818,0.025000000000000005,0.2034
Reddit,ethereum,2025-02-13 21:36:10,2025-02-14 12:18:55.158135,ethereum network upgrade update pectra fusaka pectra key update feb 14 pectra release testnet announcement monday system contract eips 2935 7002 7251 deployed pectra eips moved last call devnet6 running smoothly fusaka timeline march 13 deadline eip inclusion proposal pr eip7607 march 27 core devs review share preference april 10 final fusaka scope decision key discussion testing standard set pectra eips debate eof inclusion fusaka discussion planned agreement prioritize peerdas update max blob flag rollups accept better block throughput node requirement el client except erigon support flag fusaka1 devnet launched older eof spec cleanup april full summary herehttpsethereummagiciansorgtallcoredevsexecutionacde205february13202522828,0.8807,0.15740740740740738,0.5190537037037037
Reddit,ethereum,2025-02-13 13:02:18,2025-02-14 12:18:55.158135,ungratefulness hating vitalik buterinin last month vitalik frequently target abuse crypto community sub also across social medium especially people upset eths market performance think one ungrateful thing space hate vitalik people even aware imagined created brilliant blockchain platform changed modern finance 19 year old 19 19 life creation ethereum technological revolution built basis new world boosted blockchains utility beyond original intent even though price isnt good right ethereum work intended become safer upgrade hater ignore ethereums immense impact either frustrated bag holder butthurt maxi blockchain technology might progressed far without vitaliks vision hating fails give recognition deserves contribution creation ethereum consequently large piece cryptocurrency sector plus ethereum foundation working change pay attention community say people got ta learn patient instead demanding action right away,-0.954,0.08902056277056276,-0.4324897186147186
Reddit,ethereum,2025-02-14 08:06:16,2025-02-14 12:18:55.158135,aztec foundation launch accelerate vision programmable privacy aztec blog,0.25,0.0,0.125
Reddit,ethereum,2025-02-13 21:31:55,2025-02-14 12:18:55.158135,ephemery testnet running pectra upgrade play maxeb risk nowthe ephemery testnet newish ethereum testnet reset every 28 day find relevant link httpsephemerydev today regular 28day restart cycle upgraded ethereum pectra mean mean operate validator youre thinking see max eb work practice pow minehttpsephemeryfaucetpk910de thousand ephemery ether minute use ether launch validatorshttpslaunchpadephemerydeven use 0x02 credential stake 2048 ether one validator receive higher reward whole number effective balance 32 word youll receive greater reward stake 33 34 eth etc ephemery perfect place fuck around find pectra max eb 0x02 affect validators best part wont need wait long time sync ephemery reset every 28 day there chain bloat worry cheer ephemery,0.9607,0.23958333333333337,0.6001416666666667
Reddit,ethereum,2025-02-13 07:01:31,2025-02-14 12:18:55.158135,daily general discussion february 13 2025welcome ethereum daily general discussion rethereum httpsimgurcom3y7vezphttpsimgurcom3y7vezp bookmarking link always bring current daily httpsoldredditcomrethereumaboutstickynum2httpsoldredditcomrethereumaboutstickynum2 please use thread discus ethereum topic news event even price price discussion posted elsewhere subreddit continue removed always constructive subreddit ruleshttpswwwredditcomrethereumaboutrules want stake learn rethstaker ethfinance ethereum community link ethereum jobshttpsethereumorgencommunitygetinvolvedethereumjobs twitterhttpsxcomethereum evmavericks youtubehttpswwwyoutubecomevmavericks discordhttpsdiscordggevmavericks doots podcasthttpsevmaverickslibsyncom doots websitehttpsdailydootscom old reddit doots extensionhttpsgithubcometheralphaethfinanceextension uhanniabu calendar jan 20 ethereum protocol attackathonhttpsblogethereumorg20241125ethereumprotocolattackathon end jan 3031 ethereumzurichhttpsethereumzurich conference feb 79 eth oxfordhttpsethoxfordio hackathon feb 1016 ethiopiahttpsethiopiaxyz conference hackathon feb 23 mar 2 ethdenverhttpswwwethdenvercom mar 2830 eth pondyhttpswwwethpondyxyz puducherry hackathon apr 13 ey global blockchain summit person virtual,0.3818,0.025000000000000005,0.2034
Reddit,ethereum,2025-02-13 23:38:42,2025-02-14 12:18:55.158135,pectra upgrade client release holeky sepolia testnets,0.0,0.0,0.0
Reddit,ethereum,2025-02-13 22:43:35,2025-02-14 12:18:55.158135,core devs execution acde 205 february 13 2025 protocol call happening,0.0,0.0,0.0
Reddit,ethereum,2025-02-13 13:46:24,2025-02-14 12:18:55.158135,built first fully onchain microstrategy eth looking feedback release alpha use real fund,0.0,0.225,0.1125
Reddit,ethereum,2025-02-13 16:39:58,2025-02-14 12:18:55.158135,ddocs comment v02 permissionless global collaboration unlocked,0.0,0.0,0.0
Reddit,ethereum,2025-02-13 01:16:14,2025-02-14 12:18:55.158135,acdc 150 competitive advantage ethin week episode infinite jungle christine kim unpacks latest ethereum acdc call 150 conversation revolves around ethereums competitive advantage important update upcoming pectra mainnet activation here need know pectra activation delayed ethereum developer initially planned faster rollout pectra upgrade feedback layer2 project staking provider led change course concern timeline aggressive resulted onemonth delay ensuring least 30 day final public testnet upgrade mainnet launch extra time allow better preparation smoother implementation ethereums competitive edge crowded blockchain space christine also explores ethereum continues lead despite new challenger blockchain ecosystem key strength include established ecosystem massive developer community deeprooted integration security decentralization proven track record robust security mechanism network effect widely used smart contract platform significant institutional adoption ethereum evolving competition heating episode offer valuable insight future ecosystem full podcast httpsopenspotifycomepisode4oqzjdyssuqeacnvwbfx2ghttpsopenspotifycomepisode4oqzjdyssuqeacnvwbfx2g httpspodcastsapplecomuspodcastacdc150thecompetitiveadvantageof24ethid1728091874i1000691048446httpspodcastsapplecomuspodcastacdc150thecompetitiveadvantageof24ethid1728091874i1000691048446 httpswwwyoutubecomwatchvt6soqa4hgyhttpswwwyoutubecomwatchvt6soqa4hgy,0.9739,0.1297280844155844,0.5518140422077922
Reddit,ethereum,2025-02-13 15:50:17,2025-02-14 12:18:55.158135,ethereum developer rethinking transaction signature authority,0.0772,0.0,0.0386
Reddit,ethereum,2025-02-13 15:29:11,2025-02-14 12:18:55.158135,jim posen cryptographic acceleration binius,0.0,0.0,0.0
Reddit,ethereum,2025-02-13 09:02:30,2025-02-14 12:18:55.158135,staking eth directly trust wallethi everyone anyone experience staking eth directly trust wallet everything going smooth would say risk le staking exchange reward paid regularly im planning stake little amount let ride year want sure nothing bad going happen concern post uembarrassed_ad_8406 able redeem reward staking large amount eth one additional question information validators used staking directly trust wallet app want sure legit eth doesnt land lido rocketpool case simply skip trust wallet use service thanks,0.9825,0.13282967032967036,0.5576648351648352
Reddit,ethereum,2025-02-13 14:29:05,2025-02-14 12:18:55.158135,ethereum smart contractsi recently became interested learning smart contract searched youtube best way learn also tried find perfect roadmap understanding smart contract application however havent able find something fully clear doubt new crypto including concept like gas fee wallet everything else want learn smart contract saw video integrating frontend web mobile applicationsbasically web3 development could guy please guide share reference roadmap help would greatly appreciated,0.9862,0.3369588744588745,0.6615794372294372
Reddit,ethereum,2025-02-12 07:01:21,2025-02-14 12:18:55.158135,daily general discussion february 12 2025welcome ethereum daily general discussion rethereum httpsimgurcom3y7vezphttpsimgurcom3y7vezp bookmarking link always bring current daily httpsoldredditcomrethereumaboutstickynum2httpsoldredditcomrethereumaboutstickynum2 please use thread discus ethereum topic news event even price price discussion posted elsewhere subreddit continue removed always constructive subreddit ruleshttpswwwredditcomrethereumaboutrules want stake learn rethstaker ethfinance ethereum community link ethereum jobshttpsethereumorgencommunitygetinvolvedethereumjobs twitterhttpsxcomethereum evmavericks youtubehttpswwwyoutubecomevmavericks discordhttpsdiscordggevmavericks doots podcasthttpsevmaverickslibsyncom doots websitehttpsdailydootscom old reddit doots extensionhttpsgithubcometheralphaethfinanceextension uhanniabu calendar jan 20 ethereum protocol attackathonhttpsblogethereumorg20241125ethereumprotocolattackathon end jan 3031 ethereumzurichhttpsethereumzurich conference feb 79 eth oxfordhttpsethoxfordio hackathon feb 1016 ethiopiahttpsethiopiaxyz conference hackathon feb 23 mar 2 ethdenverhttpswwwethdenvercom mar 2830 eth pondyhttpswwwethpondyxyz puducherry hackathon apr 13 ey global blockchain summit person virtual,0.3818,0.025000000000000005,0.2034
Reddit,ethereum,2025-02-12 19:28:55,2025-02-14 12:18:55.158135,eic04 released 4th issue ethereumfocused magazine feat tim beiko maria paula kevin owocki polar hildobby,0.0,-0.08333333333333333,-0.041666666666666664
