MainSource,Source,Publication Date,Pull_date,Pre-Processed Text,Sentiment_Vader,Sentiment_TextBlob,Average_Sentiment
Reddit,solana,2025-02-20 10:32:22,2025-02-22 12:16:32.950082,ama crypto taxesgreetings solana lover let talk crypto taxesbecause frankly theyre labyrinth designed make even savviest among u sweat solana ecosystem move warp speed staking yield farming token drop meme coin much exhilaratinguntil taxman knock regulation twist rule blur suddenly youre wondering staking reward income capital gain unholy hybrid darien advisor squad 25 crypto tax wrangler whove seen guide founder investor degens dreamer madness battletested knowhow host ama anything solana ecosystem simply chance fire question keep night safe harbor actually work whats tax hit farming juicy yield report token comp drop without summoning audit weve got answerspractical precise tailored keep irs local equivalent turning gain headache public question personal conundrum via dmbring ask u anything tax dont buzzkill journey weve got back,0.8934,0.11000000000000001,0.5017
Reddit,solana,2025-02-19 17:06:06,2025-02-22 12:16:32.950082,incinerate dead sol dustif yall using phantom sol wallet bought countless meme nothing show suggest heading sol incinerator wallet claim sol back 4 wallet got 23 sol back dead meme dust sitting account worth especially ammo coming week youre trouble google use sol incinerator collect dust respond dm question leave update 1 2202025 im happy ton able collect dead solana tried absolute best make sound like scam hard lot sub terrible scam trying make little better think ill monthly post keep sanity people especially hard time happy trading friend,-0.8708,0.054166666666666675,-0.40831666666666666
Reddit,solana,2025-02-20 12:33:46,2025-02-22 12:16:32.950082,type rug 101 newbie guide,0.0,0.0,0.0
Reddit,solana,2025-02-20 00:34:27,2025-02-22 12:16:32.950082,time go full cowboy modeif youre meant buy fear fear greed index everyones selling saying dead ive decided follow general advice start buying much like guy started buying 1 sol day ftx crash could wrong god going suck risk biscuit 50 day starting today april 30 assumption wild west one wildest shake out eventually come around towards middle year wish luck,-0.9393,3.469446951953614e-18,-0.46965
Reddit,solana,2025-02-20 17:06:13,2025-02-22 12:16:32.950082,run sql query solana blockchain data please let know something youve tried personallytitle,0.3182,0.0,0.1591
Reddit,solana,2025-02-20 20:11:18,2025-02-22 12:16:32.950082,guy whats ur strategy finding coin ik u dont randomly go dex screener ape inguys whats ur strategy finding coin ik u dont randomly go sex screener ape thx,0.3612,-0.5,-0.06939999999999999
Reddit,solana,2025-02-20 03:15:29,2025-02-22 12:16:32.950082,dave portnoy memecoins,0.0,0.0,0.0
Reddit,solana,2025-02-20 19:01:24,2025-02-22 12:16:32.950082,find wallet given first 4 last 4 characterssay youre given aaaabbbb wallet address find wallet information,0.0,0.125,0.0625
Reddit,solana,2025-02-20 01:39:06,2025-02-22 12:16:32.950082,thought solana still feel goodi bought solana high last cycle based couple fact platform easy code develop fee really low straight forward staking reasonable installing turnaround time network speed fast dependent hardware rather software bought high kept buying way 20 held way staked turned good investment seeing space become today interesting memecoins rug everywhere enough talk whats built good platform market getting rattled one still confident network also let know fact wrong im missing fact would love learn cool project worked,0.9391,0.22960784313725488,0.5843539215686274
Reddit,solana,2025-02-20 18:24:05,2025-02-22 12:16:32.950082,find wallet based set informationbasically want find wallet came kraken put 10k certain coin solscan give wallet recent 1000 holder dont see everyone keep saying best resource furthermore went dexscreener noticed bought coin 100 example doesnt show 100 reason im assuming there slippage fee thought get taken amount coin get discrepency come account searching bound coin one buy couldnt find wallet even owner couldnt find transaction there free api website etc lmk code needed,0.872,0.4035714285714286,0.6377857142857143
Reddit,solana,2025-02-20 13:03:52,2025-02-22 12:16:32.950082,stake coinbase show different wayi keep seeing people replying people stake coinbase isnt best way option stake better way app best appreciate help ive tried understand commenting post success,0.9158,0.5599999999999999,0.7379
Reddit,solana,2025-02-20 15:58:36,2025-02-22 12:16:32.950082,checkout 25min video get started new solana javascript client called gill nick frostbutter x twittersource httpsxcomnickfrostystatus1892590228097122341httpsxcomnickfrostystatus1892590228097122341 learn basic new solanahttpsxcomsolana javascript client called gill checkout 25min video get started readme linked thread httpspreviewreddit92gnqlhogbke1pngwidth553formatpngautowebpsde8b3f4945052a2dea709f6f9c96e042d3cebc4b checkout thread overview gill httpsxcomnickfrostystatus1891588509128888432httpsxcomnickfrostystatus1891588509128888432 find repo detailed readme httpspreviewreddit2cqnypcmgbke1pngwidth603formatpngautowebpse7fc72b25860d134678bb600fb49aefe96cb5dcc,0.0,0.16818181818181818,0.08409090909090909
Reddit,solana,2025-02-19 19:06:53,2025-02-22 12:16:32.950082,im sick meme coin daysits daily pump dump community dead ctos never work nobody even attempt anymore turned im sick used like meme buy token hold month trade hour max dead change anyone got suggestion idea,-0.946,-0.3657142857142857,-0.6558571428571428
Reddit,solana,2025-02-20 15:28:17,2025-02-22 12:16:32.950082,movistar telefnicas mobile flagship carrier mexico bringing 2 million subscriber helium networksource httpsxcomheliumstatus1892591344524107892httpsxcomheliumstatus1892591344524107892 big news mexico today movistar bringing 23m subscriber heliumhttpsxcomhelium partnership movistarmxhttpsxcommovistarmx subscriber able connect peoplepowered network accelerating mass adoption helium mexico movistar also make hotspot available retail online store drive coverage 300 location learn httpsblogheliumcommovistar2eac6386f379httpstcol1xlfjna5w httpspreviewredditcvtnijn6bbke1pngwidth680formatpngautowebps563a6bcea49802f36450ae52c7e83b83829f7ddc,0.1027,0.3,0.20135
Reddit,solana,2025-02-20 15:13:45,2025-02-22 12:16:32.950082,jupuary appeal open,0.0,0.0,0.0
Reddit,solana,2025-02-20 23:42:20,2025-02-22 12:16:32.950082,im concerned trying sew undue fud meansi understand stuff go come im one merely see 3060 drop go oh ive dont get wrong doomsday post tell yall see good time stock buy recent event though left concerned solana suck highest conviction bet throughout cycle far memecoin craze b seems produce horror story people actually winning big issue memecoin put argentinian president drama jupiter meteora right etc coming light crucial time weve seen downward trend typical post inauguration drop deepseaks effect nvidia threat tariff leading uncertainty market manipulation keep price lower etc obviously last piece affected crypto whole solana specific issue bit concerned im cultist crypto blockchain know every crypto community die hard never back meet naysaying anger genuinely think solana fundamentally one best blockchain major concern recent event im really hoping least see reasonable amount growth think read dont price prediction cant get full rule pull whatever reason said dont even expect u break 3 digit hope something solid hasnt stunted thing unfortunately sol lowest low cycle getting help w life issue couldnt really afford put much havent taken eye sol love coin community hoping best,0.7395,0.10120851370851369,0.42035425685425687
Reddit,solana,2025-02-19 11:09:28,2025-02-22 12:16:32.950082,fuders yesterday v today,0.0,0.0,0.0
Reddit,solana,2025-02-20 19:56:02,2025-02-22 12:16:32.950082,need help getting fund mev solana programmer needed pay goodi fund stuck mev bot cant get need experienced rust solana programmer know mevs pay 10 solana help,0.3818,0.8,0.5909
Reddit,solana,2025-02-20 13:08:20,2025-02-22 12:16:32.950082,5 min volume meme coinsso trading meme know 5 min volume crucial metric catching pump remember photon filter cant find anymore whats weird opened bullx ipad first time filer like thats awsome keep open ipad since better filtered browser version minute change something else filter gone going think volume without timeframe setting quite useless graduated coin way landscape want explore suck suggest reliably track 5 min volume aside tooltips filter,-0.2484,0.049999999999999996,-0.09920000000000001
Reddit,solana,2025-02-20 12:46:02,2025-02-22 12:16:32.950082,ive never bought meme coin stake solive staking waiting right time 300 500 thats smart move think negative stuff hear rug pull everyday cant ruin solana there got positive project solana make rug pull shenanigan,0.688,0.045454545454545456,0.3667272727272727
Reddit,solana,2025-02-20 12:25:47,2025-02-22 12:16:32.950082,github account new errorgood morning issue whereby trying grab devnet sol project trying day luck idea old github account need get devnet sol faucet arent working due rate limit error sol address anyone devnet sol kicking dont use right id appreciate hjcchqq1qslfqctxannsejpec5oaprhuucpw4db3bwxa thanks advance,0.7096,0.11941558441558442,0.4145077922077922
Reddit,solana,2025-02-20 11:09:01,2025-02-22 12:16:32.950082,happens reset computer crypto photon trading platformjust title want know need store something wallet linked account im talking photon trading platform phantom wallet,0.0772,0.0,0.0386
Reddit,solana,2025-02-20 13:15:26,2025-02-22 12:16:32.950082,img infinite money glitchi bought 50 yesterday doubled value seems paying fraction solana every couple minute seems brand new cant find much info anyone knowledge coin seems like amount solana pay scale amount,0.5423,0.16818181818181818,0.3552409090909091
Reddit,solana,2025-02-19 07:53:53,2025-02-22 12:16:32.950082,sol extremely disappointed member groupi beyond disappointed ive joined group see bunch weak paper hand panicking much compared scene troy achilles speaks young boy who messenger sent summon fight giant boagrius boy say thessalonian youre fighting he biggest man ive ever seen wouldnt want fight achilles responds thats one remember name paper hand say panicking scared reason make wife changing money,-0.9304,-0.2625,-0.59645
Reddit,solana,2025-02-20 01:36:06,2025-02-22 12:16:32.950082,bot calledfound bot buy small amount token created 0001 token rugpulled someone buy rug bot sell block buy take buy make x9999 profit saw one ended selling 500 500 buy join rug httpspreviewredditxwsmkrjv67ke1pngwidth149formatpngautowebpsf22acb7d147bfc763fc21d4ab5c24361c72a97d2,0.4939,-0.25,0.12195
Reddit,solana,2025-02-19 20:51:26,2025-02-22 12:16:32.950082,solana stolen phantom account help,-0.128,0.0,-0.064
Reddit,solana,2025-02-20 00:02:41,2025-02-22 12:16:32.950082,whats total pnl crypto memecoinsstarted 34 year back tbh dont think ive made money,0.0,0.0,0.0
Reddit,solana,2025-02-19 23:20:33,2025-02-22 12:16:32.950082,possible monitor solana transaction 3 second need helphi everyone im trying monitor solana address detect transaction le 3 second time appear solscan ive tried using rpc provider like alchemy helius 15second delay slow use case ive read online running solana validator locally might solve problem zero experience rust program python here ive tried far installed solana cli validator installed solana cli validator 8203 solana version solanacli 1173 srcc9e8f9c8 feat3079302975 clientsolanalabs solanavalidator version solanavalidator 1173 srcc9e8f9c8 feat3079302975 clientsolanalabs cargo version cargo 1841 66221abde 20241119 cloned solanaaccountsdbpluginpostgres repo 8203 git clone httpsgithubcomsolanalabssolanaaccountsdbpluginpostgresgit clone httpsgithubcomsolanalabssolanaaccountsdbpluginpostgresgithttpsgithubcomsolanalabssolanaaccountsdbpluginpostgresgit however couldnt get work seems overly complicated need since dont need database question 1 even possible detect transaction 3 second using local solana validator anyone tried successfully 2 whats easiest way set preconfigured repo example doesnt involve database 3 alternative running full validator achieve level speed id really appreciate advice example resource share thanks advance,0.908,0.05714285714285713,0.4825714285714286
Reddit,solana,2025-02-19 05:26:31,2025-02-22 12:16:32.950082,mag token stealth launch real utility token sea scam tired rug pull meme scam worthless token here something different mag token launching solana wednesday feb 19th random time 16 pm utc real utility token backed working product empty promise pure value pay attention 25 revenue share holder earn passive income insane apy 50 100k market cap 3level referral system bring trader get rewarded crosschain trading coming soon expanding beyond sol magnum another launch proven platform weve running year processed 200m trading volume 80000 registered user isnt hype real product real adoption join stealth launch contract address drop exclusively telegram group 16 pm utc launch day ready rare opportunity enter early legit project serious growth potential join community stay ahead launch reddit rmagnumtradebot importand link magnum linkshttpslinktreemagnumdexbot,0.0516,-0.0949404761904762,-0.0216702380952381
Reddit,solana,2025-02-20 04:55:43,2025-02-22 12:16:32.950082,superteam grant makei want apply solana superteam grant planning making ai agent anyone know kind ai agent solana funding,0.8271,0.6,0.7135499999999999
Reddit,solana,2025-02-19 06:31:38,2025-02-22 12:16:32.950082,forgotten next monthnext month big unlock im worried waiting pick,-0.4767,0.0,-0.23835
Reddit,solana,2025-02-20 12:13:04,2025-02-22 12:16:32.950082,solana mining worth starting nowguys new crypto want use potato pc mining solana good idea shall pivot mining something else suggest,0.6249,0.28409090909090906,0.45449545454545454
Reddit,solana,2025-02-19 20:46:43,2025-02-22 12:16:32.950082,bullx nova bot questionactually trading memecoin spying big wallet noticed profitable one excellent exit strategy always exit breakeven profit possible adresses got order executed devs never lose even rug,0.8947,0.3333333333333333,0.6140166666666667
Reddit,solana,2025-02-19 16:58:19,2025-02-22 12:16:32.950082,noobie information listso trying put together list thing know idea newbie essentially place find information usefully stepping crypto universe done ton trading however made killing mining list stand right please post thing add tool like share describe work would useful well get around work way used bot much yet making list maybe get breakdown might save work induvial learning focus towards getting people comfortable idea trading crypto thank helping thing look buying check twitter telegram website give sense community behind project effort developer project isnt going go anywhere likely time 3 active community doesnt mean huge success would however make better option coin without 3 another thing look x website telegram posted actually linked project check holder check top wallet big percentage redflag big wallet could tank price sell low cap coin 200000 mcap high percentage wallet due smaller market get past would require bigger investment someone gain high percentage coin check buy sell pressure 2m bought 2m sold mean someone farming project trade mirrored also red flag small marketcap coin buy le money cheap price get coin mitigates risk alittle always buy later higher marketcap coin buy intial take money get coin higher market capover couple million stability track record go typically set slippage buysell pressure cancel transaction thing look selling set slippage buysell pressure cancel transaction pulling profit profit pull coin 2x take intial way keep going still coin dip buy back thing manages loss dont realization profit loss converted bot bot fastest way trade able snipe low mcap new coin able sell sell order certain price percentage automated increase efficiency list bot trojan bot bullx telegram first ledger bot cloud drift bot xrp sniper bot bonk photon neo wallet phantom wallet firstledger trust coinbase tool dextools dexscanner bubble map honeypot checker solscaniohttpsolscanio etherscaniohttpetherscanio dunecomhttpdunecom koinly dextools date info tracking price tool show accurate price honeypot checker show many wallet connected insider wallet wallet trading within project coin scanner check wallet balance transaction koinly glossary term used crypto sector track portfolio profit lose tax calculator alot tool well update made discord server purpose server share information like research tool would like join message anything add let know looking bot put server offer useful informationcontent,0.9858,0.12515151515151515,0.5554757575757576
Reddit,solana,2025-02-19 07:58:06,2025-02-22 12:16:32.950082,stay safe crypto ladsif youre crypto assume everyone trying take money especially influencers random alpha group sketchy project tip influencers alpha group youre exit liquidity 99 influencers called alpha group dont actually care making money theyre dumping bag making seem like theyre giving solid call might get lucky time copytrading longterm always win lose way become real insider tiktok reddit x safeguard scam steal private key there scam going around ask run command pc moment scan device private key give access telegram well youve ever done reboot pc immediately assume youre compromised fake wallet influencers tiktok twitter flex insane gain showing huge wallet here trick screenshots photoshopped dm theyll invite video call prove actually cloned version trust wallet phantom make balance look like whale wallet ask send tt trust transaction 1 actual wallet refuse fake fake exchange use coinmarketcaps top 25 recommended hundred scam exchange offering crazy return api sign bonus etc trust top 25 exchange listed coinmarketcap even listed assume scam dust attack fake airdrop drain wallet ever seen random token appear wallet thats free money scam interact sell trade stake unknowingly approve access fund scammer drain entire wallet never touch unknown token use phantom revoke permission wallet drainers fake minting staking site scammer create fake nft minting staking site look like real thing connect wallet approve transaction drain everything stay safe always double check use burner wallet minting staking clean approval exploit hidden wallet drainers solana dapps trick approving unlimited access fund take everything anytime fix go phantom connected apps revoke permission regularly paranoid one help free harsh truth everyone crypto make money help even people youve known weeksmonths could playing long game scamming someone eager help make money probably want sound good true scam,0.9346,0.0007936507936507934,0.4676968253968254
Reddit,solana,2025-02-19 22:14:54,2025-02-22 12:16:32.950082,syndica deep dive solana dapps revenue january 2025source httpsxcomsyndica_iostatus1891952193965527226httpsxcomsyndica_iostatus1891952193965527226 1 solanahttpsxcomsolanas application revenue ratcheted january continues dominate matter news cycle explosive growth trading platform memecoins defi revenue flowing solana ecosystem like never dive report httpspreviewredditdygah29z56ke1pngwidth680formatpngautowebps80ce3b390999fb33f53d7a0c01e3d52cc9a3bf35 2 blockchain come closesolana eating web3 solanahttpsxcomsolana dapps command 75 total dapp revenue across chain cementing solanas dominance undisputed leader revenue generation httpspreviewreddit6f7xlge166ke1pngwidth679formatpngautowebps4e220bd7aec763dcfbe2965d54aeaa3424bd70d3 3 solanahttpsxcomsolana dapps set new record january raking astonishing 650m revenue hitting new benchmark blockchain solana dapps posted 24x yoy revenue growth httpspreviewredditc5q7xw9366ke1pngwidth679formatpngautowebps47c4464fdd34d9c6b1368e1715dbe50166e0fc09 4 pumpdotfunhttpsxcompumpdotfun emerged solanas highestearning dapp notably top 8 dapps focus trading underscoring massive demand highperformance trading platform speculation reign supreme primary use case user willing pay httpspreviewredditipse71m566ke1pngwidth679formatpngautowebps0e21280c33ee9e05810e6eaad8577a9d93cdacac 5 pumpdotfunhttpsxcompumpdotfun amassed half billion dollar since inception memecoin launchpad strength lie providing early access newly minted pregraduated longtail token initially exclusive platform httpspreviewredditrulb7za866ke1pngwidth679formatpngautowebps3983ab12da7ca8c33f69e537abc2873bbbc5e716 6 moonshothttpsxcommoonshot revenue mooned platform focus trading memecoins offer easy fiat onramp retail investor moonshot revenue surged 184ma 13fold mom increaseafter became first platform list trumphttpsxcomsearchq24trumpsrccashtag_click memecoin httpspreviewredditaxhpzn1b66ke1pngwidth680formatpngautowebps7eea4b34b144eed894870ecc2f7a479c3890a6c0 7 jupiterexchangehttpsxcomjupiterexchange posted nearly 10x yoy revenue growth protocol revenue reached ath 265m led perps emergence newly effective ultra swap mode catstanbul team announced 50 jupiter revenue used buy back juphttpsxcomsearchq24jupsrccashtag_click httpspreviewredditz6uss38d66ke1pngwidth680formatpngautowebps1110513f00466ce34d21f906ac2aed9a435110c0 8 jupiterexchangehttpsxcomjupiterexchanges spot trading tool achieved record revenue january jupiter spot offer dca limit order value averaging ultra mode spot trading solana despite running 7 day ultra swap generated highest revenue httpspreviewreddita7ydx5qf66ke1pngwidth680formatpngautowebpse807a3d456fd545a2647707ef038e1dea23df2ed 9 jupiterexchangehttpsxcomjupiterexchanges newest revenue driverultra swap average 503k daily revenue ultra swap offer realtime slippage estimate dynamic priority fee optimized transaction depending token swapped protocol charge 005 01 fee per swap httpspreviewreddit83mroeai66ke1pngwidth680formatpngautowebpsbba9f35a20f5a53f989dfc276dae85207541c9dd 10 jupiterexchangehttpsxcomjupiterexchanges partner achieved aths 3 month straight combined revenue soared 65m january phantomhttpsxcomphantom alone contributing 80 partner integrate jupiter swap api platform earning share swap made httpspreviewreddityu69bxnk66ke1pngwidth680formatpngautowebps451762c04edeb35fb7514e25c961f98034031ef5 11 phantomhttpsxcomphantom evolved aggregator aggregator integrating jupiter okx solana aggregator wallet offer user best swap quote phantom charge 085 fee per swap aggregator share volume relatively evenly jupiter slightly ahead httpspreviewredditk4abfh1n66ke1pngwidth680formatpngautowebpsf5b2b22112fe721bb6ab2b780c715e334f3d5070 12 meteoraaghttpsxcommeteoraag propelled solanas spot dex revenue new height meteoras newly introduced protocol fee 5 dynamic fee standard dlmm pool 20 dlmm launch pool platform earned 42m january close behind raydium 45m httpspreviewreddit1kn5uvip66ke1pngwidth680formatpngautowebps8010e2e484e5373e10d690cde187b8acc450007b 13 trump family chose meteoraaghttpsxcommeteoraags dlmm pool launch memecoins trumphttpsxcomsearchq24trumpsrccashtag_click melania token launch propelled daily revenue peak 107m stabilizing roughly 733k httpspreviewredditxoa8r2ur66ke1pngwidth680formatpngautowebpsc322551c7f928282c311166fc70a0bfe21f3d045 14 trader driven record telegram bot revenue leading pack bullx_iohttpsxcombullx_io trojanonsolanahttpsxcomtrojanonsolana drove telegram bot sector new high 120m revenue trader willing pay streamlined highconvenience experience httpspreviewreddit6lmp9i7u66ke1pngwidth680formatpngautowebpsa84388939fad64efd4ddb5de86a67d61b3049173 15 vectordotfunhttpsxcomvectordotfuns revenue soared network effect full swing vector memecoin trading app broadcaster share trade user engage broadcaster earn fee followed fueling network effect revenue surged 8x dec 24 6x jan 25 httpspreviewredditvhvld5fw66ke1pngwidth680formatpngautowebps4ca6880c6f568bf6df6839e202c1d26264bf03dd 16 vectordotfunhttpsxcomvectordotfun generates 10x revenue tensor leading solana nft marketplace product developed team business wellpositioned capitalize memecoin nft wave httpspreviewredditdf18yi1z66ke1pngwidth680formatpngautowebps7136da8f4db8d762cb4927daf6f548c9cb2a8652 17 metaplexhttpsxcommetaplex revenue reached ath fueled token creation metaplexs token metadata standard power fungible token creation across solana thriving year ecosystem metaplex seen 4x increase revenue httpspreviewreddit7beyccm176ke1pngwidth680formatpngautowebps825b36abb0832f8d28cbb65af406b98e5808783a 18 subscribe email newsletter receive report inbox httpsblogsyndicaiodeepdivesolanadappsrevenuejanuary2025httpsblogsyndicaiodeepdivesolanadappsrevenuejanuary2025 httpspreviewreddith8g9lx5476ke1pngwidth680formatpngautowebpsefe94c0a0f6c82581db04cc1457e013a7afd54a9,0.9938,0.13232057416267942,0.5630602870813397
Reddit,solana,2025-02-18 19:25:25,2025-02-22 12:16:32.950082,watching reddit go crazy already swapped usdc,-0.34,-0.6,-0.47
Reddit,solana,2025-02-20 00:46:07,2025-02-22 12:16:32.950082,beamable network launching solana bringing decentralized infrastructure gaming massive scalesource httpsxcombeamablestatus1892246770186412094httpsxcombeamablestatus1892246770186412094 big news game developer beamable network launching solanahttpsxcomsolana bringing decentralized infrastructure gaming massive scale highperformance backend built million fractional cost v traditional cloud vendor lockin full developer control future game infrastructure decentralized learn httpsbeamablecomblogbeamablenetworkexpandstosolanatopowerthefutureofgameinfrastructure follow jradoffhttpsxcomjradoff detail httpsredditcomlink1itlp3kvideolnfb1nnsx6ke1player,0.0,-0.05625000000000001,-0.028125000000000004
Reddit,solana,2025-02-18 20:23:54,2025-02-22 12:16:32.950082,solana founder crashing twitter call bitcoin memecoin,0.0,0.0,0.0
