MainSource,Source,Publication Date,Pull_date,Pre-Processed Text,Sentiment_Vader,Sentiment_TextBlob,Average_Sentiment
RSS,https://cointelegraph.com/rss,2024-12-04 11:26:09+00:00,2024-12-04 12:20:15.798250,ripple rlusd stablecoin here need know launch rlusd available ripple plan use rlusd xrp crossborder payment solution,0.3182,0.4,0.3591
RSS,https://cointelegraph.com/rss,2024-12-04 11:26:06+00:00,2024-12-04 12:20:15.798250,bitcoin bottom 94k btc trader regroup 039kimchi premium039 flash crash btc price performance slowly making market observer bullish bitcoin short timeframes,-0.4019,-0.15000000000000002,-0.27595000000000003
RSS,https://cointelegraph.com/rss,2024-12-04 11:15:36+00:00,2024-12-04 12:20:15.798250,tron copy xrp 70 039god candle039 alltime high whats next trx price tron god candle appears trx price soar 70 24 hour hit new alltime high 045 reenter top 10 cryptocurrencies,0.4404,0.1912727272727273,0.31583636363636364
RSS,https://cointelegraph.com/rss,2024-12-04 10:28:34+00:00,2024-12-04 12:20:15.798250,ai training consent perfect use case blockchain aptos cofounder aptos cofounder avery ching said india blockchain week controlling content used training ai something blockchain help,0.8074,1.0,0.9037
RSS,https://cointelegraph.com/rss,2024-12-04 09:10:28+00:00,2024-12-04 12:20:15.798250,pancakeswap introduces nocode token creation platform bnb chain pancakeswaps head chef chef kid told cointelegraph springboard ecosystem rather platform launch token,0.2732,0.0,0.1366
RSS,https://cointelegraph.com/rss,2024-12-04 07:47:28+00:00,2024-12-04 12:20:15.798250,xrp price today xrp price today south korea political turmoil profitbooking overheated condition could lead deeper correction short term,-0.3612,0.0,-0.1806
RSS,https://cointelegraph.com/rss,2024-12-04 06:43:59+00:00,2024-12-04 12:20:15.798250,crypto analyst say flash crash likely 24hour liquidation hit 618m crypto analyst said flash crash likely viewed buying opportunity signaling optimism long term,0.2263,-0.016666666666666666,0.10481666666666667
RSS,https://cointelegraph.com/rss,2024-12-04 06:30:00+00:00,2024-12-04 12:20:15.798250,crypto compliance longer optional australia new draft guideline sweeping proposed change would force crypto firm australia obtain financial licensing worry could drive innovator offshore,-0.4404,-0.02121212121212122,-0.23080606060606063
RSS,https://cointelegraph.com/rss,2024-12-04 05:57:14+00:00,2024-12-04 12:20:15.798250,safe safenet want bring visalike payment network crypto safenet aim layer connecting existing blockchains allowing user interact chain single account,0.4939,0.2142857142857143,0.35409285714285715
RSS,https://cointelegraph.com/rss,2024-12-04 05:05:50+00:00,2024-12-04 12:20:15.798250,bitcoin miner hut 8 argues toss short distort shareholder suit hut 8 argued lawsuit shareholder arose short seller attempt obtain monetary gain short position crypto miner,-0.5994,0.0,-0.2997
RSS,https://cointelegraph.com/rss,2024-12-04 04:28:13+00:00,2024-12-04 12:20:15.798250,bitcoin whale employ waitandsee strategy price hovers 96k crypto analyst highlighted significant bitcoin inflow crypto exchange whale still holding back making major move,0.2023,0.14583333333333334,0.17406666666666668
RSS,https://cointelegraph.com/rss,2024-12-04 03:49:37+00:00,2024-12-04 12:20:15.798250,enron relaunch headed prankster hint offering crypto token enron back dead 23 year massive fraud bankruptcy prankster seemingly taken brand hinting launching token,-0.8442,-0.06666666666666667,-0.4554333333333333
RSS,https://cointelegraph.com/rss,2024-12-04 02:35:41+00:00,2024-12-04 12:20:15.798250,roger ver move dismiss u tax evasion charge unconstitutional roger ver argued irs exit tax renounced u citizen 2 million asset unconstitutional impermissibly vague,-0.1027,-0.5,-0.30135
RSS,https://cointelegraph.com/rss,2024-12-04 02:29:52+00:00,2024-12-04 12:20:15.798250,russia sentence hydra market founder life prison hydra market founder stanislav moiseev 15 accomplice jailed involvement darknet market crypto mixer,-0.7351,0.0,-0.36755
RSS,https://cointelegraph.com/rss,2024-12-04 01:00:57+00:00,2024-12-04 12:20:15.798250,bitcoin range consolidation healthy next step btc attempt 100k bitcoins price cooled start december several bullish catalyst support investor anticipation 100000 btc around corner,0.7003,0.16666666666666666,0.43348333333333333
RSS,https://cointelegraph.com/rss,2024-12-03 23:19:17+00:00,2024-12-04 12:20:15.798250,crypto market claw back south korea revers martial law south korean president yoon suk yeol lifted declaration martial law six hour heightened tension south korea national assembly,-0.3182,0.0,-0.1591
RSS,https://cointelegraph.com/rss,2024-12-03 21:42:46+00:00,2024-12-04 12:20:15.798250,grayscale file sec spot solana etf grayscale join rival 21shares canary capital vaneck bitwise filing solana etf u,0.296,-0.1,0.09799999999999999
RSS,https://cointelegraph.com/rss,2024-12-03 21:33:09+00:00,2024-12-04 12:20:15.798250,here happened crypto today need know happened crypto today latest news daily trend event impacting bitcoin price blockchain defi nfts web3 crypto regulation,0.0,0.25,0.125
RSS,https://cointelegraph.com/rss,2024-12-03 21:10:03+00:00,2024-12-04 12:20:15.798250,bitcoin miner foundry lay staff amid restructuring foundry let go 16 u staff part broader restructuring includes spinning selfmining business,0.0,0.0,0.0
RSS,https://cointelegraph.com/rss,2024-12-03 20:50:47+00:00,2024-12-04 12:20:15.798250,mara roll advanced asic recycling wind power bitcoin miner save energy money using excess wind power recycled asics newly purchased facility texas,0.743,0.2681818181818182,0.5055909090909091
RSS,https://cointelegraph.com/rss,2024-12-03 20:46:28+00:00,2024-12-04 12:20:15.798250,alex mashinsky plead guilty two charge plea deal u authority charged former celsius ceo seven felony count related fraud misleading user reaching nonprosecution agreement company 2023,-0.8519,-0.16666666666666666,-0.5092833333333333
RSS,https://cointelegraph.com/rss,2024-12-03 20:17:42+00:00,2024-12-04 12:20:15.798250,virgin voyage launch first cruise product accept bitcoin new offering build previous seasonal pass offering full year worth voyage single fee,0.5423,0.13304473304473305,0.33767236652236654
RSS,https://cointelegraph.com/rss,2024-12-03 20:05:52+00:00,2024-12-04 12:20:15.798250,cardano price gain 88 ada rally getting started cardanos record high open interest metric raise concern sharp selloff strong market demand suggests ada rally could continue,0.8481,0.11708333333333334,0.48259166666666664
RSS,https://cointelegraph.com/rss,2024-12-03 19:48:56+00:00,2024-12-04 12:20:15.798250,kalshi give paul atkins 93 odds trump sec chair pick despite mixed report time publication incoming administration made official announcement regarding pick sec chair,0.0,-0.06666666666666667,-0.03333333333333333
RSS,https://cointelegraph.com/rss,2024-12-03 19:00:00+00:00,2024-12-04 12:20:15.798250,trump admin unlikely change tornado cash approach coinbase warns law firm law decoded u treasury trump administration may bring reform court handle crypto mixerrelated incident following ofacs overreach tornado cash sentencing,-0.0516,-0.2333333333333333,-0.14246666666666666
RSS,https://cointelegraph.com/rss,2024-12-03 19:00:00+00:00,2024-12-04 12:20:15.798250,fan token offer stability nfts fan token change game sport engagement outperform nfts,0.765,-0.4,0.1825
RSS,https://cointelegraph.com/rss,2024-12-03 18:32:24+00:00,2024-12-04 12:20:15.798250,peter todd advocate space miner economics might make sense though todd denies hbo documentary recently claimed real satoshi nakamoto inventor bitcoin,-0.4215,0.06666666666666667,-0.17741666666666667
RSS,https://cointelegraph.com/rss,2024-12-03 17:31:56+00:00,2024-12-04 12:20:15.798250,curve finance monthly revenue 20 defi surge past 30 day curve seen annualized revenue nearly 37 million according token terminal,0.0,-0.075,-0.0375
RSS,https://cointelegraph.com/rss,2024-12-03 17:27:37+00:00,2024-12-04 12:20:15.798250,bitget launch bitexc customized crypto exchange vietnam bitget looking capture massive market dexs open affiliate designed especially user vietnam,0.0,0.0,0.0
RSS,https://cointelegraph.com/rss,2024-12-03 16:49:05+00:00,2024-12-04 12:20:15.798250,vitalik buterin urge web3 wallet improve security privacy ethereum cofounder also proposed change ease transfer among layer2 scaling network,0.7783,0.0,0.38915
RSS,https://bitcoinmagazine.com/.rss/full/,2024-12-03 18:49:37+00:00,2024-12-04 12:20:15.798250,want another bitcoin country something itfor first time history opportunity support presidential candidate want put country bitcoin standard,0.7269,0.125,0.42595
RSS,https://bitcoinmagazine.com/.rss/full/,2024-12-03 18:03:55+00:00,2024-12-04 12:20:15.798250,bother trying scale bitcoinbitcoiners need find balance pessimism optimism looking bitcoins future rather embracing one extreme,-0.1027,-0.0625,-0.0826
RSS,https://bitcoinmagazine.com/.rss/full/,2024-12-03 17:16:33+00:00,2024-12-04 12:20:15.798250,bitcoin selfcustody threat europea look current regulation change taking shape europe could threaten bitcoiners ability right self custody,-0.5719,0.14285714285714285,-0.21452142857142856
RSS,https://bitcoinmagazine.com/.rss/full/,2024-12-03 12:33:14+00:00,2024-12-04 12:20:15.798250,lack soft fork due lack interest lack processbitcoin core developer dedicate time energy whatever part codebase find interesting important work far hasnt really soft fork proposal,0.4019,0.17916666666666667,0.2905333333333333
RSS,https://bitcoinmagazine.com/.rss/full/,2024-12-02 17:57:13+00:00,2024-12-04 12:20:15.798250,dont sell microstrategy bitcoinwhen sell bitcoin mstr others buying,0.0,0.0,0.0
RSS,https://bitcoinmagazine.com/.rss/full/,2024-12-02 16:26:12+00:00,2024-12-04 12:20:15.798250,debanked financial suppression bitcoin business must endwhy regulator must held accountable consequence operation chokepoint 20,0.0,0.0,0.0
RSS,https://bitcoinmagazine.com/.rss/full/,2024-11-29 14:00:00+00:00,2024-12-04 12:20:15.798250,december surpass november recordbreaking bitcoin price increasefrom historic gain future growth november bitcoin price breakthrough mean investor december,0.7184,-0.10416666666666667,0.3071166666666667
RSS,https://bitcoinmagazine.com/.rss/full/,2024-11-27 21:45:37+00:00,2024-12-04 12:20:15.798250,fight bitcoin united state fiscal crossroadsin chapter satoshi paper avik roy explores looming fiscal crisis present three potential response united state restriction paralysis assimilation could bitcoin emerge solutionor spark conflict,-0.6249,0.0,-0.31245
RSS,https://bitcoinmagazine.com/.rss/full/,2024-11-27 20:26:13+00:00,2024-12-04 12:20:15.798250,bitcoin price repeat november 28 ath pattern 2013 2017 2024historically bitcoin achieved alltime high ath november 28 2013 2017 november 28 2024 imminent investor speculating whether bitcoin could reach 100000 mark significant date,0.2263,0.2675,0.2469
RSS,https://bitcoinmagazine.com/.rss/full/,2024-11-27 18:37:31+00:00,2024-12-04 12:20:15.798250,bitcoiners need grow focus shitstop worrying bitcoiners bitcoin worry accomplish want,-0.296,0.0,-0.148
RSS,https://bitcoinmagazine.com/.rss/full/,2024-11-27 16:18:57+00:00,2024-12-04 12:20:15.798250,bitcoin neither racist xenophobic misogynistic response ideological stereotypingkamala harris rejection bitcoin deprives vital resource need globally trump number go approach may jeopardize america core humanitarian value like refugee resettlement program ignore bitcoins potential aid vulnerable population globally,0.0052,-0.08,-0.0374
RSS,https://bitcoinmagazine.com/.rss/full/,2024-11-27 14:23:40+00:00,2024-12-04 12:20:15.798250,here talk bitcoin thanksgiving tableshare resource dont give advice,0.0,0.0,0.0
RSS,https://bitcoinmagazine.com/.rss/full/,2024-11-27 10:22:41+00:00,2024-12-04 12:20:15.798250,michael saylor doesnt control bitcoin notion michael saylor singlehandedly decide bitcoins fate microstrategys stack simply ridiculous,-0.3612,-0.3333333333333333,-0.34726666666666667
RSS,https://bitcoinmagazine.com/.rss/full/,2024-11-26 21:52:20+00:00,2024-12-04 12:20:15.798250,maximizing bitcoin accumulation beyond benchmark bitcoin redefined digital asset landscape outperforming traditional market year year investor institution maximize bitcoin holding beyond simple buyandhold strategy,0.3612,0.0,0.1806
RSS,https://bitcoinmagazine.com/.rss/full/,2024-11-26 17:26:10+00:00,2024-12-04 12:20:15.798250,bitcoin script focus building block wild geeseconversations around script upgrade bitcoin become unfocused irrational lost serious context public square,-0.8625,-0.15833333333333333,-0.5104166666666667
RSS,https://bitcoinmagazine.com/.rss/full/,2024-11-26 17:03:29+00:00,2024-12-04 12:20:15.798250,use bitcoin easily privately cake walletcake wallet founder vik sharma team created one usable noncustodial bitcoin crypto wallet market perhaps one offer transactional privacy,0.5267,0.0,0.26335
RSS,https://bitcoinmagazine.com/.rss/full/,2024-11-26 16:53:42+00:00,2024-12-04 12:20:15.798250,remembering john mcafees bullish bitcoin price bet near 100k milestoneas bitcoin teeter brink 100000 revisit john mcafees audacious 1 million prediction exploring whether maverick wild foresight sheer madness stroke geniusand timing thing got wrong,-0.6249,-0.075,-0.34995
RSS,https://bitcoinmagazine.com/.rss/full/,2024-11-26 14:00:00+00:00,2024-12-04 12:20:15.798250,fidelity investment director share bitcoins adoption valuation modelsjurrien timmer director global macro fidelity investment recently shared bitcoin valuation model based adoption curve monetary policy scenario offering perspective asset maturing role network monetary innovation,0.8271,0.0,0.41355
RSS,https://bitcoinmagazine.com/.rss/full/,2024-11-25 17:11:37+00:00,2024-12-04 12:20:15.798250,safegcds implementation formally verifiedverifying implementation novel modular inversion algorithm using proof assistant guaranteeing bitcoin cryptography handled correctly done,0.3182,0.0,0.1591
RSS,https://bitcoinmagazine.com/.rss/full/,2024-11-25 14:15:42+00:00,2024-12-04 12:20:15.798250,newmarket capital launch battery finance bitcoincollateralized loan strategy battery finance enables borrower use bitcoin collateral loan without marking market mean bring forward bitcoins value,0.34,-0.3125,0.013750000000000012
RSS,https://bitcoinmagazine.com/.rss/full/,2024-11-25 14:00:00+00:00,2024-12-04 12:20:15.798250,invest bitcoin opensource companiesthe launch timestamp really piqued interest,0.5678,0.2,0.3839
RSS,https://bitcoinmagazine.com/.rss/full/,2024-11-22 18:38:34+00:00,2024-12-04 12:20:15.798250,jason spaceboi lowerys bitcoin thesis incoherent gibberishthis space full incoherent nonsense paraded around deep insightful analysis nothing absurd jason lowerys softwar thesis,-0.4019,-0.11000000000000001,-0.25595
RSS,https://bitcoinmagazine.com/.rss/full/,2024-11-22 17:50:03+00:00,2024-12-04 12:20:15.798250,legacy medias transformation evolution beat extinctionlegacy medium evolving audience demand transparency independence bitcoin paving way new era decentralized trustworthy journalism,0.4767,0.13636363636363635,0.3065318181818182
RSS,https://bitcoinmagazine.com/.rss/full/,2024-11-22 16:23:29+00:00,2024-12-04 12:20:15.798250,gary genslers departure triumph bitcoinas upcoming trump administration gearing establish regulatory landscape facilitating fullon anythinggoes multicoinery gary gensler gone could well see atrocious scam coin proliferate soar inevitably implode,0.128,-0.35,-0.11099999999999999
RSS,https://bitcoinmagazine.com/.rss/full/,2024-11-22 14:29:00+00:00,2024-12-04 12:20:15.798250,onchain data show bitcoin price bull run far overdespite bitcoins recent rally onchain data reveals bull market still plenty room grow metric like mvrv zscore nupl puell multiple suggest bitcoin far overheated pointing potential significant upside month ahead,0.5106,0.09583333333333333,0.3032166666666667
RSS,https://bitcoinmagazine.com/.rss/full/,2024-11-21 23:02:16+00:00,2024-12-04 12:20:15.798250,bitcoin nears 100000 trump council expected implement btc reservethis bullish bitcoin ive ever,0.0,-0.1,-0.05
RSS,https://bitcoinmagazine.com/.rss/full/,2024-11-21 22:23:20+00:00,2024-12-04 12:20:15.798250,microsoft buy 78 billion worth bitcoinmicrosoft clinging cash rejecting bitcoins proven value boost make zero sense quit wasting reserve buy btc,0.0772,0.3,0.1886
RSS,https://bitcoinmagazine.com/.rss/full/,2024-11-21 18:18:18+00:00,2024-12-04 12:20:15.798250,want greater bitcoin adoption engage governmenti tip hat digioats ceo heritage falodun stepping educate nigeria deposit insurance corporation ndic importance bitcoin,0.7717,0.5,0.63585
RSS,https://bitcoinmagazine.com/.rss/full/,2024-11-21 18:01:32+00:00,2024-12-04 12:20:15.798250,bitcoin pi cycle top indicator accurately time market cycle peaksthe bitcoin pi cycle top indicator flawlessly identified every market cycle peak bitcoins history unique mathematical foundation historical accuracy could predict next top bitcoin evolves mature market,0.7906,0.3375,0.5640499999999999
RSS,https://bitcoinmagazine.com/.rss/full/,2024-11-21 17:43:35+00:00,2024-12-04 12:20:15.798250,viable bitvm based pegsa look recent report galaxy looking economic viability two way peg secured bitvm,0.4019,0.1,0.25095
RSS,https://bitcoinmagazine.com/.rss/full/,2024-11-21 15:26:49+00:00,2024-12-04 12:20:15.798250,chart show bitcoins bull run wont stop 100000 sure might selloff far peak bitcoin,-0.0191,0.3,0.14045
RSS,https://bitcoinmagazine.com/.rss/full/,2024-11-20 18:49:28+00:00,2024-12-04 12:20:15.798250,bitcoin boost microstrategy mstr higher trading volume tesla nvidiathe bitcoin treasury effect real,0.5423,0.225,0.38365
RSS,https://bitcoinmagazine.com/.rss/full/,2024-11-20 18:12:38+00:00,2024-12-04 12:20:15.798250,jippi pokémon go bitcoin gamified bitcoin education serve catalyst hyperbitcoinization coming year jippi hope spearhead next wave bitcoin adoption offering newcomer fun friendly entry point industry,0.8555,0.225,0.54025
RSS,https://bitcoinmagazine.com/.rss/full/,2024-11-19 19:33:21+00:00,2024-12-04 12:20:15.798250,u strategic bitcoin reserve fomo horribly oversoldwould great u started buying bitcoin surely industry political capital cash let use wisely,0.7506,0.2,0.47530000000000006
RSS,https://bitcoinmagazine.com/.rss/full/,2024-11-19 18:31:11+00:00,2024-12-04 12:20:15.798250,good riddance martin gruenbergthe fdic chairman one main orchestrator operation chokepoint 20 cant leave fast enough,0.4675,0.26666666666666666,0.3670833333333333
RSS,https://bitcoinmagazine.com/.rss/full/,2024-11-19 18:01:12+00:00,2024-12-04 12:20:15.798250,stablecoins friendsstablecoins one biggest mistake ever made bitcoin space ostracized discouraged embraced,-0.6249,0.0,-0.31245
RSS,https://bitcoinmagazine.com/.rss/full/,2024-11-19 17:15:53+00:00,2024-12-04 12:20:15.798250,bitcoin treasury adoption surge meet new microstrategysinstitutional bitcoin adoption,0.2023,0.13636363636363635,0.1693318181818182
RSS,https://bitcoinmagazine.com/.rss/full/,2024-11-19 14:20:08+00:00,2024-12-04 12:20:15.798250,bitcoin multisig company casa make selfsovereignty easycasa cofounder ceo nick neuman belief taking customercentric approach help get people use multikey bitcoin vault,0.4019,0.0,0.20095
RSS,https://bitcoinmagazine.com/.rss/full/,2024-11-18 23:21:33+00:00,2024-12-04 12:20:15.798250,100000 bitcoin right around corner today tidal wave bullish bitcoin development convinced btc hit 100000 week,0.4019,0.2857142857142857,0.34380714285714287
RSS,https://bitcoinmagazine.com/.rss/full/,2024-11-18 16:41:56+00:00,2024-12-04 12:20:15.798250,buy drug get bitcoini learned nihowdy company let earn bitcoin purchasing prescription drug im intrigued,0.0,0.0,0.0
RSS,https://bitcoinmagazine.com/.rss/full/,2024-11-18 15:00:27+00:00,2024-12-04 12:20:15.798250,paint sandwich solo presentation meme digital culture nardo bitcoin mena5 footlongs meme mushroom bitcoin,0.0,0.0,0.0
RSS,https://bitcoinmagazine.com/.rss/full/,2024-11-18 12:44:36+00:00,2024-12-04 12:20:15.798250,would jesus bitcoins biggest fan holy takedeciphering divine could bitcoin modern miracle money,0.8658,0.2,0.5329
RSS,https://bitcoinmagazine.com/.rss/full/,2024-11-16 15:02:26+00:00,2024-12-04 12:20:15.798250,retail investor behind bitcoin price surge bull runanalyzing bitcoins current market dynamic uncover whats driving price,0.3818,-0.13333333333333333,0.12423333333333332
RSS,https://bitcoinmagazine.com/.rss/full/,2024-11-15 17:00:00+00:00,2024-12-04 12:20:15.798250,consensus conundrumbitcoin face oneofakind leadership problem,-0.4019,0.0,-0.20095
RSS,https://bitcoinmagazine.com/.rss/full/,2024-11-15 16:52:09+00:00,2024-12-04 12:20:15.798250,jack mallers new video bitcoin scarcity right moneyjack mallers reveals bitcoin isnt inflation hedge ultimate financial solutionhighlighting unmatched scarcity world everything else multiplies like rabbit,0.296,0.10551948051948051,0.20075974025974025
RSS,https://bitcoinmagazine.com/.rss/full/,2024-11-15 16:22:58+00:00,2024-12-04 12:20:15.798250,blackrock wont ossify bitcoinshinobi argued surge institutional bitcoin adoption lead premature ossification bitcoin protocol share concern extent le convinced necessarily true,0.8321,0.35,0.59105
RSS,https://bitcoinmagazine.com/.rss/full/,2024-11-14 22:19:17+00:00,2024-12-04 12:20:15.798250,use store bitcoin safelya stepbystep list essential tip secure online transaction powered stake,0.34,0.2,0.27
RSS,https://bitcoinmagazine.com/.rss/full/,2024-11-14 18:35:21+00:00,2024-12-04 12:20:15.798250,nation individual following excerpt satoshi paper open debate money state society bitcoin world edited natalie smolenski,0.0,0.0,0.0
RSS,https://bitcoinmagazine.com/.rss/full/,2024-11-14 18:30:00+00:00,2024-12-04 12:20:15.798250,bitcoin key unlocking dream homeownership generation priced outas housing price soar beyond reach young generation bitcoin emerges ultimate saving tool turning dream homeownership tangible reality could single bitcoin buy house near future answer may surprise,0.6369,0.021428571428571432,0.32916428571428574
RSS,https://bitcoinmagazine.com/.rss/full/,2024-11-14 18:00:00+00:00,2024-12-04 12:20:15.798250,colliderscript 50m bitcoin covenant new opcodeshow covenant built bitcoin today softforks outrageously expensive set price using hash collision andrew poelstra blockstream,-0.5719,-0.18181818181818182,-0.37685909090909087
RSS,https://bitcoinist.com/feed/,2024-12-04 10:30:18+00:00,2024-12-04 12:20:15.798250,bitcoin hodler balance drop 98 compare previous cyclesdata show bitcoin hodler balance registered drop around 98 bull run here figure looked previous cycle bitcoin hodlers seen holding go recently according data market intelligence platform intotheblock bitcoin longterm holder gradually decreasing total balance recently related,-0.0258,-0.06666666666666667,-0.046233333333333335
RSS,https://bitcoinist.com/feed/,2024-12-04 09:00:06+00:00,2024-12-04 12:20:15.798250,bitcoin wellpositioned break 100000 barrier despite shortterm volatility reportaccording recent report bitfinex bitcoin btc breaking psychologically significant 100000 barrier largely depend action two key holder cohort longterm holder lth engaging profittaking shortterm holder sth driving demand shortterm holder demand critical propel bitcoin 100000 bitcoins price surged impressive 373,0.296,0.2611607142857143,0.2785803571428571
RSS,https://bitcoinist.com/feed/,2024-12-04 07:30:02+00:00,2024-12-04 12:20:15.798250,new crypto era begin trump announce sec chair pick soon tomorrowfollowing gary genslers departure announcement security exchange commission sec new report claim reelected u president donald trump set unveil pick new sec chairman coming day related reading spot xrp etf race heat wisdomtree file s1 application sec new crypto era,0.34,0.016161616161616155,0.1780808080808081
RSS,https://bitcoinist.com/feed/,2024-12-04 06:00:12+00:00,2024-12-04 12:20:15.798250,crypto exchange witness historic institutional surge binance take lead 2024the cryptocurrency exchange market appears undergone transformative shift 2024 driven largely significant uptick institutional activity according insight shared cryptoquant quicktake platform major exchange witnessing unprecedented growth bitcoin usdt deposit trend highlight increasing confidence institutional investor digital asset,0.9186,0.20750000000000002,0.56305
RSS,https://bitcoinist.com/feed/,2024-12-04 04:30:32+00:00,2024-12-04 12:20:15.798250,hoskinson cheer cardano process massive 134000 transaction per secondcardano processed 134000 transaction per second tps marking significant milestone platform development charles hoskinson ceo input output global iog shared enthusiasm x stating bad cardano hailhydra alongside screenshot displaying 134464 tps bad cardano hailhydra pictwittercomeiztrjc9ii charles hoskinson iohk_charles december 3 2024,0.34,-0.17083333333333328,0.08458333333333337
RSS,https://bitcoinist.com/feed/,2024-12-04 01:30:50+00:00,2024-12-04 12:20:15.798250,bitcoin break crypto ecosystem altseason differentbitcoin experienced day ranging price action following recent drop 99k 90k price holding 95k level area crucial determining whether btc continue ascent toward 100k mark retrace find liquidity lower level btc fails,-0.7269,0.06666666666666667,-0.33011666666666667
RSS,https://bitcoinist.com/feed/,2024-12-04 00:00:45+00:00,2024-12-04 12:20:15.798250,dogecoin investor advised ideal exit point amid rally targetsdogecoin believed surge significantly ongoing market cycle new level due past trend cycle performance bigger previous one community awaits rally crypto analyst highlighted several exit point investor order prevent substantial loss profittaking zone dogecoin audacious,0.6369,0.10871212121212119,0.3728060606060606
