MainSource,Source,Publication Date,Pull_date,Pre-Processed Text,Sentiment_Vader,Sentiment_TextBlob,Average_Sentiment
RSS,https://cointelegraph.com/rss,2024-11-10 10:27:39+00:00,2024-11-10 12:16:19.340080,ethereum hit 32k surpassing bank america market cap ethereums market cap top bank america sec weighs spot eth etf option defi gain traction,0.6369,0.2,0.41845
RSS,https://cointelegraph.com/rss,2024-11-10 08:44:08+00:00,2024-11-10 12:16:19.340080,ada price pump 30 amid rumor cardano foundertrump collaboration ada look poised rise 100 early 2025 breaking threeyearold resistance trendline,0.25,0.1,0.175
RSS,https://cointelegraph.com/rss,2024-11-10 07:59:45+00:00,2024-11-10 12:16:19.340080,charles hoskinson share new plan help foster039 u crypto policy cardano founder charles hoskinson stated come crypto policy united state get done,0.7717,0.13636363636363635,0.4540318181818182
RSS,https://cointelegraph.com/rss,2024-11-10 07:46:07+00:00,2024-11-10 12:16:19.340080,bitcoin ripe 039major leg down039 btc price nears 80k trader bitcoin well price discovery stopping market participant predicting snap btc price comedown,-0.0772,0.0,-0.0386
RSS,https://cointelegraph.com/rss,2024-11-10 05:41:21+00:00,2024-11-10 12:16:19.340080,bitcoin break 79k 039no rash action needed039 say analyst bitcoin broken 79000 price level first time many trader sharing sentiment beginning,-0.4588,0.11249999999999999,-0.17315
RSS,https://cointelegraph.com/rss,2024-11-10 04:02:16+00:00,2024-11-10 12:16:19.340080,btc 77k rally won039t spark overvaluation fear like stock bitwise ceo bitcoiners dont fear overvaluation way stock trader say bitwise invests ceo bitcoin reached new alltime high week,0.4986,0.1481818181818182,0.32339090909090906
RSS,https://cointelegraph.com/rss,2024-11-09 23:02:58+00:00,2024-11-10 12:16:19.340080,btcs incoming 110k call blackrocks 11b inflow day hodlers digest nov 3 9 analyst forecast 110k bitcoin price blackrock see 1 billion daily inflow spot bitcoin etf hodlers digest,0.0,0.0,0.0
RSS,https://cointelegraph.com/rss,2024-11-09 21:05:08+00:00,2024-11-10 12:16:19.340080,here happened crypto today need know happened crypto today latest news daily trend event impacting bitcoin price blockchain defi nfts web3 crypto regulation,0.0,0.25,0.125
RSS,https://cointelegraph.com/rss,2024-11-09 20:34:40+00:00,2024-11-10 12:16:19.340080,ftx bankruptcy estate sue anthony scaramucci skybridge capital ftx alameda research collapsed november 2022 causing approximately 8 billion loss customer nowbankrupt exchange,-0.5267,-0.4,-0.46335
RSS,https://cointelegraph.com/rss,2024-11-09 18:07:22+00:00,2024-11-10 12:16:19.340080,cumulative traffic exchange increased 8 october report election procrypto president procrypto lawmaker united state brought renewed attention crypto market,0.5994,0.0,0.2997
RSS,https://cointelegraph.com/rss,2024-11-09 16:25:00+00:00,2024-11-10 12:16:19.340080,helium mining still profitable helium mining profitable factor like location network congestion hnt price fluctuation influence earnings,0.8074,0.0,0.4037
RSS,https://cointelegraph.com/rss,2024-11-09 14:05:09+00:00,2024-11-10 12:16:19.340080,vitalik explores potential info finance eth top 3k ethereums vitalik buterin proposes info finance pioneering framework harness blockchain ai factual insight,0.2023,0.25,0.22615000000000002
RSS,https://cointelegraph.com/rss,2024-11-09 13:30:00+00:00,2024-11-10 12:16:19.340080,new trump administration may boost crypto devil detail next four year highly favorable digital asset sector thoughtful legislation critical,0.5799,0.11606060606060607,0.34798030303030303
RSS,https://cointelegraph.com/rss,2024-11-09 13:28:22+00:00,2024-11-10 12:16:19.340080,trump win drive bitcoin 76k planb set 500k target bitcoin broke 76000 following trump election victory planbs stocktoflow model forecasting 500000 btc price within four year,0.25,0.4,0.325
RSS,https://cointelegraph.com/rss,2024-11-09 09:30:05+00:00,2024-11-10 12:16:19.340080,norway support mica considers cbdc financial stability norge bank back eu mica regulation considering cbdc enhance crossborder payment support financial stability norway,0.6597,0.0,0.32985
RSS,https://cointelegraph.com/rss,2024-11-09 08:50:24+00:00,2024-11-10 12:16:19.340080,bitcoin pundit wary 039spoof city039 sour btc price gain 77k bitcoin acting weird one commentator argues btc price gain fail capitalize incremental new alltime high,-0.0,-0.1933766233766234,-0.0966883116883117
RSS,https://cointelegraph.com/rss,2024-11-09 06:22:23+00:00,2024-11-10 12:16:19.340080,founder bitcoin fog crypto mixer sentenced 125 year jail bitfog founder roman sterlingov sentenced 125 year prison forced pay forfeiture money judgment around 3955 million,-0.7845,-0.2,-0.49224999999999997
RSS,https://cointelegraph.com/rss,2024-11-09 04:39:20+00:00,2024-11-10 12:16:19.340080,blackrock039s spot ether etf clock 603m inflow highest 94 day significant daily inflow blackrocks spot ether etf come ether price seen biggest weekly gain since may 2024,0.6369,0.1875,0.4122
RSS,https://cointelegraph.com/rss,2024-11-09 02:41:07+00:00,2024-11-10 12:16:19.340080,crypto community reacts report wall st lawyer sec chair role latest rumored candidate donald trump upcoming administration potentially replace sec chair gary gensler sparked mixed reaction crypto community,0.0,0.06000000000000001,0.030000000000000006
RSS,https://cointelegraph.com/rss,2024-11-08 22:00:00+00:00,2024-11-10 12:16:19.340080,crypto biz u election crown polymarket week crypto biz feature polymarket blackrocks ibit hitting 1b volume metas llama joining u military bitcoin miner posting production record october vaneck listing pyth etn,0.0,-0.1,-0.05
RSS,https://cointelegraph.com/rss,2024-11-08 21:50:00+00:00,2024-11-10 12:16:19.340080,binance lab venture desci bio protocol investment decentralized science dao support healthcare effort might otherwise attract sufficient funding give stakeholder say management,0.6369,0.0,0.31845
RSS,https://cointelegraph.com/rss,2024-11-08 21:45:02+00:00,2024-11-10 12:16:19.340080,canadian police praise tether swift recovery stolen fund stablecoin firm previously came fire wyoming senator cynthia lummis allegedly facilitating illicit finance activity,-0.0516,-0.15555555555555556,-0.10357777777777778
RSS,https://cointelegraph.com/rss,2024-11-08 21:40:46+00:00,2024-11-10 12:16:19.340080,ftx try reclaim 11m cryptocomcontrolled alameda account alameda research filed complaint crypto exchange kucoin cryptocom recover million locked fund ftx prepares repay user,-0.296,-0.3,-0.298
RSS,https://cointelegraph.com/rss,2024-11-08 21:15:00+00:00,2024-11-10 12:16:19.340080,microstrategy share 20 week following trump victory rate cut mstr surged 486 past 12 month company planning expand bitcoin holding 42 billion purchase 2027,0.34,-0.125,0.10750000000000001
RSS,https://cointelegraph.com/rss,2024-11-08 21:00:00+00:00,2024-11-10 12:16:19.340080,ethereum enters scarcity mode paving way eth rally 6k analyst ether price metric replicated 3 key bullish action resulted 120 rally q1 2024 happen,0.0,0.05,0.025
RSS,https://cointelegraph.com/rss,2024-11-08 20:52:49+00:00,2024-11-10 12:16:19.340080,sec mull approving ethereum etf option include option bitwise ethereum etf grayscale ethereum trust grayscale ethereum mini trust well trust hold ether filing said,0.9001,-0.1,0.40005
RSS,https://cointelegraph.com/rss,2024-11-08 20:19:16+00:00,2024-11-10 12:16:19.340080,republican senate 2 crypto race still grab democrat ruben gallego leading race arizona senate race republican sam brown trailed nevada,0.0,0.0,0.0
RSS,https://cointelegraph.com/rss,2024-11-08 20:00:00+00:00,2024-11-10 12:16:19.340080,ethereum trader closely watching ethbtc chart spoiler alert it039s bullish lagging bitcoin 2024 ethereum appears early stage bullish trend reversal here trader closely watching ethbtc pair,0.0258,0.1,0.0629
RSS,https://cointelegraph.com/rss,2024-11-08 19:28:17+00:00,2024-11-10 12:16:19.340080,north korean hacker bluenoroff target crypto firm new malware according cybersecurity firm recorded future north korean hacker group stolen approximately 3 billion fund since 2017,-0.4939,-0.13272727272727275,-0.3133136363636364
RSS,https://cointelegraph.com/rss,2024-11-08 19:00:00+00:00,2024-11-10 12:16:19.340080,ether set 32k breakout coinbase exec urge sec reform finance redefined trump presidential victory inspired new wave optimism including prediction imminent ether rally 3200 hope reform u sec,0.8625,-0.02121212121212122,0.4206439393939394
RSS,https://bitcoinmagazine.com/.rss/full/,2024-11-08 19:02:07+00:00,2024-11-10 12:16:19.340080,half way 4 year bitcoin cyclebitcoins fouryear rhythm midcycle insight investor expect,0.0,-0.16666666666666666,-0.08333333333333333
RSS,https://bitcoinmagazine.com/.rss/full/,2024-11-08 17:32:26+00:00,2024-11-10 12:16:19.340080,dont lose sight bitcoin missionfighting transaction privacy need remain core,0.3089,0.0,0.15445
RSS,https://bitcoinmagazine.com/.rss/full/,2024-11-08 15:00:00+00:00,2024-11-10 12:16:19.340080,democrat must embrace bitcoin surviveif democratic party future u politics must embrace bitcoin going forward,0.743,0.0,0.3715
RSS,https://bitcoinmagazine.com/.rss/full/,2024-11-08 14:00:00+00:00,2024-11-10 12:16:19.340080,trump bitcoins saviortrump going good thing bitcoin continue malicious path regulation followed biden,0.4404,0.7,0.5702
RSS,https://bitcoinmagazine.com/.rss/full/,2024-11-08 11:32:46+00:00,2024-11-10 12:16:19.340080,bitcoins time come u election result trump win put world notice embrace bitcoin get left behind,0.7269,0.13333333333333333,0.43011666666666665
RSS,https://bitcoinmagazine.com/.rss/full/,2024-11-07 15:03:06+00:00,2024-11-10 12:16:19.340080,bitcoin report key trend insight bitcoin price forecastdiscover key insight expert analysis bullish bitcoin price forecast featured october 2024 edition bitcoin report,0.0,0.0,0.0
RSS,https://bitcoinmagazine.com/.rss/full/,2024-11-07 11:56:06+00:00,2024-11-10 12:16:19.340080,satoshi nakamoto robin hood digital age stole himselfin modernday robin hood tale satoshi nakamoto didnt rob richhe stole discover bitcoins mysterious creator rewrote rule wealth redistribution without tights crossbow gave power back people,0.7289,0.0,0.36445
RSS,https://bitcoinmagazine.com/.rss/full/,2024-11-06 07:55:14+00:00,2024-11-10 12:16:19.340080,probitcoin donald trump becomes 47th president united state bitcoin magazine report la vega realtime election result powered stand crypto,0.4215,0.0,0.21075
RSS,https://bitcoinmagazine.com/.rss/full/,2024-11-05 12:41:43+00:00,2024-11-10 12:16:19.340080,trump coin revolutionary onecoini dont think donald trump actually changed mind cryptocurrency much since three year ago think want scam,-0.5267,0.1,-0.21334999999999998
RSS,https://bitcoinmagazine.com/.rss/full/,2024-11-04 20:08:05+00:00,2024-11-10 12:16:19.340080,u establish strategic bitcoin reservewe send message world,0.0,0.0,0.0
RSS,https://bitcoinmagazine.com/.rss/full/,2024-11-04 19:19:05+00:00,2024-11-10 12:16:19.340080,paid bitcoin btcpay documentary showcase bitcoin medium exchange bitcoin 2024 conference nashvillewatch new documentary paid bitcoin bitcoin use bitcoin 2024 nashville,0.0,0.04545454545454545,0.022727272727272724
RSS,https://bitcoinmagazine.com/.rss/full/,2024-11-04 15:30:29+00:00,2024-11-10 12:16:19.340080,im grateful trump embrace bitcoinas u face consequential election lifetime trump administration offer unprecedented opportunity bitcoin community,0.7964,0.6,0.6981999999999999
RSS,https://bitcoinmagazine.com/.rss/full/,2024-11-01 22:25:58+00:00,2024-11-10 12:16:19.340080,coinbase embarrassing buying bitcoincoinbase fumbling obvious stop buying back share start stacking sat already,-0.3818,0.0,-0.1909
RSS,https://bitcoinmagazine.com/.rss/full/,2024-11-01 17:59:39+00:00,2024-11-10 12:16:19.340080,bitcoin time high postponed please hodlwho win election dictate see new time high,0.6486,0.3140909090909091,0.4813454545454545
RSS,https://bitcoinmagazine.com/.rss/full/,2024-11-01 16:50:43+00:00,2024-11-10 12:16:19.340080,bitcoins price matter lotits okay excited bitcoin hitting new alltime high fact pumped,0.5267,0.29284090909090904,0.40977045454545447
RSS,https://bitcoinmagazine.com/.rss/full/,2024-11-01 15:47:09+00:00,2024-11-10 12:16:19.340080,mathematically forecasting peak bitcoin price next bull cycle bitcoins bull cycle price prediction historical pattern tell u next peak,0.0,0.0,0.0
RSS,https://bitcoinmagazine.com/.rss/full/,2024-11-01 14:47:51+00:00,2024-11-10 12:16:19.340080,basically nothing got 500 bitcoinproducts like lolli fold like hack make stacking sat easy,0.7845,0.43333333333333335,0.6089166666666667
RSS,https://bitcoinmagazine.com/.rss/full/,2024-10-31 17:14:57+00:00,2024-11-10 12:16:19.340080,whitepaper simplest idea profoundthe bitcoin whitepaper barely describes tiny portion bitcoin protocol vaguely bit cover important,0.2023,-0.012499999999999997,0.09490000000000001
RSS,https://bitcoinmagazine.com/.rss/full/,2024-10-31 15:50:26+00:00,2024-11-10 12:16:19.340080,latest fake satoshi fake bitcoin creator needthe newest fake satoshi nakamoto refreshing reminder medium need stop looking bitcoins creator,-0.8885,-0.1,-0.49424999999999997
RSS,https://bitcoinmagazine.com/.rss/full/,2024-10-31 10:26:18+00:00,2024-11-10 12:16:19.340080,today bitcoins birthdayyes bitcoin first proposed via satoshis white paper october 31 2008 doesnt mean today bitcoins birthday,0.0,-0.020833333333333332,-0.010416666666666666
RSS,https://bitcoinmagazine.com/.rss/full/,2024-10-31 05:00:00+00:00,2024-11-10 12:16:19.340080,forget vampire werewolvesthe scariest costume halloween money printerforget dracula werewolvesthis halloween real terror come fiat currency money printer costume inflation haunt wallet bitcoin step hero save u horror currency debasement,-0.5994,0.2,-0.19970000000000002
RSS,https://bitcoinmagazine.com/.rss/full/,2024-10-30 16:03:50+00:00,2024-11-10 12:16:19.340080,bitcoin popularity index bpi measure bitcoin interest around worldthe bitcoin popularity index unique tool measuring global bitcoin interest google search data highlighting key adoption trend,0.9042,0.125,0.5146
RSS,https://bitcoinmagazine.com/.rss/full/,2024-10-30 15:31:04+00:00,2024-11-10 12:16:19.340080,david marcus paypal president bitcoin believerleading team lightspark david marcus poised make lightning network biggest payment network world,0.25,0.0,0.125
RSS,https://bitcoinmagazine.com/.rss/full/,2024-10-30 10:18:46+00:00,2024-11-10 12:16:19.340080,bitcoin best year ever 2024 breakthrough year wed long waited,0.6369,0.475,0.5559499999999999
RSS,https://bitcoinmagazine.com/.rss/full/,2024-10-29 16:55:39+00:00,2024-11-10 12:16:19.340080,bhutan another country using bitcoin escape povertya first hand look effect bhutan bitcoin policy,0.5994,0.25,0.4247
RSS,https://bitcoinmagazine.com/.rss/full/,2024-10-29 14:07:04+00:00,2024-11-10 12:16:19.340080,21 million fashion make bitcoin clothes worth sats21 million fashion bitcoin clothing brand combine fashion crypto get best,0.7269,0.65,0.68845
RSS,https://bitcoinmagazine.com/.rss/full/,2024-10-28 18:14:48+00:00,2024-11-10 12:16:19.340080,trump momentum big rig bitcoin candidate wini think game democrat,-0.128,-0.2,-0.164
RSS,https://bitcoinmagazine.com/.rss/full/,2024-10-28 18:07:42+00:00,2024-11-10 12:16:19.340080,money electric distracted nonsenseas someone wrote book origin story bitcoin felt still watch money electric perhaps comment take even watching purpose waste time,-0.6369,-0.2,-0.41845
RSS,https://bitcoinmagazine.com/.rss/full/,2024-10-28 16:55:34+00:00,2024-11-10 12:16:19.340080,ark could potentially learn lightninga rough idea ark service provider could manage liquidity efficiently create cheaper smoother experience user,0.5859,-0.05,0.26794999999999997
RSS,https://bitcoinmagazine.com/.rss/full/,2024-10-28 13:37:29+00:00,2024-11-10 12:16:19.340080,bitcoin wont let transcend politicsbitcoin escape hatch stop caring political process,0.4019,0.0,0.20095
RSS,https://bitcoinmagazine.com/.rss/full/,2024-10-25 18:46:16+00:00,2024-11-10 12:16:19.340080,microsoft invests bitcoin likely via spot etfsmicrosofts management may choose invest bitcoin etf holding coin,0.0,0.0,0.0
RSS,https://bitcoinmagazine.com/.rss/full/,2024-10-25 18:26:24+00:00,2024-11-10 12:16:19.340080,satoshi nakamoto statue lugano inspiring luganos new disappearing satoshi nakamoto statue beautiful tribute bitcoins anonymous founder,0.7717,0.4954545454545454,0.6335772727272727
RSS,https://bitcoinmagazine.com/.rss/full/,2024-10-25 15:18:08+00:00,2024-11-10 12:16:19.340080,lightspark announces new bitcoin l2 upgraded uma capabilitieslightspark unveils new bitcoin l2 broadens functionality universal money address uma standard release uma extend uma auth uma request,0.1779,0.06818181818181818,0.12304090909090909
RSS,https://bitcoinmagazine.com/.rss/full/,2024-10-25 14:08:20+00:00,2024-11-10 12:16:19.340080,bitcoin repeating previous bull cyclesare repeating pattern accustomed time something different,0.0,-0.08333333333333333,-0.041666666666666664
RSS,https://bitcoinmagazine.com/.rss/full/,2024-10-24 17:20:48+00:00,2024-11-10 12:16:19.340080,blackrocks ibit bitcoin etf successful new etf 4 yearsinstitutional investment bitcoin getting started,0.5859,0.4431818181818182,0.5145409090909091
RSS,https://bitcoinmagazine.com/.rss/full/,2024-10-24 13:10:15+00:00,2024-11-10 12:16:19.340080,ecb economist arent exactly wrong bitcoin theyre uselessa recent paper ecb author claim existence bitcoin could impoverish nonholders latecomer drew ire many bitcoiners isnt essentially hyperbitcoinization,0.3724,0.0,0.1862
RSS,https://bitcoinmagazine.com/.rss/full/,2024-10-24 13:01:06+00:00,2024-11-10 12:16:19.340080,jack dorsey influence bitcoin learned jack dorsey provides 60 bitcoin core funding think need decentralize support,0.4019,0.0,0.20095
RSS,https://bitcoinmagazine.com/.rss/full/,2024-10-23 12:00:06+00:00,2024-11-10 12:16:19.340080,shielded csv protocol revolutionary design blockchains compatible bitcoin,0.0,0.0,0.0
RSS,https://bitcoinmagazine.com/.rss/full/,2024-10-23 08:39:07+00:00,2024-11-10 12:16:19.340080,bitcoin fait accomplibitcoin longer experimental new project decade ago still fail,-0.5423,-0.08787878787878789,-0.31508939393939395
RSS,https://bitcoinmagazine.com/.rss/full/,2024-10-22 20:56:50+00:00,2024-11-10 12:16:19.340080,prediction market pricing trump victory good bitcoinif prediction market correct probitcoin trump shoein white house,0.4404,0.35,0.3952
RSS,https://bitcoinmagazine.com/.rss/full/,2024-10-22 18:52:36+00:00,2024-11-10 12:16:19.340080,spoonful bitcoin mary poppins awakens u financial sovereignty mary poppins mr bank journey rigid conformity joyful liberation mirror transformative power bitcoin discovers true wealth lie freedom invited rethink relationship money embrace financial sovereignty bitcoin offer,0.9423,0.11666666666666665,0.5294833333333333
RSS,https://bitcoinmagazine.com/.rss/full/,2024-10-22 16:00:00+00:00,2024-11-10 12:16:19.340080,metric matter lightning networka look valuable metric measuring effectiveness lightning network routing payment,0.4939,0.0,0.24695
RSS,https://bitcoinmagazine.com/.rss/full/,2024-10-22 15:19:15+00:00,2024-11-10 12:16:19.340080,bitcoin yield dollar yes please trusted u bitcoin exchange river offer bitcoin yield dollar bitcoin interest cash feature great addition platform bitcoin enthusiast normies alike,0.9493,0.8,0.87465
RSS,https://bitcoinmagazine.com/.rss/full/,2024-10-22 14:41:14+00:00,2024-11-10 12:16:19.340080,bitaxe opensource bitcoin mining movementbitaxe founder skot created first ever opensource asicbased bitcoin miner he inspired 4000 others contribute opensource bitcoin mining project,0.6369,0.25,0.44345
RSS,https://bitcoinmagazine.com/.rss/full/,2024-10-22 14:35:40+00:00,2024-11-10 12:16:19.340080,world largest prediction market polymarket trump biased clear polymarket lean protrump aware,0.128,0.175,0.1515
RSS,https://bitcoinmagazine.com/.rss/full/,2024-10-22 11:00:26+00:00,2024-11-10 12:16:19.340080,microstrategy ceo michael saylor reveals bitcoin mstr plansome argue selfcustody nothing else core bitcoin fact trust one hold safeguard wealth,0.7717,0.0,0.38585
RSS,https://bitcoinmagazine.com/.rss/full/,2024-10-21 21:14:47+00:00,2024-11-10 12:16:19.340080,6 step move old 401k bitcoin irathe latest guide unchained offer stepbystep instruction transferring 401k ira ahead next bull run,0.0,0.19999999999999998,0.09999999999999999
RSS,https://bitcoinmagazine.com/.rss/full/,2024-10-21 16:45:52+00:00,2024-11-10 12:16:19.340080,upside world spook hero hero spooksdistorted perception reality completely inverted perception acting best interest bitcoin versus acting interest way put bitcoin risk,0.946,0.275,0.6105
RSS,https://bitcoinmagazine.com/.rss/full/,2024-10-21 16:37:09+00:00,2024-11-10 12:16:19.340080,ecb get wrong bitcoin recent paper researcher european central bank make handful claim bitcoin lack context nuance andor evidence im shed light got wrong,-0.8176,-0.09999999999999999,-0.4588
RSS,https://bitcoinmagazine.com/.rss/full/,2024-10-21 11:00:00+00:00,2024-11-10 12:16:19.340080,kamala presidency could bullish bitcoina trump victory almost certainly ensures one outcome crypto security continue flourish unchecked,0.5434,0.21428571428571427,0.37884285714285715
RSS,https://bitcoinist.com/feed/,2024-11-10 11:00:44+00:00,2024-11-10 12:16:19.340080,crypto analyst sound 160 breakout alarm meme coin dogecoin shiba inuthe crypto industry reveling bullish sentiment meme coin also participating action notably crypto analyst tradingview platform dropped interesting 160 bullish outlook meme coin neither dogecoin shiba inu instead focus dog relatively new meme cryptocurrency,0.0772,0.32727272727272727,0.20223636363636363
RSS,https://bitcoinist.com/feed/,2024-11-10 09:30:42+00:00,2024-11-10 12:16:19.340080,crypto mixer jailed 125 year 400m money laundering convictionthe founder crypto mixing platform end u prison cell call home 125 year federal court ruled crypto firm owner guilty money laundering related reading 121 billion trump effect binances changpeng zhao cash big sentence serf,-0.8402,-0.175,-0.5075999999999999
RSS,https://bitcoinist.com/feed/,2024-11-10 08:00:29+00:00,2024-11-10 12:16:19.340080,trump pick wall street lawyer considered sec chaira major revamp change u regulatory landscape lot incoming president donald trump officer choice steer future direction sec richard farley seasoned partner new york highpoint law firm kramer levin naftalis frankel made,0.0,0.006980519480519476,0.003490259740259738
RSS,https://bitcoinist.com/feed/,2024-11-10 06:30:01+00:00,2024-11-10 12:16:19.340080,gotcha tether join force canadian authority track stolen cryptotether back spotlight time assisting authority solving crypto crime according multiple report stablecoin firm recently helped ontario provincial police crypto robbery worth 10000 cad tether worked cyber investigation team recover lost fund showcasing company increasing commitment,-0.0772,0.019999999999999997,-0.028600000000000004
RSS,https://bitcoinist.com/feed/,2024-11-10 05:00:01+00:00,2024-11-10 12:16:19.340080,dogecoin price see bimonthly rsi rise 2020 level here happened last timecrypto analyst trader tardigrade highlighted similarity dogecoin price action witnessed 2020 analyst revealed happened last time pattern formed dogecoin chart expect dogecoin price see bimonthly rise 2020 level x post trader tardigrade revealed,0.0,0.03333333333333333,0.016666666666666666
RSS,https://bitcoinist.com/feed/,2024-11-10 03:30:35+00:00,2024-11-10 12:16:19.340080,crypto secret chinese man sentenced life selling state infostate authority china patching loophole national confidentiality regulation discovered one colleague assigned confidential unit sold state secret foreign contact pay debt incurred crypto investment loss incident prompt chinese official ass confidentiality system closely address,-0.8176,-0.185,-0.5013
RSS,https://bitcoinist.com/feed/,2024-11-10 02:00:42+00:00,2024-11-10 12:16:19.340080,bitcoin analyst set 88800 target btc break ath 3 day row detailsbitcoin recordbreaking run reaching new alltime high three consecutive day following donald trump victory u election recent 25 basis point rate cut federal reserve combination political economic shift fueled renewed wave investor interest btc driving price uncharted,0.4019,0.08272727272727273,0.24231363636363634
RSS,https://bitcoinist.com/feed/,2024-11-10 00:30:59+00:00,2024-11-10 12:16:19.340080,dogecoin v shiba inu investment firm reveals shib outperform doge 2025the rivalry shiba inu shib dogecoin doge continues rage making headline becoming top discussion among crypto community member recently investment firm sistine research unveiled shiba inu chart analysis suggests shib might poised outperform doge 2025 chart analysis point possible increase,0.128,0.09166666666666667,0.10983333333333334
