MainSource,Source,Publication Date,Pull_date,Pre-Processed Text,Sentiment_Vader,Sentiment_TextBlob,Average_Sentiment
Reddit,solana,2024-10-31 11:22:31,2024-11-05 12:18:39.078109,21 analytics add solana support boosting institutional adoption right tool,0.6249,0.2857142857142857,0.45530714285714285
Reddit,solana,2024-10-31 22:33:56,2024-11-05 12:18:39.078109,colosseum codex switchboard foundation radar side track winner solana ecosystem pagesource httpsblogcolosseumorgswitchboardfoundationradarsidetrackssolanaecosystempagehttpsblogcolosseumorgswitchboardfoundationradarsidetrackssolanaecosystempage switchboard foundation radar side track winner electric capital developer report solana ecosystem page httpspreviewredditj5gtfovs46yd1pngwidth960formatpngautowebps4b52ed95ce6670f06924eb6e7920b71db96a524a switchboard foundation switchboard officially partnered switchboard foundation drive forward decentralization protocol move strengthens switchboard mission deliver truly permissionless scalable data feed crucial empowering web3 developer business project alike since launch switchboard aimed provide unrestricted access data feed creation theyre evolving fully communitydriven decentralized protocol foundation foster growth strategic partnership support communityled governance oversee switchboard daos initiative switchboard foundation grouphttpsdocsswitchboardfoundationrefblogcolosseumorg radar side track winner radar hackathon saw wide range side local track targeting specific theme geographic region sponsor objective side track alone 1k submission 300k reward stake official hackathon result finalized big list winner various side track solana zero hackathon sol_idityhttpstwittercomsol_idityrefblogcolosseumorg gaming rush track send_arcadehttpstwittercomsend_arcaderefblogcolosseumorg future digital asset track projectselyohttpstwittercomprojectselyorefblogcolosseumorg wellness wearable application track shellaisolhttpstwittercomshellaisolrefblogcolosseumorg build apps using okto web3 track emojipayithttpstwittercomemojipayitrefblogcolosseumorg payment stack integration track paywithripehttpstwittercompaywithriperefblogcolosseumorg reclaim protocol integration track zkonnect_socialhttpstwittercomzkonnect_socialrefblogcolosseumorg av leveraging restaking track adrasteafinancehttpstwittercomadrasteafinancerefblogcolosseumorg data stream tool track pumpfunwhaleshttpsxcomitsaditya_xyzrefblogcolosseumorg tokenbased governance framework track nyt daohttpsxcom0x7manishrefblogcolosseumorg germany digital asset track openshelf_xyzhttpstwittercomopenshelf_xyzrefblogcolosseumorg indonesia local radar hackathon plutoleveragehttpstwittercomplutoleveragerefblogcolosseumorg thailand local radar hackathon sinestiaethhttpstwittercomsinestiaethrefblogcolosseumorg germany local track ctrlx_worldhttpstwittercomctrlx_worldrefblogcolosseumorg france local track gotokamaihttpstwittercomgotokamairefblogcolosseumorg canada local track bestlendhttpstwittercom_bestlend_refblogcolosseumorg demo day nigeria ribhfinancehttpstwittercomribhfinancerefblogcolosseumorg demo day turkey lexiconinfrahttpstwittercomlexiconinfrarefblogcolosseumorg singapore local track elfa_aihttpsxcomelfa_airefblogcolosseumorg philippine local track projectselyohttpstwittercomprojectselyorefblogcolosseumorg superteam vietnam track polyquestsolhttpstwittercompolyquestsolrefblogcolosseumorg demo day balkan verve_wallethttpstwittercomverve_walletrefblogcolosseumorg apubcc buildstation blinkfundhttpstwittercomblinkfundrefblogcolosseumorg wormhole turkey side track winkitblinkhttpstwittercomwinkitblinkrefblogcolosseumorg malaysia local track solanabreakshttpstwittercomsolanabreaksrefblogcolosseumorg depin track fitlensdotxyzhttpstwittercomfitlensdotxyzrefblogcolosseumorg creator track viora_apphttpstwittercomviora_apprefblogcolosseumorg green track whiplanohttpstwittercomwhiplanorefblogcolosseumorg side local track resultshttpsxcomsuperteamearnstatus1849815690028708332refblogcolosseumorg electric capital developer report annual electric capital blockchain developer report highlight metric like active developer contribution opensource repository developer retention rate across various blockchains featured report raise awareness project among developer investor broader web3 community getting project listed help spotlight solana thriving ecosystem benefit project entire community developer use insight report understand industry trend target right user segment prioritize feature drive growth electric capital crypto ecosystemshttpsgithubcomelectriccapitalcryptoecosystemsrefblogcolosseumorg solana ecosystem page refresh managed solana collective solana ecosystem page serf central directory active project dapps defi protocol nft collection infrastructure tool within solana ecosystem directory updated refreshed make easier add project explore existing one solana ecosystemhttpswwwsolanaecosystemcomrefblogcolosseumorg quick hit strategy help land solana transactionshttpswwwquicknodecomdocssolanatransactionsrefblogcolosseumorg quicknode diagnose transaction error solanahttpsdevelopersmetaplexcomguidesgeneralhowtodiagnosesolanatransactionerrorsrefblogcolosseumorg metaplex win heart developer threaded journey developer adoptionhttpsxcomtessak22status1851621714980970718refblogcolosseumorg tessak22httpsxcomtessak22 12 tool every web3 marketer know abouthttpsxcommia_unhashedstatus1850168037359673561refblogcolosseumorg mia_unhashedhttpsxcommia_unhashed solana lower hardware requirement validators maintaining high throughput low latencyhttpsxcomaeyakovenkostatus1851368512885047515refblogcolosseumorg aeyakovenkohttpsxcomaeyakovenko guide create 1 million nfts solana using bubblegumhttpsdevelopersmetaplexcombubblegumguidesjavascripthowtocreate1000000nftsonsolanarefblogcolosseumorg metaplex balancing innovation monetization insight product business fit videohttpswwwyoutubecomwatchvojp5qlgv61arefblogcolosseumorg xfounders introducing soon genesis hackathonhttpsxcomsuperteamearnstatus1851640334683697247refblogcolosseumorg superteamearnhttpsxcomugursirmen help shape feed protocol rng solution surveyhttpsxcomugursirmenstatus1851287581595746823refblogcolosseumorg ugursirmenhttpsxcomugursirmen deep dive capture instruction mpl404 programhttpsxcompratikdevvstatus1850492628648755436refblogcolosseumorg pratikdevvhttpsxcompratikdevv ironforge roll additional alert featureshttpswwwironforgecloudblogchangelogoctober252024refblogcolosseumorg ironforge tool resource cash app solanahttpssolanacomdevelopersguidesdappscashapprefblogcolosseumorg stepbystep guide building react native mobile app mimic cash app experience including writing anchor program integrating solana name service sn sdk incorporating solana pay pinocchiohttpsgithubcomfebopinocchiorefblogcolosseumorg zerodependency library create solana program rust eliminating dependency solanaprogram crate turn mitigates dependency issue solana program deployerhttpswwwnpmjscompackagesolanaprogramdeployerrefblogcolosseumorg tool deploy solana program nodejs optional jito bundle proof real life poirlhttpsgithubcomempiredaopoirlrefblogcolosseumorg anchor program provides onchain proof human interacted nfc tag contain cryptographic keypair prove human interacted tag given location real time funding moonwalk completed 34 million seed roundhttpssolanafloorcomnewsmoonwalkraises34mtoaccelerateexpansionandgamifyfitnesswithfinancialrewardsrefblogcolosseumorg led hack vc contribution binance lab reciprocal venture solana cofounder raj gokal funding support moonwalk mission offer secure gamified platform building maintaining healthy habit streamflow announced successful completion 5m strategic funding roundhttpsdecryptco288554streamflowsecuresstrategicinvestmenttostrengthenonchaintokenmanagementinfrastructurerefblogcolosseumorg led blockchain pioneer john lilic contribution major player jump crypto solana venture ivc accelerate streamflows mission expand robust infrastructure token creation distribution nitro lab raised 4 million seed roundhttpsxcomterminaxyzstatus1851691841793728550refblogcolosseumorg led lemniscap participation borderless race limit holding animoca venture finality including angel tensor solana jump spartan get hired phantom hiring product managerhttpsjobssolanacomcompaniesphantomjobs41857610productmanagerrefblogcolosseumorgcontent gather prioritize product requirement define product vision orca hiring software engineer backendhttpsjobssolanacomcompaniesorcajobs41799679softwareengineerbackendrefblogcolosseumorgcontent specialize building backend service infrastructure wormhole hiring technical project leadhttpswormholecomecosystemcareers41503490gh_srcsolananetworkopportunitiesjobboardrefblogcolosseumorg write code example explore novel use case integration helius hiring integration engineerhttpsxcom0xmert_status1849551708872900844refblogcolosseumorg help team integrate solana helius code successfully project solana foundation hiring defi growth leadhttpsjobssolanacomcompaniessolanafoundation2jobs41699749defigrowthleadrefblogcolosseumorgcontent primary point contact defi team building within solana ecosystem listen chopping block episode chopping block crew joined special guest anatoly yakovenko mastermind behind solana deep dive network evolution future conversation kick look solanas rapid rise rocky early day current status blockchain powerhouse debate role memecoins solanas ecosystem whether theyre stay passing craze next anatoly open fire dancer impact network scaling performance sparking broader discussion vertical v horizontal scaling finally explore solanas ambitious push mobile space seeker phone implication broader crypto industry packed expert insight bold prediction surprise episode mustlisten anyone following future blockchain chopping block feat anatoly solanas second act svm v evm extension dilemmahttpsunchainedcryptocomthechoppingblockfeatanatolysolanassecondactsvmvsevmextensiondilemmarefblogcolosseumorg bonus episode customizable oracle network switchboard mitchell gildenberg httpswwwblockhashpodcastcompodcastepisode1a559a75ep436mitchellgildenbergorcustomizableoraclenetworkonswitchboardrefblogcolosseumorg blockhash switchboard cto cofounder mitchell gildenberg recently join blockhash discus switchboard fully permissionless customizable oracle network enables developer create tailored data feed blink future crypto ux chris osbornhttpsopenspotifycomepisode2v93cru0zfkq3tgjeqso1xcontextspotify3ashow3a45zrvmawaqvjh6ggad1clhnd1dlsi307c81d3f24649e3refblogcolosseumorg liquid culture episode chris osborn founder dialect dive background physic quantum computing discovered transitioned crypto original vision dialect smart messaging blink solana action crypto novel ux paradigm reflection cryptos superpower future crypto mobile solana mobilehttpswwwyoutubecomwatchvuxd6kzlyqlqrefblogcolosseumorg kitchen emmett hollyer gm solana mobile talk u ideation process creating phone take build something tangible like hardware lesson learned first generation device solana breakpoint open source innovation eclipse lab soon mantis abk labshttpswwwpodpagecomtheindexpodcastsolanabreakpointopensourceinnovationwitheclipselabssoonmantisabklabsrefblogcolosseumorg index episode everything svm index recorded live solana breakpoint 2024 vijay chetty eclipse lab joanna zeng soon discus transformative role opensource software innovative svm l2s rollup stack principle guiding solanas opensource culture follow mikehalehttpstwittercommikehalerefblogcolosseumorg x warpcasthttpswarpcastcommikehalerefblogcolosseumorg thanks reading hope found something useful suggestion feedback let know think,0.9991,0.10711603613777525,0.5531080180688877
Reddit,solana,2024-10-31 18:19:36,2024-11-05 12:18:39.078109,usdt sol usdc solwhich better term censorship friend lot money one got frozen purely linked another address unrelated issue regard better,0.8402,0.4047619047619048,0.6224809523809524
Reddit,solana,2024-10-31 14:34:56,2024-11-05 12:18:39.078109,accidentally sent sol system program address chance get backedit proudly think created sol time capsule bavbjegbzktaymjgeudomzmj3m7epa5bsw7wejbzgfmd 05 sol forever encased friend gave wrong address send sol turned address owned system program probably wont see sol luckily 05 sol asking case there something done transaction httpssolscanioaccountbavbjegbzktaymjgeudomzmj3m7epa5bsw7wejbzgfmdhttpssolscanioaccountbavbjegbzktaymjgeudomzmj3m7epa5bsw7wejbzgfmd thank sorry stupid question lol wont answering private message,0.4936,0.01904761904761906,0.2563238095238095
Reddit,solana,2024-10-31 19:32:12,2024-11-05 12:18:39.078109,question usdc showing phantom wallethey recently sold memecoin eacc usdc birdeye using proper site seems transaction gone successfully maybe missing something idea perhaps need reinstall smth like havent even used app since dont think got scammed smth link solscan httpssolscaniotxypecwjxslvwzhmj5cg72rxeusxhfvzsik2vwpwgajbeec2qctwb7p9zmngv3yty42jsjjcvgny18kwhcrxkend9,0.5423,0.1375,0.3399
Reddit,solana,2024-10-31 22:48:57,2024-11-05 12:18:39.078109,new solana trading bothi recently launched quad solana bothttpquadbotsio rich big team rather small team lot honest work trying grow nice tool get user trader use however revenue isnt great want push writing get advice opinion think would notice ad bot would make use thanks community,0.8619,0.27348484848484855,0.5676924242424243
Reddit,ethereum,2024-10-29 13:01:37,2024-11-05 12:18:39.078109,weekly discussion thread buildinghello rethereum welcome new weekly discussion thread building space developer entrepreneur enthusiast showcase project share idea seek feedback greater ethereum community share project whether youre developing decentralized application dapp launching new layer 2 network working ethereum infrastructure encourage share detail project please provide concise overview including purpose current status link information provide xtwitter youtube link post automatically filtered engage collaborate thread excellent opportunity connect likeminded individual application tester feel free ask question offer feedback seek collaboration safety reminder encourage sharing collaboration please cautious potential scam avoid connecting wallet unfamiliar application without thorough research utilizing wallet tool offer transaction simulation eg rabby walletguard help ensure safety fund never give seed phrase private key looking forward hearing pushing ethereum ecosystem forward p devcon soon nov 1215 ticket sold apply waitlist herehttpsdevconorgentickets,0.9908,0.25606060606060604,0.623430303030303
Reddit,ethereum,2024-11-05 07:01:11,2024-11-05 12:18:39.078109,daily general discussion november 05 2024welcome today daily general discussion please use thread discus ethereum topic news event even price yes trying something new allow price discussion thread price discussion posted elsewhere subreddit continue removed always keep friendly follow sub rule ticker eth,0.8442,0.10189393939393938,0.4730469696969697
Reddit,ethereum,2024-11-05 06:33:25,2024-11-05 12:18:39.078109,evan van ness ethereum roadmap explainer rest u part 3 scourge,0.0,0.0,0.0
Reddit,ethereum,2024-11-05 10:08:51,2024-11-05 12:18:39.078109,anyone maximizing eth without staking lockupsso ive trying find way get eth without usual staking lockup also reading loan option way keep thing flexible especially eth price moving around much lately anyone got recommendation platform let use eth without tying much,0.2263,-0.08750000000000001,0.06939999999999999
Reddit,ethereum,2024-11-05 03:36:14,2024-11-05 12:18:39.078109,exploring customopensource hardware walletshey looking useful information creating custom hardware wallet idea get something like programmable usb stick two button screen imagine ledger able customize code goal fairly simple make possible anyone full control hardware wallet lot beneficial product could come example gaming arcade hardware wallet could provide identity one problem ledger closed source found long agonot really key export thank anyone knowledge id really appreciate anyone want work achieve hardware would amazing run web3 company developer provide funding well thanks,0.9679,0.1818181818181818,0.5748590909090909
Reddit,ethereum,2024-11-04 17:53:44,2024-11-05 12:18:39.078109,ethereumrelated content ive found interesting last weekhey ive curating ethereumfocused newsletterhttpsparagraphxyzkiwiweeklykiwinewsrecap69 year thought id share interesting read week here list last week celo show crypto uselesshttpsnewskiwistandcomoutboundurlhttps3a2f2fcryptoisuselesscom2f polynya challenge standard dao modelhttpsnewskiwistandcomoutboundurlhttps3a2f2fwarpcastcom2fpolynya2f0x9343b99e blockchain socialist say left hate cryptohttpsnewskiwistandcomoutboundurlhttps3a2f2fmyoutubecom2fwatch3fv3dd22u5irtfia jameson lopp share take protocol ossificationhttpsnewskiwistandcomoutboundurlhttps3a2f2fblogloppnet2fonossification trent analyzes dependency funding round dynamicshttpsnewskiwistandcomoutboundurlhttps3a2f2ftrentmirrorxyz2fia1ssxww6q_0gsewhpdpt0wbsoadcfq23yaxnn4sxa3freferreraddress3d0x5a5d9ab7b1bd978f80909503ebb828879daca9c3,0.6597,-6.938893903907228e-18,0.32985
Reddit,ethereum,2024-11-04 12:48:58,2024-11-05 12:18:39.078109,protocol berg v2 announced june 1213 2025,0.0,0.0,0.0
Reddit,ethereum,2024-11-05 10:04:01,2024-11-05 12:18:39.078109,asking help desperatefirst know sub appropriate kind post really lost also thing ask help different im simple guy romania 31 year old run music studio bucharest create release music stage name skidropz find link profile info recently dad diagnosticated cancer tumour try everything make life better day day sold car cypto asset studio gear order money first treatment vienna sadly still need around 10k make happen desperate im looking help everywhere know shame write option amount side welcome give exchange music project create song anything want want money free want lose father still need life eth wallet address 0x126c93f5fb1225052d1e404dfd33796e543be5c1 case erc20 thank kindness,0.9314,0.1730769230769231,0.5522384615384616
Reddit,ethereum,2024-11-04 07:01:34,2024-11-05 12:18:39.078109,daily general discussion november 04 2024welcome today daily general discussion please use thread discus ethereum topic news event even price yes trying something new allow price discussion thread price discussion posted elsewhere subreddit continue removed always keep friendly follow sub rule ticker eth,0.8442,0.10189393939393938,0.4730469696969697
Reddit,ethereum,2024-11-05 08:38:38,2024-11-05 12:18:39.078109,im trying join family ive bought 500 worth xrp there someone would like surprise eth wallet address 0x28e871b8d80d858c550bcf6a7372231275ec7e2f would super happy,0.936,0.4777777777777778,0.7068888888888889
Reddit,ethereum,2024-11-03 10:38:46,2024-11-05 12:18:39.078109,building ultimate evmsemi compatible rollup,0.0,0.0,0.0
Reddit,ethereum,2024-11-02 22:18:06,2024-11-05 12:18:39.078109,market risk 51 attack polymarketover past day deep dive polymarkets implementation current state market here ive found uma cryptocurrency protocol created system verify statement accuracy eg trump 2024 election call optimistic oracle asserter post assert information network staking cryptocurrency approved erc20 token alongside assertion anyone want dispute disputer may typically matching asserter stake dispute happens process escalates data verification mechanism dvm reach dvm tokenholders uma decide vote assertion resolve ie ultimately whether asserter disputer receives staked currency one vote per uma token polymarket operates separate contract blockchain interacts uma api allows user create betting market bet perform various task polymarket api also allows user propose dispute outcome betting market end costing 750 assert another 750 dispute dispute get escalated uma dvm system dispute rarely happen dvm work typically nobody incentive lose 750 clever solution allows run completely decentralized betting market shut however market cap uma 200m writing post 51 attacker would need approximately 100m worth understanding single person andor collaborative group people quantity uma could purchase dispute one side every contract polymarket vote favor dvm win every bet would destroy 100m uma theyll potentially make bet quick browse polymarket show order book quite contract readily available purchase many priced 01 cent pay 1 attacker 1000x difficult determine exactly much attacker could make polymarket depends lot factor moving market 51 attacker might attempt something like presidential election winner 2024 market httpspolymarketcomeventpresidentialelectionwinner2024 buy yes chris christie 0001 buy 72 million share right 72k buy trump week month 042 maybe accumulate 100 million share 42m buy kamala week month 058 maybe accumulate 100 million share 58m accept loss 100m worth uma due price collapsing would cost roughly 200m make 272m could make bit smaller betting market well there 670m usdc polygon network total put hard limit much money exists contract moment least someone market betting chris christie 999 likely lose correctly pricing risk 51 attack uma different play someone lot money power 51 attack uma would gain favor trump using 51 decide trump win betting market could used help publicity battle trump fight doesnt clearly win election would guess there quite enough money made yet justify risky expensive attempt 51 attack uma large part acquiring 51 last year would cost attacker lot 100m see historic price anyone already theyre probably planning hold something bigger id put small nonzero chance malicious actor already acquired 51 conclusion current market seems teetering edge uma market cap doesnt rise fast polymarkets betting market polymarket may need switch voting network 51 control system cant readily abused reference httpsdocsumaxyzprotocoloverviewhowdoesumasoraclework httpslearnpolymarketcomdocsguidesmarketsdispute httpswwwcoingeckocomencoinsuma,-0.9433,0.06314935064935065,-0.4400753246753247
Reddit,ethereum,2024-11-03 07:01:04,2024-11-05 12:18:39.078109,daily general discussion november 03 2024welcome today daily general discussion please use thread discus ethereum topic news event even price yes trying something new allow price discussion thread price discussion posted elsewhere subreddit continue removed always keep friendly follow sub rule ticker eth,0.8442,0.10189393939393938,0.4730469696969697
Reddit,ethereum,2024-11-02 16:58:29,2024-11-05 12:18:39.078109,would like make final year university project related ethereum im struggling think ideasspecifically supervisor instructed project related theme cryptoeconomics analyse extract information strategic behaviour user miner help design efficient marketregulating mechanism specifically suggested could project pb suggestion rule said past year project related credit rating fraud detection someone else year project correlation cryptocurrency price traditional finance indicies thinking proposing appeard simple proposed building basic mev bot im sure would complex undertaking 2 semester 6 month supervisor didnt lot say area wasnt familiar furthermore project isnt prohibited wont lose mark anything idea project would bit research oriented developer side one thing supervisor mentioned novelty isnt requirement proceed project dont need crazy original strategy idea something climate ie comparing emission various currency investigating environmental effect ethereum merge hope make sense id appreciate feedback feasibility idea guy suggestion,0.8419,0.007142857142857145,0.42452142857142855
Reddit,ethereum,2024-11-02 06:01:07,2024-11-05 12:18:39.078109,daily general discussion november 02 2024welcome today daily general discussion please use thread discus ethereum topic news event even price yes trying something new allow price discussion thread price discussion posted elsewhere subreddit continue removed always keep friendly follow sub rule ticker eth,0.8442,0.10189393939393938,0.4730469696969697
Reddit,ethereum,2024-11-01 17:22:47,2024-11-05 12:18:39.078109,u treasury office discus tokenization u treasury,0.3818,0.0,0.1909
Reddit,ethereum,2024-11-02 00:39:34,2024-11-05 12:18:39.078109,latest week ethereum news,0.0,0.5,0.25
Reddit,ethereum,2024-11-01 19:19:25,2024-11-05 12:18:39.078109,rabbit hole explorer guide,0.0,0.0,0.0
Reddit,ethereum,2024-11-01 15:27:19,2024-11-05 12:18:39.078109,ethereum monthly dashboardoctober steady month ethereum staking ending 344 million eth staked 49k validators currently entry queue month hasnt introduced significant change staking metric there plenty exciting work underway ethereums future development preparation pectra full swing vitalik buterin released thoughtprovoking post potential future ethereum protocol httpsxcometh_everstakestatus1851640585746026531httpsxcometh_everstakestatus1851640585746026531 httpspreviewredditdax01tlz5byd1pngwidth1943formatpngautowebpsca3d28d9ec985e216ab44d818aa4e73243bb4a23 data source dashboard compiled using metric following source httpsbeaconchainhttpsbeaconchain httpswwwvalidatorqueuecomhttpswwwvalidatorqueuecom httpsultrasoundmoneyhttpsultrasoundmoney httpsexplorerratednetworkhttpsexplorerratednetwork youre looking engage ethereum ecosystem consider everstake staking solution start little 01 eth unlock new opportunity within network httpseverstakeonelinkstakeethereumhttpseverstakeonelinkstakeethereum stay tuned update,0.8445,0.10368457300275478,0.4740922865013774
