MainSource,Source,Publication Date,Pull_date,Pre-Processed Text,Sentiment_Vader,Sentiment_TextBlob,Average_Sentiment
Reddit,solana,2025-02-02 10:47:03,2025-02-03 12:18:49.582551,unwrapping solana sure findhey guy using dexscreener phantom wallet buy memecoins ive recently sold twke profit im sure went lol pressed sell didnt get sol back time confused haha,0.875,0.22857142857142856,0.5517857142857143
Reddit,solana,2025-02-02 13:11:01,2025-02-03 12:18:49.582551,possible buy solana without kycive trying buy solana trade memecoins cant get without kyc frustrating,0.3412,-0.2,0.0706
Reddit,solana,2025-02-02 12:15:21,2025-02-03 12:18:49.582551,phantom chrome extension safeim new phantom wanted work laptop decided download chrome extension im seeing lot review saying wallet got drained scam true already phantom wallet want login laptop thats,-0.4767,0.24318181818181817,-0.11675909090909092
Reddit,solana,2025-02-02 07:55:13,2025-02-03 12:18:49.582551,solana showing ledgermy macbook air broke january 24th resulting get new macbook air restoring crypto new computer use ledger live monitor asset linking account back ledger live everything went smoothly except solana account ledger synced perfectly solana say wrong get solana acknowledged ledger live app right showing 0 help greatly appreciated thank,0.9016,0.1879574970484061,0.544778748524203
Reddit,solana,2025-02-01 22:03:56,2025-02-03 12:18:49.582551,need help bull x neo bot 70 sol 17 current holding seems way 329 use 10 slippage 001 priority fee 001 gas fee,0.4019,0.0,0.20095
Reddit,solana,2025-02-02 02:25:09,2025-02-03 12:18:49.582551,hell guy question trojan crypto bot use buy option hold coin want,-0.6486,0.0,-0.3243
Reddit,solana,2025-02-02 07:09:15,2025-02-03 12:18:49.582551,bullx weird type scami weird interaction add bonkbot get airdrop 7 sol create bullx account clicked bullx wanted get password connect telegram bullx someone logged account saw every bot got command wallet like wanted drain whole account luck didnt token wanted ask official bonkbot telegram wallet scam add happened guy,0.128,-0.26666666666666666,-0.06933333333333333
Reddit,solana,2025-02-01 21:29:07,2025-02-03 12:18:49.582551,solana investor enemy readingsorry pretentious name wanted cause stir community project projection idea discussed thing investor post guy cant exchange token could hacked post image clearly say doesnt enough fee guy sold house invested elon musk new token scammocoin made billion cant withdraw could scammed guy wont believe prince nigeria called telegram asked phrase said he going transfer fortune far im seeing 100 worth bitcoin took 9 year save disappearing could scam absolutely everything would avoided 5 minute reading seems child teenager trying luck memecoin roulette considering solana token really ever taken seriously would invest etf holder people,-0.5758,0.04478114478114478,-0.2655094276094276
Reddit,solana,2025-02-02 02:21:43,2025-02-03 12:18:49.582551,coin dexscreener showing walleti bought coin dexscreener via phantom wallet solana used new coin showing wallet transaction record look though,0.0,0.13636363636363635,0.06818181818181818
Reddit,solana,2025-02-02 09:01:45,2025-02-03 12:18:49.582551,happened dont understand,0.0,0.0,0.0
Reddit,solana,2025-02-02 08:42:35,2025-02-03 12:18:49.582551,wallet drained 2 wallet im sure didnt click scamhqik1yoytvckfqaxm2wahywzjtkjjufr8amgc8kgycxc get access wallet report phantom shi thanks answer,0.4019,0.35,0.37595
Reddit,solana,2025-02-01 09:24:47,2025-02-03 12:18:49.582551,scummy sniper bot jack lp new cointhese scummy sniper dont even wait coin stabilize completely ruined solena launched test coin game app put 170 lp muck even 30 later bot sell everything snipped stripping usdc liquidity even gon na lunch sol pumpfun site completely ruin chain,-0.7732,-0.012727272727272731,-0.39296363636363635
Reddit,solana,2025-02-02 01:35:21,2025-02-03 12:18:49.582551,eff moonshot butthole coin sol wallet photonhello title tried transfer moonshot butthole coin sol wallet photon sure address correct see test transfer mess something apps incompatible help would greatly appreciated noob doromy234rge6dv9uea4fkksyvym2tkur94nihcbzmm9 wallet address edit accidentally ommited lowercase r go existing address lost eather,0.2992,0.17500000000000002,0.23710000000000003
Reddit,solana,2025-02-02 03:15:36,2025-02-03 12:18:49.582551,phantom wallet transactionsis true 30 dollar wallet able recieve money,0.4215,0.425,0.42325
Reddit,solana,2025-02-02 03:12:51,2025-02-03 12:18:49.582551,best way get notification walleti dont need trading bot anything like well least dont need dabble yet kinda curious wallet want get notified buysellreceive something wallet would like sent phone either free app discord bot email etc tyvm,0.9472,0.25,0.5986
Reddit,solana,2025-02-02 06:58:35,2025-02-03 12:18:49.582551,trying swap wsol sol seem get workingim trying swap wsol sol however even jupaghttpjupag fails say unknown error please try change rpc wallet reduce amount trade change rpc dapp change rpc phantom wallet change rpc jupaghttpjupag via profile gear top right ive changed rpcs available every one still say add mainnet rpc solana say connect httpspreviewredditwfjn7oixboge1pngwidth409formatpngautowebps78239aaa1238f7271c1f2e3f278eaa4858b7d206 im sure working someone help point right direction ive found bunch bridge site none seem want accomplish edit figured problem metamask phantom since wsol eth connect metamask wallet initiate transfer remove phantom wallet extension order prompt meta instead phantom wallet approve transaction,-0.3927,0.19591836734693877,-0.09839081632653061
Reddit,solana,2025-02-01 22:32:28,2025-02-03 12:18:49.582551,exchange cold wallet whyi genuinely want hear everyone think better exchange one cold wallet one think interesting see many people saying cold wallet dont necessarily disagree guy thought palisade fire happened many possible cold wallet key burned fire happens safe get stolen house burn something know gone exchange atleast track record someone hold accountable potentially issue idk wan na know pro con many question let dive come peace btw let argue mean,0.5696,0.028676470588235296,0.29913823529411765
Reddit,solana,2025-02-01 20:19:37,2025-02-03 12:18:49.582551,anything important going noobs larping theyre making memecoinsi dont imagine many youus funny considering memecoin actually meme worthy youd never need mention,0.765,0.29666666666666663,0.5308333333333333
Reddit,solana,2025-02-02 05:55:11,2025-02-03 12:18:49.582551,accidentally lost 14 solalright stupid as made coin accidentally send 14 sol contract adress pump fun coin chance recover pretty much lost hope,-0.1027,-0.012499999999999983,-0.05759999999999999
Reddit,solana,2025-02-02 00:48:30,2025-02-03 12:18:49.582551,solana trading botwhat solana trading bot use trading small amount money buysell priority bribery slippage,0.0,-0.25,-0.125
Reddit,solana,2025-02-02 03:50:28,2025-02-03 12:18:49.582551,buy sol without idthis honestly pretty annoying cant find even 1 site actually let buy sol without id driver license crap anyone know one possible payment method paypal paysafecard tried get pyusd since u cant get,-0.8558,-0.27,-0.5629
Reddit,solana,2025-02-01 21:52:06,2025-02-03 12:18:49.582551,solana repo archived moved anawhy solana github repo archived moved company anaxyz,0.0,0.0,0.0
Reddit,solana,2025-02-01 18:48:26,2025-02-03 12:18:49.582551,possible build bot profitableim looking make million hundred thousand dollar week possible build sniper bot im software engineer though im familiar networking however learn build something cover hosting cost id appreciate advice approach know 3rdparty saas solution exist id prefer tip learning resource would greatly appreciated thanks,0.895,0.15499999999999997,0.525
Reddit,solana,2025-02-02 03:11:24,2025-02-03 12:18:49.582551,buying entire bonding curvelaunching coin moonshot buying entire bonding curve locking majority supply airdropping leave 100 million left c planning lock 10 year way could go wrong planning use meteroa there lot marketing place happens 88 sol move bonding curve become liquidity pool large investment theory going work make ton money later im wondering people dont control float way even let buy much curve,-0.5106,-0.01224489795918367,-0.2614224489795919
Reddit,solana,2025-01-31 22:41:14,2025-02-03 12:18:49.582551,billionaire meddling crypto reaping retail investor quickly slowly crypto market today battlefield dominated billionaire running coordinated con retail investor celebrity meme coin ai narrative murads list approved token bitcoin etf hype everything designed extract liquidity everyday trader funnel hand elite celebrity coin blatant cash grab influencers launch token pump social medium dump follower result retail get wrecked celebrity insider team walk away million ai narrative every major financial cycle golden gimmick ai latest aipowered crypto project marketed revolutionary vaporware realworld adoption murads list hedge fund institution play different game quietly accumulating asset making investable mass time coin make onto curated list upside already gone retail left buying top bitcoin etf manipulation etf approval brought wave institutional money clear game rigged institution use etf flow control bitcoins price squeezing retail trader extracting profit market manipulation real play left finding quality cto project noise retail investor left searching legitimate opportunity billionaire havent yet flooded capital answer finding strong community takeover cto project enters mainstream successful cto mean project longer hand corrupt dev insider vc firm instead guided community,0.9744,0.002898550724637678,0.48864927536231884
Reddit,solana,2025-02-01 14:37:47,2025-02-03 12:18:49.582551,ai autonomous sniper bot recommendationshey guy hope well im looking kind autonomous trading bot trade around clock meme coin using filtersprotection like autosnipe ai scam would love help cheer,0.9468,0.475,0.7109
Reddit,solana,2025-02-02 01:56:18,2025-02-03 12:18:49.582551,mev reward staking via solflaredear new staking mev reward staked solana via solflare helius validator recently learnt claiming mev reward based see app see staked solana grows slowly every epoch go claim mev reward jito website see claim reward stake solana reduced thus wondering staking solana via solflare automatically claim mev reward thus need separately go claim mev reward jito,0.9796,-0.054545454545454564,0.46252727272727273
Reddit,solana,2025-02-01 07:25:16,2025-02-03 12:18:49.582551,anyone actually using solana realworld purchasesso always talk solanas speed low fee tech advantage real talk actually used sol realworld purchase nfts staking actual stuff like electronics home good whatever feel like crypto still mostly stuck speculation phase ive seeing place like correkt commerce popping accept sol randomly came across site let buy random stuff crypto made realize wild whats best thing youve ever actually bought using sol,0.9337,0.125,0.52935
Reddit,solana,2025-02-01 23:24:53,2025-02-03 12:18:49.582551,several coin dexscreener adress social different chart time createdi dont understand scam one look legit adress,0.4585,0.011111111111111112,0.23480555555555557
Reddit,solana,2025-02-01 19:09:38,2025-02-03 12:18:49.582551,could ask find firedancer validators data like much percentage validators using guy posted image dont know source httpsxcommartypartymusicstatus1881048671862817269httpsxcommartypartymusicstatus1881048671862817269 httpsxcommartypartymusicstatus1871588369563828532httpsxcommartypartymusicstatus1871588369563828532,0.3612,0.2,0.2806
Reddit,solana,2025-02-01 13:48:18,2025-02-03 12:18:49.582551,limit order trading dex short questiona quick question limit order trading dexes little experience jupiter raydium dexes far seems jupiter possible trade limit order question place limit order via smart contract executed even computer cell phone switched dont know much technology assume still work right need make sure dont disconnect wallet dex right would nice someone experience could briefly confirmexplain,0.7783,0.19429563492063492,0.48629781746031747
Reddit,solana,2025-02-01 05:24:58,2025-02-03 12:18:49.582551,transfer value lowwhy losing 60 dollar swapping sol hood fee price impact slippage low,-0.3182,0.0,-0.1591
Reddit,solana,2025-02-01 16:20:56,2025-02-03 12:18:49.582551,please help received usdt solana network unable access themive received token see 100 token unable withdraw convert phantom wallet please help,0.8402,-0.5,0.17009999999999997
Reddit,solana,2025-02-01 22:04:31,2025-02-03 12:18:49.582551,importing wallet seed phrase wallet say watch onlyhello sol folk trying recover wallet use seed phrase one say watch even though wallet using seed phrase get watch,0.0,0.0,0.0
Reddit,solana,2025-02-01 15:59:07,2025-02-03 12:18:49.582551,pf bot buy minting sell 10secs afterwhy pump f bot buy sell fast wont incur transaction fee,0.0,0.2,0.1
Reddit,solana,2025-02-01 21:35:26,2025-02-03 12:18:49.582551,order book meme solana cexhello title suggests looking order book solana meme coin cex something lot meme really precise something like gate io pilot trading section lot meme coin added every day thanks advance,0.6872,0.30000000000000004,0.49360000000000004
Reddit,solana,2025-02-01 21:14:15,2025-02-03 12:18:49.582551,wallet steal profit telegram gmgn bot solarium bastard 9613 sol million billion even wallet steal miserable 06 sol previously mw disappeared 05 think operate virtual machine well said mean virtual window something like screw wallet,-0.836,-0.4930555555555556,-0.6645277777777778
Reddit,solana,2025-02-01 14:44:50,2025-02-03 12:18:49.582551,crazy missing somethingi deposited 1000 robinhood showing 128372 balance saying 900 know there fee high missing something thanks help,-0.0516,-0.12800000000000003,-0.08980000000000002
Reddit,solana,2025-02-01 16:29:05,2025-02-03 12:18:49.582551,gmgn keep loggin fix gmgn keep loggin logging back logging back log overlay appears sometimes every minute fix thanks,0.4404,0.06666666666666667,0.25353333333333333
Reddit,solana,2025-02-01 16:20:22,2025-02-03 12:18:49.582551,understanding flow legitimate token creation solana networkhi ive posted time token project working wanted verify im understanding flow legitimate project want sniped rug pulled bot im trying create something real step 1 create token revoke freeze mint update 2 create liquidity pool 3 create pre sale liquidity pool burn unsold 4 air drop community 5 list dex also want vest dev coin period battle botssnipers know actually occurs basic tokenomics drafted would look something like draft final 40 vested dev team share intent remain control token via amount soldtraded time period block rug pullsetc 10 whitelist discount listing dex 25 multiple air drop campaign community project 25 available sale launch similar legit project im also typing white paper project utility trying bring,0.7096,0.07500000000000001,0.3923
Reddit,solana,2025-02-02 05:37:44,2025-02-03 12:18:49.582551,scam part processbtw name channel telegram meme master 100x directed guy input 1k wallet activate bot whatever anyone done type dealsexperiences normal procedure thanks,-0.2023,0.175,-0.01365000000000001
Reddit,solana,2025-02-01 13:49:34,2025-02-03 12:18:49.582551,new crypto stuff solana even worki dont previous crypto experience wallet made phantom wallet want know earn something meme coin withdraw crypto normal currency even find crypto coints pumped something confused stuff,-0.25,-0.07007575757575758,-0.16003787878787878
Reddit,solana,2025-02-01 19:13:24,2025-02-03 12:18:49.582551,new pumpfun pf dominate mindshare solana memecoins foreseeable futuretitle,-0.128,0.13636363636363635,0.0041818181818181754
Reddit,solana,2025-02-01 10:54:00,2025-02-03 12:18:49.582551,dex spot order stop losshi mostly use jupiter would really like use stop loss spot order jupiter limit way im unaware kinda late bag 50 haha thanks,0.2333,0.13333333333333333,0.18331666666666668
Reddit,solana,2025-02-01 10:04:11,2025-02-03 12:18:49.582551,solana staking kraken variable reward amountsi staking solana kraken please dont burn much realized every week get different amount reward aware effect restakingthats variation quite big sometimes 50 disparity anybody know reason fluctuation might curious reward kraken distributed calculated,0.9403,0.06999999999999999,0.50515
Reddit,solana,2025-02-01 17:23:54,2025-02-03 12:18:49.582551,purchase bullxim quite new platform may missing something obvious please enlighten every time try purchase coin bullx get following error order whatevercoinitcouldbe failedsimulation failed error accountnotfound anyone faced error,-0.7906,-0.11272727272727275,-0.4516636363636364
Reddit,solana,2025-02-01 17:17:26,2025-02-03 12:18:49.582551,private key scam whatthere scammer said give sol new wallet address thought yeah sure downloaded solfare cuz use phantom created new wallet shared key happen,0.4939,0.12878787878787878,0.3113439393939394
Reddit,solana,2025-02-01 13:23:21,2025-02-03 12:18:49.582551,store sol gmgndo guy store solana gmgn wallet safe guy transfer another wallet,0.4404,0.5,0.4702
Reddit,solana,2025-02-01 10:21:39,2025-02-03 12:18:49.582551,bullx need help fund cant tradehi good community hoping someone help started bullx dont know skipped step something transferred fund platform come solana usdc showing available matter try cant trade distribute sell transfer anything literally stuck anything fix frustrating thank advance,0.5414,0.23333333333333336,0.3873666666666667
Reddit,solana,2025-02-01 03:30:32,2025-02-03 12:18:49.582551,dexscreener dextoolsfor mobile specifically also dextools safe download io got 3 star 50 review currently dexscreener nice watch chart sometimes phantom doesnt good job showing price moving also way use dexscreenerdextools see percent gain given time interval cuz rn thing 50000 even tho couldve 80 drop hard see correctly ty,0.7779,0.30166666666666664,0.5397833333333333
Reddit,solana,2025-02-01 07:07:53,2025-02-03 12:18:49.582551,convert wrapped sol wormhole solim relatively new solana driving wall okay sold eth uniswap wrapped sol wormhole since regular solana uniswap wsol metamask wallet want convert solana send solana wallet worth ended sending another metamask different device browser also solana wallet used snap metamask create new solana wallet thinking might help doesnt recognize wsol help loss right wondering im going convert back eth usdt send coinbase swap solana hopping easier way,0.7304,0.1698051948051948,0.4501025974025974
Reddit,solana,2025-02-01 14:26:26,2025-02-03 12:18:49.582551,unable update spl token metadata solutionshey solana community created spl token im struggling update metadata name symbol logo token recognized visible solscan phantom appears unknown metadata here ive tried far 1 solana token list attempted submit pull request update token process didnt go 2 solana cli spltoken updatemetadata command didnt work expected received error related missing metadata support 3 metaplex token extension looked metaplex metadata update seems like token might compatible 4 paid service platform offer metadata update fee id like explore free alternative first anyone successfully updated metadata without pay need recreate token differently ensure metadata support guidance would really appreciated thanks advance,0.9631,0.08333333333333333,0.5232166666666667
Reddit,solana,2025-02-01 09:36:18,2025-02-03 12:18:49.582551,bullxio invested relationship btw total revenuespend solana holdingshi going try explain hope someone help started investing bullx yesterday spend 05 solana earned bullx dont understand total revenue 17694 total spend 170 solana 0003681 mean someone understand explain please mean used 050003681 sol transaction fee httpspreviewredditjcxtzsyzyhge1pngwidth1381formatpngautowebpsd358c45617ed57d2b7076cb71212a52804da3ca7 profit made 694,0.8689,-0.125,0.37195
Reddit,solana,2025-02-01 09:27:57,2025-02-03 12:18:49.582551,tool identify common holder multiple solana tokenshello im trying identify insider wallet different solana token following certain twitter account might involved insider trading multiple memecoins want identify wallet wallet early certain token data token launched date launch need crossreferrence holder several meme chain information see one common solscan let download csv first 1000 txn holder thats enough volume highly manipulated lot mev bot could find way sort holder token held date buy tool might get job done bottlneck data export capped 1000 txn id manage rest excel altough automated tool sowftware would great thank,0.8935,0.0813265306122449,0.48741326530612245
Reddit,solana,2025-02-01 16:23:15,2025-02-03 12:18:49.582551,serious issue anger lossesso couple friend meme coin space problem getting much angry overly angry smallest loss gain feel good make 5 sol 3 time make 15 loss ill fine friend get really really pissed like average roi 1 day crazy fucking high small loss make u randomly mad way prevent calm journal ofc nothing else really,-0.9286,-0.14544444444444443,-0.5370222222222222
Reddit,solana,2025-02-01 01:00:29,2025-02-03 12:18:49.582551,getting small amount solo receiving sol several time various wallet meani receiving sol several time several wallet sometimes even day mean,0.0,-0.09375,-0.046875
Reddit,solana,2025-01-31 05:15:34,2025-02-03 12:18:49.582551,pumpfun get sued finallyhttpswwwcoindeskcompolicy20250130pumpfunhitwithproposedclassactionlawsuitallegingsecuritiesviolations httpscointelegraphcomnewspumpfunsuedclaimsallmemecoinssecurities httpsxcomwhaleinsiderstatus1885094053819138456s46tatfq2zwkwjxucytzznzlla unfortunately fortunately much cash cow im sure theyll settle court start adding better disclaimer regulation protect fun never stop everyones peril edit people much pumpfun trauma must downvote post mention pumpfun news guy lmao,0.9177,0.3095238095238095,0.6136119047619047
Reddit,solana,2025-02-01 03:02:29,2025-02-03 12:18:49.582551,help phantom showing network addressi sent like 240 address given phantom wallet accident since saved kraken app know account bitcoin address ive made 2 account anyways bitcoin isnt showing show solana even though ive turned allow multiple network setting,0.7003,0.0,0.35015
Reddit,solana,2025-01-31 17:50:24,2025-02-03 12:18:49.582551,get api websitehi dont know get api website like gmgn dexscreener hoping u know put python make trading bot,0.6486,0.0,0.3243
Reddit,solana,2025-02-01 07:43:14,2025-02-03 12:18:49.582551,help confused sniper botim new sniper bot started 01 sol testfamiliarity fund cant seem figure pnl trade shown photo ended 007 initial 01 sol priority fee set 00001 shouldnt make dent sniping fee also 0009 watched price action reached 50 hit 80 exit stop loss set 3 im really baffled loss,-0.6461,0.007272727272727269,-0.31941363636363634
Reddit,solana,2025-02-01 04:18:02,2025-02-03 12:18:49.582551,new memecoin enjoyer dislike crypto farif recently got crypto memecoins thought crypto space far building new product work love learn like hate crypto wish exist havent seen yet,0.743,0.012121212121212107,0.37756060606060604
Reddit,solana,2025-02-01 09:37:49,2025-02-03 12:18:49.582551,scammed solana discord community moderatorslet know think,-0.4019,0.0,-0.20095
Reddit,solana,2025-02-01 05:49:31,2025-02-03 12:18:49.582551,tracing solana transfersent solana coinbase account another account problem 2 year ago cant remember actually storing solana sent coinbase transfer info including address transaction hashtag basic question take information use locate access account solana held p sharing coinbase tracking info please dont dm nonsense,0.5659,0.0,0.28295
Reddit,solana,2025-02-01 09:28:44,2025-02-03 12:18:49.582551,looking trading bot without fee buying sellinghello im looking trading bot doesnt buying selling fee many bot fee doesnt matter paid,-0.0191,0.5,0.24045
Reddit,solana,2025-01-31 08:02:23,2025-02-03 12:18:49.582551,forbes cover top indicatorevery damn time forbes put crypto guy cover bitcoin top happened 2017 2021 got saylor whats next altseason another nuke sideways chop make everyone suffer httpsimagesappgooglyxkrothlzzkcjtc27 cant input second picture meme context truth one know market wild world mess people still act like got crystal ball could pump could dumpjust depends get wrecked first think altcoins gon na run coping point,-0.3182,0.16785714285714287,-0.07517142857142856
Reddit,solana,2025-02-01 12:35:50,2025-02-03 12:18:49.582551,trading phone tablet worth anyone tried trading trading ipadtablet phone using sniping bot app needed want start trading memecoins researching reading bit old laptop maybe fast trading might fast enough would want could use see real time chart stuff buying selling might slow today ipad iphone thinking using use telegram bot wallet necessary thing share experience advice welcome p work planning buy new laptop,0.7717,0.16363636363636364,0.4676681818181818
Reddit,solana,2025-01-31 23:09:36,2025-02-03 12:18:49.582551,dont understand peoplei currently 2 test token sol mainnet play around game making ode space quest game mix space quest quest glory munchkin well pvp arena card special ability gear ingame use item player earn coin like would xp eventually change contract game fully launch renounce 10m supply lp 600 need today noticed people keep buying damn thing idc obvious token worthless huge risk current form contract completely editable current form question besides bot auto buy garbage would ever buy token scream dont buy major risk im curious odd 174 people currently holding coin thats listed exchange promoted scream huge risk current form,0.8908,-0.05570728291316529,0.4175463585434174
Reddit,solana,2025-02-01 06:50:09,2025-02-03 12:18:49.582551,someone help explain thisi couple trade today seen went value lot couldnt swap even tried putting slippage 30 would fail unlucky day example seeing liquidity dropped zero let trade,0.1531,-0.5,-0.17345
