MainSource,Source,Publication Date,Pull_date,Pre-Processed Text,Sentiment_Vader,Sentiment_TextBlob,Average_Sentiment
RSS,https://cointelegraph.com/rss,2024-10-12 11:36:58+01:00,2024-10-12 12:16:12.596752,scroll list binance sparking debate centralization concern scroll binance listing sparked community debate critic raising concern centralization scroll cofounder highlighted global growth strategy,0.128,0.0,0.064
RSS,https://cointelegraph.com/rss,2024-10-12 05:41:00+01:00,2024-10-12 12:16:12.596752,bitcoin etf end threeday skid 254m inflow 254 million inflow day thirdlargest ever day blackrocks ibit failed contribute,-0.5106,-0.5,-0.5053000000000001
RSS,https://cointelegraph.com/rss,2024-10-12 02:52:11+01:00,2024-10-12 12:16:12.596752,alleged crypto fraudster run tampering ankle bracelet usitechs former ceo horst jicha placed home detention new york 5 million bond guaranteed partner child fleeing,-0.7184,0.012121212121212116,-0.353139393939394
RSS,https://cointelegraph.com/rss,2024-10-11 23:01:12+01:00,2024-10-12 12:16:12.596752,sec delay decision spot ethereum etf option security regulator authorized bitcoin option list blackrocks spot btc etf september,0.0258,-0.1,-0.0371
RSS,https://cointelegraph.com/rss,2024-10-11 22:57:17+01:00,2024-10-12 12:16:12.596752,cryptostealing malware discovered python package index checkmarx according cybersecurity firm hacken financial loss crypto hack topped 440 million third quarter 2024,-0.3182,-0.06666666666666667,-0.19243333333333332
RSS,https://cointelegraph.com/rss,2024-10-11 22:10:21+01:00,2024-10-12 12:16:12.596752,blockchain data firm arkham launch derivative exchange report arkham intelligence token arkm 16 news according coingecko,0.4767,-0.2,0.13835
RSS,https://cointelegraph.com/rss,2024-10-11 22:00:00+01:00,2024-10-12 12:16:12.596752,3 key metric point season altcoins analyst crypto market recovering week brutal selloff analyst say 3 key metric suggest altcoin season could way,-0.6249,-0.2916666666666667,-0.4582833333333334
RSS,https://cointelegraph.com/rss,2024-10-11 22:00:00+01:00,2024-10-12 12:16:12.596752,crypto biz tether 10 year meteoric growth tie u european hurdle tether achieved first 10 year considerable jump user base closer relationship u authority fresh regulatory challenge europe,0.6705,-0.030000000000000016,0.32025
RSS,https://cointelegraph.com/rss,2024-10-11 21:42:48+01:00,2024-10-12 12:16:12.596752,here happened crypto today need know happened crypto today latest news daily trend event impacting bitcoin price blockchain defi nfts web3 crypto regulation,0.0,0.25,0.125
RSS,https://cointelegraph.com/rss,2024-10-11 21:31:41+01:00,2024-10-12 12:16:12.596752,ripple cofounder donates 1 million xrp harris campaign according latest polymarket election odds kamala harris 459 chance securing oval office nov 5 presidential election,0.5106,0.5,0.5053000000000001
RSS,https://cointelegraph.com/rss,2024-10-11 20:57:20+01:00,2024-10-12 12:16:12.596752,price analysis 1011 btc eth bnb sol xrp doge ton ada avax shib bitcoin altcoins made strong comeback oct 11 indicating solid buying lower level,0.4019,0.21666666666666667,0.30928333333333335
RSS,https://cointelegraph.com/rss,2024-10-11 20:38:22+01:00,2024-10-12 12:16:12.596752,fairdesk crypto exchange shut regulatory concern singaporebased exchange officially shutter nov 30 2024,0.0,0.0,0.0
RSS,https://cointelegraph.com/rss,2024-10-11 20:05:00+01:00,2024-10-12 12:16:12.596752,sen hagerty introduces clarity payment stablecoins act 2024 new bill refinement rep patrick mchenrys 2023 bill bipartisan support,0.6597,0.13636363636363635,0.39803181818181815
RSS,https://cointelegraph.com/rss,2024-10-11 20:01:32+01:00,2024-10-12 12:16:12.596752,wef talk defi regulation hkda stablecoin integrates chainlink finance redefined world economic forum urged policymakers adopt sandboxbased framework enhance regulatory clarity defi innovation address key risk,0.5994,0.1,0.3497
RSS,https://cointelegraph.com/rss,2024-10-11 19:26:40+01:00,2024-10-12 12:16:12.596752,mt gox push repayment plan deadline october 2025 trustee overseeing mt gox asset extended deadline creditor restitution october 2025 44900 btc remains unpaid,0.5267,0.2,0.36334999999999995
RSS,https://cointelegraph.com/rss,2024-10-11 18:41:17+01:00,2024-10-12 12:16:12.596752,bipartisan support crypto fragile congressman john curtis 71 democrat joined republican colleague rare bipartisan effort repeal sec sab121 guideline earlier year,0.4019,0.049999999999999996,0.22594999999999998
RSS,https://cointelegraph.com/rss,2024-10-11 18:27:37+01:00,2024-10-12 12:16:12.596752,uber stock jump tesla stumble elon musk cybercab reveal tesla failure demonstrate progress field autonomous vehicle appears making investor skittish,-0.128,0.18333333333333335,0.027666666666666673
RSS,https://cointelegraph.com/rss,2024-10-11 18:18:21+01:00,2024-10-12 12:16:12.596752,solana sol price today solana price today liquid staking within ecosystem hit new alltime high 57 billion,0.0,0.1481818181818182,0.0740909090909091
RSS,https://cointelegraph.com/rss,2024-10-11 18:00:12+01:00,2024-10-12 12:16:12.596752,exftx exec scheduled report prison judge denies request judge lewis kaplan cited prosecutor opposition noted ryan salame appeared physically recovered entirely unimpaired recent tucker carlson interview,-0.7269,0.0,-0.36345
RSS,https://cointelegraph.com/rss,2024-10-11 14:49:51+01:00,2024-10-12 12:16:12.596752,doj push break google search monopoly antitrust case u department justice aim dismantle google dominance online search raising question future big tech influence,0.6369,0.0,0.31845
RSS,https://cointelegraph.com/rss,2024-10-11 14:32:09+01:00,2024-10-12 12:16:12.596752,bitcoin surf u ppi overshoot btc price recovers sub59k dip bitcoin appears take hot ppi print stride 4 btc price recovery,0.0,0.25,0.125
RSS,https://cointelegraph.com/rss,2024-10-11 14:31:07+01:00,2024-10-12 12:16:12.596752,fbi token fbi used fake ai fund coin nab fraudsters fbi nexfundai coin used catch alleged market manipulator crypto community may confused another coin,-0.8316,-0.3333333333333333,-0.5824666666666667
RSS,https://cointelegraph.com/rss,2024-10-11 14:15:00+01:00,2024-10-12 12:16:12.596752,bitcoin crazy decade global wealth manager dive cointelegraph spoke riot platform pierre rochard metaplanets dylan leclaire bitcoin amsterdam 2024 conference,-0.4215,-0.3,-0.36075
RSS,https://cointelegraph.com/rss,2024-10-11 14:10:39+01:00,2024-10-12 12:16:12.596752,ethereum eye 40 gain eth price fractal approach final phase eths price could rise 40 bullish fractal pattern despite ether sideways consolidation past week,0.5267,-0.125,0.20084999999999997
RSS,https://cointelegraph.com/rss,2024-10-11 13:35:00+01:00,2024-10-12 12:16:12.596752,nonkyc exchange trending here need know nonkyc exchange trending due appeal offering anonymity privacy easier access user want avoid identity verification requirement,0.2263,-0.125,0.05065
RSS,https://cointelegraph.com/rss,2024-10-11 12:55:02+01:00,2024-10-12 12:16:12.596752,ryan salame claim u unfairly targeted republican donation former ftx coceo ryan salame claim republican campaign contribution led unjust charge contrast case sbf,-0.5106,-0.25,-0.3803
RSS,https://cointelegraph.com/rss,2024-10-11 12:05:42+01:00,2024-10-12 12:16:12.596752,elon musk say unsupervised selfdriving car would save life tesla ceo elon musk revealed plan autonomous robot vehicle hollywood event introducing robotaxi cyber cab public transportation,0.4939,0.2,0.34695
RSS,https://cointelegraph.com/rss,2024-10-11 11:46:44+01:00,2024-10-12 12:16:12.596752,nigerian court denies bail binance exec despite health concern judge emeka nwite ruled tigran gambaryan stay prison unless health condition pose threat others quarantine unavailable,-0.8591,0.0,-0.42955
RSS,https://cointelegraph.com/rss,2024-10-11 10:57:24+01:00,2024-10-12 12:16:12.596752,bitcoin amsterdam flawed research drive harmful bitcoin policy speaker bitcoin amsterdam 2024 conference discussed flawed academic study bitcoin fuel misinformation affect medium coverage lead misguided policy,-0.8176,-0.3333333333333333,-0.5754666666666667
RSS,https://cointelegraph.com/rss,2024-10-11 10:23:44+01:00,2024-10-12 12:16:12.596752,xrp price today xrp price today driven growing legal tussle u sec ripple lawsuit,0.0772,0.05,0.0636
RSS,https://bitcoinmagazine.com/.rss/full/,2024-10-11 15:54:50+00:00,2024-10-12 12:16:12.596752,bitcoin miner expect nextwhat miner actually planning going near term future,0.0,0.03333333333333333,0.016666666666666666
RSS,https://bitcoinmagazine.com/.rss/full/,2024-10-10 17:38:41+00:00,2024-10-12 12:16:12.596752,trump winning closer ever freeing ross nikolauswe still fight like 13,0.7506,0.5,0.6253
RSS,https://bitcoinmagazine.com/.rss/full/,2024-10-10 14:44:21+00:00,2024-10-12 12:16:12.596752,memecoin supercycle thesis bitcoin alignedyes hyperbitcoinization happening yes messy period complete crypto degeneracy,0.0516,-0.05,0.0007999999999999986
RSS,https://bitcoinmagazine.com/.rss/full/,2024-10-09 15:16:08+00:00,2024-10-12 12:16:12.596752,hbos satoshi documentary money electric insult bitcoin hard know say documentary except marvel creativity cynicism,-0.25,-0.09722222222222222,-0.1736111111111111
RSS,https://bitcoinmagazine.com/.rss/full/,2024-10-09 12:55:53+00:00,2024-10-12 12:16:12.596752,asian bitcoiners profit maximalistsas someone who lived asia west ive noticed clear difference view bitcoin asia profit maximalists west philosophically driven,0.8126,0.03333333333333333,0.42296666666666666
RSS,https://bitcoinmagazine.com/.rss/full/,2024-10-09 07:16:35+00:00,2024-10-12 12:16:12.596752,watch bitcoin amsterdam underwaythe world largest bitcoin conference kick today amsterdam featuring speaker like jack mallers adam back watch live stream european bitcoin leader discus future,0.3612,0.03409090909090909,0.19764545454545457
RSS,https://bitcoinmagazine.com/.rss/full/,2024-10-08 19:49:31+00:00,2024-10-12 12:16:12.596752,entered bitcoin mining lottery nikolaushow im looking beat odds claim full 325 btc block worth 200000,-0.25,0.32499999999999996,0.03749999999999998
RSS,https://bitcoinmagazine.com/.rss/full/,2024-10-08 15:17:43+00:00,2024-10-12 12:16:12.596752,bitcoin report parabolic growth predicted q4 2024exclusive analysis expert insight navigating bitcoins promising q4 market dynamic,0.7845,0.1,0.44225
RSS,https://bitcoinmagazine.com/.rss/full/,2024-10-08 14:15:14+00:00,2024-10-12 12:16:12.596752,vexl next generation bitcoin p2p trading appvexl cofounder ceo lea petrášová belief app shes helped create opensource kycfree peertopeer bitcoin marketplace essential helping preserve bitcoins essential quality,0.5106,0.0,0.2553
RSS,https://bitcoinmagazine.com/.rss/full/,2024-10-08 13:00:00+00:00,2024-10-12 12:16:12.596752,shinobi stop demonizing developer nonsensea quick take latest reason people yelling bitcoin core developer,-0.296,0.41666666666666663,0.06033333333333332
RSS,https://bitcoinmagazine.com/.rss/full/,2024-10-08 12:07:44+00:00,2024-10-12 12:16:12.596752,reminder update bitcoin wallet firmwarelive digital device bitcoin hardware wallet infallible require routine upkeep least wellkept seed phrase,0.0,-0.15,-0.075
RSS,https://bitcoinmagazine.com/.rss/full/,2024-10-07 18:42:05+00:00,2024-10-12 12:16:12.596752,trump presidency best outcome bitcoin nikolaustrump would allow friendly regulatory environment bitcoiners thrive,0.8519,0.6875,0.7697
RSS,https://bitcoinmagazine.com/.rss/full/,2024-10-05 12:26:18+00:00,2024-10-12 12:16:12.596752,uncle jack chili good bitcoina selfproclaimed bitcoin pleb actual brain surgeon dr jack kruse sauce want everyone try,0.4939,0.35,0.42195
RSS,https://bitcoinmagazine.com/.rss/full/,2024-10-05 00:18:02+00:00,2024-10-12 12:16:12.596752,corva want greater adoption bitcoin use fix problemsfollow lead bitcoin ekasis hermann vivier motivs rich swisher,0.7506,0.4375,0.59405
RSS,https://bitcoinmagazine.com/.rss/full/,2024-10-04 15:37:05+00:00,2024-10-12 12:16:12.596752,positive end 2024 bitcoinoptimism ahead q4 2024 deliver bitcoins next big rally,0.5574,0.07575757575757576,0.3165787878787879
RSS,https://bitcoinmagazine.com/.rss/full/,2024-10-04 15:20:11+00:00,2024-10-12 12:16:12.596752,bitcoin magazine introduces new short form opinion format takesthe oldest trusted bitcoin publication introducing new shortform content format,0.4767,0.0909090909090909,0.2838045454545455
RSS,https://bitcoinmagazine.com/.rss/full/,2024-10-04 14:46:41+00:00,2024-10-12 12:16:12.596752,wont find satoshi nakamoto next weekas longtime bitcoiner im certain latest satoshi nakamoto unmasking attempt disappoint like rest real proof provided,0.2263,0.2285714285714286,0.2274357142857143
RSS,https://bitcoinmagazine.com/.rss/full/,2024-10-03 18:17:53+00:00,2024-10-12 12:16:12.596752,aaron trump give damn bitcointrump providing lip service bitcoiners mean continue ally bitcoin get elected second term,-0.4019,-0.15625,-0.27907499999999996
RSS,https://bitcoinmagazine.com/.rss/full/,2024-10-03 15:40:52+00:00,2024-10-12 12:16:12.596752,frank bitcoina seemingly contradictory yet profound message jeff booth,-0.34,0.08333333333333333,-0.12833333333333335
RSS,https://bitcoinmagazine.com/.rss/full/,2024-10-03 14:39:59+00:00,2024-10-12 12:16:12.596752,wall street isnt bitcoin crypto etf comingwall street want sell product make u dollar continue thing make dollar,0.0772,0.0,0.0386
RSS,https://bitcoinmagazine.com/.rss/full/,2024-10-03 12:50:17+00:00,2024-10-12 12:16:12.596752,vivek bitcoin lightning payment long way go indiai couldnt resist lightning fast fiat payment network india,0.0,0.07500000000000001,0.037500000000000006
RSS,https://bitcoinmagazine.com/.rss/full/,2024-10-02 18:04:05+00:00,2024-10-12 12:16:12.596752,offchain protocol always balancing actimportant thing consider looking future offchain system,0.0,0.0,0.0
RSS,https://bitcoinmagazine.com/.rss/full/,2024-10-02 14:42:48+00:00,2024-10-12 12:16:12.596752,1000 faraday backpack protect bitcointhe slnt submersible faraday backpack may bit splurge feature bitcoin privacy expert could want,0.4404,0.0,0.2202
RSS,https://bitcoinmagazine.com/.rss/full/,2024-10-02 13:14:50+00:00,2024-10-12 12:16:12.596752,vivek unsurprisingly bitcoin price follows global liquiditybitcoins siren ringing loudly liquiditydriven boom may soon underway,0.0,0.05,0.025
RSS,https://bitcoinmagazine.com/.rss/full/,2024-10-01 21:08:32+00:00,2024-10-12 12:16:12.596752,retail keep selling bitcoin etf dont sell btc whalesspot bitcoin etf bitcoin accumulation rampage,0.0,0.0,0.0
RSS,https://bitcoinmagazine.com/.rss/full/,2024-10-01 16:43:38+00:00,2024-10-12 12:16:12.596752,lesson running bitrefill premier bitcoin ecommerce platform10 year ago sergej kotliar set help people easily spend bitcoin everyday item task still come number challenge taught many lesson,0.6908,0.24444444444444446,0.4676222222222222
RSS,https://bitcoinmagazine.com/.rss/full/,2024-10-01 11:15:56+00:00,2024-10-12 12:16:12.596752,rizzo satoshi nakamotos new mysteryits 2024 there new mystery surfacing around bitcoins creator satoshi nakamoto time relating mining activity 2009,0.0,0.13636363636363635,0.06818181818181818
RSS,https://bitcoinmagazine.com/.rss/full/,2024-09-30 17:28:43+00:00,2024-10-12 12:16:12.596752,ocean datum tackling bitcoins pressing problemoceans datum since weekend putting transaction selection back hand hashers benefiting bitcoins censorship resistance,0.4939,0.0,0.24695
RSS,https://bitcoinmagazine.com/.rss/full/,2024-09-30 16:44:27+00:00,2024-10-12 12:16:12.596752,inside lebanon currency crisis hyperinflation feelsa look lived experience going hyperinflation lebanon,-0.6249,0.0,-0.31245
RSS,https://bitcoinmagazine.com/.rss/full/,2024-09-30 16:19:29+00:00,2024-10-12 12:16:12.596752,nikolaus business insider say trump harris courting bitcoin vote reality say otherwisekamala harris done nothing confirm support protect industry far political opponent going beyond,-0.5334,0.05,-0.2417
RSS,https://bitcoinmagazine.com/.rss/full/,2024-09-27 16:09:58+00:00,2024-10-12 12:16:12.596752,maximizing bitcoin gain etf dataoutperforming bitcoin simple etf data strategy higher return,0.5267,0.125,0.32585
RSS,https://bitcoinmagazine.com/.rss/full/,2024-09-27 13:52:18+00:00,2024-10-12 12:16:12.596752,tornado cash loses motion dismissa short summary recent decision regarding tornado cash case,-0.3182,-0.09999999999999999,-0.20909999999999998
RSS,https://bitcoinmagazine.com/.rss/full/,2024-09-26 16:05:44+00:00,2024-10-12 12:16:12.596752,proof reserve show money didnt happen proof reserve critical piece infrastructure custodial service built top bitcoin,-0.128,0.25,0.061
RSS,https://bitcoinmagazine.com/.rss/full/,2024-09-26 13:11:18+00:00,2024-10-12 12:16:12.596752,bitcoin swap service boltz launch btcpay server plugin lightning paymentsthe boltz btcpay plugin enables merchant using btcpay server accept lightning payment noncustodially transfer fund liquid sidechain,0.3818,0.0,0.1909
RSS,https://bitcoinmagazine.com/.rss/full/,2024-09-26 12:07:57+00:00,2024-10-12 12:16:12.596752,arthur hayes family office fund another bitcoin core developerarthur hayes family office maelstrom awarded bitcoin developer jon atack 1year grant work fulltime bitcoin core bips nostrings funding aim strengthen bitcoins open source ecosystem,0.7579,0.0,0.37895
RSS,https://bitcoinmagazine.com/.rss/full/,2024-09-25 21:39:13+00:00,2024-10-12 12:16:12.596752,alby release alby go mobile app selfcustodial bitcoin lightning paymentsalby go easytouse opensource bitcoin wallet serf interface lightning node nostr wallet connect nwc wallet service,0.0,0.0,0.0
RSS,https://bitcoinmagazine.com/.rss/full/,2024-09-25 19:35:20+00:00,2024-10-12 12:16:12.596752,paypal enables business account buy hold sell bitcoin cryptopaypal announced new feature allowing u business account buy hold sell transfer supported cryptocurrency bitcoin expanding crypto offering merchant,0.3182,0.13636363636363635,0.22728181818181817
RSS,https://bitcoinmagazine.com/.rss/full/,2024-09-25 18:25:41+00:00,2024-10-12 12:16:12.596752,there three door one bitcoin step througha look prolific post infamous mircea popescu positing rare clairvoyance possible path bitcoin could take road future,0.0,-0.05,-0.025
RSS,https://bitcoinmagazine.com/.rss/full/,2024-09-25 15:34:43+00:00,2024-10-12 12:16:12.596752,israel go cashlessisraels promoting new plan abolish 200 shekel banknote forbid possession physical gold silver use ai enforcement gaza state cash deteriorates efrat fenigson,0.0516,0.06818181818181818,0.05989090909090909
RSS,https://bitcoinmagazine.com/.rss/full/,2024-09-25 11:04:01+00:00,2024-10-12 12:16:12.596752,brink donates 1 million bitcoin developer last yearnonprofit organisation brink published annual report detailing 1 million donation open source developer 2023 report highlighted achievement brinksponsored contributor improving bitcoins protocol,0.4215,0.0,0.21075
RSS,https://bitcoinmagazine.com/.rss/full/,2024-09-24 16:46:51+00:00,2024-10-12 12:16:12.596752,building lnbits wordpress bitcoin lightning node ben arcben arc talented team developer behind lnbits helping user lightning,0.6705,0.14999999999999997,0.41025
RSS,https://bitcoinmagazine.com/.rss/full/,2024-09-24 13:22:48+00:00,2024-10-12 12:16:12.596752,bitwise cio say powerful people finance buying bitcoin cryptothe cio bitcoin asset manager bitwise claim powerful people finance buying bitcoin crypto say nearly 70 top financial advisor recent summit owned bitcoin crypto personally,0.836,0.18333333333333335,0.5096666666666667
RSS,https://bitcoinmagazine.com/.rss/full/,2024-09-23 17:53:49+00:00,2024-10-12 12:16:12.596752,bitcoin fork pathway innovation disruptive forcesa look history major bitcoin fork,0.0772,0.0625,0.06985
RSS,https://bitcoinmagazine.com/.rss/full/,2024-09-23 13:31:05+00:00,2024-10-12 12:16:12.596752,donald trump say crypto could help pay 35 trillion u debtdonald trump floated using crypto pay u 35 trillion debt part embrace bitcoin amid 2024 race kamala harris also pledged boost digital asset signaling cryptos growing bipartisan appeal,0.765,0.0,0.3825
RSS,https://bitcoinmagazine.com/.rss/full/,2024-09-20 21:42:07+00:00,2024-10-12 12:16:12.596752,sec approves option trading blackrocks spot bitcoin etf ibitthe sec approved listing trading option blackrocks ishares bitcoin trust marking significant milestone bitcoin integration traditional finance,0.8625,0.04375,0.453125
RSS,https://bitcoinmagazine.com/.rss/full/,2024-09-20 16:30:47+00:00,2024-10-12 12:16:12.596752,bitcoin react u electioncan historical election trend predict bitcoins next move,0.0,0.0,0.0
RSS,https://bitcoinmagazine.com/.rss/full/,2024-09-20 14:52:09+00:00,2024-10-12 12:16:12.596752,microstrategy buy additional 489 billion worth bitcoinmicrostrategy purchased additional 489 million bitcoin swelling corporate bitcoin treasury 252000 btc worth nearly 10 billion company bitcoin strategy aim boost return hedge inflation,0.743,0.175,0.45899999999999996
RSS,https://bitcoinmagazine.com/.rss/full/,2024-09-20 14:10:48+00:00,2024-10-12 12:16:12.596752,santa monica bitcoin office case study presented cmrta annual conferenceproof workforce santa monicas vice mayor present case study city innovative bitcoin office cmrta annual conference office first kind u aim educate bitcoin support economic recovery,0.8402,0.31,0.5751
RSS,https://bitcoinmagazine.com/.rss/full/,2024-09-20 09:20:12+00:00,2024-10-12 12:16:12.596752,satoshi era wallet moved 16 million worth bitcoinaround 250 btc bitcoins early day transferred 15 year inactivity revealing huge reward reaped early miner 16 million worth satoshi era coin highlight conviction pioneering hodlers,0.8807,0.24,0.56035
RSS,https://bitcoinmagazine.com/.rss/full/,2024-09-19 22:44:29+00:00,2024-10-12 12:16:12.596752,bipartisan consensus emerges final day america love crypto tourcoinbase ceo brian armstrong congressman wiley nickel dnc emphasized need united state decisively lead crypto policy bipartisan manner,0.7906,0.25,0.5203
RSS,https://bitcoinist.com/feed/,2024-10-12 10:00:36+00:00,2024-10-12 12:16:12.596752,german national accused 150 million crypto fraud evades capturehorst jicha german national charged orchestrating 150 million crypto fraud scheme become fugitive failing appear brooklyn federal court jicha reportedly home detention new york city secured 5 million bond guaranteed domestic partner child trial set march 31,-0.9287,0.03409090909090909,-0.44730454545454545
RSS,https://bitcoinist.com/feed/,2024-10-12 08:00:41+00:00,2024-10-12 12:16:12.596752,arkham intelligence set launch new crypto derivative exchange next monthaccording recent bloomberg report blockchain data firm arkham intelligence backed sam altman founder openai preparing launch crypto derivative exchange november new crypto exchange horizon according source familiar plan arkham relocating operation london new york punta,0.743,0.08344155844155843,0.4132207792207792
RSS,https://bitcoinist.com/feed/,2024-10-12 06:30:00+00:00,2024-10-12 12:16:12.596752,japan metaplanet scoop another 108 bitcoin inch closer 1000 btc targeton october 10 2024 japanese investment firm metaplanet added another 108 bitcoin btc reserve bringing total holding 748 btc metaplanet eye 1000 bitcoin target third purchase october metaplanet acquired additional 108 btc average price 61659 firm total reserve stand 748502,0.1531,-0.07857142857142858,0.037264285714285715
RSS,https://bitcoinist.com/feed/,2024-10-12 05:00:37+00:00,2024-10-12 12:16:12.596752,bitcoincentric strategy saylor envisions microstrategy leading bank cryptoin recent interview analyst research brokerage firm bernstein microstrategy founder michael saylor articulated ambitious vision company transform leading bitcoin btc bank interview saylor emphasized btcs importance valuable asset stating ultimate goal position microstrategy,0.9042,0.012499999999999997,0.45835
RSS,https://bitcoinist.com/feed/,2024-10-12 03:30:52+00:00,2024-10-12 12:16:12.596752,bitcoin whale buy 15 million btc 6 month mega rally incomingbitcoin pressure press time looking trend past two week despite upswing september bull started wrong foot october dropping around 66000 although coin press time bouncing 60000 slip october 10 buyer need prove,-0.6486,-0.375,-0.5118
RSS,https://bitcoinist.com/feed/,2024-10-12 02:00:40+00:00,2024-10-12 12:16:12.596752,former ftx exec ryan salame post bizarre linkedin update heading prisonthe way former ftx executive ryan salame prepares start 75year prison sentence surprised crypto community recent social medium update sparked wave meme joke among industry figure community member shared thought unconventional linkedin post related reading ethereum investor sound alarm china 7000,-0.296,0.11666666666666667,-0.08966666666666666
RSS,https://bitcoinist.com/feed/,2024-10-11 23:00:35+00:00,2024-10-12 12:16:12.596752,bitcoin whale bought 15m btc past 6 month smart money accumulationbitcoin experiencing significant volatility uncertainty falling 60000 mark dip sparked mixed reaction among investor view potential bear trap indicating price may soon rally others fear market could headed deeper correction despite conflicting sentiment critical data,-0.1974,0.05654761904761905,-0.07042619047619048
RSS,https://bitcoinist.com/feed/,2024-10-11 22:00:27+00:00,2024-10-12 12:16:12.596752,dogecoin analyst say 003 altcoin next doge prepares surge 075 mark q1 2025dogecoin doge gradually recovering startofoctober crypto market crash saw altcoin sector shed significant value despite bullish sign investor migrating token promise astronomical return q1 2025 explains rco finance rcof upcoming presale altcoin generates massive hype discover dogecoin doge analyst investor,0.4215,0.125,0.27325
