MainSource,Source,Publication Date,Pull_date,Pre-Processed Text,Sentiment_Vader,Sentiment_TextBlob,Average_Sentiment
Reddit,ethereum,2025-01-01 07:01:44,2025-01-04 00:51:47.376153,daily general discussion january 01 2025welcome ethfinance daily general discussion rethereum httpsimgurcom3y7vezphttpsimgurcom3y7vezp please use thread discus ethereum topic news event even price price discussion posted elsewhere subreddit continue removed rethereum mullet tech front page party daily word technical big news item go front page rethereum pricesmemestweetsoff topic go daily always constructive ticker eth subreddit ruleshttpswwwredditcomrethereumaboutrules also rethstaker incredible community dedicated staking need advice getting set head assistance ethfinance ethereum community link discord ev maverickshttpsdiscordggevmavericks ethereum twitterhttpsxcomethereum ethfinance twitterhttpsnitternetethfinancer evmavericks youtubehttpswwwyoutubecomevmavericks ethfinance doots podcasthttpsevmaverickslibsyncom daily doots websitehttpsdailydootscom ethereum jobshttpsethereumorgencommunitygetinvolvedethereumjobs get reddit doots extensionhttpsgithubcometheralphaethfinanceextension uhanniabu see fellow dooters everywhere reddit calendar courtesy week ethereum newshttpsweekinethereumnewscom jan 20 ethereum protocol attackathonhttpsblogethereumorg20241125ethereumprotocolattackathon end jan 3031 ethereumzurichhttpsethereumzurich conference feb 79 eth oxfordhttpsethoxfordio hackathon feb 1016 ethiopiahttpsethiopiaxyz conference hackathon feb 23 mar 2 ethdenverhttpswwwethdenvercom mar 2830 eth pondyhttpswwwethpondyxyz puducherry hackathon apr 13 ey global blockchain summit person virtual apr 25 eth bucharesthttpsethbucharestro hackathon conference apr 46 ethglobal taipeihttpsethglobalcomeventstaipei hackathon may 910 ethbratislavahttpsethbratislavacom conference hackathon may 911 ethdamhttpswwwethdamcom amsterdam conference hackathon may 911 ethlisbonhttpsethlisbonorg hackathon may 2729 ethpraguehttpsethpraguecom conference may 30 jun 1 ethglobal praguehttpsethglobalcomeventsprague hackathon jun 38 eth belgradehttpsethbelgraders conference hackathon jun 1213 protocol berghttpsprotocolberlin berlin conference jun 1618 dappconhttpsdappconio berlin jun 2628 ethclujhttpswwwethclujorg romania conference jun 30 jul 3 ethcchttpsethccio cannes conference jul 46 ethglobal canneshttpsethglobalcomeventscannes hackathon jul 1719 napulethhttpswwwnapulethorg napoli conference aug 1517 ethglobal new yorkhttpsethglobalcomeventsnewyork2025 hackathon sep 2628 ethglobal new delhihttpsethglobalcomeventsnewdelhi hackathon nov ethglobal devconnecthttpsethglobalcomeventsethglobaldevconnect hackathon,0.7951,0.09790209790209789,0.446501048951049
Reddit,ethereum,2025-01-01 14:03:35,2025-01-04 00:51:47.376153,start research ethereum beginnerim developer getting space ive worked development ive never done formal research crypto want expand knowledge better understand ecosystem research perspective could share advice resource someone development experience get started crypto research im particularly interested researching ethereum protocol scalability solution defi understanding key academic technical paper field tool framework platform commonly used crypto research pointer would greatly appreciated thanks,0.9569,0.10625000000000001,0.531575
Reddit,ethereum,2025-01-02 10:32:35,2025-01-04 00:51:47.376153,transfer went wrong please help mei 2 money transfer gatehub wallet revolut wallet regarding btc pushed receive revolut gave btc wallet address copy pasted pushing transfer btc gatehub exact thing eth long story short money left gatehub never reached revolut 12 hour im worried lot blockchain site say transfer successful crypto expert anyone help find money p wrote revolut said dont know money looking p 2 wrote gatehub support least responsive support ever im adding team linkedin please help edit turn gatehub sent btc eth xrp network managed revolut still found way recover fund money safe thank people tried help cheer scammer tried make log wallet dark web apps,0.9738,0.05555555555555555,0.5146777777777778
Reddit,ethereum,2024-12-31 16:10:02,2025-01-04 00:51:47.376153,vitalik buterin donated 50 eth one former tornado cash developersalexey pertsev sentenced 5 year prison dutch court httpsetherscaniotx0x6beef6a7ce0a298bfd4ec3295a45ec9be0710f476d6774027626c4c23a1a537a,-0.5267,0.0,-0.26335
Reddit,ethereum,2024-12-31 22:13:58,2025-01-04 00:51:47.376153,whats economic way swap rethon mainnet uscdon arbitrumplease let know there better way maximize fund want using dex 1 swap reth mainnet usdc mainnet dex bridge usdc arbitrum using arbitrum bridge 11 find get usdc reth mainnet bridging usdc convert usdce isnt good there also swap done mainnet requires gas 2 bridge reth mainnet arbitrum arbitrum bridge 11 swap reth arbitrum usdc arbitrum dex find reth usdc rate worse arbitrum get usdc instead usdce two way think better way seems wont able use usdce aave right bridge usdc get select type usdc recieve arbitrum automatically usdce thanks input p yes welcome scammer message privately please mutual entertainment,0.9231,0.32857142857142857,0.6258357142857143
Reddit,ethereum,2024-12-31 07:01:02,2025-01-04 00:51:47.376153,daily general discussion december 31 2024welcome ethfinance daily general discussion rethereum httpsimgurcom3y7vezphttpsimgurcom3y7vezp please use thread discus ethereum topic news event even price price discussion posted elsewhere subreddit continue removed rethereum mullet tech front page party daily word technical big news item go front page rethereum pricesmemestweetsoff topic go daily always constructive ticker eth subreddit ruleshttpswwwredditcomrethereumaboutrules also rethstaker incredible community dedicated staking need advice getting set head assistance ethfinance ethereum community link discord ev maverickshttpsdiscordggevmavericks ethereum twitterhttpsxcomethereum ethfinance twitterhttpsnitternetethfinancer evmavericks youtubehttpswwwyoutubecomevmavericks ethfinance doots podcasthttpsevmaverickslibsyncom daily doots websitehttpsdailydootscom ethereum jobshttpsethereumorgencommunitygetinvolvedethereumjobs get reddit doots extensionhttpsgithubcometheralphaethfinanceextension uhanniabu see fellow dooters everywhere reddit calendar courtesy week ethereum newshttpsweekinethereumnewscom jan 20 ethereum protocol attackathonhttpsblogethereumorg20241125ethereumprotocolattackathon end jan 3031 ethereumzurichhttpsethereumzurich conference feb 79 eth oxfordhttpsethoxfordio hackathon feb 1016 ethiopiahttpsethiopiaxyz conference hackathon feb 23 mar 2 ethdenverhttpswwwethdenvercom mar 2830 eth pondyhttpswwwethpondyxyz puducherry hackathon apr 13 ey global blockchain summit person virtual apr 25 eth bucharesthttpsethbucharestro hackathon conference apr 46 ethglobal taipeihttpsethglobalcomeventstaipei hackathon may 910 ethbratislavahttpsethbratislavacom conference hackathon may 911 ethdamhttpswwwethdamcom amsterdam conference hackathon may 911 ethlisbonhttpsethlisbonorg hackathon may 2729 ethpraguehttpsethpraguecom conference may 30 jun 1 ethglobal praguehttpsethglobalcomeventsprague hackathon jun 38 eth belgradehttpsethbelgraders conference hackathon jun 1213 protocol berghttpsprotocolberlin berlin conference jun 1618 dappconhttpsdappconio berlin jun 2628 ethclujhttpswwwethclujorg romania conference jun 30 jul 3 ethcchttpsethccio cannes conference jul 46 ethglobal canneshttpsethglobalcomeventscannes hackathon jul 1719 napulethhttpswwwnapulethorg napoli conference aug 1517 ethglobal new yorkhttpsethglobalcomeventsnewyork2025 hackathon sep 2628 ethglobal new delhihttpsethglobalcomeventsnewdelhi hackathon nov ethglobal devconnecthttpsethglobalcomeventsethglobaldevconnect hackathon,0.7951,0.09790209790209789,0.446501048951049
Reddit,ethereum,2024-12-31 15:53:42,2025-01-04 00:51:47.376153,ethereum cat herder wrap 2024 ethereum cat herder wrap 2024 2024 wrap reflecting incredible year progress collaboration community impact check ethcatherders full yearend wrapup read httpsmediumcomethereumcatherdersethereumcatherderswrapfor202462b029f1dceehttpsmediumcomethereumcatherdersethereumcatherderswrapfor202462b029f1dcee,0.4728,0.625,0.5488999999999999
Reddit,ethereum,2024-12-31 06:03:17,2025-01-04 00:51:47.376153,stake ethi currently hodl eth im true sure im fan staking figured long run might well start staking im ask daapp yall use stake eth also hodl ledger edit dont want stake cex,0.8062,0.19999999999999998,0.5031
Reddit,ethereum,2024-12-31 16:00:15,2025-01-04 00:51:47.376153,used erc2535 diamond proof peacemaking protocol,0.6249,0.0,0.31245
Reddit,ethereum,2024-12-31 11:17:17,2025-01-04 00:51:47.376153,requesting testnet eth learningpractice validator node setuphi everyone im devops professional exploring run validator ethereum testnet need larger amount test eth cover full staking requirement spare id really appreciate could send address 0x22c4a49ab378327cd443b7ae20d2f6b0a35630ac dont hand could please point towards faucet resource might provide bigger amount faucet ive found far give around 005 token isnt quite enough practicing validator deposit thank much help,0.5578,0.11875,0.338275
Reddit,ethereum,2024-12-31 03:54:44,2025-01-04 00:51:47.376153,gas fee consumption base v mainnethi launched project mainnet recently experienced issue around excess eth max wallet transaction consumed gas example httpsetherscaniotx0x627093be03913cac939c990efde1817f52cad09b5074cd724b192101372ee054 httpsetherscaniotx0xb1c94916133f374d21d3fe0339654934c99e9700e99393673b86bf1d2e013298 httpsetherscaniotx0xe6cb711184f7c2e187d7c8dab192cd739cdf21f9c2210d8dd920e0219ba102e5 contributing factor high gwei pricing time launch max wallet 025 launch low initial liquidity high gas usage transaction due contract complexity result attempted send eth max wallet worth resulted remaining eth transaction consumed gas going migrate base order significantly lower transaction cost trying determine issue follow u base relaunch thing different relaunch higher initial liquidity max wallet 2 whitelist launch le people botting launch unlimited gas limit testing base sepolia tx exceed max wallet fail hoping get insight transaction result obviously ideal project impression issue follow u base simply due gwei pricing even transaction consumes gas limit still couple dollar opinion insight would awesome cheer,0.9118,-0.04025000000000001,0.435775
Reddit,ethereum,2024-12-30 07:01:40,2025-01-04 00:51:47.376153,daily general discussion december 30 2024welcome ethfinance daily general discussion rethereum httpsimgurcom3y7vezphttpsimgurcom3y7vezp please use thread discus ethereum topic news event even price price discussion posted elsewhere subreddit continue removed rethereum mullet tech front page party daily word technical big news item go front page rethereum pricesmemestweetsoff topic go daily always constructive ticker eth subreddit ruleshttpswwwredditcomrethereumaboutrules also rethstaker incredible community dedicated staking need advice getting set head assistance ethfinance ethereum community link discord ev maverickshttpsdiscordggevmavericks ethereum twitterhttpsxcomethereum ethfinance twitterhttpsnitternetethfinancer evmavericks youtubehttpswwwyoutubecomevmavericks ethfinance doots podcasthttpsevmaverickslibsyncom daily doots websitehttpsdailydootscom ethereum jobshttpsethereumorgencommunitygetinvolvedethereumjobs get reddit doots extensionhttpsgithubcometheralphaethfinanceextension uhanniabu see fellow dooters everywhere reddit calendar courtesy week ethereum newshttpsweekinethereumnewscom jan 20 ethereum protocol attackathonhttpsblogethereumorg20241125ethereumprotocolattackathon end jan 3031 ethereumzurichhttpsethereumzurich conference feb 79 eth oxfordhttpsethoxfordio hackathon feb 1016 ethiopiahttpsethiopiaxyz conference hackathon feb 23 mar 2 ethdenverhttpswwwethdenvercom mar 2830 eth pondyhttpswwwethpondyxyz puducherry hackathon apr 13 ey global blockchain summit person virtual apr 25 eth bucharesthttpsethbucharestro hackathon conference apr 46 ethglobal taipeihttpsethglobalcomeventstaipei hackathon may 910 ethbratislavahttpsethbratislavacom conference hackathon may 911 ethdamhttpswwwethdamcom amsterdam conference hackathon may 911 ethlisbonhttpsethlisbonorg hackathon may 2729 ethpraguehttpsethpraguecom conference may 30 jun 1 ethglobal praguehttpsethglobalcomeventsprague hackathon jun 38 eth belgradehttpsethbelgraders conference hackathon jun 1213 protocol berghttpsprotocolberlin berlin conference jun 1618 dappconhttpsdappconio berlin jun 2628 ethclujhttpswwwethclujorg romania conference jun 30 jul 3 ethcchttpsethccio cannes conference jul 46 ethglobal canneshttpsethglobalcomeventscannes hackathon jul 1719 napulethhttpswwwnapulethorg napoli conference aug 1517 ethglobal new yorkhttpsethglobalcomeventsnewyork2025 hackathon sep 2628 ethglobal new delhihttpsethglobalcomeventsnewdelhi hackathon nov ethglobal devconnecthttpsethglobalcomeventsethglobaldevconnect hackathon,0.7951,0.09790209790209789,0.446501048951049
Reddit,ethereum,2024-12-29 21:07:13,2025-01-04 00:51:47.376153,starting journey smart contract hey everyone im getting started learning smart contract honestly im pretty excited little overwhelmed ethereum always fascinated finally decided time stop reading actually start building something ive messing around solidity tutorial get feel everything work goal eventually create projectsomething small manageable hopefully useful least good learning experience whove shoe advice like whats one thing wish someone told starting maybe resource found super helpful im looking forward learning community finger crossed sharing something cool soon,0.9873,0.13329365079365077,0.5602968253968253
Reddit,ethereum,2024-12-29 23:39:14,2025-01-04 00:51:47.376153,use old seed 25 wordsi noted old seed 25 word way access since wallet allow 24 word enter probably 2017,0.2263,0.1,0.16315000000000002
Reddit,ethereum,2024-12-29 14:02:38,2025-01-04 00:51:47.376153,who building ethereums next credit marketsit seems blockchainbased credit market built using overcollateralized loan considering debt one largest market earth beyond derivative cant help ask build noncollateralized debt market ethereum current leader looking hold address user accountable credit debt could credit agency bank start working ethereum blockchain even possible looking insight,0.1635,0.0,0.08175
Reddit,ethereum,2024-12-29 07:01:17,2025-01-04 00:51:47.376153,daily general discussion december 29 2024welcome ethfinance daily general discussion rethereum httpsimgurcom3y7vezphttpsimgurcom3y7vezp please use thread discus ethereum topic news event even price price discussion posted elsewhere subreddit continue removed rethereum mullet tech front page party daily word technical big news item go front page rethereum pricesmemestweetsoff topic go daily always constructive ticker eth subreddit ruleshttpswwwredditcomrethereumaboutrules also rethstaker incredible community dedicated staking need advice getting set head assistance ethfinance ethereum community link discord ev maverickshttpsdiscordggevmavericks ethereum twitterhttpsxcomethereum ethfinance twitterhttpsnitternetethfinancer evmavericks youtubehttpswwwyoutubecomevmavericks ethfinance doots podcasthttpsevmaverickslibsyncom daily doots websitehttpsdailydootscom ethereum jobshttpsethereumorgencommunitygetinvolvedethereumjobs get reddit doots extensionhttpsgithubcometheralphaethfinanceextension uhanniabu see fellow dooters everywhere reddit calendar courtesy week ethereumhttpsweekinethereumnewscom jan 20 ethereum protocol attackathon end jan 2426 eth pondy puducherry hackathon jan 3031 ethereumzurichhttpethereumzurich conference feb 79 eth oxford hackathon feb 1016 ethiopia conference hackathon feb 23 mar 2 ethdenver apr 25 eth bucharest hackathon conference apr 46 ethglobal taipei hackathon may 910 ethbratislava conference hackathon may 911 ethdam amsterdam conference hackathon may 911 ethlisbon hackathon may 2729 ethprague conference may 30 jun 1 ethglobal prague hackathon jun 38 eth belgrade conference hackathon jun 1213 protocol berg berlin conference jun 1618 dappcon berlin jun 2628 ethcluj romania conference jun 30 jul 3 ethcc cannes conference jul 46 ethglobal cannes hackathon jul 1619 napuleth napoli conference aug 1517 ethglobal new york hackathon sep 2628 ethglobal new delhi hackathon nov ethglobal devconnect hackathon,0.7951,0.10606060606060604,0.45058030303030305
Reddit,ethereum,2024-12-30 18:48:07,2025-01-04 00:51:47.376153,sub 1 cent gas feeshow come eth 20 didnt bring u sub 1 cent gas fee still think gas fee still high mainstream adoption,0.0,0.16,0.08
Reddit,ethereum,2024-12-29 00:13:55,2025-01-04 00:51:47.376153,tim beiko allcoredevs 2024 recap 2025 outlook,0.0,0.0,0.0
Reddit,ethereum,2024-12-29 00:49:16,2025-01-04 00:51:47.376153,gstar name consensus layer upgrade fusaka,0.0,0.0,0.0
Reddit,ethereum,2024-12-29 16:12:24,2025-01-04 00:51:47.376153,stop considering hardware software wallet wallet smart wallet real walletsim trying discussion terminology crytpos especially ethereum space term wallet confusing refers many different thing different way working different level security software wallet sfw like metamask keyring hold key set key doesnt hold fund rather key give access fund software client used keep key safe interact wallet fund hardware wallet hw like ledger trezor even tangem also keyring safer software wallet key stay physical device cant accessed remotely single point failure wallet alone still bit confusing may refer 2 sligthly different thing public address actually hold fund public address derived seedphrase either 1 address several public address term wallet well suited sfw hw opinion effectively store fund like real wallet store money bill smart wallet smart contract wallet scw like safe wallet wallet hold fund smart wallet im talking smart account based wallet called smart programmable feature make incredibly powerful secure multisig social recovery spending limit access management recurring payment etc nutshell sfw hw key access wallet externally owned address address scw contract address rather called sfw hw wallet using le confusing term like keyring keyring client even web3 client,0.9875,0.0850250626566416,0.5362625313283208
Reddit,ethereum,2024-12-28 21:37:25,2025-01-04 00:51:47.376153,one move eth layer 2 cheaper fee still keep eth usdc wbtc daii eth ledger bull cycle im planning exchange eth usdc dai wbtc im crazy eth gas fee never used layer 2 possible move eth layer 2 swap back forth eth usdc dai wbtc layer 2 would use migrate eth layer 2 thanks everyone p love wasting scammer time please message privately ask need help layer 2 permission setting,0.7906,0.016666666666666673,0.40363333333333334
Reddit,ethereum,2024-12-29 02:13:47,2025-01-04 00:51:47.376153,ethereum staking feecould someone explain staking fee work ethereum looking staking 361 usd worth eth say fee 1411 apr 37 fee would wipe earnings misunderstanding fee,-0.2263,0.3,0.036849999999999994
Reddit,ethereum,2024-12-29 04:13:51,2025-01-04 00:51:47.376153,buying crypto card painfulwhy crypto marketplace show different exchange rate card payment register complete verification drop rate 45 apparent reason justify offering 900 usdt 1000 card payment thats equivalent 15 fee anyone recommend crypto exchange use bankcredit card google pay low fee like 34,0.1027,0.037500000000000006,0.0701
Reddit,ethereum,2024-12-28 23:38:15,2025-01-04 00:51:47.376153,howto creating bitmap image onchain,0.296,0.0,0.148
Reddit,ethereum,2024-12-28 07:01:14,2025-01-04 00:51:47.376153,daily general discussion december 28 2024welcome ethfinance daily general discussion rethereum httpsimgurcom3y7vezphttpsimgurcom3y7vezp please use thread discus ethereum topic news event even price price discussion posted elsewhere subreddit continue removed rethereum mullet tech front page party daily word technical big news item go front page rethereum pricesmemestweetsoff topic go daily always constructive ticker eth subreddit ruleshttpswwwredditcomrethereumaboutrules also rethstaker incredible community dedicated staking need advice getting set head assistance ethfinance ethereum community link discord ev maverickshttpsdiscordggevmavericks ethereum twitterhttpsxcomethereum ethfinance twitterhttpsnitternetethfinancer evmavericks youtubehttpswwwyoutubecomevmavericks ethfinance doots podcasthttpsevmaverickslibsyncom daily doots websitehttpsdailydootscom ethereum jobshttpsethereumorgencommunitygetinvolvedethereumjobs get reddit doots extensionhttpsgithubcometheralphaethfinanceextension uhanniabu see fellow dooters everywhere reddit calendar courtesy week ethereumhttpsweekinethereumnewscom jan 20 ethereum protocol attackathon end jan 2426 eth pondy puducherry hackathon jan 3031 ethereumzurichhttpethereumzurich conference feb 79 eth oxford hackathon feb 1016 ethiopia conference hackathon feb 23 mar 2 ethdenver apr 25 eth bucharest hackathon conference apr 46 ethglobal taipei hackathon may 910 ethbratislava conference hackathon may 911 ethdam amsterdam conference hackathon may 911 ethlisbon hackathon may 2729 ethprague conference may 30 jun 1 ethglobal prague hackathon jun 38 eth belgrade conference hackathon jun 1213 protocol berg berlin conference jun 1618 dappcon berlin jun 2628 ethcluj romania conference jun 30 jul 3 ethcc cannes conference jul 46 ethglobal cannes hackathon jul 1619 napuleth napoli conference aug 1517 ethglobal new york hackathon sep 2628 ethglobal new delhi hackathon nov ethglobal devconnect hackathon,0.7951,0.10606060606060604,0.45058030303030305
Reddit,ethereum,2024-12-29 17:41:05,2025-01-04 00:51:47.376153,beam chain related beam gaming ecosystemhi ive reading upcoming beam chain upgrade cant figure related gaming ecosystem name could someone clarify thanks,0.4404,0.06666666666666667,0.25353333333333333
Reddit,ethereum,2024-12-28 18:33:37,2025-01-04 00:51:47.376153,living canada save usdchi decline canadian dollar u dollar considering creating emergency fund usd sure open usd account traditional bank also consider buying usdc token sorry dumb question want discussion regarding relevant save usdc canadian know lot canadian already investing usd anyway saving directly usd stablecoin make sense see advantage le fee maybe really dont know fee usd account opened canada easy buy disadvantage tax implication pay transaction fee eth technically may pay tax depending acb plus since erc20 token considered asset canada pay tax make gain spend usdc usdccad go value across time current consensus easy spend usd outside crypto space crypto card democratizing,0.9337,0.09166666666666669,0.5126833333333334
Reddit,ethereum,2024-12-29 03:26:14,2025-01-04 00:51:47.376153,bethhi beth binance canadian swap beth eth transfer transfer somewhere exchange beth eth outside binance metamask phantom uniswap etc tia,0.5106,0.0,0.2553
Reddit,ethereum,2024-12-28 18:55:03,2025-01-04 00:51:47.376153,help eth stuck bnb network long story short sent eth wallet via binance smart chain network sent eth network canada go convert eth bnb eth network say need purchase bnb cover fee although exchange found allows purchase bnb want eth eth network,0.5719,0.054761904761904755,0.3133309523809524
Reddit,ethereum,2024-12-28 12:11:33,2025-01-04 00:51:47.376153,possible run state node hey im really sure different ethereum bitcoin client logic understanding transaction state smart contract value etc case need access readonly feature smart contract without spending much hardware current solution use rpc provider request state contract x listen new block update state end based transaction received necessary avoid hitting rate limit usage us large number request problem sync part take day current rate limit im using contract call probably isnt best solution wanted know possible run node without whole blockchain state goal verify transaction know efficiently state specific contract know possible difficult create implementation request directly network like real node include logic instead kind ethereum client sync specific part state store verify transaction,0.7943,0.14662956091527524,0.4704647804576376
Reddit,ethereum,2024-12-27 17:18:42,2025-01-04 00:51:47.376153,somebody explain people still paying 23 gas fee second half 2024hi following eth thread cryptocurrency subreddit various people claiming paying 30 even gas fee l1 transaction example saw commenthttpswwwredditcomrcryptocurrencycomments1hm4k11commentm3tigd0 yeah try swap 45 worth eth coin want costing 23 gas fee thanks read comment past week people still paying something like upper 20 range gas fee assume transaction recently possible though checking gas fee chart httpsbitinfochartscomcomparisonethereumtransactionfeeshtml1y highest average gas fee last 6 month 14 usd november 13th gas fee generally lower last 6 month ethereum havent seen average gas fee 20 usd since march 2024 according chart people still paying like 23 even upper 20 range gas fee lately,0.8442,-0.027450980392156855,0.40837450980392154
Reddit,ethereum,2024-12-27 22:59:09,2025-01-04 00:51:47.376153,latest week ethereum news,0.0,0.5,0.25
