MainSource,Source,Publication Date,Pull_date,Pre-Processed Text,Sentiment_Vader,Sentiment_TextBlob,Average_Sentiment
Reddit,solana,2025-01-14 22:08:23,2025-01-18 00:48:31.769086,syndica report deep dive solana dapps revenue december 2024source httpsxcomsyndica_iostatus1879252036077969901httpsxcomsyndica_iostatus1879252036077969901 1 2024 groundbreaking year solanahttpsxcomsolana dapps dapp revenue hit cumulative 16b incentivizing development increased innovation dive full dapp revenue thread report httpsblogsyndicaiodeepdivesolanadappsrevenuedecember2024httpsblogsyndicaiodeepdivesolanadappsrevenuedecember2024 httpspreviewreddit2ilsfy0r71de1pngwidth680formatpngautowebps29217fdb8f4733c5a5ec1ed2cac1ca36a92a5429 2 solanahttpsxcomsolana dapp revenue outpaced chain 2024 underscoring strength ecosystem dapps collectively pulled five time solanas revenue hitting 16b httpspreviewredditz5fqedaw71de1pngwidth679formatpngautowebpsa1aadcfa62cecffeba1071cf312b2a0e888d985e 3 q4 set new solanahttpsxcomsolana dapp revenue benchmark dapp revenue grew 28x previous high q2 higher revenue draw developer fueling virtuous cycle strengthens entire ecosystem httpspreviewredditg5bcc4ty71de1pngwidth679formatpngautowebps58485d8d2305192a43479b41069eb640b557ece2 4 solanahttpsxcomsolana defi revenue led ecosystem entire year defis slice pie jumped 64 88 cutting share sector like nfts gaming httpspreviewreddit2z6q864181de1pngwidth679formatpngautowebps02737965a578a89d24f93a1e68d876b1b487db28 5 solanahttpsxcomsolana ecosystem segment experienced significant revenue growth 2024 despite brief dip december year overall trend remained well start httpspreviewredditc6aqvkv381de1pngwidth679formatpngautowebpsd3ff5abe0f07afbde694550ae87242d7a893db30 6 seven solanahttpsxcomsolana dapps eclipsed 100m annual revenue pumpdotfunhttpsxcompumpdotfun tradewithphotonhttpsxcomtradewithphoton raydiumprotocolhttpsxcomraydiumprotocol finished top 3 highestrevenue solana dapps 2024 httpspreviewredditd13g6yu581de1pngwidth679formatpngautowebps45b8b10da0cac7f774ffc82a18fe75385b6817c0 7 pumpdotfunhttpsxcompumpdotfun tradewithphotonhttpsxcomtradewithphoton dominate memecoin dapp revenue pulled 10m monthly revenue since march collectively command striking 93 sector overall revenue httpspreviewredditwo8o63ea81de1pngwidth679formatpngautowebpscb2972a0a97789f88ebee4b255a884c5b9cc0942 httpspreviewredditrbid60y881de1pngwidth679formatpngautowebpsaf3dbccc7c9bf04f0c04fde30ad1dde65d724ca1 8 vectordotfunhttpsxcomvectordotfun revenue adoption soared first 4 month vectordotfun new memecoin trading mobile dapp developed tensor_hqhttpsxcomtensor_hq team httpspreviewreddit3caga3vc81de1pngwidth679formatpngautowebps4631667a3cc086112e7b24c792662ab63fb93c10 9 telegram bot proliferated driving revenue 66x 2024 fresh entrant made space fiercely competitive among bullx_iohttpsxcombullx_io trojanonsolanahttpsxcomtrojanonsolana seen revenue capture majority httpspreviewredditelcc302f81de1pngwidth679formatpngautowebps5b48b112f79ad14747993179d3d0dc8d0ed1f971 10 raydiumprotocolhttpsxcomraydiumprotocol flipped orca revenue last year raydiums market share started 39 early 2024 grew mom reaching 84 yearend httpspreviewredditkqv0e2bh81de1pngwidth679formatpngautowebps22439cceb3ad44ff00857f1437d5118b55f88400 11 jupiterexchangehttpsxcomjupiterexchange become revenue powerhouse jupiter monthly revenue grew 7x since start year user fueling jupiter revenue growth expect enhanced airdrop jupuary expert trader allocation httpspreviewreddittk7cnymj81de1pngwidth679formatpngautowebps89979092ce9a095519d224220078e6a6eabcbdab 12 jupiterexchangehttpsxcomjupiterexchange reached 84 solana perp dex revenue share stand leader among solana perp dexes drift flash trade following httpspreviewredditd2mnikbm81de1pngwidth679formatpngautowebps60bd3a09c7d736e894a5c20fa4ba1b95c8c58dd0 13 jupiterexchangehttpsxcomjupiterexchanges swap api opened new revenue opportunity solana project leading wallet like phantom solflare capitalized large user base integrating solution affiliate revenue 2024 amassed 108m 33m respectively httpspreviewredditfzue5tmo81de1pngwidth679formatpngautowebps5026ad95799df0f79e08ba9738ba75145d69fe70 14 solanahttpsxcomsolana depin project achieved ath revenue rendernetworkhttpsxcomrendernetwork gpus heliumhttpsxcomhelium wireless bandwidth hivemapperhttpsxcomhivemapper map data collection posted new record revenue demand httpspreviewredditbqly1b0r81de1pngwidth679formatpngautowebpsdc42cdf1dee84dea0c32b1b6c9655f13f939033b 15 mobile become lifeblood heliumhttpsxcomheliums revenue account commanding 98 protocol revenue share helium_mobilehttpsxcomhelium_mobiles strategy includes partnership major telecom provider data offloading httpspreviewreddito2bs71dt81de1pngwidth679formatpngautowebps2ef9485fd2f21c55466429c32b87c2cdd9977be3 16 solanas nft marketplace rose back 1m revenue mark magic eden mehttpsxcomsearchq24mesrccashtag_click pudgy penguin penguhttpsxcomsearchq24pengusrccashtag_click token launch december provided fresh inflow nft sector tensor tnsrhttpsxcomsearchq24tnsrsrccashtag_click season 4 airdrop available claim january 2025 httpspreviewreddit0c91k9mv81de1pngwidth679formatpngautowebpsc0987e74d287e424cd57fa255f78ec5361bcdbc9 17 kaminofinancehttpsxcomkaminofinance breakout 2024 fueled kamino lend protocol reached fresh ath 38m revenue last month soaring 11x since start year httpspreviewreddit1rnldph091de1pngwidth679formatpngautowebps4c3d29699cb3fdea645b7e758edfcee1553ef0da 18 metaplexhttpsxcommetaplex riding memecoin ai agent wave memecoin creation pumpdotfun boosted metaplex revenue ai agent interacting autonomously across program 50 revenue go mplxhttpsxcomsearchq24mplxsrccashtag_click buyback hitting record high last 2 month httpspreviewredditw1a46b2191de1pngwidth679formatpngautowebpscd5997252c3fd3d40d496b3f154ab3e67b7dea62 19 subscribe email newsletter receive report inbox httpsblogsyndicaiodeepdivesolanadappsrevenuedecember2024httpsblogsyndicaiodeepdivesolanadappsrevenuedecember2024 httpspreviewreddit8ady5e4391de1pngwidth680formatpngautowebpse3f1e920d4ceea2106953182279eccf43054af50,0.9939,0.1436044511044511,0.5687522255522256
Reddit,solana,2025-01-14 21:52:10,2025-01-18 00:48:31.769086,convert trx bullx wallet solana phantom walleti would greatly appreciate help question posed title tried sending small amount trx bullx wallet kucoin exchange account fund never arrived think might straightforward process ultimately want fund solana phantom wallet right fund trx bullx wallet please point right direction thanks,0.8878,0.2423469387755102,0.5650734693877552
Reddit,ethereum,2025-01-07 13:01:17,2025-01-18 00:48:31.769086,weekly discussion thread buildinghello rethereum welcome weekly discussion thread building space developer entrepreneur enthusiast showcase project share idea seek feedback greater ethereum community share project whether youre developing decentralized application dapp launching new layer 2 network working ethereum infrastructure encourage share detail project please provide concise overview including purpose current status link information provide xtwitter youtube link post automatically filtered engage collaborate thread excellent opportunity connect likeminded individual application tester feel free ask question offer feedback seek collaboration safety reminder encourage sharing collaboration please cautious potential scam avoid connecting wallet unfamiliar application without thorough research utilizing wallet tool offer transaction simulation eg rabby walletguard help ensure safety fund never give seed phrase private key looking forward hearing pushing ethereum ecosystem forward,0.9908,0.26694214876033057,0.6288710743801653
Reddit,ethereum,2025-01-17 07:01:45,2025-01-18 00:48:31.769086,daily general discussion january 17 2025welcome ethfinance daily general discussion rethereum httpsimgurcom3y7vezphttpsimgurcom3y7vezp bookmarking link always bring current daily httpsoldredditcomrethereumaboutstickynum2httpsoldredditcomrethereumaboutstickynum2 please use thread discus ethereum topic news event even price price discussion posted elsewhere subreddit continue removed always constructive subreddit ruleshttpswwwredditcomrethereumaboutrules want stake learn rethstaker ethfinance ethereum community link ethereum jobshttpsethereumorgencommunitygetinvolvedethereumjobs twitterhttpsxcomethereum evmavericks youtubehttpswwwyoutubecomevmavericks discordhttpsdiscordggevmavericks doots podcasthttpsevmaverickslibsyncom doots websitehttpsdailydootscom old reddit doots extensionhttpsgithubcometheralphaethfinanceextension uhanniabu calendar jan 20 ethereum protocol attackathonhttpsblogethereumorg20241125ethereumprotocolattackathon end jan 3031 ethereumzurichhttpsethereumzurich conference feb 79 eth oxfordhttpsethoxfordio hackathon feb 1016 ethiopiahttpsethiopiaxyz conference hackathon feb 23 mar 2 ethdenverhttpswwwethdenvercom mar 2830 eth pondyhttpswwwethpondyxyz puducherry hackathon apr 13 ey global blockchain summit person virtual,0.3818,0.025000000000000005,0.2034
Reddit,ethereum,2025-01-17 21:42:41,2025-01-18 00:48:31.769086,announcing 2024 academic grant round recipient ethereum foundation blog,0.3612,-0.1,0.1306
Reddit,ethereum,2025-01-17 13:30:21,2025-01-18 00:48:31.769086,people discus crypto twitter instead redditis tech already people prefer short blurb instead longer discussion collect follower transform money status influence something else,0.0,0.0,0.0
Reddit,ethereum,2025-01-17 14:08:00,2025-01-18 00:48:31.769086,worldcoins eyeballscanning station gamed hustler exploited homeless,-0.4588,0.0,-0.2294
Reddit,ethereum,2025-01-17 19:18:23,2025-01-18 00:48:31.769086,radically simple guide power linux web3 cartesithis articlehttpscartesiiobloglinux_in_web3 shed light integration linux web3 ecosystem unlocking world possibility developer linux really help broaden design landscape enables use widelyadopted programming language moving beyond constraint blockchainspecific one integration simplifies development familiar tool library fostering spirit opensource collaboration moreover linux serf bridge web3 traditional web2 infrastructure boosting scalability security cartesis innovative approach delivering linuxpowered rollups transforming blockchain development making accessible versatile forwardthinking,0.8858,0.2642857142857143,0.5750428571428572
Reddit,ethereum,2025-01-17 20:49:05,2025-01-18 00:48:31.769086,core devs execution acde 203 protocol call,0.0,0.0,0.0
Reddit,ethereum,2025-01-17 20:56:20,2025-01-18 00:48:31.769086,pump gas analyzing ethereum gas limit debateas ethereum continues evolve one key topic discussed proposal increase gas limit proposal garnered ton attention among community potential scale network reduce transaction fee enable new type decentralized application dapps however higher gas limit also raise important concern decentralization validator hardware requirement overall network stability post ive shared article delf origin proposal potential benefit challenge come article cover history past attempt raise gas limit ethereum gas limit could gradually raised without network fork predictable effect higher gas limit like lower gas fee improved transaction flow potential new type dapps onchain ai largescale token operation emerge network capacity increase risk decentralization security including validator hardware requirement mev disparity potentially negative byproduct higher gas limit youre interested deep dive topic check article share thought think gas limit increase could help ethereum scale without compromising core principle read full report httpsresearch2077xyztopumpthegasornotanalyzingtheethereumgaslimitdebate1 p weve also written thread break gas limit explains high level raising gas limit could mean scalability fee dapp developer network health httpsxcom2077researchstatus1880343190412103870,0.9584,0.05895933014354068,0.5086796650717703
Reddit,ethereum,2025-01-17 04:40:01,2025-01-18 00:48:31.769086,question layer 1shi everyone got self custody coin swapping newersmaller token arent listed exchange yet drove really want understand layer 1 price driven layer 2 example ethereums price go people buying layer 2 holding go people holding stack ethereums pay gas fee also making wonder example solanas price gone compared ethereum besides ethereum gas fee even though solana cheaper gas fee dont see amount legitimate project compared solana example every time see video coming ai project gaming hot niche almost always ethereum solana getting boost market cap meme coin andor big investor holding sol hold combine narrative better speed gas fee hating ethereum im genuinely curious ethereums ecosystem bigger still continuing get project understanding thanks everyone,0.7713,0.15,0.46065
Reddit,ethereum,2025-01-17 14:54:52,2025-01-18 00:48:31.769086,ethereumorg downanyone know happened,0.0,0.0,0.0
Reddit,ethereum,2025-01-17 14:15:05,2025-01-18 00:48:31.769086,strategy handling taxable event,0.0,0.0,0.0
Reddit,ethereum,2025-01-16 11:20:34,2025-01-18 00:48:31.769086,coinbase release new paper permissionless networksjust time davos coinbase new paper permissionless network like ethereum critical innovation growth definitely read paper good indicator kind policy recommendation making pursuing read full paper httpsassetsctfassetsneto10es7wu5gm13dpt8yoiytdvfquoeuajds33b4c368f7bc6b4ff7173df36c3d00dadavos_whitepaper_a4pdf got advance copy paper chance talk one author short video interview scott bauguess coinbase institute,0.9371,0.2403409090909091,0.5887204545454545
Reddit,ethereum,2025-01-16 23:49:02,2025-01-18 00:48:31.769086,built first ondemand uncollateralized loan custom interest loan noncustodial directly taken ondemand lender wallet needed loan familyfriends 0 1000 interest,0.7184,0.175,0.4467
Reddit,ethereum,2025-01-16 07:01:24,2025-01-18 00:48:31.769086,daily general discussion january 16 2025welcome ethfinance daily general discussion rethereum httpsimgurcom3y7vezphttpsimgurcom3y7vezp bookmarking link always bring current daily httpsoldredditcomrethereumaboutstickynum2httpsoldredditcomrethereumaboutstickynum2 please use thread discus ethereum topic news event even price price discussion posted elsewhere subreddit continue removed always constructive subreddit ruleshttpswwwredditcomrethereumaboutrules want stake learn rethstaker ethfinance ethereum community link ethereum jobshttpsethereumorgencommunitygetinvolvedethereumjobs twitterhttpsxcomethereum evmavericks youtubehttpswwwyoutubecomevmavericks discordhttpsdiscordggevmavericks doots podcasthttpsevmaverickslibsyncom doots websitehttpsdailydootscom old reddit doots extensionhttpsgithubcometheralphaethfinanceextension uhanniabu calendar jan 20 ethereum protocol attackathonhttpsblogethereumorg20241125ethereumprotocolattackathon end jan 3031 ethereumzurichhttpsethereumzurich conference feb 79 eth oxfordhttpsethoxfordio hackathon feb 1016 ethiopiahttpsethiopiaxyz conference hackathon feb 23 mar 2 ethdenverhttpswwwethdenvercom mar 2830 eth pondyhttpswwwethpondyxyz puducherry hackathon apr 13 ey global blockchain summit person virtual,0.3818,0.025000000000000005,0.2034
Reddit,ethereum,2025-01-16 19:13:08,2025-01-18 00:48:31.769086,response united state senator emaili filled one automated coinbase stand crypto email sent senator jeanne shaheen new hampshire response herher office dear xxx thank contacting office regarding cryptocurrency appreciate hearing thought important issue know cryptocurrency decentralized digital currency limited circumstance used purchase good service also used variety purpose including speculation unlike dollar backed full faith credit united state government cryptocurrencies use distributed online ledger secure account transaction mean user cryptocurrencies limited recourse traditional legal financial system example item purchased cryptocurrency never arrives value particular cryptocurrency decline significantly due rapid development new technology proliferation new type cryptocurrencies token federal regulator yet taken meaningful step ensure increased adoption cryptocurrencies result criminal fraudulent use threaten stability financial system believe important allow healthy innovation new technology also important protect consumer cryptocurrency fraud scam prevent criminal activity like ransomware demand money laundering legislation would make change regulation cryptocurrency would referred either senate committee banking housing urban affair senate committee finance member either committee carefully monitoring development nascent technology relevant legislation come full senate consideration rest assured keep thought mind thank sharing thought please hesitate contact office future sincerely jeanne shaheen united state senator,0.9841,0.15263755062142156,0.5683687753107107
Reddit,ethereum,2025-01-16 22:55:22,2025-01-18 00:48:31.769086,yellow paper security auditingid like get web3 possibly security auditing dont expect go client development seems branch often refered discussing yellow paper im knowledge exactly make great security auditor could imagine greater understand greater ability findrecognize flaw would waste time focus digesting math yellow paper diving solidity,0.9485,0.20555555555555555,0.5770277777777778
Reddit,ethereum,2025-01-16 15:07:07,2025-01-18 00:48:31.769086,research space efficient zksnark,0.4215,0.0,0.21075
Reddit,ethereum,2025-01-16 00:43:55,2025-01-18 00:48:31.769086,vitalik buterin say sonys controversial l2 show ethereum great business,0.5106,0.675,0.5928
Reddit,ethereum,2025-01-16 06:42:01,2025-01-18 00:48:31.769086,dubai building crypto towerhttpswwwthenationalnewscombusinessproperty20250115dmccsblockchainbackedcryptotowertoboostdubaistechambitions,0.0,0.0,0.0
Reddit,ethereum,2025-01-15 22:21:39,2025-01-18 00:48:31.769086,proof work v proof stake bitcoin ethereum 2im confused bitcoin us pow instead po idea changed consensus cristal clear advantage pow think po sound like money secures 23 people money trust worthy anymore money would suffer much nevertheless would basically defeat sound nonsensical spend compute outperform another person without real gain compute real security bennefit pow compute exists real world po better bitcoin easily transferred po consensus,-0.6884,0.2333333333333333,-0.22753333333333337
Reddit,ethereum,2025-01-15 07:01:49,2025-01-18 00:48:31.769086,daily general discussion january 15 2025welcome ethfinance daily general discussion rethereum httpsimgurcom3y7vezphttpsimgurcom3y7vezp bookmarking link always bring current daily httpsoldredditcomrethereumaboutstickynum2httpsoldredditcomrethereumaboutstickynum2 please use thread discus ethereum topic news event even price price discussion posted elsewhere subreddit continue removed always constructive subreddit ruleshttpswwwredditcomrethereumaboutrules want stake learn rethstaker ethfinance ethereum community link ethereum jobshttpsethereumorgencommunitygetinvolvedethereumjobs twitterhttpsxcomethereum evmavericks youtubehttpswwwyoutubecomevmavericks discordhttpsdiscordggevmavericks doots podcasthttpsevmaverickslibsyncom doots websitehttpsdailydootscom old reddit doots extensionhttpsgithubcometheralphaethfinanceextension uhanniabu calendar jan 20 ethereum protocol attackathonhttpsblogethereumorg20241125ethereumprotocolattackathon end jan 3031 ethereumzurichhttpsethereumzurich conference feb 79 eth oxfordhttpsethoxfordio hackathon feb 1016 ethiopiahttpsethiopiaxyz conference hackathon feb 23 mar 2 ethdenverhttpswwwethdenvercom mar 2830 eth pondyhttpswwwethpondyxyz puducherry hackathon apr 13 ey global blockchain summit person virtual,0.3818,0.025000000000000005,0.2034
Reddit,ethereum,2025-01-15 16:00:34,2025-01-18 00:48:31.769086,sunsetting web3js,0.0,0.0,0.0
Reddit,ethereum,2025-01-16 05:47:47,2025-01-18 00:48:31.769086,converting ltc stablecoin cake usdt etcso want cash ltc stablecoin one eth address 4 option eth wallet including eth usdt create exchange swap ltc one cake wallet stable eth coin also cake eth cake wallet dont want switch eth thats address see also various network usdc saw add new address switch directly ltc usdc cake long send network ive chosen receive tried exchanging ltc usdtsol sol wallet usdt enabled using sol recieve address transfer like couple dollar someone dmd dapps link refused post reply guessing scam,-0.0057,0.046590909090909086,0.020445454545454544
Reddit,ethereum,2025-01-15 15:20:04,2025-01-18 00:48:31.769086,suspect transaction ethereum wallet noticed outgoing transaction 0 eth 0 called contract transaction wallet identifies possible fraudulent transaction address poisoning enough add new ethereum account wallet transfer fund safe,-0.6249,0.1590909090909091,-0.23290454545454548
Reddit,ethereum,2025-01-15 15:20:17,2025-01-18 00:48:31.769086,bip39 mnemonic go cli learning experimentationhttpsgithubcomvolodymyrprokopyukgowallethttpsgithubcomvolodymyrprokopyukgowallet modular design wallet cli command underlying go library allows easy composition cryptographic primitive standarddefined hd wallet operation combined flexible way invaluable learning experimentation implementation hd wallet cryptographic operation comprehensive documentation associated test case want learn understand mechanic internal working hd wallet,0.7269,0.21666666666666667,0.47178333333333333
Reddit,ethereum,2025-01-14 21:02:22,2025-01-18 00:48:31.769086,sonys l2 showed u something wild op stack censorship resistance,0.0,0.1,0.05
Reddit,ethereum,2025-01-15 06:36:24,2025-01-18 00:48:31.769086,hsiaowei wang join ethereum foundation leadership team,0.296,0.0,0.148
Reddit,ethereum,2025-01-15 22:38:22,2025-01-18 00:48:31.769086,swapping base eth solhi feeling hopeless today yesterday swapped eth base superbridge buy base coin dex want swap back eth return coinbase account tried dozen different bridge tried swapping directly coinbase wallet avail cant get bridge complete transaction 2500 worth added 150 eth coinbase wallet pay fee getting msg total cost gas gas fee value executing transaction exceeds balance account tried time 10 test transaction however morning transaction status dropped like several ive given swapping eth trying swap base sol using jumper exchange yet 4 hr later transaction still process wrong im trying recover fund losing confidence hope understand eth network busy cant swap base sol presumably cant simply return eth base coinbase account suggestion im truly adrift thanks,0.8591,-0.25,0.30455
Reddit,ethereum,2025-01-15 04:46:03,2025-01-18 00:48:31.769086,unable swap base ethcan someone pls provide simple instruction swap base eth swapped eth base superbridge buy coin dex want swap back eth ive used dozen different bridge tonight tried swapping base eth coinbase wallet avail even bought 50 worth eth transferred coinbase wallet yet still cant get bridge complete transaction read using l2 rollup swap base eth offchain idea someone provide clear mechanical instruction thx,0.765,-0.3333333333333334,0.2158333333333333
Reddit,ethereum,2025-01-14 08:34:14,2025-01-18 00:48:31.769086,sony reveals soneium mainnet layer 2 blockchain,0.0,0.0,0.0
Reddit,ethereum,2025-01-14 07:01:24,2025-01-18 00:48:31.769086,daily general discussion january 14 2025welcome ethfinance daily general discussion rethereum httpsimgurcom3y7vezphttpsimgurcom3y7vezp bookmarking link always bring current daily httpsoldredditcomrethereumaboutstickynum2httpsoldredditcomrethereumaboutstickynum2 please use thread discus ethereum topic news event even price price discussion posted elsewhere subreddit continue removed always constructive subreddit ruleshttpswwwredditcomrethereumaboutrules want stake learn rethstaker ethfinance ethereum community link ethereum jobshttpsethereumorgencommunitygetinvolvedethereumjobs twitterhttpsxcomethereum evmavericks youtubehttpswwwyoutubecomevmavericks discordhttpsdiscordggevmavericks doots podcasthttpsevmaverickslibsyncom doots websitehttpsdailydootscom old reddit doots extensionhttpsgithubcometheralphaethfinanceextension uhanniabu calendar jan 20 ethereum protocol attackathonhttpsblogethereumorg20241125ethereumprotocolattackathon end jan 3031 ethereumzurichhttpsethereumzurich conference feb 79 eth oxfordhttpsethoxfordio hackathon feb 1016 ethiopiahttpsethiopiaxyz conference hackathon feb 23 mar 2 ethdenverhttpswwwethdenvercom mar 2830 eth pondyhttpswwwethpondyxyz puducherry hackathon apr 13 ey global blockchain summit person virtual,0.3818,0.025000000000000005,0.2034
