MainSource,Source,Publication Date,Pull_date,Pre-Processed Text,Sentiment_Vader,Sentiment_TextBlob,Average_Sentiment
GoogleNews,ethereum,2 hours ago,2025-01-07 00:53:29.122107,whale offloading defi token ethereum eth recovers higher price levelsdefi whale took profit month accumulating blue chip token defi awaits attention ethereum eth recovers close 3700 supply,0.4939,0.125,0.30945
GoogleNews,ethereum,3 hours ago,2025-01-07 00:53:29.122107,solana 24hour dex volume beat ethereum base combinedthe layer1 network clocked nearly 38 billion trading volume past 24 hour according defillama source link disclaimer,0.0,-0.3166666666666667,-0.15833333333333335
GoogleNews,ethereum,3 hours ago,2025-01-07 00:53:29.122107,bitcoin ethereum dogecoin jumped todaybitcoin btc 300 climbing monday microstrategy continued massive buying spree time company announced another 1070,0.0,0.0,0.0
GoogleNews,ethereum,3 hours ago,2025-01-07 00:53:29.122107,ethereum whale buy potential 1000x token 1 here whymajor ethereum investor investing new lowpriced token huge growth potential market heat shift capturing widespread,0.5994,0.1340909090909091,0.3667454545454546
GoogleNews,ethereum,3 hours ago,2025-01-07 00:53:29.122107,10x eth surge april 2025 ethereum etf inflow according analyst ethereum price prediction ethereum news todayaccording various source ethereum plutochain worth keeping radar move 2025,0.2263,0.15,0.18814999999999998
GoogleNews,ethereum,4 hours ago,2025-01-07 00:53:29.122107,3 viral cryptos join week top gain qubetics bitcoin ethereum ready surgethe crypto world exhilarating rollercoaster groundbreaking opportunity innovative project certain coin surged ahead capturing,0.9545,0.4228571428571429,0.6886785714285715
GoogleNews,ethereum,4 hours ago,2025-01-07 00:53:29.122107,cryptocurrencies ethereum developer targeted attackerscriminals distributed fake npm package ethereum development platform hardhat tapped critical data,-0.6597,-0.25,-0.45485
GoogleNews,ethereum,4 hours ago,2025-01-07 00:53:29.122107,solanas secret surge unveiling mysterious force behind dex domination ethereumthe solana network surged ahead ethereum base term 24hour decentralized exchange dex trading volume registering nearly 38 billion,-0.0516,-0.3,-0.17579999999999998
GoogleNews,ethereum,4 hours ago,2025-01-07 00:53:29.122107,bitcoin hit new ath ethereum aim 10000 2025 mean ai coinsthe crypto market buzz bitcoin achieves new alltime high ath reigniting optimism across industry ethereum meanwhile set sight,0.5423,0.030056818181818178,0.2861784090909091
GoogleNews,ethereum,4 hours ago,2025-01-07 00:53:29.122107,blockdags tech drive growth xrp prediction ethereums next highlearn blockdags superior technology set boost bdag coin value explore xrp prediction ethereums upcoming alltime high crucial,0.8807,0.215,0.5478500000000001
GoogleNews,ethereum,4 hours ago,2025-01-07 00:53:29.122107,ethereum shiba inu coin lightchain ai altcoin reach 1000 first 2025as crypto market evolves ethereum eth shiba inu coin shib remain strong contender significant growth 2025 however lightchain ai,0.8074,0.3527777777777778,0.5800888888888889
GoogleNews,ethereum,5 hours ago,2025-01-07 00:53:29.122107,best cryptos invest january 2025 qubetics path 15 32816 roi early adopter cosmos bullish momentum polygon scale ethereumthe cryptocurrency market continues expand 2025 presenting promising opportunity investor among compelling option best,0.9524,0.52,0.7362
GoogleNews,ethereum,5 hours ago,2025-01-07 00:53:29.122107,bitcoin ethereum xrp dogecoin see another monday open pump trader predicts next move unemployment data fridaycryptocurrency market trading higher monday microstrategy metaplanet announced acquired btc,-0.4404,0.08333333333333333,-0.17853333333333335
GoogleNews,ethereum,5 hours ago,2025-01-07 00:53:29.122107,ethereum eth surge 10450 price target backed dataethereum eth emerging beacon decentralization outshining bitcoin btc according eth advocate anthony sassano credit eths,0.4019,0.0,0.20095
GoogleNews,ethereum,5 hours ago,2025-01-07 00:53:29.122107,whale move 40000 eth bitfinex ethereum price riskethereum trader high alert following massive whale transaction involving 40000 eth valued approximately 14608 million,0.6249,-0.060000000000000005,0.28245
GoogleNews,ethereum,5 hours ago,2025-01-07 00:53:29.122107,divergence ethereum price dominance trump inauguration approach meansthis rsi divergence could predicting reversal trend aligning ethereum eth price trajectory,0.2023,0.0,0.10115
GoogleNews,ethereum,5 hours ago,2025-01-07 00:53:29.122107,top crypto casino 2025 best bitcoin ethereum nokyc casinosin digital gambling realm 2025 cryptocurrency casino thrill converge spectacularly envision sleek interface bitcoin symbol dance,0.8176,0.525,0.6713
GoogleNews,ethereum,5 hours ago,2025-01-07 00:53:29.122107,ethereum eye 5000dlume could star next crypto bull runaureal one blockchainbased project merges gaming world defi innovative platform us zeroknowledge rollups,0.4404,0.25,0.3452
GoogleNews,ethereum,5 hours ago,2025-01-07 00:53:29.122107,ethereum price analysis prediction january 6 eth eye 4k amid latest surge face resistancefollowing last month crash caused setback market eth recovered nicely currently trade well 3500,0.3182,0.16666666666666666,0.24243333333333333
GoogleNews,ethereum,5 hours ago,2025-01-07 00:53:29.122107,solana 24hour dex volume beat ethereum base combinedpropelled memecoin activity solana dex trading volume surpassed ethereum base combined past 24 hour,0.0,-0.6166666666666667,-0.30833333333333335
GoogleNews,ethereum,6 hours ago,2025-01-07 00:53:29.122107,ethereum price surge coincides growing interest nollars network presalethe price ethereum eth risen 400 since december 31 reflecting 11 increase week surge accompanied notable,0.7184,0.5,0.6092
GoogleNews,ethereum,6 hours ago,2025-01-07 00:53:29.122107,top cryptocurrencies watch 2025 ethereum eth ripple xrp monsta mash mashethereum xrp mosta mash mash positioned topperforming altcoins eth xrp gaining rebound momentum,0.5574,0.5,0.5287
GoogleNews,ethereum,6 hours ago,2025-01-07 00:53:29.122107,ethereums surge 62 growth set stage 6000 2025ethereum currently experiencing solid rally trading 365399 marking 7 increase past week 6287 rise yearly chart,0.6705,-0.08333333333333333,0.2935833333333333
GoogleNews,ethereum,6 hours ago,2025-01-07 00:53:29.122107,ethereum founder advocate ai emergency button general securityvitalik buterin argues way harness computing resource worldwide potential danger ai superintelligence,-0.8225,0.02500000000000001,-0.39875
GoogleNews,ethereum,6 hours ago,2025-01-07 00:53:29.122107,pudgy penguin solana token ethereum nfts rising ahead abstract network launchpudgy penguin asset rising value ahead launch abstract ethereum layer2 network project parent company,0.5994,0.0,0.2997
GoogleNews,ethereum,6 hours ago,2025-01-07 00:53:29.122107,ethereum 5k could solana surge 10x new meme coin shake market q1 price forecast exploreuncover potential digital currency indepth analysis possibility ethereum reaching 5k solanas potential surge,0.0258,0.03409090909090909,0.029945454545454546
GoogleNews,ethereum,7 hours ago,2025-01-07 00:53:29.122107,ethereum price forecast eth resume quest tackle 4093 resistance investor begin accumulationethereum eth briefly traded 3700 monday following slight increase accumulation among investor last week,0.2516,-0.041666666666666664,0.10496666666666667
GoogleNews,ethereum,7 hours ago,2025-01-07 00:53:29.122107,hyperliquid integrates router nitro crosschain deposit supporting ethereum solana suihyperliquid support direct crosschain deposit 30 evm nonevm chain including ethereum solana sui integration router,0.6808,0.175,0.42789999999999995
GoogleNews,ethereum,7 hours ago,2025-01-07 00:53:29.122107,best crypto gem 2025 spotlight web3bay ethereum solanafind make web3bay gamechanger ecommerce ethereum poised breakout solana leading scalability,0.7351,0.65,0.69255
GoogleNews,ethereum,7 hours ago,2025-01-07 00:53:29.122107,ethereums pectra upgrade make staking easier web3bays presale offer something 2025discover ethereums pectra upgrade improves staking faster activation flexibility web3bays 420k presale offer competitive edge,0.8271,0.0,0.41355
GoogleNews,ethereum,7 hours ago,2025-01-07 00:53:29.122107,eth worthan update john pfeffers institutional investor take cryptoassets,0.0,0.0,0.0
GoogleNews,ethereum,7 hours ago,2025-01-07 00:53:29.122107,004 45000 gain goldman sachs expert back wallitiq wltq next big ethereum altcoinfrom 004 45000 gain goldman sachs expert endorses wallitiq wltq next big ethereum altcoin redefining crypto investing,0.8481,0.0,0.42405
GoogleNews,ethereum,7 hours ago,2025-01-07 00:53:29.122107,ethereums cofounder sell 28 meme coin worth 1 millionvitalik buterin ethereums cofounder sold 1 million worth meme coin,0.4215,0.3,0.36075
GoogleNews,ethereum,7 hours ago,2025-01-07 00:53:29.122107,ben lilly explains ethena cryptos role suppressing ethereum pricesignificant inflow influence eths price trend suppress speculative growth economist link ethena cryptos activity ethereums market dynamic,0.6808,0.0,0.3404
GoogleNews,ethereum,7 hours ago,2025-01-07 00:53:29.122107,ethereum climb 12 week could outperform 2025ethereum crypto eth look positioned strong performance 2025 fundamental technical analysis suggesting potential outperformance,0.5106,0.14444444444444446,0.32752222222222227
GoogleNews,ethereum,7 hours ago,2025-01-07 00:53:29.122107,crypto update xrp outshines bitcoin ethereum 57m investment surgexrp made significant wave cryptocurrency market recently surpassing bitcoin ethereum term weekly investment flow digital,0.2023,0.125,0.16365000000000002
GoogleNews,ethereum,7 hours ago,2025-01-07 00:53:29.122107,vitalik buterins 1m selling spree sends 28 memecoins flyingvitalik buterin liquidating gifted memecoins token rallied sharply ethereum cofounder sold,0.0,0.1875,0.09375
GoogleNews,ethereum,8 hours ago,2025-01-07 00:53:29.122107,ethereum could reach ath trons 2025 forecast lightchain ai promising potentialethereum target new ath tron receives bullish 2025 prediction lightchain ai gain attention early growth potential,0.8316,0.1090909090909091,0.47034545454545457
GoogleNews,ethereum,8 hours ago,2025-01-07 00:53:29.122107,blockdags bdag400 bonus countdown begin ethereum price rise tron trx eye athethereums future look promising ethereum price prediction suggesting potential high 5925 2025 driven upgrade institutional,0.7351,0.09,0.41255
GoogleNews,ethereum,8 hours ago,2025-01-07 00:53:29.122107,using ethereum plan dream vacation savvy traveler guidelearn use ethereum price prediction budget smarter travel discover tip maximizing fund,0.6124,0.0,0.3062
GoogleNews,ethereum,8 hours ago,2025-01-07 00:53:29.122107,xrp surge ahead bitcoin ethereum weekly flowsxrp outpaced bitcoin ethereum weekly inflow attracting 57m boosting positive sentiment raising expectation potential price growth,0.8934,0.11363636363636363,0.5035181818181818
GoogleNews,ethereum,9 hours ago,2025-01-07 00:53:29.122107,ethereum eth price today stablecoin inflow push price 11ethereums price action capturing attention investor year 2025 begin ethereum witnessed remarkable surge stablecoin inflow,0.5574,0.425,0.49119999999999997
GoogleNews,ethereum,9 hours ago,2025-01-07 00:53:29.122107,ethereum stablecoins volume increase 111b 2025 set another rallyaccording data x onchain data analytics website lookonchain total stablecoins inflow ethereum solana past seven day,0.3182,-0.125,0.09659999999999999
GoogleNews,ethereum,9 hours ago,2025-01-07 00:53:29.122107,big 4 january ethereum solana xrp dogen positioned rally modejanuary brings fresh energy crypto world four major digital coin hinting strong upward movement ethereum solana xrp dogecoin,0.7717,0.15916666666666668,0.46543333333333337
GoogleNews,ethereum,9 hours ago,2025-01-07 00:53:29.122107,end day ethereum price ethusd forecast update 06012025ethereum price ethusd achieved initial breach 368000 level reinforce expectation continuing bullish trend upcoming period,0.0,0.0,0.0
GoogleNews,ethereum,9 hours ago,2025-01-07 00:53:29.122107,ethereum rise cross 3750 hurdlethe price ethereum eth resumed uptrend rising moving average line,0.0,-0.075,-0.0375
GoogleNews,blockchain,1 hour ago,2025-01-07 00:53:29.122107,atua ai tua leverage ripple xrp nextlevel blockchain ai innovationripple xrp integration enhances atua ai blockchainbased platform delivering faster secure costeffective solution decentralized,0.5719,0.4,0.48595
GoogleNews,blockchain,2 hours ago,2025-01-07 00:53:29.122107,minswap launch decentralized exchange cardano blockchainisstories editorial eldridge iowa jan 6 2025 issuewirecom minswap new decentralized exchange dex officially launched today,0.128,0.13636363636363635,0.13218181818181818
GoogleNews,blockchain,3 hours ago,2025-01-07 00:53:29.122107,metas vision blockchain excellence story suiblockchain news opinion tv job news blockchain world buzzing innovation one project stand sui blockchain,0.8271,0.0,0.41355
GoogleNews,blockchain,3 hours ago,2025-01-07 00:53:29.122107,blockchain payment firm web3 enabler seek 124 million republicpayments massive sector fintech utilizing blockchain technology improve speed cost making transfer web3 enabler startup,0.4404,-0.1,0.17020000000000002
GoogleNews,blockchain,3 hours ago,2025-01-07 00:53:29.122107,solana enhances blockchain security new quantumresistant featuresolana one fastestgrowing blockchain network introduced innovative security feature designed safeguard digital asset power,0.8957,0.21212121212121213,0.553910606060606
GoogleNews,blockchain,4 hours ago,2025-01-07 00:53:29.122107,explore qubetics transforming internet privacy fantom advancing blockchain scalability cronos bridging defi top cryptos hold monthhow qubetics revolutionizing internet privacy fantom advancing blockchain cronos bridging defi metaverse,0.2023,0.5,0.35115
GoogleNews,blockchain,6 hours ago,2025-01-07 00:53:29.122107,coordinate crypto gi enhances blockchainbased gambling platformsas technology advance convergence geographic information system gi blockchain opening new possibility across various industry,0.0,0.06818181818181818,0.03409090909090909
GoogleNews,blockchain,7 hours ago,2025-01-07 00:53:29.122107,blockchain trilemmaexplore blockchain trilemma understanding balance decentralization security scalability blockchain technology impact,0.34,0.0,0.17
GoogleNews,blockchain,7 hours ago,2025-01-07 00:53:29.122107,simplifying blockchain hindsight viphindsight vip make blockchain easy understand visual block explorer us shape color line illustrate blockchain activity,0.5106,0.21666666666666667,0.36363333333333336
GoogleNews,blockchain,8 hours ago,2025-01-07 00:53:29.122107,solana introduces quantumresistant vault enhanced blockchain securitysolana introduces quantumresistant winternitz vault protecting fund quantum computing threat advanced blockchain security,0.0,0.4,0.2
GoogleNews,blockchain,1 hour ago,2025-01-07 00:53:29.122107,atua ai tua leverage ripple xrp nextlevel blockchain ai innovationripple xrp integration enhances atua ai blockchainbased platform delivering faster secure costeffective solution decentralized,0.5719,0.4,0.48595
GoogleNews,blockchain,2 hours ago,2025-01-07 00:53:29.122107,minswap launch decentralized exchange cardano blockchainisstories editorial eldridge iowa jan 6 2025 issuewirecom minswap new decentralized exchange dex officially launched today,0.128,0.13636363636363635,0.13218181818181818
GoogleNews,blockchain,3 hours ago,2025-01-07 00:53:29.122107,metas vision blockchain excellence story suiblockchain news opinion tv job news blockchain world buzzing innovation one project stand sui blockchain,0.8271,0.0,0.41355
GoogleNews,blockchain,3 hours ago,2025-01-07 00:53:29.122107,blockchain payment firm web3 enabler seek 124 million republicpayments massive sector fintech utilizing blockchain technology improve speed cost making transfer web3 enabler startup,0.4404,-0.1,0.17020000000000002
GoogleNews,blockchain,3 hours ago,2025-01-07 00:53:29.122107,solana enhances blockchain security new quantumresistant featuresolana one fastestgrowing blockchain network introduced innovative security feature designed safeguard digital asset power,0.8957,0.21212121212121213,0.553910606060606
GoogleNews,blockchain,4 hours ago,2025-01-07 00:53:29.122107,explore qubetics transforming internet privacy fantom advancing blockchain scalability cronos bridging defi top cryptos hold monthhow qubetics revolutionizing internet privacy fantom advancing blockchain cronos bridging defi metaverse,0.2023,0.5,0.35115
GoogleNews,blockchain,6 hours ago,2025-01-07 00:53:29.122107,coordinate crypto gi enhances blockchainbased gambling platformsas technology advance convergence geographic information system gi blockchain opening new possibility across various industry,0.0,0.06818181818181818,0.03409090909090909
GoogleNews,blockchain,7 hours ago,2025-01-07 00:53:29.122107,blockchain trilemmaexplore blockchain trilemma understanding balance decentralization security scalability blockchain technology impact,0.34,0.0,0.17
GoogleNews,blockchain,7 hours ago,2025-01-07 00:53:29.122107,simplifying blockchain hindsight viphindsight vip make blockchain easy understand visual block explorer us shape color line illustrate blockchain activity,0.5106,0.21666666666666667,0.36363333333333336
GoogleNews,blockchain,8 hours ago,2025-01-07 00:53:29.122107,solana introduces quantumresistant vault enhanced blockchain securitysolana introduces quantumresistant winternitz vault protecting fund quantum computing threat advanced blockchain security,0.0,0.4,0.2
GoogleNews,blockchain,1 hour ago,2025-01-07 00:53:29.122107,atua ai tua leverage ripple xrp nextlevel blockchain ai innovationripple xrp integration enhances atua ai blockchainbased platform delivering faster secure costeffective solution decentralized,0.5719,0.4,0.48595
GoogleNews,blockchain,2 hours ago,2025-01-07 00:53:29.122107,minswap launch decentralized exchange cardano blockchainisstories editorial eldridge iowa jan 6 2025 issuewirecom minswap new decentralized exchange dex officially launched today,0.128,0.13636363636363635,0.13218181818181818
GoogleNews,blockchain,3 hours ago,2025-01-07 00:53:29.122107,metas vision blockchain excellence story suiblockchain news opinion tv job news blockchain world buzzing innovation one project stand sui blockchain,0.8271,0.0,0.41355
GoogleNews,blockchain,3 hours ago,2025-01-07 00:53:29.122107,blockchain payment firm web3 enabler seek 124 million republicpayments massive sector fintech utilizing blockchain technology improve speed cost making transfer web3 enabler startup,0.4404,-0.1,0.17020000000000002
GoogleNews,blockchain,3 hours ago,2025-01-07 00:53:29.122107,solana enhances blockchain security new quantumresistant featuresolana one fastestgrowing blockchain network introduced innovative security feature designed safeguard digital asset power,0.8957,0.21212121212121213,0.553910606060606
GoogleNews,blockchain,4 hours ago,2025-01-07 00:53:29.122107,explore qubetics transforming internet privacy fantom advancing blockchain scalability cronos bridging defi top cryptos hold monthhow qubetics revolutionizing internet privacy fantom advancing blockchain cronos bridging defi metaverse,0.2023,0.5,0.35115
GoogleNews,blockchain,6 hours ago,2025-01-07 00:53:29.122107,coordinate crypto gi enhances blockchainbased gambling platformsas technology advance convergence geographic information system gi blockchain opening new possibility across various industry,0.0,0.06818181818181818,0.03409090909090909
GoogleNews,blockchain,7 hours ago,2025-01-07 00:53:29.122107,blockchain trilemmaexplore blockchain trilemma understanding balance decentralization security scalability blockchain technology impact,0.34,0.0,0.17
GoogleNews,blockchain,7 hours ago,2025-01-07 00:53:29.122107,simplifying blockchain hindsight viphindsight vip make blockchain easy understand visual block explorer us shape color line illustrate blockchain activity,0.5106,0.21666666666666667,0.36363333333333336
GoogleNews,blockchain,8 hours ago,2025-01-07 00:53:29.122107,solana introduces quantumresistant vault enhanced blockchain securitysolana introduces quantumresistant winternitz vault protecting fund quantum computing threat advanced blockchain security,0.0,0.4,0.2
GoogleNews,blockchain,1 hour ago,2025-01-07 00:53:29.122107,atua ai tua leverage ripple xrp nextlevel blockchain ai innovationripple xrp integration enhances atua ai blockchainbased platform delivering faster secure costeffective solution decentralized,0.5719,0.4,0.48595
GoogleNews,blockchain,2 hours ago,2025-01-07 00:53:29.122107,minswap launch decentralized exchange cardano blockchainisstories editorial eldridge iowa jan 6 2025 issuewirecom minswap new decentralized exchange dex officially launched today,0.128,0.13636363636363635,0.13218181818181818
GoogleNews,blockchain,3 hours ago,2025-01-07 00:53:29.122107,metas vision blockchain excellence story suiblockchain news opinion tv job news blockchain world buzzing innovation one project stand sui blockchain,0.8271,0.0,0.41355
GoogleNews,blockchain,3 hours ago,2025-01-07 00:53:29.122107,blockchain payment firm web3 enabler seek 124 million republicpayments massive sector fintech utilizing blockchain technology improve speed cost making transfer web3 enabler startup,0.4404,-0.1,0.17020000000000002
GoogleNews,blockchain,3 hours ago,2025-01-07 00:53:29.122107,solana enhances blockchain security new quantumresistant featuresolana one fastestgrowing blockchain network introduced innovative security feature designed safeguard digital asset power,0.8957,0.21212121212121213,0.553910606060606
GoogleNews,blockchain,4 hours ago,2025-01-07 00:53:29.122107,explore qubetics transforming internet privacy fantom advancing blockchain scalability cronos bridging defi top cryptos hold monthhow qubetics revolutionizing internet privacy fantom advancing blockchain cronos bridging defi metaverse,0.2023,0.5,0.35115
GoogleNews,blockchain,6 hours ago,2025-01-07 00:53:29.122107,coordinate crypto gi enhances blockchainbased gambling platformsas technology advance convergence geographic information system gi blockchain opening new possibility across various industry,0.0,0.06818181818181818,0.03409090909090909
GoogleNews,blockchain,7 hours ago,2025-01-07 00:53:29.122107,blockchain trilemmaexplore blockchain trilemma understanding balance decentralization security scalability blockchain technology impact,0.34,0.0,0.17
GoogleNews,blockchain,7 hours ago,2025-01-07 00:53:29.122107,simplifying blockchain hindsight viphindsight vip make blockchain easy understand visual block explorer us shape color line illustrate blockchain activity,0.5106,0.21666666666666667,0.36363333333333336
GoogleNews,blockchain,8 hours ago,2025-01-07 00:53:29.122107,solana introduces quantumresistant vault enhanced blockchain securitysolana introduces quantumresistant winternitz vault protecting fund quantum computing threat advanced blockchain security,0.0,0.4,0.2
GoogleNews,blockchain,8 hours ago,2025-01-07 00:53:29.122107,okaycoin introduces enhanced crypto staking platform accessible blockchain participation,0.0,0.375,0.1875
GoogleNews,blockchain,9 hours ago,2025-01-07 00:53:29.122107,6 best crypto coin hold today skyrocketing gain 2025including hidden gem set revolutionise blockchainthe crypto market 2025 already heating project delivering realworld solution strong investor interest technological innovation,0.9571,0.4222222222222222,0.6896611111111111
GoogleNews,blockchain,9 hours ago,2025-01-07 00:53:29.122107,blockchain revolutionize renewable energy 5 use caseslearn blockchain technology transforming renewable energy sector enhancing efficiency transparency sustainability energy production,0.7783,0.0,0.38915
GoogleNews,blockchain,9 hours ago,2025-01-07 00:53:29.122107,qaag ai redefines quality assurance revolutionary blockchainai fusiondelaware city delawarenewsfile corp january 6 2025 global quality assurance qa market currently valued approximately,0.7717,-0.13333333333333333,0.3191833333333334
GoogleNews,blockchain,9 hours ago,2025-01-07 00:53:29.122107,need know james hunsaker cofounder monad blockchaindiscover james hunsakers journey finance blockchain monad focusing performance usability,0.0,0.0,0.0
GoogleNews,blockchain,9 hours ago,2025-01-07 00:53:29.122107,building digital public infrastructure blockchain new era public servicesstay updated latest cryptocurrency news insight trend indepth guide explore bitcoin dogecoin ethereum altcoins blockchain nfts,0.0,0.12727272727272726,0.06363636363636363
GoogleNews,blockchain,0 hours ago,2025-01-07 00:53:29.122107,qubetics tokenised marketplace cardanos sustainable blockchain ripple crossborder revolution cryptos cant miss 2025dive qubetics cardano ripple discover best cryptos join longterm gain innovative tech realworld solution 2024,0.9376,0.75,0.8438
GoogleNews,blockchain,1 hours ago,2025-01-07 00:53:29.122107,best coin invest right qubetics hit 87m milestone polygon enhances scalability monero defends privacy blockchaindiscover qubetics tic polygon matic monero xmr best coin invest right featuring advanced dvpn technology growth,0.9186,0.5942857142857142,0.7564428571428571
GoogleNews,blockchain,1 hours ago,2025-01-07 00:53:29.122107,smartosc avalanche pioneer vietnam first blockchain loyalty programsmartosc leading digital enabler partnered avalanche advance blockchain adoption enterprise sector beginning one vietnam,0.5423,0.125,0.33365
GoogleNews,blockchain,1 hours ago,2025-01-07 00:53:29.122107,botto merging ai blockchain art revolutionary projectgerman artist mario klingemann developed latest project botto explore whether machine could genuinely embody role artist,0.0,0.3333333333333333,0.16666666666666666
