MainSource,Source,Publication Date,Pull_date,Pre-Processed Text,Sentiment_Vader,Sentiment_TextBlob,Average_Sentiment
RSS,https://cointelegraph.com/rss,2024-10-23 01:23:14+01:00,2024-10-23 00:51:38.638577,tesla likely still owns 780m bitcoin despite recent shuffle arkham tesla massive bitcoin transfer initially sparked fear market dump arkhams data suggests asset still firm control,-0.5106,-0.04,-0.27530000000000004
RSS,https://cointelegraph.com/rss,2024-10-22 22:46:56+01:00,2024-10-23 00:51:38.638577,komainu target singapore custodian propine first acquisition acquisition competitor net komainu singapore capital market service license hope major payment institution license future,0.4404,0.078125,0.2592625
RSS,https://cointelegraph.com/rss,2024-10-22 22:31:00+01:00,2024-10-23 00:51:38.638577,aurum equity partner launch tokenized fund worth 1b tokenized fund invest data center united state united arab emirate kingdom saudi arabia india europe,0.7579,0.09999999999999999,0.42895
RSS,https://cointelegraph.com/rss,2024-10-22 21:44:00+01:00,2024-10-23 00:51:38.638577,judge delay sentencing icomtech promoter allow testimony gustavo rodriguez initially scheduled sentenced following conviction conspiracy commit wire fraud testify oath oct 25,-0.7964,0.0,-0.3982
RSS,https://cointelegraph.com/rss,2024-10-22 21:33:31+01:00,2024-10-23 00:51:38.638577,metallicus secures fednow transaction certification partnership originally announced mid2023 ahead launch fednow,0.3182,0.375,0.3466
RSS,https://cointelegraph.com/rss,2024-10-22 21:27:41+01:00,2024-10-23 00:51:38.638577,international agency report tokenization g20 official bank international settlement financial stability board similar view tokenization could provide new benefit familiar challenge,0.5106,0.08522727272727272,0.2979136363636364
RSS,https://cointelegraph.com/rss,2024-10-22 20:51:10+01:00,2024-10-23 00:51:38.638577,here happened crypto today need know happened crypto today latest news daily trend event impacting bitcoin price blockchain defi nfts web3 crypto regulation,0.0,0.25,0.125
RSS,https://cointelegraph.com/rss,2024-10-22 20:30:00+01:00,2024-10-23 00:51:38.638577,bitcoin benefit rising hashrate inflation fear cryptofriendly president bitcoins upcoming price recovery driven handful unique factor,-0.0516,0.375,0.1617
RSS,https://cointelegraph.com/rss,2024-10-22 19:55:39+01:00,2024-10-23 00:51:38.638577,sec chair wish bitcoin sweet sixteen white paper anniversary interview bloomberg gary gensler suggested plan alter sec course regulation enforcement approach crypto,0.6908,0.03749999999999999,0.36415
RSS,https://cointelegraph.com/rss,2024-10-22 19:34:38+01:00,2024-10-23 00:51:38.638577,paul tudor jones say 039all road lead inflation039 long bitcoin hedge fund veteran also suggests holding gold commodity technology stock,0.0,-0.025,-0.0125
RSS,https://cointelegraph.com/rss,2024-10-22 19:30:57+01:00,2024-10-23 00:51:38.638577,buenos aire roll blockchainbased id 36m resident resident argentine capital access decentralized digital id mobile device powered scaling protocol zksync era,0.0,0.0,0.0
RSS,https://cointelegraph.com/rss,2024-10-22 19:30:00+01:00,2024-10-23 00:51:38.638577,bitcoin option trader say 80k given trump victory odds spike bitcoins brief rally 69000 maybe driven speculation trump victory meanwhile btc option trader say 80000 programmed,0.0,0.0,0.0
RSS,https://cointelegraph.com/rss,2024-10-22 18:45:22+01:00,2024-10-23 00:51:38.638577,anthropic beta let claude ai operate users039 computer mouse keyboard company say feature still experimentalat time cumbersome errorprone hope developer feedback accelerate development,0.4404,0.0,0.2202
RSS,https://cointelegraph.com/rss,2024-10-22 18:42:29+01:00,2024-10-23 00:51:38.638577,raydium beat ethereum 24hour fee revenue solanabased raydium clocked 34 million fee revenue oct 21 versus 335 million ethereum according defillama,0.0,0.0,0.0
RSS,https://cointelegraph.com/rss,2024-10-22 18:30:00+01:00,2024-10-23 00:51:38.638577,bitcoin trader expect price pullback 73k remains shortterm target trader expect bitcoin downside price action continue also agree coming week 73000 could occur fairly quickly,0.128,0.21666666666666667,0.17233333333333334
RSS,https://cointelegraph.com/rss,2024-10-22 17:47:04+01:00,2024-10-23 00:51:38.638577,bitfufu boost bitcoin mining first physical facility ethiopia bitfufu longer exclusively cloud miner transition resilient portfolio,0.4019,0.125,0.26344999999999996
RSS,https://cointelegraph.com/rss,2024-10-22 17:30:00+01:00,2024-10-23 00:51:38.638577,price analysis 1022 spx dxy btc eth bnb sol xrp doge ton ada bitcoin finding support 66500 65000 zone bitcoin etf inflow suggest trader buying dip altcoins follow,0.4019,0.0,0.20095
RSS,https://cointelegraph.com/rss,2024-10-22 17:17:40+01:00,2024-10-23 00:51:38.638577,peter todd forced hiding hbo doc claim invented bitcoin documentary filmmaker cullen hoback stand allegation todd satoshi nakamoto despite denial,-0.6369,-0.15000000000000002,-0.39345
RSS,https://cointelegraph.com/rss,2024-10-22 17:00:00+01:00,2024-10-23 00:51:38.638577,lightning network value directly correlated bitcoin price report like dialup internet became broadband bitcoin price went according ceo ambo technology,0.5994,0.1,0.3497
RSS,https://cointelegraph.com/rss,2024-10-22 16:46:40+01:00,2024-10-23 00:51:38.638577,sec list crypto examination priority 2025 regulator division examination specifically named spot bitcoin ether exchangetraded product priority 2024 launch,0.0,-0.1,-0.05
RSS,https://cointelegraph.com/rss,2024-10-22 16:43:29+01:00,2024-10-23 00:51:38.638577,core scientific host coreweave infrastructure target 87b revenue coreweave exercised final option agreement core scientific adding 120 mw critical infrastructure power nvidia gpu operation,0.2263,0.0,0.11315
RSS,https://cointelegraph.com/rss,2024-10-22 16:39:08+01:00,2024-10-23 00:51:38.638577,bitcoin price need new high 69k mid week u dollar surge bitcoin face limited time convince actually strong cooling btc price action stick around,0.5267,0.1263780663780664,0.32653903318903316
RSS,https://cointelegraph.com/rss,2024-10-22 15:30:00+01:00,2024-10-23 00:51:38.638577,michael heinrich love ai coin goat turbo amp aethir tao hall flame 0g lab cofounder michael heinrich predicts ai soon become biggest defi sector reveals tao leaf cold,0.6369,-0.04999999999999999,0.29345
RSS,https://cointelegraph.com/rss,2024-10-22 15:14:14+01:00,2024-10-23 00:51:38.638577,avalanche foundation introduces visa crypto spending card avalanche card credit card linked selfcustody wallet unique address per asset,0.6249,0.375,0.49995
RSS,https://cointelegraph.com/rss,2024-10-22 14:50:32+01:00,2024-10-23 00:51:38.638577,winklevossbacked defi platform launch 69m investment round azura completed 69 million investment round backed winklevoss twin volt capital alliance dao,0.0258,-0.2,-0.08710000000000001
RSS,https://cointelegraph.com/rss,2024-10-22 14:16:38+01:00,2024-10-23 00:51:38.638577,94 bitcoin profit hint 69k btc price local top bitcoin price rejected due profittaking big resistance 69000 breaking would trigger 16b short liquidation,0.1027,0.075,0.08885
RSS,https://cointelegraph.com/rss,2024-10-22 14:15:00+01:00,2024-10-23 00:51:38.638577,blockchain help fight ai fake crypto airdrop election thanks rapid development ai becoming increasingly challenging tell human apart future machine overlord,0.128,0.10833333333333334,0.11816666666666667
RSS,https://cointelegraph.com/rss,2024-10-22 14:01:49+01:00,2024-10-23 00:51:38.638577,liminal challenge wazirx accusation 235m security breach according liminal 75 day hack wazirx still kept 175 million liminal custody despite blaming custodian causing breach,0.5152,0.0,0.2576
RSS,https://cointelegraph.com/rss,2024-10-22 13:11:55+01:00,2024-10-23 00:51:38.638577,xrp price today xrp price declined ripple cofounder 10 million donation kamala harris u presidential campaign,0.0,0.0,0.0
RSS,https://cointelegraph.com/rss,2024-10-22 13:00:21+01:00,2024-10-23 00:51:38.638577,solana price unfazed pumpfun 66m sale 47m sol remaining pumpfuns fee account still hold 47 million worth solana token could add selling pressure,-0.0772,0.3,0.1114
RSS,https://bitcoinmagazine.com/.rss/full/,2024-10-22 20:56:50+00:00,2024-10-23 00:51:38.638577,prediction market pricing trump victory good bitcoinif prediction market correct probitcoin trump shoein white house,0.4404,0.35,0.3952
RSS,https://bitcoinmagazine.com/.rss/full/,2024-10-22 18:52:36+00:00,2024-10-23 00:51:38.638577,spoonful bitcoin mary poppins awakens u financial sovereignty mary poppins mr bank journey rigid conformity joyful liberation mirror transformative power bitcoin discovers true wealth lie freedom invited rethink relationship money embrace financial sovereignty bitcoin offer,0.9423,0.11666666666666665,0.5294833333333333
RSS,https://bitcoinmagazine.com/.rss/full/,2024-10-22 16:00:00+00:00,2024-10-23 00:51:38.638577,metric matter lightning networka look valuable metric measuring effectiveness lightning network routing payment,0.4939,0.0,0.24695
RSS,https://bitcoinmagazine.com/.rss/full/,2024-10-22 15:19:15+00:00,2024-10-23 00:51:38.638577,bitcoin yield dollar yes please trusted u bitcoin exchange river offer bitcoin yield dollar bitcoin interest cash feature great addition platform bitcoin enthusiast normies alike,0.9493,0.8,0.87465
RSS,https://bitcoinmagazine.com/.rss/full/,2024-10-22 14:41:14+00:00,2024-10-23 00:51:38.638577,bitaxe opensource bitcoin mining movementbitaxe founder skot created first ever opensource asicbased bitcoin miner he inspired 4000 others contribute opensource bitcoin mining project,0.6369,0.25,0.44345
RSS,https://bitcoinmagazine.com/.rss/full/,2024-10-22 14:35:40+00:00,2024-10-23 00:51:38.638577,world largest prediction market polymarket trump biased clear polymarket lean protrump aware,0.128,0.175,0.1515
RSS,https://bitcoinmagazine.com/.rss/full/,2024-10-22 11:00:26+00:00,2024-10-23 00:51:38.638577,microstrategy ceo michael saylor reveals bitcoin mstr plansome argue selfcustody nothing else core bitcoin fact trust one hold safeguard wealth,0.7717,0.0,0.38585
RSS,https://bitcoinmagazine.com/.rss/full/,2024-10-21 21:14:47+00:00,2024-10-23 00:51:38.638577,6 step move old 401k bitcoin irathe latest guide unchained offer stepbystep instruction transferring 401k ira ahead next bull run,0.0,0.19999999999999998,0.09999999999999999
RSS,https://bitcoinmagazine.com/.rss/full/,2024-10-21 16:45:52+00:00,2024-10-23 00:51:38.638577,upside world spook hero hero spooksdistorted perception reality completely inverted perception acting best interest bitcoin versus acting interest way put bitcoin risk,0.946,0.275,0.6105
RSS,https://bitcoinmagazine.com/.rss/full/,2024-10-21 16:37:09+00:00,2024-10-23 00:51:38.638577,ecb get wrong bitcoin recent paper researcher european central bank make handful claim bitcoin lack context nuance andor evidence im shed light got wrong,-0.8176,-0.09999999999999999,-0.4588
RSS,https://bitcoinmagazine.com/.rss/full/,2024-10-21 11:00:00+00:00,2024-10-23 00:51:38.638577,kamala presidency could bullish bitcoina trump victory almost certainly ensures one outcome crypto security continue flourish unchecked,0.5434,0.21428571428571427,0.37884285714285715
RSS,https://bitcoinmagazine.com/.rss/full/,2024-10-18 21:06:20+00:00,2024-10-23 00:51:38.638577,bitcoin make new alltime highkey psychological barrier bitcoins fight 70000,-0.4767,0.06818181818181818,-0.20425909090909092
RSS,https://bitcoinmagazine.com/.rss/full/,2024-10-18 18:50:32+00:00,2024-10-23 00:51:38.638577,el salvador survey show bitcoins lindy effect actionslowly surely el salvador way mass bitcoin adoption,0.4404,0.5,0.4702
RSS,https://bitcoinmagazine.com/.rss/full/,2024-10-18 16:25:23+00:00,2024-10-23 00:51:38.638577,bitcoin model perfection doesnt need improvementthe idea bitcoin need improve perfect state decentralized money delusional thinking model perfect state automobile,0.9325,1.0,0.96625
RSS,https://bitcoinmagazine.com/.rss/full/,2024-10-18 11:28:15+00:00,2024-10-23 00:51:38.638577,bitcoin mempool drama predictablethe mempool drama predictable given brewing culture war monetary maximalist purist season 2 pragmatist,-0.5994,-0.2,-0.39970000000000006
RSS,https://bitcoinmagazine.com/.rss/full/,2024-10-17 17:35:36+00:00,2024-10-23 00:51:38.638577,live election day coverage bitcoinersthe firstever election day livestream event tailored specifically bitcoiners going live 3pm est november 5th,0.0,0.13636363636363635,0.06818181818181818
RSS,https://bitcoinmagazine.com/.rss/full/,2024-10-17 16:34:21+00:00,2024-10-23 00:51:38.638577,succeed bitcoin need something new samereplicating type service application legacy world bitcoin necessitates interacting legacy world giving leverage bitcoin,0.6808,0.13636363636363635,0.40858181818181816
RSS,https://bitcoinmagazine.com/.rss/full/,2024-10-16 19:24:11+00:00,2024-10-23 00:51:38.638577,elizabeth warren prof democrat still bitcointhe bitcoin industry could yet another four year harassment attack kamala harris elected president,-0.765,0.0,-0.3825
RSS,https://bitcoinmagazine.com/.rss/full/,2024-10-16 16:48:11+00:00,2024-10-23 00:51:38.638577,shinobi gaza powerful demonstration bitcoin since wikileakswhat happening gaza fact bitcoin way deliver aid gazans point one powerful demonstration bitcoin decade,0.7506,0.3,0.5253
RSS,https://bitcoinmagazine.com/.rss/full/,2024-10-16 13:00:00+00:00,2024-10-23 00:51:38.638577,bitcoins false dichotomy sov moebitcoins use store value mean exchange mutually exclusive,0.4404,-0.35625000000000007,0.042074999999999974
RSS,https://bitcoinmagazine.com/.rss/full/,2024-10-15 20:25:38+00:00,2024-10-23 00:51:38.638577,art surveillance ripcaches radical take bitcoin amsterdama qa privacy ownership unstoppable rise decentralized art world watchful eye,-0.2023,0.0,-0.10115
RSS,https://bitcoinmagazine.com/.rss/full/,2024-10-15 16:00:24+00:00,2024-10-23 00:51:38.638577,corva bitcoin reduce racismharvard professor robert putnams research extrapolated show identifying bitcoiner actually reduce racism,-0.6249,0.0,-0.31245
RSS,https://bitcoinmagazine.com/.rss/full/,2024-10-15 14:07:43+00:00,2024-10-23 00:51:38.638577,president harris buy bitcoin pay black american reparationsa bitcoin stockpile could onceinacentury chance pay back reparation without taxation seriously,0.1823,-0.125,0.028649999999999995
RSS,https://bitcoinmagazine.com/.rss/full/,2024-10-15 12:42:40+00:00,2024-10-23 00:51:38.638577,blackrock ceo right trump kamala cant stop bitcoinim pleasantly surprised accurately blackrocks ceo larry fink understands politics cant stop bitcoins growth,-0.016,0.2619047619047619,0.12295238095238095
RSS,https://bitcoinmagazine.com/.rss/full/,2024-10-14 19:20:22+00:00,2024-10-23 00:51:38.638577,kamala harris prof shes worst candidate bitcoin ownership adoptionour expectation low holy fck,-0.7351,-0.5,-0.61755
RSS,https://bitcoinmagazine.com/.rss/full/,2024-10-14 18:20:59+00:00,2024-10-23 00:51:38.638577,corva welcome empowerment epoch bitcoin people moneyin fifth bitcoin epoch bitcoin looked le speculative bet financial life raft many around world living failing oppressive system,-0.3818,0.43333333333333335,0.025766666666666688
RSS,https://bitcoinmagazine.com/.rss/full/,2024-10-14 14:15:38+00:00,2024-10-23 00:51:38.638577,bought microstrategy mstr stock real reasonso buy mstr short story really im tired watching mstr bull right whatever talking,-0.4902,0.021428571428571422,-0.2343857142857143
RSS,https://bitcoinmagazine.com/.rss/full/,2024-10-11 15:54:50+00:00,2024-10-23 00:51:38.638577,bitcoin miner expect nextwhat miner actually planning going near term future,0.0,0.03333333333333333,0.016666666666666666
RSS,https://bitcoinmagazine.com/.rss/full/,2024-10-10 17:38:41+00:00,2024-10-23 00:51:38.638577,trump winning closer ever freeing ross nikolauswe still fight like 13,0.7506,0.5,0.6253
RSS,https://bitcoinmagazine.com/.rss/full/,2024-10-10 14:44:21+00:00,2024-10-23 00:51:38.638577,memecoin supercycle thesis bitcoin alignedyes hyperbitcoinization happening yes messy period complete crypto degeneracy,0.0516,-0.05,0.0007999999999999986
RSS,https://bitcoinmagazine.com/.rss/full/,2024-10-09 15:16:08+00:00,2024-10-23 00:51:38.638577,hbos satoshi documentary money electric insult bitcoin hard know say documentary except marvel creativity cynicism,-0.25,-0.09722222222222222,-0.1736111111111111
RSS,https://bitcoinmagazine.com/.rss/full/,2024-10-09 12:55:53+00:00,2024-10-23 00:51:38.638577,asian bitcoiners profit maximalistsas someone who lived asia west ive noticed clear difference view bitcoin asia profit maximalists west philosophically driven,0.8126,0.03333333333333333,0.42296666666666666
RSS,https://bitcoinmagazine.com/.rss/full/,2024-10-09 07:16:35+00:00,2024-10-23 00:51:38.638577,watch bitcoin amsterdam underwaythe world largest bitcoin conference kick today amsterdam featuring speaker like jack mallers adam back watch live stream european bitcoin leader discus future,0.3612,0.03409090909090909,0.19764545454545457
RSS,https://bitcoinmagazine.com/.rss/full/,2024-10-08 19:49:31+00:00,2024-10-23 00:51:38.638577,entered bitcoin mining lottery nikolaushow im looking beat odds claim full 325 btc block worth 200000,-0.25,0.32499999999999996,0.03749999999999998
RSS,https://bitcoinmagazine.com/.rss/full/,2024-10-08 15:17:43+00:00,2024-10-23 00:51:38.638577,bitcoin report parabolic growth predicted q4 2024exclusive analysis expert insight navigating bitcoins promising q4 market dynamic,0.7845,0.1,0.44225
RSS,https://bitcoinmagazine.com/.rss/full/,2024-10-08 14:15:14+00:00,2024-10-23 00:51:38.638577,vexl next generation bitcoin p2p trading appvexl cofounder ceo lea petrášová belief app shes helped create opensource kycfree peertopeer bitcoin marketplace essential helping preserve bitcoins essential quality,0.5106,0.0,0.2553
RSS,https://bitcoinmagazine.com/.rss/full/,2024-10-08 13:00:00+00:00,2024-10-23 00:51:38.638577,shinobi stop demonizing developer nonsensea quick take latest reason people yelling bitcoin core developer,-0.296,0.41666666666666663,0.06033333333333332
RSS,https://bitcoinmagazine.com/.rss/full/,2024-10-08 12:07:44+00:00,2024-10-23 00:51:38.638577,reminder update bitcoin wallet firmwarelive digital device bitcoin hardware wallet infallible require routine upkeep least wellkept seed phrase,0.0,-0.15,-0.075
RSS,https://bitcoinmagazine.com/.rss/full/,2024-10-07 18:42:05+00:00,2024-10-23 00:51:38.638577,trump presidency best outcome bitcoin nikolaustrump would allow friendly regulatory environment bitcoiners thrive,0.8519,0.6875,0.7697
RSS,https://bitcoinmagazine.com/.rss/full/,2024-10-05 12:26:18+00:00,2024-10-23 00:51:38.638577,uncle jack chili good bitcoina selfproclaimed bitcoin pleb actual brain surgeon dr jack kruse sauce want everyone try,0.4939,0.35,0.42195
RSS,https://bitcoinmagazine.com/.rss/full/,2024-10-05 00:18:02+00:00,2024-10-23 00:51:38.638577,corva want greater adoption bitcoin use fix problemsfollow lead bitcoin ekasis hermann vivier motivs rich swisher,0.7506,0.4375,0.59405
RSS,https://bitcoinmagazine.com/.rss/full/,2024-10-04 15:37:05+00:00,2024-10-23 00:51:38.638577,positive end 2024 bitcoinoptimism ahead q4 2024 deliver bitcoins next big rally,0.5574,0.07575757575757576,0.3165787878787879
RSS,https://bitcoinmagazine.com/.rss/full/,2024-10-04 15:20:11+00:00,2024-10-23 00:51:38.638577,bitcoin magazine introduces new short form opinion format takesthe oldest trusted bitcoin publication introducing new shortform content format,0.4767,0.0909090909090909,0.2838045454545455
RSS,https://bitcoinmagazine.com/.rss/full/,2024-10-04 14:46:41+00:00,2024-10-23 00:51:38.638577,wont find satoshi nakamoto next weekas longtime bitcoiner im certain latest satoshi nakamoto unmasking attempt disappoint like rest real proof provided,0.2263,0.2285714285714286,0.2274357142857143
RSS,https://bitcoinmagazine.com/.rss/full/,2024-10-03 18:17:53+00:00,2024-10-23 00:51:38.638577,aaron trump give damn bitcointrump providing lip service bitcoiners mean continue ally bitcoin get elected second term,-0.4019,-0.15625,-0.27907499999999996
RSS,https://bitcoinmagazine.com/.rss/full/,2024-10-03 15:40:52+00:00,2024-10-23 00:51:38.638577,frank bitcoina seemingly contradictory yet profound message jeff booth,-0.34,0.08333333333333333,-0.12833333333333335
RSS,https://bitcoinmagazine.com/.rss/full/,2024-10-03 14:39:59+00:00,2024-10-23 00:51:38.638577,wall street isnt bitcoin crypto etf comingwall street want sell product make u dollar continue thing make dollar,0.0772,0.0,0.0386
RSS,https://bitcoinmagazine.com/.rss/full/,2024-10-03 12:50:17+00:00,2024-10-23 00:51:38.638577,vivek bitcoin lightning payment long way go indiai couldnt resist lightning fast fiat payment network india,0.0,0.07500000000000001,0.037500000000000006
RSS,https://bitcoinmagazine.com/.rss/full/,2024-10-02 18:04:05+00:00,2024-10-23 00:51:38.638577,offchain protocol always balancing actimportant thing consider looking future offchain system,0.0,0.0,0.0
RSS,https://bitcoinmagazine.com/.rss/full/,2024-10-02 14:42:48+00:00,2024-10-23 00:51:38.638577,1000 faraday backpack protect bitcointhe slnt submersible faraday backpack may bit splurge feature bitcoin privacy expert could want,0.4404,0.0,0.2202
RSS,https://bitcoinist.com/feed/,2024-10-23 00:30:08+00:00,2024-10-23 00:51:38.638577,cardano holder earn passive income here howyoroi wallet leading light wallet cardano partnered bring whitelabel crypto cashback platform collaboration aim bridge gap cardano community global retail allowing user earn ada cashback reward shopping 775 international retailer passive income cardano holder upcoming integration,0.743,0.13333333333333333,0.43816666666666665
RSS,https://bitcoinist.com/feed/,2024-10-22 23:00:44+00:00,2024-10-23 00:51:38.638577,india crack crypto regulator favor cbdc push v bitcoin coindia leaning toward total prohibition private cryptocurrencies like bitcoin ethereum attempt regulate risk current volatile market government said preference central bank digital currency cbdc provide benefit private cryptocurrencies without potential instability,0.7269,0.0,0.36345
RSS,https://bitcoinist.com/feed/,2024-10-22 21:30:29+00:00,2024-10-23 00:51:38.638577,dogecoin price replicates reversal box move 2020 happens nextcrypto analyst trader tardigrade drawn crypto community attention historical pattern dogecoin price replicated cycle analyst indicated bullish foremost meme coin revealed likely happen next dogecoin price replicates reversal box move 2020 trader tardigrade mentioned,0.0,0.0,0.0
RSS,https://bitcoinist.com/feed/,2024-10-22 21:00:45+00:00,2024-10-23 00:51:38.638577,dogecoin xrp price rco finance presale token could see bigger gain q4 2024 here whythe crypto market pumping xrp price gaining traction meanwhile dogecoin doge performed exceptionally jumping double digit past week despite gain investor increasingly flock rco finance rcof upcoming presale token xrp dogecoin investor rushing buy rco finance rcof let find,0.5305,0.10416666666666666,0.3173333333333333
RSS,https://bitcoinist.com/feed/,2024-10-22 20:00:15+00:00,2024-10-23 00:51:38.638577,bitcoins uptober breakout sight next potential critical levelsoctober historically one bitcoins bestperforming month triggering notable price increase year considering price btc month several crypto analyst believe digital asset could gearing breakout might catalyze move new alltime high major move bitcoin around,0.3612,0.08588636363636364,0.22354318181818184
RSS,https://bitcoinist.com/feed/,2024-10-22 17:49:39+00:00,2024-10-23 00:51:38.638577,paul tudor jones point bitcoin gold shield u inflation threatsbillionaire hedge fund manager paul tudor jones ceo tudor investment corporation highlighted growing threat inflation recent interview cnbc describing bitcoin gold essential asset amid rising recession fear united state interview jones revealed investment strategy stating actively purchasing bitcoin,-0.2732,-0.044444444444444446,-0.15882222222222223
RSS,https://bitcoinist.com/feed/,2024-10-22 17:00:29+00:00,2024-10-23 00:51:38.638577,shiba inu price could resume uptrend 000002 whale transaction jump 240 342 trillion shibshiba inu whale transaction skyrocketed whopping 240 largescale investor seen moving trillion shib token week considering significant increase shib whale movement price shiba inu could continue previously halted uptrend 000002 shib whale activity spike new data intotheblock shown,0.4767,0.1148989898989899,0.295799494949495
RSS,https://bitcoinist.com/feed/,2024-10-22 16:00:47+00:00,2024-10-23 00:51:38.638577,boom bust ton network daily user drop 5 million 158mthe open network ton blockchain significantly decreased daily active user according twitterx post intotheblock ton network currently boast 158 million active user high 5 million post also shared chart tracking number daily active address network punctuated,0.8271,-0.06399999999999999,0.38155
