MainSource,Source,Publication Date,Pull_date,Pre-Processed Text,Sentiment_Vader,Sentiment_TextBlob,Average_Sentiment
GoogleNews,ethereum,4 minutes ago,2025-02-19 00:53:02.675086,ethereum etf flow analysis grayscale mini record zero flowaccording farside investor ethereum etf specifically grayscale mini recorded u flow 0 million indicates new capital inflow,0.0,0.13636363636363635,0.06818181818181818
GoogleNews,ethereum,8 minutes ago,2025-02-19 00:53:02.675086,best cryptos buy bitcoin ethereum litecoin dogecoin blockdag set explosive growthbitcoin ethereum litecoin dogecoin gearing major breakout blockdag steal spotlight recordbreaking 196m presale,0.1868,0.53125,0.359025
GoogleNews,ethereum,0 minutes ago,2025-02-19 00:53:02.675086,ethereum shiba inu dogecoin top cryptos expected surge next bull runethereum shiba inu dogecoin predicted lead next crypto bull run new official magacoin presale coin stealing spotlight,-0.4404,0.10727272727272727,-0.16656363636363636
GoogleNews,ethereum,1 hour ago,2025-02-19 00:53:02.675086,ethereum name service en price prediction 20252031explore ethereum name service en price forecast 2025 2031 prediction substantial growth potential longterm gain driven,0.7783,0.0,0.38915
GoogleNews,ethereum,1 hour ago,2025-02-19 00:53:02.675086,tether cofounder support new stablecoin project ethereum solanacofounder tether supporting pi protocol decentralized yieldgenerating stablecoin set launch ethereum solana 2025,0.6808,0.19318181818181818,0.4369909090909091
GoogleNews,ethereum,2 hours ago,2025-02-19 00:53:02.675086,ethereum price prediction latest ethereum news lightchain ai becomes trader favourite cryptoethereum eth remains one dominant force crypto market smart contract capability driving innovation across decentralized,0.6486,0.35714285714285715,0.5028714285714285
GoogleNews,ethereum,2 hours ago,2025-02-19 00:53:02.675086,ethereum short position surge 113 billion major breakdown comingon february 18th tuesday ethereum price recorded 35 intraday loss currently trading 2650 broader market uncertainty offer,-0.5719,0.020833333333333332,-0.2755333333333333
GoogleNews,ethereum,3 hours ago,2025-02-19 00:53:02.675086,mfc asset promotes initial ethereum etfmfc asset management launching thailand first ethereum exchangetraded fund etf invest world secondlargest cryptocurrency amid boom,0.7506,0.125,0.4378
GoogleNews,ethereum,3 hours ago,2025-02-19 00:53:02.675086,sec seek public feedback approving option trading grayscale bitwise ethereum etfsthe u sec asking public weigh whether agency approve option trading trio spot ethereum etf,0.0,-0.05,-0.025
GoogleNews,ethereum,3 hours ago,2025-02-19 00:53:02.675086,ethereum shiba inu price struggle afloat floppypepe fppe emerges top contender massive gainsthe shiba inu price losing steam ethereum eth isnt faring much better pushing investor seek better opportunity floppypepe fppe,0.1764,0.3,0.2382
GoogleNews,ethereum,3 hours ago,2025-02-19 00:53:02.675086,cryptomagnetbitcoingainer7s insightsethereum price prediction eth reach 1900 february close approach end february many trader keenly watching ethereum eth,0.2732,0.5,0.3866
GoogleNews,ethereum,3 hours ago,2025-02-19 00:53:02.675086,hidden shift ethereums resurgence spell doom solana amid memecoin mysteriesshockwaves crypto sol v eth showdown amid scandal reign supreme find juicy detail trader eye major reversal3 hour ago,-0.25,-0.05208333333333333,-0.15104166666666666
GoogleNews,ethereum,3 hours ago,2025-02-19 00:53:02.675086,ethereum face bearish reversal 2700ethereum struggle 2700 bearish signal potentially dropping 2400 institutional interest low exchange reserve offer hope,0.3612,0.0,0.1806
GoogleNews,ethereum,3 hours ago,2025-02-19 00:53:02.675086,tron trx maintain dominance token like remittix continue outperform ethereum solanatron trx established important blockchain player remittix rtx entered market making serious move threatened,0.2023,0.033333333333333354,0.11781666666666668
GoogleNews,ethereum,4 hours ago,2025-02-19 00:53:02.675086,analyst bullish dogecoin ethereum amid red monthly price chart new crypto coin gain mass attention early 2025analysts optimistic future dogecoin ethereum despite recent market volatility meanwhile new crypto coin getting massive medium,0.6908,0.053246753246753244,0.3720233766233766
GoogleNews,ethereum,4 hours ago,2025-02-19 00:53:02.675086,crypto market crash bitcoin ethereum solana xrp price droppinga crypto market crash happening bitcoin ethereum solana xrp price suffering significant decline,-0.7717,0.375,-0.19835000000000003
GoogleNews,ethereum,5 hours ago,2025-02-19 00:53:02.675086,ethereum eth price prediction february 19 2025ethereum remains bearish key support 2560 breakdown could send eth 2120 rebound 2650 may push,0.4019,0.0,0.20095
GoogleNews,ethereum,5 hours ago,2025-02-19 00:53:02.675086,cardano price prediction 50 tax cut proposal drive ada ethereumcardano ada price broke 080 support level tuesday booking daily loss 8 amid bearish macro market sentiment,-0.5423,0.0,-0.27115
GoogleNews,ethereum,5 hours ago,2025-02-19 00:53:02.675086,ethereum outperforms altcoins onchain signal flash bullishdespite general decline crypto market token better others one ethereum outperforming many,0.4404,0.35000000000000003,0.3952
GoogleNews,ethereum,5 hours ago,2025-02-19 00:53:02.675086,chinese investor burn 68 million ethereum expose alleged mind control conspiracya chinese programmer named hu lezhi spent 68 million worth ethereum eth spread warning mind control technology,-0.2732,0.019999999999999997,-0.1266
GoogleNews,ethereum,5 hours ago,2025-02-19 00:53:02.675086,bitcoin dip ethereum fall 2700the cryptocurrency market remains trapped uncertainty bitcoin struggling maintain bullish structure ethereum attracting institutional,-0.6705,-0.2,-0.43525
GoogleNews,ethereum,5 hours ago,2025-02-19 00:53:02.675086,ethereum retests symmetrical triangle pattern analyst set next targetin x post trader tardigrade revealed ethereum price retesting symmetrical triangle breakout,0.0,0.0,0.0
GoogleNews,ethereum,6 hours ago,2025-02-19 00:53:02.675086,allegedly bridgewater hedge fund hold 31b ethereum eth short positiona report making round claiming one biggest hedge fund world strategy shorting ethereum eth 31b directional,0.0,-0.10000000000000002,-0.05000000000000001
GoogleNews,ethereum,6 hours ago,2025-02-19 00:53:02.675086,xrp might steal crown bitcoin ethereumxrp navigates complex cryptocurrency landscape surging past challenge amid regulatory market change compared bitcoins 2370,-0.4404,-0.275,-0.3577
GoogleNews,ethereum,6 hours ago,2025-02-19 00:53:02.675086,ethereum ethusd long setup 1d bullish breakout aheadeth ethereum eth stand crucial crossroad 1day chart week consolidation battle bull bear intensifies,-0.3818,-0.025,-0.2034
GoogleNews,ethereum,6 hours ago,2025-02-19 00:53:02.675086,trader called 2022 market crash predicts big correction bitcoin ethereum solana massive ralliesa veteran trader known calling collapse 2022 predicting big fakeout dip bitcoin btc two top altcoins fresh explosive,-0.4215,0.13333333333333333,-0.14408333333333334
GoogleNews,ethereum,6 hours ago,2025-02-19 00:53:02.675086,ethereum price forecast whale secure profit sparking 4 dip 1 billion worth eth distributionethereum eth dipped 4 tuesday following rising selling activity whale cut holding 1 billion past two day,0.6249,0.11249999999999999,0.3687
GoogleNews,ethereum,6 hours ago,2025-02-19 00:53:02.675086,trader build record 113 billion short position ethereum amid 2 billion long position defianttraders established record short position ethereum eth6 hour ago,0.0,-0.016666666666666666,-0.008333333333333333
GoogleNews,ethereum,6 hours ago,2025-02-19 00:53:02.675086,ethereum price eth inrethereum eth cryptocurrency price india today 19 feb 2025 know today cryptocurrency price exchange rate ethereum,0.0,0.0,0.0
GoogleNews,ethereum,6 hours ago,2025-02-19 00:53:02.675086,ethereum meme coin could 100x february endsas crypto market face recent correction ethereum meme coin catching attention investor seeking high return,0.0,0.25333333333333335,0.12666666666666668
GoogleNews,ethereum,7 hours ago,2025-02-19 00:53:02.675086,ethereum supply squeeze exchange reserve plunge 9year lowkey takeaway eth reserve exchange lowest level since 2016 signaling reduced sellside pressure investor increasingly moving,-0.5859,0.0,-0.29295
GoogleNews,ethereum,7 hours ago,2025-02-19 00:53:02.675086,ethereum etf staking spark price surge yeti ouro yetio gain traction p2e marketethereum eth making headline surging 5 week institutional interest strengthens,0.8834,0.0,0.4417
GoogleNews,ethereum,7 hours ago,2025-02-19 00:53:02.675086,spot ethereum etf inflow hit 317 billion eth hit new high buy new cheap ai meme coinas spot ethereum etf inflow cross 3 billion mark investor decide whether remain bullish ethereum eth purchase floppypepe fppe,0.0,0.16654545454545455,0.08327272727272728
GoogleNews,ethereum,7 hours ago,2025-02-19 00:53:02.675086,ethereum 26k liquidation pool could decide eths next moveethereums 2800 surge triggered short liquidation contrasting bitcoins stagnant price geopolitical factor etf inflow contributed,0.0,0.0,0.0
GoogleNews,ethereum,7 hours ago,2025-02-19 00:53:02.675086,xrp overtake bitcoin ethereum crypto racethe cryptocurrency market volatile bitcoin ethereum seeing significant surge xrp gaining attention different reason,0.5574,0.1875,0.37245
GoogleNews,ethereum,7 hours ago,2025-02-19 00:53:02.675086,former tether ceo debut rival yieldbearing stablecoin ethereum solana bloombergunlike tether usdt collins pi protocol offer holder yield likely earned tokenized realworld asset,0.3612,0.0,0.1806
GoogleNews,ethereum,7 hours ago,2025-02-19 00:53:02.675086,ethereum l2 abstract accusation wallet emptied suspected tie cardexabstract ethereum layer2 l2 platform facing serious security issue several user reported wallet drained developer deny,-0.7506,-0.16666666666666666,-0.45863333333333334
GoogleNews,ethereum,8 hours ago,2025-02-19 00:53:02.675086,ethereum release pectra upgrade testnets february 24thethereum scheduled deploy pectra upgrade testnets february 24th epoch 115968 upgrade implemented holesky,0.0,0.0,0.0
GoogleNews,ethereum,8 hours ago,2025-02-19 00:53:02.675086,ethereum l2 abstract hit wallet drain tie cardex suspectedethereum l2 platform abstract investigating wallet drain issue day abstract global wallet hit milestone one million deployed,0.0,0.0,0.0
GoogleNews,ethereum,8 hours ago,2025-02-19 00:53:02.675086,ethereum etf surge 393m bitcoin etf face crisisethereum etf surge 393m inflow bitcoin etf struggle outflow signaling major shift investor sentiment,-0.3182,0.0625,-0.12785
GoogleNews,ethereum,8 hours ago,2025-02-19 00:53:02.675086,ethereum surge 12day high exchange supply hit record lowethereum gained momentum past 24 hour reaching 12day high 2832 returning 2720 price increase represents 2 daily gain,0.8442,0.0175,0.43084999999999996
GoogleNews,ethereum,8 hours ago,2025-02-19 00:53:02.675086,solana face bearish triangle ethereum gain market interestsolana sol price drop bearish triangle signal ethereum gain market interest trader shift focus amid high volatility,0.8271,0.16,0.49355
GoogleNews,ethereum,8 hours ago,2025-02-19 00:53:02.675086,ethereum price prediction could panshibi shibi next big meme coin eth networkon valentine day 2025 ethereum maxi filled something lovenyse arca staked eth etf filing ignited optimism8 hour ago,0.0,0.13333333333333333,0.06666666666666667
GoogleNews,ethereum,8 hours ago,2025-02-19 00:53:02.675086,ethereum fix target 3000 amid rising demand bull push eth priceinvestor interest ethereum growing seek break current consolidation phase onchain data show strong demand ethereum,0.7184,0.21666666666666667,0.46753333333333336
GoogleNews,ethereum,8 hours ago,2025-02-19 00:53:02.675086,ethereum rise amid libra controversy strategic shift crypto marketethereum eth recently gained momentum increasing 3 controversy surrounding metas libra project resurfaces,0.3818,0.0,0.1909
GoogleNews,ethereum,8 hours ago,2025-02-19 00:53:02.675086,altseason risk expert belief ethereum must hold 2600 sustain momentumethereum battle hold 2600 analyst warns potential altseason cancelation,-0.6249,0.0,-0.31245
GoogleNews,ethereum,8 hours ago,2025-02-19 00:53:02.675086,elite crypto analyst reveals 4 pick next altseason neither ethereum eth solana sol made listas cryptocurrency market gear next altseason top analyst making prediction altcoins shine surprisingly ethereum,0.4588,0.3,0.37939999999999996
GoogleNews,ethereum,8 hours ago,2025-02-19 00:53:02.675086,ethereum etf apply permission eth stakingwhen ethereum etf made stock market debut u last july significant downside,-0.0516,0.1875,0.06795
GoogleNews,ethereum,8 hours ago,2025-02-19 00:53:02.675086,ethereum eth etf see inflow spike amid crypto rotationinflows spot ethereum eth exchangetraded fund etf growing investor rotate money bitcoin btc latest data show,0.1779,0.5,0.33895
GoogleNews,blockchain,1 minutes ago,2025-02-19 00:53:02.675086,sarawak poised become regional cryptocurrency blockchain tech hub say mpkuching feb 19 sarawak unique advantage could make potential hub cryptocurrency blockchain technology region,0.4588,0.1875,0.32315
GoogleNews,blockchain,3 minutes ago,2025-02-19 00:53:02.675086,alibabas hong kong surprise ai blockchain shaping future share pricesai blockchain technology set transform alibabas operation influence hong kong share price trajectory ai enhances consumer experience,0.6705,0.0,0.33525
GoogleNews,blockchain,1 hour ago,2025-02-19 00:53:02.675086,unleashing future solana could outshine blockchainssolana achieves 65000 transaction per second due innovative proof history poh system speed costefficiency revolutionizing,0.4404,0.09375,0.267075
GoogleNews,blockchain,2 hours ago,2025-02-19 00:53:02.675086,nakamotodex move forward presale strengthening stack blockchain ecosystemnakamotodex push forward presale enhancing stack ecosystem bringing new standard crypto trading,0.4939,0.06818181818181818,0.28104090909090906
GoogleNews,blockchain,3 hours ago,2025-02-19 00:53:02.675086,ai blockchain 11 3virtuals protocol transforming artificial intelligence ai agent tokenized asset blockchain unlocking new digital communication opportunity,0.8126,-0.15454545454545454,0.3290272727272727
GoogleNews,blockchain,3 hours ago,2025-02-19 00:53:02.675086,blockchain technology healthcare market size set grow 6832 2025 2032 ibm microsoft patientory oracle blockpharmablockchain technology originally developed underlying structure cryptocurrencies like bitcoin shown immense potential beyond realm,0.3612,0.03333333333333333,0.19726666666666667
GoogleNews,blockchain,4 hours ago,2025-02-19 00:53:02.675086,agentoras ainative metaverse meet metaarenas blockchain mmorpg groundbreaking alliancemetaarena agentora recently teamed merge system agentoras ainative autonomous metaverse metaarenas blockchain mmorpg,0.0,0.2,0.1
GoogleNews,blockchain,4 hours ago,2025-02-19 00:53:02.675086,cocacolas stock revolution ai na blockchain naagbanwe egwuregwucocacola integrating ai optimize production enhance supply chain logistics personalize marketing strategy blockchain technology,0.4939,0.0,0.24695
GoogleNews,blockchain,6 hours ago,2025-02-19 00:53:02.675086,qubetics massive roi make top crypto 100x potential polkadot cosmos lead blockchain worlddiscover qubetics polkadot cosmos poised offer exponential return explore unique feature growth potential,0.6597,0.175,0.41735
GoogleNews,blockchain,6 hours ago,2025-02-19 00:53:02.675086,solanas reputation shaken analyst report graphite network solves blockchains trust problemsolanas reputation fire graphite network redefining blockchain trust verified user kyc filter reputationbased security,0.8126,0.0,0.4063
GoogleNews,blockchain,1 minutes ago,2025-02-19 00:53:02.675086,sarawak poised become regional cryptocurrency blockchain tech hub say mpkuching feb 19 sarawak unique advantage could make potential hub cryptocurrency blockchain technology region,0.4588,0.1875,0.32315
GoogleNews,blockchain,3 minutes ago,2025-02-19 00:53:02.675086,alibabas hong kong surprise ai blockchain shaping future share pricesai blockchain technology set transform alibabas operation influence hong kong share price trajectory ai enhances consumer experience,0.6705,0.0,0.33525
GoogleNews,blockchain,1 hour ago,2025-02-19 00:53:02.675086,unleashing future solana could outshine blockchainssolana achieves 65000 transaction per second due innovative proof history poh system speed costefficiency revolutionizing,0.4404,0.09375,0.267075
GoogleNews,blockchain,2 hours ago,2025-02-19 00:53:02.675086,nakamotodex move forward presale strengthening stack blockchain ecosystemnakamotodex push forward presale enhancing stack ecosystem bringing new standard crypto trading,0.4939,0.06818181818181818,0.28104090909090906
GoogleNews,blockchain,3 hours ago,2025-02-19 00:53:02.675086,ai blockchain 11 3virtuals protocol transforming artificial intelligence ai agent tokenized asset blockchain unlocking new digital communication opportunity,0.8126,-0.15454545454545454,0.3290272727272727
GoogleNews,blockchain,3 hours ago,2025-02-19 00:53:02.675086,blockchain technology healthcare market size set grow 6832 2025 2032 ibm microsoft patientory oracle blockpharmablockchain technology originally developed underlying structure cryptocurrencies like bitcoin shown immense potential beyond realm,0.3612,0.03333333333333333,0.19726666666666667
GoogleNews,blockchain,4 hours ago,2025-02-19 00:53:02.675086,agentoras ainative metaverse meet metaarenas blockchain mmorpg groundbreaking alliancemetaarena agentora recently teamed merge system agentoras ainative autonomous metaverse metaarenas blockchain mmorpg,0.0,0.2,0.1
GoogleNews,blockchain,4 hours ago,2025-02-19 00:53:02.675086,cocacolas stock revolution ai na blockchain naagbanwe egwuregwucocacola integrating ai optimize production enhance supply chain logistics personalize marketing strategy blockchain technology,0.4939,0.0,0.24695
GoogleNews,blockchain,6 hours ago,2025-02-19 00:53:02.675086,qubetics massive roi make top crypto 100x potential polkadot cosmos lead blockchain worlddiscover qubetics polkadot cosmos poised offer exponential return explore unique feature growth potential,0.6597,0.175,0.41735
GoogleNews,blockchain,6 hours ago,2025-02-19 00:53:02.675086,solanas reputation shaken analyst report graphite network solves blockchains trust problemsolanas reputation fire graphite network redefining blockchain trust verified user kyc filter reputationbased security,0.8126,0.0,0.4063
GoogleNews,blockchain,1 minutes ago,2025-02-19 00:53:02.675086,sarawak poised become regional cryptocurrency blockchain tech hub say mpkuching feb 19 sarawak unique advantage could make potential hub cryptocurrency blockchain technology region,0.4588,0.1875,0.32315
GoogleNews,blockchain,3 minutes ago,2025-02-19 00:53:02.675086,alibabas hong kong surprise ai blockchain shaping future share pricesai blockchain technology set transform alibabas operation influence hong kong share price trajectory ai enhances consumer experience,0.6705,0.0,0.33525
GoogleNews,blockchain,1 hour ago,2025-02-19 00:53:02.675086,unleashing future solana could outshine blockchainssolana achieves 65000 transaction per second due innovative proof history poh system speed costefficiency revolutionizing,0.4404,0.09375,0.267075
GoogleNews,blockchain,2 hours ago,2025-02-19 00:53:02.675086,nakamotodex move forward presale strengthening stack blockchain ecosystemnakamotodex push forward presale enhancing stack ecosystem bringing new standard crypto trading,0.4939,0.06818181818181818,0.28104090909090906
GoogleNews,blockchain,3 hours ago,2025-02-19 00:53:02.675086,ai blockchain 11 3virtuals protocol transforming artificial intelligence ai agent tokenized asset blockchain unlocking new digital communication opportunity,0.8126,-0.15454545454545454,0.3290272727272727
GoogleNews,blockchain,3 hours ago,2025-02-19 00:53:02.675086,blockchain technology healthcare market size set grow 6832 2025 2032 ibm microsoft patientory oracle blockpharmablockchain technology originally developed underlying structure cryptocurrencies like bitcoin shown immense potential beyond realm,0.3612,0.03333333333333333,0.19726666666666667
GoogleNews,blockchain,4 hours ago,2025-02-19 00:53:02.675086,agentoras ainative metaverse meet metaarenas blockchain mmorpg groundbreaking alliancemetaarena agentora recently teamed merge system agentoras ainative autonomous metaverse metaarenas blockchain mmorpg,0.0,0.2,0.1
GoogleNews,blockchain,4 hours ago,2025-02-19 00:53:02.675086,cocacolas stock revolution ai na blockchain naagbanwe egwuregwucocacola integrating ai optimize production enhance supply chain logistics personalize marketing strategy blockchain technology,0.4939,0.0,0.24695
GoogleNews,blockchain,6 hours ago,2025-02-19 00:53:02.675086,qubetics massive roi make top crypto 100x potential polkadot cosmos lead blockchain worlddiscover qubetics polkadot cosmos poised offer exponential return explore unique feature growth potential,0.6597,0.175,0.41735
GoogleNews,blockchain,6 hours ago,2025-02-19 00:53:02.675086,solanas reputation shaken analyst report graphite network solves blockchains trust problemsolanas reputation fire graphite network redefining blockchain trust verified user kyc filter reputationbased security,0.8126,0.0,0.4063
GoogleNews,blockchain,1 minutes ago,2025-02-19 00:53:02.675086,sarawak poised become regional cryptocurrency blockchain tech hub say mpkuching feb 19 sarawak unique advantage could make potential hub cryptocurrency blockchain technology region,0.4588,0.1875,0.32315
GoogleNews,blockchain,3 minutes ago,2025-02-19 00:53:02.675086,alibabas hong kong surprise ai blockchain shaping future share pricesai blockchain technology set transform alibabas operation influence hong kong share price trajectory ai enhances consumer experience,0.6705,0.0,0.33525
GoogleNews,blockchain,1 hour ago,2025-02-19 00:53:02.675086,unleashing future solana could outshine blockchainssolana achieves 65000 transaction per second due innovative proof history poh system speed costefficiency revolutionizing,0.4404,0.09375,0.267075
GoogleNews,blockchain,2 hours ago,2025-02-19 00:53:02.675086,nakamotodex move forward presale strengthening stack blockchain ecosystemnakamotodex push forward presale enhancing stack ecosystem bringing new standard crypto trading,0.4939,0.06818181818181818,0.28104090909090906
GoogleNews,blockchain,3 hours ago,2025-02-19 00:53:02.675086,ai blockchain 11 3virtuals protocol transforming artificial intelligence ai agent tokenized asset blockchain unlocking new digital communication opportunity,0.8126,-0.15454545454545454,0.3290272727272727
GoogleNews,blockchain,3 hours ago,2025-02-19 00:53:02.675086,blockchain technology healthcare market size set grow 6832 2025 2032 ibm microsoft patientory oracle blockpharmablockchain technology originally developed underlying structure cryptocurrencies like bitcoin shown immense potential beyond realm,0.3612,0.03333333333333333,0.19726666666666667
GoogleNews,blockchain,4 hours ago,2025-02-19 00:53:02.675086,agentoras ainative metaverse meet metaarenas blockchain mmorpg groundbreaking alliancemetaarena agentora recently teamed merge system agentoras ainative autonomous metaverse metaarenas blockchain mmorpg,0.0,0.2,0.1
GoogleNews,blockchain,4 hours ago,2025-02-19 00:53:02.675086,cocacolas stock revolution ai na blockchain naagbanwe egwuregwucocacola integrating ai optimize production enhance supply chain logistics personalize marketing strategy blockchain technology,0.4939,0.0,0.24695
GoogleNews,blockchain,6 hours ago,2025-02-19 00:53:02.675086,qubetics massive roi make top crypto 100x potential polkadot cosmos lead blockchain worlddiscover qubetics polkadot cosmos poised offer exponential return explore unique feature growth potential,0.6597,0.175,0.41735
GoogleNews,blockchain,6 hours ago,2025-02-19 00:53:02.675086,solanas reputation shaken analyst report graphite network solves blockchains trust problemsolanas reputation fire graphite network redefining blockchain trust verified user kyc filter reputationbased security,0.8126,0.0,0.4063
GoogleNews,blockchain,6 hours ago,2025-02-19 00:53:02.675086,wyoming set blockchain precedent state treasurer office may operate blockchain new stablecoin launchwyomings statebacked stablecoin aim integrate blockchain state financial operation enhancing government transparency,0.128,0.06818181818181818,0.09809090909090909
GoogleNews,blockchain,6 hours ago,2025-02-19 00:53:02.675086,institutional love crypto blockchaincom president lane kasselman live nyseipo edge hosted fireside chat feb 13 floor new york stock exchange 12th annual ipo summit lane kasselman president,0.6369,0.25757575757575757,0.4472378787878788
GoogleNews,blockchain,7 hours ago,2025-02-19 00:53:02.675086,justin sun advocate bridging blockchain technology people via tronaccording justin sun founder tron strong emphasis bridging gap blockchain technology general populace,0.5106,0.2416666666666667,0.3761333333333334
GoogleNews,blockchain,7 hours ago,2025-02-19 00:53:02.675086,high dogecoin price could go dogefather elon musk adopts blockchain u treasury transactionsdogecoins potential hit 5 musk backing contrast rexas finance 23400 growth rwa tokenization invest rxs debut,0.6369,0.08,0.35845
GoogleNews,blockchain,7 hours ago,2025-02-19 00:53:02.675086,near protocol introduces proof response enhance blockchain livenessproof response por mechanism developed near ai guarantee availability efficiency service decentralized network,0.5423,0.10000000000000002,0.32115
GoogleNews,blockchain,7 hours ago,2025-02-19 00:53:02.675086,hong kong advance blockchain finance gold tokenizationhong kong considering combining physical gold blockchain technology promoting golden tokenization,0.3612,0.15,0.2556
