MainSource,Source,Publication Date,Pull_date,Pre-Processed Text,Sentiment_Vader,Sentiment_TextBlob,Average_Sentiment
Reddit,solana,2024-10-31 11:07:12,2024-11-02 12:16:52.022401,meritbased fundraising solana coming generate legion score nowsource httpsxcomsolanastatus1851655804744520049httpsxcomsolanastatus1851655804744520049 welcome legiondotcchttpsxcomlegiondotcc bringing meritbased fundraising solana proof work reign legion turn onchain social developer history communitycentric investment opportunity httpsredditcomlink1ggbv9wvideo9lc8pk1gq2yd1player legion support solana native contract track key onchain solana achievement legion score transaction milestone early solanamobilehttpsxcomsolanamobile saga phone adoptoooors popular nft collection like madladshttpsxcommadlads httpspreviewredditagihlk5jq2yd1pngwidth680formatpngautowebps01e217d86489066e94c0532beb418b4d1aa0ff6e capital formation reimagined stand sign find legion score httpslegioncchttpslegioncc httpspreviewreddit0p58k2jkq2yd1pngwidth530formatpngautowebpsd96e5e3eaabd5698dfc854894c145ddb42294d6f source httpsxcomlegiondotccstatus1851641778367349024httpsxcomlegiondotccstatus1851641778367349024 1 legion score live generate 1 participate fundraises legion 2 see stack crypto legend leaderboard 3 use invite code build legion 4 access exclusive reputationgated community expand link tldr x200b 2 let see youre made generate legion score read learn matter httplegionccaccesshttplegionccaccess httpspreviewredditviox8wajr2yd1pngwidth680formatpngautowebpsafcf9c0556dce7e1d1a1a3b667a6e803a5f12bc1 3 legion score combine onchain activity github contribution social impact community engagement another vanity metric passkey access earlystage deal httpspreviewreddityj5a98alr2yd1pngwidth680formatpngautowebps815bbf8cccb0dc21729beeaac548ad80732efe13 4 higher score various area likely get significant allocation access size wallet mean nothing score edge x200b 5 future crypto fundraising meritbased legion score proof merit dont wait early adopter already securing score nab spot upcoming launch httpslegionccaccesshttpslegionccaccess httpspreviewredditxm74jqcor2yd1pngwidth530formatpngautowebps6dc6570357d8139ffed499d3657ccc2a0f6e0f2f 6 score unlocked show world comment turn notification chance win prize partner x200b,0.9854,0.19436868686868689,0.5898843434343435
Reddit,solana,2024-10-31 12:59:08,2024-11-02 12:16:52.022401,memecoin locked liquidityhey folk trading memecoins new wondering locked liquidity mean selltrade token specified time date thats creatorsdevs provided initial liquidity want locked liquidity unlocked tia folk,0.5574,-0.058712121212121215,0.2493439393939394
Reddit,solana,2024-10-31 16:43:53,2024-11-02 12:16:52.022401,created meme token need advicejust update last time posted create meme token currently 6k mc ath 85k mc know lot hey im actually pushing every day 22 day wont give people bought wont let paid dex created tg around 150 member created x going start raiding soon ive got plan state im raydium stated group 50k mc publish detail marketing also big give away certain mc small surprise give aways look community question push pumpfun raydium im shilling every day tg group everywhere get chance,0.8834,-0.005952380952380955,0.4387238095238095
Reddit,solana,2024-10-31 12:06:38,2024-11-02 12:16:52.022401,ultimate drop guide underfarmed solana project,-0.2732,0.0,-0.1366
Reddit,solana,2024-10-31 11:57:35,2024-11-02 12:16:52.022401,solandy solana program entrypoint deep dive solana tutorial oct 18th 24,0.0,0.0,0.0
Reddit,solana,2024-10-31 04:50:38,2024-11-02 12:16:52.022401,trading ohm eth sol want sol feesis enough liquidity trade get loststuck use sol wormhole exactly thanks end goal use sol raydium exchange solflare thanks,0.7269,0.13333333333333333,0.43011666666666665
Reddit,solana,2024-10-30 23:08:25,2024-11-02 12:16:52.022401,track dev wallet transfer exchange possible track dev wallet know amount sends fresh wallet specific tool method could help monitoring developer wallet go exchange,0.6124,0.09999999999999999,0.3562
Reddit,solana,2024-10-30 10:34:39,2024-11-02 12:16:52.022401,vaneck offer solana staking institutional investor,0.0,0.0,0.0
Reddit,solana,2024-10-30 15:01:46,2024-11-02 12:16:52.022401,xandeum roll token launch storageenabled staking solana,0.0,0.0,0.0
Reddit,solana,2024-10-30 18:46:51,2024-11-02 12:16:52.022401,buy solana instantlyi tried kraken buy solana however say wont able transfer crypto 72hrs since first cash purchase buy transfer solana instantly first crypto experience,0.0,0.3333333333333333,0.16666666666666666
Reddit,solana,2024-10-31 01:59:29,2024-11-02 12:16:52.022401,fetch top holder solana tokenanyone interesting building python code fetch top 15 holder noteworthy solana token something interesting propose,0.7906,0.5,0.6453
Reddit,solana,2024-10-30 22:07:45,2024-11-02 12:16:52.022401,solana option protocolhey everyone im fullstack developer web2 3 well trader ive primarily traded option past number year recently done fun trading solana ecosystem memecoins fun im thinking seriously launching onchain decentralized option trading mechanism protocol solana ive already mapped mechanism ive even started carving protocol already wanted see level interest protocol rsolana initially id probably start solana option eventually could expanded spl token writer could stake underlying token sell exercise premium thought interest level thanks,0.9451,0.07708333333333334,0.5110916666666667
Reddit,solana,2024-10-30 08:18:00,2024-11-02 12:16:52.022401,ct solana price hit 3month high data hint sol rally 200,0.0,0.16,0.08
Reddit,solana,2024-10-31 01:47:44,2024-11-02 12:16:52.022401,jupiter fee slippageso understand slippage much change coin may receive predicted amount purely based price change allowed price change buy sell take place also jupiter make difference cost fee click ultra turbo mode instead fast whilst keeping capped fee certain amount broadcast mode use simple term,0.2732,0.16571428571428573,0.21945714285714285
Reddit,solana,2024-10-31 14:09:34,2024-11-02 12:16:52.022401,di get solana bank account without kyc 18 verificationwon bit site stuck cake wallet,-0.25,0.0,-0.125
Reddit,solana,2024-10-30 11:50:31,2024-11-02 12:16:52.022401,sandwich attack whatim seeing transaction like someone explain think sandwich middle wallet didnt lose sol,0.1675,0.0,0.08375
Reddit,solana,2024-10-31 11:09:54,2024-11-02 12:16:52.022401,cost marketing new coinim planning launch new coin friend pooled money together marketing would like understand typical monthly marketing cost involved experienced space approach found effective working crypto marketing agency usual rate handling inhouse allocate budget insight recommendation greatly appreciated thank,0.9345,0.208008658008658,0.571254329004329
Reddit,solana,2024-10-31 01:30:49,2024-11-02 12:16:52.022401,bridge solana basei tried using phantom wallet swap tab base doesnt show asset available even stable believe still beta use,0.0232,-0.2,-0.0884
Reddit,solana,2024-10-31 00:48:24,2024-11-02 12:16:52.022401,solana ecosystem overview solanas expanding universe,0.0,0.0,0.0
Reddit,solana,2024-10-31 00:31:53,2024-11-02 12:16:52.022401,snipe token first second bond ray pumpfunso here thing devs know tested bundled launch get directly ray pumpfun hold supply order avoid dumping chart jeets sell bonding problem sniper got first second lp got created bought 9million token 36 sol fullclipped 800k 35sol making big red candle scaring people away token didnt die sure didnt help thinking one way solve problem would could snipe token hit ray buying another 50100 sol order raise price high enough sniper cant buy much supply cheap could good strategy also anyone know good bot require custom rpcs experience sniping token zero btw know stuff read around need custom rpc faster,-0.5063,0.23285714285714285,-0.13672142857142855
Reddit,solana,2024-10-30 17:50:41,2024-11-02 12:16:52.022401,looking solution automatically sell received tokenshey took part presale idk censored lol one token got wallet others already faster dumped supply botsolution auto detect received token without knowing ca automatically sell like half even supplly would ape 2 smaller bag instead 1 bigger im using always new wallet sale get im worried malicious airdrop thanks answer,0.5574,0.16161616161616163,0.35950808080808083
Reddit,solana,2024-10-31 10:13:16,2024-11-02 12:16:52.022401,yall fake community hype new pumpfun token asking friend alright degens need wisdom im launching memecoin solana soon like one want buy dead project seen bunch project looking like got whole cult day one even smoke mirror anyone got tip making new token page look poppin without actual community yet im talkin comment small trade maybe transaction volume anything get curious eye trying scam anyone wan na avoid ghost town vibe scare people thing even get going yall use sneaky bot script legit way make look active without crossing shady territory trying keep level give project fighting chance,-0.5106,-0.10550964187327824,-0.30805482093663916
Reddit,solana,2024-10-30 12:10:01,2024-11-02 12:16:52.022401,buy sol without idanybody know responding dm clicking link tell alternatively somewhere accept expires driver license verification,0.3818,0.0,0.1909
Reddit,solana,2024-10-30 09:52:45,2024-11-02 12:16:52.022401,liquidity pool amount transaction affect price markcap raydiumone trasaction httpspreviewredditnbfrvvor7vxd1pngwidth1068formatpngautowebps7491e27efab983d2b61597404be9edf7eb543e84 20 transactionshttpspreviewredditodts2diu7vxd1pngwidth1134formatpngautowebpsc763b63b1f94c244534c2909c95554e5a12548de trying understand coin liquidity pool work pumpfunhttppumpfun ussually pool created around 86 sol 206m coin want simulate transaction started excel noticed 20 transaction 10m coin would bring pool 1161 sol 6m coin left price 0033 around 32 markcap single transaction 200m coin liq pool 169 sol 6m coin price 00048 48 markcap please explain missing understand swap bigger amount make bigger price impact overall mean le bigger transaction impact price coin markcap le multitude small transaction,0.4215,-0.09265873015873016,0.1644206349206349
Reddit,solana,2024-10-30 14:39:04,2024-11-02 12:16:52.022401,method avoid rug pull meme coinshey guy im new crypto always use multiple rug checker sometimes come good still end getting rug pulled anyone method try determine coin rug pull,0.1779,0.27878787878787875,0.22834393939393938
Reddit,solana,2024-10-30 16:01:54,2024-11-02 12:16:52.022401,tool paper tradingi want test strategy trojan im hoping paper trade dont risk anything im developing plan tool used paper trade automation accurately track result,0.6012,0.4000000000000001,0.5006
Reddit,solana,2024-10-29 21:38:46,2024-11-02 12:16:52.022401,pumpfun releasing around 28000 meme every dayaccording dune pump fun releasing around 28000 memecoins per day httpsdunecomadam_tehcmemecoinwarshttpsdunecomadam_tehcmemecoinwars august average 15000 sustainable,0.5106,0.075,0.2928
Reddit,solana,2024-10-30 02:59:24,2024-11-02 12:16:52.022401,institutional product built solanaim writing report institutional product built crypto curious others know big name building solana eth blackrocks buidl program franklin templeton money market avalanche institutionsproducts building solana edit thing ive found far july 23 solana see arrival nomura brevan howardaffiliated tokenization firm librehttpswwwcoindeskcombusiness20240723solanaseesarrivalofnomurabrevanhowardaffiliatedtokenizationfirmlibre aug 28 case study etherfuse introduces mexican stablebond solanahttpssolanacomnewscasestudyetherfuse sept 20 franklin templeton plan mutual fund solanahttpswwwbanklesscomfranklintempletonplansmutualfundonsolana oct 29 vaneck partner kiln power institutional staking vanecks solana strategyhttpswwwbusinesswirecomnewshome20241029346139envaneckpartnerswithkilntopowerinstitutionalstakingforvanecke28099ssolanastrategy,0.3182,-0.04,0.1391
Reddit,solana,2024-10-30 14:03:00,2024-11-02 12:16:52.022401,new community building transparent coin need app developer web developer till successtext reelcaption got rich together imagine meme coin community minimal investment maximum gain would join journey comment yes,0.8979,0.13712121212121212,0.5175106060606061
Reddit,solana,2024-10-29 18:24:53,2024-11-02 12:16:52.022401,solana flip ethereum long lastyesterday solana flipped ethereum daily fee generating 254 million fee 24 hour think,0.0,-0.025,-0.0125
Reddit,solana,2024-10-30 00:43:41,2024-11-02 12:16:52.022401,copytrading working mei tried two different bot first unibot tradewiz entered wallet setting funded sol copying anything even tested using one wallet copy trade could possibly issue,0.0,0.08333333333333333,0.041666666666666664
Reddit,solana,2024-10-29 22:35:09,2024-11-02 12:16:52.022401,looking fastest trading bothi everyone im looking recommendation trading bot specifically one prioritize speed else ive tried bullx unfortunately experienced several trade taking second process still failing end main goal complete buy order quickly possible minimal delay anyone better experience bot like photon similar suggestion fastest reliable bot would greatly appreciated thank,0.5819,0.16666666666666669,0.3742833333333333
Reddit,solana,2024-10-29 22:45:09,2024-11-02 12:16:52.022401,photon sol crazy feesso trading solely trading bot trojan bonk masetro others wanted something visual straight forward went try photon today deposited 05 sol found good play entered 015 sol set take profit 50 price quickly take profit triggered id let u know already adjusted fee tip priority fee 0005 bribe 0001 slippage 15 anways price quickly hit take profit even keep going higher checked fund instead 0075 0025 question much exactly need trade position able break even small amount arent enough even 50 profit,0.9274,0.15606060606060604,0.541730303030303
Reddit,solana,2024-10-30 08:17:48,2024-11-02 12:16:52.022401,token instruction type initializemintcould someone explain difference initializemint initializemint2 initializemint 2 front field purpose work way httpsgithubcomsolanalabssolanaprogramlibraryblobd72289c79tokenjssrcinstructionstypestsl3httpsgithubcomsolanalabssolanaprogramlibraryblobd72289c79tokenjssrcinstructionstypestsl3 httpspreviewreddithpvu68ufruxd1pngwidth257formatpngautowebps18e670def7c7d2f37ca54553fdff4e6ffd847532,0.0,0.0,0.0
Reddit,solana,2024-10-29 15:47:33,2024-11-02 12:16:52.022401,large buy solana hello everyone im getting ready make first big buy meme coin 50sol want make sure correctly dont lose ton money slippagefees due mev bot suggestion safely possible thank,0.9013,0.14846938775510202,0.524884693877551
Reddit,solana,2024-10-29 07:59:03,2024-11-02 12:16:52.022401,solana memecoins todo list 1 get trading bot idc use personally use bullx truly love even quit job since using super easy im able trade go 2 learn identify metas must twitter tiktok tbh place metas born need learn identify come 3 network network network stop trading alone deathtrap others make much profitable long run keep grinding keep clicking originally response decided also make quick post also anyone know posted originally getting drained good news ive made money back god bless space,0.9578,0.30833333333333335,0.6330666666666667
Reddit,solana,2024-10-30 02:34:41,2024-11-02 12:16:52.022401,export coin stats screener result csv xlsanyone know tool site screen coin export result excel via csv xl birdeye feature worth 50 month alone,0.4404,0.3,0.3702
Reddit,ethereum,2024-10-29 13:01:37,2024-11-02 12:16:52.022401,weekly discussion thread buildinghello rethereum welcome new weekly discussion thread building space developer entrepreneur enthusiast showcase project share idea seek feedback greater ethereum community share project whether youre developing decentralized application dapp launching new layer 2 network working ethereum infrastructure encourage share detail project please provide concise overview including purpose current status link information provide xtwitter youtube link post automatically filtered engage collaborate thread excellent opportunity connect likeminded individual application tester feel free ask question offer feedback seek collaboration safety reminder encourage sharing collaboration please cautious potential scam avoid connecting wallet unfamiliar application without thorough research utilizing wallet tool offer transaction simulation eg rabby walletguard help ensure safety fund never give seed phrase private key looking forward hearing pushing ethereum ecosystem forward p devcon soon nov 1215 ticket sold apply waitlist herehttpsdevconorgentickets,0.9908,0.25606060606060604,0.623430303030303
Reddit,ethereum,2024-11-02 06:01:07,2024-11-02 12:16:52.022401,daily general discussion november 02 2024welcome today daily general discussion please use thread discus ethereum topic news event even price yes trying something new allow price discussion thread price discussion posted elsewhere subreddit continue removed always keep friendly follow sub rule ticker eth,0.8442,0.10189393939393938,0.4730469696969697
Reddit,ethereum,2024-11-01 17:22:47,2024-11-02 12:16:52.022401,u treasury office discus tokenization u treasury,0.3818,0.0,0.1909
Reddit,ethereum,2024-11-02 00:39:34,2024-11-02 12:16:52.022401,latest week ethereum news,0.0,0.5,0.25
Reddit,ethereum,2024-11-01 19:19:25,2024-11-02 12:16:52.022401,rabbit hole explorer guide,0.0,0.0,0.0
Reddit,ethereum,2024-11-01 15:27:19,2024-11-02 12:16:52.022401,ethereum monthly dashboardoctober steady month ethereum staking ending 344 million eth staked 49k validators currently entry queue month hasnt introduced significant change staking metric there plenty exciting work underway ethereums future development preparation pectra full swing vitalik buterin released thoughtprovoking post potential future ethereum protocol httpsxcometh_everstakestatus1851640585746026531httpsxcometh_everstakestatus1851640585746026531 httpspreviewredditdax01tlz5byd1pngwidth1943formatpngautowebpsca3d28d9ec985e216ab44d818aa4e73243bb4a23 data source dashboard compiled using metric following source httpsbeaconchainhttpsbeaconchain httpswwwvalidatorqueuecomhttpswwwvalidatorqueuecom httpsultrasoundmoneyhttpsultrasoundmoney httpsexplorerratednetworkhttpsexplorerratednetwork youre looking engage ethereum ecosystem consider everstake staking solution start little 01 eth unlock new opportunity within network httpseverstakeonelinkstakeethereumhttpseverstakeonelinkstakeethereum stay tuned update,0.8445,0.10368457300275478,0.4740922865013774
Reddit,ethereum,2024-11-01 13:56:14,2024-11-02 12:16:52.022401,18 day activation queue holesky something big brewing eth staking httpspreviewredditkwfa1wk1payd1pngwidth2824formatpngautowebpscf194f89d8043bde3deb46912a04e4eb4cbbaffb httpspreviewredditcbwoza4tpayd1pngwidth1614formatpngautowebps2f9499f245c79d318b1bb4b01408482484107393 okay weird tried set validator holesky testnet noticed id wait 18 day activation doublechecked queue 32033 validators httpsholeskybeaconchainwaiting testnet somethings definitely cooking whats even interesting massive queue started forming right eip7002 beacon state root evm proposal hit testnet familiar proposal essentially enables smart contract verify beacon chain state crucial many staking innovation looking github discussion discord channel ive noticed lot activity around dvt distributed validator technology implementation restaking protocol liquid staking solution new staking pool mechanism im particularly intrigued dvt testing activity recent lido simpledvt csm discussion implementing validator splitting dvt solution seeing project like ssv others actively testing holesky make wonder closer seeing productionready dvt implementation think anyone else noticed unusual testnet activity think tested scale,0.9393,0.1320409982174688,0.5356704991087344
Reddit,ethereum,2024-11-01 18:28:23,2024-11-02 12:16:52.022401,aggregation atomization dependency funding round dynamicsnew article aggregation atomization dependency funding round dynamic read full piecehttpstrentmirrorxyzia1ssxww6q_0gsewhpdpt0wbsoadcfq23yaxnn4sxa summary term public good diluted dependency might better roundbased funding mechanism incentivize atomization avoid failed develop standard rigor use public good term applies everything describes nothing dependency better ethereum software ecosystem crucial bit infrastructure directly maintained actor recurring funding round come tradeoff attention game eligibility scoping high expectation evaluator atomization incentive reflecting op retro round 5 incentivizing atomization legibility impact stewardship le legible good reason misconception level pg funding httpspreviewredditzlkqaqpd2cyd1pngwidth3720formatpngautowebps74616256a8524d67ed4bb9c4314835f3cc0047bd possible modification round remove cap allocation give special consideration project large number beneficiary cap project per round explicitly weight number beneficiary allocation formula topic include public good v dependency impact allocator common uoptimismhttpsxcomoptimism retro round 5 protocolguildhttpsxcomprotocolguild ethereum core protocol gitcoinhttpsxcomgitcoin octantapphttpsxcomoctantapp,0.9647,0.08901477832512314,0.5268573891625615
Reddit,ethereum,2024-11-01 06:01:40,2024-11-02 12:16:52.022401,daily general discussion november 01 2024welcome today daily general discussion please use thread discus ethereum topic news event even price yes trying something new allow price discussion thread price discussion posted elsewhere subreddit continue removed always keep friendly follow sub rule ticker eth,0.8442,0.10189393939393938,0.4730469696969697
Reddit,ethereum,2024-11-01 12:29:43,2024-11-02 12:16:52.022401,codex enables durable archive ethereum,0.0,0.0,0.0
Reddit,ethereum,2024-10-31 14:25:40,2024-11-02 12:16:52.022401,ethereum wont reach real adoption solve mobile wallet problem here quick story trench first bit context guess people use crypto primarily via desktop wallet like metamask dont use crypto way youd use cash app revolut everyday payment 10 small tx per day truth people spend nonwork time mobile scrolling youtube instagram whatsapp want ethereum reach significant consumer adoption mobile experience must great people used troubleshooting stuff mobile irritating plus people asia africa mobilefirst even talk weve building kiwi like 15 yr idea stay open ethereumaligned mean havent set sign google embedded wallet powered privy capsule others havent even built android apple app pwa app everyone use since app primarily focused people reading discussing ethereumrelated content mobile experience important u unfortunately mobile wallet dont work ive flying around world attend conference istanbul la saw people getting onboarded app used rainbow coinbase wallet metamask many wallet metamask basically doesnt work time rainbow sometimes break coinbase wallet used best redirect people create passkey wallet confusing kiwi many user similar problem established apps like zora say ah yeah normal figure get front laptop imagine trying onboard user app circumstance last year cofounder even made viral thread testing different mobile wallet since lot changed httpsxcomtimdaubstatus1673591390687690753httpsxcomtimdaubstatus1673591390687690753 ethereum community doesnt care ux vitalik even said one talk decentralized open linux android time consistent user experience apple steve job still alive saw hell going mobile wallet connection hed ban crypto wallet appstore forever wallet something need work 999999 time cant build consumer crypto apps real adoption wallet work 80 time sad reality thats making adoption much harder reason everyone excited embedded wallet go around obvious bug solution either dapp get vendor locked user create send money new wallet without identity onchain history whole idea en onchain history one place hot wallet question keep happening maybe complex people use different browser firefox chrome opera wallet must compatible desktop wallet work 9999 time solved merge imagine would found way connect mobile wallet reliably 15 year mobile wallet connectivity problem still omnipresent,0.9021,0.11306277056277056,0.5075813852813853
Reddit,ethereum,2024-11-01 12:20:20,2024-11-02 12:16:52.022401,looking web3crypto game winter showcasehey looking crypto game put winter showcase detail showcase winter web3 gaming showshttpskappggglitchfungameshowsd03ad1779d8d4d4baa4ff93021d17ed4viewstandalone detail include game yet complete participate event marketing material wishlist page ready creator stream play game providing valuable opportunity promote developer encouraged stream creator discus game realtime developer also participate 11 interview discus creative process preorders sale bundled allowing consumer purchase multiple game one transaction offer incentive player random crypto drop live stream host contest around shortform content encourage signups playtesting engage player testing unreleased game please apply share web3 game feel free leave questionscomments,0.9826,-0.1575757575757576,0.4125121212121212
Reddit,ethereum,2024-11-01 00:24:23,2024-11-02 12:16:52.022401,core devs consensus acdc 145 protocol call,0.0,0.0,0.0
Reddit,ethereum,2024-10-31 17:12:57,2024-11-02 12:16:52.022401,devcon schedule live ethereum foundation blog,0.0,0.13636363636363635,0.06818181818181818
Reddit,ethereum,2024-11-01 13:22:54,2024-11-02 12:16:52.022401,video left hate crypto josh,-0.5719,-0.4,-0.48595
Reddit,ethereum,2024-10-31 22:44:11,2024-11-02 12:16:52.022401,argot collective credibly neutral home ethereum core infrastructure,0.0,0.4,0.2
Reddit,ethereum,2024-10-31 06:01:13,2024-11-02 12:16:52.022401,daily general discussion october 31 2024welcome today daily general discussion please use thread discus ethereum topic news event even price yes trying something new allow price discussion thread price discussion posted elsewhere subreddit continue removed always keep friendly follow sub rule ticker eth,0.8442,0.10189393939393938,0.4730469696969697
