MainSource,Source,Publication Date,Pull_date,Pre-Processed Text,Sentiment_Vader,Sentiment_TextBlob,Average_Sentiment
RSS,https://cointelegraph.com/rss,2024-11-02 11:37:18+00:00,2024-11-02 12:16:52.022401,nft sale surge 18 alltime volume solana nears 6b nfts recorded monthly sale volume 356 october 18 increase september record,0.3182,0.0,0.1591
RSS,https://cointelegraph.com/rss,2024-11-02 11:00:00+00:00,2024-11-02 12:16:52.022401,brics pay matter brics pay seek lessen reliance u dollar reducing sanction risk fostering sovereign financial system transaction,-0.4215,0.0,-0.21075
RSS,https://cointelegraph.com/rss,2024-11-02 10:22:09+00:00,2024-11-02 12:16:52.022401,u store chain sheetz expands crypto payment via flexa sheetz expanded partnership flexa accept btc eth stablecoin payment 750 location u,0.4588,0.0,0.2294
RSS,https://cointelegraph.com/rss,2024-11-02 09:33:15+00:00,2024-11-02 12:16:52.022401,cardano ada price week ada gain largely coincide conclusion fourth cardano summit among catalyst,0.5267,0.10714285714285714,0.3169214285714285
RSS,https://cointelegraph.com/rss,2024-11-02 07:39:17+00:00,2024-11-02 12:16:52.022401,crypto volatility may spike u election close call falconx analyst warns volatility could emerge u election result close trader relieved giving market firmer ground,0.5574,0.0,0.2787
RSS,https://cointelegraph.com/rss,2024-11-02 07:23:40+00:00,2024-11-02 12:16:52.022401,mutant ape nft ripoff creator forfeit 14m avoids prison mutant ape planet creator aurelien michel pleaded guilty defrauding investor avoided prison sentence,-0.9042,-0.5,-0.7021
RSS,https://cointelegraph.com/rss,2024-11-02 06:00:00+00:00,2024-11-02 12:16:52.022401,safepal launch telegram crypto wallet visa card support safepals new mini wallet app enable 950 million telegram user create individually owned compliant cryptofriendly swiss bank account firm said,0.5859,-0.02121212121212122,0.28234393939393937
RSS,https://cointelegraph.com/rss,2024-11-02 05:09:16+00:00,2024-11-02 12:16:52.022401,coinbase find 03920 examples039 fdic telling bank avoid crypto coinbases chief legal officer declares content shameful example government agency trying cut financial access lawabiding american company,-0.7184,0.06666666666666667,-0.3258666666666667
RSS,https://cointelegraph.com/rss,2024-11-02 02:12:13+00:00,2024-11-02 12:16:52.022401,ubs launch tokenized fund put eth 039into heart039 tradfi move ubs launch tokenized fund ethereum like putting eth right heart traditional finance say one crypto commentator,0.7717,0.14285714285714285,0.4572785714285714
RSS,https://cointelegraph.com/rss,2024-11-01 21:30:13+00:00,2024-11-02 12:16:52.022401,judge push tornado cash cofounder trial april 2025 roman storm currently free bail facing three federal charge another four month prepare criminal trial,-0.0258,0.0,-0.0129
RSS,https://cointelegraph.com/rss,2024-11-01 21:11:35+00:00,2024-11-02 12:16:52.022401,low bitcoin price go bitcoin price 65 recent local high market analyst expect btc bottom 65000 69000 range,-0.2732,0.04,-0.1166
RSS,https://cointelegraph.com/rss,2024-11-01 21:08:45+00:00,2024-11-02 12:16:52.022401,crypto voter guide congressional legislation 2024 election 2024 united state election held nov 5 digital asset policy becomes growing concern among procrypto voter,0.7184,0.0,0.3592
RSS,https://cointelegraph.com/rss,2024-11-01 21:00:00+00:00,2024-11-02 12:16:52.022401,crypto biz crypto industry face fresh round layoff week crypto biz explores coinbases earnings reddits sale crypto holding circle new fee structure institutional investor highvolume trader,0.3182,0.07878787878787878,0.1984939393939394
RSS,https://cointelegraph.com/rss,2024-11-01 20:53:52+00:00,2024-11-02 12:16:52.022401,zkproofs affordable legacy id system cysic founder according world bank data estimated one billion individual worldwide lack official identification credential,-0.3182,0.0,-0.1591
RSS,https://cointelegraph.com/rss,2024-11-01 20:51:24+00:00,2024-11-02 12:16:52.022401,huawei integrates digital yuan harmonyos next 1b user need download pull app pay chinese cbdc huawei phone,-0.1027,0.0,-0.05135
RSS,https://cointelegraph.com/rss,2024-11-01 20:38:18+00:00,2024-11-02 12:16:52.022401,frenchman behind trump polymarket pump political agenda wsj polymarket data showed four account reportedly controlled french national théo bet roughly 38 million donald trump win u electoral college popular vote,0.765,0.15,0.4575
RSS,https://cointelegraph.com/rss,2024-11-01 20:36:05+00:00,2024-11-02 12:16:52.022401,ignoring blockchain may cost politician poll digital chamber ceo u election approach crypto advocate warn opposing blockchain could shortsighted resisting internet 90 potentially costing politician key support,-0.1027,0.0,-0.05135
RSS,https://cointelegraph.com/rss,2024-11-01 19:16:26+00:00,2024-11-02 12:16:52.022401,kalshi roll betting market ahead u election usbased prediction market vying catch industry leader polymarket,0.0,0.0,0.0
RSS,https://cointelegraph.com/rss,2024-11-01 19:13:08+00:00,2024-11-02 12:16:52.022401,here happened crypto today need know happened crypto today latest news daily trend event impacting bitcoin price blockchain defi nfts web3 crypto regulation,0.0,0.25,0.125
RSS,https://cointelegraph.com/rss,2024-11-01 19:00:00+00:00,2024-11-02 12:16:52.022401,tether ceo mica concern buterin purge ethereum inefficiency finance redefined concern europe upcoming mica regulation vitalik buterins plan make ethereum efficient main focus crypto investor week,0.4215,0.16666666666666666,0.2940833333333333
RSS,https://cointelegraph.com/rss,2024-11-01 18:03:25+00:00,2024-11-02 12:16:52.022401,price analysis 111 btc eth bnb sol xrp doge ton ada avax shib market started selloff bitcoin need hold 70000 btc altcoin rally continue,0.0,0.0,0.0
RSS,https://cointelegraph.com/rss,2024-11-01 17:52:53+00:00,2024-11-02 12:16:52.022401,21shares file form s1 sec spot xrp etf asset manager became third firm apply listing trading share spot xrp etf following canary capital bitwise,0.5719,-0.07500000000000001,0.24844999999999998
RSS,https://cointelegraph.com/rss,2024-11-01 17:33:46+00:00,2024-11-02 12:16:52.022401,depin xyo launch solana xyos native token tradable token including sol usdc solananative decentralized exchange jupiter raydium,0.0,0.0,0.0
RSS,https://cointelegraph.com/rss,2024-11-01 17:15:24+00:00,2024-11-02 12:16:52.022401,temasekbacked blockchain vc firm start new investment fund report temasek stateowned investment company singapore currently total portfolio value approximately 288 billion,0.3976,-0.11590909090909092,0.14084545454545455
RSS,https://cointelegraph.com/rss,2024-11-01 16:56:25+00:00,2024-11-02 12:16:52.022401,u treasury blockchain improve financial system u treasury especially keen distributed ledger technology payment settlement clearing,0.807,0.0,0.4035
RSS,https://cointelegraph.com/rss,2024-11-01 16:38:03+00:00,2024-11-02 12:16:52.022401,vc roundup web3 funding hit 54b 2024 blockchainbased startup raised 14 billion third quarter bringing investment yeartodate 54 billion,0.0,0.0,0.0
RSS,https://cointelegraph.com/rss,2024-11-01 16:04:02+00:00,2024-11-02 12:16:52.022401,nansen highlight aifueled nodefi gpufi depin investment nansen take detailed look emerging opportunity web3powered investor new report,0.6369,0.2681818181818182,0.4525409090909091
RSS,https://cointelegraph.com/rss,2024-11-01 15:09:26+00:00,2024-11-02 12:16:52.022401,u fed think bitcoin ban could preserve deficit spending ban bitcoin even suggestion part thought experiment bound chafe crypto community,-0.872,0.0,-0.436
RSS,https://cointelegraph.com/rss,2024-11-01 14:54:27+00:00,2024-11-02 12:16:52.022401,bitcoin trader eye key level u job shock sends btc price past 71k bitcoin basks nonfarm payroll data miss btc price action canceling trip 69000,-0.4939,-0.049999999999999996,-0.27195
RSS,https://cointelegraph.com/rss,2024-11-01 14:54:18+00:00,2024-11-02 12:16:52.022401,bitcoin still hit 100k matter win u election prospect favorable regulation bitcoins hedge status mean bitcoin weather election result even reach 100000,0.8519,0.24375000000000002,0.547825
RSS,https://bitcoinmagazine.com/.rss/full/,2024-11-01 22:25:58+00:00,2024-11-02 12:16:52.022401,coinbase embarrassing buying bitcoincoinbase fumbling obvious stop buying back share start stacking sat already,-0.3818,0.0,-0.1909
RSS,https://bitcoinmagazine.com/.rss/full/,2024-11-01 17:59:39+00:00,2024-11-02 12:16:52.022401,bitcoin time high postponed please hodlwho win election dictate see new time high,0.6486,0.3140909090909091,0.4813454545454545
RSS,https://bitcoinmagazine.com/.rss/full/,2024-11-01 16:50:43+00:00,2024-11-02 12:16:52.022401,bitcoins price matter lotits okay excited bitcoin hitting new alltime high fact pumped,0.5267,0.29284090909090904,0.40977045454545447
RSS,https://bitcoinmagazine.com/.rss/full/,2024-11-01 15:47:09+00:00,2024-11-02 12:16:52.022401,mathematically forecasting peak bitcoin price next bull cycle bitcoins bull cycle price prediction historical pattern tell u next peak,0.0,0.0,0.0
RSS,https://bitcoinmagazine.com/.rss/full/,2024-11-01 14:47:51+00:00,2024-11-02 12:16:52.022401,basically nothing got 500 bitcoinproducts like lolli fold like hack make stacking sat easy,0.7845,0.43333333333333335,0.6089166666666667
RSS,https://bitcoinmagazine.com/.rss/full/,2024-10-31 17:14:57+00:00,2024-11-02 12:16:52.022401,whitepaper simplest idea profoundthe bitcoin whitepaper barely describes tiny portion bitcoin protocol vaguely bit cover important,0.2023,-0.012499999999999997,0.09490000000000001
RSS,https://bitcoinmagazine.com/.rss/full/,2024-10-31 15:50:26+00:00,2024-11-02 12:16:52.022401,latest fake satoshi fake bitcoin creator needthe newest fake satoshi nakamoto refreshing reminder medium need stop looking bitcoins creator,-0.8885,-0.1,-0.49424999999999997
RSS,https://bitcoinmagazine.com/.rss/full/,2024-10-31 10:26:18+00:00,2024-11-02 12:16:52.022401,today bitcoins birthdayyes bitcoin first proposed via satoshis white paper october 31 2008 doesnt mean today bitcoins birthday,0.0,-0.020833333333333332,-0.010416666666666666
RSS,https://bitcoinmagazine.com/.rss/full/,2024-10-31 05:00:00+00:00,2024-11-02 12:16:52.022401,forget vampire werewolvesthe scariest costume halloween money printerforget dracula werewolvesthis halloween real terror come fiat currency money printer costume inflation haunt wallet bitcoin step hero save u horror currency debasement,-0.5994,0.2,-0.19970000000000002
RSS,https://bitcoinmagazine.com/.rss/full/,2024-10-30 16:03:50+00:00,2024-11-02 12:16:52.022401,bitcoin popularity index bpi measure bitcoin interest around worldthe bitcoin popularity index unique tool measuring global bitcoin interest google search data highlighting key adoption trend,0.9042,0.125,0.5146
RSS,https://bitcoinmagazine.com/.rss/full/,2024-10-30 15:31:04+00:00,2024-11-02 12:16:52.022401,david marcus paypal president bitcoin believerleading team lightspark david marcus poised make lightning network biggest payment network world,0.25,0.0,0.125
RSS,https://bitcoinmagazine.com/.rss/full/,2024-10-30 10:18:46+00:00,2024-11-02 12:16:52.022401,bitcoin best year ever 2024 breakthrough year wed long waited,0.6369,0.475,0.5559499999999999
RSS,https://bitcoinmagazine.com/.rss/full/,2024-10-29 16:55:39+00:00,2024-11-02 12:16:52.022401,bhutan another country using bitcoin escape povertya first hand look effect bhutan bitcoin policy,0.5994,0.25,0.4247
RSS,https://bitcoinmagazine.com/.rss/full/,2024-10-29 14:07:04+00:00,2024-11-02 12:16:52.022401,21 million fashion make bitcoin clothes worth sats21 million fashion bitcoin clothing brand combine fashion crypto get best,0.7269,0.65,0.68845
RSS,https://bitcoinmagazine.com/.rss/full/,2024-10-28 18:14:48+00:00,2024-11-02 12:16:52.022401,trump momentum big rig bitcoin candidate wini think game democrat,-0.128,-0.2,-0.164
RSS,https://bitcoinmagazine.com/.rss/full/,2024-10-28 18:07:42+00:00,2024-11-02 12:16:52.022401,money electric distracted nonsenseas someone wrote book origin story bitcoin felt still watch money electric perhaps comment take even watching purpose waste time,-0.6369,-0.2,-0.41845
RSS,https://bitcoinmagazine.com/.rss/full/,2024-10-28 16:55:34+00:00,2024-11-02 12:16:52.022401,ark could potentially learn lightninga rough idea ark service provider could manage liquidity efficiently create cheaper smoother experience user,0.5859,-0.05,0.26794999999999997
RSS,https://bitcoinmagazine.com/.rss/full/,2024-10-28 13:37:29+00:00,2024-11-02 12:16:52.022401,bitcoin wont let transcend politicsbitcoin escape hatch stop caring political process,0.4019,0.0,0.20095
RSS,https://bitcoinmagazine.com/.rss/full/,2024-10-25 18:46:16+00:00,2024-11-02 12:16:52.022401,microsoft invests bitcoin likely via spot etfsmicrosofts management may choose invest bitcoin etf holding coin,0.0,0.0,0.0
RSS,https://bitcoinmagazine.com/.rss/full/,2024-10-25 18:26:24+00:00,2024-11-02 12:16:52.022401,satoshi nakamoto statue lugano inspiring luganos new disappearing satoshi nakamoto statue beautiful tribute bitcoins anonymous founder,0.7717,0.4954545454545454,0.6335772727272727
RSS,https://bitcoinmagazine.com/.rss/full/,2024-10-25 15:18:08+00:00,2024-11-02 12:16:52.022401,lightspark announces new bitcoin l2 upgraded uma capabilitieslightspark unveils new bitcoin l2 broadens functionality universal money address uma standard release uma extend uma auth uma request,0.1779,0.06818181818181818,0.12304090909090909
RSS,https://bitcoinmagazine.com/.rss/full/,2024-10-25 14:08:20+00:00,2024-11-02 12:16:52.022401,bitcoin repeating previous bull cyclesare repeating pattern accustomed time something different,0.0,-0.08333333333333333,-0.041666666666666664
RSS,https://bitcoinmagazine.com/.rss/full/,2024-10-24 17:20:48+00:00,2024-11-02 12:16:52.022401,blackrocks ibit bitcoin etf successful new etf 4 yearsinstitutional investment bitcoin getting started,0.5859,0.4431818181818182,0.5145409090909091
RSS,https://bitcoinmagazine.com/.rss/full/,2024-10-24 13:10:15+00:00,2024-11-02 12:16:52.022401,ecb economist arent exactly wrong bitcoin theyre uselessa recent paper ecb author claim existence bitcoin could impoverish nonholders latecomer drew ire many bitcoiners isnt essentially hyperbitcoinization,0.3724,0.0,0.1862
RSS,https://bitcoinmagazine.com/.rss/full/,2024-10-24 13:01:06+00:00,2024-11-02 12:16:52.022401,jack dorsey influence bitcoin learned jack dorsey provides 60 bitcoin core funding think need decentralize support,0.4019,0.0,0.20095
RSS,https://bitcoinmagazine.com/.rss/full/,2024-10-23 12:00:06+00:00,2024-11-02 12:16:52.022401,shielded csv protocol revolutionary design blockchains compatible bitcoin,0.0,0.0,0.0
RSS,https://bitcoinmagazine.com/.rss/full/,2024-10-23 08:39:07+00:00,2024-11-02 12:16:52.022401,bitcoin fait accomplibitcoin longer experimental new project decade ago still fail,-0.5423,-0.08787878787878789,-0.31508939393939395
RSS,https://bitcoinmagazine.com/.rss/full/,2024-10-22 20:56:50+00:00,2024-11-02 12:16:52.022401,prediction market pricing trump victory good bitcoinif prediction market correct probitcoin trump shoein white house,0.4404,0.35,0.3952
RSS,https://bitcoinmagazine.com/.rss/full/,2024-10-22 18:52:36+00:00,2024-11-02 12:16:52.022401,spoonful bitcoin mary poppins awakens u financial sovereignty mary poppins mr bank journey rigid conformity joyful liberation mirror transformative power bitcoin discovers true wealth lie freedom invited rethink relationship money embrace financial sovereignty bitcoin offer,0.9423,0.11666666666666665,0.5294833333333333
RSS,https://bitcoinmagazine.com/.rss/full/,2024-10-22 16:00:00+00:00,2024-11-02 12:16:52.022401,metric matter lightning networka look valuable metric measuring effectiveness lightning network routing payment,0.4939,0.0,0.24695
RSS,https://bitcoinmagazine.com/.rss/full/,2024-10-22 15:19:15+00:00,2024-11-02 12:16:52.022401,bitcoin yield dollar yes please trusted u bitcoin exchange river offer bitcoin yield dollar bitcoin interest cash feature great addition platform bitcoin enthusiast normies alike,0.9493,0.8,0.87465
RSS,https://bitcoinmagazine.com/.rss/full/,2024-10-22 14:41:14+00:00,2024-11-02 12:16:52.022401,bitaxe opensource bitcoin mining movementbitaxe founder skot created first ever opensource asicbased bitcoin miner he inspired 4000 others contribute opensource bitcoin mining project,0.6369,0.25,0.44345
RSS,https://bitcoinmagazine.com/.rss/full/,2024-10-22 14:35:40+00:00,2024-11-02 12:16:52.022401,world largest prediction market polymarket trump biased clear polymarket lean protrump aware,0.128,0.175,0.1515
RSS,https://bitcoinmagazine.com/.rss/full/,2024-10-22 11:00:26+00:00,2024-11-02 12:16:52.022401,microstrategy ceo michael saylor reveals bitcoin mstr plansome argue selfcustody nothing else core bitcoin fact trust one hold safeguard wealth,0.7717,0.0,0.38585
RSS,https://bitcoinmagazine.com/.rss/full/,2024-10-21 21:14:47+00:00,2024-11-02 12:16:52.022401,6 step move old 401k bitcoin irathe latest guide unchained offer stepbystep instruction transferring 401k ira ahead next bull run,0.0,0.19999999999999998,0.09999999999999999
RSS,https://bitcoinmagazine.com/.rss/full/,2024-10-21 16:45:52+00:00,2024-11-02 12:16:52.022401,upside world spook hero hero spooksdistorted perception reality completely inverted perception acting best interest bitcoin versus acting interest way put bitcoin risk,0.946,0.275,0.6105
RSS,https://bitcoinmagazine.com/.rss/full/,2024-10-21 16:37:09+00:00,2024-11-02 12:16:52.022401,ecb get wrong bitcoin recent paper researcher european central bank make handful claim bitcoin lack context nuance andor evidence im shed light got wrong,-0.8176,-0.09999999999999999,-0.4588
RSS,https://bitcoinmagazine.com/.rss/full/,2024-10-21 11:00:00+00:00,2024-11-02 12:16:52.022401,kamala presidency could bullish bitcoina trump victory almost certainly ensures one outcome crypto security continue flourish unchecked,0.5434,0.21428571428571427,0.37884285714285715
RSS,https://bitcoinmagazine.com/.rss/full/,2024-10-18 21:06:20+00:00,2024-11-02 12:16:52.022401,bitcoin make new alltime highkey psychological barrier bitcoins fight 70000,-0.4767,0.06818181818181818,-0.20425909090909092
RSS,https://bitcoinmagazine.com/.rss/full/,2024-10-18 18:50:32+00:00,2024-11-02 12:16:52.022401,el salvador survey show bitcoins lindy effect actionslowly surely el salvador way mass bitcoin adoption,0.4404,0.5,0.4702
RSS,https://bitcoinmagazine.com/.rss/full/,2024-10-18 16:25:23+00:00,2024-11-02 12:16:52.022401,bitcoin model perfection doesnt need improvementthe idea bitcoin need improve perfect state decentralized money delusional thinking model perfect state automobile,0.9325,1.0,0.96625
RSS,https://bitcoinmagazine.com/.rss/full/,2024-10-18 11:28:15+00:00,2024-11-02 12:16:52.022401,bitcoin mempool drama predictablethe mempool drama predictable given brewing culture war monetary maximalist purist season 2 pragmatist,-0.5994,-0.2,-0.39970000000000006
RSS,https://bitcoinmagazine.com/.rss/full/,2024-10-17 17:35:36+00:00,2024-11-02 12:16:52.022401,live election day coverage bitcoinersthe firstever election day livestream event tailored specifically bitcoiners going live 3pm est november 5th,0.0,0.13636363636363635,0.06818181818181818
RSS,https://bitcoinmagazine.com/.rss/full/,2024-10-17 16:34:21+00:00,2024-11-02 12:16:52.022401,succeed bitcoin need something new samereplicating type service application legacy world bitcoin necessitates interacting legacy world giving leverage bitcoin,0.6808,0.13636363636363635,0.40858181818181816
RSS,https://bitcoinmagazine.com/.rss/full/,2024-10-16 19:24:11+00:00,2024-11-02 12:16:52.022401,elizabeth warren prof democrat still bitcointhe bitcoin industry could yet another four year harassment attack kamala harris elected president,-0.765,0.0,-0.3825
RSS,https://bitcoinmagazine.com/.rss/full/,2024-10-16 16:48:11+00:00,2024-11-02 12:16:52.022401,shinobi gaza powerful demonstration bitcoin since wikileakswhat happening gaza fact bitcoin way deliver aid gazans point one powerful demonstration bitcoin decade,0.7506,0.3,0.5253
RSS,https://bitcoinmagazine.com/.rss/full/,2024-10-16 13:00:00+00:00,2024-11-02 12:16:52.022401,bitcoins false dichotomy sov moebitcoins use store value mean exchange mutually exclusive,0.4404,-0.35625000000000007,0.042074999999999974
RSS,https://bitcoinmagazine.com/.rss/full/,2024-10-15 20:25:38+00:00,2024-11-02 12:16:52.022401,art surveillance ripcaches radical take bitcoin amsterdama qa privacy ownership unstoppable rise decentralized art world watchful eye,-0.2023,0.0,-0.10115
RSS,https://bitcoinmagazine.com/.rss/full/,2024-10-15 16:00:24+00:00,2024-11-02 12:16:52.022401,corva bitcoin reduce racismharvard professor robert putnams research extrapolated show identifying bitcoiner actually reduce racism,-0.6249,0.0,-0.31245
RSS,https://bitcoinmagazine.com/.rss/full/,2024-10-15 14:07:43+00:00,2024-11-02 12:16:52.022401,president harris buy bitcoin pay black american reparationsa bitcoin stockpile could onceinacentury chance pay back reparation without taxation seriously,0.1823,-0.125,0.028649999999999995
RSS,https://bitcoinist.com/feed/,2024-11-02 11:30:13+00:00,2024-11-02 12:16:52.022401,turkish investor shift focus crypto outshines real estate 2024 investment trendsa cryptocurrency exchange called paribu recently conducted survey highlighting notable trend turkey increasing preference crypto traditional investment option stock real estate 2024 cryptocurrency awareness perception survey survey involved interview 2002 individual familiar crypto 541 interview actively trading digital asset market,0.5859,0.12685185185185185,0.35637592592592593
RSS,https://bitcoinist.com/feed/,2024-11-02 10:00:44+00:00,2024-11-02 12:16:52.022401,bitcoin mining take center stage argentina central bank here whythe central bank argentina bcra unveiled unique art exhibition héctor carlos janson historical numismatic museum bitcoin spotlight exhibition titled art artificial intelligence future economy mark first instance globally actual destroyed currency various nation showcased alongside operational bitcoin,-0.0258,-0.007499999999999995,-0.016649999999999998
RSS,https://bitcoinist.com/feed/,2024-11-02 07:00:56+00:00,2024-11-02 12:16:52.022401,kraken sack 15 staffa strategic pivot growth risky gamblean american cryptocurrency exchange announced streamline operation make change organizational structure aim become world largest crypto platform part change kraken crypto exchange downsize workforce least 15 related reading ada star cardano founder say market,0.2023,-0.09999999999999999,0.05115000000000001
RSS,https://bitcoinist.com/feed/,2024-11-02 06:00:12+00:00,2024-11-02 12:16:52.022401,dogecoin price completes october green here historical data say novemberfollowing bitcoins recent bullish trajectory dogecoin price ended october green marking secondhighest monthly return october since 2014 according cryptoranks historical data november unfolds investor market expert eager see month store popular meme coin market sentiment high,0.6486,0.05142857142857143,0.35001428571428567
RSS,https://bitcoinist.com/feed/,2024-11-02 04:30:32+00:00,2024-11-02 12:16:52.022401,bitcoin market sentiment enters extreme greed zone mean btcdespite facing strong resistance 73000 price level leading notable price drop thursday remarkable week upside movement trader investor still betting bitcoin demonstrating persistent demand crypto asset bitcoin extreme greed territory few month investor sentiment around bitcoin witnessed,0.2057,0.13154761904761905,0.1686238095238095
RSS,https://bitcoinist.com/feed/,2024-11-02 03:00:30+00:00,2024-11-02 12:16:52.022401,satoshi nakamoto unmasked pr agency claim raise skepticismfor 10 year mystery satoshi nakamoto captured attention fascination crypto user general public around world satoshi nakamotos white paper peertopeer electronic cash system became basis bitcoin spawned similar project development however nakamoto suddenly disappeared limelight,0.3182,0.010000000000000004,0.1641
RSS,https://bitcoinist.com/feed/,2024-11-02 01:30:12+00:00,2024-11-02 12:16:52.022401,machine learning algorithm predicts 109 surge shiba inu price timeline shockingthe shiba inu price seen slight decline past 24 hour suggesting trader may taking profit recent price rally peaked 000001972 dip however hasnt dampened overall bullish outlook meme coin according prediction coincodex machine learning algorithm shiba,0.4404,-0.10416666666666666,0.1681166666666667
RSS,https://bitcoinist.com/feed/,2024-11-02 00:00:40+00:00,2024-11-02 12:16:52.022401,sec crackdown cost crypto firm 426 million genslers compliance mandate hit hardblockchain association cryptofocused lobby group announced crypto company spent around 426 million fighting lawsuit filed u security exchange commission sec chief gary gensler related reading youtuber mrbeast make 23 million crypto scam shocking allegation emerge october 31st report partnership harrisx,-0.8074,-0.25,-0.5287
