MainSource,Source,Publication Date,Pull_date,Pre-Processed Text,Sentiment_Vader,Sentiment_TextBlob,Average_Sentiment
Reddit,solana,2024-12-21 14:27:17,2024-12-24 12:19:06.881210,losing way much bullx feesthere probably lot post ive seen seriously trouble understanding fee ive trade ive place 3050 trade im losing like 1020 fee dont see possible slippage 1 problem much money really need use per trade even still taking like 3040 dont understand im losing much fee edit yes guy right think bribe gas fee set 001 believe didnt think lot traded test added couple zero bribe gas seems lot better thank,0.0987,0.1732142857142857,0.13595714285714286
Reddit,solana,2024-12-22 01:42:20,2024-12-24 12:19:06.881210,bullx wont refresh automaticallyas title say constantly refresh bullx show new coin even update chart ive tried syncing time trying microsoft edge ect,0.0,0.06818181818181818,0.03409090909090909
Reddit,solana,2024-12-22 01:54:53,2024-12-24 12:19:06.881210,dexscreener slowthe candle dont match whats trojanbot wallet pretty annoying im new space tip would appreciated also slippage buying selling using trojan bot,0.5859,-0.05340909090909092,0.2662454545454545
Reddit,solana,2024-12-20 21:54:20,2024-12-24 12:19:06.881210,randomly received little sol wallethas happened anyone else,0.0,-0.34375,-0.171875
Reddit,solana,2024-12-21 22:36:20,2024-12-24 12:19:06.881210,anyone help thisit asks pin never pin phantomwhat,0.4019,0.0,0.20095
Reddit,solana,2024-12-21 21:59:04,2024-12-24 12:19:06.881210,need rust web development want start learning develop dapps solana full stack j developer specified next j node j start learning rust get started developing solana dapps good also solana devnet purchase token sell similar eth smart contract,0.7096,0.2528571428571428,0.4812285714285714
Reddit,solana,2024-12-21 18:39:49,2024-12-24 12:19:06.881210,happened lawsuit read lawsuit solana sec relate etf filing,-0.4215,-0.1,-0.26075
Reddit,solana,2024-12-22 06:39:54,2024-12-24 12:19:06.881210,nobody answer ask buy sell slippage trojan walleta noob want answer man,0.0258,0.0,0.0129
Reddit,solana,2024-12-21 23:42:32,2024-12-24 12:19:06.881210,pumpfun n00b questioni connected phantom wallet pumpfun pc transferred fund phantom app pumpfun gambled coin ready withdrawal solana gain see absolutely withdrawal send option anywhere someone help plz transfer solana back phantom wallet possible send gemini,0.7778,0.1,0.4389
Reddit,solana,2024-12-21 19:35:04,2024-12-24 12:19:06.881210,pick token wallet scanningso im trying build wallet scanner scan top trader tried going using birdeyes api among top trader gave many scam huge pnl close 0 balance even even pnl checked address gmgn website tried way came across dexwhales gave top trader given token problem arised selecting token many include doubt ill grateful guy help 1 include token impactful dont miss top trader 2 select top player 24h token pro con 3 change approach yes note main objective make script return top trader actually authentic fake thankyou,0.1906,0.29047619047619044,0.24053809523809522
Reddit,solana,2024-12-21 14:07:45,2024-12-24 12:19:06.881210,bullx freeze chrome inactivewhen different tab open bullx go back 5 minute bullx tab page refreshes cause froze im inactive dont get alert bullx page frozen 5 minute problem photon gmgn idea,-0.5248,0.0,-0.2624
Reddit,solana,2024-12-21 11:50:13,2024-12-24 12:19:06.881210,trying buy solana phantom cant find currency try use dollar workim afraid payment go wont receive anything due currency difference,0.0,-0.3625,-0.18125
Reddit,solana,2024-12-20 22:22:16,2024-12-24 12:19:06.881210,kraken stole 1 solana meso today wanted deposit 32 solana account sent solana noticed account 1 solana balance margin account since see got scared immediately withdraw solanas back see image 31 solana since minus one solana gave 31 keeping 1 solana cover misterious minus position point investigate transaction guess transaction happened 28 day ago show today 1pm sense click show explorer show done 22nd november old transaction probably mine confirmed yet pop stole 1 solana account transaction already happened paid 28 day ago happen scammed one famous cex ridiculous kind error system dangerous,-0.7783,0.05185185185185185,-0.3632240740740741
Reddit,solana,2024-12-21 10:40:05,2024-12-24 12:19:06.881210,desktop bot trade solcan recommend actual desktop program tradesnipe sol support private node none telegram bot crap paid one,0.7494,-0.26666666666666666,0.24136666666666665
Reddit,solana,2024-12-21 08:02:06,2024-12-24 12:19:06.881210,bridging usdc pol solsuccessfully added solana snap metamask wallet participate kamino usdc need usdc solana rather polygon chain metamask wallet properly connected solflare httpssolflarecombridgehttpssolflarecombridge pick usdc position pick pol position example anybody experienced recommendation,0.0,0.4,0.2
Reddit,solana,2024-12-21 06:59:58,2024-12-24 12:19:06.881210,help connecting solflare wallet pumpim using chrome connected solflare wallet metamask extention transfer 2 try connect solflare wallet pump popup window solflare asks confirm connection brings back loading screen pump telling confirm wallet stuck anyone else issue,0.1779,0.0,0.08895
Reddit,solana,2024-12-21 06:17:54,2024-12-24 12:19:06.881210,buy 175k worth solana transfer trezor safe 5 would gas fee especially bull run anyone experience transferring lot solana trezor exchange gas fee,0.5859,0.26666666666666666,0.42628333333333335
Reddit,solana,2024-12-21 09:37:23,2024-12-24 12:19:06.881210,best setting quick buy sell trojan bot tip context im extremely new space want know slippage buying sell slippage absolute quickness dont mind losing money better buysell position also u guy track meme coin noticed dexscreener fairly laggy ive literally hitting refresh trojan bot see much money quick trade candle dex slow better way tip would appreciated,0.9437,0.3457300275482094,0.6447150137741047
Reddit,solana,2024-12-21 04:21:18,2024-12-24 12:19:06.881210,staking reward going inactive stake bucketim staking sol blocksmith recently new reward started going inactive stake total leaving active stake unchanged presume inactive mean generating reward happening fix,0.9334,-0.07736742424242424,0.42801628787878787
Reddit,solana,2024-12-21 03:25:24,2024-12-24 12:19:06.881210,introducing shdwdrive v2 thoughtful phased rollout better experience,0.6705,0.45,0.56025
Reddit,solana,2024-12-21 02:07:18,2024-12-24 12:19:06.881210,cant anything wallet hey guy havent used wallet macbook month log cant send token even sol cant even check private key link wallet anywhere nothing pay gold someone gon na help,0.4581,0.0,0.22905
Reddit,solana,2024-12-20 22:22:05,2024-12-24 12:19:06.881210,solflare phantom walleti want get trading sol mobile wallet choose,0.0772,0.0,0.0386
Reddit,solana,2024-12-21 03:44:20,2024-12-24 12:19:06.881210,add nonevm network like solana metamask android appim pretty new cryptocurrency understand metamask support ethereumbased network however add nonevm network using snap tell snap arent available android app wanted ask plan add support future also way add solana platform android app posting posted metamask subreddit dm became full scammer,0.8779,0.22727272727272724,0.5525863636363636
Reddit,solana,2024-12-20 16:13:25,2024-12-24 12:19:06.881210,arent getting lunch money stolen automated botsi want preface disclaimer im trying learn might hilariously wrong missing several point understand im likely making mistake ignorance malice bias front im building automated trading system rust im going sell isnt ad read herehttpswwwredditcomralgotradingcomments1h6ljbvrust_trading_platform_from_scratch_update_2 ive working ive browsing solscan data repos im fairly new blockchainweb3solana trying learn much possible looking money move around ecosystem helpful writing code directly interacts watching ive watched lot sniper auto trader dumper bot site found analyzed trade data put win rate 90100 didnt believe napkin analysis noted went youtube look top memecoin trader looked folk follow kinda laughed 99 vibe based entirely gambling kind silly honestly im trying insulting want gamble meme coin go seems like sometimes work really seems like since gambling folk manually almost entirely vibe based there fair bit losing trade id assume mostly losing trade bot 90100 win rate manual trader presumably lot le manual trader gambler basically providing liquidity scooting price bot right lot trader saw copy trading seems like tactic lot bot use said make close sense run strat manually theyre watching window smashing button every time see popular wallet position theyre half dozen coin could fairly trivially automated across wider variety coin one automating using myriad different hosted open source solution seems kinda weird strategy thats easy automate especially since automating trade pool trader making trade nuke alpha zero question 1 assumption correct 2 many memecoin trader trading manually strategy super easy automate 3 use someone el service take fairly little effort learn requisite amount python typescript automate youre already staring screen 12 hour day trying catch next pump learn code automate away 4 plainly obvious lot trader providing liquidity bot,0.972,0.16765460729746443,0.5698273036487322
Reddit,solana,2024-12-20 23:19:36,2024-12-24 12:19:06.881210,jito bundling v jito tipsi working trading bot time implemented jito tip speed transaction landing ive reading jito bundling well unsure whether implement program simply swap sol given token vice versa jito bundling benefit im sending 1 transaction every,0.4767,0.0,0.23835
Reddit,solana,2024-12-20 20:03:33,2024-12-24 12:19:06.881210,fund stolen phantom walletyesterday noticed fund missing phantom wallet transferred another unknown wallet havent given away seed phrase password anyone majority swapping ive done within wallet month ago used swapping jupiter get random meme coin airdrop though possible got hacked clicking one honestly dont recall anything could jeopardized account reported phantom im assuming money gone right nothing ughhh suck know keep main fund wallet separate separate wallet transaction swapping feel terrible quick search show many ppl hacked without even knowing insight please,-0.7347,0.008571428571428558,-0.36306428571428573
Reddit,solana,2024-12-19 18:37:24,2024-12-24 12:19:06.881210,aaaaaaaaaaaaaaaaaaaaaaaaaaaaa,0.0,0.0,0.0
Reddit,solana,2024-12-20 22:01:34,2024-12-24 12:19:06.881210,transferring token new wallet minimize risk fund drained scammerlets say scammer might access wallet plan drain creating new wallet sending holding new wallet eliminate chance scammer access drain fund possible track new wallet make current one,-0.1027,0.0909090909090909,-0.005895454545454551
Reddit,solana,2024-12-20 15:15:53,2024-12-24 12:19:06.881210,massive new update star atlas playable early access game key epic game store,0.0,-0.06623376623376624,-0.03311688311688312
Reddit,solana,2024-12-21 03:40:32,2024-12-24 12:19:06.881210,sol meme coin creation created coin tried launch wont launch tried adding liquidity creating open market book wont launch minimum amount sol need lp launch tried launching minum think like 1 2 wont launch tried multiple different website add lp missing wrong,0.3612,-0.13999999999999999,0.11060000000000002
Reddit,solana,2024-12-21 02:45:26,2024-12-24 12:19:06.881210,wish could trade solana dont feel comfortable giving full social security number exchange service solution screwed,-0.0613,0.2611111111111111,0.09990555555555557
Reddit,solana,2024-12-20 20:03:28,2024-12-24 12:19:06.881210,usds work read itinfo google minimal,0.0,-0.1,-0.05
Reddit,solana,2024-12-20 17:04:22,2024-12-24 12:19:06.881210,sonicsvm injective collaborate create first crosschain smart agent hub bridging solana injective ecosystem top altcoins,0.6808,0.32142857142857145,0.5011142857142857
Reddit,solana,2024-12-20 17:51:29,2024-12-24 12:19:06.881210,lightspeed podcast solana need fix max resnick,0.0,0.0,0.0
Reddit,solana,2024-12-20 17:49:44,2024-12-24 12:19:06.881210,solana validator education firedancer v0 frankendancer operational guide,0.0,0.0,0.0
Reddit,solana,2024-12-20 09:19:53,2024-12-24 12:19:06.881210,solana getting etf whats current status etf solana,0.0,0.0,0.0
Reddit,solana,2024-12-20 17:22:35,2024-12-24 12:19:06.881210,portal platform connects user liquidity every chain coming solanasource httpsxcomportalcoinstatus1869452869273010603httpsxcomportalcoinstatus1869452869273010603 bringing portalhttpsxcomsearchq24portalsrccashtag_click solanahttpsxcomsolana make web3 borderless beyond excited building one web3s fastest network portal infrastructure making web3 accessible everyone creating universal liquidity next leap forward 13 httpspreviewreddit08q4f7pxe18e1pngwidth680formatpngautowebpsd7e9c102182cf5974339d22cfdce2e3f47204ae8 holder able bridge portalhttpsxcomsearchq24portalsrccashtag_click solana via portal hub well become liquidity provider earn fee via partner meteoraaghttpsxcommeteoraag onboarding best solana portal ecosystem watch space 23 cant wait build solana community solve crosschain distribution sol apps solana apps game feature portal hub use portal pay connect sol ecosystem evm user liquidity via hyperway 33,0.8834,0.2642857142857143,0.5738428571428571
Reddit,solana,2024-12-20 18:33:50,2024-12-24 12:19:06.881210,ca deployer address token photon mean blank address lp creator address,0.0,-0.15625,-0.078125
Reddit,solana,2024-12-20 18:27:23,2024-12-24 12:19:06.881210,sol trading campaignwhat ithey yall new crypto still learning term like solana bought couple token get started sol trading campaign popped competition see buy sol given period idk campaign sorry,0.2023,-0.18181818181818182,0.010240909090909092
Reddit,solana,2024-12-20 22:08:55,2024-12-24 12:19:06.881210,like solana faucet gas fee im trying withdraw bullx apparently need least 002 soso basically sent crypto bullx neo want withdraw 001763 sol showing error since le 002 like faucet give small amount solana proceed withdrawal,0.4019,-0.16666666666666666,0.11761666666666666
Reddit,solana,2024-12-20 18:04:03,2024-12-24 12:19:06.881210,solanafloor podcast pulse future wearable reward solana,0.5719,0.0,0.28595
Reddit,solana,2024-12-20 18:01:34,2024-12-24 12:19:06.881210,empire podcast luca netz pudgy penguin airdrop roundup,0.0,0.0,0.0
Reddit,solana,2024-12-20 17:52:45,2024-12-24 12:19:06.881210,midcurve podcast vision jito ep 31,0.25,0.0,0.125
Reddit,solana,2024-12-20 01:10:37,2024-12-24 12:19:06.881210,crypto fraud fake pumping getting controlhey everyone dont know lately feel like crypto space overrun fraud manipulation witnessing explosion fake pump sniping outright scam making harder regular investor confidence market first let talk sniping practice targeting coin artificially inflating price false misleading information selling gain momentum leaving unsuspecting holder stuck worthless asset longer bad actor feel like trend worst part platform often fail act quickly enough prevent there fake pumping coordinated effort artificially inflate price cryptocurrency using bot paid shill spread hype become common tactic especially lowcap coin vulnerable manipulation unfortunately pumpers cash price plummet one left holding bag often one got late hype frustrating rogue trader largest exchange influencers project seemingly turning blind eye even profiting manipulation wonder many new investor getting burned dont know solution think start better regulation accountability crypto ever going gain mainstream adoption respectability need take stand kind behavior time community hold scammer manipulator accountable action anyone else seeing thing lately feel direction market heading let talk stay safe,-0.9723,-0.22378787878787879,-0.5980439393939394
Reddit,solana,2024-12-20 17:09:54,2024-12-24 12:19:06.881210,dont hold solana yet came across video would like hear thought solana httpswwwyoutubecomwatchvysji_d0agkchttpswwwyoutubecomwatchvysji_d0agkc,0.3612,0.0,0.1806
Reddit,solana,2024-12-20 17:08:00,2024-12-24 12:19:06.881210,go reclaim sol photon,0.0,0.0,0.0
Reddit,solana,2024-12-20 14:54:48,2024-12-24 12:19:06.881210,ama pudgy penguin luca netz dec 21 0230 pm utc ask question,0.0,0.0,0.0
Reddit,solana,2024-12-20 14:08:25,2024-12-24 12:19:06.881210,scared death nowi opened trust wallet saw 0 sol usdcsol found refresh trust wallet show second also transaction solscan show real amount still scare anyone know whats problem trust wallet bug ecosystem show normal btw,-0.4215,0.11666666666666665,-0.15241666666666667
Reddit,solana,2024-12-20 17:00:45,2024-12-24 12:19:06.881210,succinctlabs expands sp1 zkvm solana verifier bringing scalable zeroknowledge proof solana ecosystemsource httpsxcomsuccinctlabsstatus1868733490998788338httpsxcomsuccinctlabsstatus1868733490998788338 attention manlets bringing zk talent solanahttpsxcomsolana httpsredditcomlink1hio9ctvideoy63g644ta18e1player 2 zkps emerging theme solana ecosystem helping application unlimited scalability via network extension largescale zk coprocessing onchain privacy verifiable credential confidential amms httpsxcomsolanastatus1865799989663805464httpsxcomsolanastatus1865799989663805464 httpspreviewreddit249i01ixa18e1pngwidth627formatpngautowebpsec9af7133a264af24c395246b92568c314377ca5 3 today excited launch sp1 solana verifier sp1 turbocharged zkvm make developing zkps easy 1 write verifiable program rust 2 generate proof succinct prover network 3 verify solana using sp1_solana verifier crate httpsgithubcomsuccinctlabssp1solanahttpstcosicivzj0xo 4 top solana builder building sp1 uterminaxyzhttpsxcomterminaxyz building svm network extension stack soon_svmhttpsxcomsoon_svm building svm rollup stack zk fraud proof aeriuslabshttpsxcomaeriuslabs making svm zkprovable spicenetiohttpsxcomspicenetio unified composable liquidity layer enabled zk twinexyzhttpsxcomtwinexyz built zk solana light client part multisettlement rollup 5 interested using zk solana get started sp1 solana today httpsblogsuccinctxyzsolanasp1httpsblogsuccinctxyzsolanasp1 httpspreviewredditrbi1h3v3b18e1pngwidth680formatpngautowebpsc9335b7ea599dfd4df9722be43374a0452a239ff,0.9001,0.3916666666666667,0.6458833333333334
Reddit,solana,2024-12-19 16:52:57,2024-12-24 12:19:06.881210,else developing hypomanicdepression disorder trading memecoins solana ive trading meme coin lately thought id seen im married cuban woman honestly believed nothing could volatile mood swingsuntil met meme coin one minute im riding high euphoric wave moon next im plummeting abyss think investing cumshot good idea hypomanic episode basically 3 staring chart like hold secret universe brain whisper youre genius definitely next bitcoin spoiler alert inevitable crash happens well let say mood swing sponsored company bring get rich quick scheme im waiting day therapist suggests diversify portfolio emotion tried investing happiness stable coin anyone else riding meme coin wave juggling mental health let commiserate share ridiculous trading story remember youre going lose money least smile manic laugh face sincerely man cry shower,0.9686,0.15472222222222223,0.5616611111111112
Reddit,solana,2024-12-20 16:22:25,2024-12-24 12:19:06.881210,introducing echo crypto meet xsource httpsxcomsayechooostatus1869436428180168735httpsxcomsayechooostatus1869436428180168735 introducing echo crypto meet x start toda httpsredditcomlink1hinefxvideoynifxkg6418e1player join wave httpsayechoxyzhttpstcoe2oo0j6pbq httpspreviewreddit4ep39438418e1pngwidth679formatpngautowebps39e6f57624d2a482be687589d172e79fc3653060 game play send 1 collect wave token usdc amount 1 1 tap start chain send 1 usdc someone x httpspreviewredditkyq6p2hd418e1pngwidth680formatpngautowebps985404280ecd45864cff18cdca4485eadebce972 2 user must keep going sending 1 usdc someone else x httpspreviewreddite0aks4ze418e1pngwidth679formatpngautowebpsb02d5882a05b738d4b22a2cafc44867c8438a456 3 youre added chain youll see waiting httpspreviewredditrdvrfemg418e1pngwidth680formatpngautowebps486e4d5bf1a2450708152a4f467608f8d2657e94 4 time chain grows amount wave increase 100 earlier chain higher reward httpspreviewreddit3sgo4ixi418e1pngwidth679formatpngautowebpsf40bd99443d9f624167317930200d30f1086c255 win timer run participant top 3 chain win glhf,0.9584,0.325,0.6417
Reddit,solana,2024-12-20 06:00:26,2024-12-24 12:19:06.881210,meme overshadow practical use case solanahello everyone lately ive noticed meme narrative seem dominate conversation around solana dont get wrong meme culture great community building brand visibility exciting use case like defi web3 gaming rwa dao etc often get overshadowed meme frenzy im wondering imbalance meme practical application could hold solana back future actually part strategy make dominant force blockchain space bitcoin im curious know people thought,0.8969,0.024999999999999998,0.46095
Reddit,ethereum,2024-12-17 13:01:18,2024-12-24 12:19:06.881210,weekly discussion thread buildinghello rethereum welcome weekly discussion thread building space developer entrepreneur enthusiast showcase project share idea seek feedback greater ethereum community share project whether youre developing decentralized application dapp launching new layer 2 network working ethereum infrastructure encourage share detail project please provide concise overview including purpose current status link information provide xtwitter youtube link post automatically filtered engage collaborate thread excellent opportunity connect likeminded individual application tester feel free ask question offer feedback seek collaboration safety reminder encourage sharing collaboration please cautious potential scam avoid connecting wallet unfamiliar application without thorough research utilizing wallet tool offer transaction simulation eg rabby walletguard help ensure safety fund never give seed phrase private key looking forward hearing pushing ethereum ecosystem forward,0.9908,0.26694214876033057,0.6288710743801653
Reddit,ethereum,2024-12-24 07:01:04,2024-12-24 12:19:06.881210,daily general discussion december 24 2024welcome ethfinance daily general discussion rethereum httpsimgurcom3y7vezphttpsimgurcom3y7vezp please use thread discus ethereum topic news event even price price discussion posted elsewhere subreddit continue removed rethereum mullet tech front page party daily iin word technical big news item go front page rethereum pricesmemestweetsoff topic go daily always constructive ticker eth subreddit ruleshttpswwwredditcomrethereumaboutrules also rethstaker incredible community dedicated staking need advice getting set head assistance ethfinance ethereum community link discord ev maverickshttpsdiscordggevmavericks ethereum twitterhttpsxcomethereum ethfinance twitterhttpsnitternetethfinancer evmavericks youtubehttpswwwyoutubecomevmavericks ethfinance doots podcasthttpsevmaverickslibsyncom daily doots websitehttpsdailydootscom ethereum jobshttpsethereumorgencommunitygetinvolvedethereumjobs get reddit doots extensionhttpsgithubcometheralphaethfinanceextension uhanniabu see fellow dooters everywhere reddit calendar courtesy week ethereumhttpsweekinethereumnewscom jan 20 ethereum protocol attackathon end jan 2426 eth pondy puducherry hackathon jan 3031 ethereumzurichhttpethereumzurich conference feb 79 eth oxford hackathon feb 1016 ethiopia conference hackathon feb 23 mar 2 ethdenver apr 25 eth bucharest hackathon conference apr 46 ethglobal taipei hackathon may 910 ethbratislava conference hackathon may 911 ethdam amsterdam conference hackathon may 911 ethlisbon hackathon may 2729 ethprague conference may 30 jun 1 ethglobal prague hackathon jun 38 eth belgrade conference hackathon jun 1213 protocol berg berlin conference jun 1618 dappcon berlin jun 2628 ethcluj romania conference jun 30 jul 3 ethcc cannes conference jul 46 ethglobal cannes hackathon jul 1619 napuleth napoli conference aug 1517 ethglobal new york hackathon sep 2628 ethglobal new delhi hackathon nov ethglobal devconnect hackathon,0.7951,0.10606060606060604,0.45058030303030305
Reddit,ethereum,2024-12-24 09:59:35,2024-12-24 12:19:06.881210,ethereum break 10million active l2s address,0.4019,-0.13333333333333333,0.1342833333333333
Reddit,ethereum,2024-12-24 10:18:50,2024-12-24 12:19:06.881210,made merry xmas card send friend family onchain nfts custom message custom design mint cost also l2s,0.7717,0.0,0.38585
Reddit,ethereum,2024-12-24 09:53:10,2024-12-24 12:19:06.881210,grayscale diversifies 22 crypto trust including defi ai sector,0.5106,0.0,0.2553
Reddit,ethereum,2024-12-23 16:09:19,2024-12-24 12:19:06.881210,ethereumrelated content ive found interesting last week stuff found interesting anurag arjun concerned people concerned ethereumhttpsxcomanuragarjunstatus1868704216396529767 consequence eip7623 dapp buildershttpsethereummagiciansorgteip7623increasecalldatacost1864749utimdaub rm say btc relic pasthttpsparagraphxyzrmbtcarelicofthepast daniel fernandes criticizes ethereums reliance centralized platformshttpsparagraphxyzdferneththecommunicationparadoxreferrer0xc304eef1023e0b6e644f8ed8f8c629fd0973c52d eff share know joining blueskyhttpswwwefforgdeeplinks202412whatyoushouldknowwhenjoiningbluesky im sharing ive curating ethereumfocused newsletterhttpsparagraphxyzkiwiweeklykiwinewsrecap75 year thought id share interesting read find,0.8979,0.375,0.63645
