MainSource,Source,Publication Date,Pull_date,Pre-Processed Text,Sentiment_Vader,Sentiment_TextBlob,Average_Sentiment
Reddit,solana,2025-01-27 23:55:09,2025-01-28 12:18:29.785325,sorry nobody care anything getting scammedit said way many post fell honeypot got wallet drained etc trading meme coin complaining fault investing largely unregulated market without proper research someone fallen trap say nothing done lost money please stop complaining,-0.7676,0.05357142857142857,-0.3570142857142857
Reddit,solana,2025-01-28 04:59:14,2025-01-28 12:18:29.785325,think sol killing ethas eths fee gas extremely high basically eth value hasnt changed much year think sol killing eth,-0.8126,0.18,-0.3163
Reddit,solana,2025-01-28 11:16:14,2025-01-28 12:18:29.785325,peak sol experience dogwiftools rugged ruggersbasically title shit hilarious fuck tool made rugging rugged rugger lmaoo,-0.6597,-0.03333333333333335,-0.34651666666666664
Reddit,solana,2025-01-28 09:25:21,2025-01-28 12:18:29.785325,told pyrate sailing stronggood day crew cannoneer qvr another pyrate update number making wave turnaround begun last post pyrate already climbed 13m fast forward weve surged 185m momentum undeniable closing ath 3m december kind growth reclaiming surpassing previous high horizon reversal ship full steam ahead httpspreviewredditfknptw98dpfe1jpgwidth1255formatpjpgautowebps006fe05f486216ea3b51b23dc0653d162f94f6ae catbats biggest holder one word advice pyrate sfn biggest holder believer since start isnt holding strong he ready take thing access 100k fund sfn prepared help pyrate grow push u next level dedication speaks volume project potential whats possible community team work together whats next dev team community working tirelessly weve got exciting development lined setting liquidity farm pool improve liquidity create stronger support project growth make trading smoother attract investor size nfts coming soon nft collection already fully drawn ready minted holding waiting grow bit launch maximum impact benefit everyone involved httpspreviewreddit9m1r37mcdpfe1jpgwidth1265formatpjpgautowebpsee20d3de9e08d3e8c32e6e0034b135bff64e4924 clear pyrate getting started momentum building opportunity ahead huge whether youre whale dipping toe there place everyone aboard ship contract address 5odbsfh3kkhfncy6kai7ykm7da9b55kk9wgy4fh8gsfh telegram pyrate aiming higher ever cannon ready fire part crew part ship,0.9899,0.17925925925925928,0.5845796296296296
Reddit,solana,2025-01-28 10:23:10,2025-01-28 12:18:29.785325,u looking eth holder,0.0,0.0,0.0
Reddit,solana,2025-01-28 09:49:27,2025-01-28 12:18:29.785325,wallet buy boughthey guy recently bought small memecoin dont judge little gamble traded bit sold top bought realized sometimes 5 wallet bought instantly bought like 1 second later small cap coin low volume easy track thats know happened three time timespawn two day look like 5 wallet bundled something strategy behind concerned,0.765,-0.014015151515151515,0.37549242424242424
Reddit,solana,2025-01-28 11:54:55,2025-01-28 12:18:29.785325,expert meme coin make guy choose coin buywhat guy look buying meme coin volume chart something else generic check,0.0,0.0,0.0
Reddit,solana,2025-01-27 15:22:28,2025-01-28 12:18:29.785325,feel rn sick tired,-0.7351,-0.5571428571428572,-0.6461214285714285
Reddit,solana,2025-01-28 09:23:20,2025-01-28 12:18:29.785325,everyones strategy selling taking profitshow people approaching taking profit people still holding hope thing go higher bull run nearly come end getting started would like hear people thought,0.8074,0.11666666666666665,0.46203333333333335
Reddit,solana,2025-01-28 12:18:29,2025-01-28 12:18:29.785325,solana transaction failso ive trying buy crypto website since yesterday solana transaction keep failing solana wallet even tried send back exchange convert ethereum even doesnt work idea make work,-0.5106,0.0,-0.2553
Reddit,solana,2025-01-28 11:31:18,2025-01-28 12:18:29.785325,wallet open account deposit sol close itis kind money laundering technique trying make coin harder track point behaviour look like deleted solana explain please,0.802,0.16666666666666666,0.48433333333333334
Reddit,solana,2025-01-28 11:30:47,2025-01-28 12:18:29.785325,solana x cardano integration send pyusd crosschain httpspreviewredditxc55r69xzpfe1pngwidth1920formatpngautowebps38cf17906439fcf87d73a70595f7cb261901bc6b big news solana ecosystem send pyusd paypals fullybacked nydfscompliant stablecoin directly solana cardano thanks wanchains newest integration try pyusd stablecoin bridge bridgewanchainorghttpbridgewanchainorg major milestone interoperability defi innovation seamless crosschain pyusd transfer bridge powered wanchain leader crosschain solution enhanced collaboration solana cardano ecosystem get better crosschain support sol ada horizon ability move native asset two major blockchains coming soon think mean solanas defi growth pyusd adoption let discus possibility comment,0.9571,0.08906249999999999,0.5230812499999999
Reddit,solana,2025-01-28 03:54:39,2025-01-28 12:18:29.785325,sol incinerator safeam safe continue using wallet linking sol incinerator,0.4404,0.5,0.4702
Reddit,solana,2025-01-28 11:20:37,2025-01-28 12:18:29.785325,question experienced player psychological side trading july 2021 1 sol 30 june 2022 1 sol 40 october 2023 1 sol 40 hello community couple question 1 manage go crazy rollercoaster maintaining cold blood 2 dont know really market price fall crypto hindsight bias hodl strategy applied july 2021 peak turn millionaire hodl apply know long term reward time imagine going red dot blue dot waiting 2 year half recover investment would really put uncomfortable position thanks time young crypto investor,0.2315,-0.03205128205128205,0.09972435897435898
Reddit,solana,2025-01-28 09:21:42,2025-01-28 12:18:29.785325,alternative cookie3 work sol address analytics tool analytics tool worth solana address let say list address want import get information asset activity etc similar cookie3 unfortunately support solana,0.6124,-0.06666666666666667,0.2728666666666667
Reddit,solana,2025-01-28 08:50:13,2025-01-28 12:18:29.785325,whats deal mev botsive joined free group telegram man constantly promoting solblaze mev bot free money without anything good true myman also deleted loss group bragging 3 digit x winning private 2 sol exact name xylo,0.7552,0.325,0.5401
Reddit,solana,2025-01-27 12:06:30,2025-01-28 12:18:29.785325,put 100 gmgnai ive made 30 profit 9 leftive done small 2 trade really lost 100 fee,0.079,-0.024999999999999994,0.027000000000000003
Reddit,solana,2025-01-27 06:44:51,2025-01-28 12:18:29.785325,help please scammedi never used seed phrase account recovery phrase anywhere someone log account steal money please help guy im paranoid idk saving lost 3uazrhgrccitufkaqbcicr5q45cyabsvvjzuap8zqbxj wallet money sent help,0.5859,0.0,0.29295
Reddit,solana,2025-01-26 22:52:12,2025-01-28 12:18:29.785325,eth maxi watching solana take crypto,0.0,0.0,0.0
Reddit,solana,2025-01-27 06:08:18,2025-01-28 12:18:29.785325,best wallet tracker solana walletsi need know best wallet alerter solana looked around tried option gmgn alert bot free option tried miss lot transaction solana raybot hobby option good cap 5000 transaction per day youre following around 50 wallet easily go daily limit cielo havent used bit expensive 60 per month 1000 transaction notfied per hour guy think wallet master expensive havent tried spybot similar rate raybot one guy recommend come transaction notification count overall cost effectiveness,0.9643,0.20999999999999996,0.5871500000000001
Reddit,solana,2025-01-27 20:24:53,2025-01-28 12:18:29.785325,honeypotgiving error message 5 smh,-0.6124,0.0,-0.3062
Reddit,solana,2025-01-28 04:26:26,2025-01-28 12:18:29.785325,solana dev help needed solana tutorial coursei trying follow course solana website always get error tried everythinbg doesnt workhttpssolanacomdeveloperscoursesintrotosolanaintrotowritingdatahttpssolanacomdeveloperscoursesintrotosolanaintrotowritingdatahttpssolanacomdeveloperscoursesintrotosolanaintrotowritingdatathis lesson herei always get error running code typescript course suggest nodeinternalmodulesrun_main129 triggeruncaughtexception error err_module_not_found find module eprojectssolanadevelopercoursecreatetransactionsonthesolananetworknode_modulesbinnode_modulessolanaweb3jslibindexcjsjs imported eprojectssolanadevelopercoursecreatetransactionsonthesolananetworknode_modulesbinesrun1738037857970tmpmjs mean import solanaweb3jslibindexcjsjs finalizeresolution nodeinternalmodulesesmresolve26511 moduleresolve nodeinternalmodulesesmresolve93310 defaultresolve nodeinternalmodulesesmresolve116911 moduleloaderdefaultresolve nodeinternalmodulesesmloader38312 moduleloaderresolve nodeinternalmodulesesmloader35225 moduleloadergetmodulejob nodeinternalmodulesesmloader22738 modulewrapanonymous nodeinternalmodulesesmmodule_job8739 link nodeinternalmodulesesmmodule_job8636 code err_module_not_found url fileeprojectssolanadevelopercoursecreatetransactionsonthesolananetworknode_modulesbinnode_modulessolanaweb3jslibindexcjsjs nodejs v20160 sure package installed root dirand used npm many time confirm itand checked packagejsonand name createtransactionsonthesolananetwork version 100 main indexjs script test echo error test specified exit 1 keywords author license isc description dependency solanadevelopershelpers 260 solanaweb3js 1980 esrun 3226 typescript 573,-0.7003,0.21354166666666666,-0.2433791666666667
Reddit,solana,2025-01-27 22:16:50,2025-01-28 12:18:29.785325,worth buy sol phoneit say preorder 500 much money airdrop get last time dont need extra phone free ordering,0.6369,0.18,0.40845
Reddit,solana,2025-01-27 10:51:01,2025-01-28 12:18:29.785325,regain confidence first 23k loss significant mei lost lot sol attempting future trading cut loss hour ago know stupid learnt lesson still depressed af know lot people say part initiation get past edit seeing market starting recover make much painful,-0.91,-0.16071428571428573,-0.5353571428571429
Reddit,solana,2025-01-27 22:48:13,2025-01-28 12:18:29.785325,anyone using limit order automated buyssellsnovas limit order efficient set trigger buy sell based price market cap im still figuring finetune target set tp yall set 2x cause ive used end going higher lool,0.4215,0.25,0.33575
Reddit,solana,2025-01-28 00:54:08,2025-01-28 12:18:29.785325,scam workwith following instruction accompanying instructional video someone explain scam done scammer access wallet contract address copied pasted withdraw everything work scam thanks here make purchase raydium exchange utilizing pump solana blockchain tap contract address copy open phantom wallet navigate browser tab located bottom right corner select raydium connect wallet set slippage value 2530 paste contract address swap tab click swap httpsredditcomlink1ibpd3uvideoyqzeg819tmfe1player,-0.7783,0.12142857142857143,-0.3284357142857143
Reddit,solana,2025-01-27 18:27:53,2025-01-28 12:18:29.785325,reliable bot memecoinswhat bot tool use memecoins nova bot seems solidany feedback,0.0,0.0,0.0
Reddit,solana,2025-01-28 00:24:28,2025-01-28 12:18:29.785325,using moonshot weekive using moonshot week initiated first withdrawal via debit card anyone know long take appear bank account,0.0258,0.1,0.0629
Reddit,solana,2025-01-27 17:47:52,2025-01-28 12:18:29.785325,guy learn hear memecoinsis social medium reddit etc promoted,0.4215,0.03333333333333333,0.22741666666666666
Reddit,solana,2025-01-27 23:37:04,2025-01-28 12:18:29.785325,get jito uuidseems impossible get day,0.0,-0.6666666666666666,-0.3333333333333333
Reddit,solana,2025-01-28 03:22:49,2025-01-28 12:18:29.785325,swapped base benji mother fund goneso made swap base benji towards mother solana first said trajectory waited clickable made said error try later confirmed transaction tried right confirmed everything worked fund never showed transaction id 0xd41b1be6dd7dd18c087507333bbc1d82106d5340770feeade2f533f61c4005bf help im truly clueless saw usdt end actived wallet nothing probably noob question huge amount would appreciate help,0.8046,0.016964285714285703,0.4107821428571428
Reddit,solana,2025-01-27 23:30:11,2025-01-28 12:18:29.785325,solcard used someone communitythis intended promote telegram page coin purely share cool project build solana blockchain,0.7698,0.28214285714285714,0.5259714285714285
Reddit,solana,2025-01-27 22:52:51,2025-01-28 12:18:29.785325,coinbase solana transfer issue fixedi wondering cuz didnt wan na buy sol yet,0.0,-0.2,-0.1
Reddit,solana,2025-01-27 22:39:39,2025-01-28 12:18:29.785325,someone please explain formula calculating marketcapconst marketcap virtualsolreserves 1_000_000_000 dividing 109 get sol like relation virtualsol reserve marketcap token also uniswap v3 current price calculated yx isnt working tried solrealsolvirtual tokenrealtokenvirtual yx formula doesnt seem working,0.5859,0.0,0.29295
Reddit,solana,2025-01-27 22:29:05,2025-01-28 12:18:29.785325,got scammed bullx bloomhttpspreviewredditabszr0nc4mfe1pngwidth680formatpngautowebps25dca7caea4b04b116ec17ab9bf20729e237a50c picture see spend 174 sell 100 entry thing recieved 31 selling 100 174 make sense look picture make sense lost soldt 100 thought atleast 100,-0.3182,0.0,-0.1591
Reddit,solana,2025-01-27 22:27:51,2025-01-28 12:18:29.785325,cryptonews spotlight podcast gaurav sharma cto ionet depin internet gpus ai integration,0.0,0.0,0.0
Reddit,solana,2025-01-27 22:26:33,2025-01-28 12:18:29.785325,im buying 1000 worth solana 8 going coinbase advanced,0.4404,0.35,0.3952
Reddit,solana,2025-01-27 22:25:14,2025-01-28 12:18:29.785325,empire podcast hidden cost usdc nathan mccauley charles cascarilla,0.0,-0.16666666666666666,-0.08333333333333333
Reddit,solana,2025-01-27 12:40:26,2025-01-28 12:18:29.785325,imported phantom walletive imported phantom wallet bullx neo realised shouldnt done also realised cant removed archived there like 5 phantom wallet havent started yet dont plan ive properly learnt make new phantom wallet use main current one imported site unsafe im aware exporting wallet site onto phantom safer thanks advance,0.802,0.12550505050505048,0.46375252525252525
Reddit,solana,2025-01-27 22:22:19,2025-01-28 12:18:29.785325,solfate podcast building investment dao star atlas buying 5m space ship w craig founder superphoenixdao,0.0,0.0,0.0
Reddit,solana,2025-01-27 22:20:34,2025-01-28 12:18:29.785325,index podcast bitcoin liquid staking solana synergy lombard jacob phillips,0.0,0.0,0.0
Reddit,solana,2025-01-27 22:18:22,2025-01-28 12:18:29.785325,solana validator education firedancer v0 setup hot backup,0.0,0.25,0.125
Reddit,solana,2025-01-27 22:17:56,2025-01-28 12:18:29.785325,solana core community call 23 ptoken,0.0,0.0,0.0
Reddit,solana,2025-01-27 22:17:15,2025-01-28 12:18:29.785325,solandy verified solana program solana tutorial dec 13th 24,0.0,0.0,0.0
Reddit,solana,2025-01-27 11:07:01,2025-01-28 12:18:29.785325,coinbase take 35 staking reward here keep,0.5719,0.0,0.28595
Reddit,solana,2025-01-27 17:21:29,2025-01-28 12:18:29.785325,need explanation pleasewhy happen especially new coin,0.0,0.2727272727272727,0.13636363636363635
Reddit,solana,2025-01-27 20:48:17,2025-01-28 12:18:29.785325,best liquidity provideri scouting liquidity provider choose token found raydium orca jupiter feedback system also possible create pool token 3 system time need choose one0,0.743,0.5,0.6214999999999999
Reddit,solana,2025-01-27 14:43:44,2025-01-28 12:18:29.785325,security important trading dexhey full disclosure work tokensight dex platform fully self custodial wallet wanted gather info trader sentiment need tailor app said feedback highly appreciated put security trading fund top 3 priority looking dex platform feature look dex use trade thanks advanced hope grow big open discussion benefit whole community dex platform free participate give feedback thought,0.9731,0.265,0.61905
Reddit,solana,2025-01-27 20:00:47,2025-01-28 12:18:29.785325,anyone see sniperoo getting shilled hereany conversation around bot exchange see bunch comment talking sniperoo seems super sus paranoid,0.4404,0.3333333333333333,0.3868666666666667
Reddit,solana,2025-01-27 19:13:01,2025-01-28 12:18:29.785325,many rugpulls pumpfunim curious many rug pumpfun manage make many whats process behind feel like there whole story honestly also think could using bundle liquidity farming bot rug make money im wondering thats part strategy theyre using pull,0.7783,0.2571428571428571,0.5177214285714286
Reddit,solana,2025-01-27 18:23:28,2025-01-28 12:18:29.785325,best holder tracker besides photoni mean holder amount tracker since photon doesnt show amount holder mobile site like geckoterminal dont track live,0.7717,0.2746212121212121,0.5231606060606061
Reddit,solana,2025-01-27 18:20:27,2025-01-28 12:18:29.785325,help understanding bot walletanyone know wallet attjqkxo1cyta2muxpartr382zyhpu5yx4wmmpvaa1oy solscan show crazy token balance birdeye doesnt even load wallet noob please dumb question,-0.2263,-0.4875,-0.3569
Reddit,solana,2025-01-27 17:59:39,2025-01-28 12:18:29.785325,introducing psyche nous research open infrastructure democratize decentralize development superintelligence humanitysource httpsxcomnousresearchstatus1883912370696704011httpsxcomnousresearchstatus1883912370696704011 recent ai breakthrough challenge status quo narrative closed mega lab ability push frontier superintelligence today announce nous psyche built solanahttpsxcomsolana cooperative training network generative ai psyche coordinate heterogeneous hardware join run train opensource model retell myth psyche mortal quest retribution divine odds httpsredditcomlink1ibffv3videoegdqriburkfe1player read blog post httpsnousresearchcomnouspsychehttpsnousresearchcomnouspsyche httpspreviewredditc3l8xp2irkfe1pngwidth505formatpngautowebps0383a90cdd15a136735d1964a615d5de9e6b1fd1 experiment psyche distroenabled training code github larger opensourced distributed training stack released alongside testnet httpsgithubcompsychefoundationpsychehttpsgithubcompsychefoundationpsyche httpspreviewreddit42iroojkrkfe1pngwidth680formatpngautowebpsd48954747d14b71a26eeaef7c15b1b058ee2019d apply attend nous research x solana foundation thursday nyc httpslumanousxsolanahttpslumanousxsolana httpspreviewredditxuezcj1orkfe1pngwidth680formatpngautowebpse70c3aa38ed723c36485c92b897e5debdbeb0dff,0.8126,-0.025,0.3938
Reddit,solana,2025-01-27 13:43:11,2025-01-28 12:18:29.785325,swapped phantom wallet sol plath transactioon shown solscan dexscreener worriedswapped phantom wallet sol plath transactioon shown solscan dexscreener worried looking transaction le last two showing phantom wallet show right number token looking transaction dexscreener show,-0.2263,0.14285714285714285,-0.041721428571428576
Reddit,solana,2025-01-26 18:05:37,2025-01-28 12:18:29.785325,48000 token day created pumpfun,0.25,0.0,0.125
Reddit,solana,2025-01-26 16:16:45,2025-01-28 12:18:29.785325,dev buy dev sell scamare memecoins developer basically scamming everyone literally every coin see made pumpfun developer sell 3040 second considered illegal scamming,-0.5574,-0.25,-0.4037
Reddit,solana,2025-01-27 11:25:23,2025-01-28 12:18:29.785325,opened nft ghost wallet dohey guy im newbie crypto wanted ask advice got unknown nft whatever loading screen phantom wallet wanted burn soon clicked disappeared everywhere status changed got dont collection whatever dont almost money wallet bit sol stacked wallet infected money 1 dollar im sorry dumb question thank lot,-0.8176,-0.325,-0.5713
Reddit,solana,2025-01-27 15:05:47,2025-01-28 12:18:29.785325,superteam uae announces solana economic zone dubaisource httpsxcomafscottstatus1883863334971465887httpsxcomafscottstatus1883863334971465887 announcing solana economic zone dubai httpspreviewreddit4zywmdw8xjfe1pngwidth506formatpngautowebps1142b7c2d4f39045c85587114b107e21403fe403,0.0,0.2,0.1
Reddit,solana,2025-01-27 14:07:14,2025-01-28 12:18:29.785325,enzabit crypto platformhey guy please support there site called enzabit thats selling solana higher original price basically send sol binance swap usdt send usdt binance tried worked first 5 transaction 6th processing queue 20 hour dumb enough go im panicking think got scammed saving someone help please,0.6249,0.1,0.36245
Reddit,solana,2025-01-27 19:44:05,2025-01-28 12:18:29.785325,cant swap tokenhi guy trading deepseek token highest market cap earlier last trade phantom started saying swap available due unsupported pair low liquidity low amount issue trade made 15 different trade liquidity problem 600k liquidity tried swap jupiter say error fetching route money stuck token going cant swap even though others still please help figure,-0.8074,0.03928571428571429,-0.3840571428571429
Reddit,solana,2025-01-27 13:27:31,2025-01-28 12:18:29.785325,cant see instant trade button bull xhello cant see instant trade button filter interface bullx thanks,0.4404,0.06666666666666667,0.25353333333333333
Reddit,solana,2025-01-27 13:20:01,2025-01-28 12:18:29.785325,using jupiter mobile app anybody know view price purchased solana im able view jupiter desktop website going transaction history view using jupiter app,0.0,0.5,0.25
Reddit,solana,2025-01-27 13:12:19,2025-01-28 12:18:29.785325,sol token stuck pumpfun bonding curvei put 5 creating shitty meme coin see platform work sold almost immediately sol sent bonding curve 5 buck whatever get sent back wallet buy httpssolscaniotx4nqcuwtdxixp6m9z4gbxgwgnrfycwu88zn1smr27nyjfuwz4stzubcsoqz7chq9f56exxgubhkfszjp9kmhxujkehttpssolscaniotx4nqcuwtdxixp6m9z4gbxgwgnrfycwu88zn1smr27nyjfuwz4stzubcsoqz7chq9f56exxgubhkfszjp9kmhxujke sell httpssolscaniotx3p9pgrznpfxm9fpq8ec2pcgfki7dv9jmk3epdnivptag2xgzyjw1md8hbdtrw8y854bdwvfz8excoxzt777b8yyphttpssolscaniotx3p9pgrznpfxm9fpq8ec2pcgfki7dv9jmk3epdnivptag2xgzyjw1md8hbdtrw8y854bdwvfz8excoxzt777b8yyp wallet httpssolscanioaccountcagdfqp6pmm7gtixkt76wvstnr5h9e7w2aw3vdge9f1bhttpssolscanioaccountcagdfqp6pmm7gtixkt76wvstnr5h9e7w2aw3vdge9f1b,-0.5267,0.0,-0.26335
Reddit,solana,2025-01-27 12:57:00,2025-01-28 12:18:29.785325,think devs selling scam harsh truth every newbie need learn,-0.6486,-0.2,-0.4243
Reddit,solana,2025-01-26 06:05:46,2025-01-28 12:18:29.785325,0 capital gain tax u based crypto projectsgood news like sol sui xrp,0.7096,0.0,0.3548
Reddit,solana,2025-01-27 14:14:47,2025-01-28 12:18:29.785325,love hate meme coin boosting solanas adoptioncredit picture chainalysishttpspreviewredditcv2kn25snjfe1pngwidth497formatpngautowebpse729628c1708ba1c6992b94cd5d7d243b09690d9 meme coin love em hate em actually good solanas ecosystem 50 trump melania holder totally new solana altcoins lot even created wallet day bought flood new retail buyer helping onboard fresh user bringing activity solana overall imo,0.8957,0.07474747474747473,0.48522373737373736
Reddit,solana,2025-01-27 09:49:30,2025-01-28 12:18:29.785325,tried trading meme coin here wentso decided give trading meme coin shot started kind mehi tried getting melania 6 hoping double money fomo kicked never used coinbase wallet phantom bit hassle sol imploding ended buying around 10 selling losing 400 checked kolscan pumpfun x usual suspect im genuinely happy people whove made money im another couple grand trading meme ive realized hard way successful player game hype train know exactly coin theyre getting use rest u liquidity youre part crowd still manage make money youre absolute legend anyway thats story anyone else better luck id love hear think ill stay sideline cheer little guy making juicy gain oh cry altseason,0.9732,0.17648809523809525,0.5748440476190476
Reddit,solana,2025-01-27 06:01:38,2025-01-28 12:18:29.785325,best cold wallet buy storagelooking suggestion best ledger buy storage little uncertainty surrounding hot wallet atm plus bag getting quite substancial guy recommend pro con recommendation,0.8766,0.2925,0.58455
Reddit,solana,2025-01-27 16:36:48,2025-01-28 12:18:29.785325,need help cant switch eth usdc cant swap send anywhere 200 eth usdc wont let swap send phantom,0.4019,0.0,0.20095
Reddit,solana,2025-01-27 08:14:34,2025-01-28 12:18:29.785325,develop something like thishttpsdunecomadam_tehcpumpfunhttpsdunecomadam_tehcpumpfun wan na make something like selfhosted cant find nice way dip toe solana develpoment know python happy learn rust lot stuff sidebar eg solana cookbook code typescript dont really want learn future project mine require speed rust better help resource find online use random apis cost money would slower rpcing node thanks,0.925,0.19999999999999998,0.5625
Reddit,solana,2025-01-26 18:40:23,2025-01-28 12:18:29.785325,coin get past botsafter briefly looking pumpfun seems overwhelmingly majority coin created immediately get bought bot two bot sell somewhere 39 sol gained usually take 15 minute get gain sell fuck chart kill coin lead come ask coin like fart coin unicorn fart dust etc make past get insane market cap idgi,-0.4404,-0.2357142857142857,-0.33805714285714283
Reddit,solana,2025-01-27 01:47:26,2025-01-28 12:18:29.785325,help memecoin platform fast manual trading bot whats popular fast telegram non telegram trading bot could use would easier create complete beginner coding anything else know getting started even im negative right fee im currently using coinbase buy crypto transfer phantom wallet make swap phantom also using maestro trading bot coin swapping 0006 sol gas buy sell think may bit high 1 trade,0.6908,0.15571428571428572,0.42325714285714283
Reddit,solana,2025-01-27 00:19:49,2025-01-28 12:18:29.785325,solayer scam site searchhi friend dad wanted stake sol told solayer good look 18 googled ended scam site asked phantom wallet password seed entered pw seed happen understand pw device phone unless scammer phone ok google solayer u see see scam site,-0.5859,0.6,0.007050000000000001
