MainSource,Source,Publication Date,Pull_date,Pre-Processed Text,Sentiment_Vader,Sentiment_TextBlob,Average_Sentiment
RSS,https://cointelegraph.com/rss,2024-12-23 11:57:47+00:00,2024-12-23 12:19:20.445400,nft promoter face fraud charge alleged 22m rug pull two 23yearolds gabriel hay gavin mayo allegedly abandoned project providing misleading information project roadmaps,-0.8591,-0.1,-0.47955
RSS,https://cointelegraph.com/rss,2024-12-23 11:06:28+00:00,2024-12-23 12:19:20.445400,usdx built support defi ecosystem growth hex trust ceo usdx hex trust integrates defi flare network offering 11 usd backing yield generation crosschain capability,0.9001,0.0,0.45005
RSS,https://cointelegraph.com/rss,2024-12-23 11:00:00+00:00,2024-12-23 12:19:20.445400,nfts 2024 surviving challenge embracing growth eyeing future nft project encountered numerous setback 2024 many remain hopeful asset class stage comeback,0.872,0.16666666666666666,0.5193333333333333
RSS,https://cointelegraph.com/rss,2024-12-23 08:24:44+00:00,2024-12-23 12:19:20.445400,botswana central bank flag 039minimal risk crypto urge regulation botswana central bank acknowledges minimal crypto risk highlight money laundering regulatory concern key priority,-0.2023,-0.025,-0.11365
RSS,https://cointelegraph.com/rss,2024-12-23 08:23:15+00:00,2024-12-23 12:19:20.445400,btc price risk 20k crash 5 thing know bitcoin week bitcoin trader rapidly adjust shortterm btc price outlook support fails btcusd head 100000,-0.5994,-0.5,-0.5497000000000001
RSS,https://cointelegraph.com/rss,2024-12-23 07:00:00+00:00,2024-12-23 12:19:20.445400,vasp license wont save anymore relying solely vasp license superficial compliance policy isnt enough,-0.3875,0.0,-0.19375
RSS,https://cointelegraph.com/rss,2024-12-23 05:54:00+00:00,2024-12-23 12:19:20.445400,phishing fear trade crypto event attendee detail revealed cointelegraph obtained data set sample packed sensitive information crypto conference attendee could treasure trove scammer,-0.25,0.1,-0.075
RSS,https://cointelegraph.com/rss,2024-12-23 05:28:39+00:00,2024-12-23 12:19:20.445400,italy fine openai 15m data protection privacy breach italy privacy watchdog ordered openai conduct sixmonth public awareness campaign promote chatgpt collect us data,0.5267,0.20833333333333334,0.36751666666666666
RSS,https://cointelegraph.com/rss,2024-12-23 05:05:48+00:00,2024-12-23 12:19:20.445400,metaplanet buy dip biggestever 620 bitcoin buy japanese investment firm metaplanet purchased 60 million worth bitcoin largest btc buy made since started acquiring cryptocurrency may,0.2263,0.033333333333333326,0.12981666666666666
RSS,https://cointelegraph.com/rss,2024-12-23 04:45:52+00:00,2024-12-23 12:19:20.445400,bitcoin see first major weekly price decline since trump election win bitcoin 10 reaching alltime high price 108135 dec 17,0.6808,0.318125,0.4994625
RSS,https://cointelegraph.com/rss,2024-12-23 03:26:20+00:00,2024-12-23 12:19:20.445400,saylor float u crypto framework 81t bitcoin reserve plan bitcoin bull michael saylor pitched u crypto framework saying strategic digital asset policy strengthen dollar neutralize country national debt,0.3182,0.0,0.1591
RSS,https://cointelegraph.com/rss,2024-12-23 02:37:55+00:00,2024-12-23 12:19:20.445400,australia barefoot investor take crypto scammer stealing likeness australian investing finance educator scott pape known barefoot investor broken secret behind whatsapp group crypto scam targeting facebook user,-0.8885,-0.30000000000000004,-0.59425
RSS,https://cointelegraph.com/rss,2024-12-23 00:54:58+00:00,2024-12-23 12:19:20.445400,u bitcoin reserve could slash national debt 35 2049 vaneck vaneck said u bitcoin reserve could slash national debt cryptocurrency increase 423 million coin 2049,-0.7096,0.0,-0.3548
RSS,https://cointelegraph.com/rss,2024-12-22 23:59:52+00:00,2024-12-23 12:19:20.445400,trump appoints former college football player bo hines head crypto council bo hines work donald trump crypto ai czar david sack incoming president crypto council bid foster innovation growth digital asset,0.7717,0.0,0.38585
RSS,https://cointelegraph.com/rss,2024-12-22 22:02:30+00:00,2024-12-23 12:19:20.445400,securitize proposes blackrock buidl fund collateral frax usd according rwaxyz blackrocks u dollar institutional digital liquidity fund roughly 549 million asset management,0.4215,-0.05,0.18575
RSS,https://cointelegraph.com/rss,2024-12-22 21:05:12+00:00,2024-12-23 12:19:20.445400,sui bgb ena virtual show strength bitcoin look direction bitcoins recovery toward 100000 could attract buyer sui bgb ena virtual,0.6908,0.0,0.3454
RSS,https://cointelegraph.com/rss,2024-12-22 19:52:47+00:00,2024-12-23 12:19:20.445400,here happened crypto today need know happened crypto today latest news daily trend event impacting bitcoin price blockchain defi nfts web3 crypto regulation,0.0,0.25,0.125
RSS,https://cointelegraph.com/rss,2024-12-22 19:31:22+00:00,2024-12-23 12:19:20.445400,trump nominates stephen miran council economic advisor chairman im huge believer innovation powering betterment mankind increasing prosperity miran recently said podcast,0.5994,0.19999999999999998,0.3997
RSS,https://cointelegraph.com/rss,2024-12-22 16:46:28+00:00,2024-12-23 12:19:20.445400,microstrategy bitcoin purchase surpass 2021 bull market level according microstrategy cofounder michael saylor company currently hold 439000 bitcoin valued 41 billion,0.4404,0.0,0.2202
RSS,https://cointelegraph.com/rss,2024-12-22 13:17:13+00:00,2024-12-23 12:19:20.445400,bitcoin social sentiment drop yearly low signaling btc breakout bitcoin could see another week correction manages recover 100000 based historical chart pattern,-0.4939,0.011111111111111112,-0.24139444444444444
RSS,https://cointelegraph.com/rss,2024-12-22 10:23:28+00:00,2024-12-23 12:19:20.445400,quantum computing fortify bitcoin signature adam back postquantum era still several decade away could net positive bitcoin network security,0.7184,0.056818181818181816,0.3876090909090909
RSS,https://cointelegraph.com/rss,2024-12-22 09:20:00+00:00,2024-12-23 12:19:20.445400,compressed nfts minting cnfts compressed nfts cnfts spaceefficient nfts mint need use platform support cnft compression follow minting process,0.4019,0.0,0.20095
RSS,https://cointelegraph.com/rss,2024-12-22 05:09:14+00:00,2024-12-23 12:19:20.445400,interpol issue 039red notice039 hex founder richard heart interpol issued red notice hex founder richard schueler also known richard heart allegedly committing tax fraud assault,0.2732,-0.05,0.1116
RSS,https://cointelegraph.com/rss,2024-12-22 02:17:03+00:00,2024-12-23 12:19:20.445400,former binanceus ceo brian brook take board seat microstrategy michael saylors microstrategy added three new member board director including former binanceus ceo brian brook recently rumored contender sec chair position,0.128,0.007272727272727269,0.06763636363636363
RSS,https://cointelegraph.com/rss,2024-12-21 23:09:05+00:00,2024-12-23 12:19:20.445400,btc correction almost done hailey welch speaks hodlers digest dec 15 21 bitcoin correction approaching conclusion hawk tuah influencer release statement hodlers digest,0.0,0.0,0.0
RSS,https://cointelegraph.com/rss,2024-12-21 21:12:08+00:00,2024-12-23 12:19:20.445400,jump crypto subsidiary tai mo settle sec 123 million ensuing fallout terra ecosystem collapse eventually caused terraform lab shut following settlement sec,-0.4939,-0.06666666666666667,-0.28028333333333333
RSS,https://cointelegraph.com/rss,2024-12-21 16:18:13+00:00,2024-12-23 12:19:20.445400,relationship building hedge debanking okx exec document released dec 6 show federal deposit insurance corporation fdic asked bank pause cryptorelated activity,0.0,0.0,0.0
RSS,https://cointelegraph.com/rss,2024-12-21 12:17:32+00:00,2024-12-23 12:19:20.445400,xrp price today xrps rally today could shortlived bearish reversal pattern hint potential 20plus correction ahead,0.0,0.0,0.0
RSS,https://cointelegraph.com/rss,2024-12-21 12:16:20+00:00,2024-12-23 12:19:20.445400,trust wallet fix disappearing balance glitch community member went social medium report trust wallet glitch caused crypto balance disappear,0.6908,0.03333333333333333,0.36206666666666665
RSS,https://cointelegraph.com/rss,2024-12-21 12:09:31+00:00,2024-12-23 12:19:20.445400,spacecoin xyz launch first satellite outer space blockchain network spacecoin xyz taken first step launching extraterrestrial decentralized physical infrastructure network,0.0,0.16666666666666666,0.08333333333333333
RSS,https://bitcoinmagazine.com/.rss/full/,2024-12-21 19:38:26+00:00,2024-12-23 12:19:20.445400,blackrock cant change bitcoin worried blackrock might change bitcoins supply let explain thats possible,0.2235,0.0,0.11175
RSS,https://bitcoinmagazine.com/.rss/full/,2024-12-20 23:22:52+00:00,2024-12-23 12:19:20.445400,need inkind redemption spot bitcoin etfshopefully sec commissioner hester peirce isnt playing say shell reconsider inkind redemption spot bitcoin etf,-0.1511,-0.1,-0.12555
RSS,https://bitcoinmagazine.com/.rss/full/,2024-12-20 20:31:05+00:00,2024-12-23 12:19:20.445400,bought bitcoin 108000 dont panicwhile bitcoins volatility may seem intense correction healthy normal,0.4588,0.2833333333333333,0.37106666666666666
RSS,https://bitcoinmagazine.com/.rss/full/,2024-12-20 16:42:53+00:00,2024-12-23 12:19:20.445400,dont support strategic bitcoin reserve neither younic carter lay argument bitcoin strategic reserve,-0.5801,0.0,-0.29005
RSS,https://bitcoinmagazine.com/.rss/full/,2024-12-20 14:47:33+00:00,2024-12-23 12:19:20.445400,time admit 21 quadrillion bitcoinsim favor bip 21q clever way resolve known problem bitcoin denomination,0.7506,0.16666666666666666,0.45863333333333334
RSS,https://bitcoinmagazine.com/.rss/full/,2024-12-20 13:54:47+00:00,2024-12-23 12:19:20.445400,exploring six onchain indicator understand bitcoin market cycleexplore key bitcoin metric like puell multiple mvrv zscore understand cycle progress anticipate price peak prepare bitcoins potential path toward 200k,0.6486,0.0,0.3243
RSS,https://bitcoinmagazine.com/.rss/full/,2024-12-19 21:26:36+00:00,2024-12-23 12:19:20.445400,bitcoin investor 67000 average startbitcoin investor average average american yearly salary,0.0,-0.11249999999999999,-0.056249999999999994
RSS,https://bitcoinmagazine.com/.rss/full/,2024-12-19 20:26:21+00:00,2024-12-23 12:19:20.445400,foundation introduces passport prime bitcoin wallet data security devicefoundations new device allinone tool digital security,0.5859,0.06818181818181818,0.3270409090909091
RSS,https://bitcoinmagazine.com/.rss/full/,2024-12-19 19:42:53+00:00,2024-12-23 12:19:20.445400,bukele president el salvador bitcoina good leader first priority well people whim public gossip banter,0.5106,0.31666666666666665,0.41363333333333335
RSS,https://bitcoinmagazine.com/.rss/full/,2024-12-19 15:00:29+00:00,2024-12-23 12:19:20.445400,vancouver mayor share probitcoin vision mayor ken sim isnt paying lip service bitcoin supporter come probitcoin rhetoric proposal he true believer,0.7964,0.35,0.5731999999999999
RSS,https://bitcoinmagazine.com/.rss/full/,2024-12-19 14:24:33+00:00,2024-12-23 12:19:20.445400,dont fall bitcoin crash breather worried bitcoins pullback let explain dip nothing healthy pause bull run,-0.296,0.5,0.10200000000000001
RSS,https://bitcoinmagazine.com/.rss/full/,2024-12-19 14:18:59+00:00,2024-12-23 12:19:20.445400,imf improved el salvador bitcoin lawin return loan deal imf el salvador give probitcoin policy made bitcoin law better,0.7184,0.5,0.6092
RSS,https://bitcoinmagazine.com/.rss/full/,2024-12-19 13:00:00+00:00,2024-12-23 12:19:20.445400,human right foundation donates 700000000 satoshis fund bitcoin development projectsthe hrf announces latest round bitcoin grant targeting key area latin america asia africa,0.3612,0.11714285714285713,0.2391714285714286
RSS,https://bitcoinmagazine.com/.rss/full/,2024-12-18 19:11:13+00:00,2024-12-23 12:19:20.445400,self custody theea counter argument attitude people never even consider self custody bitcoin,-0.3612,0.0,-0.1806
RSS,https://bitcoinmagazine.com/.rss/full/,2024-12-18 16:53:49+00:00,2024-12-23 12:19:20.445400,bitcoin puell multiple indicator workthe puell multiple powerful tool bitcoin investor analyzing miner revenue identify potential market top bottom here read itand signaling today,0.5574,0.16,0.3587
RSS,https://bitcoinmagazine.com/.rss/full/,2024-12-18 16:43:41+00:00,2024-12-23 12:19:20.445400,blackrocks new bitcoin ad monumental paradigm shiftthe overton window officially shifted bitcoin going mainstream,0.0,0.13636363636363635,0.06818181818181818
RSS,https://bitcoinmagazine.com/.rss/full/,2024-12-18 14:03:52+00:00,2024-12-23 12:19:20.445400,nic carter wrong u strategic bitcoin reserveis adding bitcoin u reserve sign weakness strength let tell nic carter wrong,-0.7003,-0.5,-0.60015
RSS,https://bitcoinmagazine.com/.rss/full/,2024-12-18 13:04:46+00:00,2024-12-23 12:19:20.445400,youngest ever bitcoin core contributor get bitcoin scholarship17yearold ishaana misra awarded chaincode lab inaugural bitcoin scholarship making youngest ever contributor bitcoin core,0.4019,0.0,0.20095
RSS,https://bitcoinmagazine.com/.rss/full/,2024-12-17 22:15:21+00:00,2024-12-23 12:19:20.445400,china may verge ending bitcoin banis china secretly stacking bitcoin gearing unban let break think theyre make huge moveand sooner think,0.3182,-2.7755575615628914e-17,0.15909999999999996
RSS,https://bitcoinmagazine.com/.rss/full/,2024-12-17 20:00:34+00:00,2024-12-23 12:19:20.445400,unit denomination bitcoin need changea recent bip proposed change way unit bitcoin displayed proposal needed,0.0,0.0,0.0
RSS,https://bitcoinmagazine.com/.rss/full/,2024-12-17 17:24:23+00:00,2024-12-23 12:19:20.445400,gridless mining bitcoin fostering human flourishing africagridless cofounder janet maingi explains company bitcoin mining work helping electrify rural africa leading better quality life community gridless touch,0.6249,0.16666666666666666,0.3957833333333333
RSS,https://bitcoinmagazine.com/.rss/full/,2024-12-17 17:12:07+00:00,2024-12-23 12:19:20.445400,mathematically predicting bitcoin price bull cycle peak bitcoin magazine pro lead analyst matt crosby us mathematical analysis predict next bitcoin bull cycle peak forecasting potential peak price 256000 310000 august 24 2025,0.0,0.0,0.0
RSS,https://bitcoinmagazine.com/.rss/full/,2024-12-17 16:49:59+00:00,2024-12-23 12:19:20.445400,buying bitcoin easy hodling hard partwhile bitcoin boom bull market volatility provide intense reality check ask veteran investor american hodl,0.4215,0.06833333333333333,0.24491666666666667
RSS,https://bitcoinmagazine.com/.rss/full/,2024-12-17 16:25:37+00:00,2024-12-23 12:19:20.445400,bitcoin university investment yield greater financial freedoma look whether bitcoin university education wiser long term investment one financial freedom,0.836,0.1125,0.47425
RSS,https://bitcoinmagazine.com/.rss/full/,2024-12-16 18:57:49+00:00,2024-12-23 12:19:20.445400,bitcoin etf surpass 1 million btc 2025accelerating etf inflow dwindling exchange supply potential u strategic reserve setting stage unprecedented bitcoin scarcitymaking even 1 million price target suddenly plausible,0.0,0.3666666666666667,0.18333333333333335
RSS,https://bitcoinmagazine.com/.rss/full/,2024-12-16 18:46:35+00:00,2024-12-23 12:19:20.445400,last resort unfed covenant bitcoinjeremy rubin recently released proposal allow specialized oracle emulate covenant bitcoin softforks necessary secured bitvm based slashable bond,0.5574,0.0,0.2787
RSS,https://bitcoinmagazine.com/.rss/full/,2024-12-13 19:01:18+00:00,2024-12-23 12:19:20.445400,perianne boring predicts trump 2025 economic policy drive bitcoin price 800kin bold prediction fox business perianne boring ceo digital chamber asserted presidentelect donald trump economic policy could position u global leader bitcoin adoption potentially driving asset price unprecedented 800000 2025,0.128,-0.0740740740740741,0.026962962962962952
RSS,https://bitcoinmagazine.com/.rss/full/,2024-12-13 18:05:58+00:00,2024-12-23 12:19:20.445400,tando rage year africa bitcoin conferencethe app let user pay merchant kenya accepts digital payment via mpesa bitcoin lightning,-0.4019,0.0,-0.20095
RSS,https://bitcoinmagazine.com/.rss/full/,2024-12-13 16:08:29+00:00,2024-12-23 12:19:20.445400,early bitcoin investor sentenced prison tax evasion 37 million btc salethis mark first criminal tax evasion prosecution centered solely bitcoin,-0.875,-0.01666666666666668,-0.44583333333333336
RSS,https://bitcoinmagazine.com/.rss/full/,2024-12-13 14:22:54+00:00,2024-12-23 12:19:20.445400,bitcoin fear greed index trading strategy beat buy hold investingdiscover bitcoin fear greed index sentiment analysis tool rooted human psychology outperform traditional buyandhold strategy,-0.8957,0.0,-0.44785
RSS,https://bitcoinmagazine.com/.rss/full/,2024-12-13 10:46:58+00:00,2024-12-23 12:19:20.445400,government large institution buy bitcoin want except yoursgovernments institution buying large amount bitcoin without risk one thing,0.2764,0.21428571428571427,0.24534285714285714
RSS,https://bitcoinmagazine.com/.rss/full/,2024-12-12 17:33:51+00:00,2024-12-23 12:19:20.445400,texas state rep file strategic bitcoin reserverepresentative giovanni capriglione filed live 𝕏 space,0.0,0.13636363636363635,0.06818181818181818
RSS,https://bitcoinmagazine.com/.rss/full/,2024-12-12 15:32:00+00:00,2024-12-23 12:19:20.445400,realized cap hodl wave identify next bitcoin price peakthe realized cap hodl wave chart highlight bitcoins market cycle align shift investor behavior shortterm holder currently 55 total realized value data suggests significant upside potential market overheats near 80,0.7076,0.095,0.4013
RSS,https://bitcoinmagazine.com/.rss/full/,2024-12-11 20:14:04+00:00,2024-12-23 12:19:20.445400,late invest bitcointhink youve missed bitcoin boom think despite impressive past performance bitcoin continues topperforming asset even recent month strategy like dollar cost averaging dca dont need fortune start investing learn bitcoin outshines gold dow jones traditional investment proving never late join bitcoin revolution,-0.1999,0.09999999999999999,-0.04995
RSS,https://bitcoinmagazine.com/.rss/full/,2024-12-11 17:22:57+00:00,2024-12-23 12:19:20.445400,backup bitcoina look bitcoin backup important manage,0.2023,0.4,0.30115000000000003
RSS,https://bitcoinmagazine.com/.rss/full/,2024-12-11 16:43:46+00:00,2024-12-23 12:19:20.445400,ray dalio prefers bitcoin bondsray dalio say prefers bitcoin gold bond amid rising global debt level signaling growing institutional endorsement bitcoin safe asset,0.7096,0.25,0.4798
RSS,https://bitcoinmagazine.com/.rss/full/,2024-12-10 22:05:55+00:00,2024-12-23 12:19:20.445400,eric trump state bitcoin ultimate hedge real estate investorseric trump highlight bitcoin transformative asset real estate investor emphasizing liquidity portability potential democratize wealthbuilding opportunity globally,0.7717,0.08,0.42585
RSS,https://bitcoinmagazine.com/.rss/full/,2024-12-10 22:05:09+00:00,2024-12-23 12:19:20.445400,microstrategy mstr expected added nasdaq 100 bloombergthe official announcement likely come friday say bloomberg,0.0,-0.05,-0.025
RSS,https://bitcoinmagazine.com/.rss/full/,2024-12-10 17:52:32+00:00,2024-12-23 12:19:20.445400,eric trump confident bitcoin price hit 1 millioneric trump confidently predicts bitcoin reach 1 million emphasizing scarcity global potential early adopter stand gain,0.8689,0.22000000000000003,0.54445
RSS,https://bitcoinmagazine.com/.rss/full/,2024-12-10 17:30:19+00:00,2024-12-23 12:19:20.445400,bitcoin islamic moneya look bitcoin complies islamic law regarding finance money,0.0,0.0,0.0
RSS,https://bitcoinmagazine.com/.rss/full/,2024-12-10 16:59:57+00:00,2024-12-23 12:19:20.445400,golden ratio multiplier mathematically reveals next bitcoin price targetthe golden ratio multiplier bitcoinspecific indicator created philip swift highlight 100000 critical resistance level analysis explores fibonacci multiple 350day moving average provide key insight bitcoins price cycle 127000 emerging next major target barrier broken,-0.3054,0.010227272727272722,-0.14758636363636365
RSS,https://bitcoinmagazine.com/.rss/full/,2024-12-09 22:01:13+00:00,2024-12-23 12:19:20.445400,russian state duma deputy proposes strategic bitcoin reservethe document would see russia create bitcoin reserve similar traditional currency reserve,0.2732,0.0,0.1366
RSS,https://bitcoinmagazine.com/.rss/full/,2024-12-09 18:00:14+00:00,2024-12-23 12:19:20.445400,wabisabi deanonymization vulnerability discloseda major vulnerability wabisabi publicly revealed would allow malicious coordinator server deanonymize user,-0.2944,0.03125,-0.131575
RSS,https://bitcoinmagazine.com/.rss/full/,2024-12-09 12:20:00+00:00,2024-12-23 12:19:20.445400,microbt unveils newgen whatsminer m6xs series bitcoin mena 2024microbt unveils newgen whatsminer m6xs series bitcoin mena 2024,0.0,0.0,0.0
RSS,https://bitcoinmagazine.com/.rss/full/,2024-12-07 18:07:35+00:00,2024-12-23 12:19:20.445400,trump must end capital gain tax bitcoinby eliminating capital gain tax bitcoin trump administration spur u innovation strengthen nation economic sovereignty ensure everyday american gain equal footing world rapidly evolving digital economy,0.9493,0.0,0.47465
RSS,https://bitcoinmagazine.com/.rss/full/,2024-12-06 19:12:33+00:00,2024-12-23 12:19:20.445400,joule paradox energy set value bitcoin bitcoin set value energyenergy fundamental base commodity upon everything value produced bitcoin pure embodiment energy monetary form,0.8402,-0.29285714285714287,0.27367142857142857
RSS,https://bitcoinmagazine.com/.rss/full/,2024-12-05 18:49:06+00:00,2024-12-23 12:19:20.445400,money isnt fixed yeta finite supply cap think necessary fix monetary system money seizure surveillance fundamentally much bigger problem solve,-0.2263,0.03333333333333333,-0.09648333333333334
RSS,https://bitcoinmagazine.com/.rss/full/,2024-12-05 17:27:55+00:00,2024-12-23 12:19:20.445400,100000 bitcoin price beginningwhoa think bitcoin hitting 100k peak think whats ahead 2025 getting started folk,0.0,0.0,0.0
RSS,https://bitcoinmagazine.com/.rss/full/,2024-12-05 17:26:47+00:00,2024-12-23 12:19:20.445400,guatemalan government taking closer look bitcoin memea nayib bukele bitcoin meme posted el salvador bitcoin office went viral guatemala last month im told prompted power country begin homework bitcoin craft better policy around asset,0.6597,0.25,0.45485
RSS,https://bitcoinmagazine.com/.rss/full/,2024-12-05 15:42:57+00:00,2024-12-23 12:19:20.445400,month bitcoin shattered record dive bitcoin reportdiscover key insight trend historic month bitcoin free bitcoin report dont miss outread,0.164,0.13333333333333333,0.14866666666666667
RSS,https://bitcoinist.com/feed/,2024-12-23 11:52:26+00:00,2024-12-23 12:19:20.445400,crypto allstars blockbuster presale raise 26m star meme coin list dexscrypto allstars launching native token star decentralized exchange dex uniswap today 2 pm utc ahead dex listing meme project surpassed 26m presale ended friday star momentum fueled role linchpin memevault novel unified meme coin staking platform,0.8316,0.0,0.4158
RSS,https://bitcoinist.com/feed/,2024-12-23 08:00:27+00:00,2024-12-23 12:19:20.445400,dogecoin price form ascending channel bottom surge 2025 could send price 1the 24hour dogecoin price action highlighted range 03049 03229 bull bear work break either side cryptocurrency continues struggle price correction shortterm timeframe technical analysis wider timeframe show bullish structure would lead,-0.3182,0.05,-0.1341
RSS,https://bitcoinist.com/feed/,2024-12-23 06:00:28+00:00,2024-12-23 12:19:20.445400,breakingtrumps crypto council take shape bo hines executive directorpresidentelect donald trump made headline latest selection bo hines executive director newly formed presidential council adviser digital asset also known crypto council announcement made via trump truth social account key step shaping incoming administration stance cryptocurrency blockchain technology,0.5859,0.13393939393939394,0.35991969696969695
RSS,https://bitcoinist.com/feed/,2024-12-23 03:51:08+00:00,2024-12-23 12:19:20.445400,analyst predict presales surge like pengu fartcoin end 2024we last week year 7 day make impact 2024 portfolio need right token thats today top 4 best meme coin token could still surge end year,0.8176,0.4464285714285714,0.6320142857142856
RSS,https://bitcoinist.com/feed/,2024-12-22 18:04:01+00:00,2024-12-23 12:19:20.445400,everyone eyeing xrp gain presale huge potential radarripple xrp wild ride turning head recent rally climbing 20 past week securing partial clarity legal battle sec token seen renewed interest xrp climbing steadily still long way go reach,0.8934,0.03666666666666667,0.4650333333333333
RSS,https://bitcoinist.com/feed/,2024-12-22 17:00:50+00:00,2024-12-23 12:19:20.445400,dogecoins third final leap analyst highlight potential midaugust peaklike many cryptocurrencies dogecoins price action past week highlighted notable correction dogecoin particular saw price break 03 first time four week leading bottom 027 related reading fed cant hold bitcoin plan yet change law powell say according,0.34,0.12666666666666665,0.23333333333333334
RSS,https://bitcoinist.com/feed/,2024-12-22 15:30:30+00:00,2024-12-23 12:19:20.445400,73 million exodus blackrock bitcoin etf suffers recordbreaking outflowa major player cryptocurrency market found unusual side history experiencing largest outflow month related reading fed cant hold bitcoin plan yet change law powell say leading asset manager blackrock ended inflow streak bitcoin exchangetraded fund recording 727 million,-0.1531,-0.08437499999999999,-0.1187375
