MainSource,Source,Publication Date,Pull_date,Pre-Processed Text,Sentiment_Vader,Sentiment_TextBlob,Average_Sentiment
RSS,https://cointelegraph.com/rss,2025-02-11 00:44:15+00:00,2025-02-11 00:52:33.334010,grayscale nyse arca file launch usbased spot cardano etf nyse arca filed behalf grayscale launch firm firstever standalone cardano etf product,0.0,-0.2,-0.1
RSS,https://cointelegraph.com/rss,2025-02-11 00:35:16+00:00,2025-02-11 00:52:33.334010,litecoin etf 90 chance get sec approval 2025 analyst bloomberg etf analyst say litecoin regulatory filing acknowledged sec likely view commodity,0.6249,-0.06666666666666667,0.2791166666666667
RSS,https://cointelegraph.com/rss,2025-02-10 23:33:56+00:00,2025-02-11 00:52:33.334010,openais altman appears reject musk 974b bid control openais sam altman told elon musk thank x musk reportedly offered buy ai firm almost 100 million,-0.0516,-0.2,-0.1258
RSS,https://cointelegraph.com/rss,2025-02-10 21:39:36+00:00,2025-02-11 00:52:33.334010,here happened crypto today need know happened crypto today latest news daily trend event impacting bitcoin price blockchain defi nfts web3 crypto regulation,0.0,0.25,0.125
RSS,https://cointelegraph.com/rss,2025-02-10 21:30:07+00:00,2025-02-11 00:52:33.334010,rep water call support bipartisan stablecoin legislation u house financial service committee ranking member maxine water suggested lawmaker look bipartisan stablecoin legislation drafted 118th session congress,0.4019,0.0,0.20095
RSS,https://cointelegraph.com/rss,2025-02-10 20:44:46+00:00,2025-02-11 00:52:33.334010,solana revenue outpace ethereum l2s despite market dip solanabased app revenue beat ethereum apps 10x according crypto researcher aylo,0.0,0.0,0.0
RSS,https://cointelegraph.com/rss,2025-02-10 20:10:00+00:00,2025-02-11 00:52:33.334010,postelection trading surge bullish coinbase earnings kaiko coinbase among several top u crypto firm scheduled report earnings week,0.2023,0.09999999999999999,0.15115
RSS,https://cointelegraph.com/rss,2025-02-10 19:49:08+00:00,2025-02-11 00:52:33.334010,bitcoin price rally 97k institutional retail trader appetite shrink bitcoin trader slamming buy button concern connected macroeconomic condition,0.0,0.0,0.0
RSS,https://cointelegraph.com/rss,2025-02-10 19:35:00+00:00,2025-02-11 00:52:33.334010,cftc announces crypto fraud action enforcement priority shift acting cftc chair caroline pham announced feb 4 commission would essentially end practice regulation enforcement,-0.5859,0.03333333333333333,-0.2762833333333333
RSS,https://cointelegraph.com/rss,2025-02-10 19:18:05+00:00,2025-02-11 00:52:33.334010,metaplanet share price rise 4800 company stack btc metaplanet share risen 4800 company known asia microstrategy stacked bitcoin,0.5267,0.0,0.26335
RSS,https://cointelegraph.com/rss,2025-02-10 19:00:00+00:00,2025-02-11 00:52:33.334010,u treasury sued doge access lawmaker propose stablecoin bill law decoded united state largest union group sued treasury department accusing unlawfully providing sensitive information elon musk doge,0.5719,0.1,0.33594999999999997
RSS,https://cointelegraph.com/rss,2025-02-10 17:57:41+00:00,2025-02-11 00:52:33.334010,bitcoin039s booming 039permanent holder demand039 position btc price 116k bitcoin holder record selling holding increased btc reserve trumpled market rally,0.2732,0.0,0.1366
RSS,https://cointelegraph.com/rss,2025-02-10 17:30:00+00:00,2025-02-11 00:52:33.334010,crypto betting market huge growth fuel call billiondollar volume 2025 cryptobased prediction market casino sport betting reshaping igaming sector generating billion dollar trading volume,0.5994,0.39999999999999997,0.49970000000000003
RSS,https://cointelegraph.com/rss,2025-02-10 16:40:37+00:00,2025-02-11 00:52:33.334010,tesla q4 bitcoin profit highlight btc collateral opportunity crypto exec marktomarket gain tesla could use bitcoin collateral unlock liquidity hedge market downturn said gadi chait investment manager xapo bank,0.8885,0.0,0.44425
RSS,https://cointelegraph.com/rss,2025-02-10 15:54:36+00:00,2025-02-11 00:52:33.334010,usdc hit 563b market cap regains loss bear market circle usdc stablecoin reached 563 billion market capitalization erasing loss sustained bear market,-0.4939,0.0,-0.24695
RSS,https://cointelegraph.com/rss,2025-02-10 15:32:29+00:00,2025-02-11 00:52:33.334010,alleged hacker behind fake sec post could forfeit 50k plea deal individual allegedly helped compromise sec x account post fake bitcoin etf approval message earned roughly 50000 could forced forfeit,-0.7269,-0.22000000000000003,-0.47345000000000004
RSS,https://cointelegraph.com/rss,2025-02-10 15:06:15+00:00,2025-02-11 00:52:33.334010,ethereum short position surge 500 hedge fund bet decline ethereum may also lack fundamental blockchain activity ether price recovery analyst told cointelegraph,-0.3182,0.0,-0.1591
RSS,https://cointelegraph.com/rss,2025-02-10 15:00:00+00:00,2025-02-11 00:52:33.334010,zk identity project holonym acquires gitcoin passport 10m following acquisition holonym plan offer rebranded human passport user worldwide,0.0,0.0,0.0
RSS,https://cointelegraph.com/rss,2025-02-10 15:00:00+00:00,2025-02-11 00:52:33.334010,web3 growth synonymous ethereum growth ethereum key driving web3 growth thanks robust ecosystem rise layer 2 rollups superchains potential,0.9022,0.06666666666666667,0.4844333333333333
RSS,https://cointelegraph.com/rss,2025-02-10 14:49:39+00:00,2025-02-11 00:52:33.334010,bitcoin tease gain trader say 100k key support reclaim btc price momentum still lacking active bitcoin trading range get ever narrower,0.7579,-0.06666666666666667,0.3456166666666667
RSS,https://cointelegraph.com/rss,2025-02-10 14:01:11+00:00,2025-02-11 00:52:33.334010,michael saylors strategy bag first bitcoin purchase new name strategy fresh 7633btc purchase came day firm rebranded microstrategy last week,0.3182,0.09727272727272726,0.2077363636363636
RSS,https://cointelegraph.com/rss,2025-02-10 13:51:08+00:00,2025-02-11 00:52:33.334010,central african republic car memecoin info page plagued phishing link investor may find clicking malicious link researching controversial central african republic memecoin,-0.2023,0.11000000000000001,-0.04615
RSS,https://cointelegraph.com/rss,2025-02-10 13:31:10+00:00,2025-02-11 00:52:33.334010,binance cofounder clarifies token listing process amid tst controversy concern around binances token listing criterion ignited binancelisted tst token briefly rallied 489 million social medium hype,0.2263,0.016666666666666666,0.12148333333333333
RSS,https://cointelegraph.com/rss,2025-02-10 13:28:32+00:00,2025-02-11 00:52:33.334010,vitaliks community note plan work ai prediction market creator ai agent would happily predict community note market worth 1 2 help get online hour earlier say david minarsch ola predict,0.802,0.3666666666666667,0.5843333333333334
RSS,https://cointelegraph.com/rss,2025-02-10 12:47:52+00:00,2025-02-11 00:52:33.334010,ether etps outpace bitcoin crypto inflow first time 2025 ether altcoins saw massive week etp inflow bitcoin inflow continued decline according data coinshares,0.0,0.125,0.0625
RSS,https://cointelegraph.com/rss,2025-02-10 12:41:42+00:00,2025-02-11 00:52:33.334010,xrp price going crash xrp price could avoid potential crash 30 bull reclaim key trendline move previously preceded doubledigit rally,-0.765,-0.05555555555555555,-0.4102777777777778
RSS,https://cointelegraph.com/rss,2025-02-10 11:10:11+00:00,2025-02-11 00:52:33.334010,bitcoin hold 95k support despite heavy selling pressure bitcoin remains 95000 despite largest selling pressure since 2022 break 93000 could trigger 17 billion liquidation amid trade war concern,0.1471,-0.2,-0.02645
RSS,https://cointelegraph.com/rss,2025-02-10 10:38:25+00:00,2025-02-11 00:52:33.334010,bitcoin price stuck bitcoin price trade fiveday range data suggest pattern could continue day,-0.25,0.0,-0.125
RSS,https://cointelegraph.com/rss,2025-02-10 10:27:40+00:00,2025-02-11 00:52:33.334010,ethereum fee dip 1m first since september 2024 second time ether daily transaction fee fallen 1 million since november 2020,-0.3612,0.08333333333333333,-0.13893333333333335
RSS,https://cointelegraph.com/rss,2025-02-10 10:16:49+00:00,2025-02-11 00:52:33.334010,sell risk since 3ac collapse 5 thing know bitcoin week bitcoin digest tariff selloff price action cling center threemonth range,-0.6486,0.0,-0.3243
RSS,https://bitcoinmagazine.com/.rss/full/,2025-02-10 11:00:03+00:00,2025-02-11 00:52:33.334010,proton wallet available everyone great starter selfcustodial bitcoin walletproton wallet wellsuited anyone looking begin bitcoin self custody journey andor anyone looking make semifrequent payment onchain managing relatively small bitcoin stack,0.6249,0.3166666666666667,0.47078333333333333
RSS,https://bitcoinmagazine.com/.rss/full/,2025-02-07 21:33:45+00:00,2025-02-11 00:52:33.334010,el salvador still bitcoin countrybitcoin may longer legal tender el salvador bitcoiners country havent given mission,0.128,0.2,0.164
RSS,https://bitcoinmagazine.com/.rss/full/,2025-02-07 13:57:13+00:00,2025-02-11 00:52:33.334010,introducing bitcoin everything indicatora single metric rule bitcoin everything indicator combine multiple key metric one comprehensive tool better investment decision,0.5994,0.10714285714285715,0.35327142857142857
RSS,https://bitcoinmagazine.com/.rss/full/,2025-02-06 20:03:42+00:00,2025-02-11 00:52:33.334010,here secret investing bitcoindont use leverage dont overexpose,0.0,-0.4,-0.2
RSS,https://bitcoinmagazine.com/.rss/full/,2025-02-06 18:04:44+00:00,2025-02-11 00:52:33.334010,lightning company raising good bitcoin tether usdt bitcoin made headline last week lightning ecosystem blossoming,0.4404,0.35,0.3952
RSS,https://bitcoinmagazine.com/.rss/full/,2025-02-06 17:50:20+00:00,2025-02-11 00:52:33.334010,nostr importance censorshipresistant communication innovation human progress open communication central part fostering innovation threatened modern digital age,0.7579,0.04,0.39895
RSS,https://bitcoinmagazine.com/.rss/full/,2025-02-06 15:00:00+00:00,2025-02-11 00:52:33.334010,bitcoin payment arent future theyre alreadytake look breez 1a1zs latest report deep diving current state bitcoins use transactional payment mechanism,0.0772,0.125,0.1011
RSS,https://bitcoinmagazine.com/.rss/full/,2025-02-06 14:09:30+00:00,2025-02-11 00:52:33.334010,bitcoins core remains unbreakablewhy surviving hostility doesnt mean court itand proactive engagement secures better future,0.8271,0.0625,0.4448
RSS,https://bitcoinmagazine.com/.rss/full/,2025-02-05 18:40:49+00:00,2025-02-11 00:52:33.334010,didnt take orange pill threw outthe government hasnt orange pilled theyve simply shown new way pull revolving door grifts,0.0,0.06818181818181818,0.03409090909090909
RSS,https://bitcoinmagazine.com/.rss/full/,2025-02-05 17:22:53+00:00,2025-02-11 00:52:33.334010,blackrock launch spot bitcoin etp europethe world largest asset manager set expand bitcoin footprint internationally new exchangetraded product switzerland,0.5859,0.13636363636363635,0.36113181818181816
RSS,https://bitcoinmagazine.com/.rss/full/,2025-02-05 17:11:55+00:00,2025-02-11 00:52:33.334010,bringin make bitcoin easier spend europe bringin founder ceo prashanth chandrashekar created product make easier european live bitcoin standard onboard bitcoin,0.765,0.04545454545454545,0.4052272727272727
RSS,https://bitcoinmagazine.com/.rss/full/,2025-02-04 23:39:46+00:00,2025-02-11 00:52:33.334010,president trump crypto czar host us first press conference bitcoin digital assetsdavid sack several procrypto politician discus future bitcoin crypto industry united state firstever u press conference digital asset,0.6486,0.05,0.3493
RSS,https://bitcoinmagazine.com/.rss/full/,2025-02-04 21:16:01+00:00,2025-02-11 00:52:33.334010,smart investor buy bitcoin real estatebitcoins finite supply unmatched liquidity deflationary model make ultimate asset modern investor learn forwardthinking investor decided buy bitcoin real estate inflationary world,0.5994,0.16285714285714287,0.3811285714285715
RSS,https://bitcoinmagazine.com/.rss/full/,2025-02-03 20:32:42+00:00,2025-02-11 00:52:33.334010,cowboy reservationthe logical soundness argument ossification bitcoin getting point pure absurdity,-0.3612,0.23214285714285715,-0.06452857142857144
RSS,https://bitcoinmagazine.com/.rss/full/,2025-02-03 20:18:03+00:00,2025-02-11 00:52:33.334010,bitcoin price already peakedbitcoin recently faced 10 retracement leading concern whether bull market article explores onchain metric institutional confidence macroeconomic factor determine whether bitcoin still room growth cycle peak reached,0.743,0.0,0.3715
RSS,https://bitcoinmagazine.com/.rss/full/,2025-02-03 19:45:40+00:00,2025-02-11 00:52:33.334010,buying holding bitcoin best strategy navigate trump tariff warbitcoin safest asset today,0.8555,1.0,0.9277500000000001
RSS,https://bitcoinmagazine.com/.rss/full/,2025-02-03 17:28:13+00:00,2025-02-11 00:52:33.334010,power play bitcoins institutionalization reshaping futureare new institutional player influenced bitcoin one influencing,0.34,0.13636363636363635,0.2381818181818182
RSS,https://bitcoinmagazine.com/.rss/full/,2025-01-31 20:07:04+00:00,2025-02-11 00:52:33.334010,bitcoin benjamin franklinsaving new generation riding wave folly,0.0,0.13636363636363635,0.06818181818181818
RSS,https://bitcoinmagazine.com/.rss/full/,2025-01-31 13:45:44+00:00,2025-02-11 00:52:33.334010,bitcoin bridgeas pleb fiat job important role play,0.4939,0.4,0.44695
RSS,https://bitcoinmagazine.com/.rss/full/,2025-01-31 13:26:54+00:00,2025-02-11 00:52:33.334010,take profit bitcoin cycle peaksselling bitcoin doesnt emotional decisionlearn use key market indicator take profit strategically reaccumulate lower price,0.4864,0.0,0.2432
RSS,https://bitcoinmagazine.com/.rss/full/,2025-01-31 10:15:01+00:00,2025-02-11 00:52:33.334010,forget ecb czechia embrace bitcoin termsthe czech national bank considering adding bitcoin reserve regardless european central bank think,0.1027,0.0,0.05135
RSS,https://bitcoinmagazine.com/.rss/full/,2025-01-30 21:42:05+00:00,2025-02-11 00:52:33.334010,tether back bitcoin lightning dominance startingthe stablecoin issuer choice bring usdt back bitcoin massive win lightning network joltzs bet taproot asset,0.7964,0.2,0.4982
RSS,https://bitcoinmagazine.com/.rss/full/,2025-01-30 17:24:24+00:00,2025-02-11 00:52:33.334010,trump executive order break bitcoins fouryear market cycle trump recent executive order may signal end bitcoins historically rigid fouryear market cycle regulatory clarity institutional adoption governmentbacked initiative could policy shift usher new era sustained growtheliminating dreaded crypto winter,-0.3612,0.04545454545454545,-0.15787272727272728
RSS,https://bitcoinmagazine.com/.rss/full/,2025-01-30 17:01:53+00:00,2025-02-11 00:52:33.334010,bitcoin empowers womenbitcoin tool woman around world closed traditional financial system,0.0,-0.03333333333333333,-0.016666666666666666
RSS,https://bitcoinmagazine.com/.rss/full/,2025-01-30 16:18:30+00:00,2025-02-11 00:52:33.334010,czech national bank ass bitcoin part reserve strategythe cnb approves plan explore allocating portion 140 billion reserve bitcoin,-0.2023,0.0,-0.10115
RSS,https://bitcoinmagazine.com/.rss/full/,2025-01-30 15:06:39+00:00,2025-02-11 00:52:33.334010,grayscale investment launch bitcoin miner etfgrayscale investment launched grayscale bitcoin miner etf mnrs offering investor way gain exposure bitcoin mining industry without directly holding btc tracking indxx bitcoin miner index etf includes major player like mara riot core scientific making attractive option looking diversify bitcoinrelated equity,0.7165,0.32083333333333336,0.5186666666666667
RSS,https://bitcoinmagazine.com/.rss/full/,2025-01-30 14:09:36+00:00,2025-02-11 00:52:33.334010,bitcoin cypherpunk spirit alive well africafrom south africa kenya ghana african using bitcoin better life arent asking anyones permission,0.8074,0.19999999999999998,0.5037
RSS,https://bitcoinmagazine.com/.rss/full/,2025-01-29 18:56:28+00:00,2025-02-11 00:52:33.334010,bitcoin ultimate hedge 97t global liquidity bubblediscover bitcoins fixed supply deflationary nature make ultimate asset navigating 97 trillion global liquidity bubble learn rising money supply influence market trend position bitcoin strategic hedge fiat currency debasement,0.3612,0.02,0.19060000000000002
RSS,https://bitcoinmagazine.com/.rss/full/,2025-01-29 18:10:45+00:00,2025-02-11 00:52:33.334010,bitcoin went wrongthe priority bitcoiners starting shift wrong direction represent actual existential threat success censorship resistant resilient system,-0.4215,-0.05,-0.23575
RSS,https://bitcoinmagazine.com/.rss/full/,2025-01-29 17:38:06+00:00,2025-02-11 00:52:33.334010,forget strategic bitcoin reserve moment mining censorship backf2pool mining pool representing 11 hash power bitcoin network censoring ofacsanctioned transaction,-0.2263,0.0,-0.11315
RSS,https://bitcoinmagazine.com/.rss/full/,2025-01-29 17:29:12+00:00,2025-02-11 00:52:33.334010,cme group launch option bitcoin friday future februarycme group looking obtain regulatory approval option successful cryptocurrency product launch,0.7845,0.375,0.57975
RSS,https://bitcoinmagazine.com/.rss/full/,2025-01-29 16:10:50+00:00,2025-02-11 00:52:33.334010,czech central bank head want buy bitcoin 5 reserve allocationthe czech national bank cnb considering 5 bitcoin allocation surpassing gold reserve approved move could reshape future national reserve asset,0.6808,0.0,0.3404
RSS,https://bitcoinmagazine.com/.rss/full/,2025-01-28 19:29:07+00:00,2025-02-11 00:52:33.334010,200000 realistic bitcoin price target cycleexplore potential bitcoin price reach 200000 cycle analyze market dynamic supply demand money multiplier effect ass feasibility,-0.3182,0.05555555555555555,-0.13132222222222223
RSS,https://bitcoinmagazine.com/.rss/full/,2025-01-28 19:24:46+00:00,2025-02-11 00:52:33.334010,go reserve people wont see differencearguing bitcoin reserve fund inclusion cryptocurrencies ultimately futile fight public large doesnt see difference,-0.6705,0.07142857142857142,-0.2995357142857143
RSS,https://bitcoinmagazine.com/.rss/full/,2025-01-28 17:04:20+00:00,2025-02-11 00:52:33.334010,preston pysh explains sab 121 beat strategic bitcoin reservepreston pysh explains rescission sab 121 could permanently entrench bitcoin financial system surpassing importance strategic bitcoin reserve,0.3612,0.0,0.1806
RSS,https://bitcoinmagazine.com/.rss/full/,2025-01-28 15:30:07+00:00,2025-02-11 00:52:33.334010,game theory strategic bitcoin reserve united state throwing weight behind bitcoin would effect massive shift game theory underpinning bitcoin probably way think,0.4215,-0.30000000000000004,0.06074999999999997
RSS,https://bitcoinmagazine.com/.rss/full/,2025-01-28 15:11:28+00:00,2025-02-11 00:52:33.334010,donald trump vow propel bitcoin new heightsdavid bailey ceo bitcoin magazine share insight private conversation president donald trump expressed support bitcoin community ambitious plan outcompete global competitor,0.7906,0.09659090909090909,0.4435954545454545
RSS,https://bitcoinmagazine.com/.rss/full/,2025-01-28 13:46:52+00:00,2025-02-11 00:52:33.334010,protect bitcoin anchorwatchbecca rubenfeld anchorwatch team recently unveiled firstofitskind bitcoin custody plus insurance solution aim keep customer bitcoin safe customer well,0.836,0.25,0.5429999999999999
RSS,https://bitcoinmagazine.com/.rss/full/,2025-01-27 22:10:39+00:00,2025-02-11 00:52:33.334010,microstrategy expands bitcoin holding 471100 btc worth 46 billionmicrostrategys relentless bitcoin buying spree continues adding 10100 btc 11 billion 471100 btc treasury valued 46 billion firm reinforces commitment bitcoincentric strategy amid market volatility,0.8316,0.04999999999999999,0.44079999999999997
RSS,https://bitcoinmagazine.com/.rss/full/,2025-01-27 18:54:56+00:00,2025-02-11 00:52:33.334010,declining shortterm u treasury yield impact bitcoin pricehow shifting treasury yield signal economic uncertainty bitcoin could benefit riskon safehaven asset,0.6908,0.2,0.4454
RSS,https://bitcoinmagazine.com/.rss/full/,2025-01-27 14:53:53+00:00,2025-02-11 00:52:33.334010,nasdaq proposes inkind redemption blackrocks bitcoin etfnasdaq proposed new system blackrocks ishares bitcoin etf allowing institutional investor redeem share directly bitcoin instead cash innovative model aim streamline operation cut cost reduce market impact marking significant step forward evolution bitcoin etf,0.5859,0.2778409090909091,0.43187045454545453
RSS,https://bitcoinmagazine.com/.rss/full/,2025-01-24 19:28:07+00:00,2025-02-11 00:52:33.334010,cynic idealist bitcoinbitcoiners need stop letting extreme naive idealism jaded cynicism drive public discourse,-0.7165,-0.14166666666666666,-0.42908333333333337
RSS,https://bitcoinmagazine.com/.rss/full/,2025-01-24 18:01:45+00:00,2025-02-11 00:52:33.334010,dear president trump bitcoin reserve shitcoin reservethe u government shouldnt stockpile anything bitcoin,0.3818,0.0,0.1909
RSS,https://bitcoinmagazine.com/.rss/full/,2025-01-24 17:47:27+00:00,2025-02-11 00:52:33.334010,trump digital asset executive order may last senator lummis rightpresident trump digital asset executive order hoped luckily senator lummis taking better approach establishing strategic bitcoin reserve,0.9153,0.16666666666666666,0.5409833333333334
RSS,https://bitcoinmagazine.com/.rss/full/,2025-01-24 12:47:29+00:00,2025-02-11 00:52:33.334010,brc20 bitcoin token could outshine rune efficient token standard bitcoin good thing,0.6908,0.35,0.5204
RSS,https://bitcoinmagazine.com/.rss/full/,2025-01-24 12:08:51+00:00,2025-02-11 00:52:33.334010,sec rescinds sab 121 permitting bank custody bitcointhe sec rescinded sab 121 removing barrier bank custody bitcoin crypto signaling major shift crypto regulation,-0.128,-0.04583333333333334,-0.08691666666666667
RSS,https://bitcoinmagazine.com/.rss/full/,2025-01-23 21:55:20+00:00,2025-02-11 00:52:33.334010,president trump sign executive order ban central bank digital currency cbdcthe president also assigned working group ass creation strategic bitcoin stockpile,-0.7184,0.0,-0.3592
RSS,https://bitcoinmagazine.com/.rss/full/,2025-01-23 21:19:26+00:00,2025-02-11 00:52:33.334010,trump sign executive order explore u strategic bitcoin reservepresident trump new executive order embrace bitcoin open blockchain technology ban central bank digital currency revoke prior restrictive regulationssignaling landmark policy shift toward fostering responsible innovation financial freedom united state,0.872,0.048051948051948054,0.460025974025974
RSS,https://bitcoinmagazine.com/.rss/full/,2025-01-23 17:38:39+00:00,2025-02-11 00:52:33.334010,ross free far overross last person government try make example,0.5106,0.16666666666666666,0.33863333333333334
RSS,https://bitcoinmagazine.com/.rss/full/,2025-01-23 16:29:45+00:00,2025-02-11 00:52:33.334010,donald trump right thing freeing ross ulbrichttrump delivered promise im glad,0.8126,0.39285714285714285,0.6027285714285714
RSS,https://bitcoinist.com/feed/,2025-02-10 23:30:38+00:00,2025-02-11 00:52:33.334010,huge bitcoin transaction signal potential volatility 14000 btc 7y 10y moved onchainuncertainty dominated bitcoin broader crypto market past week leaving investor anxious shortterm direction bitcoin struggled reclaim psychologically significant 100k mark also managing hold key demand level near 96k rangebound price action reflects market indecision bull bear,-0.3818,0.059375,-0.16121249999999998
RSS,https://bitcoinist.com/feed/,2025-02-10 23:05:29+00:00,2025-02-11 00:52:33.334010,spot cardano etf application grayscale seek approval uson monday asset manager crypto etf issuer grayscale officially filed 19b4 proposal u security exchange commission sec launch spot cardano etf firstever cardano etf proposal submitted move mark first formal application cardano etf come heel increasing number crypto,0.8074,0.075,0.4412
RSS,https://bitcoinist.com/feed/,2025-02-10 22:00:37+00:00,2025-02-11 00:52:33.334010,bitcoin hold 90k level funding rate across top exchange drop zero meansbitcoin endured volatile bearish week marked extreme price swing uncertainty last monday cryptocurrency experienced sharp drop 9 le 24 hour recover 11 hour later showcasing unpredictability market despite rebound bitcoins price action remains pressure,-0.7402,0.15625,-0.291975
RSS,https://bitcoinist.com/feed/,2025-02-10 20:30:17+00:00,2025-02-11 00:52:33.334010,crypto analyst say dogecoin price ready rally toward 05 good newsa new technical analysis crypto analyst suggests recent dogecoin price decline may coming fast end analyst project top meme coin gearing price rally toward 05 although doge longterm outlook appears bullish meme coin face final hurdle could delay,0.5994,0.2170454545454545,0.4082227272727273
RSS,https://bitcoinist.com/feed/,2025-02-10 19:00:37+00:00,2025-02-11 00:52:33.334010,bitcoin treasury firm metaplanet japan hottest stock 3600 detailswith dramatic shift bitcoin former hotel developer transformed investment landscape japan causing stir asia financial market metaplanet inc previously recognized modest portfolio hospitality property undergone remarkable transformation japan preeminent bitcoin investment vehicle providing shareholder 3600 return,0.6597,0.00714285714285715,0.33342142857142854
RSS,https://bitcoinist.com/feed/,2025-02-10 17:30:49+00:00,2025-02-11 00:52:33.334010,ripple expands portugal unicâmbio partnershipripple disclosed new partnership portuguese currency exchange provider unicâmbio today collaboration announced february 10 2025 extend company cryptoenabled payment solution portugal first timeparticularly aimed facilitating seamless transaction portuguese brazilian market ripple team unicâmbio via x company announced planting,0.5267,0.1621212121212121,0.34441060606060603
