MainSource,Source,Publication Date,Pull_date,Pre-Processed Text,Sentiment_Vader,Sentiment_TextBlob,Average_Sentiment
Reddit,ethereum,2024-09-03 14:41:57,2024-09-24 12:18:14.622873,ama ef research pt 12 05 september 2024notice closed thank participating look forward soon member ethereum foundation research team back answer question throughout day 12th amahttpsredditzendeskcomhcenusarticles115002427523whatisanamaandwhywouldihostone lot member taking part keep question coming enjoy click view 11th ef research team amahttpswwwredditcomrethereumcomments191kke6ama_we_are_ef_research_pt_11_10_january_2024 jan 2024 click view 10th ef research team amahttpswwwredditcomrethereumcomments14vpyb3ama_we_are_ef_research_pt_10_12_july_2023 july 2023 click view 9th ef research team amahttpswwwredditcomrethereumcomments107cqi8ama_we_are_ef_research_pt_9_11_january_2023 jan 2023 click view 8th ef research team amahttpswwwredditcomrethereumcommentsvrx9xeama_we_are_ef_research_pt_8_07_july_2022 july 2022 click view 7th ef research team amahttpswwwredditcomrethereumcommentsrwojtkama_we_are_the_efs_research_team_pt_7_07_january jan 2022 click view 6th ef research team amahttpswwwredditcomrethereumcommentso4unlpama_we_are_the_efs_research_team_pt_6_23_june_2021 june 2021 click view 5th ef research team amahttpswwwredditcomrethereumcommentsjvkoatama_we_are_the_efs_eth_20_research_team_pt_5_18 nov 2020 click view 4th ef research team amahttpswwwredditcomrethereumcommentsho2zptama_we_are_the_efs_eth_20_research_team_pt_4_10 july 2020 click view 3rd ef research team amahttpswwwredditcomrethereumcommentsez972uama_we_are_the_eth_20_research_team_pt_3 feb 2020 click view 2nd ef research team amahttpswwwredditcomrethereumcommentscdg8v6ama_we_are_the_eth_20_research_team_pt_2 july 2019 click view 1st ef research team amahttpswwwredditcomrethereumcommentsajc9ipama_we_are_the_eth_20_research_team jan 2019 x200b ama concluded,0.6908,0.06000000000000001,0.3754
Reddit,ethereum,2024-09-23 18:46:42,2024-09-24 12:18:14.622873,question next upgradeso extremely plugged happening ethereum heard next upgrade people able pay gas fee token really true would significantly undermine value eth ethereum maintain value longer required gas fee token needed converted eth used,0.6478,0.18333333333333335,0.4155666666666667
Reddit,ethereum,2024-09-23 13:23:35,2024-09-24 12:18:14.622873,top web3 platform transforming philanthropy 2024,0.2023,0.5,0.35115
Reddit,ethereum,2024-09-22 18:03:10,2024-09-24 12:18:14.622873,query ethereum mainnet snapshot beginnerso thinking running light node learn eth blockchain work started geth also need beacon client reading realized light node way slow whereas full node huge system thinking way download historic snapshot eth mainnet use locally query explore data instead always staying connected chain dont wan na use third party api client plan totally hand starter want try basic stuff like token actively exchanged wallet many type token sent null address transaction frequency account balance gas price etc new used eth wallet interacted smart contract end user perspective want see stuff work backend helpadvice would greatly appreciated thanks,0.9706,0.1274891774891775,0.5490445887445887
Reddit,ethereum,2024-09-21 09:03:29,2024-09-24 12:18:14.622873,vitalik buterin documentary vitalik ethereum story available streaming,0.0,0.2,0.1
Reddit,ethereum,2024-09-22 17:53:57,2024-09-24 12:18:14.622873,one original holder founderslong story short back ethereum originally worked best friend dead cant ask told friend developer new crypto called ethereum clue friend could friend told let add email address phone number would original share forgot find dead friend actually something email andor phone number even thing could would really nice claim sonething like dont even know turned info anyone,0.9499,0.2237603305785124,0.5868301652892562
Reddit,ethereum,2024-09-21 14:42:03,2024-09-24 12:18:14.622873,vorbit ssf circular spiral finality validator selection distribution,0.0,0.0,0.0
Reddit,ethereum,2024-09-22 13:18:23,2024-09-24 12:18:14.622873,eth deposit vanished hey guy tried deposit eth usdt poloniex exchange wallet im new crypto double checked deposit withdrawal wallet network well withdrawing transaction blockchain show transaction completed received fund poloniex wallet helpcenter created ticket say theyve forwarded detail technical team information help vet 24 hour anvone else faced issue,0.7096,0.04545454545454545,0.3775272727272727
Reddit,ethereum,2024-09-21 01:32:53,2024-09-24 12:18:14.622873,latest week ethereum news,0.0,0.5,0.25
Reddit,ethereum,2024-09-20 19:53:35,2024-09-24 12:18:14.622873,earth get geth working prysmim trying set ethereum node hobby life get geth begin syncing sits 0 claim beacon client yet oddly enough prysm running time say connects geth port 8551 problem increased verbosity geth see problem seems related repeatedly failing rlpx handshake peer although check adminpeerslength geth attach shell see ive got dozen peer however output ethsyncing show value idling 0 ive confirmed issue related jwt networkport forwarding related issue anyone else problem geth im ready throw towel switch besuteku setup damn hate walking away something like without understanding isnt working reference geth command geth syncmode snap http httpapi ethnetengineadmin authrpcport 8551 authrpcjwtsecret ethereumjwthex prysm command prysmsh beaconchain executionendpointhttplocalhost8551 jwtsecretethereumjwthex please let know anyone advice suggestion chatgpt lol idea,-0.6369,0.07500000000000001,-0.28095000000000003
Reddit,ethereum,2024-09-20 19:36:53,2024-09-24 12:18:14.622873,vitalik buterin political philosophy 21st century,0.0,0.0,0.0
Reddit,ethereum,2024-09-20 16:07:31,2024-09-24 12:18:14.622873,radically simple guide unlocking power linux web3 cartesiwhy wait dive endless building opportunity cartesi explore indepth blog post fully understand leveraging linux enhances overall developer innovation experience web3 key point superiority linux also highlighted think let discus httpscartesiiobloglinux_in_web3httpscartesiiobloglinux_in_web3,0.7783,-0.03125,0.373525
Reddit,ethereum,2024-09-20 17:10:15,2024-09-24 12:18:14.622873,ethereum film releasei got nft watch film supposed start noon east time httpsethereumfilmxyzstreaminghttpsethereumfilmxyzstreaming transaction success op network see explorer however refresh page dont see nft anywhere page refreshed show movie someone actually transaction able see movie success ui great transaction passed see confirmation almost look like 20 usd rug edit got work address httpsethereumfilmxyzhttpsethereumfilmxyz movie great far love fact available buy eth l1 l2,0.972,0.41111111111111115,0.6915555555555556
Reddit,ethereum,2024-09-20 09:21:03,2024-09-24 12:18:14.622873,self custodial app let business generate qr code usdc paymenti saw horrible user experience trump paying something bitcoin start think ethereum definitely better 2 second l2 15 second l1 cost 0002 l2 01 l1 furthermore trump use favorite currency usd form usdc know end goal make eth main currency business want receive usd converting amount eth convert back expected amount usd pointless like trump video showed great business want receive eth transaction fee would lower current reality business want receive usdc eth tried demonstrate much easier would pay usdc ethereum couldnt find self custodial wallet generates qr code address token usdc amount qr code address think good user experience would user need scan qr code click confirm doesnt need type anything kind app exist know centralized service like coinbase commerce binance pay cant find self custodial one think great adoption,0.9758,0.19444444444444448,0.5851222222222222
Reddit,ethereum,2024-09-20 07:30:02,2024-09-24 12:18:14.622873,need sepolia eth dissertationim working lending protocol bachelor dissertation due next week ive burned eth ive collected last week still test need run live environment im kinda stuck without could anyone send 12 eth finish writting thesis ill send picture graduate thanks address 0x7dea8e8f4f73a6bf7e1d5bd44002253cd3deb572,-0.1548,-0.048106060606060604,-0.1014530303030303
Reddit,ethereum,2024-09-19 20:38:15,2024-09-24 12:18:14.622873,research topic smart contract scami research work university detecting scam smart contract could tell already database contract definitely scam perhaps already solution personal question big problem 2017 2022 scam contract popular dont really follow topic maybe interesting anymore,0.0258,0.21607142857142855,0.12093571428571427
Reddit,ethereum,2024-09-19 15:26:25,2024-09-24 12:18:14.622873,transferring fee 1 exchange anotherhow much cost transfer 250 worth eth binance paypal crypto wallet using erc20 see people talking high fee transferring 1 exchange another,0.2263,0.22,0.22315000000000002
Reddit,ethereum,2024-09-18 14:46:04,2024-09-24 12:18:14.622873,account abstraction crypto beyond private keyschances come across term account abstraction dont know mean fear guide well simplify explain account abstraction matter work technically provide practical example help understand httpspreviewreddituliy7j98ykpd1pngwidth1600formatpngautowebps5ab67cd97bb20fc124f47e8b6b274325d3462423 let dive fascinating topic see transform understanding cryptocurrency httpspreviewredditcryhfe1bxkpd1pngwidth1600formatpngautowebpse2c156583b63dfe1fa0fbb46ca88fe2e33573ec4 current situation status praesens ethereum two main type account contract account externally owned account eoa eoas regular user account every action blockchain requires transaction initiated paid eoa eoas controlled private key used create signature proving ownership account contract account however controlled code instead private key account cant initiate action independently respond transaction eoas cant directly pay gas fee theyre highly programmable perform wide range operation httpspreviewredditd6l81mocxkpd1pngwidth1600formatpngautowebpsaf084112a700012423b3838f16662eb37501dbcd current setup fall short lacuna sistema atual unfriendly onboarding experience true challenge web3 lie usability user even unlock door decentralized realm must first navigate labyrinth complexity step present new hurdle use dapp one go multiple step including creating wallet securing seed phrase navigating exchange paying gas fee complexity make challenging engage seamlessly web3 application poor security relying solely private key account access pose significant risk lost stolen access account fund gone multisignature smart contract wallet provide security default remains inflexible leaving user vulnerable theft hack requirement eth balance ethereum transaction typically demand payment eth gas fee however account abstraction allows gas fee paid erc20 token making transaction flexible accessible additionally anyone cover gas fee user transaction removing requirement user hold eth balance difficulty batching transaction traditional eoas transaction requires individual approval authorization timeconsuming especially frequent transaction like gaming account abstraction streamlines process allowing multiple transaction bundled single authorization making transaction smoother convenient challenge mind let explore account abstraction address unlocks new possibility world cryptocurrency httpspreviewredditcio8hwgfxkpd1pngwidth1600formatpngautowebpsd20a3703848b92783e55ea0dfd73e806dba78490 solution account abstraction el remedio account abstraction essence enhancing smart contract wallet function like traditional wallet additional flexibility capability traditional setup wallet metamask enable user send transaction directly blockchain however account abstraction there blending role externally owned account eoas smart contract making smart contract wallet robust user perspective user standpoint account abstraction simplifies intricate working ethereum account enhances user security mitigates risk losstheft make easier intuitive user interact dapps managing complexity behind scene account abstraction make blockchain technology accessible userfriendly technical setup ethereum evms ethereum evm chain blockchain activity must initiated eoa limit usability smart contract account native account abstraction newer protocol like zksync starknet remove limitation account abstraction protocol level erc4337 introduces account abstraction transforming user account smart contract eliminates need managing private key directly enhancing security usability key feature include user operation object encapsulate transaction detail bundlers external entity aggregate multiple user operation single transaction improving efficiency decoupling user intent transaction execution simplifies user operation maintaining decentralization here breakdown work particularly erc4337 standard user operation alternative mempool instead submitting traditional transaction user create user operation submit alternative mempool allows greater customization transaction processed bundlers bundlers validate aggregate multiple user operation single transaction check proper signature authorization bundling operation reduces transaction cost improves efficiency httpspreviewredditiegallxsxkpd1pngwidth2751formatpngautowebps1fb0b8618ebf50cb583ad8fddacc7bedd411d7b3 bundled operation contract wallet bundled operation sent contract wallet central contract known entry point entry point contract coordinate validation user operation communication contract wallet interaction bundlers paymaster maintaining system integrity smooth operation contract wallet receives prepares execute bundled operation permissionless bundling anyone including miner validators become bundler permissionless nature encourages decentralization wider participation miner validators actor participate mining validating bundled user operation ensuring security integrity within alternative mempool execution payment upon validation contract wallet executes operation handle payment either ether converted token bundle transaction gas sponsored 3rd party go via paymaster sponsor gas fee enabling dapps cover user gas cost httpspreviewreddit63e86cxeykpd1pngwidth2819formatpngautowebpsa2acfbe40efdc431d5c0545467a6f08485baa028 benefit account abstraction beneficios enhanced security account abstraction developer introduce various option account authentication recovery providing better security measure user set spending limit create whitelisted account freeze account needed adding layer protection potential threat example could set daily transaction limit prevent large unauthorized transfer establish recovery option account set rule multisignature transaction multiple approval required transaction processed walletless web3 logins account abstraction user interact dapps without needing cryptocurrency wallet instead authenticate using alternative method social medium account email batching transaction account abstraction enables bundling multiple transaction single transaction feature useful executing multiple trade dex andor making batch payment automation aa open avenue automation customization possible current eoa system user customize transaction automate recurring payment streamlining process improving efficiency example could set smart contract automatically pay rent recurring expense specific date gas fee dapps smart contract programmed cover gas fee user transaction feature lower barrier entry new user sponsoring gas fee helpful may always economically viable another option allow user pay gas fee using erc20 token provides flexibility convenience user httpspreviewredditap9hgw9kxkpd1pngwidth1600formatpngautowebpsb9e35294bda82f505d43239dcf250a6ad63daf67 conclusion conclusie account abstraction major advancement simplifying blockchain cryptocurrency replacing traditional wallet smart contract wallet offer user experience convenient secure web2 application maintaining web3 principle like selfcustody decentralization use case mentioned provide merely glimpse account abstraction potential technology evolves integrates deeply blockchain ecosystem new possibility emerge lead sophisticated userfriendly secure dapps driving broader adoption innovation till stay safe key wallet httpsyoutubebb_nqcoaquuhttpsyoutubebb_nqcoaquu find helpful please support u subscribing following everythingblockchain pursuit simplifying different block chain metaverse social twitterhttpstwittercomeverythingb0x mediumhttpsmediumcomeverythingblockchain youtubehttpswwwyoutubecomchanneluckcc6eceeau1smoi2dkczcq reddithttpswwwredditcomusercyekmyster substackhttpseverythingblockchainsubstackcomaccountutm_sourcemenudropdown information provided work intended solely educational purpose must treated investment advice lapse presenting information correctly alone disclaim liability associated use content,0.999,0.07566915788613904,0.5373345789430695
Reddit,ethereum,2024-09-18 17:17:24,2024-09-24 12:18:14.622873,ethereums got talent vitaliks token2049 serenade echo legendary eth 20 rap,0.4215,1.0,0.71075
Reddit,ethereum,2024-09-18 05:40:23,2024-09-24 12:18:14.622873,psa dont get computer infected new captcha infection tactic,0.3875,0.13636363636363635,0.2619318181818182
Reddit,ethereum,2024-09-18 02:19:16,2024-09-24 12:18:14.622873,staking third party versus becoming validator helpive heard risk staking eth validator platform ie smart contract failure hacking etc become validator stake 32 eth risk deal would already lost eth multichain hack last year dont want lose eth im eager stake eth told risk ill reconsider,-0.5809,-0.0253968253968254,-0.3031484126984127
Reddit,ethereum,2024-09-17 13:11:30,2024-09-24 12:18:14.622873,validator node better rocket pool puffethi 10 eth im confused validator node start rocket pool cost 9 eth dont idea profit run 1 minipool validator puffeth run 5 validator key 10 eth im sure option make money,0.1265,0.15,0.13824999999999998
Reddit,ethereum,2024-09-16 14:28:01,2024-09-24 12:18:14.622873,vitalik speaks importance solo staking ethereums futureat ethereum singapore 2024 vitalik buterin dropped important insight solo staking key ethereums futurehttpscointelegraphcomnewsvitalikbuterinsolostakingethereumsecurity vitalik buterin samuel chong discussing network security role staking ethereum singapore 2024 source coin telegraphhttpspreviewreddit7xd6fp8jl6pd1pngwidth2992formatpngautowebpsf8eb88badbda7ad9ae70c11fb69758e00d457a08 solo staking stake ether independently staking pool third party isnt earning rewardsits boosting decentralization making network secure vitalik explained solo stakers help reduce risk posed centralized entity protect ethereum potential 51 attack also floated idea increasing ethereums block finality threshold make attack even harder pull raising current twothirds something like threequarters could gamechanger keeping ethereum resilient staking solo whats take proposal,0.6558,0.1111111111111111,0.38345555555555555
Reddit,ethereum,2024-09-17 21:33:56,2024-09-24 12:18:14.622873,safest way stake 1000000i work tradfi bought ethereum back 2018 recently seen earn passive interest staking would node liquid staking kind apy would,0.872,0.19999999999999998,0.536
Reddit,ethereum,2024-09-17 10:54:40,2024-09-24 12:18:14.622873,expected eth node apri trying spin eth node computer expected apr compare stake lido,0.0,-0.1,-0.05
Reddit,ethereum,2024-09-16 09:34:16,2024-09-24 12:18:14.622873,security auditing framework smart contract decentralized finance hello people master thesis msc blockchain digital currency university nicosia developed smart contract security auditing framework bridging traditional security standard blockchain challenge iso27001 nist owasp master thesis github repository find vulnerable smart contract created specifically thesis designed educate test security knowledge attacking smart contract demonstrate realworld vulnerability completing challenge explored thesis smart contract auditing framework indepth practical approach discussed detail enhance security practice defi space 18 episode smart contract security video available youtubelbry tuxhouse episode designed enhance security awareness among greekspeaking community check github repository httpsgithubcomsv1sjpsmart_contract_security_audithttpsgithubcomsv1sjpsmart_contract_security_audit,0.9771,0.10714285714285714,0.5421214285714285
Reddit,ethereum,2024-09-15 20:15:54,2024-09-24 12:18:14.622873,still keep ethive eth year crazy amount enough value ive never really understood passionate eth like bitcoin ive kept case shoot value whereas btc never plan sell question eth community would reason keeping im inclined buy btc forget eth altogether there compelling argument keep im open ear ____ edit thanks reply definitely food thought though cant work made confused appreciate reply though,0.7415,-0.07222222222222223,0.33463888888888893
Reddit,ethereum,2024-09-16 11:32:12,2024-09-24 12:18:14.622873,delta prime defi project hacked 6 million dollarsleaked private key cant believe project attract much money fail follow basic security principle httpsopensubstackcompubcryptocsecphackalertdeltaprimedefiprojecthttpsopensubstackcompubcryptocsecphackalertdeltaprimedefiproject,-0.7105,-0.06,-0.38525
Reddit,ethereum,2024-09-15 21:29:41,2024-09-24 12:18:14.622873,uk parliament introduces bill recognize bitcoin crypto personal property,0.0,0.0,0.0
Reddit,ethereum,2024-09-16 15:04:15,2024-09-24 12:18:14.622873,beginner question created wallet eth name say complete two transaction 24 hour secure name transaction thank,0.7096,0.25,0.4798
Reddit,ethereum,2024-09-16 19:18:52,2024-09-24 12:18:14.622873,kyc add security without compromising decentralization hey everyone ive thinking whole key fund philosophy agree also feel like there room added security especially come fund recovery preventing fraud implemented kyc wallet without compromising decentralization here im thinking 1 kyc data stored decentralized storage eg ipfs filecoin instead traditional database way central authority hold personal data 2 use zeroknowledge proof zk proof verify user without actually exposing identity mean user could prove ownership compliance without revealing personal informationmaintaining privacy transparency 3 focus managing private key fund recovery case hack scam ensuring transparency system without adding centralized control opinion would add extra layer security verifiability without compromising decentralization privacy could also help antimoney laundering aml effort offer way recover fund without needing full central control think could work decentralized privacypreserving solution improve wallet security fund recovery think still centralized even decentralized storage zk proof im still new space would love hear thought,0.9742,0.05461647727272727,0.5144082386363636
Reddit,ethereum,2024-09-16 03:17:29,2024-09-24 12:18:14.622873,lido 28 staked eth getting closer 33 also prysm used 37thoughsi would like heard honest opinion topic lido 28 staked eth close 33 prysmis used 37,0.7003,0.6,0.65015
