MainSource,Source,Publication Date,Pull_date,Pre-Processed Text,Sentiment_Vader,Sentiment_TextBlob,Average_Sentiment
RSS,https://cointelegraph.com/rss,2025-02-14 11:46:13+00:00,2025-02-14 12:18:55.158135,bnb chain flip solana daily fee beat chain addition beating solana daily fee first time since october 2024 bnb chain first chain since bitcoin beat ethereum solana daily fee,-0.4588,0.1,-0.1794
RSS,https://cointelegraph.com/rss,2025-02-14 11:41:43+00:00,2025-02-14 12:18:55.158135,elizabeth warren call elon musk bank robber dismantling cfpb elizabeth warren accuses musk trump dismantling cfpb gain financial control crypto regulation debate also heat,-0.3818,0.0,-0.1909
RSS,https://cointelegraph.com/rss,2025-02-14 11:15:33+00:00,2025-02-14 12:18:55.158135,bybit removed france amf blacklist eye mica license bybit removed france amf blacklist seek mica license eu still facing regulatory challenge india malaysia,0.0772,0.0,0.0386
RSS,https://cointelegraph.com/rss,2025-02-14 11:00:00+00:00,2025-02-14 12:18:55.158135,artificial intelligence prevent next financial crisis ai enhance financial forecasting decisionmaking ability prevent next financial crisis remains uncertain due complexity like unpredictable event,-0.5106,-0.11145833333333333,-0.3110291666666667
RSS,https://cointelegraph.com/rss,2025-02-14 10:53:21+00:00,2025-02-14 12:18:55.158135,solana bridge reach 101b alltime inbound volume solana bridge volume surged november 2024 january 2025 billion flowing network,0.0258,0.0,0.0129
RSS,https://cointelegraph.com/rss,2025-02-14 10:46:48+00:00,2025-02-14 12:18:55.158135,dogecoin doge price today doge price today may grow another 15 amid growing etf buzz supportive bullish reversal setup dogecoin,0.4404,0.5,0.4702
RSS,https://cointelegraph.com/rss,2025-02-14 10:36:31+00:00,2025-02-14 12:18:55.158135,xrp price today xrp price 7 feb 14 responding sec acknowledgment grayscales xrp etf filing elysias rwa tokenization xrp ledger,0.0,-0.1,-0.05
RSS,https://cointelegraph.com/rss,2025-02-14 10:27:20+00:00,2025-02-14 12:18:55.158135,bitcoin retail demand dip 2 analyst eye btc price breakout bitcoin retail investor demand remains healthy despite rangebound btc price action leaving new alltime high reach,0.2023,0.2240909090909091,0.21319545454545455
RSS,https://cointelegraph.com/rss,2025-02-14 10:25:53+00:00,2025-02-14 12:18:55.158135,crypto sniper make 28m czinspired broccoli memecoin 28 million profit raised insider trading allegation among crypto community,0.4404,0.0,0.2202
RSS,https://cointelegraph.com/rss,2025-02-14 09:46:52+00:00,2025-02-14 12:18:55.158135,near protocol exmanager livestreams nude apologizes girlfriend exbusiness development manager andrew krynin revealed pair nude image public call prompting response near team,0.3612,0.06666666666666667,0.21393333333333334
RSS,https://cointelegraph.com/rss,2025-02-14 09:16:05+00:00,2025-02-14 12:18:55.158135,alexander vinnik land moscow usrussia prisoner swap btce operator alexander vinnik returned russia prisoner swap exchanged american teacher marc fogel,-0.7906,0.0,-0.3953
RSS,https://cointelegraph.com/rss,2025-02-14 09:06:09+00:00,2025-02-14 12:18:55.158135,whats status bitcoin el salvador imf deal vague language el salvador 14 billion deal imf may imply might stop buying bitcoin point according samson mow,-0.3818,-0.5,-0.44089999999999996
RSS,https://cointelegraph.com/rss,2025-02-14 05:58:06+00:00,2025-02-14 12:18:55.158135,blockchain game see 3x yearonyear rise activity january dappradar dappradar reported 7 million daily unique active wallet web3 gaming last month 386 compared january 2024,0.4019,-0.03166666666666667,0.18511666666666665
RSS,https://cointelegraph.com/rss,2025-02-14 05:44:01+00:00,2025-02-14 12:18:55.158135,bitcoins chance hitting 125k june rise trader bid upside derive bitcoin remains stuck 100000 derives dr sean dawson say chance hitting 125000 late june inched 44,0.25,-0.3,-0.024999999999999994
RSS,https://cointelegraph.com/rss,2025-02-14 04:46:22+00:00,2025-02-14 12:18:55.158135,michigan becomes latest state propose crypto reserve bill bill filed michigan house would allow state buy crypto lend increase yield state fund,0.4939,0.5,0.49695
RSS,https://cointelegraph.com/rss,2025-02-14 04:25:10+00:00,2025-02-14 12:18:55.158135,sec acknowledges grayscales xrp doge etf filing security exchange commission likely face midoctober deadline decide whether grayscales xrp dogecoin etf get ground,0.34,-0.05,0.14500000000000002
RSS,https://cointelegraph.com/rss,2025-02-14 03:17:41+00:00,2025-02-14 12:18:55.158135,coinbase ceo predicts 10 global gdp crypto rail 2030 brian armstrong said u procrypto congress weve ever seen lead global change crypto regulation,0.0,0.0,0.0
RSS,https://cointelegraph.com/rss,2025-02-14 03:03:58+00:00,2025-02-14 12:18:55.158135,ether peak bearishness face tipping point tyr capital cofounder tyr capital ed hindi say sentiment around ethereum rock bottom making nearterm reversal likely,0.0,0.0,0.0
RSS,https://cointelegraph.com/rss,2025-02-14 02:32:55+00:00,2025-02-14 12:18:55.158135,gibraltar court freeze 7m play token amid crypto gaming firm internal biff usbased ready maker say court order freeze crypto token gibraltar subsidiary ready maker claim lost control,0.6705,0.05,0.36025
RSS,https://cointelegraph.com/rss,2025-02-14 02:03:17+00:00,2025-02-14 12:18:55.158135,gamestop rise 18 hour report considering investing bitcoin unofficial gamestop solanabased memecoin also saw huge surge following speculation retailer considering adding crypto balance sheet,0.3182,0.19999999999999998,0.2591
RSS,https://cointelegraph.com/rss,2025-02-14 01:47:14+00:00,2025-02-14 12:18:55.158135,ethereum devs agree stop forking around accelerate roadmap ethereum devs agreed deploy future hard fork quicker succession part broader move accelerate ethereums roadmap,0.4215,-0.14583333333333334,0.1378333333333333
RSS,https://cointelegraph.com/rss,2025-02-13 22:45:55+00:00,2025-02-14 12:18:55.158135,coinbase q4 revenue surge 88 trump election boost crypto price crypto exchange coinbase reported net income 129 billion fourth quarter 22 billion net revenue comfortably beat industry estimate,0.6705,0.1,0.38525
RSS,https://cointelegraph.com/rss,2025-02-13 22:30:00+00:00,2025-02-14 12:18:55.158135,trump cftc pick us farcaster tout nomination brian quintenzs use web3 social medium platform signal friendly stance toward crypto,0.4019,0.20416666666666666,0.3030333333333333
RSS,https://cointelegraph.com/rss,2025-02-13 22:15:00+00:00,2025-02-14 12:18:55.158135,trump sign reciprocal tariff order includes nonmonetary provision whatever charge u charging work well president donald trump told reporter signing order,0.2732,0.0,0.1366
RSS,https://cointelegraph.com/rss,2025-02-13 21:57:49+00:00,2025-02-14 12:18:55.158135,czs dog name spark broccoli memecoin frenzy changpeng zhao founder binance revealed dog name x post sparking wave memecoins named canine,-0.1027,0.0,-0.05135
RSS,https://cointelegraph.com/rss,2025-02-13 21:20:46+00:00,2025-02-14 12:18:55.158135,here happened crypto today need know happened crypto today latest news daily trend event impacting bitcoin price blockchain defi nfts web3 crypto regulation,0.0,0.25,0.125
RSS,https://cointelegraph.com/rss,2025-02-13 20:50:25+00:00,2025-02-14 12:18:55.158135,nyc prosecutor behind sam bankmanfried case resigns report acting u attorney southern district new york reportedly resigned federal justice department directed halt case nyc mayor eric adam,0.0258,-0.06590909090909092,-0.020054545454545457
RSS,https://cointelegraph.com/rss,2025-02-13 20:38:09+00:00,2025-02-14 12:18:55.158135,ethereum tvl approach 3year high eth price follow ethereums total value locked rose level seen since 2022 eth price benefit rise activity,0.6901,0.25333333333333335,0.4717166666666667
RSS,https://cointelegraph.com/rss,2025-02-13 20:09:29+00:00,2025-02-14 12:18:55.158135,u mining company feel supply squeeze bitmain shipment delay publicly traded mining company u feeling effect trade tension united state china,-0.0772,0.0,-0.0386
RSS,https://cointelegraph.com/rss,2025-02-13 19:45:21+00:00,2025-02-14 12:18:55.158135,metaplanet raise 4b jpy 0 interest bond buy btc metaplanet known microstrategy asia raised additional 4 billion jpy zerointerest bond buy bitcoin,0.4588,0.0,0.2294
RSS,https://cointelegraph.com/rss,2019-06-18 13:04:00+01:00,2025-02-14 12:18:55.158135,twitter user claim tradingview ignored fibonacci retracement bug 5 year popular chart analysis service tradingview contains bug fibonacci retracement technical analysis tool,0.128,0.3,0.214
RSS,https://bitcoinmagazine.com/.rss/full/,2025-02-14 03:00:00+00:00,2025-02-14 12:18:55.158135,bitvm got massive upgradethe bitlayer finality bridge delivering promise bitvm still far fully trustless system progress made past year remarkable,0.6565,0.15,0.40325
RSS,https://bitcoinmagazine.com/.rss/full/,2025-02-12 20:29:27+00:00,2025-02-14 12:18:55.158135,bitcoin bank build ourselvesbitcoiners shouldnt sit around wait fiat bank financial company offer service built bitcoin,0.0,0.0,0.0
RSS,https://bitcoinmagazine.com/.rss/full/,2025-02-12 16:39:01+00:00,2025-02-14 12:18:55.158135,galoy launch bitcoinbacked loan software set groundwork opensource bankinggaloy founder ceo nicolas burtey want help borrower use bitcoin collateral loan introducing opensource software traditional banking stack,0.4588,0.0,0.2294
RSS,https://bitcoinmagazine.com/.rss/full/,2025-02-11 22:37:53+00:00,2025-02-14 12:18:55.158135,future bitcoin scaling institutional adoption strategic reserve rich rinesas bitcoin continues dominate financial landscape rich rines core dao explores evolutiondelving institutional adoption defi expansion potential global reserve asset,0.8481,0.125,0.48655
RSS,https://bitcoinmagazine.com/.rss/full/,2025-02-11 18:21:31+00:00,2025-02-14 12:18:55.158135,szabos micropayments mental transaction cost 25 year latera look reality ux friction widespread micropayments would create potential solution problem,0.1779,-0.05,0.06395
RSS,https://bitcoinmagazine.com/.rss/full/,2025-02-11 17:00:37+00:00,2025-02-14 12:18:55.158135,fold launch bitcoin reward credit cardfolds bitcoin reward credit card latest addition company suite bitcoinfocused financial product,0.9118,0.25,0.5809
RSS,https://bitcoinmagazine.com/.rss/full/,2025-02-10 11:00:03+00:00,2025-02-14 12:18:55.158135,proton wallet available everyone great starter selfcustodial bitcoin walletproton wallet wellsuited anyone looking begin bitcoin self custody journey andor anyone looking make semifrequent payment onchain managing relatively small bitcoin stack,0.6249,0.3166666666666667,0.47078333333333333
RSS,https://bitcoinmagazine.com/.rss/full/,2025-02-07 21:33:45+00:00,2025-02-14 12:18:55.158135,el salvador still bitcoin countrybitcoin may longer legal tender el salvador bitcoiners country havent given mission,0.128,0.2,0.164
RSS,https://bitcoinmagazine.com/.rss/full/,2025-02-07 13:57:13+00:00,2025-02-14 12:18:55.158135,introducing bitcoin everything indicatora single metric rule bitcoin everything indicator combine multiple key metric one comprehensive tool better investment decision,0.5994,0.10714285714285715,0.35327142857142857
RSS,https://bitcoinmagazine.com/.rss/full/,2025-02-06 20:03:42+00:00,2025-02-14 12:18:55.158135,here secret investing bitcoindont use leverage dont overexpose,0.0,-0.4,-0.2
RSS,https://bitcoinmagazine.com/.rss/full/,2025-02-06 18:04:44+00:00,2025-02-14 12:18:55.158135,lightning company raising good bitcoin tether usdt bitcoin made headline last week lightning ecosystem blossoming,0.4404,0.35,0.3952
RSS,https://bitcoinmagazine.com/.rss/full/,2025-02-06 17:50:20+00:00,2025-02-14 12:18:55.158135,nostr importance censorshipresistant communication innovation human progress open communication central part fostering innovation threatened modern digital age,0.7579,0.04,0.39895
RSS,https://bitcoinmagazine.com/.rss/full/,2025-02-06 15:00:00+00:00,2025-02-14 12:18:55.158135,bitcoin payment arent future theyre alreadytake look breez 1a1zs latest report deep diving current state bitcoins use transactional payment mechanism,0.0772,0.125,0.1011
RSS,https://bitcoinmagazine.com/.rss/full/,2025-02-06 14:09:30+00:00,2025-02-14 12:18:55.158135,bitcoins core remains unbreakablewhy surviving hostility doesnt mean court itand proactive engagement secures better future,0.8271,0.0625,0.4448
RSS,https://bitcoinmagazine.com/.rss/full/,2025-02-05 18:40:49+00:00,2025-02-14 12:18:55.158135,didnt take orange pill threw outthe government hasnt orange pilled theyve simply shown new way pull revolving door grifts,0.0,0.06818181818181818,0.03409090909090909
RSS,https://bitcoinmagazine.com/.rss/full/,2025-02-05 17:22:53+00:00,2025-02-14 12:18:55.158135,blackrock launch spot bitcoin etp europethe world largest asset manager set expand bitcoin footprint internationally new exchangetraded product switzerland,0.5859,0.13636363636363635,0.36113181818181816
RSS,https://bitcoinmagazine.com/.rss/full/,2025-02-05 17:11:55+00:00,2025-02-14 12:18:55.158135,bringin make bitcoin easier spend europe bringin founder ceo prashanth chandrashekar created product make easier european live bitcoin standard onboard bitcoin,0.765,0.04545454545454545,0.4052272727272727
RSS,https://bitcoinmagazine.com/.rss/full/,2025-02-04 23:39:46+00:00,2025-02-14 12:18:55.158135,president trump crypto czar host us first press conference bitcoin digital assetsdavid sack several procrypto politician discus future bitcoin crypto industry united state firstever u press conference digital asset,0.6486,0.05,0.3493
RSS,https://bitcoinmagazine.com/.rss/full/,2025-02-04 21:16:01+00:00,2025-02-14 12:18:55.158135,smart investor buy bitcoin real estatebitcoins finite supply unmatched liquidity deflationary model make ultimate asset modern investor learn forwardthinking investor decided buy bitcoin real estate inflationary world,0.5994,0.16285714285714287,0.3811285714285715
RSS,https://bitcoinmagazine.com/.rss/full/,2025-02-03 20:32:42+00:00,2025-02-14 12:18:55.158135,cowboy reservationthe logical soundness argument ossification bitcoin getting point pure absurdity,-0.3612,0.23214285714285715,-0.06452857142857144
RSS,https://bitcoinmagazine.com/.rss/full/,2025-02-03 20:18:03+00:00,2025-02-14 12:18:55.158135,bitcoin price already peakedbitcoin recently faced 10 retracement leading concern whether bull market article explores onchain metric institutional confidence macroeconomic factor determine whether bitcoin still room growth cycle peak reached,0.743,0.0,0.3715
RSS,https://bitcoinmagazine.com/.rss/full/,2025-02-03 19:45:40+00:00,2025-02-14 12:18:55.158135,buying holding bitcoin best strategy navigate trump tariff warbitcoin safest asset today,0.8555,1.0,0.9277500000000001
RSS,https://bitcoinmagazine.com/.rss/full/,2025-02-03 17:28:13+00:00,2025-02-14 12:18:55.158135,power play bitcoins institutionalization reshaping futureare new institutional player influenced bitcoin one influencing,0.34,0.13636363636363635,0.2381818181818182
RSS,https://bitcoinmagazine.com/.rss/full/,2025-01-31 20:07:04+00:00,2025-02-14 12:18:55.158135,bitcoin benjamin franklinsaving new generation riding wave folly,0.0,0.13636363636363635,0.06818181818181818
RSS,https://bitcoinmagazine.com/.rss/full/,2025-01-31 13:45:44+00:00,2025-02-14 12:18:55.158135,bitcoin bridgeas pleb fiat job important role play,0.4939,0.4,0.44695
RSS,https://bitcoinmagazine.com/.rss/full/,2025-01-31 13:26:54+00:00,2025-02-14 12:18:55.158135,take profit bitcoin cycle peaksselling bitcoin doesnt emotional decisionlearn use key market indicator take profit strategically reaccumulate lower price,0.4864,0.0,0.2432
RSS,https://bitcoinmagazine.com/.rss/full/,2025-01-31 10:15:01+00:00,2025-02-14 12:18:55.158135,forget ecb czechia embrace bitcoin termsthe czech national bank considering adding bitcoin reserve regardless european central bank think,0.1027,0.0,0.05135
RSS,https://bitcoinmagazine.com/.rss/full/,2025-01-30 21:42:05+00:00,2025-02-14 12:18:55.158135,tether back bitcoin lightning dominance startingthe stablecoin issuer choice bring usdt back bitcoin massive win lightning network joltzs bet taproot asset,0.7964,0.2,0.4982
RSS,https://bitcoinmagazine.com/.rss/full/,2025-01-30 17:24:24+00:00,2025-02-14 12:18:55.158135,trump executive order break bitcoins fouryear market cycle trump recent executive order may signal end bitcoins historically rigid fouryear market cycle regulatory clarity institutional adoption governmentbacked initiative could policy shift usher new era sustained growtheliminating dreaded crypto winter,-0.3612,0.04545454545454545,-0.15787272727272728
RSS,https://bitcoinmagazine.com/.rss/full/,2025-01-30 17:01:53+00:00,2025-02-14 12:18:55.158135,bitcoin empowers womenbitcoin tool woman around world closed traditional financial system,0.0,-0.03333333333333333,-0.016666666666666666
RSS,https://bitcoinmagazine.com/.rss/full/,2025-01-30 16:18:30+00:00,2025-02-14 12:18:55.158135,czech national bank ass bitcoin part reserve strategythe cnb approves plan explore allocating portion 140 billion reserve bitcoin,-0.2023,0.0,-0.10115
RSS,https://bitcoinmagazine.com/.rss/full/,2025-01-30 15:06:39+00:00,2025-02-14 12:18:55.158135,grayscale investment launch bitcoin miner etfgrayscale investment launched grayscale bitcoin miner etf mnrs offering investor way gain exposure bitcoin mining industry without directly holding btc tracking indxx bitcoin miner index etf includes major player like mara riot core scientific making attractive option looking diversify bitcoinrelated equity,0.7165,0.32083333333333336,0.5186666666666667
RSS,https://bitcoinmagazine.com/.rss/full/,2025-01-30 14:09:36+00:00,2025-02-14 12:18:55.158135,bitcoin cypherpunk spirit alive well africafrom south africa kenya ghana african using bitcoin better life arent asking anyones permission,0.8074,0.19999999999999998,0.5037
RSS,https://bitcoinmagazine.com/.rss/full/,2025-01-29 18:56:28+00:00,2025-02-14 12:18:55.158135,bitcoin ultimate hedge 97t global liquidity bubblediscover bitcoins fixed supply deflationary nature make ultimate asset navigating 97 trillion global liquidity bubble learn rising money supply influence market trend position bitcoin strategic hedge fiat currency debasement,0.3612,0.02,0.19060000000000002
RSS,https://bitcoinmagazine.com/.rss/full/,2025-01-29 18:10:45+00:00,2025-02-14 12:18:55.158135,bitcoin went wrongthe priority bitcoiners starting shift wrong direction represent actual existential threat success censorship resistant resilient system,-0.4215,-0.05,-0.23575
RSS,https://bitcoinmagazine.com/.rss/full/,2025-01-29 17:38:06+00:00,2025-02-14 12:18:55.158135,forget strategic bitcoin reserve moment mining censorship backf2pool mining pool representing 11 hash power bitcoin network censoring ofacsanctioned transaction,-0.2263,0.0,-0.11315
RSS,https://bitcoinmagazine.com/.rss/full/,2025-01-29 17:29:12+00:00,2025-02-14 12:18:55.158135,cme group launch option bitcoin friday future februarycme group looking obtain regulatory approval option successful cryptocurrency product launch,0.7845,0.375,0.57975
RSS,https://bitcoinmagazine.com/.rss/full/,2025-01-29 16:10:50+00:00,2025-02-14 12:18:55.158135,czech central bank head want buy bitcoin 5 reserve allocationthe czech national bank cnb considering 5 bitcoin allocation surpassing gold reserve approved move could reshape future national reserve asset,0.6808,0.0,0.3404
RSS,https://bitcoinmagazine.com/.rss/full/,2025-01-28 19:29:07+00:00,2025-02-14 12:18:55.158135,200000 realistic bitcoin price target cycleexplore potential bitcoin price reach 200000 cycle analyze market dynamic supply demand money multiplier effect ass feasibility,-0.3182,0.05555555555555555,-0.13132222222222223
RSS,https://bitcoinmagazine.com/.rss/full/,2025-01-28 19:24:46+00:00,2025-02-14 12:18:55.158135,go reserve people wont see differencearguing bitcoin reserve fund inclusion cryptocurrencies ultimately futile fight public large doesnt see difference,-0.6705,0.07142857142857142,-0.2995357142857143
RSS,https://bitcoinmagazine.com/.rss/full/,2025-01-28 17:04:20+00:00,2025-02-14 12:18:55.158135,preston pysh explains sab 121 beat strategic bitcoin reservepreston pysh explains rescission sab 121 could permanently entrench bitcoin financial system surpassing importance strategic bitcoin reserve,0.3612,0.0,0.1806
RSS,https://bitcoinmagazine.com/.rss/full/,2025-01-28 15:30:07+00:00,2025-02-14 12:18:55.158135,game theory strategic bitcoin reserve united state throwing weight behind bitcoin would effect massive shift game theory underpinning bitcoin probably way think,0.4215,-0.30000000000000004,0.06074999999999997
RSS,https://bitcoinmagazine.com/.rss/full/,2025-01-28 15:11:28+00:00,2025-02-14 12:18:55.158135,donald trump vow propel bitcoin new heightsdavid bailey ceo bitcoin magazine share insight private conversation president donald trump expressed support bitcoin community ambitious plan outcompete global competitor,0.7906,0.09659090909090909,0.4435954545454545
RSS,https://bitcoinmagazine.com/.rss/full/,2025-01-28 13:46:52+00:00,2025-02-14 12:18:55.158135,protect bitcoin anchorwatchbecca rubenfeld anchorwatch team recently unveiled firstofitskind bitcoin custody plus insurance solution aim keep customer bitcoin safe customer well,0.836,0.25,0.5429999999999999
RSS,https://bitcoinmagazine.com/.rss/full/,2025-01-27 22:10:39+00:00,2025-02-14 12:18:55.158135,microstrategy expands bitcoin holding 471100 btc worth 46 billionmicrostrategys relentless bitcoin buying spree continues adding 10100 btc 11 billion 471100 btc treasury valued 46 billion firm reinforces commitment bitcoincentric strategy amid market volatility,0.8316,0.04999999999999999,0.44079999999999997
RSS,https://bitcoinmagazine.com/.rss/full/,2025-01-27 18:54:56+00:00,2025-02-14 12:18:55.158135,declining shortterm u treasury yield impact bitcoin pricehow shifting treasury yield signal economic uncertainty bitcoin could benefit riskon safehaven asset,0.6908,0.2,0.4454
RSS,https://bitcoinmagazine.com/.rss/full/,2025-01-27 14:53:53+00:00,2025-02-14 12:18:55.158135,nasdaq proposes inkind redemption blackrocks bitcoin etfnasdaq proposed new system blackrocks ishares bitcoin etf allowing institutional investor redeem share directly bitcoin instead cash innovative model aim streamline operation cut cost reduce market impact marking significant step forward evolution bitcoin etf,0.5859,0.2778409090909091,0.43187045454545453
RSS,https://bitcoinmagazine.com/.rss/full/,2025-01-24 19:28:07+00:00,2025-02-14 12:18:55.158135,cynic idealist bitcoinbitcoiners need stop letting extreme naive idealism jaded cynicism drive public discourse,-0.7165,-0.14166666666666666,-0.42908333333333337
RSS,https://bitcoinmagazine.com/.rss/full/,2025-01-24 18:01:45+00:00,2025-02-14 12:18:55.158135,dear president trump bitcoin reserve shitcoin reservethe u government shouldnt stockpile anything bitcoin,0.3818,0.0,0.1909
RSS,https://bitcoinmagazine.com/.rss/full/,2025-01-24 17:47:27+00:00,2025-02-14 12:18:55.158135,trump digital asset executive order may last senator lummis rightpresident trump digital asset executive order hoped luckily senator lummis taking better approach establishing strategic bitcoin reserve,0.9153,0.16666666666666666,0.5409833333333334
RSS,https://bitcoinist.com/feed/,2025-02-14 12:08:13+00:00,2025-02-14 12:18:55.158135,coinbase ceo predicts 10 crypto global gdp cryptos golden age btc bull tokenthese day crypto getting ego stroked future prospect hailed second coming messiah latest worshiper coinbase ceo brian armstrong predicts 10 global gdp crypto 2030 bullish prediction come coinbase posted rather whopping 130 revenue growth,0.7717,0.13333333333333333,0.4525166666666667
RSS,https://bitcoinist.com/feed/,2025-02-14 11:30:06+00:00,2025-02-14 12:18:55.158135,6 arrested shocking chicago kidnapping massive crypto ransomsix men accused kidnapping three family member nanny chicago townhouse october 2024 exchange cryptoransom freed next dry cleaner victim allegedly kept five day forced handing almost 15 million bitcoin btc holding crypto kidnapping case,-0.8271,-0.22023809523809526,-0.5236690476190476
RSS,https://bitcoinist.com/feed/,2025-02-14 11:09:59+00:00,2025-02-14 12:18:55.158135,new crypto explode 20 u state consider bitcoin reservewhile implementing strategic bitcoin reserve federal level isnt easy 20 u state proposed bitcoin bill includes oklahoma massachusetts ohio texas illinois north carolina plan allocate largest sum btc purchase 26b passed 20 u state would collectively buy roughly 247000 btc worth,-0.1295,0.19242424242424244,0.03146212121212122
RSS,https://bitcoinist.com/feed/,2025-02-14 10:30:11+00:00,2025-02-14 12:18:55.158135,sec cftc crypto collaboration regulator discussing revival joint advisory committeerecent report allege u security exchange commission sec commodity future trading commission cftc talk collaborate crypto regulation amid new approach shift trump industryfriendly administration related reading sec v coinbase u regulator next move reveal lot new crypto approach sec cftc,0.34,-0.014141414141414146,0.16292929292929295
RSS,https://bitcoinist.com/feed/,2025-02-14 09:49:51+00:00,2025-02-14 12:18:55.158135,gamestops ryan cohen hint bitcoin investment could spark altcoin rallyon monday gamestop ceo ryan cohen posted pic microstrategys michael saylor many saw going right insider say gamestop plan take page microstrategys book invest bitcoin btc gme share spiked 20 back rumor hitting 31 falling,0.3612,0.2619047619047619,0.31155238095238097
RSS,https://bitcoinist.com/feed/,2025-02-14 09:00:53+00:00,2025-02-14 12:18:55.158135,retail flees bitcoin xrp ethereum continue see adoptiononchain data show retail investor liquidating bitcoin wallet recently buying xrp ethereum total amount holder xrp ethereum bitcoin new post x onchain analytics firm santiment discussed latest trend total amount holder,-0.1779,0.07272727272727272,-0.05258636363636364
