MainSource,Source,Publication Date,Pull_date,Pre-Processed Text,Sentiment_Vader,Sentiment_TextBlob,Average_Sentiment
RSS,https://cointelegraph.com/rss,2025-01-22 00:06:44+00:00,2025-01-22 00:52:36.797171,trump pardon silk road creator ross ulbricht u president donald trump followed promise pardon ross ulbricht founder online drug market silk road imprisoned decade,0.4404,0.0,0.2202
RSS,https://cointelegraph.com/rss,2025-01-21 22:22:10+00:00,2025-01-22 00:52:36.797171,bitcoin hold 106k trader bite nail absence trump crypto executive order bitcoin price bounce back 106000 u dollar index cool market react positively trump economic agenda,0.6908,0.15295454545454543,0.4218772727272727
RSS,https://cointelegraph.com/rss,2025-01-21 21:41:38+00:00,2025-01-22 00:52:36.797171,here happened crypto today need know happened crypto today latest news daily trend event impacting bitcoin price blockchain defi nfts web3 crypto regulation,0.0,0.25,0.125
RSS,https://cointelegraph.com/rss,2025-01-21 21:37:19+00:00,2025-01-22 00:52:36.797171,cryptocom launch u institutional crypto investing platform singaporebased crypto conglomerate expanding footprint u market following donald trump presidential victory,0.0,0.0,0.0
RSS,https://cointelegraph.com/rss,2025-01-21 21:30:00+00:00,2025-01-22 00:52:36.797171,ethereum foundation infighting drop dapp volume put cloud eth price eths price momentum slows amid leadership dispute ethereum foundation solanas expanding dapp market share,-0.3818,0.0,-0.1909
RSS,https://cointelegraph.com/rss,2025-01-21 20:53:43+00:00,2025-01-22 00:52:36.797171,coinbase ceo future stablecoin regs likely demand full u treasury backing brian armstrong said cryptocurrency exchange would delist usdt tether comply new u legislation,0.1027,0.12159090909090908,0.11214545454545455
RSS,https://cointelegraph.com/rss,2025-01-21 20:26:10+00:00,2025-01-22 00:52:36.797171,trading bitcoin tricky here 3 key macroeconomic indicator worth following knowing buy sell bitcoin nerveracking investor btc macro cheat sheet cane island digital could ease process,-0.0516,0.075,0.011699999999999999
RSS,https://cointelegraph.com/rss,2025-01-21 20:21:47+00:00,2025-01-22 00:52:36.797171,circle acquires hashnote usyc onchain money fund deal combine issuer secondlargest stablecoin largest onchain money fund market cap,0.0,0.0,0.0
RSS,https://cointelegraph.com/rss,2025-01-21 20:08:31+00:00,2025-01-22 00:52:36.797171,sec launch crypto task force led hester peirce u financial watchdog announced jan 21 task force aimed developing regulatory framework digital asset,0.3612,-0.03333333333333333,0.16393333333333335
RSS,https://cointelegraph.com/rss,2025-01-21 19:54:46+00:00,2025-01-22 00:52:36.797171,u department government efficiency slapped lawsuit doge sued ethic watchdog nonprofit law firm federal worker union nonprofit member organization,0.1531,-0.2,-0.02345
RSS,https://cointelegraph.com/rss,2025-01-21 19:27:18+00:00,2025-01-22 00:52:36.797171,u asset manager file trump doge etf osprey fund rex share submitted filing u security exchange commission multiple crypto etf including three focused memecoins,0.8271,0.0,0.41355
RSS,https://cointelegraph.com/rss,2025-01-21 19:15:00+00:00,2025-01-22 00:52:36.797171,80 bitcoin shortterm holder back profit analyst say 039fomo full swing039 bitcoin shortterm holder profit increased panic selling also evident around 100000 despite clear technical support 95000,0.0408,0.13999999999999999,0.0904
RSS,https://cointelegraph.com/rss,2025-01-21 19:06:59+00:00,2025-01-22 00:52:36.797171,bitcoin miner see 3x profit margin despite higher network difficulty glassnodes difficulty regression model estimate cost mine single btc approximately 33900,0.3687,-0.07380952380952381,0.1474452380952381
RSS,https://cointelegraph.com/rss,2025-01-21 18:09:31+00:00,2025-01-22 00:52:36.797171,bitcoin price going crash bitcoin price maintained strong high time frame structure 100000 despite increasing conversation market top observed past 24 hour,0.34,0.21083333333333332,0.27541666666666664
RSS,https://cointelegraph.com/rss,2025-01-21 16:55:44+00:00,2025-01-22 00:52:36.797171,boa ceo say bank eager enter crypto regulator allow brian moynihan belief financial institution would gladly facilitate cryptocurrency payment clearer regulation around use established,0.7003,0.25,0.47515
RSS,https://cointelegraph.com/rss,2025-01-21 15:33:25+00:00,2025-01-22 00:52:36.797171,fake trump melania token record 48m inflow 24 hour copycat token claiming official trump melania coin recorded 48 million purchase 24 hour 12641 wallet,-0.4767,-0.5,-0.48835
RSS,https://cointelegraph.com/rss,2025-01-21 15:30:00+00:00,2025-01-22 00:52:36.797171,goat ai agent play win crypto flappy bird reboot web3 gamer goat gaming set launch ai agent play game february flappy bird game review web3 gamer,0.8225,0.0,0.41125
RSS,https://cointelegraph.com/rss,2025-01-21 14:54:14+00:00,2025-01-22 00:52:36.797171,trump family memecoins may trigger increased sec scrutiny crypto retailfueled memecoin speculation around trump memecoins could invite regulatory scrutiny crypto industry u industry insider told cointelegraph,0.4019,-0.1,0.15094999999999997
RSS,https://cointelegraph.com/rss,2025-01-21 14:20:27+00:00,2025-01-22 00:52:36.797171,vitalik claim sole authority ethereum foundation leadership vitalik buterin dismissed call leadership shakeup ethereum foundation reaffirmed authority condemned harassment aya miyaguchi,-0.7506,0.0,-0.3753
RSS,https://cointelegraph.com/rss,2025-01-21 14:12:51+00:00,2025-01-22 00:52:36.797171,dogecoin price jump 13 minute official u doge website launch doge price revers loss 13 jump 15 minute official department government efficiency website flash dogecoin token logo,0.0516,0.0,0.0258
RSS,https://cointelegraph.com/rss,2025-01-21 14:00:23+00:00,2025-01-22 00:52:36.797171,toncoin becomes telegram accepted crypto app service telegram exclusively support toncoin ton network apps service following new partnership,0.5859,0.06818181818181818,0.3270409090909091
RSS,https://cointelegraph.com/rss,2025-01-21 14:00:00+00:00,2025-01-22 00:52:36.797171,immunefi launch blockchain arbitration system bug bounty immunefi launched first blockchainbased arbitration system bug bounty aiming boost trust legal enforceability enhanced cybersecurity across industry,0.7906,0.225,0.5078
RSS,https://cointelegraph.com/rss,2025-01-21 13:56:34+00:00,2025-01-22 00:52:36.797171,bitcoin mining saved texas 18b boosted grid stability btc mining aid texas grid stability cutting 18 billion cost replacing gas peaker plant efficient demand response,0.7269,-0.6,0.06345
RSS,https://cointelegraph.com/rss,2025-01-21 13:38:38+00:00,2025-01-22 00:52:36.797171,microstrategy bought 11k btc week trump inauguration microstrategys latest bitcoin purchase firm third acquisition january largest buy 2025,0.0,0.09999999999999999,0.049999999999999996
RSS,https://cointelegraph.com/rss,2025-01-21 13:18:19+00:00,2025-01-22 00:52:36.797171,trump melania memecoins attract firsttime investor survey survey reveals trump memecoins drew firsttime investor crypto spurring adoption raising concern political token longterm effect market,0.3612,0.0,0.1806
RSS,https://cointelegraph.com/rss,2025-01-21 12:49:43+00:00,2025-01-22 00:52:36.797171,switzerland crypto valley hit 593b 17 unicorn 2024 switzerland crypto valley reached 593 billion valuation 17 unicorn 2024 capturing 29 european blockchain funding showing significant growth,0.5859,0.1875,0.3867
RSS,https://cointelegraph.com/rss,2025-01-21 12:40:51+00:00,2025-01-22 00:52:36.797171,trump melania token crash hardest memecoins bleed memecoins underperform broader crypto market doubledigit daily loss fueled sharp drop trump melania token,-0.7269,-0.0625,-0.3947
RSS,https://cointelegraph.com/rss,2025-01-21 12:40:00+00:00,2025-01-22 00:52:36.797171,trump donald trump billiondollar memecoin trump memecoin launched donald trump ahead return white house celebrates ideal attracts million investor,0.8834,0.45,0.6667
RSS,https://cointelegraph.com/rss,2025-01-21 11:59:33+00:00,2025-01-22 00:52:36.797171,musk doge agency launch official website dogecoin logo dogecoin rallied elon musk department government efficiency launched official u government website displaying dogthemed cryptocurrencys logo,0.4588,0.0,0.2294
RSS,https://cointelegraph.com/rss,2025-01-21 11:40:00+00:00,2025-01-22 00:52:36.797171,melania trump melania coin everything need know discover melania coin melania trump trending meme token understand purpose allocation significance crypto space,0.2732,0.0,0.1366
RSS,https://bitcoinmagazine.com/.rss/full/,2025-01-21 20:50:46+00:00,2025-01-22 00:52:36.797171,david bailey forecast 1m bitcoin price trump presidencydavid bailey ceo btc inc share bold prediction bitcoins future including potential reach 1 million trump presidency article delf political economic technological force shaping bitcoins role global reserve asset highlight key strategy investor align transformative potential,0.8316,0.06666666666666667,0.44913333333333333
RSS,https://bitcoinmagazine.com/.rss/full/,2025-01-21 18:00:40+00:00,2025-01-22 00:52:36.797171,trump free ross day one course didntdonald trump broke campaign promise free ross ulbricht day one presidency let hope follows next couple day,0.8402,0.26666666666666666,0.5534333333333333
RSS,https://bitcoinmagazine.com/.rss/full/,2025-01-21 17:48:19+00:00,2025-01-22 00:52:36.797171,advanced mathematical projection bitcoin bull cycle peakdiscover advanced statistical method historical data including renowned pi cycle top indicator monte carlo simulation used project bitcoins next bull cycle peak insight potential price range timing savvy investor,0.5859,0.18571428571428572,0.38580714285714285
RSS,https://bitcoinmagazine.com/.rss/full/,2025-01-21 16:48:07+00:00,2025-01-22 00:52:36.797171,bitcoin missed 54 billion opportunity neglecting runesbitcoins reluctance embrace emerging economic trend like memecoins token mean ceding market share user growth innovation competing chain like solana,0.8481,-0.056249999999999994,0.39592499999999997
RSS,https://bitcoinmagazine.com/.rss/full/,2025-01-20 15:11:26+00:00,2025-01-22 00:52:36.797171,watch bitcoin president donald trump inaugurationdonald trump inauguration first probitcoin u president herejoin bitcoin magazine live coverage 10 est,0.0,0.19318181818181818,0.09659090909090909
RSS,https://bitcoinmagazine.com/.rss/full/,2025-01-20 15:00:00+00:00,2025-01-22 00:52:36.797171,btcpay server foundation receives 25000 grant bitcoin unbankthe grant help btcpay continue work opensource payment development,0.7717,0.0,0.38585
RSS,https://bitcoinmagazine.com/.rss/full/,2025-01-19 17:27:03+00:00,2025-01-22 00:52:36.797171,trump like crypto long griftingtrump coin nothing way extract money crypto ecosystem,0.3612,-0.05,0.15560000000000002
RSS,https://bitcoinmagazine.com/.rss/full/,2025-01-17 17:55:41+00:00,2025-01-22 00:52:36.797171,president trump got bold vision bitcoin americaas president donald trump second term begin bitcoin community look bold promise bitcoin regulation national strategy economic growth whats storeand soon,0.8779,0.21666666666666667,0.5472833333333333
RSS,https://bitcoinmagazine.com/.rss/full/,2025-01-17 17:25:55+00:00,2025-01-22 00:52:36.797171,wyoming introduces bitcoin strategic reserve billa look bill proposed wyoming state level bitcoin strategic reserve,0.0,0.0,0.0
RSS,https://bitcoinmagazine.com/.rss/full/,2025-01-17 15:22:17+00:00,2025-01-22 00:52:36.797171,treat bitcoin tool cultignore mindless chanting slogan want bitcoin stack,0.0258,-0.2,-0.08710000000000001
RSS,https://bitcoinmagazine.com/.rss/full/,2025-01-17 14:34:04+00:00,2025-01-22 00:52:36.797171,updated mvrv zscore improves bitcoin price predictionsweve enhanced mvrv zscore better reflect bitcoins evolving market dynamic reduced volatility,0.8074,0.25,0.5287
RSS,https://bitcoinmagazine.com/.rss/full/,2025-01-17 14:00:00+00:00,2025-01-22 00:52:36.797171,california working towards embracing bitcoinbitcoin focused nonprofit proof workforce working office california legislation bitcoin initiative,0.3818,0.0,0.1909
RSS,https://bitcoinmagazine.com/.rss/full/,2025-01-16 18:24:39+00:00,2025-01-22 00:52:36.797171,bitcoin price history predicts february 2025discover bitcoins historical february performance posthalving trend provide insight investor expect 2025,0.0,0.0,0.0
RSS,https://bitcoinmagazine.com/.rss/full/,2025-01-16 16:37:32+00:00,2025-01-22 00:52:36.797171,coinbases bitcoin loan seemnot backed real bitcoin bitcoin blockchain better,0.4588,0.35,0.4044
RSS,https://bitcoinmagazine.com/.rss/full/,2025-01-15 22:03:40+00:00,2025-01-22 00:52:36.797171,bitcoin miner economic irrationality fatalbitcoins censorship resistance depends miner decentralization economic rationality therefore sustainability,-0.4019,0.2,-0.10094999999999998
RSS,https://bitcoinmagazine.com/.rss/full/,2025-01-15 21:30:04+00:00,2025-01-22 00:52:36.797171,u government release half bitcoin intended trump strategic reservethis bullish bitcoin,0.0,-0.16666666666666666,-0.08333333333333333
RSS,https://bitcoinmagazine.com/.rss/full/,2025-01-15 17:57:22+00:00,2025-01-22 00:52:36.797171,bitcoiners view quantum computinga breakdown type risk quantum computing pose bitcoin worried user network,-0.5106,0.0,-0.2553
RSS,https://bitcoinmagazine.com/.rss/full/,2025-01-15 17:46:01+00:00,2025-01-22 00:52:36.797171,hundred company buy bitcoin 2025bitwise cio matt hougan predicts treasury revolution forecasting hundred company buy bitcoin reserve asset within 18 month shaping transformative overlooked megatrend,0.4939,0.0,0.24695
RSS,https://bitcoinmagazine.com/.rss/full/,2025-01-15 16:27:46+00:00,2025-01-22 00:52:36.797171,mining bitcoin congo beyond journey bigblock datacenters sébastien gouspillousébastien gouspillou established bitcoin mining facility remote region world given back community process,0.0,-0.05,-0.025
RSS,https://bitcoinmagazine.com/.rss/full/,2025-01-15 16:18:01+00:00,2025-01-22 00:52:36.797171,x fiatyou sometimes hear bitcoiners claim x fiat x mean category food medicine art whatever im fan extrapolation supposed bitcoin value ill make exception actual x,0.2263,-0.2708333333333333,-0.022266666666666657
RSS,https://bitcoinmagazine.com/.rss/full/,2025-01-14 21:05:22+00:00,2025-01-22 00:52:36.797171,wear bitcoin shirt here whyyou putting target back wearing merch like,0.3612,0.0,0.1806
RSS,https://bitcoinmagazine.com/.rss/full/,2025-01-14 19:57:19+00:00,2025-01-22 00:52:36.797171,bitcoin defi finding productmarket fit runesbtcfi track compete ecosystem,0.3612,0.4,0.38060000000000005
RSS,https://bitcoinmagazine.com/.rss/full/,2025-01-14 19:13:56+00:00,2025-01-22 00:52:36.797171,repeating 2017 bitcoin bull cycleexplore potential bitcoin repeat 2017 bull cycle analyze price action investor behavior future prediction bitcoins market trajectory,0.0,0.03333333333333333,0.016666666666666666
RSS,https://bitcoinmagazine.com/.rss/full/,2025-01-14 17:01:08+00:00,2025-01-22 00:52:36.797171,syria exploring embrace bitcoinsyria fall assad considering legalization bitcoin including partially backing syrian pound mining excess energy reserve,0.5423,-0.1,0.22115
RSS,https://bitcoinmagazine.com/.rss/full/,2025-01-14 15:05:58+00:00,2025-01-22 00:52:36.797171,bitcoin explainer video going insanely viral let tell viral 40minute video best noobfriendly resource ive ever seen,0.6369,0.0,0.31845
RSS,https://bitcoinmagazine.com/.rss/full/,2025-01-14 14:53:02+00:00,2025-01-22 00:52:36.797171,nostr world biggest bitcoin circular economy join usstart sending receiving bitcoin exchange content,0.296,0.0,0.148
RSS,https://bitcoinmagazine.com/.rss/full/,2025-01-13 20:00:52+00:00,2025-01-22 00:52:36.797171,one week donald trump decide ross ulbrichts fatechances ross ulbricht soon free man,0.5106,0.4,0.45530000000000004
RSS,https://bitcoinmagazine.com/.rss/full/,2025-01-13 17:20:23+00:00,2025-01-22 00:52:36.797171,arka noego noah ark solidarity bitcoina look history polish solidarity movement overthrew communism similarity movement bitcoin natalie smolenski,0.5267,0.0,0.26335
RSS,https://bitcoinmagazine.com/.rss/full/,2025-01-10 21:05:24+00:00,2025-01-22 00:52:36.797171,may want redeem bitcoin thorchains lending serviceif thorchain creditor id withdraw bitcoin collateral,0.0516,0.0,0.0258
RSS,https://bitcoinmagazine.com/.rss/full/,2025-01-10 20:13:27+00:00,2025-01-22 00:52:36.797171,privacy shouldnt product stop treating like onethe degree scrutiny accountability privacy project bitcoin space almost nonexistent need change,0.5248,0.0,0.2624
RSS,https://bitcoinmagazine.com/.rss/full/,2025-01-10 19:03:04+00:00,2025-01-22 00:52:36.797171,spot bitcoin etf approval important moment 2024these etf set stage bullish 2024 become,0.5994,0.4,0.49970000000000003
RSS,https://bitcoinmagazine.com/.rss/full/,2025-01-10 15:30:39+00:00,2025-01-22 00:52:36.797171,pieter wuille gregory maxwell receive finney freedom prize pieter wuille gregory maxwell honoured finney freedom prize transformative contribution bitcoins scalability privacy usability,0.9595,0.0,0.47975
RSS,https://bitcoinmagazine.com/.rss/full/,2025-01-10 13:30:00+00:00,2025-01-22 00:52:36.797171,bitcoin etf lived hypebitcoin etf launched high expectation 2024 one year later analyze performance market influence whether theyve lived hype,0.128,0.08,0.10400000000000001
RSS,https://bitcoinmagazine.com/.rss/full/,2025-01-09 15:48:40+00:00,2025-01-22 00:52:36.797171,future home bitcoin mining bright new bitaxe device come market heatbit device helping everyday user mine bitcoin keeping home warm 5500 opensource mining developer continue work together push home bitcoin mining industry forward,0.7184,0.24727272727272726,0.4828363636363636
RSS,https://bitcoinmagazine.com/.rss/full/,2025-01-08 22:03:10+00:00,2025-01-22 00:52:36.797171,steve hanke wrong strategic bitcoin reserve let break outdated argument dont add,-0.6808,-0.45000000000000007,-0.5654
RSS,https://bitcoinmagazine.com/.rss/full/,2025-01-08 19:34:20+00:00,2025-01-22 00:52:36.797171,dont buy bitcoin dipnow time make sizable bitcoin purchase,0.0,0.0,0.0
RSS,https://bitcoinmagazine.com/.rss/full/,2025-01-08 19:02:07+00:00,2025-01-22 00:52:36.797171,lightning network privacy big picture dont forget nsawhile lightning might provide good privacy direct participant network case powerful adversary,0.6774,0.27499999999999997,0.47619999999999996
RSS,https://bitcoinmagazine.com/.rss/full/,2025-01-08 18:16:42+00:00,2025-01-22 00:52:36.797171,buying greenland would huge boost u bitcoin mininggreenlands abundance renewable energy cold climate make ideal place trump encourage american bitcoin mining,0.9153,0.175,0.54515
RSS,https://bitcoinmagazine.com/.rss/full/,2025-01-08 17:09:03+00:00,2025-01-22 00:52:36.797171,using mining create fully validating bitcoin usershow stratum v2 help improve bitcoin decentralization mining ecosystem overall,0.8553,0.0,0.42765
RSS,https://bitcoinmagazine.com/.rss/full/,2025-01-08 14:00:11+00:00,2025-01-22 00:52:36.797171,ledn remains bitcoins premier borrowing lending platformledns chief strategy officer cso mauricio di bartolomeo reflects choice cofounder made led six year success,0.5719,0.3,0.43594999999999995
RSS,https://bitcoinmagazine.com/.rss/full/,2025-01-07 19:10:31+00:00,2025-01-22 00:52:36.797171,bitcoin layer 2 foundation buy bitcoin treasury bitcoin layer 2 foundation building bitcoin arent storing treasury,0.0536,0.0,0.0268
RSS,https://bitcoinmagazine.com/.rss/full/,2025-01-07 16:55:11+00:00,2025-01-22 00:52:36.797171,meet jason marquez truck driver made 750000 microstrategyafter getting crypto ftx one man went michael saylor made fortune,0.0,0.0,0.0
RSS,https://bitcoinmagazine.com/.rss/full/,2025-01-07 15:13:33+00:00,2025-01-22 00:52:36.797171,laser eye upsidedown pic new bitcoin campaign flip goldbitcoin hit 100k next mission clear flip gold market cap join picfliptillgoldflip campaign help push bitcoin 1 million laser eye upsidedown pic time turn financial world headliterally,0.7579,0.05909090909090908,0.40849545454545455
RSS,https://bitcoinmagazine.com/.rss/full/,2025-01-07 14:55:00+00:00,2025-01-22 00:52:36.797171,democrat reverse stance bitcoinvan jones admits democrat paid attention crypto voter last election cycle want party moving forward offering voting bloc lip service wont enough win,0.2796,0.26666666666666666,0.27313333333333334
RSS,https://bitcoinmagazine.com/.rss/full/,2025-01-06 18:45:12+00:00,2025-01-22 00:52:36.797171,anchor evil bitcoin core destroying bitcoincriticism bitcoin core developer hitting new high absurdity illogical foundation around ridiculousness,-0.8779,-0.22590909090909086,-0.5519045454545455
RSS,https://bitcoinmagazine.com/.rss/full/,2025-01-06 17:11:57+00:00,2025-01-22 00:52:36.797171,canada elect next bitcoin world leadercanadas prime minster resigned paving way conservative party probitcoin leader replace,0.1779,0.4,0.28895000000000004
RSS,https://bitcoinmagazine.com/.rss/full/,2025-01-06 14:44:57+00:00,2025-01-22 00:52:36.797171,new pi cycle top prediction chart identifies bitcoin price market peak precisiondiscover newly launched pi cycle top prediction chart cuttingedge tool designed help professional investor anticipate bitcoins market cycle peak manage risk effectively,0.765,0.3287878787878788,0.5468939393939394
RSS,https://bitcoinmagazine.com/.rss/full/,2025-01-03 19:58:22+00:00,2025-01-22 00:52:36.797171,michael saylors trump meeting turbo bullish bitcointhe u finally active probitcoin administration coming office,0.4019,-0.13333333333333333,0.1342833333333333
RSS,https://bitcoinmagazine.com/.rss/full/,2025-01-03 18:34:50+00:00,2025-01-22 00:52:36.797171,birthday letter bitcoina letter bitcoin lesson impetuous teenager take heed teenage year,0.0,0.0,0.0
RSS,https://bitcoinmagazine.com/.rss/full/,2025-01-03 13:50:00+00:00,2025-01-22 00:52:36.797171,2025 bitcoin outlook insight backed metric market dataexplore bitcoins 2025 potential datadriven perspective analyzing key metric like mvrv zscore pi cycle oscillator macroeconomic trend uncover insight year ahead,0.3818,0.0,0.1909
RSS,https://bitcoinist.com/feed/,2025-01-21 23:00:25+00:00,2025-01-22 00:52:36.797171,bitcoin bull cycle nearing conclusion expert share key insightsbitcoin exciting weekend filled sharp volatility historic price movement leaving market buzzing anticipation cryptocurrency pushed 108000 mark reaching new alltime high ath 109350 however rally met resistance bitcoin quickly retraced low 99400 recovering dramatic swing,0.6705,0.07713636363636363,0.3738181818181818
RSS,https://bitcoinist.com/feed/,2025-01-21 21:30:27+00:00,2025-01-22 00:52:36.797171,11 bitcoin added el salvador ignores imf bolster crypto holdingsin dramatic gesture reinforces stance bitcoin el salvador bought 11 btc national reserve amount 6044 unit related reading gold bitcoin 52 american choose crypto traditional assetssurvey move follows agreement international monetary fund imf 14 billion whose,0.2732,-0.08666666666666667,0.09326666666666666
RSS,https://bitcoinist.com/feed/,2025-01-21 20:00:24+00:00,2025-01-22 00:52:36.797171,dogecoin price break falling wedge formation 50 jump possible herethe dogecoin price display strong bullish signal breaking falling wedge formation breakout successful retest wedge pattern fueled optimism potential price rally crypto analyst forecasting 50 jump new high soon falling wedge breakout signal dogecoin price rally dogecoin,0.8316,0.24661616161616162,0.5391080808080808
RSS,https://bitcoinist.com/feed/,2025-01-21 18:30:25+00:00,2025-01-22 00:52:36.797171,ethereum funding rate resume uptrend eth prepares key price breakoutseveral ethereum key metric witnessing positive sentiment following renewed upward momentum digital asset price favorable macroeconomic market condition believed bolstered uptrend eths price market dynamic reflecting potential price growth bullish sentiment building ethereum amidst improving condition encouraging trend,0.9618,0.032467532467532464,0.4971337662337662
RSS,https://bitcoinist.com/feed/,2025-01-21 18:20:19+00:00,2025-01-22 00:52:36.797171,u sec unveils new crypto task force led commissioner peirce detailsthe newly appointed procrypto acting chairman u security exchange commission sec mark uyeda announced formation dedicated digital asset task force aimed establishing clear regulatory framework industry initiative follows year heavy criticism regulator led former chair gary gensler,0.765,-0.0030303030303030377,0.3809848484848485
RSS,https://bitcoinist.com/feed/,2025-01-21 17:00:46+00:00,2025-01-22 00:52:36.797171,doge trouble elon musk face lawsuit trump take officeelon musk doge department government efficiency facing legal scrutiny yet time however lawsuit stating compliance federal transparency rule national security counselor argue doge bound federal advisory committee act 1972 law requires advisory committee,-0.3612,0.0,-0.1806
RSS,https://bitcoinist.com/feed/,2025-01-21 15:58:40+00:00,2025-01-22 00:52:36.797171,elon musk doge go live amid backlash could send 5 presales 100x 2025despite hit three lawsuit within minute trump reclaiming presidency elon musk department government efficiency doge officially live bringing attention five presales set 100x doge aim minimize federal budget 2t measure like downsizing federal workforce modernizing tech however,0.4767,0.13636363636363635,0.3065318181818182
RSS,https://bitcoinist.com/feed/,2025-01-21 15:30:24+00:00,2025-01-22 00:52:36.797171,cardano founder reveals skipped wef davoscharles hoskinson founder cardano shed light opted annual davos gathering highprofile event known drawing world elite instead hoskinson chose attend world concrete expo la vega underscoring personal passion building technology handson innovation cardano founder skip wef,0.6808,0.18333333333333335,0.43206666666666665
