MainSource,Source,Publication Date,Pull_date,Pre-Processed Text,Sentiment_Vader,Sentiment_TextBlob,Average_Sentiment
GoogleNews,ethereum,2 hours ago,2024-10-23 00:51:38.638577,breaking ethereums price slump temporary setback ethover past 24 hour ethereum eth entered known retracementa temporary dip often precedes renewed rally bullish,0.0,-0.25,-0.125
GoogleNews,ethereum,2 hours ago,2024-10-23 00:51:38.638577,scroll airdrop farmer gripe ethereum layer2 token launchethereum layer2 network scroll launched tokenbut like recent hamster kombat airdrop recipient arent happy,0.0005,0.4,0.20025
GoogleNews,ethereum,3 hours ago,2024-10-23 00:51:38.638577,ethereum investor bet longterm gain staked supply reach 29ethereum see surge longterm holding staking 29 eths total supply locked investor optimistic future price stability,0.7003,0.0,0.35015
GoogleNews,ethereum,7 minutes ago,2024-10-23 00:51:38.638577,ethereum eth outshines layer 1 rival major metricethereum seeing rapid surge unique active address uncovered cryptoquant metric boost price rally,0.6597,0.1013888888888889,0.3805444444444444
GoogleNews,ethereum,0 minutes ago,2024-10-23 00:51:38.638577,ethereum eth 3000 comeback dogecoin doge 77 billion price peak shiba inu shib 40 price growth continuehopes rally toward 3000 raised ethereums recent 15 price increase look like upward momentum encountered major obstacle,0.5584,0.03125,0.294825
GoogleNews,ethereum,0 minutes ago,2024-10-23 00:51:38.638577,ethereum price break symmetrical triangle next stop 3400the ethereum price broken key symmetrical triangle pattern signaling potential surge new level 3000,-0.6486,-0.052727272727272734,-0.35066363636363634
GoogleNews,ethereum,1 minutes ago,2024-10-23 00:51:38.638577,analyst predicts 75 upside burst ethereum see solana repeating massive 2021 surgea closely followed crypto strategist trader think ethereum eth gearing ignite big breakout rally,0.0,0.0,0.0
GoogleNews,ethereum,1 hour ago,2024-10-23 00:51:38.638577,understanding ethereums price downturn shortterm hurdle eth guest post coineaglecomkey point ethereum experienced price retracement 270 decline past 24 hour market indicator suggest possible decline,0.0,0.18333333333333335,0.09166666666666667
GoogleNews,ethereum,1 hour ago,2024-10-23 00:51:38.638577,ethereum etf see daily flow bitwises latest reportaccording farside investor ethereum etf managed bitwise reported daily flow zero million u dollar indicates new capital inflow,0.0,0.1590909090909091,0.07954545454545454
GoogleNews,ethereum,2 hours ago,2024-10-23 00:51:38.638577,solana surpass ethereum etfswap surpass doge claim top 10 crypto spotanalyst predicts solana surpass ethereum etfswap go meteoric price rally surpass dogecoin claim top 10 crypto spot,0.3818,0.5,0.44089999999999996
GoogleNews,ethereum,2 hours ago,2024-10-23 00:51:38.638577,breaking ethereums price slump temporary setback ethover past 24 hour ethereum eth entered known retracementa temporary dip often precedes renewed rally bullish,0.0,-0.25,-0.125
GoogleNews,ethereum,2 hours ago,2024-10-23 00:51:38.638577,scroll airdrop farmer gripe ethereum layer2 token launchethereum layer2 network scroll launched tokenbut like recent hamster kombat airdrop recipient arent happy,0.0005,0.4,0.20025
GoogleNews,ethereum,3 hours ago,2024-10-23 00:51:38.638577,ethereum investor bet longterm gain staked supply reach 29ethereum see surge longterm holding staking 29 eths total supply locked investor optimistic future price stability,0.7003,0.0,0.35015
GoogleNews,ethereum,3 hours ago,2024-10-23 00:51:38.638577,xrp predicted surge 30x flip ethereum 2025 according top crypto expertxrp predicted soar past 16 potentially overtaking ethereum 2025 forecasted crypto influencer ben armstrong attribute xrps rise,0.2023,0.08333333333333333,0.14281666666666668
GoogleNews,ethereum,4 hours ago,2024-10-23 00:51:38.638577,news explorer ethereum bridge layer2 base hit record held ethbases bridging smart contract associated coinbase hold record 623130 eth making eighthlargest eth holder growth eth base,0.6486,-0.4619047619047619,0.09334761904761904
GoogleNews,ethereum,4 hours ago,2024-10-23 00:51:38.638577,popcat rise top surpassing bitcoin ethereumit appears popular solanabased meme coin popcat pocat outperforming major cryptocurrencies like bitcoin btc ethereum eth solana,0.749,0.3875,0.56825
GoogleNews,ethereum,5 hours ago,2024-10-23 00:51:38.638577,ethereum could heading massive capitulation fed rate cut cycle rock eth benjamin cowena widely followed crypto analyst issuing warning ethereum eth may collapse value sync fed rate cut,-0.7506,-0.05,-0.40030000000000004
GoogleNews,ethereum,5 hours ago,2024-10-23 00:51:38.638577,bitcoin ethereum dogecoin trade sideways 66500 support need hold say trader warns 61000 could otherwise nextcryptocurrency market trading sideways tuesday cryptocurrency price gain bitcoin btcusd 6743675 003 ethereum,0.6908,0.0,0.3454
GoogleNews,ethereum,5 hours ago,2024-10-23 00:51:38.638577,ethereum price analysis prediction october 22 eth trade 2700 break critical resistanceethereum still struggling overcome critical resistance level despite recovering nicely past month,-0.8319,-0.08333333333333333,-0.45761666666666667
GoogleNews,ethereum,6 hours ago,2024-10-23 00:51:38.638577,one ethereum rival turn 100 1000 2025finbold identified one promising ethereum rival high growth potential 2025 expectation met could deliver 10fold return,0.6486,0.12,0.3843
GoogleNews,ethereum,6 hours ago,2024-10-23 00:51:38.638577,ethereum price analyst point potential shortsqueezeethereum traded near 2750 monday oct 21 rising amid broader gain crypto market bitcoin shot past 69000 however btc dipping,0.5267,-0.049999999999999996,0.23834999999999998
GoogleNews,ethereum,7 hours ago,2024-10-23 00:51:38.638577,raydium beat ethereum 24hour fee revenuessolanabased raydium clocked 34 million fee revenue oct 21 versus 335 million ethereum according defillama,0.0,0.0,0.0
GoogleNews,ethereum,7 hours ago,2024-10-23 00:51:38.638577,cryptocurrencies price prediction ethereum solana cryptos american wrap 22 octoberethereum eth decline second consecutive day tuesday facing rejection around 2700 level previous day,-0.5423,-0.05555555555555555,-0.2989277777777778
GoogleNews,ethereum,7 hours ago,2024-10-23 00:51:38.638577,beyond basic plus wallet revolutionary approach storing bitcoin ethereum binance crypto storagediscover plus wallet captivating crypto trader robust security innovative reward versatile crosschain functionality,0.886,0.3333333333333333,0.6096666666666667
GoogleNews,ethereum,7 hours ago,2024-10-23 00:51:38.638577,raydium beat ethereum 24hour fee revenueson oct 21 decentralized exchange dex raydium beat ethereum network 24hour revenue according defillama raydium hosted,0.0,0.0,0.0
GoogleNews,ethereum,7 hours ago,2024-10-23 00:51:38.638577,significant inflow bitcoin ethereum etf reported lookonchainaccording lookonchain net inflow 10 bitcoin etf amounted 4772 btc equivalent approximately 31927 million notably blackrock ishares,0.2023,0.11875,0.160525
GoogleNews,ethereum,7 hours ago,2024-10-23 00:51:38.638577,india favor cbdcs bitcoin ethereum despite top rank global adoptiondespite leading global crypto adoption india may ban private cryptocurrencies favor cbdc alternative,0.0536,-0.06000000000000001,-0.003200000000000005
GoogleNews,ethereum,8 hours ago,2024-10-23 00:51:38.638577,bitcoin hold steady 67000 ethereum xrp correct amidst rising anticipation u electionbitcoin trade 67000 tuesday holding steady day ethereum xrp corrected nearly 2 day u presidential election could,0.1027,0.14444444444444446,0.12357222222222222
GoogleNews,ethereum,8 hours ago,2024-10-23 00:51:38.638577,plume join enterprise ethereum alliance eea new chapter rwafi innovationnew york city united state october 22nd 2024 chainwire plume thrilled announce officially joined enterprise ethereum alliance,0.7845,0.36818181818181817,0.5763409090909091
GoogleNews,ethereum,8 hours ago,2024-10-23 00:51:38.638577,toncoin ecosystem decline dog hmstr see price drop investor hedging viral ethereum tokensmaller cryptocurrencies continue battle amid market fluctuation leading investor seek stable alternative coin open network ton,-0.3612,0.0,-0.1806
GoogleNews,ethereum,8 hours ago,2024-10-23 00:51:38.638577,top crypto buy blockdag blow past 100m mark ethereum solana price prediction signal recoveryblockdag excels top crypto buy eclipsing 100m record time also learn ethereum whale move solana price prediction,0.7269,0.25,0.48845
GoogleNews,ethereum,8 hours ago,2024-10-23 00:51:38.638577,buterin proposes solution combat centralization attack risk ethereumvitalik buterin outlined several solution combat increasing centralization risk ethereum network proofofstake mechanism,-0.7579,0.0,-0.37895
GoogleNews,ethereum,8 hours ago,2024-10-23 00:51:38.638577,shib burn 324 million token one week xrp ledger see huge spike active wallet vitalik buterin unveils four major milestone ethereum crypto news digest utodaydont miss latest event world crypto u,0.5267,0.20729166666666665,0.3669958333333333
GoogleNews,ethereum,8 hours ago,2024-10-23 00:51:38.638577,ethereum bullish breakout confirmed top analyst predicts 3400 targetethereum test crucial support 2600 recent volatility analyst predicts bullish breakout 3400 eth seek regain momentum,0.5423,0.225,0.38365
GoogleNews,ethereum,9 hours ago,2024-10-23 00:51:38.638577,understanding scroll scr ethereums layer 2 scaling solutionscroll scr innovative layer 2 solution ethereum utilizing zero knowledge proof enhance scalability maintaining security,0.765,0.5,0.6325000000000001
GoogleNews,ethereum,9 hours ago,2024-10-23 00:51:38.638577,ethereum classic set potential rally break 20 monthethereum classic etc capturing attention investor analyst alike recent market trend suggest etc may poised potential rally,0.25,0.06666666666666667,0.15833333333333333
GoogleNews,ethereum,9 hours ago,2024-10-23 00:51:38.638577,update ethereum price ethusd press supportethereum price ethusd face negative pressure attack 262377 level urge caution upcoming trading confirming break force,-0.8402,-0.3,-0.5700999999999999
GoogleNews,ethereum,9 hours ago,2024-10-23 00:51:38.638577,revolutionary change ahead whats next ethereums futureethereum one leading blockchain platform brink transformative upgrade vitalik buterin ethereums visionary cofounder,0.5267,0.0,0.26335
GoogleNews,ethereum,9 hours ago,2024-10-23 00:51:38.638577,100m raised blockdag cement tier 1 status presale beat ethereum toncoin news become coin toethereum price analysis point uptrend toncoin news suggests bearish trend setting mainstream asset remain volatile trader,0.3612,0.0,0.1806
GoogleNews,ethereum,0 hours ago,2024-10-23 00:51:38.638577,cardano predicted surpass bitcoin ethereum yolowirecomyolowirecom charles hoskinson founder cardano crypto ada predicting value cryptocurrency surpass bitcoin,0.34,0.0,0.17
GoogleNews,ethereum,0 hours ago,2024-10-23 00:51:38.638577,ethereum price forecast eth future market seems overheatedethereum price extends decline rejection around 2700 level monday eths estimated leverage ratio increased highest since early,-0.2263,0.05,-0.08815
GoogleNews,ethereum,0 hours ago,2024-10-23 00:51:38.638577,crypto ethereum ready bullish explosionfor past week ethereum seems full swing capturing attention investor analyst combination technical fundamental,0.3612,0.075,0.21810000000000002
GoogleNews,ethereum,0 hours ago,2024-10-23 00:51:38.638577,market expects volatility bitcoin ethereum option worth 52b set expire weekthe crypto market may gearing increased volatility bitcoin ethereum option worth 52 billion expiring week,0.5994,0.3,0.4497
GoogleNews,ethereum,0 hours ago,2024-10-23 00:51:38.638577,ethereum v solana altcoin bet upcoming altseasonethereum eth solana sol cryptocurrencies gaining momentum investor eager know one might better choice,0.802,0.5,0.651
GoogleNews,ethereum,0 hours ago,2024-10-23 00:51:38.638577,cardano predicted surpass bitcoin ethereumcharles hoskinson founder cardano crypto ada predicting value cryptocurrency surpass bitcoin crypto btc,0.34,0.0,0.17
GoogleNews,ethereum,0 hours ago,2024-10-23 00:51:38.638577,ethereum staking surge amid market optimism unlock eth power keynodenetnew york ny oct 22 2024 globe newswire continuous evolution ethereums staking ecosystem fueled remarkable growth driven market,0.8658,0.75,0.8079000000000001
GoogleNews,ethereum,0 hours ago,2024-10-23 00:51:38.638577,global leader making blockdag raise 100m ethereum bnb investor stream presale presale heavyweight blockdag made bold statement journey tier 1 status smashing past 100 million milestone 24 batch,0.3818,0.027777777777777773,0.20478888888888888
GoogleNews,ethereum,0 hours ago,2024-10-23 00:51:38.638577,vitalik buterin share vision ethereum goal achievevitalik buterin envisions ethereum scaling 100000 tps tackling centralization concern enhancing security,0.6808,0.0,0.3404
GoogleNews,ethereum,0 hours ago,2024-10-23 00:51:38.638577,ethereum lag behind bitcoin despite positive macroeconomic trend here whybitcoin demonstrated superior performance compared ethereum despite favorable macroeconomic environment cryptocurrencies,-0.5232,0.17575757575757575,-0.1737212121212121
GoogleNews,ethereum,0 hours ago,2024-10-23 00:51:38.638577,india favor cbdcs bitcoin ethereum potential banindias government leaning toward favoring central bank digital currency cbdcs private cryptos btc eth,0.6705,0.0,0.33525
GoogleNews,ethereum,1 hours ago,2024-10-23 00:51:38.638577,altcoin season kickstart ethereum eth price hit level first guest post coinpedia newsamid increased price volatility bitcoin price experienced strong pullback past 24 hour following ethereum price experienced,0.6597,0.33888888888888885,0.4992944444444444
GoogleNews,ethereum,1 hours ago,2024-10-23 00:51:38.638577,jito surpasses usdc ethereum 24hour fee boosting solanas onchain activitysolanabased liquid staking service protocol jito made significant stride blockchain industry surpassing usdc ethereum 24hour fee,0.4939,0.375,0.43445
GoogleNews,ethereum,2 hours ago,2024-10-23 00:51:38.638577,coredao bridge ethereum bitcoin 64 user surge record dapp volumesa new star world blockchainbased system coredao bridge ethereum bitcoin increased number active user 64 within,0.6249,0.001515151515151511,0.31320757575757574
GoogleNews,blockchain,3 hours ago,2024-10-23 00:51:38.638577,vultisig announces presence binance blockchain week 10m airdropthorchains new wallet standard vultisig attend binance blockchain week launch 10 million airdrop campaign,0.0,0.06818181818181818,0.03409090909090909
GoogleNews,blockchain,3 hours ago,2024-10-23 00:51:38.638577,discover ai blockchain revolutionizing data reportingin groundbreaking experiment chainlink renowned blockchain oracle service unveiled integration artificial intelligence ai,0.4767,-0.6,-0.06164999999999998
GoogleNews,blockchain,3 hours ago,2024-10-23 00:51:38.638577,blockchain name locker launch ape ape ina couple blockchainconnected name launch week image ape name bored ape yacht club picture ape sitting,-0.2732,-0.5,-0.3866
GoogleNews,blockchain,4 hours ago,2024-10-23 00:51:38.638577,peanut release instant offrampblockchain news opinion tv job london united kingdom 22nd october 2024 chainwire,0.4215,0.0,0.21075
GoogleNews,blockchain,4 hours ago,2024-10-23 00:51:38.638577,faraway reveals fchain new layer 1 gaming blockchainyuga lab goto game studio faraway recently announced introduction fchain new layer 1 blockchain built avalanche,0.0,-0.03181818181818183,-0.015909090909090914
GoogleNews,blockchain,4 hours ago,2024-10-23 00:51:38.638577,officially issued national blockchain strategycpv october 22 government issued decision 10qdttg announcing national strategy application development blockchain technology,0.0,0.0,0.0
GoogleNews,blockchain,4 hours ago,2024-10-23 00:51:38.638577,inside dmg blockchains plan canada first indigenousled ai data centersthe bitcoin mining vertically integrated blockchain firm dmg blockchain solution announced partnership malahat nation,0.3182,0.024999999999999994,0.17159999999999997
GoogleNews,blockchain,4 hours ago,2024-10-23 00:51:38.638577,top blockchain oracle provider comparisonblockchain oracle serve essential bridge blockchain ecosystem external data oracle enable smart contract interact,0.5423,0.17857142857142858,0.3604357142857143
GoogleNews,blockchain,5 hours ago,2024-10-23 00:51:38.638577,chainlink debut blockchainbased private transaction tech institutionschainlink launched privacypreserving technology institution bagging anz bank client,0.128,0.0,0.064
GoogleNews,blockchain,5 hours ago,2024-10-23 00:51:38.638577,chainlink partner major finance firm ai oracle blockchain data solution projectblockchain oracle provider chainlink provided result experiment improve corporate action data reporting using artificial intelligence,0.8074,-0.1275,0.33995
GoogleNews,blockchain,3 hours ago,2024-10-23 00:51:38.638577,vultisig announces presence binance blockchain week 10m airdropthorchains new wallet standard vultisig attend binance blockchain week launch 10 million airdrop campaign,0.0,0.06818181818181818,0.03409090909090909
GoogleNews,blockchain,3 hours ago,2024-10-23 00:51:38.638577,discover ai blockchain revolutionizing data reportingin groundbreaking experiment chainlink renowned blockchain oracle service unveiled integration artificial intelligence ai,0.4767,-0.6,-0.06164999999999998
GoogleNews,blockchain,3 hours ago,2024-10-23 00:51:38.638577,blockchain name locker launch ape ape ina couple blockchainconnected name launch week image ape name bored ape yacht club picture ape sitting,-0.2732,-0.5,-0.3866
GoogleNews,blockchain,4 hours ago,2024-10-23 00:51:38.638577,peanut release instant offrampblockchain news opinion tv job london united kingdom 22nd october 2024 chainwire,0.4215,0.0,0.21075
GoogleNews,blockchain,4 hours ago,2024-10-23 00:51:38.638577,faraway reveals fchain new layer 1 gaming blockchainyuga lab goto game studio faraway recently announced introduction fchain new layer 1 blockchain built avalanche,0.0,-0.03181818181818183,-0.015909090909090914
GoogleNews,blockchain,4 hours ago,2024-10-23 00:51:38.638577,officially issued national blockchain strategycpv october 22 government issued decision 10qdttg announcing national strategy application development blockchain technology,0.0,0.0,0.0
GoogleNews,blockchain,4 hours ago,2024-10-23 00:51:38.638577,inside dmg blockchains plan canada first indigenousled ai data centersthe bitcoin mining vertically integrated blockchain firm dmg blockchain solution announced partnership malahat nation,0.3182,0.024999999999999994,0.17159999999999997
GoogleNews,blockchain,4 hours ago,2024-10-23 00:51:38.638577,top blockchain oracle provider comparisonblockchain oracle serve essential bridge blockchain ecosystem external data oracle enable smart contract interact,0.5423,0.17857142857142858,0.3604357142857143
GoogleNews,blockchain,5 hours ago,2024-10-23 00:51:38.638577,chainlink debut blockchainbased private transaction tech institutionschainlink launched privacypreserving technology institution bagging anz bank client,0.128,0.0,0.064
GoogleNews,blockchain,5 hours ago,2024-10-23 00:51:38.638577,chainlink partner major finance firm ai oracle blockchain data solution projectblockchain oracle provider chainlink provided result experiment improve corporate action data reporting using artificial intelligence,0.8074,-0.1275,0.33995
GoogleNews,blockchain,3 hours ago,2024-10-23 00:51:38.638577,vultisig announces presence binance blockchain week 10m airdropthorchains new wallet standard vultisig attend binance blockchain week launch 10 million airdrop campaign,0.0,0.06818181818181818,0.03409090909090909
GoogleNews,blockchain,3 hours ago,2024-10-23 00:51:38.638577,discover ai blockchain revolutionizing data reportingin groundbreaking experiment chainlink renowned blockchain oracle service unveiled integration artificial intelligence ai,0.4767,-0.6,-0.06164999999999998
GoogleNews,blockchain,3 hours ago,2024-10-23 00:51:38.638577,blockchain name locker launch ape ape ina couple blockchainconnected name launch week image ape name bored ape yacht club picture ape sitting,-0.2732,-0.5,-0.3866
GoogleNews,blockchain,4 hours ago,2024-10-23 00:51:38.638577,peanut release instant offrampblockchain news opinion tv job london united kingdom 22nd october 2024 chainwire,0.4215,0.0,0.21075
GoogleNews,blockchain,4 hours ago,2024-10-23 00:51:38.638577,faraway reveals fchain new layer 1 gaming blockchainyuga lab goto game studio faraway recently announced introduction fchain new layer 1 blockchain built avalanche,0.0,-0.03181818181818183,-0.015909090909090914
GoogleNews,blockchain,4 hours ago,2024-10-23 00:51:38.638577,officially issued national blockchain strategycpv october 22 government issued decision 10qdttg announcing national strategy application development blockchain technology,0.0,0.0,0.0
GoogleNews,blockchain,4 hours ago,2024-10-23 00:51:38.638577,inside dmg blockchains plan canada first indigenousled ai data centersthe bitcoin mining vertically integrated blockchain firm dmg blockchain solution announced partnership malahat nation,0.3182,0.024999999999999994,0.17159999999999997
GoogleNews,blockchain,4 hours ago,2024-10-23 00:51:38.638577,top blockchain oracle provider comparisonblockchain oracle serve essential bridge blockchain ecosystem external data oracle enable smart contract interact,0.5423,0.17857142857142858,0.3604357142857143
GoogleNews,blockchain,5 hours ago,2024-10-23 00:51:38.638577,chainlink debut blockchainbased private transaction tech institutionschainlink launched privacypreserving technology institution bagging anz bank client,0.128,0.0,0.064
GoogleNews,blockchain,5 hours ago,2024-10-23 00:51:38.638577,chainlink partner major finance firm ai oracle blockchain data solution projectblockchain oracle provider chainlink provided result experiment improve corporate action data reporting using artificial intelligence,0.8074,-0.1275,0.33995
GoogleNews,blockchain,3 hours ago,2024-10-23 00:51:38.638577,vultisig announces presence binance blockchain week 10m airdropthorchains new wallet standard vultisig attend binance blockchain week launch 10 million airdrop campaign,0.0,0.06818181818181818,0.03409090909090909
GoogleNews,blockchain,3 hours ago,2024-10-23 00:51:38.638577,discover ai blockchain revolutionizing data reportingin groundbreaking experiment chainlink renowned blockchain oracle service unveiled integration artificial intelligence ai,0.4767,-0.6,-0.06164999999999998
GoogleNews,blockchain,3 hours ago,2024-10-23 00:51:38.638577,blockchain name locker launch ape ape ina couple blockchainconnected name launch week image ape name bored ape yacht club picture ape sitting,-0.2732,-0.5,-0.3866
GoogleNews,blockchain,4 hours ago,2024-10-23 00:51:38.638577,peanut release instant offrampblockchain news opinion tv job london united kingdom 22nd october 2024 chainwire,0.4215,0.0,0.21075
GoogleNews,blockchain,4 hours ago,2024-10-23 00:51:38.638577,faraway reveals fchain new layer 1 gaming blockchainyuga lab goto game studio faraway recently announced introduction fchain new layer 1 blockchain built avalanche,0.0,-0.03181818181818183,-0.015909090909090914
GoogleNews,blockchain,4 hours ago,2024-10-23 00:51:38.638577,officially issued national blockchain strategycpv october 22 government issued decision 10qdttg announcing national strategy application development blockchain technology,0.0,0.0,0.0
GoogleNews,blockchain,4 hours ago,2024-10-23 00:51:38.638577,inside dmg blockchains plan canada first indigenousled ai data centersthe bitcoin mining vertically integrated blockchain firm dmg blockchain solution announced partnership malahat nation,0.3182,0.024999999999999994,0.17159999999999997
GoogleNews,blockchain,4 hours ago,2024-10-23 00:51:38.638577,top blockchain oracle provider comparisonblockchain oracle serve essential bridge blockchain ecosystem external data oracle enable smart contract interact,0.5423,0.17857142857142858,0.3604357142857143
GoogleNews,blockchain,5 hours ago,2024-10-23 00:51:38.638577,chainlink debut blockchainbased private transaction tech institutionschainlink launched privacypreserving technology institution bagging anz bank client,0.128,0.0,0.064
GoogleNews,blockchain,5 hours ago,2024-10-23 00:51:38.638577,chainlink partner major finance firm ai oracle blockchain data solution projectblockchain oracle provider chainlink provided result experiment improve corporate action data reporting using artificial intelligence,0.8074,-0.1275,0.33995
GoogleNews,blockchain,5 hours ago,2024-10-23 00:51:38.638577,alchemy pay participate binance blockchain week dubai october 30thalchemy pay present binance blockchain week dubai october 3031 company exhibit latest crypto payment solution,0.128,0.25,0.189
GoogleNews,blockchain,5 hours ago,2024-10-23 00:51:38.638577,dforce token participate binance blockchain week dubai october 30thdforce token participate binance blockchain week taking place dubai october 3031 event offer insight dforce ecosystem,0.0,0.0,0.0
GoogleNews,blockchain,5 hours ago,2024-10-23 00:51:38.638577,ocean protocol participate binance blockchain week dubai october 30thocean protocol participate panel discussion titled ai web3 decentralization web3 impact generative ai binance blockchain,0.0,0.0,0.0
GoogleNews,blockchain,5 hours ago,2024-10-23 00:51:38.638577,sui open first suihub dubai empower blockchain developerssui open first suihub dubai empowering blockchain developer resource funding accelerator program growth,0.3818,0.125,0.25339999999999996
GoogleNews,blockchain,5 hours ago,2024-10-23 00:51:38.638577,mantra participate binance blockchain week dubai october 30thmantra participate binance blockchain week october 30th31st dubai event feature series panel providing platform,0.0,0.0,0.0
