MainSource,Source,Publication Date,Pull_date,Pre-Processed Text,Sentiment_Vader,Sentiment_TextBlob,Average_Sentiment
RSS,https://cointelegraph.com/rss,2025-02-04 12:15:00+00:00,2025-02-04 12:19:06.748666,039the worst thing happened ethereum039 bitcoin 160 since merge ethereums supply climbing eth whale dumping biggest rival solana gaining ground two year switch proofofstake,-0.5574,-1.0,-0.7787
RSS,https://cointelegraph.com/rss,2025-02-04 12:00:00+00:00,2025-02-04 12:19:06.748666,web3 platform travala integrates crypto payment 22m hotel trivago platform offer btc ava reward cryptocurrencybased booking trivago,0.5719,0.0,0.28595
RSS,https://cointelegraph.com/rss,2025-02-04 11:48:00+00:00,2025-02-04 12:19:06.748666,coinbase accused neglecting security costing user 300m annually crypto investigator zachxbt tanuki42 claim coinbase neglected security lapse cost user 300 million annually,-0.5423,0.0,-0.27115
RSS,https://cointelegraph.com/rss,2025-02-04 11:27:38+00:00,2025-02-04 12:19:06.748666,xrp price today xrp price 7 feb 4 responding u president trump pause canada mexico tariff chart technical warning dead cat bounce,-0.7717,-0.1,-0.43585
RSS,https://cointelegraph.com/rss,2025-02-04 11:05:20+00:00,2025-02-04 12:19:06.748666,thorchain approves plan restructure 200m debt thorchains node operator approved plan convert 200 million debt equity token community member raising concern longterm viability,0.128,0.0,0.064
RSS,https://cointelegraph.com/rss,2025-02-04 10:39:01+00:00,2025-02-04 12:19:06.748666,telegram ton exclusivity limitation necessity steve yun steve yun founder tonfocused 100 million fund tvm venture bullish ton despite toncoin market cap dropping 64 since april 2024,-0.296,0.0,-0.148
RSS,https://cointelegraph.com/rss,2025-02-04 08:05:11+00:00,2025-02-04 12:19:06.748666,uschina tariff cost bitcoin 100k mark analyst eye alltime high bitcoin fails hold six figure fresh round tradewar posturing begin market participant confident worst,-0.34,-0.12333333333333334,-0.2316666666666667
RSS,https://cointelegraph.com/rss,2025-02-04 08:00:00+00:00,2025-02-04 12:19:06.748666,stellar xlm explained work learn stellar xlm enables seamless transaction promotes financial inclusion support decentralized digital economy,0.6249,0.12,0.37245
RSS,https://cointelegraph.com/rss,2025-02-04 06:15:00+00:00,2025-02-04 12:19:06.748666,tokenized rwa market return ath level token lead crypto recovery onchain value realworld asset sector increased 94 since time last year adding nearly 4 billion three month,0.7184,0.05,0.38420000000000004
RSS,https://cointelegraph.com/rss,2025-02-04 05:59:39+00:00,2025-02-04 12:19:06.748666,u treasury sued giving elon musk doge access sensitive info u treasury accused unlawfully allowing elon musk government efficiency organization access million american personal financial data,0.6486,0.025,0.3368
RSS,https://cointelegraph.com/rss,2025-02-04 05:36:48+00:00,2025-02-04 12:19:06.748666,50 validators signal increase eth gas limit ethereum community debating whether increase gas limit saying would reduce fee others worried could destabilize network raised high,0.34,0.16,0.25
RSS,https://cointelegraph.com/rss,2025-02-04 04:18:28+00:00,2025-02-04 12:19:06.748666,crypto ai agent see remarkable traction value still unclear sygnum agentic ai crypto remains highly speculative emerging niche may gain traction year said researcher sygnum bank,0.8439,0.455,0.64945
RSS,https://cointelegraph.com/rss,2025-02-04 04:07:52+00:00,2025-02-04 12:19:06.748666,ethereum top 29k eric trump say great time add eth eric trump involved trump family world financial liberty platform told follower good time buy ether,0.9042,0.5,0.7021
RSS,https://cointelegraph.com/rss,2025-02-04 01:25:00+00:00,2025-02-04 12:19:06.748666,u charge canadian 65m kyberswap indexed finance hack u department justice charged andean medjedovic exploiting two crypto protocol alleging tried extort one sham settlement proposal,-0.0772,-0.2,-0.1386
RSS,https://cointelegraph.com/rss,2025-02-04 00:42:19+00:00,2025-02-04 12:19:06.748666,cftc probe super bowl wager offered cryptocom kalshi report u commodity regulator investigating super bowl market offered cryptocom reportedly kalshi asking comply derivative rule,0.8316,0.3333333333333333,0.5824666666666667
RSS,https://cointelegraph.com/rss,2025-02-04 00:28:39+00:00,2025-02-04 12:19:06.748666,crypto market rebound trump put canada mexico tariff hold canada mexico agreed implement policy stop flow illegal drug immigration u phone call u president donald trump,-0.5719,-0.5,-0.5359499999999999
RSS,https://cointelegraph.com/rss,2025-02-03 22:11:35+00:00,2025-02-04 12:19:06.748666,u senator hint trump latest eo could mean u buying bitcoin wyoming senator cynthia lummis suggested donald trump executive order creating u sovereign wealth fund big deal bitcoin,0.6597,0.0625,0.3611
RSS,https://cointelegraph.com/rss,2025-02-03 21:29:57+00:00,2025-02-04 12:19:06.748666,here happened crypto today need know happened crypto today latest news daily trend event impacting bitcoin price blockchain defi nfts web3 crypto regulation,0.0,0.25,0.125
RSS,https://cointelegraph.com/rss,2025-02-03 21:20:20+00:00,2025-02-04 12:19:06.748666,hyperliquid flip ethereum 7day revenue new layer1 network focused derivative trading continues gain traction ethereum face sharp revenue decline,0.7184,0.005681818181818177,0.36204090909090914
RSS,https://cointelegraph.com/rss,2025-02-03 20:35:00+00:00,2025-02-04 12:19:06.748666,trump name treasury sec acting cfpb head firing predecessor scott bessent office le week u treasury secretary also take role acting director consumer financial protection bureau,0.0516,-0.025,0.0133
RSS,https://cointelegraph.com/rss,2025-02-03 20:30:00+00:00,2025-02-04 12:19:06.748666,bitcoin bottom btc derivative point limited price downside bitcoin derivative data suggest bottom investor fear could limit recovery beyond 100000,-0.7269,-0.07142857142857142,-0.3991642857142857
RSS,https://cointelegraph.com/rss,2025-02-03 20:09:38+00:00,2025-02-04 12:19:06.748666,cboe launch 24hour stock trading traditional exchange seeking expand trading hour 247 onchain trading gain momentum,0.6908,0.0,0.3454
RSS,https://cointelegraph.com/rss,2025-02-03 19:34:10+00:00,2025-02-04 12:19:06.748666,ethereum eth price today ether price dropped much 40 last week high entire crypto market saw largest singleday liquidation event since 2022,0.0,0.05333333333333334,0.02666666666666667
RSS,https://cointelegraph.com/rss,2025-02-03 19:00:00+00:00,2025-02-04 12:19:06.748666,crypto broker uphold relaunches uk staking india reconsiders crypto policy law decoded uphold resume staking uk postregulatory change india signal potential crypto policy shift kraken prepares delist usdt europe,0.0,0.0,0.0
RSS,https://cointelegraph.com/rss,2025-02-03 18:58:32+00:00,2025-02-04 12:19:06.748666,trumpbacked world liberty financial denies token sale world liberty financials current crypto holding valued 373 million major stake ether wrapped bitcoin,0.7845,0.020833333333333332,0.4026666666666667
RSS,https://cointelegraph.com/rss,2025-02-03 18:51:48+00:00,2025-02-04 12:19:06.748666,price analysis 23 spx dxy btc eth xrp sol bnb doge ada link bitcoin select altcoins bounced back sharply indicating solid purchasing demand lower level,-0.2732,-0.041666666666666664,-0.15743333333333334
RSS,https://cointelegraph.com/rss,2025-02-03 18:06:03+00:00,2025-02-04 12:19:06.748666,microstrategy halted bitcoin purchase say hodl 30b btc since initial 250million bitcoin acquisition august 2020 microstrategy bought 471107 btc february roughly 30 billion,0.0,-0.05,-0.025
RSS,https://cointelegraph.com/rss,2025-02-03 17:26:42+00:00,2025-02-04 12:19:06.748666,kraken secures mifid license offer derivative europe recent acquisition kraken allowed offer derivative product across european union,0.3182,0.0,0.1591
RSS,https://cointelegraph.com/rss,2025-02-03 16:00:00+00:00,2025-02-04 12:19:06.748666,vc roundup bitcoin rwa bnb incubator web3 gaming secure funding hamilton treasury gate venture keplr earnos starpower hyve lab highlight latest edition vc roundup,0.6808,0.45,0.5654
RSS,https://cointelegraph.com/rss,2025-02-03 15:59:30+00:00,2025-02-04 12:19:06.748666,riskon asset trump tariff lead mass bitcoin crypto liquidation u president donald trump tariff shocked market investor fear impending trade war,-0.7845,-0.7,-0.74225
RSS,https://bitcoinmagazine.com/.rss/full/,2025-02-03 20:32:42+00:00,2025-02-04 12:19:06.748666,cowboy reservationthe logical soundness argument ossification bitcoin getting point pure absurdity,-0.3612,0.23214285714285715,-0.06452857142857144
RSS,https://bitcoinmagazine.com/.rss/full/,2025-02-03 20:18:03+00:00,2025-02-04 12:19:06.748666,bitcoin price already peakedbitcoin recently faced 10 retracement leading concern whether bull market article explores onchain metric institutional confidence macroeconomic factor determine whether bitcoin still room growth cycle peak reached,0.743,0.0,0.3715
RSS,https://bitcoinmagazine.com/.rss/full/,2025-02-03 19:45:40+00:00,2025-02-04 12:19:06.748666,buying holding bitcoin best strategy navigate trump tariff warbitcoin safest asset today,0.8555,1.0,0.9277500000000001
RSS,https://bitcoinmagazine.com/.rss/full/,2025-02-03 17:28:13+00:00,2025-02-04 12:19:06.748666,power play bitcoins institutionalization reshaping futureare new institutional player influenced bitcoin one influencing,0.34,0.13636363636363635,0.2381818181818182
RSS,https://bitcoinmagazine.com/.rss/full/,2025-01-31 20:07:04+00:00,2025-02-04 12:19:06.748666,bitcoin benjamin franklinsaving new generation riding wave folly,0.0,0.13636363636363635,0.06818181818181818
RSS,https://bitcoinmagazine.com/.rss/full/,2025-01-31 13:45:44+00:00,2025-02-04 12:19:06.748666,bitcoin bridgeas pleb fiat job important role play,0.4939,0.4,0.44695
RSS,https://bitcoinmagazine.com/.rss/full/,2025-01-31 13:26:54+00:00,2025-02-04 12:19:06.748666,take profit bitcoin cycle peaksselling bitcoin doesnt emotional decisionlearn use key market indicator take profit strategically reaccumulate lower price,0.4864,0.0,0.2432
RSS,https://bitcoinmagazine.com/.rss/full/,2025-01-31 10:15:01+00:00,2025-02-04 12:19:06.748666,forget ecb czechia embrace bitcoin termsthe czech national bank considering adding bitcoin reserve regardless european central bank think,0.1027,0.0,0.05135
RSS,https://bitcoinmagazine.com/.rss/full/,2025-01-30 21:42:05+00:00,2025-02-04 12:19:06.748666,tether back bitcoin lightning dominance startingthe stablecoin issuer choice bring usdt back bitcoin massive win lightning network joltzs bet taproot asset,0.7964,0.2,0.4982
RSS,https://bitcoinmagazine.com/.rss/full/,2025-01-30 17:24:24+00:00,2025-02-04 12:19:06.748666,trump executive order break bitcoins fouryear market cycle trump recent executive order may signal end bitcoins historically rigid fouryear market cycle regulatory clarity institutional adoption governmentbacked initiative could policy shift usher new era sustained growtheliminating dreaded crypto winter,-0.3612,0.04545454545454545,-0.15787272727272728
RSS,https://bitcoinmagazine.com/.rss/full/,2025-01-30 17:01:53+00:00,2025-02-04 12:19:06.748666,bitcoin empowers womenbitcoin tool woman around world closed traditional financial system,0.0,-0.03333333333333333,-0.016666666666666666
RSS,https://bitcoinmagazine.com/.rss/full/,2025-01-30 16:18:30+00:00,2025-02-04 12:19:06.748666,czech national bank ass bitcoin part reserve strategythe cnb approves plan explore allocating portion 140 billion reserve bitcoin,-0.2023,0.0,-0.10115
RSS,https://bitcoinmagazine.com/.rss/full/,2025-01-30 15:06:39+00:00,2025-02-04 12:19:06.748666,grayscale investment launch bitcoin miner etfgrayscale investment launched grayscale bitcoin miner etf mnrs offering investor way gain exposure bitcoin mining industry without directly holding btc tracking indxx bitcoin miner index etf includes major player like mara riot core scientific making attractive option looking diversify bitcoinrelated equity,0.7165,0.32083333333333336,0.5186666666666667
RSS,https://bitcoinmagazine.com/.rss/full/,2025-01-30 14:09:36+00:00,2025-02-04 12:19:06.748666,bitcoin cypherpunk spirit alive well africafrom south africa kenya ghana african using bitcoin better life arent asking anyones permission,0.8074,0.19999999999999998,0.5037
RSS,https://bitcoinmagazine.com/.rss/full/,2025-01-29 18:56:28+00:00,2025-02-04 12:19:06.748666,bitcoin ultimate hedge 97t global liquidity bubblediscover bitcoins fixed supply deflationary nature make ultimate asset navigating 97 trillion global liquidity bubble learn rising money supply influence market trend position bitcoin strategic hedge fiat currency debasement,0.3612,0.02,0.19060000000000002
RSS,https://bitcoinmagazine.com/.rss/full/,2025-01-29 18:10:45+00:00,2025-02-04 12:19:06.748666,bitcoin went wrongthe priority bitcoiners starting shift wrong direction represent actual existential threat success censorship resistant resilient system,-0.4215,-0.05,-0.23575
RSS,https://bitcoinmagazine.com/.rss/full/,2025-01-29 17:38:06+00:00,2025-02-04 12:19:06.748666,forget strategic bitcoin reserve moment mining censorship backf2pool mining pool representing 11 hash power bitcoin network censoring ofacsanctioned transaction,-0.2263,0.0,-0.11315
RSS,https://bitcoinmagazine.com/.rss/full/,2025-01-29 17:29:12+00:00,2025-02-04 12:19:06.748666,cme group launch option bitcoin friday future februarycme group looking obtain regulatory approval option successful cryptocurrency product launch,0.7845,0.375,0.57975
RSS,https://bitcoinmagazine.com/.rss/full/,2025-01-29 16:10:50+00:00,2025-02-04 12:19:06.748666,czech central bank head want buy bitcoin 5 reserve allocationthe czech national bank cnb considering 5 bitcoin allocation surpassing gold reserve approved move could reshape future national reserve asset,0.6808,0.0,0.3404
RSS,https://bitcoinmagazine.com/.rss/full/,2025-01-28 19:29:07+00:00,2025-02-04 12:19:06.748666,200000 realistic bitcoin price target cycleexplore potential bitcoin price reach 200000 cycle analyze market dynamic supply demand money multiplier effect ass feasibility,-0.3182,0.05555555555555555,-0.13132222222222223
RSS,https://bitcoinmagazine.com/.rss/full/,2025-01-28 19:24:46+00:00,2025-02-04 12:19:06.748666,go reserve people wont see differencearguing bitcoin reserve fund inclusion cryptocurrencies ultimately futile fight public large doesnt see difference,-0.6705,0.07142857142857142,-0.2995357142857143
RSS,https://bitcoinmagazine.com/.rss/full/,2025-01-28 17:04:20+00:00,2025-02-04 12:19:06.748666,preston pysh explains sab 121 beat strategic bitcoin reservepreston pysh explains rescission sab 121 could permanently entrench bitcoin financial system surpassing importance strategic bitcoin reserve,0.3612,0.0,0.1806
RSS,https://bitcoinmagazine.com/.rss/full/,2025-01-28 15:30:07+00:00,2025-02-04 12:19:06.748666,game theory strategic bitcoin reserve united state throwing weight behind bitcoin would effect massive shift game theory underpinning bitcoin probably way think,0.4215,-0.30000000000000004,0.06074999999999997
RSS,https://bitcoinmagazine.com/.rss/full/,2025-01-28 15:11:28+00:00,2025-02-04 12:19:06.748666,donald trump vow propel bitcoin new heightsdavid bailey ceo bitcoin magazine share insight private conversation president donald trump expressed support bitcoin community ambitious plan outcompete global competitor,0.7906,0.09659090909090909,0.4435954545454545
RSS,https://bitcoinmagazine.com/.rss/full/,2025-01-28 13:46:52+00:00,2025-02-04 12:19:06.748666,protect bitcoin anchorwatchbecca rubenfeld anchorwatch team recently unveiled firstofitskind bitcoin custody plus insurance solution aim keep customer bitcoin safe customer well,0.836,0.25,0.5429999999999999
RSS,https://bitcoinmagazine.com/.rss/full/,2025-01-27 22:10:39+00:00,2025-02-04 12:19:06.748666,microstrategy expands bitcoin holding 471100 btc worth 46 billionmicrostrategys relentless bitcoin buying spree continues adding 10100 btc 11 billion 471100 btc treasury valued 46 billion firm reinforces commitment bitcoincentric strategy amid market volatility,0.8316,0.04999999999999999,0.44079999999999997
RSS,https://bitcoinmagazine.com/.rss/full/,2025-01-27 18:54:56+00:00,2025-02-04 12:19:06.748666,declining shortterm u treasury yield impact bitcoin pricehow shifting treasury yield signal economic uncertainty bitcoin could benefit riskon safehaven asset,0.6908,0.2,0.4454
RSS,https://bitcoinmagazine.com/.rss/full/,2025-01-27 14:53:53+00:00,2025-02-04 12:19:06.748666,nasdaq proposes inkind redemption blackrocks bitcoin etfnasdaq proposed new system blackrocks ishares bitcoin etf allowing institutional investor redeem share directly bitcoin instead cash innovative model aim streamline operation cut cost reduce market impact marking significant step forward evolution bitcoin etf,0.5859,0.2778409090909091,0.43187045454545453
RSS,https://bitcoinmagazine.com/.rss/full/,2025-01-24 19:28:07+00:00,2025-02-04 12:19:06.748666,cynic idealist bitcoinbitcoiners need stop letting extreme naive idealism jaded cynicism drive public discourse,-0.7165,-0.14166666666666666,-0.42908333333333337
RSS,https://bitcoinmagazine.com/.rss/full/,2025-01-24 18:01:45+00:00,2025-02-04 12:19:06.748666,dear president trump bitcoin reserve shitcoin reservethe u government shouldnt stockpile anything bitcoin,0.3818,0.0,0.1909
RSS,https://bitcoinmagazine.com/.rss/full/,2025-01-24 17:47:27+00:00,2025-02-04 12:19:06.748666,trump digital asset executive order may last senator lummis rightpresident trump digital asset executive order hoped luckily senator lummis taking better approach establishing strategic bitcoin reserve,0.9153,0.16666666666666666,0.5409833333333334
RSS,https://bitcoinmagazine.com/.rss/full/,2025-01-24 12:47:29+00:00,2025-02-04 12:19:06.748666,brc20 bitcoin token could outshine rune efficient token standard bitcoin good thing,0.6908,0.35,0.5204
RSS,https://bitcoinmagazine.com/.rss/full/,2025-01-24 12:08:51+00:00,2025-02-04 12:19:06.748666,sec rescinds sab 121 permitting bank custody bitcointhe sec rescinded sab 121 removing barrier bank custody bitcoin crypto signaling major shift crypto regulation,-0.128,-0.04583333333333334,-0.08691666666666667
RSS,https://bitcoinmagazine.com/.rss/full/,2025-01-23 21:55:20+00:00,2025-02-04 12:19:06.748666,president trump sign executive order ban central bank digital currency cbdcthe president also assigned working group ass creation strategic bitcoin stockpile,-0.7184,0.0,-0.3592
RSS,https://bitcoinmagazine.com/.rss/full/,2025-01-23 21:19:26+00:00,2025-02-04 12:19:06.748666,trump sign executive order explore u strategic bitcoin reservepresident trump new executive order embrace bitcoin open blockchain technology ban central bank digital currency revoke prior restrictive regulationssignaling landmark policy shift toward fostering responsible innovation financial freedom united state,0.872,0.048051948051948054,0.460025974025974
RSS,https://bitcoinmagazine.com/.rss/full/,2025-01-23 17:38:39+00:00,2025-02-04 12:19:06.748666,ross free far overross last person government try make example,0.5106,0.16666666666666666,0.33863333333333334
RSS,https://bitcoinmagazine.com/.rss/full/,2025-01-23 16:29:45+00:00,2025-02-04 12:19:06.748666,donald trump right thing freeing ross ulbrichttrump delivered promise im glad,0.8126,0.39285714285714285,0.6027285714285714
RSS,https://bitcoinmagazine.com/.rss/full/,2025-01-23 15:33:00+00:00,2025-02-04 12:19:06.748666,bitcoin deep dive data analysis onchain roundupbitcoin kick 2025 bullish momentum rally sustain dive miner recovery sentiment market dynamic insight,0.3818,0.0,0.1909
RSS,https://bitcoinmagazine.com/.rss/full/,2025-01-22 19:33:10+00:00,2025-02-04 12:19:06.748666,blackrock ceo larry fink forecast 700k bitcoin price amid inflation worrieslarry fink ceo blackrock suggested bitcoin could reach 700000 per coin citing growing role hedge economic instability projection sparked discussion sovereign wealth fund highlight increasing momentum institutional adoption potential reshape market dynamic,0.8402,0.06666666666666667,0.4534333333333333
RSS,https://bitcoinmagazine.com/.rss/full/,2025-01-22 18:19:06+00:00,2025-02-04 12:19:06.748666,silk road ross ulbricht defend murdererross ulbricht free unproven allegation silk road founder overshadow well deserved pardon corner internet,0.7717,0.4,0.58585
RSS,https://bitcoinmagazine.com/.rss/full/,2025-01-22 18:11:37+00:00,2025-02-04 12:19:06.748666,making wave tampa bay bitcoin bay foundation join gasparilla parade pirateslook bitcoin bay pirate float gasparilla parade year tampa bay,0.296,-0.25,0.022999999999999993
RSS,https://bitcoinmagazine.com/.rss/full/,2025-01-22 17:40:57+00:00,2025-02-04 12:19:06.748666,bitcoin hacking edition 2025 brazilbitcoin hacking edition 2025 month away dont miss chance learn bitcoin development person best developer,0.5999,1.0,0.7999499999999999
RSS,https://bitcoinmagazine.com/.rss/full/,2025-01-22 17:21:26+00:00,2025-02-04 12:19:06.748666,ethereums looming collapse lesson blockchain integrityif founder pivoting bronze age mindset 2025 youre ngmi,-0.5719,0.0,-0.28595
RSS,https://bitcoinmagazine.com/.rss/full/,2025-01-22 12:55:02+00:00,2025-02-04 12:19:06.748666,ross ulbricht free let fight samourai devsby freeing ross bitcoin network state proven political power use make sure like developer samourai wallet dont go jail,0.8225,0.2,0.51125
RSS,https://bitcoinmagazine.com/.rss/full/,2025-01-22 03:21:28+00:00,2025-02-04 12:19:06.748666,ross ulbricht free victory bitcoin freedomross ulbrichts full pardon president trump mark monumental victory bitcoiners symbolizing justice man became beacon freedom innovation longawaited moment prof power persistence reminds u keep advocating bitcoin freedom,0.9638,0.375,0.6694
RSS,https://bitcoinmagazine.com/.rss/full/,2025-01-21 20:50:46+00:00,2025-02-04 12:19:06.748666,david bailey forecast 1m bitcoin price trump presidencydavid bailey ceo btc inc share bold prediction bitcoins future including potential reach 1 million trump presidency article delf political economic technological force shaping bitcoins role global reserve asset highlight key strategy investor align transformative potential,0.8316,0.06666666666666667,0.44913333333333333
RSS,https://bitcoinmagazine.com/.rss/full/,2025-01-21 18:00:40+00:00,2025-02-04 12:19:06.748666,trump free ross day one course didntdonald trump broke campaign promise free ross ulbricht day one presidency let hope follows next couple day,0.8402,0.26666666666666666,0.5534333333333333
RSS,https://bitcoinmagazine.com/.rss/full/,2025-01-21 17:48:19+00:00,2025-02-04 12:19:06.748666,advanced mathematical projection bitcoin bull cycle peakdiscover advanced statistical method historical data including renowned pi cycle top indicator monte carlo simulation used project bitcoins next bull cycle peak insight potential price range timing savvy investor,0.5859,0.18571428571428572,0.38580714285714285
RSS,https://bitcoinmagazine.com/.rss/full/,2025-01-21 16:48:07+00:00,2025-02-04 12:19:06.748666,bitcoin missed 54 billion opportunity neglecting runesbitcoins reluctance embrace emerging economic trend like memecoins token mean ceding market share user growth innovation competing chain like solana,0.8481,-0.056249999999999994,0.39592499999999997
RSS,https://bitcoinmagazine.com/.rss/full/,2025-01-20 15:11:26+00:00,2025-02-04 12:19:06.748666,watch bitcoin president donald trump inaugurationdonald trump inauguration first probitcoin u president herejoin bitcoin magazine live coverage 10 est,0.0,0.19318181818181818,0.09659090909090909
RSS,https://bitcoinist.com/feed/,2025-02-04 12:11:20+00:00,2025-02-04 12:19:06.748666,crypto buy february coinbase exchange come ukcoinbase make cut finally uk financial conduct authority fca approves 14 application financial institution operate country recently visited coinbase uk received standard service restricted notice message changed fca approved coinbases application exchange,0.2732,0.0,0.1366
RSS,https://bitcoinist.com/feed/,2025-02-04 12:00:46+00:00,2025-02-04 12:19:06.748666,bitcoin set 150 billion inflow trump push sovereign fund expertbitcoin could see unprecedented capital inflow ranging 150 billion 500 billion u president donald trump signed executive order monday mandating creation new sovereign wealth fund initiativewhich explicitly reference btc announcementwill helmed jointly u secretary commerce howard lutnick u,0.6486,0.36818181818181817,0.5083909090909091
RSS,https://bitcoinist.com/feed/,2025-02-04 11:35:50+00:00,2025-02-04 12:19:06.748666,trump new executive order bitcoin reserve coming wepe presale 100xwhile president trump signed executive order create american sovereign wealth fund top new crypto token wall street pepe wepe preparing list 12 day left presale there good news crypto bitcoin around corner might affect incoming altcoins like wepe,0.8885,0.24545454545454545,0.5669772727272727
RSS,https://bitcoinist.com/feed/,2025-02-04 10:30:41+00:00,2025-02-04 12:19:06.748666,cftcs inquiry cryptocom kalshi scrutiny super bowl wageringthe commodity future trading commission cftc initiated inquiry cryptocom kalshi inc regarding recently launched event contract tied super bowl reported bloomberg cryptocom vow cooperation prepared address cftcs question existing statute cftc authority request additional information company selfcertify financial,0.8885,0.13333333333333333,0.5109166666666667
RSS,https://bitcoinist.com/feed/,2025-02-04 09:30:13+00:00,2025-02-04 12:19:06.748666,bitcoin recovers 98000 coinbase whale start buyingdata show bitcoin coinbase premium gap turned back positive sign buyer returned platform bitcoin coinbase premium gap green pointed cryptoquant community analyst maartunn new post x bitcoin coinbase premium gap flipped back positive indicator,0.802,0.06515151515151514,0.4335757575757576
