MainSource,Source,Publication Date,Pull_date,Pre-Processed Text,Sentiment_Vader,Sentiment_TextBlob,Average_Sentiment
Reddit,solana,2024-10-09 19:30:45,2024-10-12 12:16:12.596752,small buy fori noticed meme coin lot small txn made time le dollar wondering purchase done since look really suspicious httpspreviewreddit9yonemaj8std1pngwidth1713formatpngautowebpsb169c50e678b88673ce3073bc9a880aaa5cb84ae,-0.4201,-0.09999999999999999,-0.26005
Reddit,solana,2024-10-10 09:10:48,2024-10-12 12:16:12.596752,tracking pumpfun tokensguys tool bot android notificationsalerts track price pumpfun token,0.0,0.0,0.0
Reddit,solana,2024-10-09 21:12:51,2024-10-12 12:16:12.596752,anyone tried solana card want know whats like,0.4215,0.0,0.21075
Reddit,solana,2024-10-09 12:58:20,2024-10-12 12:16:12.596752,biggest meme coin trader solana tell social network wallet,0.0,0.03333333333333333,0.016666666666666666
Reddit,solana,2024-10-09 20:20:51,2024-10-12 12:16:12.596752,nfts scammersare safe burn,0.4404,0.5,0.4702
Reddit,solana,2024-10-09 21:22:18,2024-10-12 12:16:12.596752,jambo exactly partnership raiinmaker anyone idea,0.0,0.25,0.125
Reddit,solana,2024-10-09 10:18:06,2024-10-12 12:16:12.596752,thought solanas recent 173m funding surgedamn saw solana raised 173m q3 highest pulled since 2022 new project like jambo phone 2 defi buzz ecosystem gearing something big curious everyones thought project dapps think take new momentum,0.5859,0.03454545454545454,0.31022272727272726
Reddit,solana,2024-10-09 17:49:19,2024-10-12 12:16:12.596752,jupiter cpi unittesting localnethey devs looking gather required information build rust program stuff afterwards call jupiter swap alone isntthe problem need set localnet testing thanks,-0.2023,0.2,-0.0011499999999999982
Reddit,solana,2024-10-09 14:16:52,2024-10-12 12:16:12.596752,product ama joe doe apepro starting 15mins,0.0,0.0,0.0
Reddit,solana,2024-10-09 02:10:09,2024-10-12 12:16:12.596752,way buy solana recurring weekly cheaper coin base writing america way buy solana recurring investment preferably weekly cheaper fee please let know thanks information,0.6369,-0.30000000000000004,0.16845
Reddit,solana,2024-10-08 18:15:54,2024-10-12 12:16:12.596752,hello solana sold etherjust bought small amount sol replace small amount staked ether myetherwallet staked,0.0,-0.25,-0.125
Reddit,solana,2024-10-09 16:14:21,2024-10-12 12:16:12.596752,liquity like project solanapretty much title say looking type lending platform 0 percent interest rate,0.6705,0.2,0.43525
Reddit,solana,2024-10-09 09:41:25,2024-10-12 12:16:12.596752,banned discord reasonhi friend mine banned discord running testnet validator reason think asked help posting log directly chat via hastebin harm involved discord id 1259469672177340439,-0.8934,0.1,-0.3967
Reddit,solana,2024-10-08 21:01:20,2024-10-12 12:16:12.596752,meme coin trend dyingeverything title personally think yes,0.4019,0.0,0.20095
Reddit,solana,2024-10-09 09:44:29,2024-10-12 12:16:12.596752,building realtime talent clash app radarclashhey everyone weve web3 gaming space realized tech thatll winits community realworld integration web3 need better network effect tackling radarclash solana radarclash let turn daily activity chess elo uber ride github contribution etc clash challenge others set wager earn rewardsbuilding local rep process gaming boring compete reallife stuff shake thing would love feedback check u radarclashhttpsxcomradar_clash hit u beta access,0.802,0.0,0.401
Reddit,solana,2024-10-08 19:33:21,2024-10-12 12:16:12.596752,crypto stolen phantom wallet please helpgood afternoon community couple hour ago today 36000 hammy token stolen phantom wallet never interacted malicious site signed contract stranger also never opened scam nft cant understand robbed afraid emptied account seed phrase although already moved fund binance think might tg since 3 hour ago decided invest token going pumpfun website saw among comment someone posted tg link supposed cto coin opened take look commenthttpspreviewreddithmtmhpa81ltd1pngwidth892formatpngautowebps08a76a8615a422e5cbfc388505b275997a6567fc opened asked verification like tg group difference one asked scan qr code stupid scanned didnt get group forgot half hour later started check wallet saw missing 36000 hammy token feared worstso checked transaction history realized indeed stoleni couldnt explain explained always avoid misusing wallet guess qr code scanned tg checked session realized telegram open session device paris france mexico guess thats managed steal token since theft happened minute foolishly scanned qr code unknown session telegram opened minute robberyhttpspreviewredditofvdbbbj3ltd1pngwidth432formatpngautowebps7e5b615984c94348471949e0b73bbfd3e4d4f062 httpspreviewredditr8fwddiz2ltd1pngwidth333formatpngautowebpsb5d35099eadf0914ee0bd658c2bb97bdb2b07539 transactionhttpspreviewreddit678skqm33ltd1pngwidth1322formatpngautowebps91f0e058cc1c2b68383d41c6f597682fc80b5495 know impossible recover token want ask help know theft believe done malicious software slipped without realizing right dont know whether format pc delete tg account thanks reading nice day,-0.8226,-0.13160173160173158,-0.4771008658008658
Reddit,solana,2024-10-09 06:45:28,2024-10-12 12:16:12.596752,getting daily list pump fun token hitting raydiumany way python easily extract daily list pumpfun token succeeded bonding curse hit raydium,0.6124,0.18333333333333335,0.3978666666666667
Reddit,solana,2024-10-09 10:43:17,2024-10-12 12:16:12.596752,someone explain community takeover work memecoin spacesomeone please explain depth community take certain coin,0.5267,0.21428571428571427,0.3704928571428571
Reddit,solana,2024-10-09 00:38:37,2024-10-12 12:16:12.596752,understanding transactionwhere get help understanding transaction tax purpose im missing historical price info red square transaction orca,0.128,-0.06666666666666667,0.03066666666666667
Reddit,solana,2024-10-08 20:41:13,2024-10-12 12:16:12.596752,multiple bot wallet infinity buysell order spamming take httpspreviewredditj5w0irvufltd1pngwidth1339formatpngautowebpse062b50227f85a50551983065e72735d63e5220d multiple bot wallet infinity buysell spamming take,-0.7351,0.0,-0.36755
Reddit,solana,2024-10-08 21:25:56,2024-10-12 12:16:12.596752,anyway filter pumpfun token trojan photonim interested pumpfun launch anyway filter upcoming new pair listing,0.4019,0.19318181818181818,0.2975409090909091
Reddit,solana,2024-10-08 19:14:55,2024-10-12 12:16:12.596752,colosseumorg final day solana radar hackathonsource httpsxcomcolosseumorgstatus1843709053131993195httpsxcomcolosseumorgstatus1843709053131993195 final day solanahttpsxcomsolana radar hackathon solo developer cofounding team across world submitting product building past couple month remember today end journey beginning httpsredditcomlink1fz8058videojxbye8eo0ltd1player lfg next generation solana product loading x200b,0.0,-0.0625,-0.03125
Reddit,solana,2024-10-08 15:28:51,2024-10-12 12:16:12.596752,would make bullx betteri want know feature would guy would want see bullx would increase profit quality trading life,0.7003,0.0,0.35015
Reddit,solana,2024-10-08 19:21:06,2024-10-12 12:16:12.596752,layer3 consumer attention layer live solanasource httpsxcomlayer3xyzstatus1843665700541608363httpsxcomlayer3xyzstatus1843665700541608363 layer3 live solanahttpsxcomsolana vision create consumer fun hub powering every next transaction weve partnered top protocol bring vertically integrated app distribution layer solana appspowered l3 token httpsredditcomlink1fz85g2videoom1dctrb1ltd1player youre new layer3 consumer fun hub powered l3 300k user monthly use layer3 explore earn trade ecosystem like uniswaphttpsxcomuniswap basehttpsxcombase lineabuildhttpsxcomlineabuild 500 use build userbase far powered 150mm transaction evm build solana every ecosystem need consumer hub distribution layer user earn trade one platform make alwaysopen appso also best place reach building layer3 incentive identity network user ecosystem layer3 importantly solanahttpsxcomsolana win goal 1 provide 247 fun every solana user best ux eco 2 create consumer distribution layer solana protocol 3 enable solana team user use l3 token whats new httpspreviewreddity2uwhtrj1ltd1pngwidth680formatpngautowebps4120452c9cee0ffd713103cb8a13ec094523c055 existing user token migration coming soon via wormholehttpsxcomwormhole native token transfer enables utility solana separate solanafocused app youre part unified layer3 ecosystem backend x200b solanas lightning fast lowcost tx enable feature possible evm excited share coming week plus 1 new leaderboards reward community 2 cube credential race lootboxes realtime token incentive 3 l3 token staking utility natively solana x200b weve partnered best solana dexes orca_sohttpsxcomorca_so raydiumprotocolhttpsxcomraydiumprotocol jupiterexchangehttpsxcomjupiterexchange driftprotocolhttpsxcomdriftprotocol meteoraaghttpsxcommeteoraag lsts jito_solhttpsxcomjito_sol web3withbinancehttpsxcomweb3withbinance solayer_labshttpsxcomsolayer_labs marinadefinancehttpsxcommarinadefinance sanctumsohttpsxcomsanctumso wallet phantomhttpsxcomphantom solflare_wallethttpsxcomsolflare_wallet backpackhttpsxcombackpack magicedenhttpsxcommagiceden birdeye_sohttpsxcombirdeye_so ondofinancehttpsxcomondofinance arciumhqhttpsxcomarciumhq marginfihttpsxcommarginfi httpspreviewredditmejtyk6s1ltd1pngwidth680formatpngautowebps7465c1806e84479f3386d65061e185a459e13c1b head layer3 solana open first daily loot box join see top 1000 user come back avg 325 day row counting httpspreviewredditpi6m3c4u1ltd1pngwidth680formatpngautowebps9bf80f2892bae71e09d47ab95413f7e870bf4e1c,0.9953,0.3211174242424243,0.6582087121212121
Reddit,solana,2024-10-08 10:11:51,2024-10-12 12:16:12.596752,sent solana token cex addressive sent solana token mistake phantom sol address cex token listen cex im aware process solana wondering contact support could help send back token anyone experienced kind mistake happy end thanks cooked,0.891,0.4416666666666667,0.6663333333333333
Reddit,solana,2024-10-08 07:43:29,2024-10-12 12:16:12.596752,superteamuk solana event 900k prize medium grant cointelegraph httpslumastukdemoday,0.7003,0.0,0.35015
Reddit,solana,2024-10-07 12:10:54,2024-10-12 12:16:12.596752,solana project raised 170m q3 2024,0.0,0.0,0.0
Reddit,solana,2024-10-07 14:37:22,2024-10-12 12:16:12.596752,xandeum jump breakpoint 2024 full surprise,0.2732,0.35,0.3116
Reddit,solana,2024-10-07 21:42:24,2024-10-12 12:16:12.596752,see insider photon bot anyone know see insider photon used bullx seeing rat icon,0.0,0.0,0.0
Reddit,solana,2024-10-08 02:28:56,2024-10-12 12:16:12.596752,solana false transactionhey everybody get back sol token sent false adresse,0.0,-0.2666666666666667,-0.13333333333333336
Reddit,solana,2024-10-07 16:52:26,2024-10-12 12:16:12.596752,sonic solana x ethereum compatible gaming blockchain backpack learn,0.0,0.0,0.0
Reddit,solana,2024-10-08 00:42:09,2024-10-12 12:16:12.596752,im launching first project pumpfun legitimate project advice working personal passion project quite time pretty well established team thats growing daily everything ready launch coin im bit nervous first launch spent lot time developing concept idea tip one give first time dev im best learn in out go advice suggestion would amazing thank time,0.9659,0.27,0.61795
Reddit,solana,2024-10-07 20:50:14,2024-10-12 12:16:12.596752,memecoin bot question tgsup guy wanted ask u guy exists bot give notification something bond dex paid volume coin asking bot telegram,0.0,0.0,0.0
Reddit,solana,2024-10-07 17:20:03,2024-10-12 12:16:12.596752,hi need help contract code rustif someone experience writing solana contract help debug please help,0.8555,0.0,0.42775
Reddit,solana,2024-10-07 06:44:47,2024-10-12 12:16:12.596752,heap 001 cent buy sell solana meme coinsdoes anyone know mean meme coin get flooooded 001 cent buy sell ive asked people either dont know avoid question lol cheershttpspreviewredditrq0vt7yy5atd1pngwidth1362formatpngautowebps205241e0ea3410eb868293df30cdd4ab26babf75,0.5702,0.24375000000000002,0.40697500000000003
Reddit,solana,2024-10-07 09:33:38,2024-10-12 12:16:12.596752,im new want ask quick question withdraw usdt phantom wallet binance 4 chain phantom wallet polygon cheapest 01usdt sol 150 question use polygon network transfer usdt wallet cheapest instead using sol network thing dont know polygon im afraid usdt gone forever thanks,0.4939,0.017424242424242425,0.25566212121212123
Reddit,solana,2024-10-07 04:49:13,2024-10-12 12:16:12.596752,vet audit new memecoin decrease risk ruggedhello degens scammer dont write nonsensical response im wanting know vet audit potential new memecoin honestly bit experience crypto really break like im 15 year old bad case brain rot want know criterion an check would ascertain investing memecoin eg online tool would use solana know dex screener would look owns large amount supply percentage relevant information youd investigate base conclusion thanks,0.5233,0.04427390791027158,0.28378695395513576
Reddit,ethereum,2024-09-03 14:41:57,2024-10-12 12:16:12.596752,ama ef research pt 12 05 september 2024notice closed thank participating look forward soon member ethereum foundation research team back answer question throughout day 12th amahttpsredditzendeskcomhcenusarticles115002427523whatisanamaandwhywouldihostone lot member taking part keep question coming enjoy click view 11th ef research team amahttpswwwredditcomrethereumcomments191kke6ama_we_are_ef_research_pt_11_10_january_2024 jan 2024 click view 10th ef research team amahttpswwwredditcomrethereumcomments14vpyb3ama_we_are_ef_research_pt_10_12_july_2023 july 2023 click view 9th ef research team amahttpswwwredditcomrethereumcomments107cqi8ama_we_are_ef_research_pt_9_11_january_2023 jan 2023 click view 8th ef research team amahttpswwwredditcomrethereumcommentsvrx9xeama_we_are_ef_research_pt_8_07_july_2022 july 2022 click view 7th ef research team amahttpswwwredditcomrethereumcommentsrwojtkama_we_are_the_efs_research_team_pt_7_07_january jan 2022 click view 6th ef research team amahttpswwwredditcomrethereumcommentso4unlpama_we_are_the_efs_research_team_pt_6_23_june_2021 june 2021 click view 5th ef research team amahttpswwwredditcomrethereumcommentsjvkoatama_we_are_the_efs_eth_20_research_team_pt_5_18 nov 2020 click view 4th ef research team amahttpswwwredditcomrethereumcommentsho2zptama_we_are_the_efs_eth_20_research_team_pt_4_10 july 2020 click view 3rd ef research team amahttpswwwredditcomrethereumcommentsez972uama_we_are_the_eth_20_research_team_pt_3 feb 2020 click view 2nd ef research team amahttpswwwredditcomrethereumcommentscdg8v6ama_we_are_the_eth_20_research_team_pt_2 july 2019 click view 1st ef research team amahttpswwwredditcomrethereumcommentsajc9ipama_we_are_the_eth_20_research_team jan 2019 x200b ama concluded,0.6908,0.06000000000000001,0.3754
Reddit,ethereum,2024-10-12 08:15:40,2024-10-12 12:16:12.596752,layer 2 scalability really undermine ethereums valuelately ive seeing post mostly x explaining opinion certain price eth go argument ethereums scalability based l2 lead growing reduction user rely l1 fee paid l2s l1 extremely low almost free translates lower revenue l1 l2s roadmap play would basically result divergence ethereum l1 utility increasing number user l2s settling ethereum eth price decreasing lower fee geenrated l1 another argument thats often heard successful l2s mediumlong term completely detach ethereum becoming independent l1s taking user base regarding last argument find unlikely since value ethereum lie precisely degree decentralization censorship resistance thats something l2s easily achieve overnight unless l2 want become centralized l1 like others wouldnt make sense detach ethereum first argument issue fee paid l2s settle transaction l1 definitely relevant currently low doesnt mean cant change future ethereums main value provide decentralized censorshipresistant layer settling transaction chain characteristic aside perhaps bitcoin ethereum l1 charge appropriate fee l2s settlement think,0.731,0.140232683982684,0.43561634199134197
Reddit,ethereum,2024-10-12 04:52:12,2024-10-12 12:16:12.596752,quickest way swap sweth ethi unstaked swell eth want back eth say take 12 day quick way,0.0772,0.16666666666666666,0.12193333333333334
Reddit,ethereum,2024-10-12 10:15:17,2024-10-12 12:16:12.596752,crypto suck mostly gambling ponzis narrative moneygrab garbage decided build cryptoonly use case like transparent ondemand loan familyfriends vault let store asset stream subscription would really appreciate feedback alpha,0.624,0.35,0.487
Reddit,ethereum,2024-10-11 23:13:08,2024-10-12 12:16:12.596752,latest week ethereum news,0.0,0.5,0.25
Reddit,ethereum,2024-10-11 18:21:43,2024-10-12 12:16:12.596752,binance coinbasenot individualsare taking full advantage ethereum layer2 benefit here,0.6124,0.35,0.4812
Reddit,ethereum,2024-10-11 07:51:56,2024-10-12 12:16:12.596752,welcome future shutterized gnosis chain become blueprint base layer neutrality,0.4588,0.0,0.2294
Reddit,ethereum,2024-10-11 20:56:16,2024-10-12 12:16:12.596752,ecodev research fellowship call application ethereum foundation blog,0.0,0.0,0.0
Reddit,ethereum,2024-10-11 14:55:38,2024-10-12 12:16:12.596752,dapps monitoringhi know similar solution like dapp radar monitoring ethereum dapps data,0.5859,0.0,0.29295
Reddit,ethereum,2024-10-12 02:25:41,2024-10-12 12:16:12.596752,triple bottom 4hri think pattern forming daily 4hr triple bottom perhaps,0.0,0.0,0.0
Reddit,ethereum,2024-10-11 14:10:12,2024-10-12 12:16:12.596752,gas feesgas fee really high week bridging etc someone put perspective,0.0,0.16,0.08
Reddit,ethereum,2024-10-10 08:08:28,2024-10-12 12:16:12.596752,vitalik buterin surprising contender 2024 nobel prize economics,0.7096,0.7,0.7048
Reddit,ethereum,2024-10-11 06:02:27,2024-10-12 12:16:12.596752,binance profit launchpoolrecently scroll staking bnb fusd 1 binance make money event 2 indirect benefit 3 scroll team pay binance make launchpool list trading fee excluded something binance get default,0.4767,0.0,0.23835
Reddit,ethereum,2024-10-10 20:41:40,2024-10-12 12:16:12.596752,zk circuit verifier contract hide anything solidity output use new circuitscan opensource tool submit browse verifier source circomnoir circuit make proof,-0.1779,0.13636363636363635,-0.020768181818181825
Reddit,ethereum,2024-10-10 15:13:58,2024-10-12 12:16:12.596752,protocol guild funding framework ethereum common read full post herehttpstrentmirrorxyzlehny46zmdxmeow0xe_rgowv2ntkp30chjrwpceybgq summary exploration common scale good make ethereum network asset medium underpins integrity uprotocolguildhttpsxcomprotocolguild help thanks barnabéhttpsxcombarnabemonnot johnhttpsxcomjszcz_ joshhttpsxcomtbsocialist paulhttpsxcompost_polar_ timhttpsxcomtimbeiko review ethereum common like natural digital one precede fishery forest internet linux etc common productive system create resource collective benefit httpspreviewredditfn8akvk03ytd1pngwidth2400formatpngautowebpsf0513922a6950641fdbb2763d2c5eeb9c9b51a31 ethereums three shared resource network asset medium confluence produce call ethereum mainnet deeply interdependent altered form make edge broader common httpspreviewredditwktng23d3ytd1pngwidth1200formatpngautowebps1a330236f940f4d34094b83689d6f2d7acba69f1 resource produced protocol technical legal economic social political complete ownership resource desirable destroys integrity therefore actor engage production influence extraction httpspreviewreddit4k9pd6hf3ytd1pngwidth1200formatpngautowebpsba7f5b53ba8a1e0c722c38529fab0fc78bf35936 protocol guild give u transparent legible sustainable accountable funding allocation mechanism software medium production 5 main thread make unique 1 narrow mandate 2 broad selfcuration 3 member individual 4 4yr onchain vesting contract 5 designed time mind holistically fund stewardship entire watershed river isolation common rough go capitalism hope longlived natural precedent irrigation fishery farming blossoming digital common practice posture develop mechanism necessary ensure uncaptured longevity read herehttpstrentmirrorxyzlehny46zmdxmeow0xe_rgowv2ntkp30chjrwpceybgq,0.9872,0.012916666666666667,0.5000583333333333
Reddit,ethereum,2024-10-10 18:26:32,2024-10-12 12:16:12.596752,ethereum platform context purchasing good internet hey guy total newbie although technically invested ethereum lol want buy something internet requires pay ethereum specifically ethereum platform mean paid via ethereum coinbase wallet sufficient hello sir ethereum main network eth independent platform able pay wallet choose network ethereum mean transaction appear eth blockchain httpsetherscanioaddress0x466d0713fb2ae827751402f68f81ba2f7d5ec5f0 instruction im unclear thats paying via ethereum coinbase app got website make transaction said could pay wallet anyways anyone willing explain like im 5 dont lose money would greatly appreciated thank advance,0.9174,0.18106060606060606,0.5492303030303031
Reddit,ethereum,2024-10-09 15:04:14,2024-10-12 12:16:12.596752,vitalik buterin deserves nobel prize economics report,0.5106,0.0,0.2553
Reddit,ethereum,2024-10-09 22:54:53,2024-10-12 12:16:12.596752,solidity 0828 release announcement solidity programming language,0.0,0.0,0.0
Reddit,ethereum,2024-10-09 22:50:53,2024-10-12 12:16:12.596752,vote name public pectra testnet voting signaling purpose,0.0,0.0,0.0
Reddit,ethereum,2024-10-10 05:38:16,2024-10-12 12:16:12.596752,address hide transaction etherscani came across address 0x22c41289d413bcbc5486ca3a7fa9149fd747544d clearly made several transaction check etherscan there history whatsoeverit literally look like brand new unused address look zapperxyzhttpzapperxyz see interaction seems like owner using kind proxy contract relayer mask transaction history ability hide transaction etherscan like gamechanger im really curious done anyone insight replicate setup tool might using,0.9336,0.1727272727272727,0.5531636363636363
Reddit,ethereum,2024-10-09 18:39:40,2024-10-12 12:16:12.596752,ethereum follow protocol brantlyethecosystem project demo ethereum follow protocol brantlymillegan joined ethcatherders discus ethereum follow protocol impact decentralized community building catch full recording httpswwwyoutubecomwatchvgw_gu8xfrtohttpswwwyoutubecomwatchvgw_gu8xfrto project demo followed epd playlist httpswwwyoutubecomplaylistlistpl4cwhxaawzxrhbmxucqmsciwx1lwu_cnshttpswwwyoutubecomplaylistlistpl4cwhxaawzxrhbmxucqmsciwx1lwu_cns,0.0,0.35,0.175
Reddit,ethereum,2024-10-09 17:05:13,2024-10-12 12:16:12.596752,base transaction sent website eth base without realizing dont support base sitting wallet see claim havent received done case httpsbasescanorgaddress0x8bd96cdc5a9511217c62fd72e46198931e842695multichainportfolio,0.2337,-0.8000000000000002,-0.28315000000000007
Reddit,ethereum,2024-10-08 16:21:26,2024-10-12 12:16:12.596752,ethereum staking surge 2024 289 eth staked,0.0,0.0,0.0
Reddit,ethereum,2024-10-09 18:48:22,2024-10-12 12:16:12.596752,weird scam legitin weird situation never owned eth coin account matter reached email someone wanting purcahce artwork website wanted mint gas fee 01eth wasnt able mint didnt actually eth told able get send 02 eth account able mint artwork online keep reading site ask fee art never get bought lose money paid ghas fee didnt even pay minting fee im sure scam wouldnt get anything,-0.6647,0.14285714285714285,-0.2609214285714285
Reddit,ethereum,2024-10-08 18:46:17,2024-10-12 12:16:12.596752,avoid crazy feeshey thank advice post day bought 116 ethereum cryptocom amount got 110 worth account sent two seperate payment friend one 50 received 36 sent 6271 received 48 night time usa dont think gas rate crazy wild bought 116 worth received 84 32 go avoid paying much fee everytime want send crypto people use crypto keep 73 money,0.1531,-0.04999999999999999,0.05155000000000001
Reddit,ethereum,2024-10-08 15:16:04,2024-10-12 12:16:12.596752,gas fee going downis gas fee high day havent seen 10gwei day,0.0,0.16,0.08
Reddit,ethereum,2024-10-09 15:20:37,2024-10-12 12:16:12.596752,dad hacked money war zone please help u outso scammed guy claiming lawyer suffer multiple chronic illness unable really see he really feeling ill past month story go like guy scam invest crypto withdraw money keep adding reported police nothing fast forward found lawyer facebook guy said help return 8 money get back thing fooled investing crypto said needed invest another 1000 money go mixer dad got better research guy us fake name picture lawyer canada pretend he uk he asking another 1200 mixer thing sure scam left dad broke debt dad war zone thing hard enough research truly area expertise dont know trust wallet work stupid guy claim revolut refused money dirty using mom account couldnt access would know except lie scam dad sure money went mixer went wallet fact also told dad 18000 somehow far strech would invest please help scam explain dad,-0.9863,-0.06898148148148146,-0.5276407407407407
Reddit,ethereum,2024-10-08 06:00:30,2024-10-12 12:16:12.596752,plan reduce block reward raise burn ratehey since blob got introduced regular user moved l2s way lower gas fee ethereum ecosystem time celebrate right downside constantly increasing eth supply fear eth isnt seen good investment anymore know inflation bitcoin still higher rn bitcoins supply capped eths infinite imo important eth seen store value besides functionality attract new user also risk old user slowly fading away feel spiral le new user supply falling price interested thought discussion around topic community especially devs pov cheer,0.7147,0.1632034632034632,0.4389517316017316
