MainSource,Source,Publication Date,Pull_date,Pre-Processed Text,Sentiment_Vader,Sentiment_TextBlob,Average_Sentiment
RSS,https://cointelegraph.com/rss,2025-02-07 11:50:00+00:00,2025-02-07 12:18:15.944119,choose market maker web3 project navigating uncharted water web3 space requires partner track record cuttingedge technology adaptability global reach strong ethical standard,0.7717,0.15833333333333333,0.4650166666666667
RSS,https://cointelegraph.com/rss,2025-02-07 11:39:12+00:00,2025-02-07 12:18:15.944119,kentucky join growing list u state introduce bitcoin reserve bill kentucky bill massive vote confidence bitcoin brings u closer federal bitcoin reserve,0.7351,0.0,0.36755
RSS,https://cointelegraph.com/rss,2025-02-07 10:44:11+00:00,2025-02-07 12:18:15.944119,japan asks apple google remove unregistered crypto exchange apps japan financial service agency said action shutting crypto investing drawing line sand noncompliant exchange,0.0,0.05,0.025
RSS,https://cointelegraph.com/rss,2025-02-07 09:59:20+00:00,2025-02-07 12:18:15.944119,crypto market today trader anxiety trump dump intensifies crypto market sold ahead u job data feb 7,-0.5106,0.0,-0.2553
RSS,https://cointelegraph.com/rss,2025-02-07 09:42:42+00:00,2025-02-07 12:18:15.944119,u lawmaker propose stablecoin bill boost dollar dominance house financial service committee chairman french hill said would work trump administration deliver dollarbacked stablecoins american,0.5423,0.0,0.27115
RSS,https://cointelegraph.com/rss,2025-02-07 09:12:05+00:00,2025-02-07 12:18:15.944119,bitcoin trader eye huge u job data btc price risk 95k dip btc price strength face risk prediction market see giant beat u january job,0.3182,0.19999999999999998,0.2591
RSS,https://cointelegraph.com/rss,2025-02-07 08:00:37+00:00,2025-02-07 12:18:15.944119,missouri bill proposes bitcoin reserve fund state investment house bill 1217 introduced representative ben keathley aim establish bitcoin reserve fund missouri mandate crypto acceptance state payment,0.4588,0.0,0.2294
RSS,https://cointelegraph.com/rss,2025-02-07 05:22:20+00:00,2025-02-07 12:18:15.944119,ether derivative netflow fall lowest 18 month bullish analyst speculate rising ether outflow crypto derivative exchange bullish may lead reduced selling pressure closed leverage position,-0.5859,-0.1,-0.34295
RSS,https://cointelegraph.com/rss,2025-02-07 04:57:31+00:00,2025-02-07 12:18:15.944119,ondo finance unveils layer1 blockchain institution tokenize rwas ondo finance new ondo chain geared serve institution looking tokenize realworld asset anyone launch token build apps network,0.3612,0.13636363636363635,0.2487818181818182
RSS,https://cointelegraph.com/rss,2025-02-07 04:41:01+00:00,2025-02-07 12:18:15.944119,fed waller back regulated stablecoins boost u dollar global dominance fed board governor christopher waller support regulated stablecoins belief help keep u dollar global reserve currency,0.836,0.0,0.418
RSS,https://cointelegraph.com/rss,2025-02-07 03:33:22+00:00,2025-02-07 12:18:15.944119,phishing attacker target phantom wallet user fake update popups scammer connecting phantom wallet attempt lure user fake update extension signature request,-0.872,-0.5,-0.6859999999999999
RSS,https://cointelegraph.com/rss,2025-02-07 03:00:00+00:00,2025-02-07 12:18:15.944119,stablecoin memecoin frenzy drive trons adoption report 2024 tron reached several important milestone outpacing bitcoin broader altcoin market expanding user base,-0.0258,-0.13333333333333333,-0.07956666666666666
RSS,https://cointelegraph.com/rss,2025-02-07 02:28:21+00:00,2025-02-07 12:18:15.944119,canadian tried hide 450 bitcoin fed get prison time crypto app founder firoz patel serve three half year u prison hiding 450 bitcoin sentenced money laundering,-0.8625,-0.16666666666666666,-0.5145833333333334
RSS,https://cointelegraph.com/rss,2025-02-07 01:49:59+00:00,2025-02-07 12:18:15.944119,utah take lead potentially enacting bitcoin reserve bill bill would give utah treasurer power buy btc highcap crypto asset public fund way senate,0.4588,0.0,0.2294
RSS,https://cointelegraph.com/rss,2025-02-07 01:34:58+00:00,2025-02-07 12:18:15.944119,sec acknowledges grayscale solana etf filing notable step one development reflecting change approach u security exchange commission toward crypto,0.34,0.2,0.27
RSS,https://cointelegraph.com/rss,2025-02-07 00:59:11+00:00,2025-02-07 12:18:15.944119,franklin templeton seek sec approval crypto index etf franklin crypto index etf seek provide exposure spot price bitcoin ether following similar filing bitwise week earlier,0.4767,-0.025,0.22585
RSS,https://cointelegraph.com/rss,2025-02-07 00:44:23+00:00,2025-02-07 12:18:15.944119,tornado cash dev get dutch court nod leave prison amid appeal pertsev working appeal found guilty money laundering dutch court may 2024 receiving five year four month,-0.743,-0.5,-0.6214999999999999
RSS,https://cointelegraph.com/rss,2025-02-06 23:33:56+00:00,2025-02-07 12:18:15.944119,copper provide crypto custody service fineqias crypto etns institutional investor allocate capital crypto investment custody solution becoming important,0.4767,0.42500000000000004,0.45085000000000003
RSS,https://cointelegraph.com/rss,2025-02-06 22:53:38+00:00,2025-02-07 12:18:15.944119,winklevoss brother mull ipo gemini crypto exchange report winklevoss brother reportedly considering another ipo gemini deciding pursue public listing 2021,0.0,0.0,0.0
RSS,https://cointelegraph.com/rss,2025-02-06 22:28:52+00:00,2025-02-07 12:18:15.944119,cboe bzx file xrp etf bitwise wisdomtree canary 21shares canary capital wisdomtree 21shares bitwise latest fund manager filing launch xrp exchangetraded fund,0.0,0.5,0.25
RSS,https://cointelegraph.com/rss,2025-02-06 22:12:20+00:00,2025-02-07 12:18:15.944119,bitcoin price seasonality data call 120k q1 leverage remains btcs biggest risk bitcoins historical price data favor new alltime high q1 liquidity gap 80000 could pull price lower short term,-0.1531,0.0740909090909091,-0.03950454545454546
RSS,https://cointelegraph.com/rss,2025-02-06 22:05:05+00:00,2025-02-07 12:18:15.944119,grayscale file list litecoin trust etp nyse arca crypto industry executive asset manager expect trump administration usher regulatory climate conducive innovation,0.8126,0.0,0.4063
RSS,https://cointelegraph.com/rss,2025-02-06 22:00:30+00:00,2025-02-07 12:18:15.944119,here happened crypto today need know happened crypto today latest news daily trend event impacting bitcoin price blockchain defi nfts web3 crypto regulation,0.0,0.25,0.125
RSS,https://cointelegraph.com/rss,2025-02-06 21:34:07+00:00,2025-02-07 12:18:15.944119,justin sun reignites htx feud india reconsiders crypto hate asia express justin sun reignites feud htx cofounder india rethink crypto stance thailand cut power myanmar pig butcher asia express,-0.8625,-0.8,-0.83125
RSS,https://cointelegraph.com/rss,2025-02-06 21:20:00+00:00,2025-02-07 12:18:15.944119,ai token 90 2024 high trader say token drawdown shift market liquidity fundamental,0.0,0.16,0.08
RSS,https://cointelegraph.com/rss,2025-02-06 21:07:03+00:00,2025-02-07 12:18:15.944119,texas lawmaker attack trump memecoin debanking hearing representative al green also called donald trump impeachment feb 5 said operation choke point 20 fake program never existed,-0.8658,-0.35,-0.6079
RSS,https://cointelegraph.com/rss,2025-02-06 20:39:26+00:00,2025-02-07 12:18:15.944119,bitcoin slump tech giant palantir pltr rally new high give palantir technology rallied 356 last 12months hit new high outperform bitcoins 1year performance gain purely speculative,0.624,0.11528756957328387,0.36964378478664195
RSS,https://cointelegraph.com/rss,2025-02-06 20:02:30+00:00,2025-02-07 12:18:15.944119,potential candidate trump crypto council revealed report u president trump signed executive order establishing working group digital asset market jan 23 2025,0.3612,0.0,0.1806
RSS,https://cointelegraph.com/rss,2025-02-06 19:20:59+00:00,2025-02-07 12:18:15.944119,watchdog group defends u regulator approach crypto firm u lawmaker hear coinbase mara executive testifying hearing regarding claim debanking crypto firm,0.0,-0.2,-0.1
RSS,https://cointelegraph.com/rss,2025-02-06 19:16:41+00:00,2025-02-07 12:18:15.944119,bitcoin treasury adoption grows latam mirroring u strategic btc reserve plan large corporation argentina brazil embracing bitcoin establishing btcbased treasury cointelegraph explains,0.3818,0.21428571428571427,0.2980428571428571
RSS,https://bitcoinmagazine.com/.rss/full/,2025-02-06 20:03:42+00:00,2025-02-07 12:18:15.944119,here secret investing bitcoindont use leverage dont overexpose,0.0,-0.4,-0.2
RSS,https://bitcoinmagazine.com/.rss/full/,2025-02-06 18:04:44+00:00,2025-02-07 12:18:15.944119,lightning company raising good bitcoin tether usdt bitcoin made headline last week lightning ecosystem blossoming,0.4404,0.35,0.3952
RSS,https://bitcoinmagazine.com/.rss/full/,2025-02-06 17:50:20+00:00,2025-02-07 12:18:15.944119,nostr importance censorshipresistant communication innovation human progress open communication central part fostering innovation threatened modern digital age,0.7579,0.04,0.39895
RSS,https://bitcoinmagazine.com/.rss/full/,2025-02-06 15:00:00+00:00,2025-02-07 12:18:15.944119,bitcoin payment arent future theyre alreadytake look breez 1a1zs latest report deep diving current state bitcoins use transactional payment mechanism,0.0772,0.125,0.1011
RSS,https://bitcoinmagazine.com/.rss/full/,2025-02-06 14:09:30+00:00,2025-02-07 12:18:15.944119,bitcoins core remains unbreakablewhy surviving hostility doesnt mean court itand proactive engagement secures better future,0.8271,0.0625,0.4448
RSS,https://bitcoinmagazine.com/.rss/full/,2025-02-05 18:40:49+00:00,2025-02-07 12:18:15.944119,didnt take orange pill threw outthe government hasnt orange pilled theyve simply shown new way pull revolving door grifts,0.0,0.06818181818181818,0.03409090909090909
RSS,https://bitcoinmagazine.com/.rss/full/,2025-02-05 17:22:53+00:00,2025-02-07 12:18:15.944119,blackrock launch spot bitcoin etp europethe world largest asset manager set expand bitcoin footprint internationally new exchangetraded product switzerland,0.5859,0.13636363636363635,0.36113181818181816
RSS,https://bitcoinmagazine.com/.rss/full/,2025-02-05 17:11:55+00:00,2025-02-07 12:18:15.944119,bringin make bitcoin easier spend europe bringin founder ceo prashanth chandrashekar created product make easier european live bitcoin standard onboard bitcoin,0.765,0.04545454545454545,0.4052272727272727
RSS,https://bitcoinmagazine.com/.rss/full/,2025-02-04 23:39:46+00:00,2025-02-07 12:18:15.944119,president trump crypto czar host us first press conference bitcoin digital assetsdavid sack several procrypto politician discus future bitcoin crypto industry united state firstever u press conference digital asset,0.6486,0.05,0.3493
RSS,https://bitcoinmagazine.com/.rss/full/,2025-02-04 21:16:01+00:00,2025-02-07 12:18:15.944119,smart investor buy bitcoin real estatebitcoins finite supply unmatched liquidity deflationary model make ultimate asset modern investor learn forwardthinking investor decided buy bitcoin real estate inflationary world,0.5994,0.16285714285714287,0.3811285714285715
RSS,https://bitcoinmagazine.com/.rss/full/,2025-02-03 20:32:42+00:00,2025-02-07 12:18:15.944119,cowboy reservationthe logical soundness argument ossification bitcoin getting point pure absurdity,-0.3612,0.23214285714285715,-0.06452857142857144
RSS,https://bitcoinmagazine.com/.rss/full/,2025-02-03 20:18:03+00:00,2025-02-07 12:18:15.944119,bitcoin price already peakedbitcoin recently faced 10 retracement leading concern whether bull market article explores onchain metric institutional confidence macroeconomic factor determine whether bitcoin still room growth cycle peak reached,0.743,0.0,0.3715
RSS,https://bitcoinmagazine.com/.rss/full/,2025-02-03 19:45:40+00:00,2025-02-07 12:18:15.944119,buying holding bitcoin best strategy navigate trump tariff warbitcoin safest asset today,0.8555,1.0,0.9277500000000001
RSS,https://bitcoinmagazine.com/.rss/full/,2025-02-03 17:28:13+00:00,2025-02-07 12:18:15.944119,power play bitcoins institutionalization reshaping futureare new institutional player influenced bitcoin one influencing,0.34,0.13636363636363635,0.2381818181818182
RSS,https://bitcoinmagazine.com/.rss/full/,2025-01-31 20:07:04+00:00,2025-02-07 12:18:15.944119,bitcoin benjamin franklinsaving new generation riding wave folly,0.0,0.13636363636363635,0.06818181818181818
RSS,https://bitcoinmagazine.com/.rss/full/,2025-01-31 13:45:44+00:00,2025-02-07 12:18:15.944119,bitcoin bridgeas pleb fiat job important role play,0.4939,0.4,0.44695
RSS,https://bitcoinmagazine.com/.rss/full/,2025-01-31 13:26:54+00:00,2025-02-07 12:18:15.944119,take profit bitcoin cycle peaksselling bitcoin doesnt emotional decisionlearn use key market indicator take profit strategically reaccumulate lower price,0.4864,0.0,0.2432
RSS,https://bitcoinmagazine.com/.rss/full/,2025-01-31 10:15:01+00:00,2025-02-07 12:18:15.944119,forget ecb czechia embrace bitcoin termsthe czech national bank considering adding bitcoin reserve regardless european central bank think,0.1027,0.0,0.05135
RSS,https://bitcoinmagazine.com/.rss/full/,2025-01-30 21:42:05+00:00,2025-02-07 12:18:15.944119,tether back bitcoin lightning dominance startingthe stablecoin issuer choice bring usdt back bitcoin massive win lightning network joltzs bet taproot asset,0.7964,0.2,0.4982
RSS,https://bitcoinmagazine.com/.rss/full/,2025-01-30 17:24:24+00:00,2025-02-07 12:18:15.944119,trump executive order break bitcoins fouryear market cycle trump recent executive order may signal end bitcoins historically rigid fouryear market cycle regulatory clarity institutional adoption governmentbacked initiative could policy shift usher new era sustained growtheliminating dreaded crypto winter,-0.3612,0.04545454545454545,-0.15787272727272728
RSS,https://bitcoinmagazine.com/.rss/full/,2025-01-30 17:01:53+00:00,2025-02-07 12:18:15.944119,bitcoin empowers womenbitcoin tool woman around world closed traditional financial system,0.0,-0.03333333333333333,-0.016666666666666666
RSS,https://bitcoinmagazine.com/.rss/full/,2025-01-30 16:18:30+00:00,2025-02-07 12:18:15.944119,czech national bank ass bitcoin part reserve strategythe cnb approves plan explore allocating portion 140 billion reserve bitcoin,-0.2023,0.0,-0.10115
RSS,https://bitcoinmagazine.com/.rss/full/,2025-01-30 15:06:39+00:00,2025-02-07 12:18:15.944119,grayscale investment launch bitcoin miner etfgrayscale investment launched grayscale bitcoin miner etf mnrs offering investor way gain exposure bitcoin mining industry without directly holding btc tracking indxx bitcoin miner index etf includes major player like mara riot core scientific making attractive option looking diversify bitcoinrelated equity,0.7165,0.32083333333333336,0.5186666666666667
RSS,https://bitcoinmagazine.com/.rss/full/,2025-01-30 14:09:36+00:00,2025-02-07 12:18:15.944119,bitcoin cypherpunk spirit alive well africafrom south africa kenya ghana african using bitcoin better life arent asking anyones permission,0.8074,0.19999999999999998,0.5037
RSS,https://bitcoinmagazine.com/.rss/full/,2025-01-29 18:56:28+00:00,2025-02-07 12:18:15.944119,bitcoin ultimate hedge 97t global liquidity bubblediscover bitcoins fixed supply deflationary nature make ultimate asset navigating 97 trillion global liquidity bubble learn rising money supply influence market trend position bitcoin strategic hedge fiat currency debasement,0.3612,0.02,0.19060000000000002
RSS,https://bitcoinmagazine.com/.rss/full/,2025-01-29 18:10:45+00:00,2025-02-07 12:18:15.944119,bitcoin went wrongthe priority bitcoiners starting shift wrong direction represent actual existential threat success censorship resistant resilient system,-0.4215,-0.05,-0.23575
RSS,https://bitcoinmagazine.com/.rss/full/,2025-01-29 17:38:06+00:00,2025-02-07 12:18:15.944119,forget strategic bitcoin reserve moment mining censorship backf2pool mining pool representing 11 hash power bitcoin network censoring ofacsanctioned transaction,-0.2263,0.0,-0.11315
RSS,https://bitcoinmagazine.com/.rss/full/,2025-01-29 17:29:12+00:00,2025-02-07 12:18:15.944119,cme group launch option bitcoin friday future februarycme group looking obtain regulatory approval option successful cryptocurrency product launch,0.7845,0.375,0.57975
RSS,https://bitcoinmagazine.com/.rss/full/,2025-01-29 16:10:50+00:00,2025-02-07 12:18:15.944119,czech central bank head want buy bitcoin 5 reserve allocationthe czech national bank cnb considering 5 bitcoin allocation surpassing gold reserve approved move could reshape future national reserve asset,0.6808,0.0,0.3404
RSS,https://bitcoinmagazine.com/.rss/full/,2025-01-28 19:29:07+00:00,2025-02-07 12:18:15.944119,200000 realistic bitcoin price target cycleexplore potential bitcoin price reach 200000 cycle analyze market dynamic supply demand money multiplier effect ass feasibility,-0.3182,0.05555555555555555,-0.13132222222222223
RSS,https://bitcoinmagazine.com/.rss/full/,2025-01-28 19:24:46+00:00,2025-02-07 12:18:15.944119,go reserve people wont see differencearguing bitcoin reserve fund inclusion cryptocurrencies ultimately futile fight public large doesnt see difference,-0.6705,0.07142857142857142,-0.2995357142857143
RSS,https://bitcoinmagazine.com/.rss/full/,2025-01-28 17:04:20+00:00,2025-02-07 12:18:15.944119,preston pysh explains sab 121 beat strategic bitcoin reservepreston pysh explains rescission sab 121 could permanently entrench bitcoin financial system surpassing importance strategic bitcoin reserve,0.3612,0.0,0.1806
RSS,https://bitcoinmagazine.com/.rss/full/,2025-01-28 15:30:07+00:00,2025-02-07 12:18:15.944119,game theory strategic bitcoin reserve united state throwing weight behind bitcoin would effect massive shift game theory underpinning bitcoin probably way think,0.4215,-0.30000000000000004,0.06074999999999997
RSS,https://bitcoinmagazine.com/.rss/full/,2025-01-28 15:11:28+00:00,2025-02-07 12:18:15.944119,donald trump vow propel bitcoin new heightsdavid bailey ceo bitcoin magazine share insight private conversation president donald trump expressed support bitcoin community ambitious plan outcompete global competitor,0.7906,0.09659090909090909,0.4435954545454545
RSS,https://bitcoinmagazine.com/.rss/full/,2025-01-28 13:46:52+00:00,2025-02-07 12:18:15.944119,protect bitcoin anchorwatchbecca rubenfeld anchorwatch team recently unveiled firstofitskind bitcoin custody plus insurance solution aim keep customer bitcoin safe customer well,0.836,0.25,0.5429999999999999
RSS,https://bitcoinmagazine.com/.rss/full/,2025-01-27 22:10:39+00:00,2025-02-07 12:18:15.944119,microstrategy expands bitcoin holding 471100 btc worth 46 billionmicrostrategys relentless bitcoin buying spree continues adding 10100 btc 11 billion 471100 btc treasury valued 46 billion firm reinforces commitment bitcoincentric strategy amid market volatility,0.8316,0.04999999999999999,0.44079999999999997
RSS,https://bitcoinmagazine.com/.rss/full/,2025-01-27 18:54:56+00:00,2025-02-07 12:18:15.944119,declining shortterm u treasury yield impact bitcoin pricehow shifting treasury yield signal economic uncertainty bitcoin could benefit riskon safehaven asset,0.6908,0.2,0.4454
RSS,https://bitcoinmagazine.com/.rss/full/,2025-01-27 14:53:53+00:00,2025-02-07 12:18:15.944119,nasdaq proposes inkind redemption blackrocks bitcoin etfnasdaq proposed new system blackrocks ishares bitcoin etf allowing institutional investor redeem share directly bitcoin instead cash innovative model aim streamline operation cut cost reduce market impact marking significant step forward evolution bitcoin etf,0.5859,0.2778409090909091,0.43187045454545453
RSS,https://bitcoinmagazine.com/.rss/full/,2025-01-24 19:28:07+00:00,2025-02-07 12:18:15.944119,cynic idealist bitcoinbitcoiners need stop letting extreme naive idealism jaded cynicism drive public discourse,-0.7165,-0.14166666666666666,-0.42908333333333337
RSS,https://bitcoinmagazine.com/.rss/full/,2025-01-24 18:01:45+00:00,2025-02-07 12:18:15.944119,dear president trump bitcoin reserve shitcoin reservethe u government shouldnt stockpile anything bitcoin,0.3818,0.0,0.1909
RSS,https://bitcoinmagazine.com/.rss/full/,2025-01-24 17:47:27+00:00,2025-02-07 12:18:15.944119,trump digital asset executive order may last senator lummis rightpresident trump digital asset executive order hoped luckily senator lummis taking better approach establishing strategic bitcoin reserve,0.9153,0.16666666666666666,0.5409833333333334
RSS,https://bitcoinmagazine.com/.rss/full/,2025-01-24 12:47:29+00:00,2025-02-07 12:18:15.944119,brc20 bitcoin token could outshine rune efficient token standard bitcoin good thing,0.6908,0.35,0.5204
RSS,https://bitcoinmagazine.com/.rss/full/,2025-01-24 12:08:51+00:00,2025-02-07 12:18:15.944119,sec rescinds sab 121 permitting bank custody bitcointhe sec rescinded sab 121 removing barrier bank custody bitcoin crypto signaling major shift crypto regulation,-0.128,-0.04583333333333334,-0.08691666666666667
RSS,https://bitcoinmagazine.com/.rss/full/,2025-01-23 21:55:20+00:00,2025-02-07 12:18:15.944119,president trump sign executive order ban central bank digital currency cbdcthe president also assigned working group ass creation strategic bitcoin stockpile,-0.7184,0.0,-0.3592
RSS,https://bitcoinmagazine.com/.rss/full/,2025-01-23 21:19:26+00:00,2025-02-07 12:18:15.944119,trump sign executive order explore u strategic bitcoin reservepresident trump new executive order embrace bitcoin open blockchain technology ban central bank digital currency revoke prior restrictive regulationssignaling landmark policy shift toward fostering responsible innovation financial freedom united state,0.872,0.048051948051948054,0.460025974025974
RSS,https://bitcoinmagazine.com/.rss/full/,2025-01-23 17:38:39+00:00,2025-02-07 12:18:15.944119,ross free far overross last person government try make example,0.5106,0.16666666666666666,0.33863333333333334
RSS,https://bitcoinmagazine.com/.rss/full/,2025-01-23 16:29:45+00:00,2025-02-07 12:18:15.944119,donald trump right thing freeing ross ulbrichttrump delivered promise im glad,0.8126,0.39285714285714285,0.6027285714285714
RSS,https://bitcoinmagazine.com/.rss/full/,2025-01-23 15:33:00+00:00,2025-02-07 12:18:15.944119,bitcoin deep dive data analysis onchain roundupbitcoin kick 2025 bullish momentum rally sustain dive miner recovery sentiment market dynamic insight,0.3818,0.0,0.1909
RSS,https://bitcoinmagazine.com/.rss/full/,2025-01-22 19:33:10+00:00,2025-02-07 12:18:15.944119,blackrock ceo larry fink forecast 700k bitcoin price amid inflation worrieslarry fink ceo blackrock suggested bitcoin could reach 700000 per coin citing growing role hedge economic instability projection sparked discussion sovereign wealth fund highlight increasing momentum institutional adoption potential reshape market dynamic,0.8402,0.06666666666666667,0.4534333333333333
RSS,https://bitcoinmagazine.com/.rss/full/,2025-01-22 18:19:06+00:00,2025-02-07 12:18:15.944119,silk road ross ulbricht defend murdererross ulbricht free unproven allegation silk road founder overshadow well deserved pardon corner internet,0.7717,0.4,0.58585
RSS,https://bitcoinist.com/feed/,2025-02-07 11:00:12+00:00,2025-02-07 12:18:15.944119,canada say lower margin rate crypto fundsheres whythe canadian investment regulatory organization ciro announced cryptocurrency fund excluded list security eligible reduced margin lserm quarterly list identifies security qualifying reduced margin rate ciros ruling effective february 5 cite high volatility liquidity concern regulatory uncertainty surrounding cryptocurrency fund behind,0.2263,0.12,0.17315
RSS,https://bitcoinist.com/feed/,2025-02-07 10:13:25+00:00,2025-02-07 12:18:15.944119,berachain threatens solana sec approves sol etf solaxy meme coin explodeit seems weve entered alternate reality sec security exchange commission previously firmly anticrypto acknowledged multiple altcoin etf exchangetraded fund application namely regulator made update grayscales solana sol etf rejected last year calling asset security bloomberg analyst eric balchunas,0.4767,-0.06666666666666667,0.20501666666666668
RSS,https://bitcoinist.com/feed/,2025-02-07 09:02:39+00:00,2025-02-07 12:18:15.944119,fed backing u stablecoins best wallet presale ride crypto hypechristopher waller confirmed federal reserve bank fed board rolling stablecoin regulation would strengthen dollar reserve currency status comment come right senator hagerty lummis introduced genius act guiding establishing national innovation u stablecoins 2025 president trump crypto czar david sack,0.8481,0.5619047619047618,0.7050023809523809
RSS,https://bitcoinist.com/feed/,2025-02-07 07:00:42+00:00,2025-02-07 12:18:15.944119,dogecoin price show similarity 2017 see major rally wellcrypto analyst master kenobi drawn similarity current dogecoin price action 2017 bull run based similarity analyst suggested foremost meme coin could soon witness major rally like 2017 bull run dogecoin price could rally based similarity,0.4173,0.05625,0.236775
RSS,https://bitcoinist.com/feed/,2025-02-07 05:30:00+00:00,2025-02-07 12:18:15.944119,shiba inu big reveal memecoin tech powerhouseshiba inu currently one top meme coin market cap 92 billion trailing top dogthemed coin dogecoin meme coin pump shib one popular token surge dominate market activity related reading ethereum drop 3kand u congressman loading shytoshi,0.4215,0.26666666666666666,0.3440833333333333
RSS,https://bitcoinist.com/feed/,2025-02-07 04:00:12+00:00,2025-02-07 12:18:15.944119,dogecoin poised growth sight beginning major uptrend breakoutin ongoing bull market cycle dogecoin seen considerable upward movement reaching 048 mark even though dogthemed meme coin since dropped 025 price level likely witness another bullish run could push doge new alltime high cycle major uptrend dogecoin draw,0.6872,0.0868939393939394,0.3870469696969697
