MainSource,Source,Publication Date,Pull_date,Pre-Processed Text,Sentiment_Vader,Sentiment_TextBlob,Average_Sentiment
Reddit,ethereum,2025-02-04 19:46:53,2025-02-07 12:18:15.944119,ethereum scalingover 50 ethereum validators signaled support raising network gas limit pushing 36 million gas unit mark first increase since 2021 first postmerge era signaling node configuration change validators enable adjustment without requiring hard fork network previous gas limit 30 million place since august 2021 give way improved throughput reduced congestion matter enhanced network throughput increased gas limit enables ethereum handle transaction execute complex operation block reduced congestion higher limit help reduce congestion transaction delay peak period defi growth greater capacity support sophisticated decentralized application improved uptime market impact greater utility may add investor demand eth tech note gas ethereum represents computational work required processing operation like transaction smart contract function gas limit defines maximum gas usable per block demand exceeds threshold transaction compete inclusion based gas price raising gas limit ethereum continues evolving robust decentralized innovation platform balancing scalability network security httpspreviewredditmg3mccywe6he1pngwidth1593formatpngautowebps2bf098b814c2cd9c0fb5e5fa4fa796796482c2c4,0.9831,0.17059523809523808,0.576847619047619
Reddit,ethereum,2025-02-05 14:37:05,2025-02-07 12:18:15.944119,great article helped understand dex liquidity poolsi thought might benefit beginner space httpswwwthecoinscriptcompwhatisadexandhowtouseithttpswwwthecoinscriptcompwhatisadexandhowtouseit,0.7964,0.8,0.7982
Reddit,ethereum,2025-02-05 15:31:34,2025-02-07 12:18:15.944119,cartesi x eigenlayer devfolio experiment week 3 application opencartesi eigenlayer hosting inviteonly experiment week february 10 16 2025 focusing cartesi coprocessor integrated eigenlayers restaking technology participant develop innovative proof concept decentralized application leverage combined feature platform aiming unlock building possibility web3 exploring new decentralized technology horizon submission require oneminute video demonstration may lead invitation present demo day scheduled february 16 4 pm utc total 12k prize available here detail httpscartesixeigenlayerdevfoliocohttpscartesixeigenlayerdevfolioco,0.7832,0.20727272727272728,0.49523636363636364
Reddit,ethereum,2025-02-04 07:01:20,2025-02-07 12:18:15.944119,daily general discussion february 04 2025welcome ethereum daily general discussion rethereum httpsimgurcom3y7vezphttpsimgurcom3y7vezp bookmarking link always bring current daily httpsoldredditcomrethereumaboutstickynum2httpsoldredditcomrethereumaboutstickynum2 please use thread discus ethereum topic news event even price price discussion posted elsewhere subreddit continue removed always constructive subreddit ruleshttpswwwredditcomrethereumaboutrules want stake learn rethstaker ethfinance ethereum community link ethereum jobshttpsethereumorgencommunitygetinvolvedethereumjobs twitterhttpsxcomethereum evmavericks youtubehttpswwwyoutubecomevmavericks discordhttpsdiscordggevmavericks doots podcasthttpsevmaverickslibsyncom doots websitehttpsdailydootscom old reddit doots extensionhttpsgithubcometheralphaethfinanceextension uhanniabu calendar jan 20 ethereum protocol attackathonhttpsblogethereumorg20241125ethereumprotocolattackathon end jan 3031 ethereumzurichhttpsethereumzurich conference feb 79 eth oxfordhttpsethoxfordio hackathon feb 1016 ethiopiahttpsethiopiaxyz conference hackathon feb 23 mar 2 ethdenverhttpswwwethdenvercom mar 2830 eth pondyhttpswwwethpondyxyz puducherry hackathon apr 13 ey global blockchain summit person virtual,0.3818,0.025000000000000005,0.2034
Reddit,ethereum,2025-02-04 01:59:58,2025-02-07 12:18:15.944119,convinced ethhey guy year ago fell bitcoin rabbit hole im completely convinced someone created best hardest store value idea im happy experience moment tend say im bitcoin maxi eth last month put 75 btc eth cause thinking eths turn gon na come cyclewise wanted make money always liked name ethereum somehow aura spread thought match look realize dont share core value eth believe pow po dont see purpose decreasing supply intended burn im pro fixed supply like btc question cause maybe dont see whole picture eth convinces core value eth eth thx response mate,0.9667,0.4,0.68335
Reddit,ethereum,2025-02-04 22:34:30,2025-02-07 12:18:15.944119,eigenlayer restaking apyslooking get feedback experience using eigenlayer restake used worth kind apy expecting operator use feedback would great thanks,0.9062,0.475,0.6906
Reddit,ethereum,2025-02-04 12:35:20,2025-02-07 12:18:15.944119,dont see wlfi buying eth see postswlfi wallet addresshttpsetherscanioaddress0x5be9a4959308a0d0c7bc0870e319314d8d957dbb see world liberty financial link address almost eth compared daysweeks ago see post trump wlfi bought ten thousand eth anyone point right direction blockchain information see wlfi public address 300 million le asset compared day ago open block let know insight tracking since trump meme coin launch dont see accumulation happening,0.4588,0.05714285714285714,0.2579714285714286
Reddit,ethereum,2025-02-04 17:55:41,2025-02-07 12:18:15.944119,eth address linked wallethey people week ago made transaction upcoming token using eth blockchain opportunity buy directly without linked wallet chooses cause lack trust recommended wallet got later made direct transaction reach token payment service like eth wallet address must address wallet like say didnt use wallet connect specific eth wallet address coin,0.8658,0.05,0.45790000000000003
Reddit,ethereum,2025-02-04 12:25:13,2025-02-07 12:18:15.944119,eth phantom wallet disapearedhey dont know place right place ask question ill try swapped eth base network meme coin also base network phantom wallet coin swapped appeared wallet second disapeared transaction history say succesfully swapped eth gone someone help exactly happened money asked question phantom reddit well wont posted without moderator approval,-0.1416,-0.26071428571428573,-0.20115714285714287
Reddit,ethereum,2025-02-04 15:48:59,2025-02-07 12:18:15.944119,create bug bounty project us openzeppelin contract,0.2732,0.0,0.1366
Reddit,ethereum,2025-02-03 22:50:23,2025-02-07 12:18:15.944119,purrsuit ethereum 4purrsuit ethereum 4httpshackmdiopoojaranjanpoe4 ethereum ecosystem continues push forward major protocol upgrade client testing ecosystemwide discussion week update cover latest pectra prague electra upgrade development including security update testnet timeline system contract audit read httpsmediumcomethereumcatherderspurrsuitofethereum486ef8469b479httpsmediumcomethereumcatherderspurrsuitofethereum486ef8469b479,0.34,0.28125,0.31062500000000004
Reddit,ethereum,2025-02-03 07:01:50,2025-02-07 12:18:15.944119,daily general discussion february 03 2025welcome ethereum daily general discussion rethereum httpsimgurcom3y7vezphttpsimgurcom3y7vezp bookmarking link always bring current daily httpsoldredditcomrethereumaboutstickynum2httpsoldredditcomrethereumaboutstickynum2 please use thread discus ethereum topic news event even price price discussion posted elsewhere subreddit continue removed always constructive subreddit ruleshttpswwwredditcomrethereumaboutrules want stake learn rethstaker ethfinance ethereum community link ethereum jobshttpsethereumorgencommunitygetinvolvedethereumjobs twitterhttpsxcomethereum evmavericks youtubehttpswwwyoutubecomevmavericks discordhttpsdiscordggevmavericks doots podcasthttpsevmaverickslibsyncom doots websitehttpsdailydootscom old reddit doots extensionhttpsgithubcometheralphaethfinanceextension uhanniabu calendar jan 20 ethereum protocol attackathonhttpsblogethereumorg20241125ethereumprotocolattackathon end jan 3031 ethereumzurichhttpsethereumzurich conference feb 79 eth oxfordhttpsethoxfordio hackathon feb 1016 ethiopiahttpsethiopiaxyz conference hackathon feb 23 mar 2 ethdenverhttpswwwethdenvercom mar 2830 eth pondyhttpswwwethpondyxyz puducherry hackathon apr 13 ey global blockchain summit person virtual,0.3818,0.025000000000000005,0.2034
Reddit,ethereum,2025-02-03 15:52:59,2025-02-07 12:18:15.944119,ethereumrelated content ive found interesting last weekstuff found interesting 1 punk 6529 share deepseek thesishttpsxcancelcompunk6529status1884003516320252260 2 andre cronje explains quit 2022httpsandrecronjemediumcomwhydidiquitin2022e9a3a6ae91ef 3 vitalik share take beam chainhttpswarpcastcomvitaliketh0x8343c5d3 4 dashboard aave liquidationshttpsdunecomkartodaaveliquidations 5 project solar protocolhttpssolarprotocolnet link many handpicked kiwi communityhttpskiwistandgithubiokiwidocsdocsintro shared weekly newsletterhttpsparagraphxyzkiwiweeklykiwinewsrecap81,0.8807,0.375,0.62785
Reddit,ethereum,2025-02-03 22:49:11,2025-02-07 12:18:15.944119,peepanrip 7759 layer 2 transaction fee andreas freundpeepanrip 7759 layer 2 transaction feeshttpsyoutubej0epnboy2g andreas freund joined ethcatherders talk need standardization layer2 transaction fee spec check recording httpsyoutubej0epnboy2ghttpstcoo8gklbl9eb,0.0,0.0,0.0
Reddit,ethereum,2025-02-03 14:56:23,2025-02-07 12:18:15.944119,major update wanchains eth xflows integrated polygon zkevm httpspreviewredditmnxzuga2uxge1pngwidth680formatpngautowebps930d2fb712a78a211091fca9262c13d3acd8fdb9 exciting news ethereum community jan 23 2025 wanchains eth xflows successfully integrated polygon zkevm integration brings significant improvement zkevm eth transaction including nativetonative transfer wrapped token middleman decentralized secure trustless transaction slippagefree predictable smooth transfer fast transaction completed instant inexpensive lower fee crosschain transfer eth easily move polygon zkevm 11 blockchains enhancing flexibility interoperability ethereum ecosystem integration huge step forward crosschain interoperabilitymaking easier ethereum interact network decentralized efficient way another example wanchain continues promote blockchain adoption connecting isolated blockchains enabling seamless communication across chain check bridge httpsbridgewanchainorghttpsbridgewanchainorg,0.959,0.2684027777777778,0.6137013888888889
Reddit,ethereum,2025-02-03 17:06:17,2025-02-07 12:18:15.944119,securing internet trust establishing digital human right juan benet protocol lab,0.6808,0.09523809523809523,0.3880190476190476
Reddit,ethereum,2025-02-03 15:10:07,2025-02-07 12:18:15.944119,happens eth optimism blockchain optimism go zeroi believe kinda stupid question eth optimism mainlet risk lose eth wanted use optimism reduce fee,0.796,-0.7999999999999999,-0.0019999999999999463
Reddit,ethereum,2025-02-03 15:36:42,2025-02-07 12:18:15.944119,rise fake web3 recruiter,-0.4767,-0.5,-0.48835
Reddit,ethereum,2025-02-02 07:01:30,2025-02-07 12:18:15.944119,daily general discussion february 02 2025welcome ethereum daily general discussion rethereum httpsimgurcom3y7vezphttpsimgurcom3y7vezp bookmarking link always bring current daily httpsoldredditcomrethereumaboutstickynum2httpsoldredditcomrethereumaboutstickynum2 please use thread discus ethereum topic news event even price price discussion posted elsewhere subreddit continue removed always constructive subreddit ruleshttpswwwredditcomrethereumaboutrules want stake learn rethstaker ethfinance ethereum community link ethereum jobshttpsethereumorgencommunitygetinvolvedethereumjobs twitterhttpsxcomethereum evmavericks youtubehttpswwwyoutubecomevmavericks discordhttpsdiscordggevmavericks doots podcasthttpsevmaverickslibsyncom doots websitehttpsdailydootscom old reddit doots extensionhttpsgithubcometheralphaethfinanceextension uhanniabu calendar jan 20 ethereum protocol attackathonhttpsblogethereumorg20241125ethereumprotocolattackathon end jan 3031 ethereumzurichhttpsethereumzurich conference feb 79 eth oxfordhttpsethoxfordio hackathon feb 1016 ethiopiahttpsethiopiaxyz conference hackathon feb 23 mar 2 ethdenverhttpswwwethdenvercom mar 2830 eth pondyhttpswwwethpondyxyz puducherry hackathon apr 13 ey global blockchain summit person virtual,0.3818,0.025000000000000005,0.2034
Reddit,ethereum,2025-02-01 23:52:08,2025-02-07 12:18:15.944119,controversial opinion ethereum foundation ef rename accurately reflect actually stop medium posting misleading clickbait fud article itthe medium never talk efs actual function would really boring almost every single medium article ethereum foundation concern selling eth realize extremely controversial better community stop focusing efs selling hold 02 eth supply sold 4766 eth 2024 eth selling completely trivial ef sold 0004 eth supply 2024 bitcoin annual inflation 17 2024 solana annual inflation 47 2024 every day bitcoin miner sell larger percent bitcoin ef entire year every day solana validators sell larger percent sol ef entire year due principle subtraction ethereum foundation relinquished original role remaining function related sponsoring tool research grant promoting academic outreach layman knew ef mainly function provide grant would extremely obvious regularly sell eth one would questioning misconception due word foundation unfortunately layman medium see word foundation incorrectly assume control governs develops blockchain question organization selling eth instead holding medium take advantage write clickbait fud article ef actually control ethereum governance consensus development indirect influence grant direct control ethereum foundation consists 3 program 1 ecosystem support program allocates fund sponsor critical project research infrastructure tooling community education httpsespethereumfoundationaboutwhowesupport example include node client eg nimbus erigon lighthouse research verkle tree epbs tool revokecash growthepie evm gas cost estimator 2 devcon host annual devcon meetups 3 fellowship program help sponsor project grant identifies fund individual working public good research project related blockchains necessarily ethereum feel free correct im wrong renaming ef better reflect actually believe ef need rename something like ethereum grant program would immediately get medium back people stop asking misleading question like blockchain foundation selling cryptocurrency want stop fud need rename ef,0.8689,0.05772108843537416,0.4633105442176871
Reddit,ethereum,2025-02-02 13:53:08,2025-02-07 12:18:15.944119,call dao single wallet quorumthats relatively new situation im looking good term adjective potential option 1 autocratodaoic 2 quoruminant 3 monowalletic 4 unisignatory 5 solocratic 6 singularitarian 7 unilateraldao 8 pluralityofone 9 omniwallet 10 soloquorum theory token holder could coordinate realistically publicly available chat aware practical real life,0.4404,0.23070500927643783,0.33555250463821895
Reddit,ethereum,2025-02-03 02:30:01,2025-02-07 12:18:15.944119,talk roadmapwhats next whats realistic lot great idea havent seen well formulated plan year devs still guessing see question answer read blog dev note seems still dont know actually achieve scalability worrisome totally understand thing take time code still unclear going achieve goal much time surpassed really brings doubt anyone bring clarity roadblock,-0.1261,0.19523809523809524,0.034569047619047624
Reddit,ethereum,2025-02-01 07:01:56,2025-02-07 12:18:15.944119,daily general discussion february 01 2025welcome ethereum daily general discussion rethereum httpsimgurcom3y7vezphttpsimgurcom3y7vezp bookmarking link always bring current daily httpsoldredditcomrethereumaboutstickynum2httpsoldredditcomrethereumaboutstickynum2 please use thread discus ethereum topic news event even price price discussion posted elsewhere subreddit continue removed always constructive subreddit ruleshttpswwwredditcomrethereumaboutrules want stake learn rethstaker ethfinance ethereum community link ethereum jobshttpsethereumorgencommunitygetinvolvedethereumjobs twitterhttpsxcomethereum evmavericks youtubehttpswwwyoutubecomevmavericks discordhttpsdiscordggevmavericks doots podcasthttpsevmaverickslibsyncom doots websitehttpsdailydootscom old reddit doots extensionhttpsgithubcometheralphaethfinanceextension uhanniabu calendar jan 20 ethereum protocol attackathonhttpsblogethereumorg20241125ethereumprotocolattackathon end jan 3031 ethereumzurichhttpsethereumzurich conference feb 79 eth oxfordhttpsethoxfordio hackathon feb 1016 ethiopiahttpsethiopiaxyz conference hackathon feb 23 mar 2 ethdenverhttpswwwethdenvercom mar 2830 eth pondyhttpswwwethpondyxyz puducherry hackathon apr 13 ey global blockchain summit person virtual,0.3818,0.025000000000000005,0.2034
Reddit,ethereum,2025-02-01 16:14:29,2025-02-07 12:18:15.944119,built free website learning solidity inspired codecademyhey everyone launched solidityquesta free interactive platform learn solidity built take basic advanced topic practical coding exercise challenge httpspreviewredditaze7p3heyjge1jpgwidth2642formatpjpgautowebps1184db9b24ceced6fa2dfe386dc7a92f9995a91d designed solidityquest simple engaging whether youre starting looking level skill hope youll find resource valuable check httpswwwsolidityquestxyzhttpswwwsolidityquestxyz looking forward feedback suggestion,0.9638,0.2285714285714286,0.5961857142857143
Reddit,ethereum,2025-02-01 18:38:41,2025-02-07 12:18:15.944119,eigenlayer cartesi join force advance web3 innovationeigenlayer teaming cartesi empower innovation space february 1018 builder dive hackathon develop unprecendented dapps integration unlocking new possibility decentralized tech youre looking opportunity combine ai blockchain now moment check detail httpcartesiioblogexperimentweek3httpcartesiioblogexperimentweek3,0.765,0.13636363636363635,0.4506818181818182
Reddit,ethereum,2025-02-01 19:09:48,2025-02-07 12:18:15.944119,hallucinate server gubsheep,0.0,0.0,0.0
Reddit,ethereum,2025-02-01 04:41:40,2025-02-07 12:18:15.944119,cant eth consensus voting every 3 block instead every blockfrom understand reason 12 interval block consensus voting reason block gas limit sudden burst network cpuram usage still consensus voting every 12 second every consensus voting includes 3 block block time 4 consensus voting happens every 12 4 separation sudden burst high load seems enough heard delayed execution way basically spread block processing across entire 12 sudden burst allow u large block still year away seems much easier make consensus voting happen every 3 10 block instead every block im pretty sure good reason otherwise would implemented already dont know,-0.9313,0.16869047619047617,-0.3813047619047619
Reddit,ethereum,2025-01-31 19:48:18,2025-02-07 12:18:15.944119,happy hour 97 justin drake eth foundation jan 31st 2025,0.5719,0.8,0.6859500000000001
Reddit,ethereum,2025-02-01 02:03:23,2025-02-07 12:18:15.944119,building simple onchain orderbook dex rwa token need ive looking dex orderbook could list rwa token fixed price fundraising couldnt find one here use case 1 initial sale want tokenize real estate development project sell token fixed price raise construction fund 2 construction 1 year token holder able trade token price choose 3 project exit selling property want place single large buy order fair price token holder exit rate 4 capital efficiency raised fund available business need land purchase material labor without locking portion liquidity pool ammbased dexes like uniswap become standard defi arent suitable type rwa token amm pool would cause price fluctuation making unfair initial buyer final exit require locking significant capital liquidity pool price discovery mechanism doesnt match rwa trading pattern rwa trading often requires precise price control doesnt need highspeed execution amms provide post explores simple approach building onchain orderbook dex specifically designed rwa token problem traditional orderbook dexes often considered impractical onchain due 1 high gas cost order matching 2 complex order matching logic 3 frontrunning concern 4 speed limitation onchain execution however rwa token limitation le critical trading velocity lower price precision important execution speed frontrunning le profitable due lower volatility gas cost acceptable given higher transaction value solution simple onchain orderbook build simplified onchain orderbook dex key feature core design one smart contract per token pair fixed price step simplify matching priceindexed mapping order offchain order matching calculation onchain order execution factory contract easy deployment new pair data structure price order price level mappinguint256 order public buyorders mappinguint256 order public sellorders struct order address maker uint256 amount bool isbuyorder key function 1 create order 2 take price amountvalidates price steptransfers token contractstores order mapping 3 take order 4 take existing order price indextransfers token partiesremoves fulfilled order 5 cancel order 6 original maker cancelreturns locked tokensremoves order mapping price step pair fixed minimum price step eg 001 price must multiple step larger step mean fewer possible price level reduces storage cost simplifies matching frontend integration javascript frontend calculates best matching order easily scan available order price level simplified order matching due price step structure clear view liquidity price level advantage 1 simple predictable gas cost 2 easy understand audit 3 precise price control trader 4 impermanent loss 5 perfect rwa token speed isnt critical 6 ideal fixedprice token sale fair exit 7 capital locked liquidity pool 8 support fixedprice primary market variableprice secondary market 9 fair equal treatment token holder exit event gas optimization 1 fixed price step reduce storage complexity 2 direct price indexing quick lookup 3 batch operation possible efficiency 4 simple matching logic reduces computation limitation 1 higher gas cost amms 2 suitable highfrequency trading 3 le capital efficient amms 4 requires active market making future improvement 1 partial order filling 2 better order prioritization 3 multiple token pair support single contract 4 gas optimization bulk operation 5 integration liquidity provider incentive conclusion rwa token simple onchain orderbook provide better price discovery precise trading ammbased solution approach wouldnt work well highfrequency trading token perfectly suited rwa market trade frequency lower price precision important execution speed implementation straightforward enough built audited maintained small team making attractive option rwa token project need custom trading solution think approach would love hear thought suggestion improvement,0.9971,0.18974787558120895,0.5934239377906044
Reddit,ethereum,2025-01-31 07:01:56,2025-02-07 12:18:15.944119,daily general discussion january 31 2025welcome ethereum daily general discussion rethereum httpsimgurcom3y7vezphttpsimgurcom3y7vezp bookmarking link always bring current daily httpsoldredditcomrethereumaboutstickynum2httpsoldredditcomrethereumaboutstickynum2 please use thread discus ethereum topic news event even price price discussion posted elsewhere subreddit continue removed always constructive subreddit ruleshttpswwwredditcomrethereumaboutrules want stake learn rethstaker ethfinance ethereum community link ethereum jobshttpsethereumorgencommunitygetinvolvedethereumjobs twitterhttpsxcomethereum evmavericks youtubehttpswwwyoutubecomevmavericks discordhttpsdiscordggevmavericks doots podcasthttpsevmaverickslibsyncom doots websitehttpsdailydootscom old reddit doots extensionhttpsgithubcometheralphaethfinanceextension uhanniabu calendar jan 20 ethereum protocol attackathonhttpsblogethereumorg20241125ethereumprotocolattackathon end jan 3031 ethereumzurichhttpsethereumzurich conference feb 79 eth oxfordhttpsethoxfordio hackathon feb 1016 ethiopiahttpsethiopiaxyz conference hackathon feb 23 mar 2 ethdenverhttpswwwethdenvercom mar 2830 eth pondyhttpswwwethpondyxyz puducherry hackathon apr 13 ey global blockchain summit person virtual,0.3818,0.025000000000000005,0.2034
Reddit,ethereum,2025-01-31 18:49:55,2025-02-07 12:18:15.944119,aristotle revenge cyclical ethereum sentimentaristotles revenge refers resurgence validation aristotelian philosophy particularly view nature science light modern scientific discovery term suggests many aristotle fundamental idea reality dismissed scientific revolution enlightenment partially vindicated contemporary physic philosophy science let analyze example lens aristotle revenge breaking three phase phase 1 initial praise original truth project presented receives recognition like aristotle original teaching initially accepted valued there intuitive understanding merit potential praise suggests project aligns fundamental truth need phase 2 dismissal modern rejection project face criticism negativity similar aristotelian thought dismissed scientific revolution new thinking approach considered superior original merit forgotten minimized there sense project outdated flawed compared better alternative phase 3 vindication revenge project prof worth despite criticism like aristotelian concept validated modern discovery fundamental truth value initially recognized reemerges dismissal shown shortsighted project success demonstrates original understanding correct sound familiar,0.9702,0.19402680652680654,0.5821134032634032
Reddit,ethereum,2025-01-31 22:10:32,2025-02-07 12:18:15.944119,retroactive funding round ethereum public good obol,0.4404,0.16666666666666666,0.3035333333333333
Reddit,ethereum,2025-01-31 07:44:25,2025-02-07 12:18:15.944119,highlight ethereums core devs meeting acde 204,0.34,0.0,0.17
Reddit,ethereum,2025-01-31 17:21:07,2025-02-07 12:18:15.944119,method eth_getencryptionpublickey exist available,0.0,0.4,0.2
