MainSource,Source,Publication Date,Pull_date,Pre-Processed Text,Sentiment_Vader,Sentiment_TextBlob,Average_Sentiment
RSS,https://cointelegraph.com/rss,2024-09-17 13:11:53+01:00,2024-09-17 12:17:31.205866,here happened crypto today need know happened crypto today latest news daily trend event impacting bitcoin price blockchain defi nfts web3 crypto regulation,0.0,0.25,0.125
RSS,https://cointelegraph.com/rss,2024-09-17 13:07:06+01:00,2024-09-17 12:17:31.205866,ton curve finance team stablecoin swap initiative partnership introduces curve finance cfmm technology ton optimizing stablecoin swap reduced price volatility slippage,0.4588,0.0,0.2294
RSS,https://cointelegraph.com/rss,2024-09-17 11:49:53+01:00,2024-09-17 12:17:31.205866,digital chamber urge u crypto user support new nft bill crypto advocate urged american help industry flourish without misapplied security regulation,0.521,0.04545454545454545,0.2832272727272727
RSS,https://cointelegraph.com/rss,2024-09-17 10:41:39+01:00,2024-09-17 12:17:31.205866,bitcoin poised volatility ahead u interest rate decision analyst fed expected deliver first interest rate cut since pandemic could introduce volatility next bitcoin leg,0.7096,0.049999999999999996,0.3798
RSS,https://cointelegraph.com/rss,2024-09-17 10:18:39+01:00,2024-09-17 12:17:31.205866,hong kong prepares ai guideline finance sector hong kongs government plan regulate ai finance issuing policy upcoming fintech week,0.0,0.0,0.0
RSS,https://cointelegraph.com/rss,2024-09-17 10:09:48+01:00,2024-09-17 12:17:31.205866,privacy missing ingredient business blockchain adoption ey exec paul brody eys global blockchain leader highlight privacy missing piece blockchain adoption business provides potential solution enterprise concern,0.0772,-0.1,-0.0114
RSS,https://cointelegraph.com/rss,2024-09-17 09:37:18+01:00,2024-09-17 12:17:31.205866,bitcoin trader say it039s still 039too early039 call btc price bottom btc price performance fails convince commentator bitcoin wood,-0.2023,-0.5,-0.35115
RSS,https://cointelegraph.com/rss,2024-09-17 09:14:32+01:00,2024-09-17 12:17:31.205866,db launch crypto option structured note institution db say exact date bank said newlyannounced crypto offering begin time fourth quarter 2024,0.0,0.125,0.0625
RSS,https://cointelegraph.com/rss,2024-09-17 08:58:09+01:00,2024-09-17 12:17:31.205866,circle usdc stablecoin launch sui network udsc stablecoin soon become natively supported sui network crosschain transfer protocol,0.3182,0.0,0.1591
RSS,https://cointelegraph.com/rss,2024-09-17 07:16:10+01:00,2024-09-17 12:17:31.205866,blockchain could help uk 145t payment sector say trade group trade group uk finance hailed experiment regulated liability network success called talk regulator develop system,0.7579,0.3,0.52895
RSS,https://cointelegraph.com/rss,2024-09-17 07:09:58+01:00,2024-09-17 12:17:31.205866,bhutan twice much bitcoin el salvador say arkham bhutan investment arm druk holding hold 13000 btc double el salvador stash,0.0,0.1,0.05
RSS,https://cointelegraph.com/rss,2024-09-17 06:45:41+01:00,2024-09-17 12:17:31.205866,intel share jump 6 plan spin ai chipmaking arm intel share closed higher following new plan spin aifocused foundry business independent subsidiary capable raising outside funding,0.7184,0.06948051948051949,0.39394025974025976
RSS,https://cointelegraph.com/rss,2024-09-17 04:42:35+01:00,2024-09-17 12:17:31.205866,ai scientist urge contingency plan case human lose control ai open letter scientist shared worry loss human control malicious use ai system could lead catastrophic outcome humanity,-0.8271,0.0,-0.41355
RSS,https://cointelegraph.com/rss,2024-09-17 04:24:14+01:00,2024-09-17 12:17:31.205866,sec commissioner slam agency 750k flyfish club nft settlement sec commissioner hester peirce mark uyeda didnt believe u security law triggered urged commission give nft firm room experiment,-0.5627,-0.13333333333333333,-0.34801666666666664
RSS,https://cointelegraph.com/rss,2024-09-17 04:07:40+01:00,2024-09-17 12:17:31.205866,donald trump silent world liberty financial team unveils wlfi token donald trump didnt share detail family new crypto platform 45minute talk x team later revealed token would launched,0.461,0.03409090909090909,0.24754545454545457
RSS,https://cointelegraph.com/rss,2024-09-17 02:58:14+01:00,2024-09-17 12:17:31.205866,bitcoin price action tough call fed rate decision zerocap bitcoin could rally high 65000 following expected rate cut later week analyst fear u election uncertainty could keep crypto asset price lower longer,-0.7845,-0.038148148148148146,-0.41132407407407406
RSS,https://cointelegraph.com/rss,2024-09-17 02:07:02+01:00,2024-09-17 12:17:31.205866,cathedra bitcoin cool mining tap microstrategy playbook cathedra bitcoin said bitcoin mining simply hasnt provided enough shareholder value bitcoin basis last three year prompted change strategy,0.5719,0.0875,0.3297
RSS,https://cointelegraph.com/rss,2024-09-16 23:01:29+01:00,2024-09-17 12:17:31.205866,exsec official speak hearing politicized approach crypto u house lawmaker hear former sec commissioner crypto industry leader dazed confused digital asset hearing sept 18,-0.128,-0.2,-0.164
RSS,https://cointelegraph.com/rss,2024-09-16 22:36:49+01:00,2024-09-17 12:17:31.205866,microstrategy announces third debt offering 2024 plan raise 700m proceeds used pay 500 million existing debt purchase bitcoin microstrategy currently hold 244800 btc,-0.6597,0.0,-0.32985
RSS,https://cointelegraph.com/rss,2024-09-16 22:00:00+01:00,2024-09-17 12:17:31.205866,fantom ftm price surge 40 month whats behind momentum fantom price flash classic bullish trading pattern could extend monthlong doubledigit rally,0.1779,-0.11666666666666668,0.03061666666666666
RSS,https://cointelegraph.com/rss,2024-09-16 21:41:13+01:00,2024-09-17 12:17:31.205866,41 firm join bi project agora advance unified ledger application large private company work seven central bank improving structural inefficiency international transfer,0.765,0.0028571428571428524,0.38392857142857145
RSS,https://cointelegraph.com/rss,2024-09-16 20:59:21+01:00,2024-09-17 12:17:31.205866,risc zero aim bring blockchain security offchain app nextgen zeroknowledge proof order magnitude cheaper existing option risc said,0.34,0.0,0.17
RSS,https://cointelegraph.com/rss,2024-09-16 20:45:00+01:00,2024-09-17 12:17:31.205866,bitcoin price turn shaky ahead potential fed rate cut weak global economic data bitcoin price wobble near 58000 uncertainty fed monetary policy decision loom trader eyeball weak economic data china,-0.9022,-0.07291666666666666,-0.4875583333333333
RSS,https://cointelegraph.com/rss,2024-09-16 20:37:32+01:00,2024-09-17 12:17:31.205866,new token likely win find institutional investor new token launched 2024 fared poorly compared predecessor however institutional investment helped succeed,0.8176,0.13454545454545455,0.47607272727272726
RSS,https://cointelegraph.com/rss,2024-09-16 20:30:00+01:00,2024-09-17 12:17:31.205866,vc roundup asylum venture launch 55m fund back startup artists039 asset edition cointelegraphs vc roundup feature asylum venture new fund well startup puffpaw permissionless lab infinit drip in1 defigold,0.5574,0.06818181818181818,0.3127909090909091
RSS,https://cointelegraph.com/rss,2024-09-16 20:07:28+01:00,2024-09-17 12:17:31.205866,excelsius exec planning attend token2049 timing travel request filed roni cohenpavon u court coincides crypto conference celsius executive previously attended,0.0,-0.16666666666666666,-0.08333333333333333
RSS,https://cointelegraph.com/rss,2024-09-16 20:05:38+01:00,2024-09-17 12:17:31.205866,kraken denies sec claim argues digital asset arent security law decoded kraken reject sec security allegation brazil lift freeze starlinks bank account uk clarifies crypto property right coinbase back nfts legal defense,-0.2815,0.047619047619047616,-0.11694047619047618
RSS,https://cointelegraph.com/rss,2024-09-16 19:45:00+01:00,2024-09-17 12:17:31.205866,price analysis 916 spx dxy btc eth bnb sol xrp doge ton ada bitcoins failure hold 60000 show hesitation buy higher level fomc decision sept 18,-0.6597,-0.033333333333333326,-0.34651666666666664
RSS,https://cointelegraph.com/rss,2024-09-16 19:15:00+01:00,2024-09-17 12:17:31.205866,bitgo launch regulated custody platform native protocol token u custodian cryptonative client include worldcoin zetachain layerzero,0.0,0.0,0.0
RSS,https://cointelegraph.com/rss,2024-09-16 18:59:37+01:00,2024-09-17 12:17:31.205866,crypto investment product see 436m inflow ethereum continues suffer inflow crypto investment product rose past week ethereum continues lose investor interest,-0.4939,0.175,-0.15945
RSS,https://bitcoinmagazine.com/.rss/full/,2024-09-17 11:58:05+00:00,2024-09-17 12:17:31.205866,singapore db bank launch bitcoin crypto option institutionssingapores largest bank db begin offering otc bitcoin crypto option trading institutional client q4 2024 db first major asian bank providing sophisticated bitcoin derivative amid rising allocation demand,0.4767,0.203125,0.3399125
RSS,https://bitcoinmagazine.com/.rss/full/,2024-09-17 11:35:43+00:00,2024-09-17 12:17:31.205866,arthur hayes family office fund bitcoin core developerarthur hayes family office maelstrom awarded first grant bitcoin developer program contributor rkrux funding support rkrux working fulltime contributing bitcoin core open source project,0.7845,0.125,0.45475
RSS,https://bitcoinmagazine.com/.rss/full/,2024-09-16 21:03:54+00:00,2024-09-17 12:17:31.205866,microstrategy announces 700 million raise redeem senior secured note buy bitcoinmicrostrategy use net proceeds offering redeem senior secured note due 2028 acquire additional bitcoin,0.6597,-0.0625,0.2986
RSS,https://bitcoinmagazine.com/.rss/full/,2024-09-16 19:40:50+00:00,2024-09-17 12:17:31.205866,financial anarchist manifestousing technology like nostr chaumian ecash financial anarchist challenge status quo aiming reclaim economic sovereignty disrupt centralized financial power bitcoin,0.4215,0.05,0.23575
RSS,https://bitcoinmagazine.com/.rss/full/,2024-09-16 19:14:18+00:00,2024-09-17 12:17:31.205866,bitcoin crypto voter make voice heard america love crypto stop wisconsinwisconsin ready move past partisanship unifying force bitcoin crypto ahead 2024 election,0.6705,0.15,0.41025
RSS,https://bitcoinmagazine.com/.rss/full/,2024-09-16 16:42:08+00:00,2024-09-17 12:17:31.205866,bhutan bitcoin holding revealed kingdom owns 780m btc miningbhutans growing bitcoin empire revealed 780 million btc acquired extensive mining operation powered nation renewable energy resource,0.4215,0.0,0.21075
RSS,https://bitcoinmagazine.com/.rss/full/,2024-09-16 16:21:17+00:00,2024-09-17 12:17:31.205866,urgent need bitcoin tax reform encourage everyday usean argument tax treatment bitcoin massive disincentive use commerce,0.3818,-0.1,0.14089999999999997
RSS,https://bitcoinmagazine.com/.rss/full/,2024-09-16 14:00:08+00:00,2024-09-17 12:17:31.205866,mi primer bitcoin promotes two staff member leadership rolesthe opensource bitcoin education platform founded el salvador move two member inhouse talent one native salvadoran supervisory position,0.6369,0.0,0.31845
RSS,https://bitcoinmagazine.com/.rss/full/,2024-09-16 13:26:09+00:00,2024-09-17 12:17:31.205866,bitcoin mining shutdown cause 20 surge electricity billsthe shutdown bitcoin mining facility norway caused 20 increase electricity bill town resident loss mining operation revenue forced local power company raise rate offset cost,-0.4588,-0.15000000000000002,-0.3044
RSS,https://bitcoinmagazine.com/.rss/full/,2024-09-13 20:20:40+00:00,2024-09-17 12:17:31.205866,detroit aim drive digital asset innovation day three america love crypto tourthe motor city state michigan see opportunity creating businessfriendly environment bitcoin crypto industry welcoming stand crypto alliance,0.9451,0.25,0.59755
RSS,https://bitcoinmagazine.com/.rss/full/,2024-09-13 20:09:00+00:00,2024-09-17 12:17:31.205866,bitcoin surge 60000 market brace potential fed rate cutbitcoin touch 60000 ahead potential interest rate cut federal reserve signaling market optimism amid falling reported inflation data,0.5859,0.0,0.29295
RSS,https://bitcoinmagazine.com/.rss/full/,2024-09-13 17:30:36+00:00,2024-09-17 12:17:31.205866,bitcoin price action expect next bitcoins path forward insight price target support resistance zone,0.4019,0.05,0.22594999999999998
RSS,https://bitcoinmagazine.com/.rss/full/,2024-09-13 13:02:18+00:00,2024-09-17 12:17:31.205866,microstrategy buy additional 111 billion worth bitcoinmicrostrategy purchased additional 18300 bitcoins 111 billion boosting total bitcoin trove 244800 btc acquired 945 billion company continues bitcoin accumulation strategy capitalizing btc appreciation,0.765,0.15,0.4575
RSS,https://bitcoinmagazine.com/.rss/full/,2024-09-13 10:28:54+00:00,2024-09-17 12:17:31.205866,bitcoin crypto exchange htx integrate lightning networkone leading bitcoin crypto exchange htx announced integration bitcoins lightning network enable faster cheaper payment,0.0,0.0,0.0
RSS,https://bitcoinmagazine.com/.rss/full/,2024-09-12 15:49:09+00:00,2024-09-17 12:17:31.205866,trump election victory could send bitcoin 125000 say standard chartered analysta trump win could fuel bitcoin rally though new alltime high expected regardless 2024 election outcome,0.5859,0.1992727272727273,0.3925863636363636
RSS,https://bitcoinmagazine.com/.rss/full/,2024-09-12 13:00:00+00:00,2024-09-17 12:17:31.205866,revolutionizing bitcoin mining power threephase systemswhy threephase electrical system offer competitive advantage miner asic efficiency gain tapering,0.8225,0.0,0.41125
RSS,https://bitcoinmagazine.com/.rss/full/,2024-09-11 18:40:01+00:00,2024-09-17 12:17:31.205866,bitcoin vault future bitcoin custodyas bitcoin grows value popularity custody solution become critical learn bitcoin vault importance custody space,0.7906,0.0,0.3953
RSS,https://bitcoinmagazine.com/.rss/full/,2024-09-11 17:06:05+00:00,2024-09-17 12:17:31.205866,uk parliament introduces bill recognize bitcoin crypto personal propertythe new legislation aim provide legal clarity protection bitcoin digital asset owner,0.6908,0.08409090909090909,0.38744545454545454
RSS,https://bitcoinmagazine.com/.rss/full/,2024-09-11 15:31:02+00:00,2024-09-17 12:17:31.205866,el salvador bitcoin office celebrates 21 month success set stage renaissance 20the national bitcoin office onbtc office president el salvador led stacy herbert aim help integrate bitcoin el salvador economy foster cultural artistic psychological renaissance,0.8779,0.18333333333333335,0.5306166666666667
RSS,https://bitcoinmagazine.com/.rss/full/,2024-09-11 13:00:00+00:00,2024-09-17 12:17:31.205866,early bitcoin developer back satoshi nakamoto theorya bitcoin developer 2010 gone public support theory project anonymous founder,0.4019,0.03333333333333333,0.21761666666666665
RSS,https://bitcoinmagazine.com/.rss/full/,2024-09-11 12:14:47+00:00,2024-09-17 12:17:31.205866,bitcoin mining difficulty hit record 92 trillionthe bitcoin mining difficulty hit record high 9267 trillion september 11 displaying intensifying competition network rise indicates greater security surging collective computing power dedicated mining bitcoin,0.4767,0.33,0.40335
RSS,https://bitcoinmagazine.com/.rss/full/,2024-09-10 21:23:09+00:00,2024-09-17 12:17:31.205866,standard chartered bank launch bitcoin crypto custody service uaethe international banking group granted licence dubai financial service authority allowing custody client digital asset,0.5859,0.0,0.29295
RSS,https://bitcoinmagazine.com/.rss/full/,2024-09-10 17:59:33+00:00,2024-09-17 12:17:31.205866,un ode de lprovocateur du bitcoina poem written loosely haiku style enza coin,0.0,-0.07692307692307693,-0.038461538461538464
RSS,https://bitcoinmagazine.com/.rss/full/,2024-09-10 09:40:25+00:00,2024-09-17 12:17:31.205866,metaplanet buy additional 300 million worth bitcoinpubliclylisted metaplanet purchased additional 300 million 22m bitcoin bringing total holding 3988 btc bought 375 billion 276m,0.2263,0.15,0.18814999999999998
RSS,https://bitcoinmagazine.com/.rss/full/,2024-09-09 21:47:47+00:00,2024-09-17 12:17:31.205866,give timeon bitcoin saturn synchronicity privacy issue,0.0,0.0,0.0
RSS,https://bitcoinmagazine.com/.rss/full/,2024-09-09 17:00:00+00:00,2024-09-17 12:17:31.205866,introducing bitcoin report new monthly digest bitcoin magazine probitcoin magazine pro launch bitcoin report monthly digest offering key insight bitcoin trend onchain analysis price forecast mustread investor inaugural august edition free download,0.5106,0.1787878787878788,0.34469393939393944
RSS,https://bitcoinmagazine.com/.rss/full/,2024-09-09 16:13:00+00:00,2024-09-17 12:17:31.205866,bitcoin rollups rock hard placea look scalability limit rollups choice making decision regarding maximizing,-0.1027,-0.2916666666666667,-0.19718333333333335
RSS,https://bitcoinmagazine.com/.rss/full/,2024-09-09 13:00:00+00:00,2024-09-17 12:17:31.205866,proof workforce career government partner integrate bitcoin public sector jobsproof workforce foundation career government teamed integrate bitcoin public sector employment practice revolutionizing compensation financial literacy,0.0,0.0,0.0
RSS,https://bitcoinmagazine.com/.rss/full/,2024-09-09 12:00:28+00:00,2024-09-17 12:17:31.205866,australian bitcoin etf implement proof reserve hosekiaustralias monochrome bitcoin etf partnering hoseki implement proofofreserves becoming first australian spot bitcoin etf provide daily verification holding,0.0,0.13999999999999999,0.06999999999999999
RSS,https://bitcoinmagazine.com/.rss/full/,2024-09-09 09:43:43+00:00,2024-09-17 12:17:31.205866,japan largest power company tepco mining bitcoin using renewablesjapans largest power company tepco begun mining bitcoin subsidiary using excess renewable energy showing bitcoin incentivize green energy growth,0.7003,-0.2,0.25015
RSS,https://bitcoinmagazine.com/.rss/full/,2024-09-06 15:05:24+00:00,2024-09-17 12:17:31.205866,nevada welcome bitcoin crypto day two america love crypto touron stop two crypto industrysponsored tour battleground state political figure urge nevadan support procrypto candidate upcoming election pledge make state home crypto industry,0.7184,0.43333333333333335,0.5758666666666667
RSS,https://bitcoinmagazine.com/.rss/full/,2024-09-06 14:03:22+00:00,2024-09-17 12:17:31.205866,bitcoins potential rally amid u dollar weaknessanalyzing recent drop dollar strength index implication bitcoin,0.2732,0.0,0.1366
RSS,https://bitcoinmagazine.com/.rss/full/,2024-09-05 18:15:02+00:00,2024-09-17 12:17:31.205866,politician founder motivate crypto voter day one america love crypto tourprominent politician crypto industry leader arizona encourage procrypto voter head poll november first stop fivedate swing state tour,0.836,0.375,0.6054999999999999
RSS,https://bitcoinmagazine.com/.rss/full/,2024-09-05 16:26:22+00:00,2024-09-17 12:17:31.205866,venezuelan opposition leader maría corina machado call bitcoin lifeline exclusive interviewmaría corina machado venezuelan opposition leader discus bitcoin vital mean resistance venezuelan suffering hyperinflation chávez maduro regime,-0.1027,-0.10625,-0.104475
RSS,https://bitcoinmagazine.com/.rss/full/,2024-09-05 16:17:57+00:00,2024-09-17 12:17:31.205866,advancing bitcoin security journey basic wallet advanced protocolsa look history evolution bitcoin wallet,0.5267,0.2,0.36334999999999995
RSS,https://bitcoinmagazine.com/.rss/full/,2024-09-05 12:45:27+00:00,2024-09-17 12:17:31.205866,mastercard launch euro denominated noncustodial bitcoin debit cardmastercard launched euro debit card enabling direct spending bitcoin crypto noncustodial wallet 100 million merchant move reflects mastercards expanding effort bridge bitcoin traditional payment network,0.128,0.05,0.089
RSS,https://bitcoinmagazine.com/.rss/full/,2024-09-05 10:00:00+00:00,2024-09-17 12:17:31.205866,blockstream open new funding round second bitcoin mining security tokenblockstreams second mining note bmn2 designed much like successful bmn1,0.8271,0.1266233766233766,0.4768616883116883
RSS,https://bitcoinmagazine.com/.rss/full/,2024-09-04 20:23:06+00:00,2024-09-17 12:17:31.205866,coinbase cfo say kamala harris campaign accepts crypto donation fortunefortune report coinbase cfo said kamala harris using coinbase commerce accept cryptocurrency donation presidential campaign,0.5994,0.0,0.2997
RSS,https://bitcoinmagazine.com/.rss/full/,2024-09-04 20:11:07+00:00,2024-09-17 12:17:31.205866,choose privacytechnological capability enough create bitcoin privacy unless user society actively defend demand privacy die privacy issue,-0.25,-0.06666666666666667,-0.15833333333333333
RSS,https://bitcoinmagazine.com/.rss/full/,2024-09-04 19:08:31+00:00,2024-09-17 12:17:31.205866,u spot bitcoin etf see record 287 million outflow except blackrockus spot bitcoin etf experienced significant outflow yesterday totaling 287 million blackrock exception reporting withdrawal,0.2263,0.5875,0.40690000000000004
RSS,https://bitcoinmagazine.com/.rss/full/,2024-09-04 14:08:22+00:00,2024-09-17 12:17:31.205866,utxo research report state bridgesa research report analyzing different trust model functioning mechanism proposed existing twoway peg bitcoin layer,0.5106,0.0,0.2553
RSS,https://bitcoinmagazine.com/.rss/full/,2024-09-04 13:02:09+00:00,2024-09-17 12:17:31.205866,switzerland fourth largest bank zkb launch bitcoin tradingswitzerlands fourth largest bank zürcher kantonalbank zkb launched bitcoin crypto trading custody service amid country open regulatory environment,0.128,0.0,0.064
RSS,https://bitcoinmagazine.com/.rss/full/,2024-09-03 20:20:07+00:00,2024-09-17 12:17:31.205866,fbi warns north korean hacker targeting u bitcoin crypto etfsthe fbi issued alert warning north korean hacker attempting steal cryptocurrency fund usbased etf using sophisticated social engineering technique,-0.0516,0.26666666666666666,0.10753333333333333
RSS,https://bitcoinmagazine.com/.rss/full/,2024-09-03 20:02:24+00:00,2024-09-17 12:17:31.205866,privacy pain craig raw creator sparrow wallet selfcustodyan interview craig raw creator popular sparrow wallet bitcoin privacy best practice pain teacher privacy issue,0.1027,0.2846153846153846,0.1936576923076923
RSS,https://bitcoinmagazine.com/.rss/full/,2024-09-03 15:13:42+00:00,2024-09-17 12:17:31.205866,relais bitcoin mission bringing european orange coin despite red taperelai cofounder ceo julian liniger want onboard many eu uk citizen possible bitcoin even mean jump regulatory hoop,0.0772,0.0375,0.05735
RSS,https://bitcoinmagazine.com/.rss/full/,2024-09-03 13:20:21+00:00,2024-09-17 12:17:31.205866,dnc doesnt care bitcoinpoliticians cater voting base simple want politician care bitcoin voter need care,0.6214,-0.4,0.11069999999999997
RSS,https://bitcoinmagazine.com/.rss/full/,2024-09-03 10:13:54+00:00,2024-09-17 12:17:31.205866,bitcoin hashrate record new ath surpassing 740 ehsthe bitcoin network hashrate hit new alltime high 746 ehs september 3rd showcasing improved security fundamental come bitcoin price decline underscoring disconnect shortterm pricing longterm network health,0.6705,0.10818181818181818,0.38934090909090907
RSS,https://bitcoinmagazine.com/.rss/full/,2024-09-02 13:47:01+00:00,2024-09-17 12:17:31.205866,bitcoiners wobbly labor day editiona look history american global labor movement parallel bitcoins labor movement evolution,0.0,0.0,0.0
RSS,https://bitcoinmagazine.com/.rss/full/,2024-08-30 20:27:57+00:00,2024-09-17 12:17:31.205866,fight bitcoin privacy truly begunthen fight finally arrived financial privacy crosshairs bitcoins promise freedom money stake privacy issue,0.6369,0.0,0.31845
RSS,https://bitcoinmagazine.com/.rss/full/,2024-08-30 15:45:09+00:00,2024-09-17 12:17:31.205866,impact institutional investor bitcointhe institutional paradox big money reshaping bitcoins future,-0.1027,0.0,-0.05135
RSS,https://bitcoinist.com/feed/,2024-09-17 12:00:55+00:00,2024-09-17 12:17:31.205866,analyst urge doge investor add gegg new socialfi meme coin poised outshine weak momentumas dogecoin doge face period stagnant growth bearish pressure top analyst urging doge investor consider adding goodegg gegg portfolio goodegg gegg new socialfi memecoin poised outperform dogecoin doge thanks unique aipowered dating platform rapidly growing community weak momentum continuing plague,0.4588,0.08538961038961038,0.27209480519480517
RSS,https://bitcoinist.com/feed/,2024-09-17 12:00:49+00:00,2024-09-17 12:17:31.205866,doge volume drop 050 gegg shake ecosysteminvestors rush grab presale 000015the memecoin market long dominated dogecoin doge token famously skyrocketed thanks social medium buzz endorsement figure like elon musk however landscape shifting recently dogecoin doge seen trading volume drop 050 concerning sign coin relies heavily community engagement,0.7003,0.08055555555555556,0.3904277777777778
RSS,https://bitcoinist.com/feed/,2024-09-17 12:00:48+00:00,2024-09-17 12:17:31.205866,shib v gegg shib trader millionaire bet gegg create millionaire 2024 24b token snapped 72hrs 000015 presalea shiba inu shib millionaire known amassing fortune shibs meteoric rise recently made headline time trader betting big goodegg gegg aidriven social scoring dating platform quickly gaining traction crypto community span 72 hour 24 billion,0.5994,0.09166666666666666,0.34553333333333336
RSS,https://bitcoinist.com/feed/,2024-09-17 12:00:34+00:00,2024-09-17 12:17:31.205866,shib inu whale introduces ai social scoring coin goodegg gegginvestors rush presale 300x rallya prominent shiba inu shib whale made wave crypto community introducing goodegg gegg new aidriven socialfi coin known early investment shiba inu shib netted million whale betting goodegg gegg next big player cryptocurrency market bold move,0.5994,0.15757575757575756,0.3784878787878788
