MainSource,Source,Publication Date,Pull_date,Pre-Processed Text,Sentiment_Vader,Sentiment_TextBlob,Average_Sentiment
Reddit,solana,2025-01-02 20:14:00,2025-01-06 12:19:54.972980,colosseum codex helius startup launchpad solflare guard vortxsource httpsblogcolosseumorgheliusstartuplaunchpadsolflareguardsvortxhttpsblogcolosseumorgheliusstartuplaunchpadsolflareguardsvortx helius startup launchpad solflare guard vortx ai hackathon project solana game agent kit httpspreviewredditfj6984rr0nae1pngwidth960formatpngautowebps138745a96c7493f1af6ccd8f398bca95b4c9f343 helius startup launchpad helius startup launchpad new program turn solana builder fullfledged startup founder alongside engineering support program offer resource fundraising sale overall business strategy critical area many earlystage crypto team struggle benefit participant include 8 month free business tier access helius exclusive discount perk industryleading partner mentorship veteran solana operator investor private working group educational session introduction top vcs qualify founder working product proof concept although preseed seedstage team even earlier also encouraged apply colosseum accelerator founder automatic access launchpad combining technical infrastructure realworld mentorship launchpad aim help solana startup accelerate product development build sustainable business announcing helius startup launchpadhttpswwwheliusdevblogheliusstartuplaunchpadrefblogcolosseumorg solflare guard solflares new guard feature tackle major concern solana ecosystem malicious dapps hidden tx fee unauthorized action exploit user guard provides realtime monitoring every external transaction automatically warning there anything suspicious airdrop actually wallet drainers scam site posing legitimate apps token delegation exploit slip radar guard even help protect hardware wallet like ledger keystone theyre connected higher level trust safety help encourage broader adoption solanabased project strengthening entire ecosystem meet solflare guardshttpsxcomsolflare_walletstatus1870502712464535667refblogcolosseumorg vortx vortx exclusive community spearheaded allmight superteam designed make texas vibrant hub solana builder gathering top talent serious capital dynamic culture vortx aim transform lone star state solana stronghold member look forward networking event grant coworking opportunity centered around accelerating solanafocused innovation although small vortx stacked elite developer founder designer ecosystem contributor dedicated pushing crypto forward builder want part network apply vortx membershiphttpsairtablecomappblt8rdsjsla7ujshr0r629cc9zplyjkrefblogcolosseumorg join movement vortxhttpsvortxxyzrefblogcolosseumorg quick hit discover 400 agentic project built solana ai hackathon across 8 trackshttpsxcomsendaifunstatus1873398902654976114refblogcolosseumorg sendaifunhttpsxcomsendaifun dev tip write contentionhttpsxcomblockiosaurusstatus1869478591320523120refblogcolosseumorg blockiosaurushttpsxcomblockiosaurus building trust solana everything need know solana verifiable build videohttpswwwyoutubecomwatchvejmgevcpzkyrefblogcolosseumorg olumide micheal position agentic cyclehttpsxcomdefi0xjeffstatus1873272066834841699refblogcolosseumorg defi0xjeffhttpsxcomdefi0xjeff range announces advanced solananative realtime simulation apihttpsxcomrangesecuritystatus1871237974945399225refblogcolosseumorg rangesecurityhttpsxcomrangesecurity 10 solana game play todayhttpsxcomsolanastatus1872751267891823041refblogcolosseumorg solanahttpsxcomsolana sanctum launch creator coin betahttpsxcomsanctumsostatus1870107563720954101refblogcolosseumorg sanctumsohttpsxcomsanctumso tool resource solana agent kithttpswwwsolanaagentkitxyzrefblogcolosseumorg opensource toolkit connecting ai agent solana protocol trade launch token send compressed airdrop execute blink solana summarizerhttpsgistgithubcomrexsaurusf2571a217fc1fc9ce41033fefdeec5aarefblogcolosseumorg python script crawl top solana blog doc github repos produce flat file could used create solanasmart llm lutrshttpsgistgithubcommgild8a6a31999c7baf9d921c4a5181d8d05brefblogcolosseumorg anchor interface address lookup table get hired asymmetric research hiring technical project managerhttpsjobssolanacomcompaniesasymmetricresearch2refblogcolosseumorgcontent lead professional service security portfolio arka hiring web3 engineerhttpsjobssolanacomcompaniesarka2jobs44251755web3engineerrefblogcolosseumorgcontent develop maintain decentralized dapps phantom hiring senior software engineer fullstackhttpsjobssolanacomcompaniesphantomjobs44292706seniorsoftwareengineerfullstackrefblogcolosseumorgcontent help build phantom extension website listen unchained 2024 transformative year solana surge developer activity bold innovation depin ambition become decentralized nasdaq ecosystem making wave change enough differentiate competitor like ethereum l2 solution base episode lily liu president solana foundation mert mumtaz ceo helius join unchained discus solana carving niche debate whether base serious contender theyre concerned 2025 token unlocks solanas unique approach mev could shape future plus tackle ecosystem broader challenge believe solanas vision endure 2024 solanas best year yet sustain momentum 2025httpsunchainedcryptocom2024wassolanasbestyearyetcanitsustainthemomentumin2025refblogcolosseumorg bonus episode solana need fix max resnickhttpsblockworkscopodcastlightspeedcf4c1e24be7911ef9ae5cbebc61c7f85refblogcolosseumorg lightspeed week max resnick discus left ethereum ecosystem focus solana deep dive joining anza solana need fix successful solana ethereum ever considered money firedancer impact luca netz pudgy penguin airdrophttpsblockworkscopodcastempirecf61bcfabe5311efbbb7ef91780b5749refblogcolosseumorg empire pudgy penguin founder luca netz unpacks recent pengu token launch challenge fundraising ip project strategic decision around launching solana versus abstract l2 project aim transcend traditional memecoins become cultural phenomenon follow mikehalehttpstwittercommikehalerefblogcolosseumorg x warpcasthttpswarpcastcommikehalerefblogcolosseumorg thanks reading hope found something useful suggestion feedback let know think,0.9983,0.08094223484848485,0.5396211174242425
Reddit,solana,2025-01-02 18:04:44,2025-01-06 12:19:54.972980,solflare sending problemhey im trying move tsuki solflare ledger account main solflare account everytime im trying send say failed sign transaction using ledger anyone help pls,-0.0772,-0.16666666666666669,-0.12193333333333334
Reddit,solana,2025-01-02 15:38:37,2025-01-06 12:19:54.972980,marinade native staking apyhow 10 apy everywhere else seems 67 seems good true make suspicious,0.4939,0.5249999999999999,0.50945
Reddit,ethereum,2024-12-31 13:01:14,2025-01-06 12:19:54.972980,weekly discussion thread buildinghello rethereum welcome weekly discussion thread building space developer entrepreneur enthusiast showcase project share idea seek feedback greater ethereum community share project whether youre developing decentralized application dapp launching new layer 2 network working ethereum infrastructure encourage share detail project please provide concise overview including purpose current status link information provide xtwitter youtube link post automatically filtered engage collaborate thread excellent opportunity connect likeminded individual application tester feel free ask question offer feedback seek collaboration safety reminder encourage sharing collaboration please cautious potential scam avoid connecting wallet unfamiliar application without thorough research utilizing wallet tool offer transaction simulation eg rabby walletguard help ensure safety fund never give seed phrase private key looking forward hearing pushing ethereum ecosystem forward,0.9908,0.26694214876033057,0.6288710743801653
Reddit,ethereum,2025-01-06 07:01:27,2025-01-06 12:19:54.972980,daily general discussion january 06 2025welcome ethfinance daily general discussion rethereum httpsimgurcom3y7vezphttpsimgurcom3y7vezp please use thread discus ethereum topic news event even price price discussion posted elsewhere subreddit continue removed always constructive subreddit ruleshttpswwwredditcomrethereumaboutrules want stake learn rethstaker ethfinance ethereum community link ethereum jobshttpsethereumorgencommunitygetinvolvedethereumjobs twitterhttpsxcomethereum evmavericks youtubehttpswwwyoutubecomevmavericks discordhttpsdiscordggevmavericks doots podcasthttpsevmaverickslibsyncom doots websitehttpsdailydootscom old reddit doots extensionhttpsgithubcometheralphaethfinanceextension uhanniabu calendar jan 20 ethereum protocol attackathonhttpsblogethereumorg20241125ethereumprotocolattackathon end jan 3031 ethereumzurichhttpsethereumzurich conference feb 79 eth oxfordhttpsethoxfordio hackathon feb 1016 ethiopiahttpsethiopiaxyz conference hackathon feb 23 mar 2 ethdenverhttpswwwethdenvercom mar 2830 eth pondyhttpswwwethpondyxyz puducherry hackathon apr 13 ey global blockchain summit person virtual,0.3818,0.03333333333333334,0.20756666666666665
Reddit,ethereum,2025-01-06 10:39:10,2025-01-06 12:19:54.972980,l2s burn ethcan someone break simply make tx arbbase pay tx fee go towards l1 fee rolled published ethereum blob fee,0.5574,0.0,0.2787
Reddit,ethereum,2025-01-06 01:07:25,2025-01-06 12:19:54.972980,understanding correct ethereum v solana term securityim old eth miner back around 1020 started warm back recent day interacted defi used interact solana realized tradeoff switched back eth l2 rollups hype surrounding solana speed transaction fee many dont realize compromise theyre making term security understanding ethereum 1m validators posteip4488 significantly decentralized comparison solanas 2000 could open attack vector could compromise validators security solana network do validator crash single layer data availability consensus execution paying gas ill know security important technical folk verify im saying correct thanks,0.4939,0.1145408163265306,0.3042204081632653
Reddit,ethereum,2025-01-06 10:23:22,2025-01-06 12:19:54.972980,accelerate l2 interoperability update 0httpsnotesethereumorgrudolfinteropacc copypasted text would prefer read reddit text mine im simply reposting visibility credit author arbitrum base en metamask optimism phantom polygon taiko world zksync tldr need solve l2 interop build world computer needed solve interop already today using timescale month rather year one highest priority item right increasing da could considered type liveness failure solved l2s wallet collaborating closely first item enable fast trustless crosschain sends stay tuned update group interop matter ethereums goal world computer place anyoneanywhere build use new kind powerful unstoppable application achieve world computer vision application need accessible user time scalable cheap transact permissionless censorshipresistant secure easy lowfriction ux switching apps chain feel simple using single chain ethereum found path achieving 1 accessible time enabling lowcost l2s moving portion user activity though debate much type activity live l2s much type improvement needed l1 execution note done parallel goal eventually serve billion user world computer l1 blockchain almost certainly meaningful combination activity l1s l2s l2like thing critical user able move easily securely across chain user churn migrate place provides frictionless ux maintain focus solving pressing problem ethereums user risk letting shortterm competitive dynamic get way longerterm much larger goal achieving world computer vision mean growing pie 1000x get good news frictioness interoperability already possible today wallet support crosschain swap several highquality fast bridging solution generally ethereum ecosystem continuing towards future user dont really think much chain theyre key building block still need standardize order enable trustless secure scalable communication across chain ethereum ecosystem including nonevm chain important part making sure solve thing userfirst perspective start common user flow ethereum interop forum bangkok l2s came together shared goal user able send asset chain chain 3 slot le building block necessary achieve includes following onchain registration chain id erc7785 l2s register en rather list maintained github chainspecific address erc7828 draw erc3770 chain part address crossl2 sending done putting correct address send field crosschain messaging shared bridge many flavor discussed varying tradeoff need align first ideal base layer functionality built top see erc6170 erc7683 rip7755 erc7786 erc7802 erc7841 erc7854 whats next l2s wallet related infra across ethereum coming together solve initial goal set ethereum interop forum fast trustless crosschain sends finalize ercs 1 onchain registration chain id 2 chainspecific address l2s wallet begin implementation erc7702 parallel programmable eoa wallet coming next hard fork unify unification effort starting crosschain messaging align broader interop roadmap already working interop wed love hear anyone else who generally interested getting involved please jump erc discussion thread join next rollcall ping directly stay tuned interop update,0.9937,0.1524918831168831,0.5730959415584416
Reddit,ethereum,2025-01-06 11:30:07,2025-01-06 12:19:54.972980,access o1 pro eth l2s via nanogpt,0.0,0.0,0.0
Reddit,ethereum,2025-01-05 22:07:05,2025-01-06 12:19:54.972980,vitalik dacc one year later,0.0,0.0,0.0
Reddit,ethereum,2025-01-05 07:00:59,2025-01-06 12:19:54.972980,daily general discussion january 05 2025welcome ethfinance daily general discussion rethereum httpsimgurcom3y7vezphttpsimgurcom3y7vezp please use thread discus ethereum topic news event even price price discussion posted elsewhere subreddit continue removed always constructive subreddit ruleshttpswwwredditcomrethereumaboutrules want stake learn rethstaker ethfinance ethereum community link ethereum jobshttpsethereumorgencommunitygetinvolvedethereumjobs twitterhttpsxcomethereum evmavericks youtubehttpswwwyoutubecomevmavericks discordhttpsdiscordggevmavericks doots podcasthttpsevmaverickslibsyncom doots websitehttpsdailydootscom doots extensionhttpsgithubcometheralphaethfinanceextension uhanniabu calendar jan 20 ethereum protocol attackathonhttpsblogethereumorg20241125ethereumprotocolattackathon end jan 3031 ethereumzurichhttpsethereumzurich conference feb 79 eth oxfordhttpsethoxfordio hackathon feb 1016 ethiopiahttpsethiopiaxyz conference hackathon feb 23 mar 2 ethdenverhttpswwwethdenvercom mar 2830 eth pondyhttpswwwethpondyxyz puducherry hackathon apr 13 ey global blockchain summit person virtual,0.3818,0.020000000000000007,0.2009
Reddit,ethereum,2025-01-05 18:48:52,2025-01-06 12:19:54.972980,started claude generating private ethereum key,0.0,0.0,0.0
Reddit,ethereum,2025-01-05 22:25:11,2025-01-06 12:19:54.972980,buy ethereum without kyc wanted start crypto kind get know try stuff want spend buck really liked ethereum since also try nfts however im 17 cant buy anywhere way cryptocurrency buy without kyc could try parent friend might work id still like buy id grateful suggestion,0.9381,0.6,0.76905
Reddit,ethereum,2025-01-06 08:24:06,2025-01-06 12:19:54.972980,seedy v10 seed recovery managment tool gm im reposting tool rcryptocurrencyhttpswwwredditcomrcryptocurrency sub think many find useful extent recovery tool named seedy advanced etherium network derivitives seed phrase recovery helper tool primary function provide working seed phrase presented partial seed phrase ie missing word two seed phrase sure wrote correctly wallet accepting chance seed incorrect word either mispelling wrote wrong order simply incorrect word altogether tool take word got long know address wallet depending word needed search thousand word per second searching entire dictionary bip seed one postition time find seed display along confirmed address tied work word phrase looked position second word position 2 example start position 1 check provided word bip dictionary generated sequencial seed match part address move position 2 repeat position 3 4 etc happens quickly every single word processed complete string 12 15 18 24 word checked cryptographically see checksum validates signifying valid seed phrase derives address public key would provide key part key match address user provided move next word eventually leaving user final phraase matching private key derived seed well valid address data presentted output log well every single valid combonation attempt logged text file thats built folder tool upon running file generated user see massive amount variable processed eventually come end result study user reliable far able correclty find missing invalid word seed upto 3 bad word within hour 2 word 2030 minute single word completed possibly within minute sometimes second complicated math need longer take realistic anything half 12 word seed would take long would impractical use said infact cointinue searching endlessly untill canceled powersystem failure finally find correct phrase may seem impossible actually simple program unique approach based mathamatical algorythm developed help github community hour hour sleepless research nessesaty mother invention thus corrupt seed phrase two missing word ripped sheet paper thing stopping accessing fund hardware wallet failure failure lost phrase caused create tool help figure thats seedy born get current version 100 free long python installed system mac window linux able download github link bottom currently published open source may remain open forever significant risk malicous use discovered example may forced close source help slow creation malicous tool using code thanks reading showing interest work hope help many people released private beta testing tool limit many word missing example accept 3 4 5 word fewer word exponentially longer take year decade etc computing power required achieve search recovery correct seed seedy v100 httpsgithubcomd31337m3seedyhttpsgithubcomd31337m3seedy,0.9325,0.010584077380952382,0.4715420386904762
Reddit,ethereum,2025-01-05 04:37:02,2025-01-06 12:19:54.972980,lamborghini animocas motorverse tap base blockchain ingame asset,0.3612,-0.8,-0.2194
Reddit,ethereum,2025-01-05 12:00:26,2025-01-06 12:19:54.972980,unwrap weth polygon networka year ago used mine eth would receive weth ethermine ive trying figure unwrap clue help would greatly appreciated,0.7425,0.2,0.47125000000000006
Reddit,ethereum,2025-01-05 03:55:29,2025-01-06 12:19:54.972980,question staking ethereumstarting take crypto seriously taking break 2 year investing altcoin mostly ethereum question staking cold wallet know people like stake rocketpool decentralization 1 must one convert eth reth stake cant stake eth 2 safely stake eth directly cold wallet 3 wont depegging eth reth 4 know risk chance fund lost rocketpool,0.3818,-0.10666666666666665,0.13756666666666667
Reddit,ethereum,2025-01-05 21:17:01,2025-01-06 12:19:54.972980,new blockchain development build first dapps 20 minute published article regarding decentralized application dapps development new blockchain development build first dapps 20 minute read article medium httpsrafsunsheikh116mediumcomnewtoblockchaindevelopmentbuildyourfirstdappsinunder20minutes1f2f392d50fe happy reading,0.5719,0.3145454545454546,0.44322272727272727
Reddit,ethereum,2025-01-04 07:01:10,2025-01-06 12:19:54.972980,daily general discussion january 04 2025welcome ethfinance daily general discussion rethereum httpsimgurcom3y7vezphttpsimgurcom3y7vezp please use thread discus ethereum topic news event even price price discussion posted elsewhere subreddit continue removed always constructive subreddit ruleshttpswwwredditcomrethereumaboutrules want stake learn rethstaker ethfinance ethereum community link discord ev maverickshttpsdiscordggevmavericks ethereum twitterhttpsxcomethereum ethfinance twitterhttpsnitternetethfinancer evmavericks youtubehttpswwwyoutubecomevmavericks ethfinance doots podcasthttpsevmaverickslibsyncom daily doots websitehttpsdailydootscom ethereum jobshttpsethereumorgencommunitygetinvolvedethereumjobs get reddit doots extensionhttpsgithubcometheralphaethfinanceextension uhanniabu see fellow dooters everywhere reddit calendar jan 20 ethereum protocol attackathonhttpsblogethereumorg20241125ethereumprotocolattackathon end jan 3031 ethereumzurichhttpsethereumzurich conference feb 79 eth oxfordhttpsethoxfordio hackathon feb 1016 ethiopiahttpsethiopiaxyz conference hackathon feb 23 mar 2 ethdenverhttpswwwethdenvercom mar 2830 eth pondyhttpswwwethpondyxyz puducherry hackathon apr 13 ey global blockchain summit person virtual,-0.0258,0.016666666666666673,-0.004566666666666663
Reddit,ethereum,2025-01-05 03:22:28,2025-01-06 12:19:54.972980,tryint connect metamask wallet chainlisthi anyone already using chainlist trying connect metamask wallet chain list reason wont select wallet anyone issue,0.0,0.0,0.0
Reddit,ethereum,2025-01-04 20:00:48,2025-01-06 12:19:54.972980,staking wealthsimple canadait mention validation slashed lose ethereum reward please could someone explain mean staking safe risk,0.4939,0.09375,0.293825
Reddit,ethereum,2025-01-03 14:32:32,2025-01-06 12:19:54.972980,vitalik buterin deserves nobel prize economics work crypto ethereum bankless cofounder ryan sean adamsin tweet ryan sean adam cofounder bankless said vitalik buterin recognized nobel prize economics contribution ethereum entire crypto space said there disconnection traditional economist revolutionary economic theory applied defi vitaliks genius time go unnoticed outside crypto circle think vitalik buterin definitely ahead time contributed creation portal defi yet like many visionary think global recognition achievement might come long time everyone defi know vitalik rest world he still relatively unknown lack acknowledgment prof far true global adoption maybe still somewhat early satoshi vitalik built revolutionary platform changed finance world forever crypto stained rug pull pump dump scheme opportunistic influencers take credibility away bitcoin ethereum thats lot people refuse acknowledge crypto genuine economic innovation wonder one day vitalik remembered one greatest economic innovator time,0.9623,0.15000000000000002,0.55615
Reddit,ethereum,2025-01-04 04:33:37,2025-01-06 12:19:54.972980,help pick gstar name consensus layer upgrade fusaka add vote poll,0.4019,0.0,0.20095
Reddit,ethereum,2025-01-03 07:01:20,2025-01-06 12:19:54.972980,daily general discussion january 03 2025welcome ethfinance daily general discussion rethereum httpsimgurcom3y7vezphttpsimgurcom3y7vezp please use thread discus ethereum topic news event even price price discussion posted elsewhere subreddit continue removed always constructive subreddit ruleshttpswwwredditcomrethereumaboutrules want stake learn rethstaker ethfinance ethereum community link discord ev maverickshttpsdiscordggevmavericks ethereum twitterhttpsxcomethereum ethfinance twitterhttpsnitternetethfinancer evmavericks youtubehttpswwwyoutubecomevmavericks ethfinance doots podcasthttpsevmaverickslibsyncom daily doots websitehttpsdailydootscom ethereum jobshttpsethereumorgencommunitygetinvolvedethereumjobs get reddit doots extensionhttpsgithubcometheralphaethfinanceextension uhanniabu see fellow dooters everywhere reddit calendar jan 20 ethereum protocol attackathonhttpsblogethereumorg20241125ethereumprotocolattackathon end jan 3031 ethereumzurichhttpsethereumzurich conference feb 79 eth oxfordhttpsethoxfordio hackathon feb 1016 ethiopiahttpsethiopiaxyz conference hackathon feb 23 mar 2 ethdenverhttpswwwethdenvercom mar 2830 eth pondyhttpswwwethpondyxyz puducherry hackathon apr 13 ey global blockchain summit person virtual,-0.0258,0.016666666666666673,-0.004566666666666663
Reddit,ethereum,2025-01-03 11:13:03,2025-01-06 12:19:54.972980,ethereumrelated content ive found interesting last weekstuff found interesting porter read every 1990s cypherpunk email present interesting oneshttpsdocsgooglecompresentationd1yg3_w41k3gysuj9s3ixvjjshawjjr05s7fo09izicwgeditslideidp nicola greco alex obadia share quantum punk manifestohttpsquantumpunksorg stani compare eth stablecoins medium exchange economic currencyhttpsxcomstanikulechovstatus1871133962321408439 0xquit explains exited validatorshttpsxcom0xquitstatus1870581266640511387s19tm3p6ze6gopdfjtxnjqdc9w peteris erin confesses barely us web3httpsnewskiwistandcomstoriesal89confessionibarelyuseweb3index0x676adf39688b9731446ef20c5c4f018b4d992abe47984e22c78feebc510f63257d3a1dbb im sharing ive curating ethereumfocused newsletterhttpsparagraphxyzkiwiweeklykiwinewsrecap76 year thought id share interesting read find,0.9432,0.28125,0.612225
Reddit,ethereum,2025-01-03 17:31:17,2025-01-06 12:19:54.972980,hope recover eidoo walletseidoo old wallet seems business 2023 luckily lot eth 12 word phrase seems work modern wallet anyone know get eth back lost forever still access original app see 12 word feel like thats eidoo direct eth passphrase help appreciated,0.9287,0.1869047619047619,0.5578023809523809
