MainSource,Source,Publication Date,Pull_date,Pre-Processed Text,Sentiment_Vader,Sentiment_TextBlob,Average_Sentiment
RSS,https://cointelegraph.com/rss,2025-01-04 00:27:48+00:00,2025-01-04 00:51:47.376153,microstrategy eye bitcoin potential 2b preferred stock offering microstrategy may decide move forward perpetual preferred stock offering market condition arent favorable quarter,-0.3724,0.0,-0.1862
RSS,https://cointelegraph.com/rss,2025-01-03 20:58:52+00:00,2025-01-04 00:51:47.376153,ftxs payment plan effective user see fund according plan certain ftx user claiming le 50000 could expect see fund returned within 60 day,0.6369,0.40714285714285714,0.5220214285714286
RSS,https://cointelegraph.com/rss,2025-01-03 20:40:00+00:00,2025-01-04 00:51:47.376153,base mull launching tokenized coin stock plan yet concrete coinbase awaiting regulatory clarity security tokenization,0.6249,-0.325,0.14995
RSS,https://cointelegraph.com/rss,2025-01-03 20:20:57+00:00,2025-01-04 00:51:47.376153,u account 40 global bitcoin hashrate report hashrate dominance continues debated due pseudonymous geographically distributed nature bitcoin mining,0.2023,-0.0625,0.0699
RSS,https://cointelegraph.com/rss,2025-01-03 19:46:43+00:00,2025-01-04 00:51:47.376153,high xrp price go xrp price brink breaking pattern 100 bullish outcome potentially take value 5,0.34,0.08,0.21000000000000002
RSS,https://cointelegraph.com/rss,2025-01-03 19:00:00+00:00,2025-01-04 00:51:47.376153,sol rebound 200 aave deposit hit 334b record finance redefined growing investor optimism anticipation trump inauguration inviting new capital market pushed aave deposit new alltime high,0.7845,0.14424242424242426,0.46437121212121213
RSS,https://cointelegraph.com/rss,2025-01-03 18:54:16+00:00,2025-01-04 00:51:47.376153,price analysis 13 btc eth xrp bnb sol doge ada avax link ton bitcoin price look track reclaim 100000 level altcoins set follow,0.0,0.0,0.0
RSS,https://cointelegraph.com/rss,2025-01-03 18:40:09+00:00,2025-01-04 00:51:47.376153,here happened crypto today need know happened crypto today latest news daily trend event impacting bitcoin price blockchain defi nfts web3 crypto regulation,0.0,0.25,0.125
RSS,https://cointelegraph.com/rss,2025-01-03 18:29:21+00:00,2025-01-04 00:51:47.376153,solana founder embrace memecoins say ai agent overrated survey cited mev major concern said couldnt build solana would opt either base sui,0.3182,-0.36875,-0.02527500000000002
RSS,https://cointelegraph.com/rss,2025-01-03 17:15:48+00:00,2025-01-04 00:51:47.376153,u lawmaker kick 2025 disclosing altcoin investment georgia representative mike collins disclosed investment ether altcoins since taking office 2023,0.0,0.0,0.0
RSS,https://cointelegraph.com/rss,2025-01-03 17:09:45+00:00,2025-01-04 00:51:47.376153,crypto vcs reveal theyre looking 2025 political tailwind u anticipation friendlier regulatory climate positive sign crypto industry,0.7906,0.11363636363636363,0.4521181818181818
RSS,https://cointelegraph.com/rss,2025-01-03 16:48:21+00:00,2025-01-04 00:51:47.376153,bitcoin hashrate tap alltime high jan 3 network hashrate briefly tapped 1000 ehs miner continued adding capacity,0.0,0.08,0.04
RSS,https://cointelegraph.com/rss,2025-01-03 15:30:00+00:00,2025-01-04 00:51:47.376153,big move expected crypto asia 2025 asia express trump may take aim digital yuan overseas expansion korean institution remain sidelined crypto asia express 2025,0.0,-0.03333333333333333,-0.016666666666666666
RSS,https://cointelegraph.com/rss,2025-01-03 15:27:22+00:00,2025-01-04 00:51:47.376153,bitcoin bull run 97k key btc price resistance level beat bitcoin trader lining crucial btc price point market start show newyear sign life,0.0,0.0,0.0
RSS,https://cointelegraph.com/rss,2025-01-03 14:45:43+00:00,2025-01-04 00:51:47.376153,ethena target tradfi adoption synthetic dollar 2025 roadmap ethenas singular focus first quarter 2025 distribution tradfi wrapped iusde synthetic dollar,0.0,0.25,0.125
RSS,https://cointelegraph.com/rss,2025-01-03 14:21:17+00:00,2025-01-04 00:51:47.376153,bitcoin summer 2025 prediction inside cointelegraphs crypto roundtable join cointelegraphs editorial team reflects bitcoins breakout year landmark etf approval lie ahead crypto 2025,0.6808,0.0,0.3404
RSS,https://cointelegraph.com/rss,2025-01-03 14:00:00+00:00,2025-01-04 00:51:47.376153,almost ai agent memecoins talk ai agent taking crypto storm analyst executive arent convinced rising tide generative chatbots affiliated token longterm staying power,-0.3089,0.0,-0.15445
RSS,https://cointelegraph.com/rss,2025-01-03 14:00:00+00:00,2025-01-04 00:51:47.376153,computable economy unlock new economic order web3 rwa tokenization enable computable economy,0.0,0.16818181818181818,0.08409090909090909
RSS,https://cointelegraph.com/rss,2025-01-03 13:53:33+00:00,2025-01-04 00:51:47.376153,xrp flip usdt become 3rdlargest crypto market cap xrp previously overtook usdt dec 1 climbed past solana tether stablecoin,0.0,-0.20833333333333331,-0.10416666666666666
RSS,https://cointelegraph.com/rss,2025-01-03 13:26:28+00:00,2025-01-04 00:51:47.376153,genesis global evolution bitcoin since block 0 historic genesis block 100000 btc bitcoins journey span 16 year resilience growth innovation,-0.1531,0.0,-0.07655
RSS,https://cointelegraph.com/rss,2025-01-03 12:01:45+00:00,2025-01-04 00:51:47.376153,phishing scam top crypto security threat 2024 certik phishing attack costly attack vector crypto industry 2024 netting attacker 1 billion across 296 incident,-0.9349,0.5,-0.21744999999999998
RSS,https://cointelegraph.com/rss,2025-01-03 10:24:55+00:00,2025-01-04 00:51:47.376153,039parabolic039 bitcoin buy 80k btc price track stock research bitcoin etf outflow one headwind bull btc price drop 80000 becomes genuine risk say bravo research,-0.4939,0.4,-0.04694999999999999
RSS,https://cointelegraph.com/rss,2025-01-03 09:26:09+00:00,2025-01-04 00:51:47.376153,virtuals protocol fix bug pledge bounty researcher discovery pseudonymous security researcher identified critical vulnerability virtuals protocol audited contract prompting urgent fix,-0.0,0.0,0.0
RSS,https://cointelegraph.com/rss,2025-01-03 06:46:23+00:00,2025-01-04 00:51:47.376153,u republican lawmaker call treasury explain recent cyber breach two congressional republican calling briefing treasury department recent cyber breach alleged chinabacked hacker,0.3818,-0.03333333333333333,0.17423333333333332
RSS,https://cointelegraph.com/rss,2025-01-03 05:46:24+00:00,2025-01-04 00:51:47.376153,pentagon concludes pilot program using chatbots military medicine part pilot 200 clinical provider healthcare analyst helped identify potential vulnerability using ai chatbots military medical application,-0.2263,-0.05,-0.13815
RSS,https://cointelegraph.com/rss,2025-01-03 04:46:34+00:00,2025-01-04 00:51:47.376153,bitfufu share rise 13 inking 80000 miner agreement bitmain cloud mining firm buying latest bitmain sseries miner including higher hashrate s21 xp s21 pro model,0.7906,0.18333333333333335,0.48696666666666666
RSS,https://cointelegraph.com/rss,2025-01-03 04:44:12+00:00,2025-01-04 00:51:47.376153,mara ceo say retail investor buy bitcoin forget mara ceo fred thiel said bitcoin fallen three last 14 calendar year retail consider buying bitcoin let appreciate value,0.1779,0.0,0.08895
RSS,https://cointelegraph.com/rss,2025-01-03 03:17:58+00:00,2025-01-04 00:51:47.376153,bitcoin investor pull 333m blackrock ibit etf record outflow blackrocks ibit also saw record three consecutive trading day outflow,0.0,0.0,0.0
RSS,https://cointelegraph.com/rss,2025-01-03 02:54:48+00:00,2025-01-04 00:51:47.376153,california man sue 3 asia bank 1m pig butchering cryptofraud scam california resident ken liem accused three bank failing perform adequate check could blocked scammer opening account,-0.8555,0.3333333333333333,-0.26108333333333333
RSS,https://cointelegraph.com/rss,2025-01-03 02:49:04+00:00,2025-01-04 00:51:47.376153,crypto brokerage falconx acquires derivative startup arbelos market falconxs ceo raghu yarlagadda said institutional confidence strengthen healthy transparent crypto derivative market place,0.8074,0.5,0.6537
RSS,https://bitcoinmagazine.com/.rss/full/,2025-01-03 19:58:22+00:00,2025-01-04 00:51:47.376153,michael saylors trump meeting turbo bullish bitcointhe u finally active probitcoin administration coming office,0.4019,-0.13333333333333333,0.1342833333333333
RSS,https://bitcoinmagazine.com/.rss/full/,2025-01-03 18:34:50+00:00,2025-01-04 00:51:47.376153,birthday letter bitcoina letter bitcoin lesson impetuous teenager take heed teenage year,0.0,0.0,0.0
RSS,https://bitcoinmagazine.com/.rss/full/,2025-01-03 13:50:00+00:00,2025-01-04 00:51:47.376153,2025 bitcoin outlook insight backed metric market dataexplore bitcoins 2025 potential datadriven perspective analyzing key metric like mvrv zscore pi cycle oscillator macroeconomic trend uncover insight year ahead,0.3818,0.0,0.1909
RSS,https://bitcoinmagazine.com/.rss/full/,2025-01-02 22:17:57+00:00,2025-01-04 00:51:47.376153,1 million seed capital awarded defi hedge fund boreal bitcoin alpha competition winnersamara asset management bitcoin magazine pro selected boreal winner secondever bitcoin alpha competition,0.8126,0.0,0.4063
RSS,https://bitcoinmagazine.com/.rss/full/,2025-01-02 21:39:36+00:00,2025-01-04 00:51:47.376153,owning 1 bitcoin better millionaire think millionaire exclusive let explain owning 1 bitcoin might real wealth symbol future,0.765,0.2333333333333333,0.49916666666666665
RSS,https://bitcoinmagazine.com/.rss/full/,2025-01-02 16:05:44+00:00,2025-01-04 00:51:47.376153,woman bitcoin cointelegraph forgotwomen based europe u excellent work bitcoin space cointelegraph pointed woman africa latin america southeast asia middle east,0.5719,0.5,0.5359499999999999
RSS,https://bitcoinmagazine.com/.rss/full/,2025-01-01 18:33:27+00:00,2025-01-04 00:51:47.376153,bitcoin fiatbitcoin digital commodity decentralized digital fiat currency,0.0,0.0,0.0
RSS,https://bitcoinmagazine.com/.rss/full/,2025-01-01 17:29:37+00:00,2025-01-04 00:51:47.376153,recounting ethiopia bitcoin development 2024reviewing development 2024 ethiopian electric power eep 25 privately owned bitcoin miner ethiopia contribute 600 mw energy bitcoin network,0.2732,0.0,0.1366
RSS,https://bitcoinmagazine.com/.rss/full/,2024-12-31 19:25:04+00:00,2025-01-04 00:51:47.376153,neobank yopaki aim make every mexican bitcoinerfrancisco chavarria yopakis cofounder ceo belief educating yopakis user bitcoin incorporating favorite mexican pastime app team poised make mexico nation bitcoin enthusiast,0.7579,0.16666666666666666,0.4622833333333333
RSS,https://bitcoinmagazine.com/.rss/full/,2024-12-31 16:58:18+00:00,2025-01-04 00:51:47.376153,watch michael saylors bitcoin 100k partyjoin bitcoin magazine news desk live michael saylors 100k nye bitcoin party miami,0.4019,0.13636363636363635,0.2691318181818182
RSS,https://bitcoinmagazine.com/.rss/full/,2024-12-30 19:41:00+00:00,2025-01-04 00:51:47.376153,capitulated started buying mstrbitcoin changing way public company bolster finance mstr leading way,0.0,0.0,0.0
RSS,https://bitcoinmagazine.com/.rss/full/,2024-12-30 19:17:12+00:00,2025-01-04 00:51:47.376153,bitcoin use lose itwhy simply hodling bitcoin watching number go enough succeed,0.2023,0.0,0.10115
RSS,https://bitcoinmagazine.com/.rss/full/,2024-12-30 17:00:12+00:00,2025-01-04 00:51:47.376153,earn bitcoin providing liquidity via boltz proi look forward earning sat noncustodial manner helping boltz manage liquidity,0.296,0.0,0.148
RSS,https://bitcoinmagazine.com/.rss/full/,2024-12-30 16:20:14+00:00,2025-01-04 00:51:47.376153,progressive case strategic bitcoin reserve strengthening america social safety netprimarily endorsed bitcoin proponent gop politician trump here strategic bitcoin reserve could actually appeal progressive,0.7906,0.016666666666666666,0.40363333333333334
RSS,https://bitcoinmagazine.com/.rss/full/,2024-12-27 19:09:40+00:00,2025-01-04 00:51:47.376153,debt bitcoin return stateless money firstsome quick thought book debt first 5000 year david graeber nonaustrian view history money,-0.6124,0.29166666666666663,-0.1603666666666667
RSS,https://bitcoinmagazine.com/.rss/full/,2024-12-27 16:52:20+00:00,2025-01-04 00:51:47.376153,michael saylor doesnt understand bitcoin saylor convinced bitcoin capital currency would like see whole world adopt u dollar money instead,0.7096,0.2,0.4548
RSS,https://bitcoinmagazine.com/.rss/full/,2024-12-27 14:00:00+00:00,2025-01-04 00:51:47.376153,buy bitcoin bull market dipsbuying bitcoin bull market dip requires strategic approach avoid overpaying maximizing return,-0.296,0.0,-0.148
RSS,https://bitcoinmagazine.com/.rss/full/,2024-12-25 16:14:27+00:00,2025-01-04 00:51:47.376153,bitcoin christmascelebrate season festive bitcoin twist sixfigure high institutional fomo bitcoin christmas unwraps magic holiday hodlers thrive adoption soar santa sleigh get bullish upgrade,0.6908,0.33,0.5104
RSS,https://bitcoinmagazine.com/.rss/full/,2024-12-24 17:57:00+00:00,2025-01-04 00:51:47.376153,protect noncustodial bitcoin wallet support open dialogue foundationa new report open dialogue foundation detail whats coming pike regarding regulation around noncustodial bitcoin crypto wallet european union organization use help push back unfavorable proposal,0.7906,0.02727272727272727,0.4089363636363636
RSS,https://bitcoinmagazine.com/.rss/full/,2024-12-23 18:57:30+00:00,2025-01-04 00:51:47.376153,satoshi paper explores role state postbitcoin world interview natalie smolenskitheoretical anthropologist natalie smolenski discus latest work satoshi paper second booklength academic text bitcoin conceptualized contributed edited,0.0,0.16666666666666666,0.08333333333333333
RSS,https://bitcoinmagazine.com/.rss/full/,2024-12-21 19:38:26+00:00,2025-01-04 00:51:47.376153,blackrock cant change bitcoin worried blackrock might change bitcoins supply let explain thats possible,0.2235,0.0,0.11175
RSS,https://bitcoinmagazine.com/.rss/full/,2024-12-20 23:22:52+00:00,2025-01-04 00:51:47.376153,need inkind redemption spot bitcoin etfshopefully sec commissioner hester peirce isnt playing say shell reconsider inkind redemption spot bitcoin etf,-0.1511,-0.1,-0.12555
RSS,https://bitcoinmagazine.com/.rss/full/,2024-12-20 20:31:05+00:00,2025-01-04 00:51:47.376153,bought bitcoin 108000 dont panicwhile bitcoins volatility may seem intense correction healthy normal,0.4588,0.2833333333333333,0.37106666666666666
RSS,https://bitcoinmagazine.com/.rss/full/,2024-12-20 16:42:53+00:00,2025-01-04 00:51:47.376153,dont support strategic bitcoin reserve neither younic carter lay argument bitcoin strategic reserve,-0.5801,0.0,-0.29005
RSS,https://bitcoinmagazine.com/.rss/full/,2024-12-20 14:47:33+00:00,2025-01-04 00:51:47.376153,time admit 21 quadrillion bitcoinsim favor bip 21q clever way resolve known problem bitcoin denomination,0.7506,0.16666666666666666,0.45863333333333334
RSS,https://bitcoinmagazine.com/.rss/full/,2024-12-20 13:54:47+00:00,2025-01-04 00:51:47.376153,exploring six onchain indicator understand bitcoin market cycleexplore key bitcoin metric like puell multiple mvrv zscore understand cycle progress anticipate price peak prepare bitcoins potential path toward 200k,0.6486,0.0,0.3243
RSS,https://bitcoinmagazine.com/.rss/full/,2024-12-19 21:26:36+00:00,2025-01-04 00:51:47.376153,bitcoin investor 67000 average startbitcoin investor average average american yearly salary,0.0,-0.11249999999999999,-0.056249999999999994
RSS,https://bitcoinmagazine.com/.rss/full/,2024-12-19 20:26:21+00:00,2025-01-04 00:51:47.376153,foundation introduces passport prime bitcoin wallet data security devicefoundations new device allinone tool digital security,0.5859,0.06818181818181818,0.3270409090909091
RSS,https://bitcoinmagazine.com/.rss/full/,2024-12-19 19:42:53+00:00,2025-01-04 00:51:47.376153,bukele president el salvador bitcoina good leader first priority well people whim public gossip banter,0.5106,0.31666666666666665,0.41363333333333335
RSS,https://bitcoinmagazine.com/.rss/full/,2024-12-19 15:00:29+00:00,2025-01-04 00:51:47.376153,vancouver mayor share probitcoin vision mayor ken sim isnt paying lip service bitcoin supporter come probitcoin rhetoric proposal he true believer,0.7964,0.35,0.5731999999999999
RSS,https://bitcoinmagazine.com/.rss/full/,2024-12-19 14:24:33+00:00,2025-01-04 00:51:47.376153,dont fall bitcoin crash breather worried bitcoins pullback let explain dip nothing healthy pause bull run,-0.296,0.5,0.10200000000000001
RSS,https://bitcoinmagazine.com/.rss/full/,2024-12-19 14:18:59+00:00,2025-01-04 00:51:47.376153,imf improved el salvador bitcoin lawin return loan deal imf el salvador give probitcoin policy made bitcoin law better,0.7184,0.5,0.6092
RSS,https://bitcoinmagazine.com/.rss/full/,2024-12-19 13:00:00+00:00,2025-01-04 00:51:47.376153,human right foundation donates 700000000 satoshis fund bitcoin development projectsthe hrf announces latest round bitcoin grant targeting key area latin america asia africa,0.3612,0.11714285714285713,0.2391714285714286
RSS,https://bitcoinmagazine.com/.rss/full/,2024-12-18 19:11:13+00:00,2025-01-04 00:51:47.376153,self custody theea counter argument attitude people never even consider self custody bitcoin,-0.3612,0.0,-0.1806
RSS,https://bitcoinmagazine.com/.rss/full/,2024-12-18 16:53:49+00:00,2025-01-04 00:51:47.376153,bitcoin puell multiple indicator workthe puell multiple powerful tool bitcoin investor analyzing miner revenue identify potential market top bottom here read itand signaling today,0.5574,0.16,0.3587
RSS,https://bitcoinmagazine.com/.rss/full/,2024-12-18 16:43:41+00:00,2025-01-04 00:51:47.376153,blackrocks new bitcoin ad monumental paradigm shiftthe overton window officially shifted bitcoin going mainstream,0.0,0.13636363636363635,0.06818181818181818
RSS,https://bitcoinmagazine.com/.rss/full/,2024-12-18 14:03:52+00:00,2025-01-04 00:51:47.376153,nic carter wrong u strategic bitcoin reserveis adding bitcoin u reserve sign weakness strength let tell nic carter wrong,-0.7003,-0.5,-0.60015
RSS,https://bitcoinmagazine.com/.rss/full/,2024-12-18 13:04:46+00:00,2025-01-04 00:51:47.376153,youngest ever bitcoin core contributor get bitcoin scholarship17yearold ishaana misra awarded chaincode lab inaugural bitcoin scholarship making youngest ever contributor bitcoin core,0.4019,0.0,0.20095
RSS,https://bitcoinmagazine.com/.rss/full/,2024-12-17 22:15:21+00:00,2025-01-04 00:51:47.376153,china may verge ending bitcoin banis china secretly stacking bitcoin gearing unban let break think theyre make huge moveand sooner think,0.3182,-2.7755575615628914e-17,0.15909999999999996
RSS,https://bitcoinmagazine.com/.rss/full/,2024-12-17 20:00:34+00:00,2025-01-04 00:51:47.376153,unit denomination bitcoin need changea recent bip proposed change way unit bitcoin displayed proposal needed,0.0,0.0,0.0
RSS,https://bitcoinmagazine.com/.rss/full/,2024-12-17 17:24:23+00:00,2025-01-04 00:51:47.376153,gridless mining bitcoin fostering human flourishing africagridless cofounder janet maingi explains company bitcoin mining work helping electrify rural africa leading better quality life community gridless touch,0.6249,0.16666666666666666,0.3957833333333333
RSS,https://bitcoinmagazine.com/.rss/full/,2024-12-17 17:12:07+00:00,2025-01-04 00:51:47.376153,mathematically predicting bitcoin price bull cycle peak bitcoin magazine pro lead analyst matt crosby us mathematical analysis predict next bitcoin bull cycle peak forecasting potential peak price 256000 310000 august 24 2025,0.0,0.0,0.0
RSS,https://bitcoinmagazine.com/.rss/full/,2024-12-17 16:49:59+00:00,2025-01-04 00:51:47.376153,buying bitcoin easy hodling hard partwhile bitcoin boom bull market volatility provide intense reality check ask veteran investor american hodl,0.4215,0.06833333333333333,0.24491666666666667
RSS,https://bitcoinmagazine.com/.rss/full/,2024-12-17 16:25:37+00:00,2025-01-04 00:51:47.376153,bitcoin university investment yield greater financial freedoma look whether bitcoin university education wiser long term investment one financial freedom,0.836,0.1125,0.47425
RSS,https://bitcoinmagazine.com/.rss/full/,2024-12-16 18:57:49+00:00,2025-01-04 00:51:47.376153,bitcoin etf surpass 1 million btc 2025accelerating etf inflow dwindling exchange supply potential u strategic reserve setting stage unprecedented bitcoin scarcitymaking even 1 million price target suddenly plausible,0.0,0.3666666666666667,0.18333333333333335
RSS,https://bitcoinmagazine.com/.rss/full/,2024-12-16 18:46:35+00:00,2025-01-04 00:51:47.376153,last resort unfed covenant bitcoinjeremy rubin recently released proposal allow specialized oracle emulate covenant bitcoin softforks necessary secured bitvm based slashable bond,0.5574,0.0,0.2787
RSS,https://bitcoinmagazine.com/.rss/full/,2024-12-13 19:01:18+00:00,2025-01-04 00:51:47.376153,perianne boring predicts trump 2025 economic policy drive bitcoin price 800kin bold prediction fox business perianne boring ceo digital chamber asserted presidentelect donald trump economic policy could position u global leader bitcoin adoption potentially driving asset price unprecedented 800000 2025,0.128,-0.0740740740740741,0.026962962962962952
RSS,https://bitcoinmagazine.com/.rss/full/,2024-12-13 18:05:58+00:00,2025-01-04 00:51:47.376153,tando rage year africa bitcoin conferencethe app let user pay merchant kenya accepts digital payment via mpesa bitcoin lightning,-0.4019,0.0,-0.20095
RSS,https://bitcoinmagazine.com/.rss/full/,2024-12-13 16:08:29+00:00,2025-01-04 00:51:47.376153,early bitcoin investor sentenced prison tax evasion 37 million btc salethis mark first criminal tax evasion prosecution centered solely bitcoin,-0.875,-0.01666666666666668,-0.44583333333333336
RSS,https://bitcoinmagazine.com/.rss/full/,2024-12-13 14:22:54+00:00,2025-01-04 00:51:47.376153,bitcoin fear greed index trading strategy beat buy hold investingdiscover bitcoin fear greed index sentiment analysis tool rooted human psychology outperform traditional buyandhold strategy,-0.8957,0.0,-0.44785
RSS,https://bitcoinist.com/feed/,2025-01-04 00:22:48+00:00,2025-01-04 00:51:47.376153,7 cryptocurrency baru yang harus anda ketahui pada januari 2025pasar crypto dan meme coin kini sedang bangkit kembali top gainer dalam 24 jam terakhir termasuk fofar 184 cummies 88 dan carlo 68 bahkan pemimpin tren seperti pepe dan dogecoin juga mengalami kenaikan dengan total kapitalisasi pasar meme coin meningkat sebesar 06 fartcoin fartcoin juga menjadi pemenang lainnya naik 48 dalam satu hari terakhir dan,0.2023,0.25,0.22615000000000002
RSS,https://bitcoinist.com/feed/,2025-01-03 23:53:35+00:00,2025-01-04 00:51:47.376153,adopsi blockchain mencapai titik tertinggi dengan pencapaian 10 triliun pada 2024 detail lengkapnyaindikator utama seperti tingkat adopsi volume transaksi dan tingkat aktivitas menunjukkan rekor tertinggi pada 2024 memberikan dorongan signifikan bagi teknologi blockchain meskipun menghadapi tantangan regulasi yang berkelanjutan blockchain tetap berkembang pesat seperti yang terlihat dari peningkatan ini jaringan blockchain telah membuktikan kemampuannya untuk bertahan dan kini bergerak menuju penggunaan yang lebih luas di tengah pengawasan,0.0,0.0,0.0
RSS,https://bitcoinist.com/feed/,2025-01-03 23:30:07+00:00,2025-01-04 00:51:47.376153,worried sell bitcoin analyst provides sweet spot much higherusing technical indicator like fibonacci extension elliott wave theory crypto analyst pinpoint ideal sweet spot selling bitcoin btc according analysis specific price zone identified target btc sell area investor trader could use exit position strategically ahead possible downtrend analyst set 169000,0.8658,0.2571428571428572,0.5614714285714286
RSS,https://bitcoinist.com/feed/,2025-01-03 23:18:30+00:00,2025-01-04 00:51:47.376153,bitcoin siap lakukan pergerakan bullish selanjutnya pakar prediksi jalur btc menuju milestone 155000bitcoin menunjukkan momentum kenaikan yang baru setelah pergantian tahun memunculkan optimisme mengenai potensi lonjakan harga dalam beberapa waktu ke depan dengan peningkatan minat terhadap aset unggulan ini beberapa analis berpendapat bahwa kenaikan ke rekor harga tertinggi baru bisa segera terjadi indikator utama mengisyaratkan rally bitcoin ke wilayah tak terjangkau di tengah meningkatnya perhatian pasar mag,0.0,0.0,0.0
RSS,https://bitcoinist.com/feed/,2025-01-03 23:03:49+00:00,2025-01-04 00:51:47.376153,shiba inu mengumumkan token treat siap diluncurkan bulan inishiba inu inc secara resmi mengumumkan peluncuran token ekosistem terakhirnya treat yang dijadwalkan rilis pada januari 2025 dengan kehadiran ini ekosistem shiba inu yang sebelumnya mencakup shib bone dan leash kini diperluas treat akan menjadi komponen kunci dalam mekanisme reward dan governance yang ada di jaringan ini token keempat shiba inu akan diluncurkan januari pengumuman,0.8957,0.0,0.44785
RSS,https://bitcoinist.com/feed/,2025-01-03 22:42:32+00:00,2025-01-04 00:51:47.376153,x money mendukung crypto di peluncuran best wallet bisa jadi kunci yang hilangdebut x money yang segera tiba atau yang dikenal juga sebagai x payment tengah memicu spekulasi luas di kalangan pengguna dan pengamat industri beragam teori terkait platform pembayaran ini terus bermunculan setelah ceo x lindas yaccarino memastikan pada malam tahun baru bahwa layanan ini akan diluncurkan pada tahun 2025 bersamaan dengan peluncuran x tv dan,0.6369,1.0,0.81845
RSS,https://bitcoinist.com/feed/,2025-01-03 22:28:52+00:00,2025-01-04 00:51:47.376153,prediksi harga ethereum apakah eth akan menembus 3500ethereum eth mulai menunjukkan tandatanda pemulihan setelah sepanjang minggu berada di bawah angka 3420 meskipun level tertinggi bulan desember di 4077 masih belum terjangkau ada harapan bahwa eth mampu melewati resistensi di 3500 kenaikan ini didorong oleh lonjakan volume perdagangan token ekosistem ethereum sebesar 1629 dalam 24 jam terakhir kapitalisasi pasar gabungan dari semua proyek,0.0,0.0,0.0
