MainSource,Source,Publication Date,Pull_date,Pre-Processed Text,Sentiment_Vader,Sentiment_TextBlob,Average_Sentiment
Reddit,solana,2025-01-20 12:12:55,2025-01-20 12:18:29.171073,need help claiming pengu allocationfirst youre gon na dm dont waste time answering dm hi guy phantom wallet showing qualified pengu airdrop opened pengu website linked wallet told could claim 1837 pengu trying claim pay transaction keep getting transaction error time transaction error transactionexpiredtimeouterror transaction confirmed 3000 second unkown succeeded failedplease check image attached reference tried almost 20 time keep getting error im give anyone encountered issue know fix please let know comment,0.1611,0.06666666666666667,0.11388333333333334
Reddit,solana,2025-01-20 06:12:19,2025-01-20 12:18:29.171073,5hrs transfer still pendingi transferred sol cryptoco 5 hour ago phantom wallet still pending support say withdrawal still review time frame even transferred small amount said took minute wtf,-0.25,-0.375,-0.3125
Reddit,solana,2025-01-20 12:04:29,2025-01-20 12:18:29.171073,ivanka appeared scam whathttpspreviewreddit2wiybxcj35ee1pngwidth1589formatpngautowebps84bf2ce39a34a0a4b8f99e1bc8a8b6085ca9d2e3 minute ago appeared ivanka trump coin social medium nothing said think,-0.5719,0.03333333333333333,-0.2692833333333333
Reddit,solana,2025-01-20 08:15:24,2025-01-20 12:18:29.171073,get rid trace residual swapping phantomif try swap sol something else still tiny amount sol left transaction get rid,0.0,0.0,0.0
Reddit,solana,2025-01-18 18:18:20,2025-01-20 12:18:29.171073,im going sick thought rug,-0.5106,-0.7142857142857143,-0.6124428571428572
Reddit,solana,2025-01-20 11:50:43,2025-01-20 12:18:29.171073,everyone complains solana congestion still refuse stake improve decentralizationpeople frustrated slow transaction guess validators better network efficiencyif want solana scale need distribute stake across validators pool like vault marinade jito exactly people still delegating biggest validators complaining network struggle stake smarter fix congestion faster imo,0.0772,-0.0625,0.007350000000000002
Reddit,solana,2025-01-20 07:58:34,2025-01-20 12:18:29.171073,solana phantom hackedcan anyone tell happened account context wanted buy meme coin bought htx transferred phantom account sure transferred multiple try well pls advise,0.5719,0.25,0.41095
Reddit,solana,2025-01-20 02:54:49,2025-01-20 12:18:29.171073,please help able swapanyway someone send 2 dollar solana make swap phantom dont enough solana make trade cant send solana uphold acct bc b cooling period also deposit bank straight phantom help would greatly appreciated,0.9041,0.22499999999999998,0.56455
Reddit,solana,2025-01-19 22:32:27,2025-01-20 12:18:29.171073,cant sell moonshot always saying price change quicklyany idea know trump super hot already set range 20 max price increasing still getting message stopping selling,0.5106,0.29166666666666663,0.40113333333333334
Reddit,solana,2025-01-19 23:00:04,2025-01-20 12:18:29.171073,finally gave answer solana network experiencing high traffic,0.0,0.08,0.04
Reddit,solana,2025-01-20 11:29:38,2025-01-20 12:18:29.171073,much solana tip priority auto snipe using crypto bot 01 sol enough first auto snipe 5 sol meme coin put tippriority fee 01 sol saw someone else put 1 sol idk mistake would put using maestro sniper bot huge thanks advance,0.34,0.21000000000000002,0.275
Reddit,solana,2025-01-20 11:08:43,2025-01-20 12:18:29.171073,solana interesting criminalswhat title say solsolana useable interesting criminal create meme coin scam people optoutrugpull simple answer let honest kind action work trustworthy sol arent community interested solana build trust reliability instead always mentioned criminal act,0.8096,0.19444444444444445,0.5020222222222223
Reddit,solana,2025-01-20 00:28:27,2025-01-20 12:18:29.171073,instant buy sol jupiter money gonei tried get sol jupiter app used instant buy option card got charged sol arrived first got indicator bottom transfer process disappeard still got none tried search wallet address network explorer transaction history pending transaction get scamed,-0.2023,0.08333333333333333,-0.05948333333333334
Reddit,solana,2025-01-20 04:58:15,2025-01-20 12:18:29.171073,anyone experience using sharkbotioim looking see anyone used,0.0,0.0,0.0
Reddit,solana,2025-01-19 23:34:52,2025-01-20 12:18:29.171073,losing sol failed transactionmy swap solana failed time ive lost 1 sol total anyone know happens,-0.8885,-0.3333333333333333,-0.6109166666666667
Reddit,solana,2025-01-19 11:53:53,2025-01-20 12:18:29.171073,official solana 4th highest market cap crypto worldat ath 29331 per sol market cap 142bn solana overtaken tether number 4 valuable blockchain world congratulation one solana community march towards number 3 etf approval soon come,0.8934,0.0,0.4467
Reddit,solana,2025-01-20 10:37:39,2025-01-20 12:18:29.171073,sol expensive moonpayapologies dumb question noticed day ago last purchase purchasing sol moonpay last time noticed quite expensive market price sol around 250 purchased 055 150 would take price 1 sol around 300 thats 50 actual price didnt pay attention previous purchase noticed last time normal thats crazy tho,-0.6602,-0.19916666666666666,-0.4296833333333333
Reddit,solana,2025-01-20 02:59:36,2025-01-20 12:18:29.171073,imagine like day trump inauguration,0.3612,0.0,0.1806
Reddit,solana,2025-01-19 23:11:15,2025-01-20 12:18:29.171073,apps node severe load phantom alone receiving 8million request per minute may use jupiter another direct platform higher slippage transaction fee normal trade network experiencing little demand every part network seeing highest demand crypto date little patience stop extending trade,-0.7374,0.025,-0.3562
Reddit,solana,2025-01-20 04:27:17,2025-01-20 12:18:29.171073,accidentally sent usdc sol phantom coinbase solana address fund lostbasically title swapped sol usdc sol phantom wallet sent coinbase address however sent wrong coinbase address address sol address usdc sol address lose fund,-0.802,-0.5,-0.651
Reddit,solana,2025-01-19 23:07:38,2025-01-20 12:18:29.171073,friend sent 10 sol phantom 10 minute dont itwhats going,0.4939,0.0,0.24695
Reddit,solana,2025-01-20 10:19:48,2025-01-20 12:18:29.171073,slippagei thought slippage included estimate actually took 200 coin make money take much,0.0,0.1,0.05
Reddit,solana,2025-01-20 10:09:57,2025-01-20 12:18:29.171073,solana coinbase blaming transfer solana taking 10 hoursas coinbase blaming transfer solana taking 10 hour,-0.7506,0.0,-0.3753
Reddit,solana,2025-01-20 01:19:47,2025-01-20 12:18:29.171073,anyone received sol phantom tonighti withdrew sol phantom coinbase around 6pm still coinbase account long taking tonight,0.0,-0.05,-0.025
Reddit,solana,2025-01-19 23:22:26,2025-01-20 12:18:29.171073,reason solana unstable right nowreason melania trump launched memecoin hour ago,-0.25,0.2857142857142857,0.01785714285714285
Reddit,solana,2025-01-20 02:23:29,2025-01-20 12:18:29.171073,withdraw trump moonshoti made small investment wont let get could someone tell,0.0,-0.25,-0.125
Reddit,solana,2025-01-19 22:36:14,2025-01-20 12:18:29.171073,phantom bugging ive using phantom year lot time buggy token wont load u guy recommend another wallet thats also good know walllets solana never used asking yalll experience,0.6597,0.7,0.67985
Reddit,solana,2025-01-20 03:43:56,2025-01-20 12:18:29.171073,really bad stilli sent transfer sol phantom wallet 8hrs ago still pending wouldve thought whole situation wouldve calmed anyone else,-0.2944,-0.24999999999999992,-0.27219999999999994
Reddit,solana,2025-01-19 23:43:15,2025-01-20 12:18:29.171073,understand happened lost bit sol hello nik trying jump action buy melania thru phantom wallet dex said know try phantom trying swap swaping screen long decided press close cancel return main page saw sol trying exhange gone new coin wallet idea happened get back gone ever huge amount something cry either way meme coin money try luck would still like money back help would great thank advance everyone,0.8658,0.19412878787878787,0.529964393939394
Reddit,solana,2025-01-20 03:17:26,2025-01-20 12:18:29.171073,solana taking forever show coinbase walleti sent solana phantom wallet coinbase 635pm almost 4 hour later dont anything coinbase balance know used right wallet passed confirmation checked solscan know coinbases end know trump melania crashed solana memecoin market damn didnt know bad,0.0387,-0.13809523809523805,-0.049697619047619025
Reddit,solana,2025-01-18 13:35:36,2025-01-20 12:18:29.171073,trader bought 1million usd trump coin flipped 120mil,0.0,0.0,0.0
Reddit,solana,2025-01-20 03:09:59,2025-01-20 12:18:29.171073,sol jupiter coin arrivehey guy sent sol 15 bitpanda jupiter wallet long take till arrives already 30 minute checked entered right address seems okay anybody know sorry silly question im pretty new game,0.5994,-0.03474025974025974,0.28232987012987015
Reddit,solana,2025-01-19 22:47:40,2025-01-20 12:18:29.171073,failed swap left nothinggreetings everyone first post hope im violating rule post decided done trump coin melania announce decided take ive made since fairly early call quits went solflare swapped trump sol approved swap usual nothing happened sol balance hasnt gone still see trump wallet way interact cant swap send anything like neither sol money gone lost wasnt big chunk anything special im curious happened eventually got money thanks advance whoever able explain,0.7184,0.055714285714285716,0.3870571428571429
Reddit,solana,2025-01-20 08:28:31,2025-01-20 12:18:29.171073,waiting making movesok waiting hour transaction go hope ive evaluating position far xrps giving issue guess im buying sol get shit together already 30000 xrp original 5000 buy back 2022 using coinbase btw shit platform,-0.1531,0.015000000000000003,-0.06905
Reddit,solana,2025-01-20 08:16:33,2025-01-20 12:18:29.171073,sniper bot snipe call telegram channelshey guy one know there sniper bot automativly snipe call telegram channel,0.0,0.0,0.0
Reddit,solana,2025-01-20 11:48:17,2025-01-20 12:18:29.171073,learned missing trump gainsi banging head wall weekend missing hypothetical trump gain luckily got second chance weekend time notification wallet ready ran computer copied address jupiter first transaction didnt go obviously slippage set 30 finally managed buy melania 450 30 minute tweet remember next time wallet ready sol know swap understand slippage mean lot people werent able buy,0.8519,0.0642361111111111,0.4580680555555555
Reddit,solana,2025-01-20 04:00:54,2025-01-20 12:18:29.171073,best platform trading memecoinsphoton ape pro jupiter whats favorite,0.802,0.75,0.776
Reddit,solana,2025-01-20 03:42:34,2025-01-20 12:18:29.171073,help swap sendhello solana bnb smart chain trustwallet want swap solana solana chain send phantom wallet understand technical thing crypto layperson trying get crypto one wallet another thank,0.802,0.10714285714285714,0.45457142857142857
Reddit,solana,2025-01-19 21:42:43,2025-01-20 12:18:29.171073,yalls transfer speed suck ballz,-0.4404,0.0,-0.2202
Reddit,solana,2025-01-20 03:38:57,2025-01-20 12:18:29.171073,dexscreener customizing tradingview charthello like use custom indicator tradingview chart cant seem find way customize integrated dexscreener chart add default indicator cant find way add custom one possible thanks,0.6597,0.1,0.37984999999999997
Reddit,solana,2025-01-19 23:38:34,2025-01-20 12:18:29.171073,anyone facing transaction error,-0.4019,0.0,-0.20095
Reddit,solana,2025-01-20 03:21:22,2025-01-20 12:18:29.171073,swap solana usdcso ive experimenting swapping via jupiter raydium phantom wallet generally im trying swap usdc token solana swap back usdc however liquidity poor often raise slippage really high level like 5 greater set limit order via jupiter set well market price im seeing coinmarketcap get fill ive noticed bit better slippage swapping solana first swapping usdc anyone else noticed usdc liquidity always poor raydiumjupiter phenomenon launch trump melania hold solana core currency phantom wallet dealing token solana blockchain,0.4703,0.0825,0.2764
Reddit,solana,2025-01-19 19:07:43,2025-01-20 12:18:29.171073,anyone else trouble hey guy seeing trump website said buy moonshot able purchase yesterday fairly early problem moonshot wont let sell adjusted slippage manually 20 still wont work saying hypothetical quid would problematic,-0.8074,0.13333333333333333,-0.33703333333333335
Reddit,solana,2025-01-20 01:02:26,2025-01-20 12:18:29.171073,mean selling 80usd worth sol gon na receive 86usdt,0.2263,-0.0062500000000000056,0.110025
Reddit,solana,2025-01-19 23:23:30,2025-01-20 12:18:29.171073,issue trying swap sol taiuk investor ive never swapped new want invest tai tried making swap within coinbase wallet wasnt letting got onto phantom sent sol still wont let swap tai anyone know get swap done thanks haha,0.6886,0.1787878787878788,0.4336939393939394
Reddit,solana,2025-01-19 23:19:48,2025-01-20 12:18:29.171073,getting tracking wallet starting look others wallet copy trade tracker bullx would like see latest pnl investment etc glance able click wallet address see theyre buying selling much wallet tracker show thanks,0.6597,0.27999999999999997,0.46985
Reddit,solana,2025-01-19 23:11:35,2025-01-20 12:18:29.171073,anyone successful solana transaction im 90 minute incurious slowly processing processing rn,0.5859,0.22499999999999998,0.40545
Reddit,solana,2025-01-20 06:34:54,2025-01-20 12:18:29.171073,accidentally sent cash solana adress receive goneim getting stressed rn lose money,-0.7579,0.0,-0.37895
Reddit,solana,2025-01-20 06:34:10,2025-01-20 12:18:29.171073,wrong coin bought solana coinbase said would take 3 hour transfer another wallet like 12 hour already dont understand lose money,0.1675,-0.5,-0.16625
Reddit,solana,2025-01-20 00:13:51,2025-01-20 12:18:29.171073,better wallet phantom swappingtradingtitle,0.4404,0.5,0.4702
Reddit,ethereum,2025-01-19 06:01:32,2025-01-20 12:18:29.171073,weekly discussion thread buildinghello rethereumhttpswwwredditcomrethereum welcome weekly discussion thread building space developer entrepreneur enthusiast showcase project share idea seek feedback greater ethereum community share project whether youre developing decentralized application dapp launching new layer 2 network working ethereum infrastructure encourage share detail project please provide concise overview including purpose current status link information provide xtwitter youtube link post automatically filtered engage collaborate thread excellent opportunity connect likeminded individual application tester feel free ask question offer feedback seek collaboration safety reminder encourage sharing collaboration please cautious potential scam avoid connecting wallet unfamiliar application without thorough research utilizing wallet tool offer transaction simulation eg rabby walletguard help ensure safety fund never give seed phrase private key looking forward hearing pushing ethereum ecosystem forward,0.9908,0.26694214876033057,0.6288710743801653
Reddit,ethereum,2025-01-20 07:01:47,2025-01-20 12:18:29.171073,daily general discussion january 20 2025welcome ethereum daily general discussion rethereum httpsimgurcom3y7vezphttpsimgurcom3y7vezp bookmarking link always bring current daily httpsoldredditcomrethereumaboutstickynum2httpsoldredditcomrethereumaboutstickynum2 please use thread discus ethereum topic news event even price price discussion posted elsewhere subreddit continue removed always constructive subreddit ruleshttpswwwredditcomrethereumaboutrules want stake learn rethstaker ethfinance ethereum community link ethereum jobshttpsethereumorgencommunitygetinvolvedethereumjobs twitterhttpsxcomethereum evmavericks youtubehttpswwwyoutubecomevmavericks discordhttpsdiscordggevmavericks doots podcasthttpsevmaverickslibsyncom doots websitehttpsdailydootscom old reddit doots extensionhttpsgithubcometheralphaethfinanceextension uhanniabu calendar jan 20 ethereum protocol attackathonhttpsblogethereumorg20241125ethereumprotocolattackathon end jan 3031 ethereumzurichhttpsethereumzurich conference feb 79 eth oxfordhttpsethoxfordio hackathon feb 1016 ethiopiahttpsethiopiaxyz conference hackathon feb 23 mar 2 ethdenverhttpswwwethdenvercom mar 2830 eth pondyhttpswwwethpondyxyz puducherry hackathon apr 13 ey global blockchain summit person virtual,0.3818,0.025000000000000005,0.2034
Reddit,ethereum,2025-01-20 04:20:35,2025-01-20 12:18:29.171073,ethereum top 10,0.2023,0.5,0.35115
Reddit,ethereum,2025-01-20 03:51:37,2025-01-20 12:18:29.171073,question layer 2si crypto decided get dexs gas fee brutal swapping normal ethereum two question layer 2 1 many different ethereum remember hearing polygon lot last bull someone said layer 2 coin like polygon interesting 2 layer 2 work anything ethereum got using dexs wanted mid micro cap coin couldnt find exchange bought smaller cap coin exchange know risky price action wise dexs self custody im new thanks,0.6486,0.11761363636363636,0.38310681818181813
Reddit,ethereum,2025-01-19 07:01:09,2025-01-20 12:18:29.171073,daily general discussion january 19 2025welcome ethereum daily general discussion rethereum httpsimgurcom3y7vezphttpsimgurcom3y7vezp bookmarking link always bring current daily httpsoldredditcomrethereumaboutstickynum2httpsoldredditcomrethereumaboutstickynum2 please use thread discus ethereum topic news event even price price discussion posted elsewhere subreddit continue removed always constructive subreddit ruleshttpswwwredditcomrethereumaboutrules want stake learn rethstaker ethfinance ethereum community link ethereum jobshttpsethereumorgencommunitygetinvolvedethereumjobs twitterhttpsxcomethereum evmavericks youtubehttpswwwyoutubecomevmavericks discordhttpsdiscordggevmavericks doots podcasthttpsevmaverickslibsyncom doots websitehttpsdailydootscom old reddit doots extensionhttpsgithubcometheralphaethfinanceextension uhanniabu calendar jan 20 ethereum protocol attackathonhttpsblogethereumorg20241125ethereumprotocolattackathon end jan 3031 ethereumzurichhttpsethereumzurich conference feb 79 eth oxfordhttpsethoxfordio hackathon feb 1016 ethiopiahttpsethiopiaxyz conference hackathon feb 23 mar 2 ethdenverhttpswwwethdenvercom mar 2830 eth pondyhttpswwwethpondyxyz puducherry hackathon apr 13 ey global blockchain summit person virtual,0.3818,0.025000000000000005,0.2034
Reddit,ethereum,2025-01-19 21:57:31,2025-01-20 12:18:29.171073,sepolia test neti need test net eth token faucet seem require login sort one please send play around 0x7e8ea32016a3c32b6aae0296e20b1c28e71753e0,0.5719,0.0,0.28595
Reddit,ethereum,2025-01-19 21:15:17,2025-01-20 12:18:29.171073,whiterock web 3 authso heard whiteroch thing like oh cool onchain stock went page connect ok cool metamask usual google facebook linkedin friend web 2 new web 3 missing,0.8519,0.14772727272727273,0.49981363636363635
Reddit,ethereum,2025-01-19 10:37:51,2025-01-20 12:18:29.171073,ethereums scalability paradox forgotten stakeholder investorslet start saying big believer ethereum ecosystem know post may downvoted lot think important raise issue constructively discus said learn acknowledge understanding might flawed thats case welcome insight help understand better 1 l2s hurting ethereums tokenomics layer2 solution critical ethereums scalability seem harming economic model l2s inherently designed reduce ethereums base layer layer1 demand lower demand mean lower gas fee extension reduced burn rate eip1559 limiting eths deflationary pressure visualized eth supply chart herehttpswwwtradingviewcomsymbolseth_supply reduced demand eths price could stagnate decline hurt investor validators included 2 failing understand every validator investor first validators important maintaining security decentralization ethereum network however fail understand every validator investor first proof stake environment tied project profitable eth price continues stagnate eventually move chain ultimately compromising eths security decentralization 3 enough focus investor wholeheartedly agree encouraged change ef leadership goalshttpsxcomvitalikbuterinstatus1880635379771904423 however would like understand vested interest mean ethereum proof stake network every validator investor developer user vested interest understand ef trying eliminate influence large investor institutional individual may however cautious ignore role investor important actor contributing ethereum network 4 community critical investor voice opinion price movement dedicated sub discus price movement rethtrader sometimes isnt straight forward fundament supporting price movement discussed encouraged often people discus price looked upon despite valid point community understand ethereum proof stake stake ie eth token integral part consensus mechanism hope post spark constructive discussion hopefully bring necessary change ifwhere needed edit post doesnt discus price increasedecrease rather discus change fundamental affecting investor ie validators developer user eth token,0.9088,0.06257763975155281,0.48568881987577645
Reddit,ethereum,2025-01-19 12:57:23,2025-01-20 12:18:29.171073,best way stake ethereum small portfoliohi everyone im starting invest ethereum exploring staking way earn passive income moment eth part portfolio really smallunder 200 im dca holding gradually grow time definitely modest ive done research staking option must admit im bit overwhelmed since im still beginner advice experienced people would really helpful whats best way stake eth small amount simply stake directly exchange bigger amount want choose method work well small portfolio im open suggestion transition get bigger thanks advance insight looking forward learning,0.9704,0.17812500000000003,0.5742625
Reddit,ethereum,2025-01-20 11:20:25,2025-01-20 12:18:29.171073,trump team buying 48 mill eric trump tweet tommorow fact bought 48 million eth eth show strong movement upside coming week vitalin need go gym real pump proper gain thought,0.7717,0.2111111111111111,0.4914055555555556
Reddit,ethereum,2025-01-19 15:16:09,2025-01-20 12:18:29.171073,professional interview high school research paperhello everyone name ryan 17 year old high school student writing research paper based question take cryptocurrency democratized united state live real professional field taking reddit attempt find someone investor called professional would willing let quickly interview phone answering question giving opinion would greatly appreciated looking 1 viewpoint procrypto neutral anticrypto please shoot message comment post thanks,0.8908,0.1717906336088154,0.5312953168044077
Reddit,ethereum,2025-01-19 17:03:55,2025-01-20 12:18:29.171073,help needed accidentally used wrong network crypto transfer eth instead polygon dear community made mistake need advice transferred cryptocurrency revolut crypto account polymarket account accidentally used ethereum network eth instead polygon fund havent shown polymarket account see eth address way recover fund resolve problem guidance would greatly appreciated thanks advance,0.3962,-0.033333333333333326,0.18143333333333334
Reddit,ethereum,2025-01-19 18:03:36,2025-01-20 12:18:29.171073,access eth wallet private keyhi sent 01 eth kraken account ethadress many year ago saved private key public key installed trusted wallet android phone scanned private key qr wallet showing 0 eth public address visible etherscaniohttpetherscanio see 01 eth wrong please help want send ethereum kraken sell thx,0.8625,0.0,0.43125
Reddit,ethereum,2025-01-19 18:27:14,2025-01-20 12:18:29.171073,cartesi coprocessor template complete solution simple counter dapp utilizing cartesis coprocessorherehttpsgithubcommugenbuilderscartesicoprocessortemplates full smart contract template featuring basic counter dapp built cartesi coprocessors infrastructure seamlessly combine frontend backend think,0.6124,0.12738095238095237,0.3698904761904762
Reddit,ethereum,2025-01-19 14:14:47,2025-01-20 12:18:29.171073,eth gas priceshey im fearly new crypto currently 3 mid cap coin ethereum network efficient way get coin swapping eth ethereum main net ethereum gas price probably going suw way swap bundle eth paying gas dapp maybe gas price probably much amount coin even 23x probably didnt use right term new would appreciate suggestion,0.6705,0.13215831787260357,0.4013291589363018
Reddit,ethereum,2025-01-19 23:45:43,2025-01-20 12:18:29.171073,trump inadvertently promote ethhear though want say pro crypto space coin group trump release meme coin sol pump coin dump sol era nice base structure sol forming chart possible intentional part gain eth eth bag million liquid invest eth see resurgence holing strong right sol consolidates notice soltrump pumped eth fell money went rushing back ethbtc curious community thought going fun ride though,0.9371,0.08988095238095237,0.5134904761904762
