MainSource,Source,Publication Date,Pull_date,Pre-Processed Text,Sentiment_Vader,Sentiment_TextBlob,Average_Sentiment
RSS,https://cointelegraph.com/rss,2025-01-17 22:07:12+00:00,2025-01-18 00:48:31.769086,dogecoin 1 trader say 140 doge rally could happen february analyst say dogecoin 60 chance hitting 1 jan 31,0.25,0.0,0.125
RSS,https://cointelegraph.com/rss,2025-01-17 21:52:17+00:00,2025-01-18 00:48:31.769086,coinbase ceo call country establish bitcoin reserve brian armstrong reportedly discussed potential policy issue related cryptocurrencies u presidentelect donald trump,0.0,0.0,0.0
RSS,https://cointelegraph.com/rss,2025-01-17 21:23:15+00:00,2025-01-18 00:48:31.769086,here happened crypto today need know happened crypto today latest news daily trend event impacting bitcoin price blockchain defi nfts web3 crypto regulation,0.0,0.25,0.125
RSS,https://cointelegraph.com/rss,2025-01-17 21:00:00+00:00,2025-01-18 00:48:31.769086,crypto biz metas free speech aboutface isnt seems mark zuckerberg sincere promoting free speech platform trying mend political fence incoming trump administration,0.8957,0.325,0.6103500000000001
RSS,https://cointelegraph.com/rss,2025-01-17 20:30:52+00:00,2025-01-18 00:48:31.769086,sec charge digital currency group misleading investor dcg moro painted misleadingly rosy picture acting director sec enforcement division sanjay wadhwa wrote,-0.4019,-0.05,-0.22594999999999998
RSS,https://cointelegraph.com/rss,2025-01-17 20:06:31+00:00,2025-01-18 00:48:31.769086,ethereum price go 4k eths open interest surge institution turn bullish eth price fell 11 past 30 day bullish sentiment data point toward rally 4000,0.4588,-0.125,0.1669
RSS,https://cointelegraph.com/rss,2025-01-17 19:35:00+00:00,2025-01-18 00:48:31.769086,correlation bitcoin price vc investment break report 2024 challenging year crypto blockchain venture capital former hot sector like gaming metaverse nfts failed spur bigger funding opportunity,0.3818,0.05,0.21589999999999998
RSS,https://cointelegraph.com/rss,2025-01-17 19:00:00+00:00,2025-01-18 00:48:31.769086,xrp hit 7year peak amid bullish sentiment ftx plan payouts finance redefined ftxs 12 billion repayment seen significant liquidity event industry may bolster cryptocurrency valuation,0.2023,0.375,0.28865
RSS,https://cointelegraph.com/rss,2025-01-17 18:54:52+00:00,2025-01-18 00:48:31.769086,one sec commissioner trump term gary gensler next gary gensler prepares announce resignation sec official said step donald trump inauguration,-0.296,-0.06666666666666667,-0.18133333333333332
RSS,https://cointelegraph.com/rss,2025-01-17 18:30:00+00:00,2025-01-18 00:48:31.769086,cryptocom get eu nod mica license finalized license let cryptocom operate across eu unified regulatory framework,0.3818,0.0,0.1909
RSS,https://cointelegraph.com/rss,2025-01-17 18:00:00+00:00,2025-01-18 00:48:31.769086,u bitcoin reserve odds skyrocket betting market kalshi bettor put odds trump creating bitcoin reserve 2026 roughly 70,0.296,-0.1,0.09799999999999999
RSS,https://cointelegraph.com/rss,2025-01-17 17:51:00+00:00,2025-01-18 00:48:31.769086,price analysis 117 btc eth xrp bnb sol doge ada avax link xlm bitcoins chance hitting new alltime high increased buoyed expectation adoption u bitcoin reserve,0.4767,0.1481818181818182,0.3124409090909091
RSS,https://cointelegraph.com/rss,2025-01-17 17:30:00+00:00,2025-01-18 00:48:31.769086,dan tapiero predicts 10t crypto market 2025 driven u probusiness policy macro investor asset manager dan tapiero explains trump policy doge initiative might fuel explosive crypto growth,0.6249,0.0,0.31245
RSS,https://cointelegraph.com/rss,2025-01-17 16:30:00+00:00,2025-01-18 00:48:31.769086,crypto exec plan trump inauguration attendance steep price industry insider spent million support u presidentelects party fund inauguration likely good view capitol building jan 20,0.8074,0.19999999999999998,0.5037
RSS,https://cointelegraph.com/rss,2025-01-17 16:22:32+00:00,2025-01-18 00:48:31.769086,mara trump 47 block highlight anticipation probitcoin president immortalizing donald trump bitcoin network may seem like gimmick driven real optimism future crypto u,0.7096,0.1,0.4048
RSS,https://cointelegraph.com/rss,2025-01-17 15:49:38+00:00,2025-01-18 00:48:31.769086,probitcoin lawmaker pack congress partisan gridlock loom donald trump prepares take office crypto industry enjoys unprecedented support washington could partisan bickering spoil chance,0.7269,0.6,0.66345
RSS,https://cointelegraph.com/rss,2025-01-17 15:27:10+00:00,2025-01-18 00:48:31.769086,bitcoin price still track 180k 2025 interview filbfilb bitcoin bull market excitement building decentraders filbfilb see chance 80 btc price upside,0.6369,0.0,0.31845
RSS,https://cointelegraph.com/rss,2025-01-17 15:00:00+00:00,2025-01-18 00:48:31.769086,chirp solves iot connectivity challenge report cointelegraph research delf chirp depin address problem fragmented iot industry,-0.0772,0.0,-0.0386
RSS,https://cointelegraph.com/rss,2025-01-17 15:00:00+00:00,2025-01-18 00:48:31.769086,defi fragmentation solved account level defi fragmentation hinders adoption chain abstraction account level could fix fragmentation,0.2732,0.0,0.1366
RSS,https://cointelegraph.com/rss,2025-01-17 14:30:00+00:00,2025-01-18 00:48:31.769086,trump first week office crypto regulation take back seat crypto investor commentator hopeful ahead trump inauguration anticipating innovationfriendly regulation first day office,0.5106,0.16666666666666666,0.33863333333333334
RSS,https://cointelegraph.com/rss,2025-01-17 14:15:00+00:00,2025-01-18 00:48:31.769086,bitcoin future etf bitcoin future etf offer investor exposure bitcoins price movement without directly owning cryptocurrency,0.0,0.03333333333333333,0.016666666666666666
RSS,https://cointelegraph.com/rss,2025-01-17 13:37:44+00:00,2025-01-18 00:48:31.769086,eu new dora rule come effect mean crypto europe digital operational resilience act applies crypto business expanding mica scope requiring firm enhance cybersecurity risk management,-0.2732,-0.09403409090909091,-0.18361704545454546
RSS,https://cointelegraph.com/rss,2025-01-17 13:07:13+00:00,2025-01-18 00:48:31.769086,boerse stuttgart receives first crypto license germany mica boerse stuttgart digital custody became germany first fully licensed crypto asset service provider eu mica framework two week came full effect,0.4144,0.2125,0.31345
RSS,https://cointelegraph.com/rss,2025-01-17 12:54:25+00:00,2025-01-18 00:48:31.769086,binance update crypto rule poland meet new mica requirement binance update crypto rule polish user requiring sender recipient detail transaction align eu mica regulatory framework,0.0,0.13636363636363635,0.06818181818181818
RSS,https://cointelegraph.com/rss,2025-01-17 11:44:36+00:00,2025-01-18 00:48:31.769086,xrps 2017 playbook hint 100 rally v bitcoin march xrps price action 2025 similar one preceded 2500 price boom early 2017 altcoin snapped eightyear downtrend,0.0,0.06666666666666667,0.03333333333333333
RSS,https://cointelegraph.com/rss,2025-01-17 11:12:05+00:00,2025-01-18 00:48:31.769086,bitcoin defi tvl 2000 amid bumper 2024 btc price adoption 22fold increase attributed bitcoin staking development launch spot bitcoin etf u btcs soaring price 2024,0.3182,0.0,0.1591
RSS,https://cointelegraph.com/rss,2025-01-17 10:50:57+00:00,2025-01-18 00:48:31.769086,dogecoin doge price today doge price 10 today classic technical setup suggests dogecoin could soon tag new alltime high,0.0,0.11575757575757575,0.05787878787878788
RSS,https://cointelegraph.com/rss,2025-01-17 10:45:02+00:00,2025-01-18 00:48:31.769086,digital art venue makersplace shuts amid nft market decline new makersplace account disabled immediately user still purchase nfts platform shuts completely,0.0,0.009090909090909087,0.0045454545454545435
RSS,https://cointelegraph.com/rss,2025-01-17 10:30:41+00:00,2025-01-18 00:48:31.769086,trump inauguration buzz make bitcoin coinbase premium green bitcoin interest u investor uturn alongside btc price action returning six figure,0.4588,-0.05,0.2044
RSS,https://cointelegraph.com/rss,2025-01-17 10:02:39+00:00,2025-01-18 00:48:31.769086,yat siubacked open campus launch layer3 edu chain arbitrum edu chain support educational apps onchain education tamperproof credential developer incentive,0.6369,0.125,0.38095
RSS,https://bitcoinmagazine.com/.rss/full/,2025-01-17 17:55:41+00:00,2025-01-18 00:48:31.769086,president trump got bold vision bitcoin americaas president donald trump second term begin bitcoin community look bold promise bitcoin regulation national strategy economic growth whats storeand soon,0.8779,0.21666666666666667,0.5472833333333333
RSS,https://bitcoinmagazine.com/.rss/full/,2025-01-17 17:25:55+00:00,2025-01-18 00:48:31.769086,wyoming introduces bitcoin strategic reserve billa look bill proposed wyoming state level bitcoin strategic reserve,0.0,0.0,0.0
RSS,https://bitcoinmagazine.com/.rss/full/,2025-01-17 15:22:17+00:00,2025-01-18 00:48:31.769086,treat bitcoin tool cultignore mindless chanting slogan want bitcoin stack,0.0258,-0.2,-0.08710000000000001
RSS,https://bitcoinmagazine.com/.rss/full/,2025-01-17 14:34:04+00:00,2025-01-18 00:48:31.769086,updated mvrv zscore improves bitcoin price predictionsweve enhanced mvrv zscore better reflect bitcoins evolving market dynamic reduced volatility,0.8074,0.25,0.5287
RSS,https://bitcoinmagazine.com/.rss/full/,2025-01-17 14:00:00+00:00,2025-01-18 00:48:31.769086,california working towards embracing bitcoinbitcoin focused nonprofit proof workforce working office california legislation bitcoin initiative,0.3818,0.0,0.1909
RSS,https://bitcoinmagazine.com/.rss/full/,2025-01-16 18:24:39+00:00,2025-01-18 00:48:31.769086,bitcoin price history predicts february 2025discover bitcoins historical february performance posthalving trend provide insight investor expect 2025,0.0,0.0,0.0
RSS,https://bitcoinmagazine.com/.rss/full/,2025-01-16 16:37:32+00:00,2025-01-18 00:48:31.769086,coinbases bitcoin loan seemnot backed real bitcoin bitcoin blockchain better,0.4588,0.35,0.4044
RSS,https://bitcoinmagazine.com/.rss/full/,2025-01-15 22:03:40+00:00,2025-01-18 00:48:31.769086,bitcoin miner economic irrationality fatalbitcoins censorship resistance depends miner decentralization economic rationality therefore sustainability,-0.4019,0.2,-0.10094999999999998
RSS,https://bitcoinmagazine.com/.rss/full/,2025-01-15 21:30:04+00:00,2025-01-18 00:48:31.769086,u government release half bitcoin intended trump strategic reservethis bullish bitcoin,0.0,-0.16666666666666666,-0.08333333333333333
RSS,https://bitcoinmagazine.com/.rss/full/,2025-01-15 17:57:22+00:00,2025-01-18 00:48:31.769086,bitcoiners view quantum computinga breakdown type risk quantum computing pose bitcoin worried user network,-0.5106,0.0,-0.2553
RSS,https://bitcoinmagazine.com/.rss/full/,2025-01-15 17:46:01+00:00,2025-01-18 00:48:31.769086,hundred company buy bitcoin 2025bitwise cio matt hougan predicts treasury revolution forecasting hundred company buy bitcoin reserve asset within 18 month shaping transformative overlooked megatrend,0.4939,0.0,0.24695
RSS,https://bitcoinmagazine.com/.rss/full/,2025-01-15 16:27:46+00:00,2025-01-18 00:48:31.769086,mining bitcoin congo beyond journey bigblock datacenters sébastien gouspillousébastien gouspillou established bitcoin mining facility remote region world given back community process,0.0,-0.05,-0.025
RSS,https://bitcoinmagazine.com/.rss/full/,2025-01-15 16:18:01+00:00,2025-01-18 00:48:31.769086,x fiatyou sometimes hear bitcoiners claim x fiat x mean category food medicine art whatever im fan extrapolation supposed bitcoin value ill make exception actual x,0.2263,-0.2708333333333333,-0.022266666666666657
RSS,https://bitcoinmagazine.com/.rss/full/,2025-01-14 21:05:22+00:00,2025-01-18 00:48:31.769086,wear bitcoin shirt here whyyou putting target back wearing merch like,0.3612,0.0,0.1806
RSS,https://bitcoinmagazine.com/.rss/full/,2025-01-14 19:57:19+00:00,2025-01-18 00:48:31.769086,bitcoin defi finding productmarket fit runesbtcfi track compete ecosystem,0.3612,0.4,0.38060000000000005
RSS,https://bitcoinmagazine.com/.rss/full/,2025-01-14 19:13:56+00:00,2025-01-18 00:48:31.769086,repeating 2017 bitcoin bull cycleexplore potential bitcoin repeat 2017 bull cycle analyze price action investor behavior future prediction bitcoins market trajectory,0.0,0.03333333333333333,0.016666666666666666
RSS,https://bitcoinmagazine.com/.rss/full/,2025-01-14 17:01:08+00:00,2025-01-18 00:48:31.769086,syria exploring embrace bitcoinsyria fall assad considering legalization bitcoin including partially backing syrian pound mining excess energy reserve,0.5423,-0.1,0.22115
RSS,https://bitcoinmagazine.com/.rss/full/,2025-01-14 15:05:58+00:00,2025-01-18 00:48:31.769086,bitcoin explainer video going insanely viral let tell viral 40minute video best noobfriendly resource ive ever seen,0.6369,0.0,0.31845
RSS,https://bitcoinmagazine.com/.rss/full/,2025-01-14 14:53:02+00:00,2025-01-18 00:48:31.769086,nostr world biggest bitcoin circular economy join usstart sending receiving bitcoin exchange content,0.296,0.0,0.148
RSS,https://bitcoinmagazine.com/.rss/full/,2025-01-13 20:00:52+00:00,2025-01-18 00:48:31.769086,one week donald trump decide ross ulbrichts fatechances ross ulbricht soon free man,0.5106,0.4,0.45530000000000004
RSS,https://bitcoinmagazine.com/.rss/full/,2025-01-13 17:20:23+00:00,2025-01-18 00:48:31.769086,arka noego noah ark solidarity bitcoina look history polish solidarity movement overthrew communism similarity movement bitcoin natalie smolenski,0.5267,0.0,0.26335
RSS,https://bitcoinmagazine.com/.rss/full/,2025-01-10 21:05:24+00:00,2025-01-18 00:48:31.769086,may want redeem bitcoin thorchains lending serviceif thorchain creditor id withdraw bitcoin collateral,0.0516,0.0,0.0258
RSS,https://bitcoinmagazine.com/.rss/full/,2025-01-10 20:13:27+00:00,2025-01-18 00:48:31.769086,privacy shouldnt product stop treating like onethe degree scrutiny accountability privacy project bitcoin space almost nonexistent need change,0.5248,0.0,0.2624
RSS,https://bitcoinmagazine.com/.rss/full/,2025-01-10 19:03:04+00:00,2025-01-18 00:48:31.769086,spot bitcoin etf approval important moment 2024these etf set stage bullish 2024 become,0.5994,0.4,0.49970000000000003
RSS,https://bitcoinmagazine.com/.rss/full/,2025-01-10 15:30:39+00:00,2025-01-18 00:48:31.769086,pieter wuille gregory maxwell receive finney freedom prize pieter wuille gregory maxwell honoured finney freedom prize transformative contribution bitcoins scalability privacy usability,0.9595,0.0,0.47975
RSS,https://bitcoinmagazine.com/.rss/full/,2025-01-10 13:30:00+00:00,2025-01-18 00:48:31.769086,bitcoin etf lived hypebitcoin etf launched high expectation 2024 one year later analyze performance market influence whether theyve lived hype,0.128,0.08,0.10400000000000001
RSS,https://bitcoinmagazine.com/.rss/full/,2025-01-09 15:48:40+00:00,2025-01-18 00:48:31.769086,future home bitcoin mining bright new bitaxe device come market heatbit device helping everyday user mine bitcoin keeping home warm 5500 opensource mining developer continue work together push home bitcoin mining industry forward,0.7184,0.24727272727272726,0.4828363636363636
RSS,https://bitcoinmagazine.com/.rss/full/,2025-01-08 22:03:10+00:00,2025-01-18 00:48:31.769086,steve hanke wrong strategic bitcoin reserve let break outdated argument dont add,-0.6808,-0.45000000000000007,-0.5654
RSS,https://bitcoinmagazine.com/.rss/full/,2025-01-08 19:34:20+00:00,2025-01-18 00:48:31.769086,dont buy bitcoin dipnow time make sizable bitcoin purchase,0.0,0.0,0.0
RSS,https://bitcoinmagazine.com/.rss/full/,2025-01-08 19:02:07+00:00,2025-01-18 00:48:31.769086,lightning network privacy big picture dont forget nsawhile lightning might provide good privacy direct participant network case powerful adversary,0.6774,0.27499999999999997,0.47619999999999996
RSS,https://bitcoinmagazine.com/.rss/full/,2025-01-08 18:16:42+00:00,2025-01-18 00:48:31.769086,buying greenland would huge boost u bitcoin mininggreenlands abundance renewable energy cold climate make ideal place trump encourage american bitcoin mining,0.9153,0.175,0.54515
RSS,https://bitcoinmagazine.com/.rss/full/,2025-01-08 17:09:03+00:00,2025-01-18 00:48:31.769086,using mining create fully validating bitcoin usershow stratum v2 help improve bitcoin decentralization mining ecosystem overall,0.8553,0.0,0.42765
RSS,https://bitcoinmagazine.com/.rss/full/,2025-01-08 14:00:11+00:00,2025-01-18 00:48:31.769086,ledn remains bitcoins premier borrowing lending platformledns chief strategy officer cso mauricio di bartolomeo reflects choice cofounder made led six year success,0.5719,0.3,0.43594999999999995
RSS,https://bitcoinmagazine.com/.rss/full/,2025-01-07 19:10:31+00:00,2025-01-18 00:48:31.769086,bitcoin layer 2 foundation buy bitcoin treasury bitcoin layer 2 foundation building bitcoin arent storing treasury,0.0536,0.0,0.0268
RSS,https://bitcoinmagazine.com/.rss/full/,2025-01-07 16:55:11+00:00,2025-01-18 00:48:31.769086,meet jason marquez truck driver made 750000 microstrategyafter getting crypto ftx one man went michael saylor made fortune,0.0,0.0,0.0
RSS,https://bitcoinmagazine.com/.rss/full/,2025-01-07 15:13:33+00:00,2025-01-18 00:48:31.769086,laser eye upsidedown pic new bitcoin campaign flip goldbitcoin hit 100k next mission clear flip gold market cap join picfliptillgoldflip campaign help push bitcoin 1 million laser eye upsidedown pic time turn financial world headliterally,0.7579,0.05909090909090908,0.40849545454545455
RSS,https://bitcoinmagazine.com/.rss/full/,2025-01-07 14:55:00+00:00,2025-01-18 00:48:31.769086,democrat reverse stance bitcoinvan jones admits democrat paid attention crypto voter last election cycle want party moving forward offering voting bloc lip service wont enough win,0.2796,0.26666666666666666,0.27313333333333334
RSS,https://bitcoinmagazine.com/.rss/full/,2025-01-06 18:45:12+00:00,2025-01-18 00:48:31.769086,anchor evil bitcoin core destroying bitcoincriticism bitcoin core developer hitting new high absurdity illogical foundation around ridiculousness,-0.8779,-0.22590909090909086,-0.5519045454545455
RSS,https://bitcoinmagazine.com/.rss/full/,2025-01-06 17:11:57+00:00,2025-01-18 00:48:31.769086,canada elect next bitcoin world leadercanadas prime minster resigned paving way conservative party probitcoin leader replace,0.1779,0.4,0.28895000000000004
RSS,https://bitcoinmagazine.com/.rss/full/,2025-01-06 14:44:57+00:00,2025-01-18 00:48:31.769086,new pi cycle top prediction chart identifies bitcoin price market peak precisiondiscover newly launched pi cycle top prediction chart cuttingedge tool designed help professional investor anticipate bitcoins market cycle peak manage risk effectively,0.765,0.3287878787878788,0.5468939393939394
RSS,https://bitcoinmagazine.com/.rss/full/,2025-01-03 19:58:22+00:00,2025-01-18 00:48:31.769086,michael saylors trump meeting turbo bullish bitcointhe u finally active probitcoin administration coming office,0.4019,-0.13333333333333333,0.1342833333333333
RSS,https://bitcoinmagazine.com/.rss/full/,2025-01-03 18:34:50+00:00,2025-01-18 00:48:31.769086,birthday letter bitcoina letter bitcoin lesson impetuous teenager take heed teenage year,0.0,0.0,0.0
RSS,https://bitcoinmagazine.com/.rss/full/,2025-01-03 13:50:00+00:00,2025-01-18 00:48:31.769086,2025 bitcoin outlook insight backed metric market dataexplore bitcoins 2025 potential datadriven perspective analyzing key metric like mvrv zscore pi cycle oscillator macroeconomic trend uncover insight year ahead,0.3818,0.0,0.1909
RSS,https://bitcoinmagazine.com/.rss/full/,2025-01-02 22:17:57+00:00,2025-01-18 00:48:31.769086,1 million seed capital awarded defi hedge fund boreal bitcoin alpha competition winnersamara asset management bitcoin magazine pro selected boreal winner secondever bitcoin alpha competition,0.8126,0.0,0.4063
RSS,https://bitcoinmagazine.com/.rss/full/,2025-01-02 21:39:36+00:00,2025-01-18 00:48:31.769086,owning 1 bitcoin better millionaire think millionaire exclusive let explain owning 1 bitcoin might real wealth symbol future,0.765,0.2333333333333333,0.49916666666666665
RSS,https://bitcoinmagazine.com/.rss/full/,2025-01-02 16:05:44+00:00,2025-01-18 00:48:31.769086,woman bitcoin cointelegraph forgotwomen based europe u excellent work bitcoin space cointelegraph pointed woman africa latin america southeast asia middle east,0.5719,0.5,0.5359499999999999
RSS,https://bitcoinmagazine.com/.rss/full/,2025-01-01 18:33:27+00:00,2025-01-18 00:48:31.769086,bitcoin fiatbitcoin digital commodity decentralized digital fiat currency,0.0,0.0,0.0
RSS,https://bitcoinmagazine.com/.rss/full/,2025-01-01 17:29:37+00:00,2025-01-18 00:48:31.769086,recounting ethiopia bitcoin development 2024reviewing development 2024 ethiopian electric power eep 25 privately owned bitcoin miner ethiopia contribute 600 mw energy bitcoin network,0.2732,0.0,0.1366
RSS,https://bitcoinmagazine.com/.rss/full/,2024-12-31 19:25:04+00:00,2025-01-18 00:48:31.769086,neobank yopaki aim make every mexican bitcoinerfrancisco chavarria yopakis cofounder ceo belief educating yopakis user bitcoin incorporating favorite mexican pastime app team poised make mexico nation bitcoin enthusiast,0.7579,0.16666666666666666,0.4622833333333333
RSS,https://bitcoinmagazine.com/.rss/full/,2024-12-31 16:58:18+00:00,2025-01-18 00:48:31.769086,watch michael saylors bitcoin 100k partyjoin bitcoin magazine news desk live michael saylors 100k nye bitcoin party miami,0.4019,0.13636363636363635,0.2691318181818182
RSS,https://bitcoinist.com/feed/,2025-01-17 23:30:06+00:00,2025-01-18 00:48:31.769086,bitcoin bull market alive kicking study confirmsmany crypto investor worried bitcoins uncertainty cryptocurrency experienced fluctuation price wherein trader saw traded 100000 went 90000 related reading bitcoin state mind texas aim pioneer strategic reserve however renowned crypto analytics platform asserted bull market experienced,-0.25,0.42500000000000004,0.08750000000000002
RSS,https://bitcoinist.com/feed/,2025-01-17 22:00:34+00:00,2025-01-18 00:48:31.769086,bitcoins key metric point crucial support level case pullbackwith shifting market dynamic bitcoin moved positive territory price sight key resistance level however due volatile nature crypto asset flagship asset recent uptrend might experience brief drawback resuming upward direction support area bitcoin amid potential trend reversal cryptocurrency asset known sudden,0.9552,0.010227272727272727,0.4827136363636364
RSS,https://bitcoinist.com/feed/,2025-01-17 20:30:40+00:00,2025-01-18 00:48:31.769086,looking unimaginable financial freedom expert reveals many xrp need achieve thisxrp become focal point crypto market experiencing massive price surge surpassing 3 mark many investor seeking wealth previously stagnant cryptocurrency presented opportunity buy low hope price increase fortunately xrp stayed true bullish prediction finally rallying,0.9442,0.17592592592592593,0.560062962962963
RSS,https://bitcoinist.com/feed/,2025-01-17 19:36:16+00:00,2025-01-18 00:48:31.769086,massachusetts introduces strategic bitcoin reserve bill first among deep blue statesrepublican senator peter durant worcester county massachusetts introduced legislation aimed establishing bitcoin strategic reserve initiative mark significant step cryptocurrency traditionally democratic stronghold make massachusetts first deep blue state consider legislation senator durant champion bitcoin bill proposes creation,0.8074,0.109375,0.4583875
RSS,https://bitcoinist.com/feed/,2025-01-17 19:30:02+00:00,2025-01-18 00:48:31.769086,btc koers herpakt 100k niveau bekende cryptos pumpen na lek trump crypto reservesbitcoin btc heeft het 100000 niveau herpakt aangedreven door de lekken trump plannen voor een nationale bitcoinreserve dit nieuws heeft de cryptomarkt nieuw bullish momentum gegeven terwijl ook andere bekende cryptos grote prijsbewegingen vertonen de aankomende inauguratie van trump lijkt dit positieve sentiment verder te versterken wat de kans vergroot op verdere prijsstijgingen,0.0,0.0,0.0
RSS,https://bitcoinist.com/feed/,2025-01-17 17:30:25+00:00,2025-01-18 00:48:31.769086,fdic fire senator alleges destruction operation chokepoint 20 recordsthere new concern regarding transparency regulatory method federal deposit insurance corporation fdic following allegation senator cynthia lummis wyoming think agency sabotaged critical data related operation chokepoint 20 believed targeted cryptocurrency sector related reading bitmex slapped 100 million,-0.8126,0.02727272727272727,-0.3926636363636364
RSS,https://bitcoinist.com/feed/,2025-01-17 16:16:29+00:00,2025-01-18 00:48:31.769086,wall street pepe wepe rocket past 50m ongoing presale investor anticipate 100x returnspepe saw massive 800m surge volume little last 48 hour hinting recordbreaking institutional participation meme coin additionally meme market today green across board big name like litecoin hbar double digit pepe around 6 according claybro,0.3612,-0.09107142857142857,0.13506428571428572
RSS,https://bitcoinist.com/feed/,2025-01-17 16:00:38+00:00,2025-01-18 00:48:31.769086,dogecoin close daily candle outside falling wedge pattern 041 next important levelcrypto analyst kevin capital provided insight current dogecoin price action part analysis highlighted 041 price level next important level foremost meme coin 041 next important level dogecoin close outside falling wedge pattern x post kevin capital revealed dogecoin,0.296,0.11818181818181818,0.20709090909090908
