MainSource,Source,Publication Date,Pull_date,Pre-Processed Text,Sentiment_Vader,Sentiment_TextBlob,Average_Sentiment
Reddit,ethereum,2024-12-02 20:38:23,2024-12-04 12:20:15.798250,whats going gas feeshttpspreviewreddit556g52srxh4e1pngwidth1964formatpngautowebpsd91c2473ecd28c44da5c0836e441c6e4166ca1fb havent seen fee like long time hell going almost 200 buck swap,-0.7724,-0.05,-0.4112
Reddit,ethereum,2024-12-02 20:05:57,2024-12-04 12:20:15.798250,eth ranger program,0.0,0.0,0.0
Reddit,ethereum,2024-12-02 07:01:36,2024-12-04 12:20:15.798250,daily general discussion december 02 2024welcome today daily general discussion please use thread discus ethereum topic news event even price yes trying something new allow price discussion thread price discussion posted elsewhere subreddit continue removed always keep friendly follow sub rule ticker eth,0.8442,0.10189393939393938,0.4730469696969697
Reddit,ethereum,2024-12-01 22:34:27,2024-12-04 12:20:15.798250,blob driving million fee ethereumethereum blob consistently hit target throughout november driving million fee ethereum last 7 day blob ranked 4 contributor eth burn httpspreviewredditbe7eeqwmdb4e1pngwidth1104formatpngautowebps2c9b438928f8ec930fe8a7d66ab431940d0f0f5c source httpsxcomsealaunch_status1863345297587331249httpsxcomsealaunch_status1863345297587331249,0.0,0.125,0.0625
Reddit,ethereum,2024-12-02 22:50:54,2024-12-04 12:20:15.798250,sent eth old binance account robinhood wrong network really losthello last night went process digging old binance account 2017 see crypto gone recently 1600 excited wanted one single platform also binance u couldnt anything withdraw happy find easy transferred ripple robinhood problem network option said automatically match network everything went quickly worth 600 tried 1k worth eth network option didnt say automatically match choose 1 4 option explanation difference looked transaction price transfer time chose cheapest fee arbitrum nothing robinhood binance gave warning need pick correct network found digging deeper robinhood find doesnt accept transfer network everything customer service end say lost forever googling also tell help would appreciated lost forever want know sure give thanks,0.3855,0.1957936507936508,0.2906468253968254
Reddit,ethereum,2024-12-01 19:39:13,2024-12-04 12:20:15.798250,base l2 seeing surge activityhttpspreviewreddit9d1kqct7ia4e1pngwidth900formatpngautowebpsbe38595aa83104cfceb82467cf36200c4def2b2b httpspreviewredditr0gu7n2aia4e1pngwidth900formatpngautowebps25718de9d504cc158d49ed755557012e557f2f07 httpspreviewredditpblm5mnbia4e1pngwidth900formatpngautowebpse54fdeb52e1e2e13c1fbf8aad467732d78c174d4 base seeing surge transaction network increased demand impact transaction success rate declined 90 close 70 surge also driven significant rise l2 revenue profit despite increased cost blob reducing l2 profit margin 99 90 base generated 4m l2 profit last week alone sourcehttpsxcomsealaunch_status1863306275058041114,0.8998,-0.28750000000000003,0.30615000000000003
Reddit,ethereum,2024-12-02 04:17:23,2024-12-04 12:20:15.798250,describe setup hi there much client manage digital asset im genuinely curious toolswallets use everyday manage web3 journey underlying question client wallet use desktop mobile use smart wallet account like safehttpssafeglobal use configured use several address across several chain including l2 keep track fund nfts use aggregator like zerion zapper etc whatever im curious use everyday send transaction manage asset cryptos asset manage smart account etc thanks,0.9698,0.020779220779220776,0.4952896103896104
Reddit,ethereum,2024-12-01 14:58:36,2024-12-04 12:20:15.798250,recently interested ethereums roadmap however seem completely understand talking blob recommended reading material help nontechnical person roughly understand ethereum roadmapalthough trading onchain long time used bot understanding theory behind ethereum especially ethereum roadmap really abouti hope recommended material read understand ethereum roadmap think introduction,0.8871,-7.93016446160826e-18,0.44355
Reddit,ethereum,2024-12-02 17:44:37,2024-12-04 12:20:15.798250,happens average ethereum user ethereum hit like 50k sending 10 cost averagely 26 going current gas price plan reduce gas fee sth ethereum mainnet,0.3612,-0.09999999999999999,0.13060000000000002
Reddit,ethereum,2024-12-01 07:01:35,2024-12-04 12:20:15.798250,daily general discussion december 01 2024welcome today daily general discussion please use thread discus ethereum topic news event even price yes trying something new allow price discussion thread price discussion posted elsewhere subreddit continue removed always keep friendly follow sub rule ticker eth,0.8442,0.10189393939393938,0.4730469696969697
Reddit,ethereum,2024-12-01 22:36:28,2024-12-04 12:20:15.798250,please help possible scammed year ago would like know scammer tracked downgreetings year ago foolishly fell scam scammer managed steal 62k chainlink token methis transaction httpsetherscaniotx0xde07048f5200bb78a46a199bdc71ffa68c186e5003c5074634074082ff392101httpsetherscaniotx0xde07048f5200bb78a46a199bdc71ffa68c186e5003c5074634074082ff392101 wallet one ending 0xa1276 already reported local police department well ic3 ftc however year waiting update getting nothing may someone familiar track stuff able assist im saavy would like help possible constantly get panic attack due event even able get fund back scammerhacker face kind legal justice would awesome,0.8442,0.2541666666666667,0.5491833333333334
Reddit,ethereum,2024-12-01 02:39:04,2024-12-04 12:20:15.798250,good documentary blockchain web3hi im looking good documentary web3 blockchain would crypto scam mooooooon especially im looking something would approach tech innovation smart contract dapps etc documentary ive watched far money electric bitcoin mysteryhttpswwwhbocommoviesmoneyelectricthebitcoinmystery vitalik ethereum storyhttpsethereumfilmxyz thanks,0.8519,0.2126984126984127,0.5322992063492064
Reddit,ethereum,2024-11-30 21:31:45,2024-12-04 12:20:15.798250,could someone please guide usdc stuck eth wallet look etherscan show toke holding take somebody sent usdc accidentally sent eth wallet fund sitting limbo basically read needed fund wallet eth cover gas fee im stuck anybody know solution,-0.2023,0.0,-0.10115
Reddit,ethereum,2024-11-30 07:01:25,2024-12-04 12:20:15.798250,daily general discussion november 30 2024welcome today daily general discussion please use thread discus ethereum topic news event even price yes trying something new allow price discussion thread price discussion posted elsewhere subreddit continue removed always keep friendly follow sub rule ticker eth,0.8442,0.10189393939393938,0.4730469696969697
Reddit,ethereum,2024-11-29 11:46:09,2024-12-04 12:20:15.798250,someone 50000 convincing ai agent send fund,0.4019,0.5,0.45094999999999996
Reddit,ethereum,2024-11-29 23:09:09,2024-12-04 12:20:15.798250,latest week ethereum news,0.0,0.5,0.25
Reddit,ethereum,2024-11-29 13:31:34,2024-12-04 12:20:15.798250,bankless discloses bag,0.0,0.0,0.0
Reddit,ethereum,2024-11-30 00:41:41,2024-12-04 12:20:15.798250,protocol berg back 2025,0.0,0.0,0.0
Reddit,ethereum,2024-11-30 09:15:00,2024-12-04 12:20:15.798250,hyperliquid dexcan anyone explain hyperliquid point resource inknow tldr onchain binance come deposit withdraw usdc get thebliquidity spot token cant withdraw others,0.0,0.0,0.0
Reddit,ethereum,2024-11-29 23:15:20,2024-12-04 12:20:15.798250,discover async p2p collab w textspecific commenting,0.0,0.0,0.0
Reddit,ethereum,2024-11-29 07:01:21,2024-12-04 12:20:15.798250,daily general discussion november 29 2024welcome today daily general discussion please use thread discus ethereum topic news event even price yes trying something new allow price discussion thread price discussion posted elsewhere subreddit continue removed always keep friendly follow sub rule ticker eth,0.8442,0.10189393939393938,0.4730469696969697
Reddit,ethereum,2024-11-29 14:23:31,2024-12-04 12:20:15.798250,markus haas ethos building cryptonative device,0.0,0.0,0.0
Reddit,ethereum,2024-11-29 16:39:02,2024-12-04 12:20:15.798250,eli5 gas fee eth v altstrying understand buy eth pay 150 gas fee buy alt coin eth network gas fee 25 based completing transaction time hour apart gas fee different,-0.1027,0.0,-0.05135
Reddit,ethereum,2024-11-29 04:37:26,2024-12-04 12:20:15.798250,nanogpt access chatgptclaudegrok uncensored model using eth l2s full privacy,0.0,0.35,0.175
Reddit,ethereum,2024-11-29 20:46:32,2024-12-04 12:20:15.798250,someone sent digital card ethereum wallet view card,0.0,0.0,0.0
Reddit,ethereum,2024-11-29 16:42:43,2024-12-04 12:20:15.798250,anyone know rwas projectsi know big promise crypto market future rwas real world asset project wellstructured grounded,0.5859,0.06666666666666667,0.3262833333333333
Reddit,ethereum,2024-11-29 15:30:11,2024-12-04 12:20:15.798250,tax sending eth robinhood walleti see robinhood finally added ability send crypto would happen hypothetical scenario john sends 1x eth robinhood account janes wallet jane life puerto rico capital gain tax jane sell eth usd give money john john reinvests buy original amount eth john avoided capital gain tax value eth,0.886,0.1875,0.5367500000000001
Reddit,ethereum,2024-11-29 04:10:25,2024-12-04 12:20:15.798250,want versus want secthanks ive seen couple people id like explore,0.4767,0.0,0.23835
Reddit,ethereum,2024-11-29 05:48:12,2024-12-04 12:20:15.798250,testing threat hey fellow builder wondering tool available test smart contract different attack beyond static testing improve security let say want test contract actual reentrancy attack testing method tool,-0.3182,0.22285714285714286,-0.04767142857142856
Reddit,ethereum,2024-11-28 16:59:11,2024-12-04 12:20:15.798250,poll daily general discussion threadsthere daily general discussion thread sub think change view pollhttpswwwredditcompoll1h20e73,0.0,0.02500000000000001,0.012500000000000004
Reddit,ethereum,2024-11-28 12:51:48,2024-12-04 12:20:15.798250,information number user eth chainstokens build itso im curious genuinely open minded total number user ethereum plus using token higher layer depend build whatever compare figure see bitcoin btc environment regarding estimated number user also deduced selfcustodial usage blockchain got question talk strategic reserve im hearing politician talk eth reserve despite impression actual _usage_ actual individual _people_ potentially higher widerutility focused eth digital gold btc blockchain know number ever approximated interested whatever information community point thanks,0.8841,0.07727272727272728,0.48068636363636363
Reddit,ethereum,2024-11-28 07:01:11,2024-12-04 12:20:15.798250,daily general discussion november 28 2024welcome today daily general discussion please use thread discus ethereum topic news event even price yes trying something new allow price discussion thread price discussion posted elsewhere subreddit continue removed always keep friendly follow sub rule ticker eth,0.8442,0.10189393939393938,0.4730469696969697
Reddit,ethereum,2024-11-28 08:32:16,2024-12-04 12:20:15.798250,insecure keystore file generated deposit tool,-0.4215,-0.5,-0.46075
Reddit,ethereum,2024-11-27 13:21:39,2024-12-04 12:20:15.798250,beam chain whats nextthe beam chain introduced publicly justin drake ethereum researcher devcon 2024 two week ago highly anticipated announcement sparked mixed reaction met excitement others expressed skepticism whats next stage waiting official proposal technical specification could take time finalize meanwhile discussion around beam chain intensifying essential address concern one key point raised argument could continue without beam chain however crucial remember ethereum consensus layer cl 5 already year old yes lot nutshell cl become outdated accumulated technical debt utilizing latest innovation zeroknowledge zk proof beam chain introduction present opportunity address backlog perform necessary upgrade clean ethereums tech debt one go justin drake mentioned primary reason overhaul reduce technological debt built beacon chain past five year note beam chain change ethereums roadmap rather consolidates upcoming change unified proposal batch upgrade read recent threadhttpsxcometh_everstakestatus1856687548694720933 another significant concern 5year timeline beam chain implementation many argue five year long however justin drake clarified ethereum continue receive regular update throughout period beam chain fork occur five year constant update ethereum five year ethereum currently support hundred billion dollar asset tvl thousand dapps immense ecosystem requires careful planning testing ensure smooth rollout mainnet hard rationale argue httpspreviewreddit2ga9omf63g3e1pngwidth1842formatpngautowebps4ba7a269b9891de6520b5f8682bdcc6e4ada62c8 also important note beam chain still proposal highly likely change made initial design ossifies thus great opportunity everyone engage ethereum governance share thought beam chain proposal open discussion reasoned opinion input better chance shape best solution ethereums future,0.9853,0.1225,0.5539
Reddit,ethereum,2024-11-27 01:19:13,2024-12-04 12:20:15.798250,u 5th circuit rule tornado cash contract sanctioned pdf,0.0,0.0,0.0
Reddit,ethereum,2024-11-27 07:01:14,2024-12-04 12:20:15.798250,daily general discussion november 27 2024welcome today daily general discussion please use thread discus ethereum topic news event even price yes trying something new allow price discussion thread price discussion posted elsewhere subreddit continue removed always keep friendly follow sub rule ticker eth,0.8442,0.10189393939393938,0.4730469696969697
Reddit,ethereum,2024-11-27 14:51:50,2024-12-04 12:20:15.798250,revisiting world computer,0.0,0.0,0.0
Reddit,ethereum,2024-11-27 18:39:46,2024-12-04 12:20:15.798250,uneasy early victory lap 5th circuit ruling based couple phenomenon industry thread raniergrant thread reader app,-0.3818,0.1,-0.14089999999999997
Reddit,ethereum,2024-11-26 15:42:29,2024-12-04 12:20:15.798250,ethereum blob usage hit record high dencun upgrade,0.0,0.16,0.08
Reddit,ethereum,2024-11-27 01:42:41,2024-12-04 12:20:15.798250,next billion fellowship program application open,0.0,0.0,0.0
Reddit,ethereum,2024-11-26 14:40:31,2024-12-04 12:20:15.798250,reputable partner staking opinionso want stake eth holding im short 32 required solo staking know use many platform people also often warn using third party platform holding technically anymore know decentralized staking pool exist im lacking overview share knowledge experience,0.5859,0.2,0.39295
Reddit,ethereum,2024-11-27 14:50:04,2024-12-04 12:20:15.798250,service crypto wallet bank store know private key get sign transaction via access bank account 2fa would mean would touch private key user service would also let export private key wanted,0.0,-0.044642857142857144,-0.022321428571428572
Reddit,ethereum,2024-11-26 16:11:46,2024-12-04 12:20:15.798250,united state department treasurydigital asset treasury market,0.7269,0.0,0.36345
Reddit,ethereum,2024-11-26 04:28:41,2024-12-04 12:20:15.798250,get ethereumhi id love hear personal story discovering ethereum first hear ethereum sparked interest youve start learning ethereum bought eth motivated decision thanks sharing journey,0.9423,0.2375,0.5899
Reddit,ethereum,2024-11-26 13:01:19,2024-12-04 12:20:15.798250,weekly discussion thread buildinghello rethereum welcome new weekly discussion thread building space developer entrepreneur enthusiast showcase project share idea seek feedback greater ethereum community share project whether youre developing decentralized application dapp launching new layer 2 network working ethereum infrastructure encourage share detail project please provide concise overview including purpose current status link information provide xtwitter youtube link post automatically filtered engage collaborate thread excellent opportunity connect likeminded individual application tester feel free ask question offer feedback seek collaboration safety reminder encourage sharing collaboration please cautious potential scam avoid connecting wallet unfamiliar application without thorough research utilizing wallet tool offer transaction simulation eg rabby walletguard help ensure safety fund never give seed phrase private key looking forward hearing pushing ethereum ecosystem forward p devcon soon nov 1215 ticket sold apply waitlist herehttpsdevconorgentickets,0.9908,0.25606060606060604,0.623430303030303
Reddit,ethereum,2024-11-25 10:31:31,2024-12-04 12:20:15.798250,donald trump million dollar worth eth,0.2263,0.3,0.26315
Reddit,ethereum,2024-11-26 07:01:14,2024-12-04 12:20:15.798250,daily general discussion november 26 2024welcome today daily general discussion please use thread discus ethereum topic news event even price yes trying something new allow price discussion thread price discussion posted elsewhere subreddit continue removed always keep friendly follow sub rule ticker eth,0.8442,0.10189393939393938,0.4730469696969697
Reddit,ethereum,2024-11-26 04:25:28,2024-12-04 12:20:15.798250,ethereum protocol attackathon live ethereum foundation blog,0.0,0.13636363636363635,0.06818181818181818
Reddit,ethereum,2024-11-26 16:51:59,2024-12-04 12:20:15.798250,best crypto price data websocket apisi developing alert bot need monitor price change across token traded decentralized exchange option looking compare data provider across breadth number chain covered price much cost listen token,0.7717,0.6,0.6858500000000001
Reddit,ethereum,2024-11-26 15:26:29,2024-12-04 12:20:15.798250,nextjs template developing dapp wagmii dont know many thing please help im getting error wagmi integration getting error please provide tutorial template,0.2263,0.5,0.36315
Reddit,ethereum,2024-11-27 02:07:44,2024-12-04 12:20:15.798250,szabo better denomination public think eth saying 300 szabo easier understand saying 00003 ethit impractical silly use number lot decimal place talking money computer nerd ever want public need friendly unit account given 1 eth 106 szabo assuming 1 eth go 3300 dollar worth 303 szabo lot friendly think public like better peek fence see bitcoin ecosystem wallet apps gradually shifting satoshi default primary denomination starting say thing like dollar worth 1000 satoshi paid ten thousand sat thats easier conceptualize people like better long run szabo practical roughly double value japanese yen million people price thing term jpy want buy 20 item 0006 eth would rather pay 6000 szabo,0.9831,0.15882352941176472,0.5709617647058823
Reddit,ethereum,2024-11-26 08:05:03,2024-12-04 12:20:15.798250,glitter nihilism crypto,0.0,0.0,0.0
Reddit,ethereum,2024-11-26 20:16:14,2024-12-04 12:20:15.798250,question ethereum transferredso go crypto wallet today twoway bus wallet trust wallet trust wallet nice little bit ethereum built today gone balance zero say transferred yesterday different address told contact try get back anybody else issue maybe messed something fudge something anybody know else make sure doesnt happen im sure stuff gotten twostep verification fingerprint input get like every security access put yet somehow transfer yesterday ethereum,0.905,0.2354166666666667,0.5702083333333333
Reddit,ethereum,2024-11-25 23:11:02,2024-12-04 12:20:15.798250,pseudo transaction sandwichingfrontrunning occurring cowswap frontrunning protected dexplease note transcription someone el twitter post original content transcription reddit user always find native content convenient read privacy friendly op agentchud twitter original posthttpsxcomagentchudstatus1860760767727079558 ok town weekend got back still working programmatic demonstration feel comfortable saying stop using cowswap saddens say ive loyal user suggested long time cowswap user taken cleaner dont get sandwiched ok pseudo sandwich here work traditional sandwich mev dbag like jaredfromsubway see order mempool buy coin sell coin block free money mev bot little risk cowswap pseudo sandwich mev bot monitoring cowswap auction data front running user auction completed selling auction completed great traditional sandwich bc multiblock operation bot carry inventory risk know future people buy pretty solid edge possible well live auction available via public api following endpoint anyone see user intent solver win competition execute order httpsapicowfimainnetapiv1auction noticed trying use cowswap buy kekec dbag kept buying second signed cowswap order selling shortly order went sometimes even causing order fail bc order pushed order outside slippage tolerance intention buy fucking kekec im going resubmit order right well yeah thats multiple time sure enough guy ready sell front ran kekec second order actually executed here address he made 200k usd past 2 month exploiting cowswap user fashion youd better believe he successful others tried inform cowswap team behavior ive absolutely loved using product past year guy spoke condescending didnt seem think issue shit hadnt put together comprehensive report yet brother christ pending auction data public know damn well people taking advantage httpsetherscanioaddress0x9f9401c76e054d1c9fe3b94a7356361ff32b1ea1tokentxns design flaw literally advantage using cowswap moving forward suggest using flashbots rpc llamaswap defillama 0xngmi exclusively least addressed rectified stay safe cousin there crime afoot im interested hear people opinion personally probably keep using cowswap smaller transaction cowswap still higher upfront cost someone frontrun though wonder swapping frontrunning protection service like metamasks built one might better option going forward,0.9926,0.15801859704920931,0.5753092985246047
Reddit,ethereum,2024-11-26 12:08:27,2024-12-04 12:20:15.798250,scott bessent lead treasury cnn businesswhat think could impact ethereums ecosystem,0.2023,0.0,0.10115
Reddit,ethereum,2024-11-25 15:42:07,2024-12-04 12:20:15.798250,ethereumrelated content ive found interesting last weekstuff found interesting dmnc asks crypto fragmentation problemhttpsnewskiwistandcomoutboundurlhttps3a2f2fbskyapp2fprofile2fdmncbskysocial2fpost2f3lboukaseyk2y mikko ohtamaa share unpopular opinion new ethereum infrahttpsnewskiwistandcomoutboundurlhttps3a2f2fxcom2fmoo90002fstatus2f1859176975283130665 anthony sassano online v offline vibeshttpsnewskiwistandcomoutboundurlhttps3a2f2fwwwyoutubecom2fwatch3ft3d2209s26v3dsg9npx4dju0 tekkac describes cheap zeroknowledge magichttpsmediumcomtekkaczeroknowledgemagiconstarknet56ac2453234f whitepaper cycleshttpsnewskiwistandcomoutboundurlhttps3a2f2fcyclesmoney2fwhitepaperpdf im sharing ive curating ethereumfocused newsletterhttpsparagraphxyzkiwiweeklykiwinewsrecap71 year thought id share interesting read find,0.9153,0.33939393939393936,0.6273469696969697
Reddit,ethereum,2024-11-26 06:39:12,2024-12-04 12:20:15.798250,staking erc20 coinscan stake erc20 coin ledger nano metamask connecting way get wide option staking coin remain secure cold wallet,0.34,-0.09999999999999998,0.12000000000000002
Reddit,ethereum,2024-11-25 07:01:30,2024-12-04 12:20:15.798250,daily general discussion november 25 2024welcome today daily general discussion please use thread discus ethereum topic news event even price yes trying something new allow price discussion thread price discussion posted elsewhere subreddit continue removed always keep friendly follow sub rule ticker eth,0.8442,0.10189393939393938,0.4730469696969697
Reddit,ethereum,2024-11-25 23:20:36,2024-12-04 12:20:15.798250,auto invest paycheck cryptohello everyone im looking invest portion w2 salary every month crypto portfolio preface im still starting crypto apology say something dumb every month 30th get w2 direct deposit recently decided id like take small portion let say 5 equally distributed across 510 coin choose example btc eth xrp uni link ada dot invest let say 1000 every month would want equally divided amount coin portfolio example example 1000 8 125 125 coin every coin 30th every month keep automatically every month without managing similar saving account ira etc way platform best ideally least fee ill monthly several coin preferred platform type crypto investing far im looking kraken pro thank help advance tldr looking platform auto invest direct deposit salary crypto portfolio across several coin choose,0.8442,-0.008333333333333333,0.4179333333333333
Reddit,ethereum,2024-11-25 21:39:04,2024-12-04 12:20:15.798250,moving eth purchased eth using ramp metamask wallet io isnt amount added eth wallet app bridge base eth without mad gas fee thank,0.6283,-0.7125,-0.042100000000000026
Reddit,ethereum,2024-11-25 09:42:22,2024-12-04 12:20:15.798250,would guy use transaction sharing tool like thishttpswwwtinytxlink ive created simple tool devsusers create skeleton transaction shared others use input editable lot refine would happy get feedback feature request interest thanks,0.9607,0.3333333333333333,0.6470166666666667
Reddit,ethereum,2024-11-25 09:29:13,2024-12-04 12:20:15.798250,reflection devcon ahmed gatnash,0.0,0.0,0.0
