MainSource,Source,Publication Date,Pull_date,Pre-Processed Text,Sentiment_Vader,Sentiment_TextBlob,Average_Sentiment
GoogleNews,ethereum,1 hour ago,2025-02-04 12:19:06.748666,setting jetbolt panshibi apart investment like ethereum februarythe best crypto presales rocking market currently trending altcoins well trending wrong reason ethereum news today show,0.6908,0.16666666666666666,0.4287333333333333
GoogleNews,ethereum,1 hour ago,2025-02-04 12:19:06.748666,ethereum boost network capacity validators approve gas limit increaseethereum successfully increased gas limit first time since transitioning proofofstake po consensus mechanism,0.5267,0.5,0.51335
GoogleNews,ethereum,2 hours ago,2025-02-04 12:19:06.748666,choosing ethereum shiba inu could save investmentinvesting ethereum provides stable option compared meme coin like shiba inu ethereums market cap approximately 400 billion reflects,0.7845,-0.4,0.19224999999999998
GoogleNews,ethereum,2 hours ago,2025-02-04 12:19:06.748666,ethereum bitcoin price comparison reach prenft defi boom level 2021ethereum eth keep sinking new low btc returning prepandemic level erasing gain nft web3 defi boom,0.34,0.06818181818181818,0.2040909090909091
GoogleNews,ethereum,2 hours ago,2025-02-04 12:19:06.748666,ethereums ongoing struggle marketethereum secondlargest cryptocurrency market capitalization facing mounting challenge investor sentiment remains weak,-0.5994,-0.375,-0.4872
GoogleNews,ethereum,2 hours ago,2025-02-04 12:19:06.748666,bitcoin ethereum recoup loss trump halt tariff canada mexicobitcoin face resistance near 100k risking drop 94k ethereum eye rebound toward 4k meanwhile rising uschina trade tension add,-0.7906,0.1,-0.3453
GoogleNews,ethereum,2 hours ago,2025-02-04 12:19:06.748666,ethereum trash convinced peter brandt there catchveteran trader peter brandt trash ethereum give two scenario bitcoin,0.4019,0.0,0.20095
GoogleNews,ethereum,2 hours ago,2025-02-04 12:19:06.748666,ethereum boost transaction power first gas limit increase since 2021ethereum ethusd validators agreed raise gas limit nearly 32 million unit enhancing network capacity process transaction,0.7269,0.175,0.45094999999999996
GoogleNews,ethereum,2 hours ago,2025-02-04 12:19:06.748666,ethereum adjusts gas limit first time since 2021the ethereum network recently raised gas limit 30 million 50 validators indicating change,0.0,0.125,0.0625
GoogleNews,ethereum,2 hours ago,2025-02-04 12:19:06.748666,bitcoin ethereum etf flow decline amid market uncertainty marketthe cryptocurrency market facing significant turbulence investment flow bitcoin btc ethereum eth exchangetraded fund etf,-0.1531,0.375,0.11095
GoogleNews,ethereum,2 hours ago,2025-02-04 12:19:06.748666,top reason ethereum eth price 12 todayfollowing crypto market correction ethereum eth price registered strong bounce back gaining 12 shooting past 2800 level,0.7845,0.17083333333333334,0.4776666666666667
GoogleNews,ethereum,2 hours ago,2025-02-04 12:19:06.748666,ethereum price ethusd forecast update 04022025ethereum price ethusd trade clear negativity break 276475 settle hint weak positive momentum might turn decline,0.0,-0.015909090909090918,-0.007954545454545459
GoogleNews,ethereum,2 hours ago,2025-02-04 12:19:06.748666,ethereums struggle spotlight marketethereum secondlargest cryptocurrency market capitalization facing challenging period investor sentiment remains subdued,-0.1779,0.5,0.16105
GoogleNews,ethereum,2 hours ago,2025-02-04 12:19:06.748666,ethereums sudden crash manipulated market eventethereum eth dramatic plunge reveals calculated manipulation event exploiting market leverage triggering massive selloff,-0.8555,-0.14444444444444446,-0.49997222222222226
GoogleNews,ethereum,2 hours ago,2025-02-04 12:19:06.748666,vitalik buterin hail ethereums l1 scaling 50 validators wantethereum scalability effort hit critical milestone majority validators supporting gas limit increase l1 block capacity,0.0772,0.125,0.1011
GoogleNews,ethereum,2 hours ago,2025-02-04 12:19:06.748666,crypto price analysis 24 bitcoin btc ethereum eth solana sol chainlink link near protocol near filecoin fil arbitrum arbthe crypto market rebounded donald trump agreed delay tariff canada mexico following conversation president,-0.0516,0.06666666666666667,0.007533333333333333
GoogleNews,ethereum,2 hours ago,2025-02-04 12:19:06.748666,ethereum bearish alertcoin name eth position short see ethereum chart 15minute timeframe show bearish pattern forming,0.0,0.0,0.0
GoogleNews,ethereum,2 hours ago,2025-02-04 12:19:06.748666,bitcoin ethereum etf flow decline amid crypto market turmoil marketthe cryptocurrency market experiencing significant turbulence investment flow bitcoin btc ethereum eth exchangetraded fund etf,-0.1779,0.375,0.09855
GoogleNews,ethereum,2 hours ago,2025-02-04 12:19:06.748666,ethereum holder migrating viral altcoin set 20x cycleaccording today crypto news ethereums ecosystem shamble ethereum investor moving trending altcoins following sluggish beginning,-0.4019,0.0,-0.20095
GoogleNews,ethereum,2 hours ago,2025-02-04 12:19:06.748666,ethereums market surging whale quietly accumulating panshibi shibi alarming rateethereum whale accumulating panshibi shibi ahead presale surge high yield realworld utility panshibi present promising meme,0.296,0.052000000000000005,0.174
GoogleNews,ethereum,3 hours ago,2025-02-04 12:19:06.748666,invest 2000 ethereum shiba inudeciding major cryptocurrency like ethereum eth 515 meme coin like shiba inu shib 597 easy choice investor,0.8008,0.24791666666666667,0.5243583333333333
GoogleNews,ethereum,3 hours ago,2025-02-04 12:19:06.748666,ethereum struggle breach 4k rollblocks presale frenzy hint 2025 breakoutthe crypto market constant dance anticipation speculation watch bitcoins every move like hawk analyze ethereums struggle,-0.4588,0.0,-0.2294
GoogleNews,ethereum,3 hours ago,2025-02-04 12:19:06.748666,ethereums next move accumulation dormant whale market uncertaintyfor recognizable dynamic quality associated ethereums price current market cycle anything dynamic,0.6369,0.05,0.34345000000000003
GoogleNews,ethereum,3 hours ago,2025-02-04 12:19:06.748666,blackrock report zero daily flow ethereum etfaccording farside investor twitter blackrocks ethereum etf reported daily flow 0 million usd highlighting lack investment activity,-0.3182,0.0,-0.1591
GoogleNews,ethereum,3 hours ago,2025-02-04 12:19:06.748666,ethereum etf exhibit diverse net flow february 3 2025according farside investor total net flow ethereum etf reached 836 million february 3 2025 breakdown reveals feth etf,0.1027,0.0,0.05135
GoogleNews,ethereum,3 hours ago,2025-02-04 12:19:06.748666,ethereum stock rise gas limit increase boost scalabilityethereum achieved significant milestone reaching consensus required raise network gas limit move aimed enhancing blockchains,0.765,0.375,0.5700000000000001
GoogleNews,ethereum,3 hours ago,2025-02-04 12:19:06.748666,ethereum eth price eric trump endorsement trigger 26 price recovery amid tariff pauseeric trump publicly endorsed ethereum social medium followed company world liberty financial purchasing 1826 eth worth 5 million ethereum price,0.8225,0.08333333333333333,0.4529166666666667
GoogleNews,ethereum,3 hours ago,2025-02-04 12:19:06.748666,ethereum raise gas limit first time since 2021 boosting eth appealthis change implemented half validators supported adjustment enacted automatically without need hard,0.6119,-0.06944444444444445,0.2712277777777778
GoogleNews,ethereum,3 hours ago,2025-02-04 12:19:06.748666,eric trump recommends buying ethereum wlfi buy tokeneric trump recently shilled ethereum social medium garnered much speculation especially ensuing whale ether purchase wlfi,0.2263,0.058333333333333334,0.14231666666666667
GoogleNews,ethereum,3 hours ago,2025-02-04 12:19:06.748666,ethereum identity crisis scale bloxthere competition ethereum form block chain solana example blockchain solana could lot faster,-0.7906,0.0,-0.3953
GoogleNews,ethereum,3 hours ago,2025-02-04 12:19:06.748666,dogecoin ethereum face heavy 10 loss 1fuels exchange immune market crash tipped 10xover year ethereum dogecoin earned status two best altcoins buy however stop 1fuel capturing,0.0516,0.4,0.2258
GoogleNews,ethereum,3 hours ago,2025-02-04 12:19:06.748666,ethereum solana rebound trump agrees pause tariff canada mexico marketthe cryptocurrency market experienced dramatic rebound early february 2025 significant gain seen ethereum eth solana sol,0.7184,0.21041666666666667,0.46440833333333337
GoogleNews,ethereum,3 hours ago,2025-02-04 12:19:06.748666,ethereum struggle filecoin face pressure blockdag eye 1 major cex listingswhile ethereum filecoin navigate market uncertainty blockdag surge past 1915m presale prepares major cex listing,-0.7096,-0.041666666666666664,-0.3756333333333333
GoogleNews,ethereum,3 hours ago,2025-02-04 12:19:06.748666,ethereums surge exciting whale quietly buying panshibi shibiwhile ethereums performance captivating trader across board observer intrigued different development major holder typically,0.4939,0.11597222222222224,0.30493611111111113
GoogleNews,ethereum,4 hours ago,2025-02-04 12:19:06.748666,silent accumulation phase begin stellar ethereum whale liquidity shift 1fuels superfast tech1fuel set take crypto world surprise first two presales success ongoing third presale fire,0.5267,0.16,0.34335
GoogleNews,ethereum,4 hours ago,2025-02-04 12:19:06.748666,china u trade war could push ethereum 22002400 andrew kangmechanism capital partner andrew kang predicted china really launch trade war u ethereum fall back 22002400,-0.8428,0.1,-0.3714
GoogleNews,ethereum,4 hours ago,2025-02-04 12:19:06.748666,investor place 105 million remittix 100x ethereum cardano holder watch rise new monstera brand new target fastchanging cryptocurrency market focus remittix rtx,0.0,0.13636363636363635,0.06818181818181818
GoogleNews,ethereum,4 hours ago,2025-02-04 12:19:06.748666,crypto price prediction 2025 bitcoin ethereum moreexplore future cryptocurrencies expert insight crypto price prediction 2025 discover key trend shaping bitcoin ethereum xrp,0.0,0.0,0.0
GoogleNews,ethereum,4 hours ago,2025-02-04 12:19:06.748666,ethereum price prediction eth maintain momentum recent rallyethereum surged 2300 2900 wild 24hour ride keep climbing4 hour ago,0.0,0.05,0.025
GoogleNews,ethereum,4 hours ago,2025-02-04 12:19:06.748666,ethereums pectra upgrade set boost layer 2 capacity eth price jump 10ethereum one leading blockchain network gearing next big upgrade pectra scheduled launch march recent tweet post,0.4019,0.0,0.20095
GoogleNews,blockchain,0 minutes ago,2025-02-04 12:19:06.748666,fantoms transition sonic reshapes blockchain landscapethe blockchain world never sits still fantoms transition sonic proof major upgrade speed efficiency incentive,0.6444,0.0625,0.35345
GoogleNews,blockchain,6 minutes ago,2025-02-04 12:19:06.748666,beyond traditional po tan bpos changing blockchain consensusblockchain consensus mechanism evolved significantly year still face inefficiency fairness decentralization longterm,-0.5574,0.1875,-0.18495
GoogleNews,blockchain,1 hour ago,2025-02-04 12:19:06.748666,taiko takeoff initiative set propel blockchain projectstaiko introduces taiko takeoff program designed support new blockchain project marketing funding tech support fostering thriving,0.6597,0.13636363636363635,0.39803181818181815
GoogleNews,blockchain,2 hours ago,2025-02-04 12:19:06.748666,top blockchain stock keep eye january 31storacle riot platform applied digital three blockchain stock watch today according marketbeats stock screener tool,-0.4215,0.25,-0.08574999999999999
GoogleNews,blockchain,2 hours ago,2025-02-04 12:19:06.748666,aptos blockchain feature archivesin everevolving world cryptocurrencies staying ahead curve crucial step february 2025 three altcoins making significant,0.2023,0.1875,0.19490000000000002
GoogleNews,blockchain,2 hours ago,2025-02-04 12:19:06.748666,largest publicly traded blockchain companiesthere total 46 noteworthy publicly traded blockchain company expectedly blockchain company listed nasdaq 24 total,0.0,-0.02,-0.01
GoogleNews,blockchain,3 hours ago,2025-02-04 12:19:06.748666,rowan energy decentralized renewable energy blockchain innovationlondon gb access newswire february 4 2025 era sustainability technological advancement paramount rowan energy emerges,0.6486,0.0,0.3243
GoogleNews,blockchain,3 hours ago,2025-02-04 12:19:06.748666,aptos remarkable achievement january 2025 game changer blockchain spaceaptos top ecosystem blockchain arena received burst propulsion head 2025 achieving series noteworthy milestone,0.6597,0.2833333333333333,0.47151666666666664
GoogleNews,blockchain,3 hours ago,2025-02-04 12:19:06.748666,polkadotpowered prediction market blockchain launch bridging gap trust truthlondon united kingdom february 4th 2025 chainwire truth network launched decentralized verification network operating appchain,0.836,0.0,0.418
GoogleNews,blockchain,4 hours ago,2025-02-04 12:19:06.748666,blockchainpowered private market solution launch europejp morgan alumnus milo guastamacchia launched private market solution market heat europe yooro us blockchain technology,0.6249,0.0,0.31245
GoogleNews,blockchain,0 minutes ago,2025-02-04 12:19:06.748666,fantoms transition sonic reshapes blockchain landscapethe blockchain world never sits still fantoms transition sonic proof major upgrade speed efficiency incentive,0.6444,0.0625,0.35345
GoogleNews,blockchain,6 minutes ago,2025-02-04 12:19:06.748666,beyond traditional po tan bpos changing blockchain consensusblockchain consensus mechanism evolved significantly year still face inefficiency fairness decentralization longterm,-0.5574,0.1875,-0.18495
GoogleNews,blockchain,1 hour ago,2025-02-04 12:19:06.748666,taiko takeoff initiative set propel blockchain projectstaiko introduces taiko takeoff program designed support new blockchain project marketing funding tech support fostering thriving,0.6597,0.13636363636363635,0.39803181818181815
GoogleNews,blockchain,2 hours ago,2025-02-04 12:19:06.748666,top blockchain stock keep eye january 31storacle riot platform applied digital three blockchain stock watch today according marketbeats stock screener tool,-0.4215,0.25,-0.08574999999999999
GoogleNews,blockchain,2 hours ago,2025-02-04 12:19:06.748666,aptos blockchain feature archivesin everevolving world cryptocurrencies staying ahead curve crucial step february 2025 three altcoins making significant,0.2023,0.1875,0.19490000000000002
GoogleNews,blockchain,2 hours ago,2025-02-04 12:19:06.748666,largest publicly traded blockchain companiesthere total 46 noteworthy publicly traded blockchain company expectedly blockchain company listed nasdaq 24 total,0.0,-0.02,-0.01
GoogleNews,blockchain,3 hours ago,2025-02-04 12:19:06.748666,rowan energy decentralized renewable energy blockchain innovationlondon gb access newswire february 4 2025 era sustainability technological advancement paramount rowan energy emerges,0.6486,0.0,0.3243
GoogleNews,blockchain,3 hours ago,2025-02-04 12:19:06.748666,aptos remarkable achievement january 2025 game changer blockchain spaceaptos top ecosystem blockchain arena received burst propulsion head 2025 achieving series noteworthy milestone,0.6597,0.2833333333333333,0.47151666666666664
GoogleNews,blockchain,3 hours ago,2025-02-04 12:19:06.748666,polkadotpowered prediction market blockchain launch bridging gap trust truthlondon united kingdom february 4th 2025 chainwire truth network launched decentralized verification network operating appchain,0.836,0.0,0.418
GoogleNews,blockchain,4 hours ago,2025-02-04 12:19:06.748666,blockchainpowered private market solution launch europejp morgan alumnus milo guastamacchia launched private market solution market heat europe yooro us blockchain technology,0.6249,0.0,0.31245
GoogleNews,blockchain,0 minutes ago,2025-02-04 12:19:06.748666,fantoms transition sonic reshapes blockchain landscapethe blockchain world never sits still fantoms transition sonic proof major upgrade speed efficiency incentive,0.6444,0.0625,0.35345
GoogleNews,blockchain,6 minutes ago,2025-02-04 12:19:06.748666,beyond traditional po tan bpos changing blockchain consensusblockchain consensus mechanism evolved significantly year still face inefficiency fairness decentralization longterm,-0.5574,0.1875,-0.18495
GoogleNews,blockchain,1 hour ago,2025-02-04 12:19:06.748666,taiko takeoff initiative set propel blockchain projectstaiko introduces taiko takeoff program designed support new blockchain project marketing funding tech support fostering thriving,0.6597,0.13636363636363635,0.39803181818181815
GoogleNews,blockchain,2 hours ago,2025-02-04 12:19:06.748666,top blockchain stock keep eye january 31storacle riot platform applied digital three blockchain stock watch today according marketbeats stock screener tool,-0.4215,0.25,-0.08574999999999999
GoogleNews,blockchain,2 hours ago,2025-02-04 12:19:06.748666,aptos blockchain feature archivesin everevolving world cryptocurrencies staying ahead curve crucial step february 2025 three altcoins making significant,0.2023,0.1875,0.19490000000000002
GoogleNews,blockchain,2 hours ago,2025-02-04 12:19:06.748666,largest publicly traded blockchain companiesthere total 46 noteworthy publicly traded blockchain company expectedly blockchain company listed nasdaq 24 total,0.0,-0.02,-0.01
GoogleNews,blockchain,3 hours ago,2025-02-04 12:19:06.748666,rowan energy decentralized renewable energy blockchain innovationlondon gb access newswire february 4 2025 era sustainability technological advancement paramount rowan energy emerges,0.6486,0.0,0.3243
GoogleNews,blockchain,3 hours ago,2025-02-04 12:19:06.748666,aptos remarkable achievement january 2025 game changer blockchain spaceaptos top ecosystem blockchain arena received burst propulsion head 2025 achieving series noteworthy milestone,0.6597,0.2833333333333333,0.47151666666666664
GoogleNews,blockchain,3 hours ago,2025-02-04 12:19:06.748666,polkadotpowered prediction market blockchain launch bridging gap trust truthlondon united kingdom february 4th 2025 chainwire truth network launched decentralized verification network operating appchain,0.836,0.0,0.418
GoogleNews,blockchain,4 hours ago,2025-02-04 12:19:06.748666,blockchainpowered private market solution launch europejp morgan alumnus milo guastamacchia launched private market solution market heat europe yooro us blockchain technology,0.6249,0.0,0.31245
GoogleNews,blockchain,0 minutes ago,2025-02-04 12:19:06.748666,fantoms transition sonic reshapes blockchain landscapethe blockchain world never sits still fantoms transition sonic proof major upgrade speed efficiency incentive,0.6444,0.0625,0.35345
GoogleNews,blockchain,6 minutes ago,2025-02-04 12:19:06.748666,beyond traditional po tan bpos changing blockchain consensusblockchain consensus mechanism evolved significantly year still face inefficiency fairness decentralization longterm,-0.5574,0.1875,-0.18495
GoogleNews,blockchain,1 hour ago,2025-02-04 12:19:06.748666,taiko takeoff initiative set propel blockchain projectstaiko introduces taiko takeoff program designed support new blockchain project marketing funding tech support fostering thriving,0.6597,0.13636363636363635,0.39803181818181815
GoogleNews,blockchain,2 hours ago,2025-02-04 12:19:06.748666,top blockchain stock keep eye january 31storacle riot platform applied digital three blockchain stock watch today according marketbeats stock screener tool,-0.4215,0.25,-0.08574999999999999
GoogleNews,blockchain,2 hours ago,2025-02-04 12:19:06.748666,aptos blockchain feature archivesin everevolving world cryptocurrencies staying ahead curve crucial step february 2025 three altcoins making significant,0.2023,0.1875,0.19490000000000002
GoogleNews,blockchain,2 hours ago,2025-02-04 12:19:06.748666,largest publicly traded blockchain companiesthere total 46 noteworthy publicly traded blockchain company expectedly blockchain company listed nasdaq 24 total,0.0,-0.02,-0.01
GoogleNews,blockchain,3 hours ago,2025-02-04 12:19:06.748666,rowan energy decentralized renewable energy blockchain innovationlondon gb access newswire february 4 2025 era sustainability technological advancement paramount rowan energy emerges,0.6486,0.0,0.3243
GoogleNews,blockchain,3 hours ago,2025-02-04 12:19:06.748666,aptos remarkable achievement january 2025 game changer blockchain spaceaptos top ecosystem blockchain arena received burst propulsion head 2025 achieving series noteworthy milestone,0.6597,0.2833333333333333,0.47151666666666664
GoogleNews,blockchain,3 hours ago,2025-02-04 12:19:06.748666,polkadotpowered prediction market blockchain launch bridging gap trust truthlondon united kingdom february 4th 2025 chainwire truth network launched decentralized verification network operating appchain,0.836,0.0,0.418
GoogleNews,blockchain,4 hours ago,2025-02-04 12:19:06.748666,blockchainpowered private market solution launch europejp morgan alumnus milo guastamacchia launched private market solution market heat europe yooro us blockchain technology,0.6249,0.0,0.31245
GoogleNews,blockchain,5 hours ago,2025-02-04 12:19:06.748666,blockchain stock follow today february 02ndoracle riot platform applied digital core scientific globant five blockchain stock watch today according marketbeats stock,-0.5574,0.0,-0.2787
GoogleNews,blockchain,5 hours ago,2025-02-04 12:19:06.748666,blockchain water right new paradigmdiscover right management optimizes water resource scarcity supply value blockchain enhance efficiency,0.7717,0.2359307359307359,0.503815367965368
GoogleNews,blockchain,7 hours ago,2025-02-04 12:19:06.748666,blockchain revolutionizing sustainable energy supply chainsblockchain technology transforming sustainable energy supply chain beyond traditional finance smart grid powered blockchain enhance efficiency,0.8126,0.10714285714285714,0.45987142857142854
GoogleNews,blockchain,7 hours ago,2025-02-04 12:19:06.748666,blockchain interoperability future crosschain communicationblockchain technology actually older may seem blockchain platform based relatively young like phenomenon,0.3612,0.08888888888888889,0.22504444444444446
GoogleNews,blockchain,7 hours ago,2025-02-04 12:19:06.748666,ubs expands blockchain use digital gold trading zksyncubs test blockchain digital gold investment using zksync validium ensuring scalability privacy fast transactions7 hour ago,0.3612,0.06666666666666667,0.21393333333333334
GoogleNews,blockchain,7 hours ago,2025-02-04 12:19:06.748666,key influencer blockchain digital right managementpress release business research company key influencer blockchain digital right management market 2025 impact online gaming,0.0,0.09523809523809523,0.047619047619047616
GoogleNews,blockchain,8 hours ago,2025-02-04 12:19:06.748666,crypto revolution isnt money meet new blockchain ecosystemblockchain technology expanding beyond finance significantly impacting industry like sustainable energy supply chain,0.5574,0.2556818181818182,0.4065409090909091
GoogleNews,blockchain,8 hours ago,2025-02-04 12:19:06.748666,kdac expands blockchain validator role injectivekorea digital asset custody kdac joined injective injas validator enhancing security scalability blockchain ecosystem signaling,0.6486,0.0,0.3243
GoogleNews,blockchain,9 hours ago,2025-02-04 12:19:06.748666,spetz inc expands blockchain capability sonic strategy acquisitionspetz inc cse sptz otc dbksf announced execution definitive agreement sonic strategy inc february 2 2025 complete,0.5574,0.1,0.3287
GoogleNews,blockchain,9 hours ago,2025-02-04 12:19:06.748666,synthelix unmarshal ai partner transform blockchain data across 55 chainssynthelix partnered unmarshal ai unite aipowered decentralized physical infrastructure network unmarshals multichain data network,0.0,0.0,0.0
GoogleNews,blockchain,0 minutes ago,2025-02-04 12:19:06.748666,fantoms transition sonic reshapes blockchain landscapethe blockchain world never sits still fantoms transition sonic proof major upgrade speed efficiency incentive,0.6444,0.0625,0.35345
GoogleNews,blockchain,6 minutes ago,2025-02-04 12:19:06.748666,beyond traditional po tan bpos changing blockchain consensusblockchain consensus mechanism evolved significantly year still face inefficiency fairness decentralization longterm,-0.5574,0.1875,-0.18495
GoogleNews,blockchain,1 hour ago,2025-02-04 12:19:06.748666,taiko takeoff initiative set propel blockchain projectstaiko introduces taiko takeoff program designed support new blockchain project marketing funding tech support fostering thriving,0.6597,0.13636363636363635,0.39803181818181815
GoogleNews,blockchain,2 hours ago,2025-02-04 12:19:06.748666,top blockchain stock keep eye january 31storacle riot platform applied digital three blockchain stock watch today according marketbeats stock screener tool,-0.4215,0.25,-0.08574999999999999
GoogleNews,blockchain,2 hours ago,2025-02-04 12:19:06.748666,aptos blockchain feature archivesin everevolving world cryptocurrencies staying ahead curve crucial step february 2025 three altcoins making significant,0.2023,0.1875,0.19490000000000002
GoogleNews,blockchain,2 hours ago,2025-02-04 12:19:06.748666,largest publicly traded blockchain companiesthere total 46 noteworthy publicly traded blockchain company expectedly blockchain company listed nasdaq 24 total,0.0,-0.02,-0.01
GoogleNews,blockchain,3 hours ago,2025-02-04 12:19:06.748666,rowan energy decentralized renewable energy blockchain innovationlondon gb access newswire february 4 2025 era sustainability technological advancement paramount rowan energy emerges,0.6486,0.0,0.3243
GoogleNews,blockchain,3 hours ago,2025-02-04 12:19:06.748666,aptos remarkable achievement january 2025 game changer blockchain spaceaptos top ecosystem blockchain arena received burst propulsion head 2025 achieving series noteworthy milestone,0.6597,0.2833333333333333,0.47151666666666664
