MainSource,Source,Publication Date,Pull_date,Pre-Processed Text,Sentiment_Vader,Sentiment_TextBlob,Average_Sentiment
Reddit,ethereum,2024-09-29 13:08:58,2024-10-09 12:18:05.016333,using ᴇɪᴘ197 precompile risk forgery allowing degeneracy bilinear pairing using groth16 public input rework groth16 protocol order let verifier ditching pairing ecvk calling precompile gas saving measure non degeneracy criterion there bilinear pairing resulting finite field element 1 equivalent case optimal ate pairing happen one point pairing point infinity whatever point key result always 1 reason zcash prevent prover fully controlling proof input thus provide encoding point infinity ethereum prover often set without filter b c check ᴇɪᴘ197 point must curve implementation skip compultation bilinear paring containing point infinity long end result 1 f_q¹² contract call succeed even 1 3 point infinity 00 would happen would case happening implementation use ethereums ᴇɪᴘ197 precompile clear example forge proof there public input allowed 0 security risk public input used yes done,0.8519,0.008333333333333331,0.43011666666666665
Reddit,ethereum,2024-09-30 12:17:29,2024-10-09 12:18:05.016333,written sandi feel like hard fast rule matlock style lawyer rule court beating people court course beyond shameful even name plaintiff defense case major privacy related case acting imminent threat industry say side government case enemy industry said mass misinformation broker frontends ui ux tdlicannhnsens aml policy work issue expert area people understand extensive background regular tradfi commodity derivative suffering fool absolutely way one write instruction haskell interact smart contract sand beach reproduce live production successfully anywhere world machine connected internet tradfi work facilitation association advertising marketing business operator custodianship principle agent relation aws server api key intermediation layer order relayers broker etc possible ui ux stock bond derivative commodity interest rate forex centralized crypto exchange possible reproduce interaction smart contract based raw programming language written sand beach true smart contract defi fundamentally axiomatically possible tradfi radical legal implication highest level court globally god host smart contract sand fully schizo cracked mr prosecutor,0.7906,0.10152593618502709,0.44606296809251356
Reddit,ethereum,2024-09-29 07:19:20,2024-10-09 12:18:05.016333,devcon ticket ticketattractive memorize violet paltry relieved absurd escape station vase mindless post mass deleted anonymized redacthttpsredactdevhome,0.1027,-0.35,-0.12364999999999998
Reddit,ethereum,2024-09-28 22:09:35,2024-10-09 12:18:05.016333,best ethereum layer 2 privacywhich ethereum layer 2 solution best protect privacy one spending sending receiving ethereumbased token looked several layer 2 solution confused,0.9231,0.4,0.6615500000000001
Reddit,ethereum,2024-09-28 09:20:55,2024-10-09 12:18:05.016333,value proposition incentivizing mass end user adoption emergehello hodlr 6 year understand potential platform decentralization growing annoyed lack sort killer appuse casevalue proposition spur mass adoption without personally believe technology doesnt capability supplant existing centralized heavily entrenched web 20 platform service top mind always thinking credit card payment system forsee anythin built atop ethereum level 2 disrupting speed effortless convenience safety existing marketplace solution anyway im increasingly disenfranchised technology feel made useful would love hear thought ty,0.9022,0.09999999999999999,0.5011
Reddit,ethereum,2024-09-28 19:04:13,2024-10-09 12:18:05.016333,much agree hot walletif use hot wallet noncustodial opensource wallet pin 2fa stay cautious ad scam link feasible rely hot wallet mobile store 1k cryptocurrency safely,0.1531,0.29,0.22155
Reddit,ethereum,2024-09-28 14:29:29,2024-10-09 12:18:05.016333,possible check data type present functionbasically let say know function selector know data type present function validate whether data type actually correct mean data type arent correct check mean dont think would work encoding value based data type think present function simulating transaction dont spend money could work extent data type dont share similar encoding rule example function buywethwithusdcaddress uint256 uint256 address think data type present buywethwithusdcuint256 uint256 address address would parse value token contract expects address prarse address expects uint256 isnt issue parsed address represent number uint256 idea,0.6919,-0.06944444444444445,0.31122777777777777
Reddit,ethereum,2024-09-27 16:44:16,2024-10-09 12:18:05.016333,base blockchain coinbase showing explosive growth,0.3818,-0.8,-0.20910000000000004
Reddit,ethereum,2024-09-28 00:38:39,2024-10-09 12:18:05.016333,l2 equivalentfork liquitys interestfree lending protocolthe harsh redemption mechanism employ make liquity v1 almost unusable lately good l2 alternative ideally interestfree lending eth collateral interest sub 7,0.6743,0.4666666666666666,0.5704833333333333
Reddit,ethereum,2024-09-27 17:12:55,2024-10-09 12:18:05.016333,meet ethersnek cosmic snake ether hey everyone thinking explain ethereum blockchain kid hit there giant world snake hanging ether let introduce ethersnek slithers tube internet quietly eating data way thats fair trusted everyone here work ethersnek life digital ether every 14 second open mouth consumes blob datapeoples transaction smart contract anything important swallow never forgets locked belly forever ask snake hey eat dinner hell tell truth every time exactly way make everyone trust snake one trick alter he already eaten trust snake one make lie get eat data need pay little bit etherits like special snake food help keep ethersnek strong participating network hell reward ether like feeding snake getting back ssnek ssnack return ethersnek like old piggy bank used digital alive instead storing coin store data blob always trust data safe one steal change he constantly moving forward consuming data steady rhythm one stop slow magical snek know much money everyone smart contract stay honest trust built digital world feed grows secure ethereum becomes tldr ethereum like giant world snake ethersnek swallow data every 14 second never forgets trust snake one change eaten reward helping keep healthy,0.9928,0.17752463054187195,0.585162315270936
Reddit,ethereum,2024-09-27 05:44:20,2024-10-09 12:18:05.016333,desperate swap failing 24 hr contract function approve revertedive never problem using uniswap plenty time im using coinbase wallet connected ledger always error contract function approve reverted ive stuck 12 hour progress update per suggestion tried rabby worked flawlessly would still like figure problem cb wallet coinbase wallet pop click approve instant error nothing reach ledger wallet approval change ledger appears even receive request reject ledger connected everything work fine solana chain deleted ledger eth app reuploaded result afaik everything correct ledger open eth app open application ready setting blind sign enabled everything else disabled ledger live app closed app using ledger eth gas avail wallet uniswap connected coinbase wallet showing correct address correct existing balance swap window coin balance available swap ive deleted cooky closedopened tab cycled tab disconnectreconnect ledger cb wallet day pending transaction cant connect uni discord result tried sushiswap input reaching ledger even though plugged updated suggestion try absolutely maddening thanks,-0.3965,0.08235930735930734,-0.15707034632034633
Reddit,ethereum,2024-09-26 18:06:53,2024-10-09 12:18:05.016333,nonkyc exchange sell eth euroare exchange without kyc sell eth retrieve euro isnt low limit like 10k something like 100k every week edit since people think laundering money lol thats case dont want wait several week see holding worth euro bank account,0.689,0.275,0.482
Reddit,ethereum,2024-09-26 03:40:18,2024-10-09 12:18:05.016333,eth l2 token usageso bunch l2 l2 token understanding token basically goverance token arent used burning gas earning transaction fee etc short dont generate profit like aave example wrong protocol earn fee transactionsprotocol substainial respective l2 holder negligible,-0.5881,-0.16666666666666666,-0.3773833333333333
Reddit,ethereum,2024-09-26 23:28:00,2024-10-09 12:18:05.016333,ethereum trading reset dayim aware ethereum trade 24 7 cutoff percentage change reset east coast time preferably thanks,0.4404,0.225,0.3327
Reddit,ethereum,2024-09-24 17:55:24,2024-10-09 12:18:05.016333,whats latest news world ethim trying learn crypto please tell favorite thing eth thanks sharing knowledge,0.875,0.39999999999999997,0.6375
Reddit,ethereum,2024-09-25 06:59:21,2024-10-09 12:18:05.016333,best place add liquidity meme coin ethereumwhere best place add liquidity meme coin ethereum ecosystem,0.8555,1.0,0.9277500000000001
Reddit,ethereum,2024-09-25 02:54:23,2024-10-09 12:18:05.016333,profanity address eth name recoveryhi profanity generated address used year ago got hacked lost eth gave also lost private key since problem still eth name attached old address hacker didnt bother taking id like recover whats best way crack old profanity address reclaim eth name,-0.068,0.24000000000000005,0.08600000000000002
Reddit,ethereum,2024-09-25 11:54:10,2024-10-09 12:18:05.016333,create sustainable social token artistsdisclaimer following based understanding youtube chatgpt resource inaccuracy please feel free correct enlighten also used ai restructured question make readable english first language thank one friend fairly popular artistsinger instagram around 30k follower recently needed fund host concert didnt necessary resource brainstorming came idea id like input feasibility concept create token would create token friend name hold 50 token plan keep around 50 token prevent major pump dump scenario token purchase fan fan could buy token increasing value time monetize gradually token price rise sell swap token fund concert project provide value fan add stability real value would offer physical merchandise delivered fan hold token challenge 1 avoiding pump dump im concerned whale large investor manipulating token price prevent 2 promoting getrichquick want ensure isnt marketed way get rich longterm investment artist 3 legal concern security since people essentially investing artist could considered security potential legal implication social token research came across term social token seems fit concept however noticed arent popular stable question havent social token gained traction fundamental flaw concept improvement could modify recreate idea certain adjustment make viable detailed plan mind would love insight suggestion proceed particularly around challenge mentioned,0.9945,0.18907967032967032,0.5917898351648352
Reddit,ethereum,2024-09-25 05:42:46,2024-10-09 12:18:05.016333,web3 startup infrastructure dappshi friend startup founder advisor developer got 2 question please state experience 1 many rollups layer 2 development coming position wanting innovate focus building infrastructure decentralized application built top newly launched layer 2 2 rapid advancement technology stick want build im sure multiple idea going mind execute stay convicted one without thinking others,0.9118,0.32727272727272727,0.6195363636363637
Reddit,ethereum,2024-09-25 19:32:40,2024-10-09 12:18:05.016333,08152024 hacker transferred cryptocurrencies 70000 metamask account08152024 hacker withdrew metamask account hacker transferred cryptocurrencies 70000 hisher account balance cryptocurrencies 0 metamask contacted metamask support team metamask refers cryptoforensic investigator team email teamcryptoforensiccom metamask close case 09252024 dont receive email crypto forensic team get back crypto currency feel frustrated point invest crypto currency hacker came wiped account p metamask removed post rmetamask,-0.1779,-0.35,-0.26395
Reddit,ethereum,2024-09-24 15:50:18,2024-10-09 12:18:05.016333,practical implication finality time l2squite frequently crypto realise really dont understand probably basic issue thinking finality time rollups whether use case payment require near immediate confidence certainty problematic suppose one splitting trust l2 ethereum wonder degree trust necessary payment application expect see payment processor creating l2s theyre fully liable transaction proof submitted,0.8807,0.05000000000000001,0.46535000000000004
Reddit,ethereum,2024-09-24 13:34:33,2024-10-09 12:18:05.016333,crypto arbitrage dex even worki find lot token listed multiple decentralized exchange make lucrative money first one find price difference around 1 like literall always second even find token listed multiple exchange liquidity pool big problem one exchange pool 100 million exchange 5 million 1 difference isnt amount arbitrage result profit expense 200 transaction fee interest flash loan slippage make want know missing something didnt notice something dexscreener cant find token result good profit 50 per arbitrage opportunity exchange pool 100 million b 10 million price difference 1 transaction fee 150 interest fee 009 used 2021 today 100 time using aave atleast loan 41k make 3819 change interest fee current interest rate aave profit gone fast,0.9729,0.10555555555555556,0.5392277777777778
Reddit,ethereum,2024-09-24 13:21:37,2024-10-09 12:18:05.016333,rwai want hold gold tesla nvda co eth wallet,0.0772,0.0,0.0386
Reddit,ethereum,2024-09-24 21:36:11,2024-10-09 12:18:05.016333,jaredfromsubwayeth mev attacksso guy going get caught asking wreaking havoc eth mainnet imo,-0.5994,0.0,-0.2997
Reddit,ethereum,2024-09-23 18:46:42,2024-10-09 12:18:05.016333,question next upgradeso extremely plugged happening ethereum heard next upgrade people able pay gas fee token really true would significantly undermine value eth ethereum maintain value longer required gas fee token needed converted eth used,0.6478,0.18333333333333335,0.4155666666666667
Reddit,ethereum,2024-09-23 13:23:35,2024-10-09 12:18:05.016333,top web3 platform transforming philanthropy 2024,0.2023,0.5,0.35115
Reddit,ethereum,2024-09-22 18:03:10,2024-10-09 12:18:05.016333,query ethereum mainnet snapshot beginnerso thinking running light node learn eth blockchain work started geth also need beacon client reading realized light node way slow whereas full node huge system thinking way download historic snapshot eth mainnet use locally query explore data instead always staying connected chain dont wan na use third party api client plan totally hand starter want try basic stuff like token actively exchanged wallet many type token sent null address transaction frequency account balance gas price etc new used eth wallet interacted smart contract end user perspective want see stuff work backend helpadvice would greatly appreciated thanks,0.9706,0.1274891774891775,0.5490445887445887
Reddit,ethereum,2024-09-21 09:03:29,2024-10-09 12:18:05.016333,vitalik buterin documentary vitalik ethereum story available streaming,0.0,0.2,0.1
Reddit,ethereum,2024-09-22 17:53:57,2024-10-09 12:18:05.016333,one original holder founderslong story short back ethereum originally worked best friend dead cant ask told friend developer new crypto called ethereum clue friend could friend told let add email address phone number would original share forgot find dead friend actually something email andor phone number even thing could would really nice claim sonething like dont even know turned info anyone,0.9499,0.2237603305785124,0.5868301652892562
Reddit,ethereum,2024-09-21 14:42:03,2024-10-09 12:18:05.016333,vorbit ssf circular spiral finality validator selection distribution,0.0,0.0,0.0
Reddit,ethereum,2024-09-21 01:32:53,2024-10-09 12:18:05.016333,latest week ethereum news,0.0,0.5,0.25
Reddit,ethereum,2024-09-20 19:53:35,2024-10-09 12:18:05.016333,earth get geth working prysmim trying set ethereum node hobby life get geth begin syncing sits 0 claim beacon client yet oddly enough prysm running time say connects geth port 8551 problem increased verbosity geth see problem seems related repeatedly failing rlpx handshake peer although check adminpeerslength geth attach shell see ive got dozen peer however output ethsyncing show value idling 0 ive confirmed issue related jwt networkport forwarding related issue anyone else problem geth im ready throw towel switch besuteku setup damn hate walking away something like without understanding isnt working reference geth command geth syncmode snap http httpapi ethnetengineadmin authrpcport 8551 authrpcjwtsecret ethereumjwthex prysm command prysmsh beaconchain executionendpointhttplocalhost8551 jwtsecretethereumjwthex please let know anyone advice suggestion chatgpt lol idea,-0.6369,0.07500000000000001,-0.28095000000000003
Reddit,ethereum,2024-09-20 19:36:53,2024-10-09 12:18:05.016333,vitalik buterin political philosophy 21st century,0.0,0.0,0.0
Reddit,ethereum,2024-09-20 16:07:31,2024-10-09 12:18:05.016333,radically simple guide unlocking power linux web3 cartesiwhy wait dive endless building opportunity cartesi explore indepth blog post fully understand leveraging linux enhances overall developer innovation experience web3 key point superiority linux also highlighted think let discus httpscartesiiobloglinux_in_web3httpscartesiiobloglinux_in_web3,0.7783,-0.03125,0.373525
Reddit,ethereum,2024-09-20 17:10:15,2024-10-09 12:18:05.016333,ethereum film releasei got nft watch film supposed start noon east time httpsethereumfilmxyzstreaminghttpsethereumfilmxyzstreaming transaction success op network see explorer however refresh page dont see nft anywhere page refreshed show movie someone actually transaction able see movie success ui great transaction passed see confirmation almost look like 20 usd rug edit got work address httpsethereumfilmxyzhttpsethereumfilmxyz movie great far love fact available buy eth l1 l2,0.972,0.41111111111111115,0.6915555555555556
Reddit,ethereum,2024-09-20 09:21:03,2024-10-09 12:18:05.016333,self custodial app let business generate qr code usdc paymenti saw horrible user experience trump paying something bitcoin start think ethereum definitely better 2 second l2 15 second l1 cost 0002 l2 01 l1 furthermore trump use favorite currency usd form usdc know end goal make eth main currency business want receive usd converting amount eth convert back expected amount usd pointless like trump video showed great business want receive eth transaction fee would lower current reality business want receive usdc eth tried demonstrate much easier would pay usdc ethereum couldnt find self custodial wallet generates qr code address token usdc amount qr code address think good user experience would user need scan qr code click confirm doesnt need type anything kind app exist know centralized service like coinbase commerce binance pay cant find self custodial one think great adoption,0.9758,0.19444444444444448,0.5851222222222222
Reddit,ethereum,2024-09-20 07:30:02,2024-10-09 12:18:05.016333,need sepolia eth dissertationim working lending protocol bachelor dissertation due next week ive burned eth ive collected last week still test need run live environment im kinda stuck without could anyone send 12 eth finish writting thesis ill send picture graduate thanks address 0x7dea8e8f4f73a6bf7e1d5bd44002253cd3deb572,-0.1548,-0.048106060606060604,-0.1014530303030303
Reddit,ethereum,2024-09-19 20:38:15,2024-10-09 12:18:05.016333,research topic smart contract scami research work university detecting scam smart contract could tell already database contract definitely scam perhaps already solution personal question big problem 2017 2022 scam contract popular dont really follow topic maybe interesting anymore,0.0258,0.21607142857142855,0.12093571428571427
Reddit,ethereum,2024-09-19 15:26:25,2024-10-09 12:18:05.016333,transferring fee 1 exchange anotherhow much cost transfer 250 worth eth binance paypal crypto wallet using erc20 see people talking high fee transferring 1 exchange another,0.2263,0.22,0.22315000000000002
