MainSource,Source,Publication Date,Pull_date,Pre-Processed Text,Sentiment_Vader,Sentiment_TextBlob,Average_Sentiment
RSS,https://cointelegraph.com/rss,2025-02-22 11:21:12+00:00,2025-02-22 12:16:32.950082,lazarus group consolidates bybit fund phemex hacker wallet onchain evidence following 14 billion bybit hack linked north korea lazarus group phemex hack january according zachxbt,0.0,0.0,0.0
RSS,https://cointelegraph.com/rss,2025-02-22 10:35:00+00:00,2025-02-22 12:16:32.950082,bitcoin good investment retirement find potential advantage risk incorporating bitcoin retirement portfolio whether viable longterm investment option 2025,0.4215,0.35,0.38575
RSS,https://cointelegraph.com/rss,2025-02-22 10:03:41+00:00,2025-02-22 12:16:32.950082,ethereum eth price today ethereums price dropped following bybit hack growing eth hard fork rumor among reason,0.0772,-0.14583333333333334,-0.03431666666666667
RSS,https://cointelegraph.com/rss,2025-02-22 09:33:37+00:00,2025-02-22 12:16:32.950082,bybit exploit expose security flaw centralized crypto exchange 14 billion hack caused similar attack vector 230 million wazirx hack 58 million radiant capital hack according cyvers,0.1027,0.0,0.05135
RSS,https://cointelegraph.com/rss,2025-02-22 07:36:37+00:00,2025-02-22 12:16:32.950082,bybit process withdrawal system return normal pace ben zhou bybit ceo ben zhou said withdrawal returned normal pace major exploit drained 15 billion exchange,-0.5059,0.12083333333333333,-0.19253333333333333
RSS,https://cointelegraph.com/rss,2025-02-22 04:35:19+00:00,2025-02-22 12:16:32.950082,blockchain gaming market game musical chair gunzilla exec gunzilla game web3 director say biggest problem blockchain gaming lack new money coming system,-0.6124,-0.16590909090909092,-0.3891545454545455
RSS,https://cointelegraph.com/rss,2025-02-22 00:54:07+00:00,2025-02-22 12:16:32.950082,sec drop investigation nft marketplace opensea opensea founder devin finzer announced sec closing investigation nft platform calling win everyone industry,0.4019,0.20000000000000004,0.30095
RSS,https://cointelegraph.com/rss,2025-02-21 21:40:56+00:00,2025-02-22 12:16:32.950082,here happened crypto today need know happened crypto today latest news daily trend event impacting bitcoin price blockchain defi nfts web3 crypto regulation,0.0,0.25,0.125
RSS,https://cointelegraph.com/rss,2025-02-21 21:40:00+00:00,2025-02-22 12:16:32.950082,u crypto index etf slow start first day since listing newly launched fund holding bitcoin ether far seen scant interest investor,0.5423,0.04659090909090908,0.29444545454545457
RSS,https://cointelegraph.com/rss,2025-02-21 21:30:00+00:00,2025-02-22 12:16:32.950082,solana v ethereum tale two blockchains victor come crypto value determined price utility user based metric solana ethereum winning battle best blockchain,0.8689,0.75,0.80945
RSS,https://cointelegraph.com/rss,2025-02-21 21:30:00+00:00,2025-02-22 12:16:32.950082,crypto biz please buy one bitcoin hk asia purchased one bitcoin saw share price spike nearly 93 result,0.5423,0.1,0.32115
RSS,https://cointelegraph.com/rss,2025-02-21 21:20:00+00:00,2025-02-22 12:16:32.950082,trump tariff may lead saving american tax cut research prior 16th amendment ratified 1913 united state permanent income tax levied citizen,0.3182,0.0,0.1591
RSS,https://cointelegraph.com/rss,2025-02-21 21:10:00+00:00,2025-02-22 12:16:32.950082,biggest crypto hack history bybit exploit latest security blow industry bybit hack twice large secondlargest crypto exploit belongs ronin network,0.1531,0.35714285714285715,0.2551214285714286
RSS,https://cointelegraph.com/rss,2025-02-21 20:57:51+00:00,2025-02-22 12:16:32.950082,zachxbt identifies lazarus group behind bybit 14b hack win arkham bounty bybit exchange hacked 14 billion crypto community x reacted support security advice user,0.7351,0.2,0.46755
RSS,https://cointelegraph.com/rss,2025-02-21 20:30:00+00:00,2025-02-22 12:16:32.950082,bitcoin come back life data support rally 100k higher bitcoin price staged recovery week data show trader reducing appetite risk,0.1531,0.125,0.13905
RSS,https://cointelegraph.com/rss,2025-02-21 19:44:17+00:00,2025-02-22 12:16:32.950082,ethena assures user solvency bybit hack according ethena lab usde stablecoins exposure bybit via derivative offset reserve fund,0.3182,0.0,0.1591
RSS,https://cointelegraph.com/rss,2025-02-21 19:30:00+00:00,2025-02-22 12:16:32.950082,recent crypto liquidation scared youtubes retail audience ran neuner ran neuner founder crypto banter say recent crypto liquidation scared retail investor,-0.7003,0.0,-0.35015
RSS,https://cointelegraph.com/rss,2025-02-21 19:21:31+00:00,2025-02-22 12:16:32.950082,libra scandal exposed memecoin market rigged latest cointelegraph video unveils recent fiasco around libra shed light widespread fraud memecoin market,-0.9153,0.3,-0.30765
RSS,https://cointelegraph.com/rss,2025-02-21 19:18:18+00:00,2025-02-22 12:16:32.950082,argentina crypto adoption hope dim mileis libra memecoin scandal chance procrypto regulation argentina could crumble result president mileis libra memecoin scandal,-0.2263,0.1,-0.06315
RSS,https://cointelegraph.com/rss,2025-02-21 19:00:00+00:00,2025-02-22 12:16:32.950082,libra scandal continues manufactured bitcoin price action finance redefined argentina libra scandal continues unfold bitcoins twomonth crab walk raised price suppression concern among industry leader samson mow,-0.7003,0.1,-0.30015000000000003
RSS,https://cointelegraph.com/rss,2025-02-21 18:41:30+00:00,2025-02-22 12:16:32.950082,alt season begun cryptoquant ceo time season likely driven stablecoin holder rather rotation bitcoin said,0.0,0.0,0.0
RSS,https://cointelegraph.com/rss,2025-02-21 18:32:20+00:00,2025-02-22 12:16:32.950082,price analysis 221 btc eth xrp bnb sol doge ada link sui xlm bitcoin showing sign strength rallying within hair 100000 altcoins follow,0.4939,0.0,0.24695
RSS,https://cointelegraph.com/rss,2025-02-21 17:57:41+00:00,2025-02-22 12:16:32.950082,bybit confirms withdrawal active warns delay livestream bybits ceo stated 70 transaction successfully gone though user may experience delay due network congestion,0.25,0.1638888888888889,0.20694444444444443
RSS,https://cointelegraph.com/rss,2025-02-21 17:24:04+00:00,2025-02-22 12:16:32.950082,stripe paypal primary catalyst stablecoin growth polygon lab stablecoins ballooned 230billion industry equivalent 1 u money supply,0.3818,0.4,0.3909
RSS,https://cointelegraph.com/rss,2025-02-21 15:59:43+00:00,2025-02-22 12:16:32.950082,bybit exchange hacked 14 billion ethrelated token drained hacker took control eth cold wallet bybit exchange feb 21 stealing 14 billion fund process,-0.836,-0.6,-0.718
RSS,https://cointelegraph.com/rss,2025-02-21 15:39:11+00:00,2025-02-22 12:16:32.950082,bitcoin face 100k test bull trap 039bonafide039 btc price breakout bitcoin targeting six figure welcome break rangebound trading continues btc price bull,0.1779,0.8,0.48895
RSS,https://cointelegraph.com/rss,2025-02-21 15:38:41+00:00,2025-02-22 12:16:32.950082,sbf always played side aisle despite new republican plea bankmanfried hoping appeal case secure pardon president trump,0.836,0.2681818181818182,0.5520909090909091
RSS,https://cointelegraph.com/rss,2025-02-21 15:06:57+00:00,2025-02-22 12:16:32.950082,blackrock bitcoin etf surpasses 50 market share despite 3day selloff blackrocks bitcoin etf hold 50 market despite rising outflow bitcoins price remains resilient amid industry concern price action,0.296,0.1,0.198
RSS,https://cointelegraph.com/rss,2025-02-21 15:00:00+00:00,2025-02-22 12:16:32.950082,blockchain interoperability accelerate institutional success blockchain interoperability key unlocks institutional adoption success,0.8126,0.19999999999999998,0.5063
RSS,https://cointelegraph.com/rss,2025-02-21 14:53:34+00:00,2025-02-22 12:16:32.950082,kraken mull usd stablecoin mica force usdt removal report tether usdt remains top traded cryptocurrency kraken reportedly explores launching stablecoin delist usdt european economic area,0.2023,0.2333333333333333,0.21781666666666666
RSS,https://cointelegraph.com/rss,2019-06-18 13:04:00+01:00,2025-02-22 12:16:32.950082,twitter user claim tradingview ignored fibonacci retracement bug 5 year popular chart analysis service tradingview contains bug fibonacci retracement technical analysis tool,0.128,0.3,0.214
RSS,https://bitcoinmagazine.com/.rss/full/,2025-02-21 20:46:34+00:00,2025-02-22 12:16:32.950082,top 3 takeaway fidelity voltage recent lightning reportnostr user zapping storm ark show lightning network capability expanded upon,0.2023,0.25,0.22615000000000002
RSS,https://bitcoinmagazine.com/.rss/full/,2025-02-21 16:10:52+00:00,2025-02-22 12:16:32.950082,conference bitcoin afrique bitcoinonly revolution frenchspeaking africaconference bitcoin afrique aim empower frenchspeaking bitcoin community across africa,0.0,0.0,0.0
RSS,https://bitcoinmagazine.com/.rss/full/,2025-02-21 15:51:53+00:00,2025-02-22 12:16:32.950082,fpps free lunch bitcoin minersa comprehensive deep dive masked le obvious cost associated full fixed per sale fpps payouts affect miner profitability ability maximize return increasingly competitive industry,0.8555,0.16999999999999998,0.51275
RSS,https://bitcoinmagazine.com/.rss/full/,2025-02-20 15:00:00+00:00,2025-02-22 12:16:32.950082,next decade part 4 actual predictionsa republication series post shinobi january 2020 predicting course bitcoin 2020s,0.0,0.0,0.0
RSS,https://bitcoinmagazine.com/.rss/full/,2025-02-19 15:46:18+00:00,2025-02-22 12:16:32.950082,still dont like tether usdt bitcoin lightninghaving usdt bitcoin lightning creates potential threat bitcoins security stain soul bitcoin,-0.2523,0.0,-0.12615
RSS,https://bitcoinmagazine.com/.rss/full/,2025-02-19 15:00:00+00:00,2025-02-22 12:16:32.950082,next decade part 3 road blocksand road arounda republication series post shinobi january 2020 predicting course bitcoin 2020s,0.0,0.0,0.0
RSS,https://bitcoinmagazine.com/.rss/full/,2025-02-18 17:33:50+00:00,2025-02-22 12:16:32.950082,ambo ceo talk growth bitcoin lightning network tether usdt lightningcofounder ceo ambo jesse shrader belief broader adoption lightning network around corner usdt lightning game changer,0.3818,-0.4,-0.009100000000000025
RSS,https://bitcoinmagazine.com/.rss/full/,2025-02-18 15:00:00+00:00,2025-02-22 12:16:32.950082,next decade part 2 road aheada republication series post shinobi january 2020 predicting course bitcoin 2020s,0.0,0.0,0.0
RSS,https://bitcoinmagazine.com/.rss/full/,2025-02-18 13:59:20+00:00,2025-02-22 12:16:32.950082,mastering bitcoin onchain data gain deeper insight market cycle mastering bitcoin onchain data illuminates intricate pattern behind investor behavior price movement,0.6124,-0.4,0.10620000000000002
RSS,https://bitcoinmagazine.com/.rss/full/,2025-02-17 17:13:07+00:00,2025-02-22 12:16:32.950082,next decade part 1 road behinda republication series post shinobi january 2020 predicting course bitcoin 2020s,0.0,0.0,0.0
RSS,https://bitcoinmagazine.com/.rss/full/,2025-02-14 03:00:00+00:00,2025-02-22 12:16:32.950082,bitvm got massive upgradethe bitlayer finality bridge delivering promise bitvm still far fully trustless system progress made past year remarkable,0.6565,0.15,0.40325
RSS,https://bitcoinmagazine.com/.rss/full/,2025-02-12 20:29:27+00:00,2025-02-22 12:16:32.950082,bitcoin bank build ourselvesbitcoiners shouldnt sit around wait fiat bank financial company offer service built bitcoin,0.0,0.0,0.0
RSS,https://bitcoinmagazine.com/.rss/full/,2025-02-12 16:39:01+00:00,2025-02-22 12:16:32.950082,galoy launch bitcoinbacked loan software set groundwork opensource bankinggaloy founder ceo nicolas burtey want help borrower use bitcoin collateral loan introducing opensource software traditional banking stack,0.4588,0.0,0.2294
RSS,https://bitcoinmagazine.com/.rss/full/,2025-02-11 22:37:53+00:00,2025-02-22 12:16:32.950082,future bitcoin scaling institutional adoption strategic reserve rich rinesas bitcoin continues dominate financial landscape rich rines core dao explores evolutiondelving institutional adoption defi expansion potential global reserve asset,0.8481,0.125,0.48655
RSS,https://bitcoinmagazine.com/.rss/full/,2025-02-11 18:21:31+00:00,2025-02-22 12:16:32.950082,szabos micropayments mental transaction cost 25 year latera look reality ux friction widespread micropayments would create potential solution problem,0.1779,-0.05,0.06395
RSS,https://bitcoinmagazine.com/.rss/full/,2025-02-11 17:00:37+00:00,2025-02-22 12:16:32.950082,fold launch bitcoin reward credit cardfolds bitcoin reward credit card latest addition company suite bitcoinfocused financial product,0.9118,0.25,0.5809
RSS,https://bitcoinmagazine.com/.rss/full/,2025-02-10 11:00:03+00:00,2025-02-22 12:16:32.950082,proton wallet available everyone great starter selfcustodial bitcoin walletproton wallet wellsuited anyone looking begin bitcoin self custody journey andor anyone looking make semifrequent payment onchain managing relatively small bitcoin stack,0.6249,0.3166666666666667,0.47078333333333333
RSS,https://bitcoinmagazine.com/.rss/full/,2025-02-07 21:33:45+00:00,2025-02-22 12:16:32.950082,el salvador still bitcoin countrybitcoin may longer legal tender el salvador bitcoiners country havent given mission,0.128,0.2,0.164
RSS,https://bitcoinmagazine.com/.rss/full/,2025-02-07 13:57:13+00:00,2025-02-22 12:16:32.950082,introducing bitcoin everything indicatora single metric rule bitcoin everything indicator combine multiple key metric one comprehensive tool better investment decision,0.5994,0.10714285714285715,0.35327142857142857
RSS,https://bitcoinmagazine.com/.rss/full/,2025-02-06 20:03:42+00:00,2025-02-22 12:16:32.950082,here secret investing bitcoindont use leverage dont overexpose,0.0,-0.4,-0.2
RSS,https://bitcoinmagazine.com/.rss/full/,2025-02-06 18:04:44+00:00,2025-02-22 12:16:32.950082,lightning company raising good bitcoin tether usdt bitcoin made headline last week lightning ecosystem blossoming,0.4404,0.35,0.3952
RSS,https://bitcoinmagazine.com/.rss/full/,2025-02-06 17:50:20+00:00,2025-02-22 12:16:32.950082,nostr importance censorshipresistant communication innovation human progress open communication central part fostering innovation threatened modern digital age,0.7579,0.04,0.39895
RSS,https://bitcoinmagazine.com/.rss/full/,2025-02-06 15:00:00+00:00,2025-02-22 12:16:32.950082,bitcoin payment arent future theyre alreadytake look breez 1a1zs latest report deep diving current state bitcoins use transactional payment mechanism,0.0772,0.125,0.1011
RSS,https://bitcoinmagazine.com/.rss/full/,2025-02-06 14:09:30+00:00,2025-02-22 12:16:32.950082,bitcoins core remains unbreakablewhy surviving hostility doesnt mean court itand proactive engagement secures better future,0.8271,0.0625,0.4448
RSS,https://bitcoinmagazine.com/.rss/full/,2025-02-05 18:40:49+00:00,2025-02-22 12:16:32.950082,didnt take orange pill threw outthe government hasnt orange pilled theyve simply shown new way pull revolving door grifts,0.0,0.06818181818181818,0.03409090909090909
RSS,https://bitcoinmagazine.com/.rss/full/,2025-02-05 17:22:53+00:00,2025-02-22 12:16:32.950082,blackrock launch spot bitcoin etp europethe world largest asset manager set expand bitcoin footprint internationally new exchangetraded product switzerland,0.5859,0.13636363636363635,0.36113181818181816
RSS,https://bitcoinmagazine.com/.rss/full/,2025-02-05 17:11:55+00:00,2025-02-22 12:16:32.950082,bringin make bitcoin easier spend europe bringin founder ceo prashanth chandrashekar created product make easier european live bitcoin standard onboard bitcoin,0.765,0.04545454545454545,0.4052272727272727
RSS,https://bitcoinmagazine.com/.rss/full/,2025-02-04 23:39:46+00:00,2025-02-22 12:16:32.950082,president trump crypto czar host us first press conference bitcoin digital assetsdavid sack several procrypto politician discus future bitcoin crypto industry united state firstever u press conference digital asset,0.6486,0.05,0.3493
RSS,https://bitcoinmagazine.com/.rss/full/,2025-02-04 21:16:01+00:00,2025-02-22 12:16:32.950082,smart investor buy bitcoin real estatebitcoins finite supply unmatched liquidity deflationary model make ultimate asset modern investor learn forwardthinking investor decided buy bitcoin real estate inflationary world,0.5994,0.16285714285714287,0.3811285714285715
RSS,https://bitcoinmagazine.com/.rss/full/,2025-02-03 20:32:42+00:00,2025-02-22 12:16:32.950082,cowboy reservationthe logical soundness argument ossification bitcoin getting point pure absurdity,-0.3612,0.23214285714285715,-0.06452857142857144
RSS,https://bitcoinmagazine.com/.rss/full/,2025-02-03 20:18:03+00:00,2025-02-22 12:16:32.950082,bitcoin price already peakedbitcoin recently faced 10 retracement leading concern whether bull market article explores onchain metric institutional confidence macroeconomic factor determine whether bitcoin still room growth cycle peak reached,0.743,0.0,0.3715
RSS,https://bitcoinmagazine.com/.rss/full/,2025-02-03 19:45:40+00:00,2025-02-22 12:16:32.950082,buying holding bitcoin best strategy navigate trump tariff warbitcoin safest asset today,0.8555,1.0,0.9277500000000001
RSS,https://bitcoinmagazine.com/.rss/full/,2025-02-03 17:28:13+00:00,2025-02-22 12:16:32.950082,power play bitcoins institutionalization reshaping futureare new institutional player influenced bitcoin one influencing,0.34,0.13636363636363635,0.2381818181818182
RSS,https://bitcoinmagazine.com/.rss/full/,2025-01-31 20:07:04+00:00,2025-02-22 12:16:32.950082,bitcoin benjamin franklinsaving new generation riding wave folly,0.0,0.13636363636363635,0.06818181818181818
RSS,https://bitcoinmagazine.com/.rss/full/,2025-01-31 13:45:44+00:00,2025-02-22 12:16:32.950082,bitcoin bridgeas pleb fiat job important role play,0.4939,0.4,0.44695
RSS,https://bitcoinmagazine.com/.rss/full/,2025-01-31 13:26:54+00:00,2025-02-22 12:16:32.950082,take profit bitcoin cycle peaksselling bitcoin doesnt emotional decisionlearn use key market indicator take profit strategically reaccumulate lower price,0.4864,0.0,0.2432
RSS,https://bitcoinmagazine.com/.rss/full/,2025-01-31 10:15:01+00:00,2025-02-22 12:16:32.950082,forget ecb czechia embrace bitcoin termsthe czech national bank considering adding bitcoin reserve regardless european central bank think,0.1027,0.0,0.05135
RSS,https://bitcoinmagazine.com/.rss/full/,2025-01-30 21:42:05+00:00,2025-02-22 12:16:32.950082,tether back bitcoin lightning dominance startingthe stablecoin issuer choice bring usdt back bitcoin massive win lightning network joltzs bet taproot asset,0.7964,0.2,0.4982
RSS,https://bitcoinmagazine.com/.rss/full/,2025-01-30 17:24:24+00:00,2025-02-22 12:16:32.950082,trump executive order break bitcoins fouryear market cycle trump recent executive order may signal end bitcoins historically rigid fouryear market cycle regulatory clarity institutional adoption governmentbacked initiative could policy shift usher new era sustained growtheliminating dreaded crypto winter,-0.3612,0.04545454545454545,-0.15787272727272728
RSS,https://bitcoinmagazine.com/.rss/full/,2025-01-30 17:01:53+00:00,2025-02-22 12:16:32.950082,bitcoin empowers womenbitcoin tool woman around world closed traditional financial system,0.0,-0.03333333333333333,-0.016666666666666666
RSS,https://bitcoinmagazine.com/.rss/full/,2025-01-30 16:18:30+00:00,2025-02-22 12:16:32.950082,czech national bank ass bitcoin part reserve strategythe cnb approves plan explore allocating portion 140 billion reserve bitcoin,-0.2023,0.0,-0.10115
RSS,https://bitcoinmagazine.com/.rss/full/,2025-01-30 15:06:39+00:00,2025-02-22 12:16:32.950082,grayscale investment launch bitcoin miner etfgrayscale investment launched grayscale bitcoin miner etf mnrs offering investor way gain exposure bitcoin mining industry without directly holding btc tracking indxx bitcoin miner index etf includes major player like mara riot core scientific making attractive option looking diversify bitcoinrelated equity,0.7165,0.32083333333333336,0.5186666666666667
RSS,https://bitcoinmagazine.com/.rss/full/,2025-01-30 14:09:36+00:00,2025-02-22 12:16:32.950082,bitcoin cypherpunk spirit alive well africafrom south africa kenya ghana african using bitcoin better life arent asking anyones permission,0.8074,0.19999999999999998,0.5037
RSS,https://bitcoinmagazine.com/.rss/full/,2025-01-29 18:56:28+00:00,2025-02-22 12:16:32.950082,bitcoin ultimate hedge 97t global liquidity bubblediscover bitcoins fixed supply deflationary nature make ultimate asset navigating 97 trillion global liquidity bubble learn rising money supply influence market trend position bitcoin strategic hedge fiat currency debasement,0.3612,0.02,0.19060000000000002
RSS,https://bitcoinmagazine.com/.rss/full/,2025-01-29 18:10:45+00:00,2025-02-22 12:16:32.950082,bitcoin went wrongthe priority bitcoiners starting shift wrong direction represent actual existential threat success censorship resistant resilient system,-0.4215,-0.05,-0.23575
RSS,https://bitcoinmagazine.com/.rss/full/,2025-01-29 17:38:06+00:00,2025-02-22 12:16:32.950082,forget strategic bitcoin reserve moment mining censorship backf2pool mining pool representing 11 hash power bitcoin network censoring ofacsanctioned transaction,-0.2263,0.0,-0.11315
RSS,https://bitcoinmagazine.com/.rss/full/,2025-01-29 17:29:12+00:00,2025-02-22 12:16:32.950082,cme group launch option bitcoin friday future februarycme group looking obtain regulatory approval option successful cryptocurrency product launch,0.7845,0.375,0.57975
RSS,https://bitcoinmagazine.com/.rss/full/,2025-01-29 16:10:50+00:00,2025-02-22 12:16:32.950082,czech central bank head want buy bitcoin 5 reserve allocationthe czech national bank cnb considering 5 bitcoin allocation surpassing gold reserve approved move could reshape future national reserve asset,0.6808,0.0,0.3404
RSS,https://bitcoinmagazine.com/.rss/full/,2025-01-28 19:29:07+00:00,2025-02-22 12:16:32.950082,200000 realistic bitcoin price target cycleexplore potential bitcoin price reach 200000 cycle analyze market dynamic supply demand money multiplier effect ass feasibility,-0.3182,0.05555555555555555,-0.13132222222222223
RSS,https://bitcoinmagazine.com/.rss/full/,2025-01-28 19:24:46+00:00,2025-02-22 12:16:32.950082,go reserve people wont see differencearguing bitcoin reserve fund inclusion cryptocurrencies ultimately futile fight public large doesnt see difference,-0.6705,0.07142857142857142,-0.2995357142857143
RSS,https://bitcoinist.com/feed/,2025-02-22 12:10:12+00:00,2025-02-22 12:16:32.950082,15b bybit hack protect asset best wallet tokenin significant security breach bybit one leading cryptocurrency exchange found center devastating hack attacker made staggering 15b worth eth sending shockwaves throughout crypto space crypto continues gain popularity incident like remind u importance safeguarding,0.9517,0.11499999999999999,0.53335
RSS,https://bitcoinist.com/feed/,2025-02-22 12:00:00+00:00,2025-02-22 12:16:32.950082,trump appoints bitcoin proponent new fbi chief detailsunited state president donald trump latest appointment close ally officially confirmed new fbi director confirmation kash patel come significant controversy past criticism agency also personal investment bitcoin cryptocurrencyrelated stock related reading trump push doge redistribution20 back,-0.2732,0.1441919191919192,-0.0645040404040404
RSS,https://bitcoinist.com/feed/,2025-02-22 11:00:31+00:00,2025-02-22 12:16:32.950082,dogecoin price enters boring phase cycle bad newsthe dogecoin price currently analyst described boring phase term may suggest stagnation historical trend indicate necessarily bad news potential precursor explosive price rally history repeat doge could see price skyrocketing past 1 threshold new boring,-0.9169,-0.45136363636363636,-0.6841318181818182
RSS,https://bitcoinist.com/feed/,2025-02-22 09:30:30+00:00,2025-02-22 12:16:32.950082,utah bitcoin reserve bill pass senate one vote leftthe race establish bitcoin statelevel strategic reserve asset taken decisive step forward beehive state february 20 house bill 230 hb230 also known blockchain digital innovation amendment passed senate revenue taxation committee 421 vote legislation already cleared state,0.7506,0.0,0.3753
RSS,https://bitcoinist.com/feed/,2025-02-22 06:30:33+00:00,2025-02-22 12:16:32.950082,dogecoin bollinger band tell bullish story here level watchdogecoins price action bollinger band indicator show junction either breakout upside another downward move technical analysis show dogecoins interaction bollinger band suggests could go swift upwards move however remains critical risk factor bull,-0.3818,0.03333333333333333,-0.17423333333333332
RSS,https://bitcoinist.com/feed/,2025-02-22 05:30:43+00:00,2025-02-22 12:16:32.950082,grayscales ethereum etf brink major change nyse staking proposalthe new york stock exchange nyse submitted proposed rule change aimed allowing grayscale ethereum trust ethe grayscale ethereum mini trust ezet stake eth holding proposal particularly noteworthy seek enable trust earn reward staked eth ensuring,0.9403,0.12184343434343432,0.5310717171717172
RSS,https://bitcoinist.com/feed/,2025-02-22 05:00:50+00:00,2025-02-22 12:16:32.950082,bitcoin longterm holder cut back selling pressure amid market uncertainty major move loomingsince general crypto market entered volatile period bitcoin faced persistent heightened selling pressure investor trader past week causing btcs price drop sharply toward 93000 support level period bearish behavior optimism seems returned market evidenced reduction,-0.4215,-0.05249999999999999,-0.237
