MainSource,Source,Publication Date,Pull_date,Pre-Processed Text,Sentiment_Vader,Sentiment_TextBlob,Average_Sentiment
Reddit,solana,2024-11-07 20:40:37,2024-11-10 12:16:19.340080,colosseum codex state solana chainlink data stream superteam loungesource httpsblogcolosseumorgstateofsolanachainlinkstreamssuperteamloungehttpsblogcolosseumorgstateofsolanachainlinkstreamssuperteamlounge state solana q3 2024 global developer market share gmx chainlink data stream superteam member lounge timefun migrating solana arcium inpher httpspreviewreddit77nep5lbjjzd1pngwidth960formatpngautowebps21a9aa3415f74d64eea6081dfce93b65cf8a8b09 state solana q3 2024 q3 2024 solana solidified position leading blockchain platform advancement developer tool infrastructure report messari highlight key development shaped solana ecosystem period factor driving growth going forward key highlight include blink adoption since launch june dialect solana foundation 500 blink created blink convert solana action metadatarich url enabling immediate transaction preview wallet interactive button zk compression light protocol helius introduced zk compression scaling primitive live mainnet allows efficient storage cheaper operation token account nfts airship helius leveraging zk compression airship provides efficient way perform mass airdrop practical tool integrated project enhance user distribution strategy embedded wallet phantom launched embedded wallet enabling user create wallet using email google apple account privy also added support solana development reduce onboarding friction allowing reach broader audience le technical barrier agave client update v118 new transaction scheduler improves deterministic transaction ordering inclusion transaction higher priority fee likely included block providing predictable behavior crucial application relying transaction prioritization new mobile platform unveiling seeker phone formerly solana mobile chapter 2 jambophone2 provides new hardware platform integrated hardware wallet solana support device encourage development mobilefirst dapps offering new avenue reach user client development firedancer live mainnet nonvoting mode frankendancer also live team like jito syndica mithril tinydancer making stride client diversity hackathons colosseum radar hackathon received 1359 project submission reflecting broad developer community participating event leveraging grant program provide funding support project state solana q3 2024httpsmessariioreportstateofsolanaq32024refblogcolosseumorg shifting global developer market share electric capital insight crypto development underscore shift web3 space u remains leading country term developer count holding 188 crypto developer facing increasing competition nation particularly india 118 uk 42 notably 81 crypto developer reside outside u one notable trend us 51 decline crypto developer share since 2015 even industry surged 5 billion 24 trillion market much crypto world associated hub california new york 64 usbased crypto developer actually live outside region distribution represents opportunity crypto job creation across country finding based extensive analysis tracking 200 million cryptorelated git commits across 350000 repository geo data derived 110000 developer selfreported location global crypto developer datahttpsxcommariashenstatus1851702779946901968refblogcolosseumorg chainlink data stream gmxsolana upcoming expansion gmx v2 protocol solana blockchain announced adoption chainlink data stream official data oracle solution collaboration aim enhance performance security gmxsolana perps dex providing secure lowlatency market data essential execution price funding rate calculation liquidation critical feature gmxsolana utilize chainlinks highfrequency market data ensure accurate timely information trader developer leverage chainlink data streamshttpsdocschainlinkdatastreamsrefblogcolosseumorg highperformance defi application require immediate data update leveraging chainlink data stream solana developer access realtime lowlatency market data enabling build defi apps offer user enhanced speed security functionality gmxsolana adopts chainlink data stream official data oracle solution solanahttpsgmxiosubstackcompgmxsolanaadoptschainlinkdatarefblogcolosseumorg superteam member lounge superteam unveiled superteam member lounge new platform designed unite solana developer builder around world space aim leverage global network superteam member providing exclusive resource including introduction request introduction anyone solana ecosystem membersonly job board access exclusive job opportunity within community fundraising resource obtain support resource fundraising effort exclusive workshop participate specialized workshop live stream amas dedicated mobile app stay connected mobile app easy access superteam activity local group continue using discord telegram whatsapp channel member lounge serf additional space enhance collaboration country existing superteam member check inbox invitation nonmember apply grant superteam earnhttpsearnsuperteamfunrefblogcolosseumorg start contributing solana ecosystem introducing superteam member loungehttpsxcomsuperteamstatus1852284030537900442refblogcolosseumorg timefun migrating solana timefun platform tokenize creator time audience interaction announced migration base l2 solana last year ive seen solana completely dominate aspect growth product importantly culture ive seen solana leadership care nurturing culture ground eth ecosystem feel tiring part care tech holierthanthou mindset completely ignoring typical user degen culture important thing ecosystem security aside u0xkawz team feel stronger connection solanas community describe energetic supportive closely aligned demographic target user degenerate trader speculator everyday enthusiast solanas ecosystem also perceived unified le fragmentation clear effective roadmap provides confidence building scaling platform migration solanahttpsmediumcomtimedotfunourmigrationtosolanace6097d6a2cerefblogcolosseumorg arcium inpher arcium solanas confidential computing startup acquired web2 leader inpher known advanced encrypted data secure machine learning tech mean arcium offer decentralized network encrypted computation happen seamlessly perfect developer need build secure privacyfirst apps inphers tech integrated solana devs build project around private ai data sharing secure defi without needing master complex encryption arciums platform include python sdk ability run private machine learning distributed datasets arcium also announced plan opensource inpher patent arcium acquires core tech team inpher supercharging confidential computinghttpswwwarciumcomarticlesarciumacquirescoretechandteamfrominphersuperchargingconfidentialcomputingrefblogcolosseumorg quick hit access realtime solana data 3 tool comparedhttpsblogquicknodecomaccessrealtimesolanadata3toolscomparedrefblogcolosseumorg quicknode earning crypto guide start earning full part timehttpsblogsuperteamfunpearningincryptopublication_id358607post_id150746159isfreemailtruer2apdtriedredirecttruerefblogcolosseumorg superteam solana changelog october 30th recaphttpssolanacompasscomlearnchangelogsolanachangelogoctober30threfblogcolosseumorg compass web3 need empathy part 1httpsmirrorxyzdappadanethqhfq9lajr1zccache5dt2sg7smspy7k9agj4aebhc0qrefblogcolosseumorg dappadan introducing syndica cloud v2 rpc implementationhttpsblogsyndicaiointroducingsyndicacloudourv2reimplementation2refblogcolosseumorg syndica institutional investment solana blockchain dapps 54 q3httpscointelegraphcomnewsinstitutionalinvestmentssolanadapps54percentq3refblogcolosseumorg cointelegraph introducing worthy definitive solana credit rating protocolhttpsmediumcomtrustlessengineeringintroducingworthydbfbaff54046refblogcolosseumorg matt pfeifer registration solana super game jam openhttpsxcomsuperteamvnstatus1853437154619445443refblogcolosseumorg superteamvnhttpsxcomsuperteamvn solana auditor bootcamp 2024 recaphttpsxcomackeeblockchainstatus1852368478025707823refblogcolosseumorg ackeeblockchainhttpsxcomackeeblockchain lifi aggregation protocol expands solanahttpsdocslifilifiapisolanarefblogcolosseumorg lifi tool resource awesometridenttestshttpsgithubcomackeeblockchainawesometridenttestsrefblogcolosseumorg collection trident fuzzing test including link guide solana amm sdkhttpswwwnpmjscompackageconfirmedwtfsolanaammsdkrefblogcolosseumorg simple sdk market making solana allows anyone swap token dex spam maker generate volume 3 line code funding ellipsis lab known building phoenix dex raised 21 millionhttpswwwellipsislabsxyzblogpostsellipsislabsraises21mledbyhaunventuresrefblogcolosseumorg led haun venture additional backing electric capital anatoly yakovenko paradigm advance atlas verifiable finance blockchain fragmetric native liquid restaking protocol completed builder round financinghttpsblogfragmetricxyzfragmetricbuildersroundrefblogcolosseumorg attracting investment prominent figure solana ecosystem including solana founder anatoly yakovenko jito lab founder lucas bruder backpack founder tristan others get hired triton one hiring senior backend infrastructure developerhttpsxcomijobs1852369428903608617refblogcolosseumorg build developer tool highperformance blockchains sonic svm hiring lead bdhttpsxcomchrizhuustatus1853402579180626116refblogcolosseumorg role gaming solana growth community listen index future solana virtual machine episode index cofounder joanna zeng nazreen share journey traditional finance blockchain innovation joanna former wall street currency trader offer insight leading blockchain startup describing third childa testament dedication behind soons mission nazreen break op stack solana vm integration highlighting tool enhance multichain support transaction speed solana optimistic network soon decentralized platform aiming improve scalability security interoperability blockchain decentralized finance defi providing tool infrastructure build decoupled svm stack soon optimizes transaction efficiency web3 application discover soon achieved rapid growth bypassed traditional vc funding angel investor launched devnet six month conversation also cover commitment sustainable realworld solution partnership abk lab power next wave decentralized application episode packed insight vision strategy future web3 scaling web3 inside solana optimistic network soon joanna zeng nazreen mhttpswwwpodpagecomtheindexpodcastscalingweb3insidethesolanaoptimisticnetworksoonwithwithjoannazengnazreenmohammadrefblogcolosseumorg bonus episode intersection crypto ai andrej radonjichttpsblockworkscopodcastlightspeed3a7bd65e9b9c11ef96f4eb025dead220refblogcolosseumorg lightspeed andrej radonjic join lightspeed discus recent grass airdrop crypto help fix internet intersection ai crypto much web3 artist community leader w superteam germany feat bekka httpssolfatecompodcast66refblogcolosseumorg solfate bekka cofounder superteam germany share journey canada germany detailing transition art world web3 founding superteam germany support solana ecosystem emphasizes value inperson connection fostering collaboration discus unique focus different regional superteams share insight evolving nft space bridge founder 11b stripe acquisition zach abramshttpsblockworkscopodcastempire3ab5d8229b0b11efa966a3f84f94e3d8refblogcolosseumorg empire episode bridge founder zach abrams discus built billiondollar company 18 month acquired stripe conversation cover rapid growth launch usdc depeg becoming essential infrastructure government fintechs global company follow mikehalehttpstwittercommikehalerefblogcolosseumorg x warpcasthttpswarpcastcommikehalerefblogcolosseumorg thanks reading hope found something useful suggestion feedback let know think,0.9995,0.12480392156862744,0.5621519607843137
Reddit,solana,2024-11-07 23:19:22,2024-11-10 12:16:19.340080,bot make moneyhello could someone help understand bot making money know amount small somehow able milk liquidity dead coin 5,-0.3818,0.016666666666666663,-0.18256666666666665
Reddit,solana,2024-11-07 23:06:31,2024-11-10 12:16:19.340080,get token address anyone know get token address early solana sniping bot,0.0,0.1,0.05
Reddit,solana,2024-11-07 17:07:13,2024-11-10 12:16:19.340080,find account key new spl tokensi asked question solana stackexchange one answered httpssolanastackexchangecomquestions16771howtofinddistinguishbetweenpoolsandmarketsfornewlycreatedtokentransahttpssolanastackexchangecomquestions16771howtofinddistinguishbetweenpoolsandmarketsfornewlycreatedtokentransa anyone know get pool id market id new pool raydium parse creation signature located different position json using helius parse transaction call get consistent position helius take far long initialise retrieve key like const accountkeys instructionwithmanyaccountsaccounts consolelogpicked account key accountkeyslength 8 throw new errortransaction doesnt enough account key const tokenaccountaddress new publickeyaccountkeys10 const tokenaccountaddresswrappedsol new publickeyaccountkeys11 const tokenmarket new publickeyaccountkeys4,0.5574,0.07454545454545454,0.3159727272727273
Reddit,solana,2024-11-07 15:55:54,2024-11-10 12:16:19.340080,grayscale gain hurtingthe last two day really hurt lost nearly 60 anyone heard news,-0.4351,0.10000000000000002,-0.16754999999999998
Reddit,solana,2024-11-08 03:29:05,2024-11-10 12:16:19.340080,bot profitable small amount moneywhich trading bot profitable small budget like 10 30 solana ive tried using trojan bot solana return okay people say effective small budget im expecting large profit small budget im curious there bot solana could yield slightly better return small amount capital,0.959,0.04642857142857143,0.5027142857142857
Reddit,solana,2024-11-07 17:32:23,2024-11-10 12:16:19.340080,solana mainnet faucet working solana mainnet faucet dispense gas fee worth sol,0.2263,0.3,0.26315
Reddit,solana,2024-11-07 19:16:57,2024-11-10 12:16:19.340080,made pump fun botsa month ago encountered lot flaw tg bot using congestion failed transaction crowded launch executing transaction much higher price decided create sniper tool failed attempt managed create tool using everyday gambling session pump fun currently use newly launched token monitoring bot sniper willing share free look improve tool could use feedback monitoring bot filter newly launched token certain criterion dev initial buy sol bonding curve name token symbol also capability track developer wallet new launch use daily search trending hype word search token launched devs good job previous project use improvement new filter idea please tell sniper buy bot simple buy specified token certain slippage priority fee adjust slippagepriority fee order get succesful transaction worth mentioning bot fee 05 go api provider trying get many feedback possible decided share free interested pm share github also tool development currently working finish sniper bot automatic stop loss feature autosniper buy sell every token launched filter certain criterion token launcher bundle buying selling bump bot volume bot everything go well probably sell low amount already working want add extra feature thinking interested contact case decide try tool thank waiting feedback also developing bot need opinion question related feel free contact happy gambling everyone,0.9925,0.1491407582316673,0.5708203791158337
Reddit,solana,2024-11-06 11:58:06,2024-11-10 12:16:19.340080,sol surpassed bnb market cap making 4th largest cryptocurrency next,0.0,0.0,0.0
Reddit,solana,2024-11-06 19:44:07,2024-11-10 12:16:19.340080,trump back office whats next market guy planning dopeople say market tend repeat last time saw strong stock market crypto market lot bold move made well think trump inflation push market new high curious guy positioning,0.8519,0.12037878787878788,0.4861393939393939
Reddit,solana,2024-11-07 13:34:12,2024-11-10 12:16:19.340080,larix dead withdrawwhen open larix keep trying load dashboard nothing happens msol withdrew left withdraw later got website keep loading loading nothing phantom connects nothing happens solflare browser even find site larix dead possible withdraw cli,-0.8625,-0.06666666666666667,-0.46458333333333335
Reddit,solana,2024-11-07 08:45:37,2024-11-10 12:16:19.340080,withdraw luloit either tell isnt enough fee try withdraw le wont let either,0.0,0.0,0.0
Reddit,ethereum,2024-11-08 03:01:40,2024-11-10 12:16:19.340080,ethereum foundation report 2024 edition,0.0,0.0,0.0
Reddit,ethereum,2024-11-10 07:01:12,2024-11-10 12:16:19.340080,daily general discussion november 10 2024welcome today daily general discussion please use thread discus ethereum topic news event even price yes trying something new allow price discussion thread price discussion posted elsewhere subreddit continue removed always keep friendly follow sub rule ticker eth,0.8442,0.10189393939393938,0.4730469696969697
Reddit,ethereum,2024-11-10 09:32:37,2024-11-10 12:16:19.340080,converting beth wbeth eth binancehi converted eth beth binance loooong time ago forgot wanted see convert normal eth case want sell soon couldnt figure even click convert wbeth show anybody know situation,0.0772,0.15,0.1136
Reddit,ethereum,2024-11-10 00:33:27,2024-11-10 12:16:19.340080,decentralized sport betting year cheap transaction layer 2 decentralized sport betting kyc account creation like decentralized app exchange legal ramification prohibitive,0.6249,0.30000000000000004,0.46245
Reddit,ethereum,2024-11-09 21:56:38,2024-11-10 12:16:19.340080,reentrancy attack explained hacker exploit smart contract stay safehey ethereum community recently wrote case study reentrancy attacksone biggest vulnerability smart contract common cause major defi hack break attack work mean user like check learn stay safe,0.3182,0.05408163265306122,0.1861408163265306
Reddit,ethereum,2024-11-09 09:21:35,2024-11-10 12:16:19.340080,vitalik prediction market info finance,0.0,0.0,0.0
Reddit,ethereum,2024-11-09 07:01:29,2024-11-10 12:16:19.340080,daily general discussion november 09 2024welcome today daily general discussion please use thread discus ethereum topic news event even price yes trying something new allow price discussion thread price discussion posted elsewhere subreddit continue removed always keep friendly follow sub rule ticker eth,0.8442,0.10189393939393938,0.4730469696969697
Reddit,ethereum,2024-11-08 23:09:55,2024-11-10 12:16:19.340080,latest week ethereum news,0.0,0.5,0.25
Reddit,ethereum,2024-11-09 08:12:25,2024-11-10 12:16:19.340080,use l2 network swapping uniswapdextoolsi want save transaction fee dont quite get l2s thing work like want swap eth erc token use l2s instead mainnet high fee eth still exchange wan na know network use transferring l2 option see metamask linea,0.743,-0.020000000000000004,0.3615
Reddit,ethereum,2024-11-08 22:43:30,2024-11-10 12:16:19.340080,noncrypto trader questioni crypto trader friend though close acquaintance said wanted try could download trust wallet coinbase wallet send ethereum address coinbase wallet fund account trust wallet would use ethereum address synchronize account whatever trade made would make automatically whatever money wanted put say 500 buck instance sound extremely shady arent explaining would sync account methodprogram use etc however average online search say sending someone ethereum address generally safe dont see could use sole information theyre saying method initially saw harmless way glimpse trading crypto like im starting feel method phishingscamming im aware dont want anyone access personalfinancial information obvious reason someone could explain work layman term eli5 whether setup grift money andor personal info id appreciate theyre annoyed question part im skeptical seems like would reason hide theyre safe legitimate anyway let know im missing anything confirm gut say isnt real thing someone trying see found new mark,0.9458,0.03039772727272727,0.4880988636363636
Reddit,ethereum,2024-11-08 14:11:23,2024-11-10 12:16:19.340080,swap eth bitcoin kycwhat best way lowest cost way swap eth bitcoin nonkyc,0.3818,1.0,0.6909
Reddit,ethereum,2024-11-09 06:28:36,2024-11-10 12:16:19.340080,skip line 12000 ppl get wristband preregistration,0.0,0.0,0.0
Reddit,ethereum,2024-11-08 17:20:30,2024-11-10 12:16:19.340080,devcon road lead collaboration,0.0,0.0,0.0
Reddit,ethereum,2024-11-09 03:25:30,2024-11-10 12:16:19.340080,trying make withdrawswap network fee higher transaction httpspreviewredditfpjwjbx8oszd1jpgwidth1080formatpjpgautowebps3a3a94534420cb9afa31c8d744075775b504c399 wanted send 100 180 fee screen trying send 10 idea,0.0,0.25,0.125
Reddit,ethereum,2024-11-08 07:01:16,2024-11-10 12:16:19.340080,daily general discussion november 08 2024welcome today daily general discussion please use thread discus ethereum topic news event even price yes trying something new allow price discussion thread price discussion posted elsewhere subreddit continue removed always keep friendly follow sub rule ticker eth,0.8442,0.10189393939393938,0.4730469696969697
Reddit,ethereum,2024-11-08 15:15:38,2024-11-10 12:16:19.340080,etherscan support eip2535 diamond,0.6249,0.0,0.31245
Reddit,ethereum,2024-11-08 16:35:49,2024-11-10 12:16:19.340080,secret sharing snitching addressing shareholder collusion threshold cryptography,0.4215,-0.4,0.010749999999999982
Reddit,ethereum,2024-11-08 03:40:04,2024-11-10 12:16:19.340080,see devcon,0.0,0.0,0.0
Reddit,ethereum,2024-11-08 14:04:13,2024-11-10 12:16:19.340080,network need use send eth binance hello network need use send eth binance,0.0,0.0,0.0
Reddit,ethereum,2024-11-07 15:47:14,2024-11-10 12:16:19.340080,realized 2 validator effectiveness gap costing 01 eth per year math inside httpspreviewredditrjfk226r2izd1pngwidth1200formatpngautowebps87bd110d414df60e36f35f747241df88fa904fd3 tldr analyzed lido validator data found something crazy 994 v 975 effectiveness 01 eth difference per year 32 eth stake simple math reward actually compound multiple mechanism finally understand dvt validators consistently earn yo fellow eth stakers going rabbit hole analyzing validator data thats sunday night right found mindblowing stuff effectiveness really impact reward nerdy stuff first promise get interesting basic staking math max theoretical apy base rewardepoch epochsyear 32 attestation block proposal 4107 82125 32 05 42 here get spicy real reward affected attestation bread butter 95 reward block proposal juicy 5 sync committee reward mev cherry top looking actual data lido simpledvt validators dvt validators 994 effectiveness 406 apy average validators 9752 effectiveness 374 apy wait hear say thats 188 difference nope here real impact 32 eth 374 1197 ethyear 406 1299 ethyear difference 0102 eth big difference miss attestation 1 lose base reward 2 get slapped penalty 3 miss sync committee opportunity 4 network delay snowball interesting part data ssvpowered validators lido turn distributed validation isnt fancy tech actually putting eth people wallet anyone else tracking effectiveness number seeing drop stats,0.9384,0.024350649350649345,0.4813753246753247
Reddit,ethereum,2024-11-08 06:01:07,2024-11-10 12:16:19.340080,looking devcon ticketlooking ticket go official channel verify ticket sale scammer please dont dm waste time use preferred payment method,0.5621,-0.2,0.18105000000000002
Reddit,ethereum,2024-11-07 18:27:16,2024-11-10 12:16:19.340080,interesting side event devconi already booked event devcon luma calendar hundred entry hard decide,0.3182,0.10416666666666666,0.21118333333333333
Reddit,ethereum,2024-11-08 00:49:09,2024-11-10 12:16:19.340080,safe wallet recovery feature way notified recoverer start processhi set safe wallet recoverer according safe documentation safe mobile app android io cant notify recoverer start recovery process mean dont check regularly miss delay recoverer could technically take total control safe wallet im wondering way notified recovery process way thanks,0.9415,0.23875000000000002,0.590125
Reddit,ethereum,2024-11-07 08:21:39,2024-11-10 12:16:19.340080,mekong testnet announcement ethereum foundation blog,0.0,0.0,0.0
Reddit,ethereum,2024-11-07 07:01:06,2024-11-10 12:16:19.340080,daily general discussion november 07 2024welcome today daily general discussion please use thread discus ethereum topic news event even price yes trying something new allow price discussion thread price discussion posted elsewhere subreddit continue removed always keep friendly follow sub rule ticker eth,0.8442,0.10189393939393938,0.4730469696969697
Reddit,ethereum,2024-11-06 23:23:57,2024-11-10 12:16:19.340080,stake ethereumi recently checked coinbase account year ignoring ethereum soon logged back coinbase asked want stake ethereum smart move stake ethereum im looking make quick buck investment plan hold long term advise appreciate thank,0.6705,0.09952380952380951,0.3850119047619047
Reddit,ethereum,2024-11-07 10:07:11,2024-11-10 12:16:19.340080,mekong faucet devcon 2024 attendee,0.0,0.0,0.0
Reddit,ethereum,2024-11-07 03:09:54,2024-11-10 12:16:19.340080,aware scam ticket seller devconsea ticket,-0.5719,0.25,-0.16094999999999998
Reddit,ethereum,2024-11-06 18:50:32,2024-11-10 12:16:19.340080,transfer eth old accountsorry question isnt appropriate cant find info anywhere probably im quite sure phrase mined eth back 2018 2019 joined pool mined acct setup locally geth later switched nicehash transferred eth coinbase account still approx 18 eth havent done anything acct since well switch po fired geth couple day ago finally transfer eth realized course old geth couldnt connect network longer downloading new version give error failed register ethereum service ethash supported historical component already merged network ok dawned wont connecting block chain directly like previously since cant stake whats easiest way transfer eth still locally connect network submit transaction even without mining need use service assume total newb newb enough respond dm offering help,-0.186,0.07468805704099822,-0.05565597147950089
