MainSource,Source,Publication Date,Pull_date,Pre-Processed Text,Sentiment_Vader,Sentiment_TextBlob,Average_Sentiment
RSS,https://cointelegraph.com/rss,2024-12-08 11:47:05+00:00,2024-12-08 12:18:46.802946,el salvador bitcoin gain top 300m president el salvador unrealized gain 300 million bitcoin purchase came btc broke 100000 milestone price,0.7003,0.5,0.60015
RSS,https://cointelegraph.com/rss,2024-12-08 09:00:38+00:00,2024-12-08 12:18:46.802946,nfts start december 187m weekly sale volume pudgy penguin recorded 25 million sale cryptopunks weekly volume 165 million,0.0,0.0,0.0
RSS,https://cointelegraph.com/rss,2024-12-08 05:56:58+00:00,2024-12-08 12:18:46.802946,crypto industry fear vehemently anti crypto caroline crenshaw sec vote sec commissioner caroline crenshaw widely known opposing spot bitcoin etf renomination crypto industry fear reelection,-0.8271,-0.10000000000000002,-0.46354999999999996
RSS,https://cointelegraph.com/rss,2024-12-08 02:44:37+00:00,2024-12-08 12:18:46.802946,altcoin season 039leg ugly039 say venture capitalist crypto venture capitalist warns momentum tip market participant might caught guard murder wick chart,-0.7269,0.0,-0.36345
RSS,https://cointelegraph.com/rss,2024-12-07 22:57:45+00:00,2024-12-08 12:18:46.802946,btc hit 100k trump tap paul atkins sec chair hodlers digest dec 1 7 week bitcoin reached 100000 first time ever trump nominates procrypto paul atkins replace gary gensler hodlers digest,0.1027,0.075,0.08885
RSS,https://cointelegraph.com/rss,2024-12-07 22:13:49+00:00,2024-12-08 12:18:46.802946,here happened crypto today need know happened crypto today latest news daily trend event impacting bitcoin price blockchain defi nfts web3 crypto regulation,0.0,0.25,0.125
RSS,https://cointelegraph.com/rss,2024-12-07 21:56:56+00:00,2024-12-08 12:18:46.802946,pepe memecoin flip uniswap token market cap hit alltime high according data coinmarketcap pepe maximum supply roughly 420 trillion token token already circulation,0.0,0.03,0.015
RSS,https://cointelegraph.com/rss,2024-12-07 19:51:43+00:00,2024-12-08 12:18:46.802946,bitcoin separate money state david sack sack also highlighted bitcoins portability major feature crypto make attractive option social turmoil,0.1027,0.2986111111111111,0.20065555555555556
RSS,https://cointelegraph.com/rss,2024-12-07 17:14:43+00:00,2024-12-08 12:18:46.802946,layer2 network need decentralized sequencer metis cofounder according data l2 beat 118 layer2 scaling solution listed ethereum network december 2024,0.3182,0.0,0.1591
RSS,https://cointelegraph.com/rss,2024-12-07 15:18:18+00:00,2024-12-08 12:18:46.802946,bitcoin 039choppiness039 index hint 110k btc price tough crack bitcoin getting choppier btc price uptrend le strong new indicator data suggests,0.4215,0.06026936026936027,0.24088468013468012
RSS,https://cointelegraph.com/rss,2024-12-07 14:35:00+00:00,2024-12-08 12:18:46.802946,train ai bot daytrade crypto training ai bot crypto trading open 247 market access speed learn build deploy bot risk involved fit strategy,0.1027,0.2,0.15135
RSS,https://cointelegraph.com/rss,2024-12-07 14:27:04+00:00,2024-12-08 12:18:46.802946,bitcoin rally continue end 2025 analyst bitcoins historic 100000 milestone come despite sluggish momentum oil gold sp 500 index,0.3089,0.0,0.15445
RSS,https://cointelegraph.com/rss,2024-12-07 14:00:00+00:00,2024-12-08 12:18:46.802946,bitcoin hit 100k pizza bitcoin national stockpile bitcoin worth little thousand btc given away free one worth roughly 100000 valuable cryptocurrency ever,0.8481,0.14250000000000002,0.49529999999999996
RSS,https://cointelegraph.com/rss,2024-12-07 13:58:38+00:00,2024-12-08 12:18:46.802946,ethereum poised copy xrps 390 rally toward 76k next ether breaking similar symmetrical triangle pattern propelled xrps price around 050 around 290 within month,0.25,0.0,0.125
RSS,https://cointelegraph.com/rss,2024-12-07 11:40:35+00:00,2024-12-08 12:18:46.802946,ether 5k fractal blackrock eth etf holding 2x 500m buy ether price rally 5000 psychological mark may minimum target based emerging eth fractal pattern bitcoins surge 100000,0.0,0.0,0.0
RSS,https://cointelegraph.com/rss,2024-12-07 09:15:28+00:00,2024-12-08 12:18:46.802946,telegram founder pavel durov questioned paris court first time report durov said trust french justice system refused elaborate legal proceeding,0.6808,0.2375,0.45914999999999995
RSS,https://cointelegraph.com/rss,2024-12-07 05:58:36+00:00,2024-12-08 12:18:46.802946,coffeezilla call insane headline hawk tuah memecoin youtube investigator coffeezilla called end spread misinformation viral influencer hailey welchs recent controversial memecoin launch hawk,-0.7003,-0.15,-0.42515000000000003
RSS,https://cointelegraph.com/rss,2024-12-07 02:41:40+00:00,2024-12-08 12:18:46.802946,fsoc warns stablecoins remain 039potential risk039 financial stability 2024 annual report fsoc said stablecoins acutely vulnerable run absent appropriate risk management standard,-0.5267,0.0,-0.26335
RSS,https://cointelegraph.com/rss,2024-12-06 22:15:00+00:00,2024-12-08 12:18:46.802946,ethereum impulse breakout lead 15k eth price 2025 analyst ethereum price finally took 4000 resistance level one analyst say eth could hit 15000 may 2025,0.0,0.0,0.0
RSS,https://cointelegraph.com/rss,2024-12-06 21:59:29+00:00,2024-12-08 12:18:46.802946,czech govt move exempt crypto held 3 year taxed prime minister said czech resident would report crypto transaction 4200 per year pay tax selling digital asset held three year,0.3612,0.0,0.1806
RSS,https://cointelegraph.com/rss,2024-12-06 21:58:04+00:00,2024-12-08 12:18:46.802946,400 million crypto wallet nonzero balance chainalysis according chainalysis realworld tokenized asset investment vehicle continue major driver crypto adoption,0.3612,0.0625,0.21185
RSS,https://cointelegraph.com/rss,2024-12-06 21:54:12+00:00,2024-12-08 12:18:46.802946,nansen provide analysis galxes gravity blockchain nansen expands yet another blockchain gravity launched galxe alpha mainnet june,0.2263,0.0,0.11315
RSS,https://cointelegraph.com/rss,2024-12-06 21:30:00+00:00,2024-12-08 12:18:46.802946,crypto biz wall street get taste altseason week crypto biz explores ether etf growing inflow political move behind metas stablecoin sunset bitgos plan india,0.1779,-0.2,-0.011050000000000004
RSS,https://cointelegraph.com/rss,2024-12-06 21:15:00+00:00,2024-12-08 12:18:46.802946,future bitcoin price dip 90k routine profit taking btc trader keep buying trader bought bitcoins dip 90000 sign investor confident btc price 100000,0.7269,0.25,0.48845
RSS,https://cointelegraph.com/rss,2024-12-06 20:45:36+00:00,2024-12-08 12:18:46.802946,eigenlayer upgrade restaking reward upgrade designed bring greater flexibility eigenlayers restaking ecosystem,0.8225,0.5,0.66125
RSS,https://cointelegraph.com/rss,2024-12-06 20:12:50+00:00,2024-12-08 12:18:46.802946,bitcoin spinning top candle target 115k recent 15 btc flash crash bitcoins rebound week flash crash reset key price metric paved path btc chase 115000 level,-0.5574,0.16666666666666666,-0.1953666666666667
RSS,https://cointelegraph.com/rss,2024-12-06 19:43:44+00:00,2024-12-08 12:18:46.802946,trump btc reserve plan would bad deal exny fed president bill dudley joined others suggesting purpose u government bitcoin reserve would reward trump crypto supporter,0.3182,-0.6999999999999998,-0.19089999999999993
RSS,https://cointelegraph.com/rss,2024-12-06 19:15:50+00:00,2024-12-08 12:18:46.802946,u job data point likely rate cut december grayscale interest rate cut increase m2 money supply structural deficit geopolitical tension typically drive bitcoins price higher,-0.4404,0.02777777777777778,-0.2063111111111111
RSS,https://cointelegraph.com/rss,2024-12-06 19:11:11+00:00,2024-12-08 12:18:46.802946,trump new crypto czar called openai piranha forprofit company david sack professed view openais business restructuring seemingly align elon musk,0.0,0.13636363636363635,0.06818181818181818
RSS,https://cointelegraph.com/rss,2024-12-06 19:05:52+00:00,2024-12-08 12:18:46.802946,nuvei visa partner stablecoin payment latam merchant latin america continues center blockchain integration nuvei partner new ecommerce solution merchant,0.3182,0.018181818181818174,0.16819090909090909
RSS,https://bitcoinmagazine.com/.rss/full/,2024-12-07 18:07:35+00:00,2024-12-08 12:18:46.802946,trump must end capital gain tax bitcoinby eliminating capital gain tax bitcoin trump administration spur u innovation strengthen nation economic sovereignty ensure everyday american gain equal footing world rapidly evolving digital economy,0.9493,0.0,0.47465
RSS,https://bitcoinmagazine.com/.rss/full/,2024-12-06 19:12:33+00:00,2024-12-08 12:18:46.802946,joule paradox energy set value bitcoin bitcoin set value energyenergy fundamental base commodity upon everything value produced bitcoin pure embodiment energy monetary form,0.8402,-0.29285714285714287,0.27367142857142857
RSS,https://bitcoinmagazine.com/.rss/full/,2024-12-05 18:49:06+00:00,2024-12-08 12:18:46.802946,money isnt fixed yeta finite supply cap think necessary fix monetary system money seizure surveillance fundamentally much bigger problem solve,-0.2263,0.03333333333333333,-0.09648333333333334
RSS,https://bitcoinmagazine.com/.rss/full/,2024-12-05 17:27:55+00:00,2024-12-08 12:18:46.802946,100000 bitcoin price beginningwhoa think bitcoin hitting 100k peak think whats ahead 2025 getting started folk,0.0,0.0,0.0
RSS,https://bitcoinmagazine.com/.rss/full/,2024-12-05 17:26:47+00:00,2024-12-08 12:18:46.802946,guatemalan government taking closer look bitcoin memea nayib bukele bitcoin meme posted el salvador bitcoin office went viral guatemala last month im told prompted power country begin homework bitcoin craft better policy around asset,0.6597,0.25,0.45485
RSS,https://bitcoinmagazine.com/.rss/full/,2024-12-05 15:42:57+00:00,2024-12-08 12:18:46.802946,month bitcoin shattered record dive bitcoin reportdiscover key insight trend historic month bitcoin free bitcoin report dont miss outread,0.164,0.13333333333333333,0.14866666666666667
RSS,https://bitcoinmagazine.com/.rss/full/,2024-12-05 02:34:57+00:00,2024-12-08 12:18:46.802946,bitcoin officially hit 100000 first time everthis historic day cemented history,0.0,0.125,0.0625
RSS,https://bitcoinmagazine.com/.rss/full/,2024-12-04 21:37:40+00:00,2024-12-08 12:18:46.802946,fed chair jerome powell correct bitcoin competition gold dollarpowell said bitcoin digital gold,0.0,0.0,0.0
RSS,https://bitcoinmagazine.com/.rss/full/,2024-12-04 20:01:42+00:00,2024-12-08 12:18:46.802946,bitcoin developer move gauge consensus covenant soft forksbitcoin taken notable step often contentious software upgrade process,-0.296,0.3,0.0020000000000000018
RSS,https://bitcoinmagazine.com/.rss/full/,2024-12-04 14:09:46+00:00,2024-12-08 12:18:46.802946,heat home earning bitcoin heatbitheatbits founder alex busarov created device let people increase bitcoin stack keeping home warm also contributes decentralization bitcoin hashrate,0.6369,0.6,0.6184499999999999
RSS,https://bitcoinmagazine.com/.rss/full/,2024-12-03 18:49:37+00:00,2024-12-08 12:18:46.802946,want another bitcoin country something itfor first time history opportunity support presidential candidate want put country bitcoin standard,0.7269,0.125,0.42595
RSS,https://bitcoinmagazine.com/.rss/full/,2024-12-03 18:03:55+00:00,2024-12-08 12:18:46.802946,bother trying scale bitcoinbitcoiners need find balance pessimism optimism looking bitcoins future rather embracing one extreme,-0.1027,-0.0625,-0.0826
RSS,https://bitcoinmagazine.com/.rss/full/,2024-12-03 17:16:33+00:00,2024-12-08 12:18:46.802946,bitcoin selfcustody threat europea look current regulation change taking shape europe could threaten bitcoiners ability right self custody,-0.5719,0.14285714285714285,-0.21452142857142856
RSS,https://bitcoinmagazine.com/.rss/full/,2024-12-03 12:33:14+00:00,2024-12-08 12:18:46.802946,lack soft fork due lack interest lack processbitcoin core developer dedicate time energy whatever part codebase find interesting important work far hasnt really soft fork proposal,0.4019,0.17916666666666667,0.2905333333333333
RSS,https://bitcoinmagazine.com/.rss/full/,2024-12-02 17:57:13+00:00,2024-12-08 12:18:46.802946,dont sell microstrategy bitcoinwhen sell bitcoin mstr others buying,0.0,0.0,0.0
RSS,https://bitcoinmagazine.com/.rss/full/,2024-12-02 16:26:12+00:00,2024-12-08 12:18:46.802946,debanked financial suppression bitcoin business must endwhy regulator must held accountable consequence operation chokepoint 20,0.0,0.0,0.0
RSS,https://bitcoinmagazine.com/.rss/full/,2024-11-29 14:00:00+00:00,2024-12-08 12:18:46.802946,december surpass november recordbreaking bitcoin price increasefrom historic gain future growth november bitcoin price breakthrough mean investor december,0.7184,-0.10416666666666667,0.3071166666666667
RSS,https://bitcoinmagazine.com/.rss/full/,2024-11-27 21:45:37+00:00,2024-12-08 12:18:46.802946,fight bitcoin united state fiscal crossroadsin chapter satoshi paper avik roy explores looming fiscal crisis present three potential response united state restriction paralysis assimilation could bitcoin emerge solutionor spark conflict,-0.6249,0.0,-0.31245
RSS,https://bitcoinmagazine.com/.rss/full/,2024-11-27 20:26:13+00:00,2024-12-08 12:18:46.802946,bitcoin price repeat november 28 ath pattern 2013 2017 2024historically bitcoin achieved alltime high ath november 28 2013 2017 november 28 2024 imminent investor speculating whether bitcoin could reach 100000 mark significant date,0.2263,0.2675,0.2469
RSS,https://bitcoinmagazine.com/.rss/full/,2024-11-27 18:37:31+00:00,2024-12-08 12:18:46.802946,bitcoiners need grow focus shitstop worrying bitcoiners bitcoin worry accomplish want,-0.296,0.0,-0.148
RSS,https://bitcoinmagazine.com/.rss/full/,2024-11-27 16:18:57+00:00,2024-12-08 12:18:46.802946,bitcoin neither racist xenophobic misogynistic response ideological stereotypingkamala harris rejection bitcoin deprives vital resource need globally trump number go approach may jeopardize america core humanitarian value like refugee resettlement program ignore bitcoins potential aid vulnerable population globally,0.0052,-0.08,-0.0374
RSS,https://bitcoinmagazine.com/.rss/full/,2024-11-27 14:23:40+00:00,2024-12-08 12:18:46.802946,here talk bitcoin thanksgiving tableshare resource dont give advice,0.0,0.0,0.0
RSS,https://bitcoinmagazine.com/.rss/full/,2024-11-27 10:22:41+00:00,2024-12-08 12:18:46.802946,michael saylor doesnt control bitcoin notion michael saylor singlehandedly decide bitcoins fate microstrategys stack simply ridiculous,-0.3612,-0.3333333333333333,-0.34726666666666667
RSS,https://bitcoinmagazine.com/.rss/full/,2024-11-26 21:52:20+00:00,2024-12-08 12:18:46.802946,maximizing bitcoin accumulation beyond benchmark bitcoin redefined digital asset landscape outperforming traditional market year year investor institution maximize bitcoin holding beyond simple buyandhold strategy,0.3612,0.0,0.1806
RSS,https://bitcoinmagazine.com/.rss/full/,2024-11-26 17:26:10+00:00,2024-12-08 12:18:46.802946,bitcoin script focus building block wild geeseconversations around script upgrade bitcoin become unfocused irrational lost serious context public square,-0.8625,-0.15833333333333333,-0.5104166666666667
RSS,https://bitcoinmagazine.com/.rss/full/,2024-11-26 17:03:29+00:00,2024-12-08 12:18:46.802946,use bitcoin easily privately cake walletcake wallet founder vik sharma team created one usable noncustodial bitcoin crypto wallet market perhaps one offer transactional privacy,0.5267,0.0,0.26335
RSS,https://bitcoinmagazine.com/.rss/full/,2024-11-26 16:53:42+00:00,2024-12-08 12:18:46.802946,remembering john mcafees bullish bitcoin price bet near 100k milestoneas bitcoin teeter brink 100000 revisit john mcafees audacious 1 million prediction exploring whether maverick wild foresight sheer madness stroke geniusand timing thing got wrong,-0.6249,-0.075,-0.34995
RSS,https://bitcoinmagazine.com/.rss/full/,2024-11-26 14:00:00+00:00,2024-12-08 12:18:46.802946,fidelity investment director share bitcoins adoption valuation modelsjurrien timmer director global macro fidelity investment recently shared bitcoin valuation model based adoption curve monetary policy scenario offering perspective asset maturing role network monetary innovation,0.8271,0.0,0.41355
RSS,https://bitcoinmagazine.com/.rss/full/,2024-11-25 17:11:37+00:00,2024-12-08 12:18:46.802946,safegcds implementation formally verifiedverifying implementation novel modular inversion algorithm using proof assistant guaranteeing bitcoin cryptography handled correctly done,0.3182,0.0,0.1591
RSS,https://bitcoinmagazine.com/.rss/full/,2024-11-25 14:15:42+00:00,2024-12-08 12:18:46.802946,newmarket capital launch battery finance bitcoincollateralized loan strategy battery finance enables borrower use bitcoin collateral loan without marking market mean bring forward bitcoins value,0.34,-0.3125,0.013750000000000012
RSS,https://bitcoinmagazine.com/.rss/full/,2024-11-25 14:00:00+00:00,2024-12-08 12:18:46.802946,invest bitcoin opensource companiesthe launch timestamp really piqued interest,0.5678,0.2,0.3839
RSS,https://bitcoinmagazine.com/.rss/full/,2024-11-22 18:38:34+00:00,2024-12-08 12:18:46.802946,jason spaceboi lowerys bitcoin thesis incoherent gibberishthis space full incoherent nonsense paraded around deep insightful analysis nothing absurd jason lowerys softwar thesis,-0.4019,-0.11000000000000001,-0.25595
RSS,https://bitcoinmagazine.com/.rss/full/,2024-11-22 17:50:03+00:00,2024-12-08 12:18:46.802946,legacy medias transformation evolution beat extinctionlegacy medium evolving audience demand transparency independence bitcoin paving way new era decentralized trustworthy journalism,0.4767,0.13636363636363635,0.3065318181818182
RSS,https://bitcoinmagazine.com/.rss/full/,2024-11-22 16:23:29+00:00,2024-12-08 12:18:46.802946,gary genslers departure triumph bitcoinas upcoming trump administration gearing establish regulatory landscape facilitating fullon anythinggoes multicoinery gary gensler gone could well see atrocious scam coin proliferate soar inevitably implode,0.128,-0.35,-0.11099999999999999
RSS,https://bitcoinmagazine.com/.rss/full/,2024-11-22 14:29:00+00:00,2024-12-08 12:18:46.802946,onchain data show bitcoin price bull run far overdespite bitcoins recent rally onchain data reveals bull market still plenty room grow metric like mvrv zscore nupl puell multiple suggest bitcoin far overheated pointing potential significant upside month ahead,0.5106,0.09583333333333333,0.3032166666666667
RSS,https://bitcoinmagazine.com/.rss/full/,2024-11-21 23:02:16+00:00,2024-12-08 12:18:46.802946,bitcoin nears 100000 trump council expected implement btc reservethis bullish bitcoin ive ever,0.0,-0.1,-0.05
RSS,https://bitcoinmagazine.com/.rss/full/,2024-11-21 22:23:20+00:00,2024-12-08 12:18:46.802946,microsoft buy 78 billion worth bitcoinmicrosoft clinging cash rejecting bitcoins proven value boost make zero sense quit wasting reserve buy btc,0.0772,0.3,0.1886
RSS,https://bitcoinmagazine.com/.rss/full/,2024-11-21 18:18:18+00:00,2024-12-08 12:18:46.802946,want greater bitcoin adoption engage governmenti tip hat digioats ceo heritage falodun stepping educate nigeria deposit insurance corporation ndic importance bitcoin,0.7717,0.5,0.63585
RSS,https://bitcoinmagazine.com/.rss/full/,2024-11-21 18:01:32+00:00,2024-12-08 12:18:46.802946,bitcoin pi cycle top indicator accurately time market cycle peaksthe bitcoin pi cycle top indicator flawlessly identified every market cycle peak bitcoins history unique mathematical foundation historical accuracy could predict next top bitcoin evolves mature market,0.7906,0.3375,0.5640499999999999
RSS,https://bitcoinmagazine.com/.rss/full/,2024-11-21 17:43:35+00:00,2024-12-08 12:18:46.802946,viable bitvm based pegsa look recent report galaxy looking economic viability two way peg secured bitvm,0.4019,0.1,0.25095
RSS,https://bitcoinmagazine.com/.rss/full/,2024-11-21 15:26:49+00:00,2024-12-08 12:18:46.802946,chart show bitcoins bull run wont stop 100000 sure might selloff far peak bitcoin,-0.0191,0.3,0.14045
RSS,https://bitcoinmagazine.com/.rss/full/,2024-11-20 18:49:28+00:00,2024-12-08 12:18:46.802946,bitcoin boost microstrategy mstr higher trading volume tesla nvidiathe bitcoin treasury effect real,0.5423,0.225,0.38365
RSS,https://bitcoinmagazine.com/.rss/full/,2024-11-20 18:12:38+00:00,2024-12-08 12:18:46.802946,jippi pokémon go bitcoin gamified bitcoin education serve catalyst hyperbitcoinization coming year jippi hope spearhead next wave bitcoin adoption offering newcomer fun friendly entry point industry,0.8555,0.225,0.54025
RSS,https://bitcoinmagazine.com/.rss/full/,2024-11-19 19:33:21+00:00,2024-12-08 12:18:46.802946,u strategic bitcoin reserve fomo horribly oversoldwould great u started buying bitcoin surely industry political capital cash let use wisely,0.7506,0.2,0.47530000000000006
RSS,https://bitcoinmagazine.com/.rss/full/,2024-11-19 18:31:11+00:00,2024-12-08 12:18:46.802946,good riddance martin gruenbergthe fdic chairman one main orchestrator operation chokepoint 20 cant leave fast enough,0.4675,0.26666666666666666,0.3670833333333333
RSS,https://bitcoinmagazine.com/.rss/full/,2024-11-19 18:01:12+00:00,2024-12-08 12:18:46.802946,stablecoins friendsstablecoins one biggest mistake ever made bitcoin space ostracized discouraged embraced,-0.6249,0.0,-0.31245
RSS,https://bitcoinmagazine.com/.rss/full/,2024-11-19 17:15:53+00:00,2024-12-08 12:18:46.802946,bitcoin treasury adoption surge meet new microstrategysinstitutional bitcoin adoption,0.2023,0.13636363636363635,0.1693318181818182
RSS,https://bitcoinmagazine.com/.rss/full/,2024-11-19 14:20:08+00:00,2024-12-08 12:18:46.802946,bitcoin multisig company casa make selfsovereignty easycasa cofounder ceo nick neuman belief taking customercentric approach help get people use multikey bitcoin vault,0.4019,0.0,0.20095
RSS,https://bitcoinmagazine.com/.rss/full/,2024-11-18 23:21:33+00:00,2024-12-08 12:18:46.802946,100000 bitcoin right around corner today tidal wave bullish bitcoin development convinced btc hit 100000 week,0.4019,0.2857142857142857,0.34380714285714287
RSS,https://bitcoinmagazine.com/.rss/full/,2024-11-18 16:41:56+00:00,2024-12-08 12:18:46.802946,buy drug get bitcoini learned nihowdy company let earn bitcoin purchasing prescription drug im intrigued,0.0,0.0,0.0
RSS,https://bitcoinist.com/feed/,2024-12-08 10:30:10+00:00,2024-12-08 12:18:46.802946,u council sound alarm crypto oversight needed stablecoinspopular stablecoins digital asset designed relatively stable price getting noticed policymakers crypto unit stable counterpart recent financial service oversight council fsoc report suggests pose risk financial market related reading bitcoin go taxfree czech republic longterm holder,0.34,0.05714285714285715,0.1985714285714286
RSS,https://bitcoinist.com/feed/,2024-12-08 09:00:31+00:00,2024-12-08 12:18:46.802946,bitcoin rally fuel demand crypto loan lending sector reboundthe recent bitcoin price surge surpassed 100000 first time creating ripple longstruggling crypto lending sector particularly decentralized finance defi application according bloomberg report speculative excitement surrounding bitcoin invigorated trading also spilling lending platform signaling potential resurgence,0.7269,0.10416666666666666,0.4155333333333333
RSS,https://bitcoinist.com/feed/,2024-12-08 06:30:55+00:00,2024-12-08 12:18:46.802946,dogecoin steadily ascends 04484 resistance bull maintain controldogecoin steadily climbing price approaching critical 044848 mark consistent upward movement signal bull firmly control pushing doge closer new territory price steadily advance market attention intensifies leaving many wondering persistent ascent beginning major breakout increased,0.0202,0.1248863636363636,0.0725431818181818
RSS,https://bitcoinist.com/feed/,2024-12-08 05:00:05+00:00,2024-12-08 12:18:46.802946,dogecoin price could hit double digit follows 2 subcycle surge 2017crypto analyst trader tardigrade predicted dogecoin price could hit double digit repeat historical pattern 2017 bull run analyst previously predicted dogecoin could rally high 87 mirror 2017 bull cycle related reading bitcoin hit 100k mt gox make,0.0,-0.001111111111111109,-0.0005555555555555545
RSS,https://bitcoinist.com/feed/,2024-12-08 03:30:27+00:00,2024-12-08 12:18:46.802946,elon musk laugh openai ceo tweet sack appointment here scoopthe rivalry two respected tech giant continues evident congratulatory post might reignited rift two former ally ai tech spacex ceo elon musk took swipe rival openai ceo sam altman latter congratulated david sack nominated u presidentelect donald,0.7717,0.11000000000000001,0.44085
RSS,https://bitcoinist.com/feed/,2024-12-08 02:00:34+00:00,2024-12-08 12:18:46.802946,dogecoin price primed violent 60 move bitcoin happenscrypto analyst bluntz capital predicted dogecoin price could soon witness violent 60 move bitcoin analyst revealed need happen parabolic rally happen dogecoin price record 60 move bitcoin x post bluntz capital shared accompanying chart showing dogecoin,-0.7506,-0.8,-0.7753000000000001
RSS,https://bitcoinist.com/feed/,2024-12-08 00:30:58+00:00,2024-12-08 12:18:46.802946,bitcoin etf surpass satoshis holding blockchain firm break institutional adoption 2024the year 2024 one history book cryptocurrency industry especially bitcoin kickstarting year approval spot exchangetraded fund etf didnt take long premier cryptocurrency rode back fresh institutional capital new alltime high pretty much,0.8225,0.08848484848484849,0.45549242424242425
RSS,https://bitcoinist.com/feed/,2024-12-07 23:00:37+00:00,2024-12-08 12:18:46.802946,bitcoin go taxfree czech republic longterm holdersif youre czech republic another good reason hold bitcoin government approved new tax policy exempting bitcoin capital gain tax provided asset held least three year updated tax policy also exempts individual paying tax income digital currency,0.891,0.10727272727272727,0.49913636363636366
