MainSource,Source,Publication Date,Pull_date,Pre-Processed Text,Sentiment_Vader,Sentiment_TextBlob,Average_Sentiment
Reddit,solana,2025-02-08 07:26:06,2025-02-11 00:52:33.334010,im pretty sure im missing like 1015 sol help find ill give 1 2i recently realized balance looking little bit smaller im pretty sure misplaced like 1015 sol im really dumb anyone would willing help find ill send like 152 sol 4 wallet 7cfluqse4uwc5b39ny6mnqoqu17sfuatfntxukzynxdm whgzyt4rfj3zf4jbkmzpse7nunwvdxc8is6zhqw8gko two photon 82xmrdfkgsgmbknjbz2mhz8pgs3y35sy1erpltjefbnv h1kruwo6zx8qtwjvzsbdvqxznmnirtt4zicecszbghdu two phantom anyone find reply address missing sol send thanks,0.9044,-0.014166666666666664,0.44511666666666666
Reddit,solana,2025-02-08 05:37:16,2025-02-11 00:52:33.334010,best platform launch onhi currently seeing 3 option launch solana token outside whole kit caboodle something like createmytoken etc id love feedback exp platform better put better quote know none perfect launching sol meme pretty much trip vega play watch sniper slot need type commentary please lol 1 pumpfunhttppumpfun obviously cheap fast huge following pay 5 sol migrate main question cant get straight answer pay 5 sol devcreator also make initial purchase launch say yes say biggest con imo rep scam city well deserved likelihood id get rugged sniper bat lol community huge thats helpful newer token hasnt established much following yet also im kind leary lawsuit popping 2 moonshot via dexscreener cheap deployment fee come enhanced dex listing 295 saving select raydium pay 2 sol token migrates question also 2 sol paid creator make initial purchase creator make initial purchase cant tell doc also creator make initial purchase considered liquidity lockedburned treated normal transaction traded per usual obvious con community smaller dont see many token migrating moonshot ive heard climb bonding dump speculation seems inside job moonshot dex 3 newer one ive found gofundmemes super new ui look janky like raise little much want prior migration also seem version allows create tokenomics vesting schedule look like showed like week ago dont know anybody launched there feedback would appreciated given topic tell bother wasting time launching token solana lol thanks advance,0.9927,0.2717657342657343,0.6322328671328672
Reddit,solana,2025-02-08 09:39:22,2025-02-11 00:52:33.334010,solscan showing token creatordev icon new devs coinsi like tracking devs wallet recently solscan showing token creatordev icon new devs old devs still show icon wallet tracker bot stop tracking account well idea information might help,0.6249,0.09318181818181817,0.3590409090909091
Reddit,solana,2025-02-07 10:07:22,2025-02-11 00:52:33.334010,whats stopping telegram trading bot stealing moneylets say make trade lifetime snipe runner go million make hundred thousand whats stopping bot taking,-0.7096,0.0,-0.3548
Reddit,solana,2025-02-08 07:50:28,2025-02-11 00:52:33.334010,solana auto trading botwhat solanaraydium autotrading bot im talking copy trading please,0.3182,0.0,0.1591
Reddit,solana,2025-02-08 16:02:41,2025-02-11 00:52:33.334010,making memecoin please give advicehi im currently working making memecoin would anyone able give advice let know think idea thanks,0.6369,0.2333333333333333,0.43511666666666665
Reddit,solana,2025-02-07 16:26:14,2025-02-11 00:52:33.334010,jup contributes margin collateral backpack meow,0.0,0.0,0.0
Reddit,solana,2025-02-07 22:14:17,2025-02-11 00:52:33.334010,somebody steal solonayo guy somebody stole solana omg didnt downloaded linked nothing malicious please help avoid be9rc2uc4gkv97xhe31aeulmxpex5zbdt1cugiwzjoeg wallet got solana httpssolscaniotx3xrgtqrahghxwyjpbwworacdbu56kpavsfrarsqchktncrai2yxlmdeoykwxqwdf8wjigpyphs6horphpnoekpfpsolbalancechangehttpssolscaniotx3xrgtqrahghxwyjpbwworacdbu56kpavsfrarsqchktncrai2yxlmdeoykwxqwdf8wjigpyphs6horphpnoekpfpsolbalancechange httpspreviewredditlf24xmm1kshe1jpgwidth1170formatpjpgautowebps045f9c4a88ae162e6f4b6dc9dc75cbf0aa07066a,-0.8234,0.0,-0.4117
Reddit,solana,2025-02-06 22:40:20,2025-02-11 00:52:33.334010,found profitable wallet sellsusing gmgn found wallet thats pretty good however wallet sell im trying find wallet bought connect wallet solscan im sure im looking time possible find buy wallet,0.8834,0.3625,0.62295
Reddit,solana,2025-02-07 18:44:24,2025-02-11 00:52:33.334010,good notification bot new pair namedoes anyone know good bot send notification new coin theyre dex screener specifically id like get notification new pair name ive using fluxbeam doesnt tell thank,0.7343,0.3618181818181817,0.5480590909090908
Reddit,solana,2025-02-07 18:21:50,2025-02-11 00:52:33.334010,zetachain add support solana developer build universal apps natively span solana bitcoin ethereum base blockchainssource httpsxcomzetablockchainstatus1887629501150155216httpsxcomzetablockchainstatus1887629501150155216 zetachain adding support solana developer build universal apps natively span solana bitcoin ethereum base also solana dapps native access bitcoin without bridging wrapping,0.6597,-0.4,0.12984999999999997
Reddit,solana,2025-02-07 08:47:30,2025-02-11 00:52:33.334010,solana etf usa move forwardhttpswwwtheblockcopost339394secadvancesgrayscalessolanaetfproposalfollowing19b4seekspublicinput,0.0,0.0,0.0
Reddit,solana,2025-02-08 05:58:12,2025-02-11 00:52:33.334010,good meme coin trading course preferably something youve used also open getting mentored 11 good tradertitle,0.7003,0.4666666666666666,0.5834833333333334
Reddit,solana,2025-02-07 15:04:34,2025-02-11 00:52:33.334010,shipment saga 2 phonedoes anybody know delivery saga 2 phone going going,0.0,0.0,0.0
Reddit,solana,2025-02-07 00:34:11,2025-02-11 00:52:33.334010,dont really understand slippage worksok id think 7000000 coin id get 7000000 coin value hit 1 slippage affect way much like slippage,0.5994,0.2,0.39970000000000006
Reddit,solana,2025-02-07 22:33:16,2025-02-11 00:52:33.334010,went telegram today saw nova recommended lot ppl watch concernednot worried account linked nova 1 use nova change wallet,-0.1027,0.0,-0.05135
Reddit,solana,2025-02-07 12:37:27,2025-02-11 00:52:33.334010,midcurve podcast ideology innovation jed leggett backend engineer jito lab,0.3818,0.0,0.1909
Reddit,solana,2025-02-07 12:29:50,2025-02-11 00:52:33.334010,lightspeed podcast cryptos biggest opportunity 2025 weekly roundup,0.4215,0.0,0.21075
Reddit,solana,2025-02-07 18:16:04,2025-02-11 00:52:33.334010,removing connection appsi pre ordered psg1 solana seeker 2 ago remove connection matrica wallet also stake marinade leave original connection site remove establish later biggie thanks,0.6124,0.19166666666666665,0.40203333333333335
Reddit,solana,2025-02-07 09:22:42,2025-02-11 00:52:33.334010,clip good game podcast,0.4404,0.14999999999999997,0.2952
Reddit,solana,2025-02-07 13:55:55,2025-02-11 00:52:33.334010,long sol transfer walletmy kraken account month old bought sol yesterday tried move wallet wont let click anything withdrawal page im thinking first bought said 7 day could take maybe going 7 day transfer,0.0258,0.09999999999999999,0.0629
Reddit,solana,2025-02-07 03:47:20,2025-02-11 00:52:33.334010,need validate walletive gotten 10 dm different people advertising validation website also bunch stuff like fixing missing balance validating nfts supposed look sketchy dont want give away phrasekey,0.6096,-0.1,0.2548
Reddit,solana,2025-02-07 07:51:36,2025-02-11 00:52:33.334010,solana becomes secondlargest chain defi tvl revenue surge q 2024,0.0,0.0,0.0
Reddit,solana,2025-02-07 12:35:08,2025-02-11 00:52:33.334010,midcurve whiteboard series tip flow part 2,0.0,0.0,0.0
Reddit,solana,2025-02-07 06:01:47,2025-02-11 00:52:33.334010,122m sol unlock 17 day predictionshow think affect price think go market otc roughly 24 billion 229 ftx 20250301 000000 1911 unique withdrawer 8714790 sol unlocks 500000 sol total unlocking average unlock 20250224 000000 7 1 2232026 sol 318861 sol 20250226 000000 1 1 1309132 sol 1309132 sol 20250307 000000 25 24 581892 sol 23276 sol 20250324 000000 3 3 595365 sol 198455 sol 20250404 000000 5 5 1809063 sol 361813 sol 20250407 000000 32 31 698590 sol 21831 sol 20250507 000000 32 31 579148 sol 18098 sol 20250607 000000 30 29 524176 sol 17473 sol 20250612 000000 1 1 450000 sol 450000 sol 20250707 000000 30 29 524467 sol 17482 sol 20250807 000000 31 30 577487 sol 18629 sol 20250907 000000 32 31 581364 sol 18168 sol 20251007 000000 32 31 579219 sol 18101 sol 20251107 000000 32 31 579069 sol 18096 sol 20251207 000000 32 31 582132 sol 18192 sol 20260107 000000 32 31 581118 sol 18160 sol 20260207 000000 32 31 581041 sol 18158 sol 20260228 000000 1 1 625000 sol 625000 sol 20260307 000000 31 30 524726 sol 16927 sol 20260407 000000 31 30 523014 sol 16871 sol 20260507 000000 32 31 577410 sol 18044 sol 20260607 000000 31 30 523255 sol 16879 sol 20260707 000000 31 30 523127 sol 16875 sol 20260801 000000 3 3 1375000 sol 458333 sol 20260807 000000 30 29 518954 sol 17298 sol 20260830 000000 1 1 875000 sol 875000 sol 20260907 000000 32 31 578977 sol 18093 sol 20261007 000000 31 30 577163 sol 18618 sol 20261107 000000 30 29 520266 sol 17342 sol 20261207 000000 31 30 524935 sol 16933 sol 20270107 000000 32 31 578236 sol 18070 sol 20270207 000000 32 31 579973 sol 18124 sol 20270307 000000 32 31 576644 sol 18020 sol 20270407 000000 32 31 580094 sol 18128 sol 20270507 000000 30 29 520910 sol 17364 sol 20270607 000000 31 30 579062 sol 18679 sol 20270707 000000 30 29 520471 sol 17349 sol 20270707 000000 30 29 520471 sol 17349 sol 20270807 000000 32 31 578284 sol 18071 sol 20270907 000000 31 30 578221 sol 18652 sol 20271007 000000 32 31 581071 sol 18158 sol 20271107 000000 30 29 532405 sol 17747 sol 20271207 000000 30 29 532986 sol 17766 sol 20280107 000000 32 31 580255 sol 18133 sol 29 unique withdrawer x 9 unlocks 30 unique withdrawer x 9 unlocks 31 unique withdrawer x 17 unlocks httpswwwsolanacompasscomtokenomicshttpswwwsolanacompasscomtokenomics,0.0,0.17857142857142858,0.08928571428571429
Reddit,solana,2025-02-07 10:55:13,2025-02-11 00:52:33.334010,telegram safety drainyesterday foolishly lost 15 sol entering phone number verification number fake safeguard bot playing around api python thought multiple logins whatever within second wallet drained since turned 2fa removed authorized device telegram also blocked bot reported question would safe reinstall trojan bot create completely new telegram account,-0.0,0.02727272727272727,0.013636363636363636
Reddit,solana,2025-02-06 12:44:51,2025-02-11 00:52:33.334010,crypto already toxic subreddit making worseive seen every time someone loses money face problem post idiot add zero value keep commenting negatively seem cool idiot jump thinking theyll look cool start upvoting youre adding zero value dont want help dont comment idea person going,-0.6888,-0.25000000000000006,-0.46940000000000004
Reddit,solana,2025-02-06 22:44:47,2025-02-11 00:52:33.334010,sec recent acknowledgment grayscales solana filing signal positive regulatory shift,0.5574,0.04242424242424242,0.2999121212121212
Reddit,solana,2025-02-07 12:43:26,2025-02-11 00:52:33.334010,solanafloor podcast solanas tech dominate 2025,-0.128,0.0,-0.064
Reddit,solana,2025-02-07 12:35:14,2025-02-11 00:52:33.334010,midcurve whiteboard series tiprouter part 3,0.0,0.0,0.0
Reddit,solana,2025-02-06 22:52:53,2025-02-11 00:52:33.334010,liquid staking better staking centralized exchange avoid binance bsol bybit staked sol coinbasehey seeing lot question staking lately especially around liquid staking v staking centralized exchange like kraken coinbase binance bybit wanted share thought liquid staking better move avoid staking sol binance bsol bybit even coinbase 1 liquid staking give flexibility stake sol liquid staking protocol like marinade lido vault jito get liquid staked token eg msol stsol jitosol vsol return mean still use staked sol defilending borrowing providing liquidity earning staking reward best world youre securing network earning yield youre locked using fund centralized exchange sol locked cant anything unstake take day thats huge opportunity cost especially fastmoving ecosystem like solana defi opportunity everywhere 2 decentralization matter staking centralized exchange like kraken coinbase mean control validators centralizes power go whole ethos crypto solana decentralization staking independent validators liquid staking protocol delegate youre helping keep network secure decentralized 3 vault support decentralization delegating communitydriven validators one thing love liquid staking protocol like vault actively support decentralization example vault delegate validators actively involved solana community validators arent big player massive stake theyre smaller communitydriven operator contribute ecosystem staking vault youre earning reward youre helping grow decentralized resilient network 4 avoid binance bsol bybit staked sol coinbase get sketchy binances bsol bybits staked sol essentially iou token youre actually staking solana network youre trusting binance bybit add unnecessary counterparty risk happens binance bybit get hacked go decides freeze withdrawal youre stuck coinbase isnt much better used stake sol coinbase easy quickly realized getting lower apy compared liquid staking even direct staking plus coinbase take 35 cut reward youre leaving money table like binance bybit youre trusting centralized entity fund coinbase issue like sec lawsuit staked sol could risk 5 better yield liquid staking liquid staking protocol often offer competitive apys boost return even using liquid staked token defi example deposit vsol jitosol lending platform lp pool stack yield centralized exchange cant compete used stake coinbase felt safe familiar learned staking work risk centralized exchange switched liquid staking use vault gamechanger earning better yield also use vsol defi maximize return plus knowing stake supporting communitydriven validators vault make feel like im actually contributing solanas growth nobrainer understand benefit guy think anyone else make switch cex staking liquid staking,0.9975,0.18437499999999998,0.5909375
Reddit,solana,2025-02-07 12:12:26,2025-02-11 00:52:33.334010,good game podcast imran qiao together iljia richard tensor vector consumer crypto,0.4404,0.14999999999999997,0.2952
Reddit,solana,2025-02-07 10:56:29,2025-02-11 00:52:33.334010,10 apy usdc perps collateral backpack,0.0,0.0,0.0
Reddit,solana,2025-02-07 01:22:30,2025-02-11 00:52:33.334010,anyone use fasol trading boti recently got suggested use fasol trading bot mini app telegram telegram supposedly 38k monthly user watched couple pump dump go chartsstats coin seem 100 accurate soon go drop market cap liquidity correlate unlike dexscreen ill watching market cat stay still like possum playing dead ill check chart actually 24k higher say ive lost 34k profit trade actual investment obviously roughly 4k would take away fucking phantom wallet didnt fail transaction anyways yeah wondering anyone know fasol reliabletrustworthy anyone actually personally us cant find much info online thought id ask cant get insight probably going check bullx photon hear pretty reliable fast transaction,-0.3506,-0.07333333333333333,-0.2119666666666667
Reddit,ethereum,2025-02-09 06:01:43,2025-02-11 00:52:33.334010,weekly discussion thread buildinghello rethereumhttpswwwredditcomrethereum welcome weekly discussion thread building space developer entrepreneur enthusiast showcase project share idea seek feedback greater ethereum community share project whether youre developing decentralized application dapp launching new layer 2 network working ethereum infrastructure encourage share detail project please provide concise overview including purpose current status link information provide xtwitter youtube link post automatically filtered engage collaborate thread excellent opportunity connect likeminded individual application tester feel free ask question offer feedback seek collaboration safety reminder encourage sharing collaboration please cautious potential scam avoid connecting wallet unfamiliar application without thorough research utilizing wallet tool offer transaction simulation eg rabby walletguard help ensure safety fund never give seed phrase private key looking forward hearing pushing ethereum ecosystem forward,0.9908,0.26694214876033057,0.6288710743801653
Reddit,ethereum,2025-02-10 07:01:50,2025-02-11 00:52:33.334010,daily general discussion february 10 2025welcome ethereum daily general discussion rethereum httpsimgurcom3y7vezphttpsimgurcom3y7vezp bookmarking link always bring current daily httpsoldredditcomrethereumaboutstickynum2httpsoldredditcomrethereumaboutstickynum2 please use thread discus ethereum topic news event even price price discussion posted elsewhere subreddit continue removed always constructive subreddit ruleshttpswwwredditcomrethereumaboutrules want stake learn rethstaker ethfinance ethereum community link ethereum jobshttpsethereumorgencommunitygetinvolvedethereumjobs twitterhttpsxcomethereum evmavericks youtubehttpswwwyoutubecomevmavericks discordhttpsdiscordggevmavericks doots podcasthttpsevmaverickslibsyncom doots websitehttpsdailydootscom old reddit doots extensionhttpsgithubcometheralphaethfinanceextension uhanniabu calendar jan 20 ethereum protocol attackathonhttpsblogethereumorg20241125ethereumprotocolattackathon end jan 3031 ethereumzurichhttpsethereumzurich conference feb 79 eth oxfordhttpsethoxfordio hackathon feb 1016 ethiopiahttpsethiopiaxyz conference hackathon feb 23 mar 2 ethdenverhttpswwwethdenvercom mar 2830 eth pondyhttpswwwethpondyxyz puducherry hackathon apr 13 ey global blockchain summit person virtual,0.3818,0.025000000000000005,0.2034
Reddit,ethereum,2025-02-10 17:28:12,2025-02-11 00:52:33.334010,ethereumrelated content ive found interesting last weekstuff found interesting ferran describes minotaur paradoxhttpswarpcastcomferran0x8f457f32 wyatt benno say zkprover network asks data dont give themhttpsblogicmeiozkprovernetworkswantyourdatadontgiveittothem2 zachxbt explains coinbase user lose 300m per year scamshttpsxcancelcomzachxbtstatus1886411879939031530 cointelegraph describes ethereum l2s interoperable within monthshttpscointelegraphcommagazineethereuml2sinteroperabilityroadmapcompleteguide product zkp2p v2httpsmirrorxyz0x2374a24e7424e322d48063be799b7ac343fbba20mr3u9rsycvxf5onj1uvmy0pwfblbaalmkczf2zxvpigreferreraddress0x3e6c23cdaa52b1b6621dbb30c367d16ace21f760 link many handpicked kiwi communityhttpskiwistandgithubiokiwidocsdocsintro shared weekly newsletterhttpsparagraphxyzkiwiweeklykiwinewsrecap82,0.6249,0.375,0.49995
Reddit,ethereum,2025-02-10 22:58:53,2025-02-11 00:52:33.334010,purrsuit ethereum 5 purrsuit ethereum 5 httpsmediumcomethereumcatherderspurrsuitofethereum53dbfe72b3855 latest update ethereum development eips community initiative dive purrsuit ethereum 5 read full newsletter httpshackmdiopoojaranjanpoehttps3a2f2fhackmdio2f40poojaranjan2fpoe5httpshackmdiopoojaranjanpoehttps3a2f2fhackmdio2f40poojaranjan2fpoe5,0.0,0.425,0.2125
Reddit,ethereum,2025-02-10 16:46:58,2025-02-11 00:52:33.334010,incentive compatibility ethereums po consensus protocol,-0.2732,0.0,-0.1366
Reddit,ethereum,2025-02-10 22:49:11,2025-02-11 00:52:33.334010,client testing call 24 february 10 2025 protocol call happening,0.0,0.0,0.0
Reddit,ethereum,2025-02-10 23:32:44,2025-02-11 00:52:33.334010,whats point staking fall nothing downside trajectory staking reward show abatementive read comment stabilizing eventually isnt becoming one lowest yielding staking asset crypto incentivizing,0.8452,0.45,0.6476
Reddit,ethereum,2025-02-09 07:01:23,2025-02-11 00:52:33.334010,daily general discussion february 09 2025welcome ethereum daily general discussion rethereum httpsimgurcom3y7vezphttpsimgurcom3y7vezp bookmarking link always bring current daily httpsoldredditcomrethereumaboutstickynum2httpsoldredditcomrethereumaboutstickynum2 please use thread discus ethereum topic news event even price price discussion posted elsewhere subreddit continue removed always constructive subreddit ruleshttpswwwredditcomrethereumaboutrules want stake learn rethstaker ethfinance ethereum community link ethereum jobshttpsethereumorgencommunitygetinvolvedethereumjobs twitterhttpsxcomethereum evmavericks youtubehttpswwwyoutubecomevmavericks discordhttpsdiscordggevmavericks doots podcasthttpsevmaverickslibsyncom doots websitehttpsdailydootscom old reddit doots extensionhttpsgithubcometheralphaethfinanceextension uhanniabu calendar jan 20 ethereum protocol attackathonhttpsblogethereumorg20241125ethereumprotocolattackathon end jan 3031 ethereumzurichhttpsethereumzurich conference feb 79 eth oxfordhttpsethoxfordio hackathon feb 1016 ethiopiahttpsethiopiaxyz conference hackathon feb 23 mar 2 ethdenverhttpswwwethdenvercom mar 2830 eth pondyhttpswwwethpondyxyz puducherry hackathon apr 13 ey global blockchain summit person virtual,0.3818,0.025000000000000005,0.2034
Reddit,ethereum,2025-02-10 16:53:59,2025-02-11 00:52:33.334010,encrypted private key safe tryna see fund safe notim wondering encrypting private key safe let know guy think httpspreviewredditnglr529mdcie1pngwidth884formatpngautowebps1383d1bbce768c61a80d02cd688c8290e2fcec92,0.8271,0.21428571428571427,0.5206928571428571
Reddit,ethereum,2025-02-08 19:47:38,2025-02-11 00:52:33.334010,tornado cash cofounder released prison,-0.5106,0.0,-0.2553
Reddit,ethereum,2025-02-09 16:04:32,2025-02-11 00:52:33.334010,ethereum sentive got old coinomi wallet wanted send coinbase sent trial amount never arrived idea never went,0.0,0.1,0.05
Reddit,ethereum,2025-02-08 16:08:21,2025-02-11 00:52:33.334010,erc programmatically derived address improved scaleability reduced cost easier devhey submitted erc pda pda super powerful regarding compute cost storage optimization somewhat bound iron triangle decentralization shrink entire triangle efficiency improvement structural innovation read ethereum magician post pr httpsethereummagiciansorgtnewercprogrammaticallyderivedaddressespdas22800,0.9694,0.2111111111111111,0.5902555555555555
Reddit,ethereum,2025-02-08 07:01:34,2025-02-11 00:52:33.334010,daily general discussion february 08 2025welcome ethereum daily general discussion rethereum httpsimgurcom3y7vezphttpsimgurcom3y7vezp bookmarking link always bring current daily httpsoldredditcomrethereumaboutstickynum2httpsoldredditcomrethereumaboutstickynum2 please use thread discus ethereum topic news event even price price discussion posted elsewhere subreddit continue removed always constructive subreddit ruleshttpswwwredditcomrethereumaboutrules want stake learn rethstaker ethfinance ethereum community link ethereum jobshttpsethereumorgencommunitygetinvolvedethereumjobs twitterhttpsxcomethereum evmavericks youtubehttpswwwyoutubecomevmavericks discordhttpsdiscordggevmavericks doots podcasthttpsevmaverickslibsyncom doots websitehttpsdailydootscom old reddit doots extensionhttpsgithubcometheralphaethfinanceextension uhanniabu calendar jan 20 ethereum protocol attackathonhttpsblogethereumorg20241125ethereumprotocolattackathon end jan 3031 ethereumzurichhttpsethereumzurich conference feb 79 eth oxfordhttpsethoxfordio hackathon feb 1016 ethiopiahttpsethiopiaxyz conference hackathon feb 23 mar 2 ethdenverhttpswwwethdenvercom mar 2830 eth pondyhttpswwwethpondyxyz puducherry hackathon apr 13 ey global blockchain summit person virtual,0.3818,0.025000000000000005,0.2034
Reddit,ethereum,2025-02-08 17:26:09,2025-02-11 00:52:33.334010,yield farming beginnerssomeone asked yield farming recommendation yesterday daily thought id open thread im sure people interested id love hear experience recommendation protocol project strategy keeping track deposit moving fund yield good avoiding tax headache resource learning protocol project saw mentioned aave yearn beefy convex pendle resource httpsdefillamacomyieldshttpsdefillamacomyields httpsswapdefillamacomtabearnhttpsswapdefillamacomtabearn ill add list based recommendation thread personally think id like something usdc want split smallish amount couple different protocol low risk low yield also bit experimental im ready loose money mainly want try stuff im germany ideally make tax complete nightmare crab market yield farming lfg,0.8271,0.17051282051282052,0.49880641025641026
Reddit,ethereum,2025-02-08 22:10:46,2025-02-11 00:52:33.334010,find cofounder deployed evm based apphey rethereum recently built deployed smart contract based crypto service application several network mostly ethereum l2s im looking marketing cofounder partner mostly handle technical aspect development programming managing app im good getting word advice find best potential marketing partner without risking getting cheated,0.9255,0.3238095238095238,0.6246547619047619
Reddit,ethereum,2025-02-08 00:12:37,2025-02-11 00:52:33.334010,peepaneip fast confirmation rule ethereumwith roberto saltini fast confirmation rule ethereumhttpswwwyoutubecomwatchvdzuch22mky new ethereum research could significantly reduce block confirmation time 12 second watch deep dive roberto saltinihttpswwwlinkedincomcompany19023828adminpagepostspublished pooja rhttpswwwlinkedincomcompany19023828adminpagepostspublished peepaneip httpswwwyoutubecomwatchvdzuch22mkyhttpswwwyoutubecomwatchvdzuch22mky,-0.4404,0.1518939393939394,-0.14425303030303033
