MainSource,Source,Publication Date,Pull_date,Pre-Processed Text,Sentiment_Vader,Sentiment_TextBlob,Average_Sentiment
Reddit,solana,2024-09-13 18:22:17,2024-09-17 12:17:31.205866,colosseumorg supported regolith lab team preseed seed raise 3m accelerate development ore ecosystemsource httpsxcomcolosseumorgstatus1834653107646529728httpsxcomcolosseumorgstatus1834653107646529728 thrilled support hardhatchadhttpsxcomhardhatchad regolith lab team preseed seed market nonsovereign sov asset native scalable blockchains massive ore community forming around project shipping fast see mine httpsxcomoresupplystatus1834638295277694984httpsxcomoresupplystatus1834638295277694984 httpspreviewredditl6d3spukcmod1pngwidth599formatpngautowebpsc1f16278acdb836d80052db570376a770f45ea54,0.8555,0.26666666666666666,0.5610833333333334
Reddit,solana,2024-09-13 15:26:17,2024-09-17 12:17:31.205866,wormhole brings world id solana new world id integration take globallysource httpsxcomworldcoinstatus1834577701182566472httpsxcomworldcoinstatus1834577701182566472 big day ai big day human wormholehttpsxcomwormhole brings world id solanahttpsxcomsolana httpspreviewredditcc2pm0j4hlod1pngwidth680formatpngautowebps70218263110c428e97ab52efa02e1677a7c18e9c httpsworldcoinorgblogannouncementswormholebringsworldidsolananewintegrationstakeoffgloballyhttpsworldcoinorgblogannouncementswormholebringsworldidsolananewintegrationstakeoffglobally httpspreviewredditvrj87rt6hlod1pngwidth680formatpngautowebpsed3b2dc9284bbf9fe7def17979e3fb8403aad5b5,0.0,0.03409090909090909,0.017045454545454544
Reddit,solana,2024-09-13 08:11:34,2024-09-17 12:17:31.205866,pump dot fun official program idshello trying code pumpfunhttppumpfun bot buy sell token via j trouble coming official program id someone please help provide official program id pumpfun,0.6808,0.04999999999999999,0.36539999999999995
Reddit,solana,2024-09-13 11:58:51,2024-09-17 12:17:31.205866,insider trading bot photonis insider someone bought pumpfun,0.0,0.0,0.0
Reddit,solana,2024-09-12 23:37:10,2024-09-17 12:17:31.205866,token exchange listing notificationsi received significant amount new coin promotional airdrop coin launched app use get notified coin get listed exchange,0.3182,0.2556818181818182,0.2869409090909091
Reddit,solana,2024-09-12 22:41:04,2024-09-17 12:17:31.205866,best bundler pfmoonshothi anyone done bundled launch whats best way without risk getting dumped sniper etc many thanks,0.9368,0.675,0.8059000000000001
Reddit,solana,2024-09-13 01:10:45,2024-09-17 12:17:31.205866,crypto trading signal solana find use effectivelywhen buy sell hold crypto tough decision make thats signal often provide entry point take profit stoploss level based different indicator here find use signal benefit crypto trading signal reduced emotional decisionmaking signal help minimize impulsive trading decision opportunity identification offer insight potential trade directly improved trading rate beneficial new experienced trader providing idea save time effort find quality signal provider avoid unrealistic claim cautious provider promising 100 accuracy scammer trying signal scam token take firstvalue announced win rate calculate win rate signal source statistic look proven record choose provider verified track record doublecheck metric experimentation check community feedback research trader think source reading feedback community practical tip effective use verify signal analyze confirm signal acting start demo test signal demo account spreadsheet trading real asset understand macro basic signal paired macro understanding take new level take time master fundamental find right signal strategy,0.9823,0.1864442746795688,0.5843721373397843
Reddit,solana,2024-09-12 14:35:16,2024-09-17 12:17:31.205866,anticipating breakpoint 2024title,0.0,0.0,0.0
Reddit,solana,2024-09-12 17:11:10,2024-09-17 12:17:31.205866,find legit aird huntadmin would please let slide legit couldnt find anywhere else ask youtubers twitter guy seems paid pushing weird project subreddits tried ask insta delete post small introduction newbie crypto space recently got cryptic madness thro telegram could see one make good amount money hunting airdrop free since brokie seems like good opportunity legit clue look check legit info guy could please take time explain simply tell look way go check source tell,0.9246,0.14999999999999997,0.5373
Reddit,solana,2024-09-12 21:25:07,2024-09-17 12:17:31.205866,phantom support localnet solana beginner set localnet using solanacli trying connect phantom show option localnet test network able detect local_wallets phantom support localnet httpspreviewreddit6xbj9dub4god1pngwidth449formatpngautowebps020020c01466377c2ab8a2f71c5593bdcdf9556b httpspreviewredditxv49108c4god1pngwidth447formatpngautowebpsfd68f59d41019f0f186b911cf58339ea1e1d194f,0.6597,0.5,0.57985
Reddit,solana,2024-09-12 18:31:05,2024-09-17 12:17:31.205866,help solnet csharpsolanaim looking working example swap sol token csharp appropriate place ask kind question thanks lot,0.8402,0.43333333333333335,0.6367666666666667
Reddit,solana,2024-09-13 11:00:56,2024-09-17 12:17:31.205866,solana content creator pls comment something saytitle say jt,0.296,0.0,0.148
Reddit,solana,2024-09-12 19:42:24,2024-09-17 12:17:31.205866,whats different jito bundled transaction v multi instruction transactionif add multiple instruction transaction execute whats point jito bundle,0.0,0.0,0.0
Reddit,solana,2024-09-12 16:54:42,2024-09-17 12:17:31.205866,trade stable coin like usdc usdt eurihi guy currently want switch broker binance saw people use usdc usdt euri stable coin trading feel confused stable coin like dollar euro people direct trade dollar euro,0.8225,-0.10000000000000002,0.36125
Reddit,solana,2024-09-12 16:46:25,2024-09-17 12:17:31.205866,crypto solana wallet mfa multifactor authentication worth itsecurity crypto cant neglected dont use 2fa multifactor authentication mfa need catch fast type mfa biometrics use facial recognition fingerprint physical usb key physical device verification like yubikey google authenticator app provides timesensitive code secure access onetime call message additional layer verification common 2fa benefit multifactor authentication better security crypto wallet reduces risk unauthorized access protects investment adding multiple layer security measure would common threat prevention phishing attack use strong password avoid public wifi ensure youre visiting official link website social medium protect phishing malware threat equip good antivirus malware detector prevent malware accessing private key keyloggers pc use task manager detect keylogger installed malware application automatically detect like malwarebytes browser vulnerability avoid storing sensitive data general browser never save password browser directly save password manager way dont give away password get hacked look lastpass use hardware wallet enable twofactor authentication laziness timesaving bad excuse enabling mfa trading success worth,0.9481,0.08611111111111112,0.5171055555555556
Reddit,solana,2024-09-12 20:03:05,2024-09-17 12:17:31.205866,solana changelog september 11 professional education deprecated rpc method reduced default cu per inst,0.0,0.1,0.05
Reddit,solana,2024-09-12 19:57:12,2024-09-17 12:17:31.205866,colosseum codex solana boston breakpoint agenda metadao reportsource httpsblogcolosseumorgsolanabostonbreakpointagendametadaohttpsblogcolosseumorgsolanabostonbreakpointagendametadao solana boston breakpoint agenda finternet blockworks metadao report solana foundation rfps httpspreviewredditjc7m3s1nofod1pngwidth960formatpngautowebps5c0b8372c9ac2d391b2d1f159f85596c5ee3ccf5 solana boston solana boston firstever solana city conference u take place october 19 2024 mit medium lab hosted boston dao supported solana foundation event place usbased developer connect learn grow together happening month breakpoint solana boston hope extend momentum stateside speaker applicationshttpsdocsgooglecomformsde1faipqlscgovuhkjygpbaaas_14ifkxjhsnlbd9dknqlpsrjbx5khiqviewformrefblogcolosseumorg open solana bostonhttpswwwsolanabostoncomrefblogcolosseumorg breakpoint agenda breakpoint agenda announced session across three key theme left curve track focus culture product fireside chat raj gokal balaji srinivasan discussing solana network state highlight include update firedancer debate crypto east v west product keynote ecosystem founder like fp lee sanctum siong jupiter right curve deep dive tech featuring session sandwichresistant amms handson solana action blink zk compression major highlight toly mert discussing solana 20 ecosystem activation connect community pod attend workshop level radar hackathon project colosseum arenahttpsblogcolosseumorgannouncingcolosseumshackathonarenaatsolanabreakpoint2024 blockworks metadao report report blockworks explores metadao leverage futarchy improve governance early result potential governance model hold daos seeking align decisionmaking financial incentive futarchy protocol proposed metadao address flaw dao governance misaligned incentive inefficient decisionmaking leveraging conditional market futarchy turn speculation tool let market participant bet outcome proposal based believe decision positively affect token market value trader evaluate impact decision based data rather pure opinion ideology outcome could lead valuedriven decision daos metadao pioneering approach directly applying governance making platform case study futarchybased decisionmaking however model still experimental phase 675k market volume 15 proposal liquidity participation level remain modest without sufficient trading volume participation market may produce reliable signal key success futarchy successful futarchy could improve dao governance also attract wider adoption across solana particularly among organization seeking efficient decisionmaking process metadao market incentive improved decisionmakinghttpsxcomblockworksresstatus1833898041059024989refblogcolosseumorg finternet solana finternethttpswwwbisorgpublwork1178pdfrefblogcolosseumorg initiative create global network tokenized asset stablecoins stock nfts user transact anyone worldwide support goal solana foundation announced 1m grant program developer founder policy professional contributing building finternet solana grant range 1000 10000 focus area like user application token management tool authentication wallet unified ledger infrastructure solana foundation finternet instagrantshttpsearnsuperteamfungrantsfinternetgrantsrefblogcolosseumorg solana foundation rfps solana foundation announced two new rfps aimed driving development open source data tooling solana blockchain 160000 available funding solana indexer tooling rfp offer 100000 funding develop opensource infrastructure solution accessing realtime historical data solana program account deliverable include tool indexing realtime historical update set account program using anchor idls feature like account tracking program listener transaction index integration luzid local validator solana discriminator directory rfp provides 60000 funding create opensource discriminator database aim enable developer interact unknown deployed program parse instruction goal build comprehensive solution simplifies developer access manage program discriminator solana making easier work program whose detail may fully known accessible proposed solution includes development api allows developer fetch program discriminator access communitymanaged dataset dataset allow user upload discriminator making available others structured format rfps open submission october 4 2024 solana foundation rfpshttpsairtablecomapppdmk2pin9wx8jvshrdbfj1wktq7pb6ftbli2erm3sdhyhjybrefblogcolosseumorg quick hit solana get physical depin httpswwwbanklesscomsolanagetsphysicalwithdepinrefbanklessghostio bankless blurt developer think crypto make better donation twitch streamershttpswwwcoindeskcombusiness20240906blurtdeveloperthinkscryptomakesforbetterdonationstotwitchstreamersrefblogcolosseumorg coindesk ironforge add improvement including new firewall product system status pagehttpswwwironforgecloudblogchangelogseptember42024refblogcolosseumorg ironforge godot solana sdk smart contract video serieshttpswwwyoutubecomplaylistlistplcjmwjxnd40dzpk9dbg0mmvekdbyc2cwcrefblogcolosseumorg zen republic state depin growth evolution cryptos next big use casehttpsapphubspotcomdocuments45150296view874288247accessid17ee67refblogcolosseumorg mv global fetch parsed solana transaction faster bulkhttpsblogsshyfttohowtofetchparsedsolanatransactionsfasterandinbulk911f37a3b6d0refblogcolosseumorg shyft callisto support solana blink inside discordhttpsxcomcallisto_walletstatus1830994152395342308refblogcolosseumorg ucallisto_wallet funding drip raised 8 million seed funding roundhttpswwwtheblockcopost315270solanadripraises8millionusdrefblogcolosseumorg led nfx coinbase venture progression fund funding accelerate launch drip mobile app tool help creator engage directly audience get hired chorus one hiring software engineer producthttpscareerschorusoneosoftwareengineerproductgh_srcsolananetworkopportunitiesjobboardrefblogcolosseumorg nous research hiring protocol engineerhttpsjobssolanacomcompaniesnousresearchjobs40285836protocolengineerrefblogcolosseumorgcontent neon evm hiring leadsenior engineer rustchttpsjobssolanacomcompaniesneonevm2jobs40184264leadseniorengineerrustcrefblogcolosseumorgcontent listen lightspeed episode dan smith blockworks research discus l2 mev extraction blockworks research solana dashboard total economic value solana additionally conversation cover validators earn revenue mev supporting small validators sanctum recent lst partnership whether nfts ever make comeback unpacking solanas total economic value dan smithhttpsblockworkscopodcastlightspeed2855f9ec6f1311ef927b6316b1f54540refblogcolosseumorg bonus episode ionet internet gpushttpswwwyoutubecomwatchvtoxie1sq_xalistpl7xazdz_x_hliiipskou1nqxnovrdzw1index2refblogcolosseumorg brave new coin tory green cofounder ceo ionet internet gpus largescale ai startup ionet decentralized gpu network designed unlock fair access computing power assembling 1m gpus independent data center crypto miner crypto project filecoin render crypto fix internet monopoly neil chatterjee dawn andrenahttpsblockworkscopodcastempirecb69d42c6f2311ef80c3cb4bd32154d7refblogcolosseumorg empire episode neil chatterjee founder dawn explains current state internet infrastructure hidden cost behind isp pricing role solana dawn ecosystem broader vision future depin project follow mikehalehttpstwittercommikehalerefblogcolosseumorg x warpcasthttpswarpcastcommikehalerefblogcolosseumorg thanks reading hope found something useful suggestion feedback let know think x200b,0.9989,0.11477089294885905,0.5568354464744295
Reddit,solana,2024-09-12 13:57:32,2024-09-17 12:17:31.205866,optimal wallet trait tip copy trading solana solid roi aim wallet roi 100 increase change success even percentage lost due copy trade bot delay high winrate look win rate 60 indicates trader consistent profitable trade combine roi winrate clear picture profitability low buy amount easier manage trader average buy per trade le 3 copy trade bot usually 2 setting buy 1 fixed amount sol 2 percent trader buy case youll get high level spread position trade trade choose wallet make lot buy transaction per trade longer trade duration trade held minute easier copy le dependence microscale price change realistic expectation copying trade doesnt guarantee identical result factor like bot speed blockchain congestion market cap original trader buy size affect outcome final tip start small test result positive gradually increase position size use different telegram account clear statistic trader copy track journey paper use excelgoogle sheet,0.9834,0.10336523125996812,0.5433826156299841
Reddit,solana,2024-09-12 18:58:28,2024-09-17 12:17:31.205866,syndica deep dive solana defi august 2024source httpsxcomsyndica_iostatus1833970697766662346httpsxcomsyndica_iostatus1833970697766662346 1 august saw significant growth solanahttpsxcomsolana defi sol locked defi perp dex volume reaching aths meanwhile interest memecoins finally slowed dominant year dive onchain data full thread report httpsblogsyndicaiodeepdivesolanadefiaugust2024httpsblogsyndicaiodeepdivesolanadefiaugust2024utm_sourcetwitterutm_mediumblogutm_campaignresearchutm_id1utm_contentaugustdefi24 httpspreviewredditg26nbpfecfod1pngwidth680formatpngautowebps9ec1c1edf4f152f37b0fb3295b366718360b4f12 2 sol locked solanahttpsxcomsolana defi protocol reached ath 76m raydiumprotocolhttpsxcomraydiumprotocol command highest amount sol locked among defi protocol jupiter perps close second httpspreviewredditt63maafhcfod1pngwidth680formatpngautowebps6f1d9bd21b42f8ed88f8b9375b55ce978cb27a32 3 including liquid staking sol locked solanahttpsxcomsolana defi hit ath 33m currently 57 entire sol supply locked defi httpspreviewredditeniew5ejcfod1pngwidth680formatpngautowebps7fd809eb079bd980cc722ce7834e46ce452e13fc 4 dex market cooled august dex volume declined 31 settle 48b httpspreviewredditterart7lcfod1pngwidth680formatpngautowebps6a98c8fcc6c4c4715b8bb13a00d388e8e24a625e 5 interest memecoins tapered memecoins previously dominated spot dex volume account little half dex volume httpspreviewreddithpi4hh1ncfod1pngwidth680formatpngautowebpsf42ac103f4cd43769371673f140f42440f15f166 6 memecoin market showing sign exhaustion date 192m cumulative unique memecoins launched pumpdotfunhttpsxcompumpdotfun rate new token creation cooling may high httpspreviewredditeipd107pcfod1pngwidth680formatpngautowebps9e9db18658c82f5660931a58d048577175878f5a 7 99 memecoins launched pumpdotfunhttpsxcompumpdotfun fail reach raydium despite new memecoin launch month fail achieve 69k market cap required graduation listing raydium httpspreviewredditdrww53drcfod1pngwidth679formatpngautowebpsb43c3597818148e133877f577268875ce7f027a8 8 jupiterexchangehttpsxcomjupiterexchange perps volume reached new ath 175b protocol adjusted fee remain competitive cexes httpspreviewredditc1op7qitcfod1pngwidth680formatpngautowebps892812433bb95aec5f2c9850dc7653bc821be3c3 9 solanahttpsxcomsolana perp dexes growing blistering pace tvl perp dexes also reached new ath 82m sol growing almost 4x since january httpspreviewreddituflz21ovcfod1pngwidth680formatpngautowebps8a2985f55bf51b121bc7961d8a9383d45d5785c8 10 driftprotocolhttpsxcomdriftprotocols bet prediction market already shown sign pmf launched august 19th new betting platform saw nearly 6k bet placed first two week active market focus whether trump win 2024 u presidential election httpspreviewredditkf64nmlxcfod1pngwidth680formatpngautowebps80c18527dec3d233e6b22d69ad2d2360efab8209 11 solanahttpsxcomsolana lending tvl reached new ath 14m sol tvl broke 5month stagnation period surge kaminofinancehttpsxcomkaminofinance httpspreviewredditqs50chszcfod1pngwidth680formatpngautowebps2c3c8aab32ef65d78898b9c62f44d4034f63ca54 12 kaminofinancehttpsxcomkaminofinance continued dominate solana lending protocol command twothirds overall lending tvl share httpspreviewredditdh896id2dfod1pngwidth680formatpngautowebps6b615c3dc96efa3cde6d21ed2804a8062b22a32a 13 lending market follows winnertakesmost dynamic aave eth kamino sol command 23 lending tvl share respective blockchains benefiting network effect higher tvl make platform appear safer attracting user deposit httpspreviewreddit1z1m9ga4dfod1pngwidth680formatpngautowebps8ff3d234dc120e914b905ce77b1d72d17f4b887a 14 solanahttpsxcomsolana stablecoin market cap returned preftx level stablecoin adoption steadily increased throughout 2024 completing resurgence two year making httpspreviewredditecvjmna6dfod1pngwidth680formatpngautowebps5688ad158fb0da970c995fc0b342ff5a97657867 15 pyusd experienced first pullback market cap peaked 647m experiencing first notable drawdown 561m attributed decline pyusd incentive across various defi protocol httpspreviewredditld2uaie8dfod1pngwidth680formatpngautowebps5a348168c4e7a8992c26bdc958047b744014ff65 16 orca_sohttpsxcomorca_so driftprotocolhttpsxcomdriftprotocol marginfihttpsxcommarginfi emerged capture pyusd supply distribution 86 pyusd held defi protocol kaminofinancehttpsxcomkaminofinance still commanding 68 pyusd supply httpspreviewreddit1praacbbdfod1pngwidth680formatpngautowebps867bbc01c5d8991f0859c978e334188fbddc50ea 17 solanahttpsxcomsolanas pyusd supply exceeds ethereum counterpart httpspreviewredditreccdlpddfod1pngwidth679formatpngautowebps90fe9b1639ba62e43774d156b6938c51e8b50112 18 uselulohttpsxcomuselulos directed liquidity hit new ath mom growth continues skyrocket lulos directed liquidity hitting 34m pyusd became directed asset platform surpassing usdc httpspreviewredditrb9dhh9gdfod1pngwidth680formatpngautowebps432e43533af073711f35b11702c2ca850a54699d 19 sanctumsohttpsxcomsanctumso lsts pushed liquidstaking tvl past 25m sol mark 17 total liquid staking tvl comprised sanctum lsts keep eye figure tier1 cexes like binancehttpsxcombinance bybit_officialhttpsxcombybit_official launch sanctum lsts httpspreviewreddithxrgywwidfod1pngwidth680formatpngautowebps1a6ce2146c200ed0c0efa3036707d16e827cb105 20 august project watch include renzoprotocolhttpsxcomrenzoprotocol expanding solana thevaultfinancehttpsxcomthevaultfinance pathfinders__httpsxcompathfinders__ deficarrothttpsxcomdeficarrot httpspreviewreddit3fbl3ikldfod1pngwidth680formatpngautowebps801c733fe02ef22101ee594b8650f607188ec45c 21 read full report learn httpsblogsyndicaiodeepdivesolanadefiaugust2024httpsblogsyndicaiodeepdivesolanadefiaugust2024utm_sourcetwitterutm_mediumblogutm_campaignresearchutm_id1utm_contentaugustdefi24,0.9878,0.10883906633906634,0.5483195331695332
Reddit,solana,2024-09-12 12:30:10,2024-09-17 12:17:31.205866,genuine question cashouthello best way cashout larger amount crypto winning better transfer usdt cash always wondered thank advance,0.9186,0.48,0.6993
Reddit,solana,2024-09-12 20:01:54,2024-09-17 12:17:31.205866,brave new coin podcast internet gpus tory green cofounder ceo ionet,0.5267,0.24545454545454545,0.3860772727272727
Reddit,solana,2024-09-12 14:02:59,2024-09-17 12:17:31.205866,wallet address exchange g2yxra6wt1qepmwfjzdxzg62ej4qatc7yurzuh2lwd3tg2yxra6wt1qepmwfjzdxzg62ej4qatc7yurzuh2lwd3thttpssolscanioaccountg2yxra6wt1qepmwfjzdxzg62ej4qatc7yurzuh2lwd3t hi curious anyone identify solana wallet address transfer make look like exchange say thanks,0.7717,0.05,0.41085000000000005
Reddit,solana,2024-09-12 08:50:10,2024-09-17 12:17:31.205866,bullx_io_bot drained phantom walletdear reader today trying connect wallet bullx_io_bot drained phantom wallet checked transaction sol scan link enclosed show detail could anyone please look matter explain happened telegram bot suppose transferdrain fund kind malicious act please advise resolve issue get back fund tried contact bullxio official website however couldnt reach helpsupport link sent connect wallet page connect telegram etc please help httpssolscaniotx3h1xt86add9natqqe8lqc9jj2zkyev4ye7tdetkbnb4xraf297ebtzsc6erdfubbfrusfbpbgtzacmyc98d6pcrvhttpssolscaniotx3h1xt86add9natqqe8lqc9jj2zkyev4ye7tdetkbnb4xraf297ebtzsc6erdfubbfrusfbpbgtzacmyc98d6pcrv,0.8633,0.3,0.58165
Reddit,solana,2024-09-13 04:48:36,2024-09-17 12:17:31.205866,cheapest way trade solana memecoinsi normally use bot trade telegram photon bullx think trade avoid 1 buy 1 sell platform fee somehow wondering cheaper swap photon wallet trade directly jupiter another way trade really cheap avoid fee without much complexity,-0.5688,0.21250000000000002,-0.17814999999999998
Reddit,solana,2024-09-12 10:03:03,2024-09-17 12:17:31.205866,plz help nft scamive received couple recently wondering anybody experience buy wolf recently didnt burn instantly,0.4588,0.0,0.2294
Reddit,solana,2024-09-12 12:44:48,2024-09-17 12:17:31.205866,cost effective way listen transaction raydiumi need efficient easy set way listen transaction raydium communicate solana program swap detail wallet address amount swapped intend monitor one pool spl im going launch suggestion,0.8316,0.5166666666666666,0.6741333333333333
Reddit,ethereum,2024-09-03 14:41:57,2024-09-17 12:17:31.205866,ama ef research pt 12 05 september 2024notice closed thank participating look forward soon member ethereum foundation research team back answer question throughout day 12th amahttpsredditzendeskcomhcenusarticles115002427523whatisanamaandwhywouldihostone lot member taking part keep question coming enjoy click view 11th ef research team amahttpswwwredditcomrethereumcomments191kke6ama_we_are_ef_research_pt_11_10_january_2024 jan 2024 click view 10th ef research team amahttpswwwredditcomrethereumcomments14vpyb3ama_we_are_ef_research_pt_10_12_july_2023 july 2023 click view 9th ef research team amahttpswwwredditcomrethereumcomments107cqi8ama_we_are_ef_research_pt_9_11_january_2023 jan 2023 click view 8th ef research team amahttpswwwredditcomrethereumcommentsvrx9xeama_we_are_ef_research_pt_8_07_july_2022 july 2022 click view 7th ef research team amahttpswwwredditcomrethereumcommentsrwojtkama_we_are_the_efs_research_team_pt_7_07_january jan 2022 click view 6th ef research team amahttpswwwredditcomrethereumcommentso4unlpama_we_are_the_efs_research_team_pt_6_23_june_2021 june 2021 click view 5th ef research team amahttpswwwredditcomrethereumcommentsjvkoatama_we_are_the_efs_eth_20_research_team_pt_5_18 nov 2020 click view 4th ef research team amahttpswwwredditcomrethereumcommentsho2zptama_we_are_the_efs_eth_20_research_team_pt_4_10 july 2020 click view 3rd ef research team amahttpswwwredditcomrethereumcommentsez972uama_we_are_the_eth_20_research_team_pt_3 feb 2020 click view 2nd ef research team amahttpswwwredditcomrethereumcommentscdg8v6ama_we_are_the_eth_20_research_team_pt_2 july 2019 click view 1st ef research team amahttpswwwredditcomrethereumcommentsajc9ipama_we_are_the_eth_20_research_team jan 2019 x200b ama concluded,0.6908,0.06000000000000001,0.3754
