MainSource,Source,Publication Date,Pull_date,Pre-Processed Text,Sentiment_Vader,Sentiment_TextBlob,Average_Sentiment
GoogleNews,New Crypto Projects,3 days ago,2025-02-11 00:52:33.334010,100 fxguys fxg shiba inu cardano expected rise 10000 later year ahead bull runas crypto market prepares next surge year new opportunity come fxguys fxg shiba inu shib cardano ada seem,0.4215,0.009090909090909087,0.21529545454545454
GoogleNews,New Crypto Projects,3 days ago,2025-02-11 00:52:33.334010,crypto whale 3 coinsfollow moneydiscover crypto whale investing ondo jup agent ai explore potential price prediction profit bullish trend,0.4404,0.0,0.2202
GoogleNews,New Crypto Projects,3 days ago,2025-02-11 00:52:33.334010,crypto presales pump three new altcoins set gainsdiscover three hot crypto presales solaxy mind pepe best wallet solaxy address solanas congestion issue innovative layer2 solution,0.8555,0.47159090909090906,0.6635454545454545
GoogleNews,New Crypto Projects,3 days ago,2025-02-11 00:52:33.334010,three altcoins buy go mainstream 2025currently presale new altcoins like wall street pepe solaxy best wallet stand unique feature wall street pepe raised 69,0.7717,0.5037878787878788,0.6377439393939395
GoogleNews,New Crypto Projects,3 days ago,2025-02-11 00:52:33.334010,top undervalued altcoins buy explodepopular cryptocurrencies like bitcoin ethereum high entry barrier leading investor seek new altcoins promising potential,0.6705,0.19927272727272727,0.4348863636363636
GoogleNews,New Crypto Projects,3 days ago,2025-02-11 00:52:33.334010,floki trading bot new crypto game launchfloki among memecoins top 100 cryptos market cap floki could explosive altcoin project 2025,0.2023,0.07878787878787878,0.1405439393939394
GoogleNews,New Crypto Projects,3 days ago,2025-02-11 00:52:33.334010,top 19 best crypto buy right february 20253 best cryptos buy right include solaxy solx mind pepe mind best wallet best,0.9618,0.7244897959183673,0.8431448979591836
GoogleNews,New Crypto Projects,3 days ago,2025-02-11 00:52:33.334010,best new cryptocurrencies invest 2025 top new crypto coinslooking new cryptocurrencies invest daunting task may beneficial done right one able buy upcoming crypto,0.836,0.38497217068645634,0.6104860853432281
GoogleNews,New Crypto Projects,3 days ago,2025-02-11 00:52:33.334010,17 best crypto presales invest february 2025 top token presaleexplore best crypto presales upcoming preico project 2025 discover top cryptocurrency presales invest,0.9001,0.75,0.8250500000000001
GoogleNews,New Crypto Projects,3 days ago,2025-02-11 00:52:33.334010,new ai blockchain project next big innovation cryptoif youre searching new ai blockchain project set reshape market youve come right,0.3818,0.11168831168831168,0.24674415584415582
GoogleNews,New Crypto Projects,3 days ago,2025-02-11 00:52:33.334010,revolutionizing crypto new wave ai blockchain projectsexplore cuttingedge ai blockchain project set revolutionize crypto market leading charge dawgz ai aipowered platform optimizing,0.4588,0.13636363636363635,0.29758181818181817
GoogleNews,New Crypto Projects,4 days ago,2025-02-11 00:52:33.334010,crypto ai agent struggle market cap drop 13 new token launch slumpcrypto ai agent market cap fell 13 major coin struggle engagement 60 raising concern fading investor interest,0.0735,0.09943181818181818,0.0864659090909091
GoogleNews,New Crypto Projects,4 days ago,2025-02-11 00:52:33.334010,new blockchainbased coin top crypto picksdiscover new blockchainbased coin including dawgz ai bringing ai trading staking reward real utility cryptocurrency market,0.6705,0.24318181818181817,0.4568409090909091
GoogleNews,New Crypto Projects,4 days ago,2025-02-11 00:52:33.334010,world liberty fi buy ondo ondo project launch new chain rwa tokenizationworld liberty fi reorganized reserve allocating 470k usdc buy new position ondo ondo ondo finance support made usa crypto trend,0.8591,0.13636363636363635,0.49773181818181816
GoogleNews,New Crypto Projects,3 hours ago,2025-02-11 00:52:33.334010,discover best new crypto presales set skyrocket 6 top investment opportunity 2025the crypto market buzzing new opportunity february 2025 shaping crucial month investor looking promising project,0.9231,0.32878787878787874,0.6259439393939394
GoogleNews,New Crypto Projects,6 hours ago,2025-02-11 00:52:33.334010,xrp continue bullish momentum xrp investor diversify new iot blockchain solutionripple xrp remained focal point crypto market due speed low transaction cost institutional adoption,-0.2732,0.0037878787878787845,-0.1347060606060606
GoogleNews,New Crypto Projects,6 hours ago,2025-02-11 00:52:33.334010,hot presale alert new emerging rexas finance rival could disrupt defi tokenizationthe defi tokenization landscape evolving rapidly new project emerging challenge dominance established player,0.5106,0.17424242424242423,0.3424212121212121
GoogleNews,New Crypto Projects,7 hours ago,2025-02-11 00:52:33.334010,coin rookie blend new crypto worldthe new u administration alter rule govern crypto good bad people starting,-0.1531,0.054545454545454564,-0.049277272727272725
GoogleNews,New Crypto Projects,2 hours ago,2025-02-11 00:52:33.334010,cryptoclicksio new youtube service aim revolutionize crypto project marketingnewry gb access newswire february 10 2025 cryptoclicksio launching january 29th 2025 introducing specialized youtube review service,0.0,0.13636363636363635,0.06818181818181818
GoogleNews,New Crypto Projects,3 hours ago,2025-02-11 00:52:33.334010,new crypto token beware price crash may inevitable listingcrypto analyst warns new token listing could see 80 price drop,-0.6369,0.0909090909090909,-0.27299545454545454
GoogleNews,New Crypto Projects,3 hours ago,2025-02-11 00:52:33.334010,ripple massive xrp move new crypto era dawningripple lab made significant acquisition xrp token indicating strategic shift aimed innovation expansion digital asset space,0.7096,0.1278409090909091,0.41872045454545453
GoogleNews,New Crypto Projects,5 hours ago,2025-02-11 00:52:33.334010,new crypto gaining attention solana polkadot fall favor investorsinvestor mood clearly changed creative solution like remittix taking center stage venture like polkadot disappearing,0.9468,0.1590909090909091,0.5529454545454545
GoogleNews,New Crypto Projects,1 day ago,2025-02-11 00:52:33.334010,sec new crypto task force gamechanger digital asset innovationthe sec shifting towards supporting digital asset innovation establishment crypto task force new leadership commissioner hester,0.8591,0.07784090909090909,0.46847045454545455
GoogleNews,New Crypto Projects,1 day ago,2025-02-11 00:52:33.334010,coin struggle new crypto making wave marketwhile coin struggle volatile market lightchain ai making wave blockchain ai integration drawing significant investor,-0.4215,0.2556818181818182,-0.0829090909090909
GoogleNews,New Crypto Projects,3 hours ago,2025-02-11 00:52:33.334010,discover best new crypto presales set skyrocket 6 top investment opportunity 2025the crypto market buzzing new opportunity february 2025 shaping crucial month investor looking promising project,0.9231,0.32878787878787874,0.6259439393939394
GoogleNews,New Crypto Projects,6 hours ago,2025-02-11 00:52:33.334010,xrp continue bullish momentum xrp investor diversify new iot blockchain solutionripple xrp remained focal point crypto market due speed low transaction cost institutional adoption,-0.2732,0.0037878787878787845,-0.1347060606060606
GoogleNews,New Crypto Projects,6 hours ago,2025-02-11 00:52:33.334010,hot presale alert new emerging rexas finance rival could disrupt defi tokenizationthe defi tokenization landscape evolving rapidly new project emerging challenge dominance established player,0.5106,0.17424242424242423,0.3424212121212121
GoogleNews,New Crypto Projects,7 hours ago,2025-02-11 00:52:33.334010,coin rookie blend new crypto worldthe new u administration alter rule govern crypto good bad people starting,-0.1531,0.054545454545454564,-0.049277272727272725
GoogleNews,New Crypto Projects,2 hours ago,2025-02-11 00:52:33.334010,cryptoclicksio new youtube service aim revolutionize crypto project marketingnewry gb access newswire february 10 2025 cryptoclicksio launching january 29th 2025 introducing specialized youtube review service,0.0,0.13636363636363635,0.06818181818181818
GoogleNews,New Crypto Projects,3 hours ago,2025-02-11 00:52:33.334010,new crypto token beware price crash may inevitable listingcrypto analyst warns new token listing could see 80 price drop,-0.6369,0.0909090909090909,-0.27299545454545454
GoogleNews,New Crypto Projects,3 hours ago,2025-02-11 00:52:33.334010,ripple massive xrp move new crypto era dawningripple lab made significant acquisition xrp token indicating strategic shift aimed innovation expansion digital asset space,0.7096,0.1278409090909091,0.41872045454545453
GoogleNews,New Crypto Projects,5 hours ago,2025-02-11 00:52:33.334010,new crypto gaining attention solana polkadot fall favor investorsinvestor mood clearly changed creative solution like remittix taking center stage venture like polkadot disappearing,0.9468,0.1590909090909091,0.5529454545454545
GoogleNews,New Crypto Projects,1 day ago,2025-02-11 00:52:33.334010,sec new crypto task force gamechanger digital asset innovationthe sec shifting towards supporting digital asset innovation establishment crypto task force new leadership commissioner hester,0.8591,0.07784090909090909,0.46847045454545455
GoogleNews,New Crypto Projects,1 day ago,2025-02-11 00:52:33.334010,coin struggle new crypto making wave marketwhile coin struggle volatile market lightchain ai making wave blockchain ai integration drawing significant investor,-0.4215,0.2556818181818182,-0.0829090909090909
GoogleNews,New Crypto Projects,1 day ago,2025-02-11 00:52:33.334010,rising new crypto star preparing rival sui sui tron trx investor get early huge gainsnew crypto project launched every new day rare thing see whats rare one newcomer rival established token like sui,0.6486,0.2287878787878788,0.43869393939393936
GoogleNews,New Crypto Projects,1 day ago,2025-02-11 00:52:33.334010,dogecoin face uncertainty remittix soar new crypto project outperform dogecoin 2025the world cryptocurrencies everevolving latest development surrounding dogecoin doge shiba inu shib remittix creating wave,-0.0516,0.3181818181818182,0.1332909090909091
GoogleNews,New Crypto Projects,2 days ago,2025-02-11 00:52:33.334010,best crypto presale project earlystage investment boomthe scene cryptocurrencies changing dramatically smart investor position ahead possible market growth,0.8591,0.4047619047619047,0.6319309523809523
GoogleNews,New Crypto Projects,2 days ago,2025-02-11 00:52:33.334010,new blockchainbased coin top crypto pick 2025the new blockchainbased coin entering cryptocurrency market introducing fresh opportunity investor trader new crypto,0.7096,0.2418181818181818,0.4757090909090909
GoogleNews,New Crypto Projects,2 days ago,2025-02-11 00:52:33.334010,better buy february xrp sol new crypto rblknew crypto project launch almost daily yet established giant like xrp sol continue dominate market classic battlefresh innovation,0.7579,0.16060606060606059,0.45925303030303033
GoogleNews,New Crypto Projects,2 days ago,2025-02-11 00:52:33.334010,best new crypto invest 3 hidden gem 2025looking next big crypto investment discover three promising cryptocurrencies including web3baya decentralized ecommerce project offering staking,0.7845,0.19494949494949496,0.4897247474747475
GoogleNews,New Crypto Projects,2 days ago,2025-02-11 00:52:33.334010,pepe 20 new meme coin gaining unstoppable hypediscover buzz around pepe 20 newest meme coin taking crypto world storm learn unstoppable token capturing investor,0.0516,0.13636363636363635,0.09398181818181818
GoogleNews,New Crypto Projects,2 days ago,2025-02-11 00:52:33.334010,dont miss arctic pablo lead best new meme coin buy 2025invest 0000054 price soar dogwifhat slerfhave ever wondered meme coin set dominate 2025 countless new crypto project launching rise rest attracting,0.8044,0.3181818181818181,0.5612909090909091
GoogleNews,New Crypto Projects,2 days ago,2025-02-11 00:52:33.334010,crypto top 10 contender cardano tron place threat new altcoin compared xrpgetting best crypto invest last month proven big struggle explosion number project hitting market,0.2732,0.32727272727272727,0.30023636363636363
GoogleNews,New Crypto Projects,2 days ago,2025-02-11 00:52:33.334010,130 top crypto telegram channel listfrom trading signal price prediction airdrop news channel discussion group find various kind telegram channelsgroups concentrate,0.6369,0.3666666666666667,0.5017833333333334
GoogleNews,New Crypto Projects,3 days ago,2025-02-11 00:52:33.334010,new crypto outshine ripple xrp soar new heightsripple xrp recognized role international payment processing concern growth competition increasing,0.3818,0.0909090909090909,0.23635454545454543
GoogleNews,New Crypto Projects,3 days ago,2025-02-11 00:52:33.334010,10 best low market cap crypto buy 2025list top low market cap coin 2025 ionet peaq niero sushi paal ai illuvium magic eden hivemapper usual finance,0.4215,0.2916666666666667,0.35658333333333336
GoogleNews,New Crypto Projects,3 days ago,2025-02-11 00:52:33.334010,best blockchain project invest 2025explore best blockchain project invest including dawgz ai aipowered meme coin revolutionizing automated trading staking3 day ago,0.8555,1.0,0.9277500000000001
GoogleNews,New Crypto Projects,3 days ago,2025-02-11 00:52:33.334010,investor flocking new crypto wallet ico surge past 9mbest wallet best crossed 9 million ico investor seize project discovery tool pepe unchaineds pepu success drive early demand,0.8126,0.25727272727272726,0.5349363636363637
GoogleNews,New Crypto Projects,3 days ago,2025-02-11 00:52:33.334010,best blockchain project invest top pick 2025discover best blockchain project invest 2025 including dawgz ai top crypto investment aipowered trading staking reward,0.9403,0.75,0.8451500000000001
GoogleNews,New Crypto Projects,3 days ago,2025-02-11 00:52:33.334010,analyst predict new crypto make millionaire solana 2025a new digital currency capturing attention analyst amid current market surge buzz surround emerging cryptos potential outshine,0.0,0.05454545454545454,0.02727272727272727
GoogleNews,New Crypto Projects,3 days ago,2025-02-11 00:52:33.334010,100 fxguys fxg shiba inu cardano expected rise 10000 later year ahead bull runas crypto market prepares next surge year new opportunity come fxguys fxg shiba inu shib cardano ada seem,0.4215,0.009090909090909087,0.21529545454545454
GoogleNews,New Crypto Projects,3 days ago,2025-02-11 00:52:33.334010,crypto whale 3 coinsfollow moneydiscover crypto whale investing ondo jup agent ai explore potential price prediction profit bullish trend,0.4404,0.0,0.2202
GoogleNews,New Crypto Projects,3 days ago,2025-02-11 00:52:33.334010,crypto presales pump three new altcoins set gainsdiscover three hot crypto presales solaxy mind pepe best wallet solaxy address solanas congestion issue innovative layer2 solution,0.8555,0.47159090909090906,0.6635454545454545
GoogleNews,New Crypto Projects,3 days ago,2025-02-11 00:52:33.334010,three altcoins buy go mainstream 2025currently presale new altcoins like wall street pepe solaxy best wallet stand unique feature wall street pepe raised 69,0.7717,0.5037878787878788,0.6377439393939395
GoogleNews,New Crypto Projects,3 days ago,2025-02-11 00:52:33.334010,top undervalued altcoins buy explodepopular cryptocurrencies like bitcoin ethereum high entry barrier leading investor seek new altcoins promising potential,0.6705,0.19927272727272727,0.4348863636363636
GoogleNews,New Crypto Projects,3 days ago,2025-02-11 00:52:33.334010,floki trading bot new crypto game launchfloki among memecoins top 100 cryptos market cap floki could explosive altcoin project 2025,0.2023,0.07878787878787878,0.1405439393939394
GoogleNews,New Crypto Projects,3 days ago,2025-02-11 00:52:33.334010,top 19 best crypto buy right february 20253 best cryptos buy right include solaxy solx mind pepe mind best wallet best,0.9618,0.7244897959183673,0.8431448979591836
GoogleNews,New Crypto Projects,3 days ago,2025-02-11 00:52:33.334010,best new cryptocurrencies invest 2025 top new crypto coinslooking new cryptocurrencies invest daunting task may beneficial done right one able buy upcoming crypto,0.836,0.38497217068645634,0.6104860853432281
GoogleNews,New Crypto Projects,3 days ago,2025-02-11 00:52:33.334010,17 best crypto presales invest february 2025 top token presaleexplore best crypto presales upcoming preico project 2025 discover top cryptocurrency presales invest,0.9001,0.75,0.8250500000000001
GoogleNews,New Crypto Projects,3 days ago,2025-02-11 00:52:33.334010,new ai blockchain project next big innovation cryptoif youre searching new ai blockchain project set reshape market youve come right,0.3818,0.11168831168831168,0.24674415584415582
GoogleNews,New Crypto Projects,3 days ago,2025-02-11 00:52:33.334010,revolutionizing crypto new wave ai blockchain projectsexplore cuttingedge ai blockchain project set revolutionize crypto market leading charge dawgz ai aipowered platform optimizing,0.4588,0.13636363636363635,0.29758181818181817
GoogleNews,New Crypto Projects,4 days ago,2025-02-11 00:52:33.334010,crypto ai agent struggle market cap drop 13 new token launch slumpcrypto ai agent market cap fell 13 major coin struggle engagement 60 raising concern fading investor interest,0.0735,0.09943181818181818,0.0864659090909091
GoogleNews,New Crypto Projects,4 days ago,2025-02-11 00:52:33.334010,new blockchainbased coin top crypto picksdiscover new blockchainbased coin including dawgz ai bringing ai trading staking reward real utility cryptocurrency market,0.6705,0.24318181818181817,0.4568409090909091
GoogleNews,New Crypto Projects,4 days ago,2025-02-11 00:52:33.334010,world liberty fi buy ondo ondo project launch new chain rwa tokenizationworld liberty fi reorganized reserve allocating 470k usdc buy new position ondo ondo ondo finance support made usa crypto trend,0.8591,0.13636363636363635,0.49773181818181816
GoogleNews,New Crypto Projects,4 days ago,2025-02-11 00:52:33.334010,best blockchain project invest 2025discover best blockchain project invest including dawgz ai aipowered meme coin staking smart contract real growth potential4 day ago,0.9287,0.6035714285714286,0.7661357142857144
GoogleNews,New Crypto Projects,4 days ago,2025-02-11 00:52:33.334010,best crypto invest right top new coin reviewedthe crypto market mushroomed recent year digital asset found way many serious investment portfolio whether youre new,0.802,0.24723424723424717,0.5246171236171236
GoogleNews,New Crypto Projects,4 days ago,2025-02-11 00:52:33.334010,lightchain ai could profitable new cryptoheres need knowlightchain ai rapidly emerging one profitable new crypto project drawing strong investor interest innovative blend,0.9325,0.3015151515151515,0.6170075757575757
GoogleNews,New Crypto Projects,4 days ago,2025-02-11 00:52:33.334010,shiba inu solana drop 20 1st february new upcoming meme coin could take centre stage yearthe ongoing crypto selloff seen token bleed profit value top altcoins like shiba inu lost profit amassed new,0.7964,0.25757575757575757,0.5269878787878788
GoogleNews,New Crypto Projects,4 days ago,2025-02-11 00:52:33.334010,new sec crypto task force plan mean coinssec commissioner hester peirce new crypto task force floated bold idearetroactive relief token coin offering,0.6908,0.03871212121212121,0.3647560606060606
GoogleNews,New Crypto Projects,4 days ago,2025-02-11 00:52:33.334010,best crypto presales invest 4 new project could 100x 2025discover best crypto presales 2025 lightchain ai three project could 100x offering massive investment potential,0.8555,0.42727272727272725,0.6413863636363637
GoogleNews,New Crypto Projects,4 days ago,2025-02-11 00:52:33.334010,global payment processor stripe make billion dollar crypto bet best new crypto buy 2025stripe acquires bridge 11 billion interest surging wall street pepe raise 70 million viral wepe presale,0.802,0.37878787878787873,0.5903939393939394
GoogleNews,New Crypto Projects,4 days ago,2025-02-11 00:52:33.334010,new ai blockchain projectsexplore new ai blockchain project including dawgz ai aipowered trading coin reshaping crypto automation real financial potential,0.0,0.06818181818181818,0.03409090909090909
GoogleNews,New Crypto Projects,4 days ago,2025-02-11 00:52:33.334010,top 22 new upcoming binance listing 2025new binance listing often explode soon announcement becomes public meaning crypto investor know earliest stage,0.2023,0.21212121212121213,0.20721060606060607
GoogleNews,New Crypto Projects,4 days ago,2025-02-11 00:52:33.334010,depin top 11 depin crypto project 2025find everything need know top 10 depin decentralized physical infrastructure project latest guide,0.3818,0.375,0.37839999999999996
GoogleNews,Crypto Bullrun,,2025-02-11 00:52:33.334010,,0.0,0.0,0.0
GoogleNews,Crypto Bullrun,6 hours ago,2025-02-11 00:52:33.334010,vechain hedera holder buy bullrun 1fuel exchange launch surpassing 2mcrypto investor shifting strategy market dynamic change vechain vet hedera hbar continue expanding underwhelming token,0.3818,0.0,0.1909
GoogleNews,Crypto Bullrun,9 hours ago,2025-02-11 00:52:33.334010,crypto bull run trader predicts end 70 crashtrader warns crypto market peak altcoins drop 70,-0.3612,0.0,-0.1806
GoogleNews,Crypto Bullrun,0 hours ago,2025-02-11 00:52:33.334010,trader shift focus ozak ai ai dominates 2025 crypto bull runozak ai oz represents ai innovation project attracts trader interested highgrowth investment investor seek emerging aibased,0.802,0.25,0.526
GoogleNews,Crypto Bullrun,5 hours ago,2025-02-11 00:52:33.334010,here 3 reason crypto bull run getting startedcrypto stable bitcoin hash rate rise institution buy fomo subsides altcoins news spotlight crypto bull run,0.296,0.0,0.148
GoogleNews,Crypto Bullrun,1 day ago,2025-02-11 00:52:33.334010,ethereums bull run xrps soaring price blockdags finalcall700which crypto dominate feb 2025ethereum eye 2200 xrp surge 300 blockdags finalcall700 presale hit 193m 2340 roi discover scarcity regulation,-0.128,0.0,-0.064
GoogleNews,Crypto Bullrun,1 day ago,2025-02-11 00:52:33.334010,crypto bull run imminent economist predicts bitcoin altcoins verge surgeeconomist henrik zeberg predicts final phase crypto bull market imminent see le 5 chance bitcoin reached peak,0.34,0.0,0.17
GoogleNews,Crypto Bullrun,1 day ago,2025-02-11 00:52:33.334010,xrp ethereum rollblock get attention bull run edge closerthe crypto market preparing strong upward momentum investor seeking altcoins potential profit 2025 bull run,0.7351,0.21666666666666667,0.4758833333333333
GoogleNews,Crypto Bullrun,1 day ago,2025-02-11 00:52:33.334010,best crypto buy top pick 1 could explode 2025 bull runthe crypto bull run 2025 horizon savvy investor hunting undervalued gem 1 could skyrocket value,0.8126,0.75,0.7813
GoogleNews,Crypto Bullrun,1 day ago,2025-02-11 00:52:33.334010,gamefi could lead next bull run last dwarf tld best crypto presale invest nowthe next crypto bull run approaching investor searching highgrowth opportunity beyond traditional asset like bitcoin btc,0.9001,0.16666666666666666,0.5333833333333333
GoogleNews,Crypto Bullrun,2 days ago,2025-02-11 00:52:33.334010,pepe coin price prediction next bull run push pepe new highsat time plutochain pluto could solve bitcoins biggest limitation slow transaction high fee,-0.1027,-0.0009090909090909219,-0.051804545454545464
GoogleNews,Crypto Bullrun,,2025-02-11 00:52:33.334010,,0.0,0.0,0.0
GoogleNews,Crypto Bullrun,6 hours ago,2025-02-11 00:52:33.334010,vechain hedera holder buy bullrun 1fuel exchange launch surpassing 2mcrypto investor shifting strategy market dynamic change vechain vet hedera hbar continue expanding underwhelming token,0.3818,0.0,0.1909
GoogleNews,Crypto Bullrun,9 hours ago,2025-02-11 00:52:33.334010,crypto bull run trader predicts end 70 crashtrader warns crypto market peak altcoins drop 70,-0.3612,0.0,-0.1806
GoogleNews,Crypto Bullrun,0 hours ago,2025-02-11 00:52:33.334010,trader shift focus ozak ai ai dominates 2025 crypto bull runozak ai oz represents ai innovation project attracts trader interested highgrowth investment investor seek emerging aibased,0.802,0.25,0.526
GoogleNews,Crypto Bullrun,5 hours ago,2025-02-11 00:52:33.334010,here 3 reason crypto bull run getting startedcrypto stable bitcoin hash rate rise institution buy fomo subsides altcoins news spotlight crypto bull run,0.296,0.0,0.148
GoogleNews,Crypto Bullrun,9 hours ago,2025-02-11 00:52:33.334010,rwa crypto bull run anytime ondo finance review analysisondo finance one leading project hot rwa sector held ondo summit recently nyc introduced wall street 20,0.0,0.125,0.0625
GoogleNews,Crypto Bullrun,1 day ago,2025-02-11 00:52:33.334010,ethereums bull run xrps soaring price blockdags finalcall700which crypto dominate feb 2025ethereum eye 2200 xrp surge 300 blockdags finalcall700 presale hit 193m 2340 roi discover scarcity regulation,-0.128,0.0,-0.064
GoogleNews,Crypto Bullrun,1 day ago,2025-02-11 00:52:33.334010,crypto bull run imminent economist predicts bitcoin altcoins verge surgeeconomist henrik zeberg predicts final phase crypto bull market imminent see le 5 chance bitcoin reached peak,0.34,0.0,0.17
GoogleNews,Crypto Bullrun,1 day ago,2025-02-11 00:52:33.334010,xrp ethereum rollblock get attention bull run edge closerthe crypto market preparing strong upward momentum investor seeking altcoins potential profit 2025 bull run,0.7351,0.21666666666666667,0.4758833333333333
GoogleNews,Crypto Bullrun,1 day ago,2025-02-11 00:52:33.334010,best crypto buy top pick 1 could explode 2025 bull runthe crypto bull run 2025 horizon savvy investor hunting undervalued gem 1 could skyrocket value,0.8126,0.75,0.7813
