MainSource,Source,Publication Date,Pull_date,Pre-Processed Text,Sentiment_Vader,Sentiment_TextBlob,Average_Sentiment
Reddit,solana,2024-10-20 22:03:58,2024-10-22 12:19:07.094288,convert sol jitosol invest kaminos liquidity pool long termhey everyone ive saved around 55 sol plan hold long term 35 year course im looking best safest way generate gain holding recently found jitosol kamino im wondering safe convert sol jitosol invest kamino liquidity pool say 5 year insight advice would greatly appreciated,0.9617,0.26666666666666666,0.6141833333333333
Reddit,solana,2024-10-20 21:32:25,2024-10-22 12:19:07.094288,sol perpwhere bestcheapest place whats risk anyone explain sol prep please done appreciate sort leverage believe couldnt find much information,0.4404,0.2,0.32020000000000004
Reddit,solana,2024-10-20 15:20:22,2024-10-22 12:19:07.094288,havent received reward staking coinbase staked sol 8 day ago oct 12th unstaking earning frequency est time say 5 day currently coinbase 8 day havent received reward yet first time staking sol sure good coinbase staking curious timing maybe taking longer wait maybe problem unstake,-0.2951,0.26999999999999996,-0.012550000000000006
Reddit,solana,2024-10-20 23:51:44,2024-10-22 12:19:07.094288,need help good solana setting trojan boti question making profit say sold 77 bought 13 bought 21 worth sold 28 wondering seeing much profit receiving playing around buy gas slippage dont know thats issue wondering could help,0.9413,0.39999999999999997,0.67065
Reddit,solana,2024-10-19 21:57:09,2024-10-22 12:19:07.094288,please help say 24k usd worth qwack cant sell,0.7096,0.3,0.5048
Reddit,solana,2024-10-20 13:05:16,2024-10-22 12:19:07.094288,photon sol rediculous platform fee 3hey ive experimenting using photon sol bit cant get crazy fee example using 03 slippage fee 00001 bribery priority fee buying coin 1 sol left 0965 sol worth token bought seems like transaction fee roughly 3 even though people online seem claiming 1 missing something,0.5,-0.12000000000000002,0.19
Reddit,solana,2024-10-20 15:11:56,2024-10-22 12:19:07.094288,mad jupiter coinbase validator betterwhich validator best safe,0.5994,0.2916666666666667,0.44553333333333334
Reddit,solana,2024-10-20 22:23:07,2024-10-22 12:19:07.094288,low transaction fee solana solana phantom wallet im planning selling whenever reach 200 best place sell,0.4939,0.5,0.49695
Reddit,solana,2024-10-20 16:19:21,2024-10-22 12:19:07.094288,phantom wallet say im overall usd worth le put inso bought roughly 230usd worth coin went updown couple day an showing around 170usd worth wallet say im roughly 23usd work shouldnt 60usd,0.5719,0.11666666666666668,0.34428333333333333
Reddit,solana,2024-10-20 13:01:52,2024-10-22 12:19:07.094288,trying build web3 blockchain module deltabased state synchi im building web3 blockchain module sync state node using delta update aiming reduce data transfer especially sidechains shard chain bandwidth critical basic grasp delta calculation sending change full state want explore something innovative guidance implementing potential challenge would greatly appreciated,0.6997,0.15,0.42485
Reddit,solana,2024-10-20 17:50:12,2024-10-22 12:19:07.094288,phantom wallet wont authenticate reason phantom wallet failing read thumbprint using iphone suggestion unable authenticate message,-0.5106,-0.5,-0.5053000000000001
Reddit,solana,2024-10-20 10:34:43,2024-10-22 12:19:07.094288,inpermanent loss hey guy idk happened got 6 worth coin even tho paid 95 800k mcap bought 370k someone help legit telegram raydiumswap group full scammer go defi idk someone guide,0.128,0.32499999999999996,0.22649999999999998
Reddit,solana,2024-10-20 21:06:36,2024-10-22 12:19:07.094288,service send sol memecoin alert webhooki currently use tradingview alert triggered custom indicator setting send webhook alert instruct trading bot execute trade solana blockchain however tradingview doesnt support latest meme coin looking alternative service offer following feature 1 support latest meme coin 2 ability create alert based indicator setting simple price alert 3 webhook support send alert 4 option include json alert detailed instruction bot service feature exist,0.958,0.2333333333333333,0.5956666666666667
Reddit,solana,2024-10-20 20:46:12,2024-10-22 12:19:07.094288,batch processing blockshi want process solana transaction two option 1 use getblock rpc 2 use websocket connection second approach seems ok requires running computer time also retries probably data loss itd perfect batch load new block every hour even though jsonrpc support batching think free node wont happy serve request hundred subrequests service providing history data transaction,0.6126,0.47272727272727266,0.5426636363636363
Reddit,solana,2024-10-20 20:35:07,2024-10-22 12:19:07.094288,anybody know good trojan bot setting pumpfun copy trading wondering setting copy trading pumpfunhttppumpfun token ensure making maximum profit trading 05 solana per trade want know put slippage buy sell gas,0.8271,0.7,0.76355
Reddit,solana,2024-10-20 20:32:33,2024-10-22 12:19:07.094288,drift dex subaccounts securityhi ive using drifttradehttpdrifttrade perpetuals platform great however uncertain safety requirement deposit fund subaccounts actively trade borrow lend platform fund transferred trading subaccount effectively leave original wallet address solflare key dex essentially key balance ttrading subaccount architecture solana chain contract enables still belong original wallet im clued intricacy blockchain smart contract attempted fund clarity reviewing relevant transaction wasnt able glean much,0.9565,0.3028138528138528,0.6296569264069264
Reddit,solana,2024-10-20 17:45:20,2024-10-22 12:19:07.094288,help getting solana keplr walleti cant seem find bridge thats cosmos friendly need send fund phantomsolflare,0.7096,0.375,0.5423
Reddit,solana,2024-10-19 19:25:47,2024-10-22 12:19:07.094288,one buy sell crypto le second tool useits called sniping apparently huge advantage others anyone able execute tx speed know done,0.7003,0.3,0.50015
Reddit,solana,2024-10-19 14:01:43,2024-10-22 12:19:07.094288,who actual millionaire multimillionaire solana wondering watching alot wallet scare shit see 100m wallet basically creating degen memecoins rugpulling whove made profit especially whore millionaire care explain coin pumping approximate time make money big challenge feel becoming millonaires would like new found wealth write comment looking forward reading,0.2893,-0.0019480519480519606,0.143675974025974
Reddit,solana,2024-10-20 08:04:43,2024-10-22 12:19:07.094288,holder analysis solanaanyone know get graph holder analysis like moodeng btw httpspreviewredditesqknp87cvvd1pngwidth1120formatpngautowebps21953379d7b317f12669b9023bfb024674be5b1f,0.3612,0.0,0.1806
Reddit,solana,2024-10-19 19:16:38,2024-10-22 12:19:07.094288,dont help much greed ive selflearning trading solana two year ive struggled lot ive lost ive earned losing money made work personal project problem one real life learn everyone ive tried learn opportunistic even tried scam mewhether social medium influencers peer online platform ive started doubt community others like anyone genuine integrity guide set right path,-0.8807,0.1865079365079365,-0.34709603174603176
Reddit,solana,2024-10-20 06:36:54,2024-10-22 12:19:07.094288,python historical sol balanceis way use python retrieve historical sol balance multiple address wanting track performance account plot trouble finding right tool thanks,0.0516,0.047619047619047616,0.04960952380952381
Reddit,solana,2024-10-19 02:24:05,2024-10-22 12:19:07.094288,wonder got course buy start better option,0.4404,0.5,0.4702
Reddit,solana,2024-10-20 08:31:08,2024-10-22 12:19:07.094288,phantom issue sending usdchi someone help send usdc bank account someone trust send usdc send via coinsphhttpcoinsph paypal much better give straight bank account im hard time sending transaction error every time try send think enough sol doesnt work trust someone please help thanks,0.8979,0.12166666666666666,0.5097833333333334
Reddit,solana,2024-10-19 21:52:24,2024-10-22 12:19:07.094288,get money crypto put tradecan someone explain transferred 01 sol 1574 got 2585 memecoin buying coin going transaction processing whats going,0.0,0.0,0.0
Reddit,solana,2024-10-20 04:30:52,2024-10-22 12:19:07.094288,insider avoid tracked creating new wallet crypto tradinghello community im beginner crypto space came across thread twitter timeline spot insider trading tracking insider wallet trade memecoins profit alongside however doubt many tool tracker bot available monitor every activity insider must also know wallet tracked case wouldnt insider want avoid tracked make trade completely private wouldnt create new wallet time avoid tracked copied,-0.2986,0.23454545454545456,-0.03202727272727271
Reddit,solana,2024-10-20 00:26:18,2024-10-22 12:19:07.094288,wallet watchthere key wallet guy follow closely well known even linked public figure,0.2732,0.0,0.1366
Reddit,solana,2024-10-19 23:39:57,2024-10-22 12:19:07.094288,use dexscreener pumpdotfun filter coin potential go upwards,0.0,0.0,0.0
Reddit,solana,2024-10-20 05:05:07,2024-10-22 12:19:07.094288,choose mode onchain bot many people rushing buy token want participate token purchase kol call token surely large number people buying time want buy tolerate slippage mode choose various solana bot fast mode safemev protect mode,0.7506,0.2285714285714286,0.4895857142857143
Reddit,solana,2024-10-20 04:11:11,2024-10-22 12:19:07.094288,cant get money phantom walletive trying get month thing,0.0,0.0,0.0
Reddit,solana,2024-10-19 22:19:22,2024-10-22 12:19:07.094288,solana bot pay best commission ive tried trojan never make much anything enough get payout sol trading bot doesnt pay much either got 1 payout 1 dozen referral people make wild claim 6 referral made 1000 telegram bot pay good commission youve actually used people dont use many affiliate roughly much make,0.7647,0.32222222222222224,0.5434611111111112
Reddit,solana,2024-10-19 15:03:49,2024-10-22 12:19:07.094288,dog wif tool review hello everybody anyone used dwt software whats opinion better bundler market thanks,0.7003,0.35,0.52515
Reddit,solana,2024-10-19 12:23:17,2024-10-22 12:19:07.094288,buying multiple sn domain single wallet buy multiple sn domain single wallet yes solscan choose domain would showed solscan transaction page,0.4019,-0.03571428571428571,0.18309285714285714
Reddit,solana,2024-10-19 11:55:58,2024-10-22 12:19:07.094288,almost profit staking ophttpspreviewreddit42zkbshjcpvd1pngwidth1086formatpngautowebps5f84eab9ee5732ce6b1b7c1d4b680998b4701861,0.3832,0.0,0.1916
Reddit,solana,2024-10-20 02:20:18,2024-10-22 12:19:07.094288,least second one month yall,0.0,-0.15,-0.075
Reddit,solana,2024-10-19 06:55:21,2024-10-22 12:19:07.094288,anyone explain bullxs bribe fee cant find anywherein bullx pay 2 additional fee 1 priority fee 2bribe fee searched bot platform like raydium priority fee could ask bribe fee bullx set,-0.128,0.0,-0.064
Reddit,solana,2024-10-18 16:25:37,2024-10-22 12:19:07.094288,murad totally right found agreeing lot murad said lot thesis aligns bitcoin maxi ideology crypto never technology memecoins final honest evolution crypto best crypto product dont token best token dont need product meanwhile bitcoin keep bitcoin,0.778,0.5771428571428572,0.6775714285714286
Reddit,solana,2024-10-19 12:57:51,2024-10-22 12:19:07.094288,anyway cryptocurrency solve issue interest ok everybody agree interest huge problem buy house need house forced take loan stupidly outrageous compounding interest end paying house almost triple original price know bank want make money triple much also already house case pay risk lesser nowhere expert topic kind puzzling thinking everybody kind ok like sort also wonder endpoint small bedroom 1 trillion dollar war reset everything hunch bitcoin cryptocurrency able help sort thing sure guy think,0.8536,0.20192307692307693,0.5277615384615385
Reddit,solana,2024-10-18 13:43:34,2024-10-22 12:19:07.094288,solscan sniper account doubt httpspreviewreddittfsxu03bpivd1pngwidth1404formatpngautowebps71265b4d1a2b14b6f0681ce34f87678f011e0857 hello everyone someone explain movement see account 6vfwflmcznhcheaytzvcpjdvxdpcrpkgu7mcergdphp time see somehow snipe new coin like 200usd sell 1k seen 4 time like 10 min thanks,0.6597,0.16818181818181818,0.4139409090909091
Reddit,solana,2024-10-18 22:51:21,2024-10-22 12:19:07.094288,eclipse svm ethereum solana layer2,0.0,0.0,0.0
Reddit,solana,2024-10-18 10:19:21,2024-10-22 12:19:07.094288,warning fatality bot breachdo use fatality bot breach theyre paying group keep quiet someone swiping private key stealing fund wallet happened 4 project kept quiet massive data breach dont want people pulling banana bot dont fucking use telegram bot,-0.9462,-0.09999999999999999,-0.5231
Reddit,solana,2024-10-19 02:00:46,2024-10-22 12:19:07.094288,updating tax softwareim trying update transaction within tax software solana within phantom wallet work network trouble,-0.4019,-0.2,-0.30095
Reddit,solana,2024-10-18 20:36:46,2024-10-22 12:19:07.094288,trojan solana doesnt copy trade sniper botim trying beat one sniper bot ive identified trade going expected however try copytrade trojan bot opening position copy trade sniper bot wallet added idea happening adding setting reference copy trade setting httpspreviewreddit5zis6qtctkvd1pngwidth437formatpngautowebps45905a2269650b60b36a91ccd0d0fd857d7385c8 bot setting httpspreviewreddit80nopbuxskvd1pngwidth444formatpngautowebpsc2468f94c0b81b41f7320933cdfec66e0dec2868 bot setting httpspreviewredditijuv26uxskvd1pngwidth444formatpngautowebps48c083bc1aeba1a3511a3cd42f64f9e0f3a07077,0.0,-0.1,-0.05
Reddit,solana,2024-10-18 17:14:07,2024-10-22 12:19:07.094288,create much starting market capfor example create token put raydium uniswap base initial market cap calculated liquidity pool put thanks,0.7269,-0.15000000000000002,0.28845
Reddit,solana,2024-10-18 16:59:14,2024-10-22 12:19:07.094288,big news wanchain add solana usdc xflows httpsredditcomlink1g6n1m5video5woql1jmpjvd1player hey everyone exciting update wanchain theyve integrated solana usdc xflows mean execute nativetonative secure fast lowcost usdc crosschain transaction solana 12 blockchains blockchains included bnb chain base ethereum optimism polygon open incredible possibility crosschain defi allowing seamless usdc transfer across multiple ecosystem wanchains crosschain bridge continue push boundary interoperability making decentralized finance accessible fluid ever youre looking move usdc across solana major chain now perfect time try check detail httpsbridgewanchainorghttpsbridgewanchainorg think mean solana broader defi space let discus comment,0.9196,0.1275,0.52355
Reddit,solana,2024-10-18 22:44:29,2024-10-22 12:19:07.094288,way know wish token adress wallet create please,0.7269,0.0,0.36345
Reddit,solana,2024-10-18 18:55:26,2024-10-22 12:19:07.094288,photon tinyastro v exchangesive using photon last month trade sol memecoins one saw twitter however fee seem quite large well setting fee taker fee buyingselling also take additional chunk example sold 15 sol worth memecoins one go cost 05 sol like 70 80 exchange lower fee stick photon,0.5542,0.1714285714285714,0.3628142857142857
Reddit,solana,2024-10-18 18:08:03,2024-10-22 12:19:07.094288,geodnet global earth observation decentralized network integrated solanasource httpsxcomgeodnet_status1846189290159563150httpsxcomgeodnet_status1846189290159563150 geod token available solanahttpsxcomsolana wormholehttpsxcomwormhole native token transfer following successful approval gip3 integration open opportunity geodnet support solanabased depins engage web3 community solana launch geodnets mobile apps within solana ecosystem learn transfer token httpsdocsgeodnetcomgeodtokenbridgefrompolygontosolanahttpsdocsgeodnetcomgeodtokenbridgefrompolygontosolana wormhole connect httpssolgeodnetcomhttpssolgeodnetcom httpspreviewredditud4qt1rn1kvd1pngwidth680formatpngautowebps9b9d933c19af84e3b055ce6dbc9875f947a7ac2c,0.93,0.22999999999999998,0.5800000000000001
Reddit,solana,2024-10-18 18:03:05,2024-10-22 12:19:07.094288,enkrypt multichain browser extension wallet myetherwallet support solanasource httpsxcomenkryptstatus1845899640639528997httpsxcomenkryptstatus1845899640639528997 attention sol enjoyooors solanahttpsxcomsolana live enkrypthttpsxcomenkrypt matter blockchain simp enkrypt make easy solana bitcoin ordinal ethereum l2s polkadot parachains try enkrypt today httpspreviewredditpxkg7kyu0kvd1pngwidth679formatpngautowebps8905bc0884ac05b96fa8093b00b5ca579067ac01 download enkrypt httpsenkryptcomdownloadhtmlhttpsenkryptcomdownloadhtml httpspreviewreddit03kyz27x0kvd1pngwidth680formatpngautowebps48cbcd0107c0c5fc47037ca9e714cf3d2ce8a31b,0.6908,0.28484848484848485,0.4878242424242424
Reddit,solana,2024-10-18 17:51:22,2024-10-22 12:19:07.094288,advice solana meme coinsim currently toying idea vwntuong meme coin hold vast majority investment cryptos solid fundamental far want dedicate small meme coin aiming 3x meme coin marker still viable option one anyone would recommend looking,0.5267,-0.03,0.24834999999999996
Reddit,solana,2024-10-18 17:50:03,2024-10-22 12:19:07.094288,introducing shipyard global network solana ecosystem workspace managed community communitysource httpsxcomneilshroffstatus1847316087945523710httpsxcomneilshroffstatus1847316087945523710 1 introducing ushipyard_ global network usolana ecosystem workspace managed community community asked usuperteam member around world came well detail httpspreviewredditsh3hijb0yjvd1pngwidth680formatpngautowebps5060b886b19186deaad4ae0ad6a95a36ec227629 2 first one came bengaluru spun superteaminhttpsxcomsuperteamin anchored local team _cubikhttpsxcom_cubik decharge__httpsxcomdecharge__ goatfishxyzhttpsxcomgoatfishxyz thesendcoinhttpsxcomthesendcoin dp_protohttpsxcomdp_proto daily coworking already hosted 10 event many quiz party even startup village blr hackerhouseshttpsxcomhackerhouses httpspreviewredditjib7nan5yjvd1pngwidth575formatpngautowebps43950424e09e6c77cfc77e49c957f5951309a16b 3 started startup village hcmc superteamvnhttpsxcomsuperteamvn chad continued ship radar continue even today httpspreviewredditgmgayulbyjvd1pngwidth543formatpngautowebpsbe50f9ee47b60895de4c9fe916671ab975d02919 4 capinukhttpsxcomcapinuk superteamukhttpsxcomsuperteamuk recently announced square london experimental tokenized coworking space coming soon collaboration metawealthhttpsxcommetawealth swanky office space restaurant event space httpspreviewredditxuuugh9hyjvd1pngwidth607formatpngautowebpscc0d1da5f77a0180fca15a9110f4bdfc625f721c 5 latest addition network san francisco solayer_labshttpsxcomsolayer_labs sfonchainhttpsxcomsfonchain coming together launch brand new workspace fidi small opening party next week come check space first grab spot httpspartifulcomebeae3rj7g7youlyuuatqhttpstco0afwufttyq httpspreviewredditn8zajn1kyjvd1pngwidth680formatpngautowebpsc3e7c525ad2ab2be9c9e8f5a6ea8fd3159518983 6 cooking country soon office space want open living solana hub think would want spin one reach time follow shipyard_httpsxcomshipyard_ thnx,0.802,0.10616883116883116,0.4540844155844156
Reddit,solana,2024-10-18 16:32:25,2024-10-22 12:19:07.094288,privy authentication key management platform support solanasource httpsxcomprivy_iostatus1847275528161828873httpsxcomprivy_iostatus1847275528161828873 1 native solana funding today expanding funding capability solanahttpsxcomsolana making even seamless go 0 transacting onchain whether user prefer fiat funding method like applepay bridging evm asset external wallet weve get covered httpspreviewreddit4w2zy0bckjvd1pngwidth680formatpngautowebps84aa84ed41c44a2edaadaf6e13a72509c68e0288 2 today launch allows user support following 1 fiat funding via moonpayhttpsxcommoonpay 2 sending evmsol asset external wallet privy handle bridging hood via reservoir0xhttpsxcomreservoir0x 3 transferring asset centralized coinbasehttpsxcomcoinbase account via cbs onramp 3 weve blown away caliber solana team weve gotten work excited continue doubling ecosystem head httpdemoprivyiohttpdemoprivyio check experience get set today httpsdocsprivyioguidereactwalletssolanafundinghttpsdocsprivyioguidereactwalletssolanafunding httpspreviewreddit53nq5oggkjvd1pngwidth680formatpngautowebpsbba7c8961c67a3297e6d087fedde72197b42ab47,0.9413,0.07916666666666666,0.5102333333333333
Reddit,solana,2024-10-17 23:57:33,2024-10-22 12:19:07.094288,solana trading pro poke hole sol trading strategy whats working rn,0.0,0.0,0.0
Reddit,solana,2024-10-18 15:21:47,2024-10-22 12:19:07.094288,bullxs limit orderhasnt triggered onchain chain placing limit order bullx dont want order seen known others could ask bullxs limit order onchan using onchain thing could discoverd others front runner,-0.0572,0.0,-0.0286
Reddit,solana,2024-10-17 18:02:33,2024-10-22 12:19:07.094288,start solanaim new meme coin watching researching month wanted know much need put solana start able make profit ive heard couple different thing wanted advice 50 100 160,0.4404,0.2090909090909091,0.32474545454545456
Reddit,ethereum,2024-09-03 14:41:57,2024-10-22 12:19:07.094288,ama ef research pt 12 05 september 2024notice closed thank participating look forward soon member ethereum foundation research team back answer question throughout day 12th amahttpsredditzendeskcomhcenusarticles115002427523whatisanamaandwhywouldihostone lot member taking part keep question coming enjoy click view 11th ef research team amahttpswwwredditcomrethereumcomments191kke6ama_we_are_ef_research_pt_11_10_january_2024 jan 2024 click view 10th ef research team amahttpswwwredditcomrethereumcomments14vpyb3ama_we_are_ef_research_pt_10_12_july_2023 july 2023 click view 9th ef research team amahttpswwwredditcomrethereumcomments107cqi8ama_we_are_ef_research_pt_9_11_january_2023 jan 2023 click view 8th ef research team amahttpswwwredditcomrethereumcommentsvrx9xeama_we_are_ef_research_pt_8_07_july_2022 july 2022 click view 7th ef research team amahttpswwwredditcomrethereumcommentsrwojtkama_we_are_the_efs_research_team_pt_7_07_january jan 2022 click view 6th ef research team amahttpswwwredditcomrethereumcommentso4unlpama_we_are_the_efs_research_team_pt_6_23_june_2021 june 2021 click view 5th ef research team amahttpswwwredditcomrethereumcommentsjvkoatama_we_are_the_efs_eth_20_research_team_pt_5_18 nov 2020 click view 4th ef research team amahttpswwwredditcomrethereumcommentsho2zptama_we_are_the_efs_eth_20_research_team_pt_4_10 july 2020 click view 3rd ef research team amahttpswwwredditcomrethereumcommentsez972uama_we_are_the_eth_20_research_team_pt_3 feb 2020 click view 2nd ef research team amahttpswwwredditcomrethereumcommentscdg8v6ama_we_are_the_eth_20_research_team_pt_2 july 2019 click view 1st ef research team amahttpswwwredditcomrethereumcommentsajc9ipama_we_are_the_eth_20_research_team jan 2019 x200b ama concluded,0.6908,0.06000000000000001,0.3754
Reddit,ethereum,2024-10-22 06:21:01,2024-10-22 12:19:07.094288,eip1559 solve predictability high utilization limit max_priority_fee title eip1559 solve problem gas period high utilizationcongestion limit priority fee max fee aware empirically eip1559 improved gas fee situation however wondering work folk set higher higher max fee get transaction succeed resulting problem type 0legacy transaction apologize asked tried look around internet didnt get far maybe didnt get far enough search result post talk eip1559 help situation adjusting base fee predictably fail see people dont start bidding war setting high max fee,0.7388,0.019166666666666672,0.37898333333333334
Reddit,ethereum,2024-10-22 12:12:18,2024-10-22 12:19:07.094288,mbridgei saw recently brics thinking crating new international payment system inspired mbridge also see mbridge compatible ethereum virtual machine decentralised vurtual environment executes code across ethereum node also see us ethereum compatible dlt network possibly thing could someone explain mbridge us ethereum impact price coin thanks help well versed crypto,0.872,0.06727272727272728,0.46963636363636363
Reddit,ethereum,2024-10-21 12:27:28,2024-10-22 12:19:07.094288,cant understand l2 network matter whatso current understanding rollups since eth gas fee like really high per transaction would much better transaction bundled submitted single transaction like work say take optimism example like lot node running particular l2 right make transaction network bundled transaction submitted single transaction main network like say bob sends 1 eth alice like work rollups first optimism node work verifying stuff like balance submit main network submit like via rpc contract smtn please help cant find source go technical detail blog post saying l2s fix eth scaling issue edit finally clicked huge thanks udepartedquantity helping here understanding till far mind rolling l1 transaction since transaction fee higher send transaction separate network let batch multiple user transaction together mine submit l1 single transaction proof smart contract magic everything good doesnt make sense someone either way pay change state main chain going really expensive thing l2 network evm state change etc etc connected main chain bridge equivalent chain given transaction happening independent submits main network transaction detailsor whatever l2 something ever happens recovered l1 transaction verified offchain submitted batch main chain,0.9906,0.1486067019400353,0.5696033509700177
Reddit,ethereum,2024-10-21 20:45:02,2024-10-22 12:19:07.094288,possiblehello know dumb dont secret phase key qr code eth address gone forever right,-0.5106,-0.12232142857142858,-0.3164607142857143
Reddit,ethereum,2024-10-20 23:14:17,2024-10-22 12:19:07.094288,vitalik possible future ethereum protocol part 3 scourge,0.0,0.0,0.0
