MainSource,Source,Publication Date,Pull_date,Pre-Processed Text,Sentiment_Vader,Sentiment_TextBlob,Average_Sentiment
RSS,https://cointelegraph.com/rss,2024-11-05 11:40:26+00:00,2024-11-05 12:18:39.078109,mt gox move 22b bitcoin adding btc selling pressure 94 billion worth bitcoin owed 127000 mt gox creditor 10 year,-0.1027,0.3,0.09864999999999999
RSS,https://cointelegraph.com/rss,2024-11-05 11:33:35+00:00,2024-11-05 12:18:39.078109,xrp price today xrp price today market structure point potential explosive rally u election day,0.0,0.0,0.0
RSS,https://cointelegraph.com/rss,2024-11-05 11:14:51+00:00,2024-11-05 12:18:39.078109,hamster kombat loses 86 user paw mini app soar telegram interest hamster kombat decline paw surge outperforming oncetop telegram mini app,-0.2263,-0.3,-0.26315
RSS,https://cointelegraph.com/rss,2024-11-05 10:33:41+00:00,2024-11-05 12:18:39.078109,binance cz file motion dismiss sec amended complaint secondary market resale crypto asset long first distributed developer security transaction lawyer binance former ceo argued,0.0516,-0.08333333333333333,-0.015866666666666664
RSS,https://cointelegraph.com/rss,2024-11-05 09:04:59+00:00,2024-11-05 12:18:39.078109,bitcoin price outlook hinge 2024 u election outcome analyst postelection price volatility could set stage bitcoins rally record high 73800,0.0,0.16,0.08
RSS,https://cointelegraph.com/rss,2024-11-05 08:36:56+00:00,2024-11-05 12:18:39.078109,meet procrypto contender could replace sec chief gary gensler several new candidate could potentially become next chair sec,0.128,-0.01060606060606061,0.0586969696969697
RSS,https://cointelegraph.com/rss,2024-11-05 08:27:02+00:00,2024-11-05 12:18:39.078109,dogecoin price today dogecoins price today fueled donald trump marginal edge kamala harris key u state,0.0,0.0,0.0
RSS,https://cointelegraph.com/rss,2024-11-05 07:13:39+00:00,2024-11-05 12:18:39.078109,bitcoin price need 2 month return 039above macro trend039 forecast btc price strength back vengeance early 2025 analysis predicts u presidential election bug bitcoin bull inauguration day,0.4939,0.05,0.27195
RSS,https://cointelegraph.com/rss,2024-11-05 06:00:00+00:00,2024-11-05 12:18:39.078109,openai talk regulator become forprofit company report 157 billion artificial intelligence giant want retain nonprofit arm pursue mission benevolent ai development,0.7964,-0.3,0.2482
RSS,https://cointelegraph.com/rss,2024-11-05 05:27:19+00:00,2024-11-05 12:18:39.078109,calm storm bitcoin volatility stall ahead u election notching threemonth high last week bitcoin volatility flattened trader await outcome u election bated breath,0.2263,0.15333333333333335,0.1898166666666667
RSS,https://cointelegraph.com/rss,2024-11-05 05:10:46+00:00,2024-11-05 12:18:39.078109,meta open llama ai model u military meta said sharing opensourcing ai tech within u ally play role helping preserve technological edge china competitor,0.7506,-0.05,0.3503
RSS,https://cointelegraph.com/rss,2024-11-05 04:55:45+00:00,2024-11-05 12:18:39.078109,u bitcoin etf notch secondlargest daily outflow eve election 11 u spot bitcoin etf recorded net outflow 5411 million nov 4 secondlargest outflow day history,0.0,0.0,0.0
RSS,https://cointelegraph.com/rss,2024-11-05 02:17:53+00:00,2024-11-05 12:18:39.078109,robinhood kraken paxos launch global dollar stablecoin network major firm crypto traditional finance partnered launch global dollar network regulationcompliant network designed accelerate adoption stablecoins,0.0,-0.027500000000000004,-0.013750000000000002
RSS,https://cointelegraph.com/rss,2024-11-05 01:42:42+00:00,2024-11-05 12:18:39.078109,semler scientific laserfocused buying bitcoin say ceo medical device firm semler scientific spent 71 million buy 1058 bitcoin adding another 181 bitcoin stash q3 start november,0.0,-0.10000000000000002,-0.05000000000000001
RSS,https://cointelegraph.com/rss,2024-11-05 00:58:41+00:00,2024-11-05 12:18:39.078109,marathon riot record highest monthly btc production since april halving firm attributed expanded bitcoin production partially increasing energized hash rate october,-0.0772,-0.15000000000000002,-0.1136
RSS,https://cointelegraph.com/rss,2024-11-05 00:02:12+00:00,2024-11-05 12:18:39.078109,microsoft risk shareholder lawsuit ignores bitcoin price rise ncppr microsoft fiduciary duty financial interest shareholder slighting bitcoin could go interest policy research center executive said,0.2263,-0.05,0.08815
RSS,https://cointelegraph.com/rss,2024-11-04 22:12:58+00:00,2024-11-05 12:18:39.078109,crypto etf call option u election u presidential race may determine fate half dozen proposed crypto etf,0.0,-0.16666666666666666,-0.08333333333333333
RSS,https://cointelegraph.com/rss,2024-11-04 22:08:14+00:00,2024-11-05 12:18:39.078109,curve finance ton drive defi evolution partnership 2025 ton year defi partnered curve finance support competition find early leader,0.4019,0.1,0.25095
RSS,https://cointelegraph.com/rss,2024-11-04 21:24:16+00:00,2024-11-05 12:18:39.078109,2024 u election live crypto ballot follow cointelegraphs live update 2024 u election potential impact crypto regulation market future digital asset,0.3612,0.05454545454545454,0.2078727272727273
RSS,https://cointelegraph.com/rss,2024-11-04 21:12:46+00:00,2024-11-05 12:18:39.078109,ukbased pension scheme make 3 bitcoin allocation cartwright reported unnamed scheme based uk made 3 allocation bitcoin pension fund,0.0,0.0,0.0
RSS,https://cointelegraph.com/rss,2024-11-04 20:38:28+00:00,2024-11-05 12:18:39.078109,3 reason bitcoin price bottom may 673k data suggests trader ignoring current bitcoin price correction betting new high u election wrap,-0.4019,0.0987878787878788,-0.15155606060606058
RSS,https://cointelegraph.com/rss,2024-11-04 20:37:12+00:00,2024-11-05 12:18:39.078109,here happened crypto today need know happened crypto today latest news daily trend event impacting bitcoin price blockchain defi nfts web3 crypto regulation,0.0,0.25,0.125
RSS,https://cointelegraph.com/rss,2024-11-04 20:18:53+00:00,2024-11-05 12:18:39.078109,musk could charged lawyer say 1m winner chosen chance winner handpicked based personal story according lawyer,0.8316,0.0,0.4158
RSS,https://cointelegraph.com/rss,2024-11-04 20:00:02+00:00,2024-11-05 12:18:39.078109,blockchain association call sec leadership shift amid shameful fdic reveal law decoded blockchain association coinbase spotlight sec fdic action revealing significant financial burden crypto firm,-0.6486,0.012500000000000002,-0.31805
RSS,https://cointelegraph.com/rss,2024-11-04 19:53:39+00:00,2024-11-05 12:18:39.078109,internet computer crosschain protocol usage 13x amid bitcoin defi boom network activity across internet computer protocol increased 150 yearoveryear according dfinity,0.2732,0.0,0.1366
RSS,https://cointelegraph.com/rss,2024-11-04 19:07:06+00:00,2024-11-05 12:18:39.078109,u regulator mull approving grayscale crypto index etf grayscale digital large cap fund could first u etf hold altcoins solana avax approved,0.4215,0.15476190476190477,0.2881309523809524
RSS,https://cointelegraph.com/rss,2024-11-04 18:30:00+00:00,2024-11-05 12:18:39.078109,bitcoin price volatility expected ahead u election price level watch bitcoin struggle reclaim 70000 ahead u election analyst agree volatility present election result announced,0.0516,-0.05,0.0007999999999999986
RSS,https://cointelegraph.com/rss,2024-11-04 18:28:42+00:00,2024-11-05 12:18:39.078109,3 bold bitcoin price prediction u election nears finishline bitcoin analyst see btc price heading 80000 immediately donald trump beat kamala harris,0.3818,0.3333333333333333,0.35756666666666664
RSS,https://cointelegraph.com/rss,2024-11-04 17:34:24+00:00,2024-11-05 12:18:39.078109,price analysis 114 spx dxy btc eth bnb sol xrp doge ton ada bitcoin price trade 70000 trader derisk ahead election altcoins follow trend take advantage btcs consolidation,0.25,0.0,0.125
RSS,https://cointelegraph.com/rss,2024-11-04 17:32:34+00:00,2024-11-05 12:18:39.078109,singapore advance asset tokenization new ma framework monetary authority singapore pulling together project participant needed next step asset tokenization trial,0.6486,0.06818181818181818,0.3583909090909091
RSS,https://bitcoinmagazine.com/.rss/full/,2024-11-04 20:08:05+00:00,2024-11-05 12:18:39.078109,u establish strategic bitcoin reservewe send message world,0.0,0.0,0.0
RSS,https://bitcoinmagazine.com/.rss/full/,2024-11-04 19:19:05+00:00,2024-11-05 12:18:39.078109,paid bitcoin btcpay documentary showcase bitcoin medium exchange bitcoin 2024 conference nashvillewatch new documentary paid bitcoin bitcoin use bitcoin 2024 nashville,0.0,0.04545454545454545,0.022727272727272724
RSS,https://bitcoinmagazine.com/.rss/full/,2024-11-04 15:30:29+00:00,2024-11-05 12:18:39.078109,im grateful trump embrace bitcoinas u face consequential election lifetime trump administration offer unprecedented opportunity bitcoin community,0.7964,0.6,0.6981999999999999
RSS,https://bitcoinmagazine.com/.rss/full/,2024-11-01 22:25:58+00:00,2024-11-05 12:18:39.078109,coinbase embarrassing buying bitcoincoinbase fumbling obvious stop buying back share start stacking sat already,-0.3818,0.0,-0.1909
RSS,https://bitcoinmagazine.com/.rss/full/,2024-11-01 17:59:39+00:00,2024-11-05 12:18:39.078109,bitcoin time high postponed please hodlwho win election dictate see new time high,0.6486,0.3140909090909091,0.4813454545454545
RSS,https://bitcoinmagazine.com/.rss/full/,2024-11-01 16:50:43+00:00,2024-11-05 12:18:39.078109,bitcoins price matter lotits okay excited bitcoin hitting new alltime high fact pumped,0.5267,0.29284090909090904,0.40977045454545447
RSS,https://bitcoinmagazine.com/.rss/full/,2024-11-01 15:47:09+00:00,2024-11-05 12:18:39.078109,mathematically forecasting peak bitcoin price next bull cycle bitcoins bull cycle price prediction historical pattern tell u next peak,0.0,0.0,0.0
RSS,https://bitcoinmagazine.com/.rss/full/,2024-11-01 14:47:51+00:00,2024-11-05 12:18:39.078109,basically nothing got 500 bitcoinproducts like lolli fold like hack make stacking sat easy,0.7845,0.43333333333333335,0.6089166666666667
RSS,https://bitcoinmagazine.com/.rss/full/,2024-10-31 17:14:57+00:00,2024-11-05 12:18:39.078109,whitepaper simplest idea profoundthe bitcoin whitepaper barely describes tiny portion bitcoin protocol vaguely bit cover important,0.2023,-0.012499999999999997,0.09490000000000001
RSS,https://bitcoinmagazine.com/.rss/full/,2024-10-31 15:50:26+00:00,2024-11-05 12:18:39.078109,latest fake satoshi fake bitcoin creator needthe newest fake satoshi nakamoto refreshing reminder medium need stop looking bitcoins creator,-0.8885,-0.1,-0.49424999999999997
RSS,https://bitcoinmagazine.com/.rss/full/,2024-10-31 10:26:18+00:00,2024-11-05 12:18:39.078109,today bitcoins birthdayyes bitcoin first proposed via satoshis white paper october 31 2008 doesnt mean today bitcoins birthday,0.0,-0.020833333333333332,-0.010416666666666666
RSS,https://bitcoinmagazine.com/.rss/full/,2024-10-31 05:00:00+00:00,2024-11-05 12:18:39.078109,forget vampire werewolvesthe scariest costume halloween money printerforget dracula werewolvesthis halloween real terror come fiat currency money printer costume inflation haunt wallet bitcoin step hero save u horror currency debasement,-0.5994,0.2,-0.19970000000000002
RSS,https://bitcoinmagazine.com/.rss/full/,2024-10-30 16:03:50+00:00,2024-11-05 12:18:39.078109,bitcoin popularity index bpi measure bitcoin interest around worldthe bitcoin popularity index unique tool measuring global bitcoin interest google search data highlighting key adoption trend,0.9042,0.125,0.5146
RSS,https://bitcoinmagazine.com/.rss/full/,2024-10-30 15:31:04+00:00,2024-11-05 12:18:39.078109,david marcus paypal president bitcoin believerleading team lightspark david marcus poised make lightning network biggest payment network world,0.25,0.0,0.125
RSS,https://bitcoinmagazine.com/.rss/full/,2024-10-30 10:18:46+00:00,2024-11-05 12:18:39.078109,bitcoin best year ever 2024 breakthrough year wed long waited,0.6369,0.475,0.5559499999999999
RSS,https://bitcoinmagazine.com/.rss/full/,2024-10-29 16:55:39+00:00,2024-11-05 12:18:39.078109,bhutan another country using bitcoin escape povertya first hand look effect bhutan bitcoin policy,0.5994,0.25,0.4247
RSS,https://bitcoinmagazine.com/.rss/full/,2024-10-29 14:07:04+00:00,2024-11-05 12:18:39.078109,21 million fashion make bitcoin clothes worth sats21 million fashion bitcoin clothing brand combine fashion crypto get best,0.7269,0.65,0.68845
RSS,https://bitcoinmagazine.com/.rss/full/,2024-10-28 18:14:48+00:00,2024-11-05 12:18:39.078109,trump momentum big rig bitcoin candidate wini think game democrat,-0.128,-0.2,-0.164
RSS,https://bitcoinmagazine.com/.rss/full/,2024-10-28 18:07:42+00:00,2024-11-05 12:18:39.078109,money electric distracted nonsenseas someone wrote book origin story bitcoin felt still watch money electric perhaps comment take even watching purpose waste time,-0.6369,-0.2,-0.41845
RSS,https://bitcoinmagazine.com/.rss/full/,2024-10-28 16:55:34+00:00,2024-11-05 12:18:39.078109,ark could potentially learn lightninga rough idea ark service provider could manage liquidity efficiently create cheaper smoother experience user,0.5859,-0.05,0.26794999999999997
RSS,https://bitcoinmagazine.com/.rss/full/,2024-10-28 13:37:29+00:00,2024-11-05 12:18:39.078109,bitcoin wont let transcend politicsbitcoin escape hatch stop caring political process,0.4019,0.0,0.20095
RSS,https://bitcoinmagazine.com/.rss/full/,2024-10-25 18:46:16+00:00,2024-11-05 12:18:39.078109,microsoft invests bitcoin likely via spot etfsmicrosofts management may choose invest bitcoin etf holding coin,0.0,0.0,0.0
RSS,https://bitcoinmagazine.com/.rss/full/,2024-10-25 18:26:24+00:00,2024-11-05 12:18:39.078109,satoshi nakamoto statue lugano inspiring luganos new disappearing satoshi nakamoto statue beautiful tribute bitcoins anonymous founder,0.7717,0.4954545454545454,0.6335772727272727
RSS,https://bitcoinmagazine.com/.rss/full/,2024-10-25 15:18:08+00:00,2024-11-05 12:18:39.078109,lightspark announces new bitcoin l2 upgraded uma capabilitieslightspark unveils new bitcoin l2 broadens functionality universal money address uma standard release uma extend uma auth uma request,0.1779,0.06818181818181818,0.12304090909090909
RSS,https://bitcoinmagazine.com/.rss/full/,2024-10-25 14:08:20+00:00,2024-11-05 12:18:39.078109,bitcoin repeating previous bull cyclesare repeating pattern accustomed time something different,0.0,-0.08333333333333333,-0.041666666666666664
RSS,https://bitcoinmagazine.com/.rss/full/,2024-10-24 17:20:48+00:00,2024-11-05 12:18:39.078109,blackrocks ibit bitcoin etf successful new etf 4 yearsinstitutional investment bitcoin getting started,0.5859,0.4431818181818182,0.5145409090909091
RSS,https://bitcoinmagazine.com/.rss/full/,2024-10-24 13:10:15+00:00,2024-11-05 12:18:39.078109,ecb economist arent exactly wrong bitcoin theyre uselessa recent paper ecb author claim existence bitcoin could impoverish nonholders latecomer drew ire many bitcoiners isnt essentially hyperbitcoinization,0.3724,0.0,0.1862
RSS,https://bitcoinmagazine.com/.rss/full/,2024-10-24 13:01:06+00:00,2024-11-05 12:18:39.078109,jack dorsey influence bitcoin learned jack dorsey provides 60 bitcoin core funding think need decentralize support,0.4019,0.0,0.20095
RSS,https://bitcoinmagazine.com/.rss/full/,2024-10-23 12:00:06+00:00,2024-11-05 12:18:39.078109,shielded csv protocol revolutionary design blockchains compatible bitcoin,0.0,0.0,0.0
RSS,https://bitcoinmagazine.com/.rss/full/,2024-10-23 08:39:07+00:00,2024-11-05 12:18:39.078109,bitcoin fait accomplibitcoin longer experimental new project decade ago still fail,-0.5423,-0.08787878787878789,-0.31508939393939395
RSS,https://bitcoinmagazine.com/.rss/full/,2024-10-22 20:56:50+00:00,2024-11-05 12:18:39.078109,prediction market pricing trump victory good bitcoinif prediction market correct probitcoin trump shoein white house,0.4404,0.35,0.3952
RSS,https://bitcoinmagazine.com/.rss/full/,2024-10-22 18:52:36+00:00,2024-11-05 12:18:39.078109,spoonful bitcoin mary poppins awakens u financial sovereignty mary poppins mr bank journey rigid conformity joyful liberation mirror transformative power bitcoin discovers true wealth lie freedom invited rethink relationship money embrace financial sovereignty bitcoin offer,0.9423,0.11666666666666665,0.5294833333333333
RSS,https://bitcoinmagazine.com/.rss/full/,2024-10-22 16:00:00+00:00,2024-11-05 12:18:39.078109,metric matter lightning networka look valuable metric measuring effectiveness lightning network routing payment,0.4939,0.0,0.24695
RSS,https://bitcoinmagazine.com/.rss/full/,2024-10-22 15:19:15+00:00,2024-11-05 12:18:39.078109,bitcoin yield dollar yes please trusted u bitcoin exchange river offer bitcoin yield dollar bitcoin interest cash feature great addition platform bitcoin enthusiast normies alike,0.9493,0.8,0.87465
RSS,https://bitcoinmagazine.com/.rss/full/,2024-10-22 14:41:14+00:00,2024-11-05 12:18:39.078109,bitaxe opensource bitcoin mining movementbitaxe founder skot created first ever opensource asicbased bitcoin miner he inspired 4000 others contribute opensource bitcoin mining project,0.6369,0.25,0.44345
RSS,https://bitcoinmagazine.com/.rss/full/,2024-10-22 14:35:40+00:00,2024-11-05 12:18:39.078109,world largest prediction market polymarket trump biased clear polymarket lean protrump aware,0.128,0.175,0.1515
RSS,https://bitcoinmagazine.com/.rss/full/,2024-10-22 11:00:26+00:00,2024-11-05 12:18:39.078109,microstrategy ceo michael saylor reveals bitcoin mstr plansome argue selfcustody nothing else core bitcoin fact trust one hold safeguard wealth,0.7717,0.0,0.38585
RSS,https://bitcoinmagazine.com/.rss/full/,2024-10-21 21:14:47+00:00,2024-11-05 12:18:39.078109,6 step move old 401k bitcoin irathe latest guide unchained offer stepbystep instruction transferring 401k ira ahead next bull run,0.0,0.19999999999999998,0.09999999999999999
RSS,https://bitcoinmagazine.com/.rss/full/,2024-10-21 16:45:52+00:00,2024-11-05 12:18:39.078109,upside world spook hero hero spooksdistorted perception reality completely inverted perception acting best interest bitcoin versus acting interest way put bitcoin risk,0.946,0.275,0.6105
RSS,https://bitcoinmagazine.com/.rss/full/,2024-10-21 16:37:09+00:00,2024-11-05 12:18:39.078109,ecb get wrong bitcoin recent paper researcher european central bank make handful claim bitcoin lack context nuance andor evidence im shed light got wrong,-0.8176,-0.09999999999999999,-0.4588
RSS,https://bitcoinmagazine.com/.rss/full/,2024-10-21 11:00:00+00:00,2024-11-05 12:18:39.078109,kamala presidency could bullish bitcoina trump victory almost certainly ensures one outcome crypto security continue flourish unchecked,0.5434,0.21428571428571427,0.37884285714285715
RSS,https://bitcoinmagazine.com/.rss/full/,2024-10-18 21:06:20+00:00,2024-11-05 12:18:39.078109,bitcoin make new alltime highkey psychological barrier bitcoins fight 70000,-0.4767,0.06818181818181818,-0.20425909090909092
RSS,https://bitcoinmagazine.com/.rss/full/,2024-10-18 18:50:32+00:00,2024-11-05 12:18:39.078109,el salvador survey show bitcoins lindy effect actionslowly surely el salvador way mass bitcoin adoption,0.4404,0.5,0.4702
RSS,https://bitcoinmagazine.com/.rss/full/,2024-10-18 16:25:23+00:00,2024-11-05 12:18:39.078109,bitcoin model perfection doesnt need improvementthe idea bitcoin need improve perfect state decentralized money delusional thinking model perfect state automobile,0.9325,1.0,0.96625
RSS,https://bitcoinmagazine.com/.rss/full/,2024-10-18 11:28:15+00:00,2024-11-05 12:18:39.078109,bitcoin mempool drama predictablethe mempool drama predictable given brewing culture war monetary maximalist purist season 2 pragmatist,-0.5994,-0.2,-0.39970000000000006
RSS,https://bitcoinmagazine.com/.rss/full/,2024-10-17 17:35:36+00:00,2024-11-05 12:18:39.078109,live election day coverage bitcoinersthe firstever election day livestream event tailored specifically bitcoiners going live 3pm est november 5th,0.0,0.13636363636363635,0.06818181818181818
RSS,https://bitcoinmagazine.com/.rss/full/,2024-10-17 16:34:21+00:00,2024-11-05 12:18:39.078109,succeed bitcoin need something new samereplicating type service application legacy world bitcoin necessitates interacting legacy world giving leverage bitcoin,0.6808,0.13636363636363635,0.40858181818181816
RSS,https://bitcoinmagazine.com/.rss/full/,2024-10-16 19:24:11+00:00,2024-11-05 12:18:39.078109,elizabeth warren prof democrat still bitcointhe bitcoin industry could yet another four year harassment attack kamala harris elected president,-0.765,0.0,-0.3825
RSS,https://bitcoinmagazine.com/.rss/full/,2024-10-16 16:48:11+00:00,2024-11-05 12:18:39.078109,shinobi gaza powerful demonstration bitcoin since wikileakswhat happening gaza fact bitcoin way deliver aid gazans point one powerful demonstration bitcoin decade,0.7506,0.3,0.5253
RSS,https://bitcoinmagazine.com/.rss/full/,2024-10-16 13:00:00+00:00,2024-11-05 12:18:39.078109,bitcoins false dichotomy sov moebitcoins use store value mean exchange mutually exclusive,0.4404,-0.35625000000000007,0.042074999999999974
RSS,https://bitcoinist.com/feed/,2024-11-05 12:00:12+00:00,2024-11-05 12:18:39.078109,shiba inu lead dev proposes establish silicon valley cryptoshytoshi kusama lead developer shiba inu unveiled ambitious proposal establish strategic hub innovation blockchain shib united state city aka silicon valley crypto aiming transform selected location global epicenter blockchain technology initiative seek position u,0.8176,0.125,0.4713
RSS,https://bitcoinist.com/feed/,2024-11-05 09:00:14+00:00,2024-11-05 12:18:39.078109,michigan pension fund allocates 10m ethereum etf exceeding btc etf holdingson monday state michigan revealed substantial investment cryptocurrency exchangetraded fund etf bitcoin ethereum 13f filing u security exchange commission sec strategic move mark significant step institutional investment digital asset michigan retirement system manages approximately 144 million pension fund,0.7579,-0.03125,0.363325
RSS,https://bitcoinist.com/feed/,2024-11-05 07:00:14+00:00,2024-11-05 12:18:39.078109,a16z crypto donates nearly 30 million ahead upcoming 2026 u electionsas political landscape shift anticipation upcoming midterm election 2026 major player crypto industry making significant financial commitment support candidate advocate favorable regulatory change notably venture capital firm andreessen horowitz better known a16z pledged 23 million political action committee,0.91,0.14375000000000002,0.526875
RSS,https://bitcoinist.com/feed/,2024-11-05 04:30:50+00:00,2024-11-05 12:18:39.078109,binance founder cz responds 100 million listing fee controversyover weekend binance coinbase accused asking millionaire fee token listing igniting discussion listing requirement exchange rivalry fud fear uncertainty doubt several industry figure weighed matter including justin sun brian armstrong changpeng zhao denied claim monday related reading xrp,-0.9217,0.0,-0.46085
RSS,https://bitcoinist.com/feed/,2024-11-05 03:00:18+00:00,2024-11-05 12:18:39.078109,crypto fund hit alltime high inflow 29 billioncan growth sustainedthis year seen major surge inflow crypto investment product hitting annual record 292 billion revealed recent report coinshares weekly net inflow past week alone reached 218 billion driven various market factor influenced significantly political climate united state,0.5859,-0.003928571428571428,0.2909857142857143
RSS,https://bitcoinist.com/feed/,2024-11-05 01:30:23+00:00,2024-11-05 12:18:39.078109,comeback binance founder cz say he returning exchangebinance founder changpeng zhao cz back limelight serving four month jail one zhaos first public appearance binance blockchain week conference discussed experience future plan current relationship exchange founded related reading crypto bank danger fdic pause letter,-0.5267,0.02142857142857143,-0.25263571428571424
RSS,https://bitcoinist.com/feed/,2024-11-05 00:00:15+00:00,2024-11-05 12:18:39.078109,largest european telecom begin bitcoin mining using excess energydeutsche telekom europe largest telecommunication provider announced pioneering pilot project operate bitcoin mining infrastructure using surplus renewable energy initiative collaboration deutsche telekom subsidiary mm bankhaus metzler aiming utilize excess electricity would otherwise remain unused due grid limitation lack storage solution deutsche telekom,-0.0258,-0.0625,-0.04415
RSS,https://bitcoinist.com/feed/,2024-11-04 19:30:00+00:00,2024-11-05 12:18:39.078109,bitcoin 20 craig wright terranode pitch global payment future btcan australian entrepreneur could become key contributor future bitcoin transforming coin tool push economic inclusivity around world related reading 3ac founder wife cash 385 million singapore mansion sale craig wright looking building global payment system back,0.0,0.022222222222222223,0.011111111111111112
