MainSource,Source,Publication Date,Pull_date,Pre-Processed Text,Sentiment_Vader,Sentiment_TextBlob,Average_Sentiment
RSS,https://cointelegraph.com/rss,2024-09-24 12:53:07+01:00,2024-09-24 12:18:14.622873,bybit eye muslim investor shariahcompliant crypto account bybit launch shariahcompliant crypto account targeting muslim investor seeking investment option line islamic finance principle,0.0,0.0,0.0
RSS,https://cointelegraph.com/rss,2024-09-24 11:55:44+01:00,2024-09-24 12:18:14.622873,telegram039s policy shift raise privacy concern top messaging apps like whatsapp metas messenger also sharing user data authority valid legal request,0.7845,0.35,0.56725
RSS,https://cointelegraph.com/rss,2024-09-24 11:35:08+01:00,2024-09-24 12:18:14.622873,philippine agency empowers youth blockchain nft education philippine dostasti introduced blockchain nfts crypto youth focus realworld application fostering innovation future,0.3818,0.0,0.1909
RSS,https://cointelegraph.com/rss,2024-09-24 11:05:58+01:00,2024-09-24 12:18:14.622873,bitcoin price target rise 78k chinese stimulus package bitcoin rallied strongly previous two stimulus package announcement people bank china,0.2732,-0.08333333333333333,0.09493333333333334
RSS,https://cointelegraph.com/rss,2024-09-24 10:24:21+01:00,2024-09-24 12:18:14.622873,upbit store user data aws user know upbits privacy policy update involves transferring user data aws server u improved service reliability compliance local regulation,0.4767,0.0,0.23835
RSS,https://cointelegraph.com/rss,2024-09-24 10:14:03+01:00,2024-09-24 12:18:14.622873,bitget predicts ton detelegramization next 2 year ton toncoin cryptocurrency likely outperform spot return bitcoin bullish scenario coming year bitget predicted,0.0,0.0,0.0
RSS,https://cointelegraph.com/rss,2024-09-24 09:55:16+01:00,2024-09-24 12:18:14.622873,celsius token surge 300 month 25b payment creditor celsius token skyrocketed 300 month firm paid 25 billion creditor marking strong rebound aftermath bankruptcy settlement,0.4767,0.11666666666666667,0.29668333333333335
RSS,https://cointelegraph.com/rss,2024-09-24 09:50:53+01:00,2024-09-24 12:18:14.622873,kraken acquires dutch broker bcm part european expansion acquisition dutch broker firm key part exchange european expansion strategy ahead mica regulation,0.0,-0.05,-0.025
RSS,https://cointelegraph.com/rss,2024-09-24 09:19:36+01:00,2024-09-24 12:18:14.622873,btc price support 62k must hold bitcoin bear step trader bitcoin bull bear lining epic tug war based order book liquidity gain control btc price trend,0.296,0.1,0.198
RSS,https://cointelegraph.com/rss,2024-09-24 08:47:53+01:00,2024-09-24 12:18:14.622873,ireland eye mica guardrail democratize finance crypto central bank ireland leading call democratize finance boost financial inclusivity implementing eu mica regulation highlighting country priority,0.4019,0.0,0.20095
RSS,https://cointelegraph.com/rss,2024-09-24 08:39:45+01:00,2024-09-24 12:18:14.622873,sweden see crypto exchange professional money launderers swedish authority label certain cryptocurrency exchange key enablers organized crime highlighting four distinct moneylaundering profile,-0.2732,0.15357142857142858,-0.05981428571428571
RSS,https://cointelegraph.com/rss,2024-09-24 06:50:34+01:00,2024-09-24 12:18:14.622873,court question sec vacuous denial coinbase rulemaking petition 2022 coinbase asked sec propose adopt rule govern crypto including clarification crypto asset security,0.6808,-0.1,0.2904
RSS,https://cointelegraph.com/rss,2024-09-24 06:26:30+01:00,2024-09-24 12:18:14.622873,flappy bird never nfts crypto option revived flappy bird mobile game option use web3 spokesperson say never nfts,0.0,-0.4,-0.2
RSS,https://cointelegraph.com/rss,2024-09-24 06:18:14+01:00,2024-09-24 12:18:14.622873,openais press account hack 5th security breach 20 month hacker shilled fake openai token openais press account method reminiscent previous x hacking incident targeting firm executive,-0.1779,-0.21666666666666667,-0.19728333333333334
RSS,https://cointelegraph.com/rss,2024-09-24 04:30:55+01:00,2024-09-24 12:18:14.622873,sbfs neurodivergence saw misinterpreted trial doctor argue court jury may misunderstood sam bankmanfrieds behavior criminal trial amid autism attention deficit disorder doctor wrote amicus brief,-0.9313,-0.2,-0.56565
RSS,https://cointelegraph.com/rss,2024-09-24 03:48:35+01:00,2024-09-24 12:18:14.622873,history suggests breakout time bitcoin rekt capital bitcoin breakout could happen within next handful day according pseudonymous crypto market analyst,0.0,0.0,0.0
RSS,https://cointelegraph.com/rss,2024-09-24 03:37:57+01:00,2024-09-24 12:18:14.622873,green united loses bid dismiss 18m crypto mining fraud suit defendant accused operating fraudulent cryptomining operation sold mining equipment blockchain didnt exist,-0.8271,-0.25,-0.53855
RSS,https://cointelegraph.com/rss,2024-09-24 02:34:19+01:00,2024-09-24 12:18:14.622873,mango market mull 500k cftc settlement amid ongoing investigation solanabased decentralized exchange mango market considering offering cftc 500000 civil penalty resolve regulator allegation platform,-0.1027,0.0,-0.05135
RSS,https://cointelegraph.com/rss,2024-09-24 00:19:41+01:00,2024-09-24 12:18:14.622873,house republican urge sec rescind disastrous sab 121 republican u house representative senate claim sec evaded notice comment rulemaking process required administrative procedure act issuing sab 121,-0.5994,-0.3,-0.4497
RSS,https://cointelegraph.com/rss,2024-09-23 22:41:06+01:00,2024-09-24 12:18:14.622873,21co bitcoin wrapper add chainlink proof reserve integration come bitcoin wrapper face scrutiny custody practice,0.0,0.0,0.0
RSS,https://cointelegraph.com/rss,2024-09-23 22:26:28+01:00,2024-09-24 12:18:14.622873,drop bitcoin dominance bullish altcoin market structure trader predicting altseason analyst believe new altcoin season entering early stage cointelegraph dig data,-0.0772,0.11818181818181818,0.020490909090909087
RSS,https://cointelegraph.com/rss,2024-09-23 22:07:36+01:00,2024-09-24 12:18:14.622873,sam altman say chatgpt bring unimaginable prosperity fix climate also said itll solve physic usher era grandparent couldnt imagined,0.2023,0.0,0.10115
RSS,https://cointelegraph.com/rss,2024-09-23 21:02:44+01:00,2024-09-24 12:18:14.622873,hong kongs ehkd project expands tokenization programmability hong kong monetary authority looking potential cbdc wide perspective,0.1779,-0.05,0.06395
RSS,https://cointelegraph.com/rss,2024-09-23 21:00:08+01:00,2024-09-24 12:18:14.622873,celestia foundation secures 100m capital led bain capital crypto investment round backer include bain capital syncracy capital 1kx robot venture placeholder bringing celestias total fundraising 155 million,0.3182,-0.1,0.10909999999999999
RSS,https://cointelegraph.com/rss,2024-09-23 20:35:07+01:00,2024-09-24 12:18:14.622873,investment manager eye extraordinary upside btc option debut could potentially spark explosively recursive price upside bitcoin according one investment manager,0.2263,0.16666666666666666,0.19648333333333334
RSS,https://cointelegraph.com/rss,2024-09-23 20:34:46+01:00,2024-09-24 12:18:14.622873,solana tvl decline sol price react negatively sol recently rallied 152 decline solanas network tvl negatively impact altcoins price,0.0,-0.19999999999999998,-0.09999999999999999
RSS,https://cointelegraph.com/rss,2024-09-23 20:05:15+01:00,2024-09-24 12:18:14.622873,cftc eyeing polymarket betting platform amid u election law decoded polymarket offshore platform cftc scrutiny compliance sec german authority ramping crypto crackdown,0.0772,-0.05,0.013600000000000001
RSS,https://cointelegraph.com/rss,2024-09-23 19:31:30+01:00,2024-09-24 12:18:14.622873,ethereum gain 15 week recovery 3k back sight ethereum show strength usd btc pair network activity surge move 3000 realistic,0.765,0.08333333333333333,0.4241666666666667
RSS,https://cointelegraph.com/rss,2024-09-23 19:20:49+01:00,2024-09-24 12:18:14.622873,bitcoins bottom slowly erodes whale wallet increase 3 number wallet le 10 btc swelled 75 period cryptocurrencys middle class shrank,0.3818,-0.15000000000000002,0.11589999999999998
RSS,https://cointelegraph.com/rss,2024-09-23 18:26:41+01:00,2024-09-24 12:18:14.622873,digital asset dtcc complete collateral tokenization pilot project aimed speed privacy legal compliance using highly accessible desirable u treasury bond collateral asset,0.835,0.16875,0.501875
RSS,https://bitcoinmagazine.com/.rss/full/,2024-09-23 17:53:49+00:00,2024-09-24 12:18:14.622873,bitcoin fork pathway innovation disruptive forcesa look history major bitcoin fork,0.0772,0.0625,0.06985
RSS,https://bitcoinmagazine.com/.rss/full/,2024-09-23 13:31:05+00:00,2024-09-24 12:18:14.622873,donald trump say crypto could help pay 35 trillion u debtdonald trump floated using crypto pay u 35 trillion debt part embrace bitcoin amid 2024 race kamala harris also pledged boost digital asset signaling cryptos growing bipartisan appeal,0.765,0.0,0.3825
RSS,https://bitcoinmagazine.com/.rss/full/,2024-09-20 21:42:07+00:00,2024-09-24 12:18:14.622873,sec approves option trading blackrocks spot bitcoin etf ibitthe sec approved listing trading option blackrocks ishares bitcoin trust marking significant milestone bitcoin integration traditional finance,0.8625,0.04375,0.453125
RSS,https://bitcoinmagazine.com/.rss/full/,2024-09-20 16:30:47+00:00,2024-09-24 12:18:14.622873,bitcoin react u electioncan historical election trend predict bitcoins next move,0.0,0.0,0.0
RSS,https://bitcoinmagazine.com/.rss/full/,2024-09-20 14:52:09+00:00,2024-09-24 12:18:14.622873,microstrategy buy additional 489 billion worth bitcoinmicrostrategy purchased additional 489 million bitcoin swelling corporate bitcoin treasury 252000 btc worth nearly 10 billion company bitcoin strategy aim boost return hedge inflation,0.743,0.175,0.45899999999999996
RSS,https://bitcoinmagazine.com/.rss/full/,2024-09-20 14:10:48+00:00,2024-09-24 12:18:14.622873,santa monica bitcoin office case study presented cmrta annual conferenceproof workforce santa monicas vice mayor present case study city innovative bitcoin office cmrta annual conference office first kind u aim educate bitcoin support economic recovery,0.8402,0.31,0.5751
RSS,https://bitcoinmagazine.com/.rss/full/,2024-09-20 09:20:12+00:00,2024-09-24 12:18:14.622873,satoshi era wallet moved 16 million worth bitcoinaround 250 btc bitcoins early day transferred 15 year inactivity revealing huge reward reaped early miner 16 million worth satoshi era coin highlight conviction pioneering hodlers,0.8807,0.24,0.56035
RSS,https://bitcoinmagazine.com/.rss/full/,2024-09-19 22:44:29+00:00,2024-09-24 12:18:14.622873,bipartisan consensus emerges final day america love crypto tourcoinbase ceo brian armstrong congressman wiley nickel dnc emphasized need united state decisively lead crypto policy bipartisan manner,0.7906,0.25,0.5203
RSS,https://bitcoinmagazine.com/.rss/full/,2024-09-19 20:26:27+00:00,2024-09-24 12:18:14.622873,hut 8 bitmain launch nextgeneration asic bitcoin miner liquidtochip coolingthese mining giant join force release u3s21exph nextgeneration asic miner featuring advanced liquidtochip cooling technology,0.4939,0.2,0.34695
RSS,https://bitcoinmagazine.com/.rss/full/,2024-09-19 16:01:04+00:00,2024-09-24 12:18:14.622873,celebrating 10 year hardware wallet revolutiona look back start hardware wallet bitcoin space,0.5719,0.0,0.28595
RSS,https://bitcoinmagazine.com/.rss/full/,2024-09-19 12:22:17+00:00,2024-09-24 12:18:14.622873,germany commerzbank dz bank offer bitcoin crypto tradinggermanys two large bank commerzbank dz bank launching bitcoin crypto trading service amid growing demand,0.0516,0.21428571428571427,0.13294285714285714
RSS,https://bitcoinmagazine.com/.rss/full/,2024-09-18 22:59:20+00:00,2024-09-24 12:18:14.622873,donald trump make historic bitcoin payment pubkeyformer u president republican presidential nominee donald trump becomes first u president publicly transact bitcoin,0.0,0.08333333333333333,0.041666666666666664
RSS,https://bitcoinmagazine.com/.rss/full/,2024-09-18 22:30:01+00:00,2024-09-24 12:18:14.622873,louisiana state government accepts bitcoin lightning paymentlouisiana become one first u state accept bitcoin government payment offering resident flexible option transaction,0.7003,0.25,0.47515
RSS,https://bitcoinmagazine.com/.rss/full/,2024-09-18 19:58:31+00:00,2024-09-24 12:18:14.622873,fractal bitcoin misleading affinitya quick look socalled sidechain fractal bitcoin,-0.4019,0.3333333333333333,-0.03428333333333333
RSS,https://bitcoinmagazine.com/.rss/full/,2024-09-18 18:29:12+00:00,2024-09-24 12:18:14.622873,federal reserve cut interest rate 50 basis point address economic uncertaintythe federal reserve lowered interest rate 50 basis point today marking first significant cut four year,0.4767,0.27499999999999997,0.37585
RSS,https://bitcoinmagazine.com/.rss/full/,2024-09-18 14:05:22+00:00,2024-09-24 12:18:14.622873,picklebit proof workforce fold pickle pop partner pickleball tournament offer bitcoin prize poolthe tournament held santa monica peer pier bitcoin festival feature semipro amateur division awarding 5000 prize pool paid bitcoin,0.9136,-0.25,0.3318
RSS,https://bitcoinmagazine.com/.rss/full/,2024-09-18 14:05:06+00:00,2024-09-24 12:18:14.622873,river secures 800 million worth bitcoin launch proof reserveriver launched transparency tool proving hold 800 million worth bitcoin full reserve custody u exchange aim rebuild trust failure like ftx new river proof reserve,0.7964,0.15393939393939393,0.47516969696969696
RSS,https://bitcoinmagazine.com/.rss/full/,2024-09-18 10:34:49+00:00,2024-09-24 12:18:14.622873,blackrock release new report bitcoin unique diversifierblackrock released new report explaining bitcoin unique portfolio diversifier detached asset world largest asset manager continues embracing bitcoin adoption gain mainstream acceptance,0.872,0.2556818181818182,0.5638409090909091
RSS,https://bitcoinmagazine.com/.rss/full/,2024-09-17 22:59:22+00:00,2024-09-24 12:18:14.622873,samourai developer appear together court first time status conferencedefense attorney keonne rodriguez william lonergan hill continue argue developer didnt operate money transmitting business samourai rodriguez request modification bail condition,-0.34,0.25,-0.04500000000000001
RSS,https://bitcoinmagazine.com/.rss/full/,2024-09-17 16:34:57+00:00,2024-09-24 12:18:14.622873,key battleground state pennsylvania host day five america love crypto tourresidents pennsylvania key u swing state upcoming u presidential election come support probitcoin procrypto future united state,0.7906,0.125,0.4578
RSS,https://bitcoinmagazine.com/.rss/full/,2024-09-17 16:21:53+00:00,2024-09-24 12:18:14.622873,regulating bitcoin crypto nigeria crossroad capital control financial freedoma call sensible measured bitcoin regulation nigerian government,0.0,0.0,0.0
RSS,https://bitcoinmagazine.com/.rss/full/,2024-09-17 14:00:00+00:00,2024-09-24 12:18:14.622873,human right foundation grant 10 bitcoin 20 project worldwidethe human right foundation announced latest round grant totaling 1 billion satoshis worth 590000,0.7096,0.1673469387755102,0.4384734693877551
RSS,https://bitcoinmagazine.com/.rss/full/,2024-09-17 13:37:36+00:00,2024-09-24 12:18:14.622873,bitcoins future payment overcoming stablecoin dominance fiatless fiat bitcoin stable channel supported lightning network could introduce novel peertopeer payment infrastructure rival stablecoins,0.765,0.0,0.3825
RSS,https://bitcoinmagazine.com/.rss/full/,2024-09-17 11:58:05+00:00,2024-09-24 12:18:14.622873,singapore db bank launch bitcoin crypto option institutionssingapores largest bank db begin offering otc bitcoin crypto option trading institutional client q4 2024 db first major asian bank providing sophisticated bitcoin derivative amid rising allocation demand,0.4767,0.203125,0.3399125
RSS,https://bitcoinmagazine.com/.rss/full/,2024-09-17 11:35:43+00:00,2024-09-24 12:18:14.622873,arthur hayes family office fund bitcoin core developerarthur hayes family office maelstrom awarded first grant bitcoin developer program contributor rkrux funding support rkrux working fulltime contributing bitcoin core open source project,0.7845,0.125,0.45475
RSS,https://bitcoinmagazine.com/.rss/full/,2024-09-16 21:03:54+00:00,2024-09-24 12:18:14.622873,microstrategy announces 700 million raise redeem senior secured note buy bitcoinmicrostrategy use net proceeds offering redeem senior secured note due 2028 acquire additional bitcoin,0.6597,-0.0625,0.2986
RSS,https://bitcoinmagazine.com/.rss/full/,2024-09-16 19:40:50+00:00,2024-09-24 12:18:14.622873,financial anarchist manifestousing technology like nostr chaumian ecash financial anarchist challenge status quo aiming reclaim economic sovereignty disrupt centralized financial power bitcoin,0.4215,0.05,0.23575
RSS,https://bitcoinmagazine.com/.rss/full/,2024-09-16 19:14:18+00:00,2024-09-24 12:18:14.622873,bitcoin crypto voter make voice heard america love crypto stop wisconsinwisconsin ready move past partisanship unifying force bitcoin crypto ahead 2024 election,0.6705,0.15,0.41025
RSS,https://bitcoinmagazine.com/.rss/full/,2024-09-16 16:42:08+00:00,2024-09-24 12:18:14.622873,bhutan bitcoin holding revealed kingdom owns 780m btc miningbhutans growing bitcoin empire revealed 780 million btc acquired extensive mining operation powered nation renewable energy resource,0.4215,0.0,0.21075
RSS,https://bitcoinmagazine.com/.rss/full/,2024-09-16 16:21:17+00:00,2024-09-24 12:18:14.622873,urgent need bitcoin tax reform encourage everyday usean argument tax treatment bitcoin massive disincentive use commerce,0.3818,-0.1,0.14089999999999997
RSS,https://bitcoinmagazine.com/.rss/full/,2024-09-16 14:00:08+00:00,2024-09-24 12:18:14.622873,mi primer bitcoin promotes two staff member leadership rolesthe opensource bitcoin education platform founded el salvador move two member inhouse talent one native salvadoran supervisory position,0.6369,0.0,0.31845
RSS,https://bitcoinmagazine.com/.rss/full/,2024-09-16 13:26:09+00:00,2024-09-24 12:18:14.622873,bitcoin mining shutdown cause 20 surge electricity billsthe shutdown bitcoin mining facility norway caused 20 increase electricity bill town resident loss mining operation revenue forced local power company raise rate offset cost,-0.4588,-0.15000000000000002,-0.3044
RSS,https://bitcoinmagazine.com/.rss/full/,2024-09-13 20:20:40+00:00,2024-09-24 12:18:14.622873,detroit aim drive digital asset innovation day three america love crypto tourthe motor city state michigan see opportunity creating businessfriendly environment bitcoin crypto industry welcoming stand crypto alliance,0.9451,0.25,0.59755
RSS,https://bitcoinmagazine.com/.rss/full/,2024-09-13 20:09:00+00:00,2024-09-24 12:18:14.622873,bitcoin surge 60000 market brace potential fed rate cutbitcoin touch 60000 ahead potential interest rate cut federal reserve signaling market optimism amid falling reported inflation data,0.5859,0.0,0.29295
RSS,https://bitcoinmagazine.com/.rss/full/,2024-09-13 17:30:36+00:00,2024-09-24 12:18:14.622873,bitcoin price action expect next bitcoins path forward insight price target support resistance zone,0.4019,0.05,0.22594999999999998
RSS,https://bitcoinmagazine.com/.rss/full/,2024-09-13 13:02:18+00:00,2024-09-24 12:18:14.622873,microstrategy buy additional 111 billion worth bitcoinmicrostrategy purchased additional 18300 bitcoins 111 billion boosting total bitcoin trove 244800 btc acquired 945 billion company continues bitcoin accumulation strategy capitalizing btc appreciation,0.765,0.15,0.4575
RSS,https://bitcoinmagazine.com/.rss/full/,2024-09-13 10:28:54+00:00,2024-09-24 12:18:14.622873,bitcoin crypto exchange htx integrate lightning networkone leading bitcoin crypto exchange htx announced integration bitcoins lightning network enable faster cheaper payment,0.0,0.0,0.0
RSS,https://bitcoinmagazine.com/.rss/full/,2024-09-12 15:49:09+00:00,2024-09-24 12:18:14.622873,trump election victory could send bitcoin 125000 say standard chartered analysta trump win could fuel bitcoin rally though new alltime high expected regardless 2024 election outcome,0.5859,0.1992727272727273,0.3925863636363636
RSS,https://bitcoinmagazine.com/.rss/full/,2024-09-12 13:00:00+00:00,2024-09-24 12:18:14.622873,revolutionizing bitcoin mining power threephase systemswhy threephase electrical system offer competitive advantage miner asic efficiency gain tapering,0.8225,0.0,0.41125
RSS,https://bitcoinmagazine.com/.rss/full/,2024-09-11 18:40:01+00:00,2024-09-24 12:18:14.622873,bitcoin vault future bitcoin custodyas bitcoin grows value popularity custody solution become critical learn bitcoin vault importance custody space,0.7906,0.0,0.3953
RSS,https://bitcoinmagazine.com/.rss/full/,2024-09-11 17:06:05+00:00,2024-09-24 12:18:14.622873,uk parliament introduces bill recognize bitcoin crypto personal propertythe new legislation aim provide legal clarity protection bitcoin digital asset owner,0.6908,0.08409090909090909,0.38744545454545454
RSS,https://bitcoinmagazine.com/.rss/full/,2024-09-11 15:31:02+00:00,2024-09-24 12:18:14.622873,el salvador bitcoin office celebrates 21 month success set stage renaissance 20the national bitcoin office onbtc office president el salvador led stacy herbert aim help integrate bitcoin el salvador economy foster cultural artistic psychological renaissance,0.8779,0.18333333333333335,0.5306166666666667
RSS,https://bitcoinmagazine.com/.rss/full/,2024-09-11 13:00:00+00:00,2024-09-24 12:18:14.622873,early bitcoin developer back satoshi nakamoto theorya bitcoin developer 2010 gone public support theory project anonymous founder,0.4019,0.03333333333333333,0.21761666666666665
RSS,https://bitcoinmagazine.com/.rss/full/,2024-09-11 12:14:47+00:00,2024-09-24 12:18:14.622873,bitcoin mining difficulty hit record 92 trillionthe bitcoin mining difficulty hit record high 9267 trillion september 11 displaying intensifying competition network rise indicates greater security surging collective computing power dedicated mining bitcoin,0.4767,0.33,0.40335
RSS,https://bitcoinmagazine.com/.rss/full/,2024-09-10 21:23:09+00:00,2024-09-24 12:18:14.622873,standard chartered bank launch bitcoin crypto custody service uaethe international banking group granted licence dubai financial service authority allowing custody client digital asset,0.5859,0.0,0.29295
RSS,https://bitcoinmagazine.com/.rss/full/,2024-09-10 17:59:33+00:00,2024-09-24 12:18:14.622873,un ode de lprovocateur du bitcoina poem written loosely haiku style enza coin,0.0,-0.07692307692307693,-0.038461538461538464
RSS,https://bitcoinmagazine.com/.rss/full/,2024-09-10 09:40:25+00:00,2024-09-24 12:18:14.622873,metaplanet buy additional 300 million worth bitcoinpubliclylisted metaplanet purchased additional 300 million 22m bitcoin bringing total holding 3988 btc bought 375 billion 276m,0.2263,0.15,0.18814999999999998
RSS,https://bitcoinmagazine.com/.rss/full/,2024-09-09 21:47:47+00:00,2024-09-24 12:18:14.622873,give timeon bitcoin saturn synchronicity privacy issue,0.0,0.0,0.0
RSS,https://bitcoinmagazine.com/.rss/full/,2024-09-09 17:00:00+00:00,2024-09-24 12:18:14.622873,introducing bitcoin report new monthly digest bitcoin magazine probitcoin magazine pro launch bitcoin report monthly digest offering key insight bitcoin trend onchain analysis price forecast mustread investor inaugural august edition free download,0.5106,0.1787878787878788,0.34469393939393944
RSS,https://bitcoinmagazine.com/.rss/full/,2024-09-09 16:13:00+00:00,2024-09-24 12:18:14.622873,bitcoin rollups rock hard placea look scalability limit rollups choice making decision regarding maximizing,-0.1027,-0.2916666666666667,-0.19718333333333335
RSS,https://bitcoinist.com/feed/,2024-09-24 12:00:19+00:00,2024-09-24 12:18:14.622873,top 3 altcoins buy explosive growth october 24th solana cardano goodeggthe cryptocurrency market known volatility also mean massive opportunity know look bull market around corner investor scrambling find next big winner october approach three altcoins standing top pick explosive growth solana,0.9246,0.11458333333333333,0.5195916666666667
RSS,https://bitcoinist.com/feed/,2024-09-24 11:30:25+00:00,2024-09-24 12:18:14.622873,polymarket gear 50 million raise potential token debutpolymarket decentralized prediction market platform reportedly seeking secure 50 million new funding round considering launching token potential development could mark significant moment crypto space especially market continues recover downturn 2022 related reading digital asset,0.6908,0.07904040404040405,0.384920202020202
RSS,https://bitcoinist.com/feed/,2024-09-24 10:00:09+00:00,2024-09-24 12:18:14.622873,1 milestone dogecoin loom market expert reveals shocking timelinethe early aftermath recent federal reserve fed interest rate cut positive general crypto industry major asset like dogecoin displaying optimistic sentiment positive performance prompted several bullish prediction doge analyst predicting dogthemed meme coin could reach unprecedented height,0.9095,0.029671717171717175,0.46958585858585855
RSS,https://bitcoinist.com/feed/,2024-09-24 08:30:20+00:00,2024-09-24 12:18:14.622873,here many new bitcoin millionaire made 2024with market recovery 2024 number newly minted bitcoin millionaire rise given btc price actually touched new alltime high year number bitcoin wallet holding balance least 1 million skyrocket report take look,0.1531,0.10987012987012987,0.13148506493506495
RSS,https://bitcoinist.com/feed/,2024-09-24 07:00:29+00:00,2024-09-24 12:18:14.622873,ftx client testimony indicates imminent 16 billion distribution progressas year draw close significant development emerging fallout defunct cryptocurrency exchange ftx led convicted founder sam bankmanfried month anticipation sign payouts ftx customer affected exchange collapse two year ago finally horizon 16 billion,-0.3818,0.1875,-0.09714999999999999
