MainSource,Source,Publication Date,Pull_date,Pre-Processed Text,Sentiment_Vader,Sentiment_TextBlob,Average_Sentiment
Reddit,solana,2024-12-11 22:24:41,2024-12-13 12:20:19.654237,safest trading platform allowing limit buy sell order solana token read lot negative sol platform allow limit order either working properly fund stolen please comment experience,-0.25,-0.15,-0.2
Reddit,solana,2024-12-11 22:09:50,2024-12-13 12:20:19.654237,jito transactionshow transaction example buy sell memecoins bullx work understand 1 bullx fee priority bribe fee priority bribe fee step process transaction help hell jito completing transaction,-0.6705,0.0,-0.33525
Reddit,solana,2024-12-11 17:29:52,2024-12-13 12:20:19.654237,popcat phantom 107 geko 124 differenceim new trading decentralized exchange using phantom wallet jupiter im finding somethings frustrating someone tell popcat phantom le coin gecko seemed match earlier today 107 phantom whereas 124 everywhere else thanks help,0.4019,-0.015909090909090914,0.19299545454545453
Reddit,solana,2024-12-11 02:06:12,2024-12-13 12:20:19.654237,deal sniper every meme coin launchim seriously every time team drop launch like sniper waiting bot locked loaded buying everything blink flipping people even hit confirm killing vibe making tough real one get fair shot im looking tip strategy even alpha counter sniper make le appealing mess drop anybody found way level playing field appreciate advice insightslets outsmart bot together,-0.6124,0.0837962962962963,-0.2643018518518519
Reddit,solana,2024-12-11 16:04:29,2024-12-13 12:20:19.654237,anyone else constant issue unstaking marinade financeive noticed every time try unstake marinade transaction fails even increase slippage set priority fast cant remove staked sol dont know anyone struggled might know answer annoying product,-0.2878,-0.275,-0.2814
Reddit,solana,2024-12-11 18:34:27,2024-12-13 12:20:19.654237,lightspeed podcast everything need know doublezero austin federa,0.0,0.0,0.0
Reddit,solana,2024-12-11 17:52:59,2024-12-13 12:20:19.654237,jito bundle v normal transactionswhat difference bundled jito transaction faster normal transaction,0.0,0.15,0.075
Reddit,solana,2024-12-11 23:34:35,2024-12-13 12:20:19.654237,today lost money scami using gmgnaihttpgmgnai today first time going trade seemed neat trade savvy sent sol bought coin coin getting volatile getting sell position tried initiate sell wasnt able sell limit order wouldnt work sell button wouldnt work tried increasing slippage 55 tried turning mev tried increasing priority fee tried disconnecting reconnecting wallet prevail couldnt sell position panicked coin started drop went gmgnaihttpgmgnai telegram started messaging made biggest mistake got messaged someone thought gmgnai yeah also first time ever using telegram anything wallet wise idea got tricked giving person private key telegram desperate dumb probably cause lack sleep trading memecoins wallet cleared lost life saving im devastated sad thing could prevented didnt used gmgnai hope learn mistake yeah go ahead laugh best way end year right,-0.5894,0.15089285714285716,-0.21925357142857144
Reddit,solana,2024-12-11 15:58:39,2024-12-13 12:20:19.654237,paying dex work understand anyone pay dex someone pay dex make look trash wrong link whats stopping people stealing dex putting scam link,-0.9169,-0.5,-0.70845
Reddit,solana,2024-12-10 15:33:04,2024-12-13 12:20:19.654237,dont worry everyone fixed,0.3412,0.1,0.22060000000000002
Reddit,solana,2024-12-11 15:31:58,2024-12-13 12:20:19.654237,looking tool tell wallet interacted list coinsi got profitable telegram channel ca posted profitable meme least first minute want able deduct wallet channel using buy meme tool input bunch contract adresses would give wallet interacted least ca,0.7269,0.037500000000000006,0.3822
Reddit,solana,2024-12-11 00:38:50,2024-12-13 12:20:19.654237,question dust attacksfrom little research reckon call dust attack post read people experience people comment dont accept im confused didnt option accept reject ended wallet another question would eventually want cash sol actually bought sol scam transaction jumbled received right sent shtuff cb wallet coinbase,-0.7682,-0.07544642857142858,-0.4218232142857143
Reddit,solana,2024-12-11 14:53:20,2024-12-13 12:20:19.654237,cardano solana rivalry seamless interoperabilityhttpspreviewreddita6258n9lf86e1pngwidth1600formatpngautowebps3e685ede1846dd3567ae0d21f73318f91a84f5e1 year cardanohttpscardanoorg solanahttpssolanacom leader blockchain space distinct strength dedicated community cardano known researchdriven approach emphasizing scalability security solana hand recognized speed efficiency making goto choice defi meme coin two ecosystem often seen rival competing shape future blockchain didnt compete two powerhouse could actually work together thats exactly wanchainhttpswwwwanchainorg making possible building bridge cardano solana wanchain creating new paradigm blockchains collaborate future crosschain transfer wanchain imagine youre holding usdc cardano want use solanas fastpaced defi environment past would required multiple step centralized exchange plenty headache thanks wanchains newly launched bridge transferring usdc usdt cardano solana seamless direct thats beginning soon youll able move sol two blockchains well isnt technical breakthroughits significant step toward making blockchain interconnected userfriendly interoperability matter core interoperability mean breaking barrier blockchains allowing work together rather compete isolation user brings simplified transaction move asset cardano solana without hassle centralized exchange complex process defi option access liquidity pool staking opportunity yield farm across ecosystem greater innovation developer build application leverage cardanos robust security alongside solanas speed scalability bigger picture bridging cardano solana wanchain setting new standard collaboration blockchain space onceisolated ecosystem connected opening door new opportunity shared growth whether youre defi enthusiast developer simply curious blockchain perfect time explore whats possible visit wanchain bridge experience future interoperability wanchain wanchain decentralized interoperable crosschain solution established 2017 promotes blockchain adoption crosschain interoperability building fully decentralized direct bridge connect world many isolated blockchain network official link wanchain bridgehttpsbridgewanchainorgassetbridge wanchain websitehttpswwwwanchainorg wanchain twitterhttpstwittercomwanchain_org,0.993,0.12026515151515152,0.5566325757575757
Reddit,solana,2024-12-11 13:13:39,2024-12-13 12:20:19.654237,invest jupiter liquidity pool back perpetualthe brief description jupiter website brief dont get work buy jlp thats like would buy coin keep wallet jlp balance increase time supposed yirld obtained simply value jlp going even getting wrong one provide liquidity coin say sol usdt,0.4767,-0.1,0.18835000000000002
Reddit,solana,2024-12-11 12:07:33,2024-12-13 12:20:19.654237,nova really fastest telegram bothey guy ive using nova much recently lot faster trojan filling really good wondering really bot faster nova right interest thanks,0.8439,0.2642857142857143,0.5540928571428572
Reddit,solana,2024-12-10 23:33:08,2024-12-13 12:20:19.654237,pumpfun pumpscam still worth hype breeding ground scammer,0.2263,0.3,0.26315
Reddit,solana,2024-12-11 03:03:39,2024-12-13 12:20:19.654237,sol staked solflare stopped issuing reward hasnt updated reward since epoch 705should unstake restake checked solscaniohttpsolscanio confirmed werent new reward since epoch 705 sol solflare validator im confused,-0.6701,0.04545454545454545,-0.3123227272727273
Reddit,solana,2024-12-11 13:56:39,2024-12-13 12:20:19.654237,know human coin human app built solanayes theyre built solana actually like pumpfun real people recently big solana influencers started verifying token let discus,0.3612,0.04,0.2006
Reddit,solana,2024-12-11 00:12:30,2024-12-13 12:20:19.654237,looking filter coin looking filter filter coin old would like target coin least week old advice,0.3612,-0.033333333333333326,0.16393333333333335
Reddit,solana,2024-12-10 19:26:42,2024-12-13 12:20:19.654237,solana quantumproofi guess many noticed yesterday google announced huge advancement chip technology showed willow newest version quantum chipshttpsbloggoogletechnologyresearchgooglewillowquantumchip capable solving super complex problem would normally resolved thousand million year normal computer 5 min course pose risk blockchain technologyhttpsthequantuminsidercom20240908blockchainandquantumcomputingareonacollisioncourseexpertwarns could solana made quantomproof working already,0.7964,0.2047619047619047,0.5005809523809523
Reddit,solana,2024-12-11 03:21:34,2024-12-13 12:20:19.654237,anyone else use nova clickhey guy nova bot came new update chrome extension able linked onto photon bull x honestly cheat code way faster photon bull x filling snipe straight away using nova photon bull x wondering anyone else used execute snipe still need go telegram setup task make automatically set need click run thanks,0.5859,0.32727272727272727,0.4565863636363636
Reddit,solana,2024-12-11 02:22:26,2024-12-13 12:20:19.654237,buy multiple wallet timeive juggling bunch wallet lately since thing finally picking getting profitable helping friend even offering cut managing wallet im looking easy use app tool let trade meme coin across multiple wallet without hassle solid recommendation thanks advance,0.8899,0.04761904761904762,0.46875952380952385
Reddit,solana,2024-12-11 05:59:33,2024-12-13 12:20:19.654237,anyone hosting private rpc im looking rent server hosting rpc node im looking advice feedback need lowest latency possible lot getaccountsinfo call possible geyseryellowstone plugin need historical data got experience hosting rpc node,-0.3818,0.0,-0.1909
Reddit,solana,2024-12-10 20:47:56,2024-12-13 12:20:19.654237,best telegram trading bot atmi interested trading bot telegram whats best moment ive read bonkbot photon maestro many one would recommend,0.9274,0.6875,0.80745
Reddit,solana,2024-12-11 05:30:32,2024-12-13 12:20:19.654237,coinbase usdc phantom sol buy sol coinbase transferwhich one cheaper feestaxes also keep hearing jupiter dont understand yet applies equation,0.0,0.0,0.0
Reddit,ethereum,2024-12-10 13:01:17,2024-12-13 12:20:19.654237,weekly discussion thread buildinghello rethereum welcome weekly discussion thread building space developer entrepreneur enthusiast showcase project share idea seek feedback greater ethereum community share project whether youre developing decentralized application dapp launching new layer 2 network working ethereum infrastructure encourage share detail project please provide concise overview including purpose current status link information provide xtwitter youtube link post automatically filtered engage collaborate thread excellent opportunity connect likeminded individual application tester feel free ask question offer feedback seek collaboration safety reminder encourage sharing collaboration please cautious potential scam avoid connecting wallet unfamiliar application without thorough research utilizing wallet tool offer transaction simulation eg rabby walletguard help ensure safety fund never give seed phrase private key looking forward hearing pushing ethereum ecosystem forward,0.9908,0.26694214876033057,0.6288710743801653
Reddit,ethereum,2024-12-13 07:01:10,2024-12-13 12:20:19.654237,daily general discussion december 13 2024welcome today daily general discussion please use thread discus ethereum topic news event even price yes trying something new allow price discussion thread price discussion posted elsewhere subreddit continue removed always keep friendly follow sub rule ticker eth,0.8442,0.10189393939393938,0.4730469696969697
Reddit,ethereum,2024-12-12 19:28:54,2024-12-13 12:20:19.654237,eigenlayer commits 1 token supply protocol guild fund ethereum core development,0.0258,0.0,0.0129
Reddit,ethereum,2024-12-13 10:18:17,2024-12-13 12:20:19.654237,community thought light clientscurious everyone think light client long term viability get bit disheartened much conversation around blockchain focus application developed economy seems addressing problem related finance environment energy compute power political stability relatively consistent ethereum become ubiquitous global settlement interaction layer need consider broader challenge like scalability resource constraint scarcity everywhere light client basically main thing vitalik talk momenthttps22649712fs1hubspotusercontentna1nethubfs22649712blogimages1730972303718inlineimagejpg ef seems funding fair project light client useful provide least capability available full client includes ability submit transaction provide read access onchain data verify belongs canonical chain present ethereum light client provide capability standalone peertopeer application run device capability still development team working area focusing able verify data untrusted endpoint given node provider project light client running already helioshttpsgithubcoma16zhelios lodestarhttpschainsafegithubiolodestarlibrarieslightclientproverlightclient nimbushttpsnimbusguideellightclienthtml pier twohttpspiertwolandingsitegitnewdesignpiertwovercelapplantern beta version light client c run well free censorshipresistant lightweight access ethereum light client seem unlock range practical application extend ethereums utility realworld scenario mobilecompatible light client trustless access smart contract state enable device like smart lock controlled using digital signature private key ethereum smart contract allow feature like key rotation multisig recovery ensuring access restored private key lost without relying centralised system world dominated aigenerated content light client help verify authenticity humangenerated material leveraging ethereums immutability trustless nature potential use case include supporting realworld use case like smart lock device leveraging ethereums security verifying authenticity good supply chain tracking,0.9865,0.2262515262515263,0.6063757631257631
Reddit,ethereum,2024-12-12 19:27:29,2024-12-13 12:20:19.654237,aligned layer pledge 15 align token supply funding ethereum core development via protocol guild,0.0,0.0,0.0
Reddit,ethereum,2024-12-13 09:02:18,2024-12-13 12:20:19.654237,rhino review ethereum staking journal 29 outhttpsrhinoreviewsubstackcomprhinoreviewethereumstakingjournalc7ahttpsrhinoreviewsubstackcomprhinoreviewethereumstakingjournalc7a rhino review ethereum staking journal supported ethstakerhttpsethstakercc ethstaker community deserves immense recognition unwavering support kudos dedication collaborative spirit,0.8402,0.0,0.4201
Reddit,ethereum,2024-12-12 05:43:15,2024-12-13 12:20:19.654237,sold crypto eth could run nodethis thrown away account wipe identity cant tracked wont answer dm scammer dont rich crypto since 2021 suffered lot crypto winter ive also learnt lot glad announce finally sold crypto eth whooping amount 34 eth post show ask running node know 4 10 apr complicated could potentially fuck latter reason going lot research practice jumping last thing want lose 1 start learn running node 2 good idea 3 buy secondary cheap computer purpose main computer laptop use wifi 4 connect ethernet cable run linux 5 anything else aware,-0.7289,0.09930555555555554,-0.31479722222222223
Reddit,ethereum,2024-12-12 14:29:24,2024-12-13 12:20:19.654237,tether mint additional 1 billion usdt ethereum network httpswwwbinancecomensquarepost12112024tethermintsadditional1billionusdtonethereumnetwork17425416082497httpswwwbinancecomensquarepost12112024tethermintsadditional1billionusdtonethereumnetwork17425416082497,0.0,0.0,0.0
Reddit,ethereum,2024-12-12 12:57:20,2024-12-13 12:20:19.654237,ethereums planned upgrade render polygon obsoletehello everyone please excuse ignorance regarding eths planned update tried research havent able find satisfactory answer question following think eths planned upgrade would render polygon obsolete keeping mind polygon main service speeding eth transaction offering lower transaction fee making easier eth dapss transact blockchains thanks,0.0747,0.16333333333333333,0.11901666666666666
Reddit,ethereum,2024-12-12 23:45:57,2024-12-13 12:20:19.654237,core devs consensus acdc 147 protocol call,0.0,0.0,0.0
Reddit,ethereum,2024-12-12 19:33:02,2024-12-13 12:20:19.654237,twitter space 1600 et 2100 utc eigenlayer take 1 protocol guild pledge w sreeram tim beiko trent van epps morehttpsxcomispaces1rmxpoxmgwxjnhttpsxcomispaces1rmxpoxmgwxjn,0.0,0.0,0.0
Reddit,ethereum,2024-12-12 07:01:38,2024-12-13 12:20:19.654237,daily general discussion december 12 2024welcome today daily general discussion please use thread discus ethereum topic news event even price yes trying something new allow price discussion thread price discussion posted elsewhere subreddit continue removed always keep friendly follow sub rule ticker eth,0.8442,0.10189393939393938,0.4730469696969697
Reddit,ethereum,2024-12-13 01:55:48,2024-12-13 12:20:19.654237,stolen 6000 usdt exodusabout hour ago discovered 6000 usdt stolen exodus wallet fund sent address httpsetherscaniotoken0xdac17f958d2ee523a2206206994597c13d831ec7a0xe306a67fea527c3f13bf2316894224e107b2cc73httpsetherscaniotoken0xdac17f958d2ee523a2206206994597c13d831ec7a0xe306a67fea527c3f13bf2316894224e107b2cc73 address httpsetherscaniotoken0xdac17f958d2ee523a2206206994597c13d831ec7a0x87df1c186e0aea7b220487434ac6b3b4dec362e5httpsetherscaniotoken0xdac17f958d2ee523a2206206994597c13d831ec7a0x87df1c186e0aea7b220487434ac6b3b4dec362e5 looked address etherscan seems strange 3 transaction first one occurred 20 day ago make think might scam wallet somehow related exploit detail wallet usage habit 1 use exodus iphone ive never logged wallet computer device iphone updated latest version io 2 12word seed phrase written paper stored securely nobody ever seen access paper kept safe place home never photographed shared 3 exodus wallet secured face id pin code 4 iphone setting secure ive disabled automatic downloads photo file content unknown source eg via airdrop telegram whatsapp havent installed suspicious apps clicked shady link im completely loss could happened could issue exodus app vulnerability io maybe sort phishing hacking didnt notice anyone know id really appreciate advice insight people might faced similar situation knowledge potential exploit anything investigate recover fund,-0.5756,0.125,-0.2253
Reddit,ethereum,2024-12-12 21:36:56,2024-12-13 12:20:19.654237,lost moneyhello newbee please explain happened bought token buy trx httpsetherscaniotx0xa9692098ba2ea89ec40b61ec06493d94e549d28530cc3c1f811e4cc36ced1498httpsetherscaniotx0xa9692098ba2ea89ec40b61ec06493d94e549d28530cc3c1f811e4cc36ced1498 sell 0000001 token httpsetherscaniotx0x03789cde0204a52ae8371b77e0e09e215b6b88e1eaf8d075b57d2b8797e02bc1 part,0.0,0.0,0.0
Reddit,ethereum,2024-12-12 16:20:43,2024-12-13 12:20:19.654237,selling locked liquidity guy know place sell locked liquidity platform know peertopeer bit worried getting scammed,-0.296,0.0,-0.148
Reddit,ethereum,2024-12-12 19:12:19,2024-12-13 12:20:19.654237,polygon agglayer testnet livepolygon agglayer testnet live polygon agglayer testnet scheduled live 9th december miss live,-0.1531,0.13636363636363635,-0.00836818181818183
Reddit,ethereum,2024-12-12 18:17:40,2024-12-13 12:20:19.654237,erc7683 unifying ethereum crosschain intentserc7683 simplifies multichain interaction creating unified framework intentbased action like token transfer swap many including vitalikhttpscointelegraphcomnewsvitalikbuterinbackserc7683crosschaintradestandard consider erc7683 critical component plan make l2s le fragmented improve crosschain ux user article linkhttpsresearch2077xyzerc7683unifyingethereumwithcrosschainintents 2077 research explores erc7683 aim streamline execution boost liquidity access enhance interoperability also discus challengesconsiderations associated erc7683 well implication adopting standard hope enjoy reading,0.9501,0.2,0.57505
Reddit,ethereum,2024-12-11 17:43:59,2024-12-13 12:20:19.654237,advancing evm decompilation enhancing output via llmdriven postprocessing,0.0,0.0,0.0
Reddit,ethereum,2024-12-11 12:37:04,2024-12-13 12:20:19.654237,ethereum high feesethereum solidifying position layer1 l1 settlement layer serving secure decentralized foundation layer2 l2 potentially layer3 l3 solution evolving role prioritizes scalability efficiency maintaining unparalleled security layer2 scaling ethereum adopted rollup technologysuch zk rollups optimistic rollupsalongside sidechains primary method scaling layer2s eg arbitrum zksync optimism offload computation transaction offchain significantly reducing cost increasing speed depend ethereums layer1 security data finalization ensuring trust decentralization model enables low fee highspeed transaction without compromising ethereums core principle security reliability layer3 beyond future layer3 l3 solution expected build layer2 platform offering applicationspecific optimization use case gaming defi enterpriselevel solution enhanced scalability functionality maintaining ethereum ultimate trust security layer conclusion l2 competition eth l2 competition l2 eth holding token exchanging l2 meant ethereums evolution backbone multilayered ecosystem ensures longevity fundamental importance combining robust security scalability layer2 layer3 solution ethereum remains essential infrastructure web3 empowering decentralized scalable future application industry global finance,0.9906,0.10291666666666666,0.5467583333333333
Reddit,ethereum,2024-12-11 07:01:01,2024-12-13 12:20:19.654237,daily general discussion december 11 2024welcome today daily general discussion please use thread discus ethereum topic news event even price yes trying something new allow price discussion thread price discussion posted elsewhere subreddit continue removed always keep friendly follow sub rule ticker eth,0.8442,0.10189393939393938,0.4730469696969697
Reddit,ethereum,2024-12-11 16:47:34,2024-12-13 12:20:19.654237,safe place stake ethim looking stake eth stash ledger im wondering lido safe service stake youd recommend staking getting caught ftxgemeni earn thing awhile back im lil skeptical staking also learned actual wallet v exchange,0.7184,0.1,0.4092
Reddit,ethereum,2024-12-11 17:58:57,2024-12-13 12:20:19.654237,understanding architecture ethereum light clientmy friend trying implementation eth light client cl trying understand architecture work thing look working,0.4939,0.4,0.44695
Reddit,ethereum,2024-12-11 15:29:34,2024-12-13 12:20:19.654237,borrowing crypto underrated riskyive noticed many people talk borrowing crypto something ive started recently manage liquidity without selling btc ive using coinrabbithttpsgocoinrabbitiortits quick doesnt require credit check let hold onto crypto even need fund feel like good balance flexibility security think cryptobacked loan worth carry much risk,0.7793,0.33888888888888885,0.5590944444444444
Reddit,ethereum,2024-12-10 17:00:46,2024-12-13 12:20:19.654237,quantum computing real riskdoes recent announcement google quantum computer put crypto risk httpswwwthevergecom202412924317382googlewillowquantumcomputingchipbreakthrough quantum computing need become mainstream capable getting bad actor becomes risk assuming google quantum computing developer good actor would test computer blockchain know vitalik mentioned possibility hard forking making change quantum computing becomes real risk kind curious close point,0.25,0.08981481481481483,0.16990740740740742
Reddit,ethereum,2024-12-11 04:07:43,2024-12-13 12:20:19.654237,12 day since staked eth start getting rewardsive staked coinbase ive yet see reward anyone know start earning,0.5719,0.0,0.28595
