MainSource,Source,Publication Date,Pull_date,Pre-Processed Text,Sentiment_Vader,Sentiment_TextBlob,Average_Sentiment
RSS,https://cointelegraph.com/rss,2024-09-18 01:00:00+01:00,2024-09-18 00:48:24.547856,south korea crypto market growth fueled rising premium index chainalysis korea premium index drive price surge south korea crypto market institutional trading play pivotal role,0.6124,0.5,0.5562
RSS,https://cointelegraph.com/rss,2024-09-17 22:35:00+01:00,2024-09-18 00:48:24.547856,bitcoins local market structure could push btc price new alltime high analyst analyst say bitcoins recent price action could sign path new alltime high begun,0.0,0.09896103896103896,0.04948051948051948
RSS,https://cointelegraph.com/rss,2024-09-17 22:26:53+01:00,2024-09-18 00:48:24.547856,u govt cite caroline ellison extraordinary cooperation sentencing lawyer representing former alameda research ceo requested time served supervised release outcome appeared likely filing u attorney,-0.1531,0.1111111111111111,-0.020994444444444454
RSS,https://cointelegraph.com/rss,2024-09-17 22:15:55+01:00,2024-09-18 00:48:24.547856,here happened crypto today need know happened crypto today latest news daily trend event impacting bitcoin price blockchain defi nfts web3 crypto regulation,0.0,0.25,0.125
RSS,https://cointelegraph.com/rss,2024-09-17 22:09:23+01:00,2024-09-18 00:48:24.547856,circle integrates usdc national payment system brazil mexico usdc integrated banking system brazil mexico allowing business use usdpegged stablecoin directly local financial institution,0.0,0.0,0.0
RSS,https://cointelegraph.com/rss,2024-09-17 21:43:03+01:00,2024-09-18 00:48:24.547856,wintermute launch outcomemarket u election prediction token new market feature chaos lab edge proof oracle support probably wont accessible united state,-0.5158,0.2556818181818182,-0.13005909090909093
RSS,https://cointelegraph.com/rss,2024-09-17 21:33:00+01:00,2024-09-18 00:48:24.547856,crypto market today crypto market today following bullish performance u equity market trader anticipation interest rate cut federal reserve,0.3182,0.0,0.1591
RSS,https://cointelegraph.com/rss,2024-09-17 21:15:51+01:00,2024-09-18 00:48:24.547856,procrypto trumpers suggest lost vote token launch though many donald trump supporter said nothing would stop voting republican candidate others didnt seem pleased latest crypto lending project,-0.1823,0.5,0.15885
RSS,https://cointelegraph.com/rss,2024-09-17 20:45:05+01:00,2024-09-18 00:48:24.547856,bitcoin rally 61k derivative trader still skeptical bitcoin price show strength ahead key federal reserve monetary policy decision sept 18 data suggests momentum may last,0.2263,-0.16666666666666666,0.029816666666666672
RSS,https://cointelegraph.com/rss,2024-09-17 20:13:51+01:00,2024-09-18 00:48:24.547856,usdt ton chain surpasses 1 billion token terminal tether stablecoin continues dominate rival including circe u dollar coin usdc,-0.128,0.0,-0.064
RSS,https://cointelegraph.com/rss,2024-09-17 19:52:19+01:00,2024-09-18 00:48:24.547856,xrp price today xrp price today broader crypto market rally ahead week federal reserve interest rate decision,0.4588,0.0,0.2294
RSS,https://cointelegraph.com/rss,2024-09-17 19:30:00+01:00,2024-09-18 00:48:24.547856,dragonfly capital eye 500m fourth crypto fund dragonfly new crypto fund target earlystage project crypto space 100 digitalasset startup part firm portfolio,0.0,-0.02121212121212122,-0.01060606060606061
RSS,https://cointelegraph.com/rss,2024-09-17 19:04:31+01:00,2024-09-18 00:48:24.547856,restaking spark next big rush money crypto platform including eigenlayer symbiotic karak charting new territory frontier restaking,0.2263,0.04545454545454545,0.13587727272727274
RSS,https://cointelegraph.com/rss,2024-09-17 18:30:00+01:00,2024-09-18 00:48:24.547856,sc venture invests one trading eu crypto perpetual future standard chartereds venture capital arm get toehold europe investment eu mifid iicompliant crypto platform,0.0,0.0,0.0
RSS,https://cointelegraph.com/rss,2024-09-17 18:16:49+01:00,2024-09-18 00:48:24.547856,prager metis pay 745k settle sec charge ftx audit misconduct regulator alleges prager issued two audit report ftx february 2021 april 2022 falsely represented auditing standard,-0.1027,-0.1666666666666667,-0.13468333333333335
RSS,https://cointelegraph.com/rss,2024-09-17 17:10:44+01:00,2024-09-18 00:48:24.547856,solana following ethereum sol price continues slump v bitcoin solana need hold crucial 120 support avoid potential correction 100 according market analyst,0.128,0.0,0.064
RSS,https://cointelegraph.com/rss,2024-09-17 16:47:33+01:00,2024-09-18 00:48:24.547856,stock may send bitcoin price back 50k october bitcoin spx share high correlation index u stock approach new alltime high day fed cut interest rate,0.4767,0.1140909090909091,0.29539545454545457
RSS,https://cointelegraph.com/rss,2024-09-17 16:00:46+01:00,2024-09-18 00:48:24.547856,ripple cofounder lead 10m raise decentralized clearing chris larsens contribution yellow network aim tackle liquidity fragmentation scalability capital efficiency crypto market,0.3612,0.0,0.1806
RSS,https://cointelegraph.com/rss,2024-09-17 15:12:22+01:00,2024-09-18 00:48:24.547856,binance denies blame 230m wazirx hack urge user repayment binance urged wazirx team take accountability hack compensate user loss fund,-0.7579,0.0,-0.37895
RSS,https://cointelegraph.com/rss,2024-09-17 15:04:28+01:00,2024-09-18 00:48:24.547856,paypal venmos en integration likely boost mainstream crypto adoption new integration may bring web2 web3 user together could key unlocking true mainstream crypto payment adoption,0.6705,0.12159090909090908,0.39604545454545453
RSS,https://cointelegraph.com/rss,2024-09-17 14:32:29+01:00,2024-09-18 00:48:24.547856,10000 step earn 620 day physical activity could equal even bigger 7 trillion attention economy sweat economy cofounder belief,0.0,0.0,0.0
RSS,https://cointelegraph.com/rss,2024-09-17 14:30:00+01:00,2024-09-18 00:48:24.547856,pixel host firstever web3 wedding immortal rising 2 get 400k registration web3 gamer popular gaming content creator show get married one love game love immortal rising 2 rack 400000 preregistrations launch news,0.9349,0.29000000000000004,0.6124499999999999
RSS,https://cointelegraph.com/rss,2024-09-17 14:13:23+01:00,2024-09-18 00:48:24.547856,microsoft open two ai center abu dhabi one center focus developing industry standard responsible ai use support project address key societal goal,0.6124,0.0,0.3062
RSS,https://cointelegraph.com/rss,2024-09-17 14:00:00+01:00,2024-09-18 00:48:24.547856,vitalik tell ethereum l2s stage 1 gtfo make cut according l2beat six ethereum layer 2 already reached stage 1 others still stuck stage 0,-0.4019,0.0,-0.20095
RSS,https://cointelegraph.com/rss,2024-09-17 13:07:06+01:00,2024-09-18 00:48:24.547856,ton curve finance team stablecoin swap initiative partnership introduces curve finance cfmm technology ton optimizing stablecoin swap reduced price volatility slippage,0.4588,0.0,0.2294
RSS,https://cointelegraph.com/rss,2024-09-17 11:49:53+01:00,2024-09-18 00:48:24.547856,digital chamber urge u crypto user support new nft bill crypto advocate urged american help industry flourish without misapplied security regulation,0.521,0.04545454545454545,0.2832272727272727
RSS,https://cointelegraph.com/rss,2024-09-17 10:41:39+01:00,2024-09-18 00:48:24.547856,bitcoin poised volatility ahead u interest rate decision analyst fed expected deliver first interest rate cut since pandemic could introduce volatility next bitcoin leg,0.7096,0.049999999999999996,0.3798
RSS,https://cointelegraph.com/rss,2024-09-17 10:18:39+01:00,2024-09-18 00:48:24.547856,hong kong prepares ai guideline finance sector hong kongs government plan regulate ai finance issuing policy upcoming fintech week,0.0,0.0,0.0
RSS,https://cointelegraph.com/rss,2024-09-17 10:09:48+01:00,2024-09-18 00:48:24.547856,privacy missing ingredient business blockchain adoption ey exec paul brody eys global blockchain leader highlight privacy missing piece blockchain adoption business provides potential solution enterprise concern,0.0772,-0.1,-0.0114
RSS,https://cointelegraph.com/rss,2024-09-17 09:37:18+01:00,2024-09-18 00:48:24.547856,bitcoin trader say still early call btc price bottom btc price performance fails convince commentator bitcoin wood,-0.2023,-0.2,-0.20115
RSS,https://bitcoinmagazine.com/.rss/full/,2024-09-17 22:59:22+00:00,2024-09-18 00:48:24.547856,samourai developer appear together court first time status conferencedefense attorney keonne rodriguez william lonergan hill continue argue developer didnt operate money transmitting business samourai rodriguez request modification bail condition,-0.34,0.25,-0.04500000000000001
RSS,https://bitcoinmagazine.com/.rss/full/,2024-09-17 16:34:57+00:00,2024-09-18 00:48:24.547856,key battleground state pennsylvania host day five america love crypto tourresidents pennsylvania key u swing state upcoming u presidential election come support probitcoin procrypto future united state,0.7906,0.125,0.4578
RSS,https://bitcoinmagazine.com/.rss/full/,2024-09-17 16:21:53+00:00,2024-09-18 00:48:24.547856,regulating bitcoin crypto nigeria crossroad capital control financial freedoma call sensible measured bitcoin regulation nigerian government,0.0,0.0,0.0
RSS,https://bitcoinmagazine.com/.rss/full/,2024-09-17 14:00:00+00:00,2024-09-18 00:48:24.547856,human right foundation grant 10 bitcoin 20 project worldwidethe human right foundation announced latest round grant totaling 1 billion satoshis worth 590000,0.7096,0.1673469387755102,0.4384734693877551
RSS,https://bitcoinmagazine.com/.rss/full/,2024-09-17 13:37:36+00:00,2024-09-18 00:48:24.547856,bitcoins future payment overcoming stablecoin dominance fiatless fiat bitcoin stable channel supported lightning network could introduce novel peertopeer payment infrastructure rival stablecoins,0.765,0.0,0.3825
RSS,https://bitcoinmagazine.com/.rss/full/,2024-09-17 11:58:05+00:00,2024-09-18 00:48:24.547856,singapore db bank launch bitcoin crypto option institutionssingapores largest bank db begin offering otc bitcoin crypto option trading institutional client q4 2024 db first major asian bank providing sophisticated bitcoin derivative amid rising allocation demand,0.4767,0.203125,0.3399125
RSS,https://bitcoinmagazine.com/.rss/full/,2024-09-17 11:35:43+00:00,2024-09-18 00:48:24.547856,arthur hayes family office fund bitcoin core developerarthur hayes family office maelstrom awarded first grant bitcoin developer program contributor rkrux funding support rkrux working fulltime contributing bitcoin core open source project,0.7845,0.125,0.45475
RSS,https://bitcoinmagazine.com/.rss/full/,2024-09-16 21:03:54+00:00,2024-09-18 00:48:24.547856,microstrategy announces 700 million raise redeem senior secured note buy bitcoinmicrostrategy use net proceeds offering redeem senior secured note due 2028 acquire additional bitcoin,0.6597,-0.0625,0.2986
RSS,https://bitcoinmagazine.com/.rss/full/,2024-09-16 19:40:50+00:00,2024-09-18 00:48:24.547856,financial anarchist manifestousing technology like nostr chaumian ecash financial anarchist challenge status quo aiming reclaim economic sovereignty disrupt centralized financial power bitcoin,0.4215,0.05,0.23575
RSS,https://bitcoinmagazine.com/.rss/full/,2024-09-16 19:14:18+00:00,2024-09-18 00:48:24.547856,bitcoin crypto voter make voice heard america love crypto stop wisconsinwisconsin ready move past partisanship unifying force bitcoin crypto ahead 2024 election,0.6705,0.15,0.41025
RSS,https://bitcoinmagazine.com/.rss/full/,2024-09-16 16:42:08+00:00,2024-09-18 00:48:24.547856,bhutan bitcoin holding revealed kingdom owns 780m btc miningbhutans growing bitcoin empire revealed 780 million btc acquired extensive mining operation powered nation renewable energy resource,0.4215,0.0,0.21075
RSS,https://bitcoinmagazine.com/.rss/full/,2024-09-16 16:21:17+00:00,2024-09-18 00:48:24.547856,urgent need bitcoin tax reform encourage everyday usean argument tax treatment bitcoin massive disincentive use commerce,0.3818,-0.1,0.14089999999999997
RSS,https://bitcoinmagazine.com/.rss/full/,2024-09-16 14:00:08+00:00,2024-09-18 00:48:24.547856,mi primer bitcoin promotes two staff member leadership rolesthe opensource bitcoin education platform founded el salvador move two member inhouse talent one native salvadoran supervisory position,0.6369,0.0,0.31845
RSS,https://bitcoinmagazine.com/.rss/full/,2024-09-16 13:26:09+00:00,2024-09-18 00:48:24.547856,bitcoin mining shutdown cause 20 surge electricity billsthe shutdown bitcoin mining facility norway caused 20 increase electricity bill town resident loss mining operation revenue forced local power company raise rate offset cost,-0.4588,-0.15000000000000002,-0.3044
RSS,https://bitcoinmagazine.com/.rss/full/,2024-09-13 20:20:40+00:00,2024-09-18 00:48:24.547856,detroit aim drive digital asset innovation day three america love crypto tourthe motor city state michigan see opportunity creating businessfriendly environment bitcoin crypto industry welcoming stand crypto alliance,0.9451,0.25,0.59755
RSS,https://bitcoinmagazine.com/.rss/full/,2024-09-13 20:09:00+00:00,2024-09-18 00:48:24.547856,bitcoin surge 60000 market brace potential fed rate cutbitcoin touch 60000 ahead potential interest rate cut federal reserve signaling market optimism amid falling reported inflation data,0.5859,0.0,0.29295
RSS,https://bitcoinmagazine.com/.rss/full/,2024-09-13 17:30:36+00:00,2024-09-18 00:48:24.547856,bitcoin price action expect next bitcoins path forward insight price target support resistance zone,0.4019,0.05,0.22594999999999998
RSS,https://bitcoinmagazine.com/.rss/full/,2024-09-13 13:02:18+00:00,2024-09-18 00:48:24.547856,microstrategy buy additional 111 billion worth bitcoinmicrostrategy purchased additional 18300 bitcoins 111 billion boosting total bitcoin trove 244800 btc acquired 945 billion company continues bitcoin accumulation strategy capitalizing btc appreciation,0.765,0.15,0.4575
RSS,https://bitcoinmagazine.com/.rss/full/,2024-09-13 10:28:54+00:00,2024-09-18 00:48:24.547856,bitcoin crypto exchange htx integrate lightning networkone leading bitcoin crypto exchange htx announced integration bitcoins lightning network enable faster cheaper payment,0.0,0.0,0.0
RSS,https://bitcoinmagazine.com/.rss/full/,2024-09-12 15:49:09+00:00,2024-09-18 00:48:24.547856,trump election victory could send bitcoin 125000 say standard chartered analysta trump win could fuel bitcoin rally though new alltime high expected regardless 2024 election outcome,0.5859,0.1992727272727273,0.3925863636363636
RSS,https://bitcoinmagazine.com/.rss/full/,2024-09-12 13:00:00+00:00,2024-09-18 00:48:24.547856,revolutionizing bitcoin mining power threephase systemswhy threephase electrical system offer competitive advantage miner asic efficiency gain tapering,0.8225,0.0,0.41125
RSS,https://bitcoinmagazine.com/.rss/full/,2024-09-11 18:40:01+00:00,2024-09-18 00:48:24.547856,bitcoin vault future bitcoin custodyas bitcoin grows value popularity custody solution become critical learn bitcoin vault importance custody space,0.7906,0.0,0.3953
RSS,https://bitcoinmagazine.com/.rss/full/,2024-09-11 17:06:05+00:00,2024-09-18 00:48:24.547856,uk parliament introduces bill recognize bitcoin crypto personal propertythe new legislation aim provide legal clarity protection bitcoin digital asset owner,0.6908,0.08409090909090909,0.38744545454545454
RSS,https://bitcoinmagazine.com/.rss/full/,2024-09-11 15:31:02+00:00,2024-09-18 00:48:24.547856,el salvador bitcoin office celebrates 21 month success set stage renaissance 20the national bitcoin office onbtc office president el salvador led stacy herbert aim help integrate bitcoin el salvador economy foster cultural artistic psychological renaissance,0.8779,0.18333333333333335,0.5306166666666667
RSS,https://bitcoinmagazine.com/.rss/full/,2024-09-11 13:00:00+00:00,2024-09-18 00:48:24.547856,early bitcoin developer back satoshi nakamoto theorya bitcoin developer 2010 gone public support theory project anonymous founder,0.4019,0.03333333333333333,0.21761666666666665
RSS,https://bitcoinmagazine.com/.rss/full/,2024-09-11 12:14:47+00:00,2024-09-18 00:48:24.547856,bitcoin mining difficulty hit record 92 trillionthe bitcoin mining difficulty hit record high 9267 trillion september 11 displaying intensifying competition network rise indicates greater security surging collective computing power dedicated mining bitcoin,0.4767,0.33,0.40335
RSS,https://bitcoinmagazine.com/.rss/full/,2024-09-10 21:23:09+00:00,2024-09-18 00:48:24.547856,standard chartered bank launch bitcoin crypto custody service uaethe international banking group granted licence dubai financial service authority allowing custody client digital asset,0.5859,0.0,0.29295
RSS,https://bitcoinmagazine.com/.rss/full/,2024-09-10 17:59:33+00:00,2024-09-18 00:48:24.547856,un ode de lprovocateur du bitcoina poem written loosely haiku style enza coin,0.0,-0.07692307692307693,-0.038461538461538464
RSS,https://bitcoinmagazine.com/.rss/full/,2024-09-10 09:40:25+00:00,2024-09-18 00:48:24.547856,metaplanet buy additional 300 million worth bitcoinpubliclylisted metaplanet purchased additional 300 million 22m bitcoin bringing total holding 3988 btc bought 375 billion 276m,0.2263,0.15,0.18814999999999998
RSS,https://bitcoinmagazine.com/.rss/full/,2024-09-09 21:47:47+00:00,2024-09-18 00:48:24.547856,give timeon bitcoin saturn synchronicity privacy issue,0.0,0.0,0.0
RSS,https://bitcoinmagazine.com/.rss/full/,2024-09-09 17:00:00+00:00,2024-09-18 00:48:24.547856,introducing bitcoin report new monthly digest bitcoin magazine probitcoin magazine pro launch bitcoin report monthly digest offering key insight bitcoin trend onchain analysis price forecast mustread investor inaugural august edition free download,0.5106,0.1787878787878788,0.34469393939393944
RSS,https://bitcoinmagazine.com/.rss/full/,2024-09-09 16:13:00+00:00,2024-09-18 00:48:24.547856,bitcoin rollups rock hard placea look scalability limit rollups choice making decision regarding maximizing,-0.1027,-0.2916666666666667,-0.19718333333333335
RSS,https://bitcoinmagazine.com/.rss/full/,2024-09-09 13:00:00+00:00,2024-09-18 00:48:24.547856,proof workforce career government partner integrate bitcoin public sector jobsproof workforce foundation career government teamed integrate bitcoin public sector employment practice revolutionizing compensation financial literacy,0.0,0.0,0.0
RSS,https://bitcoinmagazine.com/.rss/full/,2024-09-09 12:00:28+00:00,2024-09-18 00:48:24.547856,australian bitcoin etf implement proof reserve hosekiaustralias monochrome bitcoin etf partnering hoseki implement proofofreserves becoming first australian spot bitcoin etf provide daily verification holding,0.0,0.13999999999999999,0.06999999999999999
RSS,https://bitcoinmagazine.com/.rss/full/,2024-09-09 09:43:43+00:00,2024-09-18 00:48:24.547856,japan largest power company tepco mining bitcoin using renewablesjapans largest power company tepco begun mining bitcoin subsidiary using excess renewable energy showing bitcoin incentivize green energy growth,0.7003,-0.2,0.25015
RSS,https://bitcoinmagazine.com/.rss/full/,2024-09-06 15:05:24+00:00,2024-09-18 00:48:24.547856,nevada welcome bitcoin crypto day two america love crypto touron stop two crypto industrysponsored tour battleground state political figure urge nevadan support procrypto candidate upcoming election pledge make state home crypto industry,0.7184,0.43333333333333335,0.5758666666666667
RSS,https://bitcoinmagazine.com/.rss/full/,2024-09-06 14:03:22+00:00,2024-09-18 00:48:24.547856,bitcoins potential rally amid u dollar weaknessanalyzing recent drop dollar strength index implication bitcoin,0.2732,0.0,0.1366
RSS,https://bitcoinmagazine.com/.rss/full/,2024-09-05 18:15:02+00:00,2024-09-18 00:48:24.547856,politician founder motivate crypto voter day one america love crypto tourprominent politician crypto industry leader arizona encourage procrypto voter head poll november first stop fivedate swing state tour,0.836,0.375,0.6054999999999999
RSS,https://bitcoinmagazine.com/.rss/full/,2024-09-05 16:26:22+00:00,2024-09-18 00:48:24.547856,venezuelan opposition leader maría corina machado call bitcoin lifeline exclusive interviewmaría corina machado venezuelan opposition leader discus bitcoin vital mean resistance venezuelan suffering hyperinflation chávez maduro regime,-0.1027,-0.10625,-0.104475
RSS,https://bitcoinmagazine.com/.rss/full/,2024-09-05 16:17:57+00:00,2024-09-18 00:48:24.547856,advancing bitcoin security journey basic wallet advanced protocolsa look history evolution bitcoin wallet,0.5267,0.2,0.36334999999999995
RSS,https://bitcoinmagazine.com/.rss/full/,2024-09-05 12:45:27+00:00,2024-09-18 00:48:24.547856,mastercard launch euro denominated noncustodial bitcoin debit cardmastercard launched euro debit card enabling direct spending bitcoin crypto noncustodial wallet 100 million merchant move reflects mastercards expanding effort bridge bitcoin traditional payment network,0.128,0.05,0.089
RSS,https://bitcoinmagazine.com/.rss/full/,2024-09-05 10:00:00+00:00,2024-09-18 00:48:24.547856,blockstream open new funding round second bitcoin mining security tokenblockstreams second mining note bmn2 designed much like successful bmn1,0.8271,0.1266233766233766,0.4768616883116883
RSS,https://bitcoinmagazine.com/.rss/full/,2024-09-04 20:23:06+00:00,2024-09-18 00:48:24.547856,coinbase cfo say kamala harris campaign accepts crypto donation fortunefortune report coinbase cfo said kamala harris using coinbase commerce accept cryptocurrency donation presidential campaign,0.5994,0.0,0.2997
RSS,https://bitcoinmagazine.com/.rss/full/,2024-09-04 20:11:07+00:00,2024-09-18 00:48:24.547856,choose privacytechnological capability enough create bitcoin privacy unless user society actively defend demand privacy die privacy issue,-0.25,-0.06666666666666667,-0.15833333333333333
RSS,https://bitcoinmagazine.com/.rss/full/,2024-09-04 19:08:31+00:00,2024-09-18 00:48:24.547856,u spot bitcoin etf see record 287 million outflow except blackrockus spot bitcoin etf experienced significant outflow yesterday totaling 287 million blackrock exception reporting withdrawal,0.2263,0.5875,0.40690000000000004
RSS,https://bitcoinmagazine.com/.rss/full/,2024-09-04 14:08:22+00:00,2024-09-18 00:48:24.547856,utxo research report state bridgesa research report analyzing different trust model functioning mechanism proposed existing twoway peg bitcoin layer,0.5106,0.0,0.2553
RSS,https://bitcoinmagazine.com/.rss/full/,2024-09-04 13:02:09+00:00,2024-09-18 00:48:24.547856,switzerland fourth largest bank zkb launch bitcoin tradingswitzerlands fourth largest bank zürcher kantonalbank zkb launched bitcoin crypto trading custody service amid country open regulatory environment,0.128,0.0,0.064
RSS,https://bitcoinmagazine.com/.rss/full/,2024-09-03 20:20:07+00:00,2024-09-18 00:48:24.547856,fbi warns north korean hacker targeting u bitcoin crypto etfsthe fbi issued alert warning north korean hacker attempting steal cryptocurrency fund usbased etf using sophisticated social engineering technique,-0.0516,0.26666666666666666,0.10753333333333333
RSS,https://bitcoinmagazine.com/.rss/full/,2024-09-03 20:02:24+00:00,2024-09-18 00:48:24.547856,privacy pain craig raw creator sparrow wallet selfcustodyan interview craig raw creator popular sparrow wallet bitcoin privacy best practice pain teacher privacy issue,0.1027,0.2846153846153846,0.1936576923076923
RSS,https://bitcoinmagazine.com/.rss/full/,2024-09-03 15:13:42+00:00,2024-09-18 00:48:24.547856,relais bitcoin mission bringing european orange coin despite red taperelai cofounder ceo julian liniger want onboard many eu uk citizen possible bitcoin even mean jump regulatory hoop,0.0772,0.0375,0.05735
RSS,https://bitcoinist.com/feed/,2024-09-18 00:30:10+00:00,2024-09-18 00:48:24.547856,bitcoin btc metric point local bottom 49500 detailsbitcoin crucial point several day recovery consolidation august 5 experienced sharp capitulation event price dropping monthly low 49577 investor remain skeptical believing bitcoin hasnt reached bottom yet key data cryptoquant suggests worst might,-0.8315,-0.09166666666666666,-0.46158333333333335
RSS,https://bitcoinist.com/feed/,2024-09-17 23:00:53+00:00,2024-09-18 00:48:24.547856,turning point crypto exsec official testify v regulator dazed hearingin wellpublicized congressional hearing scheduled september 18 2024 former highranking united state security exchange commission executive testify agency dubbed dazed confused breaking sec politicized approach digital asset hearing center divisive sec policy crypto especially chair gary genslers direction related,0.4588,-0.17,0.14439999999999997
RSS,https://bitcoinist.com/feed/,2024-09-17 21:30:05+00:00,2024-09-18 00:48:24.547856,dogecoin millionaire reveals top 2 meme coin narrative 2025glauber contessoto widely known dogecoin millionaire social medium alias slumdoge millionaire platform x recently revealed latest pick anticipation major meme coin bull run 2025 contessoto notable figure crypto community especially regarding meme coin come amidst general lull,0.296,0.17175925925925928,0.23387962962962963
RSS,https://bitcoinist.com/feed/,2024-09-17 20:22:23+00:00,2024-09-18 00:48:24.547856,sec charge ftx audit firm negligence independence violationsthe u security exchange commission sec settled audit firm prager metis agreed pay 195 million resolve misconduct allegation related audit nowdefunct cryptocurrency exchange ftx 745000 ftx audit failure tuesday sec announced prager metis california affiliate prager metis cpa,0.34,-0.14523809523809525,0.09738095238095239
