MainSource,Source,Publication Date,Pull_date,Pre-Processed Text,Sentiment_Vader,Sentiment_TextBlob,Average_Sentiment
GoogleNews,New Crypto Projects,1 week ago,2024-12-23 12:19:20.445400,best crypto presales unlock massive potential new crypto projectsas per cryptoglobe ethereum etf making headline 1122 billion asset institutional interest grows,0.8658,0.28409090909090906,0.5749454545454545
GoogleNews,New Crypto Projects,1 week ago,2024-12-23 12:19:20.445400,6 best crypto invest right new layer 1 blockchain project steal limelightthe crypto world never stop buzzing week exception market mover like bitcoin btc solana sol innovationdriven platform,0.6584,0.47402597402597396,0.566212987012987
GoogleNews,New Crypto Projects,1 week ago,2024-12-23 12:19:20.445400,meme coin market plummet 20b new project push major milestonesthe current meme coin situation reminds investor volatile sector cryptocan new project bring profit amidst market dip1 week ago,0.4404,0.08380681818181818,0.2621034090909091
GoogleNews,New Crypto Projects,2 weeks ago,2024-12-23 12:19:20.445400,eric trump announces enormous new project saudi arabia family business expands global empiredonald trump son eric announced latest big overseas business venture family empire posting image soaring tower built jeddah,0.1027,0.12727272727272726,0.11498636363636364
GoogleNews,New Crypto Projects,2 weeks ago,2024-12-23 12:19:20.445400,new crypto project announces longawaited airdropa new cryptocurrency project set launch native token next two week initial supply 10 billion token,0.0,0.06818181818181818,0.03409090909090909
GoogleNews,New Crypto Projects,2 weeks ago,2024-12-23 12:19:20.445400,100 new cryptocurrencies invest december 2024check new cryptocurrencies invest 2024 list best new cryptos invest includes blast wif strk,0.6369,0.3522727272727273,0.49458636363636366
GoogleNews,New Crypto Projects,2 weeks ago,2024-12-23 12:19:20.445400,number cryptocurrencies worldwide 2013 december 2024how many cryptocurrencies 1000 different crypto coin world number initially declined since early 2022,0.1531,0.15,0.15155000000000002
GoogleNews,New Crypto Projects,2 weeks ago,2024-12-23 12:19:20.445400,ethereum solana killer new blockchain project could change everything 2025a groundbreaking blockchain project horizon set shake crypto world 2025 promise outpace current giant bring new era,-0.5719,0.06818181818181818,-0.25185909090909087
GoogleNews,New Crypto Projects,2 weeks ago,2024-12-23 12:19:20.445400,best new crypto buy 2024 7 new crypto coinsinvesting best new crypto coin usually offer much higher upside bitcoin ethereum largecap cryptocurrencies,0.8555,0.3441558441558441,0.5998279220779221
GoogleNews,New Crypto Projects,2 weeks ago,2024-12-23 12:19:20.445400,20 best crypto telegram group join 20241 b2cjacob crypto bury overall best crypto telegram group b2c business2community one popular cryptocurrency platform used,0.9246,0.65,0.7873
GoogleNews,New Crypto Projects,3 weeks ago,2024-12-23 12:19:20.445400,best ico invest december new crypto project potential 500x profit listingthe crypto market buzzing opportunity finding best ico invest december could gateway achieving monumental gain,0.9552,0.5340909090909091,0.7446454545454546
GoogleNews,New Crypto Projects,3 weeks ago,2024-12-23 12:19:20.445400,crypto project new token love trumpduring presidential campaign amid unprecedented flurry shilling saw hawking sneaker bible digital trading card presidentelect,0.6369,0.3090909090909091,0.47299545454545455
GoogleNews,New Crypto Projects,3 hours ago,2024-12-23 12:19:20.445400,new hype new bear project capturing attention crypto investor here whythe cryptocurrency market thrives new idea communitydriven project many token burst onto scene little flashy promise,0.2551,0.03693181818181818,0.14601590909090909
GoogleNews,New Crypto Projects,1 day ago,2024-12-23 12:19:20.445400,5 best crypto project december 2024 shiba inu shib pepe coin pepe lightchain aidecember 2024 brings exciting opportunity crypto market five standout project capturing investor attention shiba inu shib continues,0.8807,0.65,0.76535
GoogleNews,New Crypto Projects,2 days ago,2024-12-23 12:19:20.445400,new crypto project puzzle expert unveil mystery behind qubetics nowthe crypto realm buzzing cuttingedge project take stage leaving investor eager opportunity promise substantial return,0.8126,-0.13181818181818183,0.3403909090909091
GoogleNews,New Crypto Projects,2 days ago,2024-12-23 12:19:20.445400,5 best crypto coin invest right new layer 1 project presale continues riseits addressing cryptos frustrating realworld issue gamechanging tool like decentralised vpn revolutionary application,0.5859,0.2555194805194805,0.42070974025974023
GoogleNews,New Crypto Projects,2 days ago,2024-12-23 12:19:20.445400,wall street pepe raise 32m presale new trading insight ecosystemluzern switzerland dec 20 2024 globe newswire wall street pepe wepe new crypto project combining meme coin culture trading tool,0.0,0.13636363636363635,0.06818181818181818
GoogleNews,New Crypto Projects,3 days ago,2024-12-23 12:19:20.445400,unveiling trump family project wlfis asset package new crypto flagthis article sort recent operation transmission impact wlfi reader reference,0.3612,0.06818181818181818,0.2146909090909091
GoogleNews,New Crypto Projects,3 days ago,2024-12-23 12:19:20.445400,scam dead crypto project global breakdown industry troubling trendsthe explosive growth cryptocurrency brought innovation also surge scam dead project according recent report 5money,-0.946,-0.1,-0.523
GoogleNews,New Crypto Projects,3 days ago,2024-12-23 12:19:20.445400,next 1000x crypto 20 coin could 1000x 2024in guide reveal 21 crypto token could explode read discover next 1000x crypto project 2024,0.0,0.0,0.0
GoogleNews,New Crypto Projects,3 days ago,2024-12-23 12:19:20.445400,hailey welch crypto project sued hawk tuah memecoininvestors suing people associated cryptocurrency launched hawk tuah girl hailey welch following crash memecoin named,-0.5106,0.0,-0.2553
GoogleNews,New Crypto Projects,4 days ago,2024-12-23 12:19:20.445400,solana ai hackathon launch overview 12 new ai agent projectsincluding autonomous trading defi agent multiagent collaboration direction,0.0,0.2681818181818182,0.1340909090909091
GoogleNews,New Crypto Projects,3 hours ago,2024-12-23 12:19:20.445400,new hype new bear project capturing attention crypto investor here whythe cryptocurrency market thrives new idea communitydriven project many token burst onto scene little flashy promise,0.2551,0.03693181818181818,0.14601590909090909
GoogleNews,New Crypto Projects,1 day ago,2024-12-23 12:19:20.445400,5 best crypto project december 2024 shiba inu shib pepe coin pepe lightchain aidecember 2024 brings exciting opportunity crypto market five standout project capturing investor attention shiba inu shib continues,0.8807,0.65,0.76535
GoogleNews,New Crypto Projects,2 days ago,2024-12-23 12:19:20.445400,new crypto project puzzle expert unveil mystery behind qubetics nowthe crypto realm buzzing cuttingedge project take stage leaving investor eager opportunity promise substantial return,0.8126,-0.13181818181818183,0.3403909090909091
GoogleNews,New Crypto Projects,2 days ago,2024-12-23 12:19:20.445400,5 best crypto coin invest right new layer 1 project presale continues riseits addressing cryptos frustrating realworld issue gamechanging tool like decentralised vpn revolutionary application,0.5859,0.2555194805194805,0.42070974025974023
GoogleNews,New Crypto Projects,2 days ago,2024-12-23 12:19:20.445400,wall street pepe raise 32m presale new trading insight ecosystemluzern switzerland dec 20 2024 globe newswire wall street pepe wepe new crypto project combining meme coin culture trading tool,0.0,0.13636363636363635,0.06818181818181818
GoogleNews,New Crypto Projects,3 days ago,2024-12-23 12:19:20.445400,unveiling trump family project wlfis asset package new crypto flagthis article sort recent operation transmission impact wlfi reader reference,0.3612,0.06818181818181818,0.2146909090909091
GoogleNews,New Crypto Projects,3 days ago,2024-12-23 12:19:20.445400,scam dead crypto project global breakdown industry troubling trendsthe explosive growth cryptocurrency brought innovation also surge scam dead project according recent report 5money,-0.946,-0.1,-0.523
GoogleNews,New Crypto Projects,3 days ago,2024-12-23 12:19:20.445400,next 1000x crypto 20 coin could 1000x 2024in guide reveal 21 crypto token could explode read discover next 1000x crypto project 2024,0.0,0.0,0.0
GoogleNews,New Crypto Projects,3 days ago,2024-12-23 12:19:20.445400,hailey welch crypto project sued hawk tuah memecoininvestors suing people associated cryptocurrency launched hawk tuah girl hailey welch following crash memecoin named,-0.5106,0.0,-0.2553
GoogleNews,New Crypto Projects,4 days ago,2024-12-23 12:19:20.445400,solana ai hackathon launch overview 12 new ai agent projectsincluding autonomous trading defi agent multiagent collaboration direction,0.0,0.2681818181818182,0.1340909090909091
GoogleNews,New Crypto Projects,4 days ago,2024-12-23 12:19:20.445400,new solana layer 2 project solaxy raise 2 million first week presalesolana showcased remarkable performance throughout 2024 outpacing ethereum 50 yeartodate gain solidified sol position,0.7906,0.37878787878787873,0.5846939393939393
GoogleNews,New Crypto Projects,5 days ago,2024-12-23 12:19:20.445400,best crypto presales year 5 new project ready market listing 100x gainsare looking get ground floor promising new crypto project cryptocurrency domain brisk innovation,0.9118,0.3345454545454545,0.6231727272727272
GoogleNews,New Crypto Projects,5 days ago,2024-12-23 12:19:20.445400,9 best new meme coin buy december 2024review best new meme coin spot next investment opportunity ass value potential go viral community strength,0.9231,0.37878787878787873,0.6509439393939394
GoogleNews,New Crypto Projects,5 days ago,2024-12-23 12:19:20.445400,next crypto explode 2024 2025we review range cryptocurrencies regarded next cryptos likely explode including exciting new token,0.4939,0.08727272727272727,0.29058636363636364
GoogleNews,New Crypto Projects,5 days ago,2024-12-23 12:19:20.445400,best new cryptocurrencies invest 2024 top new crypto coinslooking new cryptocurrencies invest daunting task may beneficial done right one able buy upcoming crypto,0.836,0.38497217068645634,0.6104860853432281
GoogleNews,New Crypto Projects,5 days ago,2024-12-23 12:19:20.445400,8 new crypto coin invest december 2024 daily updatesfinding best new crypto coin buy daunting task risk investing new cryptocurrency release various pitfall avoid,0.2263,0.23484848484848478,0.2305742424242424
GoogleNews,New Crypto Projects,5 days ago,2024-12-23 12:19:20.445400,5 new crypto icos invest big gain 2025initial coin offering icos allow investor buy cryptocurrencies fixed rate list open market,0.6486,0.05909090909090909,0.3538454545454545
GoogleNews,New Crypto Projects,5 days ago,2024-12-23 12:19:20.445400,world largest crypto exchange roll binance alpha feature spot earlystage project potentialbinance largest crypto exchange world volume launching new wallet feature aimed shining spotlight nascent crypto project,0.0,0.13636363636363635,0.06818181818181818
GoogleNews,New Crypto Projects,5 days ago,2024-12-23 12:19:20.445400,tokenbuilder release 2025 forecast ai integration fair token offeringsaccording prediction ransu salovaara ceo tokenbuilder crypto veteran since 2014 next 12 month pivotal boosting,0.5719,0.3,0.43594999999999995
GoogleNews,New Crypto Projects,5 days ago,2024-12-23 12:19:20.445400,9 best crypto presales invest upcoming token salesdiscover top cryptocurrency presales preicos trending trading circle open invest right december 2024,0.7184,0.4464285714285714,0.5824142857142858
GoogleNews,New Crypto Projects,5 days ago,2024-12-23 12:19:20.445400,brand new solana layer2 project launched solx raise 750k minutesa new solana meme coin could set shakeup network first solana layer2 offering discover solaxy solx,-0.0258,0.17424242424242423,0.07422121212121212
GoogleNews,New Crypto Projects,5 days ago,2024-12-23 12:19:20.445400,14 best new crypto project invest december 2024from jupiter innovative approach asset swapping solana blockchain celestias exciting new blockchain platform meme coin craze,0.9042,0.41454545454545455,0.6593727272727272
GoogleNews,New Crypto Projects,5 days ago,2024-12-23 12:19:20.445400,7 best crypto invest right explore new crypto project unifies blockchaincryptocurrencies making headline good reason bitcoin recently shattered alltime high institutional investor going,0.6124,0.38034632034632027,0.49637316017316013
GoogleNews,New Crypto Projects,5 days ago,2024-12-23 12:19:20.445400,new crypto coin buy ready 500x return pick 5 fresh projectsaccording outlook business december 2024 cryptocurrency market reached staggering 36 trillion market capitalization,0.6369,0.21212121212121213,0.4245106060606061
GoogleNews,New Crypto Projects,5 days ago,2024-12-23 12:19:20.445400,binance launch binance alpha let user explore new crypto projectsthe cuttingedge program permit user explore exclusive token resilient growth potential binance network,0.4767,0.06818181818181818,0.2724409090909091
GoogleNews,New Crypto Projects,6 days ago,2024-12-23 12:19:20.445400,three affordable crypto coin poised gain 2025the cryptocurrency market offer opportunity smallbudget investor wall street pepe wepe aim empower trader educational resource,0.802,0.25,0.526
GoogleNews,New Crypto Projects,6 days ago,2024-12-23 12:19:20.445400,best crypto presales 10x gain luckhunters presale could 1000x jackpotare ready upcoming new crypto coin wave best crypto presales long term provide unique chance invest early project show,0.946,0.39448051948051954,0.6702402597402597
GoogleNews,New Crypto Projects,6 days ago,2024-12-23 12:19:20.445400,bitget introduces launchx new token launch platform featuring fuel network first projectvictoria seychelles dec 16 2024 globe newswire bitget leading cryptocurrency exchange web3 company announces launch launchx,0.0,0.19318181818181818,0.09659090909090909
GoogleNews,New Crypto Projects,1 week ago,2024-12-23 12:19:20.445400,best crypto presales unlock massive potential new crypto projectsas per cryptoglobe ethereum etf making headline 1122 billion asset institutional interest grows,0.8658,0.28409090909090906,0.5749454545454545
GoogleNews,New Crypto Projects,1 week ago,2024-12-23 12:19:20.445400,6 best crypto invest right new layer 1 blockchain project steal limelightthe crypto world never stop buzzing week exception market mover like bitcoin btc solana sol innovationdriven platform,0.6584,0.47402597402597396,0.566212987012987
GoogleNews,New Crypto Projects,1 week ago,2024-12-23 12:19:20.445400,meme coin market plummet 20b new project push major milestonesthe current meme coin situation reminds investor volatile sector cryptocan new project bring profit amidst market dip1 week ago,0.4404,0.08380681818181818,0.2621034090909091
GoogleNews,New Crypto Projects,2 weeks ago,2024-12-23 12:19:20.445400,eric trump announces enormous new project saudi arabia family business expands global empiredonald trump son eric announced latest big overseas business venture family empire posting image soaring tower built jeddah,0.1027,0.12727272727272726,0.11498636363636364
GoogleNews,New Crypto Projects,2 weeks ago,2024-12-23 12:19:20.445400,new crypto project announces longawaited airdropa new cryptocurrency project set launch native token next two week initial supply 10 billion token,0.0,0.06818181818181818,0.03409090909090909
GoogleNews,New Crypto Projects,2 weeks ago,2024-12-23 12:19:20.445400,100 new cryptocurrencies invest december 2024check new cryptocurrencies invest 2024 list best new cryptos invest includes blast wif strk,0.6369,0.3522727272727273,0.49458636363636366
GoogleNews,New Crypto Projects,2 weeks ago,2024-12-23 12:19:20.445400,number cryptocurrencies worldwide 2013 december 2024how many cryptocurrencies 1000 different crypto coin world number initially declined since early 2022,0.1531,0.15,0.15155000000000002
GoogleNews,New Crypto Projects,2 weeks ago,2024-12-23 12:19:20.445400,ethereum solana killer new blockchain project could change everything 2025a groundbreaking blockchain project horizon set shake crypto world 2025 promise outpace current giant bring new era,-0.5719,0.06818181818181818,-0.25185909090909087
GoogleNews,New Crypto Projects,2 weeks ago,2024-12-23 12:19:20.445400,best new crypto buy 2024 7 new crypto coinsinvesting best new crypto coin usually offer much higher upside bitcoin ethereum largecap cryptocurrencies,0.8555,0.3441558441558441,0.5998279220779221
GoogleNews,New Crypto Projects,2 weeks ago,2024-12-23 12:19:20.445400,20 best crypto telegram group join 20241 b2cjacob crypto bury overall best crypto telegram group b2c business2community one popular cryptocurrency platform used,0.9246,0.65,0.7873
GoogleNews,New Crypto Projects,3 weeks ago,2024-12-23 12:19:20.445400,best ico invest december new crypto project potential 500x profit listingthe crypto market buzzing opportunity finding best ico invest december could gateway achieving monumental gain,0.9552,0.5340909090909091,0.7446454545454546
GoogleNews,New Crypto Projects,3 weeks ago,2024-12-23 12:19:20.445400,crypto project new token love trumpduring presidential campaign amid unprecedented flurry shilling saw hawking sneaker bible digital trading card presidentelect,0.6369,0.3090909090909091,0.47299545454545455
GoogleNews,New Crypto Projects,3 weeks ago,2024-12-23 12:19:20.445400,apply 100000 grant web3 blockchain projectscrypto good fund drive global financial inclusion climate resilience blockchainenabled solution emerging market,0.7717,0.2333333333333333,0.5025166666666667
GoogleNews,New Crypto Projects,3 weeks ago,2024-12-23 12:19:20.445400,new crypto coin buy innovative project 100x potential invest market debutwe curated list best new crypto coin buy help investor generate exponential return next crypto boom,0.8689,0.2954545454545454,0.5821772727272727
GoogleNews,New Crypto Projects,4 weeks ago,2024-12-23 12:19:20.445400,tron founder justin sun becomes biggest investor donald trump new crypto projectthe founder tron trx blockchain justin sun announcing multimillion dollar investment world liberty financial decentralized finance defi,0.5267,0.06818181818181818,0.29744090909090903
GoogleNews,New Crypto Projects,4 weeks ago,2024-12-23 12:19:20.445400,new crypto coin buy dont miss chance nearly 400x gain luckhunter remains leading pickthe landscape cryptocurrency investment dramatically shifted 2024 new crypto coin buy offering unprecedented opportunity early,0.7099,0.21454545454545454,0.4622227272727273
GoogleNews,New Crypto Projects,1 month ago,2024-12-23 12:19:20.445400,trump crypto project get 30 million investment sunthe controversial chinaborn crypto entrepreneur largest investor trump decentralized finance project,-0.2023,0.55,0.17385
GoogleNews,New Crypto Projects,1 month ago,2024-12-23 12:19:20.445400,banana auction billionaire 30 million investment trump crypto token highlight new way enrich presidentelectblockchain founder justin sun invested 30 million presidentelect donald trump crypto project world liberty financial platform aspires,0.7003,0.06818181818181818,0.38424090909090913
GoogleNews,New Crypto Projects,1 month ago,2024-12-23 12:19:20.445400,crypto project watch 2023how 19 crypto blockchain web3 project applying cuttingedge idea tackle global problem,-0.4019,0.0,-0.20095
GoogleNews,New Crypto Projects,1 month ago,2024-12-23 12:19:20.445400,5 best crypto 1000x growth potential top 2024 listwith new project emerging finding next big crypto massive growth potential top mind however challenging determine,0.9118,0.2636363636363636,0.5877181818181818
GoogleNews,New Crypto Projects,1 month ago,2024-12-23 12:19:20.445400,top 10 new crypto coin upcoming token 2025in article provide thorough breakdown top new project garnered attention venture brings something distinctive,0.3818,0.3181818181818181,0.349990909090909
GoogleNews,New Crypto Projects,1 month ago,2024-12-23 12:19:20.445400,best crypto presales invest bet new project 100x gain shorttermthese presales grant early access promising project potential return high 100x upon market listing,0.9153,0.26606060606060605,0.590680303030303
GoogleNews,Crypto Bullrun,,2024-12-23 12:19:20.445400,,0.0,0.0,0.0
GoogleNews,Crypto Bullrun,5 hours ago,2024-12-23 12:19:20.445400,make 1 million crypto bull run 2025 top investor reveals strategydiscover top crypto investor strategy crypto bull run 2025 focusing altcoins layer 1 ai gaming massive gain,0.7184,0.3333333333333333,0.5258666666666667
GoogleNews,Crypto Bullrun,0 hours ago,2024-12-23 12:19:20.445400,cryptoquant reveals leverage risk cexs amidst approaching bull runwhile increasing anticipation potential crypto bull run cryptoquant analyzed leverage level diverse centralized crypto exchange,-0.1779,0.0,-0.08895
GoogleNews,Crypto Bullrun,4 hours ago,2024-12-23 12:19:20.445400,xrps 223 price tag overvalued ready another bull runxrp become one hottest topic altcoin market following explosive rally november token price continues surge,0.3612,0.1,0.23060000000000003
GoogleNews,Crypto Bullrun,2 hours ago,2024-12-23 12:19:20.445400,binance lead cexs leverage ratio crypto bull run approach reportin latest insight report blockchain analytics firm cryptoquant binance presently hold best leverage ratio crypto bull run prepares,0.6369,0.325,0.48095
GoogleNews,Crypto Bullrun,4 hours ago,2024-12-23 12:19:20.445400,ride next crypto bull run top token 100x potentialas cryptocurrency market continues captivate investor globally anticipation building next crypto bull run period explosive growth,0.5859,0.125,0.35545
GoogleNews,Crypto Bullrun,1 day ago,2024-12-23 12:19:20.445400,4 cryptocurrencies ready explode crypto bull run heat upare ready make profit booming market crypto trading space active thriving investor look reap benefit come,0.9118,0.0888888888888889,0.5003444444444445
GoogleNews,Crypto Bullrun,1 day ago,2024-12-23 12:19:20.445400,next crypto bull run technological renaissance speculative frenzythe realm cryptocurrencies often characterized dramatic bull run period rapid appreciation price digital asset,0.7351,-0.14444444444444446,0.29532777777777774
GoogleNews,Crypto Bullrun,1 day ago,2024-12-23 12:19:20.445400,plan double money crypto bull run 2025 desiree peralta dec 2024currently bitcoin surpassed 100000 new alltime high 103000 many investor time take profit get,0.4404,0.1990909090909091,0.31974545454545455
GoogleNews,Crypto Bullrun,1 day ago,2024-12-23 12:19:20.445400,joke stardom debo set dominate next crypto bull runbinance weighs,0.1779,0.0,0.08895
GoogleNews,Crypto Bullrun,2 days ago,2024-12-23 12:19:20.445400,best ai crypto coin next bull run 1 earthmetaartificial intelligence ai blockchain technology two transformative innovation 21st century,0.872,0.3333333333333333,0.6026666666666667
GoogleNews,Crypto Bullrun,,2024-12-23 12:19:20.445400,,0.0,0.0,0.0
GoogleNews,Crypto Bullrun,5 hours ago,2024-12-23 12:19:20.445400,make 1 million crypto bull run 2025 top investor reveals strategydiscover top crypto investor strategy crypto bull run 2025 focusing altcoins layer 1 ai gaming massive gain,0.7184,0.3333333333333333,0.5258666666666667
GoogleNews,Crypto Bullrun,0 hours ago,2024-12-23 12:19:20.445400,cryptoquant reveals leverage risk cexs amidst approaching bull runwhile increasing anticipation potential crypto bull run cryptoquant analyzed leverage level diverse centralized crypto exchange,-0.1779,0.0,-0.08895
GoogleNews,Crypto Bullrun,4 hours ago,2024-12-23 12:19:20.445400,xrps 223 price tag overvalued ready another bull runxrp become one hottest topic altcoin market following explosive rally november token price continues surge,0.3612,0.1,0.23060000000000003
GoogleNews,Crypto Bullrun,2 hours ago,2024-12-23 12:19:20.445400,binance lead cexs leverage ratio crypto bull run approach reportin latest insight report blockchain analytics firm cryptoquant binance presently hold best leverage ratio crypto bull run prepares,0.6369,0.325,0.48095
GoogleNews,Crypto Bullrun,4 hours ago,2024-12-23 12:19:20.445400,ride next crypto bull run top token 100x potentialas cryptocurrency market continues captivate investor globally anticipation building next crypto bull run period explosive growth,0.5859,0.125,0.35545
GoogleNews,Crypto Bullrun,1 day ago,2024-12-23 12:19:20.445400,4 cryptocurrencies ready explode crypto bull run heat upare ready make profit booming market crypto trading space active thriving investor look reap benefit come,0.9118,0.0888888888888889,0.5003444444444445
GoogleNews,Crypto Bullrun,1 day ago,2024-12-23 12:19:20.445400,next crypto bull run technological renaissance speculative frenzythe realm cryptocurrencies often characterized dramatic bull run period rapid appreciation price digital asset,0.7351,-0.14444444444444446,0.29532777777777774
GoogleNews,Crypto Bullrun,1 day ago,2024-12-23 12:19:20.445400,plan double money crypto bull run 2025 desiree peralta dec 2024currently bitcoin surpassed 100000 new alltime high 103000 many investor time take profit get,0.4404,0.1990909090909091,0.31974545454545455
GoogleNews,Crypto Bullrun,1 day ago,2024-12-23 12:19:20.445400,joke stardom debo set dominate next crypto bull runbinance weighs,0.1779,0.0,0.08895
GoogleNews,Crypto Bullrun,2 days ago,2024-12-23 12:19:20.445400,best ai crypto coin next bull run 1 earthmetaartificial intelligence ai blockchain technology two transformative innovation 21st century,0.872,0.3333333333333333,0.6026666666666667
GoogleNews,Crypto Bullrun,,2024-12-23 12:19:20.445400,,0.0,0.0,0.0
GoogleNews,Crypto Bullrun,5 hours ago,2024-12-23 12:19:20.445400,make 1 million crypto bull run 2025 top investor reveals strategydiscover top crypto investor strategy crypto bull run 2025 focusing altcoins layer 1 ai gaming massive gain,0.7184,0.3333333333333333,0.5258666666666667
