MainSource,Source,Publication Date,Pull_date,Pre-Processed Text,Sentiment_Vader,Sentiment_TextBlob,Average_Sentiment
GoogleNews,ethereum,1 minute ago,2025-02-03 12:18:49.582551,ethereum price drop 18 expert say consider cryptothe ethereum price dropped 18 last 24 hour trade 2541 320 est 236 pump trading volume 798 billion,-0.2732,0.0,-0.1366
GoogleNews,ethereum,0 minutes ago,2025-02-03 12:18:49.582551,ubs test key4 gold ethereums zksynczksync could play key role bank explore web3 reshaping traditional finance interacts blockchain,0.34,0.0,0.17
GoogleNews,ethereum,3 minutes ago,2025-02-03 12:18:49.582551,ethereum price surge could eth set 200 breakout 2025 marketethereum eth showing early sign potential breakout analyst predicting stunning price surge 200 relatively quiet,0.3818,0.15,0.26589999999999997
GoogleNews,ethereum,4 minutes ago,2025-02-03 12:18:49.582551,ethereum crash lowest price six month 37 60 hoursdonald trump caused lot panic crypto investor american president started global trade war cryptomarkt bothered,-0.93,0.0,-0.465
GoogleNews,ethereum,5 minutes ago,2025-02-03 12:18:49.582551,ethereum price suffered steep drop todayinvestingcom ethereum secondlargest digital asset market value experienced significant drop today leveraged bet cryptocurrency,-0.1779,0.39166666666666666,0.10688333333333333
GoogleNews,ethereum,7 minutes ago,2025-02-03 12:18:49.582551,ethereum price suffered steep drop today investingcominvestingcom ethereum secondlargest digital asset market value experienced significant drop today leveraged bet cryptocurrency,-0.1779,0.39166666666666666,0.10688333333333333
GoogleNews,ethereum,8 minutes ago,2025-02-03 12:18:49.582551,ethereum uptrend weakens eth face pullback risk selling pressure intensifies bitcoinistcomrecent price action show ethereum could gearing correction phase heightened selling pressure begin weigh asset,-0.6486,0.1,-0.2743
GoogleNews,ethereum,9 minutes ago,2025-02-03 12:18:49.582551,ethereum price failing surge mean alt rally cancelled shib 2025explore current dynamic ethereums price movement shiba inus potential rally 2025 discover alternative investment opportunity,0.0258,-0.078125,-0.026162499999999998
GoogleNews,ethereum,3 minutes ago,2025-02-03 12:18:49.582551,bitcoin ethereum altcoins crash global trade war fear spark massive selloff marketcryptocurrency price sharp decline lately driven global trade war fear sparked u president donald trump trade tariff select,-0.9432,-0.08499999999999999,-0.5141
GoogleNews,ethereum,8 minutes ago,2025-02-03 12:18:49.582551,whale swoop buy ethereum eth price crash 2500ethereum eth one biggest liquidation event since august 2024 stresstesting centralized market defi whale moved buy dip,-0.4019,0.0,-0.20095
GoogleNews,ethereum,4 minutes ago,2025-02-03 12:18:49.582551,crypto market face 500 billion loss amid market crash ethereum bitcoin struggle maintain supportthe cryptocurrency market taken heavy hit combined market capitalization major asset like bitcoin btc ethereum eth shedding,-0.1849,-0.06875,-0.12682500000000002
GoogleNews,ethereum,4 minutes ago,2025-02-03 12:18:49.582551,ethereum v solana could eth redeem 2025 elluminex take overdespite crypto market bullish momentum asset performing,0.3612,0.0,0.1806
GoogleNews,ethereum,8 minutes ago,2025-02-03 12:18:49.582551,think ethereum eth make millionaire 4 eth rival priced 5discover lightchain ai nextgen ethereum competitor aidriven smart contract optimized blockchain speed low transaction cost,0.5574,0.10714285714285714,0.33227142857142855
GoogleNews,ethereum,4 minutes ago,2025-02-03 12:18:49.582551,ethereum poised 200 surge analyst predict potential rally amid positive technical indicatorsethereum eth may verge major price surge analyst predicting potential 200 increase value coming month,0.8519,0.05795454545454546,0.45492727272727274
GoogleNews,ethereum,1 minutes ago,2025-02-03 12:18:49.582551,ethereum whale net 168m shorting eth price drop 2600an ethereum whale profited 168m shorting eth ahead drop 2600 analyst expect volatility see bullish potential rebound,-0.2263,0.0,-0.11315
GoogleNews,ethereum,1 hour ago,2025-02-03 12:18:49.582551,ethereum eth price recovers 20 flash crash 2125the ethereum price crashed last week nearly breaking 2024 low price bounced unclear begun reversal,-0.7003,0.03333333333333333,-0.33348333333333335
GoogleNews,ethereum,1 hour ago,2025-02-03 12:18:49.582551,ethereum see 200 million outflow amid market dipethereum eth recently seen wave investor attention despite continued downward trend broader cryptocurrency market,0.0,0.0,0.0
GoogleNews,ethereum,1 hour ago,2025-02-03 12:18:49.582551,top 5 ai cryptos invest massive gain ozak ai emerging ai project could surpass ethereum cardanotop five ai cryptosozak ai icp bittensor lightchain ai filecoinare forefront merging blockchain artificial intelligence,0.8074,-0.033333333333333326,0.38703333333333334
GoogleNews,ethereum,1 hour ago,2025-02-03 12:18:49.582551,crypto market plunge bitcoin ethereum ripple face troubling support level amid bearish trendin shocking turn event cryptocurrency market facing significant downward pressure leaving investor edge major coin hit concerning,-0.5994,-0.1875,-0.39345
GoogleNews,ethereum,1 hour ago,2025-02-03 12:18:49.582551,tidal wave feartrump tariff fuel price crash fear bitcoin ethereum xrp cryptofederal reserve chair jerome powell flung door open wall street adopt bitcoin crypto,-0.6369,0.0,-0.31845
GoogleNews,ethereum,1 hour ago,2025-02-03 12:18:49.582551,bitcoin ethereum etf weekly inflow mixed amid uncertain marketbitcoin ethereum etf seen mixed result cryptocurrency market continue falling bearish territory,-0.4215,0.0,-0.21075
GoogleNews,ethereum,1 hour ago,2025-02-03 12:18:49.582551,peter schiff warns long crypto winter bitcoin ethereum crashbitcoin critic peter schiff issue warning crypto market face 22 billion crash,-0.765,-0.05,-0.40750000000000003
GoogleNews,ethereum,1 hour ago,2025-02-03 12:18:49.582551,ethereum 300 surge 2024 bitcoin still outperforming eth marketethereum eth despite remarkable 300 surge 2022 low 880 continues trail behind bitcoin btc current market cycle,-0.6154,0.0875,-0.26394999999999996
GoogleNews,ethereum,1 hour ago,2025-02-03 12:18:49.582551,bitcoin binance ethereum solana ripple biggest crypto headline weekbitcoin ethereum xrp binance here week main crypto news keep date development ecosystem,0.0,0.16666666666666666,0.08333333333333333
GoogleNews,ethereum,1 hour ago,2025-02-03 12:18:49.582551,trader move away bitcoin ethereum seeking higher return lightchain ai 2025as cryptocurrency market shift trader increasingly turning away bitcoin ethereum search higheryield opportunity greater,0.6486,0.375,0.5118
GoogleNews,ethereum,1 hour ago,2025-02-03 12:18:49.582551,remittix become ethereums crown jewel payfi system set redefine cryptotofiat landscapeunder cofounder vitalik buterin ethereum wellknown several year cryptocurrency scene ethereum shaped blockchain technological,0.3612,0.0,0.1806
GoogleNews,ethereum,1 hour ago,2025-02-03 12:18:49.582551,volatility ethereum explodes dvol exceeds 100 asian hoursthe recent surge volatility ethereum eth caught market attention marking significant event trader analyst,0.2023,0.125,0.16365000000000002
GoogleNews,ethereum,2 hours ago,2025-02-03 12:18:49.582551,bitcoin ethereum tether ripple dogecoin top gainer token mindshare amid tariff war concernsas cryptocurrency market grapple increasing volatility due geopolitical tension top virtual asset garnered significant online,-0.0772,0.3125,0.11765
GoogleNews,ethereum,2 hours ago,2025-02-03 12:18:49.582551,ethereum whale buy 145m eth recent market dip price recovery imminentethereum whale 7 sibling bought 5382 eth worth 145 million buythedip move amid recent market dip,0.2263,0.09999999999999999,0.16315
GoogleNews,ethereum,2 hours ago,2025-02-03 12:18:49.582551,4 lowrisk cryptos beyond bitcoin ethereum grow usd 300 portfolio usd 30000lightchain ai integrates artificial intelligence blockchain technology aiming enhance decentralized application,0.4767,-0.6,-0.06164999999999998
GoogleNews,ethereum,2 hours ago,2025-02-03 12:18:49.582551,ethereum bitcoin face decline amid market uncertainty whats next crypto tradersethereum price face downtrend market volatility continues ethereum eth encountered sharp decline price today breaking crucial,-0.34,-0.041666666666666664,-0.19083333333333335
GoogleNews,ethereum,2 hours ago,2025-02-03 12:18:49.582551,bitcoin ethereum plunge trump tariff announcement could mean investmentspresident trump tariff announcement sparked chaos cryptocurrency market bitcoin plummeted threeweek low 91441 ethereum fell,-0.7003,-0.15625,-0.428275
GoogleNews,ethereum,2 hours ago,2025-02-03 12:18:49.582551,ethereum altcoins double digit trumpethereum large altcoins including cardano fallen double digit within hour meantime market continues respond,-0.3612,0.07142857142857142,-0.14488571428571428
GoogleNews,ethereum,2 hours ago,2025-02-03 12:18:49.582551,monochrome group expands southeast asia bitcoin ethereum etf marketin strategic move expand presence southeast asia monochrome group australian cryptoasset firm successfully registered bitcoin,0.7096,0.18333333333333335,0.4464666666666667
GoogleNews,ethereum,2 hours ago,2025-02-03 12:18:49.582551,ether volatility explodes 100 price crashesethers dvol spiked 100 asian hour price crash saw trader chase put option,-0.4019,0.0,-0.20095
GoogleNews,ethereum,2 hours ago,2025-02-03 12:18:49.582551,skyren introduces groundbreaking defi use case within polygon ethereumskyren dao unlocking new defi opportunity polygon ethereum learn unique model reshaping token reward staking airdrop,0.7579,0.2556818181818182,0.5067909090909091
GoogleNews,ethereum,2 hours ago,2025-02-03 12:18:49.582551,ethereum solana plunge u trade war fear trigger crypto selloffcryptocurrency market sea red within last 24 hour triggered growing geopolitical tension wave u tariff china,-0.8271,0.0,-0.41355
GoogleNews,ethereum,3 hours ago,2025-02-03 12:18:49.582551,trump rate ethereumcrash bitcoin etfsthe cryptomarkt growing rapidly total today market capitalization 317 trillion increase 115 last 24 hour,0.4588,0.0,0.2294
GoogleNews,ethereum,3 hours ago,2025-02-03 12:18:49.582551,price ethereum drop 3000ethereum second cryptocurrency market capitalization recently seen price drop 3000 dollar level represents significant,-0.34,0.125,-0.10750000000000001
GoogleNews,ethereum,3 hours ago,2025-02-03 12:18:49.582551,peter schiff highlight crypto winter prediction punxsutawney phil bitcoin ethereum plungerenowned economist peter schiff commented bitcoins crypto btc market slump sunday drawing unusual analogy soothsayer groundhog,0.34,0.2,0.27
GoogleNews,ethereum,3 hours ago,2025-02-03 12:18:49.582551,ethereum suffers black sunday drop 33 steepest four year due tariff defiantethereum experienced significant decline value dropping much 33 within hour monday described black sunday market,-0.25,0.04523809523809525,-0.10238095238095238
GoogleNews,ethereum,3 hours ago,2025-02-03 12:18:49.582551,monochrome brings first australian bitcoin ethereum etf singaporemonochrome group officially registered bitcoin etf singapore monetary authority ma making first australian crypto etf,0.0772,0.125,0.1011
GoogleNews,ethereum,3 hours ago,2025-02-03 12:18:49.582551,ethereum price ethusd forecast update 03022025ethereum price ethusd provides bullish bias remain stable bearish channel support line neutrality still valid,0.5423,0.0,0.27115
GoogleNews,ethereum,3 hours ago,2025-02-03 12:18:49.582551,ethereum classic etc see rising trading volume amid eth declineethereum classic etc gain momentum increased trading volume ethereum struggle learn could position etc strong alternative,0.7579,0.25555555555555554,0.5067277777777778
GoogleNews,ethereum,3 hours ago,2025-02-03 12:18:49.582551,ethereum eth price test 2500 support level amid international trade tensionsethereums price dropped 20 2500 following trump trade tariff announcement triggering massive liquidation analyst whale view,0.4019,0.0,0.20095
GoogleNews,ethereum,3 hours ago,2025-02-03 12:18:49.582551,panic cryptomarkt bitcoin 94000 xrp ethereum crash import dutiesbitcoin rest cryptomarkt fell fast monday donald trump announced import duty weekend although bitcoin heavy blow,-0.7184,0.0,-0.3592
GoogleNews,ethereum,3 hours ago,2025-02-03 12:18:49.582551,crypto crash end bitcoin ethereum ripplemajor cryptocurrencies like bitcoin ethereum ripple experiencing significant decline raising concern among investor bitcoin dropped,0.1531,0.375,0.26405
GoogleNews,ethereum,3 hours ago,2025-02-03 12:18:49.582551,ethereums price fall 3000 here whyethereum face dramatic decline dropping 3000 liquidation surge leaving investor questioning future,-0.1027,-0.21666666666666667,-0.15968333333333334
GoogleNews,ethereum,3 hours ago,2025-02-03 12:18:49.582551,ethereum lead cryptos 224b liquidation amid tariff warsmore 224 billion liquidated cryptocurrency market past 24 hour amid growing geopolitical uncertainty arising global,-0.1779,-0.125,-0.15145
GoogleNews,ethereum,3 hours ago,2025-02-03 12:18:49.582551,4 ethereum token defying bear market 10 gainsdespite market turmoil mantra hyperliquid minotaurus dexe show strong gain discover ethereum token thriving,0.6369,0.43333333333333335,0.5351166666666667
GoogleNews,blockchain,7 minutes ago,2025-02-03 12:18:49.582551,gate2chain blockchain partner smarttz4milk project2025 look fruitful year bsv blockchain expands partnership global business latest focused europe dairy sector,0.4588,0.25,0.3544
GoogleNews,blockchain,0 minutes ago,2025-02-03 12:18:49.582551,blockchain elon musk use government purposesreportedly elon musk considering blockchain use technology promote efficiency responsibility government blockchain would,0.6249,0.0,0.31245
GoogleNews,blockchain,8 minutes ago,2025-02-03 12:18:49.582551,intelmarkets expected pilot new blockchain upgrade february 7m raisedintelmarkets raise 7m presales plan major blockchain upgrade february become best ico aipowered dualchain trading,0.6369,0.2747159090909091,0.45580795454545453
GoogleNews,blockchain,8 minutes ago,2025-02-03 12:18:49.582551,ai cryptos like ozak ai overtake traditional blockchain project xrp solana litecoincrypto space present process prime transformation synthetic intelligence ai rising sportconverting era,0.6808,0.0,0.3404
GoogleNews,blockchain,8 minutes ago,2025-02-03 12:18:49.582551,dogizen move sui blockchain challenging catizen telegram gamefithe telegram gaming sector witnessing major shift dogizen dogiz move ton blockchain sui setting stage heightened competition,0.1531,0.28125,0.217175
GoogleNews,blockchain,2 hours ago,2025-02-03 12:18:49.582551,growing community nova x role pop culture blockchain integrationas blockchain technology continues reshape industry nova x emerging key player fostering trust engagement communitydriven,0.7906,0.0,0.3953
GoogleNews,blockchain,2 hours ago,2025-02-03 12:18:49.582551,future blockchain communication highlight router recordbreaking salelearn router protocol revolutionizing blockchain communication record sale route could see 300x increase,0.5719,0.0,0.28595
GoogleNews,blockchain,2 hours ago,2025-02-03 12:18:49.582551,etihad credit insurance join kyc blockchain platformetihad credit insurance eci uae federal export credit company joined kyc blockchain platform marking first insurance sector,0.8402,0.25,0.5450999999999999
GoogleNews,blockchain,2 hours ago,2025-02-03 12:18:49.582551,lagos land record get blockchain upgrade enhance efficiencynigerias economic powerhouse lagos eyeing blockchain overhaul land registry curb fraud boost efficiency part broader land reform,0.1027,0.2,0.15135
GoogleNews,blockchain,2 hours ago,2025-02-03 12:18:49.582551,thailand sec launch blockchainbased trading platform digital tokensthailand sec launch blockchainbased trading platform digital token enhancing market efficiency liquidity accessibility security,0.5994,-0.05,0.2747
GoogleNews,blockchain,7 minutes ago,2025-02-03 12:18:49.582551,gate2chain blockchain partner smarttz4milk project2025 look fruitful year bsv blockchain expands partnership global business latest focused europe dairy sector,0.4588,0.25,0.3544
GoogleNews,blockchain,0 minutes ago,2025-02-03 12:18:49.582551,blockchain elon musk use government purposesreportedly elon musk considering blockchain use technology promote efficiency responsibility government blockchain would,0.6249,0.0,0.31245
GoogleNews,blockchain,8 minutes ago,2025-02-03 12:18:49.582551,intelmarkets expected pilot new blockchain upgrade february 7m raisedintelmarkets raise 7m presales plan major blockchain upgrade february become best ico aipowered dualchain trading,0.6369,0.2747159090909091,0.45580795454545453
GoogleNews,blockchain,8 minutes ago,2025-02-03 12:18:49.582551,ai cryptos like ozak ai overtake traditional blockchain project xrp solana litecoincrypto space present process prime transformation synthetic intelligence ai rising sportconverting era,0.6808,0.0,0.3404
GoogleNews,blockchain,8 minutes ago,2025-02-03 12:18:49.582551,dogizen move sui blockchain challenging catizen telegram gamefithe telegram gaming sector witnessing major shift dogizen dogiz move ton blockchain sui setting stage heightened competition,0.1531,0.28125,0.217175
GoogleNews,blockchain,2 hours ago,2025-02-03 12:18:49.582551,growing community nova x role pop culture blockchain integrationas blockchain technology continues reshape industry nova x emerging key player fostering trust engagement communitydriven,0.7906,0.0,0.3953
GoogleNews,blockchain,2 hours ago,2025-02-03 12:18:49.582551,future blockchain communication highlight router recordbreaking salelearn router protocol revolutionizing blockchain communication record sale route could see 300x increase,0.5719,0.0,0.28595
GoogleNews,blockchain,2 hours ago,2025-02-03 12:18:49.582551,etihad credit insurance join kyc blockchain platformetihad credit insurance eci uae federal export credit company joined kyc blockchain platform marking first insurance sector,0.8402,0.25,0.5450999999999999
GoogleNews,blockchain,2 hours ago,2025-02-03 12:18:49.582551,lagos land record get blockchain upgrade enhance efficiencynigerias economic powerhouse lagos eyeing blockchain overhaul land registry curb fraud boost efficiency part broader land reform,0.1027,0.2,0.15135
GoogleNews,blockchain,2 hours ago,2025-02-03 12:18:49.582551,thailand sec launch blockchainbased trading platform digital tokensthailand sec launch blockchainbased trading platform digital token enhancing market efficiency liquidity accessibility security,0.5994,-0.05,0.2747
GoogleNews,blockchain,7 minutes ago,2025-02-03 12:18:49.582551,gate2chain blockchain partner smarttz4milk project2025 look fruitful year bsv blockchain expands partnership global business latest focused europe dairy sector,0.4588,0.25,0.3544
GoogleNews,blockchain,0 minutes ago,2025-02-03 12:18:49.582551,blockchain elon musk use government purposesreportedly elon musk considering blockchain use technology promote efficiency responsibility government blockchain would,0.6249,0.0,0.31245
GoogleNews,blockchain,8 minutes ago,2025-02-03 12:18:49.582551,intelmarkets expected pilot new blockchain upgrade february 7m raisedintelmarkets raise 7m presales plan major blockchain upgrade february become best ico aipowered dualchain trading,0.6369,0.2747159090909091,0.45580795454545453
GoogleNews,blockchain,8 minutes ago,2025-02-03 12:18:49.582551,ai cryptos like ozak ai overtake traditional blockchain project xrp solana litecoincrypto space present process prime transformation synthetic intelligence ai rising sportconverting era,0.6808,0.0,0.3404
GoogleNews,blockchain,8 minutes ago,2025-02-03 12:18:49.582551,dogizen move sui blockchain challenging catizen telegram gamefithe telegram gaming sector witnessing major shift dogizen dogiz move ton blockchain sui setting stage heightened competition,0.1531,0.28125,0.217175
GoogleNews,blockchain,2 hours ago,2025-02-03 12:18:49.582551,growing community nova x role pop culture blockchain integrationas blockchain technology continues reshape industry nova x emerging key player fostering trust engagement communitydriven,0.7906,0.0,0.3953
GoogleNews,blockchain,2 hours ago,2025-02-03 12:18:49.582551,future blockchain communication highlight router recordbreaking salelearn router protocol revolutionizing blockchain communication record sale route could see 300x increase,0.5719,0.0,0.28595
GoogleNews,blockchain,2 hours ago,2025-02-03 12:18:49.582551,etihad credit insurance join kyc blockchain platformetihad credit insurance eci uae federal export credit company joined kyc blockchain platform marking first insurance sector,0.8402,0.25,0.5450999999999999
GoogleNews,blockchain,2 hours ago,2025-02-03 12:18:49.582551,lagos land record get blockchain upgrade enhance efficiencynigerias economic powerhouse lagos eyeing blockchain overhaul land registry curb fraud boost efficiency part broader land reform,0.1027,0.2,0.15135
GoogleNews,blockchain,2 hours ago,2025-02-03 12:18:49.582551,thailand sec launch blockchainbased trading platform digital tokensthailand sec launch blockchainbased trading platform digital token enhancing market efficiency liquidity accessibility security,0.5994,-0.05,0.2747
GoogleNews,blockchain,7 minutes ago,2025-02-03 12:18:49.582551,gate2chain blockchain partner smarttz4milk project2025 look fruitful year bsv blockchain expands partnership global business latest focused europe dairy sector,0.4588,0.25,0.3544
GoogleNews,blockchain,0 minutes ago,2025-02-03 12:18:49.582551,blockchain elon musk use government purposesreportedly elon musk considering blockchain use technology promote efficiency responsibility government blockchain would,0.6249,0.0,0.31245
GoogleNews,blockchain,8 minutes ago,2025-02-03 12:18:49.582551,intelmarkets expected pilot new blockchain upgrade february 7m raisedintelmarkets raise 7m presales plan major blockchain upgrade february become best ico aipowered dualchain trading,0.6369,0.2747159090909091,0.45580795454545453
GoogleNews,blockchain,8 minutes ago,2025-02-03 12:18:49.582551,ai cryptos like ozak ai overtake traditional blockchain project xrp solana litecoincrypto space present process prime transformation synthetic intelligence ai rising sportconverting era,0.6808,0.0,0.3404
GoogleNews,blockchain,8 minutes ago,2025-02-03 12:18:49.582551,dogizen move sui blockchain challenging catizen telegram gamefithe telegram gaming sector witnessing major shift dogizen dogiz move ton blockchain sui setting stage heightened competition,0.1531,0.28125,0.217175
GoogleNews,blockchain,2 hours ago,2025-02-03 12:18:49.582551,growing community nova x role pop culture blockchain integrationas blockchain technology continues reshape industry nova x emerging key player fostering trust engagement communitydriven,0.7906,0.0,0.3953
GoogleNews,blockchain,2 hours ago,2025-02-03 12:18:49.582551,future blockchain communication highlight router recordbreaking salelearn router protocol revolutionizing blockchain communication record sale route could see 300x increase,0.5719,0.0,0.28595
GoogleNews,blockchain,2 hours ago,2025-02-03 12:18:49.582551,etihad credit insurance join kyc blockchain platformetihad credit insurance eci uae federal export credit company joined kyc blockchain platform marking first insurance sector,0.8402,0.25,0.5450999999999999
GoogleNews,blockchain,2 hours ago,2025-02-03 12:18:49.582551,lagos land record get blockchain upgrade enhance efficiencynigerias economic powerhouse lagos eyeing blockchain overhaul land registry curb fraud boost efficiency part broader land reform,0.1027,0.2,0.15135
GoogleNews,blockchain,2 hours ago,2025-02-03 12:18:49.582551,thailand sec launch blockchainbased trading platform digital tokensthailand sec launch blockchainbased trading platform digital token enhancing market efficiency liquidity accessibility security,0.5994,-0.05,0.2747
GoogleNews,blockchain,2 hours ago,2025-02-03 12:18:49.582551,cronos lab layerzero announce integration boost crossblockchain interoperabilitycronos lab expanding blockchain interoperability capability newly announced integration layerzero growing crossblockchain,0.5267,0.13636363636363635,0.33153181818181815
GoogleNews,blockchain,2 hours ago,2025-02-03 12:18:49.582551,orbiter finance obt elevating blockchain connectivity zk techorbiter finance obt zkbased rollup enhancing blockchain interoperability fast lowcost crossrollup transaction across multiple network,0.0,0.1,0.05
GoogleNews,blockchain,3 hours ago,2025-02-03 12:18:49.582551,swiss bank ubs explores blockchain digital gold investment zksyncthe swiss bank ubs global leader financial sector experimenting innovative blockchain solution simplify make investment,0.6369,0.125,0.38095
GoogleNews,blockchain,3 hours ago,2025-02-03 12:18:49.582551,xrp v ozak ai xrps 2025 price surge outpaced ozak ai aipowered blockchain solutionsozak ai blockchainbased crypto project provides technology platform specializes predictive ai advanced data analytics financial,0.25,0.2,0.225
GoogleNews,blockchain,3 hours ago,2025-02-03 12:18:49.582551,argo blockchain interim ceo buy 75k share insider dealargo blockchains interim ceo jim maccallum bought 70000 company share insider transaction,0.5267,0.0,0.26335
GoogleNews,blockchain,3 hours ago,2025-02-03 12:18:49.582551,elon musk blast treasury official fraudulent payment call blockchain fixelon musk accused career treasury official breaking law every hour approving payment either fraudulent comply,-0.7184,0.0,-0.3592
GoogleNews,blockchain,4 hours ago,2025-02-03 12:18:49.582551,cardano founder want u budget blockchainbut trust government spending shaky maybe time put u budget blockchain let explore,0.4019,-0.3333333333333333,0.03428333333333333
