MainSource,Source,Publication Date,Pull_date,Pre-Processed Text,Sentiment_Vader,Sentiment_TextBlob,Average_Sentiment
Reddit,ethereum,2025-02-04 12:02:05,2025-02-04 12:19:06.748666,serious eth questionive keeping close eye ethereums performance lately im starting question longterm viability given recent downward trend rate think one eth cover mcdonalds near future bullish expectation,-0.0772,-0.04666666666666666,-0.06193333333333333
Reddit,ethereum,2025-02-03 14:56:23,2025-02-04 12:19:06.748666,major update wanchains eth xflows integrated polygon zkevm httpspreviewredditmnxzuga2uxge1pngwidth680formatpngautowebps930d2fb712a78a211091fca9262c13d3acd8fdb9 exciting news ethereum community jan 23 2025 wanchains eth xflows successfully integrated polygon zkevm integration brings significant improvement zkevm eth transaction including nativetonative transfer wrapped token middleman decentralized secure trustless transaction slippagefree predictable smooth transfer fast transaction completed instant inexpensive lower fee crosschain transfer eth easily move polygon zkevm 11 blockchains enhancing flexibility interoperability ethereum ecosystem integration huge step forward crosschain interoperabilitymaking easier ethereum interact network decentralized efficient way another example wanchain continues promote blockchain adoption connecting isolated blockchains enabling seamless communication across chain check bridge httpsbridgewanchainorghttpsbridgewanchainorg,0.959,0.2684027777777778,0.6137013888888889
Reddit,ethereum,2025-02-03 17:06:17,2025-02-04 12:19:06.748666,securing internet trust establishing digital human right juan benet protocol lab,0.6808,0.09523809523809523,0.3880190476190476
Reddit,ethereum,2025-02-03 15:36:42,2025-02-04 12:19:06.748666,rise fake web3 recruiter,-0.4767,-0.5,-0.48835
Reddit,ethereum,2025-02-03 15:10:07,2025-02-04 12:19:06.748666,happens eth optimism blockchain optimism go zeroi believe kinda stupid question eth optimism mainlet risk lose eth wanted use optimism reduce fee,0.796,-0.7999999999999999,-0.0019999999999999463
Reddit,ethereum,2025-02-02 07:01:30,2025-02-04 12:19:06.748666,daily general discussion february 02 2025welcome ethereum daily general discussion rethereum httpsimgurcom3y7vezphttpsimgurcom3y7vezp bookmarking link always bring current daily httpsoldredditcomrethereumaboutstickynum2httpsoldredditcomrethereumaboutstickynum2 please use thread discus ethereum topic news event even price price discussion posted elsewhere subreddit continue removed always constructive subreddit ruleshttpswwwredditcomrethereumaboutrules want stake learn rethstaker ethfinance ethereum community link ethereum jobshttpsethereumorgencommunitygetinvolvedethereumjobs twitterhttpsxcomethereum evmavericks youtubehttpswwwyoutubecomevmavericks discordhttpsdiscordggevmavericks doots podcasthttpsevmaverickslibsyncom doots websitehttpsdailydootscom old reddit doots extensionhttpsgithubcometheralphaethfinanceextension uhanniabu calendar jan 20 ethereum protocol attackathonhttpsblogethereumorg20241125ethereumprotocolattackathon end jan 3031 ethereumzurichhttpsethereumzurich conference feb 79 eth oxfordhttpsethoxfordio hackathon feb 1016 ethiopiahttpsethiopiaxyz conference hackathon feb 23 mar 2 ethdenverhttpswwwethdenvercom mar 2830 eth pondyhttpswwwethpondyxyz puducherry hackathon apr 13 ey global blockchain summit person virtual,0.3818,0.025000000000000005,0.2034
Reddit,ethereum,2025-02-01 23:52:08,2025-02-04 12:19:06.748666,controversial opinion ethereum foundation ef rename accurately reflect actually stop medium posting misleading clickbait fud article itthe medium never talk efs actual function would really boring almost every single medium article ethereum foundation concern selling eth realize extremely controversial better community stop focusing efs selling hold 02 eth supply sold 4766 eth 2024 eth selling completely trivial ef sold 0004 eth supply 2024 bitcoin annual inflation 17 2024 solana annual inflation 47 2024 every day bitcoin miner sell larger percent bitcoin ef entire year every day solana validators sell larger percent sol ef entire year due principle subtraction ethereum foundation relinquished original role remaining function related sponsoring tool research grant promoting academic outreach layman knew ef mainly function provide grant would extremely obvious regularly sell eth one would questioning misconception due word foundation unfortunately layman medium see word foundation incorrectly assume control governs develops blockchain question organization selling eth instead holding medium take advantage write clickbait fud article ef actually control ethereum governance consensus development indirect influence grant direct control ethereum foundation consists 3 program 1 ecosystem support program allocates fund sponsor critical project research infrastructure tooling community education httpsespethereumfoundationaboutwhowesupport example include node client eg nimbus erigon lighthouse research verkle tree epbs tool revokecash growthepie evm gas cost estimator 2 devcon host annual devcon meetups 3 fellowship program help sponsor project grant identifies fund individual working public good research project related blockchains necessarily ethereum feel free correct im wrong renaming ef better reflect actually believe ef need rename something like ethereum grant program would immediately get medium back people stop asking misleading question like blockchain foundation selling cryptocurrency want stop fud need rename ef,0.8689,0.05772108843537416,0.4633105442176871
Reddit,ethereum,2025-02-02 13:53:08,2025-02-04 12:19:06.748666,call dao single wallet quorumthats relatively new situation im looking good term adjective potential option 1 autocratodaoic 2 quoruminant 3 monowalletic 4 unisignatory 5 solocratic 6 singularitarian 7 unilateraldao 8 pluralityofone 9 omniwallet 10 soloquorum theory token holder could coordinate realistically publicly available chat aware practical real life,0.4404,0.23070500927643783,0.33555250463821895
Reddit,ethereum,2025-02-03 02:30:01,2025-02-04 12:19:06.748666,talk roadmapwhats next whats realistic lot great idea havent seen well formulated plan year devs still guessing see question answer read blog dev note seems still dont know actually achieve scalability worrisome totally understand thing take time code still unclear going achieve goal much time surpassed really brings doubt anyone bring clarity roadblock,-0.1261,0.19523809523809524,0.034569047619047624
Reddit,ethereum,2025-02-01 07:01:56,2025-02-04 12:19:06.748666,daily general discussion february 01 2025welcome ethereum daily general discussion rethereum httpsimgurcom3y7vezphttpsimgurcom3y7vezp bookmarking link always bring current daily httpsoldredditcomrethereumaboutstickynum2httpsoldredditcomrethereumaboutstickynum2 please use thread discus ethereum topic news event even price price discussion posted elsewhere subreddit continue removed always constructive subreddit ruleshttpswwwredditcomrethereumaboutrules want stake learn rethstaker ethfinance ethereum community link ethereum jobshttpsethereumorgencommunitygetinvolvedethereumjobs twitterhttpsxcomethereum evmavericks youtubehttpswwwyoutubecomevmavericks discordhttpsdiscordggevmavericks doots podcasthttpsevmaverickslibsyncom doots websitehttpsdailydootscom old reddit doots extensionhttpsgithubcometheralphaethfinanceextension uhanniabu calendar jan 20 ethereum protocol attackathonhttpsblogethereumorg20241125ethereumprotocolattackathon end jan 3031 ethereumzurichhttpsethereumzurich conference feb 79 eth oxfordhttpsethoxfordio hackathon feb 1016 ethiopiahttpsethiopiaxyz conference hackathon feb 23 mar 2 ethdenverhttpswwwethdenvercom mar 2830 eth pondyhttpswwwethpondyxyz puducherry hackathon apr 13 ey global blockchain summit person virtual,0.3818,0.025000000000000005,0.2034
Reddit,ethereum,2025-02-01 18:38:41,2025-02-04 12:19:06.748666,eigenlayer cartesi join force advance web3 innovationeigenlayer teaming cartesi empower innovation space february 1018 builder dive hackathon develop unprecendented dapps integration unlocking new possibility decentralized tech youre looking opportunity combine ai blockchain now moment check detail httpcartesiioblogexperimentweek3httpcartesiioblogexperimentweek3,0.765,0.13636363636363635,0.4506818181818182
Reddit,ethereum,2025-02-01 16:14:29,2025-02-04 12:19:06.748666,built free website learning solidity inspired codecademyhey everyone launched solidityquesta free interactive platform learn solidity built take basic advanced topic practical coding exercise challenge httpspreviewredditaze7p3heyjge1jpgwidth2642formatpjpgautowebps1184db9b24ceced6fa2dfe386dc7a92f9995a91d designed solidityquest simple engaging whether youre starting looking level skill hope youll find resource valuable check httpswwwsolidityquestxyzhttpswwwsolidityquestxyz looking forward feedback suggestion,0.9638,0.2285714285714286,0.5961857142857143
Reddit,ethereum,2025-02-01 04:41:40,2025-02-04 12:19:06.748666,cant eth consensus voting every 3 block instead every blockfrom understand reason 12 interval block consensus voting reason block gas limit sudden burst network cpuram usage still consensus voting every 12 second every consensus voting includes 3 block block time 4 consensus voting happens every 12 4 separation sudden burst high load seems enough heard delayed execution way basically spread block processing across entire 12 sudden burst allow u large block still year away seems much easier make consensus voting happen every 3 10 block instead every block im pretty sure good reason otherwise would implemented already dont know,-0.9313,0.16869047619047617,-0.3813047619047619
Reddit,ethereum,2025-02-01 19:09:48,2025-02-04 12:19:06.748666,hallucinate server gubsheep,0.0,0.0,0.0
Reddit,ethereum,2025-01-31 19:48:18,2025-02-04 12:19:06.748666,happy hour 97 justin drake eth foundation jan 31st 2025,0.5719,0.8,0.6859500000000001
Reddit,ethereum,2025-02-01 02:03:23,2025-02-04 12:19:06.748666,building simple onchain orderbook dex rwa token need ive looking dex orderbook could list rwa token fixed price fundraising couldnt find one here use case 1 initial sale want tokenize real estate development project sell token fixed price raise construction fund 2 construction 1 year token holder able trade token price choose 3 project exit selling property want place single large buy order fair price token holder exit rate 4 capital efficiency raised fund available business need land purchase material labor without locking portion liquidity pool ammbased dexes like uniswap become standard defi arent suitable type rwa token amm pool would cause price fluctuation making unfair initial buyer final exit require locking significant capital liquidity pool price discovery mechanism doesnt match rwa trading pattern rwa trading often requires precise price control doesnt need highspeed execution amms provide post explores simple approach building onchain orderbook dex specifically designed rwa token problem traditional orderbook dexes often considered impractical onchain due 1 high gas cost order matching 2 complex order matching logic 3 frontrunning concern 4 speed limitation onchain execution however rwa token limitation le critical trading velocity lower price precision important execution speed frontrunning le profitable due lower volatility gas cost acceptable given higher transaction value solution simple onchain orderbook build simplified onchain orderbook dex key feature core design one smart contract per token pair fixed price step simplify matching priceindexed mapping order offchain order matching calculation onchain order execution factory contract easy deployment new pair data structure price order price level mappinguint256 order public buyorders mappinguint256 order public sellorders struct order address maker uint256 amount bool isbuyorder key function 1 create order 2 take price amountvalidates price steptransfers token contractstores order mapping 3 take order 4 take existing order price indextransfers token partiesremoves fulfilled order 5 cancel order 6 original maker cancelreturns locked tokensremoves order mapping price step pair fixed minimum price step eg 001 price must multiple step larger step mean fewer possible price level reduces storage cost simplifies matching frontend integration javascript frontend calculates best matching order easily scan available order price level simplified order matching due price step structure clear view liquidity price level advantage 1 simple predictable gas cost 2 easy understand audit 3 precise price control trader 4 impermanent loss 5 perfect rwa token speed isnt critical 6 ideal fixedprice token sale fair exit 7 capital locked liquidity pool 8 support fixedprice primary market variableprice secondary market 9 fair equal treatment token holder exit event gas optimization 1 fixed price step reduce storage complexity 2 direct price indexing quick lookup 3 batch operation possible efficiency 4 simple matching logic reduces computation limitation 1 higher gas cost amms 2 suitable highfrequency trading 3 le capital efficient amms 4 requires active market making future improvement 1 partial order filling 2 better order prioritization 3 multiple token pair support single contract 4 gas optimization bulk operation 5 integration liquidity provider incentive conclusion rwa token simple onchain orderbook provide better price discovery precise trading ammbased solution approach wouldnt work well highfrequency trading token perfectly suited rwa market trade frequency lower price precision important execution speed implementation straightforward enough built audited maintained small team making attractive option rwa token project need custom trading solution think approach would love hear thought suggestion improvement,0.9971,0.18974787558120895,0.5934239377906044
Reddit,ethereum,2025-01-31 07:01:56,2025-02-04 12:19:06.748666,daily general discussion january 31 2025welcome ethereum daily general discussion rethereum httpsimgurcom3y7vezphttpsimgurcom3y7vezp bookmarking link always bring current daily httpsoldredditcomrethereumaboutstickynum2httpsoldredditcomrethereumaboutstickynum2 please use thread discus ethereum topic news event even price price discussion posted elsewhere subreddit continue removed always constructive subreddit ruleshttpswwwredditcomrethereumaboutrules want stake learn rethstaker ethfinance ethereum community link ethereum jobshttpsethereumorgencommunitygetinvolvedethereumjobs twitterhttpsxcomethereum evmavericks youtubehttpswwwyoutubecomevmavericks discordhttpsdiscordggevmavericks doots podcasthttpsevmaverickslibsyncom doots websitehttpsdailydootscom old reddit doots extensionhttpsgithubcometheralphaethfinanceextension uhanniabu calendar jan 20 ethereum protocol attackathonhttpsblogethereumorg20241125ethereumprotocolattackathon end jan 3031 ethereumzurichhttpsethereumzurich conference feb 79 eth oxfordhttpsethoxfordio hackathon feb 1016 ethiopiahttpsethiopiaxyz conference hackathon feb 23 mar 2 ethdenverhttpswwwethdenvercom mar 2830 eth pondyhttpswwwethpondyxyz puducherry hackathon apr 13 ey global blockchain summit person virtual,0.3818,0.025000000000000005,0.2034
Reddit,ethereum,2025-01-31 18:49:55,2025-02-04 12:19:06.748666,aristotle revenge cyclical ethereum sentimentaristotles revenge refers resurgence validation aristotelian philosophy particularly view nature science light modern scientific discovery term suggests many aristotle fundamental idea reality dismissed scientific revolution enlightenment partially vindicated contemporary physic philosophy science let analyze example lens aristotle revenge breaking three phase phase 1 initial praise original truth project presented receives recognition like aristotle original teaching initially accepted valued there intuitive understanding merit potential praise suggests project aligns fundamental truth need phase 2 dismissal modern rejection project face criticism negativity similar aristotelian thought dismissed scientific revolution new thinking approach considered superior original merit forgotten minimized there sense project outdated flawed compared better alternative phase 3 vindication revenge project prof worth despite criticism like aristotelian concept validated modern discovery fundamental truth value initially recognized reemerges dismissal shown shortsighted project success demonstrates original understanding correct sound familiar,0.9702,0.19402680652680654,0.5821134032634032
Reddit,ethereum,2025-01-31 22:10:32,2025-02-04 12:19:06.748666,retroactive funding round ethereum public good obol,0.4404,0.16666666666666666,0.3035333333333333
Reddit,ethereum,2025-01-31 07:44:25,2025-02-04 12:19:06.748666,highlight ethereums core devs meeting acde 204,0.34,0.0,0.17
Reddit,ethereum,2025-01-31 17:21:07,2025-02-04 12:19:06.748666,method eth_getencryptionpublickey exist available,0.0,0.4,0.2
Reddit,ethereum,2025-01-30 21:58:40,2025-02-04 12:19:06.748666,could ethereum smart contract integral future ai agentsit seems like natural fit autonomous agent need autonomy smart contract could provide could breakout use care edit im asking ai agent interacting smart contract controlled,0.9501,0.2204081632653061,0.585254081632653
Reddit,ethereum,2025-01-30 07:01:43,2025-02-04 12:19:06.748666,daily general discussion january 30 2025welcome ethereum daily general discussion rethereum httpsimgurcom3y7vezphttpsimgurcom3y7vezp bookmarking link always bring current daily httpsoldredditcomrethereumaboutstickynum2httpsoldredditcomrethereumaboutstickynum2 please use thread discus ethereum topic news event even price price discussion posted elsewhere subreddit continue removed always constructive subreddit ruleshttpswwwredditcomrethereumaboutrules want stake learn rethstaker ethfinance ethereum community link ethereum jobshttpsethereumorgencommunitygetinvolvedethereumjobs twitterhttpsxcomethereum evmavericks youtubehttpswwwyoutubecomevmavericks discordhttpsdiscordggevmavericks doots podcasthttpsevmaverickslibsyncom doots websitehttpsdailydootscom old reddit doots extensionhttpsgithubcometheralphaethfinanceextension uhanniabu calendar jan 20 ethereum protocol attackathonhttpsblogethereumorg20241125ethereumprotocolattackathon end jan 3031 ethereumzurichhttpsethereumzurich conference feb 79 eth oxfordhttpsethoxfordio hackathon feb 1016 ethiopiahttpsethiopiaxyz conference hackathon feb 23 mar 2 ethdenverhttpswwwethdenvercom mar 2830 eth pondyhttpswwwethpondyxyz puducherry hackathon apr 13 ey global blockchain summit person virtual,0.3818,0.025000000000000005,0.2034
Reddit,ethereum,2025-01-30 22:00:52,2025-02-04 12:19:06.748666,possible encrypt data inside smart contract ethereumhello everyone ive practicing smart contract solidity ethereum came across question possible encrypt data directly within smart contract goal use blockchain encrypt information using someone el public key however noticed ethereum doesnt seem native support question way encrypt data within ethereum using another person public key whether rsa ecc approach anything developed achieve,0.7043,0.07662337662337662,0.3904616883116883
Reddit,ethereum,2025-01-30 11:40:13,2025-02-04 12:19:06.748666,ethereum observer weekly ethereum news roundup 4hi ethereum observer brief weekly roundup ethereum wider industry news headline find list comment get involved httpsxcomjbschweitzerstatus1884926079657239005s19,0.0,0.0,0.0
Reddit,ethereum,2025-01-31 11:51:10,2025-02-04 12:19:06.748666,please helpim new eth block saying 100 year later someone please help life saving way reverse,0.5267,0.06818181818181818,0.29744090909090903
Reddit,ethereum,2025-01-30 18:25:46,2025-02-04 12:19:06.748666,execution layer meeting 204 podcast outdive latest insight update listen key development discussion shaping future ethereum ethereum cat herder podcast tune stay ahead httpsopenspotifycomepisode2ljvsysownfliemurouxzhsiqaxful5bta2exnl_mflwghttpsopenspotifycomepisode2ljvsysownfliemurouxzhsiqaxful5bta2exnl_mflwg,0.0,0.16666666666666666,0.08333333333333333
Reddit,ethereum,2025-01-30 17:13:32,2025-02-04 12:19:06.748666,encrypt message ethereum address without knowing public keyim working project need encrypt message send blockchain intended recipient decrypt challenge recipient ethereum address encryption typically requires public key since ethereum address derived public key dont expose directly im looking best approach encrypt data recipient without full public key beforehand tackel idea,0.7135,0.11666666666666665,0.41508333333333336
Reddit,ethereum,2025-01-29 23:22:19,2025-02-04 12:19:06.748666,tokenize construction argentinawe purchased plot land la plata argentina obtained building permit 4story residential building need raise 100k construction im exploring whether possible tokenize future building want keep model simple issue erc20 token 100k token total sell entire volume 100k usdc build house take approximately 15 year sell apartment targeting around 300k sale distribute net profit paying fee tax token holder wallet usdc project end theory rwa real world asset could suggest learn properly organize ive heard platform help legal aspect ideally representation argentina technically issuing token creating script sale profit distribution isnt difficult whats unclear avoid potential regulatory issue let know youd like help explore rwa tokenization platform regulatory consideration type real estate project,0.9668,0.04000000000000001,0.5034
Reddit,ethereum,2025-01-29 07:01:45,2025-02-04 12:19:06.748666,daily general discussion january 29 2025welcome ethereum daily general discussion rethereum httpsimgurcom3y7vezphttpsimgurcom3y7vezp bookmarking link always bring current daily httpsoldredditcomrethereumaboutstickynum2httpsoldredditcomrethereumaboutstickynum2 please use thread discus ethereum topic news event even price price discussion posted elsewhere subreddit continue removed always constructive subreddit ruleshttpswwwredditcomrethereumaboutrules want stake learn rethstaker ethfinance ethereum community link ethereum jobshttpsethereumorgencommunitygetinvolvedethereumjobs twitterhttpsxcomethereum evmavericks youtubehttpswwwyoutubecomevmavericks discordhttpsdiscordggevmavericks doots podcasthttpsevmaverickslibsyncom doots websitehttpsdailydootscom old reddit doots extensionhttpsgithubcometheralphaethfinanceextension uhanniabu calendar jan 20 ethereum protocol attackathonhttpsblogethereumorg20241125ethereumprotocolattackathon end jan 3031 ethereumzurichhttpsethereumzurich conference feb 79 eth oxfordhttpsethoxfordio hackathon feb 1016 ethiopiahttpsethiopiaxyz conference hackathon feb 23 mar 2 ethdenverhttpswwwethdenvercom mar 2830 eth pondyhttpswwwethpondyxyz puducherry hackathon apr 13 ey global blockchain summit person virtual,0.3818,0.025000000000000005,0.2034
Reddit,ethereum,2025-01-30 05:06:10,2025-02-04 12:19:06.748666,whats current sentiment orbiter financejust heard seems like good way move eth googling found issue year ago still valid concern people use something similar thats better,0.8074,0.3,0.5537
Reddit,ethereum,2025-01-29 21:51:20,2025-02-04 12:19:06.748666,whats risk slashingid like stake ethereum trezor wallet im afraid slashing high risk dont really see point staking 348 pa risk higher thanks,-0.25,0.042000000000000016,-0.104
Reddit,ethereum,2025-01-29 14:47:08,2025-02-04 12:19:06.748666,come yellow paper never updatedfor example ctrlf blob show zero result new addition ethereum protocol supposed keep track current specification,0.0,0.04545454545454545,0.022727272727272724
Reddit,ethereum,2025-01-29 20:24:25,2025-02-04 12:19:06.748666,arb profit eigenphianyone else notice flashloan arbitrage profit eigenphi completely tanked like year ago monthly best would consistenly 60k 200k month highest profit arb like 15k also historically massive sandwich attack 121 apparently worth 800k sure related cant really find article anywhere mev guess still sort niche anyone else seen whats going flashloan arb profit much sandwich becoming sophisticated running plain arb getting crowded interested hear opinion,0.9787,0.27380952380952384,0.6262547619047619
Reddit,ethereum,2025-01-30 08:53:12,2025-02-04 12:19:06.748666,get scammedi came across youtube video explaining create smart contract utilizes bot generate money copied pasted provided code redux transferred fund smart contract compiling deploying moved money wallet however fund appear locked,0.7579,0.21428571428571427,0.48609285714285716
Reddit,ethereum,2025-01-29 11:53:01,2025-02-04 12:19:06.748666,eip pda dapps programmatically derived addresseshey everyone im dev long background eth im working new project pda powerful id like include ethereum never offered anything like discussion pda anything roadmap pda kind platform innovation make development easier adoption scaleable userfriendly point working erc standard forever loving pda structure think im one dont see much interest around platform innovation ethereum would love see eip edit quick pda summary youre familiar pda created passing program id array seed hash function pda look like public key dont private key seed array string include thing like signer id escrow account bump seed used ensure pda elliptic curve mean doesnt corresponding private key like private key mentioned used create hashmaps structure onchain helping structure data way easy access modify especially programmatically used create account flow control accessible specific program,0.9898,0.15176218708827402,0.570781093544137
Reddit,ethereum,2025-01-29 20:43:44,2025-02-04 12:19:06.748666,cryptocurrency coin vesting omnify guide,0.0,0.0,0.0
