MainSource,Source,Publication Date,Pull_date,Pre-Processed Text,Sentiment_Vader,Sentiment_TextBlob,Average_Sentiment
Reddit,solana,2025-01-02 21:22:32,2025-01-07 00:53:29.122107,phantom wallet got hacked deposited money phantom wallet 30 minute later solana transferred random wallet dont know could happened please help like dont next time didnt share secret key whatever please someone help,0.7853,-0.18,0.30265
Reddit,ethereum,2024-12-31 13:01:14,2025-01-07 00:53:29.122107,weekly discussion thread buildinghello rethereum welcome weekly discussion thread building space developer entrepreneur enthusiast showcase project share idea seek feedback greater ethereum community share project whether youre developing decentralized application dapp launching new layer 2 network working ethereum infrastructure encourage share detail project please provide concise overview including purpose current status link information provide xtwitter youtube link post automatically filtered engage collaborate thread excellent opportunity connect likeminded individual application tester feel free ask question offer feedback seek collaboration safety reminder encourage sharing collaboration please cautious potential scam avoid connecting wallet unfamiliar application without thorough research utilizing wallet tool offer transaction simulation eg rabby walletguard help ensure safety fund never give seed phrase private key looking forward hearing pushing ethereum ecosystem forward,0.9908,0.26694214876033057,0.6288710743801653
Reddit,ethereum,2025-01-06 07:01:27,2025-01-07 00:53:29.122107,daily general discussion january 06 2025welcome ethfinance daily general discussion rethereum httpsimgurcom3y7vezphttpsimgurcom3y7vezp please use thread discus ethereum topic news event even price price discussion posted elsewhere subreddit continue removed always constructive subreddit ruleshttpswwwredditcomrethereumaboutrules want stake learn rethstaker ethfinance ethereum community link ethereum jobshttpsethereumorgencommunitygetinvolvedethereumjobs twitterhttpsxcomethereum evmavericks youtubehttpswwwyoutubecomevmavericks discordhttpsdiscordggevmavericks doots podcasthttpsevmaverickslibsyncom doots websitehttpsdailydootscom old reddit doots extensionhttpsgithubcometheralphaethfinanceextension uhanniabu calendar jan 20 ethereum protocol attackathonhttpsblogethereumorg20241125ethereumprotocolattackathon end jan 3031 ethereumzurichhttpsethereumzurich conference feb 79 eth oxfordhttpsethoxfordio hackathon feb 1016 ethiopiahttpsethiopiaxyz conference hackathon feb 23 mar 2 ethdenverhttpswwwethdenvercom mar 2830 eth pondyhttpswwwethpondyxyz puducherry hackathon apr 13 ey global blockchain summit person virtual,0.3818,0.03333333333333334,0.20756666666666665
Reddit,ethereum,2025-01-06 15:43:10,2025-01-07 00:53:29.122107,ethereumrelated content ive found interesting last weekstuff found interesting vitalik reflects dacc one year laterhttpsvitalikethlimogeneral20250105dacc2html david phelps describes fat app thesishttpsdavidphelpssubstackcompthefatappthesis stigmergic highlight limit protocolizationhttpsforumsummerofprotocolscomtthelimitsofprotocolizationagencyvsoverreliance1696 product burner prohttpsburnerpro evan van ness say week ethereum ended explains whyhttpsnewskiwistandcomstoriesweekinethereumhasendedhereiswhyindex0x67764a6654f9c5c813401a90dd84b9716d58a0d3f5cb4ab4d2c2094565600d3cb8f7b9b1 im sharing ive curating ethereumfocused newsletterhttpsparagraphxyzkiwiweeklykiwinewsrecap77 year based community curations thought id share interesting read find,0.926,0.375,0.6505000000000001
Reddit,ethereum,2025-01-06 10:39:10,2025-01-07 00:53:29.122107,l2s burn ethcan someone break simply make tx arbbase pay tx fee go towards l1 fee rolled published ethereum blob fee,0.5574,0.0,0.2787
Reddit,ethereum,2025-01-06 10:23:22,2025-01-07 00:53:29.122107,accelerate l2 interoperability update 0httpsnotesethereumorgrudolfinteropacc copypasted text would prefer read reddit text mine im simply reposting visibility credit author arbitrum base en metamask optimism phantom polygon taiko world zksync tldr need solve l2 interop build world computer needed solve interop already today using timescale month rather year one highest priority item right increasing da could considered type liveness failure solved l2s wallet collaborating closely first item enable fast trustless crosschain sends stay tuned update group interop matter ethereums goal world computer place anyoneanywhere build use new kind powerful unstoppable application achieve world computer vision application need accessible user time scalable cheap transact permissionless censorshipresistant secure easy lowfriction ux switching apps chain feel simple using single chain ethereum found path achieving 1 accessible time enabling lowcost l2s moving portion user activity though debate much type activity live l2s much type improvement needed l1 execution note done parallel goal eventually serve billion user world computer l1 blockchain almost certainly meaningful combination activity l1s l2s l2like thing critical user able move easily securely across chain user churn migrate place provides frictionless ux maintain focus solving pressing problem ethereums user risk letting shortterm competitive dynamic get way longerterm much larger goal achieving world computer vision mean growing pie 1000x get good news frictioness interoperability already possible today wallet support crosschain swap several highquality fast bridging solution generally ethereum ecosystem continuing towards future user dont really think much chain theyre key building block still need standardize order enable trustless secure scalable communication across chain ethereum ecosystem including nonevm chain important part making sure solve thing userfirst perspective start common user flow ethereum interop forum bangkok l2s came together shared goal user able send asset chain chain 3 slot le building block necessary achieve includes following onchain registration chain id erc7785 l2s register en rather list maintained github chainspecific address erc7828 draw erc3770 chain part address crossl2 sending done putting correct address send field crosschain messaging shared bridge many flavor discussed varying tradeoff need align first ideal base layer functionality built top see erc6170 erc7683 rip7755 erc7786 erc7802 erc7841 erc7854 whats next l2s wallet related infra across ethereum coming together solve initial goal set ethereum interop forum fast trustless crosschain sends finalize ercs 1 onchain registration chain id 2 chainspecific address l2s wallet begin implementation erc7702 parallel programmable eoa wallet coming next hard fork unify unification effort starting crosschain messaging align broader interop roadmap already working interop wed love hear anyone else who generally interested getting involved please jump erc discussion thread join next rollcall ping directly stay tuned interop update,0.9937,0.1524918831168831,0.5730959415584416
Reddit,ethereum,2025-01-06 11:30:07,2025-01-07 00:53:29.122107,access o1 pro eth l2s via nanogpt,0.0,0.0,0.0
Reddit,ethereum,2025-01-06 20:38:26,2025-01-07 00:53:29.122107,purrsuit ethereum 1,0.0,0.0,0.0
Reddit,ethereum,2025-01-07 00:02:47,2025-01-07 00:53:29.122107,convince ai unlock vault take eth prize challenge 2,0.6808,0.0,0.3404
Reddit,ethereum,2025-01-06 19:45:34,2025-01-07 00:53:29.122107,ethereum client benchmarksis recent benchmark various ethereum client specially containing reth nethermind,0.0,0.11904761904761905,0.05952380952380953
Reddit,ethereum,2025-01-06 01:07:25,2025-01-07 00:53:29.122107,understanding correct ethereum v solana term securityim old eth miner back around 1020 started warm back recent day interacted defi used interact solana realized tradeoff switched back eth l2 rollups hype surrounding solana speed transaction fee many dont realize compromise theyre making term security understanding ethereum 1m validators posteip4488 significantly decentralized comparison solanas 2000 could open attack vector could compromise validators security solana network do validator crash single layer data availability consensus execution paying gas ill know security important technical folk verify im saying correct thanks,0.4939,0.1145408163265306,0.3042204081632653
Reddit,ethereum,2025-01-05 22:07:05,2025-01-07 00:53:29.122107,vitalik dacc one year later,0.0,0.0,0.0
Reddit,ethereum,2025-01-05 07:00:59,2025-01-07 00:53:29.122107,daily general discussion january 05 2025welcome ethfinance daily general discussion rethereum httpsimgurcom3y7vezphttpsimgurcom3y7vezp please use thread discus ethereum topic news event even price price discussion posted elsewhere subreddit continue removed always constructive subreddit ruleshttpswwwredditcomrethereumaboutrules want stake learn rethstaker ethfinance ethereum community link ethereum jobshttpsethereumorgencommunitygetinvolvedethereumjobs twitterhttpsxcomethereum evmavericks youtubehttpswwwyoutubecomevmavericks discordhttpsdiscordggevmavericks doots podcasthttpsevmaverickslibsyncom doots websitehttpsdailydootscom doots extensionhttpsgithubcometheralphaethfinanceextension uhanniabu calendar jan 20 ethereum protocol attackathonhttpsblogethereumorg20241125ethereumprotocolattackathon end jan 3031 ethereumzurichhttpsethereumzurich conference feb 79 eth oxfordhttpsethoxfordio hackathon feb 1016 ethiopiahttpsethiopiaxyz conference hackathon feb 23 mar 2 ethdenverhttpswwwethdenvercom mar 2830 eth pondyhttpswwwethpondyxyz puducherry hackathon apr 13 ey global blockchain summit person virtual,0.3818,0.020000000000000007,0.2009
Reddit,ethereum,2025-01-05 18:48:52,2025-01-07 00:53:29.122107,started claude generating private ethereum key,0.0,0.0,0.0
Reddit,ethereum,2025-01-05 22:25:11,2025-01-07 00:53:29.122107,buy ethereum without kyc wanted start crypto kind get know try stuff want spend buck really liked ethereum since also try nfts however im 17 cant buy anywhere way cryptocurrency buy without kyc could try parent friend might work id still like buy id grateful suggestion,0.9381,0.6,0.76905
Reddit,ethereum,2025-01-06 08:24:06,2025-01-07 00:53:29.122107,seedy v10 seed recovery managment tool gm im reposting tool rcryptocurrencyhttpswwwredditcomrcryptocurrency sub think many find useful extent recovery tool named seedy advanced etherium network derivitives seed phrase recovery helper tool primary function provide working seed phrase presented partial seed phrase ie missing word two seed phrase sure wrote correctly wallet accepting chance seed incorrect word either mispelling wrote wrong order simply incorrect word altogether tool take word got long know address wallet depending word needed search thousand word per second searching entire dictionary bip seed one postition time find seed display along confirmed address tied work word phrase looked position second word position 2 example start position 1 check provided word bip dictionary generated sequencial seed match part address move position 2 repeat position 3 4 etc happens quickly every single word processed complete string 12 15 18 24 word checked cryptographically see checksum validates signifying valid seed phrase derives address public key would provide key part key match address user provided move next word eventually leaving user final phraase matching private key derived seed well valid address data presentted output log well every single valid combonation attempt logged text file thats built folder tool upon running file generated user see massive amount variable processed eventually come end result study user reliable far able correclty find missing invalid word seed upto 3 bad word within hour 2 word 2030 minute single word completed possibly within minute sometimes second complicated math need longer take realistic anything half 12 word seed would take long would impractical use said infact cointinue searching endlessly untill canceled powersystem failure finally find correct phrase may seem impossible actually simple program unique approach based mathamatical algorythm developed help github community hour hour sleepless research nessesaty mother invention thus corrupt seed phrase two missing word ripped sheet paper thing stopping accessing fund hardware wallet failure failure lost phrase caused create tool help figure thats seedy born get current version 100 free long python installed system mac window linux able download github link bottom currently published open source may remain open forever significant risk malicous use discovered example may forced close source help slow creation malicous tool using code thanks reading showing interest work hope help many people released private beta testing tool limit many word missing example accept 3 4 5 word fewer word exponentially longer take year decade etc computing power required achieve search recovery correct seed seedy v100 httpsgithubcomd31337m3seedyhttpsgithubcomd31337m3seedy,0.9325,0.010584077380952382,0.4715420386904762
Reddit,ethereum,2025-01-05 04:37:02,2025-01-07 00:53:29.122107,lamborghini animocas motorverse tap base blockchain ingame asset,0.3612,-0.8,-0.2194
Reddit,ethereum,2025-01-05 12:00:26,2025-01-07 00:53:29.122107,unwrap weth polygon networka year ago used mine eth would receive weth ethermine ive trying figure unwrap clue help would greatly appreciated,0.7425,0.2,0.47125000000000006
Reddit,ethereum,2025-01-05 03:55:29,2025-01-07 00:53:29.122107,question staking ethereumstarting take crypto seriously taking break 2 year investing altcoin mostly ethereum question staking cold wallet know people like stake rocketpool decentralization 1 must one convert eth reth stake cant stake eth 2 safely stake eth directly cold wallet 3 wont depegging eth reth 4 know risk chance fund lost rocketpool,0.3818,-0.10666666666666665,0.13756666666666667
Reddit,ethereum,2025-01-05 21:17:01,2025-01-07 00:53:29.122107,new blockchain development build first dapps 20 minute published article regarding decentralized application dapps development new blockchain development build first dapps 20 minute read article medium httpsrafsunsheikh116mediumcomnewtoblockchaindevelopmentbuildyourfirstdappsinunder20minutes1f2f392d50fe happy reading,0.5719,0.3145454545454546,0.44322272727272727
Reddit,ethereum,2025-01-04 07:01:10,2025-01-07 00:53:29.122107,daily general discussion january 04 2025welcome ethfinance daily general discussion rethereum httpsimgurcom3y7vezphttpsimgurcom3y7vezp please use thread discus ethereum topic news event even price price discussion posted elsewhere subreddit continue removed always constructive subreddit ruleshttpswwwredditcomrethereumaboutrules want stake learn rethstaker ethfinance ethereum community link discord ev maverickshttpsdiscordggevmavericks ethereum twitterhttpsxcomethereum ethfinance twitterhttpsnitternetethfinancer evmavericks youtubehttpswwwyoutubecomevmavericks ethfinance doots podcasthttpsevmaverickslibsyncom daily doots websitehttpsdailydootscom ethereum jobshttpsethereumorgencommunitygetinvolvedethereumjobs get reddit doots extensionhttpsgithubcometheralphaethfinanceextension uhanniabu see fellow dooters everywhere reddit calendar jan 20 ethereum protocol attackathonhttpsblogethereumorg20241125ethereumprotocolattackathon end jan 3031 ethereumzurichhttpsethereumzurich conference feb 79 eth oxfordhttpsethoxfordio hackathon feb 1016 ethiopiahttpsethiopiaxyz conference hackathon feb 23 mar 2 ethdenverhttpswwwethdenvercom mar 2830 eth pondyhttpswwwethpondyxyz puducherry hackathon apr 13 ey global blockchain summit person virtual,-0.0258,0.016666666666666673,-0.004566666666666663
Reddit,ethereum,2025-01-05 03:22:28,2025-01-07 00:53:29.122107,tryint connect metamask wallet chainlisthi anyone already using chainlist trying connect metamask wallet chain list reason wont select wallet anyone issue,0.0,0.0,0.0
Reddit,ethereum,2025-01-04 20:00:48,2025-01-07 00:53:29.122107,staking wealthsimple canadait mention validation slashed lose ethereum reward please could someone explain mean staking safe risk,0.4939,0.09375,0.293825
Reddit,ethereum,2025-01-03 14:32:32,2025-01-07 00:53:29.122107,vitalik buterin deserves nobel prize economics work crypto ethereum bankless cofounder ryan sean adamsin tweet ryan sean adam cofounder bankless said vitalik buterin recognized nobel prize economics contribution ethereum entire crypto space said there disconnection traditional economist revolutionary economic theory applied defi vitaliks genius time go unnoticed outside crypto circle think vitalik buterin definitely ahead time contributed creation portal defi yet like many visionary think global recognition achievement might come long time everyone defi know vitalik rest world he still relatively unknown lack acknowledgment prof far true global adoption maybe still somewhat early satoshi vitalik built revolutionary platform changed finance world forever crypto stained rug pull pump dump scheme opportunistic influencers take credibility away bitcoin ethereum thats lot people refuse acknowledge crypto genuine economic innovation wonder one day vitalik remembered one greatest economic innovator time,0.9623,0.15000000000000002,0.55615
Reddit,ethereum,2025-01-04 04:33:37,2025-01-07 00:53:29.122107,help pick gstar name consensus layer upgrade fusaka add vote poll,0.4019,0.0,0.20095
Reddit,ethereum,2025-01-03 07:01:20,2025-01-07 00:53:29.122107,daily general discussion january 03 2025welcome ethfinance daily general discussion rethereum httpsimgurcom3y7vezphttpsimgurcom3y7vezp please use thread discus ethereum topic news event even price price discussion posted elsewhere subreddit continue removed always constructive subreddit ruleshttpswwwredditcomrethereumaboutrules want stake learn rethstaker ethfinance ethereum community link discord ev maverickshttpsdiscordggevmavericks ethereum twitterhttpsxcomethereum ethfinance twitterhttpsnitternetethfinancer evmavericks youtubehttpswwwyoutubecomevmavericks ethfinance doots podcasthttpsevmaverickslibsyncom daily doots websitehttpsdailydootscom ethereum jobshttpsethereumorgencommunitygetinvolvedethereumjobs get reddit doots extensionhttpsgithubcometheralphaethfinanceextension uhanniabu see fellow dooters everywhere reddit calendar jan 20 ethereum protocol attackathonhttpsblogethereumorg20241125ethereumprotocolattackathon end jan 3031 ethereumzurichhttpsethereumzurich conference feb 79 eth oxfordhttpsethoxfordio hackathon feb 1016 ethiopiahttpsethiopiaxyz conference hackathon feb 23 mar 2 ethdenverhttpswwwethdenvercom mar 2830 eth pondyhttpswwwethpondyxyz puducherry hackathon apr 13 ey global blockchain summit person virtual,-0.0258,0.016666666666666673,-0.004566666666666663
Reddit,ethereum,2025-01-03 11:13:03,2025-01-07 00:53:29.122107,ethereumrelated content ive found interesting last weekstuff found interesting porter read every 1990s cypherpunk email present interesting oneshttpsdocsgooglecompresentationd1yg3_w41k3gysuj9s3ixvjjshawjjr05s7fo09izicwgeditslideidp nicola greco alex obadia share quantum punk manifestohttpsquantumpunksorg stani compare eth stablecoins medium exchange economic currencyhttpsxcomstanikulechovstatus1871133962321408439 0xquit explains exited validatorshttpsxcom0xquitstatus1870581266640511387s19tm3p6ze6gopdfjtxnjqdc9w peteris erin confesses barely us web3httpsnewskiwistandcomstoriesal89confessionibarelyuseweb3index0x676adf39688b9731446ef20c5c4f018b4d992abe47984e22c78feebc510f63257d3a1dbb im sharing ive curating ethereumfocused newsletterhttpsparagraphxyzkiwiweeklykiwinewsrecap76 year thought id share interesting read find,0.9432,0.28125,0.612225
Reddit,ethereum,2025-01-03 17:31:17,2025-01-07 00:53:29.122107,hope recover eidoo walletseidoo old wallet seems business 2023 luckily lot eth 12 word phrase seems work modern wallet anyone know get eth back lost forever still access original app see 12 word feel like thats eidoo direct eth passphrase help appreciated,0.9287,0.1869047619047619,0.5578023809523809
Reddit,ethereum,2025-01-04 09:15:07,2025-01-07 00:53:29.122107,time ethereum foundation stopped sabotaging eth ethereum community x formerly twitter buzzing discontent tech time ethereum foundationhttpsethereumorgenfoundation ef ive working ethereum since 2018 barely ever even heard ef time ever hear mentioned theyre selling ethereum must great job sad word itzpoopsterhttpsxcomitzpoopsterstatus1875333344130707482 x since 2018 voice like itzpoopster echoed common sentiment ethereum foundation ef seems missing action making headline theyre selling eth isnt isolated there growing disappointment efs passive management leading label almost nonexistent purpose ethereum foundation advocate ethereum httpsxcomyugacohlerstatus1874990811236253937effective advocacy world thousand blockchain network requires active loud sustained intentional messaging currently lacking know last time ethereum foundation posted anything ethereum account x 35m follower april 18th 2022httpsxcomcupojosephstatus1875240380737974529 sabotaging ecosystem ignoring instead highlighting success comparison httpsxcombuzzdefi0xstatus1875321789020303602usolanatweets daily 150m yearly spend cant someone running point x comms better face competition ethereum foundation shouldhttpsxcomethnologismstatus1875323271086010773 increase public communication use uethereum actively social medium embrace role ethereums public face clarify outcome funded project consider leadership change fresh vision understandably ethereum foundation philosophyhttpsxcomhudsonjamesonstatus1875287834929889636 written herehttpsethereumfoundationphilosophy operate philosophy subtraction pursuing decentralization ef may want face ethereum outside world need embrace extent least doesnt marketing traditional sense inform talk great thing happening network would good rule ef discus public presence regarding ethereum shouldnt called ethereum foundationhttpsxcomethereanbullstatus1875328599726973437 even funny ef want perceived face consider main social medium handle name ethereum nothing waiting someone else wont ease situation ultimately even philosophy subtraction someone take responsibility put wheel motion right word ef could focus decentralization let another org handle marketing support arguably advocacy eth getting recent time unwavering hyper vocal strategic support jessepollak base needed mouthpiece year ago nothing wrong intentional 2025 ethereum culture need change need want win need leader want win winhttpsxcomeconoarstatus1874670307543523644 nb sentiment expressed creative fusion aggregation thought shared x subject matter best moderately link original post much link could get penalized reddit hope find thoughtful read,0.9952,0.11890589569160999,0.557052947845805
Reddit,ethereum,2025-01-02 05:50:54,2025-01-07 00:53:29.122107,running ethereum node evernodehello im attempting run ethereum node evernode evernodeorg deploying docker version ethereumethereumlatest far havent success suspect issue might related port configuration required node communicate outside world tip guidance might wondering chose evernode idea running blockchain participation node platform powered another blockchain evernode fascinating pricing incredibly low compared vps option thanks advance,0.4399,0.18571428571428572,0.31280714285714284
Reddit,ethereum,2025-01-02 16:18:07,2025-01-07 00:53:29.122107,best day go eth denver 2025ive never eth denver planning go understand schedule well whats best 23 day attend maximize experience meeting people learning good time many conference ive usually core day activity max day slower fewer people attendance,0.9246,0.5900000000000001,0.7573000000000001
