MainSource,Source,Publication Date,Pull_date,Pre-Processed Text,Sentiment_Vader,Sentiment_TextBlob,Average_Sentiment
Reddit,solana,2024-09-15 07:38:56,2024-09-18 00:48:24.547856,let make solana great againwith utility memescam coinshey reddit let face crypto space seen fair share memescam coin catgif rug pull leaving many u frustrated skeptical time change thats meemo come make solana great offering real utility real reward fun engaging platform tired meme coin value im right im 33yearold coder denmark 21 year experience watching many token fail deliver decided take thing hand thats meemo born ive built everything scratch give solana community something thats entertaining also valuable whats meemo meemo another meme token entire ecosystem meme meet blockchain offering user place share favorite meme earning real reward form meemo token httpspreviewreddito6w2obigfxod1jpgwidth994formatpjpgautowebpseaffb20079a45392452ecfb58753148a6dc2cab3 key feature meme sharing platform discover share upvote meme across category easytouse platform reward system earn meemo token active platformupload vote share get rewarded create meme nfts yes turn meme nfts right platform showcase creativity whole new way meme editor go use meme editor available onsite app create meme quickly easily instant meme creation via telegram weve built telegram bot allows instant meme creationalready gaining traction memecoin community long haul io app already live io app live available download android app fully built waiting final approval locked token stability ensure longterm growth stability weve locked 126 token meemo sick rug pull scam coin meemo offer real utility fun twist combining viral nature meme actual blockchain reward building something sustainable engaging designed last current status roadmap website launch already live io app runningget android app ready awaiting approval next step expanding community rolling marketing bringing influencers board join u making solana great part movement bring real utility meme space explore meemo create meme earn reward part something worth time link website wwwmeemolol telegram meemosol twitter meemosol contract address 4x2nbpeitqf6okl9el4n545fp4xypbyreisy9xdxpump let build something fun valuable lastingtogether,0.9982,0.16487253487253492,0.5815362674362674
Reddit,solana,2024-09-15 00:37:30,2024-09-18 00:48:24.547856,rcp call fetch token account ownerim trying use rpc call get owner field screenshot based token account address top left httpspreviewreddit2cn7vio1cvod1pngwidth1477formatpngautowebps5f999ce6599ad654a0ccec4744ef23f47b5b110b anyone know right rpc call would use getaccountinfo get following address owner tokenkegqfezyinwajbnbgkpfxcwubvf9ss623vq5da really appreciate suggestionsguidance thanks,0.788,0.1976190476190476,0.4928095238095238
Reddit,solana,2024-09-15 06:10:21,2024-09-18 00:48:24.547856,wallet tagged bot launching memecoin pumpfunwhy get tagged bot launch pumpfun im trying launch legit got everything set ready,0.3612,0.2,0.2806
Reddit,solana,2024-09-14 14:28:14,2024-09-18 00:48:24.547856,advice managing risk ive started trading meme coin around 8 month ago back building altcoin bag decided diversify blue chip meme time started spending way time meme space enjoyed trading meme probably funniest exciting thing ever somehow component im passionate meme marketing cultural event politics etc long story short ive trading meme six month started 1k meme bag bag ath 50k never cashed fund comfortable irl job income always treated meme trading chance either slowly building significant amount money ride zero would ok worst case scenario time heard many story people round tripping previous bull run decided set ambitious cash target 100k question halfway goal wan na revisit plan two scenario see 1 sol 137 rn im sitting good coin would probably 34x sol go back ath 2 market find way fuck cash see im greedy missing real life changing money way higher goal time im starting realize got point would mentally hard round trip would thanks x,0.8778,0.04345238095238095,0.46062619047619047
Reddit,solana,2024-09-14 21:03:59,2024-09-18 00:48:24.547856,review solana 2024review solana 2024 agree anything else would add,0.3612,0.0,0.1806
Reddit,solana,2024-09-14 19:29:29,2024-09-18 00:48:24.547856,escrow service solanado know solution offeer escrow service support solana,0.6124,0.0,0.3062
Reddit,solana,2024-09-14 20:52:03,2024-09-18 00:48:24.547856,cheapest way bulksendi shit coin want try send 10 thousand people address dont want spend 20 dollar know gas fee website use use python program thanks,-0.1586,0.0,-0.0793
Reddit,solana,2024-09-14 15:08:48,2024-09-18 00:48:24.547856,staking option risk associated jitosol v native validators jitosol seems yield better completely liquid v waiting next epoch unstake natively im distributed different native staking validators mainly helius want ask higher lower risk staking jitosol v helius example moment im staking 80 sol,-0.296,0.16944444444444443,-0.06327777777777778
Reddit,solana,2024-09-14 00:24:14,2024-09-18 00:48:24.547856,92 celebrity token launched since june already deadhttpsxcomslorgoftheslugsstatus1834740282526400611,0.128,0.0,0.064
Reddit,solana,2024-09-14 21:46:00,2024-09-18 00:48:24.547856,trader avoid copy trading solana1 scalper trader trade typically last le minute making unprofitable copy free copy trading bot due delay recommended copy private copy trading bot 2 trader numerous buy trader make 45 buy becomes challenging manage money effectively instance allocate 10 deposit per trade trader make 79 buy scam token could lose 7090 asset 3 mixed token trader trader receive token wallet also purchase token profit loss pnl trade may higher due token received external source 4 token sniper trader buy token start market appearance first candle using free copy trading bot lead loss due delay recommended copy private copy trading bot,0.3182,0.13499999999999998,0.22659999999999997
Reddit,solana,2024-09-14 12:17:03,2024-09-18 00:48:24.547856,solution execute solana token swap fasti new solana frontend development would like execute solana token swap fast using typescript solanaw3js library available solution way slower project manager requires requirement executing swap fast 2 second max need retrieve token mint kind data data already retrieved another application saved json file new old solution paid free communicate blockchain fast sorry new field thing confusing first best,0.9633,0.19727272727272727,0.5802863636363637
Reddit,solana,2024-09-14 18:14:43,2024-09-18 00:48:24.547856,hey jupiter rsnoofi fam piling soon looking forward ama monday,0.0,0.0,0.0
Reddit,solana,2024-09-14 13:28:44,2024-09-18 00:48:24.547856,banana gun bot fee anyone know much fee bot take ive using bonkbot want switch realizing take outrageous 1 fee,-0.6249,-0.4,-0.5124500000000001
Reddit,solana,2024-09-14 16:56:27,2024-09-18 00:48:24.547856,multisignature solana wallet safer fundsmultisignature wallet provide additional security crypto holding requiring one private key authorize transaction added layer security make much difficult hacker steal fund particularly useful company group trader sharing fund applies fund kept outside exchange dont support multisig wallet benefit stronger security fund remain safe even one key compromised shared access ideal group like family business multiple people need access reduced theft risk single stolen key insufficient access fund however managing multiple key challenging losing key might complicate fund recovery used correctly multisig wallet provide excellent protection crypto asset along 2fa mfa extra layer security,0.9754,0.1546218487394958,0.5650109243697479
Reddit,solana,2024-09-14 18:08:09,2024-09-18 00:48:24.547856,nominate meme coin discus itcan talk rising coin discus,0.0,0.0,0.0
Reddit,solana,2024-09-14 03:15:27,2024-09-18 00:48:24.547856,best promote dapp solana communityi solana dapp developer first time developing solana dapp would like know promote dapp solana user see see popular dapps solana,0.9287,0.6166666666666667,0.7726833333333334
Reddit,solana,2024-09-14 21:08:02,2024-09-18 00:48:24.547856,jupiter working ledgerim trying close trade via jupiter cold wallet blind side enabled call made via jup token none wallet due sol cover fee isnt reading reason idea,-0.4019,-0.4083333333333334,-0.4051166666666667
Reddit,solana,2024-09-14 08:31:00,2024-09-18 00:48:24.547856,pumpfun bot activityi observing pumpfun coin seem using bot make trading volume look highis reason use bot,0.0,0.0,0.0
Reddit,solana,2024-09-13 20:56:05,2024-09-18 00:48:24.547856,newbie asking helphi hoping someone could explain please transfer crypto raydium another wallet searching found answer send lp raydium app cant find withdraw function raydium,0.6249,0.0,0.31245
Reddit,solana,2024-09-13 22:15:36,2024-09-18 00:48:24.547856,dexscreener approve transaction question telegram bothey guy im trading get approve transaction tab lot kinda realized price coin moving fast im usually spamming sell tab clicking reject transaction sell never go tab show telegram bot let sell point id like ill use bot avoid tab transaction goin thanks guy,-0.6597,-0.08750000000000001,-0.3736
Reddit,solana,2024-09-13 13:15:37,2024-09-18 00:48:24.547856,new flappy bird game hidden secret solana crypto,0.0,-0.20757575757575758,-0.10378787878787879
Reddit,solana,2024-09-13 20:38:33,2024-09-18 00:48:24.547856,website like ultra sound money solana wondering website similar eth ultrasound money solana like looking data think information would interesting,0.7717,0.3,0.53585
Reddit,solana,2024-09-13 18:54:56,2024-09-18 00:48:24.547856,deploy wrapped token raydium tx raydium interact wrapper program im noob programmer sorry dumb question wondering create spl wrap using wrapper program created custom logic deploy raydium transaction raydium go througg smart contract interaction involving token bypass smart contract,0.7351,-0.11160714285714285,0.31174642857142854
Reddit,solana,2024-09-13 21:04:50,2024-09-18 00:48:24.547856,basic reading blockchain explorer like solscan solana explorertrading insight valuable resource extract onchain data must crypto trader whether analyze crypto transaction another trader predict macro behavior metric monitor active address indicates number wallet interacting network transaction volume reflects level activity usage network exchange inflowsoutflows reveals buying selling pressure market whale volume reveals level activity wallet owning large amount asset miner revenue show profitable network miner hash rate represents security strength blockchain use metric allows trader identify trend understand market sentiment refine trading strategy combining onchain data cryptocurrency trading analysis method track win rate good luck,0.9779,0.3161904761904762,0.6470452380952381
Reddit,solana,2024-09-13 19:34:40,2024-09-18 00:48:24.547856,antisniper optionsso able get ca early memecoin im planning sniping issue dev said antisniper option im sure mean like dont see way prevent one first buyer let know im missing anything help appreciated,0.8189,0.14821428571428572,0.48355714285714285
Reddit,solana,2024-09-13 18:29:03,2024-09-18 00:48:24.547856,step finance announcing step data api wallet position historical transaction nft data solanasource announcing step data api wallet position historical transaction nft data solana today represents pivotal moment towards step future launch solana data api offering widest coverage humanreadable data defi nfts contract solana speed scalability one else mean access readable solana data across wallet position lifetime history scalable million request robust inhouse indexing infrastructure api designed wallet provider tax software exchange direct custody technologyinfrastructure defi tool tier 1 crypto company anyone needing onchain wallet positional data additionally enables institutional client compliant sec guideline mandate accurate auditing management customer asset thrilled launch step data api ahead beta release dashboard v3 right solana community gather singapore see breakpoint httpspreviewreddithfz2tilndmod1pngwidth680formatpngautowebpsd1500001d85fccf491b97b2577494012e5124586 party interested step data api please fill form better understand need would require api httpsdocsgooglecomformsde1faipqlsf50ekvqfuamf40amyvacifw_dbg_2y2xfk1bfvvgnteqviewformhttpsdocsgooglecomformsde1faipqlsf50ekvqfuamf40amyvacifw_dbg_2y2xfk1bfvvgnteqviewform httpspreviewredditkijth6pqdmod1pngwidth504formatpngautowebps3f902bb9026d791bd8ba1bcc79da187522fc7783,0.9468,0.18526785714285712,0.5660339285714285
Reddit,solana,2024-09-13 18:06:02,2024-09-18 00:48:24.547856,xionglobal multichain web3 crypto payment platform launch 1click usdt solana paymentssource httpsxcomxionglobalstatus1833786326795145455httpsxcomxionglobalstatus1833786326795145455 xion thrilled announce launch 1click usdt usolana payment first nonevm payment network rollout key benefit effortless payment streamline checkout process userfriendly 1click payment solution enhanced speed security benefit speed security solana blockchain global reach accept payment wider customer base white label solution customize payment experience match brand ready integrate solana payment business contact u today learn xionglobal solana tether cryptopayments paymentinnovation httpsredditcomlink1fg1awdvideobujabods9mod1player,0.9661,0.035714285714285705,0.5009071428571429
Reddit,solana,2024-09-13 15:51:44,2024-09-18 00:48:24.547856,syndica deep dive solana daos governance august 2024source httpsxcomsyndica_iostatus1834603652507471929httpsxcomsyndica_iostatus1834603652507471929 1 solana dao activity rise august engagement realms_daoshttpsxcomrealms_daos metadaoprojecthttpsxcommetadaoproject increased individual dao team defi depin nfts followed suit dive onchain data full thread report httpsblogsyndicaiodeepdivesolanadaosgovernanceaugust2024httpsblogsyndicaiodeepdivesolanadaosgovernanceaugust2024utm_sourcetwitterutm_mediumblogutm_campaignresearchutm_id1utm_contentaugustdaosgov24 httpspreviewreddit96mzo5bnklod1pngwidth680formatpngautowebpsde25924dcc757908e9e84e7998fee6da5e2fd89e 2 spl governance daos tapered 2024 team create daos instance monthly average active instance dropped 5 3 number new daos created fallen single digit despite increased activity solana year httpspreviewredditmp2y4w9qklod1pngwidth680formatpngautowebps6c20db5c7af553cd0c8bc6221621b8adaef15b10 3 pythnetworkhttpsxcompythnetwork parclhttpsxcomparcl daos showed sign life spl governance instance two daos attracted 995 542 voter respectively voter supporting proposal passed dao httpspreviewredditucdvjnisklod1pngwidth679formatpngautowebpsc13fc753c1094ef250fe59b51c9efda387653c7f 4 2000 voter participated council election shape pythnetworkhttpsxcompythnetwork operation august four individual elected pythian council approves update change oracle program set data request fee pyth httpspreviewredditxc05ytlwklod1pngwidth680formatpngautowebps8fef346918c8f3603fb91ebf278c9723a1704b01 5 notable development include dao proposal metaplexhttpsxcommetaplex heliumhttpsxcomhelium team httpspreviewredditkoq3xkryklod1pngwidth680formatpngautowebpse4302951226c313cc8092a7fe43b1e789a9f68c7 6 heliumhttpsxcomhelium proposal surged august slow couple month number proposal increased substantially august mobile subdao submitting three hnt submitting one httpspreviewredditcsr8opy0llod1pngwidth680formatpngautowebpsce0663142045e96c308ea07b786e9d95aa948985 7 heliumhttpsxcomhelium daos excelled internal governance helium attracted 19k cumulative voter across five proposal august one engaged community weve studied httpspreviewredditcoqwmo33llod1pngwidth679formatpngautowebpsb6ae7cdff81a4856f1a35eb3574a2fc1583119af 8 sell pressure hnt triggered mass withdrawal among hnt dao voter leading significant net outflow 2024 voting requires locking token 23 withdrawing voter opted sell token dex driving significant outflow httpspreviewreddit8hnzk1c5llod1pngwidth680formatpngautowebps95c338bcecee9d9ddddfbbf28729232d3bb6a325 9 daos watch yet launched include solana team like magicedenhttpsxcommagiceden kaminofinancehttpsxcomkaminofinance zetamarketshttpsxcomzetamarkets httpspreviewredditu3z42788llod1pngwidth680formatpngautowebpscb4329a03a8fd015d630146323319bdd36f46e7a 10 dao formation realms_daoshttpsxcomrealms_daos resumed uptrend slow july dao formation realm increased 84 august bringing total number active daos created realm 1131 httpspreviewreddittqsxyzdallod1pngwidth680formatpngautowebpsce8495d4a2cb90ce11f3b1589c83ab85670c4b7d 11 expected recently formed realms_daoshttpsxcomrealms_daos active cohort past 3 month least 25 newly formed daos remain active however 10 daos launched last 2 year remain active today suggesting significant number unused daos httpspreviewreddituqe8swucllod1pngwidth680formatpngautowebpsfebd5baecaaf1579c1bf620560a535850e4b0435 12 realms_daoshttpsxcomrealms_daos seeing proposal per creator proposal creation increased despite decline number proposal maker creator drafted multiple proposal july httpspreviewreddital4bpj8fllod1pngwidth679formatpngautowebps0fb4a8b66572bbc9570c66f8a5474a880d725d94 13 realms_daoshttpsxcomrealms_daos actively submitting proposal 70 active daos august one proposal httpspreviewreddit037sui5hllod1pngwidth680formatpngautowebps1d9c77987729390a727015368bdfa7e25e9bf6dc 14 july surge voter bonk_inuhttpsxcombonk_inu proposal august governance participation realms_daoshttpsxcomrealms_daos returned normal level httpspreviewreddit2h7lp9ejllod1pngwidth680formatpngautowebpsd1df034d5e9dbf2bbdaa2d060016f6f7a03b62d3 15 metadaoprojecthttpsxcommetadaoproject hit ath new proposal created new active voter also increased august showing sign strong governance engagement httpspreviewreddit5ydowdalllod1pngwidth680formatpngautowebpsc2ee80b9bf219e422fae8c55af71a9ae13fc2e00 16 read full report learn httpsblogsyndicaiodeepdivesolanadaosgovernanceaugust2024httpsblogsyndicaiodeepdivesolanadaosgovernanceaugust2024utm_sourcetwitterutm_mediumblogutm_campaignresearchutm_id1utm_contentaugustdaosgov24 httpspreviewreddit4lkxniinllod1pngwidth680formatpngautowebps99a72e9da3bbf2b511f80c90b2656fa251511d3d,0.9964,0.030676122123490544,0.5135380610617453
Reddit,solana,2024-09-13 07:56:20,2024-09-18 00:48:24.547856,looking developer work solana start uphey ive working start solana space cofounder quit couple day ago due personal reason im looking new t react native devcofounder idea find someone good reliable also burn solana eco system tip appreciated thank,0.8271,0.18227272727272728,0.5046863636363637
Reddit,solana,2024-09-13 18:24:42,2024-09-18 00:48:24.547856,lightspeed podcast lack bold bet crypto weekly roundup,0.0772,0.3333333333333333,0.20526666666666665
Reddit,solana,2024-09-13 18:22:17,2024-09-18 00:48:24.547856,colosseumorg supported regolith lab team preseed seed raise 3m accelerate development ore ecosystemsource httpsxcomcolosseumorgstatus1834653107646529728httpsxcomcolosseumorgstatus1834653107646529728 thrilled support hardhatchadhttpsxcomhardhatchad regolith lab team preseed seed market nonsovereign sov asset native scalable blockchains massive ore community forming around project shipping fast see mine httpsxcomoresupplystatus1834638295277694984httpsxcomoresupplystatus1834638295277694984 httpspreviewredditl6d3spukcmod1pngwidth599formatpngautowebpsc1f16278acdb836d80052db570376a770f45ea54,0.8555,0.26666666666666666,0.5610833333333334
Reddit,solana,2024-09-13 15:26:17,2024-09-18 00:48:24.547856,wormhole brings world id solana new world id integration take globallysource httpsxcomworldcoinstatus1834577701182566472httpsxcomworldcoinstatus1834577701182566472 big day ai big day human wormholehttpsxcomwormhole brings world id solanahttpsxcomsolana httpspreviewredditcc2pm0j4hlod1pngwidth680formatpngautowebps70218263110c428e97ab52efa02e1677a7c18e9c httpsworldcoinorgblogannouncementswormholebringsworldidsolananewintegrationstakeoffgloballyhttpsworldcoinorgblogannouncementswormholebringsworldidsolananewintegrationstakeoffglobally httpspreviewredditvrj87rt6hlod1pngwidth680formatpngautowebpsed3b2dc9284bbf9fe7def17979e3fb8403aad5b5,0.0,0.03409090909090909,0.017045454545454544
Reddit,solana,2024-09-13 08:11:34,2024-09-18 00:48:24.547856,pump dot fun official program idshello trying code pumpfunhttppumpfun bot buy sell token via j trouble coming official program id someone please help provide official program id pumpfun,0.6808,0.04999999999999999,0.36539999999999995
Reddit,solana,2024-09-13 11:58:51,2024-09-18 00:48:24.547856,insider trading bot photonis insider someone bought pumpfun,0.0,0.0,0.0
Reddit,solana,2024-09-12 23:37:10,2024-09-18 00:48:24.547856,token exchange listing notificationsi received significant amount new coin promotional airdrop coin launched app use get notified coin get listed exchange,0.3182,0.2556818181818182,0.2869409090909091
Reddit,solana,2024-09-12 22:41:04,2024-09-18 00:48:24.547856,best bundler pfmoonshothi anyone done bundled launch whats best way without risk getting dumped sniper etc many thanks,0.9368,0.675,0.8059000000000001
Reddit,solana,2024-09-13 01:10:45,2024-09-18 00:48:24.547856,crypto trading signal solana find use effectivelywhen buy sell hold crypto tough decision make thats signal often provide entry point take profit stoploss level based different indicator here find use signal benefit crypto trading signal reduced emotional decisionmaking signal help minimize impulsive trading decision opportunity identification offer insight potential trade directly improved trading rate beneficial new experienced trader providing idea save time effort find quality signal provider avoid unrealistic claim cautious provider promising 100 accuracy scammer trying signal scam token take firstvalue announced win rate calculate win rate signal source statistic look proven record choose provider verified track record doublecheck metric experimentation check community feedback research trader think source reading feedback community practical tip effective use verify signal analyze confirm signal acting start demo test signal demo account spreadsheet trading real asset understand macro basic signal paired macro understanding take new level take time master fundamental find right signal strategy,0.9823,0.1864442746795688,0.5843721373397843
Reddit,solana,2024-09-12 14:35:16,2024-09-18 00:48:24.547856,anticipating breakpoint 2024title,0.0,0.0,0.0
Reddit,solana,2024-09-12 17:11:10,2024-09-18 00:48:24.547856,find legit aird huntadmin would please let slide legit couldnt find anywhere else ask youtubers twitter guy seems paid pushing weird project subreddits tried ask insta delete post small introduction newbie crypto space recently got cryptic madness thro telegram could see one make good amount money hunting airdrop free since brokie seems like good opportunity legit clue look check legit info guy could please take time explain simply tell look way go check source tell,0.9246,0.14999999999999997,0.5373
Reddit,solana,2024-09-12 21:25:07,2024-09-18 00:48:24.547856,phantom support localnet solana beginner set localnet using solanacli trying connect phantom show option localnet test network able detect local_wallets phantom support localnet httpspreviewreddit6xbj9dub4god1pngwidth449formatpngautowebps020020c01466377c2ab8a2f71c5593bdcdf9556b httpspreviewredditxv49108c4god1pngwidth447formatpngautowebpsfd68f59d41019f0f186b911cf58339ea1e1d194f,0.6597,0.5,0.57985
Reddit,solana,2024-09-12 18:31:05,2024-09-18 00:48:24.547856,help solnet csharpsolanaim looking working example swap sol token csharp appropriate place ask kind question thanks lot,0.8402,0.43333333333333335,0.6367666666666667
Reddit,solana,2024-09-13 11:00:56,2024-09-18 00:48:24.547856,solana content creator pls comment something saytitle say jt,0.296,0.0,0.148
Reddit,solana,2024-09-12 19:42:24,2024-09-18 00:48:24.547856,whats different jito bundled transaction v multi instruction transactionif add multiple instruction transaction execute whats point jito bundle,0.0,0.0,0.0
Reddit,ethereum,2024-09-03 14:41:57,2024-09-18 00:48:24.547856,ama ef research pt 12 05 september 2024notice closed thank participating look forward soon member ethereum foundation research team back answer question throughout day 12th amahttpsredditzendeskcomhcenusarticles115002427523whatisanamaandwhywouldihostone lot member taking part keep question coming enjoy click view 11th ef research team amahttpswwwredditcomrethereumcomments191kke6ama_we_are_ef_research_pt_11_10_january_2024 jan 2024 click view 10th ef research team amahttpswwwredditcomrethereumcomments14vpyb3ama_we_are_ef_research_pt_10_12_july_2023 july 2023 click view 9th ef research team amahttpswwwredditcomrethereumcomments107cqi8ama_we_are_ef_research_pt_9_11_january_2023 jan 2023 click view 8th ef research team amahttpswwwredditcomrethereumcommentsvrx9xeama_we_are_ef_research_pt_8_07_july_2022 july 2022 click view 7th ef research team amahttpswwwredditcomrethereumcommentsrwojtkama_we_are_the_efs_research_team_pt_7_07_january jan 2022 click view 6th ef research team amahttpswwwredditcomrethereumcommentso4unlpama_we_are_the_efs_research_team_pt_6_23_june_2021 june 2021 click view 5th ef research team amahttpswwwredditcomrethereumcommentsjvkoatama_we_are_the_efs_eth_20_research_team_pt_5_18 nov 2020 click view 4th ef research team amahttpswwwredditcomrethereumcommentsho2zptama_we_are_the_efs_eth_20_research_team_pt_4_10 july 2020 click view 3rd ef research team amahttpswwwredditcomrethereumcommentsez972uama_we_are_the_eth_20_research_team_pt_3 feb 2020 click view 2nd ef research team amahttpswwwredditcomrethereumcommentscdg8v6ama_we_are_the_eth_20_research_team_pt_2 july 2019 click view 1st ef research team amahttpswwwredditcomrethereumcommentsajc9ipama_we_are_the_eth_20_research_team jan 2019 x200b ama concluded,0.6908,0.06000000000000001,0.3754
