MainSource,Source,Publication Date,Pull_date,Pre-Processed Text,Sentiment_Vader,Sentiment_TextBlob,Average_Sentiment
Reddit,solana,2024-12-06 19:48:46,2024-12-08 12:18:46.802946,colosseum codex poseidon pudgy penguin pengu solana temple mtndao v7source httpsblogcolosseumorgposeidonpudgypenguinspengumtndaov7httpsblogcolosseumorgposeidonpudgypenguinspengumtndaov7 poseidon pudgy penguin pengu web3js 20 solana temple mtndao v7 httpspreviewredditb5hb7qba8a5e1pngwidth960formatpngautowebps34648f02ee16b056682023895509094ad7d7c134 poseidon poseidon new framework developed turbin3httpsturbin3comrefblogcolosseumorg enables developer write deploy onchain solana program using typescript language familiar million worldwide core poseidon bridge gap typescript rust primary language solana development developer write program t leveraging robust type system familiar syntax poseidon transpilation engine convert typescript code equivalent anchor code translation allows developer deploy application solana blockchain without need master rust accelerating development process reducing learning curve associated solanas complex account model poseidon great getting started fast youre aiming build complex onchain protocol might still need get familiar rust solananative tool poseidon could gamechanger developer curious solana intimidated steep learning curve ultimately poseidon bring developer solana community making development accessible mean achieve first big win like deploying first onchain program much quicker introducing poseidon framework turbin3 write solana program typescripthttpsmediumcomhrknsinstwelcometoposeidon8c31dd2a1c73refblogcolosseumorg pudgy penguin launch pengu solana pudgy penguin one top nft collection ethereum set launch native token penguhttpsxcompudgypenguinsstatus1864851993094664602refblogcolosseumorg solana opportunity interview pudgy penguin ceo luca netz prior announcement shared detail solana obvious choice launch decision launch pengu solana stem solanas superior consumer experience technical capability youre looking trying optimize bringing million fan space hard refute solana best consumer experience today luca netz scalability performance solana also align perfectly pudgy penguin vision supporting extensive integration future growth without compromising speed reliability introduction pengu token open opportunity solana developer anything everything consumer really trying position youre leveraging ip using token integrate nft marketplace consumer application wed excited luca netz developer integrate pengu token various dapps including nft marketplace defi platform gaming environment consumerfocused apps wallet payment gateway loyalty program leverage token functionality solanas vibrant active developer community provides platform pudgy penguin expand already dynamic community isnt one chain building bridge enabling everyone participate luca netz addition technical advantage solanas strong ecosystem provides pudgy penguin tool infrastructure bridge gap digital physical major retailer expand physical product line top nft brand pudgy penguin release pengu token solanahttpswwwcoindeskcommarkets20241205topnftbrandpudgypenguinstoreleasepengutokenrefblogcolosseumorg solana web3js 20 solanas web3js 20 gamechanger developer making development process smoother efficient modular architecture web3js 20 significant upgrade instead one massive library functionality broken independent package whether need rpc communication transaction handling account decoding error identification pick choose exact module need web3js 20 introduces leakresistant key ensuring accidentally log store private key metadata exposed actual key byte also tap native webcrypto signing operation reducing reliance thirdparty dependency boosting overall security customization also easier new sdk add custom rpc method transport strategy tailored specific need whether want implement fallback secondary rpc server throttle api call manage rate limit employ roundrobin approach load balancing web3js 20 provides flexibility get familiar change update v20 check indepth guide helius triton one everything need know get started start building solana web3js 20 sdkhttpswwwheliusdevbloghowtostartbuildingwiththesolanaweb3js20sdkrefblogcolosseumorg intro new solanaweb3js 2xhttpsblogtritononeintrotothenewsolanaweb3js2xrefblogcolosseumorg solana temple solana temple wellnessfirst program specifically designed developer team building solana hosted flow solana temple combine wellness practice essential business strategy foster peak performance program dedicated maintaining healthy worklife balance preventing burnout enhancing productivity variety wellness activity tailored unique challenge faced blockchain developer scheduled take place bali january 12th february 9th solana temple held temple stateoftheart facility equipped coworking space pool gym premium amenity addition wellness activity solana temple offer business workshop focused fundraising strategy pitch development essential entrepreneurial skill combination wellness business strategy provides comprehensive foundation sustainable growth allowing solana developer excel area life program also foster community developer connect share experience support one another solana temple aim transformative experience designed elevate development journey clarity balance solana templehttpswwwflowbalixyzrefblogcolosseumorg mtndao v7 mtndao leading startup summit within solana ecosystem set host 7th iteration february 128 2025 downtown salt lake city building four successful year mtndao v7 promise deliver unparalleled actionpacked experience solana developer founder marketer business developer investor since inception mtndao become cornerstone solana community attracting thousand ambitious builder year summit instrumental launching numerous awardwinning startup nurturing nearly 20 global hackathon champion solidifying reputation premier launchpad blockchain innovation mtndao v7 maintains exclusive inviteonly format ensuring curated environment toptier talent collaborate thrive 2025 summit elevates experience providing exclusive private office downtown salt lake city reserved mtndao community throughout year move underscore commitment decentralized governance mtndao launching mtn token designed steer dao towards futarchypowered future attend mtndao v7 networking opportunity connect solanas ambitious builder including founder developer marketer business developer investor collaborative environment engage dynamic setting foster creativity innovation collaboration resourcerich workspace utilize toptier facility designed support continuous development project advancement communitydriven governance participate shaping future mtndao mtn token futarchy governance model solana devs encouraged stay informed follow mtndaohttpsxcommtndaorefblogcolosseumorg twitter update secure invite mtndao v7 applicationhttpstallysorwo04ebrefblogcolosseumorg quick hit announcing firstever solana ai hackathonhttpsxcomyashhsmstatus1862166390804787611refblogcolosseumorg yashhsmhttpsxcomyashhsm workshop web3 game development framework solana videohttpswwwyoutubecomwatchvgumtnarz8ucrefblogcolosseumorg superteam vietnam recap first cohort metaplex startup programhttpsxcommetaplexstatus1862585025788879341tor5ica0pkf0galpuncey_ws09refblogcolosseumorg metaplexhttpsxcommetaplex zk resource solanahttpsxcomrexstjohnstatus1861462888516661294refblogcolosseumorg rexstjohnhttpsxcomrexstjohn trusted setup zk cryptographyhttpsxcomblockiosaurusstatus1861802246872375369tej46m12yhijeczv4jgsdqs09refblogcolosseumorg blockiosaurushttpsxcomblockiosaurus solana block truly finalizedhttpsxcomlakestakeiostatus1863931792954138935refblogcolosseumorg lakestakeiohttpsxcomlakestakeio third cohort usdc grant program includes several solana projectshttpsxcombuildoncirclestatus1861801693433954757tej46m12yhijeczv4jgsdqs09refblogcolosseumorg buildoncirclehttpsxcombuildoncircle rome protocol blockchain interoperability modularized solanahttps0xvivek88mediumcomromeprotocolblockchaininteroperabilitywithmodularizedsolana659ee656aff3refblogcolosseumorg vivek nakrani plenum super app live solanahttpsxcomplenafinancestatus1862481698606522679tmgnirkwb2bxgbfwn6fvg6as09refblogcolosseumorg plenafinancehttpsxcomplenafinance tool resource poseidon exampleshttpsgithubcomturbin3poseidontreemasterexamplesrefblogcolosseumorg vote vault escrow favorite program typescript corresponding rust program transpiled poseidon carbon pipeline examplehttpsgithubcomsevenlabshqcarbontreemainexamplespumpfunalertsrefblogcolosseumorg demonstrates use helius geyserenhanced websocket process solana transaction using pumpfun decoder plasmahttpsgithubcomellipsislabsplasmarefblogcolosseumorg reference implementation sandwichresistant ammhttpswwwumbraresearchxyzwritingssandwichresistantammrefblogcolosseumorg solana pumpfuntradingapphttpsgithubcombifrosttechnologiespumpfuntradingapprefblogcolosseumorg sample solana maui app built c solnet search pumpfun token let buy sell instantly get hired metadao hiring founding engineer frontend engineerhttpsjobsmetadaofijob5gh_srcsolananetworkopportunitiesjobboardrefblogcolosseumorg help build metadaos product trojan hiring backend developerhttpsjobssolanacomcompaniestrojanjobs43257079backenddeveloperrefblogcolosseumorgcontent build scalable efficient backend system using nodejs typescript blackwing hiring senior backend engineerhttpswellfoundcomjobs2767528seniorbackendengineergh_srcsolananetworkopportunitiesjobboardrefblogcolosseumorg develop core product 0 1 environment rome protocol hiring customer integration engineerhttpsjobssolanacomcompaniesromeprotocol2jobs43098144customerintegrationsengineerrefblogcolosseumorgcontent deliver customized technical solution customer abc lab hiring staff rust protocol engineerhttpsjobssolanacomcompaniesabclabs2829ccc6b2e704c3ea61596a5317cf3fejobs43093149staffrustprotocolengineerrefblogcolosseumorgcontent bring new defi reserve protocol solana zotto hiring solana backend engineerhttpsjobssolanacomcompanieszottoltd2jobs42995257solanabackendengineerrefblogcolosseumorgcontent develop scalable backend service dapps listen validated episode austin chat anna yuan founding perena new company designed support liquidity interoperability capital efficiency stablecoins conversation cover comprehensive value chain stablecoins existing inefficiency current stablecoin ecosystem potential transformative impact payfi global finance discussion also touch regulatory landscape evolving role stablecoins traditional versus decentralized finance future payment system financial service interconnected digital economy stablecoins payfi replace traditional banking w anna yuan perenahttpssolanacomvalidatedepisodeswillstablecoinsandpayfireplacetraditionalbankingwannayuanperenarefblogcolosseumorg bonus episode launching sky solana rune christensenhttpsblockworkscopodcastlightspeedcdb51ca0ac4011ef95715b86635648derefblogcolosseumorg lightspeed rune christensen join lightspeed discus launch sky solana rune chose launch solana future defi decentralization crypto growth stablecoins ethereum v solana future music streaming built solana hiohttpsthomasbahamassubstackcompsolanaweekly94thefutureofmusicrefblogcolosseumorg solana weekly ryder havdale ceofounder hio music share theyre transforming music streaming solana platform prioritizes artist compensation community engagement 0xmert_ feared loved reply guy crypto industryhttpswwwyoutubecomwatchvb8aptxkx8refblogcolosseumorg shift happens episode mert share unfiltered insight solana set explosive growth despite market doubt helius helping developer build faster efficiently solana 1 trillion opportunity within ecosystem mert belief solana hit 1000 follow mikehalehttpstwittercommikehalerefblogcolosseumorg x warpcasthttpswarpcastcommikehalerefblogcolosseumorg thanks reading hope found something useful suggestion feedback let know think,0.9997,0.14564206420642065,0.5726710321032104
Reddit,solana,2024-12-06 17:35:50,2024-12-08 12:18:46.802946,mean removedi looking memecoin price absolutely crashed said removed mean exactly,0.0,-0.04375,-0.021875
Reddit,solana,2024-12-06 07:18:50,2024-12-08 12:18:46.802946,meme coin scamsid love create meme coin im always thinking way seems legit enough really dont want rug pull people time want make money funny token get attention people seems there way make money token creator besides rugpulling,0.8402,0.2375,0.5388499999999999
Reddit,solana,2024-12-06 16:42:16,2024-12-08 12:18:46.802946,e money network support solana bringing compliant secure blockchain infrastructure 5m onchain userssource httpsxcomemoney_networkstatus1864323866002428084httpsxcomemoney_networkstatus1864323866002428084 16 breaking solana meet bankfi thrilled announce solanahttpsxcomsolana live e money network compliant bankfi infrastructure blockchain firstever mica compliant wallet solanas 5m onchain user secure seamless compliant let dive httpsredditcomlink1h85lfdvideoe8dc0534b95e1player 26 solana integration e money wallet solana chain live e money wallet here mean user seamless depositwithdrawal sol native spl token compliancefirst infrastructure secure access solanas speed regulatory peace mind x200b 36 empowering solana dapps every dapp solana tap e money complianceready infrastructure realworld asset rwas institutional defi depin stablecoins x200b 46 future bankfi solana beginning solanas bankfi journey e money network possibility endless blockchainpowered credit card seamless fiattocrypto integration solana meet future compliant mainstream blockchain adoption x200b 56 built developer e money network come kyc aml compliance builtin developer plug directly ecosystem without worrying compliance headache focus building handle rest x200b 66 journey begin integrationits step toward future finance building compliant accessible innovative ecosystem solana e money network welcome next chapter blockchain read blog know httpsblogemoneyioannouncementsemoneynetworkandsolanaintegratestopowercompliancefocusedbankfiinnovationinweb3httpsblogemoneyioannouncementsemoneynetworkandsolanaintegratestopowercompliancefocusedbankfiinnovationinweb3 x200b,0.9845,0.19527511961722488,0.5898875598086124
Reddit,solana,2024-12-06 17:38:05,2024-12-08 12:18:46.802946,midcurve podcast building chaos ep 29,-0.5719,0.0,-0.28595
Reddit,solana,2024-12-06 17:36:51,2024-12-08 12:18:46.802946,solana validated podcast real talk sanction debanking w kimberly donovan atlantic council,0.2263,0.2,0.21315
Reddit,solana,2024-12-06 17:35:24,2024-12-08 12:18:46.802946,lightspeed podcast accelerating cryptos ultimate vision jack lu,0.25,0.0,0.125
Reddit,solana,2024-12-06 15:17:21,2024-12-08 12:18:46.802946,would coin survive scenarioin example coin 1b supply somewhat dead coin occasional volume liquidity 30k mc 120k however someone 15 supply hidden multiple wallet example let say dead coin sudden streamer randomly click reason people come flooding start buying 15 holder dump bundled wallet hype high volume coming would new buyer flooding able save dump recover back original peak price right dump assuming buyer didnt fear dump still bought could price recovered dangerous situation like likely outcome,-0.8123,-0.01397258297258297,-0.4131362914862915
Reddit,solana,2024-12-06 17:10:41,2024-12-08 12:18:46.802946,mobile trading future memecoin tradingi hear much mobile application trading memecoins quite frankly wondering mobile platform replace traditional desktop setup recently started using one trade difference huge here speed execution fast quickly buy sell memecoins realtime tracking guessing trade track pnl realtime gamechanger volatile market security unlike telegram bot know fund safer since everything secure app linked messaging platform mobile apps fast onoff ramp funding wallet locking profit help fast environment feel mobile trading memecoins tried apps made experience smoother let discus,0.926,0.2030303030303031,0.5645151515151515
Reddit,solana,2024-12-06 17:07:27,2024-12-08 12:18:46.802946,wallet tracking visual pnl roihello hello reaching knowledgeable come displaying pnl andor roi per token wallet tracking im learning phase tracking wallet wallet found manually see trade see filtering trade dexscreener profitable im wondering anyone method visualizing effectiveness trade preferably per token also overall im still early day tracking suggestion general welcomed,0.7269,0.037500000000000006,0.3822
Reddit,solana,2024-12-06 13:04:19,2024-12-08 12:18:46.802946,guy filter bot coin bullx im using bullx mobile filter bot coin,0.0,0.0,0.0
Reddit,solana,2024-12-06 20:10:44,2024-12-08 12:18:46.802946,tool used memecoin website creationi talking fun xyz io love website see everyday made tool make,0.8176,0.20000000000000004,0.5088
Reddit,solana,2024-12-06 18:48:05,2024-12-08 12:18:46.802946,token wallet dont show adding liquidity created token smithii went well wallet also created second token revoked mint freeze try create liquidity one token show even though see wallet put wallet address solscan show one one show transaction idea,0.7506,0.0,0.3753
Reddit,solana,2024-12-06 18:39:46,2024-12-08 12:18:46.802946,made song solana hey friend created song sol using ai im excited share link listen youtube sys crypto solana speedster solhttpswwwyoutubecomwatchv7r1ysgp74wqlistplsp6t186grfgksovclsujcxebttjoamrindex3 spotify listen spotifyhttpsopenspotifycomintltrtrack3glpmxoewh7oe6p88usainsie4e2a33437d54164 id love hear thought feedback,0.9186,0.4375,0.67805
Reddit,solana,2024-12-06 18:20:02,2024-12-08 12:18:46.802946,defi twitter stream level staking gamefabianosol x vault defi stream httpstco2qkgiamtv0 xhttpsxcomfabianosolanastatus1865095043486486778 tuned defi stream awesome learn pro,0.6249,1.0,0.81245
Reddit,solana,2024-12-06 13:25:34,2024-12-08 12:18:46.802946,hi im looking application based solana chainhi im looking application based solana chain deposit store widthraw token based sol wen dwf etcwith low fee le 0001 sol work instatntly without lock period one familiar something like,0.1027,0.1875,0.1451
Reddit,solana,2024-12-06 05:01:36,2024-12-08 12:18:46.802946,scammed need advice week ago connected phantom wallet fraudulent site cause brand new disconnected losing half money thought well since accidentally swapped 14 sol usdc trying swap something else usdc never showed wallet went solscan showed transfer different wallet swap went back activity first wallet stole money usdc somehow made swap usdc automatically transfer made new wallet dunno thats enough need stop using phantom altogether get new phone wtf,-0.9022,-0.000841750841750841,-0.45152087542087543
Reddit,solana,2024-12-06 16:44:53,2024-12-08 12:18:46.802946,wasabi join solana meet culture defi powered wormholesource httpsxcomwasabi_protocolstatus1863938810587017643httpsxcomwasabi_protocolstatus1863938810587017643 wasabi x solana evm svm mission clear unite fight old guard wasabi join solana meet culture defi powered wormholehttpsxcomwormhole trade vibe leverage culture httpsredditcomlink1h85nkmvideo70hzy4nqb95e1player stake httpsappwasabixyzvaultsvaultssolnetworksolanahttpsappwasabixyzvaultsvaultssolnetworksolana trade httpsappwasabixyzmarketsolusdcnetworksolanasidelonghttpsappwasabixyzmarketsolusdcnetworksolanasidelong httpspreviewredditibapsg0vb95e1pngwidth680formatpngautowebps01a224c4bad5c889cb1c63f1db29e0dea34e85db,0.5267,0.1,0.31334999999999996
Reddit,solana,2024-12-06 16:37:58,2024-12-08 12:18:46.802946,trade new pair graduated coin ive made profit graduated new pair made loss graduated coin new pair think due fact new pair cut loss quick however graduated im loss become optimistic start thinking go back lead question trade new pair graduated know trader make crazy money theyve started last summer mostly trade new pair tell trade im good try hear undertone basically trying say avoid graduated coin ive heard say graduated coin gambling solana reddit would best opinion,0.1779,0.1876082251082251,0.18275411255411256
Reddit,solana,2024-12-06 13:10:44,2024-12-08 12:18:46.802946,legality copy trading insider wallet found wallet initiate pump dump meme coin ive tracking day roi outrageous would legal copy trade wallet,-0.6249,-0.4,-0.5124500000000001
Reddit,solana,2024-12-06 12:24:54,2024-12-08 12:18:46.802946,ii spent month analyzing solanawhat critic get right wrong comprehensive report,-0.4939,-0.10476190476190476,-0.29933095238095236
Reddit,solana,2024-12-05 04:54:12,2024-12-08 12:18:46.802946,get arrested ur celebrity shill rug see station cough hawk,-0.4767,0.0,-0.23835
Reddit,solana,2024-12-06 01:45:20,2024-12-08 12:18:46.802946,priority setting using gmgn copy trading struggling find consistent priority feeslippage number work 35 tx fail tip,-0.5423,-0.125,-0.33365
Reddit,solana,2024-12-06 00:22:45,2024-12-08 12:18:46.802946,staked sol inactive problemi unstake sol anymore stake account inactive phantom wallet advises withdrawing possible please help,0.6124,0.0,0.3062
Reddit,solana,2024-12-06 17:09:32,2024-12-08 12:18:46.802946,convince solana hype ive keeping eye solana admit im still fence appreciate speed low fee cant help notice ecosystem seems attract fair share meme coin rug pull outright scam make question whether blockchains current direction aligns solving meaningful problem fostering longterm value im also skeptical tech sure incredibly fast focus vertical scaling limitation point wont system hit diminishing return blockchains emphasize horizontal scaling decentralization wonder solanas current path might lead bottleneck sooner people anticipate clear im debate solanas price action current onchain activity instead id like understand bigger picture problem solana solving beyond meme coin hype project whats vision ecosystem next 510 year addressing concern around centralization scaling youre solana enthusiast someone deeply involved ecosystem id love hear perspective make believe solana fast cheap think positioned make meaningful impact blockchain space im genuinely curious looking thoughtful balanced response convince solana worth attention,0.9782,0.18095238095238095,0.5795761904761905
Reddit,solana,2024-12-05 15:02:33,2024-12-08 12:18:46.802946,glitch missing something,-0.296,-0.2,-0.248
Reddit,solana,2024-12-06 05:23:17,2024-12-08 12:18:46.802946,depositwithdraw vault meanwhat defi activity containing vault mean httpspreviewredditbreioih3y55e1pngwidth1104formatpngautowebps75763418fab20c535451094332ecd92bb413be52,0.0,-0.3125,-0.15625
Reddit,solana,2024-12-05 14:35:32,2024-12-08 12:18:46.802946,possible trade within second using bota see lot meme coin rug pull within hour 2 use starter 2 bot 1 bot owner intention profit start memecoin 1 second later bot liquidity burned next trade volume waiting people jump rug pull question actually possible bot sniper precisely split second bot 1 2,0.4404,0.05,0.2452
Reddit,solana,2024-12-06 00:53:36,2024-12-08 12:18:46.802946,mcap change transaction madewhen watching coin dexscreener ive noticed coin prize going updown without new transaction made somebody explain please,0.6808,0.13636363636363635,0.40858181818181816
Reddit,solana,2024-12-05 16:10:01,2024-12-08 12:18:46.802946,isnt freeze authority red flagi get mechanism cultivate security created token usage fa memecoins definitely redflag even nonmeme coin mechanism seems shady holder never know creator want liquidate position inflated price thought,0.6713,-0.08333333333333333,0.2939833333333333
Reddit,solana,2024-12-05 19:00:22,2024-12-08 12:18:46.802946,solana narrative current cyclesome thought current solana narrative back 20222023 solana always news due sbf ftx remember ftx went absolutely shocking ftx seen established platform compared platform even sbf seen established albeit young guy two collapse happened solana seen finished dead water 2223 crypto winter solana many people still developing solana could see many tweet people sf nyc india talking working solana hacker house meetups event etc even though currency dead medium people still working people talking firedancer even back fast forward solana came roaring back really want congratulate devs stuck solana came first time solana winter question feel comeback narrative procrypto u administration think officially new cyclephase major solana concept idea cycle example since expect firedancer roll production soon evaluate chain fd already assumption obv point known event solana still underdog dont think anymore pretty much top tier bitcoin ethereum short think sbf ftx day pas people mind vc controversy 20202021 forgotten go looking forward whats next major narrativetheme perspective whats story,-0.9377,0.056198347107438026,-0.440750826446281
Reddit,solana,2024-12-05 20:10:31,2024-12-08 12:18:46.802946,way check total reward staking beginninghi per title way know many reward account got staking since creation never found way far thank,0.9061,0.19999999999999998,0.55305
Reddit,solana,2024-12-05 16:02:40,2024-12-08 12:18:46.802946,get hacked missing somethingi new trading tried buy first solana token baught 20 thru unlimit crypto exchange got notification got got notification saying sent success share screen shot whole transaction get scammed hacked idk,-0.2732,0.13727272727272727,-0.06796363636363636
Reddit,solana,2024-12-05 08:28:27,2024-12-08 12:18:46.802946,purpose thousand 000 bot transaction meme coinstitle dont fee add lot loss since obviously botted whats point,-0.3182,0.0,-0.1591
Reddit,solana,2024-12-05 11:04:53,2024-12-08 12:18:46.802946,recovery wallet staked fund different walleti sol staked validator using moonlet wallet year back still staked would like unstake send new wallet however seems like moonlet really working anymore subreddit rmoonlet dead github hasnt updated year question could use recovery phase recover different wallet like phantom without unstaking since moonlet fails everything try unstake risk p please dont dm regarding,-0.1027,-0.05194805194805195,-0.07732402597402598
